moves,comment,good
1. e4 c5 2. Nf3 e6 3. d4 cxd4 4. Nxd4 Nc6 5. Nc3 Qc7 6. Be2 a6,"The Taimanov\Ka
n Sicilian.  I'm never quite sure which it is - Taimanov only likes to
recognise himself with one particular kind of set-up.",False
1. e4 c5 2. Nf3 e6 3. d4 cxd4 4. Nxd4 Nc6 5. Nc3 Qc7 6. Be2 a6 7. O-O Nf6 8. Kh1 Nxd4 9. Qxd4 Bc5 10. Qd3 b5 11. f4 Bb7 12. Bf3 O-O 13. e5 Ne8 14. a4,"Taking on b7 and either f5 or Ne4 is par
for the course here - usually White doesn't commit the queenside pawns.",True
1. e4 c5 2. Nf3 e6 3. d4 cxd4 4. Nxd4 Nc6 5. Nc3 Qc7 6. Be2 a6 7. O-O Nf6 8. Kh1 Nxd4 9. Qxd4 Bc5 10. Qd3 b5 11. f4 Bb7 12. Bf3 O-O 13. e5 Ne8 14. a4 b4 15. Bxb7 Qxb7 16. Ne4 Be7 17. Be3 Qc6 18. Ng5 g6 19. Rad1 d6 20. Bd4 dxe5 21. Bxe5 Nf6 22. Qh3 h5 23. Nf3 Ng4 24. Nd4 Qc5 25. Qg3 Rad8 26. c3 bxc3 27. bxc3 Rd5 28. Rde1 Rc8 29. Rf3 Bf8 30. h3 Nxe5 31. fxe5 Bg7 32. Rfe3 Qa5 33. Nxe6,The saving resource.,True
