moves,comment,good
1. d4 Nf6 2. e3,out of book,True
1. d4 Nf6 2. e3 d5 3. Bd3 e6,Secures f5,False
1. d4 Nf6 2. e3 d5 3. Bd3 e6 4. Nd2 c5 5. c3 b6 6. Ndf3 c4,Black wins space,False
1. d4 Nf6 2. e3 d5 3. Bd3 e6 4. Nd2 c5 5. c3 b6 6. Ndf3 c4 7. Bc2 Bd6 8. Ne5 O-O 9. f4 b5 10. Qf3 g6,Consolidates f5,False
1. d4 Nf6 2. e3 d5 3. Bd3 e6 4. Nd2 c5 5. c3 b6 6. Ndf3 c4 7. Bc2 Bd6 8. Ne5 O-O 9. f4 b5 10. Qf3 g6 11. Nh3,",but is creating weaknesses on the black squares around the King.",True
1. d4 Nf6 2. e3 d5 3. Bd3 e6 4. Nd2 c5 5. c3 b6 6. Ndf3 c4 7. Bc2 Bd6 8. Ne5 O-O 9. f4 b5 10. Qf3 g6 11. Nh3 Bd7,#,True
1. d4 Nf6 2. e3 d5 3. Bd3 e6 4. Nd2 c5 5. c3 b6 6. Ndf3 c4 7. Bc2 Bd6 8. Ne5 O-O 9. f4 b5 10. Qf3 g6 11. Nh3 Bd7 12. Nf2 Be8 13. O-O Na6 14. e4,"Attacks the pawn chain,Ifelt that the time
was right for this move. The Bishops will soon be free to move to more
aggresive squares leaving the Black position cramped.",False
1. d4 Nf6 2. e3 d5 3. Bd3 e6 4. Nd2 c5 5. c3 b6 6. Ndf3 c4 7. Bc2 Bd6 8. Ne5 O-O 9. f4 b5 10. Qf3 g6 11. Nh3 Bd7 12. Nf2 Be8 13. O-O Na6 14. e4 Nc7 15. g4,"White prepares the advance f5. The Black pieces are all tied to
defending the squares round the Kingand White is going to break open the
position in a few moes.#",False
1. d4 Nf6 2. e3 d5 3. Bd3 e6 4. Nd2 c5 5. c3 b6 6. Ndf3 c4 7. Bc2 Bd6 8. Ne5 O-O 9. f4 b5 10. Qf3 g6 11. Nh3 Bd7 12. Nf2 Be8 13. O-O Na6 14. e4 Nc7 15. g4 Be7 16. f5 Nxe4 17. Nxe4,"And Black resigned, his King will have to go to h8 in
order to save his rook. The White pieces are well placed to break trough and
force a win.",True
