moves,comment,good
1. d4 Nf6 2. c4 e5 3. dxe5 Ng4 4. e4 d6 5. exd6 Bxd6 6. Be2 f5 7. exf5 Qe7 8. Nf3 Bxf5 9. Bg5 Nf6 10. Nc3 Nc6 11. Nd5 Qf7 12. O-O O-O-O 13. Nd4 Nxd4 14. Qxd4 c6 15. Bxf6 gxf6 16. Qxf6 Qxf6 17. Nxf6 Be5 18. Bg4 Bxf6 19. Bxf5+ Kc7 20. Rad1 Bxb2 21. Rxd8 Rxd8 22. Bxh7 Rd4 23. g3 Rxc4 24. h4 b5,"The pawn race begins. Naturally, with an
extra pawn and a freer run for his passed pawns, White holds the better hand.
The endgame artist Capablanca once again plays the rest of the game
magnificently.",False
1. d4 Nf6 2. c4 e5 3. dxe5 Ng4 4. e4 d6 5. exd6 Bxd6 6. Be2 f5 7. exf5 Qe7 8. Nf3 Bxf5 9. Bg5 Nf6 10. Nc3 Nc6 11. Nd5 Qf7 12. O-O O-O-O 13. Nd4 Nxd4 14. Qxd4 c6 15. Bxf6 gxf6 16. Qxf6 Qxf6 17. Nxf6 Be5 18. Bg4 Bxf6 19. Bxf5+ Kc7 20. Rad1 Bxb2 21. Rxd8 Rxd8 22. Bxh7 Rd4 23. g3 Rxc4 24. h4 b5 25. Kg2 a5 26. h5 Bg7 27. f4 Bh6,Clearly directed against g4.,True
