moves,comment,good
1. e4 e5 2. Nf3 Nc6 3. Bb5 a6 4. Ba4 Nf6 5. O-O Be7 6. Re1 b5 7. Bb3 d6 8. c3 Na5 9. Bc2 c5 10. d4 Qc7 11. Nbd2 O-O 12. h3 Nc6 13. d5 Nd8 14. a4 b4,Weakening c4 and allowing the ensuing play. 14...Bb7 is also nice for white since the bishop has nothing to do there.,True
1. e4 e5 2. Nf3 Nc6 3. Bb5 a6 4. Ba4 Nf6 5. O-O Be7 6. Re1 b5 7. Bb3 d6 8. c3 Na5 9. Bc2 c5 10. d4 Qc7 11. Nbd2 O-O 12. h3 Nc6 13. d5 Nd8 14. a4 b4 15. Nc4 a5 16. Nfxe5,"This little combination opens up the center so white can exploit his positional advantages, particularly on the light squares. Otherwise black would be fine after 16...Ne8.",True
1. e4 e5 2. Nf3 Nc6 3. Bb5 a6 4. Ba4 Nf6 5. O-O Be7 6. Re1 b5 7. Bb3 d6 8. c3 Na5 9. Bc2 c5 10. d4 Qc7 11. Nbd2 O-O 12. h3 Nc6 13. d5 Nd8 14. a4 b4 15. Nc4 a5 16. Nfxe5 Ba6 17. Bb3 dxe5 18. d6 Bxd6 19. Qxd6 Qxd6 20. Nxd6 Nb7 21. Nxb7 Bxb7 22. cxb4 cxb4 23. f3,"Cementing white's advantage. Both of his minor pieces are better than their counterparts, and black's queenside pawns are also weak.",True
1. e4 e5 2. Nf3 Nc6 3. Bb5 a6 4. Ba4 Nf6 5. O-O Be7 6. Re1 b5 7. Bb3 d6 8. c3 Na5 9. Bc2 c5 10. d4 Qc7 11. Nbd2 O-O 12. h3 Nc6 13. d5 Nd8 14. a4 b4 15. Nc4 a5 16. Nfxe5 Ba6 17. Bb3 dxe5 18. d6 Bxd6 19. Qxd6 Qxd6 20. Nxd6 Nb7 21. Nxb7 Bxb7 22. cxb4 cxb4 23. f3 Rfd8 24. Be3 h6 25. Red1 Bc6 26. Rac1 Be8 27. Kf2 Rxd1 28. Rxd1 Rc8 29. g4,"With the idea 30.h4, 31.g5, 32.Rd5, etc.",True
1. e4 e5 2. Nf3 Nc6 3. Bb5 a6 4. Ba4 Nf6 5. O-O Be7 6. Re1 b5 7. Bb3 d6 8. c3 Na5 9. Bc2 c5 10. d4 Qc7 11. Nbd2 O-O 12. h3 Nc6 13. d5 Nd8 14. a4 b4 15. Nc4 a5 16. Nfxe5 Ba6 17. Bb3 dxe5 18. d6 Bxd6 19. Qxd6 Qxd6 20. Nxd6 Nb7 21. Nxb7 Bxb7 22. cxb4 cxb4 23. f3 Rfd8 24. Be3 h6 25. Red1 Bc6 26. Rac1 Be8 27. Kf2 Rxd1 28. Rxd1 Rc8 29. g4 Bd7 30. Bb6 Be6 31. Bxe6 fxe6 32. Rd8+,Nice. White exchanges off rooks since otherwise black would develop counterplay with ...Rc8-c2 (that was black's idea behind exchanging bishops).,True
1. e4 e5 2. Nf3 Nc6 3. Bb5 a6 4. Ba4 Nf6 5. O-O Be7 6. Re1 b5 7. Bb3 d6 8. c3 Na5 9. Bc2 c5 10. d4 Qc7 11. Nbd2 O-O 12. h3 Nc6 13. d5 Nd8 14. a4 b4 15. Nc4 a5 16. Nfxe5 Ba6 17. Bb3 dxe5 18. d6 Bxd6 19. Qxd6 Qxd6 20. Nxd6 Nb7 21. Nxb7 Bxb7 22. cxb4 cxb4 23. f3 Rfd8 24. Be3 h6 25. Red1 Bc6 26. Rac1 Be8 27. Kf2 Rxd1 28. Rxd1 Rc8 29. g4 Bd7 30. Bb6 Be6 31. Bxe6 fxe6 32. Rd8+ Rxd8 33. Bxd8 Nd7 34. Bxa5 Nc5 35. b3 Nxb3 36. Bxb4 Nd4 37. a5,The extra passed a-pawn wins easily.,True
