comment,good,reasoning,moves,context,reformulated
"This is an interesting matchup because Ponomariov was and Karjakin is now the youngest GM in the world, and they come from the same chess club in the Ukraine! They must be feeding the youngsters some kind of super-Wheaties.",False,"
The comment does not explain the mistake made by the player, as it focuses on the players' backgrounds and nationalities rather than analyzing the specific chess move.",1. e4 c5,"This is a game between Ponomariov, Ruslan (as White) and Karjakin, Sergey (as Black). Last move played: Black plays Pawn to c5",-
The Najdorf Variation prepares ...b5 holds off on moving Pe7 until White shows a bit more of his plan.,True,"

The comment correctly identifies a common strategic mistake in the Najdorf Variation, which is delaying...b5 without developing enough pieces to support the advance, allowing White to gain tempo and space.",1. e4 c5 2. Nf3 d6 3. d4 cxd4 4. Nxd4 Nf6 5. Nc3 a6,"This is a game between Ponomariov, Ruslan (as White) and Karjakin, Sergey (as Black). Last move played: Black plays Pawn to a6"," In this situation, the move played by Black (Karjakin) is not optimal. They need to develop their pieces and connect their rooks. Moving the pawn to a6 doesn't contribute to these goals."
"This move was played by the US GM Robert Byrne, but not really popularized until several British GMs began to play it. Now it's known as the English Attack.",False,"

The comment does not explain the mistake made by the player; it simply provides historical context about the origin and popularity of the move.",1. e4 c5 2. Nf3 d6 3. d4 cxd4 4. Nxd4 Nf6 5. Nc3 a6 6. Be3,"This is a game between Ponomariov, Ruslan (as White) and Karjakin, Sergey (as Black). Last move played: White plays Bishop to e3",-
6...e6 is also quite common.,False,"

The comment does not explain the mistake made by the player since it only states that the move e6 is common, without assessing whether it was a poor choice in the specific game situation.",1. e4 c5 2. Nf3 d6 3. d4 cxd4 4. Nxd4 Nf6 5. Nc3 a6 6. Be3 e5,"This is a game between Ponomariov, Ruslan (as White) and Karjakin, Sergey (as Black). Last move played: Black plays Pawn to e5",-
Black doesn't fear the backward Pd6 and the weak square at d5 if his pieces coordinate to control d-file squares. The dark-square pawns restrain Nb3 and Be3 pretty well and the Nf6 & Be6 contest White's control of e4 & d5.,True,"

The comment explains the mistake made by the player as it identifies the potential for coordination and control of d-file squares, which could lead to a strategic disadvantage for the black pieces.",1. e4 c5 2. Nf3 d6 3. d4 cxd4 4. Nxd4 Nf6 5. Nc3 a6 6. Be3 e5 7. Nb3 Be6,"This is a game between Ponomariov, Ruslan (as White) and Karjakin, Sergey (as Black). Last move played: Black plays Bishop to e6"," 'Black is ill-advised to advance their pawn to e6, which may expose d5 to weakening. The coordination of their dark-square pawns on d6 and e6 constrains White's knight on b3 and bishop on e3 effectively. Additionally, White's knight on f6 and bishop on e6 are asserting dominance over critical central squares e4 and d5.'"
White plans g2-g4-g5 to kick Nf6 away and gain control of d5. What's less certain is how Bf1 might come into play.,True,"

The comment accurately explains the mistake by stating the player's plan to pressure Nf6 and gain control over d5, but also points out the uncertainty regarding the involvement of Bf1.",1. e4 c5 2. Nf3 d6 3. d4 cxd4 4. Nxd4 Nf6 5. Nc3 a6 6. Be3 e5 7. Nb3 Be6 8. f3,"This is a game between Ponomariov, Ruslan (as White) and Karjakin, Sergey (as Black). Last move played: White plays Pawn to f3", White's plan to go g2-g4-g5 to chase away the knight on f6 and gain control over d5 seems questionable. It's unclear how the bishop on f1 will participate in this strategy.
"This has been around a few years now and it's holding up pretty well. But, some players still choose ...O-O.",True,"

The comment implies that the player's move of...O-O (castling kingside) was a mistake, as it suggests that it's an outdated strategy that some players still choose to play.",1. e4 c5 2. Nf3 d6 3. d4 cxd4 4. Nxd4 Nf6 5. Nc3 a6 6. Be3 e5 7. Nb3 Be6 8. f3 Be7 9. Qd2 h5,"This is a game between Ponomariov, Ruslan (as White) and Karjakin, Sergey (as Black). Last move played: Black plays Pawn to h5"," 'This move doesn't support their strategy well. It weakens their king's position and gives the opponent, Black, an opportunity for a potential attack.'"
"I think he must be considering f3-f4 to threaten Ph5 and to open the position while Ke8 isn't as safe as he would normally be. Or, he's still just preparing g2-g4-g5.",True,"

The comment accurately identifies the potential mistakes in the player's strategy, indicating they might be compromising king safety and not preparing for future aggressive moves.",1. e4 c5 2. Nf3 d6 3. d4 cxd4 4. Nxd4 Nf6 5. Nc3 a6 6. Be3 e5 7. Nb3 Be6 8. f3 Be7 9. Qd2 h5 10. Be2,"This is a game between Ponomariov, Ruslan (as White) and Karjakin, Sergey (as Black). Last move played: White plays Bishop to e2"," They might be thinking about playing f3-f4 to challenge P5 and to open the game, but the position for Black isn't as secure as they usually expect. Alternatively, they could be planning g2-g4-g5."
"It's unclear how well Bf5 coordinates with the other pieces in this position, but retaining the two bishops appeals to many players.",True,"

The comment does explain the mistake made by the player, as it highlights the lack of coordination between the bishop on f5 and the other pieces, while also mentioning the common preference for maintaining the bishop pair.",1. e4 c5 2. Nf3 d6 3. d4 cxd4 4. Nxd4 Nf6 5. Nc3 a6 6. Be3 e5 7. Nb3 Be6 8. f3 Be7 9. Qd2 h5 10. Be2 Nbd7 11. Nd5 Nxd5 12. exd5 Bf5,"This is a game between Ponomariov, Ruslan (as White) and Karjakin, Sergey (as Black). Last move played: Black plays Bishop to f5", White's Bishop to f5 seems misaligned with their overall strategy.
"He might have it in mind to play ...Rf8-c8 and ...Qd8, but it's usually a bad idea to commit the queen to one side of the board or the other before absolutely necessary. Pd5 & Pd6 help to divide the board in two and the player who can switch from one side to the other quickly has some advantage.",True,"

The comment accurately explains the mistake as it highlights the risk of committing the queen to one side of the board without a clear necessity, and suggests that better positional moves (Pd5 & Pd6) would create an advantage by dividing the board and allowing for quick side switches.",1. e4 c5 2. Nf3 d6 3. d4 cxd4 4. Nxd4 Nf6 5. Nc3 a6 6. Be3 e5 7. Nb3 Be6 8. f3 Be7 9. Qd2 h5 10. Be2 Nbd7 11. Nd5 Nxd5 12. exd5 Bf5 13. O-O O-O 14. c4 Qc7,"This is a game between Ponomariov, Ruslan (as White) and Karjakin, Sergey (as Black). Last move played: Black plays Queen to c7"," 'Black might consider playing...Rf8-c8 and...Qd8, but it's often not a good strategy to commit the queen to one side of the board before it's really needed. With moves like Pd5 & Pd6, White can effectively divide the board, giving them an advantage if they can quickly maneuver between sides.'"
"Opening lines on the king-side is desirable, but opening up e5 gives Nd7 a nice square.",False,"

The comment discusses the potential benefits of opening lines on the king-side and provides a plausible rationale for playing e5, but it does not specifically address the mistake made by the player.",1. e4 c5 2. Nf3 d6 3. d4 cxd4 4. Nxd4 Nf6 5. Nc3 a6 6. Be3 e5 7. Nb3 Be6 8. f3 Be7 9. Qd2 h5 10. Be2 Nbd7 11. Nd5 Nxd5 12. exd5 Bf5 13. O-O O-O 14. c4 Qc7 15. f4,"This is a game between Ponomariov, Ruslan (as White) and Karjakin, Sergey (as Black). Last move played: White plays Pawn to f4",-
"This simplification doesn't end Black's difficulties (White still has the queen-side pawn majority) , but it eases his cramp so the remaining pieces should be able to maneuver without difficulty.",False,"

The comment does not directly address whether the move was a mistake, but rather it discusses the consequences of the move on Black's position and suggests that the remaining pieces can maneuver without difficulty.",1. e4 c5 2. Nf3 d6 3. d4 cxd4 4. Nxd4 Nf6 5. Nc3 a6 6. Be3 e5 7. Nb3 Be6 8. f3 Be7 9. Qd2 h5 10. Be2 Nbd7 11. Nd5 Nxd5 12. exd5 Bf5 13. O-O O-O 14. c4 Qc7 15. f4 exf4 16. Bxf4 Bg6 17. Rac1 Qb6+ 18. Be3 Bg5 19. Bxb6 Bxd2 20. Nxd2 Nxb6,"This is a game between Ponomariov, Ruslan (as White) and Karjakin, Sergey (as Black). Last move played: Black plays Knight takes on b6",-
"I don't know whether to criticize this or not. It doesn't seem to hurt his position much, but a pawn is a pawn (sometimes) .",True,"

The comment evaluates the move's impact on the player's position, recognizing that while the move may not be catastrophic, it still represents a mistake as a pawn is valuable in chess.",1. e4 c5 2. Nf3 d6 3. d4 cxd4 4. Nxd4 Nf6 5. Nc3 a6 6. Be3 e5 7. Nb3 Be6 8. f3 Be7 9. Qd2 h5 10. Be2 Nbd7 11. Nd5 Nxd5 12. exd5 Bf5 13. O-O O-O 14. c4 Qc7 15. f4 exf4 16. Bxf4 Bg6 17. Rac1 Qb6+ 18. Be3 Bg5 19. Bxb6 Bxd2 20. Nxd2 Nxb6 21. Bf3 Nd7 22. Be4 Ne5 23. Bxg6 Nxg6 24. Ne4 Rad8 25. Ng3 h4 26. Nf5 h3,"This is a game between Ponomariov, Ruslan (as White) and Karjakin, Sergey (as Black). Last move played: Black plays Pawn to h3"," 'I'm torn about this move. It's not too detrimental to Black's position, but remember, a pawn has its limitations (sometimes).'"
"Black has given up a pawn, but he still has the basic elements of a good position: safe king, open lines for his pieces and no more weak pawns than his opponent.",True,"

The comment does explain the mistake made by the player because it identifies the pawn trade and highlights the player's positional elements that remain strong despite the loss of the pawn.",1. e4 c5 2. Nf3 d6 3. d4 cxd4 4. Nxd4 Nf6 5. Nc3 a6 6. Be3 e5 7. Nb3 Be6 8. f3 Be7 9. Qd2 h5 10. Be2 Nbd7 11. Nd5 Nxd5 12. exd5 Bf5 13. O-O O-O 14. c4 Qc7 15. f4 exf4 16. Bxf4 Bg6 17. Rac1 Qb6+ 18. Be3 Bg5 19. Bxb6 Bxd2 20. Nxd2 Nxb6 21. Bf3 Nd7 22. Be4 Ne5 23. Bxg6 Nxg6 24. Ne4 Rad8 25. Ng3 h4 26. Nf5 h3 27. gxh3 Ne5 28. Rc3 g6 29. Nh6+ Kg7 30. Ng4,"This is a game between Ponomariov, Ruslan (as White) and Karjakin, Sergey (as Black). Last move played: White plays Knight to g4"," White played Knight to g4, which may seem like a strong move at first, but it's actually a mistake. Black has maintained a defensive posture and structurally sound positioning. With the king in a secure location, open lines for their pieces, and no extra weak pawns compared to White, Black's position remains solid despite the pawn sacrifice."
Black trades rather than let White force a passed pawn by Nxe5 ...dxe5.,False,"

The comment does not explain the mistake made by the player as it only mentions the opponent's possible move and the player's potential response, without analyzing the mistake in their previous move.",1. e4 c5 2. Nf3 d6 3. d4 cxd4 4. Nxd4 Nf6 5. Nc3 a6 6. Be3 e5 7. Nb3 Be6 8. f3 Be7 9. Qd2 h5 10. Be2 Nbd7 11. Nd5 Nxd5 12. exd5 Bf5 13. O-O O-O 14. c4 Qc7 15. f4 exf4 16. Bxf4 Bg6 17. Rac1 Qb6+ 18. Be3 Bg5 19. Bxb6 Bxd2 20. Nxd2 Nxb6 21. Bf3 Nd7 22. Be4 Ne5 23. Bxg6 Nxg6 24. Ne4 Rad8 25. Ng3 h4 26. Nf5 h3 27. gxh3 Ne5 28. Rc3 g6 29. Nh6+ Kg7 30. Ng4 Rfe8 31. Nf6 Rh8 32. Rb3 Rc8 33. Rxb7 Rxc4 34. Ng4 Nxg4,"This is a game between Ponomariov, Ruslan (as White) and Karjakin, Sergey (as Black). Last move played: Black plays Knight takes on g4",-
With double rooks neither king will be completely safe and that helps Black maintain a drawn position.,True,"

The comment accurately explains the mistake, as having double rooks on the board can create unsafe positions for both kings, allowing Black to maintain a draw.",1. e4 c5 2. Nf3 d6 3. d4 cxd4 4. Nxd4 Nf6 5. Nc3 a6 6. Be3 e5 7. Nb3 Be6 8. f3 Be7 9. Qd2 h5 10. Be2 Nbd7 11. Nd5 Nxd5 12. exd5 Bf5 13. O-O O-O 14. c4 Qc7 15. f4 exf4 16. Bxf4 Bg6 17. Rac1 Qb6+ 18. Be3 Bg5 19. Bxb6 Bxd2 20. Nxd2 Nxb6 21. Bf3 Nd7 22. Be4 Ne5 23. Bxg6 Nxg6 24. Ne4 Rad8 25. Ng3 h4 26. Nf5 h3 27. gxh3 Ne5 28. Rc3 g6 29. Nh6+ Kg7 30. Ng4 Rfe8 31. Nf6 Rh8 32. Rb3 Rc8 33. Rxb7 Rxc4 34. Ng4 Nxg4 35. Rfxf7+ Kh6 36. hxg4 Rxg4+,"This is a game between Ponomariov, Ruslan (as White) and Karjakin, Sergey (as Black). Last move played: Black plays Rook takes on g4 with check"," 'The move played by Black, capturing on g4, fails to adequately protect their own king, making it vulnerable to potential attacks by White's double rooks.'"
a fair result chessically and a great result for Karjakin (!) to draw the FIDE champ,False,"

The comment does not explain the mistake made by the player; it instead praises Karjakin for drawing against the FIDE champion.",1. e4 c5 2. Nf3 d6 3. d4 cxd4 4. Nxd4 Nf6 5. Nc3 a6 6. Be3 e5 7. Nb3 Be6 8. f3 Be7 9. Qd2 h5 10. Be2 Nbd7 11. Nd5 Nxd5 12. exd5 Bf5 13. O-O O-O 14. c4 Qc7 15. f4 exf4 16. Bxf4 Bg6 17. Rac1 Qb6+ 18. Be3 Bg5 19. Bxb6 Bxd2 20. Nxd2 Nxb6 21. Bf3 Nd7 22. Be4 Ne5 23. Bxg6 Nxg6 24. Ne4 Rad8 25. Ng3 h4 26. Nf5 h3 27. gxh3 Ne5 28. Rc3 g6 29. Nh6+ Kg7 30. Ng4 Rfe8 31. Nf6 Rh8 32. Rb3 Rc8 33. Rxb7 Rxc4 34. Ng4 Nxg4 35. Rfxf7+ Kh6 36. hxg4 Rxg4+ 37. Kf2 Kg5 38. Rh7 Rf4+ 39. Ke3 Rhf8 40. Rh3 Re8+ 41. Kd3 Re5 42. Rg3+ Kf6,"This is a game between Ponomariov, Ruslan (as White) and Karjakin, Sergey (as Black). Last move played: Black plays King to f6",-
