comment,good,reasoning,moves,context,reformulated
A passive move. 5...c5 was better.,True,"

The comment correctly identifies the mistake made by the player since 5...c5 would have been a more active and strategic move in the given position.",1. d4 d5 2. c4 e6 3. Nc3 Nf6 4. Nf3 Be7 5. Bf4 c6,"This is a game between Tarrasch, S (as White) and Von Scheve, T (as Black). Last move played: Black plays Pawn to c6", Black's pawn to c6 doesn't leverage the center or develop pieces effectively. A move like 5...c5 would have been stronger.
Preparing a flight square for the Bishop in the event of 7...Nh5.,True,"

The comment accurately explains the potential mistake by highlighting a strategic opportunity for the Bishop, suggesting that the move 7...Nh5 could be a weakening move, allowing the opponent to exploit the Bishop's position.",1. d4 d5 2. c4 e6 3. Nc3 Nf6 4. Nf3 Be7 5. Bf4 c6 6. e3 Nbd7 7. h3,"This is a game between Tarrasch, S (as White) and Von Scheve, T (as Black). Last move played: White plays Pawn to h3"," ""The move to h3 by White may seem defensive, but it's a tactical mistake as it weakens the kingside pawn structure and grants Black a potential attacking square for their knight."""
"A serious mistake. After the exchange of Knights, Black's recapturing Pawn on e4 becomes weak and needs protection by...f5. White attacks it with f3 forcing Black to exchange and open the 'g' file.",True,"

The comment explains the mistake made by the player as it suggests a tactical flaw in failing to protect the e4 pawn, which could be exploited by White's f3 move.",1. d4 d5 2. c4 e6 3. Nc3 Nf6 4. Nf3 Be7 5. Bf4 c6 6. e3 Nbd7 7. h3 Ne4,"This is a game between Tarrasch, S (as White) and Von Scheve, T (as Black). Last move played: Black plays Knight to e4"," A critical error has occurred. With the exchange of Knights, Black's pawn on e4 is now vulnerable and requires support from, perhaps, a move like f5. White initiates an attack by playing f3, which compels Black to recapture the pawn, thereby opening up the 'g' file for potential tactics."
Black should have retained this Bishop for the protection of his pawn on g7.,True,"

The comment correctly explains the mistake, as the Bishop was misplaced and could have been used to protect the pawn on g7.",1. d4 d5 2. c4 e6 3. Nc3 Nf6 4. Nf3 Be7 5. Bf4 c6 6. e3 Nbd7 7. h3 Ne4 8. Nxe4 dxe4 9. Nd2 Bb4,"This is a game between Tarrasch, S (as White) and Von Scheve, T (as Black). Last move played: Black plays Bishop to b4"," The move played by black was not strategically sound as it exposed the bishop, which could have been used to defend the g7 pawn."
Now White has the advantage of the two Bishops.,False,"
The comment does not explain the mistake made by the player as it only describes a potential advantage, not the reason for the error in the move.",1. d4 d5 2. c4 e6 3. Nc3 Nf6 4. Nf3 Be7 5. Bf4 c6 6. e3 Nbd7 7. h3 Ne4 8. Nxe4 dxe4 9. Nd2 Bb4 10. a3 Bxd2+ 11. Qxd2,"This is a game between Tarrasch, S (as White) and Von Scheve, T (as Black). Last move played: White plays Queen takes on d2",-
Better was 11...Qe7 followed by 12...e5 to get some counterplay.,True,"

The comment accurately explains the mistake made by the player as it suggests a better move that could have offered counterplay and improved the position.",1. d4 d5 2. c4 e6 3. Nc3 Nf6 4. Nf3 Be7 5. Bf4 c6 6. e3 Nbd7 7. h3 Ne4 8. Nxe4 dxe4 9. Nd2 Bb4 10. a3 Bxd2+ 11. Qxd2 O-O,"This is a game between Tarrasch, S (as White) and Von Scheve, T (as Black). Last move played: Black plays kingside castle"," ""11...Qe7 leads to weakening Black's position. 12...e5 is not advisable as it creates unnecessary weaknesses without providing a substantial counterplay advantage."""
"If 12...Nf6, then 13 Be5 followed by Bxf6 wins the Pawn on e4.",True,"

The comment explains the mistake made by the player because it provides a direct consequence of the move, showing how the player's choice could have been exploited by their opponent.",1. d4 d5 2. c4 e6 3. Nc3 Nf6 4. Nf3 Be7 5. Bf4 c6 6. e3 Nbd7 7. h3 Ne4 8. Nxe4 dxe4 9. Nd2 Bb4 10. a3 Bxd2+ 11. Qxd2 O-O 12. Qc2 f5,"This is a game between Tarrasch, S (as White) and Von Scheve, T (as Black). Last move played: Black plays Pawn to f5"," Black played Nf6, which weakens their king's position. White played Be5, followed by Bxf6, gaining the pawn on e4 and improving their position."
Gets a grip on the black squares and prevents...Qe7 and...e5.,True,"

The comment correctly identifies a tactical error in the player's move, as it highlights the vulnerability created by failing to address the threat of Qe7 and e5.",1. d4 d5 2. c4 e6 3. Nc3 Nf6 4. Nf3 Be7 5. Bf4 c6 6. e3 Nbd7 7. h3 Ne4 8. Nxe4 dxe4 9. Nd2 Bb4 10. a3 Bxd2+ 11. Qxd2 O-O 12. Qc2 f5 13. Bd6,"This is a game between Tarrasch, S (as White) and Von Scheve, T (as Black). Last move played: White plays Bishop to d6"," After White's last move, Black aims to maintain control over the black squares and possibly consider advancing the pawn to e5. The move played did not support these strategic goals."
"Threatens to win a pawn after 17 Bxf6, forcing Black to exchange pawns, opening the 'g' file.",True,"

The comment accurately explains the mistake made by the player, as it highlights the potential loss of a pawn due to the forced exchange and the strategic opportunity gained by opening the 'g' file.",1. d4 d5 2. c4 e6 3. Nc3 Nf6 4. Nf3 Be7 5. Bf4 c6 6. e3 Nbd7 7. h3 Ne4 8. Nxe4 dxe4 9. Nd2 Bb4 10. a3 Bxd2+ 11. Qxd2 O-O 12. Qc2 f5 13. Bd6 Re8 14. O-O-O Nf6 15. Be5 Bd7 16. f3,"This is a game between Tarrasch, S (as White) and Von Scheve, T (as Black). Last move played: White plays Pawn to f3"," ""White's move is risky as it exposes their pawn to capture, which could lead to a disadvantageous pawn structure for them. This move also opens up the 'g' file, potentially giving Black more control and space on the board."""
Defends g7 and prevents 22 Qh4.,True,"

The comment explains the mistake well, as it highlights the loss of control over the g7 square and the potential threat of Qh4.",1. d4 d5 2. c4 e6 3. Nc3 Nf6 4. Nf3 Be7 5. Bf4 c6 6. e3 Nbd7 7. h3 Ne4 8. Nxe4 dxe4 9. Nd2 Bb4 10. a3 Bxd2+ 11. Qxd2 O-O 12. Qc2 f5 13. Bd6 Re8 14. O-O-O Nf6 15. Be5 Bd7 16. f3 exf3 17. gxf3 b5 18. Rg1 Rf8 19. Rd2 Rf7 20. Rdg2 a5 21. Qf2 Ne8,"This is a game between Tarrasch, S (as White) and Von Scheve, T (as Black). Last move played: Black plays Knight to e8", Their move to prevent 22 Qh4 might not be the best choice. Keep in mind that it's important to simplify explanations and use 'Black' or 'White' when referring to players.
"If 22...g6, White attacks with 23 h4 and 24 h5 or if 22...h6 23 Rg6 Kh7 24 Qg3 Qe7 25 Rxh6 +! Gxh6 26 Qg6#",True,"
The comment accurately explains the tactical motif the player could have missed, which involves a potential checkmate sequence after the moves 22...g6 (or h6) - 23 Rg6 - Kh7 - 24 Qg3 - Qe7 - 25 Rxh6 - Gxh6 - 26 Qg6#, and indicates the importance of defending against such tactics.",1. d4 d5 2. c4 e6 3. Nc3 Nf6 4. Nf3 Be7 5. Bf4 c6 6. e3 Nbd7 7. h3 Ne4 8. Nxe4 dxe4 9. Nd2 Bb4 10. a3 Bxd2+ 11. Qxd2 O-O 12. Qc2 f5 13. Bd6 Re8 14. O-O-O Nf6 15. Be5 Bd7 16. f3 exf3 17. gxf3 b5 18. Rg1 Rf8 19. Rd2 Rf7 20. Rdg2 a5 21. Qf2 Ne8 22. Rg5 Qe7,"This is a game between Tarrasch, S (as White) and Von Scheve, T (as Black). Last move played: Black plays Queen to e7"," White can play 23 h4, aiming to undermine Black's pawn structure on the kingside. If Black responds with 23...g6, White can follow up with 24 h5, applying pressure. Alternatively, if Black plays 23...h6, White can capture the pawn with 24 Rg6, attacking the h7 pawn and threatening Qg3+. If Black moves Kh7 in response, White's Qg3 continues the attack while Black's queen is forced to retreat to e7. White's Rxh6 captures the rook, but Black can recapture with Gxh6. If White plays Qg6#, it would result in checkmate."
"Other moves lose quickly e.g., A-24...g6 25 Rxg6+ hxg6 26 Rxg6+ Rg7 27 Bxf6 +- B-24...Kh8 25 Rxg7 and 26 Bxf6 +- C-24...Be8 25 Bxf6 Qxf6 26 Qxf6 Rxf6 27 Rxg7+ Kf8 28 Rxh7+-",True,"

Because the comment details a series of losing positions, demonstrating that the previously played move was indeed a mistake.",1. d4 d5 2. c4 e6 3. Nc3 Nf6 4. Nf3 Be7 5. Bf4 c6 6. e3 Nbd7 7. h3 Ne4 8. Nxe4 dxe4 9. Nd2 Bb4 10. a3 Bxd2+ 11. Qxd2 O-O 12. Qc2 f5 13. Bd6 Re8 14. O-O-O Nf6 15. Be5 Bd7 16. f3 exf3 17. gxf3 b5 18. Rg1 Rf8 19. Rd2 Rf7 20. Rdg2 a5 21. Qf2 Ne8 22. Rg5 Qe7 23. Qh4 Nf6 24. Qh6 Ra7,"This is a game between Tarrasch, S (as White) and Von Scheve, T (as Black). Last move played: Black plays Rook to a7"," In the given game, Tarrasch, playing as White, made a series of moves that quickly led to a disadvantage. Specifically, when Black (Von Scheve) positioned their Rook on a7, White (Tarrasch) made a mistake with A-24...g6, then followed with Rxg6+ hxg6, Rxg6+ Rg7, and Bxf6. These moves allowed Black to gain a significant advantage, leading to a swift loss for White. The sequence of moves can be summarized as White's play leading to rapid defeat after Black's Rook's strategic placement on a7."
"If 26...Kh8, 27 Qxh7+ Nxh7 28 Rg8#",True,"

The comment correctly identifies the significant mistake made by the player by presenting a checkmate sequence.",1. d4 d5 2. c4 e6 3. Nc3 Nf6 4. Nf3 Be7 5. Bf4 c6 6. e3 Nbd7 7. h3 Ne4 8. Nxe4 dxe4 9. Nd2 Bb4 10. a3 Bxd2+ 11. Qxd2 O-O 12. Qc2 f5 13. Bd6 Re8 14. O-O-O Nf6 15. Be5 Bd7 16. f3 exf3 17. gxf3 b5 18. Rg1 Rf8 19. Rd2 Rf7 20. Rdg2 a5 21. Qf2 Ne8 22. Rg5 Qe7 23. Qh4 Nf6 24. Qh6 Ra7 25. Bd6 Qxd6 26. Rxg7+ Kf8,"This is a game between Tarrasch, S (as White) and Von Scheve, T (as Black). Last move played: Black plays King to f8"," If Black plays Kh8, White responds with Qxh7+ Nxh7, and then Rg8#. This sequence of moves results in an immediate checkmate, making it a poor choice for Black."
"Threatening 31 Rg8+ and mate next move. If Black plays 30...Qf8, 31 Qg6+ Kd8 32 Rg8 and White win the Queen.",True,"

The comment explains the mistake made by the player as it outlines the consequences of the move, namely the threat of a checkmate in two moves if Black continues with the suggested defensive moves.",1. d4 d5 2. c4 e6 3. Nc3 Nf6 4. Nf3 Be7 5. Bf4 c6 6. e3 Nbd7 7. h3 Ne4 8. Nxe4 dxe4 9. Nd2 Bb4 10. a3 Bxd2+ 11. Qxd2 O-O 12. Qc2 f5 13. Bd6 Re8 14. O-O-O Nf6 15. Be5 Bd7 16. f3 exf3 17. gxf3 b5 18. Rg1 Rf8 19. Rd2 Rf7 20. Rdg2 a5 21. Qf2 Ne8 22. Rg5 Qe7 23. Qh4 Nf6 24. Qh6 Ra7 25. Bd6 Qxd6 26. Rxg7+ Kf8 27. Rxh7+ Ke7 28. Rxf7+ Kxf7 29. Rg7+ Ke8 30. Qxf6,"This is a game between Tarrasch, S (as White) and Von Scheve, T (as Black). Last move played: White plays Queen takes on f6"," Threats exist of Rg8+ followed by mate. If Black plays Qf8, White will respond with Qg6+, forcing the Black King to move to d8. Subsequently, White plays Rg8 to win the Black Queen."
