comment,good,reasoning,moves,context,reformulated
C42: Petroff Defence: 3 Nxe5 and unusual White 3rd moves,True,"

The comment accurately highlights the mistake by pointing out the Petroff Defence and the unusual third moves which deviate from the expected strategies, indicating a lack of proper play.",1. e4,"This is a game between Shirov, Alexei (as White) and Kramnik, Vladimir (as Black). Last move played: White plays Pawn to e4"," 'C42: Black employed the Petroff Defence, but their 3rd move, Nxe5, deviated from common strategy.'"
With the idea Nxe4,True,"

The comment seems to be addressing a specific chess move, Nxe4, which indicates that the player made a mistake by capturing the e4 pawn with their knight.",1. e4 e5 2. Nf3 Nf6 3. Nxe5 d6 4. Nf3 Nxe4 5. d4 d5 6. Bd3 Nc6 7. O-O Be7 8. Re1 Bg4 9. c3 f5 10. Qb3 O-O 11. Nbd2 Na5 12. Qa4 Nc6 13. Bb5 Bh4 14. g3 Bf6 15. Bxc6 bxc6 16. Qxc6 Re8 17. Ne5,"This is a game between Shirov, Alexei (as White) and Kramnik, Vladimir (as Black). Last move played: White plays Knight to e5", White's attempt to play Nxe4 is mistakenly aggressive.
Threatening mate... how?,True,"

The comment ""Threatening mate... how?"" indicates that the player's move was indeed a blunder, as it overlooked a direct checkmate threat from the opponent.",1. e4 e5 2. Nf3 Nf6 3. Nxe5 d6 4. Nf3 Nxe4 5. d4 d5 6. Bd3 Nc6 7. O-O Be7 8. Re1 Bg4 9. c3 f5 10. Qb3 O-O 11. Nbd2 Na5 12. Qa4 Nc6 13. Bb5 Bh4 14. g3 Bf6 15. Bxc6 bxc6 16. Qxc6 Re8 17. Ne5 Bxe5 18. dxe5 Ng5 19. f4 Re6 20. Qc5 Ne4 21. Nxe4 dxe4 22. Be3 a6 23. Qc4 Qd7 24. Rac1 Rd8 25. Rc2 Qf7 26. Rd2,"This is a game between Shirov, Alexei (as White) and Kramnik, Vladimir (as Black). Last move played: White plays Rook to d2"," Black's last move, placing their rook on d2, is not beneficial and could potentially lead to a quick checkmate."
Do you see the mate threat?,True,"

The comment indicates that the player missed a checkmate threat, suggesting they made a critical mistake.",1. e4 e5 2. Nf3 Nf6 3. Nxe5 d6 4. Nf3 Nxe4 5. d4 d5 6. Bd3 Nc6 7. O-O Be7 8. Re1 Bg4 9. c3 f5 10. Qb3 O-O 11. Nbd2 Na5 12. Qa4 Nc6 13. Bb5 Bh4 14. g3 Bf6 15. Bxc6 bxc6 16. Qxc6 Re8 17. Ne5 Bxe5 18. dxe5 Ng5 19. f4 Re6 20. Qc5 Ne4 21. Nxe4 dxe4 22. Be3 a6 23. Qc4 Qd7 24. Rac1 Rd8 25. Rc2 Qf7 26. Rd2 Rxd2 27. Bxd2 Rb6 28. Qxf7+ Kxf7 29. b4 Rc6 30. Kf2 Rh6 31. h4 Rc6 32. Ke3 Bh5 33. Kd4 Ke7 34. c4 Bf7 35. Rc1 Rb6 36. Kc5 Be8 37. Be3 Rc6+ 38. Kd5 Rg6 39. Bc5+ Kd7 40. Rc3 Bf7+ 41. Kd4 h6 42. a4 Rg4 43. b5 axb5 44. a5 e3 45. Rxe3 g5 46. e6+ Bxe6 47. cxb5 gxf4 48. gxf4 Rxf4+ 49. Ke5 Rc4 50. Rd3+ Kc8 51. Kxe6 Rxc5 52. Rd5,"This is a game between Shirov, Alexei (as White) and Kramnik, Vladimir (as Black). Last move played: White plays Rook to d5", Alexei's last move of Rook to d5 seems poor as it doesn't pose an immediate threat.
Threatening mate: Kxe4,True,"

Explanation: The comment accurately pinpoints the mistake made by the player, as Kxe4 would indeed be a threatening move leading to mate.",1. e4 e5 2. Nf3 Nf6 3. Nxe5 d6 4. Nf3 Nxe4 5. d4 d5 6. Bd3 Nc6 7. O-O Be7 8. Re1 Bg4 9. c3 f5 10. Qb3 O-O 11. Nbd2 Na5 12. Qa4 Nc6 13. Bb5 Bh4 14. g3 Bf6 15. Bxc6 bxc6 16. Qxc6 Re8 17. Ne5 Bxe5 18. dxe5 Ng5 19. f4 Re6 20. Qc5 Ne4 21. Nxe4 dxe4 22. Be3 a6 23. Qc4 Qd7 24. Rac1 Rd8 25. Rc2 Qf7 26. Rd2 Rxd2 27. Bxd2 Rb6 28. Qxf7+ Kxf7 29. b4 Rc6 30. Kf2 Rh6 31. h4 Rc6 32. Ke3 Bh5 33. Kd4 Ke7 34. c4 Bf7 35. Rc1 Rb6 36. Kc5 Be8 37. Be3 Rc6+ 38. Kd5 Rg6 39. Bc5+ Kd7 40. Rc3 Bf7+ 41. Kd4 h6 42. a4 Rg4 43. b5 axb5 44. a5 e3 45. Rxe3 g5 46. e6+ Bxe6 47. cxb5 gxf4 48. gxf4 Rxf4+ 49. Ke5 Rc4 50. Rd3+ Kc8 51. Kxe6 Rxc5 52. Rd5 Rc4 53. Rxf5 Re4+ 54. Kd5,"This is a game between Shirov, Alexei (as White) and Kramnik, Vladimir (as Black). Last move played: White plays King to d5", White's move Kxe4 is weak as it exposes the king and allows Black to threaten mate.
White has let it slip away,True,"

The comment correctly identifies the mistake as a loss of control or opportunity that the player allowed to happen.",1. e4 e5 2. Nf3 Nf6 3. Nxe5 d6 4. Nf3 Nxe4 5. d4 d5 6. Bd3 Nc6 7. O-O Be7 8. Re1 Bg4 9. c3 f5 10. Qb3 O-O 11. Nbd2 Na5 12. Qa4 Nc6 13. Bb5 Bh4 14. g3 Bf6 15. Bxc6 bxc6 16. Qxc6 Re8 17. Ne5 Bxe5 18. dxe5 Ng5 19. f4 Re6 20. Qc5 Ne4 21. Nxe4 dxe4 22. Be3 a6 23. Qc4 Qd7 24. Rac1 Rd8 25. Rc2 Qf7 26. Rd2 Rxd2 27. Bxd2 Rb6 28. Qxf7+ Kxf7 29. b4 Rc6 30. Kf2 Rh6 31. h4 Rc6 32. Ke3 Bh5 33. Kd4 Ke7 34. c4 Bf7 35. Rc1 Rb6 36. Kc5 Be8 37. Be3 Rc6+ 38. Kd5 Rg6 39. Bc5+ Kd7 40. Rc3 Bf7+ 41. Kd4 h6 42. a4 Rg4 43. b5 axb5 44. a5 e3 45. Rxe3 g5 46. e6+ Bxe6 47. cxb5 gxf4 48. gxf4 Rxf4+ 49. Ke5 Rc4 50. Rd3+ Kc8 51. Kxe6 Rxc5 52. Rd5 Rc4 53. Rxf5 Re4+ 54. Kd5 Rxh4 55. a6 Ra4 56. Rf8+ Kd7 57. Rf7+ Kc8 58. Rf8+,"This is a game between Shirov, Alexei (as White) and Kramnik, Vladimir (as Black). Last move played: White plays Rook to f8 with check"," ""White's last move was a mistake; allowing the Rook to move to f8 without a strong purpose."""
Demolishes the pawn shield,True,"

The comment ""Demolishes the pawn shield"" appropriately describes the mistake made by the player in a way that accurately portrays the effect of their move on their pawn structure.",1. e4 e5 2. Nf3 Nf6 3. Nxe5 d6 4. Nf3 Nxe4 5. d4 d5 6. Bd3 Nc6 7. O-O Be7 8. Re1 Bg4 9. c3 f5 10. Qb3 O-O 11. Nbd2 Na5 12. Qa4 Nc6 13. Bb5 Bh4 14. g3 Bf6 15. Bxc6 bxc6 16. Qxc6 Re8 17. Ne5 Bxe5 18. dxe5 Ng5 19. f4 Re6 20. Qc5 Ne4 21. Nxe4 dxe4 22. Be3 a6 23. Qc4 Qd7 24. Rac1 Rd8 25. Rc2 Qf7 26. Rd2 Rxd2 27. Bxd2 Rb6 28. Qxf7+ Kxf7 29. b4 Rc6 30. Kf2 Rh6 31. h4 Rc6 32. Ke3 Bh5 33. Kd4 Ke7 34. c4 Bf7 35. Rc1 Rb6 36. Kc5 Be8 37. Be3 Rc6+ 38. Kd5 Rg6 39. Bc5+ Kd7 40. Rc3 Bf7+ 41. Kd4 h6 42. a4 Rg4 43. b5 axb5 44. a5 e3 45. Rxe3 g5 46. e6+ Bxe6 47. cxb5 gxf4 48. gxf4 Rxf4+ 49. Ke5 Rc4 50. Rd3+ Kc8 51. Kxe6 Rxc5 52. Rd5 Rc4 53. Rxf5 Re4+ 54. Kd5 Rxh4 55. a6 Ra4 56. Rf8+ Kd7 57. Rf7+ Kc8 58. Rf8+ Kd7 59. Ra8 Ra1 60. a7 Rd1+ 61. Ke4 Re1+ 62. Kf3 Ra1 63. b6,"This is a game between Shirov, Alexei (as White) and Kramnik, Vladimir (as Black). Last move played: White plays Pawn to b6"," Black's last move leaves the pawn shield ineffective, opening up potential weaknesses."
