comment,good,reasoning,moves,context,reformulated
This knight is aiming to take the strong d5 square.,True,"
The comment correctly identifies the mistake made by the player as the knight's move to an unprotected or weak square (d5).",1. d4 Nf6 2. c4 e6 3. Nc3 Bb4 4. Qc2 c5 5. dxc5 Na6 6. a3 Bxc3+ 7. Qxc3 Nxc5 8. f3 d6 9. e4 e5 10. Be3 Qc7 11. Ne2,"This is a game between Flohr, Salo (as White) and Botvinnik, M. (as Black). Last move played: White plays Knight to e2"," Flohr's knight was aiming to take the strong d5 square, which was a poorly thought move."
(!),True,"

The comment ""(!)"" indicates a clear sign of disapproval and acknowledges that the move was a mistake, effectively explaining the player's blunder.",1. d4 Nf6 2. c4 e6 3. Nc3 Bb4 4. Qc2 c5 5. dxc5 Na6 6. a3 Bxc3+ 7. Qxc3 Nxc5 8. f3 d6 9. e4 e5 10. Be3 Qc7 11. Ne2 Be6 12. Qc2 O-O 13. Nc3 Rfc8 14. Be2 a6 15. Rc1 Ncd7 16. Qd2,"This is a game between Flohr, Salo (as White) and Botvinnik, M. (as Black). Last move played: White plays Queen to d2", The move was a poor decision due to the lack of safety for Black's King.
Forced.,False,"

The comment ""Forced"" does not explain the mistake made by the player, as it implies the move was inevitable due to the opponent's position, rather than a blunder.",1. d4 Nf6 2. c4 e6 3. Nc3 Bb4 4. Qc2 c5 5. dxc5 Na6 6. a3 Bxc3+ 7. Qxc3 Nxc5 8. f3 d6 9. e4 e5 10. Be3 Qc7 11. Ne2 Be6 12. Qc2 O-O 13. Nc3 Rfc8 14. Be2 a6 15. Rc1 Ncd7 16. Qd2 Qb8 17. Nd5 Bxd5,"This is a game between Flohr, Salo (as White) and Botvinnik, M. (as Black). Last move played: Black plays Bishop takes on d5",-
"White has achieved his goal: to come to an endgame with the two Bishops against Knights. From a theoretical point of view the win of the two Bishops is not a dogma but... the practice, strangely, favors it.",False,"

The comment does not explain the mistake made by the player, as it focuses on the strategic goal of the move rather than the poor execution or ineffective outcome.",1. d4 Nf6 2. c4 e6 3. Nc3 Bb4 4. Qc2 c5 5. dxc5 Na6 6. a3 Bxc3+ 7. Qxc3 Nxc5 8. f3 d6 9. e4 e5 10. Be3 Qc7 11. Ne2 Be6 12. Qc2 O-O 13. Nc3 Rfc8 14. Be2 a6 15. Rc1 Ncd7 16. Qd2 Qb8 17. Nd5 Bxd5 18. cxd5 Rxc1+ 19. Qxc1 Qd8 20. O-O Rc8 21. Qd2 Qc7 22. Rc1 Qxc1+ 23. Qxc1 Rxc1+ 24. Bxc1 Kf8,"This is a game between Flohr, Salo (as White) and Botvinnik, M. (as Black). Last move played: Black plays King to f8",-
Move by move Flohr improves his position.,False,"

The comment does not explain the mistake made by the player, as it implies the move was beneficial rather than a mistake.",1. d4 Nf6 2. c4 e6 3. Nc3 Bb4 4. Qc2 c5 5. dxc5 Na6 6. a3 Bxc3+ 7. Qxc3 Nxc5 8. f3 d6 9. e4 e5 10. Be3 Qc7 11. Ne2 Be6 12. Qc2 O-O 13. Nc3 Rfc8 14. Be2 a6 15. Rc1 Ncd7 16. Qd2 Qb8 17. Nd5 Bxd5 18. cxd5 Rxc1+ 19. Qxc1 Qd8 20. O-O Rc8 21. Qd2 Qc7 22. Rc1 Qxc1+ 23. Qxc1 Rxc1+ 24. Bxc1 Kf8 25. Kf2 Ke7 26. Be3 Kd8 27. Ke1 Kc7 28. Kd2 Nc5 29. b4 Ncd7 30. g3 Nb6 31. Kc2 Nbd7 32. a4 Nb6 33. a5,"This is a game between Flohr, Salo (as White) and Botvinnik, M. (as Black). Last move played: White plays Pawn to a5",-
Now the Nd7 is blocked because Black should not allow the white Bishop to come to c8.,True,"

The comment accurately identifies the mistake made by Black, as allowing the White Bishop to move to c8 indeed blocks the knight on d7, which could have been a useful defensive or offensive piece.",1. d4 Nf6 2. c4 e6 3. Nc3 Bb4 4. Qc2 c5 5. dxc5 Na6 6. a3 Bxc3+ 7. Qxc3 Nxc5 8. f3 d6 9. e4 e5 10. Be3 Qc7 11. Ne2 Be6 12. Qc2 O-O 13. Nc3 Rfc8 14. Be2 a6 15. Rc1 Ncd7 16. Qd2 Qb8 17. Nd5 Bxd5 18. cxd5 Rxc1+ 19. Qxc1 Qd8 20. O-O Rc8 21. Qd2 Qc7 22. Rc1 Qxc1+ 23. Qxc1 Rxc1+ 24. Bxc1 Kf8 25. Kf2 Ke7 26. Be3 Kd8 27. Ke1 Kc7 28. Kd2 Nc5 29. b4 Ncd7 30. g3 Nb6 31. Kc2 Nbd7 32. a4 Nb6 33. a5 Nbd7 34. Bc1 Kd8 35. Bb2 Ne8 36. Kd2 Nc7 37. Ke3 Ke7 38. Bf1 Nb5 39. h4 Nc7 40. Bh3,"This is a game between Flohr, Salo (as White) and Botvinnik, M. (as Black). Last move played: White plays Bishop to h3", White's bishop move to h3 is a tactical error; Black should prevent White from placing the bishop on c8.
First adjournment. Flohr then continued,False,"

The comment does not explain the mistake made by the player, as it simply states when the game was adjourned and who continued playing, without providing any insight into the error.",1. d4 Nf6 2. c4 e6 3. Nc3 Bb4 4. Qc2 c5 5. dxc5 Na6 6. a3 Bxc3+ 7. Qxc3 Nxc5 8. f3 d6 9. e4 e5 10. Be3 Qc7 11. Ne2 Be6 12. Qc2 O-O 13. Nc3 Rfc8 14. Be2 a6 15. Rc1 Ncd7 16. Qd2 Qb8 17. Nd5 Bxd5 18. cxd5 Rxc1+ 19. Qxc1 Qd8 20. O-O Rc8 21. Qd2 Qc7 22. Rc1 Qxc1+ 23. Qxc1 Rxc1+ 24. Bxc1 Kf8 25. Kf2 Ke7 26. Be3 Kd8 27. Ke1 Kc7 28. Kd2 Nc5 29. b4 Ncd7 30. g3 Nb6 31. Kc2 Nbd7 32. a4 Nb6 33. a5 Nbd7 34. Bc1 Kd8 35. Bb2 Ne8 36. Kd2 Nc7 37. Ke3 Ke7 38. Bf1 Nb5 39. h4 Nc7 40. Bh3 Ne8,"This is a game between Flohr, Salo (as White) and Botvinnik, M. (as Black). Last move played: Black plays Knight to e8",-
(!),True,"

The comment ""(!)"" indicates that the move was a blunder, as an exclamation mark is commonly used to denote a mistake or blunder in chess notation.",1. d4 Nf6 2. c4 e6 3. Nc3 Bb4 4. Qc2 c5 5. dxc5 Na6 6. a3 Bxc3+ 7. Qxc3 Nxc5 8. f3 d6 9. e4 e5 10. Be3 Qc7 11. Ne2 Be6 12. Qc2 O-O 13. Nc3 Rfc8 14. Be2 a6 15. Rc1 Ncd7 16. Qd2 Qb8 17. Nd5 Bxd5 18. cxd5 Rxc1+ 19. Qxc1 Qd8 20. O-O Rc8 21. Qd2 Qc7 22. Rc1 Qxc1+ 23. Qxc1 Rxc1+ 24. Bxc1 Kf8 25. Kf2 Ke7 26. Be3 Kd8 27. Ke1 Kc7 28. Kd2 Nc5 29. b4 Ncd7 30. g3 Nb6 31. Kc2 Nbd7 32. a4 Nb6 33. a5 Nbd7 34. Bc1 Kd8 35. Bb2 Ne8 36. Kd2 Nc7 37. Ke3 Ke7 38. Bf1 Nb5 39. h4 Nc7 40. Bh3 Ne8 41. f4,"This is a game between Flohr, Salo (as White) and Botvinnik, M. (as Black). Last move played: White plays Pawn to f4"," (!)

White's last move of pawn to f4 is risky and premature. It weakens their kingside and does not contribute to the development of the pieces."
Probably broken hearted Botvinnik is forced to weaken his position.,False,"

This comment does not explain the mistake made by the player, as it lacks specific details about the move or the resulting position.",1. d4 Nf6 2. c4 e6 3. Nc3 Bb4 4. Qc2 c5 5. dxc5 Na6 6. a3 Bxc3+ 7. Qxc3 Nxc5 8. f3 d6 9. e4 e5 10. Be3 Qc7 11. Ne2 Be6 12. Qc2 O-O 13. Nc3 Rfc8 14. Be2 a6 15. Rc1 Ncd7 16. Qd2 Qb8 17. Nd5 Bxd5 18. cxd5 Rxc1+ 19. Qxc1 Qd8 20. O-O Rc8 21. Qd2 Qc7 22. Rc1 Qxc1+ 23. Qxc1 Rxc1+ 24. Bxc1 Kf8 25. Kf2 Ke7 26. Be3 Kd8 27. Ke1 Kc7 28. Kd2 Nc5 29. b4 Ncd7 30. g3 Nb6 31. Kc2 Nbd7 32. a4 Nb6 33. a5 Nbd7 34. Bc1 Kd8 35. Bb2 Ne8 36. Kd2 Nc7 37. Ke3 Ke7 38. Bf1 Nb5 39. h4 Nc7 40. Bh3 Ne8 41. f4 f6,"This is a game between Flohr, Salo (as White) and Botvinnik, M. (as Black). Last move played: Black plays Pawn to f6",-
(!),True,"

The comment ""(!)"" indicates that the move is a blunder, clearly explaining the mistake made by the player.",1. d4 Nf6 2. c4 e6 3. Nc3 Bb4 4. Qc2 c5 5. dxc5 Na6 6. a3 Bxc3+ 7. Qxc3 Nxc5 8. f3 d6 9. e4 e5 10. Be3 Qc7 11. Ne2 Be6 12. Qc2 O-O 13. Nc3 Rfc8 14. Be2 a6 15. Rc1 Ncd7 16. Qd2 Qb8 17. Nd5 Bxd5 18. cxd5 Rxc1+ 19. Qxc1 Qd8 20. O-O Rc8 21. Qd2 Qc7 22. Rc1 Qxc1+ 23. Qxc1 Rxc1+ 24. Bxc1 Kf8 25. Kf2 Ke7 26. Be3 Kd8 27. Ke1 Kc7 28. Kd2 Nc5 29. b4 Ncd7 30. g3 Nb6 31. Kc2 Nbd7 32. a4 Nb6 33. a5 Nbd7 34. Bc1 Kd8 35. Bb2 Ne8 36. Kd2 Nc7 37. Ke3 Ke7 38. Bf1 Nb5 39. h4 Nc7 40. Bh3 Ne8 41. f4 f6 42. Bf5,"This is a game between Flohr, Salo (as White) and Botvinnik, M. (as Black). Last move played: White plays Bishop to f5"," '(!)'

Reformulated Comment:
Black's move was poor because it allowed White to gain a positional advantage."
"In this position there are no doubts: White is better, much, much better.",False,"

The comment does not explain the mistake made by the player, as it only describes the overall position without pinpointing the specific error.",1. d4 Nf6 2. c4 e6 3. Nc3 Bb4 4. Qc2 c5 5. dxc5 Na6 6. a3 Bxc3+ 7. Qxc3 Nxc5 8. f3 d6 9. e4 e5 10. Be3 Qc7 11. Ne2 Be6 12. Qc2 O-O 13. Nc3 Rfc8 14. Be2 a6 15. Rc1 Ncd7 16. Qd2 Qb8 17. Nd5 Bxd5 18. cxd5 Rxc1+ 19. Qxc1 Qd8 20. O-O Rc8 21. Qd2 Qc7 22. Rc1 Qxc1+ 23. Qxc1 Rxc1+ 24. Bxc1 Kf8 25. Kf2 Ke7 26. Be3 Kd8 27. Ke1 Kc7 28. Kd2 Nc5 29. b4 Ncd7 30. g3 Nb6 31. Kc2 Nbd7 32. a4 Nb6 33. a5 Nbd7 34. Bc1 Kd8 35. Bb2 Ne8 36. Kd2 Nc7 37. Ke3 Ke7 38. Bf1 Nb5 39. h4 Nc7 40. Bh3 Ne8 41. f4 f6 42. Bf5 g6 43. Bh3,"This is a game between Flohr, Salo (as White) and Botvinnik, M. (as Black). Last move played: White plays Bishop to h3",-
This Knight in g7 is not good looking. Maybe in c7 it was better.,True,"

The comment accurately identifies the mistake as the Knight's position on g7 being less favorable than it could be on c7, which indicates a strategic error.",1. d4 Nf6 2. c4 e6 3. Nc3 Bb4 4. Qc2 c5 5. dxc5 Na6 6. a3 Bxc3+ 7. Qxc3 Nxc5 8. f3 d6 9. e4 e5 10. Be3 Qc7 11. Ne2 Be6 12. Qc2 O-O 13. Nc3 Rfc8 14. Be2 a6 15. Rc1 Ncd7 16. Qd2 Qb8 17. Nd5 Bxd5 18. cxd5 Rxc1+ 19. Qxc1 Qd8 20. O-O Rc8 21. Qd2 Qc7 22. Rc1 Qxc1+ 23. Qxc1 Rxc1+ 24. Bxc1 Kf8 25. Kf2 Ke7 26. Be3 Kd8 27. Ke1 Kc7 28. Kd2 Nc5 29. b4 Ncd7 30. g3 Nb6 31. Kc2 Nbd7 32. a4 Nb6 33. a5 Nbd7 34. Bc1 Kd8 35. Bb2 Ne8 36. Kd2 Nc7 37. Ke3 Ke7 38. Bf1 Nb5 39. h4 Nc7 40. Bh3 Ne8 41. f4 f6 42. Bf5 g6 43. Bh3 h6 44. Bc1 Ng7,"This is a game between Flohr, Salo (as White) and Botvinnik, M. (as Black). Last move played: Black plays Knight to g7", The Knight's move to g7 by Black was not ideal. Moving it to c7 might have been a better choice.
(!),True,"
The comment ""(!)"" effectively communicates that the previously played move was a mistake.",1. d4 Nf6 2. c4 e6 3. Nc3 Bb4 4. Qc2 c5 5. dxc5 Na6 6. a3 Bxc3+ 7. Qxc3 Nxc5 8. f3 d6 9. e4 e5 10. Be3 Qc7 11. Ne2 Be6 12. Qc2 O-O 13. Nc3 Rfc8 14. Be2 a6 15. Rc1 Ncd7 16. Qd2 Qb8 17. Nd5 Bxd5 18. cxd5 Rxc1+ 19. Qxc1 Qd8 20. O-O Rc8 21. Qd2 Qc7 22. Rc1 Qxc1+ 23. Qxc1 Rxc1+ 24. Bxc1 Kf8 25. Kf2 Ke7 26. Be3 Kd8 27. Ke1 Kc7 28. Kd2 Nc5 29. b4 Ncd7 30. g3 Nb6 31. Kc2 Nbd7 32. a4 Nb6 33. a5 Nbd7 34. Bc1 Kd8 35. Bb2 Ne8 36. Kd2 Nc7 37. Ke3 Ke7 38. Bf1 Nb5 39. h4 Nc7 40. Bh3 Ne8 41. f4 f6 42. Bf5 g6 43. Bh3 h6 44. Bc1 Ng7 45. fxe5,"This is a game between Flohr, Salo (as White) and Botvinnik, M. (as Black). Last move played: White plays Pawn takes on e5", This move is bad because it does not improve the position or create any immediate threats.
This one looks forced also.,True,"

The comment accurately describes the mistake made by the player, as it refers to a move that was not chosen freely but was instead compelled by the opponent's actions.",1. d4 Nf6 2. c4 e6 3. Nc3 Bb4 4. Qc2 c5 5. dxc5 Na6 6. a3 Bxc3+ 7. Qxc3 Nxc5 8. f3 d6 9. e4 e5 10. Be3 Qc7 11. Ne2 Be6 12. Qc2 O-O 13. Nc3 Rfc8 14. Be2 a6 15. Rc1 Ncd7 16. Qd2 Qb8 17. Nd5 Bxd5 18. cxd5 Rxc1+ 19. Qxc1 Qd8 20. O-O Rc8 21. Qd2 Qc7 22. Rc1 Qxc1+ 23. Qxc1 Rxc1+ 24. Bxc1 Kf8 25. Kf2 Ke7 26. Be3 Kd8 27. Ke1 Kc7 28. Kd2 Nc5 29. b4 Ncd7 30. g3 Nb6 31. Kc2 Nbd7 32. a4 Nb6 33. a5 Nbd7 34. Bc1 Kd8 35. Bb2 Ne8 36. Kd2 Nc7 37. Ke3 Ke7 38. Bf1 Nb5 39. h4 Nc7 40. Bh3 Ne8 41. f4 f6 42. Bf5 g6 43. Bh3 h6 44. Bc1 Ng7 45. fxe5 dxe5,"This is a game between Flohr, Salo (as White) and Botvinnik, M. (as Black). Last move played: Black plays Pawn takes on e5", The play here appears forced.
(!),True,"

The comment ""(!)"" effectively communicates that the move was a blunder, as the exclamation mark is commonly used to indicate a mistake in chess annotations.",1. d4 Nf6 2. c4 e6 3. Nc3 Bb4 4. Qc2 c5 5. dxc5 Na6 6. a3 Bxc3+ 7. Qxc3 Nxc5 8. f3 d6 9. e4 e5 10. Be3 Qc7 11. Ne2 Be6 12. Qc2 O-O 13. Nc3 Rfc8 14. Be2 a6 15. Rc1 Ncd7 16. Qd2 Qb8 17. Nd5 Bxd5 18. cxd5 Rxc1+ 19. Qxc1 Qd8 20. O-O Rc8 21. Qd2 Qc7 22. Rc1 Qxc1+ 23. Qxc1 Rxc1+ 24. Bxc1 Kf8 25. Kf2 Ke7 26. Be3 Kd8 27. Ke1 Kc7 28. Kd2 Nc5 29. b4 Ncd7 30. g3 Nb6 31. Kc2 Nbd7 32. a4 Nb6 33. a5 Nbd7 34. Bc1 Kd8 35. Bb2 Ne8 36. Kd2 Nc7 37. Ke3 Ke7 38. Bf1 Nb5 39. h4 Nc7 40. Bh3 Ne8 41. f4 f6 42. Bf5 g6 43. Bh3 h6 44. Bc1 Ng7 45. fxe5 dxe5 46. Kf3 h5 47. Be3 Kd6 48. Bh6 Ne8 49. g4 hxg4+ 50. Bxg4 Nc7 51. Be3 Nb5 52. Ke2,"This is a game between Flohr, Salo (as White) and Botvinnik, M. (as Black). Last move played: White plays King to e2", (!) White's last move to e2 is poor; it neglects development and king safety.
"Zugzwang! The black King has not many possibilities to maneuver, a move of the Nd7 would allow white to checkmate, and a move of the Nc7 would allow the maneuver Bg4-e6-f7.",False,"

This comment does not directly explain the mistake made by the player, as it suggests a potential checkmate scenario and a maneuver without providing insight into the actual error committed.",1. d4 Nf6 2. c4 e6 3. Nc3 Bb4 4. Qc2 c5 5. dxc5 Na6 6. a3 Bxc3+ 7. Qxc3 Nxc5 8. f3 d6 9. e4 e5 10. Be3 Qc7 11. Ne2 Be6 12. Qc2 O-O 13. Nc3 Rfc8 14. Be2 a6 15. Rc1 Ncd7 16. Qd2 Qb8 17. Nd5 Bxd5 18. cxd5 Rxc1+ 19. Qxc1 Qd8 20. O-O Rc8 21. Qd2 Qc7 22. Rc1 Qxc1+ 23. Qxc1 Rxc1+ 24. Bxc1 Kf8 25. Kf2 Ke7 26. Be3 Kd8 27. Ke1 Kc7 28. Kd2 Nc5 29. b4 Ncd7 30. g3 Nb6 31. Kc2 Nbd7 32. a4 Nb6 33. a5 Nbd7 34. Bc1 Kd8 35. Bb2 Ne8 36. Kd2 Nc7 37. Ke3 Ke7 38. Bf1 Nb5 39. h4 Nc7 40. Bh3 Ne8 41. f4 f6 42. Bf5 g6 43. Bh3 h6 44. Bc1 Ng7 45. fxe5 dxe5 46. Kf3 h5 47. Be3 Kd6 48. Bh6 Ne8 49. g4 hxg4+ 50. Bxg4 Nc7 51. Be3 Nb5 52. Ke2 Nc7 53. Kd3,"This is a game between Flohr, Salo (as White) and Botvinnik, M. (as Black). Last move played: White plays King to d3",-
Second adjournment.,False,"

The comment ""Second adjournment"" does not explain the mistake made by the player, as it refers to a break in the game rather than providing a critique of the move.",1. d4 Nf6 2. c4 e6 3. Nc3 Bb4 4. Qc2 c5 5. dxc5 Na6 6. a3 Bxc3+ 7. Qxc3 Nxc5 8. f3 d6 9. e4 e5 10. Be3 Qc7 11. Ne2 Be6 12. Qc2 O-O 13. Nc3 Rfc8 14. Be2 a6 15. Rc1 Ncd7 16. Qd2 Qb8 17. Nd5 Bxd5 18. cxd5 Rxc1+ 19. Qxc1 Qd8 20. O-O Rc8 21. Qd2 Qc7 22. Rc1 Qxc1+ 23. Qxc1 Rxc1+ 24. Bxc1 Kf8 25. Kf2 Ke7 26. Be3 Kd8 27. Ke1 Kc7 28. Kd2 Nc5 29. b4 Ncd7 30. g3 Nb6 31. Kc2 Nbd7 32. a4 Nb6 33. a5 Nbd7 34. Bc1 Kd8 35. Bb2 Ne8 36. Kd2 Nc7 37. Ke3 Ke7 38. Bf1 Nb5 39. h4 Nc7 40. Bh3 Ne8 41. f4 f6 42. Bf5 g6 43. Bh3 h6 44. Bc1 Ng7 45. fxe5 dxe5 46. Kf3 h5 47. Be3 Kd6 48. Bh6 Ne8 49. g4 hxg4+ 50. Bxg4 Nc7 51. Be3 Nb5 52. Ke2 Nc7 53. Kd3 f5 54. exf5 gxf5 55. Bxf5 Nxd5 56. Bd2 N7f6 57. Kc4 Kc6 58. Bg6 b5+ 59. Kd3 Ne7,"This is a game between Flohr, Salo (as White) and Botvinnik, M. (as Black). Last move played: Black plays Knight to e7",-
(!) The move in the envelope.,True,"

The comment indicates that the move was a significant mistake, as it was captured by the opponent.",1. d4 Nf6 2. c4 e6 3. Nc3 Bb4 4. Qc2 c5 5. dxc5 Na6 6. a3 Bxc3+ 7. Qxc3 Nxc5 8. f3 d6 9. e4 e5 10. Be3 Qc7 11. Ne2 Be6 12. Qc2 O-O 13. Nc3 Rfc8 14. Be2 a6 15. Rc1 Ncd7 16. Qd2 Qb8 17. Nd5 Bxd5 18. cxd5 Rxc1+ 19. Qxc1 Qd8 20. O-O Rc8 21. Qd2 Qc7 22. Rc1 Qxc1+ 23. Qxc1 Rxc1+ 24. Bxc1 Kf8 25. Kf2 Ke7 26. Be3 Kd8 27. Ke1 Kc7 28. Kd2 Nc5 29. b4 Ncd7 30. g3 Nb6 31. Kc2 Nbd7 32. a4 Nb6 33. a5 Nbd7 34. Bc1 Kd8 35. Bb2 Ne8 36. Kd2 Nc7 37. Ke3 Ke7 38. Bf1 Nb5 39. h4 Nc7 40. Bh3 Ne8 41. f4 f6 42. Bf5 g6 43. Bh3 h6 44. Bc1 Ng7 45. fxe5 dxe5 46. Kf3 h5 47. Be3 Kd6 48. Bh6 Ne8 49. g4 hxg4+ 50. Bxg4 Nc7 51. Be3 Nb5 52. Ke2 Nc7 53. Kd3 f5 54. exf5 gxf5 55. Bxf5 Nxd5 56. Bd2 N7f6 57. Kc4 Kc6 58. Bg6 b5+ 59. Kd3 Ne7 60. Be4+,"This is a game between Flohr, Salo (as White) and Botvinnik, M. (as Black). Last move played: White plays Bishop to e4 with check", The envelope move is a mistake. It places their king in check.
(!),True,"

The comment clearly indicates that the move was a mistake, as denoted by the exclamation point within parentheses.",1. d4 Nf6 2. c4 e6 3. Nc3 Bb4 4. Qc2 c5 5. dxc5 Na6 6. a3 Bxc3+ 7. Qxc3 Nxc5 8. f3 d6 9. e4 e5 10. Be3 Qc7 11. Ne2 Be6 12. Qc2 O-O 13. Nc3 Rfc8 14. Be2 a6 15. Rc1 Ncd7 16. Qd2 Qb8 17. Nd5 Bxd5 18. cxd5 Rxc1+ 19. Qxc1 Qd8 20. O-O Rc8 21. Qd2 Qc7 22. Rc1 Qxc1+ 23. Qxc1 Rxc1+ 24. Bxc1 Kf8 25. Kf2 Ke7 26. Be3 Kd8 27. Ke1 Kc7 28. Kd2 Nc5 29. b4 Ncd7 30. g3 Nb6 31. Kc2 Nbd7 32. a4 Nb6 33. a5 Nbd7 34. Bc1 Kd8 35. Bb2 Ne8 36. Kd2 Nc7 37. Ke3 Ke7 38. Bf1 Nb5 39. h4 Nc7 40. Bh3 Ne8 41. f4 f6 42. Bf5 g6 43. Bh3 h6 44. Bc1 Ng7 45. fxe5 dxe5 46. Kf3 h5 47. Be3 Kd6 48. Bh6 Ne8 49. g4 hxg4+ 50. Bxg4 Nc7 51. Be3 Nb5 52. Ke2 Nc7 53. Kd3 f5 54. exf5 gxf5 55. Bxf5 Nxd5 56. Bd2 N7f6 57. Kc4 Kc6 58. Bg6 b5+ 59. Kd3 Ne7 60. Be4+ Ned5 61. Bg5 Nh5 62. Bf3 Ng3 63. Bd2,"This is a game between Flohr, Salo (as White) and Botvinnik, M. (as Black). Last move played: White plays Bishop to d2"," (!) 'Black' has played a questionable move by advancing the bishop to d2, potentially exposing it to attacks and weakening their position."
(!),True,"

The exclamation mark in the comment indicates that the move was a mistake, providing a clear explanation of the error.",1. d4 Nf6 2. c4 e6 3. Nc3 Bb4 4. Qc2 c5 5. dxc5 Na6 6. a3 Bxc3+ 7. Qxc3 Nxc5 8. f3 d6 9. e4 e5 10. Be3 Qc7 11. Ne2 Be6 12. Qc2 O-O 13. Nc3 Rfc8 14. Be2 a6 15. Rc1 Ncd7 16. Qd2 Qb8 17. Nd5 Bxd5 18. cxd5 Rxc1+ 19. Qxc1 Qd8 20. O-O Rc8 21. Qd2 Qc7 22. Rc1 Qxc1+ 23. Qxc1 Rxc1+ 24. Bxc1 Kf8 25. Kf2 Ke7 26. Be3 Kd8 27. Ke1 Kc7 28. Kd2 Nc5 29. b4 Ncd7 30. g3 Nb6 31. Kc2 Nbd7 32. a4 Nb6 33. a5 Nbd7 34. Bc1 Kd8 35. Bb2 Ne8 36. Kd2 Nc7 37. Ke3 Ke7 38. Bf1 Nb5 39. h4 Nc7 40. Bh3 Ne8 41. f4 f6 42. Bf5 g6 43. Bh3 h6 44. Bc1 Ng7 45. fxe5 dxe5 46. Kf3 h5 47. Be3 Kd6 48. Bh6 Ne8 49. g4 hxg4+ 50. Bxg4 Nc7 51. Be3 Nb5 52. Ke2 Nc7 53. Kd3 f5 54. exf5 gxf5 55. Bxf5 Nxd5 56. Bd2 N7f6 57. Kc4 Kc6 58. Bg6 b5+ 59. Kd3 Ne7 60. Be4+ Ned5 61. Bg5 Nh5 62. Bf3 Ng3 63. Bd2 Kd6 64. Bg4,"This is a game between Flohr, Salo (as White) and Botvinnik, M. (as Black). Last move played: White plays Bishop to g4"," ""(!)""

This move by White (as per your annotation) was not advisable due to potential vulnerabilities it might introduce in the position."
"After the game Flohr stated: ""I think this one is my best endgame I have ever played up to now"".",True,"

The comment provides insight into the player's mindset, suggesting that they thought the move was a strong endgame choice, which implies they might have overlooked the mistake due to their confidence in the endgame position.",1. d4 Nf6 2. c4 e6 3. Nc3 Bb4 4. Qc2 c5 5. dxc5 Na6 6. a3 Bxc3+ 7. Qxc3 Nxc5 8. f3 d6 9. e4 e5 10. Be3 Qc7 11. Ne2 Be6 12. Qc2 O-O 13. Nc3 Rfc8 14. Be2 a6 15. Rc1 Ncd7 16. Qd2 Qb8 17. Nd5 Bxd5 18. cxd5 Rxc1+ 19. Qxc1 Qd8 20. O-O Rc8 21. Qd2 Qc7 22. Rc1 Qxc1+ 23. Qxc1 Rxc1+ 24. Bxc1 Kf8 25. Kf2 Ke7 26. Be3 Kd8 27. Ke1 Kc7 28. Kd2 Nc5 29. b4 Ncd7 30. g3 Nb6 31. Kc2 Nbd7 32. a4 Nb6 33. a5 Nbd7 34. Bc1 Kd8 35. Bb2 Ne8 36. Kd2 Nc7 37. Ke3 Ke7 38. Bf1 Nb5 39. h4 Nc7 40. Bh3 Ne8 41. f4 f6 42. Bf5 g6 43. Bh3 h6 44. Bc1 Ng7 45. fxe5 dxe5 46. Kf3 h5 47. Be3 Kd6 48. Bh6 Ne8 49. g4 hxg4+ 50. Bxg4 Nc7 51. Be3 Nb5 52. Ke2 Nc7 53. Kd3 f5 54. exf5 gxf5 55. Bxf5 Nxd5 56. Bd2 N7f6 57. Kc4 Kc6 58. Bg6 b5+ 59. Kd3 Ne7 60. Be4+ Ned5 61. Bg5 Nh5 62. Bf3 Ng3 63. Bd2 Kd6 64. Bg4 Nf6 65. Bc8 Kc6 66. Be1 e4+ 67. Kd4 Ngh5 68. Bf5 Kd6 69. Bd2,"This is a game between Flohr, Salo (as White) and Botvinnik, M. (as Black). Last move played: White plays Bishop to d2", Black thinks this endgame is the best they've played to date.
