comment,good,reasoning,moves,context,reformulated
Modern theory prefers 7...Nxe4 with a sound game for Black.,True,"

The comment correctly identifies the mistake in the move, explaining that the move 7...dxe4 was not the best choice according to modern chess theory, suggesting a superior alternative of 7...Nxe4.",1. e4 e5 2. Nf3 Nc6 3. Bc4 Bc5 4. c3 Nf6 5. d4 exd4 6. cxd4 Bb4+ 7. Nc3 d5,"This is a game between Steinitz, W (as White) and Von Bardeleben, K (as Black). Last move played: Black plays Pawn to d5", White's last move has not aligned with modern chess theory.
"After 9...Nxc3 10.bxc3 Bxc3 11.Qb3 Bxa1 12.Bxf7+, White's attack is irresistible, while after 9...Bxc3 10.bxc3 Nxc3 11.Qe1+, Black loses a piece.",True,"

The comment accurately describes the mistake made by the player, providing a clear explanation of the consequences of each move.",1. e4 e5 2. Nf3 Nc6 3. Bc4 Bc5 4. c3 Nf6 5. d4 exd4 6. cxd4 Bb4+ 7. Nc3 d5 8. exd5 Nxd5 9. O-O Be6,"This is a game between Steinitz, W (as White) and Von Bardeleben, K (as Black). Last move played: Black plays Bishop to e6"," After 9...Nxc3, White plays Qb3, threatening Black with Qxa1+. The move 11.Qe1+ after 9...Bxc3 is a blunder for White as it allows Black to play 11...Nxe1 12.Qxe1 Qxe1#, resulting in a checkmate."
"Now it is sufficient for Black to remove his king to safety, and he will have the better endgame because of the isolated White d-pawn, but he does not succeed in implementing this important objective.",True,"
The comment accurately describes the critical mistake made by the player by failing to transition to the endgame and not capitalizing on the isolated White d-pawn, which could have led to a winning advantage for Black.",1. e4 e5 2. Nf3 Nc6 3. Bc4 Bc5 4. c3 Nf6 5. d4 exd4 6. cxd4 Bb4+ 7. Nc3 d5 8. exd5 Nxd5 9. O-O Be6 10. Bg5 Be7 11. Bxd5 Bxd5 12. Nxd5 Qxd5 13. Bxe7 Nxe7,"This is a game between Steinitz, W (as White) and Von Bardeleben, K (as Black). Last move played: Black plays Knight takes on e7"," 'Black's recent move to remove their king to safety was not effective. Despite the isolated White d-pawn suggesting a better endgame, 'Black' failed to capitalize on this opportunity.'"
"At the present time 16.d5! is considered to be the strongest method, for example: 16...Kf7 17.Rad1 Nxd5 18.Ng5+! fxg5 19.Qf3+ Kg8 20.Rxd5, and White should be winning.",False,"

The comment does not explain the mistake made by the player; it rather outlines a stronger move that could have been played instead.",1. e4 e5 2. Nf3 Nc6 3. Bc4 Bc5 4. c3 Nf6 5. d4 exd4 6. cxd4 Bb4+ 7. Nc3 d5 8. exd5 Nxd5 9. O-O Be6 10. Bg5 Be7 11. Bxd5 Bxd5 12. Nxd5 Qxd5 13. Bxe7 Nxe7 14. Re1 f6 15. Qe2 Qd7 16. Rac1,"This is a game between Steinitz, W (as White) and Von Bardeleben, K (as Black). Last move played: White plays Rook to c1",-
"By evacuating his king from the e-file, and then playing 17...Nd5, Black could have successfully defended his position and assumed the initiative, although a knight check, 17.Ne5+ or 17.Ng5+, would have led to complications.",True,"

The comment accurately describes the mistake made by the player as it explains the potential for Black to maintain a strong defensive position and gain the initiative, despite the fact that certain checks would complicate the position.",1. e4 e5 2. Nf3 Nc6 3. Bc4 Bc5 4. c3 Nf6 5. d4 exd4 6. cxd4 Bb4+ 7. Nc3 d5 8. exd5 Nxd5 9. O-O Be6 10. Bg5 Be7 11. Bxd5 Bxd5 12. Nxd5 Qxd5 13. Bxe7 Nxe7 14. Re1 f6 15. Qe2 Qd7 16. Rac1 c6,"This is a game between Steinitz, W (as White) and Von Bardeleben, K (as Black). Last move played: Black plays Pawn to c6"," In the given move, White has weakened their king's defensive structure, which could have led to a stronger position. Instead of 17...Nd5, another move might have been more advantageous for Black. A knight check like 17.Ne5+ or 17.Ng5+ would have introduced complexities that White would have to navigate carefully."
"After this sacrifice, the attack proceeds smoothly for White. Black's king now comes under fire.",True,"

The comment implies that the player made a strategic mistake by sacrificing a piece, which the commentator believes will not lead to a smooth attack for White and will leave the king vulnerable.",1. e4 e5 2. Nf3 Nc6 3. Bc4 Bc5 4. c3 Nf6 5. d4 exd4 6. cxd4 Bb4+ 7. Nc3 d5 8. exd5 Nxd5 9. O-O Be6 10. Bg5 Be7 11. Bxd5 Bxd5 12. Nxd5 Qxd5 13. Bxe7 Nxe7 14. Re1 f6 15. Qe2 Qd7 16. Rac1 c6 17. d5,"This is a game between Steinitz, W (as White) and Von Bardeleben, K (as Black). Last move played: White plays Pawn to d5"," After the sacrifice, the attack unfolds well for White. Black's king is now vulnerable."
"Black cannot save time, for example: 17...Kf7 18.dxc6 bxc6 19.Qc4+ Qd5 20.Qxd5+ cxd5 21.Rc7, with a decisive advantage for White.",True,"

The comment accurately explains the mistake made by the player, detailing a sequence of moves that leads to White having a decisive advantage.",1. e4 e5 2. Nf3 Nc6 3. Bc4 Bc5 4. c3 Nf6 5. d4 exd4 6. cxd4 Bb4+ 7. Nc3 d5 8. exd5 Nxd5 9. O-O Be6 10. Bg5 Be7 11. Bxd5 Bxd5 12. Nxd5 Qxd5 13. Bxe7 Nxe7 14. Re1 f6 15. Qe2 Qd7 16. Rac1 c6 17. d5 cxd5,"This is a game between Steinitz, W (as White) and Von Bardeleben, K (as Black). Last move played: Black plays Pawn takes on d5"," The move 17...Kf7 by Black is disadvantageous. After 18.dxc6 bxc6, White's 19.Qc4+ is a check that forces the Black king to move. If Black plays 19...Qd5, White can simply capture the queen with 20.Qxd5+ cxd5. The position after 21.Rc7 is clearly better for White, resulting in a winning position."
Now comes one of the most famous combinations in the history of chess.,False,"

The comment does not explain the mistake made by the player as it refers to a famous combination, which is generally considered a strong and successful move rather than a mistake.",1. e4 e5 2. Nf3 Nc6 3. Bc4 Bc5 4. c3 Nf6 5. d4 exd4 6. cxd4 Bb4+ 7. Nc3 d5 8. exd5 Nxd5 9. O-O Be6 10. Bg5 Be7 11. Bxd5 Bxd5 12. Nxd5 Qxd5 13. Bxe7 Nxe7 14. Re1 f6 15. Qe2 Qd7 16. Rac1 c6 17. d5 cxd5 18. Nd4 Kf7 19. Ne6 Rhc8 20. Qg4 g6 21. Ng5+ Ke8,"This is a game between Steinitz, W (as White) and Von Bardeleben, K (as Black). Last move played: Black plays King to e8",-
"Black probably reasoned that his queen could not be taken because of the back rank mate (Rc8xc1 mate), and meanwhile, all of White's pieces are hanging. But Steinitz has seen a little further. Note that 22...Kxe7 fails because of 23.Re1+ Kd6 24.Qb4+ Rc5 (or 24...Kc7 25.Ne6+ Kb8 26.Qf4+) 25.Re6+ and it is all over.",True,"

The comment correctly identifies the tactical error made by Black, ignoring the potential checkmate threat after 23.Re1+ Kd6 24.Qb4+ Rc5, which leads to a decisive attack.",1. e4 e5 2. Nf3 Nc6 3. Bc4 Bc5 4. c3 Nf6 5. d4 exd4 6. cxd4 Bb4+ 7. Nc3 d5 8. exd5 Nxd5 9. O-O Be6 10. Bg5 Be7 11. Bxd5 Bxd5 12. Nxd5 Qxd5 13. Bxe7 Nxe7 14. Re1 f6 15. Qe2 Qd7 16. Rac1 c6 17. d5 cxd5 18. Nd4 Kf7 19. Ne6 Rhc8 20. Qg4 g6 21. Ng5+ Ke8 22. Rxe7+ Kf8,"This is a game between Steinitz, W (as White) and Von Bardeleben, K (as Black). Last move played: Black plays King to f8"," Black made a move, likely believing the queen could not be captured due to the threat of back rank mate (Rc8xc1 mate), while all of White's pieces were vulnerable. However, Steinitz anticipated the outcome. The move 22...Kxe7 is flawed because it allows White to play 23.Re1+, followed by Kd6, and then White has a strong continuation with Qb4+ leading to a win."
"As on the previous move, the rook cannot be taken by the queen because of Rc1xc8+.",True,"

The comment correctly identifies that taking the rook on c1 with the queen would result in a check from the rook on c8, which is the mistake made by the player.",1. e4 e5 2. Nf3 Nc6 3. Bc4 Bc5 4. c3 Nf6 5. d4 exd4 6. cxd4 Bb4+ 7. Nc3 d5 8. exd5 Nxd5 9. O-O Be6 10. Bg5 Be7 11. Bxd5 Bxd5 12. Nxd5 Qxd5 13. Bxe7 Nxe7 14. Re1 f6 15. Qe2 Qd7 16. Rac1 c6 17. d5 cxd5 18. Nd4 Kf7 19. Ne6 Rhc8 20. Qg4 g6 21. Ng5+ Ke8 22. Rxe7+ Kf8 23. Rf7+ Kg8,"This is a game between Steinitz, W (as White) and Von Bardeleben, K (as Black). Last move played: Black plays King to g8"," ""The rook at c1 cannot be captured by the queen due to the forced check move Rc1xc8+."""
Yet another brilliant move. The White rook is the complete master of the seventh rank.,False,"

The comment does not explain the mistake made by the player, as it praises the White rook's position, while the player is criticized for a poor move.",1. e4 e5 2. Nf3 Nc6 3. Bc4 Bc5 4. c3 Nf6 5. d4 exd4 6. cxd4 Bb4+ 7. Nc3 d5 8. exd5 Nxd5 9. O-O Be6 10. Bg5 Be7 11. Bxd5 Bxd5 12. Nxd5 Qxd5 13. Bxe7 Nxe7 14. Re1 f6 15. Qe2 Qd7 16. Rac1 c6 17. d5 cxd5 18. Nd4 Kf7 19. Ne6 Rhc8 20. Qg4 g6 21. Ng5+ Ke8 22. Rxe7+ Kf8 23. Rf7+ Kg8 24. Rg7+,"This is a game between Steinitz, W (as White) and Von Bardeleben, K (as Black). Last move played: White plays Rook to g7 with check",-
24...Kf8 loses to 25.Nxh7+.,True,"

The comment accurately explains the mistake made by the player as it indicates a losing move that can be easily countered by 25.Nxh7+.",1. e4 e5 2. Nf3 Nc6 3. Bc4 Bc5 4. c3 Nf6 5. d4 exd4 6. cxd4 Bb4+ 7. Nc3 d5 8. exd5 Nxd5 9. O-O Be6 10. Bg5 Be7 11. Bxd5 Bxd5 12. Nxd5 Qxd5 13. Bxe7 Nxe7 14. Re1 f6 15. Qe2 Qd7 16. Rac1 c6 17. d5 cxd5 18. Nd4 Kf7 19. Ne6 Rhc8 20. Qg4 g6 21. Ng5+ Ke8 22. Rxe7+ Kf8 23. Rf7+ Kg8 24. Rg7+ Kh8,"This is a game between Steinitz, W (as White) and Von Bardeleben, K (as Black). Last move played: Black plays King to h8"," 24... Kf8 is a mistake by Black, as it allows White to win with the move 25. Nxh7+."
"A forced sequence of moves leads to an ""epaulette mate ""after 25....Kg8 26.Rg7+ Kh8 27.Qh4+ Kxg7 28.Qh7+ Kf8 29.Qh8+ Ke7 30.Qg7+ Ke8 31.Qg8+ Ke7 32.Qf7+ Kd8 (or 32...Kd6 33.Qxf6+ and mate next move) 33.Qf8+ Qe8 34.Nf7+ Kd7 35.Qd6 mate.",True,"

The comment accurately explains the mistake by detailing the forced sequence of moves that leads to an ""epaulette mate"" and highlights the critical error made by the player.",1. e4 e5 2. Nf3 Nc6 3. Bc4 Bc5 4. c3 Nf6 5. d4 exd4 6. cxd4 Bb4+ 7. Nc3 d5 8. exd5 Nxd5 9. O-O Be6 10. Bg5 Be7 11. Bxd5 Bxd5 12. Nxd5 Qxd5 13. Bxe7 Nxe7 14. Re1 f6 15. Qe2 Qd7 16. Rac1 c6 17. d5 cxd5 18. Nd4 Kf7 19. Ne6 Rhc8 20. Qg4 g6 21. Ng5+ Ke8 22. Rxe7+ Kf8 23. Rf7+ Kg8 24. Rg7+ Kh8 25. Rxh7+,"This is a game between Steinitz, W (as White) and Von Bardeleben, K (as Black). Last move played: White plays Rook takes on h7 with check"," The sequence of moves leads to an inevitable mate for White. Black's last move, Kg8, allows White's queen to deliver a check with Qh4+. Black's only possible response is Kh8, but this then allows the White queen to check again with Qh7+. Black's moves, Kxg7 and then Kf8, set up a sequence where White's queen forces Black's king into an increasingly vulnerable position. Despite Black's attempts to escape, White's queen continues to check, eventually leading to a mate with Qg8+, where Black has no legal moves left."
