comment,good,reasoning,moves,context,reformulated
"This appears harmless, because it exchanges black's bad bishop. However, as we will see, white is trying to make use of the a4-e8 diagonal to inflict serious damage before black gets castled.",True,"

The comment does explain the mistake made by the player, as it highlights a potentially strategic miscalculation, where the player may have neglected to consider the long-term implications of the move in favor of an immediate exchange.",1. d4 e6 2. e4 d5 3. Nc3 Nf6 4. Bg5 dxe4 5. Nxe4 Nbd7 6. Nxf6+ Nxf6 7. Nf3 c5 8. Bb5+,"This is a game between Mikhalchishin, Adrian (as White) and Chernin, Alexander (as Black). Last move played: White plays Bishop to b5 with check"," White's latest move appears to be a strategic error. Although it eliminates Black's bad bishop, it allows White to control the critical a4-e8 diagonal, potentially leading to significant threats before Black completes their castle."
"If black had one more move to get castled then the game could be abandoned for a draw, but it is white's turn and he demonstrates the idea behind 8.Bb5+. 12...Qc6 would have prevented white's next but leads to great complications after 13.Ne5. Still, I can't find anything concrete so perhaps white was just bluffing after all.",False,"

The comment does not directly explain the mistake made by the player; it suggests a possible alternative move and its consequences, but does not provide a clear assessment of the original move's quality.",1. d4 e6 2. e4 d5 3. Nc3 Nf6 4. Bg5 dxe4 5. Nxe4 Nbd7 6. Nxf6+ Nxf6 7. Nf3 c5 8. Bb5+ Bd7 9. Bxd7+ Qxd7 10. Qe2 cxd4 11. O-O-O Be7 12. Rxd4 Qc7,"This is a game between Mikhalchishin, Adrian (as White) and Chernin, Alexander (as Black). Last move played: Black plays Queen to c7",-
"Gaining a huge advantage. You have to keep in mind that this structure is not always so bad for black - for instance in many Sicilians, so that is why I was so impressed with how convincingly white takes it from here. It is true that compared to other lines white's rooks are very good here, and black's bishop is passive.",False,"

The comment doesn't directly address the mistake made by the player, but rather provides a general analysis of the position from white's perspective, highlighting the potential advantages for white and the passivity of black's bishop.",1. d4 e6 2. e4 d5 3. Nc3 Nf6 4. Bg5 dxe4 5. Nxe4 Nbd7 6. Nxf6+ Nxf6 7. Nf3 c5 8. Bb5+ Bd7 9. Bxd7+ Qxd7 10. Qe2 cxd4 11. O-O-O Be7 12. Rxd4 Qc7 13. Qb5+ Qc6 14. Qxc6+,"This is a game between Mikhalchishin, Adrian (as White) and Chernin, Alexander (as Black). Last move played: White plays Queen takes on c6 with check",-
"The position now begins to look very dominating for white, which was hard to foresee even a couple of moves ago. The critical feature is still the excellent placement of white's rooks. c4 can't be touched and white threatens to tickle the a-pawn. Complicating black's problems further, ...O-O is always met by Rd7.",True,"

The comment explains the mistake made by the player because it highlights the significant advantage that white has gained in terms of piece placement and potential threats, which should have prompted the player to be more cautious about the position.",1. d4 e6 2. e4 d5 3. Nc3 Nf6 4. Bg5 dxe4 5. Nxe4 Nbd7 6. Nxf6+ Nxf6 7. Nf3 c5 8. Bb5+ Bd7 9. Bxd7+ Qxd7 10. Qe2 cxd4 11. O-O-O Be7 12. Rxd4 Qc7 13. Qb5+ Qc6 14. Qxc6+ bxc6 15. Rc4 c5 16. Bxf6 gxf6 17. Rd1 Rb8 18. Rd3,"This is a game between Mikhalchishin, Adrian (as White) and Chernin, Alexander (as Black). Last move played: White plays Rook to d3"," ""White's recent move has established a dominant position that was not anticipated earlier in the game. This strategic advantage primarily stems from the optimal placement of White's rooks. Black's options are limited as White's rooks are poised to pressure the a-pawn. Any potential kingside castle by Black is met with Rd7, further complicating their position."""
"Even on g4 black hasn't managed to activate his rook at all, and now the fact that his king is cut off begins to become evident as well.",True,"

The comment accurately highlights the mistakes made by Black, as they have failed to activate their rook and have isolated their king, making their position more vulnerable.",1. d4 e6 2. e4 d5 3. Nc3 Nf6 4. Bg5 dxe4 5. Nxe4 Nbd7 6. Nxf6+ Nxf6 7. Nf3 c5 8. Bb5+ Bd7 9. Bxd7+ Qxd7 10. Qe2 cxd4 11. O-O-O Be7 12. Rxd4 Qc7 13. Qb5+ Qc6 14. Qxc6+ bxc6 15. Rc4 c5 16. Bxf6 gxf6 17. Rd1 Rb8 18. Rd3 Rb4 19. Nd2 Rg8 20. g3 Rxc4 21. Nxc4 Rg4 22. f4,"This is a game between Mikhalchishin, Adrian (as White) and Chernin, Alexander (as Black). Last move played: White plays Pawn to f4"," White's last move, advancing the pawn to f4, fails to address Black's lack of rook activity or King safety concerns."
A beautifully simple game.,False,"

The comment does not explain the mistake made by the player as it praises the game's simplicity rather than addressing the specific error.",1. d4 e6 2. e4 d5 3. Nc3 Nf6 4. Bg5 dxe4 5. Nxe4 Nbd7 6. Nxf6+ Nxf6 7. Nf3 c5 8. Bb5+ Bd7 9. Bxd7+ Qxd7 10. Qe2 cxd4 11. O-O-O Be7 12. Rxd4 Qc7 13. Qb5+ Qc6 14. Qxc6+ bxc6 15. Rc4 c5 16. Bxf6 gxf6 17. Rd1 Rb8 18. Rd3 Rb4 19. Nd2 Rg8 20. g3 Rxc4 21. Nxc4 Rg4 22. f4 h5 23. Kd2 h4 24. Ke2 hxg3 25. hxg3 Rg6 26. Ra3 Rh6 27. Kf3 Rh1 28. Rxa7,"This is a game between Mikhalchishin, Adrian (as White) and Chernin, Alexander (as Black). Last move played: White plays Rook takes on a7",-
