comment,good,reasoning,moves,context,reformulated
B23: Closed Sicilian: Lines without g3,False,"

The comment does not explain the mistake, as it merely states the Sicilian Defense without providing context or details about why the move was considered a mistake.",1. e4,"This is a game between Polgar, Judit (as White) and Topalov, Veselin (as Black). Last move played: White plays Pawn to e4",-
Secures e5,False,"

The comment ""Secures e5"" does not explain the mistake made by the player, as it suggests a strategic decision rather than identifying an error.",1. e4 c5 2. Nc3 Nc6 3. f4 g6 4. Nf3 Bg7 5. Bb5 Nd4 6. Bd3 d6,"This is a game between Polgar, Judit (as White) and Topalov, Veselin (as Black). Last move played: Black plays Pawn to d6",-
Controls c4,False,"

The comment ""controls c4"" does not explain why the move was a mistake, as it only states a fact about the position without addressing the specific issue with the move.",1. e4 c5 2. Nc3 Nc6 3. f4 g6 4. Nf3 Bg7 5. Bb5 Nd4 6. Bd3 d6 7. Nxd4 cxd4 8. Ne2 Nf6 9. O-O O-O 10. Qe1 Nd7 11. Bc4 d5 12. exd5 Nb6 13. d3,"This is a game between Polgar, Judit (as White) and Topalov, Veselin (as Black). Last move played: White plays Pawn to d3",-
Consolidates d4,False,"

The comment ""Consolidates d4"" does not explain the mistake, as it suggests a strategic intent rather than pointing out an erroneous move.",1. e4 c5 2. Nc3 Nc6 3. f4 g6 4. Nf3 Bg7 5. Bb5 Nd4 6. Bd3 d6 7. Nxd4 cxd4 8. Ne2 Nf6 9. O-O O-O 10. Qe1 Nd7 11. Bc4 d5 12. exd5 Nb6 13. d3 Nxc4 14. dxc4 b5 15. Qf2 bxc4 16. Nxd4 Qxd5 17. Be3 a5 18. c3,"This is a game between Polgar, Judit (as White) and Topalov, Veselin (as Black). Last move played: White plays Pawn to c3",-
Covers f5,True,"

This comment accurately explains that the player's move covers the opponent's pawn on f5, potentially resulting in a loss of material if the pawn advances to f6.",1. e4 c5 2. Nc3 Nc6 3. f4 g6 4. Nf3 Bg7 5. Bb5 Nd4 6. Bd3 d6 7. Nxd4 cxd4 8. Ne2 Nf6 9. O-O O-O 10. Qe1 Nd7 11. Bc4 d5 12. exd5 Nb6 13. d3 Nxc4 14. dxc4 b5 15. Qf2 bxc4 16. Nxd4 Qxd5 17. Be3 a5 18. c3 Rd8 19. Qc2 e6,"This is a game between Polgar, Judit (as White) and Topalov, Veselin (as Black). Last move played: Black plays Pawn to e6"," In response to the move e6 by Black, it can be seen as a lack of coordination with the pawn on d5, potentially weakening the control over the center."
White threatens strongly Nf3,False,"

The comment does not explain the mistake made by the player, as it merely states a potential threat without addressing why the move was considered a mistake.",1. e4 c5 2. Nc3 Nc6 3. f4 g6 4. Nf3 Bg7 5. Bb5 Nd4 6. Bd3 d6 7. Nxd4 cxd4 8. Ne2 Nf6 9. O-O O-O 10. Qe1 Nd7 11. Bc4 d5 12. exd5 Nb6 13. d3 Nxc4 14. dxc4 b5 15. Qf2 bxc4 16. Nxd4 Qxd5 17. Be3 a5 18. c3 Rd8 19. Qc2 e6 20. Rad1,"This is a game between Polgar, Judit (as White) and Topalov, Veselin (as Black). Last move played: White plays Rook to d1",-
Threatening mate... how?,True,"

The comment ""Threatening mate... how?"" implies that the previous move by the player did not effectively threaten checkmate, which suggests that it was indeed a mistake.",1. e4 c5 2. Nc3 Nc6 3. f4 g6 4. Nf3 Bg7 5. Bb5 Nd4 6. Bd3 d6 7. Nxd4 cxd4 8. Ne2 Nf6 9. O-O O-O 10. Qe1 Nd7 11. Bc4 d5 12. exd5 Nb6 13. d3 Nxc4 14. dxc4 b5 15. Qf2 bxc4 16. Nxd4 Qxd5 17. Be3 a5 18. c3 Rd8 19. Qc2 e6 20. Rad1 Qh5 21. Nc6 Rxd1 22. Rxd1 Bb7 23. Ne7+ Kh8 24. Rd7 Qb5 25. Qd2 Bd5 26. Rc7 Be4 27. Nc8,"This is a game between Polgar, Judit (as White) and Topalov, Veselin (as Black). Last move played: White plays Knight to c8"," Judit (White) moved her Knight to c8, but it's a blunder. It's not threatening mate."
Do you see the mate threat?,True,"

The comment likely indicates that the player made a move which allowed their opponent to set up a checkmate threat.",1. e4 c5 2. Nc3 Nc6 3. f4 g6 4. Nf3 Bg7 5. Bb5 Nd4 6. Bd3 d6 7. Nxd4 cxd4 8. Ne2 Nf6 9. O-O O-O 10. Qe1 Nd7 11. Bc4 d5 12. exd5 Nb6 13. d3 Nxc4 14. dxc4 b5 15. Qf2 bxc4 16. Nxd4 Qxd5 17. Be3 a5 18. c3 Rd8 19. Qc2 e6 20. Rad1 Qh5 21. Nc6 Rxd1 22. Rxd1 Bb7 23. Ne7+ Kh8 24. Rd7 Qb5 25. Qd2 Bd5 26. Rc7 Be4 27. Nc8 Qd5 28. Nd6 Kg8 29. Nxc4 Rb8 30. Qxd5 exd5 31. Ba7 Ra8 32. Nd6 Bb1 33. Nxf7 Bxa2 34. Ng5 Re8 35. Bd4,"This is a game between Polgar, Judit (as White) and Topalov, Veselin (as Black). Last move played: White plays Bishop to d4"," ""Is the bishop's move leading to a potential checkmate?"""
solves nothing,True,"

The comment ""solves nothing"" accurately indicates that the move does not improve the player's position or address any immediate threats, thus confirming the move as a mistake.",1. e4 c5 2. Nc3 Nc6 3. f4 g6 4. Nf3 Bg7 5. Bb5 Nd4 6. Bd3 d6 7. Nxd4 cxd4 8. Ne2 Nf6 9. O-O O-O 10. Qe1 Nd7 11. Bc4 d5 12. exd5 Nb6 13. d3 Nxc4 14. dxc4 b5 15. Qf2 bxc4 16. Nxd4 Qxd5 17. Be3 a5 18. c3 Rd8 19. Qc2 e6 20. Rad1 Qh5 21. Nc6 Rxd1 22. Rxd1 Bb7 23. Ne7+ Kh8 24. Rd7 Qb5 25. Qd2 Bd5 26. Rc7 Be4 27. Nc8 Qd5 28. Nd6 Kg8 29. Nxc4 Rb8 30. Qxd5 exd5 31. Ba7 Ra8 32. Nd6 Bb1 33. Nxf7 Bxa2 34. Ng5 Re8 35. Bd4 Bh6,"This is a game between Polgar, Judit (as White) and Topalov, Veselin (as Black). Last move played: Black plays Bishop to h6"," ""This move doesn't contribute to the development of their position."""
