comment,good,reasoning,moves,context,reformulated
"The Muzio Gambit. Such an audacious Knight sacrifice was already in a manuscript of the end of the 16th century. Then, for whatever reason, this attack was attributed to the mostly unknown italian player Muzio D'Alessandro. Funny things like this one are often present in the Chess Theory. Tartakover, with irony, called it ""the Short-Sighted Lady"". Although nowadays nobody is so brave to play this sacrifice, it is fully justified by the practice and the analysis. White's play must be very carefull and accurate in order to keep equality.",True,"

The comment explains the mistake made by the player as it justifies the Knight sacrifice despite being considered audacious and highlights the necessity for accurate and careful play to maintain equality.",1. e4 e5 2. f4 exf4 3. Nf3 g5 4. Bc4 g4 5. O-O,"This is a game between Chigorin, Mikhail (as White) and Davidov, A. (as Black). Last move played: White plays kingside castle"," 'In the Muzio Gambit, White's recent move involved a King's Side castle. This bold knight sacrifice, dating back to the late 16th century, was originally linked to Italian player Muzio D'Alessandro. Despite the historical context, such aggressive strategies are rare today. Tartakover, ironically, dubbed this gambit ""the Short-Sighted Lady,"" implying its risky nature. The move requires White to be cautious and precise to maintain the balance of the game.'"
Believed to be the best reply.,False,"

The comment does not explain the mistake as it asserts that the move was the best possible response, contradicting the evaluation of it being a mistake.",1. e4 e5 2. f4 exf4 3. Nf3 g5 4. Bc4 g4 5. O-O gxf3 6. Qxf3 Qf6,"This is a game between Chigorin, Mikhail (as White) and Davidov, A. (as Black). Last move played: Black plays Queen to f6",-
"Typical pawn sacrifice, aiming to open the ""e""-file.",True,"

The comment correctly identifies the mistake of sacrificing a pawn to gain control of the ""e""-file, which is a strategic move often used to open up lines for rooks and create an advantage.",1. e4 e5 2. f4 exf4 3. Nf3 g5 4. Bc4 g4 5. O-O gxf3 6. Qxf3 Qf6 7. e5,"This is a game between Chigorin, Mikhail (as White) and Davidov, A. (as Black). Last move played: White plays Pawn to e5"," Incorrect pawn move by White, seeking to open the e-file without a clear strategic advantage."
"Dubious. Probably such a move is the result of Chigorin's home analysis, and however was not the best way to keep the initiative. After many years 13. Qe2 was found and believed to be the most energetic move, but soon the theoreticians found also the right reply for Black 13... Qe6 with the continuation 14. Qf2 (Unclear would be 14. Nxe7 for 14... Qxe2 15. Nxc6+ bxc6 16. Rxe2 d5 17. Bb3 Be6 and Black has a light disadvantage.)",True,"
The comment explains the mistake by highlighting the inadequacy of the move and providing a better alternative by referencing Chigorin's home analysis, while also showing the theoretical continuation from Black's perspective.",1. e4 e5 2. f4 exf4 3. Nf3 g5 4. Bc4 g4 5. O-O gxf3 6. Qxf3 Qf6 7. e5 Qxe5 8. d3 Bh6 9. Nc3 Ne7 10. Bd2 Nbc6 11. Rae1 Qf5 12. Nd5 Kd8 13. Bc3,"This is a game between Chigorin, Mikhail (as White) and Davidov, A. (as Black). Last move played: White plays Bishop to c3"," 'This move seems dubious. It appears to be based on Chigorin's home analysis, yet it doesn't maintain the initiative well. Despite 13.Qe2 being considered energetic, Black can counter with Qe6, and the ensuing play 14.Qf2 is unclear since 14.Nxe7 allows 14...Qxe2, leading to a complex position with Black having a slight edge. This suggests that the original move might not be the most effective choice.'"
The following exchange would have been disadvantageous: 15. Bxg5 Qxg5 16. Nxf4 d6 17.Bxf7 Ne5 and Black is in very good shape.,True,"

The comment accurately explains the mistake made by the player, as the moves after 15. Bxg5 lead to a disadvantageous position for White, with Black gaining significant material and activity.",1. e4 e5 2. f4 exf4 3. Nf3 g5 4. Bc4 g4 5. O-O gxf3 6. Qxf3 Qf6 7. e5 Qxe5 8. d3 Bh6 9. Nc3 Ne7 10. Bd2 Nbc6 11. Rae1 Qf5 12. Nd5 Kd8 13. Bc3 Re8 14. Bf6 Bg5 15. g4,"This is a game between Chigorin, Mikhail (as White) and Davidov, A. (as Black). Last move played: White plays Pawn to g4"," The move 15. Bxg5 by White leads to a strong position for Black. After Black captures the bishop with 15...Qxg5, White's knight captures back with 16. Nxf4, which weakens their position. Black then develops their knight to e5 with 17...Ne5, gaining a strong outpost and putting pressure on White's position."
"A mistake! Right was 19... Rf8 20. Re2 Bf5 with exclamation mark, and White's attack vanishes.",True,"

The comment accurately explains the mistake by describing the improved move for Black that would have neutralized White's attack.",1. e4 e5 2. f4 exf4 3. Nf3 g5 4. Bc4 g4 5. O-O gxf3 6. Qxf3 Qf6 7. e5 Qxe5 8. d3 Bh6 9. Nc3 Ne7 10. Bd2 Nbc6 11. Rae1 Qf5 12. Nd5 Kd8 13. Bc3 Re8 14. Bf6 Bg5 15. g4 Qg6 16. Bxg5 Qxg5 17. h4 Qxh4 18. Qxf4 d6 19. Nf6 Ne5,"This is a game between Chigorin, Mikhail (as White) and Davidov, A. (as Black). Last move played: Black plays Knight to e5"," ""Incorrect move, 19... Rf8. Then, 20. Re2 Bf5 shows a missed opportunity for White."""
Very good!,False,"

The comment ""Very good!"" is contradictory to the statement that the move was evaluated as a mistake, indicating a discrepancy in the assessment of the move.",1. e4 e5 2. f4 exf4 3. Nf3 g5 4. Bc4 g4 5. O-O gxf3 6. Qxf3 Qf6 7. e5 Qxe5 8. d3 Bh6 9. Nc3 Ne7 10. Bd2 Nbc6 11. Rae1 Qf5 12. Nd5 Kd8 13. Bc3 Re8 14. Bf6 Bg5 15. g4 Qg6 16. Bxg5 Qxg5 17. h4 Qxh4 18. Qxf4 d6 19. Nf6 Ne5 20. Rxe5 dxe5 21. Qxe5 Bxg4 22. Qd4+ Kc8 23. Be6+,"This is a game between Chigorin, Mikhail (as White) and Davidov, A. (as Black). Last move played: White plays Bishop to e6 with check",-
and that's all folks!,False,"
The comment does not explain the mistake made by the player, as it is a cliché phrase usually used to end a performance, not a chess move evaluation.",1. e4 e5 2. f4 exf4 3. Nf3 g5 4. Bc4 g4 5. O-O gxf3 6. Qxf3 Qf6 7. e5 Qxe5 8. d3 Bh6 9. Nc3 Ne7 10. Bd2 Nbc6 11. Rae1 Qf5 12. Nd5 Kd8 13. Bc3 Re8 14. Bf6 Bg5 15. g4 Qg6 16. Bxg5 Qxg5 17. h4 Qxh4 18. Qxf4 d6 19. Nf6 Ne5 20. Rxe5 dxe5 21. Qxe5 Bxg4 22. Qd4+ Kc8 23. Be6+ Kb8 24. Nd7+ Kc8 25. Nc5+ Kb8 26. Na6+ bxa6,"This is a game between Chigorin, Mikhail (as White) and Davidov, A. (as Black). Last move played: Black plays Pawn takes on a6",-
