comment,good,reasoning,moves,context,reformulated
"From ""My Chess Career"", I report Capablanca's comment: << ... I remember I played 1.d4 because that way Corzo could not take too much advantage from my weakness in the opening.>>",False,"

The comment does not explain the mistake made by the player, as it only provides historical context on the player's reasoning, not the specific error in the game.",1. d4 d5 2. Nf3 c5 3. e3 Nc6 4. b3 e6 5. Bb2 Nf6 6. Nbd2 cxd4 7. exd4,"This is a game between Capablanca, J. (as White) and Corzo, J. (as Black). Last move played: White plays Pawn takes on d4",-
To prevent Nb4 ... (Capablanca).,False,"

The comment does not explain the mistake as it does not specify what move was played and why it was a mistake, nor does it mention White's move.",1. d4 d5 2. Nf3 c5 3. e3 Nc6 4. b3 e6 5. Bb2 Nf6 6. Nbd2 cxd4 7. exd4 Bd6 8. Bd3 O-O 9. O-O Nh5 10. g3 f5 11. Ne5 Nf6 12. f4 Bxe5 13. fxe5 Ng4 14. Qe2 Qb6 15. Nf3 Bd7 16. a3,"This is a game between Capablanca, J. (as White) and Corzo, J. (as Black). Last move played: White plays Pawn to a3",-
"For the Master, one of the most difficult task is to build a position which allows him to switch to the attack. Probably today I would have done better, but - after all I did not play badly and indeed I invented a rather brilliant combination. (Capablanca)",False,"

The comment doesn't explain the mistake made by the player as it praises the player's creative combination and doesn't address the error in the move.",1. d4 d5 2. Nf3 c5 3. e3 Nc6 4. b3 e6 5. Bb2 Nf6 6. Nbd2 cxd4 7. exd4 Bd6 8. Bd3 O-O 9. O-O Nh5 10. g3 f5 11. Ne5 Nf6 12. f4 Bxe5 13. fxe5 Ng4 14. Qe2 Qb6 15. Nf3 Bd7 16. a3 Kh8 17. h3 Nh6 18. Qf2 Nf7 19. Kg2 g5 20. g4 Ne7 21. Qe3 Rg8 22. Rae1 Ng6 23. gxf5 Nf4+ 24. Kh2 Nxd3 25. Qxd3,"This is a game between Capablanca, J. (as White) and Corzo, J. (as Black). Last move played: White plays Queen takes on d3",-
Almost certainly today I would have played,True,"

The comment implies that the player recognizes their mistake and expresses regret for not making a different move.",1. d4 d5 2. Nf3 c5 3. e3 Nc6 4. b3 e6 5. Bb2 Nf6 6. Nbd2 cxd4 7. exd4 Bd6 8. Bd3 O-O 9. O-O Nh5 10. g3 f5 11. Ne5 Nf6 12. f4 Bxe5 13. fxe5 Ng4 14. Qe2 Qb6 15. Nf3 Bd7 16. a3 Kh8 17. h3 Nh6 18. Qf2 Nf7 19. Kg2 g5 20. g4 Ne7 21. Qe3 Rg8 22. Rae1 Ng6 23. gxf5 Nf4+ 24. Kh2 Nxd3 25. Qxd3 exf5 26. c4 Qe6 27. cxd5 Qxd5 28. e6 Bb5 29. Qxb5,"This is a game between Capablanca, J. (as White) and Corzo, J. (as Black). Last move played: White plays Queen takes on b5", 'They're likely to have made a suboptimal move by taking on b5.'
"Capablanca's skill is remarkable. At 12 years he already user the ""Knight+Bishop barrier"" to imprison the enemy King (with the last move g8, g7, g6 are inhibited to Kh7).",False,"

The comment does not explain the mistake made by the player; it discusses a historical chess tactical theme instead.",1. d4 d5 2. Nf3 c5 3. e3 Nc6 4. b3 e6 5. Bb2 Nf6 6. Nbd2 cxd4 7. exd4 Bd6 8. Bd3 O-O 9. O-O Nh5 10. g3 f5 11. Ne5 Nf6 12. f4 Bxe5 13. fxe5 Ng4 14. Qe2 Qb6 15. Nf3 Bd7 16. a3 Kh8 17. h3 Nh6 18. Qf2 Nf7 19. Kg2 g5 20. g4 Ne7 21. Qe3 Rg8 22. Rae1 Ng6 23. gxf5 Nf4+ 24. Kh2 Nxd3 25. Qxd3 exf5 26. c4 Qe6 27. cxd5 Qxd5 28. e6 Bb5 29. Qxb5 Qxb5 30. d5+ Rg7 31. exf7 h6 32. Nd4 Qxf1 33. Rxf1 Rxf7 34. Rxf5 Rxf5 35. Nxf5+ Kh7 36. Ne7,"This is a game between Capablanca, J. (as White) and Corzo, J. (as Black). Last move played: White plays Knight to e7",-
"All at the center, the threat is d7 and Bc7.",False,"

The comment does not explain the mistake made by the player, as it only identifies potential threats without criticizing the move or explaining why it was a mistake.",1. d4 d5 2. Nf3 c5 3. e3 Nc6 4. b3 e6 5. Bb2 Nf6 6. Nbd2 cxd4 7. exd4 Bd6 8. Bd3 O-O 9. O-O Nh5 10. g3 f5 11. Ne5 Nf6 12. f4 Bxe5 13. fxe5 Ng4 14. Qe2 Qb6 15. Nf3 Bd7 16. a3 Kh8 17. h3 Nh6 18. Qf2 Nf7 19. Kg2 g5 20. g4 Ne7 21. Qe3 Rg8 22. Rae1 Ng6 23. gxf5 Nf4+ 24. Kh2 Nxd3 25. Qxd3 exf5 26. c4 Qe6 27. cxd5 Qxd5 28. e6 Bb5 29. Qxb5 Qxb5 30. d5+ Rg7 31. exf7 h6 32. Nd4 Qxf1 33. Rxf1 Rxf7 34. Rxf5 Rxf5 35. Nxf5+ Kh7 36. Ne7 Rf8 37. Kg2 h5 38. d6 g4 39. hxg4 hxg4 40. Be5,"This is a game between Capablanca, J. (as White) and Corzo, J. (as Black). Last move played: White plays Bishop to e5",-
"Cunningly Black expects bxa5? which would draw because the promoting square a8 is white and ... ""we all"" know that White cannot win anymore afterKe5-d6-c6-b7- a8 leaving the Pb5 too to the greedy opponent. White, instead, wins easily by keeping the pawn on the b file.",True,"

The comment accurately explains the mistake made by the player as it provides a clear analysis of why Black's move was a blunder and how White can capitalize on it by maintaining the pawn on the b file.",1. d4 d5 2. Nf3 c5 3. e3 Nc6 4. b3 e6 5. Bb2 Nf6 6. Nbd2 cxd4 7. exd4 Bd6 8. Bd3 O-O 9. O-O Nh5 10. g3 f5 11. Ne5 Nf6 12. f4 Bxe5 13. fxe5 Ng4 14. Qe2 Qb6 15. Nf3 Bd7 16. a3 Kh8 17. h3 Nh6 18. Qf2 Nf7 19. Kg2 g5 20. g4 Ne7 21. Qe3 Rg8 22. Rae1 Ng6 23. gxf5 Nf4+ 24. Kh2 Nxd3 25. Qxd3 exf5 26. c4 Qe6 27. cxd5 Qxd5 28. e6 Bb5 29. Qxb5 Qxb5 30. d5+ Rg7 31. exf7 h6 32. Nd4 Qxf1 33. Rxf1 Rxf7 34. Rxf5 Rxf5 35. Nxf5+ Kh7 36. Ne7 Rf8 37. Kg2 h5 38. d6 g4 39. hxg4 hxg4 40. Be5 Kh6 41. d7 Rd8 42. Ng8+ Rxg8 43. Bf6 Kg6 44. d8=Q Rxd8 45. Bxd8 b5 46. Kf2 Kf5 47. Ke3 Ke5 48. Kd3 Kd5 49. Kc3 g3 50. Bh4 g2 51. Bf2 a5 52. b4 Ke5,"This is a game between Capablanca, J. (as White) and Corzo, J. (as Black). Last move played: Black plays King to e5"," Black's expectations for bxa5 seem misplaced, as White's pawn on b7 can easily advance. White should continue with the pawn on the b file, securing a win by keeping pressure on Black."
The decisive move which forces the Black King to withdraw.,False,"

This comment does not explain the mistake made by the player, as it seems to describe a successful strategy rather than a poor move.",1. d4 d5 2. Nf3 c5 3. e3 Nc6 4. b3 e6 5. Bb2 Nf6 6. Nbd2 cxd4 7. exd4 Bd6 8. Bd3 O-O 9. O-O Nh5 10. g3 f5 11. Ne5 Nf6 12. f4 Bxe5 13. fxe5 Ng4 14. Qe2 Qb6 15. Nf3 Bd7 16. a3 Kh8 17. h3 Nh6 18. Qf2 Nf7 19. Kg2 g5 20. g4 Ne7 21. Qe3 Rg8 22. Rae1 Ng6 23. gxf5 Nf4+ 24. Kh2 Nxd3 25. Qxd3 exf5 26. c4 Qe6 27. cxd5 Qxd5 28. e6 Bb5 29. Qxb5 Qxb5 30. d5+ Rg7 31. exf7 h6 32. Nd4 Qxf1 33. Rxf1 Rxf7 34. Rxf5 Rxf5 35. Nxf5+ Kh7 36. Ne7 Rf8 37. Kg2 h5 38. d6 g4 39. hxg4 hxg4 40. Be5 Kh6 41. d7 Rd8 42. Ng8+ Rxg8 43. Bf6 Kg6 44. d8=Q Rxd8 45. Bxd8 b5 46. Kf2 Kf5 47. Ke3 Ke5 48. Kd3 Kd5 49. Kc3 g3 50. Bh4 g2 51. Bf2 a5 52. b4 Ke5 53. Bb6 Kd5 54. Kd3 Kc6 55. Bg1 Kd5 56. Bh2,"This is a game between Capablanca, J. (as White) and Corzo, J. (as Black). Last move played: White plays Bishop to h2",-
"The ""limit"" (the Pb5 rank) is crossed, and with it the last defense.... or maybe the next to the last, as we shall see.",True,"

The comment accurately describes the mistake made by the player by explaining that the pawn (referred to as ""limit"") has moved past a crucial defense position, potentially compromising the player's position in the game.",1. d4 d5 2. Nf3 c5 3. e3 Nc6 4. b3 e6 5. Bb2 Nf6 6. Nbd2 cxd4 7. exd4 Bd6 8. Bd3 O-O 9. O-O Nh5 10. g3 f5 11. Ne5 Nf6 12. f4 Bxe5 13. fxe5 Ng4 14. Qe2 Qb6 15. Nf3 Bd7 16. a3 Kh8 17. h3 Nh6 18. Qf2 Nf7 19. Kg2 g5 20. g4 Ne7 21. Qe3 Rg8 22. Rae1 Ng6 23. gxf5 Nf4+ 24. Kh2 Nxd3 25. Qxd3 exf5 26. c4 Qe6 27. cxd5 Qxd5 28. e6 Bb5 29. Qxb5 Qxb5 30. d5+ Rg7 31. exf7 h6 32. Nd4 Qxf1 33. Rxf1 Rxf7 34. Rxf5 Rxf5 35. Nxf5+ Kh7 36. Ne7 Rf8 37. Kg2 h5 38. d6 g4 39. hxg4 hxg4 40. Be5 Kh6 41. d7 Rd8 42. Ng8+ Rxg8 43. Bf6 Kg6 44. d8=Q Rxd8 45. Bxd8 b5 46. Kf2 Kf5 47. Ke3 Ke5 48. Kd3 Kd5 49. Kc3 g3 50. Bh4 g2 51. Bf2 a5 52. b4 Ke5 53. Bb6 Kd5 54. Kd3 Kc6 55. Bg1 Kd5 56. Bh2 Kc6 57. Kd4 a4 58. Ke5,"This is a game between Capablanca, J. (as White) and Corzo, J. (as Black). Last move played: White plays King to e5"," The move played by White was weak, leaving the ""limit"" (the Pb5 rank) open, which could lead to a significant disadvantage."
in case of,False,"

The comment does not explain the mistake made by the player, as it lacks specific details about the error and the consequences of the move.",1. d4 d5 2. Nf3 c5 3. e3 Nc6 4. b3 e6 5. Bb2 Nf6 6. Nbd2 cxd4 7. exd4 Bd6 8. Bd3 O-O 9. O-O Nh5 10. g3 f5 11. Ne5 Nf6 12. f4 Bxe5 13. fxe5 Ng4 14. Qe2 Qb6 15. Nf3 Bd7 16. a3 Kh8 17. h3 Nh6 18. Qf2 Nf7 19. Kg2 g5 20. g4 Ne7 21. Qe3 Rg8 22. Rae1 Ng6 23. gxf5 Nf4+ 24. Kh2 Nxd3 25. Qxd3 exf5 26. c4 Qe6 27. cxd5 Qxd5 28. e6 Bb5 29. Qxb5 Qxb5 30. d5+ Rg7 31. exf7 h6 32. Nd4 Qxf1 33. Rxf1 Rxf7 34. Rxf5 Rxf5 35. Nxf5+ Kh7 36. Ne7 Rf8 37. Kg2 h5 38. d6 g4 39. hxg4 hxg4 40. Be5 Kh6 41. d7 Rd8 42. Ng8+ Rxg8 43. Bf6 Kg6 44. d8=Q Rxd8 45. Bxd8 b5 46. Kf2 Kf5 47. Ke3 Ke5 48. Kd3 Kd5 49. Kc3 g3 50. Bh4 g2 51. Bf2 a5 52. b4 Ke5 53. Bb6 Kd5 54. Kd3 Kc6 55. Bg1 Kd5 56. Bh2 Kc6 57. Kd4 a4 58. Ke5 Kb6 59. Kd5 Ka6 60. Kc5,"This is a game between Capablanca, J. (as White) and Corzo, J. (as Black). Last move played: White plays King to c5",-
