moves,comment,good
1. d4 Nf6,Preventing 2. e4,True
1. d4 Nf6 2. c4,Putting pressure on d5.,True
1. d4 Nf6 2. c4 e6 3. Nf3 Bb4+ 4. Nbd2 b6,The Queen's Indian Defense. Black moves the bishop to b7 to put pressure on the center.,True
1. d4 Nf6 2. c4 e6 3. Nf3 Bb4+ 4. Nbd2 b6 5. g3,The usual counter to the bishop on b7.,False
1. d4 Nf6 2. c4 e6 3. Nf3 Bb4+ 4. Nbd2 b6 5. g3 Bb7 6. Bg2 O-O,Continuing development.,False
1. d4 Nf6 2. c4 e6 3. Nf3 Bb4+ 4. Nbd2 b6 5. g3 Bb7 6. Bg2 O-O 7. O-O Bxd2,This is a questionable move since the bishop was more powerful than the knight. The key to White's attack in this game is the power of his dark-squared bishop.,True
1. d4 Nf6 2. c4 e6 3. Nf3 Bb4+ 4. Nbd2 b6 5. g3 Bb7 6. Bg2 O-O 7. O-O Bxd2 8. Qxd2,"With Black's dark-squared bishop gone, White plans to place a bishop on b2 exerting strong pressure along the diagonal.",True
1. d4 Nf6 2. c4 e6 3. Nf3 Bb4+ 4. Nbd2 b6 5. g3 Bb7 6. Bg2 O-O 7. O-O Bxd2 8. Qxd2 d6,Black want to develop the knight on d7 rather than on c6 where it would block the bishop on b7 and the pawn on c7.,True
1. d4 Nf6 2. c4 e6 3. Nf3 Bb4+ 4. Nbd2 b6 5. g3 Bb7 6. Bg2 O-O 7. O-O Bxd2 8. Qxd2 d6 9. b3,The bishop is going to be well placed on b2.,False
1. d4 Nf6 2. c4 e6 3. Nf3 Bb4+ 4. Nbd2 b6 5. g3 Bb7 6. Bg2 O-O 7. O-O Bxd2 8. Qxd2 d6 9. b3 Nbd7 10. Bb2 Rb8,"Black wants the bishop to be protected so that after ... Ne4 the knight will not become pinned to the bishop after White moves his queen and knight. However, this is a passive place for the rook.",True
1. d4 Nf6 2. c4 e6 3. Nf3 Bb4+ 4. Nbd2 b6 5. g3 Bb7 6. Bg2 O-O 7. O-O Bxd2 8. Qxd2 d6 9. b3 Nbd7 10. Bb2 Rb8 11. Rad1 Ne4,The knight is Black's best-placed piece.,True
1. d4 Nf6 2. c4 e6 3. Nf3 Bb4+ 4. Nbd2 b6 5. g3 Bb7 6. Bg2 O-O 7. O-O Bxd2 8. Qxd2 d6 9. b3 Nbd7 10. Bb2 Rb8 11. Rad1 Ne4 12. Qe3,White would like to trade off the knight with 13. Nd2.,True
1. d4 Nf6 2. c4 e6 3. Nf3 Bb4+ 4. Nbd2 b6 5. g3 Bb7 6. Bg2 O-O 7. O-O Bxd2 8. Qxd2 d6 9. b3 Nbd7 10. Bb2 Rb8 11. Rad1 Ne4 12. Qe3 f5,Now Black can meet 13. Nd2 with Ndf6.,True
1. d4 Nf6 2. c4 e6 3. Nf3 Bb4+ 4. Nbd2 b6 5. g3 Bb7 6. Bg2 O-O 7. O-O Bxd2 8. Qxd2 d6 9. b3 Nbd7 10. Bb2 Rb8 11. Rad1 Ne4 12. Qe3 f5 13. d5,This limits the scope of Black's bishop and increases the scope of White's queen bishop. If 13...e5 then 14. Nh4 Nec5 15. f4 threatening 16. fxe5 Nxe5 17. Nxf5. Black cannot win a piece with 15... exf4 16. Qxf4 g5 because of 17. Qd4 threatening 18. Qxg7#.,True
1. d4 Nf6 2. c4 e6 3. Nf3 Bb4+ 4. Nbd2 b6 5. g3 Bb7 6. Bg2 O-O 7. O-O Bxd2 8. Qxd2 d6 9. b3 Nbd7 10. Bb2 Rb8 11. Rad1 Ne4 12. Qe3 f5 13. d5 exd5 14. cxd5 Ndf6,Attacking the pawn on d5. It doesn't look like it can be defended.,True
1. d4 Nf6 2. c4 e6 3. Nf3 Bb4+ 4. Nbd2 b6 5. g3 Bb7 6. Bg2 O-O 7. O-O Bxd2 8. Qxd2 d6 9. b3 Nbd7 10. Bb2 Rb8 11. Rad1 Ne4 12. Qe3 f5 13. d5 exd5 14. cxd5 Ndf6 15. Nh4,Black cannot capture the pawn on d5 safely. If 15... Bxd5 then 16. Bxf6 Qxf6 (or 16... Nxf6 17. Bxd5) 17. Rxd5. If 15... Nxd5 then 16. Rxd5 $1 Bxd5 17. Qd4 (Threatening Qxg7#.) 17... Qd7 18. Qxd5+ and Black's rook and pawn are no match for White's two bishops.,True
1. d4 Nf6 2. c4 e6 3. Nf3 Bb4+ 4. Nbd2 b6 5. g3 Bb7 6. Bg2 O-O 7. O-O Bxd2 8. Qxd2 d6 9. b3 Nbd7 10. Bb2 Rb8 11. Rad1 Ne4 12. Qe3 f5 13. d5 exd5 14. cxd5 Ndf6 15. Nh4 Qd7 16. Bh3,"Pinning the pawn on f5 and therefore removing its ability to protect the knight on e4. If 16... Nxd5 then 17. Qxe4 fxe4 18. Bxd7 wins. If 16... Bxd5 then 17. Rxd5 Nxd5 18. Qxe4 fxe4 19. Bxd7 and although material is even, White has a winning positional advantage.",True
1. d4 Nf6 2. c4 e6 3. Nf3 Bb4+ 4. Nbd2 b6 5. g3 Bb7 6. Bg2 O-O 7. O-O Bxd2 8. Qxd2 d6 9. b3 Nbd7 10. Bb2 Rb8 11. Rad1 Ne4 12. Qe3 f5 13. d5 exd5 14. cxd5 Ndf6 15. Nh4 Qd7 16. Bh3 g6,Black has been forced to weaken his dark squares and thus enhance the effectiveness of White's bishop on b2.,True
1. d4 Nf6 2. c4 e6 3. Nf3 Bb4+ 4. Nbd2 b6 5. g3 Bb7 6. Bg2 O-O 7. O-O Bxd2 8. Qxd2 d6 9. b3 Nbd7 10. Bb2 Rb8 11. Rad1 Ne4 12. Qe3 f5 13. d5 exd5 14. cxd5 Ndf6 15. Nh4 Qd7 16. Bh3 g6 17. f3,White chases away Black's best-placed piece and prepares for an eventual e4 breaking open the position.,True
1. d4 Nf6 2. c4 e6 3. Nf3 Bb4+ 4. Nbd2 b6 5. g3 Bb7 6. Bg2 O-O 7. O-O Bxd2 8. Qxd2 d6 9. b3 Nbd7 10. Bb2 Rb8 11. Rad1 Ne4 12. Qe3 f5 13. d5 exd5 14. cxd5 Ndf6 15. Nh4 Qd7 16. Bh3 g6 17. f3 Nc5 18. Qg5,Pinning the pawn on g6 and threatening to take the pawn on f5 with either the knight or the bishop. White also clears the way for moving a pawn to e4.,True
1. d4 Nf6 2. c4 e6 3. Nf3 Bb4+ 4. Nbd2 b6 5. g3 Bb7 6. Bg2 O-O 7. O-O Bxd2 8. Qxd2 d6 9. b3 Nbd7 10. Bb2 Rb8 11. Rad1 Ne4 12. Qe3 f5 13. d5 exd5 14. cxd5 Ndf6 15. Nh4 Qd7 16. Bh3 g6 17. f3 Nc5 18. Qg5 Qg7,Breaking the pin and bringing the queen over to help defend the king.,True
1. d4 Nf6 2. c4 e6 3. Nf3 Bb4+ 4. Nbd2 b6 5. g3 Bb7 6. Bg2 O-O 7. O-O Bxd2 8. Qxd2 d6 9. b3 Nbd7 10. Bb2 Rb8 11. Rad1 Ne4 12. Qe3 f5 13. d5 exd5 14. cxd5 Ndf6 15. Nh4 Qd7 16. Bh3 g6 17. f3 Nc5 18. Qg5 Qg7 19. b4,Pushing back a defender of e4.,True
1. d4 Nf6 2. c4 e6 3. Nf3 Bb4+ 4. Nbd2 b6 5. g3 Bb7 6. Bg2 O-O 7. O-O Bxd2 8. Qxd2 d6 9. b3 Nbd7 10. Bb2 Rb8 11. Rad1 Ne4 12. Qe3 f5 13. d5 exd5 14. cxd5 Ndf6 15. Nh4 Qd7 16. Bh3 g6 17. f3 Nc5 18. Qg5 Qg7 19. b4 Ncd7 20. e4,Threatening the pawn on f5. If 20... fxe4 21. Bxd7 Qxd7 22. Bxf6 wins a piece.,True
1. d4 Nf6 2. c4 e6 3. Nf3 Bb4+ 4. Nbd2 b6 5. g3 Bb7 6. Bg2 O-O 7. O-O Bxd2 8. Qxd2 d6 9. b3 Nbd7 10. Bb2 Rb8 11. Rad1 Ne4 12. Qe3 f5 13. d5 exd5 14. cxd5 Ndf6 15. Nh4 Qd7 16. Bh3 g6 17. f3 Nc5 18. Qg5 Qg7 19. b4 Ncd7 20. e4 Nxe4,This looks like a saving move. If 21. fxe4 then 21... Qxb2. If 21. Bxg2 Nxg5 22. Bxf8 Nxh3+ 23. Kg2 Rxf8 24. Kxh3 Nf6 25. Rfe1 Nxd5 and Black has a good position with a bishop and two pawns for a rook.,False
1. d4 Nf6 2. c4 e6 3. Nf3 Bb4+ 4. Nbd2 b6 5. g3 Bb7 6. Bg2 O-O 7. O-O Bxd2 8. Qxd2 d6 9. b3 Nbd7 10. Bb2 Rb8 11. Rad1 Ne4 12. Qe3 f5 13. d5 exd5 14. cxd5 Ndf6 15. Nh4 Qd7 16. Bh3 g6 17. f3 Nc5 18. Qg5 Qg7 19. b4 Ncd7 20. e4 Nxe4 21. Qc1,Both the Black queen and the knight on e4 are attacked.,True
1. d4 Nf6 2. c4 e6 3. Nf3 Bb4+ 4. Nbd2 b6 5. g3 Bb7 6. Bg2 O-O 7. O-O Bxd2 8. Qxd2 d6 9. b3 Nbd7 10. Bb2 Rb8 11. Rad1 Ne4 12. Qe3 f5 13. d5 exd5 14. cxd5 Ndf6 15. Nh4 Qd7 16. Bh3 g6 17. f3 Nc5 18. Qg5 Qg7 19. b4 Ncd7 20. e4 Nxe4 21. Qc1 Nef6,The only way to save the knight and the queen.,True
1. d4 Nf6 2. c4 e6 3. Nf3 Bb4+ 4. Nbd2 b6 5. g3 Bb7 6. Bg2 O-O 7. O-O Bxd2 8. Qxd2 d6 9. b3 Nbd7 10. Bb2 Rb8 11. Rad1 Ne4 12. Qe3 f5 13. d5 exd5 14. cxd5 Ndf6 15. Nh4 Qd7 16. Bh3 g6 17. f3 Nc5 18. Qg5 Qg7 19. b4 Ncd7 20. e4 Nxe4 21. Qc1 Nef6 22. Bxf5,"If 22... gxf5 23. Nxf5 Black has only three places to move his queen, and they all lose: 23... Qf7 24. Nh6+ Kg7 25. Nxf7; 23... Qg6 24. Ne7+ Kg7 25. Nxg6; 23... Qh8 24. Nh6+ Kg7 25. Qg5#.",True
1. d4 Nf6 2. c4 e6 3. Nf3 Bb4+ 4. Nbd2 b6 5. g3 Bb7 6. Bg2 O-O 7. O-O Bxd2 8. Qxd2 d6 9. b3 Nbd7 10. Bb2 Rb8 11. Rad1 Ne4 12. Qe3 f5 13. d5 exd5 14. cxd5 Ndf6 15. Nh4 Qd7 16. Bh3 g6 17. f3 Nc5 18. Qg5 Qg7 19. b4 Ncd7 20. e4 Nxe4 21. Qc1 Nef6 22. Bxf5 Kh8 23. Be6,White's position is overwhelming. He now threatens to advance his pawn to g4 and then to g5 attacking the pinned knight.,True
1. d4 Nf6 2. c4 e6 3. Nf3 Bb4+ 4. Nbd2 b6 5. g3 Bb7 6. Bg2 O-O 7. O-O Bxd2 8. Qxd2 d6 9. b3 Nbd7 10. Bb2 Rb8 11. Rad1 Ne4 12. Qe3 f5 13. d5 exd5 14. cxd5 Ndf6 15. Nh4 Qd7 16. Bh3 g6 17. f3 Nc5 18. Qg5 Qg7 19. b4 Ncd7 20. e4 Nxe4 21. Qc1 Nef6 22. Bxf5 Kh8 23. Be6 Ba6,A minor distraction.,True
1. d4 Nf6 2. c4 e6 3. Nf3 Bb4+ 4. Nbd2 b6 5. g3 Bb7 6. Bg2 O-O 7. O-O Bxd2 8. Qxd2 d6 9. b3 Nbd7 10. Bb2 Rb8 11. Rad1 Ne4 12. Qe3 f5 13. d5 exd5 14. cxd5 Ndf6 15. Nh4 Qd7 16. Bh3 g6 17. f3 Nc5 18. Qg5 Qg7 19. b4 Ncd7 20. e4 Nxe4 21. Qc1 Nef6 22. Bxf5 Kh8 23. Be6 Ba6 24. Rfe1 Ne5,Attempting to break the pin on the a1-h8 diagonal.,True
1. d4 Nf6 2. c4 e6 3. Nf3 Bb4+ 4. Nbd2 b6 5. g3 Bb7 6. Bg2 O-O 7. O-O Bxd2 8. Qxd2 d6 9. b3 Nbd7 10. Bb2 Rb8 11. Rad1 Ne4 12. Qe3 f5 13. d5 exd5 14. cxd5 Ndf6 15. Nh4 Qd7 16. Bh3 g6 17. f3 Nc5 18. Qg5 Qg7 19. b4 Ncd7 20. e4 Nxe4 21. Qc1 Nef6 22. Bxf5 Kh8 23. Be6 Ba6 24. Rfe1 Ne5 25. f4,The diagonal will be unblocked.,False
1. d4 Nf6 2. c4 e6 3. Nf3 Bb4+ 4. Nbd2 b6 5. g3 Bb7 6. Bg2 O-O 7. O-O Bxd2 8. Qxd2 d6 9. b3 Nbd7 10. Bb2 Rb8 11. Rad1 Ne4 12. Qe3 f5 13. d5 exd5 14. cxd5 Ndf6 15. Nh4 Qd7 16. Bh3 g6 17. f3 Nc5 18. Qg5 Qg7 19. b4 Ncd7 20. e4 Nxe4 21. Qc1 Nef6 22. Bxf5 Kh8 23. Be6 Ba6 24. Rfe1 Ne5 25. f4 Nd3,Forking the queen and rook.,True
1. d4 Nf6 2. c4 e6 3. Nf3 Bb4+ 4. Nbd2 b6 5. g3 Bb7 6. Bg2 O-O 7. O-O Bxd2 8. Qxd2 d6 9. b3 Nbd7 10. Bb2 Rb8 11. Rad1 Ne4 12. Qe3 f5 13. d5 exd5 14. cxd5 Ndf6 15. Nh4 Qd7 16. Bh3 g6 17. f3 Nc5 18. Qg5 Qg7 19. b4 Ncd7 20. e4 Nxe4 21. Qc1 Nef6 22. Bxf5 Kh8 23. Be6 Ba6 24. Rfe1 Ne5 25. f4 Nd3 26. Rxd3,White is happy to exchange a rook for a knight in this position.,True
1. d4 Nf6 2. c4 e6 3. Nf3 Bb4+ 4. Nbd2 b6 5. g3 Bb7 6. Bg2 O-O 7. O-O Bxd2 8. Qxd2 d6 9. b3 Nbd7 10. Bb2 Rb8 11. Rad1 Ne4 12. Qe3 f5 13. d5 exd5 14. cxd5 Ndf6 15. Nh4 Qd7 16. Bh3 g6 17. f3 Nc5 18. Qg5 Qg7 19. b4 Ncd7 20. e4 Nxe4 21. Qc1 Nef6 22. Bxf5 Kh8 23. Be6 Ba6 24. Rfe1 Ne5 25. f4 Nd3 26. Rxd3 Bxd3 27. g4,Black resigned because there is no way to stop 28. g5. A possible continuation is: 28... h6 29. g5 hxg5 30. fxg5 Kh7 31. Bxf6 Rxf6 32. gxf6 Qxf6 33. Ng2 and White is up a piece.,True
