comment,good,reasoning,moves,context,engine_eval,engine_best_line,engine_best_alternative
"Alekhine plays the ""hypermodern"" Reti Opening (named for fellow competitor Richard Reti). He'll allow Black's pawns to occupy the center, but then exert his own influence over the center by attacking Black's pawns with his flank pawns, Bishops, and Knights.",True," The comment provides a brief explanation of the opening’s strategic goals, suggesting a flawed approach to controlling the center.",1. Nf3 Nf6 2. c4 e6 3. g3 d5 4. Bg2,"This is a game between Alekhine,A (as White) and Bogoljubow,E (as Black). Last move played: White plays Bishop to g2",The position is equal,4... d4 5. e3 c5 6. d3 Nc6 7. O-O Bd6 8. exd4 cxd4 9. a3 a5 10. Bg5 h6 11. Bxf6 Qxf6 12. Nbd2 Qe7 13. Rc1 Bd7 14. Nb3 e5 15. Re1 Be6 16. c5 ,4. d4 Be7 5. Bg2 O-O 6. O-O dxc4 7. Qc2 a6 8. a4 Bd7 9. Qxc4 Bc6 10. Bf4 a5 11. Nc3 Na6 12. Rac1 Bd5 13. Qd3 Nb4 14. Qb1 Bxf3 15. Bxf3 c6 
"A wasted tempo. Bogoljubow may be thinking of supporting an advance of the b-pawn, but there's really no point or advantage to such an advance. Perhaps he'll fianchetto his light-squared Bishop and wants it to be defended by a Rook on b8.",True," The comment offers a potential explanation for the mistake, suggesting a strategic misstep.",1. Nf3 Nf6 2. c4 e6 3. g3 d5 4. Bg2 Nbd7 5. b3 Bd6 6. O-O O-O 7. Bb2 c6 8. d3 Re8 9. Nbd2 a5 10. a3 Rb8,"This is a game between Alekhine,A (as White) and Bogoljubow,E (as Black). Last move played: Black plays Rook to b8",Slight advantage for White (eval: 40 centipawns),11. cxd5 ,10... e5 11. Qc2 
Alekhine distracts Black from the capture of the d-pawn. The e5-Knight is pinned (due to the threat of Qxg7 mate). White's plan is to increase the strength of the pin by playing f2-f4.,True, The comment accurately describes a critical tactical error and the resulting threat.,1. Nf3 Nf6 2. c4 e6 3. g3 d5 4. Bg2 Nbd7 5. b3 Bd6 6. O-O O-O 7. Bb2 c6 8. d3 Re8 9. Nbd2 a5 10. a3 Rb8 11. Qc2 Qe7 12. d4 b6 13. Ne5 Bb7 14. e4 Bxe5 15. dxe5 Ng4 16. Nf3 c5 17. exd5 exd5 18. h3 Ngxe5 19. Nxe5 Nxe5 20. cxd5 Qd6 21. Qc3,"This is a game between Alekhine,A (as White) and Bogoljubow,E (as Black). Last move played: White plays Queen to c3",Slight advantage for White (eval: 39 centipawns),21... f6 ,21. Rfe1 f6 
"By making continuous threats, Bogo has succeeded in replacing the Queen on d6 with a Knight. Knights (due to their low material value) are much better suited for blockade duty than the mobile and powerful Queen.",True," The comment identifies a flawed strategic choice based on material value, suggesting the move was detrimental.",1. Nf3 Nf6 2. c4 e6 3. g3 d5 4. Bg2 Nbd7 5. b3 Bd6 6. O-O O-O 7. Bb2 c6 8. d3 Re8 9. Nbd2 a5 10. a3 Rb8 11. Qc2 Qe7 12. d4 b6 13. Ne5 Bb7 14. e4 Bxe5 15. dxe5 Ng4 16. Nf3 c5 17. exd5 exd5 18. h3 Ngxe5 19. Nxe5 Nxe5 20. cxd5 Qd6 21. Qc3 f6 22. Rad1 Re7 23. f4 Nf7 24. Rfe1 Rbe8 25. Rxe7 Qxe7 26. Bc1 Nd6,"This is a game between Alekhine,A (as White) and Bogoljubow,E (as Black). Last move played: Black plays Knight to d6",Slight advantage for Black (eval: -29 centipawns),27. Qd3 Qd7 28. Be3 h5 29. Re1 f5 30. Bf2 Rxe1+ 31. Bxe1 Ne4 32. Bxe4 fxe4 33. Qxe4 Bxd5 34. Qd3 Qe6 35. Bc3 Bxb3 36. Qd8+ Kh7 37. Qd3+ Kh6 38. Be5 Bd5 ,26... Nd6 27. g4 
The doubled pawns are no big deal (yet) as White has no way to exploit this weakness.,True," The comment suggests a potential tactical flaw, indicating a flawed assessment of the position.",1. Nf3 Nf6 2. c4 e6 3. g3 d5 4. Bg2 Nbd7 5. b3 Bd6 6. O-O O-O 7. Bb2 c6 8. d3 Re8 9. Nbd2 a5 10. a3 Rb8 11. Qc2 Qe7 12. d4 b6 13. Ne5 Bb7 14. e4 Bxe5 15. dxe5 Ng4 16. Nf3 c5 17. exd5 exd5 18. h3 Ngxe5 19. Nxe5 Nxe5 20. cxd5 Qd6 21. Qc3 f6 22. Rad1 Re7 23. f4 Nf7 24. Rfe1 Rbe8 25. Rxe7 Qxe7 26. Bc1 Nd6 27. Bd2 Qf7 28. Qd3 Qg6 29. Qxg6 hxg6,"This is a game between Alekhine,A (as White) and Bogoljubow,E (as Black). Last move played: Black plays Pawn takes on g6",The position is equal,30. b4 ,29... hxg6 30. Kf2 
"Alekhine sacrifices a pawn to launch an attack. His idea is to vacate b4, which allows Bb4. The point of that move is to allow the Bishop to control the square in front of the d5-pawn, covering its advance and making blockading more difficult. Then, if the Knight retreats, the pawn can safely advance one square.",True," The comment provides a reasonable explanation of the tactical idea behind the sacrifice, suggesting control of the square and a potential for future development.",1. Nf3 Nf6 2. c4 e6 3. g3 d5 4. Bg2 Nbd7 5. b3 Bd6 6. O-O O-O 7. Bb2 c6 8. d3 Re8 9. Nbd2 a5 10. a3 Rb8 11. Qc2 Qe7 12. d4 b6 13. Ne5 Bb7 14. e4 Bxe5 15. dxe5 Ng4 16. Nf3 c5 17. exd5 exd5 18. h3 Ngxe5 19. Nxe5 Nxe5 20. cxd5 Qd6 21. Qc3 f6 22. Rad1 Re7 23. f4 Nf7 24. Rfe1 Rbe8 25. Rxe7 Qxe7 26. Bc1 Nd6 27. Bd2 Qf7 28. Qd3 Qg6 29. Qxg6 hxg6 30. Kf2 Ba6 31. Bf3 Kf7 32. b4 cxb4 33. axb4 a4 34. Rc1 Bc4 35. b5,"This is a game between Alekhine,A (as White) and Bogoljubow,E (as Black). Last move played: White plays Pawn to b5",Advantage for Black (eval: -51 centipawns),35... Ne4+ 36. Bxe4 ,35. Bc3 
"Forking the King and dark-squared Bishop, thereby taking the initiative by forcing White's next move.",True, The comment describes a dangerous and illegal move that directly leads to a loss of the initiative.,1. Nf3 Nf6 2. c4 e6 3. g3 d5 4. Bg2 Nbd7 5. b3 Bd6 6. O-O O-O 7. Bb2 c6 8. d3 Re8 9. Nbd2 a5 10. a3 Rb8 11. Qc2 Qe7 12. d4 b6 13. Ne5 Bb7 14. e4 Bxe5 15. dxe5 Ng4 16. Nf3 c5 17. exd5 exd5 18. h3 Ngxe5 19. Nxe5 Nxe5 20. cxd5 Qd6 21. Qc3 f6 22. Rad1 Re7 23. f4 Nf7 24. Rfe1 Rbe8 25. Rxe7 Qxe7 26. Bc1 Nd6 27. Bd2 Qf7 28. Qd3 Qg6 29. Qxg6 hxg6 30. Kf2 Ba6 31. Bf3 Kf7 32. b4 cxb4 33. axb4 a4 34. Rc1 Bc4 35. b5 Ne4+,"This is a game between Alekhine,A (as White) and Bogoljubow,E (as Black). Last move played: Black plays Knight to e4 with check",Advantage for Black (eval: -74 centipawns),36. Bxe4 ,35... Ne4+ 36. Bxe4 
"The d-pawn's defender is gone and White can't save his passed pawn. Meanwhile, Black has his own passed pawn on a4. The tables have turned!",True," The comment accurately describes a critical positional weakness and a potential threat, indicating a mistake.",1. Nf3 Nf6 2. c4 e6 3. g3 d5 4. Bg2 Nbd7 5. b3 Bd6 6. O-O O-O 7. Bb2 c6 8. d3 Re8 9. Nbd2 a5 10. a3 Rb8 11. Qc2 Qe7 12. d4 b6 13. Ne5 Bb7 14. e4 Bxe5 15. dxe5 Ng4 16. Nf3 c5 17. exd5 exd5 18. h3 Ngxe5 19. Nxe5 Nxe5 20. cxd5 Qd6 21. Qc3 f6 22. Rad1 Re7 23. f4 Nf7 24. Rfe1 Rbe8 25. Rxe7 Qxe7 26. Bc1 Nd6 27. Bd2 Qf7 28. Qd3 Qg6 29. Qxg6 hxg6 30. Kf2 Ba6 31. Bf3 Kf7 32. b4 cxb4 33. axb4 a4 34. Rc1 Bc4 35. b5 Ne4+ 36. Bxe4 Rxe4,"This is a game between Alekhine,A (as White) and Bogoljubow,E (as Black). Last move played: Black plays Rook takes on e4",Advantage for Black (eval: -67 centipawns),37. Bb4 ,36... Rxe4 37. Bb4 
"Alekhine has lost his passed pawn, so he just creates another...",True," The comment suggests a potential tactical blunder by creating another pawn, indicating a flawed plan.",1. Nf3 Nf6 2. c4 e6 3. g3 d5 4. Bg2 Nbd7 5. b3 Bd6 6. O-O O-O 7. Bb2 c6 8. d3 Re8 9. Nbd2 a5 10. a3 Rb8 11. Qc2 Qe7 12. d4 b6 13. Ne5 Bb7 14. e4 Bxe5 15. dxe5 Ng4 16. Nf3 c5 17. exd5 exd5 18. h3 Ngxe5 19. Nxe5 Nxe5 20. cxd5 Qd6 21. Qc3 f6 22. Rad1 Re7 23. f4 Nf7 24. Rfe1 Rbe8 25. Rxe7 Qxe7 26. Bc1 Nd6 27. Bd2 Qf7 28. Qd3 Qg6 29. Qxg6 hxg6 30. Kf2 Ba6 31. Bf3 Kf7 32. b4 cxb4 33. axb4 a4 34. Rc1 Bc4 35. b5 Ne4+ 36. Bxe4 Rxe4 37. Be3 Bxd5 38. Bxb6,"This is a game between Alekhine,A (as White) and Bogoljubow,E (as Black). Last move played: White plays Bishop takes on b6",Advantage for Black (eval: -88 centipawns),38... a3 39. Rc7+ Kg8 40. Ba5 a2 41. Bc3 Rb4 42. Rc8+ Kh7 43. Rc7 Kh8 44. Rc8+ Bg8 45. Ra8 Rb3 46. Ba1 Rxb5 47. h4 Rb1 48. Bc3 Rh1 49. Bd4 Rh2+ 50. Ke3 Rg2 51. Ba1 ,38. Rd1 Bb3 
"...which is promptly attacked! Unfortunately, Bogo should have played ...a3 and backed the pawn up with the Rook when necessary. In the race to promote, his pawn had an extra tempo on White's as the White Bishop has to get out of the way of the b-pawn's advance.",True," The comment provides specific reasoning for the mistake, suggesting a missed opportunity to improve the position.",1. Nf3 Nf6 2. c4 e6 3. g3 d5 4. Bg2 Nbd7 5. b3 Bd6 6. O-O O-O 7. Bb2 c6 8. d3 Re8 9. Nbd2 a5 10. a3 Rb8 11. Qc2 Qe7 12. d4 b6 13. Ne5 Bb7 14. e4 Bxe5 15. dxe5 Ng4 16. Nf3 c5 17. exd5 exd5 18. h3 Ngxe5 19. Nxe5 Nxe5 20. cxd5 Qd6 21. Qc3 f6 22. Rad1 Re7 23. f4 Nf7 24. Rfe1 Rbe8 25. Rxe7 Qxe7 26. Bc1 Nd6 27. Bd2 Qf7 28. Qd3 Qg6 29. Qxg6 hxg6 30. Kf2 Ba6 31. Bf3 Kf7 32. b4 cxb4 33. axb4 a4 34. Rc1 Bc4 35. b5 Ne4+ 36. Bxe4 Rxe4 37. Be3 Bxd5 38. Bxb6 Rb4,"This is a game between Alekhine,A (as White) and Bogoljubow,E (as Black). Last move played: Black plays Rook to b4",Slight advantage for Black (eval: -28 centipawns),39. Rc7+ Kg8 ,38... a3 39. Rc7+ Kg8 40. Ba5 a2 41. Bc3 Rb4 42. Rc8+ Kh7 43. Rc7 Kh8 44. Rc8+ Bg8 45. Ra8 Rb3 46. Ba1 Rxb5 47. h4 Rb1 48. Bc3 Rh1 49. Bd4 Rh2+ 50. Ke3 Rg2 51. Ba1 
...but Alekhine stops it cold.,True,". The comment suggests a sudden and decisive halt, indicating a flaw in the opponent's strategy, which is a clear indication of a mistake.",1. Nf3 Nf6 2. c4 e6 3. g3 d5 4. Bg2 Nbd7 5. b3 Bd6 6. O-O O-O 7. Bb2 c6 8. d3 Re8 9. Nbd2 a5 10. a3 Rb8 11. Qc2 Qe7 12. d4 b6 13. Ne5 Bb7 14. e4 Bxe5 15. dxe5 Ng4 16. Nf3 c5 17. exd5 exd5 18. h3 Ngxe5 19. Nxe5 Nxe5 20. cxd5 Qd6 21. Qc3 f6 22. Rad1 Re7 23. f4 Nf7 24. Rfe1 Rbe8 25. Rxe7 Qxe7 26. Bc1 Nd6 27. Bd2 Qf7 28. Qd3 Qg6 29. Qxg6 hxg6 30. Kf2 Ba6 31. Bf3 Kf7 32. b4 cxb4 33. axb4 a4 34. Rc1 Bc4 35. b5 Ne4+ 36. Bxe4 Rxe4 37. Be3 Bxd5 38. Bxb6 Rb4 39. Rc7+ Kg8 40. Rc5 Bc4 41. Ba5 Rb2+ 42. Ke3 Bxb5 43. Bc3 Rb3 44. Kd2 Bd7 45. g4 Rb7 46. Ra5,"This is a game between Alekhine,A (as White) and Bogoljubow,E (as Black). Last move played: White plays Rook to a5",The position is equal,46... Kf7 47. g5 ,46. Ra5 Kf7 47. g5 Bc6 48. gxf6 gxf6 49. Ra6 Rd7+ 50. Kc1 Rc7 51. Kd2 Ke6 52. Kd3 Kf5 53. Ra5+ Kxf4 54. Bxf6 Rf7 55. Be5+ Kf3 56. Kc4 Rf5 57. Bc3 Bd5+ 58. Kb4 g5 59. Kxa4 Rf4+ 60. Kb5 
"This position is a great illustration of why endgames with Bishops of opposite colors are usually drawn, even with other pieces present on the board. All one has to do to neutralize the enemy Bishop is place one pieces and pawns on the opposite colored squares from the ones on which the Bishop operates. This means that the Bishop has no targets to attack; it becomes basically a useless appendage. This position is a perfect ""snapshot"" of this technique in action.",True," The comment accurately describes a common mistake in endgames, highlighting the strategic disadvantage of a Bishop with limited targets.",1. Nf3 Nf6 2. c4 e6 3. g3 d5 4. Bg2 Nbd7 5. b3 Bd6 6. O-O O-O 7. Bb2 c6 8. d3 Re8 9. Nbd2 a5 10. a3 Rb8 11. Qc2 Qe7 12. d4 b6 13. Ne5 Bb7 14. e4 Bxe5 15. dxe5 Ng4 16. Nf3 c5 17. exd5 exd5 18. h3 Ngxe5 19. Nxe5 Nxe5 20. cxd5 Qd6 21. Qc3 f6 22. Rad1 Re7 23. f4 Nf7 24. Rfe1 Rbe8 25. Rxe7 Qxe7 26. Bc1 Nd6 27. Bd2 Qf7 28. Qd3 Qg6 29. Qxg6 hxg6 30. Kf2 Ba6 31. Bf3 Kf7 32. b4 cxb4 33. axb4 a4 34. Rc1 Bc4 35. b5 Ne4+ 36. Bxe4 Rxe4 37. Be3 Bxd5 38. Bxb6 Rb4 39. Rc7+ Kg8 40. Rc5 Bc4 41. Ba5 Rb2+ 42. Ke3 Bxb5 43. Bc3 Rb3 44. Kd2 Bd7 45. g4 Rb7 46. Ra5 Kf7 47. g5 Rb6 48. h4 Rd6+ 49. Ke3 Re6+ 50. Kd3 Rd6+ 51. Ke3 Bf5 52. Ra7+ Ke6 53. Bd4 Bc2 54. Rc7 Bb1 55. Rb7 Bf5 56. Rxg7 fxg5 57. hxg5 Kd5 58. Ra7 Re6+ 59. Be5,"This is a game between Alekhine,A (as White) and Bogoljubow,E (as Black). Last move played: White plays Bishop to e5",The position is equal,59... Bc2 60. Rd7+ Kc5 61. Rc7+ Rc6 62. Rxc6+ Kxc6 63. Kd4 a3 64. Kc3 Bb1 65. Kb3 a2 66. Kb2 Kd5 67. Ka3 Ke4 68. Kb3 Kf5 69. Kb2 Ke4 ,59. Be5 Bc2 60. Rd7+ Kc5 61. Rc7+ Rc6 62. Rxc6+ Kxc6 63. Kd2 Bb3 64. Kc3 Kc5 65. Kb2 Bf7 66. Ka3 Be8 67. Bc7 Kd5 68. Kb4 Kc6 69. Be5 Kd5 
"Forcing 61...Rc6 62.Rxc6+ Kxc6 with a dead draw. The White Bishop can't be dislodged from e5 and it controls the a-pawn's promotion square. Likewise, White can make no headway on the Kingside, as the Black Bishop controls f5 and prevents the pawn advance f4-f5. The players agree to a truce.",True," The comment provides a detailed analysis of why the move is considered a mistake, outlining strategic weaknesses and resulting in a draw.",1. Nf3 Nf6 2. c4 e6 3. g3 d5 4. Bg2 Nbd7 5. b3 Bd6 6. O-O O-O 7. Bb2 c6 8. d3 Re8 9. Nbd2 a5 10. a3 Rb8 11. Qc2 Qe7 12. d4 b6 13. Ne5 Bb7 14. e4 Bxe5 15. dxe5 Ng4 16. Nf3 c5 17. exd5 exd5 18. h3 Ngxe5 19. Nxe5 Nxe5 20. cxd5 Qd6 21. Qc3 f6 22. Rad1 Re7 23. f4 Nf7 24. Rfe1 Rbe8 25. Rxe7 Qxe7 26. Bc1 Nd6 27. Bd2 Qf7 28. Qd3 Qg6 29. Qxg6 hxg6 30. Kf2 Ba6 31. Bf3 Kf7 32. b4 cxb4 33. axb4 a4 34. Rc1 Bc4 35. b5 Ne4+ 36. Bxe4 Rxe4 37. Be3 Bxd5 38. Bxb6 Rb4 39. Rc7+ Kg8 40. Rc5 Bc4 41. Ba5 Rb2+ 42. Ke3 Bxb5 43. Bc3 Rb3 44. Kd2 Bd7 45. g4 Rb7 46. Ra5 Kf7 47. g5 Rb6 48. h4 Rd6+ 49. Ke3 Re6+ 50. Kd3 Rd6+ 51. Ke3 Bf5 52. Ra7+ Ke6 53. Bd4 Bc2 54. Rc7 Bb1 55. Rb7 Bf5 56. Rxg7 fxg5 57. hxg5 Kd5 58. Ra7 Re6+ 59. Be5 Bc2 60. Rd7+ Kc5 61. Rc7+,"This is a game between Alekhine,A (as White) and Bogoljubow,E (as Black). Last move played: White plays Rook to c7 with check",The position is equal,61... Rc6 62. Rxc6+ Kxc6 63. Kd2 Bf5 64. Kc3 Kb5 65. Bf6 Kc5 66. Kb2 Bd7 67. Ka3 Kd5 68. Be5 Ke4 69. Bb8 Kd5 70. Kb4 Be8 71. Bc7 Kc6 72. Be5 Kd5 ,61. Rc7+ Rc6 62. Rxc6+ Kxc6 63. Kd2 Bb1 64. Kc1 Bf5 65. Kb2 Kd5 66. Ka3 Bd7 67. Kb4 Bc6 68. Bc7 Be8 69. Ka3 Bd7 70. Be5 Ke6 71. Bb8 Kf7 72. Kb2 Kg8 73. Be5 Be8 74. Ka3 Kf7 75. Bf6 
"Alekhine was concerned about the threat of ...Bxd5. But Black had no intention of playing it, due to the reply Rad1 pinning the Bishop to the Queen (and later winning material).",True," The comment suggests a strategic reason for the move, indicating a conscious attempt to mitigate a pawn blockage.",1. Nf3 Nf6 2. c4 e6 3. g3 d5 4. Bg2 Nbd7 5. b3 Bd6 6. O-O O-O 7. Bb2 c6 8. d3 Re8 9. Nbd2 a5 10. a3 Rb8 11. Qc2 Qe7 12. d4 b6 13. Ne5 Bb7 14. e4 Bxe5 15. dxe5 Ng4 16. Nf3 c5 17. exd5 exd5 18. h3 Ngxe5 19. Nxe5 Nxe5 20. cxd5 Qd6 21. Qc3 f6 22. Rad1,"This is a game between Alekhine,A (as White) and Bogoljubow,E (as Black). Last move played: White plays Rook to d1",Slight advantage for White (eval: 26 centipawns),22... Bc8 ,22. Rfe1 
Alekhine swaps Queens before his opponent has the chance to crank up the pressure on the Kingside with ...Nf5.,True," The comment describes a potential tactical error, suggesting the player was attempting an unsound attack.",1. Nf3 Nf6 2. c4 e6 3. g3 d5 4. Bg2 Nbd7 5. b3 Bd6 6. O-O O-O 7. Bb2 c6 8. d3 Re8 9. Nbd2 a5 10. a3 Rb8 11. Qc2 Qe7 12. d4 b6 13. Ne5 Bb7 14. e4 Bxe5 15. dxe5 Ng4 16. Nf3 c5 17. exd5 exd5 18. h3 Ngxe5 19. Nxe5 Nxe5 20. cxd5 Qd6 21. Qc3 f6 22. Rad1 Re7 23. f4 Nf7 24. Rfe1 Rbe8 25. Rxe7 Qxe7 26. Bc1 Nd6 27. Bd2 Qf7 28. Qd3 Qg6 29. Qxg6,"This is a game between Alekhine,A (as White) and Bogoljubow,E (as Black). Last move played: White plays Queen takes on g6",Slight advantage for Black (eval: -33 centipawns),29... hxg6 30. Kf2 ,29. f5 Qxf5 30. Qxf5 Nxf5 31. Bf4 Kf8 32. d6 Bxg2 33. d7 Rd8 34. Bc7 Ke7 35. Re1+ Kxd7 36. Bxd8 Kxd8 37. Kxg2 Nd4 38. b4 axb4 39. axb4 Nc2 40. Re6 Kd7 41. Rxb6 cxb4 42. Kf2 Kc7 43. Rb5 Kc6 44. Rb8 Kc7 45. Rb5 
"Alekhine plays the ""hypermodern"" Reti Opening (named for fellow competitor Richard Reti). He'll allow Black's pawns to occupy the center, but then exert his own influence over the center by attacking Black's pawns with his flank pawns, Bishops, and Knights.",True," The comment describes a strategic maneuver, not a mistake, suggesting a calculated approach rather than a flaw.",1. Nf3 Nf6 2. c4 e6 3. g3 d5 4. Bg2,"This is a game between Alekhine,A (as White) and Bogoljubow,E (as Black). Last move played: White plays Bishop to g2",The position is equal,4... d4 5. e3 c5 6. d3 Nc6 7. O-O Bd6 8. exd4 cxd4 9. a3 a5 10. Bg5 h6 11. Bxf6 Qxf6 12. Nbd2 Qe7 13. Rc1 Bd7 14. Nb3 e5 15. Re1 Be6 16. c5 ,4. d4 Be7 5. Bg2 O-O 6. O-O dxc4 7. Qc2 a6 8. a4 Bd7 9. Qxc4 Bc6 10. Bf4 a5 11. Nc3 Na6 12. Rac1 Bd5 13. Qd3 Nb4 14. Qb1 Bxf3 15. Bxf3 c6 
Now the Knight is free to move away without the threat of Qxg7#.,True," The comment provides a clear explanation of the tactical threat posed by the Black knight's move, highlighting a vulnerability and a potential tactical disaster.",1. Nf3 Nf6 2. c4 e6 3. g3 d5 4. Bg2 Nbd7 5. b3 Bd6 6. O-O O-O 7. Bb2 c6 8. d3 Re8 9. Nbd2 a5 10. a3 Rb8 11. Qc2 Qe7 12. d4 b6 13. Ne5 Bb7 14. e4 Bxe5 15. dxe5 Ng4 16. Nf3 c5 17. exd5 exd5 18. h3 Ngxe5 19. Nxe5 Nxe5 20. cxd5 Qd6 21. Qc3 f6,"This is a game between Alekhine,A (as White) and Bogoljubow,E (as Black). Last move played: Black plays Pawn to f6",Slight advantage for White (eval: 43 centipawns),22. Rfe1 ,21... f6 
