comment,good,reasoning,moves,context,engine_eval,engine_best_line,engine_best_alternative
(9....c5 10. N4b3 is good for White because of Nxc5 and cxd5 threats.),True," The comment offers a potential explanation for the mistake, suggesting a strategic advantage gained by White.",1. g3 e5 2. Nf3 e4 3. Nd4 d5 4. d3 exd3 5. Qxd3 Nf6 6. Bg2 Bb4+ 7. Bd2 Bxd2+ 8. Nxd2 O-O 9. c4 Na6,This is a game between Reti (as White) and Alekhine (as Black). Last move played: Black plays Knight to a6,Advantage for White (eval: 51 centipawns),10. cxd5 Nxd5 11. O-O c5 12. N4b3 Be6 13. a3 Rc8 14. Rad1 Rc7 15. Qc2 b5 16. Nf3 Qe7 17. Na5 Nb6 18. Rd2 h6 19. Rfd1 Re8 20. Rd6 Nb8 21. Ne5 c4 ,9... c5 10. Nc2 Be6 11. Rd1 Nc6 12. cxd5 Nxd5 13. Nb3 Ndb4 14. Nxb4 Nxb4 15. Qc3 Nxa2 16. Rxd8 Nxc3 17. Rxa8 Rxa8 18. Nxc5 Bd5 19. Bxd5 Nxd5 20. Kd2 b6 21. Nd3 Rd8 22. Ra1 a5 23. Rc1 Kf8 24. Rc6 Ke7 25. Rc4 f5 
Taking the pawn is always bad because 17. Bxh3 Qxh3 18. Nxb72 Ng4 19. Nf3 Nde3 $3 20. Fxe3 Nxe3 21. Qxf7+ Kh8! 22. Nh4 Rf8 and threat on 'f1' is deadly.,True," The comment describes a dangerous threat, suggesting a significant positional weakness due to the pawn sacrifice.",1. g3 e5 2. Nf3 e4 3. Nd4 d5 4. d3 exd3 5. Qxd3 Nf6 6. Bg2 Bb4+ 7. Bd2 Bxd2+ 8. Nxd2 O-O 9. c4 Na6 10. cxd5 Nb4 11. Qc4 Nbxd5 12. N2b3 c6 13. O-O Re8 14. Rfd1 Bg4 15. Rd2 Qc8 16. Nc5 Bh3 17. Bf3,This is a game between Reti (as White) and Alekhine (as Black). Last move played: White plays Bishop to f3,Slight advantage for White (eval: 36 centipawns),17... Nb6 18. Qb3 ,17. Bh1 Nb6 
Keeping an eye on the 'g3' Pawn.,True,". The comment suggests a potential tactical weakness, indicating a misjudgment of the pawn structure.",1. g3 e5 2. Nf3 e4 3. Nd4 d5 4. d3 exd3 5. Qxd3 Nf6 6. Bg2 Bb4+ 7. Bd2 Bxd2+ 8. Nxd2 O-O 9. c4 Na6 10. cxd5 Nb4 11. Qc4 Nbxd5 12. N2b3 c6 13. O-O Re8 14. Rfd1 Bg4 15. Rd2 Qc8 16. Nc5 Bh3 17. Bf3 Bg4 18. Bg2 Bh3 19. Bf3 Bg4 20. Bh1 h5 21. b4 a6 22. Rc1 h4 23. a4 hxg3 24. hxg3 Qc7,This is a game between Reti (as White) and Alekhine (as Black). Last move played: Black plays Queen to c7,Slight advantage for White (eval: 35 centipawns),25. e4 Nb6 ,24... Nb6 
This spectacular move not only stops White's attack but puts him into deep trouble. Of course the Rook can't be taken because of ...Qxg3+ and ...Nxe3. Now serious threat is 27...Rxg3+.,True," The comment accurately describes a problematic situation and suggests a significant threat, indicating a flawed move.",1. g3 e5 2. Nf3 e4 3. Nd4 d5 4. d3 exd3 5. Qxd3 Nf6 6. Bg2 Bb4+ 7. Bd2 Bxd2+ 8. Nxd2 O-O 9. c4 Na6 10. cxd5 Nb4 11. Qc4 Nbxd5 12. N2b3 c6 13. O-O Re8 14. Rfd1 Bg4 15. Rd2 Qc8 16. Nc5 Bh3 17. Bf3 Bg4 18. Bg2 Bh3 19. Bf3 Bg4 20. Bh1 h5 21. b4 a6 22. Rc1 h4 23. a4 hxg3 24. hxg3 Qc7 25. b5 axb5 26. axb5 Re3,This is a game between Reti (as White) and Alekhine (as Black). Last move played: Black plays Rook to e3,Slight advantage for White (eval: 29 centipawns),27. Bf3 Bxf3 ,26... Re3 
(31. Kf1 Nxg3+ 32. fg Bf3 33. Bxf3 Rxf3+ 34. Kg2 Raa3 35. Rd8+ Kh7 36. Rh1+ Kg6-+),True," The comment describes a sequence of moves that leads to a weakening of the king's position, indicating a mistake.",1. g3 e5 2. Nf3 e4 3. Nd4 d5 4. d3 exd3 5. Qxd3 Nf6 6. Bg2 Bb4+ 7. Bd2 Bxd2+ 8. Nxd2 O-O 9. c4 Na6 10. cxd5 Nb4 11. Qc4 Nbxd5 12. N2b3 c6 13. O-O Re8 14. Rfd1 Bg4 15. Rd2 Qc8 16. Nc5 Bh3 17. Bf3 Bg4 18. Bg2 Bh3 19. Bf3 Bg4 20. Bh1 h5 21. b4 a6 22. Rc1 h4 23. a4 hxg3 24. hxg3 Qc7 25. b5 axb5 26. axb5 Re3 27. Nf3 cxb5 28. Qxb5 Nc3 29. Qxb7 Qxb7 30. Nxb7 Nxe2+ 31. Kh2,This is a game between Reti (as White) and Alekhine (as Black). Last move played: White plays King to h2,Large advantage for Black (eval: -254 centipawns),31... Ne4 32. Rc4 Nxf2 33. Ng5 Nxh1 34. Ra4 Rf8 35. Rxg4 Nhxg3 36. Rd7 Nf5 37. Nd8 Nh6 38. Re4 Rxe4 39. Nxe4 Ng4+ 40. Kg2 Ne5 41. Rd6 Re8 42. Kf2 Nf4 43. Nc3 Nfd3+ 44. Kg2 Nc5 45. Kg3 Nc4 ,31. Kh2 Ne4 32. Rc4 Nxf2 33. Ng5 Nxh1 34. Ra4 Rf8 35. Rxg4 Nhxg3 36. Rd7 Nf5 37. Ne4 Ra8 38. Nf6+ Kf8 39. Nd5 Re5 40. Nd8 Nh6 41. Rc4 g5 42. Rcc7 Rf5 43. Ne6+ fxe6 44. Rh7 exd5 45. Rxh6 Rf2+ 46. Kh3 
The beginning of a new combination aiming at the 'b7' Knight after a series of 12 forced moves.,True," The comment suggests a flawed strategic plan based on a forced sequence, indicating a mistake.",1. g3 e5 2. Nf3 e4 3. Nd4 d5 4. d3 exd3 5. Qxd3 Nf6 6. Bg2 Bb4+ 7. Bd2 Bxd2+ 8. Nxd2 O-O 9. c4 Na6 10. cxd5 Nb4 11. Qc4 Nbxd5 12. N2b3 c6 13. O-O Re8 14. Rfd1 Bg4 15. Rd2 Qc8 16. Nc5 Bh3 17. Bf3 Bg4 18. Bg2 Bh3 19. Bf3 Bg4 20. Bh1 h5 21. b4 a6 22. Rc1 h4 23. a4 hxg3 24. hxg3 Qc7 25. b5 axb5 26. axb5 Re3 27. Nf3 cxb5 28. Qxb5 Nc3 29. Qxb7 Qxb7 30. Nxb7 Nxe2+ 31. Kh2 Ne4,This is a game between Reti (as White) and Alekhine (as Black). Last move played: Black plays Knight to e4,Large advantage for Black (eval: -257 centipawns),32. Rc4 Nxf2 33. Ng5 Nxh1 34. Rxg4 Nhxg3 35. Rd7 Nf5 36. Ra4 Rf8 37. Nd8 f6 38. Nge6 Re8 39. Nxg7 Nxg7 40. Rb4 R3e7 41. Rxe7 Rxe7 42. Rb7 Rxb7 43. Nxb7 ,31... Ne4 32. Rc4 Nxf2 33. Ng5 Nxh1 34. Ra4 Rf8 35. Rxg4 Nhxg3 36. Rd7 Nf5 37. Nd8 Nh6 38. Re4 Rxe4 39. Nxe4 Ng4+ 40. Kg2 Ne5 41. Rd6 Re8 42. Kf2 Nf4 43. Nc3 Nfd3+ 44. Kg2 Nc5 45. Kg3 Nc4 
Now Black Knight will occupy 'g4'.,True,". The comment suggests a potential line of play that was incorrect, indicating a flawed strategic consideration.",1. g3 e5 2. Nf3 e4 3. Nd4 d5 4. d3 exd3 5. Qxd3 Nf6 6. Bg2 Bb4+ 7. Bd2 Bxd2+ 8. Nxd2 O-O 9. c4 Na6 10. cxd5 Nb4 11. Qc4 Nbxd5 12. N2b3 c6 13. O-O Re8 14. Rfd1 Bg4 15. Rd2 Qc8 16. Nc5 Bh3 17. Bf3 Bg4 18. Bg2 Bh3 19. Bf3 Bg4 20. Bh1 h5 21. b4 a6 22. Rc1 h4 23. a4 hxg3 24. hxg3 Qc7 25. b5 axb5 26. axb5 Re3 27. Nf3 cxb5 28. Qxb5 Nc3 29. Qxb7 Qxb7 30. Nxb7 Nxe2+ 31. Kh2 Ne4 32. Rc4 Nxf2 33. Bg2 Be6,This is a game between Reti (as White) and Alekhine (as Black). Last move played: Black plays Bishop to e6,Large advantage for Black (eval: -301 centipawns),34. Rb4 Ng4+ 35. Kh3 Ne5+ 36. Kh2 Rxf3 37. Rxe2 Ng4+ 38. Rxg4 Bxg4 39. Bxf3 Bxf3 40. Re7 Ra1 41. g4 Ra7 42. Re8+ Kh7 43. Nd6 Bxg4 44. Re1 ,33... Ne4 34. Rdc2 Bxf3 35. Bxf3 Rxf3 36. Rxe2 Nxg3 37. Rec2 Raa3 38. Rh4 g6 39. Nd6 Nh5 40. Rd2 Rf6 41. Rb4 Ra7 42. Rh4 Re6 43. Rhd4 Rae7 44. Kg2 Re5 45. Rf2 Kg7 
Winning a piece.,True," The comment suggests the player made a move that results in a winning position, indicating a flaw in the evaluation.",1. g3 e5 2. Nf3 e4 3. Nd4 d5 4. d3 exd3 5. Qxd3 Nf6 6. Bg2 Bb4+ 7. Bd2 Bxd2+ 8. Nxd2 O-O 9. c4 Na6 10. cxd5 Nb4 11. Qc4 Nbxd5 12. N2b3 c6 13. O-O Re8 14. Rfd1 Bg4 15. Rd2 Qc8 16. Nc5 Bh3 17. Bf3 Bg4 18. Bg2 Bh3 19. Bf3 Bg4 20. Bh1 h5 21. b4 a6 22. Rc1 h4 23. a4 hxg3 24. hxg3 Qc7 25. b5 axb5 26. axb5 Re3 27. Nf3 cxb5 28. Qxb5 Nc3 29. Qxb7 Qxb7 30. Nxb7 Nxe2+ 31. Kh2 Ne4 32. Rc4 Nxf2 33. Bg2 Be6 34. Rcc2 Ng4+ 35. Kh3 Ne5+ 36. Kh2 Rxf3 37. Rxe2 Ng4+ 38. Kh3 Ne3+ 39. Kh2 Nxc2 40. Bxf3 Nd4 41. Rf2 Nxf3+ 42. Rxf3 Bd5,This is a game between Reti (as White) and Alekhine (as Black). Last move played: Black plays Bishop to d5,Large advantage for Black (eval: -513 centipawns),43. Rd3 Bxb7 44. Kg1 Be4 45. Rd2 Bf5 46. Kf2 Be6 47. Rd6 Kh7 48. Rd4 g5 49. g4 Ra2+ 50. Kf3 Rc2 51. Ra4 Rc4 52. Ra6 Bxg4+ 53. Kg3 Be6 54. Ra5 Kg6 55. Ra6 Rh4 56. Kf2 Kh7 57. Kg1 Rg4+ 58. Kf2 Rc4 ,42... Ra2+ 43. Kg1 Bd5 44. Rd3 Bxb7 45. Rd8+ Kh7 46. Rd7 Rg2+ 47. Kf1 Rxg3 48. Rxb7 f5 49. Ra7 Rb3 50. Ra2 Kg6 51. Rg2+ Kf6 52. Ra2 g6 53. Kf2 Kg5 54. Kg2 Kg4 55. Kh2 Kh4 56. Ra4+ Kg5 57. Ra2 Kh6 58. Kg1 Kh5 59. Kf2 g5 60. Ra5 
Alekhine's defence with reversed colours against Alekhine! Reti never repeated this experiment.,True," The comment indicates a specific, unconventional move that was considered a mistake by Alekhine, suggesting a flawed strategic approach.",1. g3 e5 2. Nf3,This is a game between Reti (as White) and Alekhine (as Black). Last move played: White plays Knight to f3,Slight advantage for Black (eval: -32 centipawns),2... e4 3. Nh4 d5 4. d3 f5 5. Bh3 Qf6 6. Nc3 Bb4 7. dxe4 dxe4 8. Bd2 Ne7 9. Nb5 Bxd2+ 10. Qxd2 Na6 11. Qd4 O-O 12. Qxf6 Rxf6 13. Bf1 Bd7 14. Nc3 Rd6 15. Rd1 Nc5 16. Rxd6 cxd6 ,2. c4 Nf6 
(9....c5 10. N4b3 is good for White because of Nxc5 and cxd5 threats.),True," The comment highlights a potential flaw in Reti's choice, suggesting a suboptimal option.",1. g3 e5 2. Nf3 e4 3. Nd4 d5 4. d3 exd3 5. Qxd3 Nf6 6. Bg2 Bb4+ 7. Bd2 Bxd2+ 8. Nxd2 O-O 9. c4 Na6,This is a game between Reti (as White) and Alekhine (as Black). Last move played: Black plays Knight to a6,Advantage for White (eval: 51 centipawns),10. cxd5 Nxd5 11. O-O c5 12. N4b3 Be6 13. a3 Rc8 14. Rad1 Rc7 15. Qc2 b5 16. Nf3 Qe7 17. Na5 Nb6 18. Rd2 h6 19. Rfd1 Re8 20. Rd6 Nb8 21. Ne5 c4 ,9... c5 10. Nc2 Be6 11. Rd1 Nc6 12. cxd5 Nxd5 13. Nb3 Ndb4 14. Nxb4 Nxb4 15. Qc3 Nxa2 16. Rxd8 Nxc3 17. Rxa8 Rxa8 18. Nxc5 Bd5 19. Bxd5 Nxd5 20. Kd2 b6 21. Nd3 Rd8 22. Ra1 a5 23. Rc1 Kf8 24. Rc6 Ke7 25. Rc4 f5 
