comment,good,reasoning,moves,context,engine_eval,engine_best_line,engine_best_alternative
"This is an interesting matchup because Ponomariov was and Karjakin is now the youngest GM in the world, and they come from the same chess club in the Ukraine! They must be feeding the youngsters some kind of super-Wheaties.",True," The comment provides a potential reason for the mistake, suggesting a strategic mismatch that might have led to a suboptimal move.",1. e4 c5,"This is a game between Ponomariov, Ruslan (as White) and Karjakin, Sergey (as Black). Last move played: Black plays Pawn to c5",Slight advantage for White (eval: 34 centipawns),2. Nf3 ,1... e5 2. Nf3 Nc6 3. d4 exd4 4. Nxd4 Bc5 5. Nb3 Bb6 6. a4 Qh4 7. Qf3 a5 8. g3 Qf6 9. Qe2 Nge7 10. Nc3 
"This move was played by the US GM Robert Byrne, but not really popularized until several British GMs began to play it. Now it's known as the English Attack.",True," The comment provides context about the move's historical significance and popularity, suggesting a potential error in the move's strategic value.",1. e4 c5 2. Nf3 d6 3. d4 cxd4 4. Nxd4 Nf6 5. Nc3 a6 6. Be3,"This is a game between Ponomariov, Ruslan (as White) and Karjakin, Sergey (as Black). Last move played: White plays Bishop to e3",Slight advantage for White (eval: 42 centipawns),6... e5 7. Nb3 ,6. Bg5 e6 
6...e6 is also quite common.,True," The comment suggests a possible overlooked tactical variation, indicating a potential error in the player's assessment.",1. e4 c5 2. Nf3 d6 3. d4 cxd4 4. Nxd4 Nf6 5. Nc3 a6 6. Be3 e5,"This is a game between Ponomariov, Ruslan (as White) and Karjakin, Sergey (as Black). Last move played: Black plays Pawn to e5",Slight advantage for White (eval: 46 centipawns),7. Nb3 ,6... e5 7. Nb3 
Black doesn't fear the backward Pd6 and the weak square at d5 if his pieces coordinate to control d-file squares. The dark-square pawns restrain Nb3 and Be3 pretty well and the Nf6 & Be6 contest White's control of e4 & d5.,True," The comment provides a potential explanation for the mistake, suggesting coordination and pawn structure are key to mitigating White’s advantage.",1. e4 c5 2. Nf3 d6 3. d4 cxd4 4. Nxd4 Nf6 5. Nc3 a6 6. Be3 e5 7. Nb3 Be6,"This is a game between Ponomariov, Ruslan (as White) and Karjakin, Sergey (as Black). Last move played: Black plays Bishop to e6",Slight advantage for White (eval: 33 centipawns),8. Qd2 Nbd7 ,7... Be6 
"I think he must be considering f3-f4 to threaten Ph5 and to open the position while Ke8 isn't as safe as he would normally be. Or, he's still just preparing g2-g4-g5.",True," The comment suggests a potential tactical threat and a preparatory move, indicating a flawed assessment of the position’s security.",1. e4 c5 2. Nf3 d6 3. d4 cxd4 4. Nxd4 Nf6 5. Nc3 a6 6. Be3 e5 7. Nb3 Be6 8. f3 Be7 9. Qd2 h5 10. Be2,"This is a game between Ponomariov, Ruslan (as White) and Karjakin, Sergey (as Black). Last move played: White plays Bishop to e2",Advantage for White (eval: 52 centipawns),10... O-O ,10. Be2 Qc7 11. Nd5 Bxd5 12. exd5 O-O 13. O-O a5 14. a4 Nbd7 15. c4 b6 16. Rae1 Rfb8 17. g4 Nc5 18. Nxc5 bxc5 19. g5 Nh7 
"It's unclear how well Bf5 coordinates with the other pieces in this position, but retaining the two bishops appeals to many players.",True," The comment suggests a potential mismatch in piece coordination, indicating a flaw in the move.",1. e4 c5 2. Nf3 d6 3. d4 cxd4 4. Nxd4 Nf6 5. Nc3 a6 6. Be3 e5 7. Nb3 Be6 8. f3 Be7 9. Qd2 h5 10. Be2 Nbd7 11. Nd5 Nxd5 12. exd5 Bf5,"This is a game between Ponomariov, Ruslan (as White) and Karjakin, Sergey (as Black). Last move played: Black plays Bishop to f5",Advantage for White (eval: 56 centipawns),13. O-O ,12... Bf5 13. O-O 
"He might have it in mind to play ...Rf8-c8 and ...Qd8, but it's usually a bad idea to commit the queen to one side of the board or the other before absolutely necessary. Pd5 & Pd6 help to divide the board in two and the player who can switch from one side to the other quickly has some advantage.",True," The comment offers a valid strategic warning about queen safety and pawn structure, suggesting a potential vulnerability.",1. e4 c5 2. Nf3 d6 3. d4 cxd4 4. Nxd4 Nf6 5. Nc3 a6 6. Be3 e5 7. Nb3 Be6 8. f3 Be7 9. Qd2 h5 10. Be2 Nbd7 11. Nd5 Nxd5 12. exd5 Bf5 13. O-O O-O 14. c4 Qc7,"This is a game between Ponomariov, Ruslan (as White) and Karjakin, Sergey (as Black). Last move played: Black plays Queen to c7",Advantage for White (eval: 71 centipawns),15. Na5 ,14... a5 15. f4 exf4 16. Bxf4 Bg6 17. Bd3 Qb6+ 18. Be3 Qb4 19. Bxg6 fxg6 20. Rxf8+ Kxf8 21. Qc2 Bf6 22. Rf1 Kg8 23. h3 Qa4 24. Bd4 Bxd4+ 25. Nxd4 Qxc2 26. Nxc2 Re8 27. Nd4 Re4 
"This simplification doesn't end Black's difficulties (White still has the queen-side pawn majority) , but it eases his cramp so the remaining pieces should be able to maneuver without difficulty.",True," The comment suggests the simplification hinders Black’s position, implying a flawed move.",1. e4 c5 2. Nf3 d6 3. d4 cxd4 4. Nxd4 Nf6 5. Nc3 a6 6. Be3 e5 7. Nb3 Be6 8. f3 Be7 9. Qd2 h5 10. Be2 Nbd7 11. Nd5 Nxd5 12. exd5 Bf5 13. O-O O-O 14. c4 Qc7 15. f4 exf4 16. Bxf4 Bg6 17. Rac1 Qb6+ 18. Be3 Bg5 19. Bxb6 Bxd2 20. Nxd2 Nxb6,"This is a game between Ponomariov, Ruslan (as White) and Karjakin, Sergey (as Black). Last move played: Black plays Knight takes on b6",Slight advantage for White (eval: 22 centipawns),21. Bf3 Nd7 ,20... Nxb6 
"I don't know whether to criticize this or not. It doesn't seem to hurt his position much, but a pawn is a pawn (sometimes) .",True," The comment suggests the move is not significantly detrimental, indicating a potential issue with the player's assessment.",1. e4 c5 2. Nf3 d6 3. d4 cxd4 4. Nxd4 Nf6 5. Nc3 a6 6. Be3 e5 7. Nb3 Be6 8. f3 Be7 9. Qd2 h5 10. Be2 Nbd7 11. Nd5 Nxd5 12. exd5 Bf5 13. O-O O-O 14. c4 Qc7 15. f4 exf4 16. Bxf4 Bg6 17. Rac1 Qb6+ 18. Be3 Bg5 19. Bxb6 Bxd2 20. Nxd2 Nxb6 21. Bf3 Nd7 22. Be4 Ne5 23. Bxg6 Nxg6 24. Ne4 Rad8 25. Ng3 h4 26. Nf5 h3,"This is a game between Ponomariov, Ruslan (as White) and Karjakin, Sergey (as Black). Last move played: Black plays Pawn to h3",Slight advantage for White (eval: 42 centipawns),27. gxh3 Rfe8 28. Rc3 Re2 29. Rb3 b5 30. cxb5 axb5 31. Rxb5 Rc8 32. Ng3 Rec2 33. Rb4 Rd2 34. Ne4 Rxd5 35. Nc3 Rg5+ 36. Kh1 Ra5 37. Ra1 Ne5 38. Rd4 ,26... Rfe8 
"Black has given up a pawn, but he still has the basic elements of a good position: safe king, open lines for his pieces and no more weak pawns than his opponent.",True," The comment identifies a potential weakness in the position, suggesting a strategic mistake, but doesn't explicitly state the move was a mistake.",1. e4 c5 2. Nf3 d6 3. d4 cxd4 4. Nxd4 Nf6 5. Nc3 a6 6. Be3 e5 7. Nb3 Be6 8. f3 Be7 9. Qd2 h5 10. Be2 Nbd7 11. Nd5 Nxd5 12. exd5 Bf5 13. O-O O-O 14. c4 Qc7 15. f4 exf4 16. Bxf4 Bg6 17. Rac1 Qb6+ 18. Be3 Bg5 19. Bxb6 Bxd2 20. Nxd2 Nxb6 21. Bf3 Nd7 22. Be4 Ne5 23. Bxg6 Nxg6 24. Ne4 Rad8 25. Ng3 h4 26. Nf5 h3 27. gxh3 Ne5 28. Rc3 g6 29. Nh6+ Kg7 30. Ng4,"This is a game between Ponomariov, Ruslan (as White) and Karjakin, Sergey (as Black). Last move played: White plays Knight to g4",Slight advantage for Black (eval: -31 centipawns),30... Nd7 31. Rg3 ,30. Ng4 Nd7 
With double rooks neither king will be completely safe and that helps Black maintain a drawn position.,True," The comment identifies a potential flaw in the move's safety, suggesting a strategic disadvantage for Black.",1. e4 c5 2. Nf3 d6 3. d4 cxd4 4. Nxd4 Nf6 5. Nc3 a6 6. Be3 e5 7. Nb3 Be6 8. f3 Be7 9. Qd2 h5 10. Be2 Nbd7 11. Nd5 Nxd5 12. exd5 Bf5 13. O-O O-O 14. c4 Qc7 15. f4 exf4 16. Bxf4 Bg6 17. Rac1 Qb6+ 18. Be3 Bg5 19. Bxb6 Bxd2 20. Nxd2 Nxb6 21. Bf3 Nd7 22. Be4 Ne5 23. Bxg6 Nxg6 24. Ne4 Rad8 25. Ng3 h4 26. Nf5 h3 27. gxh3 Ne5 28. Rc3 g6 29. Nh6+ Kg7 30. Ng4 Rfe8 31. Nf6 Rh8 32. Rb3 Rc8 33. Rxb7 Rxc4 34. Ng4 Nxg4 35. Rfxf7+ Kh6 36. hxg4 Rxg4+,"This is a game between Ponomariov, Ruslan (as White) and Karjakin, Sergey (as Black). Last move played: Black plays Rook takes on g4 with check",The position is equal,37. Kf2 Kg5 38. Rh7 Rxh7 39. Rxh7 Kf6 40. b3 Rd4 41. Ke3 Ke5 42. h4 Kxd5 43. h5 Re4+ 44. Kd3 gxh5 45. Rxh5+ Re5 46. Rxe5+ dxe5 47. b4 e4+ 48. Ke3 Ke5 49. a4 Kf5 50. a5 Ke5 51. b5 ,36... Kg5 37. Rf2 Rxg4+ 38. Rg2 Rc8 39. Rg3 Rc2 40. Rb6 Rxg3+ 41. hxg3 Kg4 42. Rxd6 Kxg3 43. Rxg6+ Kf3 44. Rf6+ Ke3 45. Re6+ Kf3 
a fair result chessically and a great result for Karjakin (!) to draw the FIDE champ,True,". The comment expresses a subjective assessment of the result, suggesting the draw was a significant achievement, potentially implying a strategic error.",1. e4 c5 2. Nf3 d6 3. d4 cxd4 4. Nxd4 Nf6 5. Nc3 a6 6. Be3 e5 7. Nb3 Be6 8. f3 Be7 9. Qd2 h5 10. Be2 Nbd7 11. Nd5 Nxd5 12. exd5 Bf5 13. O-O O-O 14. c4 Qc7 15. f4 exf4 16. Bxf4 Bg6 17. Rac1 Qb6+ 18. Be3 Bg5 19. Bxb6 Bxd2 20. Nxd2 Nxb6 21. Bf3 Nd7 22. Be4 Ne5 23. Bxg6 Nxg6 24. Ne4 Rad8 25. Ng3 h4 26. Nf5 h3 27. gxh3 Ne5 28. Rc3 g6 29. Nh6+ Kg7 30. Ng4 Rfe8 31. Nf6 Rh8 32. Rb3 Rc8 33. Rxb7 Rxc4 34. Ng4 Nxg4 35. Rfxf7+ Kh6 36. hxg4 Rxg4+ 37. Kf2 Kg5 38. Rh7 Rf4+ 39. Ke3 Rhf8 40. Rh3 Re8+ 41. Kd3 Re5 42. Rg3+ Kf6,"This is a game between Ponomariov, Ruslan (as White) and Karjakin, Sergey (as Black). Last move played: Black plays King to f6",The position is equal,43. Rb6 Rxd5+ 44. Kc3 Rc5+ 45. Kd2 Rf2+ 46. Ke3 Rcc2 47. Rxd6+ Ke5 48. Rdxg6 Rce2+ 49. Kd3 Rxb2 50. R3g5+ Kf4 51. h4 Rbd2+ 52. Kc3 Rxa2 53. Rf6+ Ke4 54. Re6+ Kf4 ,42... Kf6 43. Kc3 Rxd5 44. Rb6 Rc5+ 45. Kd2 Rd5+ 46. Kc3 
"This move was played by the US GM Robert Byrne, but not really popularized until several British GMs began to play it. Now it's known as the English Attack.",True," The comment suggests a potential weakness in the move, indicating a possible tactical error.",1. e4 c5 2. Nf3 d6 3. d4 cxd4 4. Nxd4 Nf6 5. Nc3 a6 6. Be3,"This is a game between Ponomariov, Ruslan (as White) and Karjakin, Sergey (as Black). Last move played: White plays Bishop to e3",Slight advantage for White (eval: 42 centipawns),6... e5 7. Nb3 ,6. Bg5 e6 
6...e6 is also quite common.,True," The comment suggests a potential weakness in the opening strategy, indicating a flawed choice.",1. e4 c5 2. Nf3 d6 3. d4 cxd4 4. Nxd4 Nf6 5. Nc3 a6 6. Be3 e5,"This is a game between Ponomariov, Ruslan (as White) and Karjakin, Sergey (as Black). Last move played: Black plays Pawn to e5",Slight advantage for White (eval: 46 centipawns),7. Nb3 ,6... e5 7. Nb3 
The Najdorf Variation prepares ...b5 holds off on moving Pe7 until White shows a bit more of his plan.,True," The comment suggests a potential weakness in the Black's plan, indicating a flaw in their strategic thinking.",1. e4 c5 2. Nf3 d6 3. d4 cxd4 4. Nxd4 Nf6 5. Nc3 a6,"This is a game between Ponomariov, Ruslan (as White) and Karjakin, Sergey (as Black). Last move played: Black plays Pawn to a6",Slight advantage for White (eval: 38 centipawns),6. Bg5 e6 ,5... a6 6. Be3 
The Najdorf Variation prepares ...b5 holds off on moving Pe7 until White shows a bit more of his plan.,True, The comment suggests a suboptimal trade that prevented a crucial pawn advantage.,1. e4 c5 2. Nf3 d6 3. d4 cxd4 4. Nxd4 Nf6 5. Nc3 a6,"This is a game between Ponomariov, Ruslan (as White) and Karjakin, Sergey (as Black). Last move played: Black plays Pawn to a6",Slight advantage for White (eval: 38 centipawns),6. Bg5 e6 ,5... a6 6. Be3 
