comment,good,reasoning,moves,context,engine_eval,engine_best_line,engine_best_alternative
Here Black's prospects lie mainly in his possession of the half-open c-file. His best chance lies in the minority attack comprising the advance of his two Queenside pawns combined with ... Na5-c4. Black's next move is therefore quite understandable; the only query is whether it might not have been more pruden to complete his development first by ... Be7 and ... 0-0,True," The comment offers a potential explanation for the mistake, suggesting a strategic misstep, but lacks sufficient detail to definitively assess the severity of the error.",1. e4 c5 2. Nf3 Nc6 3. d4 cxd4 4. Nxd4 Nf6 5. Nc3 d6 6. Be2 e6 7. O-O a6 8. Be3 Qc7 9. f4,This is a game between Lasker (as White) and Pirc (as Black). Last move played: White plays Pawn to f4,Slight advantage for White (eval: 33 centipawns),9... Be7 10. Kh1 ,9. f4 
White also makes an effort for the iniatitive. In view of his lead in development it is a matter of the greatest importance for him to open the position,True," The comment suggests White is trying to gain an advantage, which is a common mistake in the opening.",1. e4 c5 2. Nf3 Nc6 3. d4 cxd4 4. Nxd4 Nf6 5. Nc3 d6 6. Be2 e6 7. O-O a6 8. Be3 Qc7 9. f4 Na5 10. f5,This is a game between Lasker (as White) and Pirc (as Black). Last move played: White plays Pawn to f5,Advantage for White (eval: 87 centipawns),10... Be7 11. Qd3 O-O 12. g4 h6 13. g5 hxg5 14. Bxg5 Nh7 15. Bxe7 Qxe7 16. Rf4 Nc6 17. Qh3 g5 18. Nxc6 bxc6 19. Rf2 exf5 20. exf5 Rb8 21. Bd3 Rb4 22. Re2 Qa7+ 23. Kh1 ,10. Kh1 Nc4 
When this game was played it was generally held that a backward pawn must be a serious disadvantage. No modern master would have any scruples about playing ... Pe5,True," The comment highlights a common strategic principle that the player overlooked, indicating a flawed assessment of the position.",1. e4 c5 2. Nf3 Nc6 3. d4 cxd4 4. Nxd4 Nf6 5. Nc3 d6 6. Be2 e6 7. O-O a6 8. Be3 Qc7 9. f4 Na5 10. f5 Nc4,This is a game between Lasker (as White) and Pirc (as Black). Last move played: Black plays Knight to c4,Large advantage for White (eval: 139 centipawns),11. Bxc4 Qxc4 12. fxe6 Bxe6 13. Nd5 Bxd5 14. exd5 O-O-O 15. Rf3 h5 16. h3 Re8 17. b3 Qxd5 18. c4 Qe5 19. Bf4 Qc5 20. b4 Qb6 21. Rc1 g5 22. Bxg5 Ne4 ,10... Be7 11. Qd3 O-O 12. g4 h6 13. g5 hxg5 14. Bxg5 Nh7 15. Bxe7 Qxe7 16. Rf4 Nc6 17. Qh3 g5 18. Nxc6 bxc6 19. Rf2 exf5 20. exf5 Rb8 21. Bd3 Rb4 22. Re2 Qa7+ 23. Kh1 
Still frightened of the backward pawn.,True,", The comment suggests a potential tactical weakness stemming from the pawn's vulnerability.",1. e4 c5 2. Nf3 Nc6 3. d4 cxd4 4. Nxd4 Nf6 5. Nc3 d6 6. Be2 e6 7. O-O a6 8. Be3 Qc7 9. f4 Na5 10. f5 Nc4 11. Bxc4 Qxc4 12. fxe6 fxe6,This is a game between Lasker (as White) and Pirc (as Black). Last move played: Black plays Pawn takes on e6,Large advantage for White (eval: 412 centipawns),13. Rxf6 gxf6 14. Qh5+ Kd8 15. Qf7 Bd7 16. Qxf6+ Kc7 17. b3 Qb4 18. a3 Bh6 19. Nxe6+ Bxe6 20. axb4 Bxe3+ 21. Kh1 Rae8 ,12... Bxe6 13. Nd5 Bxd5 14. exd5 O-O-O 15. Kh1 h5 16. Bg1 Re8 17. Rf3 Qxd5 18. h3 Ne4 19. c4 Qg5 20. b4 g6 21. b5 a5 22. Qa4 b6 23. Re1 
"With this spl endid Exchange sacrifice, Lasker demonstartes how vulnerable Black's King is here",True," The comment suggests a tactical blunder, implying a risky sacrifice that exposes the King.",1. e4 c5 2. Nf3 Nc6 3. d4 cxd4 4. Nxd4 Nf6 5. Nc3 d6 6. Be2 e6 7. O-O a6 8. Be3 Qc7 9. f4 Na5 10. f5 Nc4 11. Bxc4 Qxc4 12. fxe6 fxe6 13. Rxf6,This is a game between Lasker (as White) and Pirc (as Black). Last move played: White plays Rook takes on f6,Large advantage for White (eval: 442 centipawns),13... gxf6 14. Qh5+ Kd8 15. Qf7 Be7 16. Nf5 Qc7 17. Na4 Rf8 18. Qxh7 exf5 19. Bb6 Bd7 20. Bxc7+ Kxc7 21. Nc3 Rae8 22. Nd5+ Kd8 23. exf5 Bc6 24. c4 Bxd5 25. cxd5 Kc8 26. Re1 Bd8 27. Rxe8 Rxe8 28. Kf1 Re5 29. h4 Bb6 30. Qg6 Kb8 31. h5 Be3 32. h6 Bxh6 33. Qxf6 Bf4 34. Qg6 Re3 35. f6 ,13. Rxf6 gxf6 14. Qh5+ Kd8 15. Qf7 Bd7 16. Qxf6+ Kc7 17. b3 Qb4 18. a3 Bh6 19. Nxe6+ Bxe6 20. axb4 Bxe3+ 21. Kh1 Rae8 
"Black had been counting on this move, but an elegant refutation puts an end to his hopes",True," The comment suggests the move undermined the opponent's plan, indicating a flawed strategic assessment.",1. e4 c5 2. Nf3 Nc6 3. d4 cxd4 4. Nxd4 Nf6 5. Nc3 d6 6. Be2 e6 7. O-O a6 8. Be3 Qc7 9. f4 Na5 10. f5 Nc4 11. Bxc4 Qxc4 12. fxe6 fxe6 13. Rxf6 gxf6 14. Qh5+ Kd8 15. Qf7 Bd7 16. Qxf6+ Kc7 17. Qxh8 Bh6,This is a game between Lasker (as White) and Pirc (as Black). Last move played: Black plays Bishop to h6,Large advantage for White (eval: 465 centipawns),18. Nxe6+ Qxe6 19. Qxa8 Bxe3+ 20. Kh1 Bc6 21. Qf8 Bc5 22. Rf1 Kb6 23. Qf7 Qe5 24. Qf5 Qd4 25. Nd5+ Ka7 26. c3 Qc4 27. b3 Qb5 28. Qf3 h5 29. Re1 Bxd5 30. exd5 Bb6 31. h3 ,17... Bh6 18. Nxe6+ Qxe6 19. Qxa8 Bxe3+ 20. Kh1 Bc6 21. Qf8 Bc5 22. Rf1 Kb6 23. Qf7 Qe5 24. Qf5 Qg7 25. Nd5+ Ka7 26. c3 a5 27. Rd1 Qh6 28. Qf6 Qh5 29. Qf3 Qh4 30. b3 Bxd5 31. exd5 Qe7 32. Rf1 Qe5 33. Qd3 h5 34. b4 axb4 
