comment,good,reasoning,moves,context,engine_eval,engine_best_line,engine_best_alternative
"Preventing Pb4 for the moment, and so gaining time for the Kingside attack. Curiously enough, this move is hard ever seen in actualpractise",True," The comment suggests a potential tactical blunder, indicating a flawed strategic decision.",1. d4 d5 2. c4 e6 3. Nc3 c6 4. Nf3 Nf6 5. cxd5 exd5 6. Bg5 Be7 7. Qc2 Bg4 8. Ne5 Bh5 9. e3 Nbd7 10. Nxd7 Qxd7 11. h3 Bg6 12. Bd3 Bxd3 13. Qxd3 Qe6 14. O-O O-O 15. Rab1 a5,This is a game between Dijkstra (as White) and Kramer (as Black). Last move played: Black plays Pawn to a5,The position is equal,16. Rbe1 Rfe8 ,15... a5 16. Rbd1 Rfe8 17. Bxf6 Qxf6 18. Rfe1 Bf8 19. e4 Qg6 20. Re3 dxe4 21. Nxe4 Rad8 22. a3 Re6 23. Nc3 Qxd3 24. Rdxd3 
Resuming the minority attack. As the direct advance of the b-pawn is not possible. White proceeds to occupy the furthest available square on the half open file - a device already familar to us.,True," The comment suggests a strategic retreat, indicating a flawed move that resulted in a lost opportunity.",1. d4 d5 2. c4 e6 3. Nc3 c6 4. Nf3 Nf6 5. cxd5 exd5 6. Bg5 Be7 7. Qc2 Bg4 8. Ne5 Bh5 9. e3 Nbd7 10. Nxd7 Qxd7 11. h3 Bg6 12. Bd3 Bxd3 13. Qxd3 Qe6 14. O-O O-O 15. Rab1 a5 16. Rfc1 Bd6 17. Bxf6 Qxf6 18. Na4,This is a game between Dijkstra (as White) and Kramer (as Black). Last move played: White plays Knight to a4,Slight advantage for Black (eval: -27 centipawns),18... Qe7 19. Nc5 ,18. Re1 Rfe8 
"This method of sharpening the struggle on the Kingside is also typical of this kind of situation. It is very effective here, because White's Ph3 has weakened his King position",True," The comment identifies a potential tactical flaw and suggests a strategic advantage, indicating a flawed move.",1. d4 d5 2. c4 e6 3. Nc3 c6 4. Nf3 Nf6 5. cxd5 exd5 6. Bg5 Be7 7. Qc2 Bg4 8. Ne5 Bh5 9. e3 Nbd7 10. Nxd7 Qxd7 11. h3 Bg6 12. Bd3 Bxd3 13. Qxd3 Qe6 14. O-O O-O 15. Rab1 a5 16. Rfc1 Bd6 17. Bxf6 Qxf6 18. Na4 Rfe8 19. Nc5 Re7 20. a3 g5,This is a game between Dijkstra (as White) and Kramer (as Black). Last move played: Black plays Pawn to g5,Slight advantage for Black (eval: -23 centipawns),21. Qd1 Bxc5 ,20... h5 
"White has succeeded in carrying out his plan, but meanwhile the Black counterattack has assumed decisive proportions",True," The comment suggests the counterattack significantly impacted the plan, indicating a failure to execute it effectively.",1. d4 d5 2. c4 e6 3. Nc3 c6 4. Nf3 Nf6 5. cxd5 exd5 6. Bg5 Be7 7. Qc2 Bg4 8. Ne5 Bh5 9. e3 Nbd7 10. Nxd7 Qxd7 11. h3 Bg6 12. Bd3 Bxd3 13. Qxd3 Qe6 14. O-O O-O 15. Rab1 a5 16. Rfc1 Bd6 17. Bxf6 Qxf6 18. Na4 Rfe8 19. Nc5 Re7 20. a3 g5 21. Qd1 Qg6 22. b4 axb4 23. axb4 f5 24. b5,This is a game between Dijkstra (as White) and Kramer (as Black). Last move played: White plays Pawn to b5,The position is equal,24... g4 25. Nd3 gxh3 26. Qf3 hxg2 27. Qxg2 Ra3 28. bxc6 bxc6 29. Ne5 Bxe5 30. dxe5 Ra6 31. f4 Rea7 32. Kh1 Qxg2+ 33. Kxg2 d4 34. exd4 Rg7+ 35. Kf2 Rg4 36. Rc3 Rxf4+ 37. Rf3 Rxf3+ 38. Kxf3 Kf7 39. Rb7+ Ke6 ,24. b5 f4 
"Succour for the threatened King, but it is too late",True," The comment suggests a defensive strategy, but the move is ultimately unsuccessful, indicating a flawed strategic decision.",1. d4 d5 2. c4 e6 3. Nc3 c6 4. Nf3 Nf6 5. cxd5 exd5 6. Bg5 Be7 7. Qc2 Bg4 8. Ne5 Bh5 9. e3 Nbd7 10. Nxd7 Qxd7 11. h3 Bg6 12. Bd3 Bxd3 13. Qxd3 Qe6 14. O-O O-O 15. Rab1 a5 16. Rfc1 Bd6 17. Bxf6 Qxf6 18. Na4 Rfe8 19. Nc5 Re7 20. a3 g5 21. Qd1 Qg6 22. b4 axb4 23. axb4 f5 24. b5 g4 25. hxg4 fxg4 26. g3 Rf8 27. Nd3,This is a game between Dijkstra (as White) and Kramer (as Black). Last move played: White plays Knight to d3,Large advantage for Black (eval: -241 centipawns),27... Bxg3 ,27. bxc6 
