comment,good,reasoning,moves,context,engine_eval,engine_best_line,engine_best_alternative
"This weakens his own e-pawn, this is true, but also limits much of White's attacking prospects on the Kingside",True," The comment identifies a positional weakness, suggesting a flawed plan, but doesn't explicitly state the mistake.",1. d4 d5 2. Nf3 c5 3. c4 e6 4. e3 Nc6 5. Bd3 Nf6 6. O-O Bd6 7. b3 O-O 8. Bb2 b6 9. Nbd2 Bb7 10. Ne5 Qe7 11. a3 Rad8 12. Qc2 dxc4 13. Ndxc4 cxd4 14. exd4 Rc8 15. Qe2 Bb8 16. f4 Nd5 17. Rae1 f5,This is a game between Janowsky (as White) and Lasker (as Black). Last move played: Black plays Pawn to f5,Slight advantage for Black (eval: -36 centipawns),18. Rf2 ,17... f5 18. Rf2 
"Janowksy w as an attacking player, and he had no love for patient, long, drawn-out maneuvering - which is precisely what the present position requires",True," The comment suggests a shift in strategy, indicating a departure from a slow, patient approach.",1. d4 d5 2. Nf3 c5 3. c4 e6 4. e3 Nc6 5. Bd3 Nf6 6. O-O Bd6 7. b3 O-O 8. Bb2 b6 9. Nbd2 Bb7 10. Ne5 Qe7 11. a3 Rad8 12. Qc2 dxc4 13. Ndxc4 cxd4 14. exd4 Rc8 15. Qe2 Bb8 16. f4 Nd5 17. Rae1 f5 18. Qd2,This is a game between Janowsky (as White) and Lasker (as Black). Last move played: White plays Queen to d2,Advantage for Black (eval: -59 centipawns),18... a6 ,18. Rf2 
parries the threat of Nxe6 and indirectly protects the a-pawn,True," The comment suggests a defensive move, potentially mitigating a dangerous attack, which is a reasonable interpretation of a mistake.",1. d4 d5 2. Nf3 c5 3. c4 e6 4. e3 Nc6 5. Bd3 Nf6 6. O-O Bd6 7. b3 O-O 8. Bb2 b6 9. Nbd2 Bb7 10. Ne5 Qe7 11. a3 Rad8 12. Qc2 dxc4 13. Ndxc4 cxd4 14. exd4 Rc8 15. Qe2 Bb8 16. f4 Nd5 17. Rae1 f5 18. Qd2 Nxe5 19. Nxe5 a6 20. Bb1 Bd6 21. Nc4 b5 22. Na5 Ba8 23. b4 Nb6 24. Nb3 Bd5 25. Nc5 Nc4 26. Qc3 Rf6,This is a game between Janowsky (as White) and Lasker (as Black). Last move played: Black plays Rook to f6,Large advantage for Black (eval: -111 centipawns),27. Rf2 Qd8 ,26... Qh4 27. g3 
This must have been a painful decision for Janowsky in view of his predilection for the two Bishops,True, The comment suggests a potential strategic flaw based on Janowsky’s past tendencies.,1. d4 d5 2. Nf3 c5 3. c4 e6 4. e3 Nc6 5. Bd3 Nf6 6. O-O Bd6 7. b3 O-O 8. Bb2 b6 9. Nbd2 Bb7 10. Ne5 Qe7 11. a3 Rad8 12. Qc2 dxc4 13. Ndxc4 cxd4 14. exd4 Rc8 15. Qe2 Bb8 16. f4 Nd5 17. Rae1 f5 18. Qd2 Nxe5 19. Nxe5 a6 20. Bb1 Bd6 21. Nc4 b5 22. Na5 Ba8 23. b4 Nb6 24. Nb3 Bd5 25. Nc5 Nc4 26. Qc3 Rf6 27. Bc1 a5 28. Rf2 axb4 29. axb4 Ra8 30. Ba2 Qf7 31. Bxc4,This is a game between Janowsky (as White) and Lasker (as Black). Last move played: White plays Bishop takes on c4,Large advantage for Black (eval: -208 centipawns),31... Bxc4 32. Bd2 Bd5 33. Ra1 Rxa1+ 34. Qxa1 Qh5 35. Qf1 Qe8 36. h3 h6 37. Qe2 Rg6 38. Kh2 Be7 39. g3 Bd6 40. Qe1 Qa8 41. Re2 Qa3 42. Re3 Qb2 43. Re2 Bc4 44. Re3 ,31. Bb3 Rg6 
To keep Black busy watching the possibility of Pd5,True," The comment suggests Black is trying to draw attention away from a potentially important piece or position, indicating a flaw in the move's strategic assessment.",1. d4 d5 2. Nf3 c5 3. c4 e6 4. e3 Nc6 5. Bd3 Nf6 6. O-O Bd6 7. b3 O-O 8. Bb2 b6 9. Nbd2 Bb7 10. Ne5 Qe7 11. a3 Rad8 12. Qc2 dxc4 13. Ndxc4 cxd4 14. exd4 Rc8 15. Qe2 Bb8 16. f4 Nd5 17. Rae1 f5 18. Qd2 Nxe5 19. Nxe5 a6 20. Bb1 Bd6 21. Nc4 b5 22. Na5 Ba8 23. b4 Nb6 24. Nb3 Bd5 25. Nc5 Nc4 26. Qc3 Rf6 27. Bc1 a5 28. Rf2 axb4 29. axb4 Ra8 30. Ba2 Qf7 31. Bxc4 Bxc4 32. Bb2,This is a game between Janowsky (as White) and Lasker (as Black). Last move played: White plays Bishop to b2,Large advantage for Black (eval: -204 centipawns),32... Rg6 33. Re3 ,32. Bd2 Bd5 33. Ra1 Rxa1+ 34. Qxa1 Qh5 35. Qf1 Qe8 36. h3 Rf7 37. Qa1 h6 38. Re2 Re7 39. Qe1 Bc4 40. Rf2 Qa8 41. Bc3 Qb8 42. Bd2 Ra7 43. d5 Bxd5 44. Nxe6 Re7 
"After the exchange of Rooks which follows now, the White Bishop is unable to protect the f-pawn from c1 - a fact which Lasker proceeds to put to good use. This is a piece of typical maneuvering technique",True," The comment offers a potential explanation for the mistake, suggesting a tactical maneuver, but it’s somewhat vague and doesn’t directly address the flawed move itself.",1. d4 d5 2. Nf3 c5 3. c4 e6 4. e3 Nc6 5. Bd3 Nf6 6. O-O Bd6 7. b3 O-O 8. Bb2 b6 9. Nbd2 Bb7 10. Ne5 Qe7 11. a3 Rad8 12. Qc2 dxc4 13. Ndxc4 cxd4 14. exd4 Rc8 15. Qe2 Bb8 16. f4 Nd5 17. Rae1 f5 18. Qd2 Nxe5 19. Nxe5 a6 20. Bb1 Bd6 21. Nc4 b5 22. Na5 Ba8 23. b4 Nb6 24. Nb3 Bd5 25. Nc5 Nc4 26. Qc3 Rf6 27. Bc1 a5 28. Rf2 axb4 29. axb4 Ra8 30. Ba2 Qf7 31. Bxc4 Bxc4 32. Bb2 Rg6 33. Ra1,This is a game between Janowsky (as White) and Lasker (as Black). Last move played: White plays Rook to a1,Large advantage for Black (eval: -253 centipawns),33... Rxa1+ 34. Bxa1 h5 35. Nd3 Qa7 36. Bb2 h4 37. Qc2 Qb7 38. Bc3 Qa8 39. Qe2 Rg4 40. Qe3 Bd5 41. Qe2 h3 42. g3 Bc4 43. Bb2 Be7 44. Qf3 Bd5 45. Qd1 Bf6 46. Rc2 ,33. Re3 Bd5 34. Nd3 h5 35. Rfe2 h4 36. Qe1 Qe7 37. h3 Rc8 38. Ne5 Bxe5 39. Rxe5 Qf6 40. Bc3 Qd8 41. Kh2 Kf7 42. R5e3 Rc7 43. Rc2 
An unavoidable weakening,True,", The comment suggests a tactical blunder, indicating a significant error in the move's assessment.",1. d4 d5 2. Nf3 c5 3. c4 e6 4. e3 Nc6 5. Bd3 Nf6 6. O-O Bd6 7. b3 O-O 8. Bb2 b6 9. Nbd2 Bb7 10. Ne5 Qe7 11. a3 Rad8 12. Qc2 dxc4 13. Ndxc4 cxd4 14. exd4 Rc8 15. Qe2 Bb8 16. f4 Nd5 17. Rae1 f5 18. Qd2 Nxe5 19. Nxe5 a6 20. Bb1 Bd6 21. Nc4 b5 22. Na5 Ba8 23. b4 Nb6 24. Nb3 Bd5 25. Nc5 Nc4 26. Qc3 Rf6 27. Bc1 a5 28. Rf2 axb4 29. axb4 Ra8 30. Ba2 Qf7 31. Bxc4 Bxc4 32. Bb2 Rg6 33. Ra1 Rxa1+ 34. Bxa1 Qc7 35. Qe3 Rg4 36. g3,This is a game between Janowsky (as White) and Lasker (as Black). Last move played: White plays Pawn to g3,Large advantage for Black (eval: -202 centipawns),36... Rg6 37. d5 Bxd5 38. Bd4 h6 39. Kf1 Qc6 40. Kg1 Qc8 41. Kf1 Be7 42. Rc2 Ba8 43. Qe5 Qc6 44. Qb8+ Kh7 45. Kf2 ,36. d5 Bxd5 
"In the manner of Steintiz, lasker has accumulated a variety of small advantages. Now comes the moment to strike. As Lasker put in his famous naual, it is no longer merely that Black can attack, but that he must. The player who does not attack in such positions, said Lasker, forfeits all his fighting spirit and will go under",True," The comment offers a rationale for the mistake, suggesting a failure to capitalize on tactical opportunities.",1. d4 d5 2. Nf3 c5 3. c4 e6 4. e3 Nc6 5. Bd3 Nf6 6. O-O Bd6 7. b3 O-O 8. Bb2 b6 9. Nbd2 Bb7 10. Ne5 Qe7 11. a3 Rad8 12. Qc2 dxc4 13. Ndxc4 cxd4 14. exd4 Rc8 15. Qe2 Bb8 16. f4 Nd5 17. Rae1 f5 18. Qd2 Nxe5 19. Nxe5 a6 20. Bb1 Bd6 21. Nc4 b5 22. Na5 Ba8 23. b4 Nb6 24. Nb3 Bd5 25. Nc5 Nc4 26. Qc3 Rf6 27. Bc1 a5 28. Rf2 axb4 29. axb4 Ra8 30. Ba2 Qf7 31. Bxc4 Bxc4 32. Bb2 Rg6 33. Ra1 Rxa1+ 34. Bxa1 Qc7 35. Qe3 Rg4 36. g3 g5,This is a game between Janowsky (as White) and Lasker (as Black). Last move played: Black plays Pawn to g5,The position is equal,37. d5 Bxd5 38. Nxe6 Qe7 39. Qc3 Bxe6 40. h3 Rxg3+ 41. Qxg3 Bxb4 42. Rg2 g4 43. Qe3 Kf7 44. hxg4 fxg4 45. Bd4 Bd7 46. Qb3+ Kf8 47. Qd5 Qe1+ 48. Kh2 Qh4+ 49. Kg1 ,36... Rg6 37. d5 Bxd5 38. Bd4 h6 39. Kf1 Qc6 40. Kg1 Qc8 41. Kf1 Be7 42. Rc2 Ba8 43. Qe5 Qc6 44. Qb8+ Kh7 45. Kf2 
"A very dangerous attack, but Lasker has reckoned it all out",True," The comment suggests the move was overly aggressive and potentially flawed, indicating a potential mistake.",1. d4 d5 2. Nf3 c5 3. c4 e6 4. e3 Nc6 5. Bd3 Nf6 6. O-O Bd6 7. b3 O-O 8. Bb2 b6 9. Nbd2 Bb7 10. Ne5 Qe7 11. a3 Rad8 12. Qc2 dxc4 13. Ndxc4 cxd4 14. exd4 Rc8 15. Qe2 Bb8 16. f4 Nd5 17. Rae1 f5 18. Qd2 Nxe5 19. Nxe5 a6 20. Bb1 Bd6 21. Nc4 b5 22. Na5 Ba8 23. b4 Nb6 24. Nb3 Bd5 25. Nc5 Nc4 26. Qc3 Rf6 27. Bc1 a5 28. Rf2 axb4 29. axb4 Ra8 30. Ba2 Qf7 31. Bxc4 Bxc4 32. Bb2 Rg6 33. Ra1 Rxa1+ 34. Bxa1 Qc7 35. Qe3 Rg4 36. g3 g5 37. d5,This is a game between Janowsky (as White) and Lasker (as Black). Last move played: White plays Pawn to d5,The position is equal,37... Bxd5 38. Nxe6 Qe7 39. Qc3 Bxe6 40. h3 Rxg3+ 41. Qxg3 Bxb4 42. Re2 Qa7+ 43. Kh2 Qxa1 44. Qxg5+ Kf7 45. Qh5+ Ke7 46. Qxh7+ Kd8 47. Qg6 Bc5 48. Rxe6 Qa2+ 49. Kh1 Qd5+ 50. Kh2 ,37. d5 Bxd5 38. Nxe6 Qe7 39. Qc3 Bxe6 40. h3 Rxg3+ 41. Qxg3 Bxb4 42. Rg2 g4 43. Qe3 Kf7 44. hxg4 fxg4 45. Bd4 Bd7 46. Qb3+ Kf8 47. Qd5 Qe1+ 48. Kh2 Qh4+ 49. Kg1 
"So far everything has gone well for White, but now Lasker plays his ace",True," The comment indicates a potential tactical blunder due to the use of an ace, suggesting a miscalculation.",1. d4 d5 2. Nf3 c5 3. c4 e6 4. e3 Nc6 5. Bd3 Nf6 6. O-O Bd6 7. b3 O-O 8. Bb2 b6 9. Nbd2 Bb7 10. Ne5 Qe7 11. a3 Rad8 12. Qc2 dxc4 13. Ndxc4 cxd4 14. exd4 Rc8 15. Qe2 Bb8 16. f4 Nd5 17. Rae1 f5 18. Qd2 Nxe5 19. Nxe5 a6 20. Bb1 Bd6 21. Nc4 b5 22. Na5 Ba8 23. b4 Nb6 24. Nb3 Bd5 25. Nc5 Nc4 26. Qc3 Rf6 27. Bc1 a5 28. Rf2 axb4 29. axb4 Ra8 30. Ba2 Qf7 31. Bxc4 Bxc4 32. Bb2 Rg6 33. Ra1 Rxa1+ 34. Bxa1 Qc7 35. Qe3 Rg4 36. g3 g5 37. d5 Bxd5 38. Qd4 gxf4 39. Qh8+ Kf7 40. Qxh7+ Ke8 41. Qh8+ Bf8 42. Be5 Qf7 43. Rxf4 Rxf4 44. Bxf4,This is a game between Janowsky (as White) and Lasker (as Black). Last move played: White plays Bishop takes on f4,Slight advantage for Black (eval: -22 centipawns),44... Qg7 45. Qh5+ ,44. Bxf4 
Black takes advantage of the outpost on d5 afforded by White's isolated d-pawn,True," The comment offers a potential explanation for the mistake, suggesting a tactical opportunity missed.",1. d4 d5 2. Nf3 c5 3. c4 e6 4. e3 Nc6 5. Bd3 Nf6 6. O-O Bd6 7. b3 O-O 8. Bb2 b6 9. Nbd2 Bb7 10. Ne5 Qe7 11. a3 Rad8 12. Qc2 dxc4 13. Ndxc4 cxd4 14. exd4 Rc8 15. Qe2 Bb8 16. f4 Nd5,This is a game between Janowsky (as White) and Lasker (as Black). Last move played: Black plays Knight to d5,Slight advantage for White (eval: 21 centipawns),17. f5 ,16... Qd8 17. Nxc6 Bxc6 18. f5 exf5 19. Bxf5 Bd7 20. Qd3 Bxf5 21. Qxf5 Qd5 22. Rae1 Qxf5 23. Rxf5 Rfe8 24. Rxe8+ Rxe8 
The prevent ... Ba3,True,", The comment indicates a potential weakness in the defense against the attack.",1. d4 d5 2. Nf3 c5 3. c4 e6 4. e3 Nc6 5. Bd3 Nf6 6. O-O Bd6 7. b3 O-O 8. Bb2 b6 9. Nbd2 Bb7 10. Ne5 Qe7 11. a3,This is a game between Janowsky (as White) and Lasker (as Black). Last move played: White plays Pawn to a3,The position is equal,11... cxd4 12. Nxc6 Bxc6 13. exd4 Rfd8 14. Re1 Rac8 15. Qe2 g6 16. g3 Ba8 17. Rec1 h5 ,11. cxd5 exd5 
