comment,good,reasoning,moves,context,engine_eval,engine_best_line,engine_best_alternative
The English Opening.,True,", The comment suggests a possible suboptimal opening choice.",1. c4,"This is a game between Tartakower,S (as White) and Lasker,Em (as Black). Last move played: White plays Pawn to c4",Slight advantage for White (eval: 22 centipawns),1... e5 ,1. e4 e5 
This looks weird but has a valid point. Tartakower stops his opponent from playing ...Bb4 which would pin the White d-pawn to the King and prevent it from advancing.,True, The comment identifies a potential tactical threat and explains why the move was considered a mistake.,1. c4 e5 2. a3,"This is a game between Tartakower,S (as White) and Lasker,Em (as Black). Last move played: White plays Pawn to a3",The position is equal,2... Nf6 3. d3 ,2. g3 
Challenging Black's control of d4.,True,", The comment suggests a potential weakness in Black's strategic positioning.",1. c4 e5 2. a3 Nf6 3. e3,"This is a game between Tartakower,S (as White) and Lasker,Em (as Black). Last move played: White plays Pawn to e3",The position is equal,3... c6 ,3. e3 c5 
Lasker is just clearing the way to castle.,True," The comment suggests a defensive maneuver, indicating the move was flawed.",1. c4 e5 2. a3 Nf6 3. e3 Be7,"This is a game between Tartakower,S (as White) and Lasker,Em (as Black). Last move played: Black plays Bishop to e7",The position is equal,4. Nc3 d5 ,3... c6 
Played not to influence the center but to clear the Kingside for castling.,True, The comment suggests a tactical error by prioritizing castling over strategic influence in the center.,1. c4 e5 2. a3 Nf6 3. e3 Be7 4. Qc2 O-O 5. Nc3 d6 6. Nf3 Re8 7. Be2,"This is a game between Tartakower,S (as White) and Lasker,Em (as Black). Last move played: White plays Bishop to e2",The position is equal,7... Bf8 ,7. d4 Bf8 
Now we see the Rook take part in the struggle for the central squares.,True," The comment suggests the Rook's involvement in the central squares, indicating a potential tactical error.",1. c4 e5 2. a3 Nf6 3. e3 Be7 4. Qc2 O-O 5. Nc3 d6 6. Nf3 Re8 7. Be2 Bf8,"This is a game between Tartakower,S (as White) and Lasker,Em (as Black). Last move played: Black plays Bishop to f8",The position is equal,8. O-O ,7... Bf8 
"Another move that indirectly controls the center. The Bishop puts pressure on the f3-Knight, which covers d4 and e5.",True," The comment offers a potential explanation for the mistake, though it's somewhat vague.",1. c4 e5 2. a3 Nf6 3. e3 Be7 4. Qc2 O-O 5. Nc3 d6 6. Nf3 Re8 7. Be2 Bf8 8. O-O Nc6 9. d4 Bg4,"This is a game between Tartakower,S (as White) and Lasker,Em (as Black). Last move played: Black plays Bishop to g4",Advantage for White (eval: 89 centipawns),10. d5 e4 ,9... exd4 
"Driving off a piece that, too, covers d4 and e5.",True,", The comment suggests a potential tactical blunder due to the piece covering multiple squares.",1. c4 e5 2. a3 Nf6 3. e3 Be7 4. Qc2 O-O 5. Nc3 d6 6. Nf3 Re8 7. Be2 Bf8 8. O-O Nc6 9. d4 Bg4 10. d5,"This is a game between Tartakower,S (as White) and Lasker,Em (as Black). Last move played: White plays Pawn to d5",Advantage for White (eval: 82 centipawns),10... e4 11. Nd2 Bxe2 12. Nxe2 Nb8 13. b4 Nbd7 14. Bb2 Qe7 15. Bd4 Rac8 16. h3 a6 17. Rfc1 h5 18. Rab1 g6 19. Nf4 g5 20. Ne2 h4 21. a4 ,10. d5 e4 
The Knight still keeps its hand in the center by pressuring d5.,True,", The comment suggests a strategic error by prioritizing central control over long-term development.",1. c4 e5 2. a3 Nf6 3. e3 Be7 4. Qc2 O-O 5. Nc3 d6 6. Nf3 Re8 7. Be2 Bf8 8. O-O Nc6 9. d4 Bg4 10. d5 Ne7,"This is a game between Tartakower,S (as White) and Lasker,Em (as Black). Last move played: Black plays Knight to e7",Advantage for White (eval: 88 centipawns),11. e4 ,10... e4 11. Nd2 Bxe2 12. Nxe2 Nb8 13. b4 Nbd7 14. Bb2 Qe7 15. Bd4 Rac8 16. h3 a6 17. Rfc1 h5 18. Rab1 g6 19. Nf4 g5 20. Ne2 h4 21. a4 
"Tartakower puts the question to the Bishop: ""Capture or retreat!""",True," The comment suggests a potential strategic consideration, indicating a flawed decision.",1. c4 e5 2. a3 Nf6 3. e3 Be7 4. Qc2 O-O 5. Nc3 d6 6. Nf3 Re8 7. Be2 Bf8 8. O-O Nc6 9. d4 Bg4 10. d5 Ne7 11. h3,"This is a game between Tartakower,S (as White) and Lasker,Em (as Black). Last move played: White plays Pawn to h3",Advantage for White (eval: 73 centipawns),11... Bd7 ,11. e4 
The idea is for the f-pawn to advance and break the center.,True,", The comment suggests a potential weakness in the opponent's pawn structure, indicating a flawed strategic plan.",1. c4 e5 2. a3 Nf6 3. e3 Be7 4. Qc2 O-O 5. Nc3 d6 6. Nf3 Re8 7. Be2 Bf8 8. O-O Nc6 9. d4 Bg4 10. d5 Ne7 11. h3 Bd7 12. Nh2,"This is a game between Tartakower,S (as White) and Lasker,Em (as Black). Last move played: White plays Knight to h2",Advantage for White (eval: 51 centipawns),12... Ng6 13. Ng4 ,12. e4 
"The center is now blocked. Unless the center is broken, the Knights will become more valuable than the Bishops.",True, The comment suggests a strategic miscalculation related to pawn structure and piece activity.,1. c4 e5 2. a3 Nf6 3. e3 Be7 4. Qc2 O-O 5. Nc3 d6 6. Nf3 Re8 7. Be2 Bf8 8. O-O Nc6 9. d4 Bg4 10. d5 Ne7 11. h3 Bd7 12. Nh2 Qc8 13. e4,"This is a game between Tartakower,S (as White) and Lasker,Em (as Black). Last move played: White plays Pawn to e4",Advantage for White (eval: 69 centipawns),13... Ng6 14. Re1 a5 15. Be3 a4 16. Bd3 Nf4 17. Bxf4 exf4 18. Rac1 h6 19. Qd2 g5 20. c5 Ra5 21. cxd6 Bxd6 22. Bf1 Qd8 23. Nf3 g4 24. e5 gxf3 25. exd6 fxg2 ,13. Bd2 Ng6 
Lasker tries to discourage the planned move f2-f4.,True,", The comment suggests the player is attempting to block a planned attack, indicating a flawed strategic decision.",1. c4 e5 2. a3 Nf6 3. e3 Be7 4. Qc2 O-O 5. Nc3 d6 6. Nf3 Re8 7. Be2 Bf8 8. O-O Nc6 9. d4 Bg4 10. d5 Ne7 11. h3 Bd7 12. Nh2 Qc8 13. e4 Ng6,"This is a game between Tartakower,S (as White) and Lasker,Em (as Black). Last move played: Black plays Knight to g6",Advantage for White (eval: 62 centipawns),14. Re1 a5 ,13... Ng6 14. Re1 a5 15. Be3 a4 16. Bd3 Nf4 17. Bxf4 exf4 18. Rac1 h6 19. Qd2 g5 20. c5 Ra5 21. cxd6 Bxd6 22. Bf1 Qd8 23. Nf3 g4 24. e5 gxf3 25. exd6 fxg2 
Tartakower has siezed the open file with both of his Rooks. He also has a pretty big space advantage -- all of the Black units are confined to Black's first three ranks.,True," The comment provides a specific analysis of the resulting position, suggesting a tactical blunder.",1. c4 e5 2. a3 Nf6 3. e3 Be7 4. Qc2 O-O 5. Nc3 d6 6. Nf3 Re8 7. Be2 Bf8 8. O-O Nc6 9. d4 Bg4 10. d5 Ne7 11. h3 Bd7 12. Nh2 Qc8 13. e4 Ng6 14. f4 exf4 15. Bxf4 Nxf4 16. Rxf4 Be7 17. Raf1,"This is a game between Tartakower,S (as White) and Lasker,Em (as Black). Last move played: White plays Rook to f1",Slight advantage for White (eval: 38 centipawns),17... c6 18. Kh1 ,17. Raf1 Rf8 
Tartakower now has all three heavy pieces bearing down on the Black Kingside.,True,". The comment suggests the player's move has created a situation where Black's Kingside is under immediate attack, indicating a tactical blunder.",1. c4 e5 2. a3 Nf6 3. e3 Be7 4. Qc2 O-O 5. Nc3 d6 6. Nf3 Re8 7. Be2 Bf8 8. O-O Nc6 9. d4 Bg4 10. d5 Ne7 11. h3 Bd7 12. Nh2 Qc8 13. e4 Ng6 14. f4 exf4 15. Bxf4 Nxf4 16. Rxf4 Be7 17. Raf1 Rf8 18. Qd3 Be8 19. Qg3,"This is a game between Tartakower,S (as White) and Lasker,Em (as Black). Last move played: White plays Queen to g3",The position is equal,19... Qd8 20. Bg4 ,19. Rxf6 
Played to give the g4-Rook a flight square.,True," The comment suggests a tactical blunder by sacrificing the Rook to open the g4-square, indicating a flawed plan.",1. c4 e5 2. a3 Nf6 3. e3 Be7 4. Qc2 O-O 5. Nc3 d6 6. Nf3 Re8 7. Be2 Bf8 8. O-O Nc6 9. d4 Bg4 10. d5 Ne7 11. h3 Bd7 12. Nh2 Qc8 13. e4 Ng6 14. f4 exf4 15. Bxf4 Nxf4 16. Rxf4 Be7 17. Raf1 Rf8 18. Qd3 Be8 19. Qg3 Qd8 20. Nd1 Nd7 21. Ne3 Bg5 22. Rg4 f6 23. Qf2,"This is a game between Tartakower,S (as White) and Lasker,Em (as Black). Last move played: White plays Queen to f2",Large advantage for Black (eval: -124 centipawns),23... Bg6 ,23. Nf5 
"With open lines and less Kingside congestion, Lasker can now afford to grab a pawn on the other side of the board.",True," The comment suggests a potential weakness in the opponent's position, implying Lasker's move is a mistake.",1. c4 e5 2. a3 Nf6 3. e3 Be7 4. Qc2 O-O 5. Nc3 d6 6. Nf3 Re8 7. Be2 Bf8 8. O-O Nc6 9. d4 Bg4 10. d5 Ne7 11. h3 Bd7 12. Nh2 Qc8 13. e4 Ng6 14. f4 exf4 15. Bxf4 Nxf4 16. Rxf4 Be7 17. Raf1 Rf8 18. Qd3 Be8 19. Qg3 Qd8 20. Nd1 Nd7 21. Ne3 Bg5 22. Rg4 f6 23. Qf2 h5 24. Rg3 h4 25. Rg4 Bh5 26. Nf5 Bxg4 27. Nxg4 Qe8 28. Bf3 Ne5 29. Nxe5 Qxe5 30. Nxh4 Bxh4 31. Qxh4 f5 32. exf5 Rxf5 33. Re1 Qxb2,"This is a game between Tartakower,S (as White) and Lasker,Em (as Black). Last move played: Black plays Queen takes on b2",Large advantage for Black (eval: -269 centipawns),34. c5 Qf6 35. Qb4 Rf8 36. cxd6 Rf4 37. Qd2 cxd6 38. Kh2 Rd4 39. Qc1 Qf4+ 40. Qxf4 Rdxf4 41. Re7 R4f7 42. Re6 Rd8 43. Re4 Rc7 44. Kg3 Rc3 45. Kg4 Rxa3 46. Kg5 b5 ,33... Qxb2 34. c5 Qf6 35. Qxf6 Rxf6 36. c6 Rb8 37. cxb7 Rxb7 38. Re8+ Rf8 39. Re7 Rb3 40. Bg4 Rxa3 41. Rxc7 Rf6 42. Rc6 
Passed pawns must be pushed! Nimzovitch hasn't said this yet (at the time this tournament is being played) but he will in a few years.,True," The comment suggests a potential strategic flaw based on Nimzowitch's future analysis, indicating a significant error.",1. c4 e5 2. a3 Nf6 3. e3 Be7 4. Qc2 O-O 5. Nc3 d6 6. Nf3 Re8 7. Be2 Bf8 8. O-O Nc6 9. d4 Bg4 10. d5 Ne7 11. h3 Bd7 12. Nh2 Qc8 13. e4 Ng6 14. f4 exf4 15. Bxf4 Nxf4 16. Rxf4 Be7 17. Raf1 Rf8 18. Qd3 Be8 19. Qg3 Qd8 20. Nd1 Nd7 21. Ne3 Bg5 22. Rg4 f6 23. Qf2 h5 24. Rg3 h4 25. Rg4 Bh5 26. Nf5 Bxg4 27. Nxg4 Qe8 28. Bf3 Ne5 29. Nxe5 Qxe5 30. Nxh4 Bxh4 31. Qxh4 f5 32. exf5 Rxf5 33. Re1 Qxb2 34. Bg4 Qd4+ 35. Kh2 Raf8 36. Qe7 Qf4+ 37. Kh1 Re5 38. Rxe5 dxe5 39. Qxc7 e4,"This is a game between Tartakower,S (as White) and Lasker,Em (as Black). Last move played: Black plays Pawn to e4",Large advantage for Black (eval: -313 centipawns),40. Qd7 Qe5 41. Be2 b6 42. Qg4 Rf6 43. a4 g6 44. Qc8+ Kg7 45. Qd7+ Rf7 46. Qc8 e3 47. Qg4 Rf2 48. Qd7+ Kh6 49. Qg4 Rf5 50. Kg1 Kg7 51. Bd3 Rf6 52. Qd7+ Rf7 ,39... Qg5 40. Kg1 Kh7 41. Qd7 Qc1+ 42. Kh2 Qf4+ 43. Kg1 Qxc4 44. Bf5+ Kh8 45. g4 Qc1+ 46. Kg2 Qg5 47. d6 Qf6 48. Qc7 g6 49. h4 gxf5 50. g5 Qe6 51. Kh2 Qa2+ 52. Kg3 f4+ 
"Lasker wants to exchange Queens to get his pawns connected. Then the pawn duo will march striaght up the board, supported by the Rook.",True," The comment describes a potential tactical sequence that is likely a mistake, suggesting an unnecessary and potentially harmful pawn advance.",1. c4 e5 2. a3 Nf6 3. e3 Be7 4. Qc2 O-O 5. Nc3 d6 6. Nf3 Re8 7. Be2 Bf8 8. O-O Nc6 9. d4 Bg4 10. d5 Ne7 11. h3 Bd7 12. Nh2 Qc8 13. e4 Ng6 14. f4 exf4 15. Bxf4 Nxf4 16. Rxf4 Be7 17. Raf1 Rf8 18. Qd3 Be8 19. Qg3 Qd8 20. Nd1 Nd7 21. Ne3 Bg5 22. Rg4 f6 23. Qf2 h5 24. Rg3 h4 25. Rg4 Bh5 26. Nf5 Bxg4 27. Nxg4 Qe8 28. Bf3 Ne5 29. Nxe5 Qxe5 30. Nxh4 Bxh4 31. Qxh4 f5 32. exf5 Rxf5 33. Re1 Qxb2 34. Bg4 Qd4+ 35. Kh2 Raf8 36. Qe7 Qf4+ 37. Kh1 Re5 38. Rxe5 dxe5 39. Qxc7 e4 40. Qe7 Qf6,"This is a game between Tartakower,S (as White) and Lasker,Em (as Black). Last move played: Black plays Queen to f6",Large advantage for Black (eval: -360 centipawns),41. Qc5 b6 42. Qb5 Qa1+ 43. Kh2 Qe5+ 44. Kg1 Qd4+ 45. Kh2 e3 46. Be2 Qe5+ 47. Kg1 Qg3 48. c5 bxc5 49. Qxc5 Qe1+ 50. Kh2 Qxe2 ,40... Qf1+ 41. Kh2 Qf6 42. Qxe4 Qf4+ 43. Qxf4 Rxf4 44. c5 Rc4 45. Be6+ Kf8 46. g4 Rxc5 47. h4 Ke7 48. g5 g6 49. Kg3 Rc4 50. Bg4 Rd4 51. Bf3 b6 52. a4 Rxa4 53. h5 gxh5 54. Bxh5 Rd4 55. Bf3 a5 
"This pawn grab will come back to haunt Tartakower, as we'll soon see.",True,". The comment suggests a potential future consequence of the move, indicating a strategic misjudgment.",1. c4 e5 2. a3 Nf6 3. e3 Be7 4. Qc2 O-O 5. Nc3 d6 6. Nf3 Re8 7. Be2 Bf8 8. O-O Nc6 9. d4 Bg4 10. d5 Ne7 11. h3 Bd7 12. Nh2 Qc8 13. e4 Ng6 14. f4 exf4 15. Bxf4 Nxf4 16. Rxf4 Be7 17. Raf1 Rf8 18. Qd3 Be8 19. Qg3 Qd8 20. Nd1 Nd7 21. Ne3 Bg5 22. Rg4 f6 23. Qf2 h5 24. Rg3 h4 25. Rg4 Bh5 26. Nf5 Bxg4 27. Nxg4 Qe8 28. Bf3 Ne5 29. Nxe5 Qxe5 30. Nxh4 Bxh4 31. Qxh4 f5 32. exf5 Rxf5 33. Re1 Qxb2 34. Bg4 Qd4+ 35. Kh2 Raf8 36. Qe7 Qf4+ 37. Kh1 Re5 38. Rxe5 dxe5 39. Qxc7 e4 40. Qe7 Qf6 41. Qxb7,"This is a game between Tartakower,S (as White) and Lasker,Em (as Black). Last move played: White plays Queen takes on b7",Large advantage for Black (eval: -616 centipawns),41... Qa1+ 42. Kh2 Qe5+ 43. Kg1 Rb8 44. Qxb8+ Qxb8 45. c5 Kf8 46. Kf2 Qb5 47. Ke3 Qd3+ 48. Kf4 Qxd5 49. h4 Qxc5 50. Kxe4 Qxa3 51. Bf3 Qe7+ 52. Kf4 Qxh4+ 53. Ke3 Qg5+ 54. Ke4 ,41. Qc5 b6 42. Qb5 Qa1+ 43. Kh2 Qe5+ 44. Kg1 Qd4+ 45. Kh2 e3 46. Be2 Qe5+ 47. Kg1 Qg3 48. c5 bxc5 49. Qxc5 Qe1+ 50. Kh2 Qxe2 
"The idea here is not really to attack the White Queen. Instead, Lasker wants to clear the b-file for his Rook to use it as an avenue to attack the White King.",True," The comment provides a rationale for the move, suggesting a strategic objective rather than a direct attack.",1. c4 e5 2. a3 Nf6 3. e3 Be7 4. Qc2 O-O 5. Nc3 d6 6. Nf3 Re8 7. Be2 Bf8 8. O-O Nc6 9. d4 Bg4 10. d5 Ne7 11. h3 Bd7 12. Nh2 Qc8 13. e4 Ng6 14. f4 exf4 15. Bxf4 Nxf4 16. Rxf4 Be7 17. Raf1 Rf8 18. Qd3 Be8 19. Qg3 Qd8 20. Nd1 Nd7 21. Ne3 Bg5 22. Rg4 f6 23. Qf2 h5 24. Rg3 h4 25. Rg4 Bh5 26. Nf5 Bxg4 27. Nxg4 Qe8 28. Bf3 Ne5 29. Nxe5 Qxe5 30. Nxh4 Bxh4 31. Qxh4 f5 32. exf5 Rxf5 33. Re1 Qxb2 34. Bg4 Qd4+ 35. Kh2 Raf8 36. Qe7 Qf4+ 37. Kh1 Re5 38. Rxe5 dxe5 39. Qxc7 e4 40. Qe7 Qf6 41. Qxb7 Qa1+ 42. Kh2 Qe5+ 43. Kg1 Rb8,"This is a game between Tartakower,S (as White) and Lasker,Em (as Black). Last move played: Black plays Rook to b8",Large advantage for Black (eval: -583 centipawns),44. Be6+ Kh7 45. Bf5+ Kh8 46. Qxb8+ Qxb8 47. Bxe4 Qf4 48. Bf3 Qxc4 49. g3 Qc1+ 50. Kf2 Qxa3 51. h4 Kg8 52. h5 Kf7 53. h6 gxh6 54. Bg4 Qc5+ 55. Kg2 Ke7 56. Bf3 Kd8 57. Bg4 ,43... Qd4+ 44. Kh2 Qe5+ 45. Kg1 Rb8 46. Be6+ Kh7 47. Bf5+ Kh8 48. Qxb8+ Qxb8 49. Bxe4 Qf4 50. Bf3 Qxc4 51. g3 Qd4+ 52. Kg2 Qb2+ 53. Kg1 Qxa3 54. Kg2 Qb2+ 55. Kh1 g5 56. h4 gxh4 57. d6 Qd4 58. gxh4 Qxd6 59. Kg2 a5 60. Bh5 Qd2+ 61. Kg1 Qc1+ 62. Kh2 
"Rather than play the symmetrical English (1...c5), Dr. Lasker carves out a bit of the center for himself,",True, The comment identifies a potential weakness in the move's strategic intent.,1. c4 e5,"This is a game between Tartakower,S (as White) and Lasker,Em (as Black). Last move played: Black plays Pawn to e5",Slight advantage for White (eval: 26 centipawns),2. g3 ,1... e5 2. g3 
Challenging Black's control of d4.,True," The comment suggests the Black King is defended, implying a strategic weakness in the Tartakower's move.",1. c4 e5 2. a3 Nf6 3. e3,"This is a game between Tartakower,S (as White) and Lasker,Em (as Black). Last move played: White plays Pawn to e3",The position is equal,3... c6 ,3. e3 c5 
Lasker is just clearing the way to castle.,True,". The comment suggests a potential tactical blunder, indicating a misjudgment of the resulting position.",1. c4 e5 2. a3 Nf6 3. e3 Be7,"This is a game between Tartakower,S (as White) and Lasker,Em (as Black). Last move played: Black plays Bishop to e7",The position is equal,4. Nc3 d5 ,3... c6 
The English Opening.,True," The comment suggests a strategic deviation from a standard opening, indicating a flawed move.",1. c4,"This is a game between Tartakower,S (as White) and Lasker,Em (as Black). Last move played: White plays Pawn to c4",Slight advantage for White (eval: 22 centipawns),1... e5 ,1. e4 e5 
