comment,good,reasoning,moves,context,engine_eval,engine_best_line,engine_best_alternative
"We have transposed into a Tarrasch Defense, which usually involves active piece play for Black but a better pawn structure for White.",True," The comment suggests a poor move choice, potentially indicating a tactical error.",1. Nf3 c5 2. b3 d5 3. e3 Nf6 4. Bb2 e6 5. c4 Nc6 6. cxd5 exd5 7. Be2 Be7 8. O-O O-O 9. d4,This is a game between Petrosian (as White) and Hort (as Black). Last move played: White plays Pawn to d4,Slight advantage for White (eval: 38 centipawns),9... cxd4 10. Nxd4 ,9. d4 Ne4 10. dxc5 Bxc5 11. Nc3 Ba3 12. Bxa3 Nxc3 13. Qd3 Nxe2+ 14. Qxe2 Re8 15. Bb2 Bg4 16. h3 Bh5 17. Rfd1 Qd7 18. Rd2 Rad8 19. Rc1 h6 20. Rc5 b6 21. Rcxd5 Qxd5 22. Rxd5 Rxd5 23. g4 
Black's choice of opening involves accepting an isolated d-pawn.,True,", The comment suggests a potential weakness in Black’s pawn structure, indicating a flawed opening choice.",1. Nf3 c5 2. b3 d5 3. e3 Nf6 4. Bb2 e6 5. c4 Nc6 6. cxd5 exd5 7. Be2 Be7 8. O-O O-O 9. d4 Bg4 10. dxc5,This is a game between Petrosian (as White) and Hort (as Black). Last move played: White plays Pawn takes on c5,Slight advantage for White (eval: 45 centipawns),10... Bxc5 11. Nc3 Be6 12. Rc1 Qe7 13. Bd3 Ba3 14. Bxa3 Qxa3 15. h3 Rac8 16. Qd2 a6 17. Rfd1 Rfd8 18. Qe1 h6 19. Bb1 Qa5 20. Qd2 Qa3 21. Nd4 Nxd4 22. Qxd4 Qc5 23. Qxc5 Rxc5 ,10. dxc5 
"As Aron Nimzovitch showed there are three steps to playing against the isolated pawn: Blockade, attack, destroy.",True, The comment provides a key insight into the strategic implications of the error.,1. Nf3 c5 2. b3 d5 3. e3 Nf6 4. Bb2 e6 5. c4 Nc6 6. cxd5 exd5 7. Be2 Be7 8. O-O O-O 9. d4 Bg4 10. dxc5 Bxc5 11. Nc3 Rc8 12. Rc1 Be7 13. Nd4,This is a game between Petrosian (as White) and Hort (as Black). Last move played: White plays Knight to d4,Advantage for White (eval: 59 centipawns),13... Be6 14. Nxe6 ,13. h3 Bh5 
White has the d-pawn firmly blockaded.,True," The comment suggests a potential weakness in the pawn structure, indicating a flaw in the move’s strategic planning.",1. Nf3 c5 2. b3 d5 3. e3 Nf6 4. Bb2 e6 5. c4 Nc6 6. cxd5 exd5 7. Be2 Be7 8. O-O O-O 9. d4 Bg4 10. dxc5 Bxc5 11. Nc3 Rc8 12. Rc1 Be7 13. Nd4 Bxe2 14. Ncxe2,This is a game between Petrosian (as White) and Hort (as Black). Last move played: White plays Knight takes on e2,Advantage for White (eval: 51 centipawns),14... Qd7 ,14. Ncxe2 
"A new weakness has arisen in the Black camp, namely the a1-h8 diagonal.",True," The comment directly identifies a tactical vulnerability, suggesting a flaw in Black's position.",1. Nf3 c5 2. b3 d5 3. e3 Nf6 4. Bb2 e6 5. c4 Nc6 6. cxd5 exd5 7. Be2 Be7 8. O-O O-O 9. d4 Bg4 10. dxc5 Bxc5 11. Nc3 Rc8 12. Rc1 Be7 13. Nd4 Bxe2 14. Ncxe2 Qd7 15. Nf4 Rfd8 16. Qd3 Ne4 17. Nxc6 bxc6 18. Rc2 Bf8 19. Rfc1 Qb7 20. Qe2 Re8 21. Qg4 g6 22. Qd1,This is a game between Petrosian (as White) and Hort (as Black). Last move played: White plays Queen to d1,Large advantage for White (eval: 110 centipawns),22... Bg7 23. Bxg7 Kxg7 24. Qd4+ Kg8 25. h3 Red8 26. Nd3 h5 27. b4 Re8 28. a3 Qd7 29. Ne5 Qf5 30. Nf3 Qd7 31. Qb2 Qd6 32. Nd4 c5 33. f3 Qe7 34. fxe4 cxd4 35. Rxc8 ,22. Nxd5 Rcd8 23. Nf6+ Nxf6 24. Bxf6 Rd6 25. Bc3 Ree6 26. Qe2 h5 27. h4 Rd5 28. g3 c5 29. Kh2 Re4 30. Be1 Bd6 31. Rc4 
Played with the idea of meeting 23. Qd4 with Be5.,True," The comment suggests a flawed strategic plan, indicating a mistake.",1. Nf3 c5 2. b3 d5 3. e3 Nf6 4. Bb2 e6 5. c4 Nc6 6. cxd5 exd5 7. Be2 Be7 8. O-O O-O 9. d4 Bg4 10. dxc5 Bxc5 11. Nc3 Rc8 12. Rc1 Be7 13. Nd4 Bxe2 14. Ncxe2 Qd7 15. Nf4 Rfd8 16. Qd3 Ne4 17. Nxc6 bxc6 18. Rc2 Bf8 19. Rfc1 Qb7 20. Qe2 Re8 21. Qg4 g6 22. Qd1 Bd6,This is a game between Petrosian (as White) and Hort (as Black). Last move played: Black plays Bishop to d6,Large advantage for White (eval: 251 centipawns),23. f3 Bxf4 24. exf4 Nd6 25. Qd4 Kf8 26. Ba3 Re6 27. Qh8+ Ke7 28. Qxh7 Kd7 29. Qg7 a5 30. h3 Qb8 31. Kh2 Re7 32. g4 Nf5 33. gxf5 Qxf4+ 34. Kg1 Qxf3 35. Bxe7 Qxh3 36. fxg6 ,22... Bg7 23. Bxg7 Kxg7 24. Qd4+ Kg8 25. h3 Red8 26. Nd3 h5 27. b4 Re8 28. a3 Qd7 29. Ne5 Qf5 30. Nf3 Qd7 31. Qb2 Qd6 32. Nd4 c5 33. f3 Qe7 34. fxe4 cxd4 35. Rxc8 
23...cxd5 24.Rxc8 Rxc8 25.Rxc8+ Qxc8 26.Qd4 f6 27.Qxd5+ Kg7 28.Qxe4 leaves White with a winning material advantage.,True," The comment describes a potential tactical advantage for White, indicating a flaw in the opponent's defense.",1. Nf3 c5 2. b3 d5 3. e3 Nf6 4. Bb2 e6 5. c4 Nc6 6. cxd5 exd5 7. Be2 Be7 8. O-O O-O 9. d4 Bg4 10. dxc5 Bxc5 11. Nc3 Rc8 12. Rc1 Be7 13. Nd4 Bxe2 14. Ncxe2 Qd7 15. Nf4 Rfd8 16. Qd3 Ne4 17. Nxc6 bxc6 18. Rc2 Bf8 19. Rfc1 Qb7 20. Qe2 Re8 21. Qg4 g6 22. Qd1 Bd6 23. Nxd5 Rcd8,This is a game between Petrosian (as White) and Hort (as Black). Last move played: Black plays Rook to d8,Large advantage for White (eval: 422 centipawns),24. Rxc6 Bb8 25. f3 Nc3 26. R1xc3 Be5 27. R6c5 Re6 28. Rc2 Bxb2 29. Rxb2 Rxe3 30. Rd2 Re5 31. Nf6+ Kg7 32. Rxd8 Rxc5 33. Ne8+ Kh6 ,23... Be5 24. Bxe5 Rxe5 25. Nc3 Nf6 26. Ne2 c5 27. Nf4 Qe7 28. Rd2 h5 29. h3 Kg7 30. Rc4 h4 31. Qa1 Rd8 32. Rxd8 Qxd8 33. Qxe5 
Black resigned due to his material disadvantage. If you don't see a clear winning plan for White after 26...f6 try playing it out against Gambit.,True," The comment offers a potential explanation for the mistake, suggesting a need for a different approach.",1. Nf3 c5 2. b3 d5 3. e3 Nf6 4. Bb2 e6 5. c4 Nc6 6. cxd5 exd5 7. Be2 Be7 8. O-O O-O 9. d4 Bg4 10. dxc5 Bxc5 11. Nc3 Rc8 12. Rc1 Be7 13. Nd4 Bxe2 14. Ncxe2 Qd7 15. Nf4 Rfd8 16. Qd3 Ne4 17. Nxc6 bxc6 18. Rc2 Bf8 19. Rfc1 Qb7 20. Qe2 Re8 21. Qg4 g6 22. Qd1 Bd6 23. Nxd5 Rcd8 24. Rxc6 Qb8 25. f4 Re6 26. Qd4,This is a game between Petrosian (as White) and Hort (as Black). Last move played: White plays Queen to d4,Large advantage for White (eval: 533 centipawns),26... f6 27. Qc4 Rde8 28. Nxf6+ Nxf6 29. Bxf6 Qb4 30. Qxb4 Bxb4 31. Rxe6 Rxe6 32. Bd4 Ra6 33. a4 Ba5 34. Kf2 h5 35. Rc4 Bb6 36. Bxb6 Rxb6 37. b4 a6 38. a5 ,26. Qd4 f6 27. Qc4 Kf7 28. Nc7 Qc8 29. Ba3 a5 30. Bxd6 Nxd6 31. Qxe6+ Qxe6 32. Nxe6 Kxe6 33. Ra6 Ke7 34. Rd1 Rd7 35. Rd4 Rc7 36. Rdxd6 Rc2 37. Rd4 Re2 38. Ra7+ Ke6 
"We have transposed into a Tarrasch Defense, which usually involves active piece play for Black but a better pawn structure for White.",True," The comment identifies a potential weakness in Black's pawn structure, suggesting a strategic misstep.",1. Nf3 c5 2. b3 d5 3. e3 Nf6 4. Bb2 e6 5. c4 Nc6 6. cxd5 exd5 7. Be2 Be7 8. O-O O-O 9. d4,This is a game between Petrosian (as White) and Hort (as Black). Last move played: White plays Pawn to d4,Slight advantage for White (eval: 38 centipawns),9... cxd4 10. Nxd4 ,9. d4 Ne4 10. dxc5 Bxc5 11. Nc3 Ba3 12. Bxa3 Nxc3 13. Qd3 Nxe2+ 14. Qxe2 Re8 15. Bb2 Bg4 16. h3 Bh5 17. Rfd1 Qd7 18. Rd2 Rad8 19. Rc1 h6 20. Rc5 b6 21. Rcxd5 Qxd5 22. Rxd5 Rxd5 23. g4 
