comment,good,reasoning,moves,context,engine_eval,engine_best_line,engine_best_alternative
"This type of position arises frequently from the QGD. The essential difference between it and the foregoing examples is the advanced position of the Black e-pawn. This generally betokens a slight imporvement in Black's prospects, for the e-pawn can be an important element in a Kingside attack, while the strong square d5 can also be veryuseful",True," The comment offers potential insights into why the move was considered a mistake, suggesting a positional advantage for Black.",1. d4 d5 2. c4 e6 3. Nc3 Nf6 4. Nf3 Nbd7 5. Bg5 c6 6. cxd5 exd5 7. e3 Be7 8. Qc2 O-O 9. Bd3 Re8 10. O-O h6 11. Bh4 Ne4 12. Bxe7 Qxe7 13. Bxe4 dxe4 14. Nd2 Nf6,This is a game between Kramer (as White) and Van Scheltinga (as Black). Last move played: Black plays Knight to f6,The position is equal,15. Rac1 Bf5 ,14... Nf6 15. Rfc1 
This advance is possible without preparation,True," The comment suggests the move is weak due to lack of planning, indicating a flawed strategic decision.",1. d4 d5 2. c4 e6 3. Nc3 Nf6 4. Nf3 Nbd7 5. Bg5 c6 6. cxd5 exd5 7. e3 Be7 8. Qc2 O-O 9. Bd3 Re8 10. O-O h6 11. Bh4 Ne4 12. Bxe7 Qxe7 13. Bxe4 dxe4 14. Nd2 Nf6 15. b4,This is a game between Kramer (as White) and Van Scheltinga (as Black). Last move played: White plays Pawn to b4,Slight advantage for Black (eval: -20 centipawns),15... Bf5 ,15. Rac1 Bf5 
This practically forces the following weakening move,True,", The comment suggests the move is leading to a disadvantageous pawn structure, indicating a flawed strategic choice.",1. d4 d5 2. c4 e6 3. Nc3 Nf6 4. Nf3 Nbd7 5. Bg5 c6 6. cxd5 exd5 7. e3 Be7 8. Qc2 O-O 9. Bd3 Re8 10. O-O h6 11. Bh4 Ne4 12. Bxe7 Qxe7 13. Bxe4 dxe4 14. Nd2 Nf6 15. b4 Bd7 16. Rfc1 h5 17. Rab1 h4,This is a game between Kramer (as White) and Van Scheltinga (as Black). Last move played: Black plays Pawn to h4,The position is equal,18. h3 Rac8 19. a4 Bf5 20. Qb3 b6 21. a5 Red8 22. axb6 axb6 23. Qc4 g5 24. Qf1 b5 25. Ne2 Bd7 ,17... h4 
"White must hurry, or his Kingside will be overrun",True," The comment suggests a potential tactical vulnerability, indicating a flawed strategic assessment.",1. d4 d5 2. c4 e6 3. Nc3 Nf6 4. Nf3 Nbd7 5. Bg5 c6 6. cxd5 exd5 7. e3 Be7 8. Qc2 O-O 9. Bd3 Re8 10. O-O h6 11. Bh4 Ne4 12. Bxe7 Qxe7 13. Bxe4 dxe4 14. Nd2 Nf6 15. b4 Bd7 16. Rfc1 h5 17. Rab1 h4 18. h3 g5 19. b5,This is a game between Kramer (as White) and Van Scheltinga (as Black). Last move played: White plays Pawn to b5,Slight advantage for White (eval: 34 centipawns),19... cxb5 20. Nxb5 ,19. Nc4 Rac8 20. Ne5 Bf5 21. f3 Nd5 22. Nxe4 f6 23. Nxf6+ Qxf6 24. e4 Bh7 25. b5 Nf4 26. bxc6 bxc6 27. Rb7 Re7 28. Qb3+ Kg7 29. Rxc6 Rxc6 30. Nxc6 Rxb7 31. Qxb7+ Kh8 32. Ne5 Ne2+ 33. Kf2 Nxd4 34. Nf7+ Kg8 35. Nxg5 Bg6 36. Qb8+ 
Black must also push on. It is too late for defence,True," The comment suggests a continuation of an attack, implying a flawed defensive strategy.",1. d4 d5 2. c4 e6 3. Nc3 Nf6 4. Nf3 Nbd7 5. Bg5 c6 6. cxd5 exd5 7. e3 Be7 8. Qc2 O-O 9. Bd3 Re8 10. O-O h6 11. Bh4 Ne4 12. Bxe7 Qxe7 13. Bxe4 dxe4 14. Nd2 Nf6 15. b4 Bd7 16. Rfc1 h5 17. Rab1 h4 18. h3 g5 19. b5 g4,This is a game between Kramer (as White) and Van Scheltinga (as Black). Last move played: Black plays Pawn to g4,Advantage for White (eval: 55 centipawns),20. bxc6 bxc6 ,19... cxb5 20. Nxb5 
The discovered Check is not as dangerous as White has Qh3,True, The comment suggests a misjudgment of the potential threat posed by the discovered check.,1. d4 d5 2. c4 e6 3. Nc3 Nf6 4. Nf3 Nbd7 5. Bg5 c6 6. cxd5 exd5 7. e3 Be7 8. Qc2 O-O 9. Bd3 Re8 10. O-O h6 11. Bh4 Ne4 12. Bxe7 Qxe7 13. Bxe4 dxe4 14. Nd2 Nf6 15. b4 Bd7 16. Rfc1 h5 17. Rab1 h4 18. h3 g5 19. b5 g4 20. hxg4 Bxg4 21. bxc6 bxc6 22. Na4 Nd5 23. Qxc6 Rad8 24. Nc5 Bf5 25. Nb7 Qg5 26. Nxd8 Rxd8 27. Kh2 Nf6 28. Qc7 Ng4+ 29. Kg1 h3 30. gxh3,This is a game between Kramer (as White) and Van Scheltinga (as Black). Last move played: White plays Pawn takes on h3,Large advantage for White (eval: 249 centipawns),30... Nxe3+ 31. Qg3 Qxg3+ 32. fxg3 Rxd4 33. Nb3 Ra4 34. Rc3 Nd5 35. Rc5 Be6 36. Rd1 Ne3 37. Re1 Nf5 38. Re2 Nd4 39. Nxd4 Rxd4 40. Re5 Bd5 41. Kf2 Kg7 42. g4 Rd3 43. Re3 Bxa2 ,30. Qg3 Kh7 31. Rc5 hxg2 32. Kxg2 Rd6 33. Rh1+ Kg7 34. Kf1 Rg6 35. Ke1 Rb6 36. Qh4 Qxh4 37. Rxh4 Kg6 38. a4 Rb4 39. Nxe4 Rb2 40. Nd2 Ra2 41. e4 Be6 42. Ke2 f5 43. d5 Nxf2 44. dxe6 Nxe4 
