comment,good,reasoning,moves,context,engine_eval,engine_best_line,engine_best_alternative
The queen prepares to switch over to the kingside attack.,True," The comment suggests a potential tactical weakness, indicating a flawed move.",1. c4 Nf6 2. Nc3 e6 3. Nf3 b6 4. d4 Bb7 5. a3 d5 6. cxd5 Nxd5 7. e3 Be7 8. Bb5+ c6 9. Bd3 c5 10. Nxd5 Qxd5 11. dxc5 Qxc5 12. Bd2 Nc6 13. Rc1 Qd6 14. Qc2 Rc8 15. O-O h6 16. Rfd1 O-O 17. Bc3 Qb8 18. Qa4,This is a game between Petrosian (as White) and Smyslov (as Black). Last move played: White plays Queen to a4,Large advantage for White (eval: 139 centipawns),18... Rfd8 ,18. Qa4 Rfd8 
White forces another weakening in the Black pawn structure due to the threat of Qh7+.,True," The comment suggests a tactical threat, indicating a flaw in the move's assessment.",1. c4 Nf6 2. Nc3 e6 3. Nf3 b6 4. d4 Bb7 5. a3 d5 6. cxd5 Nxd5 7. e3 Be7 8. Bb5+ c6 9. Bd3 c5 10. Nxd5 Qxd5 11. dxc5 Qxc5 12. Bd2 Nc6 13. Rc1 Qd6 14. Qc2 Rc8 15. O-O h6 16. Rfd1 O-O 17. Bc3 Qb8 18. Qa4 Rfd8 19. Qe4,This is a game between Petrosian (as White) and Smyslov (as Black). Last move played: White plays Queen to e4,Large advantage for White (eval: 139 centipawns),19... g6 20. Qg4 h5 21. Qh3 e5 22. Bxg6 fxg6 23. Qe6+ Kf8 24. Bb4 Rxd1+ 25. Rxd1 Nxb4 26. Nxe5 Bd5 27. Nxg6+ Kg7 28. Qxe7+ Kxg6 29. h4 Bf7 30. axb4 Kg7 31. Rd6 Rc1+ 32. Kh2 ,19. Qe4 g6 20. Qg4 h5 21. Qh3 e5 22. g4 hxg4 23. Qxg4 Kg7 24. Nh4 Bxh4 25. Qxh4 Rc7 26. Bc2 Rxd1+ 27. Rxd1 Qh8 28. Qg5 Qh5 29. Qxh5 gxh5 30. Rd6 
"Look at this position. All Black's pieces are on the queenside, and the king stands naked in the corner. White will destroy the Black fortress with a strong attack, using his better-placed pieces.",True," The comment offers a concise explanation of why the move was considered a mistake, highlighting a vulnerability in Black's position.",1. c4 Nf6 2. Nc3 e6 3. Nf3 b6 4. d4 Bb7 5. a3 d5 6. cxd5 Nxd5 7. e3 Be7 8. Bb5+ c6 9. Bd3 c5 10. Nxd5 Qxd5 11. dxc5 Qxc5 12. Bd2 Nc6 13. Rc1 Qd6 14. Qc2 Rc8 15. O-O h6 16. Rfd1 O-O 17. Bc3 Qb8 18. Qa4 Rfd8 19. Qe4 g6,This is a game between Petrosian (as White) and Smyslov (as Black). Last move played: Black plays Pawn to g6,Large advantage for White (eval: 144 centipawns),20. Qg4 ,19... g6 20. Qg4 h5 21. Qh3 e5 22. Bxg6 fxg6 23. Qe6+ Kf8 24. Bb4 Rxd1+ 25. Rxd1 Nxb4 26. Nxe5 Bd5 27. Nxg6+ Kg7 28. Qxe7+ Kxg6 29. h4 Bf7 30. axb4 Kg7 31. Rd6 Rc1+ 32. Kh2 
20...Kh7 21.Bxg6+ fxg6 22.Qxe6 Gives White a winning attack.,True," The comment suggests a tactical error, indicating a potential weakness that could lead to a win.",1. c4 Nf6 2. Nc3 e6 3. Nf3 b6 4. d4 Bb7 5. a3 d5 6. cxd5 Nxd5 7. e3 Be7 8. Bb5+ c6 9. Bd3 c5 10. Nxd5 Qxd5 11. dxc5 Qxc5 12. Bd2 Nc6 13. Rc1 Qd6 14. Qc2 Rc8 15. O-O h6 16. Rfd1 O-O 17. Bc3 Qb8 18. Qa4 Rfd8 19. Qe4 g6 20. Qg4 h5,This is a game between Petrosian (as White) and Smyslov (as Black). Last move played: Black plays Pawn to h5,Large advantage for White (eval: 135 centipawns),21. Qh3 e5 22. g4 hxg4 23. Qxg4 Kg7 24. Nh4 Bxh4 25. Qxh4 Rd6 26. Be4 Qc7 27. Qg5 Qd7 28. Rxd6 Qxd6 29. f4 Nd4 30. fxe5 Qe6 31. Bxb7 ,20... h5 21. Qh3 e5 22. g4 hxg4 23. Qxg4 Kg7 24. h4 Bf6 25. h5 Ne7 26. hxg6 fxg6 27. Ng5 Bd5 28. Ba6 Rc6 29. e4 Bb3 30. Rxd8 Qxd8 31. Nf3 Bd1 32. Qg3 Bxf3 33. Qxf3 Rc7 
After this central break Black's position collapses .,True," The comment accurately describes a detrimental consequence of the move, suggesting a significant positional weakness.",1. c4 Nf6 2. Nc3 e6 3. Nf3 b6 4. d4 Bb7 5. a3 d5 6. cxd5 Nxd5 7. e3 Be7 8. Bb5+ c6 9. Bd3 c5 10. Nxd5 Qxd5 11. dxc5 Qxc5 12. Bd2 Nc6 13. Rc1 Qd6 14. Qc2 Rc8 15. O-O h6 16. Rfd1 O-O 17. Bc3 Qb8 18. Qa4 Rfd8 19. Qe4 g6 20. Qg4 h5 21. Qh3 f5 22. Bc4 Rxd1+ 23. Rxd1 Kf7 24. e4,This is a game between Petrosian (as White) and Smyslov (as Black). Last move played: White plays Pawn to e4,Large advantage for White (eval: 216 centipawns),24... Qf4 25. Re1 Rd8 26. exf5 Qxc4 27. fxg6+ Kxg6 28. Rxe6+ Kf7 29. Qf5+ Ke8 30. Qxh5+ Kf8 31. Rh6 Qxc3 32. Rh8+ Qxh8 33. Qxh8+ Kf7 34. Qh5+ Kf8 35. Nd2 Bf6 36. Nc4 Rd4 37. b3 ,24. Bb3 Rd8 25. Re1 Bf6 26. Bxf6 Kxf6 27. Qh4+ Kg7 28. Ng5 Bc8 29. Bxe6 Rd6 30. Bxc8 Qxc8 31. Qc4 Qd7 32. Qc3+ Kg8 33. Nf3 Rd3 34. Qc2 Rd5 35. h3 Rc5 36. Qb1 Ne5 37. Nxe5 Rxe5 38. Rd1 Qe6 39. Rd8+ Kh7 
"Now White has a powerful passed pawn, which also helps the attack by covering the f7-square. 27...Kxg6 28.Rxe6+ Kf7 29.Rxc6 Qxc6 30.Ne5+ when White wins the queen.",True," The comment describes a potential tactical advantage, suggesting a favorable outcome for White, potentially indicating a flawed evaluation of the position.",1. c4 Nf6 2. Nc3 e6 3. Nf3 b6 4. d4 Bb7 5. a3 d5 6. cxd5 Nxd5 7. e3 Be7 8. Bb5+ c6 9. Bd3 c5 10. Nxd5 Qxd5 11. dxc5 Qxc5 12. Bd2 Nc6 13. Rc1 Qd6 14. Qc2 Rc8 15. O-O h6 16. Rfd1 O-O 17. Bc3 Qb8 18. Qa4 Rfd8 19. Qe4 g6 20. Qg4 h5 21. Qh3 f5 22. Bc4 Rxd1+ 23. Rxd1 Kf7 24. e4 Qf4 25. Re1 Qg4 26. exf5 Qxc4 27. fxg6+ Ke8,This is a game between Petrosian (as White) and Smyslov (as Black). Last move played: Black plays King to e8,Large advantage for White (eval: 517 centipawns),28. g7 Kd7 29. Rd1+ Bd6 30. Be5 Nd4 31. Nxd4 Bxe5 32. Nf3+ Kc7 33. Nxe5 Qe2 34. Qc3+ Kb8 35. Rc1 Rxc3 36. g8=Q+ Bc8 37. bxc3 Qxe5 38. h4 Qb5 ,27... Ke8 28. g7 Kd7 29. Rd1+ Bd6 30. Qg3 e5 31. Bxe5 Nxe5 32. Nxe5+ Kc7 33. Nxc4 Bxg3 34. hxg3 Rg8 35. Nd6 Bc6 36. Nf5 Kb8 
28...Kd7 29.Rd1+ Kc7 30.Qg3+ Wins material for White.,True," The comment directly states that White wins material, indicating a flaw in the move's strategic assessment.",1. c4 Nf6 2. Nc3 e6 3. Nf3 b6 4. d4 Bb7 5. a3 d5 6. cxd5 Nxd5 7. e3 Be7 8. Bb5+ c6 9. Bd3 c5 10. Nxd5 Qxd5 11. dxc5 Qxc5 12. Bd2 Nc6 13. Rc1 Qd6 14. Qc2 Rc8 15. O-O h6 16. Rfd1 O-O 17. Bc3 Qb8 18. Qa4 Rfd8 19. Qe4 g6 20. Qg4 h5 21. Qh3 f5 22. Bc4 Rxd1+ 23. Rxd1 Kf7 24. e4 Qf4 25. Re1 Qg4 26. exf5 Qxc4 27. fxg6+ Ke8 28. g7 e5,This is a game between Petrosian (as White) and Smyslov (as Black). Last move played: Black plays Pawn to e5,Large advantage for White (eval: 711 centipawns),29. Qxh5+ Kd8 30. Rd1+ Bd6 31. Bxe5 Nxe5 32. Qxe5 Rc6 33. Qg5+ Kc7 34. g8=Q Qxg8 35. Qxg8 b5 36. h4 a5 37. Kh1 Kb6 38. Rxd6 Rxd6 39. Qb8 Rd3 40. Kh2 Rd7 41. Ne5 ,28... Kd7 29. Qxh5 Bd6 30. Qf7+ Ne7 31. Bf6 Bxf3 32. gxf3 Qd5 33. Bxe7 Bxe7 34. g8=R Rxg8+ 35. Qxg8 Bc5 36. Kg2 Bxf2 37. Qf7+ Kd6 38. Qf4+ e5 39. Qf6+ Kc7 40. Rc1+ Kd7 
31...Nxe5 32.Nxe5+,True," The comment suggests a potential tactical blunder, indicating a weakness in the player's planning.",1. c4 Nf6 2. Nc3 e6 3. Nf3 b6 4. d4 Bb7 5. a3 d5 6. cxd5 Nxd5 7. e3 Be7 8. Bb5+ c6 9. Bd3 c5 10. Nxd5 Qxd5 11. dxc5 Qxc5 12. Bd2 Nc6 13. Rc1 Qd6 14. Qc2 Rc8 15. O-O h6 16. Rfd1 O-O 17. Bc3 Qb8 18. Qa4 Rfd8 19. Qe4 g6 20. Qg4 h5 21. Qh3 f5 22. Bc4 Rxd1+ 23. Rxd1 Kf7 24. e4 Qf4 25. Re1 Qg4 26. exf5 Qxc4 27. fxg6+ Ke8 28. g7 e5 29. Qxh5+ Kd7 30. Rd1+ Bd6 31. Bxe5 Nd4,This is a game between Petrosian (as White) and Smyslov (as Black). Last move played: Black plays Knight to d4,Large advantage for White (eval: 815 centipawns),32. Nxd4 Bxe5 33. Nf3+ Qd5 34. Nxe5+ Kc7 35. Rxd5 Bxd5 36. h4 Kb7 37. Kh2 Rc7 38. Qg5 a5 39. Qg6 a4 40. f3 Rc5 41. Qf6 Bb3 42. h5 Bg8 43. Qe7+ Ka6 ,31... Nd4 32. Nxd4 Bd5 33. Bxd6 Kxd6 34. Nf5+ Kc7 35. Ne3 Qe4 36. Nxd5+ Kb8 37. Qf7 Qh7 38. Ne3 Rg8 39. Qf4+ Ka8 40. Qf3+ Kb8 41. Nf5 a5 42. h4 Rxg7 43. Nxg7 Qxg7 44. Qg3+ Kb7 45. Qxg7+ Ka6 
Black resigned. 32.Nxd4 Bxe5 33.Nf3+ Bd6 34.Ne5+ would win the Black queen.,True," The comment offers a potential winning sequence for the black queen, indicating a flawed assessment of the position.",1. c4 Nf6 2. Nc3 e6 3. Nf3 b6 4. d4 Bb7 5. a3 d5 6. cxd5 Nxd5 7. e3 Be7 8. Bb5+ c6 9. Bd3 c5 10. Nxd5 Qxd5 11. dxc5 Qxc5 12. Bd2 Nc6 13. Rc1 Qd6 14. Qc2 Rc8 15. O-O h6 16. Rfd1 O-O 17. Bc3 Qb8 18. Qa4 Rfd8 19. Qe4 g6 20. Qg4 h5 21. Qh3 f5 22. Bc4 Rxd1+ 23. Rxd1 Kf7 24. e4 Qf4 25. Re1 Qg4 26. exf5 Qxc4 27. fxg6+ Ke8 28. g7 e5 29. Qxh5+ Kd7 30. Rd1+ Bd6 31. Bxe5 Nd4 32. Nxd4,This is a game between Petrosian (as White) and Smyslov (as Black). Last move played: White plays Knight takes on d4,Large advantage for White (eval: 828 centipawns),32... Bxe5 33. Nf3+ Qd5 34. Rxd5+ Bxd5 35. Nxe5+ Kc7 36. h4 Kb7 37. Kh2 Rc7 38. Qg5 a6 39. Qf6 a5 40. f3 Ka7 41. Kg3 b5 42. Kf4 b4 43. axb4 axb4 44. h5 Bg8 45. Kg5 ,32. Nxd4 Bxe5 33. Nf3+ Qd5 34. Nxe5+ Kc7 35. Rxd5 Bxd5 36. h4 Kb7 37. Kh2 Rc7 38. Qg5 a5 39. Qg6 a4 40. f3 Rc5 41. Qf6 Bb3 42. h5 Bg8 43. Qe7+ Ka6 
Petrosian was successful with this line but it didn't become popular until Kasparov took it up in the 1980s.,True,", The comment offers a potential explanation for the move's perceived failure, suggesting it was initially overlooked.",1. c4 Nf6 2. Nc3 e6 3. Nf3 b6 4. d4 Bb7 5. a3 d5 6. cxd5 Nxd5 7. e3,This is a game between Petrosian (as White) and Smyslov (as Black). Last move played: White plays Pawn to e3,The position is equal,7... Be7 ,7. Qc2 Be7 
White forces another weakening in the Black pawn structure due to the threat of Qh7+.,True, The comment clearly describes a tactical sacrifice that undermines Black’s king safety.,1. c4 Nf6 2. Nc3 e6 3. Nf3 b6 4. d4 Bb7 5. a3 d5 6. cxd5 Nxd5 7. e3 Be7 8. Bb5+ c6 9. Bd3 c5 10. Nxd5 Qxd5 11. dxc5 Qxc5 12. Bd2 Nc6 13. Rc1 Qd6 14. Qc2 Rc8 15. O-O h6 16. Rfd1 O-O 17. Bc3 Qb8 18. Qa4 Rfd8 19. Qe4,This is a game between Petrosian (as White) and Smyslov (as Black). Last move played: White plays Queen to e4,Large advantage for White (eval: 139 centipawns),19... g6 20. Qg4 h5 21. Qh3 e5 22. Bxg6 fxg6 23. Qe6+ Kf8 24. Bb4 Rxd1+ 25. Rxd1 Nxb4 26. Nxe5 Bd5 27. Nxg6+ Kg7 28. Qxe7+ Kxg6 29. h4 Bf7 30. axb4 Kg7 31. Rd6 Rc1+ 32. Kh2 ,19. Qe4 g6 20. Qg4 h5 21. Qh3 e5 22. g4 hxg4 23. Qxg4 Kg7 24. Nh4 Bxh4 25. Qxh4 Rc7 26. Bc2 Rxd1+ 27. Rxd1 Qh8 28. Qg5 Qh5 29. Qxh5 gxh5 30. Rd6 
This weakens the Black kingside. 15...Bf6 Followed by g6 would be less weakening.,True," The comment suggests a strategic intention that was flawed, indicating a mistake.",1. c4 Nf6 2. Nc3 e6 3. Nf3 b6 4. d4 Bb7 5. a3 d5 6. cxd5 Nxd5 7. e3 Be7 8. Bb5+ c6 9. Bd3 c5 10. Nxd5 Qxd5 11. dxc5 Qxc5 12. Bd2 Nc6 13. Rc1 Qd6 14. Qc2 Rc8 15. O-O h6,This is a game between Petrosian (as White) and Smyslov (as Black). Last move played: Black plays Pawn to h6,Large advantage for White (eval: 113 centipawns),16. Rfd1 Qb8 ,15... Bf6 
