comment,good,reasoning,moves,context,engine_eval,engine_best_line,engine_best_alternative
This weakens White's kingside.,True," The comment provides a specific assessment of the move's impact, suggesting a tactical weakness.",1. e4 e5 2. Nf3 Nc6 3. d4 exd4 4. Bc4 Nf6 5. e5 d5 6. Bb5 Ne4 7. Nxd4 Bc5 8. Be3 Bxd4 9. Qxd4 O-O 10. Bxc6 bxc6 11. f3,This is a game between Hunerkopf (as White) and Spassky (as Black). Last move played: White plays Pawn to f3,Large advantage for Black (eval: -242 centipawns),11... c5 12. Qd3 Qh4+ 13. Kd1 Rd8 14. Kc1 Nf2 15. Bxf2 Qxf2 16. Qd2 Qh4 17. Nc3 Be6 18. a4 Rab8 19. f4 d4 20. Nb5 Rb7 21. Ra3 Qe7 ,11. Nc3 
This is a big mistake. White's queen now gets cut off from the center and the kingside and Black's knight gives him a ready made attack on the weakened e1-h4 diagonal.,True, The comment accurately describes a positional vulnerability created by the queen's exposure.,1. e4 e5 2. Nf3 Nc6 3. d4 exd4 4. Bc4 Nf6 5. e5 d5 6. Bb5 Ne4 7. Nxd4 Bc5 8. Be3 Bxd4 9. Qxd4 O-O 10. Bxc6 bxc6 11. f3 c5 12. Qa4,This is a game between Hunerkopf (as White) and Spassky (as Black). Last move played: White plays Queen to a4,Large advantage for Black (eval: -327 centipawns),12... Qh4+ 13. g3 Qh5 14. O-O Bh3 15. Na3 Bxf1 16. Rxf1 Ng5 17. Bxg5 Qxg5 18. f4 Qg6 19. b3 Qb6 20. Re1 c4+ 21. Kg2 Qc5 22. bxc4 Rad8 23. Qb3 dxc4 24. Qc3 Rd4 25. e6 fxe6 26. Re5 ,12. Qd3 Qh4+ 13. Kd1 Rd8 14. Kc1 Nf2 15. Bxf2 Qxf2 16. Qd2 Qh4 17. Nc3 Be6 18. a4 Qe7 19. f4 d4 20. Ne4 c4 21. Rf1 d3 22. Qc3 Bd5 23. cxd3 cxd3 24. Qxd3 Rab8 25. Qc2 
"Losing immediately. White has missed Black's 16th move. His best try would be 14.Kd1, though Black would keep an attack after 14...Qh5.",True," The comment identifies a critical missed opportunity and suggests a reasonable response, indicating a flawed strategic decision.",1. e4 e5 2. Nf3 Nc6 3. d4 exd4 4. Bc4 Nf6 5. e5 d5 6. Bb5 Ne4 7. Nxd4 Bc5 8. Be3 Bxd4 9. Qxd4 O-O 10. Bxc6 bxc6 11. f3 c5 12. Qa4 Bd7 13. Qa3 Qh4+ 14. g3,This is a game between Hunerkopf (as White) and Spassky (as Black). Last move played: White plays Pawn to g3,Large advantage for Black (eval: -472 centipawns),14... Nxg3 15. Rg1 Nf5+ 16. Bf2 Qxh2 17. Nc3 Qxe5+ 18. Ne2 d4 19. f4 Qe7 20. Kd2 Qd6 21. Rae1 g6 22. Kc1 Rfe8 23. Qf3 Rab8 24. Ng3 Nxg3 25. Bxg3 Bf5 26. Re5 Rxe5 27. fxe5 ,14. Kd1 Nf2+ 15. Bxf2 Qxf2 16. Re1 Qxg2 17. Qxc5 Qxf3+ 18. Kc1 Qf4+ 19. Nd2 Qxh2 20. b4 a5 21. bxa5 Rfb8 22. Rb1 Rxb1+ 23. Nxb1 Be6 24. Nd2 Qf4 25. Qxc7 Qb4 26. Rg1 Qxa5 27. Qxa5 Rxa5 
"White had counted on this counter pin, but by leaving the c1-h6 diagonal the bishop has exposed White's other weakness, the first rank.",True," The comment identifies a strategic blunder related to the bishop's exposure, suggesting a flawed assessment of the position.",1. e4 e5 2. Nf3 Nc6 3. d4 exd4 4. Bc4 Nf6 5. e5 d5 6. Bb5 Ne4 7. Nxd4 Bc5 8. Be3 Bxd4 9. Qxd4 O-O 10. Bxc6 bxc6 11. f3 c5 12. Qa4 Bd7 13. Qa3 Qh4+ 14. g3 Nxg3 15. Bf2,This is a game between Hunerkopf (as White) and Spassky (as Black). Last move played: White plays Bishop to f2,Large advantage for Black (eval: -488 centipawns),15... Qf4 16. Qe3 Qxe3+ 17. Bxe3 Nxh1 18. Bxc5 Rfe8 19. Nc3 Rxe5+ 20. Kd2 Rg5 21. Rxh1 Rg2+ 22. Kd1 Bf5 23. Nxd5 Rd8 24. c4 Rxb2 25. Re1 Rxh2 26. Be7 Rb8 27. Bb4 Kh8 28. Re7 Bc2+ 29. Kc1 ,15. Bf2 Qf4 16. Qe3 Qxe3+ 17. Bxe3 Nxh1 18. Bxc5 Rfe8 19. Nc3 Rxe5+ 20. Kd2 f6 21. Rxh1 a5 22. a4 Rae8 23. Rf1 d4 24. Bxd4 Rh5 25. Bg1 Rd8 26. Rf2 
"White resigned here, since he has only one way to avoid the check on c1 without losing his rook,",True," The comment offers a potential reason for the resignation, suggesting a tactical disadvantage.",1. e4 e5 2. Nf3 Nc6 3. d4 exd4 4. Bc4 Nf6 5. e5 d5 6. Bb5 Ne4 7. Nxd4 Bc5 8. Be3 Bxd4 9. Qxd4 O-O 10. Bxc6 bxc6 11. f3 c5 12. Qa4 Bd7 13. Qa3 Qh4+ 14. g3 Nxg3 15. Bf2 Qh6,This is a game between Hunerkopf (as White) and Spassky (as Black). Last move played: Black plays Queen to h6,Large advantage for Black (eval: -492 centipawns),16. Be3 Qh4 17. Rg1 Nf5+ 18. Bf2 Qxh2 19. Nc3 Qxe5+ 20. Kf1 Ne3+ 21. Bxe3 Qxe3 22. Ne2 Qxa3 23. bxa3 c6 24. c4 g6 25. cxd5 cxd5 26. Rg5 Rac8 27. Rc1 Be6 28. Nf4 ,15... Qf4 16. Qe3 Qxe3+ 17. Bxe3 Nxh1 18. Bxc5 Rfe8 19. Nc3 Rxe5+ 20. Kd2 Rg5 21. Rxh1 Rg2+ 22. Kd1 Bf5 23. Nxd5 Rd8 24. c4 Rxb2 25. Re1 Rxh2 26. Be7 Rb8 27. Bb4 Kh8 28. Re7 Bc2+ 29. Kc1 
Black will end up at least two pawns ahead with a continuing attack.,True," The comment suggests a potential tactical advantage for Black, implying a significant positional benefit.",1. e4 e5 2. Nf3 Nc6 3. d4 exd4 4. Bc4 Nf6 5. e5 d5 6. Bb5 Ne4 7. Nxd4 Bc5 8. Be3 Bxd4 9. Qxd4 O-O 10. Bxc6 bxc6 11. f3 c5 12. Qa4 Bd7 13. Qa3 Qh4+ 14. g3 Nxg3 15. Bf2 Qh6 16. Be3 Qh5,This is a game between Hunerkopf (as White) and Spassky (as Black). Last move played: Black plays Queen to h5,Large advantage for Black (eval: -435 centipawns),17. Rg1 Qxh2 18. Qd3 d4 19. Qd2 Nf1 20. Kxf1 Bb5+ 21. Ke1 Qxe5 22. Nc3 dxe3 23. Qg2 Bc6 24. Qg5 Qxg5 25. Rxg5 Bxf3 26. Rf5 Bg4 27. Rxc5 h5 28. Nd5 Rad8 29. Ne7+ Kh8 ,16... Qh4 17. Rg1 Nf5+ 18. Bf2 Qxh2 19. Nc3 Qxe5+ 20. Kf1 Ne3+ 21. Bxe3 Qxe3 22. Ne2 Qxa3 23. bxa3 g6 24. Nf4 c6 25. Re1 Bf5 26. Kf2 c4 27. c3 Kh8 28. a4 a5 29. Rg5 Rfe8 
White lost time in order to weaken Black's queenside pawns. He should now play to consolidate by 11.O-O.,True," The comment suggests a strategic error by White, aiming for consolidation, which is a common mistake in chess.",1. e4 e5 2. Nf3 Nc6 3. d4 exd4 4. Bc4 Nf6 5. e5 d5 6. Bb5 Ne4 7. Nxd4 Bc5 8. Be3 Bxd4 9. Qxd4 O-O 10. Bxc6 bxc6,This is a game between Hunerkopf (as White) and Spassky (as Black). Last move played: Black plays Pawn takes on c6,Advantage for White (eval: 82 centipawns),11. Nc3 ,10... bxc6 
This weakens White's kingside.,True," The comment suggests a potential tactical risk, indicating a flawed evaluation of the resulting position.",1. e4 e5 2. Nf3 Nc6 3. d4 exd4 4. Bc4 Nf6 5. e5 d5 6. Bb5 Ne4 7. Nxd4 Bc5 8. Be3 Bxd4 9. Qxd4 O-O 10. Bxc6 bxc6 11. f3,This is a game between Hunerkopf (as White) and Spassky (as Black). Last move played: White plays Pawn to f3,Large advantage for Black (eval: -242 centipawns),11... c5 12. Qd3 Qh4+ 13. Kd1 Rd8 14. Kc1 Nf2 15. Bxf2 Qxf2 16. Qd2 Qh4 17. Nc3 Be6 18. a4 Rab8 19. f4 d4 20. Nb5 Rb7 21. Ra3 Qe7 ,11. Nc3 
