comment,good,reasoning,moves,context,engine_eval,engine_best_line,engine_best_alternative
Striking at the center by offering to trade a flank pawn for a center pawn.,True," The comment suggests a tactical blunder by sacrificing a flank pawn for a center pawn, indicating a poor strategic choice.",1. d4 Nf6 2. Nf3 e6 3. Bg5 d5 4. e3 Nbd7 5. c4,"This is a game between Marshall,F (as White) and Bogoljubow,E (as Black). Last move played: White plays Pawn to c4",Slight advantage for White (eval: 22 centipawns),5... h6 6. Bh4 ,5. c4 h6 6. Bh4 Be7 7. Nc3 O-O 8. cxd5 Nxd5 9. Bxe7 Qxe7 10. Nxd5 exd5 11. Rc1 c6 12. Bd3 Qb4+ 13. Qd2 a5 14. Rc3 Nf6 15. Qc2 
Now Marshall is prepared to castle Kingside.,True," The comment suggests a potential tactical weakness, indicating a mistake.",1. d4 Nf6 2. Nf3 e6 3. Bg5 d5 4. e3 Nbd7 5. c4 c6 6. cxd5 exd5 7. Nc3 Qa5 8. Bd3,"This is a game between Marshall,F (as White) and Bogoljubow,E (as Black). Last move played: White plays Bishop to d3",Slight advantage for White (eval: 32 centipawns),8... Ne4 9. O-O Nxg5 10. Nxg5 Qd8 11. f4 Nf6 12. Qc2 g6 13. Rae1 Bg7 14. Nf3 O-O 15. f5 Kh8 16. Kh1 a6 17. Re2 Qd6 18. e4 dxe4 19. Nxe4 Nxe4 20. Bxe4 Qf6 ,8. Nd2 Bb4 9. Qc2 O-O 10. Be2 Be7 11. O-O Qd8 12. Bd3 h6 13. Bh4 Ne8 14. Bg3 Ndf6 15. h3 Be6 16. Kh1 Rc8 17. Rad1 Nd6 18. Na4 Nfe4 19. Nxe4 Nxe4 20. Bxe4 dxe4 21. Qxe4 Bxa2 
"While not technically a ""hole"" (the f-pawn can advance to f3 to drive away the Knight after the Knight moves), it's still a pretty good post for Black's Knight.",True," The comment identifies a potential flaw in the move, suggesting a strategic misstep.",1. d4 Nf6 2. Nf3 e6 3. Bg5 d5 4. e3 Nbd7 5. c4 c6 6. cxd5 exd5 7. Nc3 Qa5 8. Bd3 Ne4,"This is a game between Marshall,F (as White) and Bogoljubow,E (as Black). Last move played: Black plays Knight to e4",Slight advantage for White (eval: 36 centipawns),9. O-O ,8... Ne4 9. O-O Nxg5 10. Nxg5 Qd8 11. f4 Nf6 12. Qc2 g6 13. Rae1 Bg7 14. Nf3 O-O 15. f5 Kh8 16. Kh1 a6 17. Re2 Qd6 18. e4 dxe4 19. Nxe4 Nxe4 20. Bxe4 Qf6 
Take a look at Marshall's position. His pieces are all developed to good squares. The only thing left to do is take care of safeguarding the King by castling.,True," The comment offers a potential explanation for the mistake, suggesting a need for King safety.",1. d4 Nf6 2. Nf3 e6 3. Bg5 d5 4. e3 Nbd7 5. c4 c6 6. cxd5 exd5 7. Nc3 Qa5 8. Bd3 Ne4 9. Qc2 Nxg5 10. Nxg5 h6 11. Nf3,"This is a game between Marshall,F (as White) and Bogoljubow,E (as Black). Last move played: White plays Knight to f3",The position is equal,11... Bd6 12. O-O ,11. Nf3 Bd6 
Another supporter for the advancing e-pawn.,True," The comment suggests the opponent is supporting the pawn advance, indicating a potential weakness in the player’s defensive strategy.",1. d4 Nf6 2. Nf3 e6 3. Bg5 d5 4. e3 Nbd7 5. c4 c6 6. cxd5 exd5 7. Nc3 Qa5 8. Bd3 Ne4 9. Qc2 Nxg5 10. Nxg5 h6 11. Nf3 Be7 12. O-O O-O 13. a3 Qd8 14. Rae1 a5 15. Qe2,"This is a game between Marshall,F (as White) and Bogoljubow,E (as Black). Last move played: White plays Queen to e2",The position is equal,15... Bd6 16. Qc2 ,15. h3 Bd6 
"Marshall finally advances the pawn, under the watchful gaze of four White pieces.",True," The comment describes a potential tactical error, suggesting a weakness in the pawn structure.",1. d4 Nf6 2. Nf3 e6 3. Bg5 d5 4. e3 Nbd7 5. c4 c6 6. cxd5 exd5 7. Nc3 Qa5 8. Bd3 Ne4 9. Qc2 Nxg5 10. Nxg5 h6 11. Nf3 Be7 12. O-O O-O 13. a3 Qd8 14. Rae1 a5 15. Qe2 Nf6 16. Ne5 Bd6 17. f4 c5 18. Bb1 Bd7 19. Qc2 Bc6 20. dxc5 Bxc5 21. Kh1 Re8 22. e4,"This is a game between Marshall,F (as White) and Bogoljubow,E (as Black). Last move played: White plays Pawn to e4",Advantage for White (eval: 55 centipawns),22... dxe4 23. Nxc6 ,22. e4 dxe4 23. Nxc6 bxc6 24. Nxe4 Nxe4 25. Rxe4 Rxe4 26. Qxe4 g6 27. f5 Qf6 28. Qc4 Qd4 29. Qc2 Kg7 30. fxg6 f6 31. Qe2 Qd6 32. Ba2 Rd8 33. Qc4 Qd5 34. Qf4 Qd6 35. Qf3 a4 36. g3 Rd7 37. Kg2 
Driving off the Knight that was covering h7...,True, The comment identifies a specific tactical error – the knight's displacement – which is a clear indication of a mistake.,1. d4 Nf6 2. Nf3 e6 3. Bg5 d5 4. e3 Nbd7 5. c4 c6 6. cxd5 exd5 7. Nc3 Qa5 8. Bd3 Ne4 9. Qc2 Nxg5 10. Nxg5 h6 11. Nf3 Be7 12. O-O O-O 13. a3 Qd8 14. Rae1 a5 15. Qe2 Nf6 16. Ne5 Bd6 17. f4 c5 18. Bb1 Bd7 19. Qc2 Bc6 20. dxc5 Bxc5 21. Kh1 Re8 22. e4 Bd4 23. Nxc6 bxc6 24. e5,"This is a game between Marshall,F (as White) and Bogoljubow,E (as Black). Last move played: White plays Pawn to e5",Large advantage for White (eval: 272 centipawns),24... Ne4 25. Nxe4 dxe4 26. Qxc6 e3 27. Qe4 Qb6 28. Qh7+ Kf8 29. Qh8+ Ke7 30. Qxg7 Rg8 31. Qh7 Qxb2 32. Bc2 Rac8 33. Re2 Qb6 34. h3 Qa6 35. Bd3 Qe6 36. Qe4 Rcd8 37. Rb1 Qd5 38. Qh7 Rb8 ,24. e5 Ne4 25. Nxe4 dxe4 26. Qxc6 e3 27. Qe4 Qb6 28. Qh7+ Kf8 29. Qh8+ Ke7 30. Qxg7 Rg8 31. Qh7 Rab8 32. Re2 Bxb2 33. h3 Rgd8 34. Bd3 Rh8 35. Qe4 Qd4 36. Qf5 Rhd8 37. Rc2 Bxa3 38. Rc7+ Rd7 
...but we see that Qh7 is no longer mate (the Rook has moved and left a square for the Black King).,True," The comment clearly identifies a critical error in the move, explaining why the Rook's move led to the stalemate.",1. d4 Nf6 2. Nf3 e6 3. Bg5 d5 4. e3 Nbd7 5. c4 c6 6. cxd5 exd5 7. Nc3 Qa5 8. Bd3 Ne4 9. Qc2 Nxg5 10. Nxg5 h6 11. Nf3 Be7 12. O-O O-O 13. a3 Qd8 14. Rae1 a5 15. Qe2 Nf6 16. Ne5 Bd6 17. f4 c5 18. Bb1 Bd7 19. Qc2 Bc6 20. dxc5 Bxc5 21. Kh1 Re8 22. e4 Bd4 23. Nxc6 bxc6 24. e5 Ng4 25. Qh7+,"This is a game between Marshall,F (as White) and Bogoljubow,E (as Black). Last move played: White plays Queen to h7 with check",Large advantage for White (eval: 297 centipawns),25... Kf8 26. g3 Rb8 27. Nd1 Ke7 28. Qxg7 Rg8 29. Qh7 Rb3 30. Re2 h5 31. Bc2 Nxh2 32. e6 Rbxg3 33. exf7+ Kd6 34. fxg8=Q Qxg8 35. Qxg8 ,25. Qh7+ Kf8 26. g3 Ke7 27. Qxg7 Rg8 28. Qh7 Rb8 29. Re2 Kf8 30. Nd1 Rb3 31. e6 Qe7 32. Bc2 Rb6 33. h3 Nf6 34. Qxh6+ Rg7 35. g4 Ng8 36. Qh5 fxe6 37. g5 Qf7 38. Qh4 c5 39. Ne3 Bxe3 40. Rxe3 
More forcing than ...Ne3 (which is not a check). White must now give up the exchange.,True," The comment points to a move that sacrifices a potential pawn for a tactical advantage, suggesting a flawed assessment of the resulting position.",1. d4 Nf6 2. Nf3 e6 3. Bg5 d5 4. e3 Nbd7 5. c4 c6 6. cxd5 exd5 7. Nc3 Qa5 8. Bd3 Ne4 9. Qc2 Nxg5 10. Nxg5 h6 11. Nf3 Be7 12. O-O O-O 13. a3 Qd8 14. Rae1 a5 15. Qe2 Nf6 16. Ne5 Bd6 17. f4 c5 18. Bb1 Bd7 19. Qc2 Bc6 20. dxc5 Bxc5 21. Kh1 Re8 22. e4 Bd4 23. Nxc6 bxc6 24. e5 Ng4 25. Qh7+ Kf8 26. g3 Qb6 27. Bf5 Nf2+,"This is a game between Marshall,F (as White) and Bogoljubow,E (as Black). Last move played: Black plays Knight to f2 with check",Large advantage for White (eval: 410 centipawns),28. Kg2 Ne4 29. Bxe4 Qxb2+ 30. Kh3 Bxc3 31. Rb1 Qe2 32. Bf3 Qa6 33. Bh5 c5 34. Qh8+ Ke7 35. Qxg7 Qe6+ 36. f5 Bxe5 37. fxe6 Bxg7 38. Rxf7+ Kd6 39. Rd7+ Kc6 40. Bxe8 Rxe8 41. Rxg7 Rxe6 42. Rf1 ,27... Ne3 28. Rxe3 Bxe3 29. Qh8+ Ke7 30. Qxg7 Rg8 31. Qxh6 Ra7 32. Rc1 Rb8 33. Rc2 Rab7 34. Kg2 Bd4 35. h4 Bxc3 36. Qd6+ Ke8 37. bxc3 Qe3 38. Qxc6+ Kf8 39. Qh6+ Ke7 
Bogo walks right into a forced mate.,True," The comment directly indicates a forced mate, signaling a significant tactical error.",1. d4 Nf6 2. Nf3 e6 3. Bg5 d5 4. e3 Nbd7 5. c4 c6 6. cxd5 exd5 7. Nc3 Qa5 8. Bd3 Ne4 9. Qc2 Nxg5 10. Nxg5 h6 11. Nf3 Be7 12. O-O O-O 13. a3 Qd8 14. Rae1 a5 15. Qe2 Nf6 16. Ne5 Bd6 17. f4 c5 18. Bb1 Bd7 19. Qc2 Bc6 20. dxc5 Bxc5 21. Kh1 Re8 22. e4 Bd4 23. Nxc6 bxc6 24. e5 Ng4 25. Qh7+ Kf8 26. g3 Qb6 27. Bf5 Nf2+ 28. Rxf2 Bxf2 29. Qh8+ Ke7 30. Qxg7 Kd8 31. Qf6+ Re7 32. e6 Bd4 33. exf7 Bxf6 34. f8=Q+ Kc7 35. Rxe7+ Bxe7 36. Qxa8 Kd6 37. Qh8 Qd8,"This is a game between Marshall,F (as White) and Bogoljubow,E (as Black). Last move played: Black plays Queen to d8",Mate in 5 for White,38. Qe5+ Kc5 39. Na4+ Kc4 40. Qc3+ Kb5 41. Bd3+ Kxa4 42. Qc2# ,37... Qb7 38. Qe5+ Kc5 39. Na4+ Kb5 40. Qe2+ Kxa4 41. Bc2+ Qb3 42. Bxb3+ Kxb3 43. Qxe7 Kc4 44. Kg2 h5 45. f5 h4 46. Kh3 hxg3 47. hxg3 d4 48. f6 Kb3 49. Qc5 a4 50. Qxd4 c5 51. Qxc5 Kxb2 52. f7 Kb3 53. Qb5+ Kc3 54. Qb4+ Kd3 
Marshall announced a forced mate in five and Bogo resigned.,True," The comment indicates a forced mate, suggesting a significant tactical error.",1. d4 Nf6 2. Nf3 e6 3. Bg5 d5 4. e3 Nbd7 5. c4 c6 6. cxd5 exd5 7. Nc3 Qa5 8. Bd3 Ne4 9. Qc2 Nxg5 10. Nxg5 h6 11. Nf3 Be7 12. O-O O-O 13. a3 Qd8 14. Rae1 a5 15. Qe2 Nf6 16. Ne5 Bd6 17. f4 c5 18. Bb1 Bd7 19. Qc2 Bc6 20. dxc5 Bxc5 21. Kh1 Re8 22. e4 Bd4 23. Nxc6 bxc6 24. e5 Ng4 25. Qh7+ Kf8 26. g3 Qb6 27. Bf5 Nf2+ 28. Rxf2 Bxf2 29. Qh8+ Ke7 30. Qxg7 Kd8 31. Qf6+ Re7 32. e6 Bd4 33. exf7 Bxf6 34. f8=Q+ Kc7 35. Rxe7+ Bxe7 36. Qxa8 Kd6 37. Qh8 Qd8 38. Qe5+,"This is a game between Marshall,F (as White) and Bogoljubow,E (as Black). Last move played: White plays Queen to e5 with check",Mate in 4 for White,38... Kc5 39. Na4+ Kc4 40. Qc3+ Kb5 41. Bd3+ Kxa4 42. Qc2# ,38. Qe5+ Kc5 39. Na4+ Kc4 40. Qc3+ Kb5 41. Bd3+ Kxa4 42. Qc2# 
Bogo defends the pawn and makes sure he'll still have two center pawns after a trade.,True," The comment suggests a potential tactical improvement, indicating a flaw in the move's assessment.",1. d4 Nf6 2. Nf3 e6 3. Bg5 d5 4. e3 Nbd7 5. c4 c6,"This is a game between Marshall,F (as White) and Bogoljubow,E (as Black). Last move played: Black plays Pawn to c6",Slight advantage for White (eval: 31 centipawns),6. Qc2 h6 ,5... h6 6. Bh4 
Now Marshall is prepared to castle Kingside.,True," The comment suggests a defensive move, potentially weakening the pawn structure and failing to capitalize on the pawn advance.",1. d4 Nf6 2. Nf3 e6 3. Bg5 d5 4. e3 Nbd7 5. c4 c6 6. cxd5 exd5 7. Nc3 Qa5 8. Bd3,"This is a game between Marshall,F (as White) and Bogoljubow,E (as Black). Last move played: White plays Bishop to d3",Slight advantage for White (eval: 32 centipawns),8... Ne4 9. O-O Nxg5 10. Nxg5 Qd8 11. f4 Nf6 12. Qc2 g6 13. Rae1 Bg7 14. Nf3 O-O 15. f5 Kh8 16. Kh1 a6 17. Re2 Qd6 18. e4 dxe4 19. Nxe4 Nxe4 20. Bxe4 Qf6 ,8. Nd2 Bb4 9. Qc2 O-O 10. Be2 Be7 11. O-O Qd8 12. Bd3 h6 13. Bh4 Ne8 14. Bg3 Ndf6 15. h3 Be6 16. Kh1 Rc8 17. Rad1 Nd6 18. Na4 Nfe4 19. Nxe4 Nxe4 20. Bxe4 dxe4 21. Qxe4 Bxa2 
Take a look at Marshall's position. His pieces are all developed to good squares. The only thing left to do is take care of safeguarding the King by castling.,True," Yes, the comment identifies a significant positional vulnerability, suggesting a mistake.",1. d4 Nf6 2. Nf3 e6 3. Bg5 d5 4. e3 Nbd7 5. c4 c6 6. cxd5 exd5 7. Nc3 Qa5 8. Bd3 Ne4 9. Qc2 Nxg5 10. Nxg5 h6 11. Nf3,"This is a game between Marshall,F (as White) and Bogoljubow,E (as Black). Last move played: White plays Knight to f3",The position is equal,11... Bd6 12. O-O ,11. Nf3 Bd6 
