comment,good,reasoning,moves,context,engine_eval,engine_best_line,engine_best_alternative
"This is all book so far, and this line is known to give a slight advantage to white. Development is critical for black...better is not to ...h5 at all, but ..h6, so that the bishop can retreat to to ..h7 safely.",True," The comment suggests a specific tactical weakness and a planned defensive move, indicating a flawed assessment of the position.",1. e4 c6 2. d4 d5 3. e5 Bf5 4. Nc3 e6 5. g4 Bg6 6. Nge2 c5 7. h4 h5 8. Nf4 Bh7,This is a game between W20 (as White) and B20 (as Black). Last move played: Black plays Bishop to h7,The position is equal,9. Nxh5 ,8... Bh7 9. Nxh5 
! Good move. 11 Bd2 Qb6 is uncomfortable for white.,True," The comment identifies a positional weakness, suggesting the move is flawed.",1. e4 c6 2. d4 d5 3. e5 Bf5 4. Nc3 e6 5. g4 Bg6 6. Nge2 c5 7. h4 h5 8. Nf4 Bh7 9. Nxh5 cxd4 10. Nb5 Qa5+ 11. Qd2,This is a game between W20 (as White) and B20 (as Black). Last move played: White plays Queen to d2,Advantage for White (eval: 94 centipawns),11... Qb6 12. a4 a6 13. a5 Qd8 14. Nxd4 Nd7 15. Qe2 Qc7 16. f4 Ne7 17. Rh3 Nc6 18. c3 Nc5 19. Qd1 Ne4 20. Be3 Bg6 21. Qa4 Bxh5 22. gxh5 ,11. Bd2 Qb6 12. a4 Nc6 13. a5 Qc5 14. Nc7+ Kd7 15. Nxa8 Bxc2 16. b4 Nxb4 17. Qf3 Nh6 18. Nf4 Be4 19. Qb3 Nc2+ 20. Kd1 Nxg4 21. Qxb7+ Kd8 22. Nd3 Bxd3 23. Bxd3 Nxf2+ 24. Ke2 Nxd3 25. Qb8+ Kd7 26. Rab1 Ndb4 27. Qb7+ Kd8 28. Kf3 Qc4 
"Excellent. Gets the rook out of danger, and puts it at an active post.",True," The comment describes a defensive action, suggesting a flaw in the opponent’s positioning.",1. e4 c6 2. d4 d5 3. e5 Bf5 4. Nc3 e6 5. g4 Bg6 6. Nge2 c5 7. h4 h5 8. Nf4 Bh7 9. Nxh5 cxd4 10. Nb5 Qa5+ 11. Qd2 Bb4 12. Nxg7+ Kf8 13. c3 dxc3 14. bxc3 Bc5 15. Nh5 Be4 16. Rh3,This is a game between W20 (as White) and B20 (as Black). Last move played: White plays Rook to h3,Large advantage for White (eval: 211 centipawns),16... Nd7 17. Qf4 a6 18. Nd6 Bxd6 19. exd6 f6 20. Be2 Kf7 21. Kf1 Nh6 22. Bd2 e5 23. Qe3 Rag8 24. f3 Bg6 25. Ng3 Qa3 26. h5 Bc2 27. Rc1 ,16. Rh3 Nd7 17. Qf4 Rc8 18. Be2 a6 19. Nd6 Bxd6 20. exd6 Bg6 21. Kf1 Bxh5 22. gxh5 Ngf6 23. h6 Rxc3 24. Bd2 Rxh3 25. Bxa5 Rh1+ 26. Kg2 Rxa1 27. Bc3 Rg8+ 28. Kh2 Rag1 29. Bxf6 Nxf6 30. Qxf6 R8g2+ 31. Kh3 
?! Dubious. Black's best defense is ...Rh7,True,". The comment suggests a potential defensive move, indicating a flawed assessment of the opponent's response.",1. e4 c6 2. d4 d5 3. e5 Bf5 4. Nc3 e6 5. g4 Bg6 6. Nge2 c5 7. h4 h5 8. Nf4 Bh7 9. Nxh5 cxd4 10. Nb5 Qa5+ 11. Qd2 Bb4 12. Nxg7+ Kf8 13. c3 dxc3 14. bxc3 Bc5 15. Nh5 Be4 16. Rh3 Nc6 17. Qg5 Bg6,This is a game between W20 (as White) and B20 (as Black). Last move played: Black plays Bishop to g6,Large advantage for White (eval: 198 centipawns),18. Nf6 Nxf6 19. Qxf6 Rh7 20. h5 Be4 21. Be2 Kg8 22. Kf1 Be7 23. Qf4 Rf8 24. g5 Bf5 25. Rg3 Rxh5 26. Bxh5 Qxb5+ 27. Kg1 Qc4 28. g6 fxg6 29. Qxc4 dxc4 30. Bxg6 Bxg6 31. Rxg6+ Kf7 ,17... Bg6 18. Nf6 Nxf6 19. Qxf6 Rh7 20. h5 Be4 21. Bd2 Be7 22. Qf4 Kg8 23. Nd6 Rf8 24. Nxe4 dxe4 25. Qxe4 Nxe5 26. Rb1 f5 27. gxf5 exf5 28. Qf4 Qc7 29. Rb5 Bc5 30. Be3 Bxe3 31. Rxe3 Ng4 32. Bc4+ Kh8 
"Alert play. Normally, one should develop first before conducting such an blunt attack, but this move does take advantage of black's earlier missteps.",True," The comment highlights a strategic oversight, suggesting the move is a result of a previous blunder.",1. e4 c6 2. d4 d5 3. e5 Bf5 4. Nc3 e6 5. g4 Bg6 6. Nge2 c5 7. h4 h5 8. Nf4 Bh7 9. Nxh5 cxd4 10. Nb5 Qa5+ 11. Qd2 Bb4 12. Nxg7+ Kf8 13. c3 dxc3 14. bxc3 Bc5 15. Nh5 Be4 16. Rh3 Nc6 17. Qg5 Bg6 18. Rf3 Bxh5 19. gxh5 Rd8 20. Rg3,This is a game between W20 (as White) and B20 (as Black). Last move played: White plays Rook to g3,Large advantage for White (eval: 383 centipawns),20... Qb6 21. Qg7+ Ke7 22. Rf3 Kd7 23. Qxh8 Nge7 24. Qf6 d4 25. Bg5 Kc8 26. Be2 Nf5 27. Nd6+ Nxd6 28. exd6 dxc3 29. Kf1 c2 ,20. Rg3 Qb6 21. Qg7+ Ke7 22. Rf3 Kd7 23. Qxh8 Nge7 24. Qf6 a6 25. Bd3 axb5 26. Kf1 d4 27. c4 bxc4 28. Bxc4 Kc8 29. Bg5 Kb8 30. Qf4 Nd5 31. Bxd5 Rxd5 32. Rb3 Qa6+ 33. Kg2 Nxe5 
One of the few missteps by white. 21 Qg7+ Ke8 22 Rf3 would checkmate or win massive amount of material.,True,", The comment suggests a potential tactical blunder, indicating a flawed assessment of the position.",1. e4 c6 2. d4 d5 3. e5 Bf5 4. Nc3 e6 5. g4 Bg6 6. Nge2 c5 7. h4 h5 8. Nf4 Bh7 9. Nxh5 cxd4 10. Nb5 Qa5+ 11. Qd2 Bb4 12. Nxg7+ Kf8 13. c3 dxc3 14. bxc3 Bc5 15. Nh5 Be4 16. Rh3 Nc6 17. Qg5 Bg6 18. Rf3 Bxh5 19. gxh5 Rd8 20. Rg3 Qb6 21. Rg2,This is a game between W20 (as White) and B20 (as Black). Last move played: White plays Rook to g2,Large advantage for White (eval: 351 centipawns),21... Ke8 22. Qg7 Nge7 23. Qxh8+ Kd7 24. Qh7 Qa5 25. Be2 a6 26. Kf1 axb5 27. Qd3 Kc8 28. Rb1 Nf5 29. Qxb5 Qa7 30. Bf4 d4 31. Qd3 dxc3 32. Qxc3 Rd4 33. Rg8+ Kc7 ,21. Qg7+ Ke7 22. Rf3 Kd7 23. Qxh8 Nge7 24. Qf6 a6 25. Be2 axb5 26. Kf1 b4 27. Rb1 Qa5 28. h6 Qxa2 29. Bd3 bxc3 30. Rxb7+ Kc8 31. Rb5 Ba3 32. Bg5 
"After this, black really could resign.",True," The comment suggests a strategic weakness, indicating a potential loss of the game.",1. e4 c6 2. d4 d5 3. e5 Bf5 4. Nc3 e6 5. g4 Bg6 6. Nge2 c5 7. h4 h5 8. Nf4 Bh7 9. Nxh5 cxd4 10. Nb5 Qa5+ 11. Qd2 Bb4 12. Nxg7+ Kf8 13. c3 dxc3 14. bxc3 Bc5 15. Nh5 Be4 16. Rh3 Nc6 17. Qg5 Bg6 18. Rf3 Bxh5 19. gxh5 Rd8 20. Rg3 Qb6 21. Rg2 Bxf2+ 22. Kd1 Bg3 23. Qxg3 Ke7 24. Qg7 Nh6 25. Bxh6 Rxh6 26. Qxh6 Nxe5 27. Qg7 Nd7 28. h6 e5 29. Qg5+ Ke6 30. Rb2,This is a game between W20 (as White) and B20 (as Black). Last move played: White plays Rook to b2,Large advantage for White (eval: 950 centipawns),30... f5 31. Nd4+ exd4 32. Rxb6+ axb6 33. Qxd8 dxc3 34. Qe8+ Kd6 35. h7 Kc7 36. Rc1 d4 37. Qg8 Nf6 38. Qg7+ Kb8 39. h8=Q+ Ka7 40. Qxf6 c2+ 41. Rxc2 ,30. Rb1 Rh8 31. Re2 Rxh6 32. Bh3+ f5 33. Nd4+ Kf7 34. Qxf5+ Nf6 35. Rxb6 axb6 36. Rxe5 Kg7 37. Qc8 Ng8 38. Rg5+ Rg6 39. Nf5+ Kh7 40. Qxb7+ Kh8 41. Rxg6 Nf6 42. Rxf6 
"For the past few moves, white could have won black's queen with Nd4+ if he wished.",True," The comment points to a missed opportunity, suggesting a strategic flaw in white's planning.",1. e4 c6 2. d4 d5 3. e5 Bf5 4. Nc3 e6 5. g4 Bg6 6. Nge2 c5 7. h4 h5 8. Nf4 Bh7 9. Nxh5 cxd4 10. Nb5 Qa5+ 11. Qd2 Bb4 12. Nxg7+ Kf8 13. c3 dxc3 14. bxc3 Bc5 15. Nh5 Be4 16. Rh3 Nc6 17. Qg5 Bg6 18. Rf3 Bxh5 19. gxh5 Rd8 20. Rg3 Qb6 21. Rg2 Bxf2+ 22. Kd1 Bg3 23. Qxg3 Ke7 24. Qg7 Nh6 25. Bxh6 Rxh6 26. Qxh6 Nxe5 27. Qg7 Nd7 28. h6 e5 29. Qg5+ Ke6 30. Rb2 Rf8 31. Bh3+ f5 32. h7,This is a game between W20 (as White) and B20 (as Black). Last move played: White plays Pawn to h7,Large advantage for White (eval: 1017 centipawns),32... Qc6 33. Nd4+ Kd6 34. Nxc6 Kxc6 35. Qg7 b6 36. Re2 e4 37. Rg2 e3 38. Ke2 Rd8 39. Bxf5 Kb7 40. Bxd7 Rxd7 41. Qxd7+ Ka6 42. Kxe3 ,32. Nd4+ exd4 33. Rxb6+ Nxb6 34. cxd4 Nc4 35. h7 a6 36. Rb1 b6 37. Ke2 b5 38. Qg6+ Ke7 39. Qg7+ Rf7 40. Qg5+ Kd6 41. Qf4+ Kc6 42. h8=Q Re7+ 43. Kf3 Re4 44. Qfh6+ Kc7 45. Q8g7+ Kd8 46. Bxf5 Re3+ 47. Qxe3 
"If you really don't lose much, then for stronger opposition, I suggest going to your local chess club. Portland has strong chess players -- I know, I've played them! Also you can play on the internet, though for improving your slow chess I strongly recommend playing over the board. Your style is aggressive...balance that with defence, you should continue to do well.",True," The comment offers potential advice related to improving a specific style, suggesting a balanced approach, which could be a contributing factor to the mistake.",1. e4 c6 2. d4 d5 3. e5 Bf5 4. Nc3 e6 5. g4 Bg6 6. Nge2 c5 7. h4 h5 8. Nf4 Bh7 9. Nxh5 cxd4 10. Nb5 Qa5+ 11. Qd2 Bb4 12. Nxg7+ Kf8 13. c3 dxc3 14. bxc3 Bc5 15. Nh5 Be4 16. Rh3 Nc6 17. Qg5 Bg6 18. Rf3 Bxh5 19. gxh5 Rd8 20. Rg3 Qb6 21. Rg2 Bxf2+ 22. Kd1 Bg3 23. Qxg3 Ke7 24. Qg7 Nh6 25. Bxh6 Rxh6 26. Qxh6 Nxe5 27. Qg7 Nd7 28. h6 e5 29. Qg5+ Ke6 30. Rb2 Rf8 31. Bh3+ f5 32. h7 Kf7 33. Qxf5+ Nf6 34. Nd6+ Kg7 35. Rg2+ Kh8 36. Rg8+ Nxg8 37. hxg8=Q+ Rxg8 38. Qh5+ Kg7 39. Qg5+ Kh7 40. Bf5+ Rg6 41. Qxg6+ Kh8,This is a game between W20 (as White) and B20 (as Black). Last move played: Black plays King to h8,Mate in 1 for White,42. Nf7# ,41... Kh8 42. Nf7# 
