comment,good,reasoning,moves,context,engine_eval,engine_best_line,engine_best_alternative
"This sharp rim shot sets the theme for the rest of the game: Fischer snipes alternately against the White king and e pawn, and his initiative snowballs.",True," The comment offers a potential analysis of the move’s strategic implications, suggesting a significant tactical development.",1. e4 c5 2. Nf3 d6 3. d4 cxd4 4. Nxd4 Nf6 5. Nc3 a6 6. Bc4 e6 7. Bb3 b5 8. f4 Bb7 9. f5 e5 10. Nde2 Nbd7 11. Bg5 Be7 12. Ng3 Rc8 13. O-O h5,"This is a game between Byrne,D (as White) and Fischer (as Black). Last move played: Black plays Pawn to h5",Large advantage for Black (eval: -148 centipawns),14. h4 b4 ,13... h5 14. h4 b4 15. Na4 Nxe4 16. Nxe4 Bxe4 17. Qe2 Bb7 18. Rad1 Nf6 19. c3 Ng4 20. Qd2 f6 21. Be3 bxc3 22. bxc3 d5 23. Bf2 Qc7 24. Nb6 Nxf2 25. Nxd5 Bxd5 26. Qxd5 Nxd1 27. Qf7+ Kd8 28. Rxd1+ Bd6 29. Qe6 Qc5+ 30. Kh1 
Now White must either give up a pawn or allow the h file to be opened.,True," The comment suggests a strategic vulnerability, indicating a flawed move that could lead to a loss of material.",1. e4 c5 2. Nf3 d6 3. d4 cxd4 4. Nxd4 Nf6 5. Nc3 a6 6. Bc4 e6 7. Bb3 b5 8. f4 Bb7 9. f5 e5 10. Nde2 Nbd7 11. Bg5 Be7 12. Ng3 Rc8 13. O-O h5 14. h4 b4,"This is a game between Byrne,D (as White) and Fischer (as Black). Last move played: Black plays Pawn to b4",Large advantage for Black (eval: -151 centipawns),15. Na4 Nxe4 16. Nxe4 Bxe4 17. Qd2 Bc6 18. a3 a5 19. axb4 axb4 20. Bxe7 Qxe7 21. Qxb4 O-O 22. Rad1 Rfd8 23. Rxd6 Nf6 24. Rfd1 Kh7 25. Nb6 Rb8 ,14... b4 15. Na4 Nxe4 16. Nxe4 Bxe4 17. Qd2 Nf6 18. a3 bxa3 19. Bxf6 gxf6 20. Nc3 Bb7 21. Nd5 axb2 22. Ra2 Bxd5 23. Qxd5 Qb6+ 24. Kh2 O-O 
Bringing the heavy artillery to bear against White's king in a wonderfully unorthodox manner.,True,". The comment suggests a risky and potentially unsound tactical maneuver, indicating a mistake in strategic planning.",1. e4 c5 2. Nf3 d6 3. d4 cxd4 4. Nxd4 Nf6 5. Nc3 a6 6. Bc4 e6 7. Bb3 b5 8. f4 Bb7 9. f5 e5 10. Nde2 Nbd7 11. Bg5 Be7 12. Ng3 Rc8 13. O-O h5 14. h4 b4 15. Bxf6 Bxf6 16. Nd5 Bxh4 17. Nxh5 Qg5,"This is a game between Byrne,D (as White) and Fischer (as Black). Last move played: Black plays Queen to g5",Large advantage for Black (eval: -313 centipawns),18. f6 Rxh5 ,17... Kf8 18. Qg4 Qg5 19. Qxg5 Bxg5 20. g4 Bxd5 21. exd5 Ke7 22. a3 Nf6 23. axb4 Nxh5 24. gxh5 Rxh5 25. Rxa6 Be3+ 26. Kg2 e4 27. Re1 Rg5+ 28. Kf1 Rxf5+ 29. Ke2 Rf3 30. b5 f5 31. b6 f4 32. Kd1 Rb8 33. Ra4 Kf6 34. Rxe4 Rf2 
Black's threats on the h file are now decisive.,True,". The comment suggests a potential tactical advantage, indicating a flaw in the player’s assessment of the board’s position.",1. e4 c5 2. Nf3 d6 3. d4 cxd4 4. Nxd4 Nf6 5. Nc3 a6 6. Bc4 e6 7. Bb3 b5 8. f4 Bb7 9. f5 e5 10. Nde2 Nbd7 11. Bg5 Be7 12. Ng3 Rc8 13. O-O h5 14. h4 b4 15. Bxf6 Bxf6 16. Nd5 Bxh4 17. Nxh5 Qg5 18. f6 g6 19. Ng7+ Kd8 20. Rf3 Bg3,"This is a game between Byrne,D (as White) and Fischer (as Black). Last move played: Black plays Bishop to g3",Large advantage for Black (eval: -267 centipawns),21. Ne3 Qh4 22. Rxg3 Qxg3 23. Qd3 Rc6 24. Bxf7 Nxf6 25. Rf1 Qh2+ 26. Kf2 Qh4+ 27. Kf3 Bc8 28. Bd5 Bg4+ 29. Nxg4 Qxg4+ 30. Kf2 Nxd5 31. exd5 Rc4 32. Kg1 Qd4+ 33. Rf2 ,20... Bg3 21. Qd3 Bh2+ 22. Kh1 Nc5 23. Rh3 Rh4 24. Qf3 Bf4 25. Kg1 Nxb3 26. axb3 Rxh3 27. Qxh3 Bxd5 28. exd5 Rxc2 29. Ne6+ fxe6 30. dxe6 Qxf6 31. Qh7 Qxe6 32. Rxa6 Be3+ 33. Kh1 Rc1+ 34. Kh2 Bg1+ 35. Kh1 
"This sharp rim shot sets the theme for the rest of the game: Fischer snipes alternately against the White king and e pawn, and his initiative snowballs.",True, The comment accurately describes the loss of a piece due to the opponent’s strategic maneuver.,1. e4 c5 2. Nf3 d6 3. d4 cxd4 4. Nxd4 Nf6 5. Nc3 a6 6. Bc4 e6 7. Bb3 b5 8. f4 Bb7 9. f5 e5 10. Nde2 Nbd7 11. Bg5 Be7 12. Ng3 Rc8 13. O-O h5,"This is a game between Byrne,D (as White) and Fischer (as Black). Last move played: Black plays Pawn to h5",Large advantage for Black (eval: -148 centipawns),14. h4 b4 ,13... h5 14. h4 b4 15. Na4 Nxe4 16. Nxe4 Bxe4 17. Qe2 Bb7 18. Rad1 Nf6 19. c3 Ng4 20. Qd2 f6 21. Be3 bxc3 22. bxc3 d5 23. Bf2 Qc7 24. Nb6 Nxf2 25. Nxd5 Bxd5 26. Qxd5 Nxd1 27. Qf7+ Kd8 28. Rxd1+ Bd6 29. Qe6 Qc5+ 30. Kh1 
