comment,good,reasoning,moves,context,engine_eval,engine_best_line,engine_best_alternative
"This time it seems ... Pg6 has an entirely different motive - not only to screen the point h7, but also to have the possibility of . .. Pf5 handy, so as to start operations on the half-open e-file. The move ... Nb6 is significant. The first intention is to bring c4 under fire; it is always a weak square as soon as the b-pawn moves. Besides this there is a second point, which emerges presently",True," The comment provides a detailed explanation of the strategic implications of the move, suggesting a flawed plan.",1. d4 d5 2. c4 e6 3. Nc3 Nf6 4. Bg5 Be7 5. e3 O-O 6. Nf3 Nbd7 7. Rc1 a6 8. cxd5 exd5 9. Bd3 c6 10. Qc2 Re8 11. O-O g6 12. Rb1 Nb6,This is a game between Kramer (as White) and Fichtl (as Black). Last move played: Black plays Knight to b6,Slight advantage for White (eval: 23 centipawns),13. h3 ,12... Ne4 13. Bxe4 
preparing ... Bf5 to exchange bishops,True,", The comment indicates a potential weakness in the pawn structure, suggesting an unfavorable exchange.",1. d4 d5 2. c4 e6 3. Nc3 Nf6 4. Bg5 Be7 5. e3 O-O 6. Nf3 Nbd7 7. Rc1 a6 8. cxd5 exd5 9. Bd3 c6 10. Qc2 Re8 11. O-O g6 12. Rb1 Nb6 13. Ne2 Nh5 14. Bxe7 Rxe7 15. b4 Ng7,This is a game between Kramer (as White) and Fichtl (as Black). Last move played: Black plays Knight to g7,Slight advantage for White (eval: 24 centipawns),16. Ng3 Be6 17. a4 Nc8 18. h3 Rc7 19. Rbc1 Ne8 20. Rfe1 Ncd6 21. Qd2 Re7 22. Ne5 Ng7 23. Qb2 Nge8 24. Re2 Rc7 25. Rce1 ,15... Ng7 16. Ng3 
White's not going to have his Good Bishop exchanged for Black's bad bishop,True," The comment suggests a potential tactical disadvantage for White, indicating a flawed assessment of the bishop exchange.",1. d4 d5 2. c4 e6 3. Nc3 Nf6 4. Bg5 Be7 5. e3 O-O 6. Nf3 Nbd7 7. Rc1 a6 8. cxd5 exd5 9. Bd3 c6 10. Qc2 Re8 11. O-O g6 12. Rb1 Nb6 13. Ne2 Nh5 14. Bxe7 Rxe7 15. b4 Ng7 16. Ng3,This is a game between Kramer (as White) and Fichtl (as Black). Last move played: White plays Knight to g3,The position is equal,16... Ne8 17. Ne5 ,16. Ng3 Be6 17. a4 Nc8 18. h3 Rc7 19. Rbc1 Ne8 20. Rfe1 Ncd6 21. Qd2 Re7 22. Ne5 Ng7 23. Qb2 Nge8 24. Re2 Rc7 25. Rce1 
Increasing pressure on the c4 square,True,". The comment suggests a potential tactical disadvantage, indicating a move that might lead to a weakened position.",1. d4 d5 2. c4 e6 3. Nc3 Nf6 4. Bg5 Be7 5. e3 O-O 6. Nf3 Nbd7 7. Rc1 a6 8. cxd5 exd5 9. Bd3 c6 10. Qc2 Re8 11. O-O g6 12. Rb1 Nb6 13. Ne2 Nh5 14. Bxe7 Rxe7 15. b4 Ng7 16. Ng3 Be6,This is a game between Kramer (as White) and Fichtl (as Black). Last move played: Black plays Bishop to e6,Slight advantage for White (eval: 22 centipawns),17. a4 ,16... Ne8 17. Ne5 
"This is the second intention of Black's 12th move. The Knight is coming to d5, from which vantage point it observes c4 and e4",True," The comment offers a potential explanation for the move's perceived weakness, suggesting a tactical error.",1. d4 d5 2. c4 e6 3. Nc3 Nf6 4. Bg5 Be7 5. e3 O-O 6. Nf3 Nbd7 7. Rc1 a6 8. cxd5 exd5 9. Bd3 c6 10. Qc2 Re8 11. O-O g6 12. Rb1 Nb6 13. Ne2 Nh5 14. Bxe7 Rxe7 15. b4 Ng7 16. Ng3 Be6 17. a4 Nc8,This is a game between Kramer (as White) and Fichtl (as Black). Last move played: Black plays Knight to c8,Slight advantage for White (eval: 21 centipawns),18. Rfc1 Nd6 ,17... Nc8 
"These last s of Black have put an entirely new complexion on the game, for the passed a-pawn could be very dangerous. In view of the fact that White still has the initiative through his control of the c-file, Black would have been wiser to play ... Rc7 first",True," The comment offers a potential explanation for the mistake, suggesting a missed opportunity to challenge the pawn.",1. d4 d5 2. c4 e6 3. Nc3 Nf6 4. Bg5 Be7 5. e3 O-O 6. Nf3 Nbd7 7. Rc1 a6 8. cxd5 exd5 9. Bd3 c6 10. Qc2 Re8 11. O-O g6 12. Rb1 Nb6 13. Ne2 Nh5 14. Bxe7 Rxe7 15. b4 Ng7 16. Ng3 Be6 17. a4 Nc8 18. b5 cxb5 19. axb5 a5,This is a game between Kramer (as White) and Fichtl (as Black). Last move played: Black plays Pawn to a5,The position is equal,20. Ra1 Nb6 21. Qd2 a4 22. h4 Rc7 23. h5 Nxh5 24. Nxh5 gxh5 25. Rfe1 Bg4 26. Ne5 Qg5 27. Qb4 Qe7 28. Qxe7 Rxe7 29. Rec1 Rc8 30. Rxc8+ Bxc8 31. Rc1 a3 ,19... a5 
the text is in line with Black's chosen strategy,True," The comment suggests a logical connection between the move and the opponent's strategy, indicating a potential flaw in the player's assessment.",1. d4 d5 2. c4 e6 3. Nc3 Nf6 4. Bg5 Be7 5. e3 O-O 6. Nf3 Nbd7 7. Rc1 a6 8. cxd5 exd5 9. Bd3 c6 10. Qc2 Re8 11. O-O g6 12. Rb1 Nb6 13. Ne2 Nh5 14. Bxe7 Rxe7 15. b4 Ng7 16. Ng3 Be6 17. a4 Nc8 18. b5 cxb5 19. axb5 a5 20. Rfc1 Nd6 21. Qa4 Ngf5,This is a game between Kramer (as White) and Fichtl (as Black). Last move played: Black plays Knight to f5,Advantage for White (eval: 59 centipawns),22. Ne2 ,21... Nc8 22. Rc5 Nb6 23. Qc2 a4 24. Ra1 Re8 25. Ne5 Qd6 26. h3 Rac8 27. Qc3 Bd7 28. Nxd7 Qxd7 29. Qa5 
Drawing a bead on the weak d-pawn and threatening Pb6,True, The comment describes a potentially risky and unsound move that led to a draw.,1. d4 d5 2. c4 e6 3. Nc3 Nf6 4. Bg5 Be7 5. e3 O-O 6. Nf3 Nbd7 7. Rc1 a6 8. cxd5 exd5 9. Bd3 c6 10. Qc2 Re8 11. O-O g6 12. Rb1 Nb6 13. Ne2 Nh5 14. Bxe7 Rxe7 15. b4 Ng7 16. Ng3 Be6 17. a4 Nc8 18. b5 cxb5 19. axb5 a5 20. Rfc1 Nd6 21. Qa4 Ngf5 22. Nxf5 Bxf5 23. Bxf5 Nxf5 24. Rc5,This is a game between Kramer (as White) and Fichtl (as Black). Last move played: White plays Rook to c5,The position is equal,24... b6 25. Rc6 Rc7 26. Ne5 Rac8 27. g4 Ne7 28. Rf6 Nf5 29. Rc6 ,24. Qa2 a4 
with the aim to prevent Nf4-e6,True,", The comment suggests a defensive strategy, indicating a flawed opening choice.",1. d4 d5 2. c4 e6 3. Nc3 Nf6 4. Bg5 Be7 5. e3 O-O 6. Nf3 Nbd7 7. Rc1 a6 8. cxd5 exd5 9. Bd3 c6 10. Qc2 Re8 11. O-O g6 12. Rb1 Nb6 13. Ne2 Nh5 14. Bxe7 Rxe7 15. b4 Ng7 16. Ng3 Be6 17. a4 Nc8 18. b5 cxb5 19. axb5 a5 20. Rfc1 Nd6 21. Qa4 Ngf5 22. Nxf5 Bxf5 23. Bxf5 Nxf5 24. Rc5 b6 25. Rc6 Nd6 26. Ne5 f6 27. Nd3 Kf7,This is a game between Kramer (as White) and Fichtl (as Black). Last move played: Black plays King to f7,Large advantage for White (eval: 237 centipawns),28. Nf4 Nc4 29. h4 Qd7 30. Rc1 Kg7 31. Qd1 a4 32. Qf3 Nd2 33. Qxd5 Qxd5 34. Nxd5 Rb7 35. Ra1 a3 36. Rc3 Rba7 37. Rc2 Nb3 38. Raa2 Kh6 39. Nxb6 Rb8 40. Nc4 Rxb5 41. Rxa3 Nxd4 42. exd4 ,27... Nc4 28. Nf4 g5 29. Nh5 f5 30. Rc1 Rf7 31. h4 gxh4 32. Nf4 Qd7 33. Qd1 a4 34. Qh5 Qd8 35. Qh6 a3 36. Ra1 Kh8 37. Ra2 Qd7 38. Qxh4 Rg7 39. Qf6 Qf7 40. Qxf7 
White has won the exchange but the Black Knight is established at his blockade post and the game is still not easy to win. White renews the pressure on the open c-file,True," The comment describes a positional disadvantage, suggesting a missed opportunity to exploit the weakened Black King.",1. d4 d5 2. c4 e6 3. Nc3 Nf6 4. Bg5 Be7 5. e3 O-O 6. Nf3 Nbd7 7. Rc1 a6 8. cxd5 exd5 9. Bd3 c6 10. Qc2 Re8 11. O-O g6 12. Rb1 Nb6 13. Ne2 Nh5 14. Bxe7 Rxe7 15. b4 Ng7 16. Ng3 Be6 17. a4 Nc8 18. b5 cxb5 19. axb5 a5 20. Rfc1 Nd6 21. Qa4 Ngf5 22. Nxf5 Bxf5 23. Bxf5 Nxf5 24. Rc5 b6 25. Rc6 Nd6 26. Ne5 f6 27. Nd3 Kf7 28. Nf4 Nf5 29. Qa2 Rd7 30. Nxd5 Rxd5 31. e4 Ne7 32. Rc2 Kg7 33. exd5 Nxd5 34. Rbc1,This is a game between Kramer (as White) and Fichtl (as Black). Last move played: White plays Rook to c1,Large advantage for White (eval: 261 centipawns),34... Qd7 35. h4 ,34. Rbc1 g5 35. Re2 Qd7 36. Rce1 Qf5 37. Re8 Rxe8 38. Rxe8 Qd3 39. Qe2 Qb1+ 40. Qf1 Qb4 41. h3 a4 42. Ra8 
Two Rooks on the sevent: the ultimate objective of everyone who operates on an open file,True," The comment suggests a strategic flaw, indicating a poor move.",1. d4 d5 2. c4 e6 3. Nc3 Nf6 4. Bg5 Be7 5. e3 O-O 6. Nf3 Nbd7 7. Rc1 a6 8. cxd5 exd5 9. Bd3 c6 10. Qc2 Re8 11. O-O g6 12. Rb1 Nb6 13. Ne2 Nh5 14. Bxe7 Rxe7 15. b4 Ng7 16. Ng3 Be6 17. a4 Nc8 18. b5 cxb5 19. axb5 a5 20. Rfc1 Nd6 21. Qa4 Ngf5 22. Nxf5 Bxf5 23. Bxf5 Nxf5 24. Rc5 b6 25. Rc6 Nd6 26. Ne5 f6 27. Nd3 Kf7 28. Nf4 Nf5 29. Qa2 Rd7 30. Nxd5 Rxd5 31. e4 Ne7 32. Rc2 Kg7 33. exd5 Nxd5 34. Rbc1 Qd7 35. Qc4 Re8 36. g3 Qf5 37. Re2 Rd8 38. Rce1 Rc8 39. Qa2 g5 40. Qb1 Qxb1 41. Rxb1 Rc4 42. Ree1 Nc3 43. Re7+ Kg6 44. Rbe1 Rxd4 45. Rb7 Na4 46. Ree7,This is a game between Kramer (as White) and Fichtl (as Black). Last move played: White plays Rook to e7,Large advantage for White (eval: 176 centipawns),46... h5 47. h3 ,46. Rc7 Rb4 47. Re6 Rxb5 48. g4 Re5 49. Rd6 Rc5 50. Rxc5 bxc5 51. Rc6 Nb2 52. Rxc5 a4 53. Rc6 Nd3 54. Ra6 Nc5 55. Ra5 Nd3 56. Kg2 h5 57. gxh5+ Kxh5 58. Kf3 Kh4 59. Rxa4+ Kh3 60. Ra6 g4+ 61. Ke3 
"White switches to the sixth rank, which is more promising in this case",True," The comment suggests a potential improvement, indicating a misunderstanding of the position's dynamics.",1. d4 d5 2. c4 e6 3. Nc3 Nf6 4. Bg5 Be7 5. e3 O-O 6. Nf3 Nbd7 7. Rc1 a6 8. cxd5 exd5 9. Bd3 c6 10. Qc2 Re8 11. O-O g6 12. Rb1 Nb6 13. Ne2 Nh5 14. Bxe7 Rxe7 15. b4 Ng7 16. Ng3 Be6 17. a4 Nc8 18. b5 cxb5 19. axb5 a5 20. Rfc1 Nd6 21. Qa4 Ngf5 22. Nxf5 Bxf5 23. Bxf5 Nxf5 24. Rc5 b6 25. Rc6 Nd6 26. Ne5 f6 27. Nd3 Kf7 28. Nf4 Nf5 29. Qa2 Rd7 30. Nxd5 Rxd5 31. e4 Ne7 32. Rc2 Kg7 33. exd5 Nxd5 34. Rbc1 Qd7 35. Qc4 Re8 36. g3 Qf5 37. Re2 Rd8 38. Rce1 Rc8 39. Qa2 g5 40. Qb1 Qxb1 41. Rxb1 Rc4 42. Ree1 Nc3 43. Re7+ Kg6 44. Rbe1 Rxd4 45. Rb7 Na4 46. Ree7 h5 47. Rbd7 Rb4 48. Rg7+ Kf5 49. Rd6,This is a game between Kramer (as White) and Fichtl (as Black). Last move played: White plays Rook to d6,Advantage for White (eval: 82 centipawns),49... Ke5 50. Rc6 Rxb5 51. f4+ gxf4 52. gxf4+ Kd5 53. Rxf6 Nc5 54. Rh6 Ke4 55. Rxh5 Kxf4 56. Rf7+ Ke3 57. Re5+ Kd4 58. Re1 a4 59. Rf4+ Kd3 ,49. Rd6 
Black's last hope is his well advanced connected passed pawns,True," The comment suggests a potential weakness in the pawn structure, indicating a flawed strategic decision.",1. d4 d5 2. c4 e6 3. Nc3 Nf6 4. Bg5 Be7 5. e3 O-O 6. Nf3 Nbd7 7. Rc1 a6 8. cxd5 exd5 9. Bd3 c6 10. Qc2 Re8 11. O-O g6 12. Rb1 Nb6 13. Ne2 Nh5 14. Bxe7 Rxe7 15. b4 Ng7 16. Ng3 Be6 17. a4 Nc8 18. b5 cxb5 19. axb5 a5 20. Rfc1 Nd6 21. Qa4 Ngf5 22. Nxf5 Bxf5 23. Bxf5 Nxf5 24. Rc5 b6 25. Rc6 Nd6 26. Ne5 f6 27. Nd3 Kf7 28. Nf4 Nf5 29. Qa2 Rd7 30. Nxd5 Rxd5 31. e4 Ne7 32. Rc2 Kg7 33. exd5 Nxd5 34. Rbc1 Qd7 35. Qc4 Re8 36. g3 Qf5 37. Re2 Rd8 38. Rce1 Rc8 39. Qa2 g5 40. Qb1 Qxb1 41. Rxb1 Rc4 42. Ree1 Nc3 43. Re7+ Kg6 44. Rbe1 Rxd4 45. Rb7 Na4 46. Ree7 h5 47. Rbd7 Rb4 48. Rg7+ Kf5 49. Rd6 Ke5 50. Rc6 Rxb5 51. Rg6 Rd5 52. Rcxf6 Kd4 53. h4 b5 54. hxg5 b4 55. Rg8 Nc5 56. g6 b3 57. g7 Rd7 58. Rf4+ Kd5 59. Rf5+ Kd4 60. Rxc5 Rxg7,This is a game between Kramer (as White) and Fichtl (as Black). Last move played: Black plays Rook takes on g7,Large advantage for White (eval: 391 centipawns),61. Rgc8 Rg8 62. R8c7 Rg7 63. Rc4+ Kd3 64. Rc3+ Kd2 65. R7c5 a4 66. R3c4 Rg4 67. Rd5+ Ke2 68. Rc6 Re4 69. Rb6 h4 70. Kg2 hxg3 71. f3 Re3 72. Ra5 Rxf3 73. Rxa4 Rf2+ 74. Kxg3 Rf3+ 75. Kg4 Re3 ,60... Rxg7 61. Rgc8 Rb7 62. Rc1 Rb4 63. Rd1+ Ke4 64. Rc5 h4 65. Rxa5 hxg3 66. fxg3 Kf3 67. Rb1 Kxg3 68. Ra3 Rg4 69. Raxb3+ Kf4+ 70. Kf2 Ke5 71. Rb5+ Kd6 72. Rb6+ Kc7 73. R1b4 Rg8 74. Rf6 Rh8 75. Rc4+ Kb7 
"Although this new plan which Black introduced in this game did not lead to the desired result, this game is an interesting contribution to the theory of the minority attack. It seems by no means impossible that this scheme - the creation of a passed a-pawn combined with the pressure against the c4 square - may be instrumental in banishing the dread of the minority attack, or at least considerably reducing it.",True," The comment offers a somewhat insightful analysis of the move's shortcomings, suggesting a potential strategic benefit despite the initial failure.",1. d4 d5 2. c4 e6 3. Nc3 Nf6 4. Bg5 Be7 5. e3 O-O 6. Nf3 Nbd7 7. Rc1 a6 8. cxd5 exd5 9. Bd3 c6 10. Qc2 Re8 11. O-O g6 12. Rb1 Nb6 13. Ne2 Nh5 14. Bxe7 Rxe7 15. b4 Ng7 16. Ng3 Be6 17. a4 Nc8 18. b5 cxb5 19. axb5 a5 20. Rfc1 Nd6 21. Qa4 Ngf5 22. Nxf5 Bxf5 23. Bxf5 Nxf5 24. Rc5 b6 25. Rc6 Nd6 26. Ne5 f6 27. Nd3 Kf7 28. Nf4 Nf5 29. Qa2 Rd7 30. Nxd5 Rxd5 31. e4 Ne7 32. Rc2 Kg7 33. exd5 Nxd5 34. Rbc1 Qd7 35. Qc4 Re8 36. g3 Qf5 37. Re2 Rd8 38. Rce1 Rc8 39. Qa2 g5 40. Qb1 Qxb1 41. Rxb1 Rc4 42. Ree1 Nc3 43. Re7+ Kg6 44. Rbe1 Rxd4 45. Rb7 Na4 46. Ree7 h5 47. Rbd7 Rb4 48. Rg7+ Kf5 49. Rd6 Ke5 50. Rc6 Rxb5 51. Rg6 Rd5 52. Rcxf6 Kd4 53. h4 b5 54. hxg5 b4 55. Rg8 Nc5 56. g6 b3 57. g7 Rd7 58. Rf4+ Kd5 59. Rf5+ Kd4 60. Rxc5 Rxg7 61. Rgc8 Rb7 62. Rxa5 b2 63. Rd8+ Kc3 64. Rd1,This is a game between Kramer (as White) and Fichtl (as Black). Last move played: White plays Rook to d1,Large advantage for White (eval: 536 centipawns),64... Kc2 65. Rf1 b1=Q 66. Rxb1 Rxb1+ 67. Kg2 Kd3 68. Rxh5 Ke4 69. f3+ Kd4 70. f4 Rb2+ 71. Kf3 Rb3+ 72. Kg4 Ke3 73. Ra5 Rb8 74. f5 Rg8+ 75. Kh5 Rf8 ,64. Rd1 Kc2 65. Re1 b1=Q 66. Rxb1 Rxb1+ 67. Kg2 Kd3 68. Rxh5 Ke4 69. f3+ Kd4 70. g4 Ke3 71. Rh1 Rxh1 72. Kxh1 Kxf3 73. g5 Kg4 74. g6 Kf5 75. g7 Ke6 76. g8=Q+ Kd6 77. Kg2 Kc5 78. Qg4 Kb6 
preparing ... Bf5 to exchange bishops,True," The comment suggests the pawn is hindering the rooks, implying a strategic blunder.",1. d4 d5 2. c4 e6 3. Nc3 Nf6 4. Bg5 Be7 5. e3 O-O 6. Nf3 Nbd7 7. Rc1 a6 8. cxd5 exd5 9. Bd3 c6 10. Qc2 Re8 11. O-O g6 12. Rb1 Nb6 13. Ne2 Nh5 14. Bxe7 Rxe7 15. b4 Ng7,This is a game between Kramer (as White) and Fichtl (as Black). Last move played: Black plays Knight to g7,Slight advantage for White (eval: 24 centipawns),16. Ng3 Be6 17. a4 Nc8 18. h3 Rc7 19. Rbc1 Ne8 20. Rfe1 Ncd6 21. Qd2 Re7 22. Ne5 Ng7 23. Qb2 Nge8 24. Re2 Rc7 25. Rce1 ,15... Ng7 16. Ng3 
The only difference here is that Black has played ... Pg6 instead of ... Nf8,True," The comment clearly identifies the error in Black's move, providing a specific correction.",1. d4 d5 2. c4 e6 3. Nc3 Nf6 4. Bg5 Be7 5. e3 O-O 6. Nf3 Nbd7 7. Rc1 a6 8. cxd5 exd5 9. Bd3 c6 10. Qc2 Re8 11. O-O g6,This is a game between Kramer (as White) and Fichtl (as Black). Last move played: Black plays Pawn to g6,Slight advantage for White (eval: 37 centipawns),12. h3 Nh5 ,11... g6 
