comment,good,reasoning,moves,context,engine_eval,engine_best_line,engine_best_alternative
"Going into this game Anand stands in last place by himself. This is uncharacteristic. Also, Kasparov has the lead by himself and this is characteristic. It's a slender lead of only one-half point over the next five (5!) tied players. A win by either player puts him into contention and severely hurts the other player's chances.",True," The comment offers insightful analysis of the positional disadvantage and potential consequences of the move, suggesting a strategic flaw.",1. e4,"This is a game between Anand, Viswanathan (as White) and Shirov, Alexei (as Black). Last move played: White plays Pawn to e4",Slight advantage for White (eval: 33 centipawns),1... e5 2. Nf3 Nc6 3. d4 exd4 4. Nxd4 Bc5 5. Nb3 Bb6 6. a4 Qh4 7. Qf3 a5 8. g3 Qf6 9. Qe2 Nge7 10. Nc3 ,1. e4 e5 
"This is different from the c2-c4 he played against Ponomariov. In this situation the pawn is almost assured of being exchanged for Pb5. In any case it makes sense to support Nd5 and doing it with this threat to Pb5 is useful. Of course, he had to calculate the effects of 9...Nxe4 10. cxb5 Qa5+.",True," The comment offers a justification for the mistake, suggesting a strategic goal, but lacks sufficient analysis of the specific tactical considerations.",1. e4 c5 2. Nf3 Nc6 3. d4 cxd4 4. Nxd4 e5 5. Nb5 d6 6. N1c3 a6 7. Na3 b5 8. Nd5 Nf6 9. c4,"This is a game between Anand, Viswanathan (as White) and Shirov, Alexei (as Black). Last move played: White plays Pawn to c4",Advantage for White (eval: 51 centipawns),9... b4 10. Nc2 ,9. c4 
Though this leaves d5 weak Black can use it as an opportunity to do some damage on the king-side; usually Black doesn't get the queen out in front until much later in the middle-game.,True," The comment suggests a strategic flaw in Black's planning, indicating a mistake.",1. e4 c5 2. Nf3 Nc6 3. d4 cxd4 4. Nxd4 e5 5. Nb5 d6 6. N1c3 a6 7. Na3 b5 8. Nd5 Nf6 9. c4 b4 10. Nxf6+ Qxf6,"This is a game between Anand, Viswanathan (as White) and Shirov, Alexei (as Black). Last move played: Black plays Queen takes on f6",Slight advantage for White (eval: 42 centipawns),11. Nc2 ,10... Qxf6 11. Nc2 Be7 12. Be2 Qg6 13. O-O O-O 14. f4 exf4 15. Bxf4 Be6 16. Qd2 a5 17. Rad1 Bf6 18. Ne3 Be5 19. Bxe5 dxe5 20. Nd5 Rad8 
"After this Rc8 is defended, so that ... Nc6xb4 is a real threat. Any move such as ...Nc6-d8 also uncovers a strong threat to Pe4.",True," The comment suggests a potential threat, indicating a flawed positional assessment.",1. e4 c5 2. Nf3 Nc6 3. d4 cxd4 4. Nxd4 e5 5. Nb5 d6 6. N1c3 a6 7. Na3 b5 8. Nd5 Nf6 9. c4 b4 10. Nxf6+ Qxf6 11. Nc2 Qg6 12. Qd5 Bb7 13. Nxb4 Rc8 14. Be3 Be7 15. h4 O-O,"This is a game between Anand, Viswanathan (as White) and Shirov, Alexei (as Black). Last move played: Black plays kingside castle",Advantage for White (eval: 90 centipawns),16. h5 ,15... Ba8 
attempting to kick Qg6 off Pe4,True,", The comment indicates a potential illegal move attempting to disrupt the pawn structure, suggesting a flawed strategic decision.",1. e4 c5 2. Nf3 Nc6 3. d4 cxd4 4. Nxd4 e5 5. Nb5 d6 6. N1c3 a6 7. Na3 b5 8. Nd5 Nf6 9. c4 b4 10. Nxf6+ Qxf6 11. Nc2 Qg6 12. Qd5 Bb7 13. Nxb4 Rc8 14. Be3 Be7 15. h4 O-O 16. h5,"This is a game between Anand, Viswanathan (as White) and Shirov, Alexei (as Black). Last move played: White plays Pawn to h5",Advantage for White (eval: 89 centipawns),16... Qg4 17. f3 ,16. h5 
"I suppose he had his choice of chasing Qg3 onto the c1-h6 diagonal, but Be3 seems better than Bf2. Also, by having Kd1 he avoids ...Nc6xb4-c2+.",True," The comment offers specific reasons for the perceived mistake, suggesting a better alternative.",1. e4 c5 2. Nf3 Nc6 3. d4 cxd4 4. Nxd4 e5 5. Nb5 d6 6. N1c3 a6 7. Na3 b5 8. Nd5 Nf6 9. c4 b4 10. Nxf6+ Qxf6 11. Nc2 Qg6 12. Qd5 Bb7 13. Nxb4 Rc8 14. Be3 Be7 15. h4 O-O 16. h5 Qg4 17. f3 Qg3+ 18. Kd1,"This is a game between Anand, Viswanathan (as White) and Shirov, Alexei (as Black). Last move played: White plays King to d1",Large advantage for White (eval: 158 centipawns),18... Bg5 19. Bxg5 Qxg5 20. Nxc6 Rxc6 21. Qd2 Qe7 22. h6 g6 23. Be2 Bc8 24. b3 Qc7 25. Ke1 Be6 26. Rd1 f6 27. f4 exf4 28. Qxf4 Kf7 29. Rd3 Qb6 30. Qd2 a5 ,18. Kd1 Bg5 
"This way Black is behind an exchange, but White's king is in the middle of the board and his rooks are nearly impossible to activate. Black has to do more than this though. He has to win to avoid the eventual loss which would occur when the rooks do become active.",True," The comment identifies a strategic disadvantage and suggests a need for a more substantial attack, indicating a flawed assessment of the position.",1. e4 c5 2. Nf3 Nc6 3. d4 cxd4 4. Nxd4 e5 5. Nb5 d6 6. N1c3 a6 7. Na3 b5 8. Nd5 Nf6 9. c4 b4 10. Nxf6+ Qxf6 11. Nc2 Qg6 12. Qd5 Bb7 13. Nxb4 Rc8 14. Be3 Be7 15. h4 O-O 16. h5 Qg4 17. f3 Qg3+ 18. Kd1 Bg5 19. Nxc6 Bxe3 20. Ne7+ Kh8 21. Qd3 Bg5 22. Nxc8 Rxc8,"This is a game between Anand, Viswanathan (as White) and Shirov, Alexei (as Black). Last move played: Black plays Rook takes on c8",Large advantage for White (eval: 207 centipawns),23. Ke2 Bf4 24. Rh3 Qg5 25. Kf2 Bc6 26. g3 Bc1 27. Rb1 Re8 28. g4 Bd7 29. Be2 d5 30. cxd5 Rc8 31. Kg2 h6 32. Rh1 Bb5 33. Qd1 ,22... Rxc8 23. Ke2 Bc6 24. Rh3 Qf4 25. g3 Qf6 26. Ke1 Qd8 27. Rd1 f5 28. exf5 h6 29. Be2 d5 30. cxd5 Ba4 31. b3 Bb5 32. Qe4 Qa5+ 33. Kf1 
Is this the only way to hope to activate Bb7 and force line openings to get at Kc2?,True," The comment suggests a flawed plan to open the position, indicating a potential tactical error.",1. e4 c5 2. Nf3 Nc6 3. d4 cxd4 4. Nxd4 e5 5. Nb5 d6 6. N1c3 a6 7. Na3 b5 8. Nd5 Nf6 9. c4 b4 10. Nxf6+ Qxf6 11. Nc2 Qg6 12. Qd5 Bb7 13. Nxb4 Rc8 14. Be3 Be7 15. h4 O-O 16. h5 Qg4 17. f3 Qg3+ 18. Kd1 Bg5 19. Nxc6 Bxe3 20. Ne7+ Kh8 21. Qd3 Bg5 22. Nxc8 Rxc8 23. h6 gxh6 24. Kc2 d5,"This is a game between Anand, Viswanathan (as White) and Shirov, Alexei (as Black). Last move played: Black plays Pawn to d5",Large advantage for White (eval: 141 centipawns),25. exd5 ,24... d5 25. exd5 Bxd5 26. Qxd5 Qf2+ 27. Kc3 Qe3+ 28. Qd3 Qb6 29. b4 a5 30. Rb1 Rd8 31. Qe4 f5 32. c5 axb4+ 33. Qxb4 Bd2+ 34. Kc2 Qxb4 35. Rxb4 Bxb4 36. c6 Kg7 37. Rh4 Ba5 38. Kb3 Rd1 39. Ra4 Rxf1 40. Rxa5 Rc1 41. Rxe5 Rxc6 42. a4 Rg6 43. Re2 Kf6 44. Ra2 Ke5 
with the minor threat Qc5-f8#,True," The comment suggests a potential weakness in the queen's position, indicating a flawed tactical assessment.",1. e4 c5 2. Nf3 Nc6 3. d4 cxd4 4. Nxd4 e5 5. Nb5 d6 6. N1c3 a6 7. Na3 b5 8. Nd5 Nf6 9. c4 b4 10. Nxf6+ Qxf6 11. Nc2 Qg6 12. Qd5 Bb7 13. Nxb4 Rc8 14. Be3 Be7 15. h4 O-O 16. h5 Qg4 17. f3 Qg3+ 18. Kd1 Bg5 19. Nxc6 Bxe3 20. Ne7+ Kh8 21. Qd3 Bg5 22. Nxc8 Rxc8 23. h6 gxh6 24. Kc2 d5 25. exd5 Bxd5 26. Qxd5 Rd8 27. Qc5 Rd2+ 28. Kb3,"This is a game between Anand, Viswanathan (as White) and Shirov, Alexei (as Black). Last move played: White plays King to b3",Large advantage for White (eval: 463 centipawns),28... Kg8 29. Rh3 Qf4 30. a3 Qf6 31. Rb1 Bf4 32. Ka2 Qd8 33. Qb4 a5 34. Qb3 Rf2 35. g3 a4 36. Qxa4 Bd2 37. Qb3 Kf8 38. Rh1 Qd4 39. Be2 Rxe2 40. c5 e4 ,28. Kb3 Kg7 29. a4 e4 30. Rb1 Qf4 31. Ka2 e3 32. Qb4 Bf6 33. Qb3 Qd4 34. Rh5 Rf2 35. Bd3 Rd2 36. Rd5 Qf4 37. Re1 Rxg2 
"I suppose this might be an indicator that Shirov's 11...Qg6 was more dubious than good. These things are always easier to evaluate in hindsight. It also shows how dangerous either of these players can be, despite their inconsistency in this tournament.",True," The comment offers a potential explanation for the mistake, suggesting a critical evaluation of a less obvious tactical element.",1. e4 c5 2. Nf3 Nc6 3. d4 cxd4 4. Nxd4 e5 5. Nb5 d6 6. N1c3 a6 7. Na3 b5 8. Nd5 Nf6 9. c4 b4 10. Nxf6+ Qxf6 11. Nc2 Qg6 12. Qd5 Bb7 13. Nxb4 Rc8 14. Be3 Be7 15. h4 O-O 16. h5 Qg4 17. f3 Qg3+ 18. Kd1 Bg5 19. Nxc6 Bxe3 20. Ne7+ Kh8 21. Qd3 Bg5 22. Nxc8 Rxc8 23. h6 gxh6 24. Kc2 d5 25. exd5 Bxd5 26. Qxd5 Rd8 27. Qc5 Rd2+ 28. Kb3 Kg7 29. a3 e4 30. Rh3 Qf4 31. fxe4,"This is a game between Anand, Viswanathan (as White) and Shirov, Alexei (as Black). Last move played: White plays Pawn takes on e4",Large advantage for White (eval: 533 centipawns),31... Bf6 32. Rb1 Bd4 33. Qb4 Be5 34. Ka2 Qg5 35. Rd3 Rxd3 36. Bxd3 h5 37. Bf1 h4 38. Qb3 h5 ,31. fxe4 Qxe4 32. Ka2 f5 33. Rb1 f4 34. Qb4 Rd8 35. Re1 Qf5 36. Rf3 Bf6 37. Qb7+ Kg6 
"After this White might intend Bc1-e3-b6 followed by Nd5-c7+. But, Black won't leave Nd5 unchallenged.",True," The comment describes a potential move that could have been better, suggesting a strategic flaw.",1. e4 c5 2. Nf3 Nc6 3. d4 cxd4 4. Nxd4 e5 5. Nb5 d6 6. N1c3 a6 7. Na3 b5 8. Nd5,"This is a game between Anand, Viswanathan (as White) and Shirov, Alexei (as Black). Last move played: White plays Knight to d5",Advantage for White (eval: 50 centipawns),8... Nf6 ,8. Nd5 
"This creates an opportunity for White to show d5 isn't sufficiently guarded, or to be more precise that d5 and all of Black's queen-side is weak.",True," The comment suggests the player sacrificed a tempo to improve king safety, indicating a flawed tactical decision.",1. e4 c5 2. Nf3 Nc6 3. d4 cxd4 4. Nxd4 e5 5. Nb5 d6 6. N1c3 a6 7. Na3 b5 8. Nd5 Nf6 9. c4 b4 10. Nxf6+ Qxf6 11. Nc2 Qg6,"This is a game between Anand, Viswanathan (as White) and Shirov, Alexei (as Black). Last move played: Black plays Queen to g6",Slight advantage for White (eval: 46 centipawns),12. Ne3 Be7 ,11... Be7 12. Be2 
"Going into this game Anand stands in last place by himself. This is uncharacteristic. Also, Kasparov has the lead by himself and this is characteristic. It's a slender lead of only one-half point over the next five (5!) tied players. A win by either player puts him into contention and severely hurts the other player's chances.",True," The comment suggests a potential flaw in Shirov's assessment of the position, indicating a missed opportunity.",1. e4,"This is a game between Anand, Viswanathan (as White) and Shirov, Alexei (as Black). Last move played: White plays Pawn to e4",Slight advantage for White (eval: 33 centipawns),1... e5 2. Nf3 Nc6 3. d4 exd4 4. Nxd4 Bc5 5. Nb3 Bb6 6. a4 Qh4 7. Qf3 a5 8. g3 Qf6 9. Qe2 Nge7 10. Nc3 ,1. e4 e5 
