comment,good,reasoning,moves,context,engine_eval,engine_best_line,engine_best_alternative
The Sicilian Defense. Black's idea is to discourage White from setting up a classic center with pawns on d4 and e4.,True," The comment suggests a potential strategic flaw in the Sicilian Defense, indicating a miscalculation of the resulting pawn structure.",1. e4 c5,"This is a game between Yates,F (as White) and Lasker,Em (as Black). Last move played: Black plays Pawn to c5",Slight advantage for White (eval: 34 centipawns),2. Nf3 ,1... e5 2. Nf3 Nc6 3. d4 exd4 4. Nxd4 Bc5 5. Nb3 Bb6 6. a4 Qh4 7. Qf3 a5 8. g3 Qf6 9. Qe2 Nge7 10. Nc3 
"White has given up a central pawn for a less-valuab;e flank pawn, but he has a centrally-placed Knight as compensation.",True, The comment identifies a strategic error – sacrificing a pawn for a less valuable flank – and offers a compensating piece as justification.,1. e4 c5 2. Nf3 e6 3. d4 cxd4 4. Nxd4,"This is a game between Yates,F (as White) and Lasker,Em (as Black). Last move played: White plays Knight takes on d4",Slight advantage for White (eval: 44 centipawns),4... Nc6 5. Nc3 ,4. Nxd4 
"Notice that everything from move 8 to this point has been completely tactical. The position is pretty even. The White Queen is preventing the Black King from castling Kingside, but White has no real way to strike at the centralized Black King.",True," The comment identifies a tactical focus that is detrimental to the position, suggesting a flawed strategic assessment.",1. e4 c5 2. Nf3 e6 3. d4 cxd4 4. Nxd4 Nf6 5. Nc3 Nc6 6. Nxc6 bxc6 7. e5 Nd5 8. Ne4 f5 9. exf6 Nxf6 10. Nd6+ Bxd6 11. Qxd6 Qa5+ 12. Bd2 Qd5 13. Qa3,"This is a game between Yates,F (as White) and Lasker,Em (as Black). Last move played: White plays Queen to a3",Advantage for White (eval: 97 centipawns),13... Qe5+ 14. Be2 ,13. Bb4 Qe4+ 14. Kd1 Qd5+ 15. Bd3 Qxd6 16. Bxd6 a5 17. h4 Ba6 18. c4 c5 19. Kc2 Rc8 20. h5 Rc6 21. Be5 O-O 22. f3 d6 23. Bc3 d5 24. b3 Rd6 
Lasker keeps the initiative with a check.,True,", The comment suggests a potential tactical advantage gained by the opponent, indicating a flawed move.",1. e4 c5 2. Nf3 e6 3. d4 cxd4 4. Nxd4 Nf6 5. Nc3 Nc6 6. Nxc6 bxc6 7. e5 Nd5 8. Ne4 f5 9. exf6 Nxf6 10. Nd6+ Bxd6 11. Qxd6 Qa5+ 12. Bd2 Qd5 13. Qa3 Qe4+,"This is a game between Yates,F (as White) and Lasker,Em (as Black). Last move played: Black plays Queen to e4 with check",Advantage for White (eval: 79 centipawns),14. Be3 a5 ,13... Qe5+ 14. Be2 
More tactics -- Lasker keeps the initiative by creating threat after threat.,True," The comment suggests a potential tactical pursuit, potentially indicating a flawed opening or a missed opportunity to solidify control.",1. e4 c5 2. Nf3 e6 3. d4 cxd4 4. Nxd4 Nf6 5. Nc3 Nc6 6. Nxc6 bxc6 7. e5 Nd5 8. Ne4 f5 9. exf6 Nxf6 10. Nd6+ Bxd6 11. Qxd6 Qa5+ 12. Bd2 Qd5 13. Qa3 Qe4+ 14. Be3 a5 15. O-O-O Qb4 16. Qxb4 axb4 17. Bc4 d5,"This is a game between Yates,F (as White) and Lasker,Em (as Black). Last move played: Black plays Pawn to d5",Slight advantage for Black (eval: -21 centipawns),18. Bb3 Ra5 19. Bb6 Ra6 20. Bd4 Nd7 21. Bxg7 Rg8 22. Bh6 c5 23. c3 bxc3 24. bxc3 Kf7 25. Rhg1 Bb7 26. Rd3 Bc6 27. Rf3+ Ke7 28. Rg3 Rxg3 29. hxg3 c4 30. Bc2 Rxa2 31. Be3 Ba4 ,17... d5 18. Bb3 Ra5 19. Bb6 Ra6 20. Be3 Nd7 21. Rhe1 c5 22. Bxd5 exd5 23. Bxc5+ Kd8 24. Rxd5 Re8 25. Bxb4 Rxe1+ 26. Bxe1 Rxa2 27. Rg5 g6 28. f3 Ke7 29. b3 Kf7 30. Bc3 Nf6 
"Now it's time for the Black King to hightail it to the board's edge. Notice that this normally defensve move carries with it a possible threat to the f2-pawn, chaining the e3-Bishop to its defense.",True," The comment suggests a potential tactical threat, indicating a flawed assessment of the move's impact.",1. e4 c5 2. Nf3 e6 3. d4 cxd4 4. Nxd4 Nf6 5. Nc3 Nc6 6. Nxc6 bxc6 7. e5 Nd5 8. Ne4 f5 9. exf6 Nxf6 10. Nd6+ Bxd6 11. Qxd6 Qa5+ 12. Bd2 Qd5 13. Qa3 Qe4+ 14. Be3 a5 15. O-O-O Qb4 16. Qxb4 axb4 17. Bc4 d5 18. Bb3 Nd7 19. Rhe1 O-O,"This is a game between Yates,F (as White) and Lasker,Em (as Black). Last move played: Black plays kingside castle",Advantage for White (eval: 50 centipawns),20. Rd4 Rb8 21. Rh4 c5 22. Ba4 d4 23. Bf4 Ra8 24. Bb3 Nb6 25. Bd6 c4 26. Bxf8 cxb3 27. axb3 Kxf8 28. Rxh7 Kf7 29. Kd2 Bb7 30. Rh4 Bxg2 31. Rhe4 ,19... c5 20. Rxd5 exd5 21. Bxd5 Ra6 22. Bg5+ Kf8 23. Be7+ Ke8 24. Bf6+ Kf8 25. Be7+ 
Clearing d7 for the Bishop's use.,True,", The comment suggests a potential tactical error by attempting to develop a piece unnecessarily.",1. e4 c5 2. Nf3 e6 3. d4 cxd4 4. Nxd4 Nf6 5. Nc3 Nc6 6. Nxc6 bxc6 7. e5 Nd5 8. Ne4 f5 9. exf6 Nxf6 10. Nd6+ Bxd6 11. Qxd6 Qa5+ 12. Bd2 Qd5 13. Qa3 Qe4+ 14. Be3 a5 15. O-O-O Qb4 16. Qxb4 axb4 17. Bc4 d5 18. Bb3 Nd7 19. Rhe1 O-O 20. f3 Ra6 21. Bd2 c5 22. c4 bxc3 23. Bxc3 Nb6,"This is a game between Yates,F (as White) and Lasker,Em (as Black). Last move played: Black plays Knight to b6",The position is equal,24. Be5 ,23... Nf6 24. a3 
The Rook keeps the White Bishop off of c7.,True," Yes, this comment suggests a potential tactical weakness due to the Rook's obstruction of the Bishop.",1. e4 c5 2. Nf3 e6 3. d4 cxd4 4. Nxd4 Nf6 5. Nc3 Nc6 6. Nxc6 bxc6 7. e5 Nd5 8. Ne4 f5 9. exf6 Nxf6 10. Nd6+ Bxd6 11. Qxd6 Qa5+ 12. Bd2 Qd5 13. Qa3 Qe4+ 14. Be3 a5 15. O-O-O Qb4 16. Qxb4 axb4 17. Bc4 d5 18. Bb3 Nd7 19. Rhe1 O-O 20. f3 Ra6 21. Bd2 c5 22. c4 bxc3 23. Bxc3 Nb6 24. a3 Bd7 25. Be5 Rc8,"This is a game between Yates,F (as White) and Lasker,Em (as Black). Last move played: Black plays Rook to c8",The position is equal,26. f4 Ba4 27. Re3 Bxb3 28. Rxb3 Nd7 29. Re1 c4 30. Rb7 Nxe5 31. Rxe5 c3 32. Re2 d4 33. Rd7 Rb6 34. bxc3 h6 35. a4 dxc3 36. Rd4 Ra6 37. Rc2 ,25... Ba4 
The Bishop finally gets developed to a decent diagonal.,True," The comment suggests a potential improvement in the Bishop's development, indicating a flaw in the original move.",1. e4 c5 2. Nf3 e6 3. d4 cxd4 4. Nxd4 Nf6 5. Nc3 Nc6 6. Nxc6 bxc6 7. e5 Nd5 8. Ne4 f5 9. exf6 Nxf6 10. Nd6+ Bxd6 11. Qxd6 Qa5+ 12. Bd2 Qd5 13. Qa3 Qe4+ 14. Be3 a5 15. O-O-O Qb4 16. Qxb4 axb4 17. Bc4 d5 18. Bb3 Nd7 19. Rhe1 O-O 20. f3 Ra6 21. Bd2 c5 22. c4 bxc3 23. Bxc3 Nb6 24. a3 Bd7 25. Be5 Rc8 26. Rd2 Bb5,"This is a game between Yates,F (as White) and Lasker,Em (as Black). Last move played: Black plays Bishop to b5",The position is equal,27. f4 Bc4 28. Bc2 d4 29. f5 exf5 30. Bxf5 Re8 31. Rc2 g6 32. Bg4 h5 33. Bd1 Nd7 34. Bg3 Rxe1 35. Bxe1 Bd3 36. Rd2 Bc4 37. Bg3 Bd5 38. Be2 Ra7 39. Bb5 Kf7 40. a4 ,26... Ba4 27. Bxa4 
"Since the Knight has been lured away from f8, exchanging Bishops now guarantees a set of doubled and isolated g-pawns.",True," The comment offers a potential explanation for the mistake, suggesting a tactical advantage through doubled and isolated pawns.",1. e4 c5 2. Nf3 e6 3. d4 cxd4 4. Nxd4 Nf6 5. Nc3 Nc6 6. Nxc6 bxc6 7. e5 Nd5 8. Ne4 f5 9. exf6 Nxf6 10. Nd6+ Bxd6 11. Qxd6 Qa5+ 12. Bd2 Qd5 13. Qa3 Qe4+ 14. Be3 a5 15. O-O-O Qb4 16. Qxb4 axb4 17. Bc4 d5 18. Bb3 Nd7 19. Rhe1 O-O 20. f3 Ra6 21. Bd2 c5 22. c4 bxc3 23. Bxc3 Nb6 24. a3 Bd7 25. Be5 Rc8 26. Rd2 Bb5 27. f4 Bc4 28. Bc2 d4 29. f5 Nd7 30. fxe6 Bxe6 31. Bg3 Nf8 32. Re5 Rb6 33. Bh4 Bf7 34. Bg3 Bg6 35. Re7 Re6 36. Rxe6 Nxe6 37. Bxg6,"This is a game between Yates,F (as White) and Lasker,Em (as Black). Last move played: White plays Bishop takes on g6",Slight advantage for White (eval: 38 centipawns),37... hxg6 38. Kc2 Kf7 39. a4 Ra8 40. Rf2+ Ke7 41. Kb3 Ra6 42. Re2 g5 43. Re5 Rb6+ 44. Ka2 d3 45. Be1 Rd6 46. Bd2 Rd7 47. Re3 c4 48. Re4 Rd4 49. Rxd4 Nxd4 ,37. Bxg6 hxg6 38. Kc2 c4 39. Rd1 Kf7 40. b4 cxb3+ 41. Kxb3 Rc3+ 42. Kb2 Ke7 43. Rd2 Rc5 44. Kb3 Rb5+ 45. Kc4 Rc5+ 46. Kb4 Rd5 47. a4 Kd7 48. a5 Kc6 49. Rc2+ Kb7 50. Re2 d3 51. Rxe6 
"Black is stuck with doubled, isolated pawns. On the other hand, he has a protected passed d-pawn. White also has a protected passed pawn on a3. Black's is more advantageously placed than White's, since it's farther advanced.",True," The comment offers a justification for the mistake, suggesting a better position for White.",1. e4 c5 2. Nf3 e6 3. d4 cxd4 4. Nxd4 Nf6 5. Nc3 Nc6 6. Nxc6 bxc6 7. e5 Nd5 8. Ne4 f5 9. exf6 Nxf6 10. Nd6+ Bxd6 11. Qxd6 Qa5+ 12. Bd2 Qd5 13. Qa3 Qe4+ 14. Be3 a5 15. O-O-O Qb4 16. Qxb4 axb4 17. Bc4 d5 18. Bb3 Nd7 19. Rhe1 O-O 20. f3 Ra6 21. Bd2 c5 22. c4 bxc3 23. Bxc3 Nb6 24. a3 Bd7 25. Be5 Rc8 26. Rd2 Bb5 27. f4 Bc4 28. Bc2 d4 29. f5 Nd7 30. fxe6 Bxe6 31. Bg3 Nf8 32. Re5 Rb6 33. Bh4 Bf7 34. Bg3 Bg6 35. Re7 Re6 36. Rxe6 Nxe6 37. Bxg6 hxg6,"This is a game between Yates,F (as White) and Lasker,Em (as Black). Last move played: Black plays Pawn takes on g6",Slight advantage for White (eval: 43 centipawns),38. Kc2 Kf7 39. a4 Ra8 40. Rf2+ Ke7 41. Kb3 Ra6 42. Ka3 Rb6 43. b3 Rb7 44. Re2 g5 45. Re1 Rb4 46. Re5 d3 47. Be1 Rd4 48. Bd2 Kd6 ,37... hxg6 38. Kc2 Kf7 39. a4 Ra8 40. Rf2+ Ke7 41. Kb3 Ra6 42. Re2 g5 43. Re5 Rb6+ 44. Ka2 d3 45. Be1 Rd6 46. Bd2 Rd7 47. Re3 c4 48. Re4 Rd4 49. Rxd4 Nxd4 
Lasker's King starts heading for the center.,True," The comment suggests a potential tactical vulnerability, indicating a flawed plan.",1. e4 c5 2. Nf3 e6 3. d4 cxd4 4. Nxd4 Nf6 5. Nc3 Nc6 6. Nxc6 bxc6 7. e5 Nd5 8. Ne4 f5 9. exf6 Nxf6 10. Nd6+ Bxd6 11. Qxd6 Qa5+ 12. Bd2 Qd5 13. Qa3 Qe4+ 14. Be3 a5 15. O-O-O Qb4 16. Qxb4 axb4 17. Bc4 d5 18. Bb3 Nd7 19. Rhe1 O-O 20. f3 Ra6 21. Bd2 c5 22. c4 bxc3 23. Bxc3 Nb6 24. a3 Bd7 25. Be5 Rc8 26. Rd2 Bb5 27. f4 Bc4 28. Bc2 d4 29. f5 Nd7 30. fxe6 Bxe6 31. Bg3 Nf8 32. Re5 Rb6 33. Bh4 Bf7 34. Bg3 Bg6 35. Re7 Re6 36. Rxe6 Nxe6 37. Bxg6 hxg6 38. Be5 Rf8 39. b3 Rf1+ 40. Kc2 Kf7,"This is a game between Yates,F (as White) and Lasker,Em (as Black). Last move played: Black plays King to f7",Slight advantage for White (eval: 48 centipawns),41. Rd1 Rf2+ ,40... Kf7 41. Kd3 Nd8 42. Re2 Rc1 43. Rc2 Rb1 44. Kc4 Ke6 45. Bf4 Kd7 46. b4 cxb4 47. axb4 Nc6 48. Bd2 g5 49. Ra2 g4 50. Kc5 d3 51. Kc4 Ne5+ 52. Kc3 Kc6 53. Ra5 
"Instead of defending the Knight, Lasker responds with a check.",True,", The comment suggests a defensive error, indicating a flawed strategic decision.",1. e4 c5 2. Nf3 e6 3. d4 cxd4 4. Nxd4 Nf6 5. Nc3 Nc6 6. Nxc6 bxc6 7. e5 Nd5 8. Ne4 f5 9. exf6 Nxf6 10. Nd6+ Bxd6 11. Qxd6 Qa5+ 12. Bd2 Qd5 13. Qa3 Qe4+ 14. Be3 a5 15. O-O-O Qb4 16. Qxb4 axb4 17. Bc4 d5 18. Bb3 Nd7 19. Rhe1 O-O 20. f3 Ra6 21. Bd2 c5 22. c4 bxc3 23. Bxc3 Nb6 24. a3 Bd7 25. Be5 Rc8 26. Rd2 Bb5 27. f4 Bc4 28. Bc2 d4 29. f5 Nd7 30. fxe6 Bxe6 31. Bg3 Nf8 32. Re5 Rb6 33. Bh4 Bf7 34. Bg3 Bg6 35. Re7 Re6 36. Rxe6 Nxe6 37. Bxg6 hxg6 38. Be5 Rf8 39. b3 Rf1+ 40. Kc2 Kf7 41. Bg3 Ke7 42. a4 Kd7 43. Kd3 Rc1 44. Rc2 Rb1 45. Kc4 Kc6 46. Re2 Rc1+,"This is a game between Yates,F (as White) and Lasker,Em (as Black). Last move played: Black plays Rook to c1 with check",Advantage for Black (eval: -66 centipawns),47. Kd3 ,46... Rc1+ 
"""Priority of check"" (when you're in check you must respond to it) means that Yates has no time to capture the Knight.",True," The comment highlights a critical error in the player's response to being in check, suggesting a missed opportunity to capture the knight.",1. e4 c5 2. Nf3 e6 3. d4 cxd4 4. Nxd4 Nf6 5. Nc3 Nc6 6. Nxc6 bxc6 7. e5 Nd5 8. Ne4 f5 9. exf6 Nxf6 10. Nd6+ Bxd6 11. Qxd6 Qa5+ 12. Bd2 Qd5 13. Qa3 Qe4+ 14. Be3 a5 15. O-O-O Qb4 16. Qxb4 axb4 17. Bc4 d5 18. Bb3 Nd7 19. Rhe1 O-O 20. f3 Ra6 21. Bd2 c5 22. c4 bxc3 23. Bxc3 Nb6 24. a3 Bd7 25. Be5 Rc8 26. Rd2 Bb5 27. f4 Bc4 28. Bc2 d4 29. f5 Nd7 30. fxe6 Bxe6 31. Bg3 Nf8 32. Re5 Rb6 33. Bh4 Bf7 34. Bg3 Bg6 35. Re7 Re6 36. Rxe6 Nxe6 37. Bxg6 hxg6 38. Be5 Rf8 39. b3 Rf1+ 40. Kc2 Kf7 41. Bg3 Ke7 42. a4 Kd7 43. Kd3 Rc1 44. Rc2 Rb1 45. Kc4 Kc6 46. Re2 Rc1+ 47. Kd3,"This is a game between Yates,F (as White) and Lasker,Em (as Black). Last move played: White plays King to d3",Slight advantage for Black (eval: -33 centipawns),47... Rc3+ 48. Kd2 Kd7 49. Re5 Rxb3 50. Rd5+ Ke8 51. Bd6 c4 52. Kc1 Rc3+ 53. Kb2 Re3 54. Be5 Rb3+ 55. Kc1 d3 56. a5 g5 57. Bd6 Rc3+ 58. Kb2 Rc2+ 59. Kb1 Rxg2 60. a6 ,47. Kd3 
"The central White Knight is missing, but White still has a foothold in the center -- namely the e4-pawn.",True," The comment offers a potential explanation for the mistake, suggesting a strategic imbalance.",1. e4 c5 2. Nf3 e6 3. d4 cxd4 4. Nxd4 Nf6 5. Nc3 Nc6 6. Nxc6 bxc6,"This is a game between Yates,F (as White) and Lasker,Em (as Black). Last move played: Black plays Pawn takes on c6",Advantage for White (eval: 63 centipawns),7. e5 ,6... bxc6 
"Notice that everything from move 8 to this point has been completely tactical. The position is pretty even. The White Queen is preventing the Black King from castling Kingside, but White has no real way to strike at the centralized Black King.",True,". The comment suggests a potential weakness in the opponent's pawn structure, indicating a tactical error.",1. e4 c5 2. Nf3 e6 3. d4 cxd4 4. Nxd4 Nf6 5. Nc3 Nc6 6. Nxc6 bxc6 7. e5 Nd5 8. Ne4 f5 9. exf6 Nxf6 10. Nd6+ Bxd6 11. Qxd6 Qa5+ 12. Bd2 Qd5 13. Qa3,"This is a game between Yates,F (as White) and Lasker,Em (as Black). Last move played: White plays Queen to a3",Advantage for White (eval: 97 centipawns),13... Qe5+ 14. Be2 ,13. Bb4 Qe4+ 14. Kd1 Qd5+ 15. Bd3 Qxd6 16. Bxd6 a5 17. h4 Ba6 18. c4 c5 19. Kc2 Rc8 20. h5 Rc6 21. Be5 O-O 22. f3 d6 23. Bc3 d5 24. b3 Rd6 
Lasker keeps the initiative with a check.,True," The comment suggests the King's protection of the Knight is no longer necessary, indicating a flaw in the move's strategic planning.",1. e4 c5 2. Nf3 e6 3. d4 cxd4 4. Nxd4 Nf6 5. Nc3 Nc6 6. Nxc6 bxc6 7. e5 Nd5 8. Ne4 f5 9. exf6 Nxf6 10. Nd6+ Bxd6 11. Qxd6 Qa5+ 12. Bd2 Qd5 13. Qa3 Qe4+,"This is a game between Yates,F (as White) and Lasker,Em (as Black). Last move played: Black plays Queen to e4 with check",Advantage for White (eval: 79 centipawns),14. Be3 a5 ,13... Qe5+ 14. Be2 
"White has given up a central pawn for a less-valuab;e flank pawn, but he has a centrally-placed Knight as compensation.",True," The comment suggests the dark-squared Bishop is being used to attack, indicating a potential tactical blunder.",1. e4 c5 2. Nf3 e6 3. d4 cxd4 4. Nxd4,"This is a game between Yates,F (as White) and Lasker,Em (as Black). Last move played: White plays Knight takes on d4",Slight advantage for White (eval: 44 centipawns),4... Nc6 5. Nc3 ,4. Nxd4 
