comment,good,reasoning,moves,context,engine_eval,engine_best_line,engine_best_alternative
A passive move. 5...c5 was better.,True," The comment suggests the move was a weakness, indicating a suboptimal choice.",1. d4 d5 2. c4 e6 3. Nc3 Nf6 4. Nf3 Be7 5. Bf4 c6,"This is a game between Tarrasch, S (as White) and Von Scheve, T (as Black). Last move played: Black plays Pawn to c6",Slight advantage for White (eval: 41 centipawns),6. e3 Nbd7 ,5... O-O 6. e3 
Preparing a flight square for the Bishop in the event of 7...Nh5.,True," The comment suggests a potential tactical error, indicating a flawed planning strategy.",1. d4 d5 2. c4 e6 3. Nc3 Nf6 4. Nf3 Be7 5. Bf4 c6 6. e3 Nbd7 7. h3,"This is a game between Tarrasch, S (as White) and Von Scheve, T (as Black). Last move played: White plays Pawn to h3",Slight advantage for White (eval: 36 centipawns),7... O-O 8. c5 ,7. Qc2 
"A serious mistake. After the exchange of Knights, Black's recapturing Pawn on e4 becomes weak and needs protection by...f5. White attacks it with f3 forcing Black to exchange and open the 'g' file.",True," The comment identifies a specific flaw in the recapture and suggests a defensive strategy, indicating a misunderstanding of the resulting position.",1. d4 d5 2. c4 e6 3. Nc3 Nf6 4. Nf3 Be7 5. Bf4 c6 6. e3 Nbd7 7. h3 Ne4,"This is a game between Tarrasch, S (as White) and Von Scheve, T (as Black). Last move played: Black plays Knight to e4",Advantage for White (eval: 64 centipawns),8. Qc2 Nxc3 ,7... O-O 8. c5 
Black should have retained this Bishop for the protection of his pawn on g7.,True," The comment suggests a potential defensive move that was missed, indicating a flaw in the player’s strategic thinking.",1. d4 d5 2. c4 e6 3. Nc3 Nf6 4. Nf3 Be7 5. Bf4 c6 6. e3 Nbd7 7. h3 Ne4 8. Nxe4 dxe4 9. Nd2 Bb4,"This is a game between Tarrasch, S (as White) and Von Scheve, T (as Black). Last move played: Black plays Bishop to b4",Large advantage for White (eval: 172 centipawns),10. a3 Bxd2+ 11. Qxd2 O-O 12. Rd1 Qf6 13. Qc3 b6 14. Be2 c5 15. Bd6 Re8 16. O-O cxd4 17. Rxd4 Bb7 18. b4 a5 19. Rfd1 axb4 20. axb4 Ra2 21. Qe1 Rea8 22. R4d2 ,9... f5 10. Qc2 
Now White has the advantage of the two Bishops.,True," The comment suggests a potential tactical advantage, indicating a flaw in the move's assessment.",1. d4 d5 2. c4 e6 3. Nc3 Nf6 4. Nf3 Be7 5. Bf4 c6 6. e3 Nbd7 7. h3 Ne4 8. Nxe4 dxe4 9. Nd2 Bb4 10. a3 Bxd2+ 11. Qxd2,"This is a game between Tarrasch, S (as White) and Von Scheve, T (as Black). Last move played: White plays Queen takes on d2",Large advantage for White (eval: 153 centipawns),11... O-O 12. Rd1 Qf6 13. Qc2 Qg6 14. g4 Re8 15. Be2 c5 16. b4 cxb4 17. axb4 a5 18. Qa4 b5 19. Qxb5 axb4 20. Qxb4 h6 21. Bd6 e5 22. dxe5 Ra2 ,11. Qxd2 O-O 12. Rd1 Qf6 13. Qc2 Qg6 14. g4 b6 15. h4 e5 16. dxe5 Nc5 17. b4 Nd3+ 18. Rxd3 exd3 19. Bxd3 Qxg4 20. Bxh7+ Kh8 21. Be4 Ba6 22. f3 Qe6 23. b5 cxb5 24. Rg1 Rad8 25. Qg2 g6 
Better was 11...Qe7 followed by 12...e5 to get some counterplay.,True," The comment suggests a potential weakness in the move, indicating a need for more active development.",1. d4 d5 2. c4 e6 3. Nc3 Nf6 4. Nf3 Be7 5. Bf4 c6 6. e3 Nbd7 7. h3 Ne4 8. Nxe4 dxe4 9. Nd2 Bb4 10. a3 Bxd2+ 11. Qxd2 O-O,"This is a game between Tarrasch, S (as White) and Von Scheve, T (as Black). Last move played: Black plays kingside castle",Large advantage for White (eval: 176 centipawns),12. Rd1 ,11... O-O 12. Rd1 Qf6 13. Qc2 Qg6 14. g4 Re8 15. Be2 c5 16. b4 cxb4 17. axb4 a5 18. Qa4 b5 19. Qxb5 axb4 20. Qxb4 h6 21. Bd6 e5 22. dxe5 Ra2 
"If 12...Nf6, then 13 Be5 followed by Bxf6 wins the Pawn on e4.",True,"

The comment offers a potential tactical sequence, suggesting a miscalculation, but it doesn't directly explain why the move was considered a mistake.",1. d4 d5 2. c4 e6 3. Nc3 Nf6 4. Nf3 Be7 5. Bf4 c6 6. e3 Nbd7 7. h3 Ne4 8. Nxe4 dxe4 9. Nd2 Bb4 10. a3 Bxd2+ 11. Qxd2 O-O 12. Qc2 f5,"This is a game between Tarrasch, S (as White) and Von Scheve, T (as Black). Last move played: Black plays Pawn to f5",Large advantage for White (eval: 170 centipawns),13. Bd6 Rf7 14. Be2 Nf6 15. Be5 Bd7 16. O-O Be8 17. b4 h6 18. a4 a6 19. Qb3 Kh7 20. Kh2 Nd7 21. Bd6 Nf6 22. c5 Nd5 23. Qa3 Qg5 24. Bc4 Kh8 25. Rg1 Rd8 26. f3 ,12... Qa5+ 13. b4 
Gets a grip on the black squares and prevents...Qe7 and...e5.,True," The comment suggests a tactical deficiency, indicating a potential loss of control over the board.",1. d4 d5 2. c4 e6 3. Nc3 Nf6 4. Nf3 Be7 5. Bf4 c6 6. e3 Nbd7 7. h3 Ne4 8. Nxe4 dxe4 9. Nd2 Bb4 10. a3 Bxd2+ 11. Qxd2 O-O 12. Qc2 f5 13. Bd6,"This is a game between Tarrasch, S (as White) and Von Scheve, T (as Black). Last move played: White plays Bishop to d6",Large advantage for White (eval: 170 centipawns),13... Rf7 14. Be2 Nf6 15. Bf4 h6 16. O-O Bd7 17. Be5 Be8 18. b4 a6 19. a4 Nd7 20. Bh2 Nf6 21. Rfb1 Rf8 22. Be5 Rf7 23. c5 Nd5 24. Bc4 b5 25. cxb6 Qxb6 26. a5 Qd8 27. Rb2 Rb7 ,13. Bd6 Rf7 14. Be2 Nf6 15. Be5 Bd7 16. O-O Be8 17. b4 h6 18. a4 a6 19. Qb3 Kh7 20. Kh2 Nd7 21. Bd6 Nf6 22. c5 Nd5 23. Qa3 Qg5 24. Bc4 Kh8 25. Rg1 Rd8 26. f3 
"Threatens to win a pawn after 17 Bxf6, forcing Black to exchange pawns, opening the 'g' file.",True," The comment describes a potential tactical threat and a resulting pawn exchange, suggesting a flawed strategic decision.",1. d4 d5 2. c4 e6 3. Nc3 Nf6 4. Nf3 Be7 5. Bf4 c6 6. e3 Nbd7 7. h3 Ne4 8. Nxe4 dxe4 9. Nd2 Bb4 10. a3 Bxd2+ 11. Qxd2 O-O 12. Qc2 f5 13. Bd6 Re8 14. O-O-O Nf6 15. Be5 Bd7 16. f3,"This is a game between Tarrasch, S (as White) and Von Scheve, T (as Black). Last move played: White plays Pawn to f3",Large advantage for White (eval: 221 centipawns),16... b5 17. Rg1 ,16. g4 Bc8 17. Rg1 Rf8 18. Be2 Rf7 19. Bf4 Nd7 20. h4 Qe7 21. gxf5 exf5 22. h5 Nf6 23. d5 Bd7 24. Qb3 Ng4 25. h6 Re8 26. hxg7 
Defends g7 and prevents 22 Qh4.,True," The comment identifies a potential defensive move that hinders the opponent's development, suggesting a flawed strategic choice.",1. d4 d5 2. c4 e6 3. Nc3 Nf6 4. Nf3 Be7 5. Bf4 c6 6. e3 Nbd7 7. h3 Ne4 8. Nxe4 dxe4 9. Nd2 Bb4 10. a3 Bxd2+ 11. Qxd2 O-O 12. Qc2 f5 13. Bd6 Re8 14. O-O-O Nf6 15. Be5 Bd7 16. f3 exf3 17. gxf3 b5 18. Rg1 Rf8 19. Rd2 Rf7 20. Rdg2 a5 21. Qf2 Ne8,"This is a game between Tarrasch, S (as White) and Von Scheve, T (as Black). Last move played: Black plays Knight to e8",Large advantage for White (eval: 282 centipawns),22. h4 Ra7 23. h5 b4 24. c5 Bc8 25. Bc4 bxa3 26. bxa3 Rab7 27. Qe1 a4 28. e4 Kf8 29. Qe3 Qa5 30. h6 g6 31. Rd1 fxe4 32. fxe4 Kg8 33. Rh2 Nf6 ,21... Ra7 22. Qh4 
"If 22...g6, White attacks with 23 h4 and 24 h5 or if 22...h6 23 Rg6 Kh7 24 Qg3 Qe7 25 Rxh6 +! Gxh6 26 Qg6#",True," The comment describes a potential tactical threat, suggesting a flawed opening choice.",1. d4 d5 2. c4 e6 3. Nc3 Nf6 4. Nf3 Be7 5. Bf4 c6 6. e3 Nbd7 7. h3 Ne4 8. Nxe4 dxe4 9. Nd2 Bb4 10. a3 Bxd2+ 11. Qxd2 O-O 12. Qc2 f5 13. Bd6 Re8 14. O-O-O Nf6 15. Be5 Bd7 16. f3 exf3 17. gxf3 b5 18. Rg1 Rf8 19. Rd2 Rf7 20. Rdg2 a5 21. Qf2 Ne8 22. Rg5 Qe7,"This is a game between Tarrasch, S (as White) and Von Scheve, T (as Black). Last move played: Black plays Queen to e7",Large advantage for White (eval: 312 centipawns),23. c5 Bc8 24. Qh4 Ra7 25. Bd3 Nf6 26. Bxf6 Qxf6 27. Rxg7+ Rxg7 28. Qxf6 Rxg1+ 29. Kd2 Rag7 30. e4 R1g2+ 31. Kc3 R7g3 32. Qd8+ Kg7 33. Qc7+ Kh6 34. Qxc8 Rxf3 35. Qxe6+ Kh5 36. exf5 ,22... c5 23. cxb5 Rc8 24. Qg3 Qe7 25. b6 Bc6 26. Kb1 Qd7 27. Be2 Bd5 28. dxc5 Rxc5 29. Bd4 Rc8 30. Ba6 Ra8 31. Bd3 
"Other moves lose quickly e.g., A-24...g6 25 Rxg6+ hxg6 26 Rxg6+ Rg7 27 Bxf6 +- B-24...Kh8 25 Rxg7 and 26 Bxf6 +- C-24...Be8 25 Bxf6 Qxf6 26 Qxf6 Rxf6 27 Rxg7+ Kf8 28 Rxh7+-",True," The comment describes a sequence of moves that leads to a compromised pawn structure, indicating a significant tactical blunder.",1. d4 d5 2. c4 e6 3. Nc3 Nf6 4. Nf3 Be7 5. Bf4 c6 6. e3 Nbd7 7. h3 Ne4 8. Nxe4 dxe4 9. Nd2 Bb4 10. a3 Bxd2+ 11. Qxd2 O-O 12. Qc2 f5 13. Bd6 Re8 14. O-O-O Nf6 15. Be5 Bd7 16. f3 exf3 17. gxf3 b5 18. Rg1 Rf8 19. Rd2 Rf7 20. Rdg2 a5 21. Qf2 Ne8 22. Rg5 Qe7 23. Qh4 Nf6 24. Qh6 Ra7,"This is a game between Tarrasch, S (as White) and Von Scheve, T (as Black). Last move played: Black plays Rook to a7",Large advantage for White (eval: 419 centipawns),25. Bxf6 Qxf6 26. Qxf6 Rxf6 27. Rxg7+ Kf8 28. Rxh7 Rf7 29. Rh8+ Ke7 30. c5 e5 31. dxe5 Ke6 32. f4 Kd5 33. h4 Re7 34. Rg6 b4 35. Rd8 Kxc5 36. h5 Be8 37. Rg5 Rad7 38. Rxd7 Bxd7 39. h6 ,24... Be8 25. Bxf6 Qxf6 26. Qxf6 Rxf6 27. Rxg7+ Kf8 28. Rxh7 Rc8 29. c5 Rd8 30. f4 Bg6 31. Ra7 Bh5 32. Rgg7 Bf3 33. Bg2 Bd5 34. Kd2 Bxg2 35. Rxg2 Rf7 36. Ra6 Rc7 37. h4 Kf7 38. Rxa5 Rh8 39. Kc3 Kf6 40. Ra6 Rxh4 
"Threatening 31 Rg8+ and mate next move. If Black plays 30...Qf8, 31 Qg6+ Kd8 32 Rg8 and White win the Queen.",True," The comment offers a potential tactical threat and a guaranteed win, suggesting the move was a flawed attempt to force a decisive outcome.",1. d4 d5 2. c4 e6 3. Nc3 Nf6 4. Nf3 Be7 5. Bf4 c6 6. e3 Nbd7 7. h3 Ne4 8. Nxe4 dxe4 9. Nd2 Bb4 10. a3 Bxd2+ 11. Qxd2 O-O 12. Qc2 f5 13. Bd6 Re8 14. O-O-O Nf6 15. Be5 Bd7 16. f3 exf3 17. gxf3 b5 18. Rg1 Rf8 19. Rd2 Rf7 20. Rdg2 a5 21. Qf2 Ne8 22. Rg5 Qe7 23. Qh4 Nf6 24. Qh6 Ra7 25. Bd6 Qxd6 26. Rxg7+ Kf8 27. Rxh7+ Ke7 28. Rxf7+ Kxf7 29. Rg7+ Ke8 30. Qxf6,"This is a game between Tarrasch, S (as White) and Von Scheve, T (as Black). Last move played: White plays Queen takes on f6",Large advantage for White (eval: 697 centipawns),30... Qf8 31. Qg6+ Kd8 32. Rg8 Qxg8 33. Qxg8+ Kc7 34. cxb5 cxb5 35. Kd2 Rb7 36. Qg7 Kd8 37. Qf8+ Kc7 38. Qc5+ Kd8 39. h4 Ke8 40. h5 Kf7 41. b3 b4 ,30. Qxf6 Qf8 31. Qg6+ Kd8 32. Rg8 Qxg8 33. Qxg8+ Kc7 34. cxb5 cxb5 35. Kd2 Rb7 36. Qg7 Kd8 37. Qf8+ Kc7 38. Qc5+ Kd8 39. h4 Ke8 40. d5 b4 41. a4 Kf7 42. Qxa5 
A passive move. 5...c5 was better.,True," The comment describes a sequence of moves that leads to a refuted attack, indicating a flawed strategic decision.",1. d4 d5 2. c4 e6 3. Nc3 Nf6 4. Nf3 Be7 5. Bf4 c6,"This is a game between Tarrasch, S (as White) and Von Scheve, T (as Black). Last move played: Black plays Pawn to c6",Slight advantage for White (eval: 41 centipawns),6. e3 Nbd7 ,5... O-O 6. e3 
