comment,good,reasoning,moves,context,engine_eval,engine_best_line,engine_best_alternative
"As we've seen in the notes to a previous game, this is a sham threat (Black can't hold on to the pawn).",True," The comment identifies a flawed strategic idea, suggesting a weakness in the opponent’s position.",1. e4 e5 2. Nf3 Nc6 3. Bb5 a6 4. Ba4 Nf6,"This is a game between Lasker,Ed (as White) and Reti,R (as Black). Last move played: Black plays Knight to f6",Slight advantage for White (eval: 43 centipawns),5. O-O Nxe4 6. d4 b5 7. Bb3 d5 8. dxe5 Be6 9. c3 Bc5 10. Bc2 Bb6 11. Nbd2 Bf5 12. Nb3 Bg6 13. Nbd4 Nxd4 14. cxd4 c5 15. Be3 cxd4 16. Nxd4 ,4... Nf6 5. O-O Be7 6. Re1 b5 7. Bb3 O-O 8. a4 Bb7 9. d3 d6 10. Nbd2 Na5 11. Ba2 c5 12. Nf1 c4 13. Bg5 h6 14. Bxf6 Bxf6 15. dxc4 bxc4 
Opening a pocket for the light-squared Bishop.,True,". The comment suggests a tactical error, indicating a potential weakness in the opening strategy.",1. e4 e5 2. Nf3 Nc6 3. Bb5 a6 4. Ba4 Nf6 5. O-O Be7 6. Re1 b5 7. Bb3 d6 8. c3,"This is a game between Lasker,Ed (as White) and Reti,R (as Black). Last move played: White plays Pawn to c3",Slight advantage for White (eval: 44 centipawns),8... O-O 9. h3 ,8. c3 O-O 
Reti starts a Queenside flank attack (which is fairly common in the main line Ruy Lopez).,True," The comment offers a potential explanation for the mistake, suggesting a common opening strategy.",1. e4 e5 2. Nf3 Nc6 3. Bb5 a6 4. Ba4 Nf6 5. O-O Be7 6. Re1 b5 7. Bb3 d6 8. c3 O-O 9. h3 Na5 10. Bc2 c5,"This is a game between Lasker,Ed (as White) and Reti,R (as Black). Last move played: Black plays Pawn to c5",Slight advantage for White (eval: 47 centipawns),11. d4 exd4 12. cxd4 cxd4 13. Nxd4 Bd7 14. Nc3 Re8 15. b3 Nc6 16. Be3 Nb4 17. Bb1 Rc8 18. a3 Rxc3 19. axb4 Qa8 20. f3 Rcc8 21. Qd2 Bd8 22. Bf2 Qb7 23. Ne2 ,10... c5 11. d4 cxd4 12. cxd4 exd4 13. Nxd4 Bd7 14. Nc3 Re8 15. b3 Nc6 16. Be3 Nb4 17. Rc1 Nxc2 18. Nxc2 a5 19. a3 Qb8 20. Bd4 b4 21. axb4 axb4 22. Nb1 
Reti opts for an immediate central pawn break. He wants to trade one of his flank pawns for a more valuable central pawn. This will also strand White's d-pawn.,True," The comment suggests a strategic maneuver that deviates from the established plan, indicating a potential mistake.",1. e4 e5 2. Nf3 Nc6 3. Bb5 a6 4. Ba4 Nf6 5. O-O Be7 6. Re1 b5 7. Bb3 d6 8. c3 O-O 9. h3 Na5 10. Bc2 c5 11. d4 Qc7 12. Nbd2 Nd7 13. d5 f5,"This is a game between Lasker,Ed (as White) and Reti,R (as Black). Last move played: Black plays Pawn to f5",Large advantage for White (eval: 142 centipawns),14. exf5 ,13... Nb6 14. b3 
"Note that the d5-pawn is now unsupported. White can't prop it up by c3-c4, since Black can just reply ...bxc4.",True," The comment directly points out a flaw in the player's plan, suggesting a strategic weakness.",1. e4 e5 2. Nf3 Nc6 3. Bb5 a6 4. Ba4 Nf6 5. O-O Be7 6. Re1 b5 7. Bb3 d6 8. c3 O-O 9. h3 Na5 10. Bc2 c5 11. d4 Qc7 12. Nbd2 Nd7 13. d5 f5 14. exf5,"This is a game between Lasker,Ed (as White) and Reti,R (as Black). Last move played: White plays Pawn takes on f5",Large advantage for White (eval: 135 centipawns),14... Nb6 15. Ne4 Bxf5 16. Nfg5 Bxg5 17. Nxg5 Qd7 18. g4 Bxc2 19. Qxc2 g6 20. Rd1 Qb7 21. Ne4 Nxd5 22. Nxd6 Qc6 23. Qe4 Qxd6 24. Rxd5 Qf6 25. Be3 Nc4 26. Rxc5 Qf3 27. Qxf3 Rxf3 ,14. exf5 
"Lasker responds by shifting the Knight to allow the Queen to cover the pawn. But guarding pawns is not the best use of one's Queen. Furthermore, the f5-pawn is no longer protected by the c2-Bishop (the Knight blocks the Bishop's path).",True, The comment identifies a strategic error – neglecting pawn protection – and highlights a potential weakness in the Queen’s position.,1. e4 e5 2. Nf3 Nc6 3. Bb5 a6 4. Ba4 Nf6 5. O-O Be7 6. Re1 b5 7. Bb3 d6 8. c3 O-O 9. h3 Na5 10. Bc2 c5 11. d4 Qc7 12. Nbd2 Nd7 13. d5 f5 14. exf5 Nb6 15. Ne4,"This is a game between Lasker,Ed (as White) and Reti,R (as Black). Last move played: White plays Knight to e4",Large advantage for White (eval: 118 centipawns),15... Bxf5 ,15. b4 cxb4 
Reti has evened the material balance.,True,". The comment suggests the opponent has equalized the game, which is a common consequence of a tactical mistake.",1. e4 e5 2. Nf3 Nc6 3. Bb5 a6 4. Ba4 Nf6 5. O-O Be7 6. Re1 b5 7. Bb3 d6 8. c3 O-O 9. h3 Na5 10. Bc2 c5 11. d4 Qc7 12. Nbd2 Nd7 13. d5 f5 14. exf5 Nb6 15. Ne4 Bxf5,"This is a game between Lasker,Ed (as White) and Reti,R (as Black). Last move played: Black plays Bishop takes on f5",Large advantage for White (eval: 129 centipawns),16. Nfg5 ,15... Bxf5 
The Knights defend each other.,True,", The comment suggests a defensive strategy, potentially indicating a flawed positional decision.",1. e4 e5 2. Nf3 Nc6 3. Bb5 a6 4. Ba4 Nf6 5. O-O Be7 6. Re1 b5 7. Bb3 d6 8. c3 O-O 9. h3 Na5 10. Bc2 c5 11. d4 Qc7 12. Nbd2 Nd7 13. d5 f5 14. exf5 Nb6 15. Ne4 Bxf5 16. Neg5,"This is a game between Lasker,Ed (as White) and Reti,R (as Black). Last move played: White plays Knight to g5",Advantage for White (eval: 68 centipawns),16... Qd7 17. Bxf5 ,16. Nfg5 
Completing the trade and setting up mate on the move.,True," The comment suggests a potential tactical advantage for the opponent, indicating a flawed move.",1. e4 e5 2. Nf3 Nc6 3. Bb5 a6 4. Ba4 Nf6 5. O-O Be7 6. Re1 b5 7. Bb3 d6 8. c3 O-O 9. h3 Na5 10. Bc2 c5 11. d4 Qc7 12. Nbd2 Nd7 13. d5 f5 14. exf5 Nb6 15. Ne4 Bxf5 16. Neg5 Qd7 17. g4 Bxc2 18. Qxc2,"This is a game between Lasker,Ed (as White) and Reti,R (as Black). Last move played: White plays Queen takes on c2",Advantage for White (eval: 50 centipawns),18... g6 ,18. Qxc2 g6 19. Rd1 Nb7 20. b3 Nd8 21. Be3 Rb8 22. a4 bxa4 23. bxa4 Nc4 24. Bc1 Na5 25. Rb1 Rxb1 26. Qxb1 Nc4 
Centralizing the Queen while continuing to defend the d5-pawn.,True,", The comment suggests a potentially weak strategic move, indicating a flawed plan.",1. e4 e5 2. Nf3 Nc6 3. Bb5 a6 4. Ba4 Nf6 5. O-O Be7 6. Re1 b5 7. Bb3 d6 8. c3 O-O 9. h3 Na5 10. Bc2 c5 11. d4 Qc7 12. Nbd2 Nd7 13. d5 f5 14. exf5 Nb6 15. Ne4 Bxf5 16. Neg5 Qd7 17. g4 Bxc2 18. Qxc2 g6 19. Qe4,"This is a game between Lasker,Ed (as White) and Reti,R (as Black). Last move played: White plays Queen to e4",Advantage for White (eval: 80 centipawns),19... Qb7 ,19. Rd1 Qb7 
"Protecting the pawn by advancing it. Notice that Black's Queenside attack has stalled. This is why a central counterattack is the best way to meet a flank attack; if you give the opponent something to think about in the center, it prevents him from carrying out his plans for the flank.",True," The comment offers a potential explanation for the mistake, suggesting a strategic response to a flank attack.",1. e4 e5 2. Nf3 Nc6 3. Bb5 a6 4. Ba4 Nf6 5. O-O Be7 6. Re1 b5 7. Bb3 d6 8. c3 O-O 9. h3 Na5 10. Bc2 c5 11. d4 Qc7 12. Nbd2 Nd7 13. d5 f5 14. exf5 Nb6 15. Ne4 Bxf5 16. Neg5 Qd7 17. g4 Bxc2 18. Qxc2 g6 19. Qe4 Bxg5 20. Nxg5 Qb7 21. f4 Qxd5 22. fxe5 Rae8 23. Qxd5+ Nxd5 24. e6,"This is a game between Lasker,Ed (as White) and Reti,R (as Black). Last move played: White plays Pawn to e6",Slight advantage for White (eval: 28 centipawns),24... Rf6 ,24. e6 Rf6 25. Rd1 Nb6 26. Rxd6 Nac4 27. Rc6 h6 28. Ne4 Rfxe6 29. Rxe6 Rxe6 30. Nxc5 Re1+ 31. Kf2 Rh1 32. Nxa6 Nxb2 33. Bxb2 Rh2+ 34. Ke3 Rxb2 35. Kd4 Rd2+ 36. Kc5 Na4+ 37. Kxb5 Nxc3+ 38. Kc4 Rxa2 39. Rxa2 Nxa2 
"Despite the fact that the e6-pawn now has one less defender, Black doesn't have the time to capture it: White's is the stronger threat. The Knight is menaced and there's a x-ray attack on the d6-pawn.",True," The comment offers a potential explanation for the mistake, suggesting a lack of immediate tactical opportunity.",1. e4 e5 2. Nf3 Nc6 3. Bb5 a6 4. Ba4 Nf6 5. O-O Be7 6. Re1 b5 7. Bb3 d6 8. c3 O-O 9. h3 Na5 10. Bc2 c5 11. d4 Qc7 12. Nbd2 Nd7 13. d5 f5 14. exf5 Nb6 15. Ne4 Bxf5 16. Neg5 Qd7 17. g4 Bxc2 18. Qxc2 g6 19. Qe4 Bxg5 20. Nxg5 Qb7 21. f4 Qxd5 22. fxe5 Rae8 23. Qxd5+ Nxd5 24. e6 Rf6 25. Rd1,"This is a game between Lasker,Ed (as White) and Reti,R (as Black). Last move played: White plays Rook to d1",Slight advantage for White (eval: 28 centipawns),25... Nb6 ,25. Rd1 Nb6 
A nice maneuver! White picks up a pawn and the Rook once again defends the e6-pawn.,True," The comment offers a superficial explanation of the move, but doesn't address why it's considered a mistake.",1. e4 e5 2. Nf3 Nc6 3. Bb5 a6 4. Ba4 Nf6 5. O-O Be7 6. Re1 b5 7. Bb3 d6 8. c3 O-O 9. h3 Na5 10. Bc2 c5 11. d4 Qc7 12. Nbd2 Nd7 13. d5 f5 14. exf5 Nb6 15. Ne4 Bxf5 16. Neg5 Qd7 17. g4 Bxc2 18. Qxc2 g6 19. Qe4 Bxg5 20. Nxg5 Qb7 21. f4 Qxd5 22. fxe5 Rae8 23. Qxd5+ Nxd5 24. e6 Rf6 25. Rd1 Nc7 26. Rxd6,"This is a game between Lasker,Ed (as White) and Reti,R (as Black). Last move played: White plays Rook takes on d6",Large advantage for White (eval: 179 centipawns),26... Re7 27. Rd7 Nc6 28. Bd2 h6 29. Rxe7 Nxe7 30. Ne4 Rxe6 31. Re1 c4 32. Bxh6 Ned5 33. Bd2 a5 34. a3 Rb6 35. Kf2 b4 36. a4 Na6 37. Kf3 Re6 38. Rd1 Nb6 39. cxb4 Nxb4 40. Bc3 Nxa4 41. Rd8+ Kf7 ,26. Rxd6 Re7 27. Rd7 Nc6 28. a4 b4 29. cxb4 Rfxe6 30. Nxe6 Rxd7 31. Nxc7 Rd1+ 32. Kf2 Nxb4 33. Ne6 Nc2 34. Rb1 c4 35. Nf4 Nb4 36. Ke2 Rh1 
Reti kicks at one of the pawn's defenders. The problem is that he kicks at the wrong defender. Now he'll lose the exchange instead of just losing a pawn.,True," The comment identifies a specific tactical error and suggests a potential consequence, indicating a clear understanding of the mistake.",1. e4 e5 2. Nf3 Nc6 3. Bb5 a6 4. Ba4 Nf6 5. O-O Be7 6. Re1 b5 7. Bb3 d6 8. c3 O-O 9. h3 Na5 10. Bc2 c5 11. d4 Qc7 12. Nbd2 Nd7 13. d5 f5 14. exf5 Nb6 15. Ne4 Bxf5 16. Neg5 Qd7 17. g4 Bxc2 18. Qxc2 g6 19. Qe4 Bxg5 20. Nxg5 Qb7 21. f4 Qxd5 22. fxe5 Rae8 23. Qxd5+ Nxd5 24. e6 Rf6 25. Rd1 Nc7 26. Rxd6 h6,"This is a game between Lasker,Ed (as White) and Reti,R (as Black). Last move played: Black plays Pawn to h6",Large advantage for White (eval: 401 centipawns),27. Ne4 Rfxe6 28. Nf6+ Rxf6 29. Rxf6 Kg7 30. Rd6 Re1+ 31. Kf2 Re7 32. b3 c4 33. b4 Nb7 34. Rd1 g5 35. Be3 Kf7 36. Rd2 Ne8 37. Kf3 ,26... Re7 27. Rd7 Nc6 28. Bd2 h6 29. Rxe7 Nxe7 30. Ne4 Rxe6 31. Re1 c4 32. Bxh6 Ned5 33. Bd2 a5 34. a3 Rb6 35. Kf2 b4 36. a4 Na6 37. Kf3 Re6 38. Rd1 Nb6 39. cxb4 Nxb4 40. Bc3 Nxa4 41. Rd8+ Kf7 
Priority of check means that the double-attack fails -- Black has no time to win the Rook.,True," The comment suggests the double-attack was unsuccessful, implying a strategic flaw in Black's planning.",1. e4 e5 2. Nf3 Nc6 3. Bb5 a6 4. Ba4 Nf6 5. O-O Be7 6. Re1 b5 7. Bb3 d6 8. c3 O-O 9. h3 Na5 10. Bc2 c5 11. d4 Qc7 12. Nbd2 Nd7 13. d5 f5 14. exf5 Nb6 15. Ne4 Bxf5 16. Neg5 Qd7 17. g4 Bxc2 18. Qxc2 g6 19. Qe4 Bxg5 20. Nxg5 Qb7 21. f4 Qxd5 22. fxe5 Rae8 23. Qxd5+ Nxd5 24. e6 Rf6 25. Rd1 Nc7 26. Rxd6 h6 27. Ne4 Rfxe6 28. Nf6+,"This is a game between Lasker,Ed (as White) and Reti,R (as Black). Last move played: White plays Knight to f6 with check",Large advantage for White (eval: 415 centipawns),28... Rxf6 29. Rxf6 g5 30. Rxh6 Re1+ 31. Kf2 Rd1 32. Rg6+ Kf7 33. Rxg5 Ke6 34. Rxc5 Nd5 35. Rc8 Nf6 36. Rf8 Ne4+ 37. Kg2 Nd2 38. Re8+ ,28. Nf6+ Rxf6 29. Rxf6 Kg7 30. Rd6 Re1+ 31. Kf2 Re7 32. b3 Nb7 33. Rd1 g5 34. Be3 Kg6 35. b4 Ne6 36. a4 a5 37. bxc5 Nbxc5 
Relatively best; Black must lose the exchange either way.,True," The comment suggests the move is objectively good, but implies a loss for Black, indicating a flaw in strategic assessment.",1. e4 e5 2. Nf3 Nc6 3. Bb5 a6 4. Ba4 Nf6 5. O-O Be7 6. Re1 b5 7. Bb3 d6 8. c3 O-O 9. h3 Na5 10. Bc2 c5 11. d4 Qc7 12. Nbd2 Nd7 13. d5 f5 14. exf5 Nb6 15. Ne4 Bxf5 16. Neg5 Qd7 17. g4 Bxc2 18. Qxc2 g6 19. Qe4 Bxg5 20. Nxg5 Qb7 21. f4 Qxd5 22. fxe5 Rae8 23. Qxd5+ Nxd5 24. e6 Rf6 25. Rd1 Nc7 26. Rxd6 h6 27. Ne4 Rfxe6 28. Nf6+ Rxf6,"This is a game between Lasker,Ed (as White) and Reti,R (as Black). Last move played: Black plays Rook takes on f6",Large advantage for White (eval: 409 centipawns),29. Rxf6 Kg7 30. Rd6 Re1+ 31. Kf2 Re7 32. b3 Nb7 33. Rd1 g5 34. Be3 Kf7 35. b4 c4 36. Rd4 Ne8 37. Rad1 Nf6 38. Kf3 Re6 39. Bf2 Ke7 40. Bg3 h5 41. gxh5 Nxh5 42. Rd7+ Kf6 43. Rxb7 Nxg3 44. Kxg3 Re3+ 45. Kf2 Rxc3 46. Rb6+ Ke5 ,28... Rxf6 29. Rxf6 g5 30. Rxh6 Re1+ 31. Kf2 Rd1 32. Rg6+ Kf7 33. Rxg5 Ke6 34. Rxc5 Nd5 35. Rc8 Nf6 36. Rf8 Ne4+ 37. Kg2 Nd2 38. Re8+ 
"Preparing to win a pawn by Rxa6, uncovering the Bishop's attack on the e7-Rook.",True," The comment describes a move that seems to be a tactical blunder, indicating a potential weakness in the position.",1. e4 e5 2. Nf3 Nc6 3. Bb5 a6 4. Ba4 Nf6 5. O-O Be7 6. Re1 b5 7. Bb3 d6 8. c3 O-O 9. h3 Na5 10. Bc2 c5 11. d4 Qc7 12. Nbd2 Nd7 13. d5 f5 14. exf5 Nb6 15. Ne4 Bxf5 16. Neg5 Qd7 17. g4 Bxc2 18. Qxc2 g6 19. Qe4 Bxg5 20. Nxg5 Qb7 21. f4 Qxd5 22. fxe5 Rae8 23. Qxd5+ Nxd5 24. e6 Rf6 25. Rd1 Nc7 26. Rxd6 h6 27. Ne4 Rfxe6 28. Nf6+ Rxf6 29. Rxf6 Kg7 30. Rd6 Re7 31. b3 c4 32. Ba3,"This is a game between Lasker,Ed (as White) and Reti,R (as Black). Last move played: White plays Bishop to a3",Large advantage for White (eval: 450 centipawns),32... cxb3 33. axb3 Nxb3 34. Rad1 Ne6 35. Re1 Kf6 36. Rxa6 Re8 37. Re2 g5 38. Kf2 Kf7 39. Kf1 b4 40. Ra7+ Kg6 41. Bxb4 Nc1 42. Rd2 Nf4 43. Rd6+ Ne6 44. Rb7 Na2 45. Ba3 Nxc3 46. Bb2 ,32. Ba3 h5 33. gxh5 gxh5 34. Rxa6 Re3 35. Rxa5 Nd5 36. Rxb5 Nf4 37. Bd6 Nd3 38. Rb7+ Kg6 39. Rf1 Re2 40. Kh1 Nf2+ 41. Rxf2 Rxf2 42. bxc4 Rxa2 
"And Reti can't prevent the loss of more material, so he resigns.",True," The comment directly identifies a critical flaw in Reti's strategy, suggesting a resignation due to material loss.",1. e4 e5 2. Nf3 Nc6 3. Bb5 a6 4. Ba4 Nf6 5. O-O Be7 6. Re1 b5 7. Bb3 d6 8. c3 O-O 9. h3 Na5 10. Bc2 c5 11. d4 Qc7 12. Nbd2 Nd7 13. d5 f5 14. exf5 Nb6 15. Ne4 Bxf5 16. Neg5 Qd7 17. g4 Bxc2 18. Qxc2 g6 19. Qe4 Bxg5 20. Nxg5 Qb7 21. f4 Qxd5 22. fxe5 Rae8 23. Qxd5+ Nxd5 24. e6 Rf6 25. Rd1 Nc7 26. Rxd6 h6 27. Ne4 Rfxe6 28. Nf6+ Rxf6 29. Rxf6 Kg7 30. Rd6 Re7 31. b3 c4 32. Ba3 cxb3 33. axb3 Nxb3 34. Rb1 Na5 35. Rxa6 Nxa6 36. Bxe7,"This is a game between Lasker,Ed (as White) and Reti,R (as Black). Last move played: White plays Bishop takes on e7",Large advantage for White (eval: 481 centipawns),36... Nc4 37. Rxb5 h5 38. gxh5 gxh5 39. Bh4 Kf7 40. Kh1 Ne3 41. Bf2 Nc4 42. Be1 h4 43. Rh5 Nb8 44. Kg2 Ne3+ 45. Kf3 ,36. Bxe7 Kf7 37. Bh4 Nc4 38. Rxb5 Ke6 39. Bg3 Kd7 40. Rb7+ Kc6 41. Rg7 g5 42. Rg6+ Kb5 43. Kg2 Nc5 44. Rxh6 Na4 45. Rh8 Kc6 46. Rd8 Nc5 47. Rd4 Kb5 48. Kg1 Ne6 49. Re4 Nf4 50. Bxf4 gxf4 51. Re8 Nd6 52. Re5+ Kc4 
"As we've seen in the notes to a previous game, this is a sham threat (Black can't hold on to the pawn).",True,", The comment suggests a potential tactical error related to knight development and pinning, indicating a flawed strategic decision.",1. e4 e5 2. Nf3 Nc6 3. Bb5 a6 4. Ba4 Nf6,"This is a game between Lasker,Ed (as White) and Reti,R (as Black). Last move played: Black plays Knight to f6",Slight advantage for White (eval: 43 centipawns),5. O-O Nxe4 6. d4 b5 7. Bb3 d5 8. dxe5 Be6 9. c3 Bc5 10. Bc2 Bb6 11. Nbd2 Bf5 12. Nb3 Bg6 13. Nbd4 Nxd4 14. cxd4 c5 15. Be3 cxd4 16. Nxd4 ,4... Nf6 5. O-O Be7 6. Re1 b5 7. Bb3 O-O 8. a4 Bb7 9. d3 d6 10. Nbd2 Na5 11. Ba2 c5 12. Nf1 c4 13. Bg5 h6 14. Bxf6 Bxf6 15. dxc4 bxc4 
Preventing the Bishop from pinning the Knight.,True," The comment suggests a potential strategic error by Reti, implying a misplaced focus on the Queenside.",1. e4 e5 2. Nf3 Nc6 3. Bb5 a6 4. Ba4 Nf6 5. O-O Be7 6. Re1 b5 7. Bb3 d6 8. c3 O-O 9. h3,"This is a game between Lasker,Ed (as White) and Reti,R (as Black). Last move played: White plays Pawn to h3",Slight advantage for White (eval: 48 centipawns),9... Bb7 10. d4 ,9. h3 
Lasker locks the center. The game will now stay in a positional mode until one of the players decides to break it open.,True, The comment directly identifies a specific tactical error – pinning the pawn – which is a clear indication of a mistake.,1. e4 e5 2. Nf3 Nc6 3. Bb5 a6 4. Ba4 Nf6 5. O-O Be7 6. Re1 b5 7. Bb3 d6 8. c3 O-O 9. h3 Na5 10. Bc2 c5 11. d4 Qc7 12. Nbd2 Nd7 13. d5,"This is a game between Lasker,Ed (as White) and Reti,R (as Black). Last move played: White plays Pawn to d5",Advantage for White (eval: 84 centipawns),13... Nb6 14. b3 ,13. Nf1 
"As we've seen in the notes to a previous game, this is a sham threat (Black can't hold on to the pawn).",True," The comment offers a potential explanation for the mistake, suggesting a strategic shift.",1. e4 e5 2. Nf3 Nc6 3. Bb5 a6 4. Ba4 Nf6,"This is a game between Lasker,Ed (as White) and Reti,R (as Black). Last move played: Black plays Knight to f6",Slight advantage for White (eval: 43 centipawns),5. O-O Nxe4 6. d4 b5 7. Bb3 d5 8. dxe5 Be6 9. c3 Bc5 10. Bc2 Bb6 11. Nbd2 Bf5 12. Nb3 Bg6 13. Nbd4 Nxd4 14. cxd4 c5 15. Be3 cxd4 16. Nxd4 ,4... Nf6 5. O-O Be7 6. Re1 b5 7. Bb3 O-O 8. a4 Bb7 9. d3 d6 10. Nbd2 Na5 11. Ba2 c5 12. Nf1 c4 13. Bg5 h6 14. Bxf6 Bxf6 15. dxc4 bxc4 
Opening a pocket for the light-squared Bishop.,True," The comment indicates a potential tactical blunder by Reti, suggesting a risky and poorly planned attack.",1. e4 e5 2. Nf3 Nc6 3. Bb5 a6 4. Ba4 Nf6 5. O-O Be7 6. Re1 b5 7. Bb3 d6 8. c3,"This is a game between Lasker,Ed (as White) and Reti,R (as Black). Last move played: White plays Pawn to c3",Slight advantage for White (eval: 44 centipawns),8... O-O 9. h3 ,8. c3 O-O 
"As we've seen in the notes to a previous game, this is a sham threat (Black can't hold on to the pawn).",True," The comment suggests a potential strategic slow-down, indicating a flawed move.",1. e4 e5 2. Nf3 Nc6 3. Bb5 a6 4. Ba4 Nf6,"This is a game between Lasker,Ed (as White) and Reti,R (as Black). Last move played: Black plays Knight to f6",Slight advantage for White (eval: 43 centipawns),5. O-O Nxe4 6. d4 b5 7. Bb3 d5 8. dxe5 Be6 9. c3 Bc5 10. Bc2 Bb6 11. Nbd2 Bf5 12. Nb3 Bg6 13. Nbd4 Nxd4 14. cxd4 c5 15. Be3 cxd4 16. Nxd4 ,4... Nf6 5. O-O Be7 6. Re1 b5 7. Bb3 O-O 8. a4 Bb7 9. d3 d6 10. Nbd2 Na5 11. Ba2 c5 12. Nf1 c4 13. Bg5 h6 14. Bxf6 Bxf6 15. dxc4 bxc4 
Opening a pocket for the light-squared Bishop.,True," The comment suggests a strategic flaw in the move, indicating a potential weakness in the defensive structure.",1. e4 e5 2. Nf3 Nc6 3. Bb5 a6 4. Ba4 Nf6 5. O-O Be7 6. Re1 b5 7. Bb3 d6 8. c3,"This is a game between Lasker,Ed (as White) and Reti,R (as Black). Last move played: White plays Pawn to c3",Slight advantage for White (eval: 44 centipawns),8... O-O 9. h3 ,8. c3 O-O 
