comment,good,reasoning,moves,context,engine_eval,engine_best_line,engine_best_alternative
"This leads to a temporary pawn sacrifice, for which White will be able to build an ideal pawn center.",True," The comment suggests a potential tactical advantage, potentially justifying the error.",1. d4 d5 2. c4 c6 3. Nc3,This is a game between Tal (as White) and Zeid (as Black). Last move played: White plays Knight to c3,Slight advantage for White (eval: 31 centipawns),3... dxc4 4. e3 ,3. cxd5 cxd5 4. Nc3 Nf6 5. Bf4 Nc6 6. Nf3 a6 7. e3 Bg4 8. Bd3 e6 9. h3 Bxf3 10. Qxf3 Nb4 11. Bb1 Bd6 12. O-O Bxf4 13. Qxf4 
Black counters by putting immediate pressure at d4.,True," The comment suggests a potential tactical error, indicating the move was poorly considered.",1. d4 d5 2. c4 c6 3. Nc3 dxc4 4. e4 e5,This is a game between Tal (as White) and Zeid (as Black). Last move played: Black plays Pawn to e5,Advantage for White (eval: 64 centipawns),5. dxe5 ,4... b5 5. a4 
5.dxe5 Qxd1+ 6.Nxd1 b5 Black has an acceptable position.,True," The comment offers a potential assessment of the Black side's position, suggesting it's acceptable.",1. d4 d5 2. c4 c6 3. Nc3 dxc4 4. e4 e5 5. Nf3,This is a game between Tal (as White) and Zeid (as Black). Last move played: White plays Knight to f3,Slight advantage for White (eval: 49 centipawns),5... exd4 ,5. dxe5 
"There is no rush to recapture at c4, because the pawn cannot be defended.",True," The comment suggests a reason why the recapture is flawed, indicating a strategic miscalculation.",1. d4 d5 2. c4 c6 3. Nc3 dxc4 4. e4 e5 5. Nf3 exd4 6. Qxd4 Qxd4 7. Nxd4 Bc5 8. Be3 Nf6 9. f3,This is a game between Tal (as White) and Zeid (as Black). Last move played: White plays Pawn to f3,Large advantage for White (eval: 100 centipawns),9... Nbd7 10. Bxc4 ,9. f3 Nbd7 
Black now has a concrete weakness.,True,". The comment suggests a positional flaw, implying the move was incorrect due to a vulnerability, which is a valid reason for a mistake.",1. d4 d5 2. c4 c6 3. Nc3 dxc4 4. e4 e5 5. Nf3 exd4 6. Qxd4 Qxd4 7. Nxd4 Bc5 8. Be3 Nf6 9. f3 Nbd7 10. Bxc4 Ne5 11. Be2 Bd7 12. h3 O-O 13. f4 Ng6 14. e5 Nd5 15. Nxd5 cxd5,This is a game between Tal (as White) and Zeid (as Black). Last move played: Black plays Pawn takes on d5,Slight advantage for White (eval: 24 centipawns),16. O-O Rae8 17. b4 Bb6 18. Bg4 Bxg4 19. hxg4 Rc8 20. Nf5 Bxe3+ 21. Nxe3 Rfd8 22. Nf5 d4 23. Rad1 Rc4 24. b5 d3 25. g3 f6 26. exf6 gxf6 27. Rd2 Rc2 28. Rfd1 Rxd2 29. Rxd2 Kf8 30. Kf2 Ne7 31. Ke3 Nxf5+ 32. gxf5 Rd5 33. Rxd3 Rxb5 ,15... cxd5 16. Rf1 Rfe8 17. Nc2 Bxe3 18. Nxe3 d4 19. Nc4 f6 20. Nd6 Re7 21. exf6 Re6 22. f5 Rxd6 23. Bc4+ Kf8 24. fxg6 hxg6 25. fxg7+ Kxg7 26. Kd2 Re8 27. Rf7+ Kh6 28. Re1 Rxe1 29. Kxe1 Kg5 30. Kd2 Kh4 31. Bd3 a5 32. Rg7 Bc6 33. Bxg6 Bxg2 
An attempt to undermine the center. But now White employs a decoy tactic to lure the bishop to an unfortunate position.,True," The comment identifies a potential tactical error and suggests a defensive move, indicating a flawed strategic choice.",1. d4 d5 2. c4 c6 3. Nc3 dxc4 4. e4 e5 5. Nf3 exd4 6. Qxd4 Qxd4 7. Nxd4 Bc5 8. Be3 Nf6 9. f3 Nbd7 10. Bxc4 Ne5 11. Be2 Bd7 12. h3 O-O 13. f4 Ng6 14. e5 Nd5 15. Nxd5 cxd5 16. O-O f6,This is a game between Tal (as White) and Zeid (as Black). Last move played: Black plays Pawn to f6,Large advantage for White (eval: 149 centipawns),17. e6 Bc6 18. f5 Ne7 19. g4 Rfc8 20. Kf2 Be8 21. a4 Kf8 22. Rfc1 Bb6 23. Rxc8 Rxc8 24. b4 Rc3 25. a5 Bc7 26. b5 Bd6 27. Rc1 Ra3 28. a6 bxa6 29. bxa6 Ra2 ,16... Rae8 
This fork wins material.,True,", The comment suggests a significant tactical advantage, indicating a flawed opening choice.",1. d4 d5 2. c4 c6 3. Nc3 dxc4 4. e4 e5 5. Nf3 exd4 6. Qxd4 Qxd4 7. Nxd4 Bc5 8. Be3 Nf6 9. f3 Nbd7 10. Bxc4 Ne5 11. Be2 Bd7 12. h3 O-O 13. f4 Ng6 14. e5 Nd5 15. Nxd5 cxd5 16. O-O f6 17. e6 Bxe6 18. f5,This is a game between Tal (as White) and Zeid (as Black). Last move played: White plays Pawn to f5,Large advantage for White (eval: 149 centipawns),18... Bd7 19. fxg6 ,18. f5 Bd7 19. fxg6 Rae8 20. Kf2 Re4 21. Bd3 Rxd4 22. gxh7+ Kh8 23. Bxd4 Bxd4+ 24. Kf3 f5 25. Rac1 Bb6 26. g4 g6 27. gxf5 Kxh7 28. Rfe1 Bxf5 29. Re7+ Kh6 30. Bxf5 Rxf5+ 31. Kg3 Rg5+ 32. Kh2 d4 33. Rd7 Re5 34. h4 Re3 35. Rf1 d3 36. Rf8 Kh5 37. Rg8 Kxh4 38. Rxg6 
White defends both pieces and Black's two pawns are not sufficient compensation for the bishop.,True," The comment identifies a flaw in Black's pawn structure as insufficient compensation, suggesting a misjudgment of the position.",1. d4 d5 2. c4 c6 3. Nc3 dxc4 4. e4 e5 5. Nf3 exd4 6. Qxd4 Qxd4 7. Nxd4 Bc5 8. Be3 Nf6 9. f3 Nbd7 10. Bxc4 Ne5 11. Be2 Bd7 12. h3 O-O 13. f4 Ng6 14. e5 Nd5 15. Nxd5 cxd5 16. O-O f6 17. e6 Bxe6 18. f5 Bxf5 19. Nxf5 Bxe3+ 20. Nxe3 Rfe8 21. Kf2,This is a game between Tal (as White) and Zeid (as Black). Last move played: White plays King to f2,Large advantage for White (eval: 389 centipawns),21... Nf4 22. Rad1 Rad8 23. Rd4 Nxe2 24. Kxe2 Rd6 25. Kf3 Ra6 26. a3 Rae6 27. Nxd5 Re5 28. Rfd1 Rf5+ 29. Rf4 Rfe5 30. g4 h5 31. Rf5 hxg4+ 32. hxg4 Kf7 ,21. Kf2 d4 22. Nf5 Rad8 23. Rad1 Re4 24. Bd3 Re5 25. Bc4+ Kh8 26. Kg3 Re4 27. Bd3 Re5 28. Bb1 Red5 29. Be4 Re5 30. Bd3 Rdd5 
21...d4 22.Bc4+ Kh8 23.Nf5,True," The comment describes a move that leads to a compromised pawn structure, suggesting a strategic error.",1. d4 d5 2. c4 c6 3. Nc3 dxc4 4. e4 e5 5. Nf3 exd4 6. Qxd4 Qxd4 7. Nxd4 Bc5 8. Be3 Nf6 9. f3 Nbd7 10. Bxc4 Ne5 11. Be2 Bd7 12. h3 O-O 13. f4 Ng6 14. e5 Nd5 15. Nxd5 cxd5 16. O-O f6 17. e6 Bxe6 18. f5 Bxf5 19. Nxf5 Bxe3+ 20. Nxe3 Rfe8 21. Kf2 Nf4,This is a game between Tal (as White) and Zeid (as Black). Last move played: Black plays Knight to f4,Large advantage for White (eval: 357 centipawns),22. Bf3 Nd3+ 23. Ke2 Nf4+ 24. Kd2 Rad8 25. Nc2 Ne6 26. Rad1 Re7 27. h4 Kf7 28. Ne3 d4 29. Nc4 Rc7 30. Rc1 d3 31. Ne3 ,21... Nf4 22. Rad1 Rad8 23. Rd4 Nxe2 24. Kxe2 Rd6 25. Kf3 Ra6 26. a3 Rae6 27. Nxd5 Re5 28. Rfd1 Rf5+ 29. Rf4 Rfe5 30. g4 h5 31. Rf5 hxg4+ 32. hxg4 Kf7 
"The threat is 23...d4, recovering the piece.",True," The comment describes a potential response, suggesting a defensive move, indicating a mistake.",1. d4 d5 2. c4 c6 3. Nc3 dxc4 4. e4 e5 5. Nf3 exd4 6. Qxd4 Qxd4 7. Nxd4 Bc5 8. Be3 Nf6 9. f3 Nbd7 10. Bxc4 Ne5 11. Be2 Bd7 12. h3 O-O 13. f4 Ng6 14. e5 Nd5 15. Nxd5 cxd5 16. O-O f6 17. e6 Bxe6 18. f5 Bxf5 19. Nxf5 Bxe3+ 20. Nxe3 Rfe8 21. Kf2 Nf4 22. Rad1 Nxe2 23. Kxe2 Rad8,This is a game between Tal (as White) and Zeid (as Black). Last move played: Black plays Rook to d8,Large advantage for White (eval: 409 centipawns),24. Rf4 Rd6 25. Kf3 Ra6 26. a3 Rb6 27. b4 Rbe6 28. Nxd5 h5 29. Rd3 Re1 30. Ne3 R8xe3+ 31. Rxe3 Rf1+ 32. Ke4 Rd1 33. Rf2 h4 34. Kf3 g5 35. Re7 ,23... Rad8 24. Rf4 Rd6 25. Kf3 Rde6 26. Rd3 h5 27. Rfd4 h4 28. Rxd5 g5 29. Rd6 Rxd6 30. Rxd6 Kf7 31. Rd1 Kg6 
Breaking the pin and creating an easily winning position.,True," The comment suggests a strategic goal, indicating a flaw in planning or tactical awareness.",1. d4 d5 2. c4 c6 3. Nc3 dxc4 4. e4 e5 5. Nf3 exd4 6. Qxd4 Qxd4 7. Nxd4 Bc5 8. Be3 Nf6 9. f3 Nbd7 10. Bxc4 Ne5 11. Be2 Bd7 12. h3 O-O 13. f4 Ng6 14. e5 Nd5 15. Nxd5 cxd5 16. O-O f6 17. e6 Bxe6 18. f5 Bxf5 19. Nxf5 Bxe3+ 20. Nxe3 Rfe8 21. Kf2 Nf4 22. Rad1 Nxe2 23. Kxe2 Rad8 24. Rd4 Re5 25. Rfd1 Rde8 26. R1d3 f5 27. Kf3,This is a game between Tal (as White) and Zeid (as Black). Last move played: White plays King to f3,Large advantage for White (eval: 430 centipawns),27... g6 28. Rxd5 Kf7 29. Rb3 b6 30. Ra3 R5e7 31. Rd4 Kg7 32. Rb3 Rc8 33. Rbd3 Rc1 34. Rd7 Kf7 35. Rxe7+ Kxe7 36. Ra3 Ke6 37. Rxa7 f4 38. Kxf4 h5 ,27. Kf3 g6 28. Rxd5 R5e7 29. Rd7 Kf8 30. h4 Kf7 31. Rxe7+ Rxe7 32. Nd5 Re5 33. Nf4 Re7 34. Ra3 b6 35. Nd3 Rc7 36. Rc3 Rxc3 37. bxc3 Ke6 38. Nf4+ Kf6 39. Ke3 g5 40. hxg5+ Kxg5 
