comment,good,reasoning,moves,context,reformulated
"This is the King's Indian transposing into the Krause variation of the Grunfeld Reversed. c5 is an aggressive move attacking your center. Dxc5 is playable if you get all your development done in quick fashion, but it's generally not good to surrender the center. Much more aggressive and to the point is c4 transposing into the Tarrasch variation of the Queen's Gambit which is a much more aggressive attacking line for you undermining his center. As occurred later in the game, he possessed powerful center pawns which he could've used to his advantage if he chose.",True,"

The comment provides a clear and detailed explanation of the mistake made by the player, highlighting the strategic errors and suggesting a more aggressive and advantageous alternative.",1. Nf3 d5 2. d4 c5 3. dxc5,This is a game between W47 (as White) and B47 (as Black). Last move played: White plays Pawn takes on c5," The c5 move is aggressive, attacking White's center. But surrendering the center isn't usually wise. A better option might be c4, leading to the Tarrasch variation which is more attacking against Black's center."
"3....e6 by your opponent was a mistake. He could've and should've kept up with development of his king knight to f6 giving his queen pawn strength with a developing move and also taking command of your K4 square. Rather than the text, you should've considered playing 4. Be3 with the idea of fianchettoing your king bishop and retaining the extra pawn. Notice this will prevent black's king bishop from taking control of that powerful diagonal that you tried to get him off later in the game. After Bxc5, you played correctly by e3, but life's not easy for you. You have what is known as a pawnless center, meaning no pawns on the fourth rank. Your opponent's fifth move was a blunder. He should've continued with the more logical Nf6 once again.",True,"

The annotation comment correctly evaluates the mistake made by the player, suggesting alternative moves and explaining the strategic implications of the opponent's actions.",1. Nf3 d5 2. d4 c5 3. dxc5 e6 4. Bf4 Bxc5 5. e3 a6,This is a game between W47 (as White) and B47 (as Black). Last move played: Black plays Pawn to a6," In this game, Black's move 3...e6 was a mistake. Their best option could've been 3...Nf6, which would develop their king knight and reinforce the pawn on e5. By playing 3...e6, Black allowed white's opportunity to fianchetto the king bishop with 4.Be3, taking control of the long diagonal. After Bxc5, White played correctly with 5.e3, but they quickly found themselves in a pawnless center with no pawns on the fourth rank. Black's fifth move was another oversight, as Nf6 would've been the more logical progression."
"Generally, it's not a good idea to move the same piece twice in the opening, when you can bring the king bishop out and castle.",True,"

The comment accurately explains the mistake because moving the same piece twice in the opening can lead to a loss of development and control over the center, which is better achieved by bringing out the king's bishop and castling early.",1. Nf3 d5 2. d4 c5 3. dxc5 e6 4. Bf4 Bxc5 5. e3 a6 6. Nc3 Bd7 7. Ne5,This is a game between W47 (as White) and B47 (as Black). Last move played: White plays Knight to e5," ""White's last move is not advisable. It's better to develop the king bishop and consider castling early in the game."""
Nxd7 is not a beneficial exchange for you because you're trading your knight for Black's bad bishop (bishop of the same color squares as his pawns are occupying). Na4 was an error because you can't chase the bishop off that diagonal and because it's never a sound idea to attack a piece that can move away unless it's for tactical reasons (decoy and deflection).,True,"

The comment accurately explains the mistake made by the player, as it correctly points out the issues with Nxd7 and Na4, highlighting the strategic errors in the player's choice of moves.",1. Nf3 d5 2. d4 c5 3. dxc5 e6 4. Bf4 Bxc5 5. e3 a6 6. Nc3 Bd7 7. Ne5 Nc6 8. Nxd7 Qxd7 9. Na4 Bb4+,This is a game between W47 (as White) and B47 (as Black). Last move played: Black plays Bishop to b4 with check," They should not play Nxd7 because they are sacrificing their knight for Black's bishop, which is located on the same color squares as Black's pawns. Additionally, Na4 is a mistake because it does not prevent the bishop from escaping the threat, and generally, it's not advisable to attack a bishop unless there's a clear tactical motive."
"Black has no merit for giving up a piece with 11....Nxb4; he simply gives you a material advantage. Castling is prime in importance in the opening to get your king to safety. After 13. Ke2, you are feeling the effects of 7. Ne5 (moving the same piece twice instead of preparing to castle via Be2 etc.) which you played earlier. Black should've castled on his 14th move rather than sacrificing another pawn for no apparent reason.",True,"

The comment accurately highlights the mistake of the player by pointing out the lack of merit in giving up a pawn for no apparent reason and emphasizing the importance of castling during the opening phase of the game.",1. Nf3 d5 2. d4 c5 3. dxc5 e6 4. Bf4 Bxc5 5. e3 a6 6. Nc3 Bd7 7. Ne5 Nc6 8. Nxd7 Qxd7 9. Na4 Bb4+ 10. c3 Ba5 11. b4 Nxb4 12. cxb4 Bxb4+ 13. Ke2 Nf6 14. f3 e5,This is a game between W47 (as White) and B47 (as Black). Last move played: Black plays Pawn to e5," Black made a mistake by offering a pawn with 11...Nxb4. They should have prioritized king safety through castling on their 14th move instead of sacrificing material without clear benefit. There was also a strategic error earlier, as 7. Ne5 was a move that repeated a piece's action instead of preparing to castle, which would have been a better priority to ensure the king's safety."
Now you possess a half-open b-file with a rook controlling it and a powerful knight that cannot be chased away by pawns. Notice you put pressure on a pawn that can't move at the moment (his a6 pawn). That simply limits his rook's abilities to a passive defender.,True,"

The comment accurately explains the mistake by pointing out the created weaknesses and unnecessary pressure.",1. Nf3 d5 2. d4 c5 3. dxc5 e6 4. Bf4 Bxc5 5. e3 a6 6. Nc3 Bd7 7. Ne5 Nc6 8. Nxd7 Qxd7 9. Na4 Bb4+ 10. c3 Ba5 11. b4 Nxb4 12. cxb4 Bxb4+ 13. Ke2 Nf6 14. f3 e5 15. Bxe5 Qe6 16. Bd4 O-O 17. Rb1 Ba5 18. Kf2 b5 19. Nc5,This is a game between W47 (as White) and B47 (as Black). Last move played: White plays Knight to c5," In this position, White's recent move of their knight to c5 has forced Black's pawn on a6 into a position where it can no longer move. This limits Black's rook's activity, confining it to a defensive role rather than an active participant in the game."
"20......Rac8 was an unwise move because it hung his a6 pawn, better for him was Rfc8. You could've taken advantage of his mistake by 21. Nxa6, where black responds 21.....Bc3 22 Rxb5 Bxd4 23 exd4 Qa7 24 Qa4, which wins two pawns and you have a much better position.",True,"

The comment accurately explains the mistake made by the player, as it suggests a better alternative and outlines a sequence of moves that would exploit the weakness created by the player's move.",1. Nf3 d5 2. d4 c5 3. dxc5 e6 4. Bf4 Bxc5 5. e3 a6 6. Nc3 Bd7 7. Ne5 Nc6 8. Nxd7 Qxd7 9. Na4 Bb4+ 10. c3 Ba5 11. b4 Nxb4 12. cxb4 Bxb4+ 13. Ke2 Nf6 14. f3 e5 15. Bxe5 Qe6 16. Bd4 O-O 17. Rb1 Ba5 18. Kf2 b5 19. Nc5 Qe7 20. Bd3 Rac8 21. Nb3,This is a game between W47 (as White) and B47 (as Black). Last move played: White plays Knight to b3," The move Rac8 was a poor choice because it put White's a6 pawn in danger, which could have been avoided with Rfc8. You could have seized this opportunity by playing Nxa6, prompting Black's response with 21...Bc3 22 Rxb5 Bxd4 23 exd4 Qa7 24 Qa4, resulting in winning two pawns and securing a superior position."
"22. a3 simply offered a pawn to Black which he could've taken on two occasions to create two passed pawns. 23....Nh5 was poor by black because he could've and should've responded with 23....Bxa3, again creating the passed pawns. 24.....f5 was Black's second missed chance. 25.....Rce8 moved the same rook again when he should've simply responded with 25.....Rxc1.",True,"

The comment accurately identifies key mistakes made by both White and Black, explaining the missed opportunities and why the moves were suboptimal.",1. Nf3 d5 2. d4 c5 3. dxc5 e6 4. Bf4 Bxc5 5. e3 a6 6. Nc3 Bd7 7. Ne5 Nc6 8. Nxd7 Qxd7 9. Na4 Bb4+ 10. c3 Ba5 11. b4 Nxb4 12. cxb4 Bxb4+ 13. Ke2 Nf6 14. f3 e5 15. Bxe5 Qe6 16. Bd4 O-O 17. Rb1 Ba5 18. Kf2 b5 19. Nc5 Qe7 20. Bd3 Rac8 21. Nb3 Bb4 22. a3 Bd6 23. g3 Nh5 24. Re1 f5 25. Rc1 Rce8,This is a game between W47 (as White) and B47 (as Black). Last move played: Black plays Rook to e8," This game showcased White's better play against Black. Black's 22. a3 offered a pawn exchange, which White could have accepted on two occasions to establish passed pawns. However, Black's 23...Nh5 was suboptimal as they should have played 23...Bxa3, also aiming for passed pawns. Black's move 24...f5 missed the chance to create them again. Finally, 25...Rce8 was a move that repeated the rook's position, which was unnecessary, as Black should have opted for 25...Rxc1 to continue the pawn structure."
"Black should've played 28....Nxf4 instead. Then, 29.....Qxf4 would have been a much better continuation for black compared to 29....Qh4+. 32. Bf2?? just loses a piece to 32....Qxf2! in which he wins a piece back and has an attack going.",True,"

The comment provides a detailed analysis of the mistake, explaining the consequences of the move and suggesting a better alternative.",1. Nf3 d5 2. d4 c5 3. dxc5 e6 4. Bf4 Bxc5 5. e3 a6 6. Nc3 Bd7 7. Ne5 Nc6 8. Nxd7 Qxd7 9. Na4 Bb4+ 10. c3 Ba5 11. b4 Nxb4 12. cxb4 Bxb4+ 13. Ke2 Nf6 14. f3 e5 15. Bxe5 Qe6 16. Bd4 O-O 17. Rb1 Ba5 18. Kf2 b5 19. Nc5 Qe7 20. Bd3 Rac8 21. Nb3 Bb4 22. a3 Bd6 23. g3 Nh5 24. Re1 f5 25. Rc1 Rce8 26. Nc5 Qg5 27. Rg1 f4 28. exf4 Bxf4 29. gxf4 Qh4+ 30. Kg2 Nxf4+ 31. Kh1 g5 32. Bf2,This is a game between W47 (as White) and B47 (as Black). Last move played: White plays Bishop to f2," The move 28...Nxf4 could have been stronger for Black. Instead, they chose 29...Qxf4, which was less advantageous than 29...Qh4+. The subsequent 32. Bf2?? leads to a loss for White, as Black can play 32...Qxf2, capturing a piece and mounting an attack."
"32....Qh5?? was a simple blunder. He should've taken your bishop without a blink of an eye. Then, instead of 33. Bg3?, you should've played 33 Nxa6 Nh3 34 Rf1 Nxf2+ 35 Rxf2 Qf7 36 Rg2 h6 37 Bxb5, which wins two pawns. Black should've responded on his 33rd move with 33....Nxd3 34. Qxd3 Qxf3+ 35. Qxf3 Rxf3, keeping the game equal and trading down to an endgame where his passed pawns would've ruled the day (two pawn majorities and a passed pawn in the center). Then instead of 35. Be2?, you could've won another pawn via 35. Qb3 Kg7 36. Qxd5 Rfxf3 37. Be5+ Kh6 38. Rxf3 Rxf3 39. Nxa6. Another possible continuation that would win you a pawn might be 35. Qb3 Rexf3 36. Qxd5+ Qf7 37. Be4 Rxf1 38. Rxf1 Nf4 39. Qxf7+ Rxf7 40. Nxa6 with a good position to win the b-pawn as well.",True,"

The comment accurately explains why taking the bishop with 33...Qxe4+ was a mistake and suggests better follow-up moves for black that could have led to a more favorable position or material gain.",1. Nf3 d5 2. d4 c5 3. dxc5 e6 4. Bf4 Bxc5 5. e3 a6 6. Nc3 Bd7 7. Ne5 Nc6 8. Nxd7 Qxd7 9. Na4 Bb4+ 10. c3 Ba5 11. b4 Nxb4 12. cxb4 Bxb4+ 13. Ke2 Nf6 14. f3 e5 15. Bxe5 Qe6 16. Bd4 O-O 17. Rb1 Ba5 18. Kf2 b5 19. Nc5 Qe7 20. Bd3 Rac8 21. Nb3 Bb4 22. a3 Bd6 23. g3 Nh5 24. Re1 f5 25. Rc1 Rce8 26. Nc5 Qg5 27. Rg1 f4 28. exf4 Bxf4 29. gxf4 Qh4+ 30. Kg2 Nxf4+ 31. Kh1 g5 32. Bf2 Qh5 33. Bg3 Nh3 34. Rf1 Re3 35. Be2 Nf4,This is a game between W47 (as White) and B47 (as Black). Last move played: Black plays Knight to f4," '32...Qh5!! was a blunder. They should've taken your bishop immediately. Instead, they could've played 33...Nxd3 34. Qxd3 Qxf3+ 35. Qxf3 Rxf3, making the game equal and entering an endgame with a two-pawn advantage. Alternatively, they might have played 35. Qb3 Rexf3 36. Qxd5+ Qf7 37. Be4 Rxf1 38. Rxf1 Nf4 39. Qxf7+ Rxf7 40. Nxa6, aiming to win the b-pawn as well.'"
"38.....Qe5 was bad defense of the pawn for the reason you exploited in move 39. He should've played 38.....Ke7. 39....Qb2??? was a grave mistake in which you could've won the game by forcing checkmate in 8 moves via 40. Qxd5+ Ke7 41. Qc5+ Kd8 (If Kxd7 it's mate in 6) 42. Qc8+ Ke7 (forced) 43. Qxf8+ Kxd7 44. Qf7+ Kd6 45. Qc7+ Ke6 46. Rc6+ Kf5 47. Qxf4++ With perfect play by Black, you could've had a forced win in 8 moves.",True,"

The annotation correctly identifies the mistake and explains why it was a bad move, also mentioning a potential winning sequence for the opponent.",1. Nf3 d5 2. d4 c5 3. dxc5 e6 4. Bf4 Bxc5 5. e3 a6 6. Nc3 Bd7 7. Ne5 Nc6 8. Nxd7 Qxd7 9. Na4 Bb4+ 10. c3 Ba5 11. b4 Nxb4 12. cxb4 Bxb4+ 13. Ke2 Nf6 14. f3 e5 15. Bxe5 Qe6 16. Bd4 O-O 17. Rb1 Ba5 18. Kf2 b5 19. Nc5 Qe7 20. Bd3 Rac8 21. Nb3 Bb4 22. a3 Bd6 23. g3 Nh5 24. Re1 f5 25. Rc1 Rce8 26. Nc5 Qg5 27. Rg1 f4 28. exf4 Bxf4 29. gxf4 Qh4+ 30. Kg2 Nxf4+ 31. Kh1 g5 32. Bf2 Qh5 33. Bg3 Nh3 34. Rf1 Re3 35. Be2 Nf4 36. Bxf4 gxf4 37. Rg1+ Kf7 38. Rg4 Qe5 39. Nd7 Qb2,This is a game between W47 (as White) and B47 (as Black). Last move played: Black plays Queen to b2," White's 38. Qe5 was a bad move because Black had better defense options. Instead of moving the queen, Black should have played 38. Ke7, which would have preserved the integrity of their position. Black's subsequent move, 39... Qb2, opened the door for a checkmating sequence that White could have executed in 8 moves with optimal play. The position after 39. Qb2 gave White a clear path to deliver checkmate, starting with 40. Qxd5+, followed by a forced sequence that could result in checkmate within 8 moves if White continued with precision."
forced,False,"

The comment ""forced"" does not explain the mistake made by the player, as it simply states that the move had to be played under the circumstances but does not address why it was a mistake.",1. Nf3 d5 2. d4 c5 3. dxc5 e6 4. Bf4 Bxc5 5. e3 a6 6. Nc3 Bd7 7. Ne5 Nc6 8. Nxd7 Qxd7 9. Na4 Bb4+ 10. c3 Ba5 11. b4 Nxb4 12. cxb4 Bxb4+ 13. Ke2 Nf6 14. f3 e5 15. Bxe5 Qe6 16. Bd4 O-O 17. Rb1 Ba5 18. Kf2 b5 19. Nc5 Qe7 20. Bd3 Rac8 21. Nb3 Bb4 22. a3 Bd6 23. g3 Nh5 24. Re1 f5 25. Rc1 Rce8 26. Nc5 Qg5 27. Rg1 f4 28. exf4 Bxf4 29. gxf4 Qh4+ 30. Kg2 Nxf4+ 31. Kh1 g5 32. Bf2 Qh5 33. Bg3 Nh3 34. Rf1 Re3 35. Be2 Nf4 36. Bxf4 gxf4 37. Rg1+ Kf7 38. Rg4 Qe5 39. Nd7 Qb2 40. Rxf4+ Ke7 41. Rxf8 Rxe2 42. Qg1 Rxh2+ 43. Qxh2,This is a game between W47 (as White) and B47 (as Black). Last move played: White plays Queen takes on h2,-
40. Rxf4? was a mistake because you could've had a forced mate. 41. Rxf8?? was an error because you could've simply won the rook with 41. Nxf8. 46.....Qg5+? was an error by your opponent because 47. Qg3 Qd2+ 48. Kh3 Qh6+ 49. Qh4+ Qxh4+ 50. Kxh4 Kxd7 51. Rf6 a5 52. Rf7+ Ke6 53. Rxh7 which results in captures to bring you to an endgame with you more than a piece up in material. Heshould've played 46.....Qd2+ keeping the captures to a minimum. The reason is because it's generally not good to trade down when you're behind in material because it will lead to a lost endgame.,False,"

The comment does not accurately explain the mistake made by the player, as it misrepresents the sequence of moves and their consequences, and contains inaccurate information about the game's outcome.",1. Nf3 d5 2. d4 c5 3. dxc5 e6 4. Bf4 Bxc5 5. e3 a6 6. Nc3 Bd7 7. Ne5 Nc6 8. Nxd7 Qxd7 9. Na4 Bb4+ 10. c3 Ba5 11. b4 Nxb4 12. cxb4 Bxb4+ 13. Ke2 Nf6 14. f3 e5 15. Bxe5 Qe6 16. Bd4 O-O 17. Rb1 Ba5 18. Kf2 b5 19. Nc5 Qe7 20. Bd3 Rac8 21. Nb3 Bb4 22. a3 Bd6 23. g3 Nh5 24. Re1 f5 25. Rc1 Rce8 26. Nc5 Qg5 27. Rg1 f4 28. exf4 Bxf4 29. gxf4 Qh4+ 30. Kg2 Nxf4+ 31. Kh1 g5 32. Bf2 Qh5 33. Bg3 Nh3 34. Rf1 Re3 35. Be2 Nf4 36. Bxf4 gxf4 37. Rg1+ Kf7 38. Rg4 Qe5 39. Nd7 Qb2 40. Rxf4+ Ke7 41. Rxf8 Rxe2 42. Qg1 Rxh2+ 43. Qxh2 Qxc1+ 44. Qg1 Qh6+ 45. Qh2 Qc1+ 46. Kg2 Qg5+,This is a game between W47 (as White) and B47 (as Black). Last move played: Black plays Queen to g5 with check,-
"Draw by 3-fold repetition. You absolutely do not want to draw when you're ahead in material, though I can understand that it's hard to remember all the positions you've played twice after so many moves. You had a superior position in many instances in this game, but you should try to learn to exploit your opponent's weaknesses and open up your mind to tactical possibilities. Good overall game.",True,"

The comment addresses the player's mistake by highlighting the importance of not settling for a draw when ahead in material and the need to consider tactics and exploit the opponent's weaknesses.",1. Nf3 d5 2. d4 c5 3. dxc5 e6 4. Bf4 Bxc5 5. e3 a6 6. Nc3 Bd7 7. Ne5 Nc6 8. Nxd7 Qxd7 9. Na4 Bb4+ 10. c3 Ba5 11. b4 Nxb4 12. cxb4 Bxb4+ 13. Ke2 Nf6 14. f3 e5 15. Bxe5 Qe6 16. Bd4 O-O 17. Rb1 Ba5 18. Kf2 b5 19. Nc5 Qe7 20. Bd3 Rac8 21. Nb3 Bb4 22. a3 Bd6 23. g3 Nh5 24. Re1 f5 25. Rc1 Rce8 26. Nc5 Qg5 27. Rg1 f4 28. exf4 Bxf4 29. gxf4 Qh4+ 30. Kg2 Nxf4+ 31. Kh1 g5 32. Bf2 Qh5 33. Bg3 Nh3 34. Rf1 Re3 35. Be2 Nf4 36. Bxf4 gxf4 37. Rg1+ Kf7 38. Rg4 Qe5 39. Nd7 Qb2 40. Rxf4+ Ke7 41. Rxf8 Rxe2 42. Qg1 Rxh2+ 43. Qxh2 Qxc1+ 44. Qg1 Qh6+ 45. Qh2 Qc1+ 46. Kg2 Qg5+ 47. Kf2 Qd2+ 48. Kg3 Qg5+ 49. Kf2 Qd2+ 50. Kg3 Qg5+ 51. Kh3 Qh6+ 52. Kg2 Qd2+ 53. Kh1 Qe1+ 54. Qg1 Qh4+ 55. Qh2 Qe1+ 56. Kg2 Qd2+ 57. Kg3,This is a game between W47 (as White) and B47 (as Black). Last move played: White plays King to g3," 'Black's attempt to draw resulted in a disadvantageous position. Despite having a better setup multiple times, 'Black' missed opportunities to capitalize on 'White's' vulnerabilities and didn't fully embrace tactical play. It's crucial to adapt and seek out chances to gain an edge over the opponent. Overall, 'Black's' performance was solid, but there's room for improvement.'"
