comment,good,reasoning,moves,context,engine_eval,engine_best_line,engine_best_alternative
White has achieved an ideal pawn center. The difference between this position and the main lines of the Closed variation of the Spanish Game is that White has a queen on e2 rather than a rook on e1.,True," The comment suggests a strategic flaw in White's pawn structure, indicating a misjudgment of the resulting position.",1. e4 e5 2. Nf3 Nc6 3. Bb5 a6 4. Ba4 Nf6 5. O-O Be7 6. Qe2 b5 7. Bb3 d6 8. c3 O-O 9. d4,This is a game between Lasker (as White) and Teichmann (as Black). Last move played: White plays Pawn to d4,Slight advantage for White (eval: 20 centipawns),9... Bg4 10. Rd1 ,9. Rd1 Re8 10. d4 Bd7 11. dxe5 Nxe5 12. Nxe5 dxe5 13. Bg5 Qc8 14. Bxf6 Bxf6 15. Nd2 Qb7 16. Nf1 Rad8 17. a4 bxa4 18. Bxa4 Bxa4 19. Rxd8 Rxd8 20. Rxa4 Qb5 21. Qxb5 axb5 22. Ra7 
Black lacks counterplay against White's impressive pawn chain.,True," The comment suggests a lack of options for White, indicating a potential weakness in the position.",1. e4 e5 2. Nf3 Nc6 3. Bb5 a6 4. Ba4 Nf6 5. O-O Be7 6. Qe2 b5 7. Bb3 d6 8. c3 O-O 9. d4 exd4 10. cxd4 Bg4 11. Rd1 d5 12. e5 Ne4 13. Nc3 Nxc3 14. bxc3,This is a game between Lasker (as White) and Teichmann (as Black). Last move played: White plays Pawn takes on c3,The position is equal,14... Bh5 15. Bc2 ,14. bxc3 
The pawn at e6 remains a thorn in Black's position.,True," The comment suggests a positional weakness, indicating a potential flaw in the opponent’s structure.",1. e4 e5 2. Nf3 Nc6 3. Bb5 a6 4. Ba4 Nf6 5. O-O Be7 6. Qe2 b5 7. Bb3 d6 8. c3 O-O 9. d4 exd4 10. cxd4 Bg4 11. Rd1 d5 12. e5 Ne4 13. Nc3 Nxc3 14. bxc3 f6 15. h3 Bh5 16. g4 Bf7 17. e6 Bg6,This is a game between Lasker (as White) and Teichmann (as Black). Last move played: Black plays Bishop to g6,Large advantage for White (eval: 183 centipawns),18. Nh4 Bd6 19. Bxd5 Bh2+ 20. Kxh2 Qxd5 21. f4 Qd6 22. Kg1 Ne7 23. f5 Be8 24. Qh2 Bc6 25. Qxd6 cxd6 26. Ba3 Rfd8 27. Ng2 a5 28. Nf4 Nd5 29. Nxd5 Bxd5 ,17... Bg6 18. Nh4 
"White has a clear advantage in control of space, a very important element in chess. The player with more space can maneuver more easily and transfer pieces from one flank to another quickly.",True," The comment offers a subjective assessment of the advantage, suggesting a strategic observation rather than a direct evaluation of the move's quality.",1. e4 e5 2. Nf3 Nc6 3. Bb5 a6 4. Ba4 Nf6 5. O-O Be7 6. Qe2 b5 7. Bb3 d6 8. c3 O-O 9. d4 exd4 10. cxd4 Bg4 11. Rd1 d5 12. e5 Ne4 13. Nc3 Nxc3 14. bxc3 f6 15. h3 Bh5 16. g4 Bf7 17. e6 Bg6 18. Nh4,This is a game between Lasker (as White) and Teichmann (as Black). Last move played: White plays Knight to h4,Large advantage for White (eval: 200 centipawns),18... f5 19. Nxf5 Bxf5 20. gxf5 Rxf5 21. Bc2 Qf8 22. Bxf5 Qxf5 23. Qg4 Qf6 24. Be3 Rf8 25. a4 b4 26. cxb4 Nxb4 27. Rf1 Bd6 28. Rae1 Nc2 29. Re2 Nxe3 30. Rxe3 g6 31. Re2 h5 32. Qg2 Qf5 33. Re3 ,18. Nh4 Bd6 19. Bxd5 Bh2+ 20. Kxh2 Qxd5 21. f4 Qd6 22. Kg1 Ne7 23. f5 Be8 24. Qh2 Bc6 25. Qxd6 cxd6 26. Ba3 Rfd8 27. Ng2 a5 28. Nf4 Nd5 29. Nxd5 Bxd5 
18...Be8 19.Qf3 Wins the d-pawn.,True,"

The comment suggests a logical error in the move, indicating a potential loss due to pawn weakness.",1. e4 e5 2. Nf3 Nc6 3. Bb5 a6 4. Ba4 Nf6 5. O-O Be7 6. Qe2 b5 7. Bb3 d6 8. c3 O-O 9. d4 exd4 10. cxd4 Bg4 11. Rd1 d5 12. e5 Ne4 13. Nc3 Nxc3 14. bxc3 f6 15. h3 Bh5 16. g4 Bf7 17. e6 Bg6 18. Nh4 Na5,This is a game between Lasker (as White) and Teichmann (as Black). Last move played: Black plays Knight to a5,Large advantage for White (eval: 222 centipawns),19. Nxg6 hxg6 20. Bc2 Qe8 21. h4 Nc4 22. h5 gxh5 23. Kg2 h4 24. Qf3 Nd6 25. Rh1 g5 26. Qxd5 Rd8 27. Qf3 Kg7 28. a4 Rh8 29. Ba3 Nc4 30. Bxe7 Qxe7 31. axb5 ,18... f5 19. Nxf5 Bxf5 20. gxf5 Rxf5 21. Bc2 Qf8 22. Bxf5 Qxf5 23. Qg4 Qf6 24. Be3 Rf8 25. a4 b4 26. cxb4 Nxb4 27. Rf1 Bd6 28. Rae1 Nc2 29. Re2 Nxe3 30. Rxe3 g6 31. Re2 h5 32. Qg2 Qf5 33. Re3 
White clears the g-file for his rook.,True,". The comment suggests a potential tactical blunder by White, indicating a misjudgment of the position.",1. e4 e5 2. Nf3 Nc6 3. Bb5 a6 4. Ba4 Nf6 5. O-O Be7 6. Qe2 b5 7. Bb3 d6 8. c3 O-O 9. d4 exd4 10. cxd4 Bg4 11. Rd1 d5 12. e5 Ne4 13. Nc3 Nxc3 14. bxc3 f6 15. h3 Bh5 16. g4 Bf7 17. e6 Bg6 18. Nh4 Na5 19. Nxg6 hxg6 20. Bc2 f5 21. Kh1,This is a game between Lasker (as White) and Teichmann (as Black). Last move played: White plays King to h1,Large advantage for White (eval: 194 centipawns),21... Bd6 22. gxf5 ,21. gxf5 
Opening the d5 diagonal to the Black king.,True,", The comment suggests an illegal and unproductive move, indicating a flawed strategic decision.",1. e4 e5 2. Nf3 Nc6 3. Bb5 a6 4. Ba4 Nf6 5. O-O Be7 6. Qe2 b5 7. Bb3 d6 8. c3 O-O 9. d4 exd4 10. cxd4 Bg4 11. Rd1 d5 12. e5 Ne4 13. Nc3 Nxc3 14. bxc3 f6 15. h3 Bh5 16. g4 Bf7 17. e6 Bg6 18. Nh4 Na5 19. Nxg6 hxg6 20. Bc2 f5 21. Kh1 Bd6 22. gxf5 Qh4 23. Qf3 gxf5 24. Rg1 f4 25. Rg4 Qh6 26. e7,This is a game between Lasker (as White) and Teichmann (as Black). Last move played: White plays Pawn to e7,Large advantage for White (eval: 527 centipawns),26... Bxe7 27. Bxf4 Rxf4 28. Rxf4 Rd8 29. Rg1 g5 30. Rf5 Nc4 31. Re1 Rd7 32. Kg2 Na3 33. Bd3 Nc4 34. Qg4 Nb2 35. Bc2 ,26. e7 Bxe7 27. Bxf4 Rxf4 28. Rxf4 c6 29. Rg1 g5 30. Rf5 Rf8 31. Re1 Rxf5 32. Qxf5 Qf6 33. Qh7+ Kf8 34. Kg2 Nc4 35. Bg6 Qg7 36. Qxg7+ Kxg7 37. Rxe7+ Kxg6 38. Re6+ Kf7 39. Rxc6 
26...Rf7 27.Bg6 Rxe7 28.Qxd5+ Kh8 29.Qxa8+ Re8 30.Qxe8+ Bf8 31.Qxf8+ Mates.,True," The comment describes a series of complex moves that lead to a compromised position, indicating a significant tactical blunder.",1. e4 e5 2. Nf3 Nc6 3. Bb5 a6 4. Ba4 Nf6 5. O-O Be7 6. Qe2 b5 7. Bb3 d6 8. c3 O-O 9. d4 exd4 10. cxd4 Bg4 11. Rd1 d5 12. e5 Ne4 13. Nc3 Nxc3 14. bxc3 f6 15. h3 Bh5 16. g4 Bf7 17. e6 Bg6 18. Nh4 Na5 19. Nxg6 hxg6 20. Bc2 f5 21. Kh1 Bd6 22. gxf5 Qh4 23. Qf3 gxf5 24. Rg1 f4 25. Rg4 Qh6 26. e7 Bxe7,This is a game between Lasker (as White) and Teichmann (as Black). Last move played: Black plays Bishop takes on e7,Large advantage for White (eval: 537 centipawns),27. Bxf4 Rxf4 28. Rxf4 c6 29. Re1 Bf6 30. Qg4 Rf8 31. Bg6 Nc4 32. Re6 c5 33. dxc5 a5 34. Kg2 Nd2 35. Rc6 Ne4 36. h4 b4 37. Rc8 bxc3 38. Rxf8+ Kxf8 39. c6 ,26... Bxe7 27. Bxf4 Rxf4 28. Rxf4 Rd8 29. Rg1 g5 30. Rf5 Nc4 31. Re1 Rd7 32. Kg2 Na3 33. Bd3 Nc4 34. Qg4 Nb2 35. Bc2 
27...Qf6 28.Qxd5+,True," The comment indicates a potential weakening of the kingside, suggesting a flawed strategic move.",1. e4 e5 2. Nf3 Nc6 3. Bb5 a6 4. Ba4 Nf6 5. O-O Be7 6. Qe2 b5 7. Bb3 d6 8. c3 O-O 9. d4 exd4 10. cxd4 Bg4 11. Rd1 d5 12. e5 Ne4 13. Nc3 Nxc3 14. bxc3 f6 15. h3 Bh5 16. g4 Bf7 17. e6 Bg6 18. Nh4 Na5 19. Nxg6 hxg6 20. Bc2 f5 21. Kh1 Bd6 22. gxf5 Qh4 23. Qf3 gxf5 24. Rg1 f4 25. Rg4 Qh6 26. e7 Bxe7 27. Bxf4 Qe6,This is a game between Lasker (as White) and Teichmann (as Black). Last move played: Black plays Queen to e6,Mate in 20 for White,28. Rxg7+ Kxg7 29. Rg1+ Bg5 30. Rxg5+ Kf6 31. Rg6+ Ke7 32. Rxe6+ Kxe6 33. Qg4+ Ke7 34. Qg7+ Rf7 35. Bg5+ Ke6 36. Qg6+ Kd7 37. Qxf7+ Kc6 38. Bf4 Rc8 39. Bf5 b4 40. Bxc8 Kb5 41. Qe7 Nc6 42. Qc5+ Ka4 43. Bc1 bxc3 44. Qxc6+ Ka5 45. Qc5+ Ka4 46. Bd7+ c6 47. Bxc6# ,27... Rxf4 28. Rxf4 Rd8 29. Rf5 Qd2 30. Qh5 Rf8 31. Rxf8+ Kxf8 32. Bg6 Bg5 33. Qh8+ Ke7 34. Qxg7+ Kd6 35. Rg1 Qf4 36. Qe5+ Kc6 37. Qe6+ Kb7 38. Qxd5+ c6 
"Black resigned. If you don't see the forced win, play this game against Gambit.",True," The comment suggests a flawed assessment of the position, indicating a mistake.",1. e4 e5 2. Nf3 Nc6 3. Bb5 a6 4. Ba4 Nf6 5. O-O Be7 6. Qe2 b5 7. Bb3 d6 8. c3 O-O 9. d4 exd4 10. cxd4 Bg4 11. Rd1 d5 12. e5 Ne4 13. Nc3 Nxc3 14. bxc3 f6 15. h3 Bh5 16. g4 Bf7 17. e6 Bg6 18. Nh4 Na5 19. Nxg6 hxg6 20. Bc2 f5 21. Kh1 Bd6 22. gxf5 Qh4 23. Qf3 gxf5 24. Rg1 f4 25. Rg4 Qh6 26. e7 Bxe7 27. Bxf4 Qe6 28. Rxg7+,This is a game between Lasker (as White) and Teichmann (as Black). Last move played: White plays Rook takes on g7 with check,Mate in 23 for White,28... Kxg7 29. Rg1+ Bg5 30. Rxg5+ Kf6 31. Rg6+ Ke7 32. Rxe6+ Kxe6 33. Qg4+ Ke7 34. Qg7+ Rf7 35. Bg5+ Kd6 36. Qg6+ Kd7 37. Qxf7+ Kc6 38. Bf4 Ra7 39. Qe6+ Kb7 40. Kg2 Nc6 41. Qxd5 Kc8 42. Qxc6 Kd8 43. Bg5+ Kc8 44. Qe6+ Kb8 45. Qe8+ Kb7 46. Be4+ Kb6 47. Qb8+ Rb7 48. Qxb7+ Ka5 49. Qc6 b4 50. Qc5+ Ka4 51. Qxb4# ,28. Rxg7+ Kxg7 29. Rg1+ Bg5 30. Rxg5+ Kf6 31. Rg6+ Ke7 32. Rxe6+ Kxe6 33. Qg4+ Ke7 34. Qg7+ Rf7 35. Bg5+ Ke6 36. Qg6+ Kd7 37. Qxf7+ Kc6 38. Bf4 Rc8 39. Bf5 b4 40. Bxc8 Kb5 41. Qe7 Nc6 42. Qc5+ Ka4 43. Bc1 bxc3 44. Qxc6+ Ka5 45. Qc5+ Ka4 46. Bd7+ c6 47. Bxc6# 
