comment,good,reasoning,moves,context,engine_eval,engine_best_line,engine_best_alternative
"This is a v ariation of the Sicilian Defense where Black allows a weakness at d5, for which there will be some compensation later.",True," The comment identifies a potential tactical flaw, suggesting a strategic disadvantage that could be exploited later.",1. e4 c5 2. Nf3 d6 3. d4 cxd4 4. Nxd4 Nf6 5. Nc3 a6 6. Be2 e5,This is a game between Averbakh (as White) and Petrosian (as Black). Last move played: Black plays Pawn to e5,Slight advantage for White (eval: 27 centipawns),7. Nb3 ,6... e5 7. Nb3 
"Black has a backward d-pawn, but it is well protected by the rook. Black stands better with his more active pieces and pending minority attack on the queenside.",True," The comment offers a potential explanation for the mistake, suggesting a weakness in the pawn structure and an opportunity for an attack.",1. e4 c5 2. Nf3 d6 3. d4 cxd4 4. Nxd4 Nf6 5. Nc3 a6 6. Be2 e5 7. Nb3 Be7 8. O-O O-O 9. Bg5 Be6 10. Bxf6 Bxf6 11. Nd5 Nd7 12. Qd3 Rc8 13. c3 Bg5 14. Rad1 Kh8 15. Bf3 g6 16. Ne3 Rc6 17. Rfe1 Nf6,This is a game between Averbakh (as White) and Petrosian (as Black). Last move played: Black plays Knight to f6,Large advantage for Black (eval: -105 centipawns),18. Nd2 Qb6 ,17... Nf6 18. Nd2 Qb6 19. b3 Qa5 20. Ndc4 Qc7 21. Nb2 b5 22. c4 Rb8 23. Nd5 Bxd5 24. exd5 Rc5 25. b4 bxc4 26. Qc3 Rcb5 27. Qxc4 Qd7 28. a3 a5 29. h4 Bh6 30. Qc6 axb4 31. Nc4 bxa3 32. Nxd6 Rb2 33. Nc4 
19.Nd5 Bxd5 20.exd5 Rc4 when Black stands better on both wings.,True," The comment suggests a positional error due to Black's improved position on the wings, indicating a potential misassessment of the resulting pawn structure.",1. e4 c5 2. Nf3 d6 3. d4 cxd4 4. Nxd4 Nf6 5. Nc3 a6 6. Be2 e5 7. Nb3 Be7 8. O-O O-O 9. Bg5 Be6 10. Bxf6 Bxf6 11. Nd5 Nd7 12. Qd3 Rc8 13. c3 Bg5 14. Rad1 Kh8 15. Bf3 g6 16. Ne3 Rc6 17. Rfe1 Nf6 18. Qe2 b5 19. Ra1,This is a game between Averbakh (as White) and Petrosian (as Black). Last move played: White plays Rook to a1,Large advantage for Black (eval: -130 centipawns),19... Qb6 20. g3 h5 21. h4 Bh6 22. Nd2 a5 23. a3 Rfc8 24. Kg2 R6c7 25. Ndf1 Rd7 26. Qd3 Qb7 27. Kg1 Kg7 ,19. Ng4 
Black starts the minority attack rolling.,True," The comment suggests a potential tactical blunder, indicating a flawed opening strategy.",1. e4 c5 2. Nf3 d6 3. d4 cxd4 4. Nxd4 Nf6 5. Nc3 a6 6. Be2 e5 7. Nb3 Be7 8. O-O O-O 9. Bg5 Be6 10. Bxf6 Bxf6 11. Nd5 Nd7 12. Qd3 Rc8 13. c3 Bg5 14. Rad1 Kh8 15. Bf3 g6 16. Ne3 Rc6 17. Rfe1 Nf6 18. Qe2 b5 19. Ra1 Qb6 20. Nd2 a5 21. Ndf1,This is a game between Averbakh (as White) and Petrosian (as Black). Last move played: White plays Knight to f1,Large advantage for Black (eval: -121 centipawns),21... h5 22. a3 Rfc8 23. Qd2 Bh6 24. g3 Kg7 25. Red1 Qb7 26. h4 Rb6 27. Qd3 Bb3 28. Rd2 ,21. a3 h5 
White has a passed pawn but it is useless.,True," The comment offers a subjective assessment of the pawn's value, suggesting a flawed strategic consideration.",1. e4 c5 2. Nf3 d6 3. d4 cxd4 4. Nxd4 Nf6 5. Nc3 a6 6. Be2 e5 7. Nb3 Be7 8. O-O O-O 9. Bg5 Be6 10. Bxf6 Bxf6 11. Nd5 Nd7 12. Qd3 Rc8 13. c3 Bg5 14. Rad1 Kh8 15. Bf3 g6 16. Ne3 Rc6 17. Rfe1 Nf6 18. Qe2 b5 19. Ra1 Qb6 20. Nd2 a5 21. Ndf1 Rfc8 22. a3 b4 23. cxb4 axb4 24. a4,This is a game between Averbakh (as White) and Petrosian (as Black). Last move played: White plays Pawn to a4,Large advantage for Black (eval: -150 centipawns),24... b3 25. a5 Qa7 26. Red1 h5 27. Qb5 Kg7 28. h3 Bf4 29. Rd2 Bh6 30. Qd3 Nd7 31. Rdd1 Nc5 ,24. a4 b3 
26.Nd5 Bxd5 27.exd5 Rxa4 28.Rxa4 Qxa4 29.Bg4 Nxg4 30.Qxg4 Rc5 31.Qxg5 Qxd1,True," The comment describes a series of moves that lead to a clearly weakened position for Black, indicating a tactical blunder.",1. e4 c5 2. Nf3 d6 3. d4 cxd4 4. Nxd4 Nf6 5. Nc3 a6 6. Be2 e5 7. Nb3 Be7 8. O-O O-O 9. Bg5 Be6 10. Bxf6 Bxf6 11. Nd5 Nd7 12. Qd3 Rc8 13. c3 Bg5 14. Rad1 Kh8 15. Bf3 g6 16. Ne3 Rc6 17. Rfe1 Nf6 18. Qe2 b5 19. Ra1 Qb6 20. Nd2 a5 21. Ndf1 Rfc8 22. a3 b4 23. cxb4 axb4 24. a4 Qa7 25. Red1 Ra6 26. Rd3,This is a game between Averbakh (as White) and Petrosian (as Black). Last move played: White plays Rook to d3,Large advantage for Black (eval: -178 centipawns),26... b3 ,26. Qd2 b3 27. Qb4 Rb8 28. Qd2 h5 29. a5 Kh7 30. h3 Rb5 31. Be2 Raxa5 32. Bxb5 Rxa1 33. Qxd6 Rxd1 34. Nxd1 Nxe4 35. Qxe5 Qa5 36. Qxe4 Qxb5 37. Qf3 Qc5 38. Nc3 Bc1 39. Ne4 
"Black's minority attack has left White with 3 pawn islands to Black's one. While, White has two isolated pawns that can be attacked, Black's queen pawn is safely tucked away.",True," The comment highlights a critical weakness in White's pawn structure, indicating a significant tactical flaw.",1. e4 c5 2. Nf3 d6 3. d4 cxd4 4. Nxd4 Nf6 5. Nc3 a6 6. Be2 e5 7. Nb3 Be7 8. O-O O-O 9. Bg5 Be6 10. Bxf6 Bxf6 11. Nd5 Nd7 12. Qd3 Rc8 13. c3 Bg5 14. Rad1 Kh8 15. Bf3 g6 16. Ne3 Rc6 17. Rfe1 Nf6 18. Qe2 b5 19. Ra1 Qb6 20. Nd2 a5 21. Ndf1 Rfc8 22. a3 b4 23. cxb4 axb4 24. a4 Qa7 25. Red1 Ra6 26. Rd3 b3 27. a5 Rcc6 28. Qd1 Qc7 29. Nd5 Bxd5 30. exd5 Rc5 31. Rxb3 Raxa5 32. Rxa5 Rxa5,This is a game between Averbakh (as White) and Petrosian (as Black). Last move played: Black plays Rook takes on a5,Advantage for Black (eval: -92 centipawns),33. g3 ,32... Rxa5 33. g3 
37.g3 Not giving up the seventh rank offered more resistance.,True," The comment suggests the move was a poor choice due to the opponent's resistance, indicating a tactical error.",1. e4 c5 2. Nf3 d6 3. d4 cxd4 4. Nxd4 Nf6 5. Nc3 a6 6. Be2 e5 7. Nb3 Be7 8. O-O O-O 9. Bg5 Be6 10. Bxf6 Bxf6 11. Nd5 Nd7 12. Qd3 Rc8 13. c3 Bg5 14. Rad1 Kh8 15. Bf3 g6 16. Ne3 Rc6 17. Rfe1 Nf6 18. Qe2 b5 19. Ra1 Qb6 20. Nd2 a5 21. Ndf1 Rfc8 22. a3 b4 23. cxb4 axb4 24. a4 Qa7 25. Red1 Ra6 26. Rd3 b3 27. a5 Rcc6 28. Qd1 Qc7 29. Nd5 Bxd5 30. exd5 Rc5 31. Rxb3 Raxa5 32. Rxa5 Rxa5 33. Rc3 Qb6 34. Rb3 Qa7 35. Rb4 Kg7 36. h4 Bh6 37. b3,This is a game between Averbakh (as White) and Petrosian (as Black). Last move played: White plays Pawn to b3,Large advantage for Black (eval: -222 centipawns),37... Ra2 38. Be2 Rb2 39. g3 Qc5 40. Rc4 Qxd5 41. Qxd5 Nxd5 42. Bf3 Ne7 43. Rc7 Kf6 44. Rb7 Ke6 45. b4 f5 46. Bd1 e4 47. Ba4 Bg7 48. Ne3 Bd4 49. Rc7 ,37. g4 Ra1 
White resigned because his queen has been trapped.,True," The comment accurately describes a situation where a queen is effectively immobilized, indicating a flawed move.",1. e4 c5 2. Nf3 d6 3. d4 cxd4 4. Nxd4 Nf6 5. Nc3 a6 6. Be2 e5 7. Nb3 Be7 8. O-O O-O 9. Bg5 Be6 10. Bxf6 Bxf6 11. Nd5 Nd7 12. Qd3 Rc8 13. c3 Bg5 14. Rad1 Kh8 15. Bf3 g6 16. Ne3 Rc6 17. Rfe1 Nf6 18. Qe2 b5 19. Ra1 Qb6 20. Nd2 a5 21. Ndf1 Rfc8 22. a3 b4 23. cxb4 axb4 24. a4 Qa7 25. Red1 Ra6 26. Rd3 b3 27. a5 Rcc6 28. Qd1 Qc7 29. Nd5 Bxd5 30. exd5 Rc5 31. Rxb3 Raxa5 32. Rxa5 Rxa5 33. Rc3 Qb6 34. Rb3 Qa7 35. Rb4 Kg7 36. h4 Bh6 37. b3 Ra2 38. Qe1 Qa5 39. Qb1 Ra1 40. Rb5 Qc3,This is a game between Averbakh (as White) and Petrosian (as Black). Last move played: Black plays Queen to c3,Large advantage for Black (eval: -672 centipawns),41. Qxa1 Qxa1 42. Rb7 e4 43. b4 exf3 44. gxf3 Nxd5 45. h5 Nf4 46. Re7 Nxh5 47. b5 Qb1 48. Rb7 Bg5 49. Rb8 Bh4 50. b6 Qb2 ,40... Qc3 41. Qxa1 Qxa1 42. g4 e4 43. Be2 e3 44. g5 Qe1 45. fxe3 Qxe2 46. Rb4 Bxg5 47. hxg5 Ng4 48. Rf4 Nxe3 49. Rf2 Qg4+ 50. Kh1 Qh4+ 51. Rh2 Qe4+ 52. Kg1 Nxf1 
"Black has a backward d-pawn, but it is well protected by the rook. Black stands better with his more active pieces and pending minority attack on the queenside.",True,". The comment suggests a potential tactical advantage, but it doesn't explicitly identify the flaw in the previous move.",1. e4 c5 2. Nf3 d6 3. d4 cxd4 4. Nxd4 Nf6 5. Nc3 a6 6. Be2 e5 7. Nb3 Be7 8. O-O O-O 9. Bg5 Be6 10. Bxf6 Bxf6 11. Nd5 Nd7 12. Qd3 Rc8 13. c3 Bg5 14. Rad1 Kh8 15. Bf3 g6 16. Ne3 Rc6 17. Rfe1 Nf6,This is a game between Averbakh (as White) and Petrosian (as Black). Last move played: Black plays Knight to f6,Large advantage for Black (eval: -105 centipawns),18. Nd2 Qb6 ,17... Nf6 18. Nd2 Qb6 19. b3 Qa5 20. Ndc4 Qc7 21. Nb2 b5 22. c4 Rb8 23. Nd5 Bxd5 24. exd5 Rc5 25. b4 bxc4 26. Qc3 Rcb5 27. Qxc4 Qd7 28. a3 a5 29. h4 Bh6 30. Qc6 axb4 31. Nc4 bxa3 32. Nxd6 Rb2 33. Nc4 
"This is a v ariation of the Sicilian Defense where Black allows a weakness at d5, for which there will be some compensation later.",True," The comment identifies a potential weakness in the outpost, suggesting a tactical vulnerability that could be exploited.",1. e4 c5 2. Nf3 d6 3. d4 cxd4 4. Nxd4 Nf6 5. Nc3 a6 6. Be2 e5,This is a game between Averbakh (as White) and Petrosian (as Black). Last move played: Black plays Pawn to e5,Slight advantage for White (eval: 27 centipawns),7. Nb3 ,6... e5 7. Nb3 
