comment,good,reasoning,moves,context,engine_eval,engine_best_line,engine_best_alternative
a big improvement over 4. e4 Bb4 from his first round game versus Kasparov,True, The comment suggests the move was a significant step up from the previous position.,1. c4 e5 2. Nc3 Nf6 3. Nf3 Nc6 4. g3,"This is a game between Vallejo Pons, Francisco (as White) and Ponomariov, Ruslan (as Black). Last move played: White plays Pawn to g3",The position is equal,4... Bb4 ,4. g3 
"Black refuses to allow White to control d5, holding back Black's pieces in the center.",True, The comment suggests a strategic deficiency in Black's planning.,1. c4 e5 2. Nc3 Nf6 3. Nf3 Nc6 4. g3 d5,"This is a game between Vallejo Pons, Francisco (as White) and Ponomariov, Ruslan (as Black). Last move played: Black plays Pawn to d5",The position is equal,5. cxd5 ,4... Bb4 
"This kind of Reversed Sicilian Dragon, Classical Variation isn't too bad for Black. Black has played ...Nd5-b6 to avoid tactical difficulties. White threatened Nf3xe5 when Bg2 and Nc3 double attack Nd5. He'd also rather retreat than capture Nc3. Allowing White to open the b-file with 6...Nxc3? 7. bxc3 isn't very good for Black. Usually White (and possibly Black) has to play on the wing (White with a2-a3, b2-b4-b5 and Black with ...Bf8-e7, ...g7-g5-g4) to fight for central squares.",True," The comment offers a justification for the mistake, suggesting a strategic retreat to avoid immediate tactical complications.",1. c4 e5 2. Nc3 Nf6 3. Nf3 Nc6 4. g3 d5 5. cxd5 Nxd5 6. Bg2 Nb6,"This is a game between Vallejo Pons, Francisco (as White) and Ponomariov, Ruslan (as Black). Last move played: Black plays Knight to b6",Slight advantage for White (eval: 21 centipawns),7. O-O ,6... Bc5 
"White's quick queen-side threat (b2-b4-b5) prevented Black from getting to play his own ...g7-g5-g4, so Black simply castles and continues normally.",True, The comment accurately describes how the threat neutralized Black’s development and allowed for a straightforward castle.,1. c4 e5 2. Nc3 Nf6 3. Nf3 Nc6 4. g3 d5 5. cxd5 Nxd5 6. Bg2 Nb6 7. O-O Be7 8. a3 O-O,"This is a game between Vallejo Pons, Francisco (as White) and Ponomariov, Ruslan (as Black). Last move played: Black plays kingside castle",Slight advantage for White (eval: 22 centipawns),9. b4 ,8... a5 
"This is a surprising move. Usually Black would avoid a trade of Nf3 in order to keep Bg2 under cover. But, in this case it appears Black intends to get his queen-side better organized before White could play Bc1-e3 and Nc3-e4-c5.",True," The comment suggests a logical reason for the move, potentially highlighting a strategic consideration that White's plan was disrupted.",1. c4 e5 2. Nc3 Nf6 3. Nf3 Nc6 4. g3 d5 5. cxd5 Nxd5 6. Bg2 Nb6 7. O-O Be7 8. a3 O-O 9. b4 Be6 10. Rb1 f6 11. d3 Nd4,"This is a game between Vallejo Pons, Francisco (as White) and Ponomariov, Ruslan (as Black). Last move played: Black plays Knight to d4",Slight advantage for White (eval: 27 centipawns),12. Be3 Nxf3+ ,11... a5 12. b5 Nd4 13. Nd2 Qc8 14. e3 Nf5 15. a4 Bb4 16. Qc2 Rd8 17. Na2 Bf8 18. Nc3 
"again a curious choice. The knight has no better square, but it's odd to see Black allowing doubled pawns this way.",True," The comment points out a strategic flaw in the move, suggesting a poor pawn structure.",1. c4 e5 2. Nc3 Nf6 3. Nf3 Nc6 4. g3 d5 5. cxd5 Nxd5 6. Bg2 Nb6 7. O-O Be7 8. a3 O-O 9. b4 Be6 10. Rb1 f6 11. d3 Nd4 12. Nd2 c6 13. e3 Nb5,"This is a game between Vallejo Pons, Francisco (as White) and Ponomariov, Ruslan (as Black). Last move played: Black plays Knight to b5",The position is equal,14. Nxb5 ,13... Nb5 14. Nxb5 
Bg2 is blocked out of play for quite some time.,True," The comment suggests the position is unfavorable due to the pawn structure, indicating a strategic flaw.",1. c4 e5 2. Nc3 Nf6 3. Nf3 Nc6 4. g3 d5 5. cxd5 Nxd5 6. Bg2 Nb6 7. O-O Be7 8. a3 O-O 9. b4 Be6 10. Rb1 f6 11. d3 Nd4 12. Nd2 c6 13. e3 Nb5 14. Nxb5 cxb5 15. Nb3 Na4 16. Bb2 Bd5 17. e4,"This is a game between Vallejo Pons, Francisco (as White) and Ponomariov, Ruslan (as Black). Last move played: White plays Pawn to e4",Slight advantage for White (eval: 35 centipawns),17... Bf7 18. Ba1 ,17. Ba1 
"This seems to solve White's problems. The threat of d4-d5 to block Bf7 or the threat of d4xe5 should force Black to exchange pawns and that opens up the way for Bb2. Pe4 will still be blocking Bg2, but if square e5 opens then there's still a chance for e4-e5 to free that bishop too.",True," The comment offers potential explanations for the mistake, suggesting a strategic move that disrupts Black's plans.",1. c4 e5 2. Nc3 Nf6 3. Nf3 Nc6 4. g3 d5 5. cxd5 Nxd5 6. Bg2 Nb6 7. O-O Be7 8. a3 O-O 9. b4 Be6 10. Rb1 f6 11. d3 Nd4 12. Nd2 c6 13. e3 Nb5 14. Nxb5 cxb5 15. Nb3 Na4 16. Bb2 Bd5 17. e4 Bf7 18. d4,"This is a game between Vallejo Pons, Francisco (as White) and Ponomariov, Ruslan (as Black). Last move played: White plays Pawn to d4",Slight advantage for White (eval: 23 centipawns),18... b6 19. d5 ,18. d4 Nxb2 19. Rxb2 exd4 20. Nxd4 g6 21. Nxb5 Bc4 22. Nd4 Qb6 23. Re1 Rfd8 24. Rd2 a5 25. Nc2 axb4 26. Nxb4 Bxb4 27. axb4 Rxd2 28. Qxd2 Ra2 29. Qf4 Qxb4 
This phase of the game is where the players reorganize their pieces to suit the new pawn structure.,True," The comment suggests a defensive strategy, not a mistake, implying a logical adjustment rather than a flawed move.",1. c4 e5 2. Nc3 Nf6 3. Nf3 Nc6 4. g3 d5 5. cxd5 Nxd5 6. Bg2 Nb6 7. O-O Be7 8. a3 O-O 9. b4 Be6 10. Rb1 f6 11. d3 Nd4 12. Nd2 c6 13. e3 Nb5 14. Nxb5 cxb5 15. Nb3 Na4 16. Bb2 Bd5 17. e4 Bf7 18. d4 Rc8 19. d5 Qd7 20. Qe2 Bd8 21. Ba1,"This is a game between Vallejo Pons, Francisco (as White) and Ponomariov, Ruslan (as Black). Last move played: White plays Bishop to a1",Large advantage for White (eval: 103 centipawns),21... Bb6 22. Kh1 ,21. h4 Bb6 22. Kh2 f5 23. Bh3 Qe8 24. Bxf5 Bxd5 25. Bxc8 Bc4 26. Qd2 Qxc8 27. Bxe5 Qc6 28. Na5 Bxa5 29. bxa5 Bxf1 30. Rxf1 Qxe4 31. Qg5 Rf7 32. Qd8+ Rf8 
"So, Black doesn't waste time.",True," The comment suggests a lack of initiative, implying a passive response, which is a common error in chess.",1. c4 e5 2. Nc3 Nf6 3. Nf3 Nc6 4. g3 d5 5. cxd5 Nxd5 6. Bg2 Nb6 7. O-O Be7 8. a3 O-O 9. b4 Be6 10. Rb1 f6 11. d3 Nd4 12. Nd2 c6 13. e3 Nb5 14. Nxb5 cxb5 15. Nb3 Na4 16. Bb2 Bd5 17. e4 Bf7 18. d4 Rc8 19. d5 Qd7 20. Qe2 Bd8 21. Ba1 Bb6 22. Rbc1 a6 23. h4 Rxc1 24. Rxc1 Rc8 25. Rc2 Rc7 26. Bf3 Qc8 27. Rxc7 Qxc7 28. Qd3 Qc4,"This is a game between Vallejo Pons, Francisco (as White) and Ponomariov, Ruslan (as Black). Last move played: Black plays Queen to c4",Slight advantage for White (eval: 36 centipawns),29. Be2 ,28... Ba7 29. Qd1 
"White can't support Pe4 with f2-f3 because it's pinned and he won't want to move Nb3-d2 because that would allow ...Qc4-c1+, with further damage to follow.",True, The comment identifies a critical tactical weakness and explains the consequences of the move.,1. c4 e5 2. Nc3 Nf6 3. Nf3 Nc6 4. g3 d5 5. cxd5 Nxd5 6. Bg2 Nb6 7. O-O Be7 8. a3 O-O 9. b4 Be6 10. Rb1 f6 11. d3 Nd4 12. Nd2 c6 13. e3 Nb5 14. Nxb5 cxb5 15. Nb3 Na4 16. Bb2 Bd5 17. e4 Bf7 18. d4 Rc8 19. d5 Qd7 20. Qe2 Bd8 21. Ba1 Bb6 22. Rbc1 a6 23. h4 Rxc1 24. Rxc1 Rc8 25. Rc2 Rc7 26. Bf3 Qc8 27. Rxc7 Qxc7 28. Qd3 Qc4 29. Be2 Bg6,"This is a game between Vallejo Pons, Francisco (as White) and Ponomariov, Ruslan (as Black). Last move played: Black plays Bishop to g6",Advantage for White (eval: 68 centipawns),30. Qxc4 bxc4 ,29... Qc8 
"Finally, after that phase the position opens a bit and it appears Black's pieces are a little better. Pe5 blunts Ba1 and Na4 & Bb6 restrain Nb3. So, Be4 and Bc4 duel. It appears to me Pd5 is exposed and weak, so ...Kg8-f8-e7-d6 would be an obvious continuation for Black.",True," The comment provides a potential explanation for the mistake, suggesting Black's piece development is vulnerable.",1. c4 e5 2. Nc3 Nf6 3. Nf3 Nc6 4. g3 d5 5. cxd5 Nxd5 6. Bg2 Nb6 7. O-O Be7 8. a3 O-O 9. b4 Be6 10. Rb1 f6 11. d3 Nd4 12. Nd2 c6 13. e3 Nb5 14. Nxb5 cxb5 15. Nb3 Na4 16. Bb2 Bd5 17. e4 Bf7 18. d4 Rc8 19. d5 Qd7 20. Qe2 Bd8 21. Ba1 Bb6 22. Rbc1 a6 23. h4 Rxc1 24. Rxc1 Rc8 25. Rc2 Rc7 26. Bf3 Qc8 27. Rxc7 Qxc7 28. Qd3 Qc4 29. Be2 Bg6 30. Qxc4 bxc4 31. Bxc4 Bxe4,"This is a game between Vallejo Pons, Francisco (as White) and Ponomariov, Ruslan (as Black). Last move played: Black plays Bishop takes on e4",Advantage for White (eval: 71 centipawns),32. Nd2 Bf5 ,31... Bxe4 
This is a very nifty tactic as it attacks two Black pawns (Pb7 & Pa6) and opens the way for Nd2-c4. Black wasn't given any time to establish a bind by blockading Pd5 and now he even has to spend moves on defense.,True," The comment describes a potential tactical advantage but fails to accurately explain why the move was considered a mistake, suggesting a missed opportunity for a powerful defensive structure.",1. c4 e5 2. Nc3 Nf6 3. Nf3 Nc6 4. g3 d5 5. cxd5 Nxd5 6. Bg2 Nb6 7. O-O Be7 8. a3 O-O 9. b4 Be6 10. Rb1 f6 11. d3 Nd4 12. Nd2 c6 13. e3 Nb5 14. Nxb5 cxb5 15. Nb3 Na4 16. Bb2 Bd5 17. e4 Bf7 18. d4 Rc8 19. d5 Qd7 20. Qe2 Bd8 21. Ba1 Bb6 22. Rbc1 a6 23. h4 Rxc1 24. Rxc1 Rc8 25. Rc2 Rc7 26. Bf3 Qc8 27. Rxc7 Qxc7 28. Qd3 Qc4 29. Be2 Bg6 30. Qxc4 bxc4 31. Bxc4 Bxe4 32. Nd2 Bf5 33. d6+ Kf8 34. Bd5,"This is a game between Vallejo Pons, Francisco (as White) and Ponomariov, Ruslan (as Black). Last move played: White plays Bishop to d5",The position is equal,34... Bc8 35. Be4 Ba7 36. Bxh7 Bb8 37. Bc2 Nb6 38. f4 exf4 39. Bd4 Nd7 40. gxf4 Bxd6 41. Be3 Bc7 42. Kf2 Nb6 43. Bb3 Bf5 44. a4 Nc8 45. Bd5 b6 46. Ne4 a5 47. bxa5 bxa5 ,34. Bd5 Bc8 35. Be4 Ba7 36. Bxh7 Bb8 37. Bc2 Nb6 38. f4 exf4 39. Bd4 Nd7 40. gxf4 Bxd6 41. Be3 Bc7 42. Kf2 Nb8 43. h5 Nc6 44. Bc5+ Kf7 45. Bg6+ Kg8 
"Time to re-evaluate: Pa6 is defended, but White has a two-to-one queen-side pawn majority. Fortunately for Black the pawns are blockaded and his king has approached the center, so that shouldn't be dangerous. White has a problem bishop (Ba1) , but even that may evaporate if White gets f2-f4 or Nd2-e4-c3. It's about as equal as can be.",True," The comment identifies a strategic weakness stemming from a pawn majority, suggesting a flawed assessment of the position's balance.",1. c4 e5 2. Nc3 Nf6 3. Nf3 Nc6 4. g3 d5 5. cxd5 Nxd5 6. Bg2 Nb6 7. O-O Be7 8. a3 O-O 9. b4 Be6 10. Rb1 f6 11. d3 Nd4 12. Nd2 c6 13. e3 Nb5 14. Nxb5 cxb5 15. Nb3 Na4 16. Bb2 Bd5 17. e4 Bf7 18. d4 Rc8 19. d5 Qd7 20. Qe2 Bd8 21. Ba1 Bb6 22. Rbc1 a6 23. h4 Rxc1 24. Rxc1 Rc8 25. Rc2 Rc7 26. Bf3 Qc8 27. Rxc7 Qxc7 28. Qd3 Qc4 29. Be2 Bg6 30. Qxc4 bxc4 31. Bxc4 Bxe4 32. Nd2 Bf5 33. d6+ Kf8 34. Bd5 Bc8 35. d7 Bxd7 36. Bxb7 Bb5,"This is a game between Vallejo Pons, Francisco (as White) and Ponomariov, Ruslan (as Black). Last move played: Black plays Bishop to b5",The position is equal,37. Be4 ,36... Bb5 37. Be4 h6 38. Nb3 Ke7 39. Kg2 Bc7 40. g4 Be2 41. Bc6 Bb5 42. Bb7 Kd7 43. Be4 Bc6 44. Kf3 Bb6 45. Nd2 Bb5 46. Kg3 a5 47. Kf3 axb4 48. axb4 Ke7 
"After this it is clearer that Black's king can't approach Pa3 because Bc2-b3, in particular, will chase him away. Nd2 helps secure square c4, so Black can't use Bb5 to worm his way in by opposing Bc2.",True," The comment accurately identifies a critical weakness in Black's position, suggesting a defensive strategy that hinders Black's development.",1. c4 e5 2. Nc3 Nf6 3. Nf3 Nc6 4. g3 d5 5. cxd5 Nxd5 6. Bg2 Nb6 7. O-O Be7 8. a3 O-O 9. b4 Be6 10. Rb1 f6 11. d3 Nd4 12. Nd2 c6 13. e3 Nb5 14. Nxb5 cxb5 15. Nb3 Na4 16. Bb2 Bd5 17. e4 Bf7 18. d4 Rc8 19. d5 Qd7 20. Qe2 Bd8 21. Ba1 Bb6 22. Rbc1 a6 23. h4 Rxc1 24. Rxc1 Rc8 25. Rc2 Rc7 26. Bf3 Qc8 27. Rxc7 Qxc7 28. Qd3 Qc4 29. Be2 Bg6 30. Qxc4 bxc4 31. Bxc4 Bxe4 32. Nd2 Bf5 33. d6+ Kf8 34. Bd5 Bc8 35. d7 Bxd7 36. Bxb7 Bb5 37. Be4 h6 38. Bc2 Ke7 39. Kg2,"This is a game between Vallejo Pons, Francisco (as White) and Ponomariov, Ruslan (as Black). Last move played: White plays King to g2",The position is equal,39... a5 ,39. Nf1 Kd6 
keeping Kd6 away is essential!,True,", The comment suggests a defensive strategy that contradicts the active piece development and control of the center.",1. c4 e5 2. Nc3 Nf6 3. Nf3 Nc6 4. g3 d5 5. cxd5 Nxd5 6. Bg2 Nb6 7. O-O Be7 8. a3 O-O 9. b4 Be6 10. Rb1 f6 11. d3 Nd4 12. Nd2 c6 13. e3 Nb5 14. Nxb5 cxb5 15. Nb3 Na4 16. Bb2 Bd5 17. e4 Bf7 18. d4 Rc8 19. d5 Qd7 20. Qe2 Bd8 21. Ba1 Bb6 22. Rbc1 a6 23. h4 Rxc1 24. Rxc1 Rc8 25. Rc2 Rc7 26. Bf3 Qc8 27. Rxc7 Qxc7 28. Qd3 Qc4 29. Be2 Bg6 30. Qxc4 bxc4 31. Bxc4 Bxe4 32. Nd2 Bf5 33. d6+ Kf8 34. Bd5 Bc8 35. d7 Bxd7 36. Bxb7 Bb5 37. Be4 h6 38. Bc2 Ke7 39. Kg2 Bd4 40. Nb3 Bxa1 41. Nxa1 Kd6 42. Bb3,"This is a game between Vallejo Pons, Francisco (as White) and Ponomariov, Ruslan (as Black). Last move played: White plays Bishop to b3",The position is equal,42... Nc3 43. Nc2 Bc6+ 44. Kf1 Bd5 45. Bxd5 Kxd5 46. Ne3+ Ke6 47. h5 f5 48. Kg2 Nd5 49. g4 fxg4 50. Nxd5 Kxd5 51. Kg3 Kc4 52. Kxg4 Kb3 53. Kf5 Kxa3 54. Kg6 Kxb4 55. Kxg7 a5 56. Kxh6 a4 57. Kg6 a3 58. h6 a2 59. h7 a1=Q 60. h8=Q Qg1+ 61. Kh7 Qxf2 62. Qxe5 ,42. Kf3 Nb6 
"After all that Black's king still makes some headway. But, Pf2 isn't endangered, so the real Black plan still is to get to White's queen-side pawns. At the moment Ne3 guards both c4 and c2, so Black must either move Nc3 to open square c3 or use ...f6-f5-f4 to kick Ne3 away.",True," The comment offers a potential explanation for the mistake, suggesting a strategic shift aimed at exploiting the king's position.",1. c4 e5 2. Nc3 Nf6 3. Nf3 Nc6 4. g3 d5 5. cxd5 Nxd5 6. Bg2 Nb6 7. O-O Be7 8. a3 O-O 9. b4 Be6 10. Rb1 f6 11. d3 Nd4 12. Nd2 c6 13. e3 Nb5 14. Nxb5 cxb5 15. Nb3 Na4 16. Bb2 Bd5 17. e4 Bf7 18. d4 Rc8 19. d5 Qd7 20. Qe2 Bd8 21. Ba1 Bb6 22. Rbc1 a6 23. h4 Rxc1 24. Rxc1 Rc8 25. Rc2 Rc7 26. Bf3 Qc8 27. Rxc7 Qxc7 28. Qd3 Qc4 29. Be2 Bg6 30. Qxc4 bxc4 31. Bxc4 Bxe4 32. Nd2 Bf5 33. d6+ Kf8 34. Bd5 Bc8 35. d7 Bxd7 36. Bxb7 Bb5 37. Be4 h6 38. Bc2 Ke7 39. Kg2 Bd4 40. Nb3 Bxa1 41. Nxa1 Kd6 42. Bb3 Nc3 43. Nc2 Bc6+ 44. Kf1 Bd5 45. Bxd5 Kxd5 46. Ne3+ Ke4,"This is a game between Vallejo Pons, Francisco (as White) and Ponomariov, Ruslan (as Black). Last move played: Black plays King to e4",The position is equal,47. Nc4 ,46... Ke6 
threat: Nc4-d6+ to win Pf5,True," The comment describes a move that doesn't lead to a clear winning threat, suggesting a flawed strategic plan.",1. c4 e5 2. Nc3 Nf6 3. Nf3 Nc6 4. g3 d5 5. cxd5 Nxd5 6. Bg2 Nb6 7. O-O Be7 8. a3 O-O 9. b4 Be6 10. Rb1 f6 11. d3 Nd4 12. Nd2 c6 13. e3 Nb5 14. Nxb5 cxb5 15. Nb3 Na4 16. Bb2 Bd5 17. e4 Bf7 18. d4 Rc8 19. d5 Qd7 20. Qe2 Bd8 21. Ba1 Bb6 22. Rbc1 a6 23. h4 Rxc1 24. Rxc1 Rc8 25. Rc2 Rc7 26. Bf3 Qc8 27. Rxc7 Qxc7 28. Qd3 Qc4 29. Be2 Bg6 30. Qxc4 bxc4 31. Bxc4 Bxe4 32. Nd2 Bf5 33. d6+ Kf8 34. Bd5 Bc8 35. d7 Bxd7 36. Bxb7 Bb5 37. Be4 h6 38. Bc2 Ke7 39. Kg2 Bd4 40. Nb3 Bxa1 41. Nxa1 Kd6 42. Bb3 Nc3 43. Nc2 Bc6+ 44. Kf1 Bd5 45. Bxd5 Kxd5 46. Ne3+ Ke4 47. h5 f5 48. Nc4,"This is a game between Vallejo Pons, Francisco (as White) and Ponomariov, Ruslan (as Black). Last move played: White plays Knight to c4",The position is equal,48... Kd5 49. Ne3+ Ke6 50. Nc4 Nd5 51. Na5 Nf6 52. Nb7 Kd5 53. Nc5 a5 54. Na6 axb4 55. Nxb4+ Kc5 56. Nd3+ Kd4 57. Nb4 Nxh5 58. a4 f4 59. a5 Kc5 60. Nd3+ Kb5 61. Nxe5 fxg3 62. fxg3 Nxg3+ 63. Kg2 Kxa5 64. Kxg3 Kb5 ,48. Nc4 Kd5 49. Ne3+ Ke6 50. Kg2 Nd5 51. Nc4 Nf6 52. a4 Nxh5 53. b5 axb5 54. axb5 e4 55. f3 Nf6 56. b6 Kd7 57. fxe4 Nxe4 58. Kf3 Nd6 59. Ne5+ Kc8 60. Ng6 Kb7 61. Kf4 Kxb6 62. Ke5 Kc5 63. Nh4 Nf7+ 64. Kxf5 h5 65. Ng6 
"Most of the pawns disappeared because they weren't mobile and that's also an indication there wasn't enough piece support for them. Now there are only a few pawns, so the pieces will be working in close support of them. But, that means there's less chance for complication to induce an error; hence a draw is likely.",True," The comment suggests the lack of mobility of pawns led to a weakening of support, potentially creating a draw.",1. c4 e5 2. Nc3 Nf6 3. Nf3 Nc6 4. g3 d5 5. cxd5 Nxd5 6. Bg2 Nb6 7. O-O Be7 8. a3 O-O 9. b4 Be6 10. Rb1 f6 11. d3 Nd4 12. Nd2 c6 13. e3 Nb5 14. Nxb5 cxb5 15. Nb3 Na4 16. Bb2 Bd5 17. e4 Bf7 18. d4 Rc8 19. d5 Qd7 20. Qe2 Bd8 21. Ba1 Bb6 22. Rbc1 a6 23. h4 Rxc1 24. Rxc1 Rc8 25. Rc2 Rc7 26. Bf3 Qc8 27. Rxc7 Qxc7 28. Qd3 Qc4 29. Be2 Bg6 30. Qxc4 bxc4 31. Bxc4 Bxe4 32. Nd2 Bf5 33. d6+ Kf8 34. Bd5 Bc8 35. d7 Bxd7 36. Bxb7 Bb5 37. Be4 h6 38. Bc2 Ke7 39. Kg2 Bd4 40. Nb3 Bxa1 41. Nxa1 Kd6 42. Bb3 Nc3 43. Nc2 Bc6+ 44. Kf1 Bd5 45. Bxd5 Kxd5 46. Ne3+ Ke4 47. h5 f5 48. Nc4 f4 49. Nd6+ Kf3 50. gxf4 exf4 51. Nf5 Nb5 52. a4 Nc3 53. Nxg7 Nxa4 54. Nf5 Kg4 55. Nxh6+ Kxh5 56. Nf5,"This is a game between Vallejo Pons, Francisco (as White) and Ponomariov, Ruslan (as Black). Last move played: White plays Knight to f5",The position is equal,56... Nc3 57. Nd4 Nd5 58. b5 axb5 59. Nxb5 f3 60. Ke1 Nf4 61. Kd2 Kg4 62. Ke3 Nh3 63. Nc3 Nxf2 64. Kxf2 Kf4 65. Nb1 Ke4 66. Nd2+ Kd3 67. Nxf3 Kc3 ,56. Nf7 Nc3 57. Ne5 Nd5 58. Nd3 Kg6 59. Ke2 Kg5 60. Kf3 Kf5 61. Ke2 Nc7 62. Nc5 Kg4 63. Ke1 f3 64. Kd2 Kh3 65. Kd3 Kg2 66. Ne4 Kg1 67. Ke3 Nd5+ 68. Kxf3 Nxb4 69. Nd2 Nd3 
"This was a game Vallejo Pons can be proud of. He played very well througout and especially in several situations which were not easy. He also retained a share of the lead, a tie with only Kasparov! That's something to write home about.",True," The comment praises the player's performance, suggesting a positive outcome despite the mistake, indicating a level of satisfaction with the move.",1. c4 e5 2. Nc3 Nf6 3. Nf3 Nc6 4. g3 d5 5. cxd5 Nxd5 6. Bg2 Nb6 7. O-O Be7 8. a3 O-O 9. b4 Be6 10. Rb1 f6 11. d3 Nd4 12. Nd2 c6 13. e3 Nb5 14. Nxb5 cxb5 15. Nb3 Na4 16. Bb2 Bd5 17. e4 Bf7 18. d4 Rc8 19. d5 Qd7 20. Qe2 Bd8 21. Ba1 Bb6 22. Rbc1 a6 23. h4 Rxc1 24. Rxc1 Rc8 25. Rc2 Rc7 26. Bf3 Qc8 27. Rxc7 Qxc7 28. Qd3 Qc4 29. Be2 Bg6 30. Qxc4 bxc4 31. Bxc4 Bxe4 32. Nd2 Bf5 33. d6+ Kf8 34. Bd5 Bc8 35. d7 Bxd7 36. Bxb7 Bb5 37. Be4 h6 38. Bc2 Ke7 39. Kg2 Bd4 40. Nb3 Bxa1 41. Nxa1 Kd6 42. Bb3 Nc3 43. Nc2 Bc6+ 44. Kf1 Bd5 45. Bxd5 Kxd5 46. Ne3+ Ke4 47. h5 f5 48. Nc4 f4 49. Nd6+ Kf3 50. gxf4 exf4 51. Nf5 Nb5 52. a4 Nc3 53. Nxg7 Nxa4 54. Nf5 Kg4 55. Nxh6+ Kxh5 56. Nf5 Nc3 57. Nd4 Kg4 58. Kg2 Nd5 59. f3+ Kg5 60. Nc6 Kf6 61. Kh3 Kf5 62. Kh4 Ne3 63. Nb8 Nc2 64. Nxa6 Nd4 65. Kh3 Nxf3,"This is a game between Vallejo Pons, Francisco (as White) and Ponomariov, Ruslan (as Black). Last move played: Black plays Knight takes on f3",The position is equal,66. b5 Ng5+ 67. Kg2 f3+ 68. Kg1 Kf4 69. b6 Ke3 70. Nb4 f2+ 71. Kf1 Ne4 72. Nc2+ Kf3 73. Nd4+ Ke3 ,65... Nxf3 66. b5 Ne5 67. b6 Ke4 68. b7 Nc6 69. Nb4 Nb8 70. Kg4 f3 71. Kg3 Nd7 72. Kf2 Ke5 73. Kxf3 Kd6 74. Na6 Kc6 75. Nc5 Kc7 76. Ke4 Nb8 77. Kd5 Nc6 78. Ne6+ Kxb7 79. Kc5 Nb8 
"Black refuses to allow White to control d5, holding back Black's pieces in the center.",True," The comment identifies a key flaw in White's position, suggesting a lack of pawn development and undeveloped pieces.",1. c4 e5 2. Nc3 Nf6 3. Nf3 Nc6 4. g3 d5,"This is a game between Vallejo Pons, Francisco (as White) and Ponomariov, Ruslan (as Black). Last move played: Black plays Pawn to d5",The position is equal,5. cxd5 ,4... Bb4 
"In earlier rounds he has played 1. c4 against Kasparov (barely surviving) and 1. e4 against Ivanchuk (preferring a closed line with 2. Nc3 and g2-g3, Bf1-g2) . Apparently he believes it will be difficult for his opponents to come and get him if he maintains a safe position.",True,"

The comment offers a potential explanation for the mistake, suggesting a strategic consideration of defensive positioning, indicating a thoughtful analysis of the opponent’s potential responses.",1. c4,"This is a game between Vallejo Pons, Francisco (as White) and Ponomariov, Ruslan (as Black). Last move played: White plays Pawn to c4",Slight advantage for White (eval: 22 centipawns),1... e5 ,1. e4 e5 
