comment,good,reasoning,moves,context,engine_eval,engine_best_line,engine_best_alternative
The effect of the bishop on the h2-b8 diagonal will be felt throughout the game.,True," The comment suggests a potential strategic weakness, indicating a flawed move.",1. d4 d5 2. c4 c6 3. Nf3 Nf6 4. Nc3 Nbd7 5. cxd5 cxd5 6. Bf4,This is a game between Kasparov (as White) and Schurer (as Black). Last move played: White plays Bishop to f4,Advantage for White (eval: 82 centipawns),6... e6 7. e3 ,6. Bf4 
Black should complete development before moving the knight a second time.,True," The comment suggests a potential weakness in the opening strategy, indicating a possible flaw in the player's planning.",1. d4 d5 2. c4 c6 3. Nf3 Nf6 4. Nc3 Nbd7 5. cxd5 cxd5 6. Bf4 e6 7. e3 Ne4,This is a game between Kasparov (as White) and Schurer (as Black). Last move played: Black plays Knight to e4,Advantage for White (eval: 76 centipawns),8. Bd3 g5 ,7... Nh5 8. Bg5 
"8...Bb4 was necessary here, to get rid of the knight at c3.8... Nxc3 would also have been reasonable.",True," The comment suggests a strategic reason for the move, potentially indicating a misjudgment of the resulting position.",1. d4 d5 2. c4 c6 3. Nf3 Nf6 4. Nc3 Nbd7 5. cxd5 cxd5 6. Bf4 e6 7. e3 Ne4 8. Bd3 f5,This is a game between Kasparov (as White) and Schurer (as Black). Last move played: Black plays Pawn to f5,Large advantage for White (eval: 196 centipawns),9. Nb5 Bb4+ 10. Ke2 O-O 11. Rc1 Qe7 12. Qb3 Ba5 13. Nc7 Ndc5 14. Nxd5 exd5 15. dxc5 Be6 16. Qb5 Bc7 17. Qxb7 Rac8 18. Qxa7 g5 19. Be5 f4 ,8... g5 
Now the capture at c3 was mandatory. The knight wreaks havoc immediately.,True," The comment suggests the move was forced due to a knight attack, indicating a tactical blunder.",1. d4 d5 2. c4 c6 3. Nf3 Nf6 4. Nc3 Nbd7 5. cxd5 cxd5 6. Bf4 e6 7. e3 Ne4 8. Bd3 f5 9. O-O Be7,This is a game between Kasparov (as White) and Schurer (as Black). Last move played: Black plays Bishop to e7,Large advantage for White (eval: 329 centipawns),10. Nb5 O-O 11. Nc7 e5 12. Ne6 Qb6 13. Nxf8 exf4 14. Nxd7 Bxd7 15. exf4 h6 16. Qe2 Bd6 17. Qe3 Re8 18. Ne5 Bc6 19. a4 g5 20. Bxe4 dxe4 21. Qh3 Bxe5 22. fxe5 ,9... Nxc3 10. bxc3 Be7 11. c4 O-O 12. cxd5 Nb6 13. dxe6 Bxe6 14. Bg3 Rc8 15. Rb1 Rc3 16. a4 Ra3 17. Ne5 Qc8 18. Ra1 Rc3 19. a5 Nd5 20. h3 f4 21. Bxf4 Nxf4 22. exf4 Rxf4 23. a6 bxa6 24. Qh5 Bf5 
A fork and discovered attack in a single move! Both rooks and the queen are attacked.,True," The comment accurately describes a complex tactical sequence involving multiple pieces, indicating a significant error.",1. d4 d5 2. c4 c6 3. Nf3 Nf6 4. Nc3 Nbd7 5. cxd5 cxd5 6. Bf4 e6 7. e3 Ne4 8. Bd3 f5 9. O-O Be7 10. Nb5 O-O 11. Nc7 Rb8 12. Nxe6,This is a game between Kasparov (as White) and Schurer (as Black). Last move played: White plays Knight takes on e6,Large advantage for White (eval: 490 centipawns),12... Qb6 13. Nxf8 Bxf8 14. Bxb8 Nxb8 15. Ne5 Nc6 16. Bxe4 fxe4 17. Qb3 Qd8 18. f4 h6 19. Kh1 Bf5 20. Qxb7 Ne7 21. Qb3 ,12. Nxe6 Qb6 13. Nxf8 Bxf8 14. Qb3 Qxb3 15. axb3 Ra8 16. Rfc1 h6 17. h3 g5 18. Bh2 Ndf6 19. Rc2 Bb4 20. Ne5 Be6 21. Rc7 
"Now White is up a double exchange, for which Black has no compensation at all.",True," The comment highlights a potential tactical blunder due to the doubled exchange, suggesting a missed opportunity for compensation.",1. d4 d5 2. c4 c6 3. Nf3 Nf6 4. Nc3 Nbd7 5. cxd5 cxd5 6. Bf4 e6 7. e3 Ne4 8. Bd3 f5 9. O-O Be7 10. Nb5 O-O 11. Nc7 Rb8 12. Nxe6 Qb6 13. Nxf8 Bxf8 14. Bxb8 Nxb8,This is a game between Kasparov (as White) and Schurer (as Black). Last move played: Black plays Knight takes on b8,Large advantage for White (eval: 500 centipawns),15. Rc1 Nc6 16. Qb3 Qd8 17. Rxc6 bxc6 18. Bxe4 fxe4 19. Ne5 Qg5 20. h4 Qxh4 21. Qb8 Bh3 22. Qe8 h5 23. Qf7+ Kh7 24. Qg6+ Kg8 25. Rb1 Bxg2 26. Qxg2 Bd6 ,14... Nxb8 15. Rc1 Nc6 16. Qb3 Qd8 17. Bxe4 fxe4 18. Ne5 Be6 19. Qxb7 Nxe5 20. dxe5 h6 21. Qc6 Bf5 22. Rcd1 Kh7 23. Qxd5 Qg5 24. Kh1 Be7 25. Qf7 Bc5 26. Rd8 
