comment,good,reasoning,moves,context,engine_eval,engine_best_line,engine_best_alternative
B33: Sicilian: Pelikan and Sveshnikov Variations,True," The comment indicates a specific opening variation, suggesting a flawed choice in the game.",1. e4,"This is a game between Polgar, S. (as White) and Kramnik, V. (as Black). Last move played: White plays Pawn to e4",Slight advantage for White (eval: 33 centipawns),1... e5 2. Nf3 Nc6 3. d4 exd4 4. Nxd4 Bc5 5. Nb3 Bb6 6. a4 Qh4 7. Qf3 a5 8. g3 Qf6 9. Qe2 Nge7 10. Nc3 ,1. e4 e5 
Black wins space,True,", The comment suggests a tactical error leading to immediate material loss, indicating a flawed plan.",1. e4 c5 2. Nf3 Nc6 3. d4 cxd4 4. Nxd4 Nf6 5. Nc3 e5 6. Ndb5 d6 7. Bg5 a6 8. Na3 b5 9. Bxf6 gxf6 10. Nd5 f5 11. Bd3 Be6 12. c3 Bg7 13. O-O Bxd5 14. exd5 Ne7 15. Qh5 e4,"This is a game between Polgar, S. (as White) and Kramnik, V. (as Black). Last move played: Black plays Pawn to e4",The position is equal,16. Bc2 O-O ,15... e4 16. Bc2 O-O 17. Rae1 Qb6 18. Kh1 Rae8 19. f3 Nxd5 20. fxe4 Ne3 21. Rf3 Nxc2 22. Nxc2 Rxe4 23. Ref1 f4 24. Qf5 d5 25. Rxf4 Qe6 26. Kg1 
Do you see the mate threat?,True," The comment directly addresses a potential tactical weakness, indicating a flawed assessment of the position.",1. e4 c5 2. Nf3 Nc6 3. d4 cxd4 4. Nxd4 Nf6 5. Nc3 e5 6. Ndb5 d6 7. Bg5 a6 8. Na3 b5 9. Bxf6 gxf6 10. Nd5 f5 11. Bd3 Be6 12. c3 Bg7 13. O-O Bxd5 14. exd5 Ne7 15. Qh5 e4 16. Bc2 Qa5 17. Rae1 Ra7 18. Kh1 Bxc3 19. bxc3 Qxa3 20. Bb3 Qb2 21. f3 Rg8,"This is a game between Polgar, S. (as White) and Kramnik, V. (as Black). Last move played: Black plays Rook to g8",The position is equal,22. g3 f4 23. fxe4 fxg3 24. Rxf7 Kd8 25. Qh6 Qxc3 26. Qxd6+ Ke8 27. Rxe7+ Rxe7 28. Qb8+ Kd7 29. Qb7+ Kd8 30. Qa8+ Kc7 31. Qa7+ Kc8 32. Qa8+ Kc7 ,21... Rg8 22. g3 f4 23. fxe4 fxg3 24. Rxf7 Rg6 25. Qxh7 Rg5 26. Rf3 Qxh2+ 27. Qxh2 gxh2 28. c4 Ng6 29. Rf5 Rg3 30. cxb5 Ne5 31. bxa6 Rag7 32. Rff1 Nf3 33. Rxf3 Rxf3 34. e5 Rfg3 35. exd6+ Kd8 36. Re7 Rg1+ 37. Kxh2 R1g2+ 38. Kh1 
Theme: Clearance for c7-h7,True," The comment indicates a potential tactical weakness, suggesting the move was not well-calculated.",1. e4 c5 2. Nf3 Nc6 3. d4 cxd4 4. Nxd4 Nf6 5. Nc3 e5 6. Ndb5 d6 7. Bg5 a6 8. Na3 b5 9. Bxf6 gxf6 10. Nd5 f5 11. Bd3 Be6 12. c3 Bg7 13. O-O Bxd5 14. exd5 Ne7 15. Qh5 e4 16. Bc2 Qa5 17. Rae1 Ra7 18. Kh1 Bxc3 19. bxc3 Qxa3 20. Bb3 Qb2 21. f3 Rg8 22. g3 f4 23. fxe4 fxg3 24. Rxf7 Kd8 25. Qh6 Qxc3 26. Rf8+ Rxf8 27. Qxf8+ Kd7 28. Rf1 Qe3 29. Qf4 Qxf4 30. Rxf4 gxh2 31. Bd1 Kc7 32. Rf7 Kb6 33. Rxh7 Rc7 34. Kxh2 Nxd5,"This is a game between Polgar, S. (as White) and Kramnik, V. (as Black). Last move played: Black plays Knight takes on d5",Large advantage for Black (eval: -333 centipawns),35. Rh6 Nc3 ,34... Nxd5 35. Rh6 Nc3 36. Bc2 Nxa2 37. Rxd6+ Kc5 38. Rd2 Nb4 39. Kg3 a5 40. Bb1 a4 41. Rd8 Nc6 42. Ra8 Kb4 43. Kf4 Rf7+ 44. Ke3 
Do you see the mate threat?,True," The comment indicates a potential vulnerability in Black’s pawn structure, suggesting a risky move.",1. e4 c5 2. Nf3 Nc6 3. d4 cxd4 4. Nxd4 Nf6 5. Nc3 e5 6. Ndb5 d6 7. Bg5 a6 8. Na3 b5 9. Bxf6 gxf6 10. Nd5 f5 11. Bd3 Be6 12. c3 Bg7 13. O-O Bxd5 14. exd5 Ne7 15. Qh5 e4 16. Bc2 Qa5 17. Rae1 Ra7 18. Kh1 Bxc3 19. bxc3 Qxa3 20. Bb3 Qb2 21. f3 Rg8,"This is a game between Polgar, S. (as White) and Kramnik, V. (as Black). Last move played: Black plays Rook to g8",The position is equal,22. g3 f4 23. fxe4 fxg3 24. Rxf7 Kd8 25. Qh6 Qxc3 26. Qxd6+ Ke8 27. Rxe7+ Rxe7 28. Qb8+ Kd7 29. Qb7+ Kd8 30. Qa8+ Kc7 31. Qa7+ Kc8 32. Qa8+ Kc7 ,21... Rg8 22. g3 f4 23. fxe4 fxg3 24. Rxf7 Rg6 25. Qxh7 Rg5 26. Rf3 Qxh2+ 27. Qxh2 gxh2 28. c4 Ng6 29. Rf5 Rg3 30. cxb5 Ne5 31. bxa6 Rag7 32. Rff1 Nf3 33. Rxf3 Rxf3 34. e5 Rfg3 35. exd6+ Kd8 36. Re7 Rg1+ 37. Kxh2 R1g2+ 38. Kh1 
