comment,good,reasoning,moves,context,engine_eval,engine_best_line,engine_best_alternative
13...Kf7 Giving the e-pawn protection is preferable.,True,", The comment suggests a defensive move, potentially hindering the opponent's development, which is a common reason for a move being deemed a mistake.",1. c4 g6 2. d4 Nf6 3. Nc3 d5 4. Nf3 Bg7 5. e3 O-O 6. Be2 dxc4 7. Bxc4 c5 8. d5 e6 9. dxe6 Qxd1+ 10. Kxd1 Bxe6 11. Bxe6 fxe6 12. Ke2 Nc6 13. Rd1 Rad8,This is a game between Petrosian (as White) and Botvinnik (as Black). Last move played: Black plays Rook to d8,Slight advantage for White (eval: 28 centipawns),14. Rxd8 Rxd8 15. Ng5 Re8 16. Bd2 b6 17. Rb1 Nd5 18. Nb5 h6 19. Ne4 Rd8 20. a4 Kf8 21. f3 Nf6 22. Nf2 a6 23. Na3 Nd5 24. Ne4 Ke7 25. g3 Rb8 26. b3 ,13... h6 14. Bd2 
A well disguised idea. The knight is actually heading to e4 but is currently attacking the e-pawn.,True, The comment accurately describes a potential tactical error and the knight's intended target.,1. c4 g6 2. d4 Nf6 3. Nc3 d5 4. Nf3 Bg7 5. e3 O-O 6. Be2 dxc4 7. Bxc4 c5 8. d5 e6 9. dxe6 Qxd1+ 10. Kxd1 Bxe6 11. Bxe6 fxe6 12. Ke2 Nc6 13. Rd1 Rad8 14. Rxd8 Rxd8 15. Ng5,This is a game between Petrosian (as White) and Botvinnik (as Black). Last move played: White plays Knight to g5,Slight advantage for White (eval: 26 centipawns),15... Re8 16. Bd2 ,15. Ng5 
White restrains the enemy pawn majority.,True," The comment suggests a defensive strategy, potentially indicating an error in planning or execution.",1. c4 g6 2. d4 Nf6 3. Nc3 d5 4. Nf3 Bg7 5. e3 O-O 6. Be2 dxc4 7. Bxc4 c5 8. d5 e6 9. dxe6 Qxd1+ 10. Kxd1 Bxe6 11. Bxe6 fxe6 12. Ke2 Nc6 13. Rd1 Rad8 14. Rxd8 Rxd8 15. Ng5 Re8 16. Nge4 Nxe4 17. Nxe4 b6 18. Rb1 Nb4 19. Bd2 Nd5 20. a4,This is a game between Petrosian (as White) and Botvinnik (as Black). Last move played: White plays Pawn to a4,Slight advantage for White (eval: 40 centipawns),20... Rd8 21. b3 ,20. b3 Nf6 21. Nd6 Rd8 22. Nc4 Nd5 23. Rc1 h6 24. a4 g5 25. h3 Rd7 26. e4 Ne7 27. Be3 Nc6 28. Rd1 Rxd1 29. Kxd1 
The Black bishop heads to e7 to keep the reins on the White knight.,True," The comment suggests a defensive move intended to control a key square, indicating a flawed strategic decision.",1. c4 g6 2. d4 Nf6 3. Nc3 d5 4. Nf3 Bg7 5. e3 O-O 6. Be2 dxc4 7. Bxc4 c5 8. d5 e6 9. dxe6 Qxd1+ 10. Kxd1 Bxe6 11. Bxe6 fxe6 12. Ke2 Nc6 13. Rd1 Rad8 14. Rxd8 Rxd8 15. Ng5 Re8 16. Nge4 Nxe4 17. Nxe4 b6 18. Rb1 Nb4 19. Bd2 Nd5 20. a4 Rc8 21. b3 Bf8,This is a game between Petrosian (as White) and Botvinnik (as Black). Last move played: Black plays Bishop to f8,Slight advantage for White (eval: 39 centipawns),22. Rc1 h6 23. Bc3 g5 24. Be5 a6 25. Bd6 Bxd6 26. Nxd6 Rb8 27. h4 Kg7 28. hxg5 hxg5 29. Ne4 Kg6 30. f3 Nf6 31. Nd2 Nd5 32. Nc4 ,21... Bf8 
22...Rc7 would have protected the Black rook and thus of broken the pin.,True," The comment suggests a potential defensive move that could have mitigated the pin, indicating a flawed strategic assessment.",1. c4 g6 2. d4 Nf6 3. Nc3 d5 4. Nf3 Bg7 5. e3 O-O 6. Be2 dxc4 7. Bxc4 c5 8. d5 e6 9. dxe6 Qxd1+ 10. Kxd1 Bxe6 11. Bxe6 fxe6 12. Ke2 Nc6 13. Rd1 Rad8 14. Rxd8 Rxd8 15. Ng5 Re8 16. Nge4 Nxe4 17. Nxe4 b6 18. Rb1 Nb4 19. Bd2 Nd5 20. a4 Rc8 21. b3 Bf8 22. Rc1 Be7,This is a game between Petrosian (as White) and Botvinnik (as Black). Last move played: Black plays Bishop to e7,Slight advantage for White (eval: 30 centipawns),23. Bc3 Kf7 ,22... Be7 23. f4 a6 24. Nf2 g5 25. fxg5 Bxg5 26. Nd3 Be7 27. g3 Nf6 28. Bc3 Kf7 29. Ne5+ Ke8 
"White has followed through on his plan, blockade, attack, destroy.",True," The comment describes a specific sequence of moves, suggesting a deliberate and aggressive plan that was ultimately unsuccessful.",1. c4 g6 2. d4 Nf6 3. Nc3 d5 4. Nf3 Bg7 5. e3 O-O 6. Be2 dxc4 7. Bxc4 c5 8. d5 e6 9. dxe6 Qxd1+ 10. Kxd1 Bxe6 11. Bxe6 fxe6 12. Ke2 Nc6 13. Rd1 Rad8 14. Rxd8 Rxd8 15. Ng5 Re8 16. Nge4 Nxe4 17. Nxe4 b6 18. Rb1 Nb4 19. Bd2 Nd5 20. a4 Rc8 21. b3 Bf8 22. Rc1 Be7 23. b4 c4 24. b5 Kf7 25. Bc3 Ba3 26. Rc2 Nxc3+ 27. Rxc3 Bb4 28. Rc2 Ke7 29. Nd2 c3 30. Ne4 Ba5 31. Kd3 Rd8+ 32. Kc4 Rd1 33. Nxc3,This is a game between Petrosian (as White) and Botvinnik (as Black). Last move played: White plays Knight takes on c3,Slight advantage for White (eval: 41 centipawns),33... Bxc3 ,33. Nxc3 Bxc3 
A deep move to understand with variations. The idea is that the h2 pawn is insignificant compared with the dominant posts White gains for his pieces.,True," The comment suggests a misunderstanding of pawn structure and the impact of piece activity, potentially indicating a flawed strategic assessment.",1. c4 g6 2. d4 Nf6 3. Nc3 d5 4. Nf3 Bg7 5. e3 O-O 6. Be2 dxc4 7. Bxc4 c5 8. d5 e6 9. dxe6 Qxd1+ 10. Kxd1 Bxe6 11. Bxe6 fxe6 12. Ke2 Nc6 13. Rd1 Rad8 14. Rxd8 Rxd8 15. Ng5 Re8 16. Nge4 Nxe4 17. Nxe4 b6 18. Rb1 Nb4 19. Bd2 Nd5 20. a4 Rc8 21. b3 Bf8 22. Rc1 Be7 23. b4 c4 24. b5 Kf7 25. Bc3 Ba3 26. Rc2 Nxc3+ 27. Rxc3 Bb4 28. Rc2 Ke7 29. Nd2 c3 30. Ne4 Ba5 31. Kd3 Rd8+ 32. Kc4 Rd1 33. Nxc3 Rh1 34. Ne4,This is a game between Petrosian (as White) and Botvinnik (as Black). Last move played: White plays Knight to e4,Large advantage for White (eval: 168 centipawns),34... Rd1 35. Ng5 ,34. Ne4 Rd1 35. Ng5 h5 36. Nf3 Kf6 37. Nd4 Ra1 38. Kb3 Rb1+ 39. Ka2 Rg1 40. f3 Rd1 41. Nc6 Bd2 42. e4 Bf4 43. g3 Be3 44. Nxa7 g5 45. Nc8 Bg1 46. f4 gxf4 47. gxf4 h4 48. a5 bxa5 49. b6 Rd4 
Played to stop the White rook from penetrating to the 7th. 35...Rxg2 36.Rc7+ Ke8 37.Ke5 leaves the Black king in a mating net.,True," The comment describes a defensive move that inadvertently creates a threat to the Black king, indicating a flawed strategic decision.",1. c4 g6 2. d4 Nf6 3. Nc3 d5 4. Nf3 Bg7 5. e3 O-O 6. Be2 dxc4 7. Bxc4 c5 8. d5 e6 9. dxe6 Qxd1+ 10. Kxd1 Bxe6 11. Bxe6 fxe6 12. Ke2 Nc6 13. Rd1 Rad8 14. Rxd8 Rxd8 15. Ng5 Re8 16. Nge4 Nxe4 17. Nxe4 b6 18. Rb1 Nb4 19. Bd2 Nd5 20. a4 Rc8 21. b3 Bf8 22. Rc1 Be7 23. b4 c4 24. b5 Kf7 25. Bc3 Ba3 26. Rc2 Nxc3+ 27. Rxc3 Bb4 28. Rc2 Ke7 29. Nd2 c3 30. Ne4 Ba5 31. Kd3 Rd8+ 32. Kc4 Rd1 33. Nxc3 Rh1 34. Ne4 Rxh2 35. Kd4 Kd7,This is a game between Petrosian (as White) and Botvinnik (as Black). Last move played: Black plays King to d7,Large advantage for White (eval: 284 centipawns),36. g3 Bb4 37. Ke5 Rh5+ 38. Kf6 Be7+ 39. Kg7 e5 40. Kg8 Ke6 41. Rc6+ Kd7 42. a5 bxa5 43. Ra6 Rh1 44. Rxa5 Ke6 45. Rxa7 h5 46. Ra6+ Kd5 47. Nc3+ Kc4 48. Rc6+ Kd3 49. Kf7 Bb4 ,35... h5 36. Rc7+ Kd8 37. Rxa7 Rxg2 38. Ke5 Kc8 39. Rh7 Kb8 40. Kxe6 Be1 41. Kd5 Ba5 42. Rh8+ Ka7 43. Rh6 Rg1 44. Rh7+ Kb8 45. Nf6 Ra1 46. Nd7+ Kc8 47. Ne5 Rd1+ 48. Ke6 
White has an overwhelming advantage because of his swarming pieces.,True," The comment suggests a strategic error based on excessive piece activity, potentially indicating a lack of positional understanding.",1. c4 g6 2. d4 Nf6 3. Nc3 d5 4. Nf3 Bg7 5. e3 O-O 6. Be2 dxc4 7. Bxc4 c5 8. d5 e6 9. dxe6 Qxd1+ 10. Kxd1 Bxe6 11. Bxe6 fxe6 12. Ke2 Nc6 13. Rd1 Rad8 14. Rxd8 Rxd8 15. Ng5 Re8 16. Nge4 Nxe4 17. Nxe4 b6 18. Rb1 Nb4 19. Bd2 Nd5 20. a4 Rc8 21. b3 Bf8 22. Rc1 Be7 23. b4 c4 24. b5 Kf7 25. Bc3 Ba3 26. Rc2 Nxc3+ 27. Rxc3 Bb4 28. Rc2 Ke7 29. Nd2 c3 30. Ne4 Ba5 31. Kd3 Rd8+ 32. Kc4 Rd1 33. Nxc3 Rh1 34. Ne4 Rxh2 35. Kd4 Kd7 36. g3 Bb4 37. Ke5 Rh5+ 38. Kf6 Be7+ 39. Kg7 e5 40. Rc6 Rh1,This is a game between Petrosian (as White) and Botvinnik (as Black). Last move played: Black plays Rook to h1,Large advantage for White (eval: 331 centipawns),41. Kf7 Ra1 42. Re6 Bb4 43. Nf6+ Kc8 44. Re8+ Kb7 45. Rh8 g5 46. Rxh7 Rxa4 47. Kg6+ Kb8 48. Kxg5 Be1 49. g4 Bxf2 50. e4 a5 51. bxa6 Rxa6 52. Kf5 Ra3 53. g5 Rf3+ 54. Kxe5 Be1 55. Ke6 Rg3 56. Kf5 Rf3+ 57. Kg4 ,40... Rh1 41. Kf7 
Black resigned because he will be unable to save his kingside pawns.,True," The comment suggests a critical flaw in Black's strategy, indicating a potential loss of king safety.",1. c4 g6 2. d4 Nf6 3. Nc3 d5 4. Nf3 Bg7 5. e3 O-O 6. Be2 dxc4 7. Bxc4 c5 8. d5 e6 9. dxe6 Qxd1+ 10. Kxd1 Bxe6 11. Bxe6 fxe6 12. Ke2 Nc6 13. Rd1 Rad8 14. Rxd8 Rxd8 15. Ng5 Re8 16. Nge4 Nxe4 17. Nxe4 b6 18. Rb1 Nb4 19. Bd2 Nd5 20. a4 Rc8 21. b3 Bf8 22. Rc1 Be7 23. b4 c4 24. b5 Kf7 25. Bc3 Ba3 26. Rc2 Nxc3+ 27. Rxc3 Bb4 28. Rc2 Ke7 29. Nd2 c3 30. Ne4 Ba5 31. Kd3 Rd8+ 32. Kc4 Rd1 33. Nxc3 Rh1 34. Ne4 Rxh2 35. Kd4 Kd7 36. g3 Bb4 37. Ke5 Rh5+ 38. Kf6 Be7+ 39. Kg7 e5 40. Rc6 Rh1 41. Kf7 Ra1 42. Re6 Bd8 43. Rd6+ Kc8 44. Ke8 Bc7 45. Rc6 Rd1 46. Ng5 Rd8+ 47. Kf7 Rd7+ 48. Kg8,This is a game between Petrosian (as White) and Botvinnik (as Black). Last move played: White plays King to g8,Large advantage for White (eval: 337 centipawns),48... h5 49. Ne4 Kb7 50. Rxg6 Rd3 51. Rg7 Ra3 52. Nd6+ Kb8 53. Ne8 Bd8 54. Kf7 Rxa4 55. Ke6 a6 56. Kd7 h4 57. Kxd8 axb5 58. Nd6 h3 59. Rh7 h2 60. Rxh2 ,48. Kg8 Kb7 49. Nxh7 a6 50. Nf6 Rd2 51. Ne4 axb5 52. axb5 Rb2 53. Rxg6 Rxb5 54. g4 Rb4 55. f3 Rb1 56. g5 Bd8 57. Rh6 Bxg5 58. Nxg5 Re1 59. f4 exf4 60. exf4 b5 61. Re6 Rf1 
"A dynamic position has arisen. True Black has an isolated e-pawn. However, this is compensated for by his queenside pawn majority and slightly more active pieces.",True, The comment identifies a positional advantage but doesn't explicitly state the mistake – the move is considered a mistake.,1. c4 g6 2. d4 Nf6 3. Nc3 d5 4. Nf3 Bg7 5. e3 O-O 6. Be2 dxc4 7. Bxc4 c5 8. d5 e6 9. dxe6 Qxd1+ 10. Kxd1 Bxe6 11. Bxe6 fxe6 12. Ke2,This is a game between Petrosian (as White) and Botvinnik (as Black). Last move played: White plays King to e2,Slight advantage for White (eval: 37 centipawns),12... h6 ,12. Ke2 
13...Kf7 Giving the e-pawn protection is preferable.,True,", The comment suggests a potential weakness in the bishop's protection of the p-pawn, indicating a flawed strategic decision.",1. c4 g6 2. d4 Nf6 3. Nc3 d5 4. Nf3 Bg7 5. e3 O-O 6. Be2 dxc4 7. Bxc4 c5 8. d5 e6 9. dxe6 Qxd1+ 10. Kxd1 Bxe6 11. Bxe6 fxe6 12. Ke2 Nc6 13. Rd1 Rad8,This is a game between Petrosian (as White) and Botvinnik (as Black). Last move played: Black plays Rook to d8,Slight advantage for White (eval: 28 centipawns),14. Rxd8 Rxd8 15. Ng5 Re8 16. Bd2 b6 17. Rb1 Nd5 18. Nb5 h6 19. Ne4 Rd8 20. a4 Kf8 21. f3 Nf6 22. Nf2 a6 23. Na3 Nd5 24. Ne4 Ke7 25. g3 Rb8 26. b3 ,13... h6 14. Bd2 
Freeing the bishop from the defense of the b-pawn.,True," The comment describes a potential tactical blunder, suggesting a missed opportunity to exploit a weakness.",1. c4 g6 2. d4 Nf6 3. Nc3 d5 4. Nf3 Bg7 5. e3 O-O 6. Be2 dxc4 7. Bxc4 c5 8. d5 e6 9. dxe6 Qxd1+ 10. Kxd1 Bxe6 11. Bxe6 fxe6 12. Ke2 Nc6 13. Rd1 Rad8 14. Rxd8 Rxd8 15. Ng5 Re8 16. Nge4 Nxe4 17. Nxe4 b6 18. Rb1,This is a game between Petrosian (as White) and Botvinnik (as Black). Last move played: White plays Rook to b1,Slight advantage for White (eval: 31 centipawns),18... Nb4 ,18. Rb1 Nb4 
"A dynamic position has arisen. True Black has an isolated e-pawn. However, this is compensated for by his queenside pawn majority and slightly more active pieces.",True,". The comment clearly indicates a dangerous situation involving a pawn, suggesting a tactical error.",1. c4 g6 2. d4 Nf6 3. Nc3 d5 4. Nf3 Bg7 5. e3 O-O 6. Be2 dxc4 7. Bxc4 c5 8. d5 e6 9. dxe6 Qxd1+ 10. Kxd1 Bxe6 11. Bxe6 fxe6 12. Ke2,This is a game between Petrosian (as White) and Botvinnik (as Black). Last move played: White plays King to e2,Slight advantage for White (eval: 37 centipawns),12... h6 ,12. Ke2 
A well disguised idea. The knight is actually heading to e4 but is currently attacking the e-pawn.,True," The comment offers potential strategies for improving a position, suggesting a flawed move.",1. c4 g6 2. d4 Nf6 3. Nc3 d5 4. Nf3 Bg7 5. e3 O-O 6. Be2 dxc4 7. Bxc4 c5 8. d5 e6 9. dxe6 Qxd1+ 10. Kxd1 Bxe6 11. Bxe6 fxe6 12. Ke2 Nc6 13. Rd1 Rad8 14. Rxd8 Rxd8 15. Ng5,This is a game between Petrosian (as White) and Botvinnik (as Black). Last move played: White plays Knight to g5,Slight advantage for White (eval: 26 centipawns),15... Re8 16. Bd2 ,15. Ng5 
