comment,good,reasoning,moves,context,engine_eval,engine_best_line,engine_best_alternative
"This may conflict with what Steinitz himself taught about the development of pieces; no matter! Steinitz is determined to refute this gambit and if he cannont do it with normal moves, he means to do it with abnormal ones",True," The comment suggests a potential misunderstanding of the move’s strategic implications, indicating a flawed assessment of the situation.",1. e4 e5 2. f4 exf4 3. Bc4 Ne7 4. Qh5 Ng6 5. Nc3 Qe7,This is a game between Janowsky (as White) and Steinitz (as Black). Last move played: Black plays Queen to e7,Advantage for White (eval: 66 centipawns),6. d4 d5 ,5... Qh4+ 6. Qxh4 
"Forced, but quite typical of Steinitz, who often withdrew pieces to the back rank",True," The comment suggests a potential tactical weakness, indicating a move that might have been overly passive.",1. e4 e5 2. f4 exf4 3. Bc4 Ne7 4. Qh5 Ng6 5. Nc3 Qe7 6. d4 Nc6 7. Nf3 Qb4 8. Qd5 Nd8,This is a game between Janowsky (as White) and Steinitz (as Black). Last move played: Black plays Knight to d8,Large advantage for White (eval: 119 centipawns),9. a3 Qe7 ,8... Nd8 
"In order to force simplification, thus reducing White's pressure by playing ... Be6",True," The comment suggests a tactical maneuver to weaken White's position, indicating a flawed strategic assessment.",1. e4 e5 2. f4 exf4 3. Bc4 Ne7 4. Qh5 Ng6 5. Nc3 Qe7 6. d4 Nc6 7. Nf3 Qb4 8. Qd5 Nd8 9. a3 Qe7 10. O-O d6,This is a game between Janowsky (as White) and Steinitz (as Black). Last move played: Black plays Pawn to d6,Large advantage for White (eval: 121 centipawns),11. Qh5 c6 12. Ne2 Qxe4 13. Re1 Be7 14. Bd3 Qd5 15. Bxg6 Qxh5 16. Bxh5 g6 17. Nxf4 gxh5 18. Nxh5 Ne6 19. c4 d5 20. cxd5 cxd5 21. Bd2 Bd7 22. Re3 O-O-O 23. Ree1 Bd6 24. Ne5 Bxe5 25. Rxe5 Nxd4 ,10... d6 
"Black's opening experiment has been refuted; his situation is truly critical, such that many would think of resigning. But in such positions Steinitz's defensive powers bordered on the miraculous",True," The comment suggests a critical position and the player’s defensive capabilities suggest a significant challenge, indicating a mistake.",1. e4 e5 2. f4 exf4 3. Bc4 Ne7 4. Qh5 Ng6 5. Nc3 Qe7 6. d4 Nc6 7. Nf3 Qb4 8. Qd5 Nd8 9. a3 Qe7 10. O-O d6 11. Qh5 c6 12. Bd2 Ne6 13. Rae1 Qc7 14. d5 Nd8 15. e5,This is a game between Janowsky (as White) and Steinitz (as Black). Last move played: White plays Pawn to e5,Large advantage for White (eval: 308 centipawns),15... dxe5 16. Nxe5 Bc5+ 17. Kh1 O-O 18. Bxf4 Bd6 19. Ne4 Nxe5 20. Nxd6 Nxc4 21. Nf5 Qb6 22. Ne7+ Kh8 23. b3 Qc5 24. bxc4 Ne6 25. Bd6 Qxd6 26. Rxf7 cxd5 27. cxd5 Re8 28. dxe6 Bxe6 29. Rxg7 Bg8 30. Qh4 Rad8 31. h3 Rd7 32. Rxg8+ Rxg8 33. Nxg8 Kxg8 34. Re8+ Kf7 35. Qh5+ Kg7 ,15. e5 dxe5 16. Nxe5 Bc5+ 17. Kh1 O-O 18. Bxf4 Bd6 19. dxc6 Nxf4 20. Rxf4 Bxe5 21. Rxe5 Qxc6 22. Bd3 Qh6 23. Qxh6 gxh6 24. Rh5 Kg7 25. Rfh4 Re8 26. Kg1 Re1+ 27. Kf2 Re6 28. Rf4 Nc6 
Now it's becoming clear that Black is taking over the attack,True," The comment suggests a potential shift in the attack, indicating a change in strategy, which is a valid reason for a mistake.",1. e4 e5 2. f4 exf4 3. Bc4 Ne7 4. Qh5 Ng6 5. Nc3 Qe7 6. d4 Nc6 7. Nf3 Qb4 8. Qd5 Nd8 9. a3 Qe7 10. O-O d6 11. Qh5 c6 12. Bd2 Ne6 13. Rae1 Qc7 14. d5 Nd8 15. e5 dxe5 16. Nxe5 Bc5+ 17. Kh1 O-O 18. dxc6 Be3 19. Nf3 Bxd2 20. Ng5 h6 21. Qxg6 hxg5 22. Nd5 Qxc6 23. Ne7+ Kh8 24. Qxg5 Qh6 25. Qc5 Ne6 26. Bxe6 Bxe6 27. Re5 Be3 28. Qb5 g6,This is a game between Janowsky (as White) and Steinitz (as Black). Last move played: Black plays Pawn to g6,Large advantage for Black (eval: -328 centipawns),29. Nxg6+ Qxg6 30. Rh5+ Kg7 31. Rg5 Rad8 32. Qe5+ Kh6 33. Rxg6+ Kxg6 34. h3 Rd5 35. Qe4+ Kg7 36. c4 Rg5 37. Rxf4 Bxf4 38. Qxf4 f6 39. Kh2 Rb5 ,28... Bg4 29. Qxb7 Rad8 30. Qb4 Rfe8 31. Qe4 Rxe7 32. Rxe7 Be6 33. Qc6 Kh7 34. Re8 Rxe8 35. Qxe8 Qh5 36. Re1 Qh4 37. Rf1 f3 38. Qc6 fxg2+ 39. Qxg2 Bh6 40. Kg1 
If the Queen moves away then 33. ... Bxh3! wins,True," The comment provides a specific tactical threat, suggesting a misjudgment of the Queen's vulnerability.",1. e4 e5 2. f4 exf4 3. Bc4 Ne7 4. Qh5 Ng6 5. Nc3 Qe7 6. d4 Nc6 7. Nf3 Qb4 8. Qd5 Nd8 9. a3 Qe7 10. O-O d6 11. Qh5 c6 12. Bd2 Ne6 13. Rae1 Qc7 14. d5 Nd8 15. e5 dxe5 16. Nxe5 Bc5+ 17. Kh1 O-O 18. dxc6 Be3 19. Nf3 Bxd2 20. Ng5 h6 21. Qxg6 hxg5 22. Nd5 Qxc6 23. Ne7+ Kh8 24. Qxg5 Qh6 25. Qc5 Ne6 26. Bxe6 Bxe6 27. Re5 Be3 28. Qb5 g6 29. Qxb7 Kg7 30. Qf3 Rad8 31. h3 Qh4 32. Nc6 Bg4,This is a game between Janowsky (as White) and Steinitz (as Black). Last move played: Black plays Bishop to g4,Large advantage for Black (eval: -497 centipawns),33. Rxe3 Bxf3 34. Rexf3 g5 35. Nxd8 Rxd8 36. b4 Qh6 37. c4 Qa6 38. c5 Rd2 39. Kg1 Qe2 40. R1f2 Qe1+ 41. Rf1 Qe4 42. R1f2 Rxf2 43. Kxf2 Qd4+ 44. Kf1 Kf8 45. c6 Qc4+ 46. Kf2 Qxc6 47. h4 Qc2+ 48. Kg1 f6 49. hxg5 fxg5 ,32... Rde8 33. Rxe3 fxe3 34. Qxe3 Bd5 35. Qd4+ Qxd4 36. Nxd4 Kg8 37. Rf6 Bb7 38. Kh2 Rd8 39. Nc6 Rd7 40. h4 Rc7 41. Ne5 Re8 42. Ng4 
