comment,good,reasoning,moves,context,reformulated
"First, I have to say this fellow's name is rather appropriate for chess. It looks to me like it would be prounced ""pawn-ovich"". But, of course, we also know pawns don't win games as much as pieces.",True,"
This comment explains the mistake made by the player by pointing out that a pawn's move appears to be a poor choice, as pawns alone do not typically win games, suggesting that the move was not strategically sound.",1. e4 c5,"This is a game between Polgar, Judit (as White) and Paunovic, D. (as Black). Last move played: Black plays Pawn to c5"," Black's last move to play a pawn to c5 is not particularly strong. It might seem like an attempt to challenge White's central control, but it's not a decisive strategy. Pairing strategies often involve pawns, but pawns alone seldom win games; it's the more important pieces that deliver victory."
now threatening e4-e5,False,"

The comment does not explain the mistake made by the player, as it merely states a potential threat without addressing the fact that the move was a mistake.",1. e4 c5 2. Nf3 e6 3. d4 cxd4 4. Nxd4 a6 5. Bd3 Nf6 6. O-O,"This is a game between Polgar, Judit (as White) and Paunovic, D. (as Black). Last move played: White plays kingside castle",-
"Again, as in several other games of this tournament, Polgar uses another pawn to restrain her opponent's pieces. This one is recognized as fully appropriate for this position. I'd probably play the same. Black usually challenges Nd4 before this and that fact changes the course of the game to make c2-c4 impossible.",True,"

The comment correctly identifies Polgar's use of a pawn to restrain her opponent's pieces as a strategic move in her gameplay, indicating a mistake in the move that should have been played.",1. e4 c5 2. Nf3 e6 3. d4 cxd4 4. Nxd4 a6 5. Bd3 Nf6 6. O-O d6 7. c4,"This is a game between Polgar, Judit (as White) and Paunovic, D. (as Black). Last move played: White plays Pawn to c4"," ""Again, White, Judit Polgar, attempts to control the board with another pawn. This move, though strategically sound, might be overly cautious. Black, D. Paunovic, often seizes opportunities to challenge Nd4, and this aggressive play can limit the effectiveness of c2-c4. Thus, considering Black's typical behavior, such a cautious approach by White could lead to missed tactical chances."""
"What is White's plan? Often it's to play a ""normal"" way and to let Pc4 participate incidentally. The costs of having Pc4 is that it's impossible to pressure Pa6 with the Bd3 and Qd1-e2 and Bd3 is undefended.",True,"

The comment does explain the mistake made by the player as it highlights the inefficiency of the piece placement and the lack of pressure on the opponent's piece.",1. e4 c5 2. Nf3 e6 3. d4 cxd4 4. Nxd4 a6 5. Bd3 Nf6 6. O-O d6 7. c4 b6 8. Nc3 Bb7,"This is a game between Polgar, Judit (as White) and Paunovic, D. (as Black). Last move played: Black plays Bishop to b7"," What is White's strategy? Usually, it involves advancing Pc4 ordinarily, which unintentionally involves a trade-off. The consequence of this is that it becomes challenging to exert pressure on Pa6 with Bd3 and Qd1-e2, and Bd3 is left weakly defended."
"The more blocked d-file makes pressure on Pd6 less significant, but weakening f6 has to be dangerous.",True,"

The comment correctly identifies the double threat created by the move, which forces the opponent to choose between defending the weakened f6 pawn or the pressure on the d-file.",1. e4 c5 2. Nf3 e6 3. d4 cxd4 4. Nxd4 a6 5. Bd3 Nf6 6. O-O d6 7. c4 b6 8. Nc3 Bb7 9. f4 g6,"This is a game between Polgar, Judit (as White) and Paunovic, D. (as Black). Last move played: Black plays Pawn to g6"," White's move doesn't increase pressure on Black's pawn at d6, but it weakens their pawn at f6 significantly."
"to defend Bd3, probably Nd4 and minimally to restrain Pd6 and Qd8",False,"

The comment does not explain the mistake made by the player as it seems to suggest a potential continuation of the game rather than addressing the error in the previous move.",1. e4 c5 2. Nf3 e6 3. d4 cxd4 4. Nxd4 a6 5. Bd3 Nf6 6. O-O d6 7. c4 b6 8. Nc3 Bb7 9. f4 g6 10. Be3 Bg7 11. Qf3 O-O 12. Rad1,"This is a game between Polgar, Judit (as White) and Paunovic, D. (as Black). Last move played: White plays Rook to d1",-
"This is a well-placed piece to limit White's options. If Pf4 advances then ...Nd7-e5 is terrific. However, if White can create a second threat to go along with f4-f5 then White can still make progress. If White does nothing immediate then Black might consider ...Nd7-c5 to pressure Pe4, but he has to be cognizant of the fact White might use b2-b4 at any moment to chase Nc5 away; so, timing is important. To that end people have often played ...Ra8-c8, ...Qd8-c7-b8-a8 to add more pressure to Pe4. The danger of that is to find Qa8 too far from the king-side to assist in any defensive measures.",True,"

The comment provides a clear explanation of the potential consequences and strategic implications of the move played, considering both Black's and White's possible responses.",1. e4 c5 2. Nf3 e6 3. d4 cxd4 4. Nxd4 a6 5. Bd3 Nf6 6. O-O d6 7. c4 b6 8. Nc3 Bb7 9. f4 g6 10. Be3 Bg7 11. Qf3 O-O 12. Rad1 Nbd7,"This is a game between Polgar, Judit (as White) and Paunovic, D. (as Black). Last move played: Black plays Knight to d7"," Black's knight move to d7 solidifies their position but limits their play. Advancing pawn to f4 could open up for...Nd7-e5, a strong move, yet White has counterplay with f4-f5. White's inaction might tempt Black with...Nd7-c5 to pressure White's pawn on e4, but Black must wait for the right moment to avoid White's potential b2-b4 to chase Nc5 away. While moving the rook to a8 and queen to c7-b8 applies pressure on e4, it also risks being out of position for defensive play."
"I'm not certain where she thinks the bishop will be better placed, but it's difficult to marshall the forces better before making a committing move such as f4-f5.",True,"

The comment explains the mistake, highlighting a lack of coordination in the player's position and a premature aggressive move (f4-f5) without adequate preparation.",1. e4 c5 2. Nf3 e6 3. d4 cxd4 4. Nxd4 a6 5. Bd3 Nf6 6. O-O d6 7. c4 b6 8. Nc3 Bb7 9. f4 g6 10. Be3 Bg7 11. Qf3 O-O 12. Rad1 Nbd7 13. Bf2,"This is a game between Polgar, Judit (as White) and Paunovic, D. (as Black). Last move played: White plays Bishop to f2"," Judit Polgar moved her bishop to f2, which could limit her piece's mobility and doesn't contribute to controlling the center or supporting future developments effectively."
"This probably indicates she wants to move Bf2, but doesn't want to retreat Nd4-e2 where it would block Re1 from defending Pe4. This indicates the difficulty of trying to maintain a static position, rather than carrying out a dynamic plan leading to some positive action. And, after all, what is Nb3 doing? It might have participated in king-side play, but it doesn't seem likely now. Also, without Nd4 the dark-square diagonal is weaker and Bg7 better.",True,"

The comment explains the mistake made by highlighting the player's possible intentions with the move Bf2, the consequences of not retreating Nd4-e2, the weaknesses in the dark-square diagonal, and the effectiveness of Bg7.",1. e4 c5 2. Nf3 e6 3. d4 cxd4 4. Nxd4 a6 5. Bd3 Nf6 6. O-O d6 7. c4 b6 8. Nc3 Bb7 9. f4 g6 10. Be3 Bg7 11. Qf3 O-O 12. Rad1 Nbd7 13. Bf2 Qc7 14. Rfe1 Rfe8 15. Nb3,"This is a game between Polgar, Judit (as White) and Paunovic, D. (as Black). Last move played: White plays Knight to b3"," White's last move, Knight to b3, seems to reflect an attempt to transition to a more static position with Bf2. However, the necessity to retreat Nd4-e2 is evident as it would block Re1's defense of Pe4, highlighting the challenges of maintaining a static setup. This move also exposes the weakness on the dark-square diagonal, suggesting that Bg7 should ideally remain on the board."
"Black controls more central squares and probably plans ...Nf6-d7, where it's more centrally located and can move to e5 or f8 and it controls e5.",True,"

The comment accurately describes Black's potential plan after the mistake, indicating a better control of central squares and flexibility for the knight.",1. e4 c5 2. Nf3 e6 3. d4 cxd4 4. Nxd4 a6 5. Bd3 Nf6 6. O-O d6 7. c4 b6 8. Nc3 Bb7 9. f4 g6 10. Be3 Bg7 11. Qf3 O-O 12. Rad1 Nbd7 13. Bf2 Qc7 14. Rfe1 Rfe8 15. Nb3 Nc5 16. Nxc5 bxc5,"This is a game between Polgar, Judit (as White) and Paunovic, D. (as Black). Last move played: Black plays Pawn takes on c5"," Black's last move doesn't strategically improve their position. By advancing their pawn to c5, they fail to control any central squares effectively. The suggested move...Nf6-d7 doesn't provide Black with a better central presence, as the knight would still be on the edge of their influence, unable to reach key central squares such as e5 or f8. The move also misses the opportunity to control crucial squares directly."
"opening the b-file and possibly preparing ...Re8-d8, ...Qc7-b7 to continue pressuring Pe4",True,"

The comment explains the mistake as it outlines the potential consequences of opening the b-file early in the game and suggests further aggressive moves to capitalize on the weakened position.",1. e4 c5 2. Nf3 e6 3. d4 cxd4 4. Nxd4 a6 5. Bd3 Nf6 6. O-O d6 7. c4 b6 8. Nc3 Bb7 9. f4 g6 10. Be3 Bg7 11. Qf3 O-O 12. Rad1 Nbd7 13. Bf2 Qc7 14. Rfe1 Rfe8 15. Nb3 Nc5 16. Nxc5 bxc5 17. Bc2 Bc6,"This is a game between Polgar, Judit (as White) and Paunovic, D. (as Black). Last move played: Black plays Bishop to c6"," Black's last move, Bishop to c6, did not enhance their position. They could have better utilized the b-file, perhaps by advancing their rook to b8, aiming for...Re8-d8, and...Qc7-b7 to increase the pressure on White's pawn on e4."
"threatening ...Nxf2 and trying to divert Qf3, so he can capture Nc3 to ""own"" the diagonal and, in particular, d4. It's hard to criticize this move because it is done with good intentions, but Polgar's reply does make it appear to be a mistake. It's just terribly unobvious.",True,"
The comment provides a clear explanation of the mistake by pointing out the unintended consequences of the move, such as weakening the king's position and neglecting more pressing threats.",1. e4 c5 2. Nf3 e6 3. d4 cxd4 4. Nxd4 a6 5. Bd3 Nf6 6. O-O d6 7. c4 b6 8. Nc3 Bb7 9. f4 g6 10. Be3 Bg7 11. Qf3 O-O 12. Rad1 Nbd7 13. Bf2 Qc7 14. Rfe1 Rfe8 15. Nb3 Nc5 16. Nxc5 bxc5 17. Bc2 Bc6 18. Ba4 Rab8 19. b3 Ng4,"This is a game between Polgar, Judit (as White) and Paunovic, D. (as Black). Last move played: Black plays Knight to g4"," ""They're attempting to create a threat with...Nxf2 and potentially mislead with Qf3. However, their move seems to miss the mark, as it doesn't effectively 'own' the c3-d4 diagonal. The move feels somewhat obscure in its intention, making it questionable despite good intentions."""
"This move might be a mistake except for the fact that in the endgame it's alright to trade the king-side pawns for Black's queen-side pawns. The better-formed queen-side pawns, if unblocked, are better. It's a curious thing also that there are times when a rook and knight work better together than a rook and bishop, so Black's Bg7 might be valued highly at the moment, but only a few moves from now the knight could be better!",True,"

The comment explains the mistake because it acknowledges that the trade of pawns could be reasonable in the endgame but highlights a potential future strategy where the knight could be more advantageous, thus providing a thoughtful analysis of the position.",1. e4 c5 2. Nf3 e6 3. d4 cxd4 4. Nxd4 a6 5. Bd3 Nf6 6. O-O d6 7. c4 b6 8. Nc3 Bb7 9. f4 g6 10. Be3 Bg7 11. Qf3 O-O 12. Rad1 Nbd7 13. Bf2 Qc7 14. Rfe1 Rfe8 15. Nb3 Nc5 16. Nxc5 bxc5 17. Bc2 Bc6 18. Ba4 Rab8 19. b3 Ng4 20. Bxc6 Qxc6 21. e5,"This is a game between Polgar, Judit (as White) and Paunovic, D. (as Black). Last move played: White plays Pawn to e5"," Polgar, Judit (as White), played Pawn to e5. This move isn't ideal as it might lead to an unnecessary trade of pawns on the king-side. White's position would benefit from retaining pawns on the queen-side to maintain pawn structure and control. A better-formed queen-side pawn structure, once unblocked, can offer White a strategic advantage."
Which pawn was more important Pf4 or Pa6?,True,"

The comment explains the mistake as it suggests that the player may have misplaced a pawn, losing a pawn without a clear strategic reason.",1. e4 c5 2. Nf3 e6 3. d4 cxd4 4. Nxd4 a6 5. Bd3 Nf6 6. O-O d6 7. c4 b6 8. Nc3 Bb7 9. f4 g6 10. Be3 Bg7 11. Qf3 O-O 12. Rad1 Nbd7 13. Bf2 Qc7 14. Rfe1 Rfe8 15. Nb3 Nc5 16. Nxc5 bxc5 17. Bc2 Bc6 18. Ba4 Rab8 19. b3 Ng4 20. Bxc6 Qxc6 21. e5 Qxf3 22. gxf3 Nxf2 23. Kxf2 Red8 24. Ne4 dxe5 25. Nxc5 exf4,"This is a game between Polgar, Judit (as White) and Paunovic, D. (as Black). Last move played: Black plays Pawn takes on f4"," The move Pawn takes on f4 by Black (D. Paunovic) wasn't strategically sound. This action weakens their position, potentially leaving them vulnerable to attacks."
"a very awkward place for a rook. It's hard to say whether this gives up the win or if it's still there. Anyway, it costs a pawn and that makes it tougher to win.",True,"

The comment effectively explains the mistake, as it highlights the rook being in an awkward position and the pawn loss, which complicates the winning process.",1. e4 c5 2. Nf3 e6 3. d4 cxd4 4. Nxd4 a6 5. Bd3 Nf6 6. O-O d6 7. c4 b6 8. Nc3 Bb7 9. f4 g6 10. Be3 Bg7 11. Qf3 O-O 12. Rad1 Nbd7 13. Bf2 Qc7 14. Rfe1 Rfe8 15. Nb3 Nc5 16. Nxc5 bxc5 17. Bc2 Bc6 18. Ba4 Rab8 19. b3 Ng4 20. Bxc6 Qxc6 21. e5 Qxf3 22. gxf3 Nxf2 23. Kxf2 Red8 24. Ne4 dxe5 25. Nxc5 exf4 26. Nxa6 Ra8 27. Rxd8+ Rxd8 28. b4 Rd3 29. Re4,"This is a game between Polgar, Judit (as White) and Paunovic, D. (as Black). Last move played: White plays Rook to e4"," They should carefully consider their next move. Placing the rook on e4 may not be the best strategic choice, as it risks weakening their position and potentially giving Black a chance to counterattack."
This time she's aiming to get behind Pc5.,True,"

The comment explains the mistake because it indicates that the player has positioned a piece strategically to create a vulnerability in the opponent's pawn structure on the c5 square.",1. e4 c5 2. Nf3 e6 3. d4 cxd4 4. Nxd4 a6 5. Bd3 Nf6 6. O-O d6 7. c4 b6 8. Nc3 Bb7 9. f4 g6 10. Be3 Bg7 11. Qf3 O-O 12. Rad1 Nbd7 13. Bf2 Qc7 14. Rfe1 Rfe8 15. Nb3 Nc5 16. Nxc5 bxc5 17. Bc2 Bc6 18. Ba4 Rab8 19. b3 Ng4 20. Bxc6 Qxc6 21. e5 Qxf3 22. gxf3 Nxf2 23. Kxf2 Red8 24. Ne4 dxe5 25. Nxc5 exf4 26. Nxa6 Ra8 27. Rxd8+ Rxd8 28. b4 Rd3 29. Re4 Ra3 30. b5 Rxa2+ 31. Ke1 Bc3+ 32. Kd1 Rb2 33. Re2 Rb3 34. Kc2 Ra3 35. c5 Ba5 36. Re4,"This is a game between Polgar, Judit (as White) and Paunovic, D. (as Black). Last move played: White plays Rook to e4", This move doesn't provide a strong position; it may lead to vulnerability in the formation.
The pawns were unstoppable and Polgar was aiming for this when she played 21. e4-e5!,True,"

The comment explains the mistake made by the player, as it highlights the aggressive intent behind the move and suggests that the pawns were positioned for an attack, which was not effectively executed.",1. e4 c5 2. Nf3 e6 3. d4 cxd4 4. Nxd4 a6 5. Bd3 Nf6 6. O-O d6 7. c4 b6 8. Nc3 Bb7 9. f4 g6 10. Be3 Bg7 11. Qf3 O-O 12. Rad1 Nbd7 13. Bf2 Qc7 14. Rfe1 Rfe8 15. Nb3 Nc5 16. Nxc5 bxc5 17. Bc2 Bc6 18. Ba4 Rab8 19. b3 Ng4 20. Bxc6 Qxc6 21. e5 Qxf3 22. gxf3 Nxf2 23. Kxf2 Red8 24. Ne4 dxe5 25. Nxc5 exf4 26. Nxa6 Ra8 27. Rxd8+ Rxd8 28. b4 Rd3 29. Re4 Ra3 30. b5 Rxa2+ 31. Ke1 Bc3+ 32. Kd1 Rb2 33. Re2 Rb3 34. Kc2 Ra3 35. c5 Ba5 36. Re4 Rc3+ 37. Kb2 Rxf3 38. b6 Rf2+ 39. Ka3 Rf1 40. b7 Rb1 41. Rb4 Rxb4 42. Nxb4 Bc7 43. Na6 Be5 44. c6,"This is a game between Polgar, Judit (as White) and Paunovic, D. (as Black). Last move played: White plays Pawn to c6"," Polgar's pawn advance to e5 was a risky maneuver, potentially opening up weaknesses in the position."
