comment,good,reasoning,moves,context,engine_eval,engine_best_line,engine_best_alternative
"Theoretically this is Ponomariov's best chance to win and get back into the race for first. But, in practice Vallejo Pons has proven tough to beat.",True," The comment suggests a potential strategic opportunity but highlights a difficult opponent, indicating a flawed strategic assessment.",1. e4,"This is a game between Ponomariov, Ruslan (as White) and Vallejo Pons, Francisco (as Black). Last move played: White plays Pawn to e4",Slight advantage for White (eval: 33 centipawns),1... e5 2. Nf3 Nc6 3. d4 exd4 4. Nxd4 Bc5 5. Nb3 Bb6 6. a4 Qh4 7. Qf3 a5 8. g3 Qf6 9. Qe2 Nge7 10. Nc3 ,1. e4 e5 
"Finally, someone chooses not to play c2-c4. However, 5. Bd3 is considered better by most people. Nc3 is a waiting target for ...b7-b5 or might be pinned by ...Bf8-b4. Black usually plays strongly on the dark squares, as in many Sicilian Defense variations, with White defending Nd4 & Nc3 and trying to find a way to open lines to Ke8 or make something of the half open d-file.",True," The comment offers a reasoned explanation for the mistake, suggesting a strategic alternative to the initial move.",1. e4 c5 2. Nf3 e6 3. d4 cxd4 4. Nxd4 a6 5. Nc3,"This is a game between Ponomariov, Ruslan (as White) and Vallejo Pons, Francisco (as Black). Last move played: White plays Knight to c3",Slight advantage for White (eval: 35 centipawns),5... b5 ,5. Bd3 Bc5 
Taking aim at Pe4 isn't going to succeed the way it would in many other variations. Here White has taken extra precaution to keep Pe4 safe and left Nd4 a little weaker. Black should adjust his play in recognition of this.,True," The comment suggests a potential strategic flaw based on a defensive approach, indicating a misjudgment of the move’s impact.",1. e4 c5 2. Nf3 e6 3. d4 cxd4 4. Nxd4 a6 5. Nc3 b5 6. Bd3 Bb7,"This is a game between Ponomariov, Ruslan (as White) and Vallejo Pons, Francisco (as Black). Last move played: Black plays Bishop to b7",Slight advantage for White (eval: 41 centipawns),7. O-O Nc6 8. Nxc6 Bxc6 9. Re1 Bc5 10. Qh5 Bd4 11. Ne2 Bb6 12. c3 Ne7 13. Bf4 Ng6 14. Bd6 Bc7 15. Bxc7 Qxc7 16. Nd4 Qe5 ,6... Bb7 
preparing Nc3-d5. This is a common tactic in a variation where Black hasn't quickly developed Ng8 and Bf8 to enable ...O-O. Ke8 is definately a target!,True," The comment identifies a potential tactical weakness stemming from a lack of development, suggesting a flawed strategic plan.",1. e4 c5 2. Nf3 e6 3. d4 cxd4 4. Nxd4 a6 5. Nc3 b5 6. Bd3 Bb7 7. O-O Nc6 8. Nxc6 Bxc6 9. Qe2,"This is a game between Ponomariov, Ruslan (as White) and Vallejo Pons, Francisco (as Black). Last move played: White plays Queen to e2",Slight advantage for White (eval: 31 centipawns),9... Be7 ,9. Re1 Ne7 10. Bf1 Ng6 11. Be3 Rb8 12. a4 Be7 13. axb5 axb5 14. Nd5 O-O 15. Nxe7+ Qxe7 16. Ba7 Rb7 17. c3 d6 18. Bd4 
Now he's combining both tactics (pressure on Pb4 and Nc3-d5) which might have the effect of overwhelming Black.,True, The comment suggests a potential strategic error stemming from overly aggressive tactical combinations.,1. e4 c5 2. Nf3 e6 3. d4 cxd4 4. Nxd4 a6 5. Nc3 b5 6. Bd3 Bb7 7. O-O Nc6 8. Nxc6 Bxc6 9. Qe2 Ne7 10. Bd2 Ng6 11. a4 b4 12. Nd5,"This is a game between Ponomariov, Ruslan (as White) and Vallejo Pons, Francisco (as Black). Last move played: White plays Knight to d5",Slight advantage for White (eval: 46 centipawns),12... a5 13. c3 ,12. Nd5 
"He's preparing Nd5-e3 and disallowing ...Ng6-f4. It's not terribly pretty, but Nd5 will have to move eventually.",True," The comment suggests a potential future development plan, indicating a flawed move.",1. e4 c5 2. Nf3 e6 3. d4 cxd4 4. Nxd4 a6 5. Nc3 b5 6. Bd3 Bb7 7. O-O Nc6 8. Nxc6 Bxc6 9. Qe2 Ne7 10. Bd2 Ng6 11. a4 b4 12. Nd5 a5 13. c3 b3 14. g3,"This is a game between Ponomariov, Ruslan (as White) and Vallejo Pons, Francisco (as Black). Last move played: White plays Pawn to g3",Slight advantage for White (eval: 22 centipawns),14... Bd6 15. Ne3 ,14. Rfd1 
"For a position which has arisen from a Sicilian Defense this is very odd. The queen-side pawn formation is quite unusual and White's bishops on the d-file and Pg3 are peculiar. White should try to play on the d-file and perhaps try to win Pb3. He shouldn't allow Black to open the f-file with ...f7-f5. That would make Bc6 too good. So, Bd3-b5 to trade bishops might be useful. But, Pe4 needs defense, so Ne3 must move first.",True," The comment offers specific suggestions for improvement, indicating a misunderstanding of the position's characteristics and potential tactical threats.",1. e4 c5 2. Nf3 e6 3. d4 cxd4 4. Nxd4 a6 5. Nc3 b5 6. Bd3 Bb7 7. O-O Nc6 8. Nxc6 Bxc6 9. Qe2 Ne7 10. Bd2 Ng6 11. a4 b4 12. Nd5 a5 13. c3 b3 14. g3 Bd6 15. Ne3 O-O,"This is a game between Ponomariov, Ruslan (as White) and Vallejo Pons, Francisco (as Black). Last move played: Black plays kingside castle",Slight advantage for White (eval: 29 centipawns),16. Nc4 Bc5 17. Be3 Bxe3 18. Qxe3 d5 19. exd5 exd5 20. Nd2 Re8 21. Qd4 Nf8 22. Nxb3 Ne6 23. Qg4 Rb8 24. Nd4 Bd7 25. Nxe6 Bxe6 26. Qd4 Rxb2 27. Rfb1 Rxb1+ 28. Rxb1 Qc7 29. Bf1 Rc8 30. Rb5 Qxc3 31. Qxc3 Rxc3 32. Rb8+ Bc8 ,15... Bc5 16. Bb5 Rc8 17. Nc4 O-O 18. Bxc6 Rxc6 19. Be3 Qc7 20. Rad1 Bxe3 21. Nxe3 Ne5 22. Rd4 d6 23. Kg2 Qb7 24. f4 Nd7 25. f5 Ne5 26. fxe6 fxe6 27. Rxf8+ Kxf8 
"Black tries to activate pieces in a desperate attempt to threaten Kg1, as compensation for the lost pawn.",True, The comment suggests a potential tactical blunder stemming from over-commitment.,1. e4 c5 2. Nf3 e6 3. d4 cxd4 4. Nxd4 a6 5. Nc3 b5 6. Bd3 Bb7 7. O-O Nc6 8. Nxc6 Bxc6 9. Qe2 Ne7 10. Bd2 Ng6 11. a4 b4 12. Nd5 a5 13. c3 b3 14. g3 Bd6 15. Ne3 O-O 16. Nc4 Bc5 17. Be3 Qe7 18. Nd2 Ne5 19. Bxc5 Qxc5 20. Nxb3 Qd6 21. Bb5 f5,"This is a game between Ponomariov, Ruslan (as White) and Vallejo Pons, Francisco (as Black). Last move played: Black plays Pawn to f5",Large advantage for White (eval: 188 centipawns),22. f4 Bxb5 23. axb5 Ng6 24. exf5 Rxf5 25. c4 Raf8 26. Qd2 Qc7 27. c5 Ne7 28. Qxa5 Qb7 29. b6 Qc6 30. Qc3 g5 31. Nd4 Qxc5 32. Qxc5 Rxc5 ,21... Bxb5 
"Sometimes it's just that simple. White keeps the f-file closed, gets rid of Bc6 and consolidates all his advantages while letting Black have none.",True," Yes, the comment highlights a strategic error – neglecting to develop pieces and weakening the position – which is a common mistake in chess.",1. e4 c5 2. Nf3 e6 3. d4 cxd4 4. Nxd4 a6 5. Nc3 b5 6. Bd3 Bb7 7. O-O Nc6 8. Nxc6 Bxc6 9. Qe2 Ne7 10. Bd2 Ng6 11. a4 b4 12. Nd5 a5 13. c3 b3 14. g3 Bd6 15. Ne3 O-O 16. Nc4 Bc5 17. Be3 Qe7 18. Nd2 Ne5 19. Bxc5 Qxc5 20. Nxb3 Qd6 21. Bb5 f5 22. f4 Ng4 23. e5 Qd5 24. Bxc6,"This is a game between Ponomariov, Ruslan (as White) and Vallejo Pons, Francisco (as Black). Last move played: White plays Bishop takes on c6",Large advantage for White (eval: 186 centipawns),24... Qxc6 ,24. Bxc6 Qxc6 25. Nd4 Qc5 26. h3 Nh6 27. Kh2 Nf7 28. Rad1 g5 29. Nb5 Qe7 30. Rd3 Rad8 31. Qd2 Kh8 32. b4 Rg8 33. Nd6 Nxd6 34. exd6 Qf6 35. fxg5 Rxg5 36. b5 Rc8 
"Black has absolutely no offense, but he does have a weak Pe6 and trapped Qb3. White threatens Ra1-a3xb3. This looked as easy as Ivanchuk's victory and is more to be expected than the struggle Kasparov had to endure before gaining the full point against Vallejo Pons. It also puts Ponomariov right back into a tie for first with Kasparov. This sets up the climactic struggle between those two in the next round -- winner take all!",True," The comment offers a subjective assessment of the move's quality, highlighting a weakness and potential strategic implications, suggesting a flawed evaluation.",1. e4 c5 2. Nf3 e6 3. d4 cxd4 4. Nxd4 a6 5. Nc3 b5 6. Bd3 Bb7 7. O-O Nc6 8. Nxc6 Bxc6 9. Qe2 Ne7 10. Bd2 Ng6 11. a4 b4 12. Nd5 a5 13. c3 b3 14. g3 Bd6 15. Ne3 O-O 16. Nc4 Bc5 17. Be3 Qe7 18. Nd2 Ne5 19. Bxc5 Qxc5 20. Nxb3 Qd6 21. Bb5 f5 22. f4 Ng4 23. e5 Qd5 24. Bxc6 dxc6 25. Nd4 c5 26. Nb5 Rad8 27. h3 Nh6 28. Rfd1 Qb3 29. Rd6,"This is a game between Ponomariov, Ruslan (as White) and Vallejo Pons, Francisco (as Black). Last move played: White plays Rook to d6",Large advantage for White (eval: 352 centipawns),29... Rxd6 30. exd6 Nf7 31. Ra3 Qd5 32. c4 Qe4 33. Re3 Qb1+ 34. Kg2 g5 35. Rxe6 gxf4 36. Re7 f3+ 37. Qxf3 Qxb2+ 38. Re2 Qc1 39. Qd5 f4 40. d7 f3+ 41. Qxf3 Nd8 42. Qd5+ Kg7 43. Kh2 ,29. Rd6 Rxd6 30. exd6 Nf7 31. Ra3 Qd5 32. c4 Qe4 33. Re3 Qb1+ 34. Kg2 g5 35. Rxe6 gxf4 36. Nc3 Qc1 37. d7 f3+ 38. Kxf3 Qh1+ 39. Ke3 Kg7 
Taking aim at Pe4 isn't going to succeed the way it would in many other variations. Here White has taken extra precaution to keep Pe4 safe and left Nd4 a little weaker. Black should adjust his play in recognition of this.,True, The comment describes a potential threat but doesn't explicitly state why it's a mistake.,1. e4 c5 2. Nf3 e6 3. d4 cxd4 4. Nxd4 a6 5. Nc3 b5 6. Bd3 Bb7,"This is a game between Ponomariov, Ruslan (as White) and Vallejo Pons, Francisco (as Black). Last move played: Black plays Bishop to b7",Slight advantage for White (eval: 41 centipawns),7. O-O Nc6 8. Nxc6 Bxc6 9. Re1 Bc5 10. Qh5 Bd4 11. Ne2 Bb6 12. c3 Ne7 13. Bf4 Ng6 14. Bd6 Bc7 15. Bxc7 Qxc7 16. Nd4 Qe5 ,6... Bb7 
