comment,good,reasoning,moves,context,engine_eval,engine_best_line,engine_best_alternative
The French Defense has the reputation of giving Black a solid yet cramped game. Morphy favored open positions so it comes as no surprise that this is the only example of his defending the French Defense.,True," The comment accurately describes a common criticism of the French Defense, highlighting its tendency to create cramped positions.",1. e4 e6 2. d4 d5,This is a game between McConnell (as White) and Morphy (as Black). Last move played: Black plays Pawn to d5,Slight advantage for White (eval: 48 centipawns),3. Nc3 Nf6 4. e5 Nfd7 5. f4 c5 6. Nf3 Nc6 7. Be3 Be7 8. Qd2 a6 9. a3 O-O 10. h4 b5 11. h5 Bb7 12. h6 g6 13. dxc5 Nxc5 14. Qf2 Nd7 15. Be2 Rc8 16. O-O b4 17. axb4 Nxb4 18. Nd4 ,2... d5 3. Nc3 Nf6 4. Bg5 dxe4 5. Nxe4 Nbd7 6. Nf3 h6 7. Nxf6+ Nxf6 8. Be3 Bd6 9. Bd3 Nd5 10. Bd2 Nf4 11. Bxf4 Bxf4 12. Qe2 Bd7 13. Ne5 Qe7 14. c3 Bxe5 15. Qxe5 
The Advance Variation of the French Defense. White's idea is to play against Black's light squared bishop which is locked out of the game by his own pawns.,True," The comment suggests a logical flaw in the opening choice, potentially hindering White’s development.",1. e4 e6 2. d4 d5 3. e5,This is a game between McConnell (as White) and Morphy (as Black). Last move played: White plays Pawn to e5,Slight advantage for White (eval: 23 centipawns),3... c5 4. c3 Nc6 5. Nf3 Bd7 6. a3 c4 7. Nbd2 Na5 8. Be2 h6 9. Rb1 Ne7 10. h4 a6 11. h5 Qc7 12. O-O Nf5 13. a4 Be7 14. Qc2 b5 ,3. Nc3 Nf6 4. e5 Nfd7 5. f4 c5 6. Nf3 Nc6 7. Be3 Be7 8. Qd2 a6 9. a3 O-O 10. h4 b5 11. h5 Bb7 12. h6 g6 13. dxc5 Nxc5 14. Qf2 Nd7 15. Be2 Rc8 16. O-O b4 17. axb4 Nxb4 18. Nd4 
Black follows the general rule that one should attack a pawn chain at it's base.,True," The comment suggests a potential tactical error related to pawn structure, indicating a misjudgment of the implications of the move.",1. e4 e6 2. d4 d5 3. e5 c5,This is a game between McConnell (as White) and Morphy (as Black). Last move played: Black plays Pawn to c5,Slight advantage for White (eval: 27 centipawns),4. c3 Nc6 ,3... c5 4. c3 Nc6 5. Nf3 Bd7 6. a3 c4 7. Nbd2 Na5 8. Be2 h6 9. Rb1 Ne7 10. h4 a6 11. h5 Qc7 12. O-O Nf5 13. a4 Be7 14. Qc2 b5 
The strengthening of White's pawn chain is the logical response to Black's last move.,True," The comment suggests a potential weakness in White's pawn structure, indicating a flawed strategic assessment.",1. e4 e6 2. d4 d5 3. e5 c5 4. c3,This is a game between McConnell (as White) and Morphy (as Black). Last move played: White plays Pawn to c3,Slight advantage for White (eval: 27 centipawns),4... Nc6 ,4. c3 Nc6 
This move is a mistake as White does not need to broaden his pawn chain especially at the expense of his development. Better was 5.Nf3. 5.Nf3 Qb6 6.Be2 Bd7 7.a3 c4,True," The comment offers a valid critique of the move's strategic implications, suggesting a less aggressive development path.",1. e4 e6 2. d4 d5 3. e5 c5 4. c3 Nc6 5. f4,This is a game between McConnell (as White) and Morphy (as Black). Last move played: White plays Pawn to f4,Slight advantage for Black (eval: -40 centipawns),5... Nh6 6. Nf3 ,5. Nf3 Bd7 6. Be2 Nge7 7. O-O Ng6 8. Be3 Be7 9. Nbd2 O-O 10. g3 cxd4 11. cxd4 f6 12. exf6 gxf6 13. Nb3 b6 14. Bd3 Bd6 15. Bh6 Rf7 
"Although in a closed position one doesn't have to develop as quickly as in an open position. White has crossed the line in only developing one piece in position moves. 7.Bd3 cxd4 8.cxd4 Nxd4 9.Nxd4 Qxd4 We see the importance of Black's 6...Bd7, otherwise White would have a discovered check with",True," The comment offers a potential explanation for the mistake, suggesting Black's development pressure was insufficient.",1. e4 e6 2. d4 d5 3. e5 c5 4. c3 Nc6 5. f4 Qb6 6. Nf3 Bd7 7. a3,This is a game between McConnell (as White) and Morphy (as Black). Last move played: White plays Pawn to a3,Large advantage for Black (eval: -114 centipawns),7... Nh6 8. Bd3 ,7. Na3 cxd4 
Black stands much better due to his large lead in development.,True," The comment suggests a positional weakness, implying the lead is not a strong advantage, which is a key element of a mistake.",1. e4 e6 2. d4 d5 3. e5 c5 4. c3 Nc6 5. f4 Qb6 6. Nf3 Bd7 7. a3 Nh6 8. b4 cxd4 9. cxd4 Rc8,This is a game between McConnell (as White) and Morphy (as Black). Last move played: Black plays Rook to c8,Slight advantage for Black (eval: -42 centipawns),10. Nc3 Nxd4 11. Qxd4 Qxd4 12. Nxd4 Rxc3 13. Bb2 Rc8 14. Bd3 Be7 15. Kd2 f6 16. Nf3 Ba4 17. Bd4 a6 18. Rhc1 Kd7 19. g3 Bb5 20. Rxc8 Rxc8 21. Bxh7 ,9... Nf5 10. Bb2 
This sacrifice is made possible because of Black's lead in development.,False,"

The comment doesn't explain why the move was considered a mistake; it simply attributes the move's success to Black's development.",1. e4 e6 2. d4 d5 3. e5 c5 4. c3 Nc6 5. f4 Qb6 6. Nf3 Bd7 7. a3 Nh6 8. b4 cxd4 9. cxd4 Rc8 10. Bb2 Nf5 11. Qd3 Bxb4+,This is a game between McConnell (as White) and Morphy (as Black). Last move played: Black plays Bishop takes on b4 with check,Large advantage for Black (eval: -218 centipawns),12. Nbd2 Be7 ,11... Bxb4+ 12. Nbd2 Bxd2+ 13. Qxd2 Na5 14. Rb1 Nc4 15. Bxc4 dxc4 16. O-O Bc6 17. g4 Ne7 18. Bc3 Qd8 19. f5 Nd5 20. f6 Rg8 21. h3 h5 22. Ba5 c3 23. Bxc3 Nxc3 24. Qxc3 gxf6 25. exf6 
Very pretty especially since most players would jump at the chance to win White's rook by 13...Nc2+.,True, The comment suggests a potential tactical blunder by attempting to immediately win a rook with a dubious development.,1. e4 e6 2. d4 d5 3. e5 c5 4. c3 Nc6 5. f4 Qb6 6. Nf3 Bd7 7. a3 Nh6 8. b4 cxd4 9. cxd4 Rc8 10. Bb2 Nf5 11. Qd3 Bxb4+ 12. axb4 Nxb4 13. Qd2 Rc2,This is a game between McConnell (as White) and Morphy (as Black). Last move played: Black plays Rook to c2,Large advantage for Black (eval: -430 centipawns),14. Kf2 O-O 15. g4 Nh4 16. Nxh4 Rxb2 17. Nf3 Rxd2+ 18. Nbxd2 f6 19. exf6 gxf6 20. Rg1 e5 21. g5 fxg5 22. Rxg5+ Kh8 23. Kg2 Be8 24. Kh1 e4 25. Ne5 Qxd4 26. Ndc4 Qxa1 ,13... Rc2 14. Na3 Rxd2 15. Kxd2 O-O 16. g4 Ne7 17. Bc3 a5 18. Be2 Ba4 19. Rhb1 Rc8 20. g5 Nf5 21. Bd3 h6 22. Bxf5 exf5 23. g6 fxg6 24. Bxb4 axb4 25. Rc1 Rxc1 
White resigned because his queen has been trapped.,True, The comment directly identifies a critical flaw in the player's strategic decision.,1. e4 e6 2. d4 d5 3. e5 c5 4. c3 Nc6 5. f4 Qb6 6. Nf3 Bd7 7. a3 Nh6 8. b4 cxd4 9. cxd4 Rc8 10. Bb2 Nf5 11. Qd3 Bxb4+ 12. axb4 Nxb4 13. Qd2 Rc2 14. Qd1 Ne3,This is a game between McConnell (as White) and Morphy (as Black). Last move played: Black plays Knight to e3,Large advantage for Black (eval: -570 centipawns),15. Qd2 Rxb2 16. Qxe3 Nc2+ 17. Kf2 Nxe3+ 18. Kxe3 Rxb1 19. Bd3 Rxh1 20. Rxh1 Ke7 21. g4 Rc8 22. Rb1 Qxb1 23. Bxb1 Rc3+ 24. Bd3 h6 25. Kd2 Rc8 26. f5 exf5 ,14... Rxb2 15. Na3 Ne3 16. Qe2 Nbc2+ 17. Nxc2 Nxc2+ 18. Qxc2 Rxc2 19. Be2 Bb5 20. O-O Bxe2 21. Rfb1 Rb2 22. Rxb2 Qxb2 23. Rxa7 Kd7 24. h3 Rc8 25. Kh2 Qb6 26. Ra1 
