comment,good,reasoning,moves,context,engine_eval,engine_best_line,engine_best_alternative
It all centered on Kasparov's stunning Rook sacrifice,True,", The comment highlights a significant tactical error, indicating a poor move choice.",1. e4 d6 2. d4 Nf6 3. Nc3 g6 4. Be3 Bg7 5. Qd2 c6 6. f3 b5 7. Nge2 Nbd7 8. Bh6 Bxh6 9. Qxh6 Bb7 10. a3 e5 11. O-O-O Qe7 12. Kb1 a6 13. Nc1 O-O-O 14. Nb3 exd4 15. Rxd4 c5 16. Rd1 Nb6 17. g3 Kb8 18. Na5 Ba8 19. Bh3 d5 20. Qf4+ Ka7 21. Rhe1 d4 22. Nd5 Nbxd5 23. exd5 Qd6,"This is a game between Kasparov, Garry (as White) and Topalov, Veselin (as Black). Last move played: Black plays Queen to d6",Slight advantage for Black (eval: -31 centipawns),24. Rxd4 Kb6 25. b4 Qxf4 26. Rxf4 Nxd5 27. Rxf7 cxb4 28. axb4 Rhe8 29. Rxe8 Rxe8 30. Nb3 Re1+ 31. Kb2 Re2 32. Rxh7 Nxb4 33. Nd4 Rxh2 34. Rh4 Bd5 35. Be6 Nd3+ 36. Kb1 ,23... Qd6 24. Rxd4 Kb6 25. b4 Qxf4 26. Rxf4 Nxd5 27. Rxf7 cxb4 28. axb4 Rhe8 29. Rxe8 Rxe8 30. Rxh7 Re1+ 31. Kb2 Nxb4 32. Nb3 Re2 33. Nd4 Rxh2 34. Rh4 Bd5 35. Bf1 Rf2 36. Be2 Nc6 37. Nxc6 Rxe2 38. Nd4 Rf2 39. Rg4 Kc5 40. Kc3 a5 
"that the world champion had planned when he allowed 19...d5. ""It is strange how the mind works,"" Kasparov told the press. ""I was looking for a way to get my Queen from h6 to b6 for the attack, when suddenly I found this tactical idea. It is important that I saw I had at least a perpetual, and intuitively I felt there should be a mate. So I decided to go for the combination."" At this point, howewer, Kasparov noticed that Black didn't have to take the Rook at all but could play 24...Kb6 instead. ""After this, I couldn't find any advantage for White, and I could tell that Topalov had seen the move too. But he looked up. Maybe he got a sign from above that he should play a great game. It takes two, you know, to do that."" Whatever Topalov's reasons may have been, he did in fact take the Rook with",True," The comment offers a potential explanation for the mistake, suggesting a tactical calculation and a possible misjudgment of the position.",1. e4 d6 2. d4 Nf6 3. Nc3 g6 4. Be3 Bg7 5. Qd2 c6 6. f3 b5 7. Nge2 Nbd7 8. Bh6 Bxh6 9. Qxh6 Bb7 10. a3 e5 11. O-O-O Qe7 12. Kb1 a6 13. Nc1 O-O-O 14. Nb3 exd4 15. Rxd4 c5 16. Rd1 Nb6 17. g3 Kb8 18. Na5 Ba8 19. Bh3 d5 20. Qf4+ Ka7 21. Rhe1 d4 22. Nd5 Nbxd5 23. exd5 Qd6 24. Rxd4,"This is a game between Kasparov, Garry (as White) and Topalov, Veselin (as Black). Last move played: White plays Rook takes on d4",Slight advantage for Black (eval: -29 centipawns),24... Kb6 25. b4 ,24. Rxd4 Kb6 25. b4 Qxf4 26. Rxf4 Nxd5 27. Rxf7 cxb4 28. axb4 Rhe8 29. Rxe8 Rxe8 30. Nb3 Re1+ 31. Kb2 Re2 32. Rxh7 Nxb4 33. Nd4 Rxh2 34. Rh4 Bd5 35. Be6 Nd3+ 36. Kb1 
"Later, Topalov explained why he had played 24...cxd4 instead of 24...Kb6. ""I had seen everything up to 33.c3!, but somehow I thought I had a saving countercheck in this variation."" There followed:",True," The comment provides a potential explanation for the mistake, suggesting a strategic consideration that was missed.",1. e4 d6 2. d4 Nf6 3. Nc3 g6 4. Be3 Bg7 5. Qd2 c6 6. f3 b5 7. Nge2 Nbd7 8. Bh6 Bxh6 9. Qxh6 Bb7 10. a3 e5 11. O-O-O Qe7 12. Kb1 a6 13. Nc1 O-O-O 14. Nb3 exd4 15. Rxd4 c5 16. Rd1 Nb6 17. g3 Kb8 18. Na5 Ba8 19. Bh3 d5 20. Qf4+ Ka7 21. Rhe1 d4 22. Nd5 Nbxd5 23. exd5 Qd6 24. Rxd4 cxd4,"This is a game between Kasparov, Garry (as White) and Topalov, Veselin (as Black). Last move played: Black plays Pawn takes on d4",Large advantage for White (eval: 273 centipawns),25. Re7+ ,24... Kb6 25. b4 
"""Now here,"" Kasparov said, ""I could have gone for the draw with 29.Qc7, but while Topalov was thinking about 24...exd4, I had already calculated all the lines and seen that I was winning by force. Sometimes it's good to think like a machine."" The game went on with",True," The comment suggests a strategic calculation error, indicating a flawed evaluation of the position.",1. e4 d6 2. d4 Nf6 3. Nc3 g6 4. Be3 Bg7 5. Qd2 c6 6. f3 b5 7. Nge2 Nbd7 8. Bh6 Bxh6 9. Qxh6 Bb7 10. a3 e5 11. O-O-O Qe7 12. Kb1 a6 13. Nc1 O-O-O 14. Nb3 exd4 15. Rxd4 c5 16. Rd1 Nb6 17. g3 Kb8 18. Na5 Ba8 19. Bh3 d5 20. Qf4+ Ka7 21. Rhe1 d4 22. Nd5 Nbxd5 23. exd5 Qd6 24. Rxd4 cxd4 25. Re7+ Kb6 26. Qxd4+ Kxa5 27. b4+ Ka4 28. Qc3 Qxd5,"This is a game between Kasparov, Garry (as White) and Topalov, Veselin (as Black). Last move played: Black plays Queen takes on d5",Advantage for White (eval: 68 centipawns),29. Ra7 Bb7 ,28... Qxd5 
Topalov went for,True,", The comment indicates a potential tactical error, suggesting the move was poorly conceived.",1. e4 d6 2. d4 Nf6 3. Nc3 g6 4. Be3 Bg7 5. Qd2 c6 6. f3 b5 7. Nge2 Nbd7 8. Bh6 Bxh6 9. Qxh6 Bb7 10. a3 e5 11. O-O-O Qe7 12. Kb1 a6 13. Nc1 O-O-O 14. Nb3 exd4 15. Rxd4 c5 16. Rd1 Nb6 17. g3 Kb8 18. Na5 Ba8 19. Bh3 d5 20. Qf4+ Ka7 21. Rhe1 d4 22. Nd5 Nbxd5 23. exd5 Qd6 24. Rxd4 cxd4 25. Re7+ Kb6 26. Qxd4+ Kxa5 27. b4+ Ka4 28. Qc3 Qxd5 29. Ra7 Bb7 30. Rxb7,"This is a game between Kasparov, Garry (as White) and Topalov, Veselin (as Black). Last move played: White plays Rook takes on b7",Advantage for White (eval: 60 centipawns),30... Qc4 ,30. Rxb7 Qc4 
after which Kasparov brilliantly concluded his attack:,True," The comment suggests a potential overreaction, indicating a misjudged tactical element, suggesting a problem with the move.",1. e4 d6 2. d4 Nf6 3. Nc3 g6 4. Be3 Bg7 5. Qd2 c6 6. f3 b5 7. Nge2 Nbd7 8. Bh6 Bxh6 9. Qxh6 Bb7 10. a3 e5 11. O-O-O Qe7 12. Kb1 a6 13. Nc1 O-O-O 14. Nb3 exd4 15. Rxd4 c5 16. Rd1 Nb6 17. g3 Kb8 18. Na5 Ba8 19. Bh3 d5 20. Qf4+ Ka7 21. Rhe1 d4 22. Nd5 Nbxd5 23. exd5 Qd6 24. Rxd4 cxd4 25. Re7+ Kb6 26. Qxd4+ Kxa5 27. b4+ Ka4 28. Qc3 Qxd5 29. Ra7 Bb7 30. Rxb7 Qc4,"This is a game between Kasparov, Garry (as White) and Topalov, Veselin (as Black). Last move played: Black plays Queen to c4",Large advantage for White (eval: 132 centipawns),31. Qxf6 Rd1+ ,30... Qc4 
(forced),True,". The comment suggests a tactical blunder, indicating a poor decision, which is a clear mistake.",1. e4 d6 2. d4 Nf6 3. Nc3 g6 4. Be3 Bg7 5. Qd2 c6 6. f3 b5 7. Nge2 Nbd7 8. Bh6 Bxh6 9. Qxh6 Bb7 10. a3 e5 11. O-O-O Qe7 12. Kb1 a6 13. Nc1 O-O-O 14. Nb3 exd4 15. Rxd4 c5 16. Rd1 Nb6 17. g3 Kb8 18. Na5 Ba8 19. Bh3 d5 20. Qf4+ Ka7 21. Rhe1 d4 22. Nd5 Nbxd5 23. exd5 Qd6 24. Rxd4 cxd4 25. Re7+ Kb6 26. Qxd4+ Kxa5 27. b4+ Ka4 28. Qc3 Qxd5 29. Ra7 Bb7 30. Rxb7 Qc4 31. Qxf6 Kxa3 32. Qxa6+ Kxb4 33. c3+ Kxc3 34. Qa1+ Kd2 35. Qb2+ Kd1 36. Bf1 Rd2 37. Rd7 Rxd7,"This is a game between Kasparov, Garry (as White) and Topalov, Veselin (as Black). Last move played: Black plays Rook takes on d7",Large advantage for White (eval: 297 centipawns),38. Bxc4 bxc4 39. Qxh8 Rb7+ 40. Ka2 Rd7 41. Qc8 Rd2+ 42. Kb1 Ke1 43. Qxc4 Rxh2 44. Qxf7 Kf2 45. g4 Rg2 46. Kc1 h6 47. Kd2 Kg1+ 48. Kd3 g5 49. Qa7+ Kh1 50. Qc5 Rg3 51. Ke4 ,37... Rxd7 38. Bxc4 
and White had no trouble with the ending.,True,". The comment suggests a lack of difficulty, which implies a flaw in White's strategic planning or execution, suggesting a mistake.",1. e4 d6 2. d4 Nf6 3. Nc3 g6 4. Be3 Bg7 5. Qd2 c6 6. f3 b5 7. Nge2 Nbd7 8. Bh6 Bxh6 9. Qxh6 Bb7 10. a3 e5 11. O-O-O Qe7 12. Kb1 a6 13. Nc1 O-O-O 14. Nb3 exd4 15. Rxd4 c5 16. Rd1 Nb6 17. g3 Kb8 18. Na5 Ba8 19. Bh3 d5 20. Qf4+ Ka7 21. Rhe1 d4 22. Nd5 Nbxd5 23. exd5 Qd6 24. Rxd4 cxd4 25. Re7+ Kb6 26. Qxd4+ Kxa5 27. b4+ Ka4 28. Qc3 Qxd5 29. Ra7 Bb7 30. Rxb7 Qc4 31. Qxf6 Kxa3 32. Qxa6+ Kxb4 33. c3+ Kxc3 34. Qa1+ Kd2 35. Qb2+ Kd1 36. Bf1 Rd2 37. Rd7 Rxd7 38. Bxc4 bxc4 39. Qxh8,"This is a game between Kasparov, Garry (as White) and Topalov, Veselin (as Black). Last move played: White plays Queen takes on h8",Large advantage for White (eval: 301 centipawns),39... Rb7+ 40. Ka2 Rd7 41. Qf6 Ke1 42. Qc3+ Kf2 43. Qxc4 Kg1 44. Qc2 f5 45. Kb2 Rf7 46. f4 Rf6 47. Qe2 Rf7 48. g4 fxg4 49. Qxg4+ Kxh2 50. Kc3 Rf5 51. Kc2 h5 52. Qxg6 Rxf4 ,39. Qxh8 Rd3 40. f4 f5 41. Qa1 Rb3+ 42. Ka2+ Kc2 43. Qd4 Rc3 44. g4 fxg4 45. f5 gxf5 46. Qf2+ Kd3 47. Qxf5+ Kd2 48. Qf4+ Kc2 49. Qxg4 h6 50. Qd4 
"that the world champion had planned when he allowed 19...d5. ""It is strange how the mind works,"" Kasparov told the press. ""I was looking for a way to get my Queen from h6 to b6 for the attack, when suddenly I found this tactical idea. It is important that I saw I had at least a perpetual, and intuitively I felt there should be a mate. So I decided to go for the combination."" At this point, howewer, Kasparov noticed that Black didn't have to take the Rook at all but could play 24...Kb6 instead. ""After this, I couldn't find any advantage for White, and I could tell that Topalov had seen the move too. But he looked up. Maybe he got a sign from above that he should play a great game. It takes two, you know, to do that."" Whatever Topalov's reasons may have been, he did in fact take the Rook with",True,", The comment indicates a potential blunder by Black due to the tactical weakness of the move.",1. e4 d6 2. d4 Nf6 3. Nc3 g6 4. Be3 Bg7 5. Qd2 c6 6. f3 b5 7. Nge2 Nbd7 8. Bh6 Bxh6 9. Qxh6 Bb7 10. a3 e5 11. O-O-O Qe7 12. Kb1 a6 13. Nc1 O-O-O 14. Nb3 exd4 15. Rxd4 c5 16. Rd1 Nb6 17. g3 Kb8 18. Na5 Ba8 19. Bh3 d5 20. Qf4+ Ka7 21. Rhe1 d4 22. Nd5 Nbxd5 23. exd5 Qd6 24. Rxd4,"This is a game between Kasparov, Garry (as White) and Topalov, Veselin (as Black). Last move played: White plays Rook takes on d4",Slight advantage for Black (eval: -29 centipawns),24... Kb6 25. b4 ,24. Rxd4 Kb6 25. b4 Qxf4 26. Rxf4 Nxd5 27. Rxf7 cxb4 28. axb4 Rhe8 29. Rxe8 Rxe8 30. Nb3 Re1+ 31. Kb2 Re2 32. Rxh7 Nxb4 33. Nd4 Rxh2 34. Rh4 Bd5 35. Be6 Nd3+ 36. Kb1 
