comment,good,reasoning,moves,context,engine_eval,engine_best_line,engine_best_alternative
By transposition we have reached the King's Indian Defense.,True," The comment suggests a potential tactical blunder, indicating a flawed approach.",1. Nf3 Nf6 2. c4 g6 3. Nc3 Bg7 4. e4 d6 5. d4,This is a game between Kasparov (as White) and Comas (as Black). Last move played: White plays Pawn to d4,Advantage for White (eval: 58 centipawns),5... O-O 6. h3 ,5. d4 O-O 6. h3 e5 7. d5 Nbd7 8. g4 Nc5 9. Qc2 a5 10. Be3 h5 11. Bg5 hxg4 12. hxg4 Bxg4 13. Be2 Qc8 
More commonly seen is 7...Nc6.,True," Yes, this comment indicates a common and often principled opening move that led to a suboptimal position.",1. Nf3 Nf6 2. c4 g6 3. Nc3 Bg7 4. e4 d6 5. d4 O-O 6. Be2 e5 7. O-O Nbd7,This is a game between Kasparov (as White) and Comas (as Black). Last move played: Black plays Knight to d7,Advantage for White (eval: 80 centipawns),8. Be3 ,7... a5 8. Be3 
"Black should take the opportunity to open up the a1-h8 diagonal for his dark squared bishop with 8...exd4 9.Nxd4 Re8, when Black has solved his opening problems.",True," The comment suggests a strategic misstep and a potential weakness in Black's development, indicating a flawed plan.",1. Nf3 Nf6 2. c4 g6 3. Nc3 Bg7 4. e4 d6 5. d4 O-O 6. Be2 e5 7. O-O Nbd7 8. Qc2 c6,This is a game between Kasparov (as White) and Comas (as Black). Last move played: Black plays Pawn to c6,Advantage for White (eval: 97 centipawns),9. d5 ,8... exd4 9. Nxd4 Nc5 10. Be3 Ng4 11. Bxg4 Bxg4 12. f3 Bd7 13. Rad1 a5 14. Qc1 a4 15. Rfe1 c6 16. Nde2 Qa5 17. Bd4 Bxd4+ 18. Nxd4 Be6 
Black's main problem in this position is the inactivity of his pieces.,True," The comment offers a potential explanation for the mistake, suggesting a lack of activity.",1. Nf3 Nf6 2. c4 g6 3. Nc3 Bg7 4. e4 d6 5. d4 O-O 6. Be2 e5 7. O-O Nbd7 8. Qc2 c6 9. Rd1 Re8 10. Rb1 a5 11. d5 cxd5 12. cxd5,This is a game between Kasparov (as White) and Comas (as Black). Last move played: White plays Pawn takes on d5,Large advantage for White (eval: 113 centipawns),12... Qc7 13. Bb5 ,12. cxd5 Qc7 13. Be3 Ng4 14. Bg5 Nc5 15. h3 h6 16. Bd2 Nf6 17. Rdc1 Bd7 18. Be3 Rec8 19. Nd2 a4 20. Qd1 Qd8 21. b4 axb3 22. axb3 Ne8 23. Ra1 Rxa1 24. Rxa1 f5 25. f3 Bf6 26. b4 
Giving Black the two bishops in exchange for a powerful passed pawn.,True," The comment suggests a strategic blunder by sacrificing a passed pawn for a bishop, indicating a flawed tactical assessment.",1. Nf3 Nf6 2. c4 g6 3. Nc3 Bg7 4. e4 d6 5. d4 O-O 6. Be2 e5 7. O-O Nbd7 8. Qc2 c6 9. Rd1 Re8 10. Rb1 a5 11. d5 cxd5 12. cxd5 Nc5 13. Be3 Bd7 14. Bxc5,This is a game between Kasparov (as White) and Comas (as Black). Last move played: White plays Bishop takes on c5,Large advantage for White (eval: 186 centipawns),14... dxc5 15. a4 Bh6 16. Nd2 Bxd2 17. Rxd2 Rc8 18. b3 Qb6 19. Bb5 Red8 20. Bxd7 Rxd7 21. Nb5 c4 22. bxc4 Qc5 23. Rc1 Qb4 24. Rdd1 Rdd8 25. Na7 Rc7 26. h3 Nd7 27. Nb5 Rc5 28. Rd3 ,14. Bxc5 
Played to keep Black's knight inactive on h5.,True," The comment suggests the move disrupted Black’s knight’s activity, indicating a flaw in the plan.",1. Nf3 Nf6 2. c4 g6 3. Nc3 Bg7 4. e4 d6 5. d4 O-O 6. Be2 e5 7. O-O Nbd7 8. Qc2 c6 9. Rd1 Re8 10. Rb1 a5 11. d5 cxd5 12. cxd5 Nc5 13. Be3 Bd7 14. Bxc5 dxc5 15. Bb5 Nh5 16. g3,This is a game between Kasparov (as White) and Comas (as Black). Last move played: White plays Pawn to g3,Large advantage for White (eval: 179 centipawns),16... Rf8 17. d6 Bg4 18. Qd3 Kh8 19. Qe3 Qb6 20. Rd5 Nf6 21. Rd2 Ng8 22. Qd3 Rad8 23. Na4 Qa7 24. Qc3 Nf6 25. Re1 Nd7 26. Red1 b6 27. h3 Bxh3 28. Ng5 ,16. Qa4 Bxb5 17. Qxb5 Bf8 18. Nd2 Qg5 19. g3 Qg4 20. f3 Qg5 21. Kf2 a4 22. Nc4 Red8 23. Qxb7 Nf6 24. d6 Ne8 25. Nb5 
"Black resigned perhaps a bit prematurely, though he is the exchange down with no counter play.",True," The comment suggests a potential flaw in the player's assessment of the position, indicating a move might have been too early.",1. Nf3 Nf6 2. c4 g6 3. Nc3 Bg7 4. e4 d6 5. d4 O-O 6. Be2 e5 7. O-O Nbd7 8. Qc2 c6 9. Rd1 Re8 10. Rb1 a5 11. d5 cxd5 12. cxd5 Nc5 13. Be3 Bd7 14. Bxc5 dxc5 15. Bb5 Nh5 16. g3 Bg4 17. Bxe8 Bxf3 18. Rd3 Bg4 19. Bb5,This is a game between Kasparov (as White) and Comas (as Black). Last move played: White plays Bishop to b5,Large advantage for White (eval: 297 centipawns),19... Bf8 20. Bc4 Ng7 21. Nb5 Qf6 22. Qd2 a4 23. Nc7 Rd8 24. b3 a3 25. d6 Rxd6 26. Rxd6 Bxd6 27. Nd5 Qd8 28. Kg2 b5 29. Bxb5 Ne6 30. f3 Nd4 31. fxg4 ,19. Bb5 Bf8 20. Bc4 Ng7 21. Nb5 Qb6 22. a4 Ne8 23. Qb3 Rd8 24. d6 Rd7 25. f3 Be6 26. Rbd1 h5 27. Bxe6 c4+ 28. Kg2 cxb3 29. Bxd7 Nf6 30. Bc8 Kg7 31. d7 Be7 32. d8=Q Bxd8 33. Rxd8 Ng4 34. Bxg4 hxg4 
More commonly seen is 7...Nc6.,True," The comment identifies the mistake as a material loss and highlights a strategic advantage, suggesting a flawed assessment of the position.",1. Nf3 Nf6 2. c4 g6 3. Nc3 Bg7 4. e4 d6 5. d4 O-O 6. Be2 e5 7. O-O Nbd7,This is a game between Kasparov (as White) and Comas (as Black). Last move played: Black plays Knight to d7,Advantage for White (eval: 80 centipawns),8. Be3 ,7... a5 8. Be3 
