comment,good,reasoning,moves,context,engine_eval,engine_best_line,engine_best_alternative
played after thinking for about 15 minutes. Did Kasparov want to force a draw now or did he miss Black's reply? Mig: 'Almost a draw offer since it is now very hard for White to find any move to avoid the repetition that does indeed end the game,True," The comment suggests a potential miscalculation and a desire to avoid a drawn position, indicating a flawed strategic decision.",1. Nf3 d5 2. c4 c6 3. d4 Nf6 4. Nc3 e6 5. e3 Nbd7 6. Qc2 Bd6 7. g4 Bb4 8. Bd2 Qe7 9. Rg1 Bxc3 10. Bxc3 Ne4 11. O-O-O Qf6 12. Be2 Nxf2 13. Rdf1 Ne4 14. Bb4 c5 15. cxd5 exd5 16. dxc5 Qe7 17. Nd4 O-O 18. Nf5 Qe5 19. c6 bxc6 20. Bxf8 Kxf8 21. Ng3 Ndc5 22. Nxe4 Nxe4 23. Bd3 Be6 24. Bxe4 dxe4 25. Rf4 Bd5 26. Qc5+ Kg8 27. Rgf1 Rb8 28. R1f2 Qc7 29. Rc2 Qd7 30. h4 Qd8 31. g5 Bxa2 32. Rxe4,"This is a game between Kasparov, Garry (as White) and X3D Fritz (as Black). Last move played: White plays Rook takes on e4",Advantage for White (eval: 99 centipawns),32... Qd3 33. Qf5 ,32. Rd2 
forces the draw as White can't escape the coming checks Mig: 'Bringing the queen to a dominating position and creating threats around the white king,True," The comment suggests White’s position is creating threats, potentially leading to a draw, indicating a flaw in the move’s strategic assessment.",1. Nf3 d5 2. c4 c6 3. d4 Nf6 4. Nc3 e6 5. e3 Nbd7 6. Qc2 Bd6 7. g4 Bb4 8. Bd2 Qe7 9. Rg1 Bxc3 10. Bxc3 Ne4 11. O-O-O Qf6 12. Be2 Nxf2 13. Rdf1 Ne4 14. Bb4 c5 15. cxd5 exd5 16. dxc5 Qe7 17. Nd4 O-O 18. Nf5 Qe5 19. c6 bxc6 20. Bxf8 Kxf8 21. Ng3 Ndc5 22. Nxe4 Nxe4 23. Bd3 Be6 24. Bxe4 dxe4 25. Rf4 Bd5 26. Qc5+ Kg8 27. Rgf1 Rb8 28. R1f2 Qc7 29. Rc2 Qd7 30. h4 Qd8 31. g5 Bxa2 32. Rxe4 Qd3,"This is a game between Kasparov, Garry (as White) and X3D Fritz (as Black). Last move played: Black plays Queen to d3",Advantage for White (eval: 63 centipawns),33. Qf5 ,32... Qd3 33. Qf5 
"Mig: 'X3D Fritz alarmed the commentators by spending eight minutes on this obvious and forced move. Seirawan, Ashley, and Hoffman wondered if there was a malfunction! Nothing of the sort. X3D Fritz had plenty of extra time, so it was in no hurry. It had started to see the repetition draw that now comes and when a decisive result comes into its analysis horizon the program gives itself more time.'",True," The comment highlights a potential overthinking and analysis paralysis, suggesting the player unnecessarily prolonged a move.",1. Nf3 d5 2. c4 c6 3. d4 Nf6 4. Nc3 e6 5. e3 Nbd7 6. Qc2 Bd6 7. g4 Bb4 8. Bd2 Qe7 9. Rg1 Bxc3 10. Bxc3 Ne4 11. O-O-O Qf6 12. Be2 Nxf2 13. Rdf1 Ne4 14. Bb4 c5 15. cxd5 exd5 16. dxc5 Qe7 17. Nd4 O-O 18. Nf5 Qe5 19. c6 bxc6 20. Bxf8 Kxf8 21. Ng3 Ndc5 22. Nxe4 Nxe4 23. Bd3 Be6 24. Bxe4 dxe4 25. Rf4 Bd5 26. Qc5+ Kg8 27. Rgf1 Rb8 28. R1f2 Qc7 29. Rc2 Qd7 30. h4 Qd8 31. g5 Bxa2 32. Rxe4 Qd3 33. Rd4 Qxe3+,"This is a game between Kasparov, Garry (as White) and X3D Fritz (as Black). Last move played: Black plays Queen takes on e3 with check",The position is equal,34. Rcd2 Qe1+ 35. Rd1 Qe3+ 36. R1d2 ,33... Qxe3+ 34. Rcd2 Qe1+ 35. Rd1 Qe3+ 
Mig: 'The other moves are suicidal. Kasparov has no choice but to accept the perpetual check draw if X3D Fritz wants it.' Mig: 'The only move.',True," The comment offers a justification for the mistake, suggesting a flawed strategic assessment.",1. Nf3 d5 2. c4 c6 3. d4 Nf6 4. Nc3 e6 5. e3 Nbd7 6. Qc2 Bd6 7. g4 Bb4 8. Bd2 Qe7 9. Rg1 Bxc3 10. Bxc3 Ne4 11. O-O-O Qf6 12. Be2 Nxf2 13. Rdf1 Ne4 14. Bb4 c5 15. cxd5 exd5 16. dxc5 Qe7 17. Nd4 O-O 18. Nf5 Qe5 19. c6 bxc6 20. Bxf8 Kxf8 21. Ng3 Ndc5 22. Nxe4 Nxe4 23. Bd3 Be6 24. Bxe4 dxe4 25. Rf4 Bd5 26. Qc5+ Kg8 27. Rgf1 Rb8 28. R1f2 Qc7 29. Rc2 Qd7 30. h4 Qd8 31. g5 Bxa2 32. Rxe4 Qd3 33. Rd4 Qxe3+ 34. Rcd2,"This is a game between Kasparov, Garry (as White) and X3D Fritz (as Black). Last move played: White plays Rook to d2",The position is equal,34... Qg1+ 35. Rd1 Qe3+ 36. R1d2 ,34. Rcd2 Qe1+ 35. Rd1 Qe3+ 36. R1d2 
Mig: 'This was the last fork in the road. X3D Fritz could have continued the game with ..Re8. The machine decides that there is no way to play for a win and forces the repetition draw.',True," The comment provides a detailed explanation of why the move was considered a mistake, suggesting the opponent's analysis led to a draw.",1. Nf3 d5 2. c4 c6 3. d4 Nf6 4. Nc3 e6 5. e3 Nbd7 6. Qc2 Bd6 7. g4 Bb4 8. Bd2 Qe7 9. Rg1 Bxc3 10. Bxc3 Ne4 11. O-O-O Qf6 12. Be2 Nxf2 13. Rdf1 Ne4 14. Bb4 c5 15. cxd5 exd5 16. dxc5 Qe7 17. Nd4 O-O 18. Nf5 Qe5 19. c6 bxc6 20. Bxf8 Kxf8 21. Ng3 Ndc5 22. Nxe4 Nxe4 23. Bd3 Be6 24. Bxe4 dxe4 25. Rf4 Bd5 26. Qc5+ Kg8 27. Rgf1 Rb8 28. R1f2 Qc7 29. Rc2 Qd7 30. h4 Qd8 31. g5 Bxa2 32. Rxe4 Qd3 33. Rd4 Qxe3+ 34. Rcd2 Qe1+ 35. Rd1 Qe3+ 36. R1d2 Qg1+,"This is a game between Kasparov, Garry (as White) and X3D Fritz (as Black). Last move played: Black plays Queen to g1 with check",The position is equal,37. Rd1 Qe3+ 38. R1d2 Qe1+ 39. Rd1 ,36... Qg1+ 37. Rd1 Qe3+ 38. R1d2 Qe1+ 39. Rd1 Qe3+ 
"The pressure on Kasparov has not become smaller after this draw. Will he be able to withstand it and show his powerful strength? Thursday we will already know more! Co-commentators IM Heiko Machelett and Prof.Dr.Althofer. Mig: 'Now the draw is completely forced because the black queen has no alternative to checking on e3 again and creating a third repetition. Any other move loses immediately. White is threatening to win instantly with Rd8+. So going to g1 for check instead of back to e1 was just a show of computer humor, if you will! The result is the same: draw. A rich and exciting battle with chances on both sides and unexpected play from the beginning.",True," The comment offers insights into the draw’s nature and the player’s perceived lack of strategic depth, indicating a potential mistake.",1. Nf3 d5 2. c4 c6 3. d4 Nf6 4. Nc3 e6 5. e3 Nbd7 6. Qc2 Bd6 7. g4 Bb4 8. Bd2 Qe7 9. Rg1 Bxc3 10. Bxc3 Ne4 11. O-O-O Qf6 12. Be2 Nxf2 13. Rdf1 Ne4 14. Bb4 c5 15. cxd5 exd5 16. dxc5 Qe7 17. Nd4 O-O 18. Nf5 Qe5 19. c6 bxc6 20. Bxf8 Kxf8 21. Ng3 Ndc5 22. Nxe4 Nxe4 23. Bd3 Be6 24. Bxe4 dxe4 25. Rf4 Bd5 26. Qc5+ Kg8 27. Rgf1 Rb8 28. R1f2 Qc7 29. Rc2 Qd7 30. h4 Qd8 31. g5 Bxa2 32. Rxe4 Qd3 33. Rd4 Qxe3+ 34. Rcd2 Qe1+ 35. Rd1 Qe3+ 36. R1d2 Qg1+ 37. Rd1,"This is a game between Kasparov, Garry (as White) and X3D Fritz (as Black). Last move played: White plays Rook to d1",The position is equal,37... Qe3+ 38. R1d2 Qe1+ 39. Rd1 Qe3+ ,37. Rd1 Qe3+ 38. R1d2 Qe1+ 39. Rd1 
"Mig: 'Logical and normal development into what is called the Slav Defense. This is a well-known system that is particularly well-known to Garry Kasparov! The X3D Fritz team shows no fear and heads right into Kasparov's strength. They wanted to show they didn't fear his preparation. This choice is also relevant because in Kasparov's last computer match, against Deep Junior in January '03, he crushed the machine in this exact opening in the first game!'",True," The comment suggests a potential alternative, indicating a flawed assessment of the situation.",1. Nf3 d5 2. c4 c6 3. d4 Nf6 4. Nc3 e6,"This is a game between Kasparov, Garry (as White) and X3D Fritz (as Black). Last move played: Black plays Pawn to e6",Slight advantage for White (eval: 26 centipawns),5. Bg5 Nbd7 ,4... e6 5. Bg5 h6 6. Bxf6 Qxf6 7. Qc2 Bb4 8. e4 O-O 9. e5 Qe7 10. a3 Ba5 11. Bd3 
"Mig: 'A normal move still in the ""book"" of both players. X3D Fritz has almost three million positions in its library of opening moves and sequences. Kasparov is legendary for his opening preparation and knowledge. He is a walking encyclopedia of opening theory and his opponents have a healthy fear of his surprises in the openings. This move also takes the game away from the game Kasparov won against Deep Junior in this line. That's a sort of psychological advantage, being the first to spring something unexpected. Between two humans it could also be sort of like a game of chicken, with the first player to turn off from the previous game being the chicken. No matter how well it plays chess, this aspect is lost on X3D Fritz. It is not, however, lost on its creators and operators! '",True," The comment offers a potential explanation for the mistake, suggesting the bishop's defensive role and the protection of the f-file.",1. Nf3 d5 2. c4 c6 3. d4 Nf6 4. Nc3 e6 5. e3 Nbd7 6. Qc2 Bd6 7. g4 Bb4,"This is a game between Kasparov, Garry (as White) and X3D Fritz (as Black). Last move played: Black plays Bishop to b4",Advantage for White (eval: 57 centipawns),8. Bd2 Bxc3 ,7... h6 
"Did Kasparov hope for this greedy pawn grab to happen? He gets now a murderous initiative based on his advantage in development, his mighty pair of bishops and the unsafe black king. A human would be shaking in his shoes with Black here. Mig: 'And X3D Fritz takes the pawn! This will give White a lot of pressure against the black position in compensation for the sacrificed pawn. It's ironic that we have the strongest chess computer of all time here and it is playing in the materialistic mode of the first chess programs. In X3D Fritz's opinion, it has enough defensive resources to rebuff Kasparov's initiative. This battle of material vs initiative is what chess is all about. Kasparov gives up a pawn for an attack, but if his attack doesn't succeed then X3D Fritz will have good chances to win with the extra material. Kasparov loves to have the initiative and such sacrifices are his stock and trade.",True," The comment suggests a strategic trade that resulted in a loss of material, indicating a flawed move.",1. Nf3 d5 2. c4 c6 3. d4 Nf6 4. Nc3 e6 5. e3 Nbd7 6. Qc2 Bd6 7. g4 Bb4 8. Bd2 Qe7 9. Rg1 Bxc3 10. Bxc3 Ne4 11. O-O-O Qf6 12. Be2 Nxf2,"This is a game between Kasparov, Garry (as White) and X3D Fritz (as Black). Last move played: Black plays Knight takes on f2",Large advantage for White (eval: 133 centipawns),13. Rdf1 Ne4 14. Be1 Qe7 15. Bh4 g5 16. Be1 b6 17. h4 Bb7 18. Nxg5 Nxg5 19. hxg5 Ba6 20. Bh4 O-O-O 21. Qa4 Kb7 22. cxd5 Bxe2 23. dxc6+ Ka8 24. Rf2 ,12... b6 13. Be1 Bb7 14. Kb1 c5 15. dxc5 dxc4 16. c6 Bxc6 17. Nd4 Bb7 18. f3 Nec5 19. Nb5 O-O 20. Nd6 Bd5 21. e4 
"Mig: 'A normal move still in the ""book"" of both players. X3D Fritz has almost three million positions in its library of opening moves and sequences. Kasparov is legendary for his opening preparation and knowledge. He is a walking encyclopedia of opening theory and his opponents have a healthy fear of his surprises in the openings. This move also takes the game away from the game Kasparov won against Deep Junior in this line. That's a sort of psychological advantage, being the first to spring something unexpected. Between two humans it could also be sort of like a game of chicken, with the first player to turn off from the previous game being the chicken. No matter how well it plays chess, this aspect is lost on X3D Fritz. It is not, however, lost on its creators and operators! '",True," The comment offers a potential explanation for the mistake, suggesting a risky and aggressive move.",1. Nf3 d5 2. c4 c6 3. d4 Nf6 4. Nc3 e6 5. e3 Nbd7 6. Qc2 Bd6 7. g4 Bb4,"This is a game between Kasparov, Garry (as White) and X3D Fritz (as Black). Last move played: Black plays Bishop to b4",Advantage for White (eval: 57 centipawns),8. Bd2 Bxc3 ,7... h6 
