comment,good,reasoning,moves,context,engine_eval,engine_best_line,engine_best_alternative
"Does Kasparov play like this to avoid the Tarrasch variation of the Queen's Gambit or is this the best move order in his opinion to reach a Meran? Mig: 'Kasparov almost always opens with 1.e4 these days, at least against humans. But over the course of his 25 year professional career he has played just about everything.",True," The comment offers potential insights into the player’s strategic approach, suggesting a focus on avoiding a specific variation.",1. Nf3,"This is a game between Kasparov, Garry (as White) and X3D Fritz (as Black). Last move played: White plays Knight to f3",Slight advantage for White (eval: 30 centipawns),1... d5 2. d4 ,1. e4 e5 
"Mig: 'Logical and normal development into what is called the Slav Defense. This is a well-known system that is particularly well-known to Garry Kasparov! The X3D Fritz team shows no fear and heads right into Kasparov's strength. They wanted to show they didn't fear his preparation. This choice is also relevant because in Kasparov's last computer match, against Deep Junior in January '03, he crushed the machine in this exact opening in the first game!'",True," The comment provides context about the Slav Defense and its historical significance, suggesting a potential misjudgment of the move's suitability.",1. Nf3 d5 2. c4 c6 3. d4 Nf6 4. Nc3 e6,"This is a game between Kasparov, Garry (as White) and X3D Fritz (as Black). Last move played: Black plays Pawn to e6",Slight advantage for White (eval: 26 centipawns),5. Bg5 Nbd7 ,4... e6 5. Bg5 h6 6. Bxf6 Qxf6 7. Qc2 Bb4 8. e4 O-O 9. e5 Qe7 10. a3 Ba5 11. Bd3 
"Mig: 'A very aggressive move that offers a pawn in exchange for attacking chances. If Black captures the pawn with ..Nxg5 White gets a lot of pressure on the open g-file. Kasparov has played this position three times, twice with white and once with black! He won all three games, including one against the computer program Deep Junior earlier this year.'",True," The comment provides context about the move's strategic implications and the player's experience with the position, suggesting a flawed assessment of the move's value.",1. Nf3 d5 2. c4 c6 3. d4 Nf6 4. Nc3 e6 5. e3 Nbd7 6. Qc2 Bd6 7. g4,"This is a game between Kasparov, Garry (as White) and X3D Fritz (as Black). Last move played: White plays Pawn to g4",The position is equal,7... h6 ,7. Bd3 O-O 8. O-O e5 9. cxd5 cxd5 10. e4 exd4 11. Nxd5 Nxd5 12. exd5 h6 13. Nxd4 Qh4 14. Bh7+ Kh8 15. Nf3 Qf6 16. Be4 Nc5 17. Be3 Nxe4 18. Qxe4 Rd8 19. h3 Kg8 20. Rfe1 Bd7 21. Bd4 Qf5 22. Qxf5 Bxf5 
"Mig: 'A normal move still in the ""book"" of both players. X3D Fritz has almost three million positions in its library of opening moves and sequences. Kasparov is legendary for his opening preparation and knowledge. He is a walking encyclopedia of opening theory and his opponents have a healthy fear of his surprises in the openings. This move also takes the game away from the game Kasparov won against Deep Junior in this line. That's a sort of psychological advantage, being the first to spring something unexpected. Between two humans it could also be sort of like a game of chicken, with the first player to turn off from the previous game being the chicken. No matter how well it plays chess, this aspect is lost on X3D Fritz. It is not, however, lost on its creators and operators! '",True," The comment provides a detailed analysis of the opponent's opening preparation, highlighting a potential loss of strategic advantage for the player.",1. Nf3 d5 2. c4 c6 3. d4 Nf6 4. Nc3 e6 5. e3 Nbd7 6. Qc2 Bd6 7. g4 Bb4,"This is a game between Kasparov, Garry (as White) and X3D Fritz (as Black). Last move played: Black plays Bishop to b4",Advantage for White (eval: 57 centipawns),8. Bd2 Bxc3 ,7... h6 
"Mig.: 'Now that we are out of X3D Fritz's opening library of recorded moves it is thinking, calculating, for itself. And right away we see a very ""computer-like"" move from the computer. It immediately plays to win a pawn by attacking the unprotected knight on f3.'",True," The comment describes a potentially over-analyzed and automated move, suggesting a flawed strategic decision.",1. Nf3 d5 2. c4 c6 3. d4 Nf6 4. Nc3 e6 5. e3 Nbd7 6. Qc2 Bd6 7. g4 Bb4 8. Bd2 Qe7 9. Rg1 Bxc3 10. Bxc3 Ne4 11. O-O-O Qf6,"This is a game between Kasparov, Garry (as White) and X3D Fritz (as Black). Last move played: Black plays Queen to f6",Large advantage for White (eval: 116 centipawns),12. Be2 ,11... Nxc3 12. Qxc3 
Mig: 'Kasparov protects his knight and offers the f2 pawn for capture.',True, The comment provides context about the potential threat posed by the move.,1. Nf3 d5 2. c4 c6 3. d4 Nf6 4. Nc3 e6 5. e3 Nbd7 6. Qc2 Bd6 7. g4 Bb4 8. Bd2 Qe7 9. Rg1 Bxc3 10. Bxc3 Ne4 11. O-O-O Qf6 12. Be2,"This is a game between Kasparov, Garry (as White) and X3D Fritz (as Black). Last move played: White plays Bishop to e2",Large advantage for White (eval: 118 centipawns),12... b6 13. Be1 Bb7 14. Kb1 c5 15. dxc5 dxc4 16. c6 Bxc6 17. Nd4 Bb7 18. f3 Nec5 19. Nb5 O-O 20. Nd6 Bd5 21. e4 ,12. Be2 
"Did Kasparov hope for this greedy pawn grab to happen? He gets now a murderous initiative based on his advantage in development, his mighty pair of bishops and the unsafe black king. A human would be shaking in his shoes with Black here. Mig: 'And X3D Fritz takes the pawn! This will give White a lot of pressure against the black position in compensation for the sacrificed pawn. It's ironic that we have the strongest chess computer of all time here and it is playing in the materialistic mode of the first chess programs. In X3D Fritz's opinion, it has enough defensive resources to rebuff Kasparov's initiative. This battle of material vs initiative is what chess is all about. Kasparov gives up a pawn for an attack, but if his attack doesn't succeed then X3D Fritz will have good chances to win with the extra material. Kasparov loves to have the initiative and such sacrifices are his stock and trade.",True," The comment offers insightful analysis of the move's strategic implications, suggesting a missed opportunity for a more solid defense and highlighting the player’s strategic mindset.",1. Nf3 d5 2. c4 c6 3. d4 Nf6 4. Nc3 e6 5. e3 Nbd7 6. Qc2 Bd6 7. g4 Bb4 8. Bd2 Qe7 9. Rg1 Bxc3 10. Bxc3 Ne4 11. O-O-O Qf6 12. Be2 Nxf2,"This is a game between Kasparov, Garry (as White) and X3D Fritz (as Black). Last move played: Black plays Knight takes on f2",Large advantage for White (eval: 133 centipawns),13. Rdf1 Ne4 14. Be1 Qe7 15. Bh4 g5 16. Be1 b6 17. h4 Bb7 18. Nxg5 Nxg5 19. hxg5 Ba6 20. Bh4 O-O-O 21. Qa4 Kb7 22. cxd5 Bxe2 23. dxc6+ Ka8 24. Rf2 ,12... b6 13. Be1 Bb7 14. Kb1 c5 15. dxc5 dxc4 16. c6 Bxc6 17. Nd4 Bb7 18. f3 Nec5 19. Nb5 O-O 20. Nd6 Bd5 21. e4 
Mig: 'Attacking the black knight.',True,". The comment suggests a potential tactical error, indicating the move was poorly considered.",1. Nf3 d5 2. c4 c6 3. d4 Nf6 4. Nc3 e6 5. e3 Nbd7 6. Qc2 Bd6 7. g4 Bb4 8. Bd2 Qe7 9. Rg1 Bxc3 10. Bxc3 Ne4 11. O-O-O Qf6 12. Be2 Nxf2 13. Rdf1,"This is a game between Kasparov, Garry (as White) and X3D Fritz (as Black). Last move played: White plays Rook to f1",Large advantage for White (eval: 137 centipawns),13... Ne4 ,13. Rdf1 Ne4 14. Be1 Qe7 15. Bh4 g5 16. Be1 b6 17. h4 Bb7 18. Nxg5 Nxg5 19. hxg5 Ba6 20. Bh4 O-O-O 21. Qa4 Kb7 22. cxd5 Bxe2 23. dxc6+ Ka8 24. Rf2 
"Mig: 'Retreating the knight. One of the drawbacks of X3D Fritz's pawn grab is that now the f-file is open for White's pieces. Right now Kasparov is threatening a discovered attack on the black queen. That means when he moves his knight, there will be a line of attack opened for his rook.'",True, The comment identifies a potential tactical threat and explains why the move was considered a mistake.,1. Nf3 d5 2. c4 c6 3. d4 Nf6 4. Nc3 e6 5. e3 Nbd7 6. Qc2 Bd6 7. g4 Bb4 8. Bd2 Qe7 9. Rg1 Bxc3 10. Bxc3 Ne4 11. O-O-O Qf6 12. Be2 Nxf2 13. Rdf1 Ne4,"This is a game between Kasparov, Garry (as White) and X3D Fritz (as Black). Last move played: Black plays Knight to e4",Large advantage for White (eval: 133 centipawns),14. Be1 Qe7 ,13... Ne4 
prevents the short castling and emphasizes Black's weak dark squares. Mig: 'Kasparov moves his bishop away so the knight can't capture it. He uses it to prevent the black king from castling by attacking the f8 square.,True," The comment highlights a potential tactical error and a strategic disadvantage, suggesting a flawed move.",1. Nf3 d5 2. c4 c6 3. d4 Nf6 4. Nc3 e6 5. e3 Nbd7 6. Qc2 Bd6 7. g4 Bb4 8. Bd2 Qe7 9. Rg1 Bxc3 10. Bxc3 Ne4 11. O-O-O Qf6 12. Be2 Nxf2 13. Rdf1 Ne4 14. Bb4,"This is a game between Kasparov, Garry (as White) and X3D Fritz (as Black). Last move played: White plays Bishop to b4",Large advantage for White (eval: 115 centipawns),14... c5 ,14. Be1 Qe7 
"Mig: 'This move apparently came as a surprise to Kasparov, who now went into a deep think after playing all of his previous moves at tremendous speed. X3D Fritz gives back the pawn in order to block the white bishop's diagonal and open lines toward the White king.'",True," The comment offers a potential explanation for the mistake, suggesting a strategic miscalculation.",1. Nf3 d5 2. c4 c6 3. d4 Nf6 4. Nc3 e6 5. e3 Nbd7 6. Qc2 Bd6 7. g4 Bb4 8. Bd2 Qe7 9. Rg1 Bxc3 10. Bxc3 Ne4 11. O-O-O Qf6 12. Be2 Nxf2 13. Rdf1 Ne4 14. Bb4 c5,"This is a game between Kasparov, Garry (as White) and X3D Fritz (as Black). Last move played: Black plays Pawn to c5",Large advantage for White (eval: 120 centipawns),15. Ba3 Qe7 16. Bd3 b6 17. Bxe4 dxe4 18. Qxe4 Rb8 19. Ne5 Bb7 20. Qf4 O-O 21. dxc5 bxc5 22. b3 Nxe5 23. Qxe5 Rbc8 24. g5 Qc7 25. Qxc7 Rxc7 26. h4 a5 27. h5 Ra8 28. Bb2 Rd7 ,14... c5 
"Mig: 'Getting the queen away from the discovered attack on the f-file and also attacking the c5 pawn. Material is now equal, Kasparov has an edge in development and X3D Fritz has a very well-placed knight on e4.'",True," The comment offers a justification for the mistake, suggesting a strategic advantage gained through material and pawn structure.",1. Nf3 d5 2. c4 c6 3. d4 Nf6 4. Nc3 e6 5. e3 Nbd7 6. Qc2 Bd6 7. g4 Bb4 8. Bd2 Qe7 9. Rg1 Bxc3 10. Bxc3 Ne4 11. O-O-O Qf6 12. Be2 Nxf2 13. Rdf1 Ne4 14. Bb4 c5 15. cxd5 exd5 16. dxc5 Qe7,"This is a game between Kasparov, Garry (as White) and X3D Fritz (as Black). Last move played: Black plays Queen to e7",Advantage for White (eval: 99 centipawns),17. Nd4 Ne5 ,16... a5 17. Ba3 
"a mighty square for White's knight, which is liked an octopus here. It can for instance jump to f5 to imcrease the pressure on the dark squares. Mig: 'A typically dynamic Kasparov move. He will play his knight to the aggressive f5 square. He ignores the threat to the c5 pawn since capturing it would cost Black a great deal of time.",True," The comment offers a potential explanation for the mistake, suggesting a risky and aggressive move that might have led to a compromised position.",1. Nf3 d5 2. c4 c6 3. d4 Nf6 4. Nc3 e6 5. e3 Nbd7 6. Qc2 Bd6 7. g4 Bb4 8. Bd2 Qe7 9. Rg1 Bxc3 10. Bxc3 Ne4 11. O-O-O Qf6 12. Be2 Nxf2 13. Rdf1 Ne4 14. Bb4 c5 15. cxd5 exd5 16. dxc5 Qe7 17. Nd4,"This is a game between Kasparov, Garry (as White) and X3D Fritz (as Black). Last move played: White plays Knight to d4",Large advantage for White (eval: 108 centipawns),17... Ne5 18. Bb5+ Kf8 19. Rf4 a5 20. Ba3 Kg8 21. Qb3 Qd8 22. c6 h5 23. g5 a4 24. Bxa4 Kh7 25. Bb5 bxc6 26. Nxc6 Nxc6 27. Bxc6 Ra5 ,17. Nd4 Ne5 
"The human looking move, which was again suggested by Oliver Reeh was a surprise. Fritz evacuates his king at the cost of an exchange. Mig: 'Getting the king to safety, but allowing Kasparov to play a powerful sequence of moves here that will win a rook for a bishop and pawns. A rather surprising decision from a program that has already shown itself to be a bit of a materialist!",True, The comment highlights a potential over-reliance on automated analysis and suggests a move that might be seen as strategically flawed due to the program's prioritization of material over overall positional considerations.,1. Nf3 d5 2. c4 c6 3. d4 Nf6 4. Nc3 e6 5. e3 Nbd7 6. Qc2 Bd6 7. g4 Bb4 8. Bd2 Qe7 9. Rg1 Bxc3 10. Bxc3 Ne4 11. O-O-O Qf6 12. Be2 Nxf2 13. Rdf1 Ne4 14. Bb4 c5 15. cxd5 exd5 16. dxc5 Qe7 17. Nd4 O-O,"This is a game between Kasparov, Garry (as White) and X3D Fritz (as Black). Last move played: Black plays kingside castle",Large advantage for White (eval: 108 centipawns),18. Nf5 Qd8 19. c6 bxc6 20. Bxf8 Qxf8 21. Kb1 Ndc5 22. Ng3 Nxg3 23. Rxg3 Qd6 24. Ka1 a5 25. Rc1 Ne4 26. Rg2 Bd7 27. g5 a4 28. a3 g6 29. Bf3 ,17... Ne5 18. Bb5+ Kf8 19. Rf4 a5 20. Ba3 Kg8 21. Qb3 Qd8 22. c6 h5 23. g5 a4 24. Bxa4 Kh7 25. Bb5 bxc6 26. Nxc6 Nxc6 27. Bxc6 Ra5 
Mig: 'Attacking the queen.',True," The comment suggests a potential tactical error, indicating a misjudgment of the board position.",1. Nf3 d5 2. c4 c6 3. d4 Nf6 4. Nc3 e6 5. e3 Nbd7 6. Qc2 Bd6 7. g4 Bb4 8. Bd2 Qe7 9. Rg1 Bxc3 10. Bxc3 Ne4 11. O-O-O Qf6 12. Be2 Nxf2 13. Rdf1 Ne4 14. Bb4 c5 15. cxd5 exd5 16. dxc5 Qe7 17. Nd4 O-O 18. Nf5,"This is a game between Kasparov, Garry (as White) and X3D Fritz (as Black). Last move played: White plays Knight to f5",Large advantage for White (eval: 125 centipawns),18... Qe5 19. c6 ,18. Nf5 Qd8 19. c6 bxc6 20. Bxf8 Qxf8 21. Kb1 Ndc5 22. Ng3 Nxg3 23. Rxg3 Qd6 24. Ka1 a5 25. Rc1 Ne4 26. Rg2 Bd7 27. g5 a4 28. a3 g6 29. Bf3 
"Mig: 'Kasparov goes for it. This pawn push is a discovered attack. The pawn attacks the knight and at the same time the diagonal for the b4 bishop is opened up to attack the rook on f8. He is going to win a rook for his bishop, a gain in material, but he usually likes to be the one giving up the material for the attack. Now X3D Fritz will have the initiative and more active pieces. '",True," The comment provides a detailed analysis of the tactical implications of the pawn push, suggesting a strategic disadvantage for the player.",1. Nf3 d5 2. c4 c6 3. d4 Nf6 4. Nc3 e6 5. e3 Nbd7 6. Qc2 Bd6 7. g4 Bb4 8. Bd2 Qe7 9. Rg1 Bxc3 10. Bxc3 Ne4 11. O-O-O Qf6 12. Be2 Nxf2 13. Rdf1 Ne4 14. Bb4 c5 15. cxd5 exd5 16. dxc5 Qe7 17. Nd4 O-O 18. Nf5 Qe5 19. c6,"This is a game between Kasparov, Garry (as White) and X3D Fritz (as Black). Last move played: White plays Pawn to c6",Large advantage for White (eval: 127 centipawns),19... bxc6 ,19. c6 bxc6 
"a tempo played by Fritz. It must have had enough time to calculate it in advance on Kasparov's time. Mig: 'Our Grandmaster commentators were expecting X3D Fritz to recapture with the knight instead of moving his king into the middle of the board. The machine prefers to keep its pieces more active and isn't worried about its king at all. A human would instictively worry about putting his king out into traffic. A computer just looks at a few hundred million positions, sees no danger, and plays what it thinks is best",True," The comment suggests a potential flaw in the computer's evaluation, indicating a missed opportunity for human intuition.",1. Nf3 d5 2. c4 c6 3. d4 Nf6 4. Nc3 e6 5. e3 Nbd7 6. Qc2 Bd6 7. g4 Bb4 8. Bd2 Qe7 9. Rg1 Bxc3 10. Bxc3 Ne4 11. O-O-O Qf6 12. Be2 Nxf2 13. Rdf1 Ne4 14. Bb4 c5 15. cxd5 exd5 16. dxc5 Qe7 17. Nd4 O-O 18. Nf5 Qe5 19. c6 bxc6 20. Bxf8 Kxf8,"This is a game between Kasparov, Garry (as White) and X3D Fritz (as Black). Last move played: Black plays King takes on f8",Large advantage for White (eval: 122 centipawns),21. Ng3 ,20... Kxf8 
Mig: 'Kasparov wants to trade material. He has a material advantage and every exchange will bring him closer to realizing it.',True," The comment suggests a potential tactical error based on the player's desire to trade material, indicating a flawed assessment of the position.",1. Nf3 d5 2. c4 c6 3. d4 Nf6 4. Nc3 e6 5. e3 Nbd7 6. Qc2 Bd6 7. g4 Bb4 8. Bd2 Qe7 9. Rg1 Bxc3 10. Bxc3 Ne4 11. O-O-O Qf6 12. Be2 Nxf2 13. Rdf1 Ne4 14. Bb4 c5 15. cxd5 exd5 16. dxc5 Qe7 17. Nd4 O-O 18. Nf5 Qe5 19. c6 bxc6 20. Bxf8 Kxf8 21. Ng3,"This is a game between Kasparov, Garry (as White) and X3D Fritz (as Black). Last move played: White plays Knight to g3",Large advantage for White (eval: 132 centipawns),21... Nec5 22. Qxh7 Nf6 23. Qc2 Qxe3+ 24. Kb1 Rb8 25. Rc1 Nfe4 26. Nxe4 Nxe4 27. Bd3 Nf2 28. Rg3 Qd4 29. Bf5 Bxf5 30. gxf5 Ne4 31. Rh3 Rb4 32. a3 Rc4 33. Rd1 Qe5 ,21. Ng3 
Mig: 'Threatening yet more trades.',True,". The comment suggests a potential weakness in the move, indicating a risky trade that could lead to a disadvantage.",1. Nf3 d5 2. c4 c6 3. d4 Nf6 4. Nc3 e6 5. e3 Nbd7 6. Qc2 Bd6 7. g4 Bb4 8. Bd2 Qe7 9. Rg1 Bxc3 10. Bxc3 Ne4 11. O-O-O Qf6 12. Be2 Nxf2 13. Rdf1 Ne4 14. Bb4 c5 15. cxd5 exd5 16. dxc5 Qe7 17. Nd4 O-O 18. Nf5 Qe5 19. c6 bxc6 20. Bxf8 Kxf8 21. Ng3 Ndc5 22. Nxe4 Nxe4 23. Bd3,"This is a game between Kasparov, Garry (as White) and X3D Fritz (as Black). Last move played: White plays Bishop to d3",Large advantage for White (eval: 143 centipawns),23... Nd6 ,23. Bd3 Be6 
Kasparov clarifies the situation by exchanges. Not only against the computer a good strategy as White's dominance on the dark square is emphasized by this.,True," The comment suggests the move was a flawed attempt to improve the position, indicating a strategic error.",1. Nf3 d5 2. c4 c6 3. d4 Nf6 4. Nc3 e6 5. e3 Nbd7 6. Qc2 Bd6 7. g4 Bb4 8. Bd2 Qe7 9. Rg1 Bxc3 10. Bxc3 Ne4 11. O-O-O Qf6 12. Be2 Nxf2 13. Rdf1 Ne4 14. Bb4 c5 15. cxd5 exd5 16. dxc5 Qe7 17. Nd4 O-O 18. Nf5 Qe5 19. c6 bxc6 20. Bxf8 Kxf8 21. Ng3 Ndc5 22. Nxe4 Nxe4 23. Bd3 Be6 24. Bxe4,"This is a game between Kasparov, Garry (as White) and X3D Fritz (as Black). Last move played: White plays Bishop takes on e4",Large advantage for White (eval: 109 centipawns),24... dxe4 ,24. Kb1 Nd6 25. Qc5 g6 26. Rc1 Kg8 27. Rc2 Bd7 28. Qd4 Qxd4 29. exd4 Rb8 30. a3 a5 31. Re1 Rb3 32. Rc3 Rxc3 33. bxc3 Bxg4 34. Re7 f5 35. Re6 Ne4 36. Kc1 Kf7 37. Rxc6 f4 38. Rc7+ Kf6 
"Mig: 'Kasparov's mission to exchange pieces has been successful, but how to now convert his slight material advantage into a win?'",True," Yes, the comment suggests the player is struggling to capitalize on a slight advantage, indicating a potential mistake.",1. Nf3 d5 2. c4 c6 3. d4 Nf6 4. Nc3 e6 5. e3 Nbd7 6. Qc2 Bd6 7. g4 Bb4 8. Bd2 Qe7 9. Rg1 Bxc3 10. Bxc3 Ne4 11. O-O-O Qf6 12. Be2 Nxf2 13. Rdf1 Ne4 14. Bb4 c5 15. cxd5 exd5 16. dxc5 Qe7 17. Nd4 O-O 18. Nf5 Qe5 19. c6 bxc6 20. Bxf8 Kxf8 21. Ng3 Ndc5 22. Nxe4 Nxe4 23. Bd3 Be6 24. Bxe4 dxe4,"This is a game between Kasparov, Garry (as White) and X3D Fritz (as Black). Last move played: Black plays Pawn takes on e4",Large advantage for White (eval: 112 centipawns),25. Rf4 Qa5 ,24... dxe4 
Mig: 'Protecting the attacked e4 pawn. Black has set up a solid defensive wall and it's up to Kasparov to find a way through.',True," The comment suggests a defensive strategy, potentially hindering Kasparov’s attack.",1. Nf3 d5 2. c4 c6 3. d4 Nf6 4. Nc3 e6 5. e3 Nbd7 6. Qc2 Bd6 7. g4 Bb4 8. Bd2 Qe7 9. Rg1 Bxc3 10. Bxc3 Ne4 11. O-O-O Qf6 12. Be2 Nxf2 13. Rdf1 Ne4 14. Bb4 c5 15. cxd5 exd5 16. dxc5 Qe7 17. Nd4 O-O 18. Nf5 Qe5 19. c6 bxc6 20. Bxf8 Kxf8 21. Ng3 Ndc5 22. Nxe4 Nxe4 23. Bd3 Be6 24. Bxe4 dxe4 25. Rf4 Bd5,"This is a game between Kasparov, Garry (as White) and X3D Fritz (as Black). Last move played: Black plays Bishop to d5",Large advantage for White (eval: 108 centipawns),26. h4 a5 27. g5 Bxa2 28. Rxe4 Qb5 29. Qc3 Bd5 30. Rd4 Re8 31. Rgd1 a4 32. Re1 Bb3 33. Qb4+ Kg8 34. Qxb5 cxb5 35. Kd2 ,25... Bxa2 26. Qxc6 
"the key of White's strategy in this position is the prevention of any counterplay by slow prophylactical improvement of all his men using his dominance on the dark squares. This is very strong especially against Fritz, who needs activity like a fish the water",True," The comment offers a potentially misleading assessment of White’s strategy, suggesting a defensive buildup rather than an active offensive plan.",1. Nf3 d5 2. c4 c6 3. d4 Nf6 4. Nc3 e6 5. e3 Nbd7 6. Qc2 Bd6 7. g4 Bb4 8. Bd2 Qe7 9. Rg1 Bxc3 10. Bxc3 Ne4 11. O-O-O Qf6 12. Be2 Nxf2 13. Rdf1 Ne4 14. Bb4 c5 15. cxd5 exd5 16. dxc5 Qe7 17. Nd4 O-O 18. Nf5 Qe5 19. c6 bxc6 20. Bxf8 Kxf8 21. Ng3 Ndc5 22. Nxe4 Nxe4 23. Bd3 Be6 24. Bxe4 dxe4 25. Rf4 Bd5 26. Qc5+ Kg8,"This is a game between Kasparov, Garry (as White) and X3D Fritz (as Black). Last move played: Black plays King to g8",Large advantage for White (eval: 102 centipawns),27. h4 a5 28. Rf2 a4 29. Qc3 Qe6 30. a3 h6 31. Rfg2 Kh7 32. g5 h5 33. g6+ fxg6 34. Rxg6 Qxg6 35. Rxg6 Kxg6 36. Qe5 Rf8 37. Qg5+ Kh7 38. Qxh5+ Kg8 39. Qe5 Rf2 40. Qd4 Bb3 41. Qxe4 Rf6 42. Kd2 Re6 43. Qd4 ,26... Kg8 27. h4 a5 28. g5 g6 29. Rd1 Qe6 30. a3 Qh3 31. Kb1 Qh2 32. Qd6 Qe2 33. Rxd5 cxd5 34. Qxd5 Qd3+ 35. Qxd3 exd3 
"threatens Rxf7, which Fritz of course will never overlook. Mig: 'Threatening the brutally blunt capture Rxf7, taking advantage of the pin on the bishop. This move was criticized by several of the assembled Grandmasters as ""too subtle."" Black's reaction develops a piece and White's threat is easily parried. The more direct 27.Rd1 was more to the point",True," The comment provides specific reasoning for the mistake, outlining Fritz's potential focus and highlighting the subtlety of the threat.",1. Nf3 d5 2. c4 c6 3. d4 Nf6 4. Nc3 e6 5. e3 Nbd7 6. Qc2 Bd6 7. g4 Bb4 8. Bd2 Qe7 9. Rg1 Bxc3 10. Bxc3 Ne4 11. O-O-O Qf6 12. Be2 Nxf2 13. Rdf1 Ne4 14. Bb4 c5 15. cxd5 exd5 16. dxc5 Qe7 17. Nd4 O-O 18. Nf5 Qe5 19. c6 bxc6 20. Bxf8 Kxf8 21. Ng3 Ndc5 22. Nxe4 Nxe4 23. Bd3 Be6 24. Bxe4 dxe4 25. Rf4 Bd5 26. Qc5+ Kg8 27. Rgf1,"This is a game between Kasparov, Garry (as White) and X3D Fritz (as Black). Last move played: White plays Rook to f1",Advantage for White (eval: 70 centipawns),27... Qb8 ,27. h4 a5 28. Rf2 a4 29. Qc3 Qe6 30. a3 h6 31. Rfg2 Kh7 32. g5 h5 33. g6+ fxg6 34. Rxg6 Qxg6 35. Rxg6 Kxg6 36. Qe5 Rf8 37. Qg5+ Kh7 38. Qxh5+ Kg8 39. Qe5 Rf2 40. Qd4 Bb3 41. Qxe4 Rf6 42. Kd2 Re6 43. Qd4 
Mig: 'Kasparov prefers to answer a threat with a counterthreat instead of playing defense. Now if Black plays ..Rb5 Kasparov exploits the new pin on the c-pawn and captures the rook with Qxb5.',True," The comment provides a potential explanation for the mistake, suggesting a strategic miscalculation by Kasparov.",1. Nf3 d5 2. c4 c6 3. d4 Nf6 4. Nc3 e6 5. e3 Nbd7 6. Qc2 Bd6 7. g4 Bb4 8. Bd2 Qe7 9. Rg1 Bxc3 10. Bxc3 Ne4 11. O-O-O Qf6 12. Be2 Nxf2 13. Rdf1 Ne4 14. Bb4 c5 15. cxd5 exd5 16. dxc5 Qe7 17. Nd4 O-O 18. Nf5 Qe5 19. c6 bxc6 20. Bxf8 Kxf8 21. Ng3 Ndc5 22. Nxe4 Nxe4 23. Bd3 Be6 24. Bxe4 dxe4 25. Rf4 Bd5 26. Qc5+ Kg8 27. Rgf1 Rb8 28. R1f2 Qc7 29. Rc2,"This is a game between Kasparov, Garry (as White) and X3D Fritz (as Black). Last move played: White plays Rook to c2",Slight advantage for White (eval: 36 centipawns),29... h6 30. Rf5 ,29. b3 
"Mig: 'Another aggressive surprise from Kasparov. Just when all the action was on the queenside and in the center, he threatens to open a new front by pushing his kingside pawns against the black king.'",True," The comment describes a potentially risky and unusual move, suggesting a misjudgment of the position.",1. Nf3 d5 2. c4 c6 3. d4 Nf6 4. Nc3 e6 5. e3 Nbd7 6. Qc2 Bd6 7. g4 Bb4 8. Bd2 Qe7 9. Rg1 Bxc3 10. Bxc3 Ne4 11. O-O-O Qf6 12. Be2 Nxf2 13. Rdf1 Ne4 14. Bb4 c5 15. cxd5 exd5 16. dxc5 Qe7 17. Nd4 O-O 18. Nf5 Qe5 19. c6 bxc6 20. Bxf8 Kxf8 21. Ng3 Ndc5 22. Nxe4 Nxe4 23. Bd3 Be6 24. Bxe4 dxe4 25. Rf4 Bd5 26. Qc5+ Kg8 27. Rgf1 Rb8 28. R1f2 Qc7 29. Rc2 Qd7 30. h4,"This is a game between Kasparov, Garry (as White) and X3D Fritz (as Black). Last move played: White plays Pawn to h4",Advantage for White (eval: 82 centipawns),30... h6 31. b3 ,30. g5 
"Mig: 'This move made X3D Fritz very happy, at least according to its evaluation function. It now considers it safe to capture the hanging pawn on a2. Kasparov wants to play h5 without allowing Black to block his pawns with ..h6. But this plan is just to slow and now X3D Fritz grabs a pawn on a2.'",True," The comment offers a subjective explanation of why the move was considered a mistake, suggesting Fritz's evaluation function influenced its decision.",1. Nf3 d5 2. c4 c6 3. d4 Nf6 4. Nc3 e6 5. e3 Nbd7 6. Qc2 Bd6 7. g4 Bb4 8. Bd2 Qe7 9. Rg1 Bxc3 10. Bxc3 Ne4 11. O-O-O Qf6 12. Be2 Nxf2 13. Rdf1 Ne4 14. Bb4 c5 15. cxd5 exd5 16. dxc5 Qe7 17. Nd4 O-O 18. Nf5 Qe5 19. c6 bxc6 20. Bxf8 Kxf8 21. Ng3 Ndc5 22. Nxe4 Nxe4 23. Bd3 Be6 24. Bxe4 dxe4 25. Rf4 Bd5 26. Qc5+ Kg8 27. Rgf1 Rb8 28. R1f2 Qc7 29. Rc2 Qd7 30. h4 Qd8 31. g5,"This is a game between Kasparov, Garry (as White) and X3D Fritz (as Black). Last move played: White plays Pawn to g5",Large advantage for White (eval: 118 centipawns),31... Bxa2 32. Rd2 Qe8 33. h5 Bd5 34. h6 a6 35. Rf5 Qf8 36. Qa7 Ra8 37. Qd4 a5 38. Kd1 a4 39. Ke1 Rd8 40. Re5 gxh6 41. gxh6 Qxh6 42. Rg2+ Kf8 43. Rxe4 Qh1+ 44. Kf2 ,31. g5 Bxa2 
Mig: 'A surprise for Kasparov. Perhaps that pawn had sat there immune for so long that Kasparov started to believe it couldn't be captured! Not only does Black win a pawn but suddenly White's king is feeling a draft.',True," The comment offers a potentially misleading explanation of the mistake, suggesting the pawn was immune, which is unlikely and could be misinterpreted.",1. Nf3 d5 2. c4 c6 3. d4 Nf6 4. Nc3 e6 5. e3 Nbd7 6. Qc2 Bd6 7. g4 Bb4 8. Bd2 Qe7 9. Rg1 Bxc3 10. Bxc3 Ne4 11. O-O-O Qf6 12. Be2 Nxf2 13. Rdf1 Ne4 14. Bb4 c5 15. cxd5 exd5 16. dxc5 Qe7 17. Nd4 O-O 18. Nf5 Qe5 19. c6 bxc6 20. Bxf8 Kxf8 21. Ng3 Ndc5 22. Nxe4 Nxe4 23. Bd3 Be6 24. Bxe4 dxe4 25. Rf4 Bd5 26. Qc5+ Kg8 27. Rgf1 Rb8 28. R1f2 Qc7 29. Rc2 Qd7 30. h4 Qd8 31. g5 Bxa2,"This is a game between Kasparov, Garry (as White) and X3D Fritz (as Black). Last move played: Black plays Bishop takes on a2",Large advantage for White (eval: 132 centipawns),32. Rd2 ,31... Bxa2 32. Rd2 Qe8 33. h5 Bd5 34. h6 a6 35. Rf5 Qf8 36. Qa7 Ra8 37. Qd4 a5 38. Kd1 a4 39. Ke1 Rd8 40. Re5 gxh6 41. gxh6 Qxh6 42. Rg2+ Kf8 43. Rxe4 Qh1+ 44. Kf2 
