comment,good,reasoning,moves,context,reformulated
"The following game is, I think, a very instructive and thematic example of what black is playing for in the King's Gambit with 3...g5. All of black's strategy is based around keeping the ""weakling"" pawn on f4 alive, because from a dynamic point of view it is incredibly annoying. Therefore, it is also a nice illustration of modern chess.",False,"

The comment does not explain the mistake made by the player, as it discusses Black's strategy in the King's Gambit, not the specific move that was played incorrectly.",1. e4,"This is a game between Nunn, John (as White) and Timman, Jan (as Black). Last move played: White plays Pawn to e4",-
"This is not necessarily better than 5...Nf6, but, to the extent that it is the beginning of a thematic plan black implements very nicely in this game, it deserves an exclam. Black has to choose between staying a pawn ahead and keeping the easy to protect g4-pawn, or allowing white to equalize material while the weak f4-pawn continues its precarious existence. He makes the dynamic choice because the f4-pawn is a great nuisance for white, blocking the f-file and the dark-squared bishop.",True,"

The comment accurately describes the key factors that led to the decision, highlighting the strategic implications of the pawn structure and the potential nuisance of the f4-pawn for White.",1. e4 e5 2. f4 exf4 3. Nf3 g5 4. h4 g4 5. Ne5 d6,"This is a game between Nunn, John (as White) and Timman, Jan (as Black). Last move played: Black plays Pawn to d6"," Black's last move to d6 isn't necessarily stronger than 5...Nf6, but it's part of Black's strategic plan. The choice here is between staying ahead by a pawn and keeping the g4-pawn safe, or letting White equalize and leave the weak f4-pawn vulnerable. Black opts for the dynamic option because the f4-pawn poses a problem for White, obstructing the f-file and the dark-squared bishop."
This move carries behind it the devious threat of 10.g4. If white could get that in it would stem black's counterplay on the g-file.,True,"

The comment correctly identifies the missed tactical opportunity of playing 10.g4, which could have stopped Black's counterplay on the g-file.",1. e4 e5 2. f4 exf4 3. Nf3 g5 4. h4 g4 5. Ne5 d6 6. Nxg4 Nf6 7. Nxf6+ Qxf6 8. Nc3 c6 9. Qf3,"This is a game between Nunn, John (as White) and Timman, Jan (as Black). Last move played: White plays Queen to f3"," White's move to Qf3 is inadvisable because it hints at a dubious plan of 10.g4. If White could successfully execute this maneuver, it would likely hinder Black's prospects on the g-file."
"White decides he would like to be a pawn ahead, but in doing so he spends precious time and fails to solve the problem of exactly how to develop. Furthermore, now if the c1-bishop ever moves the b2-pawn will hang.",True,"

The comment accurately describes the mistake, highlighting the lack of development and the potential loss of the b2-pawn.",1. e4 e5 2. f4 exf4 3. Nf3 g5 4. h4 g4 5. Ne5 d6 6. Nxg4 Nf6 7. Nxf6+ Qxf6 8. Nc3 c6 9. Qf3 Rg8 10. Qf2 Bg4 11. d3 Bh6 12. Ne2,"This is a game between Nunn, John (as White) and Timman, Jan (as Black). Last move played: White plays Knight to e2"," White's decision to push a pawn forward is risky and inefficient. It wastes valuable time and doesn't address the immediate need to develop pieces properly. This move also creates a vulnerability, as the b2-pawn becomes susceptible to attack if the c1-bishop ever moves."
"White approaches the position thus; the b2-pawn is immune because of Qxa7 in conjunction with Rb1, so it's time to finish development by mobilizing his rooks, and to get out of danger. Apparently it was better to be greedy with 17.Bxe4 or even 17.dxe4. The main idea would be to stop black's next, but it is hard to imagine white ever exploiting his extra pawn on the kingside since he is under so much pressure there.",True,"

The comment accurately explains the mistake made by White, highlighting the poor decision to capture on e4 with the bishop instead of developing a piece, which would have led to a safer and more advantageous position.",1. e4 e5 2. f4 exf4 3. Nf3 g5 4. h4 g4 5. Ne5 d6 6. Nxg4 Nf6 7. Nxf6+ Qxf6 8. Nc3 c6 9. Qf3 Rg8 10. Qf2 Bg4 11. d3 Bh6 12. Ne2 Nd7 13. Nxf4 O-O-O 14. g3 Qe5 15. Bg2 f5 16. O-O fxe4 17. Bd2,"This is a game between Nunn, John (as White) and Timman, Jan (as Black). Last move played: White plays Bishop to d2"," White's last move, Bishop to d2, exposes the position and weakens their defense. It's crucial for White to complete their development by activating their rooks and to address any immediate threats. The decision to capture a pawn on e4 or e4 might not have been the best choice, as White's position on the kingside is precarious. Controlling the center and safeguarding their king should be the priority, but White's resources are limited due to the pressure they are facing."
"After this the g-file looks much more sensitive, and black can use the g4 square for his operations as well.",True,"

The comment correctly explains the mistake made by the player, as it highlights the weakened position of the g-file and suggests that Black can exploit the open g-file for their own strategy and attack.",1. e4 e5 2. f4 exf4 3. Nf3 g5 4. h4 g4 5. Ne5 d6 6. Nxg4 Nf6 7. Nxf6+ Qxf6 8. Nc3 c6 9. Qf3 Rg8 10. Qf2 Bg4 11. d3 Bh6 12. Ne2 Nd7 13. Nxf4 O-O-O 14. g3 Qe5 15. Bg2 f5 16. O-O fxe4 17. Bd2 Bf3,"This is a game between Nunn, John (as White) and Timman, Jan (as Black). Last move played: Black plays Bishop to f3"," The move by Black to play Bishop to f3 was not strategically sound, as it could potentially expose the g-file to White's counterplay. Furthermore, Black's control over the g4 square may invite White to launch operations from there."
"Does white play the King's Gambit to come out like this, curled up into a miserable shell? Black's strategy has been wholly successful, but he still needs to find a way to cash in.",False,"

The comment does not directly explain the mistake made by the player but rather provides an analysis of the overall game situation and Black's strategy.",1. e4 e5 2. f4 exf4 3. Nf3 g5 4. h4 g4 5. Ne5 d6 6. Nxg4 Nf6 7. Nxf6+ Qxf6 8. Nc3 c6 9. Qf3 Rg8 10. Qf2 Bg4 11. d3 Bh6 12. Ne2 Nd7 13. Nxf4 O-O-O 14. g3 Qe5 15. Bg2 f5 16. O-O fxe4 17. Bd2 Bf3 18. Rae1 Rdf8 19. dxe4 Bxg2 20. Kxg2 Rg4 21. Kh3 Rfg8 22. Rg1,"This is a game between Nunn, John (as White) and Timman, Jan (as Black). Last move played: White plays Rook to g1",-
Subtle. He wants to take the knight without allowing gxf4.,True,"

The comment accurately explains that the player made a mistake by attempting to capture the knight, not considering the immediate threat of gxf4.",1. e4 e5 2. f4 exf4 3. Nf3 g5 4. h4 g4 5. Ne5 d6 6. Nxg4 Nf6 7. Nxf6+ Qxf6 8. Nc3 c6 9. Qf3 Rg8 10. Qf2 Bg4 11. d3 Bh6 12. Ne2 Nd7 13. Nxf4 O-O-O 14. g3 Qe5 15. Bg2 f5 16. O-O fxe4 17. Bd2 Bf3 18. Rae1 Rdf8 19. dxe4 Bxg2 20. Kxg2 Rg4 21. Kh3 Rfg8 22. Rg1 Nf6 23. Qf3 Qe7,"This is a game between Nunn, John (as White) and Timman, Jan (as Black). Last move played: Black plays Queen to e7", White played a move that wasn't subtle as intended. White's strategy was to capture the knight without allowing Black to play gxf4.
"It's time. White's position suddenly flops undramatically, obscuring the fine play that brought us to this point.",True,"

The comment accurately highlights the loss of material and strategic advantages due to the mistake made.",1. e4 e5 2. f4 exf4 3. Nf3 g5 4. h4 g4 5. Ne5 d6 6. Nxg4 Nf6 7. Nxf6+ Qxf6 8. Nc3 c6 9. Qf3 Rg8 10. Qf2 Bg4 11. d3 Bh6 12. Ne2 Nd7 13. Nxf4 O-O-O 14. g3 Qe5 15. Bg2 f5 16. O-O fxe4 17. Bd2 Bf3 18. Rae1 Rdf8 19. dxe4 Bxg2 20. Kxg2 Rg4 21. Kh3 Rfg8 22. Rg1 Nf6 23. Qf3 Qe7 24. Rg2 Bxf4 25. Bxf4 Qe6 26. Kh2 Nh5 27. Ree2 Rf8 28. Ref2 Nxf4,"This is a game between Nunn, John (as White) and Timman, Jan (as Black). Last move played: Black plays Knight takes on f4"," The White's recent move has unexpectedly weakened their position, undermining the strategic advancements that led up to this critical juncture."
"Oops. 0-1, set em up for the next game now...",True,"

The comment explains the mistake made by the player as it indicates a loss of material, suggesting that the move led to a disadvantageous position.",1. e4 e5 2. f4 exf4 3. Nf3 g5 4. h4 g4 5. Ne5 d6 6. Nxg4 Nf6 7. Nxf6+ Qxf6 8. Nc3 c6 9. Qf3 Rg8 10. Qf2 Bg4 11. d3 Bh6 12. Ne2 Nd7 13. Nxf4 O-O-O 14. g3 Qe5 15. Bg2 f5 16. O-O fxe4 17. Bd2 Bf3 18. Rae1 Rdf8 19. dxe4 Bxg2 20. Kxg2 Rg4 21. Kh3 Rfg8 22. Rg1 Nf6 23. Qf3 Qe7 24. Rg2 Bxf4 25. Bxf4 Qe6 26. Kh2 Nh5 27. Ree2 Rf8 28. Ref2 Nxf4 29. gxf4 Rxh4+ 30. Kg1 Qxa2,"This is a game between Nunn, John (as White) and Timman, Jan (as Black). Last move played: Black plays Queen takes on a2"," ""Nunn (as White) made an illegal move with their queen, resulting in a loss. Black (as Black) took advantage of this by capturing pawn on a2."""
