comment,good,reasoning,moves,context,engine_eval,engine_best_line,engine_best_alternative
"Kupreichik remains true to himself, heading for a complicated position with opposite side castling. White's chosen plan seems quite promising, since there are good prospects for a kingside pawnstorm.",True," The comment describes a potentially risky and aggressive plan, suggesting a mistake due to over-complexity.",1. e4 c5 2. Nf3 e6 3. d4 cxd4 4. Nxd4 Nc6 5. Nc3 d6 6. Be2 Nf6 7. Be3 Be7 8. f4 O-O 9. Qd2,This is a game between Kupreichik (as White) and Kasparov (as Black). Last move played: White plays Queen to d2,Slight advantage for White (eval: 46 centipawns),9... e5 10. Nf3 ,9. Qd2 
"An energetic Black counterblow in the center, turns the game into different channels.",True,". The comment suggests a potentially aggressive and disruptive move, which contradicts the need for a solid, controlled development.",1. e4 c5 2. Nf3 e6 3. d4 cxd4 4. Nxd4 Nc6 5. Nc3 d6 6. Be2 Nf6 7. Be3 Be7 8. f4 O-O 9. Qd2 e5,This is a game between Kupreichik (as White) and Kasparov (as Black). Last move played: Black plays Pawn to e5,Slight advantage for White (eval: 35 centipawns),10. Nf3 Qa5 ,9... e5 10. Nf3 
"Now all th at remains for White is to play 12.Nd5 and his advantage will be beyond doubt. But as so often happens, that one tempo just isn't there.",True," The comment expresses a belief in White's future advantage, suggesting a lack of tactical drive, which is a common indicator of a mistake.",1. e4 c5 2. Nf3 e6 3. d4 cxd4 4. Nxd4 Nc6 5. Nc3 d6 6. Be2 Nf6 7. Be3 Be7 8. f4 O-O 9. Qd2 e5 10. Nf3 Ng4 11. f5,This is a game between Kupreichik (as White) and Kasparov (as Black). Last move played: White plays Pawn to f5,The position is equal,11... Nb4 12. O-O-O ,11. O-O-O exf4 12. Bg1 Ne3 13. Bxe3 fxe3 14. Qxe3 Be6 15. Nd5 Re8 16. h4 Bxd5 17. Rxd5 Bf6 18. c3 Qb6 19. Qxb6 axb6 20. Bd3 Rxa2 21. Kc2 Kf8 22. Rxd6 Raa8 23. Rd1 Red8 24. Rd5 Rxd5 25. exd5 Ne5 26. Nxe5 Bxe5 
With the threat of 12...Nxe3 and 13...Nxc2 winning White's queen.,True," The comment suggests a potential tactical blunder, indicating a flawed assessment of the resulting position.",1. e4 c5 2. Nf3 e6 3. d4 cxd4 4. Nxd4 Nc6 5. Nc3 d6 6. Be2 Nf6 7. Be3 Be7 8. f4 O-O 9. Qd2 e5 10. Nf3 Ng4 11. f5 Nb4,This is a game between Kupreichik (as White) and Kasparov (as Black). Last move played: Black plays Knight to b4,Slight advantage for Black (eval: -24 centipawns),12. Bg1 d5 13. Nxd5 Nxd5 14. Qxd5 Qxd5 15. exd5 Bxf5 16. c4 e4 17. Nd4 Bd7 18. Nc2 b6 19. a4 Bd6 20. Bd4 Nh6 21. b3 ,11... Nb4 12. O-O-O 
"The unfortunate position of White's pieces and especially of his king makes this combination possible. The coming pin on the e-file destroys White, aided by the diagonal pins on c1-h6 and g1-a7.",True," The comment identifies a specific weakness in the position, suggesting a tactical blunder.",1. e4 c5 2. Nf3 e6 3. d4 cxd4 4. Nxd4 Nc6 5. Nc3 d6 6. Be2 Nf6 7. Be3 Be7 8. f4 O-O 9. Qd2 e5 10. Nf3 Ng4 11. f5 Nb4 12. Bd3 d5 13. Nxd5 Nxd5 14. exd5 e4,This is a game between Kupreichik (as White) and Kasparov (as Black). Last move played: Black plays Pawn to e4,Large advantage for Black (eval: -327 centipawns),15. Bxe4 Re8 16. O-O Bd6 17. h3 Nxe3 18. Qxe3 Bxf5 19. Nd2 Qe7 20. Rxf5 Bc5 21. Qf2 Bxf2+ 22. Rxf2 g6 23. c3 Rad8 24. Bf3 Kg7 25. Rd1 h5 26. g3 ,14... e4 15. Bxe4 Re8 16. O-O Bd6 17. h3 Nxe3 18. Qxe3 Bxf5 19. Nd2 Qe7 20. Rxf5 Bc5 21. Qf2 Bxf2+ 22. Rxf2 g6 23. Rd1 Rad8 24. c4 Qb4 
"Now the combination yields two almost symmetrical variations, depending on which side White castles.",True," The comment suggests a potential weakness in the move, indicating a flaw in the strategic planning.",1. e4 c5 2. Nf3 e6 3. d4 cxd4 4. Nxd4 Nc6 5. Nc3 d6 6. Be2 Nf6 7. Be3 Be7 8. f4 O-O 9. Qd2 e5 10. Nf3 Ng4 11. f5 Nb4 12. Bd3 d5 13. Nxd5 Nxd5 14. exd5 e4 15. Bxe4 Re8,This is a game between Kupreichik (as White) and Kasparov (as Black). Last move played: Black plays Rook to e8,Large advantage for Black (eval: -320 centipawns),16. O-O Bd6 17. h3 Nxe3 18. Qxe3 Bxf5 19. Ng5 Qe7 20. Rxf5 Bc5 21. Qxc5 Qxc5+ 22. Kh1 Qe3 23. Raf1 Rxe4 24. Nxf7 Re7 25. d6 Rxf7 26. Rxf7 Qe6 27. Rxb7 Qxd6 28. Rff7 Qg6 29. Rxa7 Rxa7 30. Rxa7 Qxc2 31. Ra8+ Kf7 32. Ra7+ Kg6 33. Rb7 Qc1+ 34. Kh2 Qc4 35. Rd7 ,15... Re8 16. O-O Bd6 17. h3 Nxe3 18. Qxe3 Bxf5 19. Nd2 Qe7 20. Rxf5 Bc5 21. Qf2 Bxf2+ 22. Rxf2 g6 23. Rd1 Rad8 24. c4 Kg7 25. Bc2 Qc5 26. b3 f5 27. Nf3 b5 28. Ng5 Qe3 29. Ne6+ Rxe6 30. dxe6 Rxd1+ 31. Bxd1 
A powerful move which opens the open file for the Black rook while taking command of the a1-h8 diagonal.,True," The comment describes a potential weakness in the move, suggesting an opening vulnerability.",1. e4 c5 2. Nf3 e6 3. d4 cxd4 4. Nxd4 Nc6 5. Nc3 d6 6. Be2 Nf6 7. Be3 Be7 8. f4 O-O 9. Qd2 e5 10. Nf3 Ng4 11. f5 Nb4 12. Bd3 d5 13. Nxd5 Nxd5 14. exd5 e4 15. Bxe4 Re8 16. O-O-O Bf6,This is a game between Kupreichik (as White) and Kasparov (as Black). Last move played: Black plays Bishop to f6,Large advantage for Black (eval: -345 centipawns),17. Bg5 Rxe4 18. h3 Ne5 19. Bxf6 Qxf6 20. Nxe5 Rxe5 21. d6 Bd7 22. g4 Rae8 23. Kb1 h6 24. b3 Rd8 25. Rhe1 Bc6 26. Rxe5 Qxe5 27. a3 a6 28. a4 Kh7 29. a5 Qg3 30. f6 gxf6 ,16... Bf6 17. Bg5 Rxe4 18. h3 Ne5 19. Bxf6 Qxf6 20. Nxe5 Rxe5 21. g4 Bd7 22. d6 h6 23. Rhe1 Rae8 24. Rxe5 Qxe5 25. Qd4 Qa5 26. Kb1 Qb6 27. Qd2 a6 28. b3 Qc5 29. Kb2 Qe5+ 30. Qd4 Qxd4+ 31. Rxd4 
"Having come to terms with the unavoidable loss of a piece, White vainly tries to exploit Black's slightly backward development. 17.h3 Nxe3 18.Qxe3 Bxf5 19.Nd2 allows Black to win material.",True," The comment describes a potential tactical error and suggests a flawed plan, indicating a mistake.",1. e4 c5 2. Nf3 e6 3. d4 cxd4 4. Nxd4 Nc6 5. Nc3 d6 6. Be2 Nf6 7. Be3 Be7 8. f4 O-O 9. Qd2 e5 10. Nf3 Ng4 11. f5 Nb4 12. Bd3 d5 13. Nxd5 Nxd5 14. exd5 e4 15. Bxe4 Re8 16. O-O-O Bf6 17. Bg5,This is a game between Kupreichik (as White) and Kasparov (as Black). Last move played: White plays Bishop to g5,Large advantage for Black (eval: -336 centipawns),17... Rxe4 18. h3 Ne5 19. Bxf6 Qxf6 20. Nxe5 Rxe5 21. g4 Bd7 22. Rhe1 Rae8 23. Rxe5 Qxe5 24. Qd4 Qg3 25. Qxa7 h5 26. Qxb7 Re1 27. Qb4 Rxd1+ 28. Kxd1 Qxh3 29. gxh5 Qxh5+ 30. Kd2 Qxf5 31. Qb8+ Kh7 32. c4 Qf2+ 33. Kd3 ,17. Bg5 Rxe4 18. h3 Ne5 19. Bxf6 Qxf6 20. Nxe5 Rxe5 21. d6 Bd7 22. g4 Rae8 23. Kb1 h6 24. b3 Rd8 25. Rhe1 Bc6 26. Rxe5 Qxe5 27. a3 a6 28. a4 Kh7 29. a5 Qg3 30. f6 gxf6 
The rest is a matter of technique.,True,". The comment suggests the mistake is due to a lack of skill, which is a common justification for a flawed move.",1. e4 c5 2. Nf3 e6 3. d4 cxd4 4. Nxd4 Nc6 5. Nc3 d6 6. Be2 Nf6 7. Be3 Be7 8. f4 O-O 9. Qd2 e5 10. Nf3 Ng4 11. f5 Nb4 12. Bd3 d5 13. Nxd5 Nxd5 14. exd5 e4 15. Bxe4 Re8 16. O-O-O Bf6 17. Bg5 Rxe4 18. h3 Ne5 19. Bxf6 Qxf6 20. Nxe5 Qxe5 21. g4 Bd7,This is a game between Kupreichik (as White) and Kasparov (as Black). Last move played: Black plays Bishop to d7,Large advantage for Black (eval: -324 centipawns),22. Rhe1 Rxe1 23. Rxe1 Qd6 24. Qd4 Rc8 25. b3 b5 26. Qxa7 Qh2 27. c4 Qd6 28. Re4 h5 29. Kd1 bxc4 30. bxc4 Kh7 31. f6 gxf6 32. Qd4 Qa3 33. gxh5 f5 34. Re2 Rg8 35. c5 ,21... Bd7 22. Rhe1 Re8 23. Rxe4 Qxe4 24. b3 h5 25. Qd4 Qe3+ 26. Kb2 Qxh3 27. gxh5 Qxf5 28. h6 Qe5 29. hxg7 f5 30. Qxe5 Rxe5 31. Kc3 Kxg7 32. Kd4 Re4+ 33. Kc5 f4 34. Kd6 Bf5 35. c4 Kf6 
"This hastens the inevitable. 24.b3 would have been more solid, and allowed further resistance.",True," The comment suggests a potential weakness in the opponent's response, indicating a flawed strategic choice.",1. e4 c5 2. Nf3 e6 3. d4 cxd4 4. Nxd4 Nc6 5. Nc3 d6 6. Be2 Nf6 7. Be3 Be7 8. f4 O-O 9. Qd2 e5 10. Nf3 Ng4 11. f5 Nb4 12. Bd3 d5 13. Nxd5 Nxd5 14. exd5 e4 15. Bxe4 Re8 16. O-O-O Bf6 17. Bg5 Rxe4 18. h3 Ne5 19. Bxf6 Qxf6 20. Nxe5 Qxe5 21. g4 Bd7 22. Rhe1 Re8 23. Rxe4 Qxe4 24. Qa5,This is a game between Kupreichik (as White) and Kasparov (as Black). Last move played: White plays Queen to a5,Large advantage for Black (eval: -442 centipawns),24... Qe3+ 25. Qd2 Qxh3 26. Rg1 Re4 27. d6 h5 28. gxh5 Qxf5 29. h6 Rg4 30. Re1 gxh6 31. b3 Qf6 32. Kb1 Kg7 33. Qd5 Rg5 34. Qd2 Kh7 35. Qd3+ Qg6 36. Qxg6+ Kxg6 ,24. b3 h5 25. Qd4 Qe3+ 26. Qxe3 Rxe3 27. Rh1 Re4 28. Rg1 Kf8 29. c4 Re3 30. Rh1 Re2 31. a4 a5 32. c5 h4 33. Rd1 Re3 34. Kd2 Rxh3 35. Rb1 Rh2+ 36. Ke3 h3 37. b4 Rc2 38. bxa5 Rxc5 39. Rxb7 h2 40. a6 
10.Nf5 Bxf5 11.exf5 d5 gives Black an initiative.,True," The comment suggests the move was unnecessarily difficult, indicating a flaw in the player's assessment.",1. e4 c5 2. Nf3 e6 3. d4 cxd4 4. Nxd4 Nc6 5. Nc3 d6 6. Be2 Nf6 7. Be3 Be7 8. f4 O-O 9. Qd2 e5 10. Nf3,This is a game between Kupreichik (as White) and Kasparov (as Black). Last move played: White plays Knight to f3,Slight advantage for White (eval: 40 centipawns),10... Qa5 ,10. Nf3 Qa5 
