comment,good,reasoning,moves,context,engine_eval,engine_best_line,engine_best_alternative
"Dr. Tartakower (Black) discourages White's planned d2-d4 pawn push, without exercising control over a center square (d4) with a flank pawn.",True," The comment suggests a strategic oversight by Black, potentially hindering their plans.",1. e4 c5,"This is a game between Lasker,Em (as White) and Tartakower,S (as Black). Last move played: Black plays Pawn to c5",Slight advantage for White (eval: 34 centipawns),2. Nf3 ,1... e5 2. Nf3 Nc6 3. d4 exd4 4. Nxd4 Bc5 5. Nb3 Bb6 6. a4 Qh4 7. Qf3 a5 8. g3 Qf6 9. Qe2 Nge7 10. Nc3 
"Tartakower grabs control of central square d5, releases his Queen and without Kingside Bishop, and paves the way for a possible d- or f-pawn advance.",True," The comment describes a series of moves that lead to a weakened position, suggesting a tactical error.",1. e4 c5 2. Nf3 e6,"This is a game between Lasker,Em (as White) and Tartakower,S (as Black). Last move played: Black plays Pawn to e6",Slight advantage for White (eval: 42 centipawns),3. d4 cxd4 ,2... Nc6 3. d4 cxd4 4. Nxd4 g6 5. c4 Nf6 6. Nc3 Nxd4 7. Qxd4 d6 8. Be2 Bg7 9. O-O b6 10. Rd1 Bb7 11. Bg5 O-O 12. Qe3 Nd7 13. Qd2 Nc5 
The usual move here is 3.d4. Lasker instead develops his Knight and without influences d5 and e4. This Knight also eyes a possible jump to without b5.,True," The comment identifies a potential tactical weakness and suggests a specific alternative move, indicating a flawed strategic decision.",1. e4 c5 2. Nf3 e6 3. Nc3,"This is a game between Lasker,Em (as White) and Tartakower,S (as Black). Last move played: White plays Knight to c3",Slight advantage for White (eval: 29 centipawns),3... a6 4. d4 cxd4 5. Nxd4 b5 6. Bd3 Bb7 7. O-O Nc6 8. Nxc6 Bxc6 9. Re1 Bc5 10. a4 b4 11. Nb1 a5 12. Qh5 Qb6 13. Qe2 Nf6 ,3. d4 cxd4 
Lasker now plays d2-d4 (which is usually played on move 3). He's going to without trade off the pawn in return for greater control of the board.,True," The comment suggests a logical error in the move, potentially leading to a weakened position.",1. e4 c5 2. Nf3 e6 3. Nc3 a6 4. d4,"This is a game between Lasker,Em (as White) and Tartakower,S (as Black). Last move played: White plays Pawn to d4",Slight advantage for White (eval: 40 centipawns),4... cxd4 5. Nxd4 b5 6. Bd3 Bb7 7. O-O Nc6 8. Nxc6 Bxc6 9. Re1 Qb8 10. a4 b4 11. Nd5 Bd6 12. a5 Bxh2+ 13. Kf1 Be5 14. f4 Bc7 15. Be3 h5 ,4. d4 
"Tartakower takes the d-pawn (as expected), trading a flank pawn for a more without valuable center pawn.",True, The comment identifies a potential strategic blunder by trading a pawn for a less valuable center position.,1. e4 c5 2. Nf3 e6 3. Nc3 a6 4. d4 cxd4,"This is a game between Lasker,Em (as White) and Tartakower,S (as Black). Last move played: Black plays Pawn takes on d4",Slight advantage for White (eval: 40 centipawns),5. Nxd4 b5 6. Bd3 Bb7 7. O-O Nc6 8. Nxc6 Bxc6 9. Re1 Bc5 10. Qg4 Qf6 11. Qe2 Nh6 12. h3 Qh4 13. a4 b4 14. Nd5 O-O 15. Be3 ,4... cxd4 5. Nxd4 b5 6. Bd3 Bb7 7. O-O Nc6 8. Nxc6 Bxc6 9. Re1 Qb8 10. a4 b4 11. Nd5 Bd6 12. a5 Bxh2+ 13. Kf1 Be5 14. f4 Bc7 15. Be3 h5 
"Early development of the Queen is usually a bad idea, but there's no real without harm yet as White is a long way from developing an attack. Black could without advance his e-pawn to e5 under the Queen's protection, attacking the without d4-Knight.",True," The comment suggests a potential weakness in White's development due to the Queen's early exposure, indicating a flawed strategic choice.",1. e4 c5 2. Nf3 e6 3. Nc3 a6 4. d4 cxd4 5. Nxd4 Qc7,"This is a game between Lasker,Em (as White) and Tartakower,S (as Black). Last move played: Black plays Queen to c7",Slight advantage for White (eval: 49 centipawns),6. Bd3 ,5... b5 
Lasker completes the development of his Kingside minor pieces. The Bishop without controls squares along the d1-h5 and a6-f1 diagonals.,True," The comment describes a potential weakness in the player's development, suggesting an imbalance in piece activity.",1. e4 c5 2. Nf3 e6 3. Nc3 a6 4. d4 cxd4 5. Nxd4 Qc7 6. Be2,"This is a game between Lasker,Em (as White) and Tartakower,S (as Black). Last move played: White plays Bishop to e2",Slight advantage for White (eval: 44 centipawns),6... b5 7. O-O ,6. Bd3 
"Tartakower continues his development as well. Note that the e4-pawn isn't without threatened (it's guarded by the c3-Knight). But now Tartakower could win the without pawn by playing Bf8-b4, pinning the defending Knight.",True," The comment offers a potential explanation for the mistake, suggesting a tactical threat.",1. e4 c5 2. Nf3 e6 3. Nc3 a6 4. d4 cxd4 5. Nxd4 Qc7 6. Be2 Nf6,"This is a game between Lasker,Em (as White) and Tartakower,S (as Black). Last move played: Black plays Knight to f6",Slight advantage for White (eval: 36 centipawns),7. O-O ,6... b5 7. O-O 
"Lasker doesn't intend to give Tartakower the chance to pin the c3-Knight. He without castles, getting the King out of the middle and taking the sting out of without ...Bb4.",True," The comment suggests a strategic deficiency in the move, indicating a potential missed opportunity to create a more active and decisive attack.",1. e4 c5 2. Nf3 e6 3. Nc3 a6 4. d4 cxd4 5. Nxd4 Qc7 6. Be2 Nf6 7. O-O,"This is a game between Lasker,Em (as White) and Tartakower,S (as Black). Last move played: White plays kingside castle",Slight advantage for White (eval: 36 centipawns),7... Be7 8. f4 ,7. O-O 
"Tartakower plays ...Bb4 anyway! The reason for this is to make Rf1-e1 a tad without uncomfortable for White (if White plays the Rook move, he creates a pin on without his own Knight!).",True," The comment provides a potential explanation for the mistake, suggesting a strategic maneuver to create a tactical disadvantage for White.",1. e4 c5 2. Nf3 e6 3. Nc3 a6 4. d4 cxd4 5. Nxd4 Qc7 6. Be2 Nf6 7. O-O Bb4,"This is a game between Lasker,Em (as White) and Tartakower,S (as Black). Last move played: Black plays Bishop to b4",Slight advantage for White (eval: 37 centipawns),8. Bg5 Be7 ,7... Be7 8. f4 
"Lasker was in immediate danger of losing his e-pawn (8...Bxc3 9.bxc3 Nxe4), without so he's forced to make a move that defends the pawn. This wastes a tempo without (since he's moving a piece that he's already moved).",True," The comment highlights a potential tactical blunder and suggests a wasted tempo, indicating a flawed assessment of the resulting position.",1. e4 c5 2. Nf3 e6 3. Nc3 a6 4. d4 cxd4 5. Nxd4 Qc7 6. Be2 Nf6 7. O-O Bb4 8. Bf3,"This is a game between Lasker,Em (as White) and Tartakower,S (as Black). Last move played: White plays Bishop to f3",The position is equal,8... O-O ,8. Bg5 Be7 
Now the pawn structure is balanced (White and Black have the same number of without pawns and they're on the same files).,False,"

The comment describes a potential outcome of a move, not a correction of a mistake, suggesting a misunderstanding of the board position.",1. e4 c5 2. Nf3 e6 3. Nc3 a6 4. d4 cxd4 5. Nxd4 Qc7 6. Be2 Nf6 7. O-O Bb4 8. Bf3 Nc6 9. Nxc6 dxc6,"This is a game between Lasker,Em (as White) and Tartakower,S (as Black). Last move played: Black plays Pawn takes on c6",The position is equal,10. Qe1 Bd6 11. Kh1 e5 12. Be2 Be6 13. Be3 Qe7 14. f3 O-O 15. Qf2 Nd7 16. Rfd1 h6 17. Bf1 b5 18. Ne2 Bc5 19. b3 a5 20. a4 Bxe3 21. Qxe3 ,9... dxc6 
Lasker develops another minor piece. The Bishop moves to a good post where it without controls a lot of squares along the a7-g1 and c1-h6 diagonals.,True," The comment provides a specific analysis of the Bishop's placement, suggesting a potential tactical disadvantage.",1. e4 c5 2. Nf3 e6 3. Nc3 a6 4. d4 cxd4 5. Nxd4 Qc7 6. Be2 Nf6 7. O-O Bb4 8. Bf3 Nc6 9. Nxc6 dxc6 10. Be3,"This is a game between Lasker,Em (as White) and Tartakower,S (as Black). Last move played: White plays Bishop to e3",The position is equal,10... O-O 11. Qe2 b5 12. a4 Bb7 13. Rfd1 h6 14. Nb1 Rfd8 15. Nd2 Nd7 16. h3 bxa4 17. Rxa4 a5 18. Raa1 Ne5 19. Bf4 Nxf3+ 20. Qxf3 e5 21. Be3 ,10. Qe1 Bd6 11. Kh1 e5 12. Be2 Be6 13. Be3 Qe7 14. f3 O-O 15. Qf2 Nd7 16. Rfd1 h6 17. Bf1 b5 18. Ne2 Bc5 19. b3 a5 20. a4 Bxe3 21. Qxe3 
Tartakower completes his Kingside development by castling.,True," The comment suggests a potential flaw in the player's opening strategy, indicating a mistake.",1. e4 c5 2. Nf3 e6 3. Nc3 a6 4. d4 cxd4 5. Nxd4 Qc7 6. Be2 Nf6 7. O-O Bb4 8. Bf3 Nc6 9. Nxc6 dxc6 10. Be3 O-O,"This is a game between Lasker,Em (as White) and Tartakower,S (as Black). Last move played: Black plays kingside castle",The position is equal,11. Qe2 b5 ,10... O-O 11. Qe2 b5 12. a4 Bb7 13. Rfd1 h6 14. Nb1 Rfd8 15. Nd2 Nd7 16. h3 bxa4 17. Rxa4 a5 18. Raa1 Ne5 19. Bf4 Nxf3+ 20. Qxf3 e5 21. Be3 
"Tartakower grabs a little more space (he now controls d4 and f4) and now can without develop his light-squared Bishop to e6 if he chooses. Mainly, he's blocking without the advance of the White e-pawn (e4-e5 threatens the Black without f6-Knight).",True," The comment identifies a positional weakness and a potential threat, suggesting a flawed strategic choice.",1. e4 c5 2. Nf3 e6 3. Nc3 a6 4. d4 cxd4 5. Nxd4 Qc7 6. Be2 Nf6 7. O-O Bb4 8. Bf3 Nc6 9. Nxc6 dxc6 10. Be3 O-O 11. h3 e5,"This is a game between Lasker,Em (as White) and Tartakower,S (as Black). Last move played: Black plays Pawn to e5",Slight advantage for White (eval: 20 centipawns),12. Na4 Be6 ,11... b5 12. e5 Nd7 13. Bf4 Bb7 14. a4 bxa4 15. Rxa4 c5 16. Bxb7 Qxb7 17. Qg4 Bxc3 18. bxc3 Kh8 19. Rfa1 Nb6 20. Rb1 a5 21. Raa1 
"The Knight makes it to the post on b6, forking the Black Rook and Bishop.",True," The comment describes a tactical blunder involving the Knight and pieces, indicating a significant error.",1. e4 c5 2. Nf3 e6 3. Nc3 a6 4. d4 cxd4 5. Nxd4 Qc7 6. Be2 Nf6 7. O-O Bb4 8. Bf3 Nc6 9. Nxc6 dxc6 10. Be3 O-O 11. h3 e5 12. Na4 b5 13. Nb6,"This is a game between Lasker,Em (as White) and Tartakower,S (as Black). Last move played: White plays Knight to b6",Slight advantage for White (eval: 24 centipawns),13... Rb8 14. Nxc8 Rfxc8 15. c4 bxc4 16. Qc2 Ba5 17. Rab1 Bb6 18. Bxb6 Qxb6 19. Qxc4 c5 20. Rfc1 a5 21. Qc3 Qc7 22. Rc2 a4 23. Rbc1 g6 24. Qxc5 Qxc5 25. Rxc5 Rxc5 26. Rxc5 Rxb2 ,13. Nb6 Rb8 
Tartakower proceeds with his plan to attack the Knight. Now 14...Rxb6 15.Bxb6 without Qxb6 nets two minor pieces for a Rook.,True,"

The comment describes a sequence of moves that leads to a loss of material, indicating a flawed strategic plan.",1. e4 c5 2. Nf3 e6 3. Nc3 a6 4. d4 cxd4 5. Nxd4 Qc7 6. Be2 Nf6 7. O-O Bb4 8. Bf3 Nc6 9. Nxc6 dxc6 10. Be3 O-O 11. h3 e5 12. Na4 b5 13. Nb6 Rb8,"This is a game between Lasker,Em (as White) and Tartakower,S (as Black). Last move played: Black plays Rook to b8",Slight advantage for White (eval: 25 centipawns),14. Nxc8 ,13... Rb8 14. Nxc8 Rfxc8 15. c4 bxc4 16. Qc2 Ba5 17. Rab1 Bb6 18. Bxb6 Qxb6 19. Qxc4 c5 20. Rfc1 a5 21. Qc3 Qc7 22. Rc2 a4 23. Rbc1 g6 24. Qxc5 Qxc5 25. Rxc5 Rxc5 26. Rxc5 Rxb2 
Lasker gives up a piece that's moved four times for a piece that hasn't moved without at all! Yet Tartakower has been unable to make any good use of the massive without time advantage that Lasker has given him.,True, The comment highlights a strategic flaw – the lack of development and the missed opportunity – suggesting a significant mistake.,1. e4 c5 2. Nf3 e6 3. Nc3 a6 4. d4 cxd4 5. Nxd4 Qc7 6. Be2 Nf6 7. O-O Bb4 8. Bf3 Nc6 9. Nxc6 dxc6 10. Be3 O-O 11. h3 e5 12. Na4 b5 13. Nb6 Rb8 14. Nxc8,"This is a game between Lasker,Em (as White) and Tartakower,S (as Black). Last move played: White plays Knight takes on c8",Slight advantage for White (eval: 29 centipawns),14... Rfxc8 ,14. Nxc8 Rfxc8 
"Lasker is going to try to get his Rook into the game. If 15...Bxa4, 16.Rxa4. without If Black doesn't capture the a-pawn, then 16.axb5 cxb5 17.Rxa6. Or there's without 16.axb5 axb5 17.Ra7 (the Rook would be guarded by the e3-Bishop).",True," The comment provides a potential plan for Black to counter the threat, suggesting a risky and potentially weakening approach.",1. e4 c5 2. Nf3 e6 3. Nc3 a6 4. d4 cxd4 5. Nxd4 Qc7 6. Be2 Nf6 7. O-O Bb4 8. Bf3 Nc6 9. Nxc6 dxc6 10. Be3 O-O 11. h3 e5 12. Na4 b5 13. Nb6 Rb8 14. Nxc8 Rfxc8 15. a4,"This is a game between Lasker,Em (as White) and Tartakower,S (as Black). Last move played: White plays Pawn to a4",The position is equal,15... Qe7 16. axb5 ,15. c4 bxc4 
"Unless Tartakower moves his Queen, White will force the exchange of Queens without after 16.axb5 axb5 17.Ra7 Qd8 19.Qxd8+ Rxd8, or an exchange of Rooks after without 17.Ra7 Rb7 18.Rxb7 Qxb7.",True," The comment offers a potential explanation for the mistake, suggesting a strategy to avoid a forced exchange of Queens.",1. e4 c5 2. Nf3 e6 3. Nc3 a6 4. d4 cxd4 5. Nxd4 Qc7 6. Be2 Nf6 7. O-O Bb4 8. Bf3 Nc6 9. Nxc6 dxc6 10. Be3 O-O 11. h3 e5 12. Na4 b5 13. Nb6 Rb8 14. Nxc8 Rfxc8 15. a4 Qe7,"This is a game between Lasker,Em (as White) and Tartakower,S (as Black). Last move played: Black plays Queen to e7",Slight advantage for White (eval: 27 centipawns),16. axb5 axb5 17. Ra7 Rb7 18. Rxb7 Qxb7 19. Qe2 Qe7 20. Ra1 Bc5 21. Bd2 Qb7 22. g3 Ra8 23. Rxa8+ Qxa8 24. Kg2 Qd8 25. c3 Be7 26. b4 h6 27. Qe3 Qd6 28. Bc1 ,15... Qe7 16. axb5 
Lasker makes the expected move and trades pawns.,True," The comment suggests a logical inconsistency, indicating a flawed assessment of the move's strategic value.",1. e4 c5 2. Nf3 e6 3. Nc3 a6 4. d4 cxd4 5. Nxd4 Qc7 6. Be2 Nf6 7. O-O Bb4 8. Bf3 Nc6 9. Nxc6 dxc6 10. Be3 O-O 11. h3 e5 12. Na4 b5 13. Nb6 Rb8 14. Nxc8 Rfxc8 15. a4 Qe7 16. axb5,"This is a game between Lasker,Em (as White) and Tartakower,S (as Black). Last move played: White plays Pawn takes on b5",Slight advantage for White (eval: 25 centipawns),16... axb5 17. Ra7 ,16. axb5 axb5 17. Ra7 Rb7 18. Rxb7 Qxb7 19. Qe2 Qe7 20. Ra1 Bc5 21. Bd2 Qb7 22. g3 Ra8 23. Rxa8+ Qxa8 24. Kg2 Qd8 25. c3 Be7 26. b4 h6 27. Qe3 Qd6 28. Bc1 
Tartakower offers to swap Rooks. Moving the Queen back to the first rank was without also possible.,True," The comment highlights a critical error in the move, indicating a potential misjudgment of the board position.",1. e4 c5 2. Nf3 e6 3. Nc3 a6 4. d4 cxd4 5. Nxd4 Qc7 6. Be2 Nf6 7. O-O Bb4 8. Bf3 Nc6 9. Nxc6 dxc6 10. Be3 O-O 11. h3 e5 12. Na4 b5 13. Nb6 Rb8 14. Nxc8 Rfxc8 15. a4 Qe7 16. axb5 axb5 17. Ra7 Rb7,"This is a game between Lasker,Em (as White) and Tartakower,S (as Black). Last move played: Black plays Rook to b7",Slight advantage for White (eval: 29 centipawns),18. Rxb7 Qxb7 ,17... Qf8 
"Lasker takes him up on the offer. Every trade takes the game closer to the without end. By now, it should be obvious that Lasker is playing for a draw; each without even trade in this dead-even position brings him closer to that goal.",True," The comment suggests Lasker is intentionally seeking a draw, implying a flawed assessment of the position's potential.",1. e4 c5 2. Nf3 e6 3. Nc3 a6 4. d4 cxd4 5. Nxd4 Qc7 6. Be2 Nf6 7. O-O Bb4 8. Bf3 Nc6 9. Nxc6 dxc6 10. Be3 O-O 11. h3 e5 12. Na4 b5 13. Nb6 Rb8 14. Nxc8 Rfxc8 15. a4 Qe7 16. axb5 axb5 17. Ra7 Rb7 18. Rxb7,"This is a game between Lasker,Em (as White) and Tartakower,S (as Black). Last move played: White plays Rook takes on b7",Slight advantage for White (eval: 32 centipawns),18... Qxb7 19. Qe2 ,18. Rxb7 Qxb7 
"Tartakower sees that Be3-g5 followed by Bxf6 frees the White Queen and without f3-Bishop from the drudgery of overprotecting the e4-pawn. By advancing the without h-pawn one square, he makes Bg5 impossible for White.",True," The comment offers a potential explanation for the mistake, suggesting a strategic opportunity for White.",1. e4 c5 2. Nf3 e6 3. Nc3 a6 4. d4 cxd4 5. Nxd4 Qc7 6. Be2 Nf6 7. O-O Bb4 8. Bf3 Nc6 9. Nxc6 dxc6 10. Be3 O-O 11. h3 e5 12. Na4 b5 13. Nb6 Rb8 14. Nxc8 Rfxc8 15. a4 Qe7 16. axb5 axb5 17. Ra7 Rb7 18. Rxb7 Qxb7 19. Qd3 h6,"This is a game between Lasker,Em (as White) and Tartakower,S (as Black). Last move played: Black plays Pawn to h6",Slight advantage for White (eval: 33 centipawns),20. Rc1 Rb8 ,19... Qe7 20. Ra1 Rd8 21. Qb3 Bc5 22. g3 h5 23. Bg5 g6 24. Kg2 Kg7 25. Qc3 Rd4 26. b3 b4 27. Qe1 Rd7 28. Qc1 Qe8 29. Bxf6+ Kxf6 30. Qh6 Bd4 
"Lasker, of course, has plans other than Bg5. He sets up a battery on the open without d-file.",True, The comment suggests a strategic miscalculation by the opponent.,1. e4 c5 2. Nf3 e6 3. Nc3 a6 4. d4 cxd4 5. Nxd4 Qc7 6. Be2 Nf6 7. O-O Bb4 8. Bf3 Nc6 9. Nxc6 dxc6 10. Be3 O-O 11. h3 e5 12. Na4 b5 13. Nb6 Rb8 14. Nxc8 Rfxc8 15. a4 Qe7 16. axb5 axb5 17. Ra7 Rb7 18. Rxb7 Qxb7 19. Qd3 h6 20. Rd1,"This is a game between Lasker,Em (as White) and Tartakower,S (as Black). Last move played: White plays Rook to d1",Slight advantage for White (eval: 31 centipawns),20... Qe7 21. c4 ,20. Rc1 Rb8 
Tartakower counters by putting his Rook at the head of the open a-file. without Always try to put your pieces on squares where they have the most play and without can control plenty of territory.,True, The comment offers valuable insight into a suboptimal opening strategy focused on positional control rather than immediate tactical gains.,1. e4 c5 2. Nf3 e6 3. Nc3 a6 4. d4 cxd4 5. Nxd4 Qc7 6. Be2 Nf6 7. O-O Bb4 8. Bf3 Nc6 9. Nxc6 dxc6 10. Be3 O-O 11. h3 e5 12. Na4 b5 13. Nb6 Rb8 14. Nxc8 Rfxc8 15. a4 Qe7 16. axb5 axb5 17. Ra7 Rb7 18. Rxb7 Qxb7 19. Qd3 h6 20. Rd1 Ra8,"This is a game between Lasker,Em (as White) and Tartakower,S (as Black). Last move played: Black plays Rook to a8",Slight advantage for White (eval: 31 centipawns),21. c4 bxc4 ,20... Qe7 21. c4 
"Tartakower retreats the Bishop, saving it (after all, a Bishop is certainly without worth more than a pawn!).",True," The comment suggests a potential strategic error by prioritizing a Bishop over a more active piece, indicating a flawed assessment of the position.",1. e4 c5 2. Nf3 e6 3. Nc3 a6 4. d4 cxd4 5. Nxd4 Qc7 6. Be2 Nf6 7. O-O Bb4 8. Bf3 Nc6 9. Nxc6 dxc6 10. Be3 O-O 11. h3 e5 12. Na4 b5 13. Nb6 Rb8 14. Nxc8 Rfxc8 15. a4 Qe7 16. axb5 axb5 17. Ra7 Rb7 18. Rxb7 Qxb7 19. Qd3 h6 20. Rd1 Ra8 21. g3 Qc8 22. Qb3 Be7,"This is a game between Lasker,Em (as White) and Tartakower,S (as Black). Last move played: Black plays Bishop to e7",Slight advantage for White (eval: 28 centipawns),23. Kg2 ,22... Qf8 23. h4 
"Now Lasker takes defensive action. The King comes to the menaced pawn's without rescue, defending it from the Black Queen.",True," The comment describes a potentially dangerous situation and Lasker’s response, suggesting a flawed tactical assessment.",1. e4 c5 2. Nf3 e6 3. Nc3 a6 4. d4 cxd4 5. Nxd4 Qc7 6. Be2 Nf6 7. O-O Bb4 8. Bf3 Nc6 9. Nxc6 dxc6 10. Be3 O-O 11. h3 e5 12. Na4 b5 13. Nb6 Rb8 14. Nxc8 Rfxc8 15. a4 Qe7 16. axb5 axb5 17. Ra7 Rb7 18. Rxb7 Qxb7 19. Qd3 h6 20. Rd1 Ra8 21. g3 Qc8 22. Qb3 Be7 23. Kh2,"This is a game between Lasker,Em (as White) and Tartakower,S (as Black). Last move played: White plays King to h2",Slight advantage for White (eval: 20 centipawns),23... Ra4 24. Qc3 Nxe4 25. Qxe5 Bf6 26. Bg4 Bxe5 27. Bxc8 Bxb2 28. Rd8+ Kh7 29. Bd7 Rc4 30. Rc8 Nd6 31. Rxc6 Rxc6 32. Bxc6 Nf5 33. Be4 g6 34. Bd2 Be5 ,23. Kg2 
Black's Rook piles up on the White e4-pawn (which is also attacked by the without Black f6-Knight). Now White must defend the pawn a second time.,True, The comment accurately describes a potential complication arising from the pawn structure.,1. e4 c5 2. Nf3 e6 3. Nc3 a6 4. d4 cxd4 5. Nxd4 Qc7 6. Be2 Nf6 7. O-O Bb4 8. Bf3 Nc6 9. Nxc6 dxc6 10. Be3 O-O 11. h3 e5 12. Na4 b5 13. Nb6 Rb8 14. Nxc8 Rfxc8 15. a4 Qe7 16. axb5 axb5 17. Ra7 Rb7 18. Rxb7 Qxb7 19. Qd3 h6 20. Rd1 Ra8 21. g3 Qc8 22. Qb3 Be7 23. Kh2 Ra4,"This is a game between Lasker,Em (as White) and Tartakower,S (as Black). Last move played: Black plays Rook to a4",Slight advantage for White (eval: 24 centipawns),24. Qd3 Qe6 25. b3 Ra8 26. Rb1 Qd6 27. Kg2 Ra2 28. Rc1 Kh7 29. Qxd6 Bxd6 30. c4 Ba3 31. Rb1 bxc4 32. bxc4 Nd7 33. Rb7 Bc5 ,23... Qe6 24. Qxe6 fxe6 25. Bd2 Ra4 26. Bc3 Rc4 27. Be2 Rxe4 28. Bd3 Ra4 29. Bg6 e4 30. Bxf6 gxf6 31. b3 Ra2 32. Rd7 Kf8 33. Bxe4 f5 34. Bd3 Kf7 35. Rc7 c5 36. Bxb5 Rxc2 
"The Queen slides over and re-establishes the d-file battery, defending the without e-pawn at the same time.",True," The comment describes a potentially defensive move that contradicts the intended plan, suggesting a miscalculation.",1. e4 c5 2. Nf3 e6 3. Nc3 a6 4. d4 cxd4 5. Nxd4 Qc7 6. Be2 Nf6 7. O-O Bb4 8. Bf3 Nc6 9. Nxc6 dxc6 10. Be3 O-O 11. h3 e5 12. Na4 b5 13. Nb6 Rb8 14. Nxc8 Rfxc8 15. a4 Qe7 16. axb5 axb5 17. Ra7 Rb7 18. Rxb7 Qxb7 19. Qd3 h6 20. Rd1 Ra8 21. g3 Qc8 22. Qb3 Be7 23. Kh2 Ra4 24. Qd3,"This is a game between Lasker,Em (as White) and Tartakower,S (as Black). Last move played: White plays Queen to d3",Slight advantage for White (eval: 27 centipawns),24... Qe6 25. b3 ,24. Qd3 Qe6 25. b3 Ra8 26. Rb1 Qd6 27. Kg2 Ra2 28. Rc1 Kh7 29. Qxd6 Bxd6 30. c4 Ba3 31. Rb1 bxc4 32. bxc4 Nd7 33. Rb7 Bc5 
"Tartakower pulls the Rook back to the first rank, where it will enjoy more without lateral movement than on any of the other ranks it could have moved to.",True," The comment suggests the Rook’s lack of mobility is a primary reason for the mistake, indicating a strategic flaw.",1. e4 c5 2. Nf3 e6 3. Nc3 a6 4. d4 cxd4 5. Nxd4 Qc7 6. Be2 Nf6 7. O-O Bb4 8. Bf3 Nc6 9. Nxc6 dxc6 10. Be3 O-O 11. h3 e5 12. Na4 b5 13. Nb6 Rb8 14. Nxc8 Rfxc8 15. a4 Qe7 16. axb5 axb5 17. Ra7 Rb7 18. Rxb7 Qxb7 19. Qd3 h6 20. Rd1 Ra8 21. g3 Qc8 22. Qb3 Be7 23. Kh2 Ra4 24. Qd3 Qe6 25. b3 Ra8,"This is a game between Lasker,Em (as White) and Tartakower,S (as Black). Last move played: Black plays Rook to a8",The position is equal,26. Qc3 h5 ,25... Ra8 
"Lasker anticipates ...Rc8 (when the Black Rook will back up the c6-pawn's without advance), so he prepares h3-h4 and Bh3 (skewering the c8-Rook and Queen).",True," The comment offers a potential explanation for the mistake, suggesting a planned counterattack.",1. e4 c5 2. Nf3 e6 3. Nc3 a6 4. d4 cxd4 5. Nxd4 Qc7 6. Be2 Nf6 7. O-O Bb4 8. Bf3 Nc6 9. Nxc6 dxc6 10. Be3 O-O 11. h3 e5 12. Na4 b5 13. Nb6 Rb8 14. Nxc8 Rfxc8 15. a4 Qe7 16. axb5 axb5 17. Ra7 Rb7 18. Rxb7 Qxb7 19. Qd3 h6 20. Rd1 Ra8 21. g3 Qc8 22. Qb3 Be7 23. Kh2 Ra4 24. Qd3 Qe6 25. b3 Ra8 26. Bg2,"This is a game between Lasker,Em (as White) and Tartakower,S (as Black). Last move played: White plays Bishop to g2",The position is equal,26... Rd8 27. Qe2 ,26. Qc3 h5 
"Tartakower prepares the Rook exchange (27.Qe2 Rxd1 28.Qxd1). With the pawn without formations symmetrical, and both players trying to whittle each other's without forces down evenly, the game appears drawish. The players agree to a truce.",True," The comment accurately describes the strategic considerations leading to a drawish outcome, suggesting a lack of decisive pressure.",1. e4 c5 2. Nf3 e6 3. Nc3 a6 4. d4 cxd4 5. Nxd4 Qc7 6. Be2 Nf6 7. O-O Bb4 8. Bf3 Nc6 9. Nxc6 dxc6 10. Be3 O-O 11. h3 e5 12. Na4 b5 13. Nb6 Rb8 14. Nxc8 Rfxc8 15. a4 Qe7 16. axb5 axb5 17. Ra7 Rb7 18. Rxb7 Qxb7 19. Qd3 h6 20. Rd1 Ra8 21. g3 Qc8 22. Qb3 Be7 23. Kh2 Ra4 24. Qd3 Qe6 25. b3 Ra8 26. Bg2 Rd8,"This is a game between Lasker,Em (as White) and Tartakower,S (as Black). Last move played: Black plays Rook to d8",The position is equal,27. Qf1 Rxd1 ,26... Rd8 27. Qe2 
The usual move here is 3.d4. Lasker instead develops his Knight and without influences d5 and e4. This Knight also eyes a possible jump to without b5.,True," The comment identifies a missed opportunity to advance a pawn, suggesting a strategic error.",1. e4 c5 2. Nf3 e6 3. Nc3,"This is a game between Lasker,Em (as White) and Tartakower,S (as Black). Last move played: White plays Knight to c3",Slight advantage for White (eval: 29 centipawns),3... a6 4. d4 cxd4 5. Nxd4 b5 6. Bd3 Bb7 7. O-O Nc6 8. Nxc6 Bxc6 9. Re1 Bc5 10. a4 b4 11. Nb1 a5 12. Qh5 Qb6 13. Qe2 Nf6 ,3. d4 cxd4 
"Early development of the Queen is usually a bad idea, but there's no real without harm yet as White is a long way from developing an attack. Black could without advance his e-pawn to e5 under the Queen's protection, attacking the without d4-Knight.",True, The comment clearly identifies a strategic error – sacrificing a Rook for a less effective recapture – and explains why it was a poor choice.,1. e4 c5 2. Nf3 e6 3. Nc3 a6 4. d4 cxd4 5. Nxd4 Qc7,"This is a game between Lasker,Em (as White) and Tartakower,S (as Black). Last move played: Black plays Queen to c7",Slight advantage for White (eval: 49 centipawns),6. Bd3 ,5... b5 
Lasker completes the development of his Kingside minor pieces. The Bishop without controls squares along the d1-h5 and a6-f1 diagonals.,True," The comment describes a move that doesn't logically follow from the previous position, indicating a mistake.",1. e4 c5 2. Nf3 e6 3. Nc3 a6 4. d4 cxd4 5. Nxd4 Qc7 6. Be2,"This is a game between Lasker,Em (as White) and Tartakower,S (as Black). Last move played: White plays Bishop to e2",Slight advantage for White (eval: 44 centipawns),6... b5 7. O-O ,6. Bd3 
Dr. Lasker (White) makes a center-controlling pawn move that allows the without future development of his Queen and Kingside Bishop.,True," The comment identifies a potential weakness in Lasker's play, suggesting a lack of strategic development.",1. e4,"This is a game between Lasker,Em (as White) and Tartakower,S (as Black). Last move played: White plays Pawn to e4",Slight advantage for White (eval: 33 centipawns),1... e5 2. Nf3 Nc6 3. d4 exd4 4. Nxd4 Bc5 5. Nb3 Bb6 6. a4 Qh4 7. Qf3 a5 8. g3 Qf6 9. Qe2 Nge7 10. Nc3 ,1. e4 e5 
Dr. Lasker (White) makes a center-controlling pawn move that allows the without future development of his Queen and Kingside Bishop.,True," The comment suggests a potential tactical error due to the Knight's influence, indicating a flawed strategic assessment.",1. e4,"This is a game between Lasker,Em (as White) and Tartakower,S (as Black). Last move played: White plays Pawn to e4",Slight advantage for White (eval: 33 centipawns),1... e5 2. Nf3 Nc6 3. d4 exd4 4. Nxd4 Bc5 5. Nb3 Bb6 6. a4 Qh4 7. Qf3 a5 8. g3 Qf6 9. Qe2 Nge7 10. Nc3 ,1. e4 e5 
