comment,good,reasoning,moves,context,engine_eval,engine_best_line,engine_best_alternative
The White Rook prepares to get behind the Black a-pawn (the rule about Rooks belonging behind passed pawns also applies to ENEMY passed pawns! It's hard for the pawn to promote with your Rook breathing down its neck).,True," The comment highlights a logical error regarding Rook placement, suggesting the player misapplied a rule.",1. e4 e5 2. Nf3 Nc6 3. Bb5 Nf6 4. d4 exd4 5. Nxd4 Be7 6. O-O a6 7. Nxc6 bxc6 8. Bd3 d6 9. Nc3 O-O 10. f4 Re8 11. Kh1 Nd7 12. Be3 Bf6 13. Qf3 Rb8 14. Rab1 Bxc3 15. bxc3 Rxb1 16. Rxb1 c5 17. c4 Qe7 18. h3 Nf6 19. Bf2 Bd7 20. e5 dxe5 21. fxe5 Qxe5 22. Bg3 Qe6 23. Bxc7 Bc6 24. Qf5 Qxf5 25. Bxf5 Be4 26. Bxe4 Nxe4 27. Rb6 Ra8 28. Rc6 h5 29. Bb6 h4 30. Kg1 Re8 31. Bxc5 Rd8 32. Kf1 Rd2 33. a4 Rxc2 34. Bb4 Rf2+ 35. Kg1 Ra2 36. Be1 Rxa4 37. Bxh4 Nd2 38. Bd8 Nxc4 39. g4 Nd2 40. Rc8,"This is a game between Bogoljubow,E (as White) and Lasker,Em (as Black). Last move played: White plays Rook to c8",Slight advantage for Black (eval: -20 centipawns),40... Kh7 ,40. Kf2 a5 
"Now the pawn will have a tough time promoting, plus the Black Rook is tied to the pawn's defense. Of course, Lasker could just give up the pawn, hoping that his theoretical Knight vs. Bishop advantage (with pawns on one side of the board) will carry the day.",True," The comment suggests a strategic disadvantage for the promoting pawn, highlighting a potential tactical threat and a reliance on a theoretical advantage, indicating a flawed assessment of the position.",1. e4 e5 2. Nf3 Nc6 3. Bb5 Nf6 4. d4 exd4 5. Nxd4 Be7 6. O-O a6 7. Nxc6 bxc6 8. Bd3 d6 9. Nc3 O-O 10. f4 Re8 11. Kh1 Nd7 12. Be3 Bf6 13. Qf3 Rb8 14. Rab1 Bxc3 15. bxc3 Rxb1 16. Rxb1 c5 17. c4 Qe7 18. h3 Nf6 19. Bf2 Bd7 20. e5 dxe5 21. fxe5 Qxe5 22. Bg3 Qe6 23. Bxc7 Bc6 24. Qf5 Qxf5 25. Bxf5 Be4 26. Bxe4 Nxe4 27. Rb6 Ra8 28. Rc6 h5 29. Bb6 h4 30. Kg1 Re8 31. Bxc5 Rd8 32. Kf1 Rd2 33. a4 Rxc2 34. Bb4 Rf2+ 35. Kg1 Ra2 36. Be1 Rxa4 37. Bxh4 Nd2 38. Bd8 Nxc4 39. g4 Nd2 40. Rc8 Kh7 41. Ra8,"This is a game between Bogoljubow,E (as White) and Lasker,Em (as Black). Last move played: White plays Rook to a8",The position is equal,41... Nf3+ 42. Kf2 Nd4 43. Be7 Nc6 44. Bd6 a5 45. Rc8 Ra2+ 46. Ke3 Rc2 47. h4 Rc4 48. g5 Kg6 49. Rc7 a4 50. h5+ Kxh5 51. Rxf7 a3 52. Bxa3 Rc3+ 53. Kd2 Rxa3 54. Rxg7 Ra6 ,41. Kg2 
"Lasker looks forward to next moving his Knight and penning the White King on the back rank (remember the Rook's ""invisible force field""? The Rook would control the second rank and the King would be unable to cross it).",True," The comment describes a potentially dangerous tactical threat, suggesting a flawed plan.",1. e4 e5 2. Nf3 Nc6 3. Bb5 Nf6 4. d4 exd4 5. Nxd4 Be7 6. O-O a6 7. Nxc6 bxc6 8. Bd3 d6 9. Nc3 O-O 10. f4 Re8 11. Kh1 Nd7 12. Be3 Bf6 13. Qf3 Rb8 14. Rab1 Bxc3 15. bxc3 Rxb1 16. Rxb1 c5 17. c4 Qe7 18. h3 Nf6 19. Bf2 Bd7 20. e5 dxe5 21. fxe5 Qxe5 22. Bg3 Qe6 23. Bxc7 Bc6 24. Qf5 Qxf5 25. Bxf5 Be4 26. Bxe4 Nxe4 27. Rb6 Ra8 28. Rc6 h5 29. Bb6 h4 30. Kg1 Re8 31. Bxc5 Rd8 32. Kf1 Rd2 33. a4 Rxc2 34. Bb4 Rf2+ 35. Kg1 Ra2 36. Be1 Rxa4 37. Bxh4 Nd2 38. Bd8 Nxc4 39. g4 Nd2 40. Rc8 Kh7 41. Ra8 Ra2,"This is a game between Bogoljubow,E (as White) and Lasker,Em (as Black). Last move played: Black plays Rook to a2",The position is equal,42. Kf2 ,41... Nf3+ 42. Kf2 Nd4 43. Be7 Nc6 44. Bd6 a5 45. Rc8 Ra2+ 46. Ke3 Rc2 47. h4 Rc4 48. g5 Kg6 49. Rc7 a4 50. h5+ Kxh5 51. Rxf7 a3 52. Bxa3 Rc3+ 53. Kd2 Rxa3 54. Rxg7 Ra6 
"Bogo sees through Lasker's plan. The King enters the second rank, shielded (ironically) by the Black Knight!",True," The comment provides a potential explanation for the mistake, suggesting a defensive maneuver designed to counter Lasker’s plan.",1. e4 e5 2. Nf3 Nc6 3. Bb5 Nf6 4. d4 exd4 5. Nxd4 Be7 6. O-O a6 7. Nxc6 bxc6 8. Bd3 d6 9. Nc3 O-O 10. f4 Re8 11. Kh1 Nd7 12. Be3 Bf6 13. Qf3 Rb8 14. Rab1 Bxc3 15. bxc3 Rxb1 16. Rxb1 c5 17. c4 Qe7 18. h3 Nf6 19. Bf2 Bd7 20. e5 dxe5 21. fxe5 Qxe5 22. Bg3 Qe6 23. Bxc7 Bc6 24. Qf5 Qxf5 25. Bxf5 Be4 26. Bxe4 Nxe4 27. Rb6 Ra8 28. Rc6 h5 29. Bb6 h4 30. Kg1 Re8 31. Bxc5 Rd8 32. Kf1 Rd2 33. a4 Rxc2 34. Bb4 Rf2+ 35. Kg1 Ra2 36. Be1 Rxa4 37. Bxh4 Nd2 38. Bd8 Nxc4 39. g4 Nd2 40. Rc8 Kh7 41. Ra8 Ra2 42. Kg2,"This is a game between Bogoljubow,E (as White) and Lasker,Em (as Black). Last move played: White plays King to g2",The position is equal,42... Nc4+ 43. Kg3 ,42. Kf2 
"The Knight begins a trek to get closer to White's pieces, and uncovers a check on the White King.",True," The comment describes a potential tactical threat, suggesting the move was flawed.",1. e4 e5 2. Nf3 Nc6 3. Bb5 Nf6 4. d4 exd4 5. Nxd4 Be7 6. O-O a6 7. Nxc6 bxc6 8. Bd3 d6 9. Nc3 O-O 10. f4 Re8 11. Kh1 Nd7 12. Be3 Bf6 13. Qf3 Rb8 14. Rab1 Bxc3 15. bxc3 Rxb1 16. Rxb1 c5 17. c4 Qe7 18. h3 Nf6 19. Bf2 Bd7 20. e5 dxe5 21. fxe5 Qxe5 22. Bg3 Qe6 23. Bxc7 Bc6 24. Qf5 Qxf5 25. Bxf5 Be4 26. Bxe4 Nxe4 27. Rb6 Ra8 28. Rc6 h5 29. Bb6 h4 30. Kg1 Re8 31. Bxc5 Rd8 32. Kf1 Rd2 33. a4 Rxc2 34. Bb4 Rf2+ 35. Kg1 Ra2 36. Be1 Rxa4 37. Bxh4 Nd2 38. Bd8 Nxc4 39. g4 Nd2 40. Rc8 Kh7 41. Ra8 Ra2 42. Kg2 Nb3+,"This is a game between Bogoljubow,E (as White) and Lasker,Em (as Black). Last move played: Black plays Knight to b3 with check",The position is equal,43. Kg3 Nd4 44. Bc7 Nc6 45. h4 Ra4 46. h5 f6 47. Bd6 Rd4 48. Bf4 a5 49. Kf3 a4 50. g5 fxg5 51. Bxg5 Rc4 52. Be3 Ne5+ 53. Ke2 ,42... Nc4+ 43. Kg3 
The King flees to the third rank (to prevent getting trapped on the back rank).,True,", The comment suggests a defensive move to avoid a potential threat, indicating a flawed strategic assessment.",1. e4 e5 2. Nf3 Nc6 3. Bb5 Nf6 4. d4 exd4 5. Nxd4 Be7 6. O-O a6 7. Nxc6 bxc6 8. Bd3 d6 9. Nc3 O-O 10. f4 Re8 11. Kh1 Nd7 12. Be3 Bf6 13. Qf3 Rb8 14. Rab1 Bxc3 15. bxc3 Rxb1 16. Rxb1 c5 17. c4 Qe7 18. h3 Nf6 19. Bf2 Bd7 20. e5 dxe5 21. fxe5 Qxe5 22. Bg3 Qe6 23. Bxc7 Bc6 24. Qf5 Qxf5 25. Bxf5 Be4 26. Bxe4 Nxe4 27. Rb6 Ra8 28. Rc6 h5 29. Bb6 h4 30. Kg1 Re8 31. Bxc5 Rd8 32. Kf1 Rd2 33. a4 Rxc2 34. Bb4 Rf2+ 35. Kg1 Ra2 36. Be1 Rxa4 37. Bxh4 Nd2 38. Bd8 Nxc4 39. g4 Nd2 40. Rc8 Kh7 41. Ra8 Ra2 42. Kg2 Nb3+ 43. Kg3,"This is a game between Bogoljubow,E (as White) and Lasker,Em (as Black). Last move played: White plays King to g3",The position is equal,43... Nd4 44. Bc7 Ra3+ 45. Kg2 Nc6 46. h4 Ra4 47. Kg3 f6 48. h5 Ra3+ 49. Kg2 a5 50. Bf4 Ra2+ 51. Kg3 Ra4 52. Ra6 ,43. Kg3 Nd4 44. Bc7 Nc6 45. h4 Ra4 46. h5 f6 47. Bd6 Rd4 48. Bf4 a5 49. Kf3 a4 50. g5 fxg5 51. Bxg5 Rc4 52. Be3 Ne5+ 53. Ke2 
"The Knight gets to the center of the board. Now it has the choice of heading to the Kingside to harass White's King, or to the Queenside to harry White's pieces.",True," The comment suggests a tactical error by moving the Knight, potentially creating a threat.",1. e4 e5 2. Nf3 Nc6 3. Bb5 Nf6 4. d4 exd4 5. Nxd4 Be7 6. O-O a6 7. Nxc6 bxc6 8. Bd3 d6 9. Nc3 O-O 10. f4 Re8 11. Kh1 Nd7 12. Be3 Bf6 13. Qf3 Rb8 14. Rab1 Bxc3 15. bxc3 Rxb1 16. Rxb1 c5 17. c4 Qe7 18. h3 Nf6 19. Bf2 Bd7 20. e5 dxe5 21. fxe5 Qxe5 22. Bg3 Qe6 23. Bxc7 Bc6 24. Qf5 Qxf5 25. Bxf5 Be4 26. Bxe4 Nxe4 27. Rb6 Ra8 28. Rc6 h5 29. Bb6 h4 30. Kg1 Re8 31. Bxc5 Rd8 32. Kf1 Rd2 33. a4 Rxc2 34. Bb4 Rf2+ 35. Kg1 Ra2 36. Be1 Rxa4 37. Bxh4 Nd2 38. Bd8 Nxc4 39. g4 Nd2 40. Rc8 Kh7 41. Ra8 Ra2 42. Kg2 Nb3+ 43. Kg3 Nd4,"This is a game between Bogoljubow,E (as White) and Lasker,Em (as Black). Last move played: Black plays Knight to d4",Slight advantage for Black (eval: -22 centipawns),44. Be7 Nc6 45. Bd6 Ra4 46. Rc8 Nd4 47. Ra8 f6 48. Bf8 a5 49. Bc5 Ne6 50. Be7 Kg6 51. h4 Ra1 52. Bd6 Rg1+ 53. Kh3 Rd1 54. Ra6 ,43... Nd4 44. Bc7 Ra3+ 45. Kg2 Nc6 46. h4 Ra4 47. Kg3 f6 48. h5 Ra3+ 49. Kg2 a5 50. Bf4 Ra2+ 51. Kg3 Ra4 52. Ra6 
"The Black Rook just keeps annoying the White King. Now it's either 45.Kf4 (and Black's pieces and pawns have a good chance of trapping the King), or else...",True," The comment suggests a potential tactical threat to the King, indicating a flawed move.",1. e4 e5 2. Nf3 Nc6 3. Bb5 Nf6 4. d4 exd4 5. Nxd4 Be7 6. O-O a6 7. Nxc6 bxc6 8. Bd3 d6 9. Nc3 O-O 10. f4 Re8 11. Kh1 Nd7 12. Be3 Bf6 13. Qf3 Rb8 14. Rab1 Bxc3 15. bxc3 Rxb1 16. Rxb1 c5 17. c4 Qe7 18. h3 Nf6 19. Bf2 Bd7 20. e5 dxe5 21. fxe5 Qxe5 22. Bg3 Qe6 23. Bxc7 Bc6 24. Qf5 Qxf5 25. Bxf5 Be4 26. Bxe4 Nxe4 27. Rb6 Ra8 28. Rc6 h5 29. Bb6 h4 30. Kg1 Re8 31. Bxc5 Rd8 32. Kf1 Rd2 33. a4 Rxc2 34. Bb4 Rf2+ 35. Kg1 Ra2 36. Be1 Rxa4 37. Bxh4 Nd2 38. Bd8 Nxc4 39. g4 Nd2 40. Rc8 Kh7 41. Ra8 Ra2 42. Kg2 Nb3+ 43. Kg3 Nd4 44. h4 Ra3+,"This is a game between Bogoljubow,E (as White) and Lasker,Em (as Black). Last move played: Black plays Rook to a3 with check",The position is equal,45. Kg2 Ra4 ,44... Ra3+ 45. Kg2 
"...45.Kf2, which means that the White King is cut off from the rest of the board (because of the Rook's ""force field"" along White's third rank).",True," The comment accurately identifies a potential threat to the White King, suggesting a tactical vulnerability.",1. e4 e5 2. Nf3 Nc6 3. Bb5 Nf6 4. d4 exd4 5. Nxd4 Be7 6. O-O a6 7. Nxc6 bxc6 8. Bd3 d6 9. Nc3 O-O 10. f4 Re8 11. Kh1 Nd7 12. Be3 Bf6 13. Qf3 Rb8 14. Rab1 Bxc3 15. bxc3 Rxb1 16. Rxb1 c5 17. c4 Qe7 18. h3 Nf6 19. Bf2 Bd7 20. e5 dxe5 21. fxe5 Qxe5 22. Bg3 Qe6 23. Bxc7 Bc6 24. Qf5 Qxf5 25. Bxf5 Be4 26. Bxe4 Nxe4 27. Rb6 Ra8 28. Rc6 h5 29. Bb6 h4 30. Kg1 Re8 31. Bxc5 Rd8 32. Kf1 Rd2 33. a4 Rxc2 34. Bb4 Rf2+ 35. Kg1 Ra2 36. Be1 Rxa4 37. Bxh4 Nd2 38. Bd8 Nxc4 39. g4 Nd2 40. Rc8 Kh7 41. Ra8 Ra2 42. Kg2 Nb3+ 43. Kg3 Nd4 44. h4 Ra3+ 45. Kf2,"This is a game between Bogoljubow,E (as White) and Lasker,Em (as Black). Last move played: White plays King to f2",The position is equal,45... Ra2+ 46. Kg3 ,45. Kg2 Ra4 
"Foresight is necessary in endgames, particularly in those where Knights are involved. Black isn't just attacking the Bishop; he's planning to attack the h4-pawn via Nc6-e7-g6-h4.",True," The comment suggests a strategic consideration beyond simple attack, indicating a flawed assessment of the position.",1. e4 e5 2. Nf3 Nc6 3. Bb5 Nf6 4. d4 exd4 5. Nxd4 Be7 6. O-O a6 7. Nxc6 bxc6 8. Bd3 d6 9. Nc3 O-O 10. f4 Re8 11. Kh1 Nd7 12. Be3 Bf6 13. Qf3 Rb8 14. Rab1 Bxc3 15. bxc3 Rxb1 16. Rxb1 c5 17. c4 Qe7 18. h3 Nf6 19. Bf2 Bd7 20. e5 dxe5 21. fxe5 Qxe5 22. Bg3 Qe6 23. Bxc7 Bc6 24. Qf5 Qxf5 25. Bxf5 Be4 26. Bxe4 Nxe4 27. Rb6 Ra8 28. Rc6 h5 29. Bb6 h4 30. Kg1 Re8 31. Bxc5 Rd8 32. Kf1 Rd2 33. a4 Rxc2 34. Bb4 Rf2+ 35. Kg1 Ra2 36. Be1 Rxa4 37. Bxh4 Nd2 38. Bd8 Nxc4 39. g4 Nd2 40. Rc8 Kh7 41. Ra8 Ra2 42. Kg2 Nb3+ 43. Kg3 Nd4 44. h4 Ra3+ 45. Kf2 Nc6,"This is a game between Bogoljubow,E (as White) and Lasker,Em (as Black). Last move played: Black plays Knight to c6",The position is equal,46. Bc7 Nd4 ,45... Ra2+ 46. Kg3 
"The Bishop must abandon the d8-h4 diagonal. 46.Bg5 is met with 46...f6, forcing the Bishop far out of play.",True," The comment identifies a tactical blunder and suggests a potential weakness, indicating a flawed assessment of the position.",1. e4 e5 2. Nf3 Nc6 3. Bb5 Nf6 4. d4 exd4 5. Nxd4 Be7 6. O-O a6 7. Nxc6 bxc6 8. Bd3 d6 9. Nc3 O-O 10. f4 Re8 11. Kh1 Nd7 12. Be3 Bf6 13. Qf3 Rb8 14. Rab1 Bxc3 15. bxc3 Rxb1 16. Rxb1 c5 17. c4 Qe7 18. h3 Nf6 19. Bf2 Bd7 20. e5 dxe5 21. fxe5 Qxe5 22. Bg3 Qe6 23. Bxc7 Bc6 24. Qf5 Qxf5 25. Bxf5 Be4 26. Bxe4 Nxe4 27. Rb6 Ra8 28. Rc6 h5 29. Bb6 h4 30. Kg1 Re8 31. Bxc5 Rd8 32. Kf1 Rd2 33. a4 Rxc2 34. Bb4 Rf2+ 35. Kg1 Ra2 36. Be1 Rxa4 37. Bxh4 Nd2 38. Bd8 Nxc4 39. g4 Nd2 40. Rc8 Kh7 41. Ra8 Ra2 42. Kg2 Nb3+ 43. Kg3 Nd4 44. h4 Ra3+ 45. Kf2 Nc6 46. Bc7,"This is a game between Bogoljubow,E (as White) and Lasker,Em (as Black). Last move played: White plays Bishop to c7",The position is equal,46... Ra2+ 47. Kg3 ,46. Bc7 Nd4 
OUCH! The Bishop springs a double-attack against both of Black's pieces! But there's a way out -- will Lasker find it?,True,", The comment suggests a potential tactical error and a possible solution, indicating a thoughtful assessment of the position.",1. e4 e5 2. Nf3 Nc6 3. Bb5 Nf6 4. d4 exd4 5. Nxd4 Be7 6. O-O a6 7. Nxc6 bxc6 8. Bd3 d6 9. Nc3 O-O 10. f4 Re8 11. Kh1 Nd7 12. Be3 Bf6 13. Qf3 Rb8 14. Rab1 Bxc3 15. bxc3 Rxb1 16. Rxb1 c5 17. c4 Qe7 18. h3 Nf6 19. Bf2 Bd7 20. e5 dxe5 21. fxe5 Qxe5 22. Bg3 Qe6 23. Bxc7 Bc6 24. Qf5 Qxf5 25. Bxf5 Be4 26. Bxe4 Nxe4 27. Rb6 Ra8 28. Rc6 h5 29. Bb6 h4 30. Kg1 Re8 31. Bxc5 Rd8 32. Kf1 Rd2 33. a4 Rxc2 34. Bb4 Rf2+ 35. Kg1 Ra2 36. Be1 Rxa4 37. Bxh4 Nd2 38. Bd8 Nxc4 39. g4 Nd2 40. Rc8 Kh7 41. Ra8 Ra2 42. Kg2 Nb3+ 43. Kg3 Nd4 44. h4 Ra3+ 45. Kf2 Nc6 46. Bc7 Ne7 47. Bd6,"This is a game between Bogoljubow,E (as White) and Lasker,Em (as Black). Last move played: White plays Bishop to d6",The position is equal,47... Ra2+ ,47. Bd6 Ra2+ 48. Ke3 Nd5+ 49. Kf3 Nb6 50. Rf8 Ra1 51. Rb8 Nd5 52. Rb7 Rc1 53. Ke4 Nc3+ 54. Ke3 Rf1 55. Bf8 a5 56. Ra7 a4 57. Ra5 
White has no time to capture the Knight. He must spent his tempo in getting out of check...,True," The comment suggests the player’s tempo was wasted on a defensive maneuver, indicating a flawed assessment of the resulting threat.",1. e4 e5 2. Nf3 Nc6 3. Bb5 Nf6 4. d4 exd4 5. Nxd4 Be7 6. O-O a6 7. Nxc6 bxc6 8. Bd3 d6 9. Nc3 O-O 10. f4 Re8 11. Kh1 Nd7 12. Be3 Bf6 13. Qf3 Rb8 14. Rab1 Bxc3 15. bxc3 Rxb1 16. Rxb1 c5 17. c4 Qe7 18. h3 Nf6 19. Bf2 Bd7 20. e5 dxe5 21. fxe5 Qxe5 22. Bg3 Qe6 23. Bxc7 Bc6 24. Qf5 Qxf5 25. Bxf5 Be4 26. Bxe4 Nxe4 27. Rb6 Ra8 28. Rc6 h5 29. Bb6 h4 30. Kg1 Re8 31. Bxc5 Rd8 32. Kf1 Rd2 33. a4 Rxc2 34. Bb4 Rf2+ 35. Kg1 Ra2 36. Be1 Rxa4 37. Bxh4 Nd2 38. Bd8 Nxc4 39. g4 Nd2 40. Rc8 Kh7 41. Ra8 Ra2 42. Kg2 Nb3+ 43. Kg3 Nd4 44. h4 Ra3+ 45. Kf2 Nc6 46. Bc7 Ne7 47. Bd6 Ra2+ 48. Kf3,"This is a game between Bogoljubow,E (as White) and Lasker,Em (as Black). Last move played: White plays King to f3",The position is equal,48... Nc6 49. h5 ,48. Ke3 
"The King must move to get out of check, so it moves to a new square where it can guard its pawns.",True," The comment suggests a defensive move, but it doesn't address why the initial move was flawed.",1. e4 e5 2. Nf3 Nc6 3. Bb5 Nf6 4. d4 exd4 5. Nxd4 Be7 6. O-O a6 7. Nxc6 bxc6 8. Bd3 d6 9. Nc3 O-O 10. f4 Re8 11. Kh1 Nd7 12. Be3 Bf6 13. Qf3 Rb8 14. Rab1 Bxc3 15. bxc3 Rxb1 16. Rxb1 c5 17. c4 Qe7 18. h3 Nf6 19. Bf2 Bd7 20. e5 dxe5 21. fxe5 Qxe5 22. Bg3 Qe6 23. Bxc7 Bc6 24. Qf5 Qxf5 25. Bxf5 Be4 26. Bxe4 Nxe4 27. Rb6 Ra8 28. Rc6 h5 29. Bb6 h4 30. Kg1 Re8 31. Bxc5 Rd8 32. Kf1 Rd2 33. a4 Rxc2 34. Bb4 Rf2+ 35. Kg1 Ra2 36. Be1 Rxa4 37. Bxh4 Nd2 38. Bd8 Nxc4 39. g4 Nd2 40. Rc8 Kh7 41. Ra8 Ra2 42. Kg2 Nb3+ 43. Kg3 Nd4 44. h4 Ra3+ 45. Kf2 Nc6 46. Bc7 Ne7 47. Bd6 Ra2+ 48. Kf3 Nc6 49. Bc7 Nd4+ 50. Kg3,"This is a game between Bogoljubow,E (as White) and Lasker,Em (as Black). Last move played: White plays King to g3",The position is equal,50... Ra3+ 51. Kf2 Ra4 52. Kg3 f6 53. Ra7 Nb5 54. Rb7 Nc3 55. Ra7 Ra3 56. Kf2 Nb5 57. Rb7 Rd3 58. Bf4 Rb3 59. g5 Nd4 60. Rxb3 Nxb3 61. gxf6 gxf6 62. Ke3 ,50. Kg3 Ra3+ 51. Kf2 f6 52. Ra7 Ra2+ 53. Kg3 Ra4 54. Ra8 Ra3+ 55. Kf2 Rf3+ 56. Kg2 Rc3 57. Bd6 Rc6 58. Bg3 Rc2+ 59. Kh3 Rc3 60. Kg2 Ra3 61. Bc7 Ne6 62. Bd6 Ra4 
It's pretty obvious that the King has to withdraw to the second rank (see the variation).,True," The comment suggests a potential tactical error, indicating a move that could lead to a loss of the King.",1. e4 e5 2. Nf3 Nc6 3. Bb5 Nf6 4. d4 exd4 5. Nxd4 Be7 6. O-O a6 7. Nxc6 bxc6 8. Bd3 d6 9. Nc3 O-O 10. f4 Re8 11. Kh1 Nd7 12. Be3 Bf6 13. Qf3 Rb8 14. Rab1 Bxc3 15. bxc3 Rxb1 16. Rxb1 c5 17. c4 Qe7 18. h3 Nf6 19. Bf2 Bd7 20. e5 dxe5 21. fxe5 Qxe5 22. Bg3 Qe6 23. Bxc7 Bc6 24. Qf5 Qxf5 25. Bxf5 Be4 26. Bxe4 Nxe4 27. Rb6 Ra8 28. Rc6 h5 29. Bb6 h4 30. Kg1 Re8 31. Bxc5 Rd8 32. Kf1 Rd2 33. a4 Rxc2 34. Bb4 Rf2+ 35. Kg1 Ra2 36. Be1 Rxa4 37. Bxh4 Nd2 38. Bd8 Nxc4 39. g4 Nd2 40. Rc8 Kh7 41. Ra8 Ra2 42. Kg2 Nb3+ 43. Kg3 Nd4 44. h4 Ra3+ 45. Kf2 Nc6 46. Bc7 Ne7 47. Bd6 Ra2+ 48. Kf3 Nc6 49. Bc7 Nd4+ 50. Kg3 Ra3+ 51. Kf2,"This is a game between Bogoljubow,E (as White) and Lasker,Em (as Black). Last move played: White plays King to f2",The position is equal,51... f6 ,51. Kf2 
"Bogo has to keep the bases covered, so the King returns to g3 to defend the pawns.",True," The comment suggests a defensive move to protect the pawns, which is a common mistake when a move is considered a mistake.",1. e4 e5 2. Nf3 Nc6 3. Bb5 Nf6 4. d4 exd4 5. Nxd4 Be7 6. O-O a6 7. Nxc6 bxc6 8. Bd3 d6 9. Nc3 O-O 10. f4 Re8 11. Kh1 Nd7 12. Be3 Bf6 13. Qf3 Rb8 14. Rab1 Bxc3 15. bxc3 Rxb1 16. Rxb1 c5 17. c4 Qe7 18. h3 Nf6 19. Bf2 Bd7 20. e5 dxe5 21. fxe5 Qxe5 22. Bg3 Qe6 23. Bxc7 Bc6 24. Qf5 Qxf5 25. Bxf5 Be4 26. Bxe4 Nxe4 27. Rb6 Ra8 28. Rc6 h5 29. Bb6 h4 30. Kg1 Re8 31. Bxc5 Rd8 32. Kf1 Rd2 33. a4 Rxc2 34. Bb4 Rf2+ 35. Kg1 Ra2 36. Be1 Rxa4 37. Bxh4 Nd2 38. Bd8 Nxc4 39. g4 Nd2 40. Rc8 Kh7 41. Ra8 Ra2 42. Kg2 Nb3+ 43. Kg3 Nd4 44. h4 Ra3+ 45. Kf2 Nc6 46. Bc7 Ne7 47. Bd6 Ra2+ 48. Kf3 Nc6 49. Bc7 Nd4+ 50. Kg3 Ra3+ 51. Kf2 Ra4 52. Kg3,"This is a game between Bogoljubow,E (as White) and Lasker,Em (as Black). Last move played: White plays King to g3",The position is equal,52... Ra3+ 53. Kf2 ,52. Kg3 
"Lasker has no intention of allowing a draw by repetition (possible if he plays ...Ra3+). His Knight move attacks the White Bishop and covers f4, denying that square to White's King.",True, The comment accurately describes a potential tactical threat and a violation of the draw rule.,1. e4 e5 2. Nf3 Nc6 3. Bb5 Nf6 4. d4 exd4 5. Nxd4 Be7 6. O-O a6 7. Nxc6 bxc6 8. Bd3 d6 9. Nc3 O-O 10. f4 Re8 11. Kh1 Nd7 12. Be3 Bf6 13. Qf3 Rb8 14. Rab1 Bxc3 15. bxc3 Rxb1 16. Rxb1 c5 17. c4 Qe7 18. h3 Nf6 19. Bf2 Bd7 20. e5 dxe5 21. fxe5 Qxe5 22. Bg3 Qe6 23. Bxc7 Bc6 24. Qf5 Qxf5 25. Bxf5 Be4 26. Bxe4 Nxe4 27. Rb6 Ra8 28. Rc6 h5 29. Bb6 h4 30. Kg1 Re8 31. Bxc5 Rd8 32. Kf1 Rd2 33. a4 Rxc2 34. Bb4 Rf2+ 35. Kg1 Ra2 36. Be1 Rxa4 37. Bxh4 Nd2 38. Bd8 Nxc4 39. g4 Nd2 40. Rc8 Kh7 41. Ra8 Ra2 42. Kg2 Nb3+ 43. Kg3 Nd4 44. h4 Ra3+ 45. Kf2 Nc6 46. Bc7 Ne7 47. Bd6 Ra2+ 48. Kf3 Nc6 49. Bc7 Nd4+ 50. Kg3 Ra3+ 51. Kf2 Ra4 52. Kg3 Ne6,"This is a game between Bogoljubow,E (as White) and Lasker,Em (as Black). Last move played: Black plays Knight to e6",The position is equal,53. Ra7 Nc5 54. Bf4 Ra3+ 55. Kg2 f6 56. Bd6 Ra2+ 57. Kh3 Ne6 58. Be7 Kg6 59. Bb4 Ra4 60. Bd6 a5 61. Re7 Nd4 62. h5+ Kh7 ,52... Ra3+ 53. Kf2 
It's move it or lose it for White.,True," Yes, the comment suggests a potential tactical blunder by White, indicating a weakness in their plan.",1. e4 e5 2. Nf3 Nc6 3. Bb5 Nf6 4. d4 exd4 5. Nxd4 Be7 6. O-O a6 7. Nxc6 bxc6 8. Bd3 d6 9. Nc3 O-O 10. f4 Re8 11. Kh1 Nd7 12. Be3 Bf6 13. Qf3 Rb8 14. Rab1 Bxc3 15. bxc3 Rxb1 16. Rxb1 c5 17. c4 Qe7 18. h3 Nf6 19. Bf2 Bd7 20. e5 dxe5 21. fxe5 Qxe5 22. Bg3 Qe6 23. Bxc7 Bc6 24. Qf5 Qxf5 25. Bxf5 Be4 26. Bxe4 Nxe4 27. Rb6 Ra8 28. Rc6 h5 29. Bb6 h4 30. Kg1 Re8 31. Bxc5 Rd8 32. Kf1 Rd2 33. a4 Rxc2 34. Bb4 Rf2+ 35. Kg1 Ra2 36. Be1 Rxa4 37. Bxh4 Nd2 38. Bd8 Nxc4 39. g4 Nd2 40. Rc8 Kh7 41. Ra8 Ra2 42. Kg2 Nb3+ 43. Kg3 Nd4 44. h4 Ra3+ 45. Kf2 Nc6 46. Bc7 Ne7 47. Bd6 Ra2+ 48. Kf3 Nc6 49. Bc7 Nd4+ 50. Kg3 Ra3+ 51. Kf2 Ra4 52. Kg3 Ne6 53. Bb6,"This is a game between Bogoljubow,E (as White) and Lasker,Em (as Black). Last move played: White plays Bishop to b6",The position is equal,53... Ra3+ 54. Kf2 Nf4 55. Ra7 Nd3+ 56. Kf3 Ne5+ 57. Ke4 Nc4 58. Bc5 Nd2+ 59. Kf4 Rc3 60. Be7 Rf3+ 61. Ke5 Rf1 62. Kd5 Rg1 63. Bc5 Rxg4 64. Rxf7 Rxh4 65. Bd4 Rh5+ 66. Be5 Rg5 67. Rf4 a5 68. Rf2 Nb3 69. Rh2+ Kg8 ,53. Ra7 Nc5 54. Bf4 Ra3+ 55. Kg2 f6 56. Bd6 Ra2+ 57. Kh3 Ne6 58. Be7 Kg6 59. Bb4 Ra4 60. Bd6 a5 61. Re7 Nd4 62. h5+ Kh7 
"Since the Knight and Bishop are on different squares than they were several moves ago, it's all right for Black to check from a3 again without fear of heading for a draw by repetition.",True," The comment suggests a potential tactical error stemming from the Knight and Bishop's position, implying a need to avoid repetition.",1. e4 e5 2. Nf3 Nc6 3. Bb5 Nf6 4. d4 exd4 5. Nxd4 Be7 6. O-O a6 7. Nxc6 bxc6 8. Bd3 d6 9. Nc3 O-O 10. f4 Re8 11. Kh1 Nd7 12. Be3 Bf6 13. Qf3 Rb8 14. Rab1 Bxc3 15. bxc3 Rxb1 16. Rxb1 c5 17. c4 Qe7 18. h3 Nf6 19. Bf2 Bd7 20. e5 dxe5 21. fxe5 Qxe5 22. Bg3 Qe6 23. Bxc7 Bc6 24. Qf5 Qxf5 25. Bxf5 Be4 26. Bxe4 Nxe4 27. Rb6 Ra8 28. Rc6 h5 29. Bb6 h4 30. Kg1 Re8 31. Bxc5 Rd8 32. Kf1 Rd2 33. a4 Rxc2 34. Bb4 Rf2+ 35. Kg1 Ra2 36. Be1 Rxa4 37. Bxh4 Nd2 38. Bd8 Nxc4 39. g4 Nd2 40. Rc8 Kh7 41. Ra8 Ra2 42. Kg2 Nb3+ 43. Kg3 Nd4 44. h4 Ra3+ 45. Kf2 Nc6 46. Bc7 Ne7 47. Bd6 Ra2+ 48. Kf3 Nc6 49. Bc7 Nd4+ 50. Kg3 Ra3+ 51. Kf2 Ra4 52. Kg3 Ne6 53. Bb6 Ra3+,"This is a game between Bogoljubow,E (as White) and Lasker,Em (as Black). Last move played: Black plays Rook to a3 with check",The position is equal,54. Kf2 ,53... Ra3+ 54. Kf2 Nf4 55. Ra7 Nd3+ 56. Kf3 Ne5+ 57. Ke4 Nc4 58. Bc5 Nd2+ 59. Kf4 Rc3 60. Be7 Rf3+ 61. Ke5 Rf1 62. Kd5 Rg1 63. Bc5 Rxg4 64. Rxf7 Rxh4 65. Bd4 Rh5+ 66. Be5 Rg5 67. Rf4 a5 68. Rf2 Nb3 69. Rh2+ Kg8 
The King retreats to a light square to keep the dark squares open for his Bishop.,True," The comment describes a logical move that defends the King, suggesting a potential tactical error.",1. e4 e5 2. Nf3 Nc6 3. Bb5 Nf6 4. d4 exd4 5. Nxd4 Be7 6. O-O a6 7. Nxc6 bxc6 8. Bd3 d6 9. Nc3 O-O 10. f4 Re8 11. Kh1 Nd7 12. Be3 Bf6 13. Qf3 Rb8 14. Rab1 Bxc3 15. bxc3 Rxb1 16. Rxb1 c5 17. c4 Qe7 18. h3 Nf6 19. Bf2 Bd7 20. e5 dxe5 21. fxe5 Qxe5 22. Bg3 Qe6 23. Bxc7 Bc6 24. Qf5 Qxf5 25. Bxf5 Be4 26. Bxe4 Nxe4 27. Rb6 Ra8 28. Rc6 h5 29. Bb6 h4 30. Kg1 Re8 31. Bxc5 Rd8 32. Kf1 Rd2 33. a4 Rxc2 34. Bb4 Rf2+ 35. Kg1 Ra2 36. Be1 Rxa4 37. Bxh4 Nd2 38. Bd8 Nxc4 39. g4 Nd2 40. Rc8 Kh7 41. Ra8 Ra2 42. Kg2 Nb3+ 43. Kg3 Nd4 44. h4 Ra3+ 45. Kf2 Nc6 46. Bc7 Ne7 47. Bd6 Ra2+ 48. Kf3 Nc6 49. Bc7 Nd4+ 50. Kg3 Ra3+ 51. Kf2 Ra4 52. Kg3 Ne6 53. Bb6 Ra3+ 54. Kg2,"This is a game between Bogoljubow,E (as White) and Lasker,Em (as Black). Last move played: White plays King to g2",Slight advantage for Black (eval: -42 centipawns),54... Nf4+ 55. Kf1 Nd5 56. Bc5 Ra5 57. Bf2 Ra1+ 58. Ke2 Ra2+ 59. Kf3 Ra3+ 60. Kg2 a5 61. Ra7 Nf4+ 62. Kh2 f6 63. g5 Kg6 64. gxf6 gxf6 65. Ra6 Kf5 66. Kg1 ,54. Kf2 
The retreat to g2 unfortunately allows this Knight check.,True," The comment identifies a potential tactical error, suggesting the retreat led to a check.",1. e4 e5 2. Nf3 Nc6 3. Bb5 Nf6 4. d4 exd4 5. Nxd4 Be7 6. O-O a6 7. Nxc6 bxc6 8. Bd3 d6 9. Nc3 O-O 10. f4 Re8 11. Kh1 Nd7 12. Be3 Bf6 13. Qf3 Rb8 14. Rab1 Bxc3 15. bxc3 Rxb1 16. Rxb1 c5 17. c4 Qe7 18. h3 Nf6 19. Bf2 Bd7 20. e5 dxe5 21. fxe5 Qxe5 22. Bg3 Qe6 23. Bxc7 Bc6 24. Qf5 Qxf5 25. Bxf5 Be4 26. Bxe4 Nxe4 27. Rb6 Ra8 28. Rc6 h5 29. Bb6 h4 30. Kg1 Re8 31. Bxc5 Rd8 32. Kf1 Rd2 33. a4 Rxc2 34. Bb4 Rf2+ 35. Kg1 Ra2 36. Be1 Rxa4 37. Bxh4 Nd2 38. Bd8 Nxc4 39. g4 Nd2 40. Rc8 Kh7 41. Ra8 Ra2 42. Kg2 Nb3+ 43. Kg3 Nd4 44. h4 Ra3+ 45. Kf2 Nc6 46. Bc7 Ne7 47. Bd6 Ra2+ 48. Kf3 Nc6 49. Bc7 Nd4+ 50. Kg3 Ra3+ 51. Kf2 Ra4 52. Kg3 Ne6 53. Bb6 Ra3+ 54. Kg2 Nf4+,"This is a game between Bogoljubow,E (as White) and Lasker,Em (as Black). Last move played: Black plays Knight to f4 with check",Slight advantage for Black (eval: -44 centipawns),55. Kf1 ,54... Nf4+ 55. Kf1 Nd5 56. Bc5 Ra5 57. Bf2 Ra1+ 58. Ke2 Ra2+ 59. Kf3 Ra3+ 60. Kg2 a5 61. Ra7 Nf4+ 62. Kh2 f6 63. g5 Kg6 64. gxf6 gxf6 65. Ra6 Kf5 66. Kg1 
The Knight continues the harassment (with an object in mind).,True," The comment suggests a tactical error, potentially involving a dangerous attack, indicating a flawed move.",1. e4 e5 2. Nf3 Nc6 3. Bb5 Nf6 4. d4 exd4 5. Nxd4 Be7 6. O-O a6 7. Nxc6 bxc6 8. Bd3 d6 9. Nc3 O-O 10. f4 Re8 11. Kh1 Nd7 12. Be3 Bf6 13. Qf3 Rb8 14. Rab1 Bxc3 15. bxc3 Rxb1 16. Rxb1 c5 17. c4 Qe7 18. h3 Nf6 19. Bf2 Bd7 20. e5 dxe5 21. fxe5 Qxe5 22. Bg3 Qe6 23. Bxc7 Bc6 24. Qf5 Qxf5 25. Bxf5 Be4 26. Bxe4 Nxe4 27. Rb6 Ra8 28. Rc6 h5 29. Bb6 h4 30. Kg1 Re8 31. Bxc5 Rd8 32. Kf1 Rd2 33. a4 Rxc2 34. Bb4 Rf2+ 35. Kg1 Ra2 36. Be1 Rxa4 37. Bxh4 Nd2 38. Bd8 Nxc4 39. g4 Nd2 40. Rc8 Kh7 41. Ra8 Ra2 42. Kg2 Nb3+ 43. Kg3 Nd4 44. h4 Ra3+ 45. Kf2 Nc6 46. Bc7 Ne7 47. Bd6 Ra2+ 48. Kf3 Nc6 49. Bc7 Nd4+ 50. Kg3 Ra3+ 51. Kf2 Ra4 52. Kg3 Ne6 53. Bb6 Ra3+ 54. Kg2 Nf4+ 55. Kf2 Nd3+,"This is a game between Bogoljubow,E (as White) and Lasker,Em (as Black). Last move played: Black plays Knight to d3 with check",Advantage for Black (eval: -93 centipawns),56. Ke2 Ne5 ,55... Nd3+ 56. Kg2 Ne5 57. Ra7 Ra4 58. Kh3 Rxg4 59. Rxa6 Re4 60. Bf2 Ng6 61. Bg3 Ne7 62. Ra5 f6 63. Bd6 Nc6 64. Rc5 Nd4 65. Rc4 Re3+ 66. Kg2 Rd3 67. Bc5 Ne6 68. Bf2 Kg6 69. Bg3 Kf5 
"Now we see the point of the repeated checks -- the Knight has positioned itself to attack the g-pawn, and the Rook prevents the White King from coming to the pawn's rescue.",True," The comment accurately describes a logical error in the move, highlighting a potential weakness in the pawn structure.",1. e4 e5 2. Nf3 Nc6 3. Bb5 Nf6 4. d4 exd4 5. Nxd4 Be7 6. O-O a6 7. Nxc6 bxc6 8. Bd3 d6 9. Nc3 O-O 10. f4 Re8 11. Kh1 Nd7 12. Be3 Bf6 13. Qf3 Rb8 14. Rab1 Bxc3 15. bxc3 Rxb1 16. Rxb1 c5 17. c4 Qe7 18. h3 Nf6 19. Bf2 Bd7 20. e5 dxe5 21. fxe5 Qxe5 22. Bg3 Qe6 23. Bxc7 Bc6 24. Qf5 Qxf5 25. Bxf5 Be4 26. Bxe4 Nxe4 27. Rb6 Ra8 28. Rc6 h5 29. Bb6 h4 30. Kg1 Re8 31. Bxc5 Rd8 32. Kf1 Rd2 33. a4 Rxc2 34. Bb4 Rf2+ 35. Kg1 Ra2 36. Be1 Rxa4 37. Bxh4 Nd2 38. Bd8 Nxc4 39. g4 Nd2 40. Rc8 Kh7 41. Ra8 Ra2 42. Kg2 Nb3+ 43. Kg3 Nd4 44. h4 Ra3+ 45. Kf2 Nc6 46. Bc7 Ne7 47. Bd6 Ra2+ 48. Kf3 Nc6 49. Bc7 Nd4+ 50. Kg3 Ra3+ 51. Kf2 Ra4 52. Kg3 Ne6 53. Bb6 Ra3+ 54. Kg2 Nf4+ 55. Kf2 Nd3+ 56. Kg2 Ne5,"This is a game between Bogoljubow,E (as White) and Lasker,Em (as Black). Last move played: Black plays Knight to e5",Large advantage for Black (eval: -109 centipawns),57. Ra7 Ra4 58. Kh3 Kg6 59. Bd8 Nxg4 60. h5+ Kxh5 61. Rxf7 Rd4 62. Bb6 Rd3+ 63. Kg2 Rb3 64. Bg1 g5 65. Rh7+ Kg6 66. Rd7 Ra3 67. Rd5 Kh5 68. Rc5 Ra2+ 69. Kh3 Ra1 70. Kg2 Ra4 71. Kg3 Nf6 72. Re5 Ne4+ 73. Kf3 Nd2+ 74. Kg2 Rg4+ 75. Kf2 ,56... Ne5 57. g5 Ng6 58. Bf2 Nf4+ 59. Kg1 Kg6 60. Ra7 Ra2 61. Be3 Ne2+ 62. Kg2 Nd4+ 63. Bf2 Nf5 64. h5+ Kxh5 65. Rxf7 Kxg5 66. Rc7 Ra4 67. Kf3 Rf4+ 68. Ke2 Kg4 69. Ba7 a5 70. Kd3 a4 71. Rc5 Rf3+ 72. Kc4 a3 73. Ra5 Nd6+ 74. Kb4 
