comment,good,reasoning,moves,context,engine_eval,engine_best_line,engine_best_alternative
"Lasker has to defend the pawn, so he does it in the most efficient way, by developing a piece that defends the pawn.",True," The comment suggests a defensive strategy, but doesn't identify the mistake as a flawed move, merely a tactical consideration.",1. e4 e5 2. Nf3 Nc6,"This is a game between Bogoljubow,E (as White) and Lasker,Em (as Black). Last move played: Black plays Knight to c6",Slight advantage for White (eval: 36 centipawns),3. Bb5 ,2... Nc6 3. Bb5 
Lasker develops his other Knight and counterattacks the White e4-pawn.,True," The comment indicates a potential tactical blunder by developing the Knight, which is a common mistake in chess.",1. e4 e5 2. Nf3 Nc6 3. Bb5 Nf6,"This is a game between Bogoljubow,E (as White) and Lasker,Em (as Black). Last move played: Black plays Knight to f6",Slight advantage for White (eval: 30 centipawns),4. O-O ,3... Nf6 
"Rather than playing 5...Nxd4 (which leaves the d7-pawn pinned), Lasker plans to castle early. He prepares for this by developing his last Kingside minor piece.",True," The comment suggests a planned strategy, potentially indicating a flawed opening choice.",1. e4 e5 2. Nf3 Nc6 3. Bb5 Nf6 4. d4 exd4 5. Nxd4 Be7,"This is a game between Bogoljubow,E (as White) and Lasker,Em (as Black). Last move played: Black plays Bishop to e7",The position is equal,6. Nc3 O-O ,5... Nxe4 
"There's no time to play 7...axb5, since the Black Queen is in jeopardy. Lasker must take the White Knight. 7...dxc6 promotes the exchange of Queens, so he captures toward the center and keeps the Queens on the board.",True," The comment offers a potential explanation for the mistake, suggesting a strategic move to mitigate the Queen's threat.",1. e4 e5 2. Nf3 Nc6 3. Bb5 Nf6 4. d4 exd4 5. Nxd4 Be7 6. O-O a6 7. Nxc6 bxc6,"This is a game between Bogoljubow,E (as White) and Lasker,Em (as Black). Last move played: Black plays Pawn takes on c6",Advantage for White (eval: 52 centipawns),8. Bd3 ,7... dxc6 8. Bd3 Nd7 9. Nc3 Ne5 10. Be2 Qxd1 11. Nxd1 f6 12. Re1 Bg4 13. f3 Be6 14. f4 Nd7 15. g3 Bc5+ 16. Nf2 O-O-O 17. Kg2 Rhe8 18. h3 
"Bogo figures that the d-pawn came to d6 to support the c-pawn's advance to c5. By developing his Knight, Bogo threatens to occupy the ""hole"" on d5 if the c6-pawn steps forward.",True," The comment identifies a potential tactical threat and suggests a strategic idea, indicating a misunderstanding of the position.",1. e4 e5 2. Nf3 Nc6 3. Bb5 Nf6 4. d4 exd4 5. Nxd4 Be7 6. O-O a6 7. Nxc6 bxc6 8. Bd3 d6 9. Nc3,"This is a game between Bogoljubow,E (as White) and Lasker,Em (as Black). Last move played: White plays Knight to c3",Advantage for White (eval: 78 centipawns),9... O-O 10. f4 a5 11. Kh1 a4 12. Qf3 Nd7 13. Be3 Ba6 14. Rad1 Qc8 15. g4 f6 16. h4 Qb7 17. Bc1 Rf7 18. Rf2 Bxd3 19. cxd3 d5 20. h5 d4 21. Ne2 c5 ,9. Nc3 a5 
We've seen this before. It's often a good idea to place your Rooks at the head of the d- and e-files. They'll be well-posted there after the center opens up.,True," The comment suggests a potential tactical weakness, indicating a flawed opening strategy.",1. e4 e5 2. Nf3 Nc6 3. Bb5 Nf6 4. d4 exd4 5. Nxd4 Be7 6. O-O a6 7. Nxc6 bxc6 8. Bd3 d6 9. Nc3 O-O 10. f4 Re8,"This is a game between Bogoljubow,E (as White) and Lasker,Em (as Black). Last move played: Black plays Rook to e8",Advantage for White (eval: 87 centipawns),11. Qf3 Nd7 ,10... a5 
"Bogo develops his Queenside Bishop and cuts down the mobility of the Black Knight. The Bishop controls b6 and c5, discouraging the Knight from moving to one of these squares.",True, The comment describes a tactical maneuver that undermines the opponent's pawn structure and potentially creates a weak square for the Black Knight.,1. e4 e5 2. Nf3 Nc6 3. Bb5 Nf6 4. d4 exd4 5. Nxd4 Be7 6. O-O a6 7. Nxc6 bxc6 8. Bd3 d6 9. Nc3 O-O 10. f4 Re8 11. Kh1 Nd7 12. Be3,"This is a game between Bogoljubow,E (as White) and Lasker,Em (as Black). Last move played: White plays Bishop to e3",Advantage for White (eval: 51 centipawns),12... Rb8 13. Qf3 ,12. Be3 Rb8 
"The Bishop occupies the long a1-h8 diagonal, putting pressure on the f3-Knight and (indirectly) on the b2-pawn.",True," The comment identifies a potential tactical threat and positional disadvantage, suggesting a flawed move.",1. e4 e5 2. Nf3 Nc6 3. Bb5 Nf6 4. d4 exd4 5. Nxd4 Be7 6. O-O a6 7. Nxc6 bxc6 8. Bd3 d6 9. Nc3 O-O 10. f4 Re8 11. Kh1 Nd7 12. Be3 Bf6,"This is a game between Bogoljubow,E (as White) and Lasker,Em (as Black). Last move played: Black plays Bishop to f6",Advantage for White (eval: 92 centipawns),13. Qh5 ,12... Rb8 13. Qf3 
Bogo finishes his development by getting his Queen off of the back rank. Now his Rooks are connected.,True," The comment describes a potential tactical error, suggesting the Queen is overextended, which is a common mistake.",1. e4 e5 2. Nf3 Nc6 3. Bb5 Nf6 4. d4 exd4 5. Nxd4 Be7 6. O-O a6 7. Nxc6 bxc6 8. Bd3 d6 9. Nc3 O-O 10. f4 Re8 11. Kh1 Nd7 12. Be3 Bf6 13. Qf3,"This is a game between Bogoljubow,E (as White) and Lasker,Em (as Black). Last move played: White plays Queen to f3",Advantage for White (eval: 58 centipawns),13... Bxc3 ,13. Qh5 
"The ONLY move (since 14.b3 Bxc3 loses the Knight, and 14.Bc1 Bxc3 15.bxc3 Rxb1 loses the Rook!).",True," The comment accurately identifies a critical error in the move, highlighting a loss due to pawn structure.",1. e4 e5 2. Nf3 Nc6 3. Bb5 Nf6 4. d4 exd4 5. Nxd4 Be7 6. O-O a6 7. Nxc6 bxc6 8. Bd3 d6 9. Nc3 O-O 10. f4 Re8 11. Kh1 Nd7 12. Be3 Bf6 13. Qf3 Rb8 14. Rab1,"This is a game between Bogoljubow,E (as White) and Lasker,Em (as Black). Last move played: White plays Rook to b1",Slight advantage for White (eval: 21 centipawns),14... Bxc3 15. bxc3 ,14. e5 
"Normally, a player wouldn't trade a long-diagonal Bishop for a Knight, but Lasker has his reasons (as we'll see soon).",True," The comment provides context and suggests a possible reason for the mistake, indicating a strategic consideration.",1. e4 e5 2. Nf3 Nc6 3. Bb5 Nf6 4. d4 exd4 5. Nxd4 Be7 6. O-O a6 7. Nxc6 bxc6 8. Bd3 d6 9. Nc3 O-O 10. f4 Re8 11. Kh1 Nd7 12. Be3 Bf6 13. Qf3 Rb8 14. Rab1 Bxc3,"This is a game between Bogoljubow,E (as White) and Lasker,Em (as Black). Last move played: Black plays Bishop takes on c3",The position is equal,15. bxc3 ,14... Bxc3 15. bxc3 
"Bogo now has control of the open b-file, but his doubled c-pawns are weak and are targets of attack for Black. This is why Dr. Lasker traded his Bishop for the Knight.",True," The comment identifies a key flaw in Bogo's pawn structure, suggesting a tactical vulnerability, justifying the trade.",1. e4 e5 2. Nf3 Nc6 3. Bb5 Nf6 4. d4 exd4 5. Nxd4 Be7 6. O-O a6 7. Nxc6 bxc6 8. Bd3 d6 9. Nc3 O-O 10. f4 Re8 11. Kh1 Nd7 12. Be3 Bf6 13. Qf3 Rb8 14. Rab1 Bxc3 15. bxc3 Rxb1 16. Rxb1,"This is a game between Bogoljubow,E (as White) and Lasker,Em (as Black). Last move played: White plays Rook takes on b1",The position is equal,16... c5 17. c4 ,16. Rxb1 c5 17. c4 Qe7 18. h3 Nf6 19. e5 dxe5 20. fxe5 Nd7 21. Qd5 Nxe5 22. Bxc5 c6 23. Qd4 Qd7 24. Be4 Qxd4 25. Bxd4 Bd7 26. Bxe5 Rxe5 27. Bd3 Re8 28. Rb7 
"Nothing dazzling here, just a quiet, position-strengthening move. Lasker has established a battery on the half-open e-file.",True," The comment accurately describes a move that doesn't significantly improve the position, suggesting a passive and potentially undesirable play.",1. e4 e5 2. Nf3 Nc6 3. Bb5 Nf6 4. d4 exd4 5. Nxd4 Be7 6. O-O a6 7. Nxc6 bxc6 8. Bd3 d6 9. Nc3 O-O 10. f4 Re8 11. Kh1 Nd7 12. Be3 Bf6 13. Qf3 Rb8 14. Rab1 Bxc3 15. bxc3 Rxb1 16. Rxb1 c5 17. c4 Qe7,"This is a game between Bogoljubow,E (as White) and Lasker,Em (as Black). Last move played: Black plays Queen to e7",The position is equal,18. h3 Nf6 ,17... Nb6 18. Bd2 Bb7 19. Bc3 Qh4 20. Qe3 Qg4 21. h3 Qg6 22. f5 Qxf5 23. exf5 Rxe3 24. Ba5 Be4 25. Bxb6 cxb6 26. Rxb6 Kf8 27. Rxd6 Ke7 28. Rxa6 Bxd3 29. cxd3 Rxd3 30. Ra5 Kf6 31. Kg1 Kxf5 32. Rxc5+ Ke4 33. Rg5 
"Bogo looks ahead and foresees Black playing ...Nf6 and ...Bg4, attacking the White Queen. He pushes the h-pawn to deny g4 to Black.",True," The comment accurately describes a potential tactical error by Black, suggesting an over-aggressive attack.",1. e4 e5 2. Nf3 Nc6 3. Bb5 Nf6 4. d4 exd4 5. Nxd4 Be7 6. O-O a6 7. Nxc6 bxc6 8. Bd3 d6 9. Nc3 O-O 10. f4 Re8 11. Kh1 Nd7 12. Be3 Bf6 13. Qf3 Rb8 14. Rab1 Bxc3 15. bxc3 Rxb1 16. Rxb1 c5 17. c4 Qe7 18. h3,"This is a game between Bogoljubow,E (as White) and Lasker,Em (as Black). Last move played: White plays Pawn to h3",The position is equal,18... Nf6 ,18. h3 Nf6 
"Lasker could have won a pawn through a massive exchange on e4, but he prefers to retain his attacking possibilities by keeping his pieces on the board. By moving the Bishop instead, he encourages White to advance the pawn...",True," The comment suggests a strategic choice to preserve attacking possibilities, potentially hindering White's advance.",1. e4 e5 2. Nf3 Nc6 3. Bb5 Nf6 4. d4 exd4 5. Nxd4 Be7 6. O-O a6 7. Nxc6 bxc6 8. Bd3 d6 9. Nc3 O-O 10. f4 Re8 11. Kh1 Nd7 12. Be3 Bf6 13. Qf3 Rb8 14. Rab1 Bxc3 15. bxc3 Rxb1 16. Rxb1 c5 17. c4 Qe7 18. h3 Nf6 19. Bf2 Bd7,"This is a game between Bogoljubow,E (as White) and Lasker,Em (as Black). Last move played: Black plays Bishop to d7",The position is equal,20. e5 dxe5 ,19... Bd7 20. e5 dxe5 21. fxe5 Qxe5 22. Re1 Qd6 23. Rxe8+ Bxe8 24. Qe3 Bc6 25. Bg3 Qd7 26. Kg1 Qe8 27. Qxe8+ Nxe8 28. Bf2 g6 29. Bxc5 f5 30. Be3 Kf7 31. Kf2 Ke6 
"...and Lasker emerges a pawn ahead. Now Lasker commands the open e-file with his battery, while Bogo has open diagonals for his Queen and light-squared Bishop.",True," The comment provides context about Lasker's positional advantage and Bogo's development, suggesting a flaw in the initial move.",1. e4 e5 2. Nf3 Nc6 3. Bb5 Nf6 4. d4 exd4 5. Nxd4 Be7 6. O-O a6 7. Nxc6 bxc6 8. Bd3 d6 9. Nc3 O-O 10. f4 Re8 11. Kh1 Nd7 12. Be3 Bf6 13. Qf3 Rb8 14. Rab1 Bxc3 15. bxc3 Rxb1 16. Rxb1 c5 17. c4 Qe7 18. h3 Nf6 19. Bf2 Bd7 20. e5 dxe5 21. fxe5 Qxe5,"This is a game between Bogoljubow,E (as White) and Lasker,Em (as Black). Last move played: Black plays Queen takes on e5",The position is equal,22. Re1 Qd6 23. Rxe8+ Nxe8 24. Qe3 g6 25. Bg3 Qd4 26. Qe7 Bc6 27. Kh2 Ba4 28. Qe1 Bc6 ,21... Qxe5 22. Re1 Qd6 23. Rxe8+ Nxe8 24. Qd5 Bc6 25. Qxc5 Qxc5 26. Bxc5 g6 27. Kg1 f5 28. g3 Kf7 29. Bb4 Ng7 30. Ba5 Ne6 31. Kf2 Ke7 32. h4 Bd7 33. Bd2 c6 34. Bc1 c5 
The Queen has no option other than retreat.,True, The comment suggests a strategic error based on a flawed assumption about the Queen's mobility.,1. e4 e5 2. Nf3 Nc6 3. Bb5 Nf6 4. d4 exd4 5. Nxd4 Be7 6. O-O a6 7. Nxc6 bxc6 8. Bd3 d6 9. Nc3 O-O 10. f4 Re8 11. Kh1 Nd7 12. Be3 Bf6 13. Qf3 Rb8 14. Rab1 Bxc3 15. bxc3 Rxb1 16. Rxb1 c5 17. c4 Qe7 18. h3 Nf6 19. Bf2 Bd7 20. e5 dxe5 21. fxe5 Qxe5 22. Bg3 Qe6,"This is a game between Bogoljubow,E (as White) and Lasker,Em (as Black). Last move played: Black plays Queen to e6",The position is equal,23. Re1 Qc6 24. Rxe8+ Nxe8 25. Be4 Qa4 26. Qb3 h6 27. Bf3 Qa5 28. Kh2 Qb6 29. Qd3 Be6 30. Qd8 Kf8 31. Bd5 Bxd5 32. cxd5 c4 33. Qd7 Nd6 ,22... Qe6 23. Re1 
"Bogo snaps up the hanging pawn. The material is even, Bogo has the advantage of the two Bishops, but his pieces aren't placed as well as Black's.",True," The comment identifies a specific tactical mistake and suggests Black's better piece placement, indicating a flawed assessment of the position.",1. e4 e5 2. Nf3 Nc6 3. Bb5 Nf6 4. d4 exd4 5. Nxd4 Be7 6. O-O a6 7. Nxc6 bxc6 8. Bd3 d6 9. Nc3 O-O 10. f4 Re8 11. Kh1 Nd7 12. Be3 Bf6 13. Qf3 Rb8 14. Rab1 Bxc3 15. bxc3 Rxb1 16. Rxb1 c5 17. c4 Qe7 18. h3 Nf6 19. Bf2 Bd7 20. e5 dxe5 21. fxe5 Qxe5 22. Bg3 Qe6 23. Bxc7,"This is a game between Bogoljubow,E (as White) and Lasker,Em (as Black). Last move played: White plays Bishop takes on c7",Slight advantage for Black (eval: -24 centipawns),23... Bc6 24. Qg3 ,23. Re1 Qc6 
"Bogo offers a Queen exchange. If Black declines, Bogo could win a pawn via Qxc5. Bogo also sees drawing chances for himself in the endgame.",True," The comment highlights a potential strategic complication and a possible endgame advantage, suggesting the move was flawed.",1. e4 e5 2. Nf3 Nc6 3. Bb5 Nf6 4. d4 exd4 5. Nxd4 Be7 6. O-O a6 7. Nxc6 bxc6 8. Bd3 d6 9. Nc3 O-O 10. f4 Re8 11. Kh1 Nd7 12. Be3 Bf6 13. Qf3 Rb8 14. Rab1 Bxc3 15. bxc3 Rxb1 16. Rxb1 c5 17. c4 Qe7 18. h3 Nf6 19. Bf2 Bd7 20. e5 dxe5 21. fxe5 Qxe5 22. Bg3 Qe6 23. Bxc7 Bc6 24. Qf5,"This is a game between Bogoljubow,E (as White) and Lasker,Em (as Black). Last move played: White plays Queen to f5",Large advantage for Black (eval: -187 centipawns),24... Bxg2+ ,24. Qg3 Ne4 
"Due to White's weak Queenside pawns and the bad placement of White's King (far from the center) versus Black's good placement of his Bishop and Knight, Lasker feels that it's to his advantage to trade down to an endgame.",True," The comment identifies a key strategic flaw in White's move, suggesting a trade to an endgame.",1. e4 e5 2. Nf3 Nc6 3. Bb5 Nf6 4. d4 exd4 5. Nxd4 Be7 6. O-O a6 7. Nxc6 bxc6 8. Bd3 d6 9. Nc3 O-O 10. f4 Re8 11. Kh1 Nd7 12. Be3 Bf6 13. Qf3 Rb8 14. Rab1 Bxc3 15. bxc3 Rxb1 16. Rxb1 c5 17. c4 Qe7 18. h3 Nf6 19. Bf2 Bd7 20. e5 dxe5 21. fxe5 Qxe5 22. Bg3 Qe6 23. Bxc7 Bc6 24. Qf5 Qxf5,"This is a game between Bogoljubow,E (as White) and Lasker,Em (as Black). Last move played: Black plays Queen takes on f5",The position is equal,25. Bxf5 Be4 26. Bxe4 Nxe4 27. Rb6 f5 28. Rxa6 g5 29. Kh2 Re7 30. Bb6 Re6 31. a4 f4 32. a5 Ng3 33. Ra8+ Kf7 34. Bxc5 Re1 35. Bg1 h5 36. Ra7+ Kg6 37. Ra8 Nf1+ 38. Kh1 g4 39. c5 Ng3+ 40. Kh2 Nf1+ ,24... Bxg2+ 
Bogo completes the trade...,True,", The comment suggests a logical error in the opponent's move, indicating a flawed trade.",1. e4 e5 2. Nf3 Nc6 3. Bb5 Nf6 4. d4 exd4 5. Nxd4 Be7 6. O-O a6 7. Nxc6 bxc6 8. Bd3 d6 9. Nc3 O-O 10. f4 Re8 11. Kh1 Nd7 12. Be3 Bf6 13. Qf3 Rb8 14. Rab1 Bxc3 15. bxc3 Rxb1 16. Rxb1 c5 17. c4 Qe7 18. h3 Nf6 19. Bf2 Bd7 20. e5 dxe5 21. fxe5 Qxe5 22. Bg3 Qe6 23. Bxc7 Bc6 24. Qf5 Qxf5 25. Bxf5,"This is a game between Bogoljubow,E (as White) and Lasker,Em (as Black). Last move played: White plays Bishop takes on f5",The position is equal,25... Be4 26. Bxe4 Rxe4 27. Rb8+ Re8 28. Rxe8+ Nxe8 29. Bb6 Nd6 30. Bxc5 Nxc4 31. g4 f6 32. Kg2 Kf7 33. Kf3 Ke6 34. Ke4 g6 35. Bf2 Na3 36. c3 f5+ 37. gxf5+ gxf5+ 38. Kd4 Nb5+ 39. Kd3 Nd6 40. Kd4 ,25. Bxf5 Be4 26. Bxe4 Nxe4 27. Rb6 f5 28. Rxa6 g5 29. Kh2 Re7 30. Bb6 Re6 31. a4 f4 32. a5 Ng3 33. Ra8+ Kf7 34. Bxc5 Re1 35. Bg1 h5 36. Ra7+ Kg6 37. Ra8 Nf1+ 38. Kh1 g4 39. c5 Ng3+ 40. Kh2 Nf1+ 
...but now his Bishop is trapped! There's no way for White to avoid giving up the advantageous Bishop pair. This was the hidden reason behind 24...Qxf5.,True," The comment identifies a tactical weakness, suggesting a lost Bishop pair, which is a clear indication of a mistake.",1. e4 e5 2. Nf3 Nc6 3. Bb5 Nf6 4. d4 exd4 5. Nxd4 Be7 6. O-O a6 7. Nxc6 bxc6 8. Bd3 d6 9. Nc3 O-O 10. f4 Re8 11. Kh1 Nd7 12. Be3 Bf6 13. Qf3 Rb8 14. Rab1 Bxc3 15. bxc3 Rxb1 16. Rxb1 c5 17. c4 Qe7 18. h3 Nf6 19. Bf2 Bd7 20. e5 dxe5 21. fxe5 Qxe5 22. Bg3 Qe6 23. Bxc7 Bc6 24. Qf5 Qxf5 25. Bxf5 Be4,"This is a game between Bogoljubow,E (as White) and Lasker,Em (as Black). Last move played: Black plays Bishop to e4",The position is equal,26. Bxe4 Nxe4 ,25... Be4 26. Bxe4 Rxe4 27. Rb8+ Re8 28. Rxe8+ Nxe8 29. Bb6 Nd6 30. Bxc5 Nxc4 31. g4 f6 32. Kg2 Kf7 33. Kf3 Ke6 34. Ke4 g6 35. Bf2 Na3 36. c3 f5+ 37. gxf5+ gxf5+ 38. Kd4 Nb5+ 39. Kd3 Nd6 40. Kd4 
Now the open b-file comes into play. Bogo uses the open file to attack the Black Queenside pawns.,True," The comment suggests a potential tactical error based on the opening move, indicating a flawed strategic assessment.",1. e4 e5 2. Nf3 Nc6 3. Bb5 Nf6 4. d4 exd4 5. Nxd4 Be7 6. O-O a6 7. Nxc6 bxc6 8. Bd3 d6 9. Nc3 O-O 10. f4 Re8 11. Kh1 Nd7 12. Be3 Bf6 13. Qf3 Rb8 14. Rab1 Bxc3 15. bxc3 Rxb1 16. Rxb1 c5 17. c4 Qe7 18. h3 Nf6 19. Bf2 Bd7 20. e5 dxe5 21. fxe5 Qxe5 22. Bg3 Qe6 23. Bxc7 Bc6 24. Qf5 Qxf5 25. Bxf5 Be4 26. Bxe4 Nxe4 27. Rb6,"This is a game between Bogoljubow,E (as White) and Lasker,Em (as Black). Last move played: White plays Rook to b6",The position is equal,27... f5 28. Rxa6 g5 29. g3 Nf2+ 30. Kg2 Re2 31. a4 Rxc2 32. a5 Ne4+ 33. Kg1 Rc1+ 34. Kh2 Rc2+ ,27. Rb6 f5 28. Rxa6 g5 29. g3 Nd2 30. a4 Re2 31. Kg1 Nf3+ 32. Kf1 Rd2 33. a5 Nh2+ 34. Kg1 Nf3+ 35. Kf1 
The Black Rook moves to defend the a-pawn...,True," The comment offers a potential reason for the mistake, suggesting a defensive move, though it doesn't explicitly state why the original move was incorrect.",1. e4 e5 2. Nf3 Nc6 3. Bb5 Nf6 4. d4 exd4 5. Nxd4 Be7 6. O-O a6 7. Nxc6 bxc6 8. Bd3 d6 9. Nc3 O-O 10. f4 Re8 11. Kh1 Nd7 12. Be3 Bf6 13. Qf3 Rb8 14. Rab1 Bxc3 15. bxc3 Rxb1 16. Rxb1 c5 17. c4 Qe7 18. h3 Nf6 19. Bf2 Bd7 20. e5 dxe5 21. fxe5 Qxe5 22. Bg3 Qe6 23. Bxc7 Bc6 24. Qf5 Qxf5 25. Bxf5 Be4 26. Bxe4 Nxe4 27. Rb6 Ra8,"This is a game between Bogoljubow,E (as White) and Lasker,Em (as Black). Last move played: Black plays Rook to a8",The position is equal,28. g4 ,27... f5 28. Rxa6 g5 29. g3 Nf2+ 30. Kg2 Re2 31. a4 Rxc2 32. a5 Ne4+ 33. Kg1 Rc1+ 34. Kh2 Rc2+ 
The pawn advances as a preparatory step to an attack on White's cornered King.,True," The comment suggests the pawn is advancing to create an attack, indicating a flawed strategic decision.",1. e4 e5 2. Nf3 Nc6 3. Bb5 Nf6 4. d4 exd4 5. Nxd4 Be7 6. O-O a6 7. Nxc6 bxc6 8. Bd3 d6 9. Nc3 O-O 10. f4 Re8 11. Kh1 Nd7 12. Be3 Bf6 13. Qf3 Rb8 14. Rab1 Bxc3 15. bxc3 Rxb1 16. Rxb1 c5 17. c4 Qe7 18. h3 Nf6 19. Bf2 Bd7 20. e5 dxe5 21. fxe5 Qxe5 22. Bg3 Qe6 23. Bxc7 Bc6 24. Qf5 Qxf5 25. Bxf5 Be4 26. Bxe4 Nxe4 27. Rb6 Ra8 28. Rc6 h5,"This is a game between Bogoljubow,E (as White) and Lasker,Em (as Black). Last move played: Black plays Pawn to h5",The position is equal,29. Bb6 ,28... h5 29. Bb6 Kh7 30. Kh2 Rb8 31. Kg1 f5 32. Kf1 h4 33. Ke2 Re8 34. Ke3 g5 35. a4 Kg7 36. Kd3 Re5 37. Bd8 Nf2+ 38. Kd2 Kf7 39. Rxa6 f4 40. Ra7+ Kg6 
"Lasker has no way to save his c-pawn, so he continues the preparations for the attack. Now ...Ng3+ traps the White King in the corner, making it possible for the Black Rook to slide down a center file and deliver mate.",True," The comment provides a potential explanation for the mistake, suggesting a planned attack and a tactical trap.",1. e4 e5 2. Nf3 Nc6 3. Bb5 Nf6 4. d4 exd4 5. Nxd4 Be7 6. O-O a6 7. Nxc6 bxc6 8. Bd3 d6 9. Nc3 O-O 10. f4 Re8 11. Kh1 Nd7 12. Be3 Bf6 13. Qf3 Rb8 14. Rab1 Bxc3 15. bxc3 Rxb1 16. Rxb1 c5 17. c4 Qe7 18. h3 Nf6 19. Bf2 Bd7 20. e5 dxe5 21. fxe5 Qxe5 22. Bg3 Qe6 23. Bxc7 Bc6 24. Qf5 Qxf5 25. Bxf5 Be4 26. Bxe4 Nxe4 27. Rb6 Ra8 28. Rc6 h5 29. Bb6 h4,"This is a game between Bogoljubow,E (as White) and Lasker,Em (as Black). Last move played: Black plays Pawn to h4",The position is equal,30. Kg1 Kh7 31. Kf1 Re8 32. Ke2 f5 33. Kd3 Re5 34. Bc7 Re7 35. Bb6 ,29... Kh7 30. Kh2 
"Lasker continues to set up his attack. There's no longer a mate threat, but a Kingside attack will allow him to control the initiative and possibly win some material.",True," The comment identifies a potential weakness in the opponent’s setup, suggesting a tactical vulnerability.",1. e4 e5 2. Nf3 Nc6 3. Bb5 Nf6 4. d4 exd4 5. Nxd4 Be7 6. O-O a6 7. Nxc6 bxc6 8. Bd3 d6 9. Nc3 O-O 10. f4 Re8 11. Kh1 Nd7 12. Be3 Bf6 13. Qf3 Rb8 14. Rab1 Bxc3 15. bxc3 Rxb1 16. Rxb1 c5 17. c4 Qe7 18. h3 Nf6 19. Bf2 Bd7 20. e5 dxe5 21. fxe5 Qxe5 22. Bg3 Qe6 23. Bxc7 Bc6 24. Qf5 Qxf5 25. Bxf5 Be4 26. Bxe4 Nxe4 27. Rb6 Ra8 28. Rc6 h5 29. Bb6 h4 30. Kg1 Re8,"This is a game between Bogoljubow,E (as White) and Lasker,Em (as Black). Last move played: Black plays Rook to e8",The position is equal,31. Bxc5 Nxc5 ,30... Kh7 31. Kf1 Re8 32. Ke2 f6 33. Kd3 Nf2+ 34. Kd2 Re5 35. Bc7 Re7 36. Bb6 Re5 
"His mating threat stymied, Lasker must content himself with winning back the lost pawn.",True," The comment suggests the player's threat was ineffective, implying a flawed strategic decision.",1. e4 e5 2. Nf3 Nc6 3. Bb5 Nf6 4. d4 exd4 5. Nxd4 Be7 6. O-O a6 7. Nxc6 bxc6 8. Bd3 d6 9. Nc3 O-O 10. f4 Re8 11. Kh1 Nd7 12. Be3 Bf6 13. Qf3 Rb8 14. Rab1 Bxc3 15. bxc3 Rxb1 16. Rxb1 c5 17. c4 Qe7 18. h3 Nf6 19. Bf2 Bd7 20. e5 dxe5 21. fxe5 Qxe5 22. Bg3 Qe6 23. Bxc7 Bc6 24. Qf5 Qxf5 25. Bxf5 Be4 26. Bxe4 Nxe4 27. Rb6 Ra8 28. Rc6 h5 29. Bb6 h4 30. Kg1 Re8 31. Bxc5 Rd8 32. Kf1 Rd2,"This is a game between Bogoljubow,E (as White) and Lasker,Em (as Black). Last move played: Black plays Rook to d2",The position is equal,33. c3 Rxa2 34. Bd4 Rc2 35. Rxa6 Nxc3 36. Ra8+ Kh7 37. Re8 Kg6 38. Re3 Na4 39. Re4 Rxc4 40. Rxh4 f5 41. g3 Nc5 42. Bxc5 Rxc5 43. Kg2 Rc2+ 44. Kf1 Rd2 45. Rb4 ,32... Nxc5 33. Rxc5 
"By shifting the Bishop, Bogo allows his Rook to defend the menaced pawn.",True," The comment describes a potential consequence of the move, suggesting a strategic error.",1. e4 e5 2. Nf3 Nc6 3. Bb5 Nf6 4. d4 exd4 5. Nxd4 Be7 6. O-O a6 7. Nxc6 bxc6 8. Bd3 d6 9. Nc3 O-O 10. f4 Re8 11. Kh1 Nd7 12. Be3 Bf6 13. Qf3 Rb8 14. Rab1 Bxc3 15. bxc3 Rxb1 16. Rxb1 c5 17. c4 Qe7 18. h3 Nf6 19. Bf2 Bd7 20. e5 dxe5 21. fxe5 Qxe5 22. Bg3 Qe6 23. Bxc7 Bc6 24. Qf5 Qxf5 25. Bxf5 Be4 26. Bxe4 Nxe4 27. Rb6 Ra8 28. Rc6 h5 29. Bb6 h4 30. Kg1 Re8 31. Bxc5 Rd8 32. Kf1 Rd2 33. a4 Rxc2 34. Bb4,"This is a game between Bogoljubow,E (as White) and Lasker,Em (as Black). Last move played: White plays Bishop to b4",The position is equal,34... Rf2+ 35. Kg1 ,34. Ba7 g5 
"The Rook checks, supported by the Knight.",True," The comment clarifies the nature of the check, indicating the Rook's movement and the Knight's response.",1. e4 e5 2. Nf3 Nc6 3. Bb5 Nf6 4. d4 exd4 5. Nxd4 Be7 6. O-O a6 7. Nxc6 bxc6 8. Bd3 d6 9. Nc3 O-O 10. f4 Re8 11. Kh1 Nd7 12. Be3 Bf6 13. Qf3 Rb8 14. Rab1 Bxc3 15. bxc3 Rxb1 16. Rxb1 c5 17. c4 Qe7 18. h3 Nf6 19. Bf2 Bd7 20. e5 dxe5 21. fxe5 Qxe5 22. Bg3 Qe6 23. Bxc7 Bc6 24. Qf5 Qxf5 25. Bxf5 Be4 26. Bxe4 Nxe4 27. Rb6 Ra8 28. Rc6 h5 29. Bb6 h4 30. Kg1 Re8 31. Bxc5 Rd8 32. Kf1 Rd2 33. a4 Rxc2 34. Bb4 Rf2+,"This is a game between Bogoljubow,E (as White) and Lasker,Em (as Black). Last move played: Black plays Rook to f2 with check",The position is equal,35. Kg1 Ra2 36. Be1 Rxa4 37. c5 Ra1 38. Kf1 f5 39. Rc7 Ng3+ 40. Kf2 Rc1 41. c6 f4 42. Rc8+ Kh7 43. Re8 Rxc6 44. Kf3 Kg6 45. Re5 Rc1 46. Kxf4 Nh5+ 47. Kf3 ,34... Rf2+ 35. Kg1 
The Rook now attacks the a-pawn.,True," The comment suggests a potential threat, indicating a misjudgment of the rook's impact.",1. e4 e5 2. Nf3 Nc6 3. Bb5 Nf6 4. d4 exd4 5. Nxd4 Be7 6. O-O a6 7. Nxc6 bxc6 8. Bd3 d6 9. Nc3 O-O 10. f4 Re8 11. Kh1 Nd7 12. Be3 Bf6 13. Qf3 Rb8 14. Rab1 Bxc3 15. bxc3 Rxb1 16. Rxb1 c5 17. c4 Qe7 18. h3 Nf6 19. Bf2 Bd7 20. e5 dxe5 21. fxe5 Qxe5 22. Bg3 Qe6 23. Bxc7 Bc6 24. Qf5 Qxf5 25. Bxf5 Be4 26. Bxe4 Nxe4 27. Rb6 Ra8 28. Rc6 h5 29. Bb6 h4 30. Kg1 Re8 31. Bxc5 Rd8 32. Kf1 Rd2 33. a4 Rxc2 34. Bb4 Rf2+ 35. Kg1 Ra2,"This is a game between Bogoljubow,E (as White) and Lasker,Em (as Black). Last move played: Black plays Rook to a2",The position is equal,36. Be1 ,35... Ra2 36. Be1 
...while Bogoljubow's Bishop swallows the h-pawn. Lasker's best bet now is to try to eliminate the Queenside pawns (Knights are better than Bishops in endgames with pawns on only one side of the board; remember?).,True," The comment offers a potential strategic explanation for the mistake, suggesting Lasker should focus on weakening the opponent’s pawn structure.",1. e4 e5 2. Nf3 Nc6 3. Bb5 Nf6 4. d4 exd4 5. Nxd4 Be7 6. O-O a6 7. Nxc6 bxc6 8. Bd3 d6 9. Nc3 O-O 10. f4 Re8 11. Kh1 Nd7 12. Be3 Bf6 13. Qf3 Rb8 14. Rab1 Bxc3 15. bxc3 Rxb1 16. Rxb1 c5 17. c4 Qe7 18. h3 Nf6 19. Bf2 Bd7 20. e5 dxe5 21. fxe5 Qxe5 22. Bg3 Qe6 23. Bxc7 Bc6 24. Qf5 Qxf5 25. Bxf5 Be4 26. Bxe4 Nxe4 27. Rb6 Ra8 28. Rc6 h5 29. Bb6 h4 30. Kg1 Re8 31. Bxc5 Rd8 32. Kf1 Rd2 33. a4 Rxc2 34. Bb4 Rf2+ 35. Kg1 Ra2 36. Be1 Rxa4 37. Bxh4,"This is a game between Bogoljubow,E (as White) and Lasker,Em (as Black). Last move played: White plays Bishop takes on h4",Slight advantage for Black (eval: -22 centipawns),37... Nd2 38. Rc8+ Kh7 39. Rc7 Kg6 40. Be7 Nxc4 41. Rc6+ Kh7 42. Rc7 Nd2 43. g4 Nf3+ 44. Kf2 Nd4 45. Ra7 Nc6 46. Rc7 Rc4 47. Bd6 Kg6 48. h4 f6 49. h5+ Kh7 ,37. c5 Ra1 
"The Knight (protected by the Rook) picks off the White c-pawn. Now Lasker must get ready for the long, slow grind of trying to convert his one-pawn advantage into a win.",True," The comment suggests a tactical weakness and a potential need for a strategic response, indicating a flawed move.",1. e4 e5 2. Nf3 Nc6 3. Bb5 Nf6 4. d4 exd4 5. Nxd4 Be7 6. O-O a6 7. Nxc6 bxc6 8. Bd3 d6 9. Nc3 O-O 10. f4 Re8 11. Kh1 Nd7 12. Be3 Bf6 13. Qf3 Rb8 14. Rab1 Bxc3 15. bxc3 Rxb1 16. Rxb1 c5 17. c4 Qe7 18. h3 Nf6 19. Bf2 Bd7 20. e5 dxe5 21. fxe5 Qxe5 22. Bg3 Qe6 23. Bxc7 Bc6 24. Qf5 Qxf5 25. Bxf5 Be4 26. Bxe4 Nxe4 27. Rb6 Ra8 28. Rc6 h5 29. Bb6 h4 30. Kg1 Re8 31. Bxc5 Rd8 32. Kf1 Rd2 33. a4 Rxc2 34. Bb4 Rf2+ 35. Kg1 Ra2 36. Be1 Rxa4 37. Bxh4 Nd2 38. Bd8 Nxc4,"This is a game between Bogoljubow,E (as White) and Lasker,Em (as Black). Last move played: Black plays Knight takes on c4",Slight advantage for Black (eval: -41 centipawns),39. Be7 Ne3 ,38... Nxc4 39. Rc5 
