comment,good,reasoning,moves,context,engine_eval,engine_best_line,engine_best_alternative
Another Bishop move is forced by the Black attack.,True," The comment suggests the move is forcing due to Black's attack, indicating a potential tactical error.",1. e4 e5 2. Nf3 Nc6 3. Bb5 Nf6 4. d4 exd4 5. Nxd4 Be7 6. O-O a6 7. Nxc6 bxc6 8. Bd3 d6 9. Nc3 O-O 10. f4 Re8 11. Kh1 Nd7 12. Be3 Bf6 13. Qf3 Rb8 14. Rab1 Bxc3 15. bxc3 Rxb1 16. Rxb1 c5 17. c4 Qe7 18. h3 Nf6 19. Bf2 Bd7 20. e5 dxe5 21. fxe5 Qxe5 22. Bg3 Qe6 23. Bxc7 Bc6 24. Qf5 Qxf5 25. Bxf5 Be4 26. Bxe4 Nxe4 27. Rb6 Ra8 28. Rc6 h5 29. Bb6 h4 30. Kg1 Re8 31. Bxc5 Rd8 32. Kf1 Rd2 33. a4 Rxc2 34. Bb4 Rf2+ 35. Kg1 Ra2 36. Be1 Rxa4 37. Bxh4 Nd2 38. Bd8 Nxc4 39. g4 Nd2 40. Rc8 Kh7 41. Ra8 Ra2 42. Kg2 Nb3+ 43. Kg3 Nd4 44. h4 Ra3+ 45. Kf2 Nc6 46. Bc7 Ne7 47. Bd6 Ra2+ 48. Kf3 Nc6 49. Bc7 Nd4+ 50. Kg3 Ra3+ 51. Kf2 Ra4 52. Kg3 Ne6 53. Bb6 Ra3+ 54. Kg2 Nf4+ 55. Kf2 Nd3+ 56. Kg2 Ne5 57. g5 Ng6 58. Bf2 Nf4+ 59. Kh2 Kg6 60. Ra7 a5 61. Bg3 Ra2+ 62. Kh1 Nh5 63. Be5 Ra4 64. Kg2 Rxh4 65. Ra6+ Kxg5 66. Rxa5 Kg6 67. Kf3 f6 68. Bd6 Rd4 69. Bc7 Rc4 70. Bd6,"This is a game between Bogoljubow,E (as White) and Lasker,Em (as Black). Last move played: White plays Bishop to d6",Large advantage for Black (eval: -350 centipawns),70... Kh6 71. Ra6 g5 72. Ke3 Kh7 73. Kf3 Kg6 74. Rb6 Rc3+ 75. Kf2 Kf5 76. Be7 Rd3 77. Rb5+ Ke6 78. Bc5 Nf4 79. Rb6+ Ke5 80. Ra6 Nd5 81. Ra5 Kf5 82. Rb5 Kg4 ,70. Bd6 Kh6 71. Ra6 g5 72. Rb6 Kg6 73. Bb8 Rc3+ 74. Kf2 Kf5 75. Bd6 Rc4 76. Kf3 Nf4 77. Rb5+ Kg6 78. Rb6 Kh5 79. Bb8 Rc3+ 80. Kf2 
"Here's the point: Black wants to advance his g-pawn. After his King backs up (probably to h6 or h7 to prevent annoying checks from the White Rook) and the g-pawn advances, the f-pawn would be undefended. The Black Rook will now defend the f-pawn laterally. The Rook is also posted on a light-colored square, free from attack by the White Bishop.",True," The comment provides a potential explanation for the mistake, suggesting a defensive strategy.",1. e4 e5 2. Nf3 Nc6 3. Bb5 Nf6 4. d4 exd4 5. Nxd4 Be7 6. O-O a6 7. Nxc6 bxc6 8. Bd3 d6 9. Nc3 O-O 10. f4 Re8 11. Kh1 Nd7 12. Be3 Bf6 13. Qf3 Rb8 14. Rab1 Bxc3 15. bxc3 Rxb1 16. Rxb1 c5 17. c4 Qe7 18. h3 Nf6 19. Bf2 Bd7 20. e5 dxe5 21. fxe5 Qxe5 22. Bg3 Qe6 23. Bxc7 Bc6 24. Qf5 Qxf5 25. Bxf5 Be4 26. Bxe4 Nxe4 27. Rb6 Ra8 28. Rc6 h5 29. Bb6 h4 30. Kg1 Re8 31. Bxc5 Rd8 32. Kf1 Rd2 33. a4 Rxc2 34. Bb4 Rf2+ 35. Kg1 Ra2 36. Be1 Rxa4 37. Bxh4 Nd2 38. Bd8 Nxc4 39. g4 Nd2 40. Rc8 Kh7 41. Ra8 Ra2 42. Kg2 Nb3+ 43. Kg3 Nd4 44. h4 Ra3+ 45. Kf2 Nc6 46. Bc7 Ne7 47. Bd6 Ra2+ 48. Kf3 Nc6 49. Bc7 Nd4+ 50. Kg3 Ra3+ 51. Kf2 Ra4 52. Kg3 Ne6 53. Bb6 Ra3+ 54. Kg2 Nf4+ 55. Kf2 Nd3+ 56. Kg2 Ne5 57. g5 Ng6 58. Bf2 Nf4+ 59. Kh2 Kg6 60. Ra7 a5 61. Bg3 Ra2+ 62. Kh1 Nh5 63. Be5 Ra4 64. Kg2 Rxh4 65. Ra6+ Kxg5 66. Rxa5 Kg6 67. Kf3 f6 68. Bd6 Rd4 69. Bc7 Rc4 70. Bd6 Rc6,"This is a game between Bogoljubow,E (as White) and Lasker,Em (as Black). Last move played: Black plays Rook to c6",Large advantage for Black (eval: -344 centipawns),71. Bc5 Kh6 72. Bd4 g5 73. Ra3 Kg6 74. Ra8 Nf4 75. Kg4 Rc4 76. Ba1 Nh5+ 77. Kh3 Rc6 78. Rg8+ Kf5 79. Ra8 Nf4+ 80. Kg3 Rd6 81. Ra4 Rd3+ 82. Kf2 g4 83. Bxf6 g3+ 84. Ke1 ,70... Kh6 71. Ra6 g5 72. Ke3 Kh7 73. Kf3 Kg6 74. Rb6 Rc3+ 75. Kf2 Kf5 76. Be7 Rd3 77. Rb5+ Ke6 78. Bc5 Nf4 79. Rb6+ Ke5 80. Ra6 Nd5 81. Ra5 Kf5 82. Rb5 Kg4 
The Bishop must retreat again. White has had no time to develop an attack by his Rook against the Black pawns as he's been too busy saving his Bishop.,True," The comment suggests the player’s strategy is hindering their attack, indicating a flawed plan.",1. e4 e5 2. Nf3 Nc6 3. Bb5 Nf6 4. d4 exd4 5. Nxd4 Be7 6. O-O a6 7. Nxc6 bxc6 8. Bd3 d6 9. Nc3 O-O 10. f4 Re8 11. Kh1 Nd7 12. Be3 Bf6 13. Qf3 Rb8 14. Rab1 Bxc3 15. bxc3 Rxb1 16. Rxb1 c5 17. c4 Qe7 18. h3 Nf6 19. Bf2 Bd7 20. e5 dxe5 21. fxe5 Qxe5 22. Bg3 Qe6 23. Bxc7 Bc6 24. Qf5 Qxf5 25. Bxf5 Be4 26. Bxe4 Nxe4 27. Rb6 Ra8 28. Rc6 h5 29. Bb6 h4 30. Kg1 Re8 31. Bxc5 Rd8 32. Kf1 Rd2 33. a4 Rxc2 34. Bb4 Rf2+ 35. Kg1 Ra2 36. Be1 Rxa4 37. Bxh4 Nd2 38. Bd8 Nxc4 39. g4 Nd2 40. Rc8 Kh7 41. Ra8 Ra2 42. Kg2 Nb3+ 43. Kg3 Nd4 44. h4 Ra3+ 45. Kf2 Nc6 46. Bc7 Ne7 47. Bd6 Ra2+ 48. Kf3 Nc6 49. Bc7 Nd4+ 50. Kg3 Ra3+ 51. Kf2 Ra4 52. Kg3 Ne6 53. Bb6 Ra3+ 54. Kg2 Nf4+ 55. Kf2 Nd3+ 56. Kg2 Ne5 57. g5 Ng6 58. Bf2 Nf4+ 59. Kh2 Kg6 60. Ra7 a5 61. Bg3 Ra2+ 62. Kh1 Nh5 63. Be5 Ra4 64. Kg2 Rxh4 65. Ra6+ Kxg5 66. Rxa5 Kg6 67. Kf3 f6 68. Bd6 Rd4 69. Bc7 Rc4 70. Bd6 Rc6 71. Bb8,"This is a game between Bogoljubow,E (as White) and Lasker,Em (as Black). Last move played: White plays Bishop to b8",Large advantage for Black (eval: -336 centipawns),71... Kh6 72. Ba7 Rc3+ 73. Kf2 Rc4 74. Kf3 g5 75. Ra6 Rf4+ 76. Kg2 Kg6 77. Bb8 Rc4 78. Bh2 Kf5 79. Kf3 Rc3+ 80. Kg2 Rd3 ,71. Bc5 Kh6 72. Bd4 g5 73. Ra3 Kg6 74. Ra8 Nf4 75. Kg4 Rc4 76. Ba1 Nh5+ 77. Kh3 Rc6 78. Rg8+ Kf5 79. Ra8 Nf4+ 80. Kg3 Rd6 81. Ra4 Rd3+ 82. Kf2 g4 83. Bxf6 g3+ 84. Ke1 
"As expected, the Black King clears the way for his connected pawns to advance. 72.Ra7 would just meet with 72...g6. Black controls all the good squares for White's Bishop. White sees the futility of further action and resigns.",True," The comment accurately describes the logical consequence of the move, indicating a flawed strategic assessment.",1. e4 e5 2. Nf3 Nc6 3. Bb5 Nf6 4. d4 exd4 5. Nxd4 Be7 6. O-O a6 7. Nxc6 bxc6 8. Bd3 d6 9. Nc3 O-O 10. f4 Re8 11. Kh1 Nd7 12. Be3 Bf6 13. Qf3 Rb8 14. Rab1 Bxc3 15. bxc3 Rxb1 16. Rxb1 c5 17. c4 Qe7 18. h3 Nf6 19. Bf2 Bd7 20. e5 dxe5 21. fxe5 Qxe5 22. Bg3 Qe6 23. Bxc7 Bc6 24. Qf5 Qxf5 25. Bxf5 Be4 26. Bxe4 Nxe4 27. Rb6 Ra8 28. Rc6 h5 29. Bb6 h4 30. Kg1 Re8 31. Bxc5 Rd8 32. Kf1 Rd2 33. a4 Rxc2 34. Bb4 Rf2+ 35. Kg1 Ra2 36. Be1 Rxa4 37. Bxh4 Nd2 38. Bd8 Nxc4 39. g4 Nd2 40. Rc8 Kh7 41. Ra8 Ra2 42. Kg2 Nb3+ 43. Kg3 Nd4 44. h4 Ra3+ 45. Kf2 Nc6 46. Bc7 Ne7 47. Bd6 Ra2+ 48. Kf3 Nc6 49. Bc7 Nd4+ 50. Kg3 Ra3+ 51. Kf2 Ra4 52. Kg3 Ne6 53. Bb6 Ra3+ 54. Kg2 Nf4+ 55. Kf2 Nd3+ 56. Kg2 Ne5 57. g5 Ng6 58. Bf2 Nf4+ 59. Kh2 Kg6 60. Ra7 a5 61. Bg3 Ra2+ 62. Kh1 Nh5 63. Be5 Ra4 64. Kg2 Rxh4 65. Ra6+ Kxg5 66. Rxa5 Kg6 67. Kf3 f6 68. Bd6 Rd4 69. Bc7 Rc4 70. Bd6 Rc6 71. Bb8 Kh6,"This is a game between Bogoljubow,E (as White) and Lasker,Em (as Black). Last move played: Black plays King to h6",Large advantage for Black (eval: -348 centipawns),72. Ba7 g5 73. Bd4 Rc4 74. Bb2 Rf4+ 75. Kg2 Rb4 76. Ba1 Kg6 77. Kf2 Rf4+ 78. Kg2 Rc4 79. Kf3 g4+ 80. Kf2 Rf4+ 81. Kg1 Rf3 82. Ra6 Rd3 83. Be5 Kg5 84. Bc7 Rc3 85. Bd8 Kg6 ,71... Kh6 72. Ba7 Rc3+ 73. Kf2 Rc4 74. Kf3 g5 75. Ra6 Rf4+ 76. Kg2 Kg6 77. Bb8 Rc4 78. Bh2 Kf5 79. Kf3 Rc3+ 80. Kg2 Rd3 
"Bogo puts pressure on the pawn's defender. The immediate threat is 3.Bxc6, capturing the Knight and leaving the pawn undefended.",True, The comment highlights a potential weakness in the player’s strategic thinking.,1. e4 e5 2. Nf3 Nc6 3. Bb5,"This is a game between Bogoljubow,E (as White) and Lasker,Em (as Black). Last move played: White plays Bishop to b5",Slight advantage for White (eval: 24 centipawns),3... Nf6 ,3. Bb5 
Bogo gets the King out of the center and develops the Rook toward the important center files.,True," The comment identifies a strategic disadvantage and suggests a defensive move, indicating a flawed assessment of the position.",1. e4 e5 2. Nf3 Nc6 3. Bb5 Nf6 4. d4 exd4 5. Nxd4 Be7 6. O-O,"This is a game between Bogoljubow,E (as White) and Lasker,Em (as Black). Last move played: White plays kingside castle",Slight advantage for White (eval: 22 centipawns),6... O-O ,6. Nc3 O-O 
"King safety should be one of your main concerns, and castling is a great way to safeguard your King.",True," The comment suggests a potential material disadvantage, indicating a flawed strategic decision.",1. e4 e5 2. Nf3 Nc6 3. Bb5 Nf6 4. d4 exd4 5. Nxd4 Be7 6. O-O a6 7. Nxc6 bxc6 8. Bd3 d6 9. Nc3 O-O,"This is a game between Bogoljubow,E (as White) and Lasker,Em (as Black). Last move played: Black plays kingside castle",Advantage for White (eval: 69 centipawns),10. f4 ,9... O-O 10. f4 a5 11. Kh1 a4 12. Qf3 Nd7 13. Be3 Ba6 14. Rad1 Qc8 15. g4 f6 16. h4 Qb7 17. Bc1 Rf7 18. Rf2 Bxd3 19. cxd3 d5 20. h5 d4 21. Ne2 c5 
Bogo has to take back with the pawn or else be behind in material. But the b-file is now open...,True," Yes, the comment suggests a flawed strategic decision to sacrifice a Bishop for a potential Bishop gain, indicating a poor tactical assessment.",1. e4 e5 2. Nf3 Nc6 3. Bb5 Nf6 4. d4 exd4 5. Nxd4 Be7 6. O-O a6 7. Nxc6 bxc6 8. Bd3 d6 9. Nc3 O-O 10. f4 Re8 11. Kh1 Nd7 12. Be3 Bf6 13. Qf3 Rb8 14. Rab1 Bxc3 15. bxc3,"This is a game between Bogoljubow,E (as White) and Lasker,Em (as Black). Last move played: White plays Pawn takes on c3",The position is equal,15... Rxb1 ,15. bxc3 
"By pushing this pawn, Lasker cuts down the mobility of the e3-Bishop, plus the c5-pawn screens b6 from the Bishop, allowing the Black Knight to move there if Lasker so chooses.",True, The comment indicates a potential tactical blunder involving a repeated attack on the pawn.,1. e4 e5 2. Nf3 Nc6 3. Bb5 Nf6 4. d4 exd4 5. Nxd4 Be7 6. O-O a6 7. Nxc6 bxc6 8. Bd3 d6 9. Nc3 O-O 10. f4 Re8 11. Kh1 Nd7 12. Be3 Bf6 13. Qf3 Rb8 14. Rab1 Bxc3 15. bxc3 Rxb1 16. Rxb1 c5,"This is a game between Bogoljubow,E (as White) and Lasker,Em (as Black). Last move played: Black plays Pawn to c5",The position is equal,17. c4 Nf6 18. Bf2 Qe7 19. Bh4 Bd7 20. Re1 Bc6 21. Qf1 Qe6 22. e5 Qh3 23. Bxf6 gxf6 24. Kg1 Qh6 25. exd6 Rxe1 26. Qxe1 Qxf4 27. dxc7 Qxc7 28. Bf5 Qe5 29. Qg3+ Kh8 30. Qxe5 fxe5 ,16... c5 17. c4 
"Bogo looks ahead and foresees Black playing ...Nf6 and ...Bg4, attacking the White Queen. He pushes the h-pawn to deny g4 to Black.",True," The comment provides a potential explanation for the mistake, suggesting a strategic misstep.",1. e4 e5 2. Nf3 Nc6 3. Bb5 Nf6 4. d4 exd4 5. Nxd4 Be7 6. O-O a6 7. Nxc6 bxc6 8. Bd3 d6 9. Nc3 O-O 10. f4 Re8 11. Kh1 Nd7 12. Be3 Bf6 13. Qf3 Rb8 14. Rab1 Bxc3 15. bxc3 Rxb1 16. Rxb1 c5 17. c4 Qe7 18. h3,"This is a game between Bogoljubow,E (as White) and Lasker,Em (as Black). Last move played: White plays Pawn to h3",The position is equal,18... Nf6 ,18. h3 Nf6 
...Bogo recaptures...,True, The comment suggests a potential weakness in the rook's development or strategic planning.,1. e4 e5 2. Nf3 Nc6 3. Bb5 Nf6 4. d4 exd4 5. Nxd4 Be7 6. O-O a6 7. Nxc6 bxc6 8. Bd3 d6 9. Nc3 O-O 10. f4 Re8 11. Kh1 Nd7 12. Be3 Bf6 13. Qf3 Rb8 14. Rab1 Bxc3 15. bxc3 Rxb1 16. Rxb1 c5 17. c4 Qe7 18. h3 Nf6 19. Bf2 Bd7 20. e5 dxe5 21. fxe5,"This is a game between Bogoljubow,E (as White) and Lasker,Em (as Black). Last move played: White plays Pawn takes on e5",The position is equal,21... Qxe5 22. Re1 Qd6 23. Rxe8+ Nxe8 24. Qd5 Bc6 25. Qxc5 Qxc5 26. Bxc5 g6 27. Kg1 f5 28. g3 Kf7 29. Bb4 Ng7 30. Ba5 Ne6 31. Kf2 Ke7 32. h4 Bd7 33. Bd2 c6 34. Bc1 c5 ,21. fxe5 Qxe5 
The Queen has no option other than retreat.,True," The comment suggests a potential tactical opportunity for the Black King, potentially hindering Black’s pawn advance.",1. e4 e5 2. Nf3 Nc6 3. Bb5 Nf6 4. d4 exd4 5. Nxd4 Be7 6. O-O a6 7. Nxc6 bxc6 8. Bd3 d6 9. Nc3 O-O 10. f4 Re8 11. Kh1 Nd7 12. Be3 Bf6 13. Qf3 Rb8 14. Rab1 Bxc3 15. bxc3 Rxb1 16. Rxb1 c5 17. c4 Qe7 18. h3 Nf6 19. Bf2 Bd7 20. e5 dxe5 21. fxe5 Qxe5 22. Bg3 Qe6,"This is a game between Bogoljubow,E (as White) and Lasker,Em (as Black). Last move played: Black plays Queen to e6",The position is equal,23. Re1 Qc6 24. Rxe8+ Nxe8 25. Be4 Qa4 26. Qb3 h6 27. Bf3 Qa5 28. Kh2 Qb6 29. Qd3 Be6 30. Qd8 Kf8 31. Bd5 Bxd5 32. cxd5 c4 33. Qd7 Nd6 ,22... Qe6 23. Re1 
Lasker attacks the White Queen to drive it off of the long a8-h1 diagonal. Then he could safely play ...Qxh3+ (since the g-pawn would be pinned).,True," The comment describes a potential tactical threat, suggesting a flawed plan.",1. e4 e5 2. Nf3 Nc6 3. Bb5 Nf6 4. d4 exd4 5. Nxd4 Be7 6. O-O a6 7. Nxc6 bxc6 8. Bd3 d6 9. Nc3 O-O 10. f4 Re8 11. Kh1 Nd7 12. Be3 Bf6 13. Qf3 Rb8 14. Rab1 Bxc3 15. bxc3 Rxb1 16. Rxb1 c5 17. c4 Qe7 18. h3 Nf6 19. Bf2 Bd7 20. e5 dxe5 21. fxe5 Qxe5 22. Bg3 Qe6 23. Bxc7 Bc6,"This is a game between Bogoljubow,E (as White) and Lasker,Em (as Black). Last move played: Black plays Bishop to c6",Slight advantage for Black (eval: -25 centipawns),24. Qg3 Ne4 ,23... Bc6 24. Qg3 
"Bogo offers a Queen exchange. If Black declines, Bogo could win a pawn via Qxc5. Bogo also sees drawing chances for himself in the endgame.",True," The comment describes a potentially risky, aggressive move with the goal of drawing, suggesting a flawed strategic decision.",1. e4 e5 2. Nf3 Nc6 3. Bb5 Nf6 4. d4 exd4 5. Nxd4 Be7 6. O-O a6 7. Nxc6 bxc6 8. Bd3 d6 9. Nc3 O-O 10. f4 Re8 11. Kh1 Nd7 12. Be3 Bf6 13. Qf3 Rb8 14. Rab1 Bxc3 15. bxc3 Rxb1 16. Rxb1 c5 17. c4 Qe7 18. h3 Nf6 19. Bf2 Bd7 20. e5 dxe5 21. fxe5 Qxe5 22. Bg3 Qe6 23. Bxc7 Bc6 24. Qf5,"This is a game between Bogoljubow,E (as White) and Lasker,Em (as Black). Last move played: White plays Queen to f5",Large advantage for Black (eval: -187 centipawns),24... Bxg2+ ,24. Qg3 Ne4 
"Bogo figures that as long as he has to give up this Bishop, he may as well get another Bishop for it (instead of a Knight).",True," The comment highlights a potential tactical blunder by sacrificing a Bishop for a strategic advantage, suggesting a flaw in the player's planning.",1. e4 e5 2. Nf3 Nc6 3. Bb5 Nf6 4. d4 exd4 5. Nxd4 Be7 6. O-O a6 7. Nxc6 bxc6 8. Bd3 d6 9. Nc3 O-O 10. f4 Re8 11. Kh1 Nd7 12. Be3 Bf6 13. Qf3 Rb8 14. Rab1 Bxc3 15. bxc3 Rxb1 16. Rxb1 c5 17. c4 Qe7 18. h3 Nf6 19. Bf2 Bd7 20. e5 dxe5 21. fxe5 Qxe5 22. Bg3 Qe6 23. Bxc7 Bc6 24. Qf5 Qxf5 25. Bxf5 Be4 26. Bxe4,"This is a game between Bogoljubow,E (as White) and Lasker,Em (as Black). Last move played: White plays Bishop takes on e4",The position is equal,26... Nxe4 27. Rb6 f5 28. Rxa6 g5 29. g3 Nf2+ 30. Kg2 Re2 31. a4 Ne4+ 32. Kf1 Rxc2 33. Ra8+ Kg7 34. a5 f4 35. gxf4 gxf4 36. Re8 Ng3+ 37. Ke1 Rc1+ 38. Kd2 Rxc4 39. a6 Ra4 40. Bxf4 Nf5 41. Rc8 Ra2+ 42. Ke1 Rxa6 43. Rxc5 Ra1+ 44. Bc1 ,26. Bxe4 Nxe4 
"...so the Rook just attacks the c-pawn instead. Of course, it's defended by the Knight, so reinforcements are needed.",True," The comment directly identifies a critical error in the move, offering a solution to the resulting problem.",1. e4 e5 2. Nf3 Nc6 3. Bb5 Nf6 4. d4 exd4 5. Nxd4 Be7 6. O-O a6 7. Nxc6 bxc6 8. Bd3 d6 9. Nc3 O-O 10. f4 Re8 11. Kh1 Nd7 12. Be3 Bf6 13. Qf3 Rb8 14. Rab1 Bxc3 15. bxc3 Rxb1 16. Rxb1 c5 17. c4 Qe7 18. h3 Nf6 19. Bf2 Bd7 20. e5 dxe5 21. fxe5 Qxe5 22. Bg3 Qe6 23. Bxc7 Bc6 24. Qf5 Qxf5 25. Bxf5 Be4 26. Bxe4 Nxe4 27. Rb6 Ra8 28. Rc6,"This is a game between Bogoljubow,E (as White) and Lasker,Em (as Black). Last move played: White plays Rook to c6",The position is equal,28... h5 ,28. g4 
"Lasker continues to set up his attack. There's no longer a mate threat, but a Kingside attack will allow him to control the initiative and possibly win some material.",True,", The comment indicates a potential tactical blunder due to relentless checking.",1. e4 e5 2. Nf3 Nc6 3. Bb5 Nf6 4. d4 exd4 5. Nxd4 Be7 6. O-O a6 7. Nxc6 bxc6 8. Bd3 d6 9. Nc3 O-O 10. f4 Re8 11. Kh1 Nd7 12. Be3 Bf6 13. Qf3 Rb8 14. Rab1 Bxc3 15. bxc3 Rxb1 16. Rxb1 c5 17. c4 Qe7 18. h3 Nf6 19. Bf2 Bd7 20. e5 dxe5 21. fxe5 Qxe5 22. Bg3 Qe6 23. Bxc7 Bc6 24. Qf5 Qxf5 25. Bxf5 Be4 26. Bxe4 Nxe4 27. Rb6 Ra8 28. Rc6 h5 29. Bb6 h4 30. Kg1 Re8,"This is a game between Bogoljubow,E (as White) and Lasker,Em (as Black). Last move played: Black plays Rook to e8",The position is equal,31. Bxc5 Nxc5 ,30... Kh7 31. Kf1 Re8 32. Ke2 f6 33. Kd3 Nf2+ 34. Kd2 Re5 35. Bc7 Re7 36. Bb6 Re5 
"Bogo recaptures with the Knight (of course, NOT 5.Qxd4 Nxd4!).",True," The comment clearly indicates a tactical blunder involving a Knight capture and a threat to the Queen, highlighting a poor strategic decision.",1. e4 e5 2. Nf3 Nc6 3. Bb5 Nf6 4. d4 exd4 5. Nxd4,"This is a game between Bogoljubow,E (as White) and Lasker,Em (as Black). Last move played: White plays Knight takes on d4",Slight advantage for Black (eval: -30 centipawns),5... Nxe4 ,5. O-O a6 
Surprise! Bogo captures the Knight (and threatens Black's Queen) instead of withdrawing the Bishop!,True," Yes, the comment provides a clear explanation of the strategic vulnerability of the King's position, suggesting a potential threat.",1. e4 e5 2. Nf3 Nc6 3. Bb5 Nf6 4. d4 exd4 5. Nxd4 Be7 6. O-O a6 7. Nxc6,"This is a game between Bogoljubow,E (as White) and Lasker,Em (as Black). Last move played: White plays Knight takes on c6",The position is equal,7... dxc6 8. Bd3 Nd7 9. Nc3 Ne5 10. Be2 Qxd1 11. Nxd1 f6 12. Re1 Bg4 13. f3 Be6 14. f4 Nd7 15. g3 Bc5+ 16. Nf2 O-O-O 17. Kg2 Rhe8 18. h3 ,7. Nxc6 dxc6 
Bogo has to take back with the pawn or else be behind in material. But the b-file is now open...,True," The comment suggests the move was a mistake, but doesn't explicitly state why.",1. e4 e5 2. Nf3 Nc6 3. Bb5 Nf6 4. d4 exd4 5. Nxd4 Be7 6. O-O a6 7. Nxc6 bxc6 8. Bd3 d6 9. Nc3 O-O 10. f4 Re8 11. Kh1 Nd7 12. Be3 Bf6 13. Qf3 Rb8 14. Rab1 Bxc3 15. bxc3,"This is a game between Bogoljubow,E (as White) and Lasker,Em (as Black). Last move played: White plays Pawn takes on c3",The position is equal,15... Rxb1 ,15. bxc3 
"Bogo snaps up the hanging pawn. The material is even, Bogo has the advantage of the two Bishops, but his pieces aren't placed as well as Black's.",True," The comment identifies a specific tactical flaw, suggesting a poor move choice.",1. e4 e5 2. Nf3 Nc6 3. Bb5 Nf6 4. d4 exd4 5. Nxd4 Be7 6. O-O a6 7. Nxc6 bxc6 8. Bd3 d6 9. Nc3 O-O 10. f4 Re8 11. Kh1 Nd7 12. Be3 Bf6 13. Qf3 Rb8 14. Rab1 Bxc3 15. bxc3 Rxb1 16. Rxb1 c5 17. c4 Qe7 18. h3 Nf6 19. Bf2 Bd7 20. e5 dxe5 21. fxe5 Qxe5 22. Bg3 Qe6 23. Bxc7,"This is a game between Bogoljubow,E (as White) and Lasker,Em (as Black). Last move played: White plays Bishop takes on c7",Slight advantage for Black (eval: -24 centipawns),23... Bc6 24. Qg3 ,23. Re1 Qc6 
Lasker decides to clear things up in the center by trading pawns.,True," The comment suggests a potential tactical error by retreating the Bishop, indicating a misjudgment of the Bishop's position.",1. e4 e5 2. Nf3 Nc6 3. Bb5 Nf6 4. d4 exd4,"This is a game between Bogoljubow,E (as White) and Lasker,Em (as Black). Last move played: Black plays Pawn takes on d4",The position is equal,5. O-O a6 ,4... Nxd4 5. Nxd4 
"The Bishop occupies the long a1-h8 diagonal, putting pressure on the f3-Knight and (indirectly) on the b2-pawn.",True," The comment offers a possible explanation for the mistake, suggesting a positional advantage for the Knight.",1. e4 e5 2. Nf3 Nc6 3. Bb5 Nf6 4. d4 exd4 5. Nxd4 Be7 6. O-O a6 7. Nxc6 bxc6 8. Bd3 d6 9. Nc3 O-O 10. f4 Re8 11. Kh1 Nd7 12. Be3 Bf6,"This is a game between Bogoljubow,E (as White) and Lasker,Em (as Black). Last move played: Black plays Bishop to f6",Advantage for White (eval: 92 centipawns),13. Qh5 ,12... Rb8 13. Qf3 
The Queen has no option other than retreat.,True," The comment suggests a potential tactical error related to king safety, indicating a flawed assessment of the resulting position.",1. e4 e5 2. Nf3 Nc6 3. Bb5 Nf6 4. d4 exd4 5. Nxd4 Be7 6. O-O a6 7. Nxc6 bxc6 8. Bd3 d6 9. Nc3 O-O 10. f4 Re8 11. Kh1 Nd7 12. Be3 Bf6 13. Qf3 Rb8 14. Rab1 Bxc3 15. bxc3 Rxb1 16. Rxb1 c5 17. c4 Qe7 18. h3 Nf6 19. Bf2 Bd7 20. e5 dxe5 21. fxe5 Qxe5 22. Bg3 Qe6,"This is a game between Bogoljubow,E (as White) and Lasker,Em (as Black). Last move played: Black plays Queen to e6",The position is equal,23. Re1 Qc6 24. Rxe8+ Nxe8 25. Be4 Qa4 26. Qb3 h6 27. Bf3 Qa5 28. Kh2 Qb6 29. Qd3 Be6 30. Qd8 Kf8 31. Bd5 Bxd5 32. cxd5 c4 33. Qd7 Nd6 ,22... Qe6 23. Re1 
"Dr. Lasker (Black) follows suit, controlling a piece of the center for himself and allowing for the development of his forces.",True," The comment describes a strategic move that, while potentially beneficial, doesn't actually correct the mistake – it merely describes a consequence of the mistake.",1. e4 e5,"This is a game between Bogoljubow,E (as White) and Lasker,Em (as Black). Last move played: Black plays Pawn to e5",Slight advantage for White (eval: 32 centipawns),2. Nf3 ,1... e5 2. Nf3 Nc6 3. d4 exd4 4. Nxd4 Bc5 5. Nb3 Bb6 6. a4 Qh4 7. Qf3 a5 8. g3 Qf6 9. Qe2 Nge7 10. Nc3 
Surprise! Bogo captures the Knight (and threatens Black's Queen) instead of withdrawing the Bishop!,True,", The comment highlights a tactical blunder, suggesting a potential loss of material due to a poorly timed trade.",1. e4 e5 2. Nf3 Nc6 3. Bb5 Nf6 4. d4 exd4 5. Nxd4 Be7 6. O-O a6 7. Nxc6,"This is a game between Bogoljubow,E (as White) and Lasker,Em (as Black). Last move played: White plays Knight takes on c6",The position is equal,7... dxc6 8. Bd3 Nd7 9. Nc3 Ne5 10. Be2 Qxd1 11. Nxd1 f6 12. Re1 Bg4 13. f3 Be6 14. f4 Nd7 15. g3 Bc5+ 16. Nf2 O-O-O 17. Kg2 Rhe8 18. h3 ,7. Nxc6 dxc6 
"...and Lasker emerges a pawn ahead. Now Lasker commands the open e-file with his battery, while Bogo has open diagonals for his Queen and light-squared Bishop.",True," The comment provides a clear explanation of why the move was considered a mistake, highlighting a tactical weakness and a doubling up of the pawn.",1. e4 e5 2. Nf3 Nc6 3. Bb5 Nf6 4. d4 exd4 5. Nxd4 Be7 6. O-O a6 7. Nxc6 bxc6 8. Bd3 d6 9. Nc3 O-O 10. f4 Re8 11. Kh1 Nd7 12. Be3 Bf6 13. Qf3 Rb8 14. Rab1 Bxc3 15. bxc3 Rxb1 16. Rxb1 c5 17. c4 Qe7 18. h3 Nf6 19. Bf2 Bd7 20. e5 dxe5 21. fxe5 Qxe5,"This is a game between Bogoljubow,E (as White) and Lasker,Em (as Black). Last move played: Black plays Queen takes on e5",The position is equal,22. Re1 Qd6 23. Rxe8+ Nxe8 24. Qe3 g6 25. Bg3 Qd4 26. Qe7 Bc6 27. Kh2 Ba4 28. Qe1 Bc6 ,21... Qxe5 22. Re1 Qd6 23. Rxe8+ Nxe8 24. Qd5 Bc6 25. Qxc5 Qxc5 26. Bxc5 g6 27. Kg1 f5 28. g3 Kf7 29. Bb4 Ng7 30. Ba5 Ne6 31. Kf2 Ke7 32. h4 Bd7 33. Bd2 c6 34. Bc1 c5 
