comment,good,reasoning,moves,context,engine_eval,engine_best_line,engine_best_alternative
6...c5 Movin g the pawn to c5 in one move is an improvement on the game continuation.,True," The comment suggests a potential improvement, but the move is a standard response to e5 and doesn't significantly alter the position.",1. d4 d5 2. Nf3 e6 3. c4 Nf6 4. Nc3 Be7 5. Bf4 O-O 6. Qc2 c6,This is a game between Lasker (as White) and Marco (as Black). Last move played: Black plays Pawn to c6,Slight advantage for White (eval: 44 centipawns),7. e3 Nbd7 ,6... c5 7. dxc5 Na6 8. e3 Nxc5 9. Be2 dxc4 10. Bxc4 a6 11. a4 b6 12. O-O Bb7 13. Rfd1 Qe8 14. Ne5 Rc8 15. Qe2 h6 16. Bg3 
"Played in order to develop his light squared bishop, which is blocked by the e6 pawn.",True," The comment identifies a potential positional issue, suggesting the move wasn't the best choice due to hindering the bishop's development.",1. d4 d5 2. Nf3 e6 3. c4 Nf6 4. Nc3 Be7 5. Bf4 O-O 6. Qc2 c6 7. e3 b6,This is a game between Lasker (as White) and Marco (as Black). Last move played: Black plays Pawn to b6,Advantage for White (eval: 57 centipawns),8. h4 c5 ,7... Nbd7 8. Rd1 
A waste of time. A better idea was developing the rook with 8.Rc1 or 8.Rd1.,True, The comment suggests a more efficient development path.,1. d4 d5 2. Nf3 e6 3. c4 Nf6 4. Nc3 Be7 5. Bf4 O-O 6. Qc2 c6 7. e3 b6 8. a3,This is a game between Lasker (as White) and Marco (as Black). Last move played: White plays Pawn to a3,Slight advantage for White (eval: 33 centipawns),8... Ba6 9. Ne5 dxc4 10. Bxc4 Bxc4 11. Nxc4 Nbd7 12. O-O Nd5 13. Bg3 Nxc3 14. Qxc3 c5 15. Rfd1 Qc8 16. Nd6 Qa6 17. dxc5 Nxc5 18. b4 Bxd6 19. Bxd6 Ne4 20. Qe5 Nxd6 21. Qxd6 Rfc8 22. Qd7 h6 23. h3 ,8. h4 c5 
The pawns at c5 and d5 are known as hanging pawns because they cannot be defended by other pawns and are targets for enemy operations. 14... Bxc5 would give Black active piece play for his isolated d-pawn.,True," The comment provides a potential explanation for the mistake, suggesting a defensive strategy that could be detrimental.",1. d4 d5 2. Nf3 e6 3. c4 Nf6 4. Nc3 Be7 5. Bf4 O-O 6. Qc2 c6 7. e3 b6 8. a3 Bb7 9. cxd5 exd5 10. Bd3 c5 11. Nb5 Nc6 12. Bf5 g6 13. Bd3 Rc8 14. dxc5 bxc5,This is a game between Lasker (as White) and Marco (as Black). Last move played: Black plays Pawn takes on c5,Large advantage for Black (eval: -139 centipawns),15. Rd1 ,14... bxc5 15. O-O d4 16. exd4 a6 17. Nc3 Nxd4 18. Qd1 Bd6 19. Bg3 Bxf3 20. gxf3 Bxg3 21. hxg3 c4 22. Be4 Nb3 23. Qxd8 Rcxd8 24. Ra2 Rd2 25. Rd1 Rfd8 26. Rxd2 Rxd2 27. Bb7 
White has the advantage because of his pressure against the hanging pawns.,True," The comment suggests a potential advantage, but doesn't directly address the flawed move itself.",1. d4 d5 2. Nf3 e6 3. c4 Nf6 4. Nc3 Be7 5. Bf4 O-O 6. Qc2 c6 7. e3 b6 8. a3 Bb7 9. cxd5 exd5 10. Bd3 c5 11. Nb5 Nc6 12. Bf5 g6 13. Bd3 Rc8 14. dxc5 bxc5 15. O-O Qd7 16. Be2 Rfd8 17. Rfd1,This is a game between Lasker (as White) and Marco (as Black). Last move played: White plays Rook to d1,Slight advantage for Black (eval: -48 centipawns),17... Nh5 18. Bh6 ,17. Rad1 d4 
With this attacking move White wins the exchange.,True," The comment suggests a victory without a clear tactical advantage, indicating a flawed assessment of the position.",1. d4 d5 2. Nf3 e6 3. c4 Nf6 4. Nc3 Be7 5. Bf4 O-O 6. Qc2 c6 7. e3 b6 8. a3 Bb7 9. cxd5 exd5 10. Bd3 c5 11. Nb5 Nc6 12. Bf5 g6 13. Bd3 Rc8 14. dxc5 bxc5 15. O-O Qd7 16. Be2 Rfd8 17. Rfd1 Ne4 18. Nc3 Nxc3 19. Qxc3 d4 20. Qc2 Na5 21. Ne5 Qe6 22. Qa4 Bf6 23. Bg4,This is a game between Lasker (as White) and Marco (as Black). Last move played: White plays Bishop to g4,Large advantage for White (eval: 317 centipawns),23... Qd5 24. Bf3 ,23. Bg4 Qd5 24. Bf3 Qb3 25. Qxa5 g5 26. Bh5 Kg7 27. Bg3 dxe3 28. Re1 exf2+ 29. Bxf2 Re8 30. Nf3 Rcd8 31. Bg4 h5 32. Bxh5 Rxe1+ 33. Rxe1 
Black resigned due to his material deficit.,True, The comment directly states the reason for the mistake – material deficit – which provides context for the flawed move.,1. d4 d5 2. Nf3 e6 3. c4 Nf6 4. Nc3 Be7 5. Bf4 O-O 6. Qc2 c6 7. e3 b6 8. a3 Bb7 9. cxd5 exd5 10. Bd3 c5 11. Nb5 Nc6 12. Bf5 g6 13. Bd3 Rc8 14. dxc5 bxc5 15. O-O Qd7 16. Be2 Rfd8 17. Rfd1 Ne4 18. Nc3 Nxc3 19. Qxc3 d4 20. Qc2 Na5 21. Ne5 Qe6 22. Qa4 Bf6 23. Bg4 Qb6 24. Bxc8 Bxc8 25. b4 Bxe5 26. Bxe5 Nc6 27. bxc5 Qxc5 28. Bxd4 Nxd4 29. Rxd4,This is a game between Lasker (as White) and Marco (as Black). Last move played: White plays Rook takes on d4,Large advantage for White (eval: 503 centipawns),29... Rf8 30. Rad1 h5 31. Rd8 Bg4 32. Rxf8+ Qxf8 33. f3 Be6 34. Qxa7 Bb3 35. Rc1 Kh7 36. Kh1 Qd6 37. Qc5 Qd2 38. Qc3 ,29. Rxd4 Rf8 30. Rad1 h5 31. Rd8 Bg4 32. Rxf8+ Qxf8 33. f3 Be6 34. Qxa7 Qc8 35. Qd4 Kh7 36. Kh1 Qc2 37. a4 Qa2 38. h4 Qf2 39. Ra1 Qg3 
13.Bh3 would keep the bishop on the h3-c8 diagonal.,True, The comment suggests a potential tactical blunder due to the unexpected development of Black's pieces.,1. d4 d5 2. Nf3 e6 3. c4 Nf6 4. Nc3 Be7 5. Bf4 O-O 6. Qc2 c6 7. e3 b6 8. a3 Bb7 9. cxd5 exd5 10. Bd3 c5 11. Nb5 Nc6 12. Bf5 g6 13. Bd3,This is a game between Lasker (as White) and Marco (as Black). Last move played: White plays Bishop to d3,Slight advantage for Black (eval: -31 centipawns),13... Rc8 14. Nc3 ,13. Bh3 
