comment,good,reasoning,moves,context,engine_eval,engine_best_line,engine_best_alternative
Reti completes his Kingside development. Now his King is safely tucked away without and his Rook is developed toward the important center files.,True, The comment suggests a defensive move that contradicts the intended strategic goal of the Queen's retreat.,1. d4 Nf6 2. Nf3 g6 3. c4 Bg7 4. Nc3 O-O,"This is a game between Marshall,F (as White) and Reti,R (as Black). Last move played: Black plays kingside castle",Advantage for White (eval: 66 centipawns),5. e4 ,4... d5 5. cxd5 Nxd5 6. e4 Nxc3 7. bxc3 c5 8. Rb1 O-O 9. Be2 Bg4 10. O-O Bxf3 11. Bxf3 cxd4 12. cxd4 Qxd4 13. Qxd4 Bxd4 14. Rxb7 Nc6 15. Bf4 Rfc8 16. Bg4 Rd8 17. Rc1 Ne5 
"Marshall develops his light-square Bishop and gets ready to castle. But the without Bishop blocks the Queen's protection of the d4-pawn, which weakens the pawn without slightly. Perhaps 6.Be2 might have been better.",True," The comment provides a potential explanation for the mistake, suggesting a strategic shift due to the absence of the Bishops.",1. d4 Nf6 2. Nf3 g6 3. c4 Bg7 4. Nc3 O-O 5. e4 d6 6. Bd3,"This is a game between Marshall,F (as White) and Reti,R (as Black). Last move played: White plays Bishop to d3",Slight advantage for White (eval: 36 centipawns),6... e5 ,6. h3 e5 
Reti hits the weak pawn a second time. How in the world will Marshall defend without it now?,True," The comment suggests a potential tactical advantage, indicating the move was incorrect.",1. d4 Nf6 2. Nf3 g6 3. c4 Bg7 4. Nc3 O-O 5. e4 d6 6. Bd3 Bg4 7. h3 Bxf3 8. Qxf3 Nfd7 9. Be3 c5,"This is a game between Marshall,F (as White) and Reti,R (as Black). Last move played: Black plays Pawn to c5",Slight advantage for White (eval: 27 centipawns),10. d5 ,9... Nc6 10. d5 
The Knight leaps ahead and forks the Queen and light-square Bishop. See how without Reti continues to make threats and keep the initiative.,True," The comment suggests a potential tactical blunder, indicating a misunderstanding of the board position.",1. d4 Nf6 2. Nf3 g6 3. c4 Bg7 4. Nc3 O-O 5. e4 d6 6. Bd3 Bg4 7. h3 Bxf3 8. Qxf3 Nfd7 9. Be3 c5 10. d5 Ne5,"This is a game between Marshall,F (as White) and Reti,R (as Black). Last move played: Black plays Knight to e5",Slight advantage for White (eval: 24 centipawns),11. Qe2 Qb6 12. Bd2 Qxb2 13. Rb1 Nxd3+ 14. Qxd3 Qa3 15. Rxb7 Na6 16. Rb3 Qa5 17. O-O Rfb8 18. Rfb1 Rxb3 19. Rxb3 Rb8 20. Nb5 Nb4 21. Qb1 Qxa2 22. Qxa2 Nxa2 23. Ra3 a6 24. Rxa6 Nb4 25. Ra7 Bf6 26. Kf1 Nd3 27. Ba5 Nb2 28. Bc7 Re8 29. Na3 g5 30. Ke2 ,10... Ne5 11. Qe2 
"The Queen recaptures, but now it's not well-placed. See how the c4 and e4 without pawns block the Queen. Meanwhile, look at how much scope Reti's g7-Bishop is without getting along the a1-h8 diagonal! Even though White's Queen and Black's without Bishop control the same number of spaces, the Bishop controls squares that without are much more important.",True," The comment suggests a strategic miscalculation, indicating the move was poorly considered.",1. d4 Nf6 2. Nf3 g6 3. c4 Bg7 4. Nc3 O-O 5. e4 d6 6. Bd3 Bg4 7. h3 Bxf3 8. Qxf3 Nfd7 9. Be3 c5 10. d5 Ne5 11. Qe2 Nxd3+ 12. Qxd3,"This is a game between Marshall,F (as White) and Reti,R (as Black). Last move played: White plays Queen takes on d3",Advantage for White (eval: 51 centipawns),12... a6 13. O-O Nd7 14. Qc2 b5 15. cxb5 axb5 16. Nxb5 Nb6 17. a4 Qd7 18. Nc3 Bxc3 19. bxc3 Rxa4 20. Bh6 Re8 21. Rxa4 Qxa4 22. Qb2 Rb8 23. e5 Nd7 ,12. Qxd3 a6 13. O-O Nd7 14. Qc2 e5 15. Rab1 f5 16. f3 Rf7 17. b4 Rc8 18. Kh1 cxb4 19. Rxb4 Rc7 20. Rfb1 Qc8 21. Qe2 Bf8 22. a4 f4 23. Bf2 
"Reti's idea is to try to win a pawn: after ...Ne5, White's Queen must move without and can't protect both c3 and c4. Depending on which square White leaves without unguarded Black will either play ...Nxc4 or exchange his Bishop for a Knight without and pawn.",True," The comment describes a move that creates a potential tactical threat, indicating a flawed strategic decision.",1. d4 Nf6 2. Nf3 g6 3. c4 Bg7 4. Nc3 O-O 5. e4 d6 6. Bd3 Bg4 7. h3 Bxf3 8. Qxf3 Nfd7 9. Be3 c5 10. d5 Ne5 11. Qe2 Nxd3+ 12. Qxd3 Nd7 13. O-O Qa5,"This is a game between Marshall,F (as White) and Reti,R (as Black). Last move played: Black plays Queen to a5",Large advantage for White (eval: 104 centipawns),14. Bd2 a6 ,13... a6 14. Qc2 Rb8 15. a4 e6 16. Rfd1 Qe7 17. Rab1 Rfe8 18. f3 Nb6 19. dxe6 fxe6 20. b3 Nd7 21. Qd2 Rbd8 22. Ne2 Ne5 23. Bg5 Bf6 24. Bxf6 Qxf6 
"Reti offers to sacrifice a pawn in an effort to open up the a and b-files for without his Rooks. Black's Bishop already pressures White's Queenside, and the Rooks without on a8 and b8 will increase the pressure.",True," The comment highlights a critical tactical error – the Rook attacking a passed pawn, leading to a potential lost advantage.",1. d4 Nf6 2. Nf3 g6 3. c4 Bg7 4. Nc3 O-O 5. e4 d6 6. Bd3 Bg4 7. h3 Bxf3 8. Qxf3 Nfd7 9. Be3 c5 10. d5 Ne5 11. Qe2 Nxd3+ 12. Qxd3 Nd7 13. O-O Qa5 14. Bd2 a6 15. Nd1 Qc7 16. Bc3 Ne5 17. Qe2 b5,"This is a game between Marshall,F (as White) and Reti,R (as Black). Last move played: Black plays Pawn to b5",Advantage for White (eval: 80 centipawns),18. b3 Nd7 19. Bxg7 Kxg7 20. f4 bxc4 21. bxc4 Rab8 22. Rc1 Rfe8 23. Rc3 e6 24. dxe6 Rxe6 25. Rd3 Nf6 26. Nc3 Qe7 27. f5 Re5 28. fxg6 fxg6 29. Rdf3 Rf8 ,17... b5 18. b3 
"White develops the Knight toward the center, controls d4, and strengthens his without grip on e5.",True, The comment accurately describes a problematic tactical situation arising from the Bishop's forced movement.,1. d4 Nf6 2. Nf3,"This is a game between Marshall,F (as White) and Reti,R (as Black). Last move played: White plays Knight to f3",Slight advantage for White (eval: 26 centipawns),2... d5 3. c4 ,2. c4 e6 
"Marshall develops his light-square Bishop and gets ready to castle. But the without Bishop blocks the Queen's protection of the d4-pawn, which weakens the pawn without slightly. Perhaps 6.Be2 might have been better.",True," The comment describes a tactical maneuver that significantly weakens Black's position, suggesting a flawed assessment of the resulting imbalances.",1. d4 Nf6 2. Nf3 g6 3. c4 Bg7 4. Nc3 O-O 5. e4 d6 6. Bd3,"This is a game between Marshall,F (as White) and Reti,R (as Black). Last move played: White plays Bishop to d3",Slight advantage for White (eval: 36 centipawns),6... e5 ,6. h3 e5 
"...drive the Bishop away. Now the Bishop is forced to either withdraw or without capture the Knight. This pawn attack is called ""putting the question to the without Bishop"".",True, The comment provides a brief explanation of the positional advantage gained by Marshall.,1. d4 Nf6 2. Nf3 g6 3. c4 Bg7 4. Nc3 O-O 5. e4 d6 6. Bd3 Bg4 7. h3,"This is a game between Marshall,F (as White) and Reti,R (as Black). Last move played: White plays Pawn to h3",Slight advantage for White (eval: 21 centipawns),7... Bxf3 8. Qxf3 Nc6 9. d5 Nd4 10. Qd1 e5 11. O-O Nd7 12. Nb5 Re8 13. Be3 a6 14. Nc3 a5 15. Qd2 a4 16. Bc2 Nc5 17. Rad1 ,7. Be2 Bxf3 8. Bxf3 Nfd7 9. h4 Nc6 10. Be3 e5 11. d5 Nd4 12. h5 Nc5 13. b4 Nd7 14. hxg6 hxg6 15. Kf1 a5 16. b5 Nc5 17. Rc1 Qe7 18. Na4 Nxa4 
"Marshall recaptures with the Queen, developing it in the process. This is without much better than doubling up pawns on the f-file with 8.gxf3. But now the without d-pawn stands alone...",True," The comment provides a potential explanation for the mistake, suggesting a flawed strategic choice.",1. d4 Nf6 2. Nf3 g6 3. c4 Bg7 4. Nc3 O-O 5. e4 d6 6. Bd3 Bg4 7. h3 Bxf3 8. Qxf3,"This is a game between Marshall,F (as White) and Reti,R (as Black). Last move played: White plays Queen takes on f3",The position is equal,8... Nc6 9. d5 ,8. Qxf3 
"...so Reti unleashes a discovered attack against it (from the g7-Bishop). without Despite the fact that he lags behind in development, Black still controls without the game by continuing to make threats which must be answered by without White.",True," Yes, the comment indicates a potentially dangerous attack by Reti, suggesting a flawed plan to gain a significant advantage.",1. d4 Nf6 2. Nf3 g6 3. c4 Bg7 4. Nc3 O-O 5. e4 d6 6. Bd3 Bg4 7. h3 Bxf3 8. Qxf3 Nfd7,"This is a game between Marshall,F (as White) and Reti,R (as Black). Last move played: Black plays Knight to d7",The position is equal,9. d5 Bxc3+ ,8... Nc6 9. d5 
"Reti develops his remaining Knight. Obviously, he's thinking about advancing without it to e5.",True," The comment highlights a potential tactical blunder and suggests a drawn endgame, indicating a flawed assessment of the position.",1. d4 Nf6 2. Nf3 g6 3. c4 Bg7 4. Nc3 O-O 5. e4 d6 6. Bd3 Bg4 7. h3 Bxf3 8. Qxf3 Nfd7 9. Be3 c5 10. d5 Ne5 11. Qe2 Nxd3+ 12. Qxd3 Nd7,"This is a game between Marshall,F (as White) and Reti,R (as Black). Last move played: Black plays Knight to d7",Advantage for White (eval: 53 centipawns),13. O-O a6 ,12... a6 13. O-O Nd7 14. Qc2 b5 15. cxb5 axb5 16. Nxb5 Nb6 17. a4 Qd7 18. Nc3 Bxc3 19. bxc3 Rxa4 20. Bh6 Re8 21. Rxa4 Qxa4 22. Qb2 Rb8 23. e5 Nd7 
The White Queen retreats and simultaneously protects the menaced without d3-Bishop.,True," The comment offers a potential explanation for the move's perceived weakness, suggesting a tactical aim rather than a defensive one.",1. d4 Nf6 2. Nf3 g6 3. c4 Bg7 4. Nc3 O-O 5. e4 d6 6. Bd3 Bg4 7. h3 Bxf3 8. Qxf3 Nfd7 9. Be3 c5 10. d5 Ne5 11. Qe2,"This is a game between Marshall,F (as White) and Reti,R (as Black). Last move played: White plays Queen to e2",Slight advantage for White (eval: 34 centipawns),11... Qb6 12. Bd2 Qxb2 13. Rb1 Nxd3+ 14. Qxd3 Qa3 15. Rxb7 Na6 16. Rb3 Qa5 17. O-O Rfb8 18. Rfb1 Rxb3 19. Rxb3 Rb8 20. Qb1 Rb6 21. Rxb6 axb6 22. Qb3 Qb4 23. Nb1 Qxb3 24. axb3 f5 25. exf5 gxf5 26. Bg5 Kf7 27. Kf1 Nc7 28. Ke2 b5 ,11. Qe2 Qb6 12. Bd2 Qxb2 13. Rb1 Nxd3+ 14. Qxd3 Qa3 15. Rxb7 Na6 16. Rb3 Qa5 17. O-O Rfb8 18. Rfb1 Rxb3 19. Rxb3 Rb8 20. Nb5 Nb4 21. Qb1 Qxa2 22. Qxa2 Nxa2 23. Ra3 a6 24. Rxa6 Nb4 25. Ra7 Bf6 26. Kf1 Nd3 27. Ba5 Nb2 28. Bc7 Re8 29. Na3 g5 30. Ke2 
"Reti hates to trade his well-posted Knight for Marshall's bad Bishop. But if without he doesn't, Marshall will play f2-f4 and drive the Knight back to d7, where without it becomes ineffective.",True," The comment suggests a potential tactical advantage for Black, but it doesn't directly address the flaw in the initial move.",1. d4 Nf6 2. Nf3 g6 3. c4 Bg7 4. Nc3 O-O 5. e4 d6 6. Bd3 Bg4 7. h3 Bxf3 8. Qxf3 Nfd7 9. Be3 c5 10. d5 Ne5 11. Qe2 Nxd3+,"This is a game between Marshall,F (as White) and Reti,R (as Black). Last move played: Black plays Knight takes on d3 with check",Advantage for White (eval: 55 centipawns),12. Qxd3 a6 13. O-O Nd7 14. Qc2 e5 15. Rab1 f5 16. f3 Rf7 17. b4 Rc8 18. Kh1 cxb4 19. Rxb4 Rc7 20. Rfb1 Qc8 21. Qe2 Bf8 22. a4 f4 23. Bf2 ,11... Qb6 12. Bd2 Qxb2 13. Rb1 Nxd3+ 14. Qxd3 Qa3 15. Rxb7 Na6 16. Rb3 Qa5 17. O-O Rfb8 18. Rfb1 Rxb3 19. Rxb3 Rb8 20. Qb1 Rb6 21. Rxb6 axb6 22. Qb3 Qb4 23. Nb1 Qxb3 24. axb3 f5 25. exf5 gxf5 26. Bg5 Kf7 27. Kf1 Nc7 28. Ke2 b5 
"Reti develops his remaining Knight. Obviously, he's thinking about advancing without it to e5.",True," The comment suggests a potential weakness in the king's defense, indicating a flawed strategic choice.",1. d4 Nf6 2. Nf3 g6 3. c4 Bg7 4. Nc3 O-O 5. e4 d6 6. Bd3 Bg4 7. h3 Bxf3 8. Qxf3 Nfd7 9. Be3 c5 10. d5 Ne5 11. Qe2 Nxd3+ 12. Qxd3 Nd7,"This is a game between Marshall,F (as White) and Reti,R (as Black). Last move played: Black plays Knight to d7",Advantage for White (eval: 53 centipawns),13. O-O a6 ,12... a6 13. O-O Nd7 14. Qc2 b5 15. cxb5 axb5 16. Nxb5 Nb6 17. a4 Qd7 18. Nc3 Bxc3 19. bxc3 Rxa4 20. Bh6 Re8 21. Rxa4 Qxa4 22. Qb2 Rb8 23. e5 Nd7 
Marshall (White) starts with a good opening pawn move. He now controls both without c5 and e5 and he releases the dark-square Bishop.,True," The comment provides a potential reason for the mistake, suggesting a strategic misstep.",1. d4,"This is a game between Marshall,F (as White) and Reti,R (as Black). Last move played: White plays Pawn to d4",Slight advantage for White (eval: 32 centipawns),1... d5 ,1. e4 e5 
"Marshall develops his light-square Bishop and gets ready to castle. But the without Bishop blocks the Queen's protection of the d4-pawn, which weakens the pawn without slightly. Perhaps 6.Be2 might have been better.",True," The comment suggests a potential tactical blunder by Reti, indicating a miscalculation of the consequences of his pawn capture.",1. d4 Nf6 2. Nf3 g6 3. c4 Bg7 4. Nc3 O-O 5. e4 d6 6. Bd3,"This is a game between Marshall,F (as White) and Reti,R (as Black). Last move played: White plays Bishop to d3",Slight advantage for White (eval: 36 centipawns),6... e5 ,6. h3 e5 
"White develops the Knight toward the center, controls d4, and strengthens his without grip on e5.",True," The comment highlights a tactical blunder and suggests a strategic miscalculation, indicating a flawed move.",1. d4 Nf6 2. Nf3,"This is a game between Marshall,F (as White) and Reti,R (as Black). Last move played: White plays Knight to f3",Slight advantage for White (eval: 26 centipawns),2... d5 3. c4 ,2. c4 e6 
