comment,good,reasoning,moves,context,engine_eval,engine_best_line,engine_best_alternative
"Reti (Black) counters by developing the Knight to its best opening square. By without doing so, he also keeps his choice of opening a secret to White, who doesn't without know if Black will develop his Bishops through the center or the flanks.",True," The comment offers a potential explanation for the mistake, suggesting a missed opportunity to improve the position.",1. d4 Nf6,"This is a game between Marshall,F (as White) and Reti,R (as Black). Last move played: Black plays Knight to f6",Slight advantage for White (eval: 21 centipawns),2. c4 e6 ,1... d5 
"White develops the Knight toward the center, controls d4, and strengthens his without grip on e5.",True," The comment describes a move that weakens the position, suggesting a flaw in the player's strategic planning.",1. d4 Nf6 2. Nf3,"This is a game between Marshall,F (as White) and Reti,R (as Black). Last move played: White plays Knight to f3",Slight advantage for White (eval: 26 centipawns),2... d5 3. c4 ,2. c4 e6 
Now Marshall knows that Reti intends to develop the f8-Bishop by without fianchettoing it to g7.,True," Yes, the comment suggests a potential tactical error by Reti, indicating a misjudgment of the Bishop's future development.",1. d4 Nf6 2. Nf3 g6,"This is a game between Marshall,F (as White) and Reti,R (as Black). Last move played: Black plays Pawn to g6",Slight advantage for White (eval: 27 centipawns),3. c4 Bg7 ,2... d5 3. c4 
"This pawn advance carves out some more of the center for White. Also, the b1- without Knight can develop to c3 without blocking the c-pawn, and the Queen has the without option to develop along the a4-d1 diagonal.",True," The comment offers specific criticisms of the move's impact on the center and pawn structure, suggesting potential weaknesses.",1. d4 Nf6 2. Nf3 g6 3. c4,"This is a game between Marshall,F (as White) and Reti,R (as Black). Last move played: White plays Pawn to c4",Slight advantage for White (eval: 32 centipawns),3... Bg7 4. Nc3 ,3. c4 Bg7 
"In the Hypermodern style, Reti chooses to attack White's center from the without flank rather than fight it out in the center with his d- and e-pawns. Once without the f6- Knight moves, the Bishop will attack White's d4-pawn.",True," The comment provides a justification for the mistake, suggesting a strategic deviation from the Hypermodern style.",1. d4 Nf6 2. Nf3 g6 3. c4 Bg7,"This is a game between Marshall,F (as White) and Reti,R (as Black). Last move played: Black plays Bishop to g7",Slight advantage for White (eval: 34 centipawns),4. Nc3 ,3... Bg7 4. Nc3 
"Marshall gets the other Knight off of the back rank and into the game. Notice without how his pieces and pawns exercise control over all four center squares without (d4,e4, d5,e5).",True," The comment offers a potential explanation for the mistake, suggesting a lack of strategic positioning.",1. d4 Nf6 2. Nf3 g6 3. c4 Bg7 4. Nc3,"This is a game between Marshall,F (as White) and Reti,R (as Black). Last move played: White plays Knight to c3",Slight advantage for White (eval: 32 centipawns),4... d5 ,4. Nc3 
Reti completes his Kingside development. Now his King is safely tucked away without and his Rook is developed toward the important center files.,True," The comment suggests the Rook is undeveloped, implying a potential weakness in the position.",1. d4 Nf6 2. Nf3 g6 3. c4 Bg7 4. Nc3 O-O,"This is a game between Marshall,F (as White) and Reti,R (as Black). Last move played: Black plays kingside castle",Advantage for White (eval: 66 centipawns),5. e4 ,4... d5 5. cxd5 Nxd5 6. e4 Nxc3 7. bxc3 c5 8. Rb1 O-O 9. Be2 Bg4 10. O-O Bxf3 11. Bxf3 cxd4 12. cxd4 Qxd4 13. Qxd4 Bxd4 14. Rxb7 Nc6 15. Bf4 Rfc8 16. Bg4 Rd8 17. Rc1 Ne5 
"This pawn advance prevents White from advancing either his Knight or pawn to without e5, prepares for a possible later e7-e5 pawn push for Black, and releases without the c8-Bishop from captivity.",True, The comment identifies a strategic maneuver that undermines White's plans and suggests a future tactical threat.,1. d4 Nf6 2. Nf3 g6 3. c4 Bg7 4. Nc3 O-O 5. e4 d6,"This is a game between Marshall,F (as White) and Reti,R (as Black). Last move played: Black plays Pawn to d6",Advantage for White (eval: 53 centipawns),6. h3 e5 ,5... d6 
"Reti's keen eye spots the d4-pawn's weakness and siezes the moment to exploit without it by pinning the f3-Knight. Now the poor pawn is totally unprotected! White without is forced to expend a tempo to protect it, or else...",True," The comment identifies a specific tactical threat and suggests a consequence, indicating a flawed assessment of the position.",1. d4 Nf6 2. Nf3 g6 3. c4 Bg7 4. Nc3 O-O 5. e4 d6 6. Bd3 Bg4,"This is a game between Marshall,F (as White) and Reti,R (as Black). Last move played: Black plays Bishop to g4",Slight advantage for White (eval: 41 centipawns),7. Be2 Bxf3 8. Bxf3 Nfd7 9. h4 Nc6 10. Be3 e5 11. d5 Nd4 12. h5 Nc5 13. b4 Nd7 14. hxg6 hxg6 15. Kf1 a5 16. b5 Nc5 17. Rc1 Qe7 18. Na4 Nxa4 ,6... e5 7. d5 
"Marshall recaptures with the Queen, developing it in the process. This is without much better than doubling up pawns on the f-file with 8.gxf3. But now the without d-pawn stands alone...",True," The comment suggests a potential weakness in the move’s pawn structure, indicating a suboptimal development.",1. d4 Nf6 2. Nf3 g6 3. c4 Bg7 4. Nc3 O-O 5. e4 d6 6. Bd3 Bg4 7. h3 Bxf3 8. Qxf3,"This is a game between Marshall,F (as White) and Reti,R (as Black). Last move played: White plays Queen takes on f3",The position is equal,8... Nc6 9. d5 ,8. Qxf3 
Marshall protects the weak pawn and usefully develops his last minor piece at without the same time.,True," The comment suggests a defensive move that could hinder development, indicating a flaw in the player’s strategic planning.",1. d4 Nf6 2. Nf3 g6 3. c4 Bg7 4. Nc3 O-O 5. e4 d6 6. Bd3 Bg4 7. h3 Bxf3 8. Qxf3 Nfd7 9. Be3,"This is a game between Marshall,F (as White) and Reti,R (as Black). Last move played: White plays Bishop to e3",The position is equal,9... Nc6 10. d5 ,9. d5 Bxc3+ 
He defends the pawn by advancing it! Now it's amply protected by two fellow without pawns and a Knight. At the same time he grabs more space on Black's side of without the board. Now c6 and e6 are unusable by Black.,True," The comment describes a defensive position that severely restricts Black's pieces and pawn structure, indicating a flawed strategic decision.",1. d4 Nf6 2. Nf3 g6 3. c4 Bg7 4. Nc3 O-O 5. e4 d6 6. Bd3 Bg4 7. h3 Bxf3 8. Qxf3 Nfd7 9. Be3 c5 10. d5,"This is a game between Marshall,F (as White) and Reti,R (as Black). Last move played: White plays Pawn to d5",Slight advantage for White (eval: 39 centipawns),10... Ne5 11. Qe2 ,10. d5 
The Knight leaps ahead and forks the Queen and light-square Bishop. See how without Reti continues to make threats and keep the initiative.,True, The comment describes a dangerous and unproductive sequence of moves that negatively impacts the position.,1. d4 Nf6 2. Nf3 g6 3. c4 Bg7 4. Nc3 O-O 5. e4 d6 6. Bd3 Bg4 7. h3 Bxf3 8. Qxf3 Nfd7 9. Be3 c5 10. d5 Ne5,"This is a game between Marshall,F (as White) and Reti,R (as Black). Last move played: Black plays Knight to e5",Slight advantage for White (eval: 24 centipawns),11. Qe2 Qb6 12. Bd2 Qxb2 13. Rb1 Nxd3+ 14. Qxd3 Qa3 15. Rxb7 Na6 16. Rb3 Qa5 17. O-O Rfb8 18. Rfb1 Rxb3 19. Rxb3 Rb8 20. Nb5 Nb4 21. Qb1 Qxa2 22. Qxa2 Nxa2 23. Ra3 a6 24. Rxa6 Nb4 25. Ra7 Bf6 26. Kf1 Nd3 27. Ba5 Nb2 28. Bc7 Re8 29. Na3 g5 30. Ke2 ,10... Ne5 11. Qe2 
"The Queen recaptures, but now it's not well-placed. See how the c4 and e4 without pawns block the Queen. Meanwhile, look at how much scope Reti's g7-Bishop is without getting along the a1-h8 diagonal! Even though White's Queen and Black's without Bishop control the same number of spaces, the Bishop controls squares that without are much more important.",True," The comment identifies a positional weakness and suggests a missed opportunity, indicating a mistake.",1. d4 Nf6 2. Nf3 g6 3. c4 Bg7 4. Nc3 O-O 5. e4 d6 6. Bd3 Bg4 7. h3 Bxf3 8. Qxf3 Nfd7 9. Be3 c5 10. d5 Ne5 11. Qe2 Nxd3+ 12. Qxd3,"This is a game between Marshall,F (as White) and Reti,R (as Black). Last move played: White plays Queen takes on d3",Advantage for White (eval: 51 centipawns),12... a6 13. O-O Nd7 14. Qc2 b5 15. cxb5 axb5 16. Nxb5 Nb6 17. a4 Qd7 18. Nc3 Bxc3 19. bxc3 Rxa4 20. Bh6 Re8 21. Rxa4 Qxa4 22. Qb2 Rb8 23. e5 Nd7 ,12. Qxd3 a6 13. O-O Nd7 14. Qc2 e5 15. Rab1 f5 16. f3 Rf7 17. b4 Rc8 18. Kh1 cxb4 19. Rxb4 Rc7 20. Rfb1 Qc8 21. Qe2 Bf8 22. a4 f4 23. Bf2 
"Now that Reti has eased up the pressure, Marshall decides that this is a good without time to get his King out of the center. White's King is protected and his without Rooks are connected on the first rank (and can support each without other).",True," The comment suggests a strategic error by Marshall, intending to consolidate his position by protecting his King and hindering White's rook development.",1. d4 Nf6 2. Nf3 g6 3. c4 Bg7 4. Nc3 O-O 5. e4 d6 6. Bd3 Bg4 7. h3 Bxf3 8. Qxf3 Nfd7 9. Be3 c5 10. d5 Ne5 11. Qe2 Nxd3+ 12. Qxd3 Nd7 13. O-O,"This is a game between Marshall,F (as White) and Reti,R (as Black). Last move played: White plays kingside castle",Advantage for White (eval: 59 centipawns),13... a6 14. Qc2 Rb8 15. a4 e6 16. Rfd1 Qe7 17. Rab1 Rfe8 18. f3 Nb6 19. dxe6 fxe6 20. b3 Nd7 21. Qd2 Rbd8 22. Ne2 Ne5 23. Bg5 Bf6 24. Bxf6 Qxf6 ,13. O-O 
"Reti's idea is to try to win a pawn: after ...Ne5, White's Queen must move without and can't protect both c3 and c4. Depending on which square White leaves without unguarded Black will either play ...Nxc4 or exchange his Bishop for a Knight without and pawn.",True," The comment accurately identifies a critical weakness in the move, leading to a lost pawn and a potential tactical disaster.",1. d4 Nf6 2. Nf3 g6 3. c4 Bg7 4. Nc3 O-O 5. e4 d6 6. Bd3 Bg4 7. h3 Bxf3 8. Qxf3 Nfd7 9. Be3 c5 10. d5 Ne5 11. Qe2 Nxd3+ 12. Qxd3 Nd7 13. O-O Qa5,"This is a game between Marshall,F (as White) and Reti,R (as Black). Last move played: Black plays Queen to a5",Large advantage for White (eval: 104 centipawns),14. Bd2 a6 ,13... a6 14. Qc2 Rb8 15. a4 e6 16. Rfd1 Qe7 17. Rab1 Rfe8 18. f3 Nb6 19. dxe6 fxe6 20. b3 Nd7 21. Qd2 Rbd8 22. Ne2 Ne5 23. Bg5 Bf6 24. Bxf6 Qxf6 
"Now c3 is defended by the Bishop. If Black plays ...Ne5, the White Queen can without retreat to e2 and White's position holds. Also, if the White Knight moves, without it uncovers an attack by the d2-Bishop against the Black Queen.",True," The comment provides a potential tactical threat and a reason for the mistake, indicating a flawed assessment of the position.",1. d4 Nf6 2. Nf3 g6 3. c4 Bg7 4. Nc3 O-O 5. e4 d6 6. Bd3 Bg4 7. h3 Bxf3 8. Qxf3 Nfd7 9. Be3 c5 10. d5 Ne5 11. Qe2 Nxd3+ 12. Qxd3 Nd7 13. O-O Qa5 14. Bd2,"This is a game between Marshall,F (as White) and Reti,R (as Black). Last move played: White plays Bishop to d2",Advantage for White (eval: 97 centipawns),14... a6 15. f4 ,14. Bd2 a6 
"Black can't prevent the discovered attack, but he can keep the White Knight without out of his territory. The a-pawn advances, denying the square b5 to the without White Knight.",True," The comment offers a potential, albeit somewhat convoluted, explanation of the mistake, suggesting the White Knight is being held up by the pawn.",1. d4 Nf6 2. Nf3 g6 3. c4 Bg7 4. Nc3 O-O 5. e4 d6 6. Bd3 Bg4 7. h3 Bxf3 8. Qxf3 Nfd7 9. Be3 c5 10. d5 Ne5 11. Qe2 Nxd3+ 12. Qxd3 Nd7 13. O-O Qa5 14. Bd2 a6,"This is a game between Marshall,F (as White) and Reti,R (as Black). Last move played: Black plays Pawn to a6",Large advantage for White (eval: 104 centipawns),15. f4 ,14... a6 15. f4 
"Predictably, Marshall uncorks the discovered attack against the Black Queen. without He also sets up a threat against Black's powerful Bishop. We'll see that without threat next move.",True," The comment describes a potential tactical threat, suggesting a flawed assessment of the position.",1. d4 Nf6 2. Nf3 g6 3. c4 Bg7 4. Nc3 O-O 5. e4 d6 6. Bd3 Bg4 7. h3 Bxf3 8. Qxf3 Nfd7 9. Be3 c5 10. d5 Ne5 11. Qe2 Nxd3+ 12. Qxd3 Nd7 13. O-O Qa5 14. Bd2 a6 15. Nd1,"This is a game between Marshall,F (as White) and Reti,R (as Black). Last move played: White plays Knight to d1",Slight advantage for White (eval: 48 centipawns),15... Qc7 ,15. f4 
"Reti has to retreat the Queen. None of the available retreat squares are very without good, but c7 is the least of the evils. On b6 the Queen takes a square away without from the d7-Knight, and on d8 it blocks communication between the without Rooks.",True," The comment provides specific suggestions for a move that is detrimental to the position, indicating a flawed assessment of the resulting consequences.",1. d4 Nf6 2. Nf3 g6 3. c4 Bg7 4. Nc3 O-O 5. e4 d6 6. Bd3 Bg4 7. h3 Bxf3 8. Qxf3 Nfd7 9. Be3 c5 10. d5 Ne5 11. Qe2 Nxd3+ 12. Qxd3 Nd7 13. O-O Qa5 14. Bd2 a6 15. Nd1 Qc7,"This is a game between Marshall,F (as White) and Reti,R (as Black). Last move played: Black plays Queen to c7",Slight advantage for White (eval: 48 centipawns),16. Bc3 ,15... Qc7 
Reti pulls a rabbit out of his hat. The Knight blocks the exchange of Bishops without and menaces the White Queen as well.,True," The comment describes a highly unusual and aggressive move, suggesting a significant tactical blunder.",1. d4 Nf6 2. Nf3 g6 3. c4 Bg7 4. Nc3 O-O 5. e4 d6 6. Bd3 Bg4 7. h3 Bxf3 8. Qxf3 Nfd7 9. Be3 c5 10. d5 Ne5 11. Qe2 Nxd3+ 12. Qxd3 Nd7 13. O-O Qa5 14. Bd2 a6 15. Nd1 Qc7 16. Bc3 Ne5,"This is a game between Marshall,F (as White) and Reti,R (as Black). Last move played: Black plays Knight to e5",Advantage for White (eval: 88 centipawns),17. Qc2 ,16... Bxc3 
"Reti offers to sacrifice a pawn in an effort to open up the a and b-files for without his Rooks. Black's Bishop already pressures White's Queenside, and the Rooks without on a8 and b8 will increase the pressure.",True," The comment identifies a potential tactical disadvantage and suggests a strategic reason for the mistake, indicating a flawed assessment of the position.",1. d4 Nf6 2. Nf3 g6 3. c4 Bg7 4. Nc3 O-O 5. e4 d6 6. Bd3 Bg4 7. h3 Bxf3 8. Qxf3 Nfd7 9. Be3 c5 10. d5 Ne5 11. Qe2 Nxd3+ 12. Qxd3 Nd7 13. O-O Qa5 14. Bd2 a6 15. Nd1 Qc7 16. Bc3 Ne5 17. Qe2 b5,"This is a game between Marshall,F (as White) and Reti,R (as Black). Last move played: Black plays Pawn to b5",Advantage for White (eval: 80 centipawns),18. b3 Nd7 19. Bxg7 Kxg7 20. f4 bxc4 21. bxc4 Rab8 22. Rc1 Rfe8 23. Rc3 e6 24. dxe6 Rxe6 25. Rd3 Nf6 26. Nc3 Qe7 27. f5 Re5 28. fxg6 fxg6 29. Rdf3 Rf8 ,17... b5 18. b3 
Marshall accepts the sacrifice. Now the White Queen is no longer chained to without the defense of c4. Marshall feels that the Queen's increased freedom will without offset Black's Queenside pressure.,True," The comment suggests Marshall’s move has created a vulnerability for Black’s Queenside, indicating a potential tactical weakness.",1. d4 Nf6 2. Nf3 g6 3. c4 Bg7 4. Nc3 O-O 5. e4 d6 6. Bd3 Bg4 7. h3 Bxf3 8. Qxf3 Nfd7 9. Be3 c5 10. d5 Ne5 11. Qe2 Nxd3+ 12. Qxd3 Nd7 13. O-O Qa5 14. Bd2 a6 15. Nd1 Qc7 16. Bc3 Ne5 17. Qe2 b5 18. cxb5,"This is a game between Marshall,F (as White) and Reti,R (as Black). Last move played: White plays Pawn takes on b5",Slight advantage for Black (eval: -34 centipawns),18... axb5 ,18. b3 Nd7 19. Bxg7 Kxg7 20. f4 bxc4 21. bxc4 Rab8 22. Rc1 Rfe8 23. Rc3 e6 24. dxe6 Rxe6 25. Rd3 Nf6 26. Nc3 Qe7 27. f5 Re5 28. fxg6 fxg6 29. Rdf3 Rf8 
"Black recaptures, expecting White to reply 19.Qxb5. Then Black will move a without Rook to b8, drive away the White Queen, and grab the initiative.",True, The comment offers a potential plan that contradicts the current position and suggests a flawed strategic approach.,1. d4 Nf6 2. Nf3 g6 3. c4 Bg7 4. Nc3 O-O 5. e4 d6 6. Bd3 Bg4 7. h3 Bxf3 8. Qxf3 Nfd7 9. Be3 c5 10. d5 Ne5 11. Qe2 Nxd3+ 12. Qxd3 Nd7 13. O-O Qa5 14. Bd2 a6 15. Nd1 Qc7 16. Bc3 Ne5 17. Qe2 b5 18. cxb5 axb5,"This is a game between Marshall,F (as White) and Reti,R (as Black). Last move played: Black plays Pawn takes on b5",Slight advantage for Black (eval: -39 centipawns),19. Qxb5 c4 20. Bxe5 Bxe5 21. Ne3 Rfc8 22. Rac1 Ra5 23. Qb4 c3 24. bxc3 Rxa2 25. Qb1 Qa5 26. h4 h5 27. Qd3 Rxc3 28. Rxc3 Bxc3 29. Nc4 Qb4 30. Rb1 Ra1 31. Rxa1 Bxa1 32. g3 Qe1+ 33. Kg2 ,18... axb5 
"Reti springs a surprise of his own. The Knight is still well-placed on c4, without and it blocks the capture of the Black b5-pawn. But the exchange of Bishops without can't be prevented now.",True, The comment highlights a tactical blunder involving a blocked pawn and a missed opportunity for a better Bishop development.,1. d4 Nf6 2. Nf3 g6 3. c4 Bg7 4. Nc3 O-O 5. e4 d6 6. Bd3 Bg4 7. h3 Bxf3 8. Qxf3 Nfd7 9. Be3 c5 10. d5 Ne5 11. Qe2 Nxd3+ 12. Qxd3 Nd7 13. O-O Qa5 14. Bd2 a6 15. Nd1 Qc7 16. Bc3 Ne5 17. Qe2 b5 18. cxb5 axb5 19. f4 Nc4,"This is a game between Marshall,F (as White) and Reti,R (as Black). Last move played: Black plays Knight to c4",Slight advantage for White (eval: 44 centipawns),20. Bxg7 ,19... b4 20. Bxe5 
"Reti makes sure that his Knight will stay posted on b4, by making the pawn without push b2-b3 extremely unattractive to White (22.b3 Qxc3 23.bxc4 bxc4 and without Black is a pawn ahead or else 23...b4, where Black gets a cramping pawn without chain).",True," The comment suggests a strategic flaw in the move, potentially leading to a disadvantage for White.",1. d4 Nf6 2. Nf3 g6 3. c4 Bg7 4. Nc3 O-O 5. e4 d6 6. Bd3 Bg4 7. h3 Bxf3 8. Qxf3 Nfd7 9. Be3 c5 10. d5 Ne5 11. Qe2 Nxd3+ 12. Qxd3 Nd7 13. O-O Qa5 14. Bd2 a6 15. Nd1 Qc7 16. Bc3 Ne5 17. Qe2 b5 18. cxb5 axb5 19. f4 Nc4 20. Bxg7 Kxg7 21. Nc3 Qa5,"This is a game between Marshall,F (as White) and Reti,R (as Black). Last move played: Black plays Queen to a5",Slight advantage for White (eval: 40 centipawns),22. a3 b4 23. Qxc4 bxc3 24. b3 Rfb8 25. Kh2 Rb7 26. b4 Qb5 27. Qxc3+ f6 28. Rfb1 Rba7 29. Rb3 cxb4 30. Rxb4 Qc5 31. Qb3 Rc8 32. a4 Qc7 33. Qb1 Qc5 34. Ra2 Qc1 35. Qxc1 Rxc1 ,21... Qa5 22. a3 
"Marshall prepares a future a4xb5, which removes the c4-Knight's immediate without protection, and discovers an attack by the a1-Rook against the Black without Queen.",True, The comment accurately describes a dangerous and undermining move that significantly weakens Black's position.,1. d4 Nf6 2. Nf3 g6 3. c4 Bg7 4. Nc3 O-O 5. e4 d6 6. Bd3 Bg4 7. h3 Bxf3 8. Qxf3 Nfd7 9. Be3 c5 10. d5 Ne5 11. Qe2 Nxd3+ 12. Qxd3 Nd7 13. O-O Qa5 14. Bd2 a6 15. Nd1 Qc7 16. Bc3 Ne5 17. Qe2 b5 18. cxb5 axb5 19. f4 Nc4 20. Bxg7 Kxg7 21. Nc3 Qa5 22. a4,"This is a game between Marshall,F (as White) and Reti,R (as Black). Last move played: White plays Pawn to a4",The position is equal,22... Qb4 23. axb5 ,22. a3 b4 23. Qxc4 bxc3 24. b3 Rfb8 25. Kh2 Rb7 26. b4 Qb5 27. Qxc3+ f6 28. Rfb1 Rba7 29. Rb3 cxb4 30. Rxb4 Qc5 31. Qb3 Rc8 32. a4 Qc7 33. Qb1 Qc5 34. Ra2 Qc1 35. Qxc1 Rxc1 
"Rather than retreat, the Black Queen stays in the thick of the fight. Now the without White b2-pawn is attacked twice (by Black's Queen and Knight) and defended without only once.",True, The comment highlights a potential tactical blunder by prioritizing a defensive position over a more efficient attack.,1. d4 Nf6 2. Nf3 g6 3. c4 Bg7 4. Nc3 O-O 5. e4 d6 6. Bd3 Bg4 7. h3 Bxf3 8. Qxf3 Nfd7 9. Be3 c5 10. d5 Ne5 11. Qe2 Nxd3+ 12. Qxd3 Nd7 13. O-O Qa5 14. Bd2 a6 15. Nd1 Qc7 16. Bc3 Ne5 17. Qe2 b5 18. cxb5 axb5 19. f4 Nc4 20. Bxg7 Kxg7 21. Nc3 Qa5 22. a4 Qb4,"This is a game between Marshall,F (as White) and Reti,R (as Black). Last move played: Black plays Queen to b4",The position is equal,23. axb5 Nxb2 ,22... Qb4 23. axb5 
"Surprise! Black's Rook comes crashing into the fight! Reti feels that White's without passed a-pawn could be dangerous later, so he keeps up the attack by killing without the pawn and getting the Rook into the game.",True," The comment suggests a tactical error by Black, aiming for a decisive attack, potentially leading to a loss of control.",1. d4 Nf6 2. Nf3 g6 3. c4 Bg7 4. Nc3 O-O 5. e4 d6 6. Bd3 Bg4 7. h3 Bxf3 8. Qxf3 Nfd7 9. Be3 c5 10. d5 Ne5 11. Qe2 Nxd3+ 12. Qxd3 Nd7 13. O-O Qa5 14. Bd2 a6 15. Nd1 Qc7 16. Bc3 Ne5 17. Qe2 b5 18. cxb5 axb5 19. f4 Nc4 20. Bxg7 Kxg7 21. Nc3 Qa5 22. a4 Qb4 23. Nxb5 Rxa4,"This is a game between Marshall,F (as White) and Reti,R (as Black). Last move played: Black plays Rook takes on a4",Advantage for Black (eval: -73 centipawns),24. Rxa4 Qxa4 ,23... Rxa4 24. Rxa4 Qxa4 25. Nc3 Qb3 26. e5 dxe5 27. fxe5 Nxb2 28. Rf3 Na4 29. Qd2 Nb6 30. d6 Qe6 31. dxe7 Qxe7 32. Qf4 Rd8 33. Ne4 Rd1+ 34. Kh2 Nd7 35. Qf6+ Qxf6 36. exf6+ Kh6 37. Rf4 g5 38. Rf5 c4 39. Rxg5 
"Black could have taken the Knight, but then he would have been behind by the without Exchange (down a Rook for a Knight). By capturing the Rook, Black keeps the without material even.",True, The comment accurately explains why the move was a mistake by highlighting a strategic disadvantage.,1. d4 Nf6 2. Nf3 g6 3. c4 Bg7 4. Nc3 O-O 5. e4 d6 6. Bd3 Bg4 7. h3 Bxf3 8. Qxf3 Nfd7 9. Be3 c5 10. d5 Ne5 11. Qe2 Nxd3+ 12. Qxd3 Nd7 13. O-O Qa5 14. Bd2 a6 15. Nd1 Qc7 16. Bc3 Ne5 17. Qe2 b5 18. cxb5 axb5 19. f4 Nc4 20. Bxg7 Kxg7 21. Nc3 Qa5 22. a4 Qb4 23. Nxb5 Rxa4 24. Rxa4 Qxa4,"This is a game between Marshall,F (as White) and Reti,R (as Black). Last move played: Black plays Queen takes on a4",Advantage for Black (eval: -85 centipawns),25. Nc3 ,24... Qxa4 25. Nc3 
"Reti captures the Knight as expected. He could also have retreated his own without Knight, but he prefers the exchange of pieces.",True," The comment suggests a potential tactical reason for the mistake, indicating a consideration beyond just the immediate capture.",1. d4 Nf6 2. Nf3 g6 3. c4 Bg7 4. Nc3 O-O 5. e4 d6 6. Bd3 Bg4 7. h3 Bxf3 8. Qxf3 Nfd7 9. Be3 c5 10. d5 Ne5 11. Qe2 Nxd3+ 12. Qxd3 Nd7 13. O-O Qa5 14. Bd2 a6 15. Nd1 Qc7 16. Bc3 Ne5 17. Qe2 b5 18. cxb5 axb5 19. f4 Nc4 20. Bxg7 Kxg7 21. Nc3 Qa5 22. a4 Qb4 23. Nxb5 Rxa4 24. Rxa4 Qxa4 25. Rc1 Qxb5,"This is a game between Marshall,F (as White) and Reti,R (as Black). Last move played: Black plays Queen takes on b5",Large advantage for Black (eval: -285 centipawns),26. Rxc4 Rb8 27. Rc2 Qa4 28. Kf2 h5 29. Kf3 h4 30. Rc3 Qa1 31. Rc2 Rb4 32. Rd2 Qa4 33. Rd3 f5 34. Ra3 Qb5 35. Qxb5 fxe4+ 36. Kg4 Rxb5 37. Kxh4 Rxb2 38. g4 Rd2 39. Re3 Rxd5 40. Rxe4 Kf7 41. Kg3 Rd3+ 42. Kh2 Kf6 43. h4 ,25... Qxb5 26. Rxc4 Rb8 27. Rc2 Qa4 28. Kf2 Rb4 29. Kf3 f5 30. exf5 Rxf4+ 31. Kg3 Rxf5 32. Rc4 Qb3+ 33. Rc3 Qb7 34. Rd3 Re5 35. Qd2 Qc8 36. b4 cxb4 37. Qxb4 Qf5 38. Qd4 Qe4 39. Qxe4 Rxe4 40. Kf2 h5 
Obviously. This was Marshall's only way to save the pawn. Now Reti can force without the exchange of Queens...,True," The comment suggests a strategic blunder by Reti, implying a reliance on a pawn rescue rather than a more principled approach.",1. d4 Nf6 2. Nf3 g6 3. c4 Bg7 4. Nc3 O-O 5. e4 d6 6. Bd3 Bg4 7. h3 Bxf3 8. Qxf3 Nfd7 9. Be3 c5 10. d5 Ne5 11. Qe2 Nxd3+ 12. Qxd3 Nd7 13. O-O Qa5 14. Bd2 a6 15. Nd1 Qc7 16. Bc3 Ne5 17. Qe2 b5 18. cxb5 axb5 19. f4 Nc4 20. Bxg7 Kxg7 21. Nc3 Qa5 22. a4 Qb4 23. Nxb5 Rxa4 24. Rxa4 Qxa4 25. Rc1 Qxb5 26. Rxc4 Rb8 27. Rc2,"This is a game between Marshall,F (as White) and Reti,R (as Black). Last move played: White plays Rook to c2",Large advantage for Black (eval: -287 centipawns),27... Qa4 28. Kf2 Rb4 29. Kf3 h5 30. g3 Qb3+ 31. Kg2 f5 32. exf5 Qxd5+ 33. Kh2 Re4 34. Qf3 Qxf5 35. Rf2 Rc4 36. b3 Rc2 37. Rxc2 Qxc2+ 38. Kh1 Qc1+ 39. Kg2 Qa3 ,27. b4 cxb4 28. Qb2+ Kg8 29. Qb3 Qb6+ 30. Kh2 Qf2 31. e5 dxe5 32. fxe5 Qe2 33. e6 Qe5+ 34. Kg1 fxe6 35. dxe6 Kg7 36. Rc1 Rf8 37. Qb1 Rf4 38. Re1 Qf6 39. Kh1 h5 40. Rg1 h4 
...which he does. Now Marshall must take with the Rook or be a whole Queen without behind (an overwhelming material disadvantage). See how Reti controls the without initiative by making moves that force a reply from White.,True," The comment highlights a significant tactical disadvantage and suggests a strategic blunder, indicating a flawed move.",1. d4 Nf6 2. Nf3 g6 3. c4 Bg7 4. Nc3 O-O 5. e4 d6 6. Bd3 Bg4 7. h3 Bxf3 8. Qxf3 Nfd7 9. Be3 c5 10. d5 Ne5 11. Qe2 Nxd3+ 12. Qxd3 Nd7 13. O-O Qa5 14. Bd2 a6 15. Nd1 Qc7 16. Bc3 Ne5 17. Qe2 b5 18. cxb5 axb5 19. f4 Nc4 20. Bxg7 Kxg7 21. Nc3 Qa5 22. a4 Qb4 23. Nxb5 Rxa4 24. Rxa4 Qxa4 25. Rc1 Qxb5 26. Rxc4 Rb8 27. Rc2 Qxe2,"This is a game between Marshall,F (as White) and Reti,R (as Black). Last move played: Black plays Queen takes on e2",Large advantage for Black (eval: -197 centipawns),28. Rxe2 Rb3 ,27... Qa4 28. Kf2 Rb4 29. Kf3 h5 30. g3 Qb3+ 31. Kg2 f5 32. exf5 Qxd5+ 33. Kh2 Re4 34. Qf3 Qxf5 35. Rf2 Rc4 36. b3 Rc2 37. Rxc2 Qxc2+ 38. Kh1 Qc1+ 39. Kg2 Qa3 
"The material is even, but Marshall is now stuck with an isolated pawn on b2. without This pawn is very weak. Its weakness stems from the fact that there are no without pawns on adjacent files to help defend it.",True," The comment identifies a critical weakness in the isolated pawn, suggesting a tactical blunder.",1. d4 Nf6 2. Nf3 g6 3. c4 Bg7 4. Nc3 O-O 5. e4 d6 6. Bd3 Bg4 7. h3 Bxf3 8. Qxf3 Nfd7 9. Be3 c5 10. d5 Ne5 11. Qe2 Nxd3+ 12. Qxd3 Nd7 13. O-O Qa5 14. Bd2 a6 15. Nd1 Qc7 16. Bc3 Ne5 17. Qe2 b5 18. cxb5 axb5 19. f4 Nc4 20. Bxg7 Kxg7 21. Nc3 Qa5 22. a4 Qb4 23. Nxb5 Rxa4 24. Rxa4 Qxa4 25. Rc1 Qxb5 26. Rxc4 Rb8 27. Rc2 Qxe2 28. Rxe2,"This is a game between Marshall,F (as White) and Reti,R (as Black). Last move played: White plays Rook takes on e2",Large advantage for Black (eval: -197 centipawns),28... Rb3 29. Kf2 Kf8 30. e5 h5 31. h4 Rd3 32. exd6 exd6 33. b4 cxb4 34. Re4 b3 35. Rb4 Ke8 36. Rb7 Rd2+ 37. Kf3 b2 38. Rb8+ Ke7 ,28. Rxe2 Rb3 
