comment,good,reasoning,moves,context,engine_eval,engine_best_line,engine_best_alternative
"The Black Rook advances to an outpost where it's protected by the c-pawn and without menaces two White pawns (b2 and e4). This ties up Marshall and restricts his without freedom of action, for if the e2-Rook moves, one of the pawns must without fall.",True," The comment describes a tactical disadvantage, suggesting a flawed plan and hindering the Black Rook's development.",1. d4 Nf6 2. Nf3 g6 3. c4 Bg7 4. Nc3 O-O 5. e4 d6 6. Bd3 Bg4 7. h3 Bxf3 8. Qxf3 Nfd7 9. Be3 c5 10. d5 Ne5 11. Qe2 Nxd3+ 12. Qxd3 Nd7 13. O-O Qa5 14. Bd2 a6 15. Nd1 Qc7 16. Bc3 Ne5 17. Qe2 b5 18. cxb5 axb5 19. f4 Nc4 20. Bxg7 Kxg7 21. Nc3 Qa5 22. a4 Qb4 23. Nxb5 Rxa4 24. Rxa4 Qxa4 25. Rc1 Qxb5 26. Rxc4 Rb8 27. Rc2 Qxe2 28. Rxe2 Rb4,"This is a game between Marshall,F (as White) and Reti,R (as Black). Last move played: Black plays Rook to b4",Large advantage for Black (eval: -169 centipawns),29. Kf2 h5 ,28... Rb3 29. Kf2 Kf8 30. e5 h5 31. h4 Rd3 32. exd6 exd6 33. b4 cxb4 34. Re4 b3 35. Rb4 Ke8 36. Rb7 Rd2+ 37. Kf3 b2 38. Rb8+ Ke7 
"Reti begins to swing his King around to the Queenside. From there, it can without either maneuver to attack White's pawns or support the advance of Black's.",True," The comment suggests a dangerous and potentially disastrous attack, indicating a flawed strategic decision.",1. d4 Nf6 2. Nf3 g6 3. c4 Bg7 4. Nc3 O-O 5. e4 d6 6. Bd3 Bg4 7. h3 Bxf3 8. Qxf3 Nfd7 9. Be3 c5 10. d5 Ne5 11. Qe2 Nxd3+ 12. Qxd3 Nd7 13. O-O Qa5 14. Bd2 a6 15. Nd1 Qc7 16. Bc3 Ne5 17. Qe2 b5 18. cxb5 axb5 19. f4 Nc4 20. Bxg7 Kxg7 21. Nc3 Qa5 22. a4 Qb4 23. Nxb5 Rxa4 24. Rxa4 Qxa4 25. Rc1 Qxb5 26. Rxc4 Rb8 27. Rc2 Qxe2 28. Rxe2 Rb4 29. Kf2 Kf8,"This is a game between Marshall,F (as White) and Reti,R (as Black). Last move played: Black plays King to f8",Large advantage for Black (eval: -136 centipawns),30. Kf3 ,29... f6 
The White King reaches a square where it defends the e4-pawn.,True,", It clarifies that the White King's move is exposing the e4 pawn, a common mistake in chess.",1. d4 Nf6 2. Nf3 g6 3. c4 Bg7 4. Nc3 O-O 5. e4 d6 6. Bd3 Bg4 7. h3 Bxf3 8. Qxf3 Nfd7 9. Be3 c5 10. d5 Ne5 11. Qe2 Nxd3+ 12. Qxd3 Nd7 13. O-O Qa5 14. Bd2 a6 15. Nd1 Qc7 16. Bc3 Ne5 17. Qe2 b5 18. cxb5 axb5 19. f4 Nc4 20. Bxg7 Kxg7 21. Nc3 Qa5 22. a4 Qb4 23. Nxb5 Rxa4 24. Rxa4 Qxa4 25. Rc1 Qxb5 26. Rxc4 Rb8 27. Rc2 Qxe2 28. Rxe2 Rb4 29. Kf2 Kf8 30. Kf3,"This is a game between Marshall,F (as White) and Reti,R (as Black). Last move played: White plays King to f3",Large advantage for Black (eval: -160 centipawns),30... h6 ,30. Kf3 
"The Rook shifts position to another square where the c5-pawn still defends without it. It also sets up an ""invisible barrier"" on the d-file which White's King without cannot enter or cross.",True," The comment offers a potential explanation for the mistake, though it's somewhat subjective and could be more precise.",1. d4 Nf6 2. Nf3 g6 3. c4 Bg7 4. Nc3 O-O 5. e4 d6 6. Bd3 Bg4 7. h3 Bxf3 8. Qxf3 Nfd7 9. Be3 c5 10. d5 Ne5 11. Qe2 Nxd3+ 12. Qxd3 Nd7 13. O-O Qa5 14. Bd2 a6 15. Nd1 Qc7 16. Bc3 Ne5 17. Qe2 b5 18. cxb5 axb5 19. f4 Nc4 20. Bxg7 Kxg7 21. Nc3 Qa5 22. a4 Qb4 23. Nxb5 Rxa4 24. Rxa4 Qxa4 25. Rc1 Qxb5 26. Rxc4 Rb8 27. Rc2 Qxe2 28. Rxe2 Rb4 29. Kf2 Kf8 30. Kf3 Rd4,"This is a game between Marshall,F (as White) and Reti,R (as Black). Last move played: Black plays Rook to d4",Advantage for Black (eval: -50 centipawns),31. g4 ,30... h6 
Marshall checks Black's King and drives it off of the back rank.,True,". The comment describes a potential tactical error, suggesting an unnecessary and potentially risky move.",1. d4 Nf6 2. Nf3 g6 3. c4 Bg7 4. Nc3 O-O 5. e4 d6 6. Bd3 Bg4 7. h3 Bxf3 8. Qxf3 Nfd7 9. Be3 c5 10. d5 Ne5 11. Qe2 Nxd3+ 12. Qxd3 Nd7 13. O-O Qa5 14. Bd2 a6 15. Nd1 Qc7 16. Bc3 Ne5 17. Qe2 b5 18. cxb5 axb5 19. f4 Nc4 20. Bxg7 Kxg7 21. Nc3 Qa5 22. a4 Qb4 23. Nxb5 Rxa4 24. Rxa4 Qxa4 25. Rc1 Qxb5 26. Rxc4 Rb8 27. Rc2 Qxe2 28. Rxe2 Rb4 29. Kf2 Kf8 30. Kf3 Rd4 31. g4 Ke8 32. Re3 Rb4 33. Ra3 Rxb2 34. Ra8+,"This is a game between Marshall,F (as White) and Reti,R (as Black). Last move played: White plays Rook to a8 with check",The position is equal,34... Kd7 35. Ra7+ Kd8 36. e5 dxe5 37. fxe5 Rd2 38. Ra8+ Kc7 39. Ra7+ ,34. e5 Kd8 
Marshall maintains the pressure by checking again.,True," The comment suggests a potential weakness in the player’s defense, indicating a flawed strategic decision.",1. d4 Nf6 2. Nf3 g6 3. c4 Bg7 4. Nc3 O-O 5. e4 d6 6. Bd3 Bg4 7. h3 Bxf3 8. Qxf3 Nfd7 9. Be3 c5 10. d5 Ne5 11. Qe2 Nxd3+ 12. Qxd3 Nd7 13. O-O Qa5 14. Bd2 a6 15. Nd1 Qc7 16. Bc3 Ne5 17. Qe2 b5 18. cxb5 axb5 19. f4 Nc4 20. Bxg7 Kxg7 21. Nc3 Qa5 22. a4 Qb4 23. Nxb5 Rxa4 24. Rxa4 Qxa4 25. Rc1 Qxb5 26. Rxc4 Rb8 27. Rc2 Qxe2 28. Rxe2 Rb4 29. Kf2 Kf8 30. Kf3 Rd4 31. g4 Ke8 32. Re3 Rb4 33. Ra3 Rxb2 34. Ra8+ Kd7 35. Ra7+,"This is a game between Marshall,F (as White) and Reti,R (as Black). Last move played: White plays Rook to a7 with check",The position is equal,35... Kd8 36. e5 Rb3+ 37. Ke2 Rxh3 38. Ra8+ Kd7 39. Ra7+ ,35. Ra7+ Kd8 36. e5 Rb5 37. exd6 exd6 38. Rxf7 Rb3+ 39. Ke2 Rxh3 40. Ra7 Rh2+ 41. Ke3 Rh1 42. Ke2 Rh4 43. Kf3 Rh1 
The King escapes check and continues to protect the e7-pawn.,True," The comment offers a potential explanation for the mistake, suggesting a defensive move, but it doesn't fully identify the flaw in the initial move.",1. d4 Nf6 2. Nf3 g6 3. c4 Bg7 4. Nc3 O-O 5. e4 d6 6. Bd3 Bg4 7. h3 Bxf3 8. Qxf3 Nfd7 9. Be3 c5 10. d5 Ne5 11. Qe2 Nxd3+ 12. Qxd3 Nd7 13. O-O Qa5 14. Bd2 a6 15. Nd1 Qc7 16. Bc3 Ne5 17. Qe2 b5 18. cxb5 axb5 19. f4 Nc4 20. Bxg7 Kxg7 21. Nc3 Qa5 22. a4 Qb4 23. Nxb5 Rxa4 24. Rxa4 Qxa4 25. Rc1 Qxb5 26. Rxc4 Rb8 27. Rc2 Qxe2 28. Rxe2 Rb4 29. Kf2 Kf8 30. Kf3 Rd4 31. g4 Ke8 32. Re3 Rb4 33. Ra3 Rxb2 34. Ra8+ Kd7 35. Ra7+ Kd8,"This is a game between Marshall,F (as White) and Reti,R (as Black). Last move played: Black plays King to d8",The position is equal,36. h4 ,35... Kd8 36. e5 Rb3+ 37. Ke2 Rxh3 38. Ra8+ Kd7 39. Ra7+ 
"The White e-pawn advances, forcing Black to capture it (if Black doesn't, without then White plays 37.exd6 exd6 38.Rxf7 and wins a pawn).",True," The comment describes a logical blunder, suggesting an unnecessary and ultimately losing pawn sacrifice.",1. d4 Nf6 2. Nf3 g6 3. c4 Bg7 4. Nc3 O-O 5. e4 d6 6. Bd3 Bg4 7. h3 Bxf3 8. Qxf3 Nfd7 9. Be3 c5 10. d5 Ne5 11. Qe2 Nxd3+ 12. Qxd3 Nd7 13. O-O Qa5 14. Bd2 a6 15. Nd1 Qc7 16. Bc3 Ne5 17. Qe2 b5 18. cxb5 axb5 19. f4 Nc4 20. Bxg7 Kxg7 21. Nc3 Qa5 22. a4 Qb4 23. Nxb5 Rxa4 24. Rxa4 Qxa4 25. Rc1 Qxb5 26. Rxc4 Rb8 27. Rc2 Qxe2 28. Rxe2 Rb4 29. Kf2 Kf8 30. Kf3 Rd4 31. g4 Ke8 32. Re3 Rb4 33. Ra3 Rxb2 34. Ra8+ Kd7 35. Ra7+ Kd8 36. e5,"This is a game between Marshall,F (as White) and Reti,R (as Black). Last move played: White plays Pawn to e5",The position is equal,36... dxe5 37. fxe5 Rb3+ 38. Ke4 Rb4+ 39. Kf3 ,36. h4 
"Now Black is stuck with a weak, isolated pawn on c5.",True, The comment accurately identifies a potential positional weakness.,1. d4 Nf6 2. Nf3 g6 3. c4 Bg7 4. Nc3 O-O 5. e4 d6 6. Bd3 Bg4 7. h3 Bxf3 8. Qxf3 Nfd7 9. Be3 c5 10. d5 Ne5 11. Qe2 Nxd3+ 12. Qxd3 Nd7 13. O-O Qa5 14. Bd2 a6 15. Nd1 Qc7 16. Bc3 Ne5 17. Qe2 b5 18. cxb5 axb5 19. f4 Nc4 20. Bxg7 Kxg7 21. Nc3 Qa5 22. a4 Qb4 23. Nxb5 Rxa4 24. Rxa4 Qxa4 25. Rc1 Qxb5 26. Rxc4 Rb8 27. Rc2 Qxe2 28. Rxe2 Rb4 29. Kf2 Kf8 30. Kf3 Rd4 31. g4 Ke8 32. Re3 Rb4 33. Ra3 Rxb2 34. Ra8+ Kd7 35. Ra7+ Kd8 36. e5 dxe5,"This is a game between Marshall,F (as White) and Reti,R (as Black). Last move played: Black plays Pawn takes on e5",The position is equal,37. fxe5 Rb3+ 38. Ke4 Rb4+ 39. Kf3 Rd4 40. Ra8+ Kc7 41. Ra7+ Kd8 ,36... dxe5 37. fxe5 Rb3+ 38. Ke4 Rb4+ 39. Kf3 
"White recaptures to complete the pawn swap. Now, if the White Rook moves, the without squares c6,d6,e6, and f6 are covered by White's pawns and are denied to without Black's King.",True, The comment clarifies why the recapture was a mistake by highlighting the blocked squares.,1. d4 Nf6 2. Nf3 g6 3. c4 Bg7 4. Nc3 O-O 5. e4 d6 6. Bd3 Bg4 7. h3 Bxf3 8. Qxf3 Nfd7 9. Be3 c5 10. d5 Ne5 11. Qe2 Nxd3+ 12. Qxd3 Nd7 13. O-O Qa5 14. Bd2 a6 15. Nd1 Qc7 16. Bc3 Ne5 17. Qe2 b5 18. cxb5 axb5 19. f4 Nc4 20. Bxg7 Kxg7 21. Nc3 Qa5 22. a4 Qb4 23. Nxb5 Rxa4 24. Rxa4 Qxa4 25. Rc1 Qxb5 26. Rxc4 Rb8 27. Rc2 Qxe2 28. Rxe2 Rb4 29. Kf2 Kf8 30. Kf3 Rd4 31. g4 Ke8 32. Re3 Rb4 33. Ra3 Rxb2 34. Ra8+ Kd7 35. Ra7+ Kd8 36. e5 dxe5 37. fxe5,"This is a game between Marshall,F (as White) and Reti,R (as Black). Last move played: White plays Pawn takes on e5",The position is equal,37... Rd2 38. Ra8+ Kc7 39. Ra7+ ,37. fxe5 Rb3+ 38. Ke4 Rb4+ 39. Kf3 Rd4 40. Ra8+ Kc7 41. Ra7+ Kd8 
"A centrally-posted King is a distinct advantage in the endgame. Marshall without moves his King toward the center, where it can move to the Quenside to help without attack Black's pawn, or to the Kingside to help prevent a Black pawn without breakthrough.",True," The comment offers a potentially flawed strategic idea, suggesting a King’s placement that could be detrimental in the endgame.",1. d4 Nf6 2. Nf3 g6 3. c4 Bg7 4. Nc3 O-O 5. e4 d6 6. Bd3 Bg4 7. h3 Bxf3 8. Qxf3 Nfd7 9. Be3 c5 10. d5 Ne5 11. Qe2 Nxd3+ 12. Qxd3 Nd7 13. O-O Qa5 14. Bd2 a6 15. Nd1 Qc7 16. Bc3 Ne5 17. Qe2 b5 18. cxb5 axb5 19. f4 Nc4 20. Bxg7 Kxg7 21. Nc3 Qa5 22. a4 Qb4 23. Nxb5 Rxa4 24. Rxa4 Qxa4 25. Rc1 Qxb5 26. Rxc4 Rb8 27. Rc2 Qxe2 28. Rxe2 Rb4 29. Kf2 Kf8 30. Kf3 Rd4 31. g4 Ke8 32. Re3 Rb4 33. Ra3 Rxb2 34. Ra8+ Kd7 35. Ra7+ Kd8 36. e5 dxe5 37. fxe5 c4 38. Ke3,"This is a game between Marshall,F (as White) and Reti,R (as Black). Last move played: White plays King to e3",The position is equal,38... c3 39. Ra8+ Kd7 40. Ra7+ Kd8 ,38. Ra8+ Kc7 39. Ra7+ Rb7 40. Ra4 Rb3+ 41. Ke4 Rxh3 42. Rxc4+ Kd8 43. Ra4 Rg3 44. Kf4 Rd3 45. Ra8+ Kc7 46. Ke4 Rg3 47. Ra7+ Kd8 48. d6 exd6 49. exd6 Rg1 50. Rxf7 Re1+ 51. Kd5 Rd1+ 52. Ke6 Re1+ 53. Kd5 
The Black pawn continues its march toward either coronation or death.,True," The comment suggests a potential vulnerability in Black’s pawn structure, hinting at a strategic weakness.",1. d4 Nf6 2. Nf3 g6 3. c4 Bg7 4. Nc3 O-O 5. e4 d6 6. Bd3 Bg4 7. h3 Bxf3 8. Qxf3 Nfd7 9. Be3 c5 10. d5 Ne5 11. Qe2 Nxd3+ 12. Qxd3 Nd7 13. O-O Qa5 14. Bd2 a6 15. Nd1 Qc7 16. Bc3 Ne5 17. Qe2 b5 18. cxb5 axb5 19. f4 Nc4 20. Bxg7 Kxg7 21. Nc3 Qa5 22. a4 Qb4 23. Nxb5 Rxa4 24. Rxa4 Qxa4 25. Rc1 Qxb5 26. Rxc4 Rb8 27. Rc2 Qxe2 28. Rxe2 Rb4 29. Kf2 Kf8 30. Kf3 Rd4 31. g4 Ke8 32. Re3 Rb4 33. Ra3 Rxb2 34. Ra8+ Kd7 35. Ra7+ Kd8 36. e5 dxe5 37. fxe5 c4 38. Ke3 c3,"This is a game between Marshall,F (as White) and Reti,R (as Black). Last move played: Black plays Pawn to c3",The position is equal,39. Ra8+ Kd7 40. Ra7+ Ke8 41. Ra8+ ,38... c3 39. Ra8+ Kd7 40. Ra7+ Kd8 
The Black King obviously must move to escape check.,True," The comment suggests a potential defensive move, but it doesn't directly address the error in the initial move.",1. d4 Nf6 2. Nf3 g6 3. c4 Bg7 4. Nc3 O-O 5. e4 d6 6. Bd3 Bg4 7. h3 Bxf3 8. Qxf3 Nfd7 9. Be3 c5 10. d5 Ne5 11. Qe2 Nxd3+ 12. Qxd3 Nd7 13. O-O Qa5 14. Bd2 a6 15. Nd1 Qc7 16. Bc3 Ne5 17. Qe2 b5 18. cxb5 axb5 19. f4 Nc4 20. Bxg7 Kxg7 21. Nc3 Qa5 22. a4 Qb4 23. Nxb5 Rxa4 24. Rxa4 Qxa4 25. Rc1 Qxb5 26. Rxc4 Rb8 27. Rc2 Qxe2 28. Rxe2 Rb4 29. Kf2 Kf8 30. Kf3 Rd4 31. g4 Ke8 32. Re3 Rb4 33. Ra3 Rxb2 34. Ra8+ Kd7 35. Ra7+ Kd8 36. e5 dxe5 37. fxe5 c4 38. Ke3 c3 39. Ra8+ Kc7,"This is a game between Marshall,F (as White) and Reti,R (as Black). Last move played: Black plays King to c7",The position is equal,40. Ra7+ Kd8 41. Ra8+ Kd7 42. Ra7+ Kd8 ,39... Kc7 40. Ra7+ Kd8 41. Ra8+ Kd7 42. Ra7+ 
...and another evasion. The Black King must come back to d8 or else the without e7-pawn is lost.,True," The comment suggests a potential threat to the Black King, indicating a flawed defensive strategy.",1. d4 Nf6 2. Nf3 g6 3. c4 Bg7 4. Nc3 O-O 5. e4 d6 6. Bd3 Bg4 7. h3 Bxf3 8. Qxf3 Nfd7 9. Be3 c5 10. d5 Ne5 11. Qe2 Nxd3+ 12. Qxd3 Nd7 13. O-O Qa5 14. Bd2 a6 15. Nd1 Qc7 16. Bc3 Ne5 17. Qe2 b5 18. cxb5 axb5 19. f4 Nc4 20. Bxg7 Kxg7 21. Nc3 Qa5 22. a4 Qb4 23. Nxb5 Rxa4 24. Rxa4 Qxa4 25. Rc1 Qxb5 26. Rxc4 Rb8 27. Rc2 Qxe2 28. Rxe2 Rb4 29. Kf2 Kf8 30. Kf3 Rd4 31. g4 Ke8 32. Re3 Rb4 33. Ra3 Rxb2 34. Ra8+ Kd7 35. Ra7+ Kd8 36. e5 dxe5 37. fxe5 c4 38. Ke3 c3 39. Ra8+ Kc7 40. Ra7+ Kd8,"This is a game between Marshall,F (as White) and Reti,R (as Black). Last move played: Black plays King to d8",The position is equal,41. Ra8+ Kd7 42. Ra7+ Ke8 43. Ra8+ ,40... Kd8 41. Ra8+ Kc7 42. Ra7+ 
"Again, Marshall hopes to draw by either threefold repetition of position or without by perpetual check.",True," The comment suggests a strategic maneuver designed to avoid a win, indicating a flawed move.",1. d4 Nf6 2. Nf3 g6 3. c4 Bg7 4. Nc3 O-O 5. e4 d6 6. Bd3 Bg4 7. h3 Bxf3 8. Qxf3 Nfd7 9. Be3 c5 10. d5 Ne5 11. Qe2 Nxd3+ 12. Qxd3 Nd7 13. O-O Qa5 14. Bd2 a6 15. Nd1 Qc7 16. Bc3 Ne5 17. Qe2 b5 18. cxb5 axb5 19. f4 Nc4 20. Bxg7 Kxg7 21. Nc3 Qa5 22. a4 Qb4 23. Nxb5 Rxa4 24. Rxa4 Qxa4 25. Rc1 Qxb5 26. Rxc4 Rb8 27. Rc2 Qxe2 28. Rxe2 Rb4 29. Kf2 Kf8 30. Kf3 Rd4 31. g4 Ke8 32. Re3 Rb4 33. Ra3 Rxb2 34. Ra8+ Kd7 35. Ra7+ Kd8 36. e5 dxe5 37. fxe5 c4 38. Ke3 c3 39. Ra8+ Kc7 40. Ra7+ Kd8 41. Ra8+,"This is a game between Marshall,F (as White) and Reti,R (as Black). Last move played: White plays Rook to a8 with check",The position is equal,41... Kc7 42. Ra7+ Kd8 43. Ra8+ ,41. Ra8+ Kd7 42. Ra7+ Ke8 43. Ra8+ 
The King must move again.,True,", The comment suggests a potential tactical blunder due to the king's forced relocation.",1. d4 Nf6 2. Nf3 g6 3. c4 Bg7 4. Nc3 O-O 5. e4 d6 6. Bd3 Bg4 7. h3 Bxf3 8. Qxf3 Nfd7 9. Be3 c5 10. d5 Ne5 11. Qe2 Nxd3+ 12. Qxd3 Nd7 13. O-O Qa5 14. Bd2 a6 15. Nd1 Qc7 16. Bc3 Ne5 17. Qe2 b5 18. cxb5 axb5 19. f4 Nc4 20. Bxg7 Kxg7 21. Nc3 Qa5 22. a4 Qb4 23. Nxb5 Rxa4 24. Rxa4 Qxa4 25. Rc1 Qxb5 26. Rxc4 Rb8 27. Rc2 Qxe2 28. Rxe2 Rb4 29. Kf2 Kf8 30. Kf3 Rd4 31. g4 Ke8 32. Re3 Rb4 33. Ra3 Rxb2 34. Ra8+ Kd7 35. Ra7+ Kd8 36. e5 dxe5 37. fxe5 c4 38. Ke3 c3 39. Ra8+ Kc7 40. Ra7+ Kd8 41. Ra8+ Kc7,"This is a game between Marshall,F (as White) and Reti,R (as Black). Last move played: Black plays King to c7",The position is equal,42. Ra7+ Kd8 43. Ra8+ Kd7 44. Ra7+ ,41... Kc7 42. Ra7+ Kd8 43. Ra8+ 
Marshall again hopes to repeat the position...,True,", The comment indicates the player is repeating a previously unsuccessful move, suggesting a flawed strategy.",1. d4 Nf6 2. Nf3 g6 3. c4 Bg7 4. Nc3 O-O 5. e4 d6 6. Bd3 Bg4 7. h3 Bxf3 8. Qxf3 Nfd7 9. Be3 c5 10. d5 Ne5 11. Qe2 Nxd3+ 12. Qxd3 Nd7 13. O-O Qa5 14. Bd2 a6 15. Nd1 Qc7 16. Bc3 Ne5 17. Qe2 b5 18. cxb5 axb5 19. f4 Nc4 20. Bxg7 Kxg7 21. Nc3 Qa5 22. a4 Qb4 23. Nxb5 Rxa4 24. Rxa4 Qxa4 25. Rc1 Qxb5 26. Rxc4 Rb8 27. Rc2 Qxe2 28. Rxe2 Rb4 29. Kf2 Kf8 30. Kf3 Rd4 31. g4 Ke8 32. Re3 Rb4 33. Ra3 Rxb2 34. Ra8+ Kd7 35. Ra7+ Kd8 36. e5 dxe5 37. fxe5 c4 38. Ke3 c3 39. Ra8+ Kc7 40. Ra7+ Kd8 41. Ra8+ Kc7 42. Ra7+,"This is a game between Marshall,F (as White) and Reti,R (as Black). Last move played: White plays Rook to a7 with check",The position is equal,42... Kd8 43. Ra8+ Kd7 44. Ra7+ Ke8 45. Ra8+ Kd7 ,42. Ra7+ Kd8 43. Ra8+ Kd7 44. Ra7+ 
"Reti pushes the pawn, but to no avail. The pawn is marked for death.",True," The comment directly identifies a flaw in the move, indicating a strategic error.",1. d4 Nf6 2. Nf3 g6 3. c4 Bg7 4. Nc3 O-O 5. e4 d6 6. Bd3 Bg4 7. h3 Bxf3 8. Qxf3 Nfd7 9. Be3 c5 10. d5 Ne5 11. Qe2 Nxd3+ 12. Qxd3 Nd7 13. O-O Qa5 14. Bd2 a6 15. Nd1 Qc7 16. Bc3 Ne5 17. Qe2 b5 18. cxb5 axb5 19. f4 Nc4 20. Bxg7 Kxg7 21. Nc3 Qa5 22. a4 Qb4 23. Nxb5 Rxa4 24. Rxa4 Qxa4 25. Rc1 Qxb5 26. Rxc4 Rb8 27. Rc2 Qxe2 28. Rxe2 Rb4 29. Kf2 Kf8 30. Kf3 Rd4 31. g4 Ke8 32. Re3 Rb4 33. Ra3 Rxb2 34. Ra8+ Kd7 35. Ra7+ Kd8 36. e5 dxe5 37. fxe5 c4 38. Ke3 c3 39. Ra8+ Kc7 40. Ra7+ Kd8 41. Ra8+ Kc7 42. Ra7+ Rb7 43. Ra3 c2,"This is a game between Marshall,F (as White) and Reti,R (as Black). Last move played: Black plays Pawn to c2",The position is equal,44. Rc3+ Kd7 45. Rxc2 Rb3+ 46. Kd4 Rxh3 47. Ra2 Rh1 48. Ra7+ Kd8 49. g5 Rd1+ 50. Kc5 Rc1+ 51. Kb5 Rb1+ 52. Kc6 Rc1+ 53. Kb5 ,43... c2 44. Rc3+ Kd7 45. Rxc2 Rb3+ 46. Kd4 Rxh3 47. Ra2 Rh1 48. Ra7+ Kd8 49. d6 exd6 50. exd6 Rf1 51. Kc5 h6 52. Kc6 Rc1+ 53. Kd5 h5 54. gxh5 gxh5 55. Rxf7 Rd1+ 56. Kc6 Rc1+ 57. Kb5 Rb1+ 58. Kc5 Rc1+ 
Marshall springs a double attack (checking the King and attacking the pawn). without This assures the pawn's sad demise.,True, The comment describes a potentially risky and unusual move that could lead to a loss of material.,1. d4 Nf6 2. Nf3 g6 3. c4 Bg7 4. Nc3 O-O 5. e4 d6 6. Bd3 Bg4 7. h3 Bxf3 8. Qxf3 Nfd7 9. Be3 c5 10. d5 Ne5 11. Qe2 Nxd3+ 12. Qxd3 Nd7 13. O-O Qa5 14. Bd2 a6 15. Nd1 Qc7 16. Bc3 Ne5 17. Qe2 b5 18. cxb5 axb5 19. f4 Nc4 20. Bxg7 Kxg7 21. Nc3 Qa5 22. a4 Qb4 23. Nxb5 Rxa4 24. Rxa4 Qxa4 25. Rc1 Qxb5 26. Rxc4 Rb8 27. Rc2 Qxe2 28. Rxe2 Rb4 29. Kf2 Kf8 30. Kf3 Rd4 31. g4 Ke8 32. Re3 Rb4 33. Ra3 Rxb2 34. Ra8+ Kd7 35. Ra7+ Kd8 36. e5 dxe5 37. fxe5 c4 38. Ke3 c3 39. Ra8+ Kc7 40. Ra7+ Kd8 41. Ra8+ Kc7 42. Ra7+ Rb7 43. Ra3 c2 44. Rc3+,"This is a game between Marshall,F (as White) and Reti,R (as Black). Last move played: White plays Rook to c3 with check",The position is equal,44... Kd7 45. Rxc2 Rb3+ 46. Kd4 Rxh3 47. Ra2 Rh1 48. Ra7+ Kd8 49. Ra8+ Kc7 50. Kc5 Rc1+ 51. Kb5 h6 52. Ra7+ Kd8 53. d6 exd6 54. exd6 h5 55. gxh5 gxh5 56. Rxf7 Rd1 57. Kc5 Ke8 58. Rh7 Rd2 59. Re7+ Kd8 ,44. Rc3+ Kd7 45. Rxc2 Rb3+ 46. Kd4 Rxh3 47. Ra2 Rh1 48. Ra7+ Kd8 49. g5 Rd1+ 50. Kc5 Rc1+ 51. Kb5 Rb1+ 52. Kc6 Rc1+ 53. Kb5 
Black's passed pawn finally gives up the ghost.,True," The comment suggests a tactical blunder, indicating a weakness in the position.",1. d4 Nf6 2. Nf3 g6 3. c4 Bg7 4. Nc3 O-O 5. e4 d6 6. Bd3 Bg4 7. h3 Bxf3 8. Qxf3 Nfd7 9. Be3 c5 10. d5 Ne5 11. Qe2 Nxd3+ 12. Qxd3 Nd7 13. O-O Qa5 14. Bd2 a6 15. Nd1 Qc7 16. Bc3 Ne5 17. Qe2 b5 18. cxb5 axb5 19. f4 Nc4 20. Bxg7 Kxg7 21. Nc3 Qa5 22. a4 Qb4 23. Nxb5 Rxa4 24. Rxa4 Qxa4 25. Rc1 Qxb5 26. Rxc4 Rb8 27. Rc2 Qxe2 28. Rxe2 Rb4 29. Kf2 Kf8 30. Kf3 Rd4 31. g4 Ke8 32. Re3 Rb4 33. Ra3 Rxb2 34. Ra8+ Kd7 35. Ra7+ Kd8 36. e5 dxe5 37. fxe5 c4 38. Ke3 c3 39. Ra8+ Kc7 40. Ra7+ Kd8 41. Ra8+ Kc7 42. Ra7+ Rb7 43. Ra3 c2 44. Rc3+ Kd7 45. Rxc2,"This is a game between Marshall,F (as White) and Reti,R (as Black). Last move played: White plays Rook takes on c2",The position is equal,45... Rb3+ 46. Kd4 Rxh3 47. Ra2 Rh1 48. Ra7+ Kd8 49. g5 h5 50. gxh6 Rxh6 51. d6 exd6 52. exd6 Rh4+ 53. Kd5 Rf4 54. Kc5 Rf2 55. Kc6 Rc2+ 56. Kb6 Rb2+ 57. Kc6 ,45. Rxc2 Rb3+ 46. Kd4 Rxh3 47. Ra2 Rh1 48. Ra7+ Kd8 49. g5 Rd1+ 50. Kc5 Rc1+ 51. Kb6 Rd1 
"Reti wins a pawn using a basic tactic: the skewer, or x-ray attack. The White without King must move out of check, after which the Black Rook pockets the without h3-pawn.",True," The comment describes a specific tactical sequence that led to the mistake, indicating a flawed assessment of the position.",1. d4 Nf6 2. Nf3 g6 3. c4 Bg7 4. Nc3 O-O 5. e4 d6 6. Bd3 Bg4 7. h3 Bxf3 8. Qxf3 Nfd7 9. Be3 c5 10. d5 Ne5 11. Qe2 Nxd3+ 12. Qxd3 Nd7 13. O-O Qa5 14. Bd2 a6 15. Nd1 Qc7 16. Bc3 Ne5 17. Qe2 b5 18. cxb5 axb5 19. f4 Nc4 20. Bxg7 Kxg7 21. Nc3 Qa5 22. a4 Qb4 23. Nxb5 Rxa4 24. Rxa4 Qxa4 25. Rc1 Qxb5 26. Rxc4 Rb8 27. Rc2 Qxe2 28. Rxe2 Rb4 29. Kf2 Kf8 30. Kf3 Rd4 31. g4 Ke8 32. Re3 Rb4 33. Ra3 Rxb2 34. Ra8+ Kd7 35. Ra7+ Kd8 36. e5 dxe5 37. fxe5 c4 38. Ke3 c3 39. Ra8+ Kc7 40. Ra7+ Kd8 41. Ra8+ Kc7 42. Ra7+ Rb7 43. Ra3 c2 44. Rc3+ Kd7 45. Rxc2 Rb3+,"This is a game between Marshall,F (as White) and Reti,R (as Black). Last move played: Black plays Rook to b3 with check",The position is equal,46. Kd4 Rxh3 47. Ra2 Rh1 48. g5 Rd1+ 49. Kc4 Re1 50. Ra7+ Kd8 51. Kc5 Re4 52. Kc6 Rc4+ 53. Kb5 Rc1 54. Kb6 Rb1+ 55. Kc5 Rc1+ 56. Kb5 Rb1+ ,45... Rb3+ 46. Kd4 Rxh3 47. Ra2 Rh1 48. Ra7+ Kd8 49. g5 h5 50. gxh6 Rxh6 51. d6 exd6 52. exd6 Rh4+ 53. Kd5 Rf4 54. Kc5 Rf2 55. Kc6 Rc2+ 56. Kb6 Rb2+ 57. Kc6 
The best place for White's King to move to. Now the King supports both of without White's center pawns.,True," The comment suggests a potential weakness in the King's position, indicating a flawed strategic decision.",1. d4 Nf6 2. Nf3 g6 3. c4 Bg7 4. Nc3 O-O 5. e4 d6 6. Bd3 Bg4 7. h3 Bxf3 8. Qxf3 Nfd7 9. Be3 c5 10. d5 Ne5 11. Qe2 Nxd3+ 12. Qxd3 Nd7 13. O-O Qa5 14. Bd2 a6 15. Nd1 Qc7 16. Bc3 Ne5 17. Qe2 b5 18. cxb5 axb5 19. f4 Nc4 20. Bxg7 Kxg7 21. Nc3 Qa5 22. a4 Qb4 23. Nxb5 Rxa4 24. Rxa4 Qxa4 25. Rc1 Qxb5 26. Rxc4 Rb8 27. Rc2 Qxe2 28. Rxe2 Rb4 29. Kf2 Kf8 30. Kf3 Rd4 31. g4 Ke8 32. Re3 Rb4 33. Ra3 Rxb2 34. Ra8+ Kd7 35. Ra7+ Kd8 36. e5 dxe5 37. fxe5 c4 38. Ke3 c3 39. Ra8+ Kc7 40. Ra7+ Kd8 41. Ra8+ Kc7 42. Ra7+ Rb7 43. Ra3 c2 44. Rc3+ Kd7 45. Rxc2 Rb3+ 46. Kd4,"This is a game between Marshall,F (as White) and Reti,R (as Black). Last move played: White plays King to d4",The position is equal,46... Rxh3 47. Ra2 Rh4 48. Kc5 Rxg4 49. Ra7+ Kd8 50. Ra8+ Kd7 ,46. Kd4 Rxh3 47. Ra2 Rh1 48. g5 Rd1+ 49. Kc4 Re1 50. Ra7+ Kd8 51. Kc5 Re4 52. Kc6 Rc4+ 53. Kb5 Rc1 54. Kb6 Rb1+ 55. Kc5 Rc1+ 56. Kb5 Rb1+ 
"Since he's a pawn behind, Marshall sees slight chance of winning the game. He without again maneuvers for a draw by repetition or perpetual check.",True," The comment suggests a flawed strategic assessment, potentially leading to a passive and uninspired approach.",1. d4 Nf6 2. Nf3 g6 3. c4 Bg7 4. Nc3 O-O 5. e4 d6 6. Bd3 Bg4 7. h3 Bxf3 8. Qxf3 Nfd7 9. Be3 c5 10. d5 Ne5 11. Qe2 Nxd3+ 12. Qxd3 Nd7 13. O-O Qa5 14. Bd2 a6 15. Nd1 Qc7 16. Bc3 Ne5 17. Qe2 b5 18. cxb5 axb5 19. f4 Nc4 20. Bxg7 Kxg7 21. Nc3 Qa5 22. a4 Qb4 23. Nxb5 Rxa4 24. Rxa4 Qxa4 25. Rc1 Qxb5 26. Rxc4 Rb8 27. Rc2 Qxe2 28. Rxe2 Rb4 29. Kf2 Kf8 30. Kf3 Rd4 31. g4 Ke8 32. Re3 Rb4 33. Ra3 Rxb2 34. Ra8+ Kd7 35. Ra7+ Kd8 36. e5 dxe5 37. fxe5 c4 38. Ke3 c3 39. Ra8+ Kc7 40. Ra7+ Kd8 41. Ra8+ Kc7 42. Ra7+ Rb7 43. Ra3 c2 44. Rc3+ Kd7 45. Rxc2 Rb3+ 46. Kd4 Rxh3 47. Ra2,"This is a game between Marshall,F (as White) and Reti,R (as Black). Last move played: White plays Rook to a2",The position is equal,47... Rh1 48. g5 Rc1 49. Ra7+ Kd8 50. Ra8+ Kd7 51. Ra3 Kd8 52. Ra7 Rd1+ 53. Kc5 Rc1+ ,47. Ra2 Rh1 48. Ra7+ Kd8 49. g5 Rd1+ 50. Kc5 Rg1 51. Kb6 Rc1 52. Ra8+ Kd7 53. Ra6 Rb1+ 54. Kc5 Rc1+ 55. Kd4 Rd1+ 56. Kc4 Rc1+ 
"As expected, Marshall plays for a draw.",True," The comment indicates a potential draw, suggesting a strategic decision rather than a tactical blunder.",1. d4 Nf6 2. Nf3 g6 3. c4 Bg7 4. Nc3 O-O 5. e4 d6 6. Bd3 Bg4 7. h3 Bxf3 8. Qxf3 Nfd7 9. Be3 c5 10. d5 Ne5 11. Qe2 Nxd3+ 12. Qxd3 Nd7 13. O-O Qa5 14. Bd2 a6 15. Nd1 Qc7 16. Bc3 Ne5 17. Qe2 b5 18. cxb5 axb5 19. f4 Nc4 20. Bxg7 Kxg7 21. Nc3 Qa5 22. a4 Qb4 23. Nxb5 Rxa4 24. Rxa4 Qxa4 25. Rc1 Qxb5 26. Rxc4 Rb8 27. Rc2 Qxe2 28. Rxe2 Rb4 29. Kf2 Kf8 30. Kf3 Rd4 31. g4 Ke8 32. Re3 Rb4 33. Ra3 Rxb2 34. Ra8+ Kd7 35. Ra7+ Kd8 36. e5 dxe5 37. fxe5 c4 38. Ke3 c3 39. Ra8+ Kc7 40. Ra7+ Kd8 41. Ra8+ Kc7 42. Ra7+ Rb7 43. Ra3 c2 44. Rc3+ Kd7 45. Rxc2 Rb3+ 46. Kd4 Rxh3 47. Ra2 Rg3 48. Ra7+,"This is a game between Marshall,F (as White) and Reti,R (as Black). Last move played: White plays Rook to a7 with check",The position is equal,48... Ke8 49. Kc5 h5 50. gxh5 gxh5 51. Ra8+ Kd7 52. Ra4 Rc3+ 53. Kd4 Rc1 54. Ra7+ Ke8 55. Ra8+ Kd7 ,48. Kc5 Rxg4 49. Ra7+ Kd8 50. d6 exd6+ 51. exd6 Rg1 52. Rxf7 h5 53. Rf8+ Kd7 54. Rf7+ Ke8 55. Re7+ Kd8 56. Rf7 Rc1+ 57. Kd4 Rd1+ 58. Ke5 Re1+ 59. Kd5 h4 60. Rh7 
"To draw, all Marshall needs to do now is keep checking the Black King.",True," The comment suggests a flawed strategy, indicating a mistake in evaluating the position.",1. d4 Nf6 2. Nf3 g6 3. c4 Bg7 4. Nc3 O-O 5. e4 d6 6. Bd3 Bg4 7. h3 Bxf3 8. Qxf3 Nfd7 9. Be3 c5 10. d5 Ne5 11. Qe2 Nxd3+ 12. Qxd3 Nd7 13. O-O Qa5 14. Bd2 a6 15. Nd1 Qc7 16. Bc3 Ne5 17. Qe2 b5 18. cxb5 axb5 19. f4 Nc4 20. Bxg7 Kxg7 21. Nc3 Qa5 22. a4 Qb4 23. Nxb5 Rxa4 24. Rxa4 Qxa4 25. Rc1 Qxb5 26. Rxc4 Rb8 27. Rc2 Qxe2 28. Rxe2 Rb4 29. Kf2 Kf8 30. Kf3 Rd4 31. g4 Ke8 32. Re3 Rb4 33. Ra3 Rxb2 34. Ra8+ Kd7 35. Ra7+ Kd8 36. e5 dxe5 37. fxe5 c4 38. Ke3 c3 39. Ra8+ Kc7 40. Ra7+ Kd8 41. Ra8+ Kc7 42. Ra7+ Rb7 43. Ra3 c2 44. Rc3+ Kd7 45. Rxc2 Rb3+ 46. Kd4 Rxh3 47. Ra2 Rg3 48. Ra7+ Kd8 49. Ra8+,"This is a game between Marshall,F (as White) and Reti,R (as Black). Last move played: White plays Rook to a8 with check",The position is equal,49... Kd7 50. Kc5 Rxg4 51. Ra7+ Kd8 52. Ra8+ ,49. Ra8+ Kd7 50. Ra7+ Ke8 51. Ra8+ 
"...and Reti retreats. Rather than play out the moves for a threefold- without repetition, Marshall and Reti agree to a draw.",True," The comment clarifies a draw due to a stalemate, indicating a flaw in the player's strategic thinking.",1. d4 Nf6 2. Nf3 g6 3. c4 Bg7 4. Nc3 O-O 5. e4 d6 6. Bd3 Bg4 7. h3 Bxf3 8. Qxf3 Nfd7 9. Be3 c5 10. d5 Ne5 11. Qe2 Nxd3+ 12. Qxd3 Nd7 13. O-O Qa5 14. Bd2 a6 15. Nd1 Qc7 16. Bc3 Ne5 17. Qe2 b5 18. cxb5 axb5 19. f4 Nc4 20. Bxg7 Kxg7 21. Nc3 Qa5 22. a4 Qb4 23. Nxb5 Rxa4 24. Rxa4 Qxa4 25. Rc1 Qxb5 26. Rxc4 Rb8 27. Rc2 Qxe2 28. Rxe2 Rb4 29. Kf2 Kf8 30. Kf3 Rd4 31. g4 Ke8 32. Re3 Rb4 33. Ra3 Rxb2 34. Ra8+ Kd7 35. Ra7+ Kd8 36. e5 dxe5 37. fxe5 c4 38. Ke3 c3 39. Ra8+ Kc7 40. Ra7+ Kd8 41. Ra8+ Kc7 42. Ra7+ Rb7 43. Ra3 c2 44. Rc3+ Kd7 45. Rxc2 Rb3+ 46. Kd4 Rxh3 47. Ra2 Rg3 48. Ra7+ Kd8 49. Ra8+ Kc7 50. Ra7+ Kd8,"This is a game between Marshall,F (as White) and Reti,R (as Black). Last move played: Black plays King to d8",The position is equal,51. d6 exd6 52. exd6 Rxg4+ 53. Kc5 Rg1 54. Rxf7 Rc1+ 55. Kd4 Rd1+ 56. Ke5 h5 57. Rg7 Re1+ 58. Kd5 h4 59. Rg8+ Kd7 60. Rxg6 h3 61. Rh6 Rh1 62. Rh7+ Kd8 63. Kc5 h2 64. Rh8+ Kd7 65. Rh7+ Kd8 ,50... Kd8 51. d6 exd6 52. exd6 Rxg4+ 53. Kc5 Rg1 54. Rxf7 h5 55. Rh7 g5 56. Kc6 Rc1+ 57. Kd5 h4 58. Rh8+ Kd7 59. Rh7+ Kd8 
"White develops the Knight toward the center, controls d4, and strengthens his without grip on e5.",True, The comment identifies a weakness in the pawn structure and suggests a potentially better alternative.,1. d4 Nf6 2. Nf3,"This is a game between Marshall,F (as White) and Reti,R (as Black). Last move played: White plays Knight to f3",Slight advantage for White (eval: 26 centipawns),2... d5 3. c4 ,2. c4 e6 
