comment,good,reasoning,moves,context,engine_eval,engine_best_line,engine_best_alternative
The French Winawer. In theory it is solid yet aggressive. You choose an older inflexible way to meet it (and more difficult to defend against). Typically White will unleash a strong Kingside attack with Qg4.,True," The comment identifies a problematic opening choice and suggests a specific defensive strategy, indicating a flawed move.",1. e4 e6 2. d4 d5 3. Nc3 Bb4,This is a game between W39 (as White) and B39 (as Black). Last move played: Black plays Bishop to b4,Advantage for White (eval: 56 centipawns),4. e5 c5 ,3... Nf6 4. e5 Nfd7 5. f4 c5 6. Nf3 Nc6 7. Be3 cxd4 8. Nxd4 Qb6 9. Ncb5 a6 10. Nf5 Bc5 11. Nbd6+ Kf8 12. Qh5 Nd8 13. Nxg7 Bxe3 14. Nxe6+ fxe6 15. Qe8+ Kg7 16. Qe7+ Kg8 17. Bd3 Qb4+ 18. c3 Qxf4 19. Qxd8+ Qf8 
"This move makes sense. Objectively it may be questionable but it offers Black two pluses. First it gives Black the half-open c - file. Second it breaks up the White center pawns. One reason for questioning this move is that it does not appear to be consistent with the objectives of Black's choice of opening. Always remember there is a plus in every negative on the chessboard. Chess is an exchange of advantages and disadvantages. For instance, if you drop a piece you generally get two moves in exchange for it. Sometimes the two moves are more critical than the piece. It is the reason that sacrifices work. That is why chess coaches warn younger players to not chase pawns. It is not worth the moves that are given up. In the games that I've seen, it appears that Black wants a quick resolution to the game by choosing this move.",True," The comment offers a justification for the move's perceived weakness, suggesting Black’s strategic goals are being compromised.",1. e4 e6 2. d4 d5 3. Nc3 Bb4 4. e5 c5 5. a3 cxd4,This is a game between W39 (as White) and B39 (as Black). Last move played: Black plays Pawn takes on d4,Large advantage for White (eval: 112 centipawns),6. axb4 dxc3 ,5... Bxc3+ 6. bxc3 Qc7 7. h4 Nc6 8. Nf3 Nge7 9. Be2 h6 10. a4 Bd7 11. Ba3 b6 12. O-O Na5 13. h5 O-O 14. Nh4 Nc4 15. Bc1 
"Interesting try for Black, typically the play would be either /\Nc6 or /\Ba5. Again the move makes sense, but remember in chess that there is an absolute truth at work. Wrong moves should be punished by accurate play.",True," The comment highlights a potential error in strategic thinking, suggesting a failure to adhere to established principles.",1. e4 e6 2. d4 d5 3. Nc3 Bb4 4. e5 c5 5. a3 cxd4 6. Qxd4 Bxc3+,This is a game between W39 (as White) and B39 (as Black). Last move played: Black plays Bishop takes on c3 with check,Advantage for White (eval: 92 centipawns),7. Qxc3 Ne7 8. Nf3 Bd7 9. Bd3 a6 10. a4 Nbc6 11. b3 Ng6 12. Bxg6 hxg6 13. O-O Rc8 14. Re1 f6 15. Qd2 Qa5 16. Qe3 Ne7 17. Bb2 Nf5 18. Qd3 ,6... Nc6 
At this point the idea would be to play Qg3. The forcing of the /\g6 gives White a huge positional advantage with the pawn at e5 and the absence of the Black's dark square Bishop. If Black castles Kingside he should not be able to defend himself. Nf3,True," The comment suggests a strategic error by Black, specifically neglecting the threat of the /\g6 pawn and failing to adequately consider the resulting positional weakness.",1. e4 e6 2. d4 d5 3. Nc3 Bb4 4. e5 c5 5. a3 cxd4 6. Qxd4 Bxc3+ 7. Qxc3 Nc6 8. Bb5,This is a game between W39 (as White) and B39 (as Black). Last move played: White plays Bishop to b5,Slight advantage for White (eval: 40 centipawns),8... Bd7 9. Bxc6 ,8. Qg3 Qc7 9. Nf3 Nge7 10. Qxg7 Rg8 11. Qf6 Ng6 12. Bf4 Nxf4 13. Qxf4 Bd7 14. O-O-O a6 15. g3 f6 16. Qh4 fxe5 17. Qh5+ Ke7 18. Qxh7+ Kd6 
"This move is too ambitious at this point. Now Black will be stuck with an over-extended pawn. In the French, Black must defend first, THEN attack. Development was essential on move 9. Again a move that makes sense. 9/\d4 is not as bad as you think. The move is not an ""attack."" Pawn moves are seldom for purposes of ""attack."" As a general rule, the idea of the pawn move is to gain or control space. I do however agree that this move is ill timed and too ambitious. In a sense the pawn is sacrificed for open lines. The problem for Black is that these open lines benefit White! BTW, in every defense the idea is to ""defend first, THEN attack."" All attacks must have positional justification. Black does have a problem unraveling his development in the French Defense - your opponent compounds this natural problem. This is why I do not personal recommend the French Defense you young players. If you are interested in completely frustrating someone playing the French Defense try the ""Exchange Variation."" It takes all the fun out of it for Black.",True," The comment identifies a strategic flaw in the move, suggests a defensive approach, and recommends a different opening, indicating a clear understanding of the mistake.",1. e4 e6 2. d4 d5 3. Nc3 Bb4 4. e5 c5 5. a3 cxd4 6. Qxd4 Bxc3+ 7. Qxc3 Nc6 8. Bb5 d4,This is a game between W39 (as White) and B39 (as Black). Last move played: Black plays Pawn to d4,Large advantage for White (eval: 134 centipawns),9. Bxc6+ ,8... Bd7 9. Bxc6 
"Black's develop ment is now becoming less effective because his pieces are being pinned and becoming useless. Black is cramped but at this point is fine. Do not mistake a cramped position for a bad position. Some defenses are specifically designed to make maxim use of as little space as possible. These can be very tough to crack and if the attacker relaxes or mishandles the position, it could get real ugly real fast. One characteristic of a cramped position is the interlocking of pieces. This is called ""over protection."" The idea is that for every attacker on a piece there is at least one more defender. This makes the various pieces more flexible - you can move any defender and not give up material. About pins: You place a high value on them for good reason. Pins often decide the game! There are two types of pins. There is the ""absolute"" pin. These are pins where the first piece can not move because the King is behind it. Then there is the ""relative"" pin where the defender can choose to give up material. The difference is that the second is flexible while the first is not. The ""magic"" behind the pin is the inflexibility of the pinned piece and generally its' defender. With one piece you can tie up as many as three defenders! That's like playing a virtual piece or two ahead. Another thing to like about pins is that they can quickly become a permanent positional advantage. Once you get a pin, work on the front piece - start piling up the attack on it.",True," The comment offers specific strategies and insights into exploiting a cramped position, suggesting a potential misunderstanding of positional advantages.",1. e4 e6 2. d4 d5 3. Nc3 Bb4 4. e5 c5 5. a3 cxd4 6. Qxd4 Bxc3+ 7. Qxc3 Nc6 8. Bb5 d4 9. Qd3 Ne7 10. Bg5,This is a game between W39 (as White) and B39 (as Black). Last move played: White plays Bishop to g5,Slight advantage for White (eval: 32 centipawns),10... Qd5 11. Nf3 a6 12. Bxe7 axb5 13. Bd6 f6 14. Qb3 Kf7 15. Qxd5 exd5 16. O-O-O Bg4 17. exf6 Bxf3 18. gxf3 gxf6 19. Rd3 Rhd8 20. Bc5 b4 21. Rb3 Ra4 ,10. Nf3 a6 11. Bxc6+ Nxc6 12. Bf4 Qa5+ 13. Nd2 O-O 14. O-O-O Qc7 15. Rhe1 Bd7 16. Nf3 f5 17. Qb3 Rfc8 18. Nxd4 Nxd4 19. Rxd4 a5 20. c3 a4 21. Qd1 Bc6 22. f3 
"Missing /\Qa5+ and /\Nxe5. The stronger of the two would be /\Nxe5, completely dissolving the White center and freeing Black's game. The draw back is that it scrambles the Black pawns and leaves White with a 2 - 3 pawn island advantage. The question is if a free game and an advantage in the center would be worth it?",True," The comment accurately identifies a critical error and explains the strategic consequences of the move, suggesting a potential disadvantage for White.",1. e4 e6 2. d4 d5 3. Nc3 Bb4 4. e5 c5 5. a3 cxd4 6. Qxd4 Bxc3+ 7. Qxc3 Nc6 8. Bb5 d4 9. Qd3 Ne7 10. Bg5 a6,This is a game between W39 (as White) and B39 (as Black). Last move played: Black plays Pawn to a6,Advantage for White (eval: 72 centipawns),11. Bxc6+ ,10... Qd5 11. Nf3 a6 12. Bxe7 axb5 13. Bd6 f6 14. Qb3 Kf7 15. Qxd5 exd5 16. O-O-O Bg4 17. exf6 Bxf3 18. gxf3 gxf6 19. Rd3 Rhd8 20. Bc5 b4 21. Rb3 Ra4 
