comment,good,reasoning,moves,context,engine_eval,engine_best_line,engine_best_alternative
"This variation has become more popular for White in recent years. Despite giving up the bishop pair, White can hope for the advantage because the pieces can be developed quickly.",True," The comment suggests a potential strategic advantage, suggesting the move was flawed.",1. c4 Nf6 2. Nf3 e6 3. Nc3 d5 4. d4 Bb4 5. cxd5 exd5 6. Bg5 h6 7. Bxf6 Qxf6,This is a game between Smyslov (as White) and Averbakh (as Black). Last move played: Black plays Queen takes on f6,The position is equal,8. e3 ,7... Qxf6 8. e3 
The minority attack. The idea to provoke weaknesses in the enemy pawn structure by advancing pawns. This strategy is characteristic of the Queen's Gambit lines where White exchanges pawns at d5.,True," The comment describes a potential tactical error, specifically a pawn advance aimed at creating weaknesses, which is a common mistake in chess.",1. c4 Nf6 2. Nf3 e6 3. Nc3 d5 4. d4 Bb4 5. cxd5 exd5 6. Bg5 h6 7. Bxf6 Qxf6 8. Qb3 Qd6 9. a3 Bxc3+ 10. Qxc3 O-O,This is a game between Smyslov (as White) and Averbakh (as Black). Last move played: Black plays kingside castle,The position is equal,11. e3 Bf5 ,10... O-O 
22.Qc3 attacking Black's a-pawn would allow Black to draw by 22...Rxg2+ 23.Kxg2 Qg4+ 24.Kh1 Qf3+ 25.Kg1 Qg4+ 26.Kh1 Qf3+ 27.Kg1 Qg4+,True," The comment suggests a dangerous and unnecessary attack that could lead to a draw, indicating a flawed strategic assessment.",1. c4 Nf6 2. Nf3 e6 3. Nc3 d5 4. d4 Bb4 5. cxd5 exd5 6. Bg5 h6 7. Bxf6 Qxf6 8. Qb3 Qd6 9. a3 Bxc3+ 10. Qxc3 O-O 11. Rc1 c6 12. e3 Bf5 13. Be2 Nd7 14. O-O a5 15. Ne1 Nf6 16. Nd3 Bxd3 17. Qxd3 Rfe8 18. Bf3 Ne4 19. Bxe4 Rxe4 20. Qb3 Qd7 21. Rc5 Rg4 22. h3,This is a game between Smyslov (as White) and Averbakh (as Black). Last move played: White plays Pawn to h3,Slight advantage for Black (eval: -27 centipawns),22... Rg6 23. Qc2 ,22. a4 Rg6 23. Kh1 Re6 24. Qc2 g5 25. Qd2 b6 26. Rc3 Kg7 27. Kg1 Rae8 28. Qc2 Rg6 
23.Qc3 Qxh3,True," The comment provides a potential blunderside move, suggesting a flawed strategic decision.",1. c4 Nf6 2. Nf3 e6 3. Nc3 d5 4. d4 Bb4 5. cxd5 exd5 6. Bg5 h6 7. Bxf6 Qxf6 8. Qb3 Qd6 9. a3 Bxc3+ 10. Qxc3 O-O 11. Rc1 c6 12. e3 Bf5 13. Be2 Nd7 14. O-O a5 15. Ne1 Nf6 16. Nd3 Bxd3 17. Qxd3 Rfe8 18. Bf3 Ne4 19. Bxe4 Rxe4 20. Qb3 Qd7 21. Rc5 Rg4 22. h3 Rg6 23. Kh1,This is a game between Smyslov (as White) and Averbakh (as Black). Last move played: White plays King to h1,Slight advantage for Black (eval: -25 centipawns),23... a4 ,23. Kh1 a4 24. Qb4 Kh7 25. Rfc1 Rf6 26. Qd2 Qd8 27. Re1 Re6 28. g3 g6 29. h4 h5 
Agreed drawn. White could have tried to win the a-pawn but it would not have mattered because Black would obtain sufficient counterplay on the kingside.,True, The comment suggests the player overemphasized the importance of counterplay and failed to consider the immediate tactical implications of the move.,1. c4 Nf6 2. Nf3 e6 3. Nc3 d5 4. d4 Bb4 5. cxd5 exd5 6. Bg5 h6 7. Bxf6 Qxf6 8. Qb3 Qd6 9. a3 Bxc3+ 10. Qxc3 O-O 11. Rc1 c6 12. e3 Bf5 13. Be2 Nd7 14. O-O a5 15. Ne1 Nf6 16. Nd3 Bxd3 17. Qxd3 Rfe8 18. Bf3 Ne4 19. Bxe4 Rxe4 20. Qb3 Qd7 21. Rc5 Rg4 22. h3 Rg6 23. Kh1 a4 24. Qb4 Rf6 25. Kg1,This is a game between Smyslov (as White) and Averbakh (as Black). Last move played: White plays King to g1,The position is equal,25... h5 26. Re1 ,25. Kg1 Rg6 26. Kh1 Ra6 27. Rg1 h5 28. Qd2 Qf5 29. Rd1 Qe4 30. Rg1 Rf6 31. Rf1 Qe7 32. f3 Re6 33. e4 dxe4 34. fxe4 Rxe4 35. Rxh5 Re2 36. Re5 
To off set White's coming minority attack Black will prepare a piece attack on the kingside.,True,". The comment suggests a potential tactical threat, indicating a flawed assessment of the board’s position.",1. c4 Nf6 2. Nf3 e6 3. Nc3 d5 4. d4 Bb4 5. cxd5 exd5 6. Bg5 h6 7. Bxf6 Qxf6 8. Qb3 Qd6 9. a3 Bxc3+ 10. Qxc3 O-O 11. Rc1 c6 12. e3 Bf5,This is a game between Smyslov (as White) and Averbakh (as Black). Last move played: Black plays Bishop to f5,Slight advantage for Black (eval: -22 centipawns),13. Bd3 Bxd3 ,12... Bf5 
"This variation has become more popular for White in recent years. Despite giving up the bishop pair, White can hope for the advantage because the pieces can be developed quickly.",True," The comment suggests a defensive move to mitigate White’s attack, indicating a flawed strategic assessment.",1. c4 Nf6 2. Nf3 e6 3. Nc3 d5 4. d4 Bb4 5. cxd5 exd5 6. Bg5 h6 7. Bxf6 Qxf6,This is a game between Smyslov (as White) and Averbakh (as Black). Last move played: Black plays Queen takes on f6,The position is equal,8. e3 ,7... Qxf6 8. e3 
