comment,good,reasoning,moves,context,engine_eval,engine_best_line,engine_best_alternative
"The Caro Kann didn't come as a surprise, since Anand played this opening several times this year.",True, The comment suggests the mistake was predictable based on past play.,1. e4 c6,"This is a game between Rebel10 (exp) (as White) and Anand,V (as Black). Last move played: Black plays Pawn to c6",Slight advantage for White (eval: 44 centipawns),2. d4 ,1... e5 2. Nf3 Nc6 3. d4 exd4 4. Nxd4 Bc5 5. Nb3 Bb6 6. a4 Qh4 7. Qf3 a5 8. g3 Qf6 9. Qe2 Nge7 10. Nc3 
"A small surprise, as Anand preferred 4 ... Nd7 earlier this year.",True," The comment provides context about a previous move, suggesting the move was a deviation from a previous plan.",1. e4 c6 2. d4 d5 3. Nc3 dxe4 4. Nxe4 Bf5,"This is a game between Rebel10 (exp) (as White) and Anand,V (as Black). Last move played: Black plays Bishop to f5",Slight advantage for White (eval: 47 centipawns),5. Ng3 Bg6 ,4... Bf5 
"With the idea of f4, Ne4 and g4 to start an attack on the Black king.",True," The comment suggests a flawed opening strategy, indicating a mistake.",1. e4 c6 2. d4 d5 3. Nc3 dxe4 4. Nxe4 Bf5 5. Ng3 Bg6 6. h4 h6 7. h5 Bh7 8. Nf3 Nf6 9. Bd3 Bxd3 10. Qxd3 e6 11. Bd2 Be7 12. O-O-O O-O 13. Ne5,"This is a game between Rebel10 (exp) (as White) and Anand,V (as Black). Last move played: White plays Knight to e5",The position is equal,13... c5 ,13. Ne4 Nbd7 14. Kb1 c5 15. g4 Nxg4 16. Qe2 cxd4 17. Rhg1 d3 18. Qxd3 f5 19. Bc3 Ndf6 20. Qe2 Qe8 21. Ng3 Qc8 22. Nd4 Nd5 23. Nxe6 Nxc3+ 24. bxc3 Rf7 
Rebel takes the first opportunity to complicate the game.,True," The comment suggests a poorly planned, overly complex move, indicating a flaw in the player’s strategy.",1. e4 c6 2. d4 d5 3. Nc3 dxe4 4. Nxe4 Bf5 5. Ng3 Bg6 6. h4 h6 7. h5 Bh7 8. Nf3 Nf6 9. Bd3 Bxd3 10. Qxd3 e6 11. Bd2 Be7 12. O-O-O O-O 13. Ne5 Nbd7 14. f4 c5 15. Bc3 Nd5 16. dxc5 Nxc5 17. Qf3 Rc8 18. Nf5,"This is a game between Rebel10 (exp) (as White) and Anand,V (as Black). Last move played: White plays Knight to f5",The position is equal,18... exf5 ,18. Nf5 exf5 
Anand used a lot of time for this more or less forced move. After f.e. 18 ... Na4 White has 19 Nxh6+! gxh6 20 Qg4+.,True," The comment identifies a time-consuming move and a resulting tactical threat, suggesting a flawed evaluation of the move’s consequences.",1. e4 c6 2. d4 d5 3. Nc3 dxe4 4. Nxe4 Bf5 5. Ng3 Bg6 6. h4 h6 7. h5 Bh7 8. Nf3 Nf6 9. Bd3 Bxd3 10. Qxd3 e6 11. Bd2 Be7 12. O-O-O O-O 13. Ne5 Nbd7 14. f4 c5 15. Bc3 Nd5 16. dxc5 Nxc5 17. Qf3 Rc8 18. Nf5 exf5,"This is a game between Rebel10 (exp) (as White) and Anand,V (as Black). Last move played: Black plays Pawn takes on f5",The position is equal,19. Rxd5 Qc7 ,18... exf5 
"Very well played. Anand temporarely gives up a piece, to obtain a dangerous attack.",True," The comment suggests a strategic retreat to create a tactical opportunity, indicating a flawed move.",1. e4 c6 2. d4 d5 3. Nc3 dxe4 4. Nxe4 Bf5 5. Ng3 Bg6 6. h4 h6 7. h5 Bh7 8. Nf3 Nf6 9. Bd3 Bxd3 10. Qxd3 e6 11. Bd2 Be7 12. O-O-O O-O 13. Ne5 Nbd7 14. f4 c5 15. Bc3 Nd5 16. dxc5 Nxc5 17. Qf3 Rc8 18. Nf5 exf5 19. Rxd5 Qc7 20. Qh3 Ne4,"This is a game between Rebel10 (exp) (as White) and Anand,V (as Black). Last move played: Black plays Knight to e4",Slight advantage for Black (eval: -25 centipawns),21. Rd7 ,20... Ne4 21. Rd7 
"From a materialistic point of view White is not in a bad shape. Still, his knight on b4 is rather shaky and also the pawn on e4 can become strong. Anand has only one problem: he has not much time left....",True," The comment offers a somewhat pessimistic assessment and suggests potential future threats, indicating a flawed evaluation of the position's current state.",1. e4 c6 2. d4 d5 3. Nc3 dxe4 4. Nxe4 Bf5 5. Ng3 Bg6 6. h4 h6 7. h5 Bh7 8. Nf3 Nf6 9. Bd3 Bxd3 10. Qxd3 e6 11. Bd2 Be7 12. O-O-O O-O 13. Ne5 Nbd7 14. f4 c5 15. Bc3 Nd5 16. dxc5 Nxc5 17. Qf3 Rc8 18. Nf5 exf5 19. Rxd5 Qc7 20. Qh3 Ne4 21. Rd7 Qc5 22. Nd3 Qc4 23. Rxe7 Qxa2 24. Rxe4 fxe4 25. Nb4,"This is a game between Rebel10 (exp) (as White) and Anand,V (as Black). Last move played: White plays Knight to b4",Large advantage for Black (eval: -121 centipawns),25... Qa1+ 26. Kd2 ,25. Nb4 Qa1+ 
"Here Vishy used his remaining time, didn't find a solution and lost on time! A pity this exciting game had to finish in such a way. After 28 ... a5 29 b3 Qd7 30 Qxd7 Rxd7 31 Na2 the ending looks better for Black. 1-0",True," The comment offers a subjective assessment of the move's outcome and suggests a potential disadvantage for Black, indicating a perceived mistake.",1. e4 c6 2. d4 d5 3. Nc3 dxe4 4. Nxe4 Bf5 5. Ng3 Bg6 6. h4 h6 7. h5 Bh7 8. Nf3 Nf6 9. Bd3 Bxd3 10. Qxd3 e6 11. Bd2 Be7 12. O-O-O O-O 13. Ne5 Nbd7 14. f4 c5 15. Bc3 Nd5 16. dxc5 Nxc5 17. Qf3 Rc8 18. Nf5 exf5 19. Rxd5 Qc7 20. Qh3 Ne4 21. Rd7 Qc5 22. Nd3 Qc4 23. Rxe7 Qxa2 24. Rxe4 fxe4 25. Nb4 Qa1+ 26. Kd2 Rfd8+ 27. Ke2 Qa4 28. Qf5,"This is a game between Rebel10 (exp) (as White) and Anand,V (as Black). Last move played: White plays Queen to f5",Large advantage for Black (eval: -138 centipawns),28... a5 29. b3 ,28. Rd1 Qb5+ 
"With the idea of f4, Ne4 and g4 to start an attack on the Black king.",True," The comment offers a potential alternative move and explains the reasoning behind the perceived mistake, indicating a consideration of other options.",1. e4 c6 2. d4 d5 3. Nc3 dxe4 4. Nxe4 Bf5 5. Ng3 Bg6 6. h4 h6 7. h5 Bh7 8. Nf3 Nf6 9. Bd3 Bxd3 10. Qxd3 e6 11. Bd2 Be7 12. O-O-O O-O 13. Ne5,"This is a game between Rebel10 (exp) (as White) and Anand,V (as Black). Last move played: White plays Knight to e5",The position is equal,13... c5 ,13. Ne4 Nbd7 14. Kb1 c5 15. g4 Nxg4 16. Qe2 cxd4 17. Rhg1 d3 18. Qxd3 f5 19. Bc3 Ndf6 20. Qe2 Qe8 21. Ng3 Qc8 22. Nd4 Nd5 23. Nxe6 Nxc3+ 24. bxc3 Rf7 
