comment,good,reasoning,moves,context,engine_eval,engine_best_line,engine_best_alternative
"This move order gives White more options against the Tarrasch than 3.Nc3, when Black, in addition to the ""normal"" lines has several sharp and unclear gambit variations to choose from.",True," The comment identifies a potential weakness in the move order, suggesting White's options are expanded, implying a flaw in the initial analysis.",1. d4 d5 2. c4 e6 3. Nf3,This is a game between Kasparov (as White) and Gavrikov (as Black). Last move played: White plays Knight to f3,Slight advantage for White (eval: 31 centipawns),3... dxc4 4. e3 ,3. Nc3 Nf6 
The Tarrasch Defense is well known to Gavrikov who has played it on a regular basis. Black's idea is to take an isolated d-pawn in exchange for active piece play.,True," The comment provides a relevant historical reference, suggesting a known opening, which is a common mistake in chess analysis.",1. d4 d5 2. c4 e6 3. Nf3 c5,This is a game between Kasparov (as White) and Gavrikov (as Black). Last move played: Black plays Pawn to c5,Slight advantage for White (eval: 39 centipawns),4. cxd5 ,3... dxc4 4. e3 
"It was Jan Timman who first employed this move, securing the central light squares. The older 12.Ne4 presents fewer problems for Black.",True," The comment offers a potential explanation for the mistake, suggesting a strategic disadvantage for Black.",1. d4 d5 2. c4 e6 3. Nf3 c5 4. cxd5 exd5 5. g3 Nc6 6. Bg2 Nf6 7. O-O Be7 8. dxc5 Bxc5 9. Bg5 O-O 10. Nc3 d4 11. Bxf6 Qxf6 12. Nd5,This is a game between Kasparov (as White) and Gavrikov (as Black). Last move played: White plays Knight to d5,The position is equal,12... Qd8 ,12. Ne4 Qe7 
"It is tempting to regard this move as an outright blunder, even though until this game was played it was considered playable.",True," The comment suggests the move was initially seen as a mistake, indicating a flawed assessment of its potential.",1. d4 d5 2. c4 e6 3. Nf3 c5 4. cxd5 exd5 5. g3 Nc6 6. Bg2 Nf6 7. O-O Be7 8. dxc5 Bxc5 9. Bg5 O-O 10. Nc3 d4 11. Bxf6 Qxf6 12. Nd5 Qd8 13. Nd2 a6,This is a game between Kasparov (as White) and Gavrikov (as Black). Last move played: Black plays Pawn to a6,Slight advantage for White (eval: 26 centipawns),14. Rc1 Ba7 15. Nf4 Re8 16. Re1 Rb8 17. Nb3 Bf5 18. Nc5 Bxc5 19. Rxc5 Be4 20. Bxe4 Rxe4 21. Qd3 Re8 22. h4 h6 23. Rec1 Qe7 24. a3 Rbd8 ,13... Re8 
"Previously this piece had been wandering to the less effective e4 square, where it only got in the way. This new idea was well prepared.",True," The comment suggests the piece was poorly placed and unnecessarily hindered, indicating a flawed strategic decision.",1. d4 d5 2. c4 e6 3. Nf3 c5 4. cxd5 exd5 5. g3 Nc6 6. Bg2 Nf6 7. O-O Be7 8. dxc5 Bxc5 9. Bg5 O-O 10. Nc3 d4 11. Bxf6 Qxf6 12. Nd5 Qd8 13. Nd2 a6 14. Rc1 Ba7 15. Nc4,This is a game between Kasparov (as White) and Gavrikov (as Black). Last move played: White plays Knight to c4,The position is equal,15... Bg4 16. Nf4 ,15. Nf4 Re8 16. Nb3 Qd6 17. Nd3 h5 18. Nbc5 h4 19. Nxa6 Bg4 20. Re1 h3 21. Bh1 Qe7 22. Kf1 Bf5 23. Nac5 Bxc5 24. Nxc5 Rxa2 25. Bxc6 
Such timidity is not a permitted luxury in this opening. 15...Bh3 16.Bxh3 Qxd5 17.Bg2 Qe6 is only slightly better for White due to Black's isolated d- pawn.,True," The comment suggests a tactical deficiency in White's move, indicating a lack of confidence and strategic consideration.",1. d4 d5 2. c4 e6 3. Nf3 c5 4. cxd5 exd5 5. g3 Nc6 6. Bg2 Nf6 7. O-O Be7 8. dxc5 Bxc5 9. Bg5 O-O 10. Nc3 d4 11. Bxf6 Qxf6 12. Nd5 Qd8 13. Nd2 a6 14. Rc1 Ba7 15. Nc4 Rb8,This is a game between Kasparov (as White) and Gavrikov (as Black). Last move played: Black plays Rook to b8,Slight advantage for White (eval: 29 centipawns),16. Qd2 Bh3 ,15... Bg4 16. Nf4 Rc8 17. Qd3 Bb8 18. Nd5 Re8 19. e4 b5 20. Nd2 Bd6 21. h3 Be6 22. Nf3 h6 23. Nxd4 Bxd5 24. exd5 Nxd4 25. Qxd4 Rxc1 26. Rxc1 
With the idea of developing the bishop to a6.,True," The comment suggests a potential weakness in the opening strategy, indicating a flaw in the planned development.",1. d4 d5 2. c4 e6 3. Nf3 c5 4. cxd5 exd5 5. g3 Nc6 6. Bg2 Nf6 7. O-O Be7 8. dxc5 Bxc5 9. Bg5 O-O 10. Nc3 d4 11. Bxf6 Qxf6 12. Nd5 Qd8 13. Nd2 a6 14. Rc1 Ba7 15. Nc4 Rb8 16. Nf4 b5 17. Nd6 Qxd6 18. Rxc6 Qd8 19. Qc2 a5,This is a game between Kasparov (as White) and Gavrikov (as Black). Last move played: Black plays Pawn to a5,Large advantage for White (eval: 106 centipawns),20. Rc1 a4 ,19... Bb6 
White's advantage is mounting and the tripling on the open c-file is the cause of Black's future problems.,True," The comment suggests a specific move led to future problems, implying a flawed strategic assessment.",1. d4 d5 2. c4 e6 3. Nf3 c5 4. cxd5 exd5 5. g3 Nc6 6. Bg2 Nf6 7. O-O Be7 8. dxc5 Bxc5 9. Bg5 O-O 10. Nc3 d4 11. Bxf6 Qxf6 12. Nd5 Qd8 13. Nd2 a6 14. Rc1 Ba7 15. Nc4 Rb8 16. Nf4 b5 17. Nd6 Qxd6 18. Rxc6 Qd8 19. Qc2 a5 20. Rc1,This is a game between Kasparov (as White) and Gavrikov (as Black). Last move played: White plays Rook to c1,Large advantage for White (eval: 106 centipawns),20... Bb6 21. Qd3 ,20. Rc1 a4 
The beginning of a fantastic attack based on Black's light squared weaknesses.,True," The comment suggests a potential tactical advantage, indicating a flawed assessment of the position.",1. d4 d5 2. c4 e6 3. Nf3 c5 4. cxd5 exd5 5. g3 Nc6 6. Bg2 Nf6 7. O-O Be7 8. dxc5 Bxc5 9. Bg5 O-O 10. Nc3 d4 11. Bxf6 Qxf6 12. Nd5 Qd8 13. Nd2 a6 14. Rc1 Ba7 15. Nc4 Rb8 16. Nf4 b5 17. Nd6 Qxd6 18. Rxc6 Qd8 19. Qc2 a5 20. Rc1 Re8 21. Bd5,This is a game between Kasparov (as White) and Gavrikov (as Black). Last move played: White plays Bishop to d5,Large advantage for White (eval: 156 centipawns),21... Bb6 22. h4 Bd7 23. Rd6 Qe7 24. Rxd7 Qxd7 25. Bc6 Qe7 26. Bxe8 Qxe8 27. h5 Bd8 28. Qf5 h6 29. Rc8 Rxc8 30. Qxc8 Kf8 31. Nd5 Bf6 32. Qxe8+ Kxe8 33. Nxf6+ gxf6 34. Kg2 ,21. Bd5 Bb6 22. h4 Bd7 23. Rd6 Qe7 24. Rxd7 Qxd7 25. Bc6 Qc8 26. Bxe8 Qxe8 27. Qd3 h6 28. Qf3 a4 29. Rc6 Bd8 30. Rc5 Bf6 31. Nd5 Qe6 32. Nxf6+ Qxf6 33. Qxf6 gxf6 34. Rd5 
Keep your eye on this piece.,True,". The comment suggests a tactical oversight, indicating a potential error in the player's assessment of the board position.",1. d4 d5 2. c4 e6 3. Nf3 c5 4. cxd5 exd5 5. g3 Nc6 6. Bg2 Nf6 7. O-O Be7 8. dxc5 Bxc5 9. Bg5 O-O 10. Nc3 d4 11. Bxf6 Qxf6 12. Nd5 Qd8 13. Nd2 a6 14. Rc1 Ba7 15. Nc4 Rb8 16. Nf4 b5 17. Nd6 Qxd6 18. Rxc6 Qd8 19. Qc2 a5 20. Rc1 Re8 21. Bd5 Bb6 22. Qb3 Re7 23. Bf3,This is a game between Kasparov (as White) and Gavrikov (as Black). Last move played: White plays Bishop to f3,Advantage for White (eval: 89 centipawns),23... Re5 24. Nd3 ,23. Qf3 
Now White is able to take advantage of Black's f-pawn which is pinned on the a2-g8 diagonal.,True," The comment identifies a specific tactical threat, suggesting a flawed plan.",1. d4 d5 2. c4 e6 3. Nf3 c5 4. cxd5 exd5 5. g3 Nc6 6. Bg2 Nf6 7. O-O Be7 8. dxc5 Bxc5 9. Bg5 O-O 10. Nc3 d4 11. Bxf6 Qxf6 12. Nd5 Qd8 13. Nd2 a6 14. Rc1 Ba7 15. Nc4 Rb8 16. Nf4 b5 17. Nd6 Qxd6 18. Rxc6 Qd8 19. Qc2 a5 20. Rc1 Re8 21. Bd5 Bb6 22. Qb3 Re7 23. Bf3 Re5 24. Bh5 g6,This is a game between Kasparov (as White) and Gavrikov (as Black). Last move played: Black plays Pawn to g6,Large advantage for White (eval: 167 centipawns),25. Bxg6 hxg6 26. Rxg6+ Kf8 27. Rcc6 Bf5 28. Rh6 Kg7 29. Qf3 d3 30. exd3 Bd4 31. Nh5+ Kg8 32. Rcd6 Qg5 33. Nf6+ Kf8 34. Rh5 Bg4 35. Nxg4 Bxf2+ 36. Qxf2 Qc1+ 37. Kg2 Rxh5 38. Nf6 Ke7 39. Qa7+ Kxd6 40. Qxb8+ Ke7 41. Nxh5 Qc6+ 42. Kf2 ,24... g6 25. Bxg6 
27...Kg7 would allow White a brilliant mating attack.,True," The comment offers a potential tactical advantage, suggesting a move that could be detrimental to the opponent, indicating a flawed assessment of the position.",1. d4 d5 2. c4 e6 3. Nf3 c5 4. cxd5 exd5 5. g3 Nc6 6. Bg2 Nf6 7. O-O Be7 8. dxc5 Bxc5 9. Bg5 O-O 10. Nc3 d4 11. Bxf6 Qxf6 12. Nd5 Qd8 13. Nd2 a6 14. Rc1 Ba7 15. Nc4 Rb8 16. Nf4 b5 17. Nd6 Qxd6 18. Rxc6 Qd8 19. Qc2 a5 20. Rc1 Re8 21. Bd5 Bb6 22. Qb3 Re7 23. Bf3 Re5 24. Bh5 g6 25. Bxg6 hxg6 26. Rxg6+ Kf8 27. Rh6 Ke7,This is a game between Kasparov (as White) and Gavrikov (as Black). Last move played: Black plays King to e7,Large advantage for White (eval: 352 centipawns),28. Rcc6 Bf5 29. Rcf6 Qg8 30. Rxb6 Rxb6 31. Rxb6 Qc8 32. Qd1 Qc4 33. Rb7+ Kd6 34. Nd3 Re4 35. Qd2 Kc6 36. Rb8 Kc7 37. Rf8 Qxa2 38. h4 Kb7 39. Nc5+ Kc6 40. Nxe4 Qb1+ 41. Kh2 Bxe4 ,27... Rg5 28. Rcc6 
Played with the idea of covering the f7 square. 28...Bd7 would allow White a mating continuation.,True," The comment suggests a potential tactical error, indicating the player misjudged the consequences of the move.",1. d4 d5 2. c4 e6 3. Nf3 c5 4. cxd5 exd5 5. g3 Nc6 6. Bg2 Nf6 7. O-O Be7 8. dxc5 Bxc5 9. Bg5 O-O 10. Nc3 d4 11. Bxf6 Qxf6 12. Nd5 Qd8 13. Nd2 a6 14. Rc1 Ba7 15. Nc4 Rb8 16. Nf4 b5 17. Nd6 Qxd6 18. Rxc6 Qd8 19. Qc2 a5 20. Rc1 Re8 21. Bd5 Bb6 22. Qb3 Re7 23. Bf3 Re5 24. Bh5 g6 25. Bxg6 hxg6 26. Rxg6+ Kf8 27. Rh6 Ke7 28. Rcc6 Rf5,This is a game between Kasparov (as White) and Gavrikov (as Black). Last move played: Black plays Rook to f5,Large advantage for White (eval: 665 centipawns),29. Qf3 d3 30. Qe4+ Kf8 31. Rh8+ Kg7 32. Rxd8 Bxd8 33. Qxd3 Rxf4 34. Qxd8 Rg4 35. Rxc8 Rxc8 36. Qxc8 Ra4 37. Kg2 Rxa2 38. Qd7 Ra1 39. Qxb5 Re1 40. Kf3 Kg8 41. Qg5+ Kh7 ,28... Bf5 29. Qf3 Rc8 30. Rxb6 Rc1+ 31. Kg2 Be4 32. Qxe4 Rxe4 33. Rb7+ Rc7 34. Rxc7+ Qxc7 35. Nd5+ Kd7 36. Nxc7 Kxc7 37. Kf3 d3 38. exd3 Ra4 39. a3 Kd7 
The Black rook is overworked on the 5th rank.,True," The comment suggests a potential tactical vulnerability, indicating a mistake.",1. d4 d5 2. c4 e6 3. Nf3 c5 4. cxd5 exd5 5. g3 Nc6 6. Bg2 Nf6 7. O-O Be7 8. dxc5 Bxc5 9. Bg5 O-O 10. Nc3 d4 11. Bxf6 Qxf6 12. Nd5 Qd8 13. Nd2 a6 14. Rc1 Ba7 15. Nc4 Rb8 16. Nf4 b5 17. Nd6 Qxd6 18. Rxc6 Qd8 19. Qc2 a5 20. Rc1 Re8 21. Bd5 Bb6 22. Qb3 Re7 23. Bf3 Re5 24. Bh5 g6 25. Bxg6 hxg6 26. Rxg6+ Kf8 27. Rh6 Ke7 28. Rcc6 Rf5 29. Qf3 Bc7,This is a game between Kasparov (as White) and Gavrikov (as Black). Last move played: Black plays Bishop to c7,Large advantage for White (eval: 704 centipawns),30. Qe4+ Re5 31. Rxc7+ Qxc7 32. Nd5+ Kd7 33. Qg4+ Re6 34. Nxc7 Kxc7 35. Qf4+ Kc6 36. Qxb8 Rxh6 37. Qxc8+ Kb6 38. Qd8+ Kc6 39. Qxa5 Re6 40. Kf1 Re4 41. Qa6+ Kc5 42. Qa3+ Kc6 43. Qd3 Kb6 44. Qxe4 f5 45. Qxf5 ,29... d3 30. Qe4+ Kf8 31. Rh8+ Kg7 32. Rxd8 dxe2 33. Nxe2 Bxd8 34. Rxc8 Rxc8 35. Qxf5 Rc6 36. Qg4+ Rg6 37. Qd7 Re6 38. Qxd8 Rxe2 39. Qd4+ Kg8 40. Qg4+ Kf8 41. Qxe2 
"Black resigns as despite his two extra bishops, he cannot avoid mate.",True," The comment directly states the resignation as a consequence of the inability to avoid a mate, indicating a flawed move.",1. d4 d5 2. c4 e6 3. Nf3 c5 4. cxd5 exd5 5. g3 Nc6 6. Bg2 Nf6 7. O-O Be7 8. dxc5 Bxc5 9. Bg5 O-O 10. Nc3 d4 11. Bxf6 Qxf6 12. Nd5 Qd8 13. Nd2 a6 14. Rc1 Ba7 15. Nc4 Rb8 16. Nf4 b5 17. Nd6 Qxd6 18. Rxc6 Qd8 19. Qc2 a5 20. Rc1 Re8 21. Bd5 Bb6 22. Qb3 Re7 23. Bf3 Re5 24. Bh5 g6 25. Bxg6 hxg6 26. Rxg6+ Kf8 27. Rh6 Ke7 28. Rcc6 Rf5 29. Qf3 Bc7 30. Qe4+ Re5 31. Ng6+ fxg6 32. Rh7+ Kf8 33. Qxg6,This is a game between Kasparov (as White) and Gavrikov (as Black). Last move played: White plays Queen takes on g6,Mate in 3 for White,33... Rf5 34. Qg7+ Ke8 35. Rh8+ Rf8 36. Rxf8# ,33. Qxg6 Rf5 34. Qg7+ Ke8 35. Rh8+ Rf8 36. Rxf8# 
"This retreat is Black's safest. 12...Qd6 Blocks the a3-f8 diagonal, which may be needed by the dark squared bishop.",True,", The comment suggests a missed opportunity to improve the position.",1. d4 d5 2. c4 e6 3. Nf3 c5 4. cxd5 exd5 5. g3 Nc6 6. Bg2 Nf6 7. O-O Be7 8. dxc5 Bxc5 9. Bg5 O-O 10. Nc3 d4 11. Bxf6 Qxf6 12. Nd5 Qd8,This is a game between Kasparov (as White) and Gavrikov (as Black). Last move played: Black plays Queen to d8,Slight advantage for White (eval: 23 centipawns),13. Nd2 Re8 14. Rc1 Bb6 15. Nc4 Bf5 16. a3 Be4 17. Bxe4 Rxe4 18. Ndxb6 axb6 19. Re1 Re6 20. Nd2 Qd7 21. Nf3 g6 22. Qd3 ,12... Qd8 
The Tarrasch Defense is well known to Gavrikov who has played it on a regular basis. Black's idea is to take an isolated d-pawn in exchange for active piece play.,True," The comment suggests a potential tactical weakness, indicating a flawed retreat.",1. d4 d5 2. c4 e6 3. Nf3 c5,This is a game between Kasparov (as White) and Gavrikov (as Black). Last move played: Black plays Pawn to c5,Slight advantage for White (eval: 39 centipawns),4. cxd5 ,3... dxc4 4. e3 
The Tarrasch Defense is well known to Gavrikov who has played it on a regular basis. Black's idea is to take an isolated d-pawn in exchange for active piece play.,True," The comment describes a tactical threat and potential for a strong attack, suggesting the move was flawed.",1. d4 d5 2. c4 e6 3. Nf3 c5,This is a game between Kasparov (as White) and Gavrikov (as Black). Last move played: Black plays Pawn to c5,Slight advantage for White (eval: 39 centipawns),4. cxd5 ,3... dxc4 4. e3 
