comment,good,reasoning,moves,context,engine_eval,engine_best_line,engine_best_alternative
"If the central tension is to be maintained, White must first take care to protect his c-pawn",True," The comment suggests a defensive strategy to stabilize the center, which is a potential reason for the mistake.",1. c4 f5 2. d4 Nf6 3. g3 e6 4. Bg2 Be7 5. Nf3 d5 6. O-O O-O 7. Nc3 c6 8. Qc2 Qe8 9. Bf4 Qh5 10. b3,This is a game between Yudovich (as White) and Botvinnik (as Black). Last move played: White plays Pawn to b3,Advantage for White (eval: 73 centipawns),10... Qe8 11. Na4 Ne4 12. Ne5 Nd7 13. Nd3 Nd6 14. Rac1 g5 15. Be3 Qg6 16. f4 g4 17. Ne5 Qg7 ,10. c5 
"From the sequel, it appears that this is not only unnecessary: it actually puts the King on a worse square",True," The comment identifies a flaw in the move, suggesting a tactical disadvantage.",1. c4 f5 2. d4 Nf6 3. g3 e6 4. Bg2 Be7 5. Nf3 d5 6. O-O O-O 7. Nc3 c6 8. Qc2 Qe8 9. Bf4 Qh5 10. b3 Nbd7 11. Rad1 Kh8 12. Kh1,This is a game between Yudovich (as White) and Botvinnik (as Black). Last move played: White plays King to h1,Advantage for White (eval: 51 centipawns),12... b6 13. Ng5 ,12. Na4 b6 13. Ng5 Ng4 14. h4 Bxg5 15. Bxg5 h6 16. Be7 Re8 17. Bd6 Ba6 18. Qc1 e5 19. Nc3 exd4 20. Rxd4 Ndf6 21. cxd5 cxd5 22. Qd2 Rac8 23. Nxd5 Nxd5 24. Rxd5 Bxe2 
"White achieves his object, but it will soon be apparent that Black has secured good counterchances",True," The comment suggests Black has gained an advantage, potentially indicating a flawed plan.",1. c4 f5 2. d4 Nf6 3. g3 e6 4. Bg2 Be7 5. Nf3 d5 6. O-O O-O 7. Nc3 c6 8. Qc2 Qe8 9. Bf4 Qh5 10. b3 Nbd7 11. Rad1 Kh8 12. Kh1 Rg8 13. e3 g5 14. Bc7 Ne8 15. Be5+ Nxe5 16. Nxe5 Nf6 17. f3 Bd6 18. e4,This is a game between Yudovich (as White) and Botvinnik (as Black). Last move played: White plays Pawn to e4,Advantage for White (eval: 51 centipawns),18... Rg7 19. Kg1 ,18. e4 Rg7 
Black has no objection now to liquidation in the centre,True," The comment suggests a potential tactical weakness, indicating a flawed assessment of the position.",1. c4 f5 2. d4 Nf6 3. g3 e6 4. Bg2 Be7 5. Nf3 d5 6. O-O O-O 7. Nc3 c6 8. Qc2 Qe8 9. Bf4 Qh5 10. b3 Nbd7 11. Rad1 Kh8 12. Kh1 Rg8 13. e3 g5 14. Bc7 Ne8 15. Be5+ Nxe5 16. Nxe5 Nf6 17. f3 Bd6 18. e4 Nd7 19. g4 Qe8 20. Nxd7 Bxd7,This is a game between Yudovich (as White) and Botvinnik (as Black). Last move played: Black plays Bishop takes on d7,Advantage for White (eval: 59 centipawns),21. gxf5 exf5 ,20... Bxd7 21. gxf5 exf5 22. e5 Bb4 23. cxd5 Bxc3 24. e6 Bc8 25. Qxc3 cxd5 26. Rfe1 Bxe6 27. Qc7 Rg6 28. Qe5+ Kg8 29. f4 gxf4 30. Rc1 Rc8 31. Rxc8 Qxc8 32. Bf3 Qc6 33. Qxf4 
This pawn which White wins by this move is dearly bought,True," The comment suggests the pawn is a strategic blunder, indicating a flawed plan.",1. c4 f5 2. d4 Nf6 3. g3 e6 4. Bg2 Be7 5. Nf3 d5 6. O-O O-O 7. Nc3 c6 8. Qc2 Qe8 9. Bf4 Qh5 10. b3 Nbd7 11. Rad1 Kh8 12. Kh1 Rg8 13. e3 g5 14. Bc7 Ne8 15. Be5+ Nxe5 16. Nxe5 Nf6 17. f3 Bd6 18. e4 Nd7 19. g4 Qe8 20. Nxd7 Bxd7 21. e5 Bb4 22. gxf5 exf5 23. cxd5 Bxc3 24. dxc6,This is a game between Yudovich (as White) and Botvinnik (as Black). Last move played: White plays Pawn takes on c6,Slight advantage for White (eval: 32 centipawns),24... Bxc6 ,24. dxc6 Bxc6 
Black secures control of d5 and gets a sharp Kingside attack as compensation for the lost pawn.,True,". The comment suggests Black is gaining control and launching an attack, potentially indicating a flawed opening strategy.",1. c4 f5 2. d4 Nf6 3. g3 e6 4. Bg2 Be7 5. Nf3 d5 6. O-O O-O 7. Nc3 c6 8. Qc2 Qe8 9. Bf4 Qh5 10. b3 Nbd7 11. Rad1 Kh8 12. Kh1 Rg8 13. e3 g5 14. Bc7 Ne8 15. Be5+ Nxe5 16. Nxe5 Nf6 17. f3 Bd6 18. e4 Nd7 19. g4 Qe8 20. Nxd7 Bxd7 21. e5 Bb4 22. gxf5 exf5 23. cxd5 Bxc3 24. dxc6 Bxc6 25. Qxc3 Qe6,This is a game between Yudovich (as White) and Botvinnik (as Black). Last move played: Black plays Queen to e6,Slight advantage for White (eval: 45 centipawns),26. Rf2 Rad8 ,25... Qe6 
"If the central tension is to be maintained, White must first take care to protect his c-pawn",True," The comment suggests a potential weakness in Black's development, indicating a flawed strategic plan.",1. c4 f5 2. d4 Nf6 3. g3 e6 4. Bg2 Be7 5. Nf3 d5 6. O-O O-O 7. Nc3 c6 8. Qc2 Qe8 9. Bf4 Qh5 10. b3,This is a game between Yudovich (as White) and Botvinnik (as Black). Last move played: White plays Pawn to b3,Advantage for White (eval: 73 centipawns),10... Qe8 11. Na4 Ne4 12. Ne5 Nd7 13. Nd3 Nd6 14. Rac1 g5 15. Be3 Qg6 16. f4 g4 17. Ne5 Qg7 ,10. c5 
