comment,good,reasoning,moves,context,engine_eval,engine_best_line,engine_best_alternative
Bronstein has been lured into a sharp opening.,True,". The comment suggests the opponent's opening strategy deceived Bronstein, indicating a tactical flaw.",1. e4 e6 2. d4 d5 3. Nc3 Bb4 4. e5 Ne7 5. Bd3 c5 6. dxc5 Qc7 7. Nf3 Nd7 8. O-O,"This is a game between Stein, Leonid (as White) and Bronstein, David (as Black). Last move played: White plays kingside castle",Slight advantage for White (eval: 34 centipawns),8... Bxc3 ,8. O-O Bxc3 
This subtlety has great strength.,True,". The comment suggests a perceived benefit of the move, which is unlikely to be a valid reason for a mistake.",1. e4 e6 2. d4 d5 3. Nc3 Bb4 4. e5 Ne7 5. Bd3 c5 6. dxc5 Qc7 7. Nf3 Nd7 8. O-O Bxc3 9. bxc3 Nxc5 10. Ba3 Bd7 11. Rb1 b6 12. Re1 Rc8 13. Bf1 Na4 14. Qc1 Qxc3 15. Ba6 Rc5 16. Bd3,"This is a game between Stein, Leonid (as White) and Bronstein, David (as Black). Last move played: White plays Bishop to d3",Large advantage for White (eval: 312 centipawns),16... Qxd3 17. Bxc5 Qc3 18. Bxe7 Kxe7 19. Qg5+ Kf8 20. Qd8+ Be8 21. Qd6+ Kg8 22. Qb8 Kf8 23. Qxa7 g6 24. Qb8 Kg7 25. Qd8 Rf8 26. Qf6+ Kg8 ,16. Bd3 Rc8 17. Bb4 Qc7 18. Qg5 Nc5 19. Qxg7 Rg8 20. Qxh7 Ne4 21. g3 Ba4 22. Bxe7 Kxe7 23. Qh4+ Ke8 
Black has been outplayed all over the board.,True,". The comment suggests a significant positional disadvantage, indicating a poor move that led to a loss.",1. e4 e6 2. d4 d5 3. Nc3 Bb4 4. e5 Ne7 5. Bd3 c5 6. dxc5 Qc7 7. Nf3 Nd7 8. O-O Bxc3 9. bxc3 Nxc5 10. Ba3 Bd7 11. Rb1 b6 12. Re1 Rc8 13. Bf1 Na4 14. Qc1 Qxc3 15. Ba6 Rc5 16. Bd3 Nc6 17. Rb3 Qa5 18. Qg5,"This is a game between Stein, Leonid (as White) and Bronstein, David (as Black). Last move played: White plays Queen to g5",Large advantage for White (eval: 330 centipawns),18... g6 19. Qh6 Kd8 20. Qg7 Re8 21. Qxf7 Re7 22. Qf8+ Re8 23. Qh6 Re7 24. Reb1 Nc3 25. Ra1 Kc8 26. Qf4 d4 ,18. Qg5 g6 19. Qh6 Kd8 20. Qg7 Re8 21. Qxf7 Re7 22. Qf4 Kc7 23. Rc1 Nc3 24. Ra1 Kb7 25. Qf8 Na4 26. Bb4 Nxb4 27. Qxe7 Nxd3 28. cxd3 Rc7 29. Qxh7 Nc3 
Bronstein takes the draw happily.,False,"

The comment doesn't offer any insight into why the move was considered a mistake; it's a passive statement.",1. e4 e6 2. d4 d5 3. Nc3 Bb4 4. e5 Ne7 5. Bd3 c5 6. dxc5 Qc7 7. Nf3 Nd7 8. O-O Bxc3 9. bxc3 Nxc5 10. Ba3 Bd7 11. Rb1 b6 12. Re1 Rc8 13. Bf1 Na4 14. Qc1 Qxc3 15. Ba6 Rc5 16. Bd3 Nc6 17. Rb3 Qa5 18. Qg5 Kf8 19. c3 h6 20. Qd2 d4 21. cxd4 Qxd2 22. Nxd2 Nxd4 23. Rb4 Nf5 24. Ne4 Rd5 25. Bc2 Kg8 26. Rc4 Bb5 27. Rc7 Rd7 28. Rxd7 Bxd7 29. Rd1 Bc6 30. Nd6 g6 31. Nxf5 gxf5 32. Rd6 Bb5 33. g4 fxg4 34. Rd4 Nc5 35. Rxg4+ Kf8 36. Bc1 Ke7 37. h4 Bd3 38. Bxd3 Nxd3 39. Ba3+ Ke8 40. Rc4 Rg8+ 41. Kf1 Nc5,"This is a game between Stein, Leonid (as White) and Bronstein, David (as Black). Last move played: Black plays Knight to c5",The position is equal,42. Bxc5 bxc5 43. a4 Ke7 44. Rxc5 Rg4 45. Ra5 Rxh4 46. Kg2 Kf8 47. f3 Rc4 48. Rxa7 Kg7 49. a5 Rc5 50. f4 Kg6 51. a6 Ra5 52. Kg3 Ra3+ 53. Kg2 h5 54. Kf2 h4 55. Kg2 Kh5 56. Rxf7 h3+ 57. Kh1 Ra1+ 58. Kh2 Rxa6 59. Rf6 ,41... Nc5 42. f3 Ke7 43. Bxc5+ bxc5 44. Rxc5 Rg3 45. Kf2 Rh3 46. Ra5 Rxh4 47. Rxa7+ Kf8 48. a4 Kg7 49. a5 Rd4 50. Kg3 Rd5 51. Kf4 h5 52. Ra8 Rd4+ 53. Kg3 Ra4 54. a6 Kg6 55. a7 Kf5 56. Rh8 Rxa7 57. Rxh5+ Kg6 58. Rh3 Ra1 59. Rh4 Ra6 
