comment,good,reasoning,moves,context,reformulated
Ponomariov plays 1. e4 in much the same way as any of the other top-level GMs.,False,"

The comment does not explain the mistake made by the player, as it only compares Ponomariov's move to other top-level GMs rather than addressing the specific mistake in the move.",1. e4,"This is a game between Ponomariov, Ruslan (as White) and Ivanchuk, Vassily (as Black). Last move played: White plays Pawn to e4",-
"Now, along with Pe4 there is an indication Black will place pawns on light-color squares to prevent Bf1 from ever being dangerous. White will probably have to meet 2...d5 with e4-e5 to open the d3-h7 diagonal. So, White needs a Pd4 to support Pe5.",False,"

The comment does not explain the mistake made by the player, as it assumes future actions and outcomes rather than addressing the specific move that was played.",1. e4 e6,"This is a game between Ponomariov, Ruslan (as White) and Ivanchuk, Vassily (as Black). Last move played: Black plays Pawn to e6",-
"I've had doubts about this move for a long time. It's not so easy to prove it's wrong, but by blocking Pc2 it makes d3 less hospitable for a bishop and it makes Pd4 a little weaker.",True,"

The comment accurately identifies the strategic flaws of the move, explaining how it weakens the position by blocking a potential bishop move and making a pawn move less favorable.",1. e4 e6 2. d4 d5 3. Nc3,"This is a game between Ponomariov, Ruslan (as White) and Ivanchuk, Vassily (as Black). Last move played: White plays Knight to c3"," 'Their move to Knight to c3 isn't ideal. It blocks Pc2, which isn't favorable for a bishop aiming for d3, and it slightly weakens the pawn on Pd4.'"
"Winawer Variation -- by pinning Nc3 Black keeps Nc3 awkward. It does, however, give White time for e4-e5.",False,"

The comment does not specifically address the mistake made by the player; it simply provides information about the Winawer Variation and the consequences of pinning the Black knight.",1. e4 e6 2. d4 d5 3. Nc3 Bb4,"This is a game between Ponomariov, Ruslan (as White) and Ivanchuk, Vassily (as Black). Last move played: Black plays Bishop to b4",-
"Black attacks in a most natural way, though he does leave Pg7 exposed for the moment.",False,"

The comment doesn't explain the mistake because it only describes the move's aggressive nature and potential weakness, without directly addressing whether the move was a mistake or not.",1. e4 e6 2. d4 d5 3. Nc3 Bb4 4. e5 c5,"This is a game between Ponomariov, Ruslan (as White) and Ivanchuk, Vassily (as Black). Last move played: Black plays Pawn to c5",-
This is a saving grace which helps White straighten-out his queen-side a bit.,False,"

The comment does not explain the mistake made by the player; it seems to praise the move instead.",1. e4 e6 2. d4 d5 3. Nc3 Bb4 4. e5 c5 5. a3,"This is a game between Ponomariov, Ruslan (as White) and Ivanchuk, Vassily (as Black). Last move played: White plays Pawn to a3",-
"After this it's clear White has to attack at the base of Black's pawn chain (Pf7, g7, h7) and Black can attack Pc2, Pc3 & Pd4; but both will also be keeping their eyes on the opponent's king, hoping to ensnare him in an attack.",True,"

The comment accurately explains the mistake as it highlights the weaknesses in Black's pawn structure and the potential threats White can create by attacking the base of the pawn chain.",1. e4 e6 2. d4 d5 3. Nc3 Bb4 4. e5 c5 5. a3 Bxc3+ 6. bxc3,"This is a game between Ponomariov, Ruslan (as White) and Ivanchuk, Vassily (as Black). Last move played: White plays Pawn takes on c3"," Following Ponomariov's ('White') pawn move to c3, Black ('Ivanchuk') has several weaknesses to exploit in Black's pawn chain (Pf7, g7, h7). They can challenge White's pawns on c2, c3, and d4. Both players are also focused on the opponent's king, aiming to launch attacks."
"For a time this was considered bad, but has recently made a come-back. The king seems a little out of place (unlike after ...O-O-O) , but with ...f7-f5 he's been able to slow White's attacks.",True,"

The comment explains the mistake as the player likely played a move that allowed the opponent to attack the king, which was not ideal. The move...f7-f5 seems to be an attempt to counterattack and slow White's advances, implying the mistake was in moving the king to a vulnerable position.",1. e4 e6 2. d4 d5 3. Nc3 Bb4 4. e5 c5 5. a3 Bxc3+ 6. bxc3 Ne7 7. Qg4 O-O,"This is a game between Ponomariov, Ruslan (as White) and Ivanchuk, Vassily (as Black). Last move played: Black plays kingside castle"," Black has found strength in the move f7-f5, shifting the position to a more defensive stance, which temporarily delays White's aggressive tactics."
"Black hasn't blocked-out Bd3, but has more room for his pieces to defend Kg8. The backward Pe6 is hardly of importance when a king's safety is at stake. There is even the possibility of ...e6-e5 (discovering an attack on Qg4) and then ...e5-e4 to block out Bd3.",True,"

The comment explains the mistake because it highlights the lack of defense against an attack on the king and suggests a better defensive move for the black player.",1. e4 e6 2. d4 d5 3. Nc3 Bb4 4. e5 c5 5. a3 Bxc3+ 6. bxc3 Ne7 7. Qg4 O-O 8. Bd3 f5 9. exf6 Rxf6,"This is a game between Ponomariov, Ruslan (as White) and Ivanchuk, Vassily (as Black). Last move played: Black plays Rook takes on f6"," ""Black's move isn't strategically sound as it doesn't secure the king's safety. They could consider...e6-e5 to disrupt White's plans and possibly...e5-e4, which may help in covering the threatened bishop on d3."""
threatening Qh5xh7+ or Bd3xh7+,True,"

The comment accurately identifies the mistake by pointing out that the player's move does not pose a direct threat to the opponent's king, as it lacks immediate check or capture that could potentially lead to a checkmate or a significant material advantage.",1. e4 e6 2. d4 d5 3. Nc3 Bb4 4. e5 c5 5. a3 Bxc3+ 6. bxc3 Ne7 7. Qg4 O-O 8. Bd3 f5 9. exf6 Rxf6 10. Bg5 Rf7 11. Qh5,"This is a game between Ponomariov, Ruslan (as White) and Ivanchuk, Vassily (as Black). Last move played: White plays Queen to h5"," They risked a queen trade on h5, which could expose their queen or lose material if Black counters effectively."
this secures Ph7 and may serve to provide a support for ...Ne7-f5,False,"
The comment does not explain the mistake made by the player.",1. e4 e6 2. d4 d5 3. Nc3 Bb4 4. e5 c5 5. a3 Bxc3+ 6. bxc3 Ne7 7. Qg4 O-O 8. Bd3 f5 9. exf6 Rxf6 10. Bg5 Rf7 11. Qh5 g6,"This is a game between Ponomariov, Ruslan (as White) and Ivanchuk, Vassily (as Black). Last move played: Black plays Pawn to g6",-
"Although he could have played 12. Qh4 I think he might have had it in mind to play h2-h4-h5xg6 to continue the attack on Kg8. In any event after Qd8 moves Black would have ...Ne7-f5, so Qd1 is safer.",True,"
The comment correctly explains the mistake made by the player as it highlights a potential alternative plan and the subsequent vulnerabilities in the position.",1. e4 e6 2. d4 d5 3. Nc3 Bb4 4. e5 c5 5. a3 Bxc3+ 6. bxc3 Ne7 7. Qg4 O-O 8. Bd3 f5 9. exf6 Rxf6 10. Bg5 Rf7 11. Qh5 g6 12. Qd1,"This is a game between Ponomariov, Ruslan (as White) and Ivanchuk, Vassily (as Black). Last move played: White plays Queen to d1"," 'Even though White had the option to play 12. Qh4, it seems they might have intended to continue the assault on Kg8 with h2-h4-h5xg6. Nevertheless, Qd8 moves would lead Black to play...Ne7-f5, making Qd1 a safer choice.'"
"It seems to me this is the moment for Black to define (and begin) his middle-game plan. To develop Bc8-d7 isn't much: ideally Black could now (without White's Pe5) aim for ...e6-e5 when Bc8 could develop to g4 or f5. So, 13...c4 14. Be2 Qd6 might be a good start. If one doesn't like ...c5-c4 then 13...Qd6 could still be played. White can't fight for square e5 so easily.",True,"

The comment accurately explains the mistake by suggesting a better move for Black and pointing out the weaknesses in the current move.",1. e4 e6 2. d4 d5 3. Nc3 Bb4 4. e5 c5 5. a3 Bxc3+ 6. bxc3 Ne7 7. Qg4 O-O 8. Bd3 f5 9. exf6 Rxf6 10. Bg5 Rf7 11. Qh5 g6 12. Qd1 Nbc6 13. Nf3,"This is a game between Ponomariov, Ruslan (as White) and Ivanchuk, Vassily (as Black). Last move played: White plays Knight to f3"," The move by White to initiate Knight to f3 isn't ideal for the middle game strategy. Ideally, Black should maneuver Bc8 to d7 and prepare e6-e5 without White's Pe5 interception. A sequence like 13...c4 14. Be2 followed by Black's Qd6 could be beneficial. If Black doesn't prefer...c5-c4, then Qd6 can still be an option. White's control over e5 eases the challenge of Black's positioning."
further weakening the king's position seems unnecessary.,True,"

The comment accurately explains the mistake as it highlights the unnecessary compromise of the king's position.",1. e4 e6 2. d4 d5 3. Nc3 Bb4 4. e5 c5 5. a3 Bxc3+ 6. bxc3 Ne7 7. Qg4 O-O 8. Bd3 f5 9. exf6 Rxf6 10. Bg5 Rf7 11. Qh5 g6 12. Qd1 Nbc6 13. Nf3 Qf8 14. O-O c4 15. Be2 h6,"This is a game between Ponomariov, Ruslan (as White) and Ivanchuk, Vassily (as Black). Last move played: Black plays Pawn to h6"," Black's last move weakens their king's position without any clear benefit, making it an unnecessary move."
"I'm told this is a novelty, which means all which preceded it had been played before. This amazes me because it seems to me Black's play was far from perfect.",False,"

This comment does not explain the mistake made by the player because it focuses on the novelty of the move rather than the quality or error of the move itself.",1. e4 e6 2. d4 d5 3. Nc3 Bb4 4. e5 c5 5. a3 Bxc3+ 6. bxc3 Ne7 7. Qg4 O-O 8. Bd3 f5 9. exf6 Rxf6 10. Bg5 Rf7 11. Qh5 g6 12. Qd1 Nbc6 13. Nf3 Qf8 14. O-O c4 15. Be2 h6 16. Bc1 Bd7 17. Ne1,"This is a game between Ponomariov, Ruslan (as White) and Ivanchuk, Vassily (as Black). Last move played: White plays Knight to e1",-
"While Black is moving the pawns in front of his king White aims to control f4, leaving Black's center and king weak. Those two factors (if achieved by White) could lead to a won position.",True,"

The comment correctly explains the mistake by pointing out the strategic goal of White to control f4 and weaken Black's center and king, which can lead to a winning position.",1. e4 e6 2. d4 d5 3. Nc3 Bb4 4. e5 c5 5. a3 Bxc3+ 6. bxc3 Ne7 7. Qg4 O-O 8. Bd3 f5 9. exf6 Rxf6 10. Bg5 Rf7 11. Qh5 g6 12. Qd1 Nbc6 13. Nf3 Qf8 14. O-O c4 15. Be2 h6 16. Bc1 Bd7 17. Ne1 g5 18. g3,"This is a game between Ponomariov, Ruslan (as White) and Ivanchuk, Vassily (as Black). Last move played: White plays Pawn to g3"," White's recent move aims to control f4, which could weaken Black's center and king's position. This strategy could potentially result in White securing a winning position."
"White might have found it useful to play a3-a4, but Black uses Pb5 to bind Pa3 & Pc3 which blocks Bc1 and Ra1. This isn't essential to a resolution of the pressures on Pf4, but it could contribute to the pressure on Ponomariov to find his way.",False,"

The comment does not explain the mistake made by the player as it does not directly address why the move was a mistake, but rather discusses potential strategies and future implications.",1. e4 e6 2. d4 d5 3. Nc3 Bb4 4. e5 c5 5. a3 Bxc3+ 6. bxc3 Ne7 7. Qg4 O-O 8. Bd3 f5 9. exf6 Rxf6 10. Bg5 Rf7 11. Qh5 g6 12. Qd1 Nbc6 13. Nf3 Qf8 14. O-O c4 15. Be2 h6 16. Bc1 Bd7 17. Ne1 g5 18. g3 Nf5 19. Ng2 Qg7 20. f4 Nd6 21. Qe1 b5,"This is a game between Ponomariov, Ruslan (as White) and Ivanchuk, Vassily (as Black). Last move played: Black plays Pawn to b5",-
"Ponomariov prefers to simplify the position; rightly so I think. His pieces need room to fight, before Black gets in ...e6-e5.",False,"

The comment does not explain the mistake made by the player; it only provides a general strategy preference.",1. e4 e6 2. d4 d5 3. Nc3 Bb4 4. e5 c5 5. a3 Bxc3+ 6. bxc3 Ne7 7. Qg4 O-O 8. Bd3 f5 9. exf6 Rxf6 10. Bg5 Rf7 11. Qh5 g6 12. Qd1 Nbc6 13. Nf3 Qf8 14. O-O c4 15. Be2 h6 16. Bc1 Bd7 17. Ne1 g5 18. g3 Nf5 19. Ng2 Qg7 20. f4 Nd6 21. Qe1 b5 22. fxg5,"This is a game between Ponomariov, Ruslan (as White) and Ivanchuk, Vassily (as Black). Last move played: White plays Pawn takes on g5",-
Offering Pc2 isn't a problem because Pg5 would fall too.,False,"

The comment does not explain the mistake made by the player because it does not address the immediate threat of Pc2 capturing Pg5, which resulted in the loss of a pawn.",1. e4 e6 2. d4 d5 3. Nc3 Bb4 4. e5 c5 5. a3 Bxc3+ 6. bxc3 Ne7 7. Qg4 O-O 8. Bd3 f5 9. exf6 Rxf6 10. Bg5 Rf7 11. Qh5 g6 12. Qd1 Nbc6 13. Nf3 Qf8 14. O-O c4 15. Be2 h6 16. Bc1 Bd7 17. Ne1 g5 18. g3 Nf5 19. Ng2 Qg7 20. f4 Nd6 21. Qe1 b5 22. fxg5 Rxf1+ 23. Bxf1 hxg5 24. Ne3 Rf8 25. Bg2 a5 26. Bd2 Qg6 27. Ng4,"This is a game between Ponomariov, Ruslan (as White) and Ivanchuk, Vassily (as Black). Last move played: White plays Knight to g4",-
"Since Black can't play ...e6-e5 this rook move doesn't help much. Better is to stir up trouble all across the board by breaking through White's ""strong"" dark squares with ...b5-b4.",True,"

The comment is insightful because it identifies the move's limited effectiveness and suggests a stronger alternative that challenges White's control of the dark squares.",1. e4 e6 2. d4 d5 3. Nc3 Bb4 4. e5 c5 5. a3 Bxc3+ 6. bxc3 Ne7 7. Qg4 O-O 8. Bd3 f5 9. exf6 Rxf6 10. Bg5 Rf7 11. Qh5 g6 12. Qd1 Nbc6 13. Nf3 Qf8 14. O-O c4 15. Be2 h6 16. Bc1 Bd7 17. Ne1 g5 18. g3 Nf5 19. Ng2 Qg7 20. f4 Nd6 21. Qe1 b5 22. fxg5 Rxf1+ 23. Bxf1 hxg5 24. Ne3 Rf8 25. Bg2 a5 26. Bd2 Qg6 27. Ng4 Rf5,"This is a game between Ponomariov, Ruslan (as White) and Ivanchuk, Vassily (as Black). Last move played: Black plays Rook to f5"," ""The move by Black does not significantly improve their position. A more effective strategy would involve challenging White's control over the dark squares by playing...b5-b4."""
"Now it's White who controls b5! An invasion by the White rook could help win the game. One curious thing about this move is that, despite it being White who is forcing matters, Black can benefit to some extent by capturing the gambit pawn and advancing it.",True,"

The comment accurately explains the mistake made by the player, as it highlights the strategic implications of the move and how it affects both sides of the game.",1. e4 e6 2. d4 d5 3. Nc3 Bb4 4. e5 c5 5. a3 Bxc3+ 6. bxc3 Ne7 7. Qg4 O-O 8. Bd3 f5 9. exf6 Rxf6 10. Bg5 Rf7 11. Qh5 g6 12. Qd1 Nbc6 13. Nf3 Qf8 14. O-O c4 15. Be2 h6 16. Bc1 Bd7 17. Ne1 g5 18. g3 Nf5 19. Ng2 Qg7 20. f4 Nd6 21. Qe1 b5 22. fxg5 Rxf1+ 23. Bxf1 hxg5 24. Ne3 Rf8 25. Bg2 a5 26. Bd2 Qg6 27. Ng4 Rf5 28. Qe3 Kg7 29. Rb1 Kh7 30. a4,"This is a game between Ponomariov, Ruslan (as White) and Ivanchuk, Vassily (as Black). Last move played: White plays Pawn to a4"," 'Attempting to dominate via b5, White's move, is a misstep. Although it might seem aggressive, it's a trap waiting to happen. Black can counter effectively by accepting the pawn and pushing it forward, turning the tables.'"
"It's not so easy to see, but this backfires on Black. Had it worked to achieve a victory or draw then we might have to reconsider the notation (""?!"") . Black is trying to achieve, despite unorthodox means, the primary offensive plan -- to bash White's queen-side and, since White's king remains safe, to advance a pawn to promotion. Considering the alternatives this seems a reasonable try; and by doing so he distracts White, to some extent, from his king-side plans.",True,"

The comment explains the mistake as an attempt by Black to disrupt White's king-side plans while pursuing a pawn promotion, which aligns with the description of the move being an unorthodox but reasonable strategy to distract White.",1. e4 e6 2. d4 d5 3. Nc3 Bb4 4. e5 c5 5. a3 Bxc3+ 6. bxc3 Ne7 7. Qg4 O-O 8. Bd3 f5 9. exf6 Rxf6 10. Bg5 Rf7 11. Qh5 g6 12. Qd1 Nbc6 13. Nf3 Qf8 14. O-O c4 15. Be2 h6 16. Bc1 Bd7 17. Ne1 g5 18. g3 Nf5 19. Ng2 Qg7 20. f4 Nd6 21. Qe1 b5 22. fxg5 Rxf1+ 23. Bxf1 hxg5 24. Ne3 Rf8 25. Bg2 a5 26. Bd2 Qg6 27. Ng4 Rf5 28. Qe3 Kg7 29. Rb1 Kh7 30. a4 bxa4 31. Bc1 Rf7 32. Ba3 Qxc2,"This is a game between Ponomariov, Ruslan (as White) and Ivanchuk, Vassily (as Black). Last move played: Black plays Queen takes on c2"," Black's attempt to pressure White's queen-side backfires, misguiding them from their king-side strategy. This move doesn't secure a win or a draw, but it's understandable as Black aims to advance a pawn for promotion, distracting White's focus."
White threatens Nd6 and to move Ng4-e5.,True,"

The comment accurately explains the mistake made by the player, as it identifies the potential threat to a knight and suggests a capturing move for another piece.",1. e4 e6 2. d4 d5 3. Nc3 Bb4 4. e5 c5 5. a3 Bxc3+ 6. bxc3 Ne7 7. Qg4 O-O 8. Bd3 f5 9. exf6 Rxf6 10. Bg5 Rf7 11. Qh5 g6 12. Qd1 Nbc6 13. Nf3 Qf8 14. O-O c4 15. Be2 h6 16. Bc1 Bd7 17. Ne1 g5 18. g3 Nf5 19. Ng2 Qg7 20. f4 Nd6 21. Qe1 b5 22. fxg5 Rxf1+ 23. Bxf1 hxg5 24. Ne3 Rf8 25. Bg2 a5 26. Bd2 Qg6 27. Ng4 Rf5 28. Qe3 Kg7 29. Rb1 Kh7 30. a4 bxa4 31. Bc1 Rf7 32. Ba3 Qxc2 33. Rc1 Qf5 34. Bh3,"This is a game between Ponomariov, Ruslan (as White) and Ivanchuk, Vassily (as Black). Last move played: White plays Bishop to h3"," In his last move, White attempted an aggressive Bishop maneuver to h3 and a Nd6 threat, as well as a forthcoming Ng4-e5 advance. This strategy seems overly ambitious given the current board state and might expose White's position to potential counterattacks."
"Black's combination allows the ""bad"" Bd7 to be traded-off, so he has Rf2 and Ne4 activated, but at a cost. The question now is whether White can neutralize Ne4 & Rf2. To that end Nd7-c5 is in the offing. There may also be an opportunity for Bh3xe6.",False,"

The comment does not directly address the mistake made by the player but rather discusses potential responses and strategies for the opponent.",1. e4 e6 2. d4 d5 3. Nc3 Bb4 4. e5 c5 5. a3 Bxc3+ 6. bxc3 Ne7 7. Qg4 O-O 8. Bd3 f5 9. exf6 Rxf6 10. Bg5 Rf7 11. Qh5 g6 12. Qd1 Nbc6 13. Nf3 Qf8 14. O-O c4 15. Be2 h6 16. Bc1 Bd7 17. Ne1 g5 18. g3 Nf5 19. Ng2 Qg7 20. f4 Nd6 21. Qe1 b5 22. fxg5 Rxf1+ 23. Bxf1 hxg5 24. Ne3 Rf8 25. Bg2 a5 26. Bd2 Qg6 27. Ng4 Rf5 28. Qe3 Kg7 29. Rb1 Kh7 30. a4 bxa4 31. Bc1 Rf7 32. Ba3 Qxc2 33. Rc1 Qf5 34. Bh3 Ne4 35. Ne5 Qf2+ 36. Qxf2 Rxf2 37. Nxd7,"This is a game between Ponomariov, Ruslan (as White) and Ivanchuk, Vassily (as Black). Last move played: White plays Knight takes on d7",-
"Black needs one or two very valuable tempi for his plan to advance Pa3. What can White do in the meantime, nothing except capture Pe6; unless Black puts his king in a dangerous spot!",True,"

The comment accurately explains the mistake by highlighting the urgency for Black to create valuable tempi to activate his plan, and it also presents a potential counter-strategy for White.",1. e4 e6 2. d4 d5 3. Nc3 Bb4 4. e5 c5 5. a3 Bxc3+ 6. bxc3 Ne7 7. Qg4 O-O 8. Bd3 f5 9. exf6 Rxf6 10. Bg5 Rf7 11. Qh5 g6 12. Qd1 Nbc6 13. Nf3 Qf8 14. O-O c4 15. Be2 h6 16. Bc1 Bd7 17. Ne1 g5 18. g3 Nf5 19. Ng2 Qg7 20. f4 Nd6 21. Qe1 b5 22. fxg5 Rxf1+ 23. Bxf1 hxg5 24. Ne3 Rf8 25. Bg2 a5 26. Bd2 Qg6 27. Ng4 Rf5 28. Qe3 Kg7 29. Rb1 Kh7 30. a4 bxa4 31. Bc1 Rf7 32. Ba3 Qxc2 33. Rc1 Qf5 34. Bh3 Ne4 35. Ne5 Qf2+ 36. Qxf2 Rxf2 37. Nxd7 Ra2 38. Bc5 Nd2 39. Bg2 a3 40. Nf8+ Kh6,"This is a game between Ponomariov, Ruslan (as White) and Ivanchuk, Vassily (as Black). Last move played: Black plays King to h6"," Black's last move was potentially tactical, aiming to advance the pawn to pa3. However, this move doesn't seem to serve their strategy well. White has a couple of options that might be more advantageous in the current position. One is to capture the pawn on e6, potentially opening up lines for their pieces. If Black's king moves to a vulnerable position as a result, White could exploit this to gain material or positional advantage."
"White is looking for moves which capture material AND check Black's king. This is to gain time for clearing the board of Black pawns. He'll probably have to gambit Bc5xa3 to get rid of that one. Bg2 is purely for defensive work at the moment, but if Pe6 disappears Bxd5 could also become useful.",True,"

The comment effectively explains the mistake by pointing out that White is trying to capture material and check the Black king, which indicates a tactical approach to gain time and clear the board of Black's pawns. It also highlights the specific move Bg2, which is defensive, and suggests the potential usefulness of Bxd5 if Black's Pe6 is no longer on the board.",1. e4 e6 2. d4 d5 3. Nc3 Bb4 4. e5 c5 5. a3 Bxc3+ 6. bxc3 Ne7 7. Qg4 O-O 8. Bd3 f5 9. exf6 Rxf6 10. Bg5 Rf7 11. Qh5 g6 12. Qd1 Nbc6 13. Nf3 Qf8 14. O-O c4 15. Be2 h6 16. Bc1 Bd7 17. Ne1 g5 18. g3 Nf5 19. Ng2 Qg7 20. f4 Nd6 21. Qe1 b5 22. fxg5 Rxf1+ 23. Bxf1 hxg5 24. Ne3 Rf8 25. Bg2 a5 26. Bd2 Qg6 27. Ng4 Rf5 28. Qe3 Kg7 29. Rb1 Kh7 30. a4 bxa4 31. Bc1 Rf7 32. Ba3 Qxc2 33. Rc1 Qf5 34. Bh3 Ne4 35. Ne5 Qf2+ 36. Qxf2 Rxf2 37. Nxd7 Ra2 38. Bc5 Nd2 39. Bg2 a3 40. Nf8+ Kh6 41. Re1,"This is a game between Ponomariov, Ruslan (as White) and Ivanchuk, Vassily (as Black). Last move played: White plays Rook to e1"," White's strategy focuses on capturing material and checking Black's king. They aim to clear Black's pawns from the board. White might consider gambiting the bishop to B5 to resolve the issue with that pawn. Currently, the bishop on g2 is for defense. However, if Black's pawn on e6 moves away, White could potentially capture it with their bishop on d5."
moving off a square where Black's Nc6 could sacrifice itself desperado-style,True,"

The comment correctly identifies a potential mistake by the player, suggesting that the move could have allowed Black to sacrifice the knight, which would have been a significant strategic error.",1. e4 e6 2. d4 d5 3. Nc3 Bb4 4. e5 c5 5. a3 Bxc3+ 6. bxc3 Ne7 7. Qg4 O-O 8. Bd3 f5 9. exf6 Rxf6 10. Bg5 Rf7 11. Qh5 g6 12. Qd1 Nbc6 13. Nf3 Qf8 14. O-O c4 15. Be2 h6 16. Bc1 Bd7 17. Ne1 g5 18. g3 Nf5 19. Ng2 Qg7 20. f4 Nd6 21. Qe1 b5 22. fxg5 Rxf1+ 23. Bxf1 hxg5 24. Ne3 Rf8 25. Bg2 a5 26. Bd2 Qg6 27. Ng4 Rf5 28. Qe3 Kg7 29. Rb1 Kh7 30. a4 bxa4 31. Bc1 Rf7 32. Ba3 Qxc2 33. Rc1 Qf5 34. Bh3 Ne4 35. Ne5 Qf2+ 36. Qxf2 Rxf2 37. Nxd7 Ra2 38. Bc5 Nd2 39. Bg2 a3 40. Nf8+ Kh6 41. Re1 e5 42. dxe5 g4 43. e6,"This is a game between Ponomariov, Ruslan (as White) and Ivanchuk, Vassily (as Black). Last move played: White plays Pawn to e6"," White moved their pawn to e6, which was a poor choice because it left a square vulnerable for Black's knight to sacrifice itself, setting up a sharp tactical position."
"It looks complicated enough to continue, though White clearly has the upper hand with Pa3 already attacked and Pe6 prepared to advance. White only needs to gobble up a bunch of pawns, so his knight & rook could win an ending without being distracted by Black pawns on the queen-side.",True,"

The comment explains the mistake made by the player because it points out the vulnerability in White's position due to the attacked Pa3 and the prepared Pe6, indicating that White's position is compromised and could lead to a loss if the pawns are not protected properly.",1. e4 e6 2. d4 d5 3. Nc3 Bb4 4. e5 c5 5. a3 Bxc3+ 6. bxc3 Ne7 7. Qg4 O-O 8. Bd3 f5 9. exf6 Rxf6 10. Bg5 Rf7 11. Qh5 g6 12. Qd1 Nbc6 13. Nf3 Qf8 14. O-O c4 15. Be2 h6 16. Bc1 Bd7 17. Ne1 g5 18. g3 Nf5 19. Ng2 Qg7 20. f4 Nd6 21. Qe1 b5 22. fxg5 Rxf1+ 23. Bxf1 hxg5 24. Ne3 Rf8 25. Bg2 a5 26. Bd2 Qg6 27. Ng4 Rf5 28. Qe3 Kg7 29. Rb1 Kh7 30. a4 bxa4 31. Bc1 Rf7 32. Ba3 Qxc2 33. Rc1 Qf5 34. Bh3 Ne4 35. Ne5 Qf2+ 36. Qxf2 Rxf2 37. Nxd7 Ra2 38. Bc5 Nd2 39. Bg2 a3 40. Nf8+ Kh6 41. Re1 e5 42. dxe5 g4 43. e6 Nf3+ 44. Bxf3 gxf3 45. Kf1,"This is a game between Ponomariov, Ruslan (as White) and Ivanchuk, Vassily (as Black). Last move played: White plays King to f1"," They might think it's complicated, but White, by playing King to f1, is overly aggressive and risks unnecessary exposure. It's not essential for them to capture many pawns; instead, focusing on a strong development with the knight and rook would be safer, especially with Black keeping pressure on the queen side."
