comment,good,reasoning,moves,context,engine_eval,engine_best_line,engine_best_alternative
"The Maroczy bind which gives White control of the center after which Black must grovel, trying to find some counterplay.",True," The comment describes a specific tactical sequence that led to a blunder, suggesting a flawed strategic decision.",1. e4 c5 2. Nf3 Nc6 3. d4 cxd4 4. Nxd4 g6 5. c4,This is a game between Alekhine (as White) and Saemisch (as Black). Last move played: White plays Pawn to c4,Slight advantage for White (eval: 45 centipawns),5... Nf6 6. Nc3 ,5. c4 Nf6 
6.Be3 Developing a piece while protecting the knight is more thematic.,True," The comment suggests a potential flaw in the move's strategic planning, indicating a misjudgment of the resulting position.",1. e4 c5 2. Nf3 Nc6 3. d4 cxd4 4. Nxd4 g6 5. c4 Bg7 6. Nb3,This is a game between Alekhine (as White) and Saemisch (as Black). Last move played: White plays Knight to b3,The position is equal,6... d6 7. Be2 ,6. Be3 Nf6 7. Nc3 d6 8. Be2 O-O 9. O-O Nxd4 10. Bxd4 Bd7 11. Qd3 a5 12. b3 Bc6 13. Rad1 Nd7 14. Bxg7 Kxg7 15. h4 Qb6 16. Nd5 Bxd5 17. exd5 Ne5 18. Qc3 Qb4 19. Qb2 f6 20. f4 
Black's light squared bishop turns out to be a target on the e6 square. Better was to castle. 8...O-O 9.O-O Bd7 10.Be3 would yield White a space advantage due to his pawns at c4 and e4.,True," The comment identifies a specific tactical weakness and suggests a better alternative move, indicating a flawed assessment of the position.",1. e4 c5 2. Nf3 Nc6 3. d4 cxd4 4. Nxd4 g6 5. c4 Bg7 6. Nb3 Nf6 7. Nc3 d6 8. Be2 Be6,This is a game between Alekhine (as White) and Saemisch (as Black). Last move played: Black plays Bishop to e6,The position is equal,9. O-O ,8... a5 
This strange looking move is directed against White playing 10.f4.,True," Yes, the comment identifies a specific tactical threat, indicating a potential mistake.",1. e4 c5 2. Nf3 Nc6 3. d4 cxd4 4. Nxd4 g6 5. c4 Bg7 6. Nb3 Nf6 7. Nc3 d6 8. Be2 Be6 9. O-O h5,This is a game between Alekhine (as White) and Saemisch (as Black). Last move played: Black plays Pawn to h5,Advantage for White (eval: 55 centipawns),10. f4 ,9... O-O 
White should just have continued with his development.,True,", The comment suggests a missed opportunity for further development, indicating a flawed strategic choice.",1. e4 c5 2. Nf3 Nc6 3. d4 cxd4 4. Nxd4 g6 5. c4 Bg7 6. Nb3 Nf6 7. Nc3 d6 8. Be2 Be6 9. O-O h5 10. c5,This is a game between Alekhine (as White) and Saemisch (as Black). Last move played: White plays Pawn to c5,Advantage for Black (eval: -51 centipawns),10... d5 11. Nd4 ,10. f4 
Black retur ns the favor as after the exchange of queens his king will remain in the center and subject to attack. Better was 10...d5 11.Nd4 Nxd4 12.Qxd4 dxe4 13. Qb4 Qc8 14.Nxe4 Nxe4 15.Qxe4 O-O when Black's active bishops compensate for White's queenside,True," The comment offers a potential explanation for the mistake, suggesting the black bishops' activity compensates for the queenside attack.",1. e4 c5 2. Nf3 Nc6 3. d4 cxd4 4. Nxd4 g6 5. c4 Bg7 6. Nb3 Nf6 7. Nc3 d6 8. Be2 Be6 9. O-O h5 10. c5 dxc5,This is a game between Alekhine (as White) and Saemisch (as Black). Last move played: Black plays Pawn takes on c5,Advantage for White (eval: 52 centipawns),11. Nxc5 ,10... d5 11. Nd4 
White wins material since Black can't defend his f-pawn.,True," The comment points to a fundamental flaw in Black's defense, indicating a loss of material.",1. e4 c5 2. Nf3 Nc6 3. d4 cxd4 4. Nxd4 g6 5. c4 Bg7 6. Nb3 Nf6 7. Nc3 d6 8. Be2 Be6 9. O-O h5 10. c5 dxc5 11. Nxc5 Bc8 12. Qxd8+ Kxd8 13. Rd1+ Nd7 14. Bc4,This is a game between Alekhine (as White) and Saemisch (as Black). Last move played: White plays Bishop to c4,Large advantage for White (eval: 106 centipawns),14... Ke8 15. Nd5 ,14. N5a4 Ke8 15. Be3 Bh6 16. f4 e5 17. g3 Nf8 18. Nc5 Ne6 19. Nd5 Rb8 20. Nxe6 fxe6 21. Nc7+ Kf7 22. b4 exf4 23. gxf4 e5 24. Bc4+ Kg7 25. b5 Na5 26. Bd5 b6 27. Rf1 Bg4 28. Rac1 Rhc8 29. h4 
White has a won game due to his extra pawn and Black's lagging development.,True," The comment suggests a logical error in the opponent's position, implying a strategic advantage due to pawn structure.",1. e4 c5 2. Nf3 Nc6 3. d4 cxd4 4. Nxd4 g6 5. c4 Bg7 6. Nb3 Nf6 7. Nc3 d6 8. Be2 Be6 9. O-O h5 10. c5 dxc5 11. Nxc5 Bc8 12. Qxd8+ Kxd8 13. Rd1+ Nd7 14. Bc4 Bxc3 15. Bxf7 Kc7 16. Ne6+ Kb8 17. bxc3,This is a game between Alekhine (as White) and Saemisch (as Black). Last move played: White plays Pawn takes on c3,Large advantage for White (eval: 419 centipawns),17... b6 18. Nd4 Nd8 19. Bxg6 Kb7 20. e5 Nc5 21. h4 Nde6 22. Be3 Kc7 23. Kh2 Bd7 24. f3 Rag8 25. Bc2 Rf8 26. a4 a5 27. Rd2 Rhg8 28. Rf1 Nf4 29. g3 Nd5 30. Bg5 ,17. bxc3 b6 18. Nd4 Nd8 19. Bxg6 Nf8 20. Bf5 e6 21. Bh3 e5 22. Bxc8 Kxc8 23. Nf5 h4 24. Rd5 Nf7 25. c4 Kc7 
Black resigned due to the pin on his knight which will cost him further material.,True," The comment clearly indicates a material loss due to a pin, suggesting a flawed strategic decision.",1. e4 c5 2. Nf3 Nc6 3. d4 cxd4 4. Nxd4 g6 5. c4 Bg7 6. Nb3 Nf6 7. Nc3 d6 8. Be2 Be6 9. O-O h5 10. c5 dxc5 11. Nxc5 Bc8 12. Qxd8+ Kxd8 13. Rd1+ Nd7 14. Bc4 Bxc3 15. Bxf7 Kc7 16. Ne6+ Kb8 17. bxc3 Nde5 18. Bf4 Bxe6 19. Bxe6 Rf8 20. Bg3,This is a game between Alekhine (as White) and Saemisch (as Black). Last move played: White plays Bishop to g3,Large advantage for White (eval: 512 centipawns),20... g5 21. Rd5 Rf4 22. Bxf4 gxf4 23. Bd7 Nxd7 24. Rxd7 Kc8 25. Rd5 h4 26. Rh5 Kd7 27. Rxh4 f3 28. gxf3 Rd8 29. f4 ,20. Bg3 h4 21. Bxh4 a6 22. Bg3 Ka7 23. f4 Nf7 24. Bf2+ Kb8 25. Rd7 Rd8 26. Rad1 Nd6 27. Rxd8+ Nxd8 28. Bd5 Kc7 29. c4 Nc6 30. Bg3 Rd8 31. f5 gxf5 32. exf5 b5 33. cxb5 axb5 
