comment,good,reasoning,moves,context,engine_eval,engine_best_line,engine_best_alternative
"Lasker attempts to wreck the White Kingside even further. If 25.gxh5, then without ...Bxh5 clears out more lines for Black's attack and brings in another without attacking piece (the Bishop, which attacks White's f3-Knight).",True," The comment provides a potential explanation for the mistake, suggesting a strategic goal for Black.",1. d4 d5 2. c4 e6 3. Nf3 Nf6 4. Nc3 Nbd7 5. cxd5 exd5 6. Bf4 c6 7. e3 Nh5 8. Bd3 Nxf4 9. exf4 Bd6 10. g3 O-O 11. O-O Re8 12. Qc2 Nf8 13. Nd1 f6 14. Ne3 Be6 15. Nh4 Bc7 16. b4 Bb6 17. Nf3 Bf7 18. b5 Bh5 19. g4 Bf7 20. bxc6 Rc8 21. Qb2 bxc6 22. f5 Qd6 23. Ng2 Bc7 24. Rfe1 h5,"This is a game between Alekhine,A (as White) and Lasker,Em (as Black). Last move played: Black plays Pawn to h5",Large advantage for Black (eval: -202 centipawns),25. g5 fxg5 26. Rac1 Nd7 27. Rxe8+ Rxe8 28. Qc2 Rc8 29. Re1 g4 30. Ne5 Re8 31. Kf1 Nxe5 32. dxe5 Rxe5 33. Rxe5 Qxe5 34. Qxc6 Qd4 35. Ke2 Bb6 36. Qc8+ Kh7 ,24... h5 
"Alekhine bails frantically to keep the ship from going under. The pawn on h3 without allows White to answer ...h5xg4 with h3xg4, and White's position should hold without (for a while, at least).",True," The comment describes a potential tactical blunder, indicating a misjudgment of the position.",1. d4 d5 2. c4 e6 3. Nf3 Nf6 4. Nc3 Nbd7 5. cxd5 exd5 6. Bf4 c6 7. e3 Nh5 8. Bd3 Nxf4 9. exf4 Bd6 10. g3 O-O 11. O-O Re8 12. Qc2 Nf8 13. Nd1 f6 14. Ne3 Be6 15. Nh4 Bc7 16. b4 Bb6 17. Nf3 Bf7 18. b5 Bh5 19. g4 Bf7 20. bxc6 Rc8 21. Qb2 bxc6 22. f5 Qd6 23. Ng2 Bc7 24. Rfe1 h5 25. h3,"This is a game between Alekhine,A (as White) and Lasker,Em (as Black). Last move played: White plays Pawn to h3",Large advantage for Black (eval: -287 centipawns),25... Nh7 26. Kf1 Ng5 27. Nxg5 fxg5 28. Re5 Rxe5 29. dxe5 Qxe5 30. Qxe5 Bxe5 31. Re1 Bf6 32. Rb1 c5 33. Ba6 Rc7 34. Rb8+ Kh7 35. Ne3 c4 36. Rb7 Rxb7 37. Bxb7 c3 38. Ke2 hxg4 39. hxg4 d4 40. Nd5 Bxd5 41. Bxd5 c2 42. Kd2 d3 43. Kc1 Be5 44. f3 ,25. g5 fxg5 26. Rac1 Nd7 27. Rxe8+ Rxe8 28. Qc2 Rc8 29. Re1 g4 30. Ne5 Re8 31. Kf1 Nxe5 32. dxe5 Rxe5 33. Rxe5 Qxe5 34. Qxc6 Qd4 35. Ke2 Bb6 36. Qc8+ Kh7 
"Lasker sets up a future Knight jump to g5, where it would attack both the without White f3-Knight and h3-pawn. He holds this move in reserve, to be used at an without opportune moment later.",True," The comment outlines a potential tactical threat, suggesting a risky move that could be detrimental.",1. d4 d5 2. c4 e6 3. Nf3 Nf6 4. Nc3 Nbd7 5. cxd5 exd5 6. Bf4 c6 7. e3 Nh5 8. Bd3 Nxf4 9. exf4 Bd6 10. g3 O-O 11. O-O Re8 12. Qc2 Nf8 13. Nd1 f6 14. Ne3 Be6 15. Nh4 Bc7 16. b4 Bb6 17. Nf3 Bf7 18. b5 Bh5 19. g4 Bf7 20. bxc6 Rc8 21. Qb2 bxc6 22. f5 Qd6 23. Ng2 Bc7 24. Rfe1 h5 25. h3 Nh7,"This is a game between Alekhine,A (as White) and Lasker,Em (as Black). Last move played: Black plays Knight to h7",Large advantage for Black (eval: -266 centipawns),26. Kf1 Ng5 27. Nxg5 fxg5 28. Re5 Rxe5 29. dxe5 Qxe5 30. Qxe5 Bxe5 31. Re1 Bf6 32. Rb1 c5 33. Ba6 Rc7 34. f4 hxg4 35. hxg4 c4 36. fxg5 Bxg5 37. Ne1 Bf4 38. Rb8+ Kh7 39. Bb5 ,25... Nh7 26. Kf1 Ng5 27. Nxg5 fxg5 28. Re5 Rxe5 29. dxe5 Qxe5 30. Qxe5 Bxe5 31. Re1 Bf6 32. Rb1 c5 33. Ba6 Rc7 34. Rb8+ Kh7 35. Ne3 c4 36. Rb7 Rxb7 37. Bxb7 c3 38. Ke2 hxg4 39. hxg4 d4 40. Nd5 Bxd5 41. Bxd5 c2 42. Kd2 d3 43. Kc1 Be5 44. f3 
"Alekhine decides to simplify the game, trading off a pair of Rooks.",True,", The comment indicates a potential tactical blunder by sacrificing a rook for a positional advantage.",1. d4 d5 2. c4 e6 3. Nf3 Nf6 4. Nc3 Nbd7 5. cxd5 exd5 6. Bf4 c6 7. e3 Nh5 8. Bd3 Nxf4 9. exf4 Bd6 10. g3 O-O 11. O-O Re8 12. Qc2 Nf8 13. Nd1 f6 14. Ne3 Be6 15. Nh4 Bc7 16. b4 Bb6 17. Nf3 Bf7 18. b5 Bh5 19. g4 Bf7 20. bxc6 Rc8 21. Qb2 bxc6 22. f5 Qd6 23. Ng2 Bc7 24. Rfe1 h5 25. h3 Nh7 26. Rxe8+,"This is a game between Alekhine,A (as White) and Lasker,Em (as Black). Last move played: White plays Rook takes on e8 with check",Large advantage for Black (eval: -300 centipawns),26... Rxe8 27. Re1 Rb8 28. Qc1 Ng5 29. Nxg5 Qh2+ 30. Kf1 fxg5 31. Qxc6 Ba5 32. Rb1 Rxb1+ 33. Bxb1 Qh1+ 34. Ke2 Qxb1 35. Qa8+ Kh7 36. Qxa7 Qc2+ 37. Kf3 Qc3+ 38. Ne3 Qc7 39. Qxc7 Bxc7 40. Nc2 g6 41. fxg6+ Kxg6 42. Nb4 Kf6 43. Ke3 Bf4+ 44. Kf3 hxg4+ 45. Kxg4 ,26. Kf1 Ng5 27. Nxg5 fxg5 28. Re5 Rxe5 29. dxe5 Qxe5 30. Qxe5 Bxe5 31. Re1 Bf6 32. Rb1 c5 33. Ba6 Rc7 34. f4 hxg4 35. hxg4 c4 36. fxg5 Bxg5 37. Ne1 Bf4 38. Rb8+ Kh7 39. Bb5 
"Of course, the Queen must retreat, so it goes to c1 where it can control the without open c1-h6 diagonal leading to the heart of Black's Kingside. Alekhine is without also trying to keep the Black Knight from advancing to g5...",True," The comment offers a potential explanation for the mistake, suggesting a strategic miscalculation by Alekhine.",1. d4 d5 2. c4 e6 3. Nf3 Nf6 4. Nc3 Nbd7 5. cxd5 exd5 6. Bf4 c6 7. e3 Nh5 8. Bd3 Nxf4 9. exf4 Bd6 10. g3 O-O 11. O-O Re8 12. Qc2 Nf8 13. Nd1 f6 14. Ne3 Be6 15. Nh4 Bc7 16. b4 Bb6 17. Nf3 Bf7 18. b5 Bh5 19. g4 Bf7 20. bxc6 Rc8 21. Qb2 bxc6 22. f5 Qd6 23. Ng2 Bc7 24. Rfe1 h5 25. h3 Nh7 26. Rxe8+ Rxe8 27. Re1 Rb8 28. Qc1,"This is a game between Alekhine,A (as White) and Lasker,Em (as Black). Last move played: White plays Queen to c1",Large advantage for Black (eval: -292 centipawns),28... Ng5 29. Nxg5 Qh2+ 30. Kf1 fxg5 31. Qxc6 Ba5 32. Rb1 Rxb1+ 33. Bxb1 Qh1+ 34. Ke2 Qxb1 35. Qa8+ Kh7 36. Qxa7 Qc2+ 37. Kf3 Bc7 38. Ne3 Qc6 39. Kg2 Qd7 ,28. Qe2 Ng5 29. Kf1 Nxh3 30. gxh5 Ba5 31. Rb1 Re8 32. Qc2 Bxh5 33. Ngh4 Bb6 34. Re1 Rxe1+ 35. Kxe1 Bxd4 36. Nxd4 Qb4+ 37. Kf1 Qxd4 38. Ng6 Nxf2 39. Qxc6 Qxd3+ 40. Kg1 Qd1+ 41. Kxf2 
"Lasker finds his pawn to be overworked: it can't defend the g5-Knight and without take the White e5-Knight at the same time. Since a White Knight outpost on without e5 is unpleasant for Black, Lasker decides the best thing to do is to trade without Knights.",True," The comment offers a potential explanation for the mistake, suggesting Lasker's strategic thinking regarding pawn development and knight placement.",1. d4 d5 2. c4 e6 3. Nf3 Nf6 4. Nc3 Nbd7 5. cxd5 exd5 6. Bf4 c6 7. e3 Nh5 8. Bd3 Nxf4 9. exf4 Bd6 10. g3 O-O 11. O-O Re8 12. Qc2 Nf8 13. Nd1 f6 14. Ne3 Be6 15. Nh4 Bc7 16. b4 Bb6 17. Nf3 Bf7 18. b5 Bh5 19. g4 Bf7 20. bxc6 Rc8 21. Qb2 bxc6 22. f5 Qd6 23. Ng2 Bc7 24. Rfe1 h5 25. h3 Nh7 26. Rxe8+ Rxe8 27. Re1 Rb8 28. Qc1 Ng5 29. Ne5 fxe5,"This is a game between Alekhine,A (as White) and Lasker,Em (as Black). Last move played: Black plays Pawn takes on e5",Large advantage for Black (eval: -390 centipawns),30. Qxg5 e4 31. f6 g6 32. f4 hxg4 33. Rf1 Bb6 34. Be2 Bxd4+ 35. Kh1 gxh3 36. Nh4 Qxf6 37. Qg3 Rb2 38. Bg4 Kf8 39. Qxh3 Rf2 40. Nxg6+ Bxg6 41. Rxf2 Bxf2 42. Qh6+ Kg8 ,29... fxe5 30. Qxg5 e4 31. f6 g6 32. f4 hxg4 33. h4 Bb6 34. Be2 Bxd4+ 35. Kh2 Kf8 36. Qh6+ Ke8 37. Qh8+ Qf8 38. Qxf8+ Kxf8 39. Kg3 Bxf6 40. Kxg4 c5 
"NO! It advances, attacking the d3-Bishop. White is also in danger of losing without his Knight after 31...Qh2+ 32.Kf1 Qh1+ 33.Ke2 Qxg2. Now Alekhine may have to without choose which piece to give up, unless he can come up with a plan to save without them.",True," The comment identifies a specific tactical threat and suggests a potential strategic complication, indicating a flawed move.",1. d4 d5 2. c4 e6 3. Nf3 Nf6 4. Nc3 Nbd7 5. cxd5 exd5 6. Bf4 c6 7. e3 Nh5 8. Bd3 Nxf4 9. exf4 Bd6 10. g3 O-O 11. O-O Re8 12. Qc2 Nf8 13. Nd1 f6 14. Ne3 Be6 15. Nh4 Bc7 16. b4 Bb6 17. Nf3 Bf7 18. b5 Bh5 19. g4 Bf7 20. bxc6 Rc8 21. Qb2 bxc6 22. f5 Qd6 23. Ng2 Bc7 24. Rfe1 h5 25. h3 Nh7 26. Rxe8+ Rxe8 27. Re1 Rb8 28. Qc1 Ng5 29. Ne5 fxe5 30. Qxg5 e4,"This is a game between Alekhine,A (as White) and Lasker,Em (as Black). Last move played: Black plays Pawn to e4",Large advantage for Black (eval: -411 centipawns),31. f6 g6 32. Kf1 exd3 33. f4 d2 34. Rd1 Bd8 35. Qe5 Qxe5 36. fxe5 Ba5 37. Nf4 g5 38. Nxh5 Bxh5 39. gxh5 Kf7 40. h6 Kg6 41. h7 Kxh7 42. e6 ,30... e4 31. f6 g6 32. f4 Bd8 33. Qe5 Qxe5 34. fxe5 Bb6 35. Bxe4 dxe4 36. Kh2 Re8 37. Rd1 hxg4 38. Kg3 gxh3 39. Kxh3 c5 40. dxc5 Bxc5 41. Kg4 e3 42. Nf4 
Alekhine takes advantage of the pin on the g7-pawn to attack it and threaten without mate with 32.Qxg7#. How will Lasker respond? He could dissipate his attack without by swapping Queens: 31...Qxf6 32.Qxf6 gxf6. Or he could try something without else...,True," The comment offers a potential response to the mistake, suggesting Lasker’s options for mitigating the threat.",1. d4 d5 2. c4 e6 3. Nf3 Nf6 4. Nc3 Nbd7 5. cxd5 exd5 6. Bf4 c6 7. e3 Nh5 8. Bd3 Nxf4 9. exf4 Bd6 10. g3 O-O 11. O-O Re8 12. Qc2 Nf8 13. Nd1 f6 14. Ne3 Be6 15. Nh4 Bc7 16. b4 Bb6 17. Nf3 Bf7 18. b5 Bh5 19. g4 Bf7 20. bxc6 Rc8 21. Qb2 bxc6 22. f5 Qd6 23. Ng2 Bc7 24. Rfe1 h5 25. h3 Nh7 26. Rxe8+ Rxe8 27. Re1 Rb8 28. Qc1 Ng5 29. Ne5 fxe5 30. Qxg5 e4 31. f6,"This is a game between Alekhine,A (as White) and Lasker,Em (as Black). Last move played: White plays Pawn to f6",Large advantage for Black (eval: -392 centipawns),31... g6 32. f4 Bd8 33. Qe5 Qxe5 34. dxe5 exd3 35. gxh5 gxh5 36. f5 d2 37. Rd1 Bc7 38. e6 Be8 39. f7+ Bxf7 40. Ne3 Kf8 41. exf7 Kxf7 42. Rxd2 ,31. f6 g6 32. Kf1 exd3 33. f4 d2 34. Rd1 Bd8 35. Qe5 Qxe5 36. fxe5 Ba5 37. Nf4 g5 38. Nxh5 Bxh5 39. gxh5 Kf7 40. h6 Kg6 41. h7 Kxh7 42. e6 
"Lasker could have played e4xf3 e.p., but he'd have to give up his attack on without the d3-Bishop (although he'd then have an attack on the g2-Knight). Either without way, there's not much hope for White's game.",True," The comment highlights a strategic disadvantage for White, suggesting a missed opportunity due to a loss of attacking potential.",1. d4 d5 2. c4 e6 3. Nf3 Nf6 4. Nc3 Nbd7 5. cxd5 exd5 6. Bf4 c6 7. e3 Nh5 8. Bd3 Nxf4 9. exf4 Bd6 10. g3 O-O 11. O-O Re8 12. Qc2 Nf8 13. Nd1 f6 14. Ne3 Be6 15. Nh4 Bc7 16. b4 Bb6 17. Nf3 Bf7 18. b5 Bh5 19. g4 Bf7 20. bxc6 Rc8 21. Qb2 bxc6 22. f5 Qd6 23. Ng2 Bc7 24. Rfe1 h5 25. h3 Nh7 26. Rxe8+ Rxe8 27. Re1 Rb8 28. Qc1 Ng5 29. Ne5 fxe5 30. Qxg5 e4 31. f6 g6 32. f4 hxg4,"This is a game between Alekhine,A (as White) and Lasker,Em (as Black). Last move played: Black plays Pawn takes on g4",Large advantage for Black (eval: -401 centipawns),33. h4 Bb6 34. Be2 Bxd4+ 35. Kh1 Qxf6 36. Qxg4 Qf5 37. Qg3 Rb2 38. Bg4 Bf2 39. Qxf2 Rxf2 40. Bxf5 gxf5 41. Rc1 d4 42. Rxc6 e3 43. Rd6 Rd2 44. Kh2 Rd1 45. Rd8+ Kg7 46. Rd7 e2 47. h5 ,32... Bd8 33. Qe5 Qxe5 34. fxe5 exd3 35. Nh4 d2 36. Rd1 Rb2 37. Nf3 Bb6 38. Kg2 c5 39. Kg3 g5 40. h4 hxg4 41. Nxg5 c4 42. Kf4 c3 43. e6 Bc7+ 44. Kf5 
Lasker swipes another pawn and attacks the Knight on g2. Notice how the White without pawn structure is fragmented while Black has a strong pawn chain from c6 to without e4.,True," The comment highlights a positional weakness stemming from a lack of pawn structure, suggesting a flawed strategic decision.",1. d4 d5 2. c4 e6 3. Nf3 Nf6 4. Nc3 Nbd7 5. cxd5 exd5 6. Bf4 c6 7. e3 Nh5 8. Bd3 Nxf4 9. exf4 Bd6 10. g3 O-O 11. O-O Re8 12. Qc2 Nf8 13. Nd1 f6 14. Ne3 Be6 15. Nh4 Bc7 16. b4 Bb6 17. Nf3 Bf7 18. b5 Bh5 19. g4 Bf7 20. bxc6 Rc8 21. Qb2 bxc6 22. f5 Qd6 23. Ng2 Bc7 24. Rfe1 h5 25. h3 Nh7 26. Rxe8+ Rxe8 27. Re1 Rb8 28. Qc1 Ng5 29. Ne5 fxe5 30. Qxg5 e4 31. f6 g6 32. f4 hxg4 33. Be2 gxh3,"This is a game between Alekhine,A (as White) and Lasker,Em (as Black). Last move played: Black plays Pawn takes on h3",Large advantage for Black (eval: -464 centipawns),34. Ne3 Qxf4 35. Qxf4 Bxf4 36. Bg4 Bg5 37. Bxh3 Bxf6 38. Rd1 Bg5 39. Ng4 Kg7 40. Ne5 Be8 41. Nd7 Rb2 42. Rf1 Be3+ 43. Kh1 ,33... gxh3 34. Qe5 Re8 35. Qxd6 Bxd6 36. Ne3 Bxf4 37. Bd1 Bxe3+ 38. Rxe3 Be6 39. Rc3 Rb8 40. Rxc6 Kf7 41. Bb3 g5 42. Kh2 Rb6 43. Rc7+ Kxf6 44. Rxa7 e3 
"Taking advantage of the pin on the g6-pawn, Alekhine prepares to break without through on Black's Kingside.",True, The comment suggests a potential tactical blunder by attempting a decisive attack without proper development or consideration of Black’s defensive capabilities.,1. d4 d5 2. c4 e6 3. Nf3 Nf6 4. Nc3 Nbd7 5. cxd5 exd5 6. Bf4 c6 7. e3 Nh5 8. Bd3 Nxf4 9. exf4 Bd6 10. g3 O-O 11. O-O Re8 12. Qc2 Nf8 13. Nd1 f6 14. Ne3 Be6 15. Nh4 Bc7 16. b4 Bb6 17. Nf3 Bf7 18. b5 Bh5 19. g4 Bf7 20. bxc6 Rc8 21. Qb2 bxc6 22. f5 Qd6 23. Ng2 Bc7 24. Rfe1 h5 25. h3 Nh7 26. Rxe8+ Rxe8 27. Re1 Rb8 28. Qc1 Ng5 29. Ne5 fxe5 30. Qxg5 e4 31. f6 g6 32. f4 hxg4 33. Be2 gxh3 34. Bh5,"This is a game between Alekhine,A (as White) and Lasker,Em (as Black). Last move played: White plays Bishop to h5",Large advantage for Black (eval: -571 centipawns),34... Rb2 35. Re2 Rb1+ 36. Re1 Rxe1+ 37. Nxe1 Qxf4 38. Qxf4 Bxf4 39. Bg4 Be3+ 40. Kh2 Bxd4 41. Bd7 c5 42. Kxh3 Bxf6 43. Nc2 Kg7 44. Kg4 Be7 45. Bc6 Bd6 46. Na3 Bb8 47. Kh4 e3 ,34. Ne3 Qxf4 35. Qxf4 Bxf4 36. Bg4 Bg5 37. Bxh3 Bxf6 38. Rd1 Bg5 39. Ng4 Kg7 40. Ne5 Be8 41. Nd7 Rb2 42. Rf1 Be3+ 43. Kh1 
"Alekhine, thinking that he's breaking up the Black attack, accepts the trade.",True, The comment indicates a potentially flawed strategic decision driven by a miscalculation of the position.,1. d4 d5 2. c4 e6 3. Nf3 Nf6 4. Nc3 Nbd7 5. cxd5 exd5 6. Bf4 c6 7. e3 Nh5 8. Bd3 Nxf4 9. exf4 Bd6 10. g3 O-O 11. O-O Re8 12. Qc2 Nf8 13. Nd1 f6 14. Ne3 Be6 15. Nh4 Bc7 16. b4 Bb6 17. Nf3 Bf7 18. b5 Bh5 19. g4 Bf7 20. bxc6 Rc8 21. Qb2 bxc6 22. f5 Qd6 23. Ng2 Bc7 24. Rfe1 h5 25. h3 Nh7 26. Rxe8+ Rxe8 27. Re1 Rb8 28. Qc1 Ng5 29. Ne5 fxe5 30. Qxg5 e4 31. f6 g6 32. f4 hxg4 33. Be2 gxh3 34. Bh5 Rb2 35. Nh4 Qxf4 36. Qxf4,"This is a game between Alekhine,A (as White) and Lasker,Em (as Black). Last move played: White plays Queen takes on f4",Large advantage for Black (eval: -677 centipawns),36... Bxf4 37. Rf1 Be3+ 38. Kh1 gxh5 39. Nf5 Bg5 40. Rg1 Rg2 41. Ne7+ Kh7 42. Rxg2 hxg2+ 43. Kxg2 Be8 44. f7 Bxf7 45. Nxc6 a6 46. Kg3 Kg7 47. a4 h4+ 48. Kg4 e3 49. Nb4 e2 50. Nc2 Bf6 51. Kf4 Kf8 ,36. Qxf4 Bxf4 37. Bg4 Bg3 38. Rc1 h2+ 39. Kh1 Bxh4 40. Rc3 Bxf6 41. Rxc6 Kg7 42. Rc7 e3 43. Rxa7 e2 44. Bxe2 Rxe2 45. a3 g5 46. a4 Bxd4 47. Rb7 Re1+ 48. Kxh2 Kg6 49. a5 Rc1 
"Lasker, who saw farther ahead than Alekhine, completes the swap. Alekhine, without already three pawns down and soon to lose more material, resigns. What's without going on? See the variation to find out.",True," The comment highlights a significant tactical blunder and resignation, suggesting a clear misjudgment of the position.",1. d4 d5 2. c4 e6 3. Nf3 Nf6 4. Nc3 Nbd7 5. cxd5 exd5 6. Bf4 c6 7. e3 Nh5 8. Bd3 Nxf4 9. exf4 Bd6 10. g3 O-O 11. O-O Re8 12. Qc2 Nf8 13. Nd1 f6 14. Ne3 Be6 15. Nh4 Bc7 16. b4 Bb6 17. Nf3 Bf7 18. b5 Bh5 19. g4 Bf7 20. bxc6 Rc8 21. Qb2 bxc6 22. f5 Qd6 23. Ng2 Bc7 24. Rfe1 h5 25. h3 Nh7 26. Rxe8+ Rxe8 27. Re1 Rb8 28. Qc1 Ng5 29. Ne5 fxe5 30. Qxg5 e4 31. f6 g6 32. f4 hxg4 33. Be2 gxh3 34. Bh5 Rb2 35. Nh4 Qxf4 36. Qxf4 Bxf4,"This is a game between Alekhine,A (as White) and Lasker,Em (as Black). Last move played: Black plays Bishop takes on f4",Large advantage for Black (eval: -739 centipawns),37. Rf1 Bh2+ 38. Kh1 gxh5 39. Nf5 Kf8 40. Re1 Bf4 41. Ne7 e3 42. a3 e2 43. Nxc6 Rd2 44. Kg1 Rd1 45. Kf2 Rxe1 46. Kxe1 h2 47. Kxe2 h1=Q 48. Ne5 Bxe5 49. dxe5 Qh2+ 50. Kf1 ,36... Bxf4 37. Rf1 Be3+ 38. Kh1 gxh5 39. Nf5 Bg5 40. Rg1 Rg2 41. Ne7+ Kh7 42. Rxg2 hxg2+ 43. Kxg2 Be8 44. f7 Bxf7 45. Nxc6 a6 46. Kg3 Kg7 47. a4 h4+ 48. Kg4 e3 49. Nb4 e2 50. Nc2 Bf6 51. Kf4 Kf8 
Alekhine advances the c-pawn in an effort to goad Black into trading a vital without center pawn (his d-pawn) for a less-valuable White flank pawn (the c-pawn).,True," The comment identifies a potential weakness in the move's strategic planning, suggesting a defensive focus over aggressive development.",1. d4 d5 2. c4,"This is a game between Alekhine,A (as White) and Lasker,Em (as Black). Last move played: White plays Pawn to c4",Slight advantage for White (eval: 34 centipawns),2... e6 3. Nf3 ,2. c4 e6 
"Lasker has much the same idea with his Knight move. He overprotects the pawn without on d5, eyes a possible outpost on e4, starts clearing the deck for Kingside without castling, and seeks to prevent the White pawn push e2-e4.",True," Yes, the comment clearly indicates a suboptimal exchange of a piece, suggesting a tactical error.",1. d4 d5 2. c4 e6 3. Nf3 Nf6,"This is a game between Alekhine,A (as White) and Lasker,Em (as Black). Last move played: Black plays Knight to f6",Slight advantage for White (eval: 32 centipawns),4. g3 Bb4+ ,3... dxc4 4. e3 
"Alekhine develops another minor piece, strikes out at the d5-pawn again, and without adds the influence of another piece to e4, trying to support the planned without e2-e4 pawn advance.",True," The comment identifies a specific weakness in the position, suggesting a flawed tactical assessment.",1. d4 d5 2. c4 e6 3. Nf3 Nf6 4. Nc3,"This is a game between Alekhine,A (as White) and Lasker,Em (as Black). Last move played: White plays Knight to c3",Slight advantage for White (eval: 27 centipawns),4... Bb4 ,4. g3 Bb4+ 
Lasker trades his Knight for White's bad Bishop.,True," The comment describes a potential immediate threat and a tactical consequence, indicating a significant error in assessment.",1. d4 d5 2. c4 e6 3. Nf3 Nf6 4. Nc3 Nbd7 5. cxd5 exd5 6. Bf4 c6 7. e3 Nh5 8. Bd3 Nxf4,"This is a game between Alekhine,A (as White) and Lasker,Em (as Black). Last move played: Black plays Knight takes on f4",The position is equal,9. exf4 Bd6 10. Qd2 O-O 11. O-O Nf6 12. Rfe1 Nh5 13. g3 g6 14. Kg2 Ng7 15. h4 h5 16. a3 Qb6 17. Na4 Qc7 18. b4 Bf5 19. Bxf5 Nxf5 20. Nc5 b6 ,8... Nxf4 9. exf4 
"The old chess adage bears repeating: Rooks belong on open files! Lasker knows without this, and siezes the open e-file. Now he's only one move behind in without development but getting his c8-Bishop out is going to be a problem.",True," The comment highlights a potential tactical blunder by ignoring piece exchange, suggesting a missed opportunity for a more solid position.",1. d4 d5 2. c4 e6 3. Nf3 Nf6 4. Nc3 Nbd7 5. cxd5 exd5 6. Bf4 c6 7. e3 Nh5 8. Bd3 Nxf4 9. exf4 Bd6 10. g3 O-O 11. O-O Re8,"This is a game between Alekhine,A (as White) and Lasker,Em (as Black). Last move played: Black plays Rook to e8",The position is equal,12. Qc2 Nf8 ,11... Nf6 12. Qd2 
The White Kingside Knight develops to a useful square where it keeps an eye without on the White d-pawn or can possibly leap to an outpost square on e5 later.,True," The comment suggests a potential tactical blunder by Alekhine, specifically regarding the Knight's lack of influence, indicating a miscalculation.",1. d4 d5 2. c4 e6 3. Nf3,"This is a game between Alekhine,A (as White) and Lasker,Em (as Black). Last move played: White plays Knight to f3",Slight advantage for White (eval: 31 centipawns),3... dxc4 4. e3 ,3. Nc3 Nf6 
"Alekhine develops another minor piece, strikes out at the d5-pawn again, and without adds the influence of another piece to e4, trying to support the planned without e2-e4 pawn advance.",True," The comment suggests a potential tactical threat, indicating a flaw in the player’s assessment of the position.",1. d4 d5 2. c4 e6 3. Nf3 Nf6 4. Nc3,"This is a game between Alekhine,A (as White) and Lasker,Em (as Black). Last move played: White plays Knight to c3",Slight advantage for White (eval: 27 centipawns),4... Bb4 ,4. g3 Bb4+ 
"Lasker continues his development by castling. Now his King is safe behind a without protective wall of pawns, and his Kingside Rook is a move away from taking without over the open e-file.",True," The comment describes a problematic pawn structure and a potential threat, indicating a mistake.",1. d4 d5 2. c4 e6 3. Nf3 Nf6 4. Nc3 Nbd7 5. cxd5 exd5 6. Bf4 c6 7. e3 Nh5 8. Bd3 Nxf4 9. exf4 Bd6 10. g3 O-O,"This is a game between Alekhine,A (as White) and Lasker,Em (as Black). Last move played: Black plays kingside castle",The position is equal,11. Kf1 Nf6 ,10... O-O 11. Qd2 Nf6 12. O-O Nh5 13. Kg2 Qf6 14. Ne2 g6 15. b4 a6 16. Rae1 Qd8 17. h3 Ng7 
"Chess openings revolve around the struggle to occupy, control, or influence without the center. Alekhine (White) occupies d4 with a pawn. The pawn controls c5 without and e5, the Queen controls d2 and d3, and the c1-Bishop controls without d2-h6.",True, The comment accurately describes a problematic move aimed at weakening the center.,1. d4,"This is a game between Alekhine,A (as White) and Lasker,Em (as Black). Last move played: White plays Pawn to d4",Slight advantage for White (eval: 32 centipawns),1... d5 2. c4 e6 3. Nf3 dxc4 4. e3 a6 5. Bxc4 Nf6 6. O-O c5 7. dxc5 Qxd1 8. Rxd1 Bxc5 9. Be2 Nbd7 10. a3 O-O 11. b4 Be7 12. Bb2 b5 ,1. e4 e5 
"Alekhine develops another minor piece. He's looking at the possibility of without posting a piece at e5. The usual move here is Bg5, pinning the Black without f6-Knight to the Queen.",True, The comment identifies a tactical error – the Knight's illegal move – and explains its consequence.,1. d4 d5 2. c4 e6 3. Nf3 Nf6 4. Nc3 Nbd7 5. cxd5 exd5 6. Bf4,"This is a game between Alekhine,A (as White) and Lasker,Em (as Black). Last move played: White plays Bishop to f4",The position is equal,6... Nb6 ,6. Bg5 c6 7. e3 h6 8. Bh4 Be7 9. Qc2 O-O 10. Bd3 Re8 11. O-O Ne4 12. Bxe7 Qxe7 13. a4 a5 14. Rae1 Nf8 15. Nd2 Nxd2 16. Qxd2 Kh8 17. e4 dxe4 18. Rxe4 
