comment,good,reasoning,moves,context,engine_eval,engine_best_line,engine_best_alternative
"Chess openings revolve around the struggle to occupy, control, or influence without the center. Alekhine (White) occupies d4 with a pawn. The pawn controls c5 without and e5, the Queen controls d2 and d3, and the c1-Bishop controls without d2-h6.",True," The comment offers a concise explanation of the strategic principles at play in the opening, suggesting the move was flawed.",1. d4,"This is a game between Alekhine,A (as White) and Lasker,Em (as Black). Last move played: White plays Pawn to d4",Slight advantage for White (eval: 32 centipawns),1... d5 2. c4 e6 3. Nf3 dxc4 4. e3 a6 5. Bxc4 Nf6 6. O-O c5 7. dxc5 Qxd1 8. Rxd1 Bxc5 9. Be2 Nbd7 10. a3 O-O 11. b4 Be7 12. Bb2 b5 ,1. e4 e5 
Lasker (Black) controls his own piece of the center. The Black pawn on d5 without stops any further advance of White's d-pawn into Black without territory.,True," The comment identifies a potential tactical weakness, suggesting the Black pawn is hindering White's development.",1. d4 d5,"This is a game between Alekhine,A (as White) and Lasker,Em (as Black). Last move played: Black plays Pawn to d5",Slight advantage for White (eval: 25 centipawns),2. c4 e6 ,1... d5 
"Lasker knows that White's ultimate goal here is to play e2-e4 and gain a without central pawn duo on d4 and e4. After e7-e6, he insures that he'll still have without a pawn on d5 (to prevent e2-e4) even after pawns are swapped on d5 (cxd5, without exd5).",True," The comment offers a plausible explanation for the mistake, suggesting a strategic aim to create a pawn structure that hinders White's central pawn development.",1. d4 d5 2. c4 e6,"This is a game between Alekhine,A (as White) and Lasker,Em (as Black). Last move played: Black plays Pawn to e6",Slight advantage for White (eval: 26 centipawns),3. Nc3 Nf6 ,2... e6 3. Nf3 
"Lasker has much the same idea with his Knight move. He overprotects the pawn without on d5, eyes a possible outpost on e4, starts clearing the deck for Kingside without castling, and seeks to prevent the White pawn push e2-e4.",True," The comment offers a detailed analysis of a potentially flawed move, suggesting a strategic error.",1. d4 d5 2. c4 e6 3. Nf3 Nf6,"This is a game between Alekhine,A (as White) and Lasker,Em (as Black). Last move played: Black plays Knight to f6",Slight advantage for White (eval: 32 centipawns),4. g3 Bb4+ ,3... dxc4 4. e3 
"Alekhine develops another minor piece, strikes out at the d5-pawn again, and without adds the influence of another piece to e4, trying to support the planned without e2-e4 pawn advance.",True," The comment describes a series of moves that appear to be aimed at weakening the opponent’s pawn structure and creating weaknesses, suggesting a flawed strategic plan.",1. d4 d5 2. c4 e6 3. Nf3 Nf6 4. Nc3,"This is a game between Alekhine,A (as White) and Lasker,Em (as Black). Last move played: White plays Knight to c3",Slight advantage for White (eval: 27 centipawns),4... Bb4 ,4. g3 Bb4+ 
"Alekhine develops another minor piece. He's looking at the possibility of without posting a piece at e5. The usual move here is Bg5, pinning the Black without f6-Knight to the Queen.",True, The comment offers a valid reason for the mistake – pinning a piece – highlighting a deviation from standard opening principles.,1. d4 d5 2. c4 e6 3. Nf3 Nf6 4. Nc3 Nbd7 5. cxd5 exd5 6. Bf4,"This is a game between Alekhine,A (as White) and Lasker,Em (as Black). Last move played: White plays Bishop to f4",The position is equal,6... Nb6 ,6. Bg5 c6 7. e3 h6 8. Bh4 Be7 9. Qc2 O-O 10. Bd3 Re8 11. O-O Ne4 12. Bxe7 Qxe7 13. a4 a5 14. Rae1 Nf8 15. Nd2 Nxd2 16. Qxd2 Kh8 17. e4 dxe4 18. Rxe4 
"Lasker allows his Queen access to the Queenside via the a5-d8 diagonal, and without keep White from launching a double attack against his c7-pawn after without 7.Nb5.",True," The comment identifies a specific tactical vulnerability, suggesting a flawed plan.",1. d4 d5 2. c4 e6 3. Nf3 Nf6 4. Nc3 Nbd7 5. cxd5 exd5 6. Bf4 c6,"This is a game between Alekhine,A (as White) and Lasker,Em (as Black). Last move played: Black plays Pawn to c6",The position is equal,7. h3 Ne4 ,6... Nb6 
"Alekhine props up his Bishop, and at the same time gives his Kingside Bishop without a route to get off the first rank (via the a6-f1 diagonal). Notice that he without moved his dark-square Bishop first, so that it wouldn't get trapped behind without the pawn.",True, The comment identifies a specific tactical error – failing to develop a key piece and leaving a potential threat exposed – which is a crucial element of a mistake.,1. d4 d5 2. c4 e6 3. Nf3 Nf6 4. Nc3 Nbd7 5. cxd5 exd5 6. Bf4 c6 7. e3,"This is a game between Alekhine,A (as White) and Lasker,Em (as Black). Last move played: White plays Pawn to e3",The position is equal,7... Nh5 8. Bg5 ,7. h3 Ne4 
Lasker launches a sortie against the well-placed f4-Bishop. Notice that the without Bishop can't move to escape capture; it's attacked no matter where it moves. without The Bishop is Black's if he wants it.,True, The comment highlights a critical tactical vulnerability due to the Bishop's lack of mobility.,1. d4 d5 2. c4 e6 3. Nf3 Nf6 4. Nc3 Nbd7 5. cxd5 exd5 6. Bf4 c6 7. e3 Nh5,"This is a game between Alekhine,A (as White) and Lasker,Em (as Black). Last move played: Black plays Knight to h5",The position is equal,8. Bg5 Be7 9. Bxe7 Qxe7 10. Be2 O-O 11. O-O Nhf6 12. Qc2 Re8 13. Rac1 g6 14. h3 Nb6 15. Bd3 Be6 16. Ne5 Nh5 17. Rfe1 Ng7 18. a4 a5 19. Nf3 Nd7 ,7... Nh5 8. Bg5 
"Rather than waste time on fruitless moves of the f4-Bishop, Alekhine without continues his development by moving his last Kingside minor piece. Now the without way is clear for castling Kingside.",True," The comment suggests a potential tactical weakness and a strategic move to improve the position, indicating a misunderstanding of the move's impact.",1. d4 d5 2. c4 e6 3. Nf3 Nf6 4. Nc3 Nbd7 5. cxd5 exd5 6. Bf4 c6 7. e3 Nh5 8. Bd3,"This is a game between Alekhine,A (as White) and Lasker,Em (as Black). Last move played: White plays Bishop to d3",The position is equal,8... Nxf4 9. exf4 ,8. Bg5 Be7 9. Bxe7 Qxe7 10. Be2 O-O 11. O-O Nhf6 12. Qc2 Re8 13. Rac1 g6 14. h3 Nb6 15. Bd3 Be6 16. Ne5 Nh5 17. Rfe1 Ng7 18. a4 a5 19. Nf3 Nd7 
"Alekhine recaptures. Black has won White's bad Bishop and saddled him with without doubled f-pawns, but it took him three Knight moves to do it. Black has without fallen way behind in development.",True," The comment accurately describes a significant tactical blunder, highlighting a lost Bishop and a delayed development, indicating a poor move.",1. d4 d5 2. c4 e6 3. Nf3 Nf6 4. Nc3 Nbd7 5. cxd5 exd5 6. Bf4 c6 7. e3 Nh5 8. Bd3 Nxf4 9. exf4,"This is a game between Alekhine,A (as White) and Lasker,Em (as Black). Last move played: White plays Pawn takes on f4",The position is equal,9... Bd6 10. Qd2 ,9. exf4 Bd6 10. Qd2 O-O 11. O-O Nf6 12. Rfe1 Nh5 13. g3 g6 14. Kg2 Ng7 15. h4 h5 16. a3 Qb6 17. Na4 Qc7 18. b4 Bf5 19. Bxf5 Nxf5 20. Nc5 b6 
"In an effort to make up some of his lost time, Lasker develops a piece and without simultaneously threatens the White f4-pawn. In your own games, develop with without a threat whenever possible.",True," The comment suggests a strategic misstep by developing without immediate threat, which is a common mistake in chess.",1. d4 d5 2. c4 e6 3. Nf3 Nf6 4. Nc3 Nbd7 5. cxd5 exd5 6. Bf4 c6 7. e3 Nh5 8. Bd3 Nxf4 9. exf4 Bd6,"This is a game between Alekhine,A (as White) and Lasker,Em (as Black). Last move played: Black plays Bishop to d6",The position is equal,10. g3 ,9... Bd6 10. Qd2 
"Lasker continues his development by castling. Now his King is safe behind a without protective wall of pawns, and his Kingside Rook is a move away from taking without over the open e-file.",True," The comment identifies a potential weakness in the King's safety and a vulnerable pawn structure, suggesting a flawed strategic decision.",1. d4 d5 2. c4 e6 3. Nf3 Nf6 4. Nc3 Nbd7 5. cxd5 exd5 6. Bf4 c6 7. e3 Nh5 8. Bd3 Nxf4 9. exf4 Bd6 10. g3 O-O,"This is a game between Alekhine,A (as White) and Lasker,Em (as Black). Last move played: Black plays kingside castle",The position is equal,11. Kf1 Nf6 ,10... O-O 11. Qd2 Nf6 12. O-O Nh5 13. Kg2 Qf6 14. Ne2 g6 15. b4 a6 16. Rae1 Qd8 17. h3 Ng7 
"Neither the Kingside nor Queenside pawn structures look particularly safe for without a castled King, but White has to get the King out of the center before Black without plays 11...Re8+. Alekhine bites the bullet and castles Kingside.",True," The comment suggests a strategic flaw in White's move, highlighting the need for King safety and a tactical consideration.",1. d4 d5 2. c4 e6 3. Nf3 Nf6 4. Nc3 Nbd7 5. cxd5 exd5 6. Bf4 c6 7. e3 Nh5 8. Bd3 Nxf4 9. exf4 Bd6 10. g3 O-O 11. O-O,"This is a game between Alekhine,A (as White) and Lasker,Em (as Black). Last move played: White plays kingside castle",The position is equal,11... Nf6 12. Qd2 ,11. Kf1 Nf6 
"The old chess adage bears repeating: Rooks belong on open files! Lasker knows without this, and siezes the open e-file. Now he's only one move behind in without development but getting his c8-Bishop out is going to be a problem.",True, The comment highlights a critical tactical error – the incorrect placement of rooks – and suggests a potential weakness in the opponent’s development.,1. d4 d5 2. c4 e6 3. Nf3 Nf6 4. Nc3 Nbd7 5. cxd5 exd5 6. Bf4 c6 7. e3 Nh5 8. Bd3 Nxf4 9. exf4 Bd6 10. g3 O-O 11. O-O Re8,"This is a game between Alekhine,A (as White) and Lasker,Em (as Black). Last move played: Black plays Rook to e8",The position is equal,12. Qc2 Nf8 ,11... Nf6 12. Qd2 
Alekhine grabs the opportunity to develop his Queen with a threat. He's without threatening to win a pawn with Bxh7 (Black couldn't recapture with his King without because the Bishop is protected by the Queen).,True, The comment identifies a potential tactical threat and explains why it was a mistake.,1. d4 d5 2. c4 e6 3. Nf3 Nf6 4. Nc3 Nbd7 5. cxd5 exd5 6. Bf4 c6 7. e3 Nh5 8. Bd3 Nxf4 9. exf4 Bd6 10. g3 O-O 11. O-O Re8 12. Qc2,"This is a game between Alekhine,A (as White) and Lasker,Em (as Black). Last move played: White plays Queen to c2",Slight advantage for Black (eval: -20 centipawns),12... Nf6 ,12. Qc2 Nf8 
"Rather than create a weakness in his Kingside pawn structure with g7-g6 without (which would weaken f6 and h6), Lasker repositions his Knight in order to without guard the h7-pawn. This also solves the problem of how to get his c8-Bishop without out.",True," The comment offers a possible explanation for the mistake, suggesting a strategic solution to a specific problem.",1. d4 d5 2. c4 e6 3. Nf3 Nf6 4. Nc3 Nbd7 5. cxd5 exd5 6. Bf4 c6 7. e3 Nh5 8. Bd3 Nxf4 9. exf4 Bd6 10. g3 O-O 11. O-O Re8 12. Qc2 Nf8,"This is a game between Alekhine,A (as White) and Lasker,Em (as Black). Last move played: Black plays Knight to f8",The position is equal,13. Rae1 Bg4 14. Rxe8 Qxe8 15. Kg2 Ne6 16. Ne2 g6 17. Neg1 Ng7 18. h3 Bc8 19. Ne2 Bd7 20. Ne5 Bf5 21. Ng4 Bxd3 22. Qxd3 Qe7 23. Rh1 Re8 ,12... Nf6 
"Alekhine's Knight jumps again, closing off part of the e-file to Black's Rook without on e8. But this move has another purpose. He's trying to control without f5...",True," The comment suggests a strategic maneuver to limit Black's Rook, indicating a flawed plan.",1. d4 d5 2. c4 e6 3. Nf3 Nf6 4. Nc3 Nbd7 5. cxd5 exd5 6. Bf4 c6 7. e3 Nh5 8. Bd3 Nxf4 9. exf4 Bd6 10. g3 O-O 11. O-O Re8 12. Qc2 Nf8 13. Nd1 f6 14. Ne3,"This is a game between Alekhine,A (as White) and Lasker,Em (as Black). Last move played: White plays Knight to e3",Slight advantage for White (eval: 41 centipawns),14... Be6 ,14. Ne3 
"Lasker finally gets his Bishop off of the first rank. He doesn't attack the without Kingside by moving the Bishop to g4 or h3, because White has too many without options there for an immediate attack to work. The Bishop is held in reserve without instead.",True, The comment identifies a strategic error – neglecting to attack with the Bishop – and offers a plausible explanation for why that move was considered a mistake.,1. d4 d5 2. c4 e6 3. Nf3 Nf6 4. Nc3 Nbd7 5. cxd5 exd5 6. Bf4 c6 7. e3 Nh5 8. Bd3 Nxf4 9. exf4 Bd6 10. g3 O-O 11. O-O Re8 12. Qc2 Nf8 13. Nd1 f6 14. Ne3 Be6,"This is a game between Alekhine,A (as White) and Lasker,Em (as Black). Last move played: Black plays Bishop to e6",Advantage for White (eval: 51 centipawns),15. b4 a6 16. Rab1 Bf7 17. a4 Kh8 18. Nd2 Bg6 19. f5 Bh5 20. Qc3 a5 ,14... Be6 
"Alekhine prepares a Kingside attack. Now he has complete control of f5, and without will probably post a Knight here. A White Knight on f5 will attack the Black without d6-Bishop. White hopes to trade a Knight for one of Black's two Bishops.",True," The comment describes a potential tactical threat and a planned piece sacrifice, indicating a mistake in the move.",1. d4 d5 2. c4 e6 3. Nf3 Nf6 4. Nc3 Nbd7 5. cxd5 exd5 6. Bf4 c6 7. e3 Nh5 8. Bd3 Nxf4 9. exf4 Bd6 10. g3 O-O 11. O-O Re8 12. Qc2 Nf8 13. Nd1 f6 14. Ne3 Be6 15. Nh4,"This is a game between Alekhine,A (as White) and Lasker,Em (as Black). Last move played: White plays Knight to h4",The position is equal,15... a5 ,15. b4 a6 16. Rab1 Bf7 17. a4 Kh8 18. Nd2 Bg6 19. f5 Bh5 20. Qc3 a5 
Lasker stops White's threat before it even gets started by moving the target without of the attack. But there's an ulterior motive to this move: Black will try without to play Bc7-b6 and attack White's isolated d-pawn.,True, The comment highlights a potential strategic flaw by anticipating a counterattack and delaying the development of a crucial defensive structure.,1. d4 d5 2. c4 e6 3. Nf3 Nf6 4. Nc3 Nbd7 5. cxd5 exd5 6. Bf4 c6 7. e3 Nh5 8. Bd3 Nxf4 9. exf4 Bd6 10. g3 O-O 11. O-O Re8 12. Qc2 Nf8 13. Nd1 f6 14. Ne3 Be6 15. Nh4 Bc7,"This is a game between Alekhine,A (as White) and Lasker,Em (as Black). Last move played: Black plays Bishop to c7",Slight advantage for White (eval: 25 centipawns),16. b4 ,15... a5 
"Alekhine launches a ""minority attack"". The b-pawn is a ""kamikaze"" that will without try to sacrifice itself in order to create weaknesses on Black's Queenside. without Watch and see...",True," The comment describes a risky and ultimately unsuccessful tactical maneuver, suggesting a flawed assessment of the position.",1. d4 d5 2. c4 e6 3. Nf3 Nf6 4. Nc3 Nbd7 5. cxd5 exd5 6. Bf4 c6 7. e3 Nh5 8. Bd3 Nxf4 9. exf4 Bd6 10. g3 O-O 11. O-O Re8 12. Qc2 Nf8 13. Nd1 f6 14. Ne3 Be6 15. Nh4 Bc7 16. b4,"This is a game between Alekhine,A (as White) and Lasker,Em (as Black). Last move played: White plays Pawn to b4",Slight advantage for White (eval: 27 centipawns),16... Bb6 ,16. b4 
"Lasker can't do much yet about the kamikaze pawn, so he sticks with his plan without to attack the isolated d-pawn. He follows a good principle: don't switch without plans in the middle of an operation without an important reason.",True," The comment offers a reasoned explanation for the move's perceived weakness, suggesting a lack of proactive planning.",1. d4 d5 2. c4 e6 3. Nf3 Nf6 4. Nc3 Nbd7 5. cxd5 exd5 6. Bf4 c6 7. e3 Nh5 8. Bd3 Nxf4 9. exf4 Bd6 10. g3 O-O 11. O-O Re8 12. Qc2 Nf8 13. Nd1 f6 14. Ne3 Be6 15. Nh4 Bc7 16. b4 Bb6,"This is a game between Alekhine,A (as White) and Lasker,Em (as Black). Last move played: Black plays Bishop to b6",Slight advantage for White (eval: 32 centipawns),17. Qb2 Bf7 ,16... Bb6 17. Qb2 Qd7 18. Rfc1 Bf7 19. a4 a6 20. f5 Qd6 21. Neg2 Qe7 22. a5 Ba7 23. Nf4 Qd6 24. Rf1 Re7 25. Ra3 Rae8 26. Bb1 g5 
Alekhine withdraws the Knight to protect the menaced d-pawn. Why didn't he without just play Qc3? Because it conflicts with his plan to advance the kamikaze without pawn. You'll see...,True," The comment offers a potential explanation for the mistake, suggesting a strategic miscalculation.",1. d4 d5 2. c4 e6 3. Nf3 Nf6 4. Nc3 Nbd7 5. cxd5 exd5 6. Bf4 c6 7. e3 Nh5 8. Bd3 Nxf4 9. exf4 Bd6 10. g3 O-O 11. O-O Re8 12. Qc2 Nf8 13. Nd1 f6 14. Ne3 Be6 15. Nh4 Bc7 16. b4 Bb6 17. Nf3,"This is a game between Alekhine,A (as White) and Lasker,Em (as Black). Last move played: White plays Knight to f3",Slight advantage for White (eval: 27 centipawns),17... Bf7 18. h3 ,17. Qb2 Bf7 
"Lasker starts to maneuver his Bishop to h5, where it will attack the hanging without Knight at f3. The two Bishops are acting like a pair of scissors, striking without at the center from two directions at once.",True," The comment describes a potential tactical threat and suggests a coordinated attack, indicating a flawed move.",1. d4 d5 2. c4 e6 3. Nf3 Nf6 4. Nc3 Nbd7 5. cxd5 exd5 6. Bf4 c6 7. e3 Nh5 8. Bd3 Nxf4 9. exf4 Bd6 10. g3 O-O 11. O-O Re8 12. Qc2 Nf8 13. Nd1 f6 14. Ne3 Be6 15. Nh4 Bc7 16. b4 Bb6 17. Nf3 Bf7,"This is a game between Alekhine,A (as White) and Lasker,Em (as Black). Last move played: Black plays Bishop to f7",Slight advantage for White (eval: 31 centipawns),18. h3 Bh5 ,17... Bf7 18. h3 
"The kamikaze pawn advances again. Now White threatens to win a pawn with without 19.bxc6 bxc6 20.Qxc6. But as soon as he moves the pawn, Alekhine grimaces! without Too late, he spotted a better move! See the variation.",True," The comment provides a potential explanation for the mistake, suggesting a challenging tactical situation.",1. d4 d5 2. c4 e6 3. Nf3 Nf6 4. Nc3 Nbd7 5. cxd5 exd5 6. Bf4 c6 7. e3 Nh5 8. Bd3 Nxf4 9. exf4 Bd6 10. g3 O-O 11. O-O Re8 12. Qc2 Nf8 13. Nd1 f6 14. Ne3 Be6 15. Nh4 Bc7 16. b4 Bb6 17. Nf3 Bf7 18. b5,"This is a game between Alekhine,A (as White) and Lasker,Em (as Black). Last move played: White plays Pawn to b5",Slight advantage for Black (eval: -41 centipawns),18... Bh5 ,18. h3 Bh5 
"Alekhine defends it by interposing the g-pawn, which also counterattacks the without Bishop. But the White Kingside looks sick, with a hanging f-pawn and holes without for Black to invade later.",True," The comment provides a detailed explanation of the tactical weaknesses revealed by the move, suggesting a flawed plan.",1. d4 d5 2. c4 e6 3. Nf3 Nf6 4. Nc3 Nbd7 5. cxd5 exd5 6. Bf4 c6 7. e3 Nh5 8. Bd3 Nxf4 9. exf4 Bd6 10. g3 O-O 11. O-O Re8 12. Qc2 Nf8 13. Nd1 f6 14. Ne3 Be6 15. Nh4 Bc7 16. b4 Bb6 17. Nf3 Bf7 18. b5 Bh5 19. g4,"This is a game between Alekhine,A (as White) and Lasker,Em (as Black). Last move played: White plays Pawn to g4",Slight advantage for Black (eval: -34 centipawns),19... Bf7 20. bxc6 Rc8 21. Ng2 bxc6 22. a4 c5 23. a5 cxd4 24. Qa4 Bc5 25. Nxd4 Ne6 26. Nxe6 Bxe6 27. h3 Bf7 28. Rfc1 Qd6 29. Rc2 Re7 30. Rac1 g6 31. f5 d4 32. fxg6 hxg6 33. Bc4 d3 ,19. g4 Bf7 
"Discretion is the better part of valour. The Bishop retreats, having no without intention of sacrificing itself for a lowly pawn.",True," The comment offers a seemingly insightful observation about the Bishop's behavior, suggesting a strategic blunder, though its effectiveness as a correction is questionable.",1. d4 d5 2. c4 e6 3. Nf3 Nf6 4. Nc3 Nbd7 5. cxd5 exd5 6. Bf4 c6 7. e3 Nh5 8. Bd3 Nxf4 9. exf4 Bd6 10. g3 O-O 11. O-O Re8 12. Qc2 Nf8 13. Nd1 f6 14. Ne3 Be6 15. Nh4 Bc7 16. b4 Bb6 17. Nf3 Bf7 18. b5 Bh5 19. g4 Bf7,"This is a game between Alekhine,A (as White) and Lasker,Em (as Black). Last move played: Black plays Bishop to f7",Slight advantage for Black (eval: -30 centipawns),20. bxc6 ,19... Bf7 20. bxc6 Rc8 21. Ng2 bxc6 22. a4 c5 23. a5 cxd4 24. Qa4 Bc5 25. Nxd4 Ne6 26. Nxe6 Bxe6 27. h3 Bf7 28. Rfc1 Qd6 29. Rc2 Re7 30. Rac1 g6 31. f5 d4 32. fxg6 hxg6 33. Bc4 d3 
Alekhine proceeds with his plan to win a pawn on the Queenside. The kamikaze without grabs the Black c-pawn.,True," The comment describes a potentially risky, aggressive plan that could be misjudged.",1. d4 d5 2. c4 e6 3. Nf3 Nf6 4. Nc3 Nbd7 5. cxd5 exd5 6. Bf4 c6 7. e3 Nh5 8. Bd3 Nxf4 9. exf4 Bd6 10. g3 O-O 11. O-O Re8 12. Qc2 Nf8 13. Nd1 f6 14. Ne3 Be6 15. Nh4 Bc7 16. b4 Bb6 17. Nf3 Bf7 18. b5 Bh5 19. g4 Bf7 20. bxc6,"This is a game between Alekhine,A (as White) and Lasker,Em (as Black). Last move played: White plays Pawn takes on c6",Slight advantage for Black (eval: -39 centipawns),20... Rc8 21. Ng2 bxc6 22. a4 c5 23. a5 cxd4 24. Qa4 Bc5 25. Nxd4 Ne6 26. Nxe6 Bxe6 27. f5 Bf7 28. Nf4 Qd6 29. Ne6 Bxe6 30. fxe6 g6 31. Kg2 Rxe6 32. Rab1 Rc7 33. Rfe1 Rxe1 34. Rxe1 Bxf2 35. Kxf2 Qxh2+ 36. Kf3 Qh3+ 37. Ke2 ,20. bxc6 
"AH-HA! Lasker temporarily sacrifices the pawn, but ONLY temporarily, as the without White c6-pawn is pinned to the White Queen! The White pawn can't take the without Black b7-pawn, because of Black's reply ...Rxc2!",True," The comment provides a detailed explanation of the tactical situation and the resulting pawn structure, highlighting a crucial moment of vulnerability.",1. d4 d5 2. c4 e6 3. Nf3 Nf6 4. Nc3 Nbd7 5. cxd5 exd5 6. Bf4 c6 7. e3 Nh5 8. Bd3 Nxf4 9. exf4 Bd6 10. g3 O-O 11. O-O Re8 12. Qc2 Nf8 13. Nd1 f6 14. Ne3 Be6 15. Nh4 Bc7 16. b4 Bb6 17. Nf3 Bf7 18. b5 Bh5 19. g4 Bf7 20. bxc6 Rc8,"This is a game between Alekhine,A (as White) and Lasker,Em (as Black). Last move played: Black plays Rook to c8",Slight advantage for Black (eval: -33 centipawns),21. Ng2 bxc6 ,20... Rc8 21. Ng2 bxc6 22. a4 c5 23. a5 cxd4 24. Qa4 Bc5 25. Nxd4 Ne6 26. Nxe6 Bxe6 27. f5 Bf7 28. Nf4 Qd6 29. Ne6 Bxe6 30. fxe6 g6 31. Kg2 Rxe6 32. Rab1 Rc7 33. Rfe1 Rxe1 34. Rxe1 Bxf2 35. Kxf2 Qxh2+ 36. Kf3 Qh3+ 37. Ke2 
"Alekhine curses under his breath. He has no choice but to get his Queen out without of the line of fire, moving it to a square where it still defends the without isolated d4-pawn.",True," The comment suggests a tactical error by moving the Queen to defend a vulnerable pawn, indicating a misjudgment of the resulting position.",1. d4 d5 2. c4 e6 3. Nf3 Nf6 4. Nc3 Nbd7 5. cxd5 exd5 6. Bf4 c6 7. e3 Nh5 8. Bd3 Nxf4 9. exf4 Bd6 10. g3 O-O 11. O-O Re8 12. Qc2 Nf8 13. Nd1 f6 14. Ne3 Be6 15. Nh4 Bc7 16. b4 Bb6 17. Nf3 Bf7 18. b5 Bh5 19. g4 Bf7 20. bxc6 Rc8 21. Qb2,"This is a game between Alekhine,A (as White) and Lasker,Em (as Black). Last move played: White plays Queen to b2",Advantage for Black (eval: -99 centipawns),21... bxc6 22. Ng2 Qd6 23. f5 Nd7 24. Rae1 c5 25. Rxe8+ Rxe8 26. Qa3 h5 27. h3 Qc7 28. Qc3 c4 29. Bc2 hxg4 30. hxg4 Nb8 31. g5 Bh5 32. g6 ,21. Ng2 bxc6 
"Lasker gets his pawn back with ease. While it's true that the c-file is without closed to his Rook, the b-file is wide open should he choose to shift the without Rook to b8. He can also now hit the d4-pawn again with c6-c5 if he wants to without try that.",True," The comment offers a potential explanation for the mistake, suggesting a missed opportunity to exploit a weakness in the opponent's pawn structure.",1. d4 d5 2. c4 e6 3. Nf3 Nf6 4. Nc3 Nbd7 5. cxd5 exd5 6. Bf4 c6 7. e3 Nh5 8. Bd3 Nxf4 9. exf4 Bd6 10. g3 O-O 11. O-O Re8 12. Qc2 Nf8 13. Nd1 f6 14. Ne3 Be6 15. Nh4 Bc7 16. b4 Bb6 17. Nf3 Bf7 18. b5 Bh5 19. g4 Bf7 20. bxc6 Rc8 21. Qb2 bxc6,"This is a game between Alekhine,A (as White) and Lasker,Em (as Black). Last move played: Black plays Pawn takes on c6",Large advantage for Black (eval: -114 centipawns),22. Ng2 Qd6 23. Rfe1 Ne6 24. Qc2 g6 25. f5 Nf4 26. Rxe8+ Bxe8 27. fxg6 hxg6 28. Re1 c5 29. Nxf4 Qxf4 30. h3 Qxf3 31. Bxg6 Kf8 32. Bxe8 Rxe8 33. Rxe8+ Kxe8 34. dxc5 Bc7 35. Qa4+ Kd8 36. Qxa7 ,21... bxc6 22. Ng2 Qd6 23. f5 Nd7 24. Rae1 c5 25. Rxe8+ Rxe8 26. Qa3 h5 27. h3 Qc7 28. Qc3 c4 29. Bc2 hxg4 30. hxg4 Nb8 31. g5 Bh5 32. g6 
"Alekhine strengthens his sickly f-pawn by advancing it. He also takes e6 away without from the Black Knight, preventing it from invading White's Kingside via e6 without and f4.",True," The comment suggests a move that weakens the f-pawn, potentially creating a vulnerability for Black.",1. d4 d5 2. c4 e6 3. Nf3 Nf6 4. Nc3 Nbd7 5. cxd5 exd5 6. Bf4 c6 7. e3 Nh5 8. Bd3 Nxf4 9. exf4 Bd6 10. g3 O-O 11. O-O Re8 12. Qc2 Nf8 13. Nd1 f6 14. Ne3 Be6 15. Nh4 Bc7 16. b4 Bb6 17. Nf3 Bf7 18. b5 Bh5 19. g4 Bf7 20. bxc6 Rc8 21. Qb2 bxc6 22. f5,"This is a game between Alekhine,A (as White) and Lasker,Em (as Black). Last move played: White plays Pawn to f5",Large advantage for Black (eval: -143 centipawns),22... Nd7 23. Rac1 c5 24. dxc5 Nxc5 25. Bb5 Re4 26. h3 h5 27. Rfd1 Rf4 28. g5 Ne4 29. g6 Rxf3 30. gxf7+ Kxf7 31. Rxc8 Qxc8 32. Qb3 Kf8 33. Qxd5 Nxf2 34. Qxf3 Nxd1 35. Qxd1 Bxe3+ 36. Kg2 Qxf5 ,22. Ng2 Qd6 23. Rfe1 Ne6 24. Qc2 g6 25. f5 Nf4 26. Rxe8+ Bxe8 27. fxg6 hxg6 28. Re1 c5 29. Nxf4 Qxf4 30. h3 Qxf3 31. Bxg6 Kf8 32. Bxe8 Rxe8 33. Rxe8+ Kxe8 34. dxc5 Bc7 35. Qa4+ Kd8 36. Qxa7 
"Lasker sees that the dark-square Bishop's options are limited on b6, so he without pulls it back to c7 where it forms a battery in conjunction with the Black without Queen. The b-file is now open, ready for a Black Rook to occupy b8.",True," The comment offers a potential explanation for the mistake, suggesting a strategic maneuver to create a battery and open the b-file.",1. d4 d5 2. c4 e6 3. Nf3 Nf6 4. Nc3 Nbd7 5. cxd5 exd5 6. Bf4 c6 7. e3 Nh5 8. Bd3 Nxf4 9. exf4 Bd6 10. g3 O-O 11. O-O Re8 12. Qc2 Nf8 13. Nd1 f6 14. Ne3 Be6 15. Nh4 Bc7 16. b4 Bb6 17. Nf3 Bf7 18. b5 Bh5 19. g4 Bf7 20. bxc6 Rc8 21. Qb2 bxc6 22. f5 Qd6 23. Ng2 Bc7,"This is a game between Alekhine,A (as White) and Lasker,Em (as Black). Last move played: Black plays Bishop to c7",Large advantage for Black (eval: -115 centipawns),24. Rac1 h5 ,23... h5 24. g5 fxg5 25. Nxg5 Qf6 26. Qd2 Qxd4 27. Rad1 Nd7 28. Nf4 Nc5 29. Bb1 Qxd2 30. Rxd2 Rb8 31. Ng6 Nd7 32. Rc1 Ne5 33. Nxe5 Rxe5 34. Nxf7 Kxf7 35. Kf1 Ba5 
