comment,good,reasoning,moves,context,engine_eval,engine_best_line,engine_best_alternative
D45: Semi-Slav: 5 e3,True," The comment provides a potential explanation for the mistake, suggesting a tactical sequence but lacks clarity.",1. d4,"This is a game between Gelfand, B. (as White) and Kramnik, V. (as Black). Last move played: White plays Pawn to d4",Slight advantage for White (eval: 32 centipawns),1... d5 ,1. e4 e5 
last book move,True,", The comment suggests the move was poorly considered, indicating a potential flaw in the player’s strategic thinking.",1. d4 d5 2. c4 c6 3. Nc3 Nf6 4. Nf3 e6 5. e3 Nbd7 6. Qc2 Bd6 7. g4 Bb4 8. Bd2 Qe7 9. a3 Bxc3 10. Bxc3 b6 11. Bd3 Ba6 12. Qa4 dxc4 13. Qxa6 cxd3 14. Qxd3 O-O 15. g5 Nd5 16. Bd2 f5 17. O-O-O c5 18. Kb1 b5,"This is a game between Gelfand, B. (as White) and Kramnik, V. (as Black). Last move played: Black plays Pawn to b5",Slight advantage for Black (eval: -39 centipawns),19. Qxb5 Rab8 ,18... a6 19. g6 
Black is in command,False,"

The comment doesn't explain *why* the move was a mistake, only that Black is in command, implying a positional disadvantage.",1. d4 d5 2. c4 c6 3. Nc3 Nf6 4. Nf3 e6 5. e3 Nbd7 6. Qc2 Bd6 7. g4 Bb4 8. Bd2 Qe7 9. a3 Bxc3 10. Bxc3 b6 11. Bd3 Ba6 12. Qa4 dxc4 13. Qxa6 cxd3 14. Qxd3 O-O 15. g5 Nd5 16. Bd2 f5 17. O-O-O c5 18. Kb1 b5 19. Qxb5 Rab8,"This is a game between Gelfand, B. (as White) and Kramnik, V. (as Black). Last move played: Black plays Rook to b8",Advantage for Black (eval: -71 centipawns),20. Qa5 Rb3 ,19... Rab8 20. Qa4 cxd4 21. Qxd4 Qxa3 22. Rc1 f4 23. Ne5 Nxe5 24. Qxe5 fxe3 25. fxe3 Qd3+ 26. Rc2 a5 27. e4 Rbc8 28. Rc1 Rxc2 29. Qxe6+ Kh8 30. Rxc2 Nb4 31. Bxb4 axb4 
Attacking the backward pawn on b2,True," The comment indicates a potential tactical error by attempting to force a pawn advance, suggesting a flawed assessment of the position.",1. d4 d5 2. c4 c6 3. Nc3 Nf6 4. Nf3 e6 5. e3 Nbd7 6. Qc2 Bd6 7. g4 Bb4 8. Bd2 Qe7 9. a3 Bxc3 10. Bxc3 b6 11. Bd3 Ba6 12. Qa4 dxc4 13. Qxa6 cxd3 14. Qxd3 O-O 15. g5 Nd5 16. Bd2 f5 17. O-O-O c5 18. Kb1 b5 19. Qxb5 Rab8 20. Qa5 Rb3 21. Ka2 Rfb8,"This is a game between Gelfand, B. (as White) and Kramnik, V. (as Black). Last move played: Black plays Rook to b8",Large advantage for Black (eval: -130 centipawns),22. Rb1 ,21... Rfb8 
Demolishes the pawn shield,True,", The comment suggests a tactical failure, indicating a significant error in the move's strategic intent.",1. d4 d5 2. c4 c6 3. Nc3 Nf6 4. Nf3 e6 5. e3 Nbd7 6. Qc2 Bd6 7. g4 Bb4 8. Bd2 Qe7 9. a3 Bxc3 10. Bxc3 b6 11. Bd3 Ba6 12. Qa4 dxc4 13. Qxa6 cxd3 14. Qxd3 O-O 15. g5 Nd5 16. Bd2 f5 17. O-O-O c5 18. Kb1 b5 19. Qxb5 Rab8 20. Qa5 Rb3 21. Ka2 Rfb8 22. Rb1 e5 23. Rhc1 Qe6 24. Ka1 exd4 25. Rxc5 Nxc5 26. Qxc5 Nc3,"This is a game between Gelfand, B. (as White) and Kramnik, V. (as Black). Last move played: Black plays Knight to c3",Large advantage for Black (eval: -541 centipawns),27. g6 R3b5 28. Qxc3 dxc3 29. Bxc3 Qb3 30. gxh7+ Kh8 31. Be5 Ra5 32. Bd6 Ra6 33. Be7 Kxh7 34. Bc5 Ra5 35. Bd6 Rb6 36. Ng5+ Kh6 37. Bc5 Kxg5 ,26... Nc3 27. Qxa7 R3b7 28. Qxb8+ Rxb8 29. bxc3 Rxb1+ 30. Kxb1 Qe4+ 31. Kc1 Qxf3 32. cxd4 Qxf2 33. a4 Qxh2 34. a5 Qe2 35. Kc2 Kf7 36. Kc3 Qb5 37. Kc2 Qc4+ 38. Kd1 Kg6 39. d5 Qd3 
Decoy theme: b2,True,", The comment suggests a tactical error, indicating a potential misjudgment of the board position.",1. d4 d5 2. c4 c6 3. Nc3 Nf6 4. Nf3 e6 5. e3 Nbd7 6. Qc2 Bd6 7. g4 Bb4 8. Bd2 Qe7 9. a3 Bxc3 10. Bxc3 b6 11. Bd3 Ba6 12. Qa4 dxc4 13. Qxa6 cxd3 14. Qxd3 O-O 15. g5 Nd5 16. Bd2 f5 17. O-O-O c5 18. Kb1 b5 19. Qxb5 Rab8 20. Qa5 Rb3 21. Ka2 Rfb8 22. Rb1 e5 23. Rhc1 Qe6 24. Ka1 exd4 25. Rxc5 Nxc5 26. Qxc5 Nc3 27. Nxd4 Rxb2 28. Rxb2,"This is a game between Gelfand, B. (as White) and Kramnik, V. (as Black). Last move played: White plays Rook takes on b2",Mate in 2 for Black,28... Qa2+ 29. Rxa2 Rb1# ,28. Qf8+ Rxf8 29. Rxb2 Qa6 30. Nc2 Qd3 31. Ne1 Qd6 32. Bxc3 Qxa3+ 33. Kb1 Qxc3 34. Nc2 Qd3 35. Ka2 Rc8 36. Nd4 Qa6+ 37. Kb1 Qf1+ 38. Ka2 Qc1 
Theme: Double Attack,True,", The comment suggests a potential tactical error, indicating a flawed strategic plan.",1. d4 d5 2. c4 c6 3. Nc3 Nf6 4. Nf3 e6 5. e3 Nbd7 6. Qc2 Bd6 7. g4 Bb4 8. Bd2 Qe7 9. a3 Bxc3 10. Bxc3 b6 11. Bd3 Ba6 12. Qa4 dxc4 13. Qxa6 cxd3 14. Qxd3 O-O 15. g5 Nd5 16. Bd2 f5 17. O-O-O c5 18. Kb1 b5 19. Qxb5 Rab8 20. Qa5 Rb3 21. Ka2 Rfb8 22. Rb1 e5 23. Rhc1 Qe6 24. Ka1 exd4 25. Rxc5 Nxc5 26. Qxc5 Nc3 27. Nxd4 Rxb2 28. Rxb2 Qa2+,"This is a game between Gelfand, B. (as White) and Kramnik, V. (as Black). Last move played: Black plays Queen to a2 with check",Mate in 1 for Black,29. Rxa2 Rb1# ,28... Qa2+ 29. Rxa2 Rb1# 
