comment,good,reasoning,moves,context,engine_eval,engine_best_line,engine_best_alternative
"Fischer plays a Benoni-style King's Indian. After a brief spell in a transpositional Twilight Zone, the game returns to well-known channels.",True," The comment suggests a flawed opening choice and a return to familiar positions, indicating a mistake.",1. d4 Nf6 2. c4 c5 3. d5 d6 4. Nc3 g6 5. e4 Bg7,This is a game between Spassky (as White) and Fischer (as Black). Last move played: Black plays Bishop to g7,Advantage for White (eval: 84 centipawns),6. h3 O-O ,5... Bg7 6. h3 e6 7. Nf3 exd5 8. exd5 O-O 9. Bd3 Re8+ 10. Be3 Bf5 11. O-O Be4 12. Nxe4 Nxe4 13. Qc2 Nf6 14. Bf4 Qc7 15. g4 Nfd7 16. Ng5 Nf6 17. Rae1 Nbd7 18. Bg3 Rxe1 19. Rxe1 Re8 
This is a more reliable move than 6.Bg5.,True," The comment suggests a more solid development, potentially addressing a weakness in the previous move.",1. d4 Nf6 2. c4 c5 3. d5 d6 4. Nc3 g6 5. e4 Bg7 6. Bd3,This is a game between Spassky (as White) and Fischer (as Black). Last move played: White plays Bishop to d3,Advantage for White (eval: 84 centipawns),6... e6 7. h3 O-O 8. Nf3 exd5 9. exd5 Re8+ 10. Be3 Nbd7 11. O-O a6 12. a4 Ne5 13. Nxe5 Rxe5 14. Bf4 Re8 15. Qd2 Nh5 16. Bh2 f5 17. Rfe1 Rxe1+ 18. Rxe1 Qf8 19. Be2 Nf6 20. Qf4 ,6. h3 O-O 
"Spassky plays conservatively, confident that Black's formation is not a solid one. The point is that by delaying e7-e6, Black will allow his opponent to recapture at d5 with the e-pawn, and the pawn structure will be good for White",True," The comment provides a potential explanation for the mistake, suggesting a defensive strategy based on pawn structure.",1. d4 Nf6 2. c4 c5 3. d5 d6 4. Nc3 g6 5. e4 Bg7 6. Bd3 O-O 7. Nf3,This is a game between Spassky (as White) and Fischer (as Black). Last move played: White plays Knight to f3,Advantage for White (eval: 63 centipawns),7... Bg4 8. O-O e6 9. h3 Bxf3 10. Qxf3 Nbd7 11. Qd1 exd5 12. exd5 Nh5 13. Ne4 Be5 14. f4 Bd4+ 15. Kh2 a6 16. g4 Nhf6 17. Nc3 b5 18. cxb5 Bxc3 19. bxc3 Nxd5 20. bxa6 Nxc3 ,7. h3 e6 8. Nf3 exd5 9. exd5 Re8+ 10. Be3 Bf5 11. O-O Be4 12. Nxe4 Nxe4 13. Qc2 Nf6 14. Rae1 Nbd7 15. Bf4 Rxe1 16. Rxe1 Qc7 17. g4 Re8 18. Qc1 Rxe1+ 19. Qxe1 Kf8 20. Bc2 Ne8 21. Ba4 Bxb2 22. Ng5 Ne5 23. Nxh7+ Kg8 24. Ng5 
"This is a well-known maneuver to fight for the e5 square, but we think that Black could have occupied that key square immediately with a good game. 7...e5 8.O-O Ne8 and f7-f5 will give Black an excellent position.",True," The comment offers a potential alternative strategy, suggesting Black's immediate response was suboptimal.",1. d4 Nf6 2. c4 c5 3. d5 d6 4. Nc3 g6 5. e4 Bg7 6. Bd3 O-O 7. Nf3 Bg4,This is a game between Spassky (as White) and Fischer (as Black). Last move played: Black plays Bishop to g4,Advantage for White (eval: 68 centipawns),8. O-O ,7... Bg4 8. O-O e6 9. h3 Bxf3 10. Qxf3 Nbd7 11. Qd1 exd5 12. exd5 Nh5 13. Ne4 Be5 14. f4 Bd4+ 15. Kh2 a6 16. g4 Nhf6 17. Nc3 b5 18. cxb5 Bxc3 19. bxc3 Nxd5 20. bxa6 Nxc3 
"The exchange of bishop for knight is a common theme in this variation. The bishop has little future in this pawn formation, and the two knights can be used effectively. Fischer has shown a preference for knights in this match.",True," The comment offers a potential explanation for the mistake, suggesting the bishop's role is limited and the knights are strategically valuable.",1. d4 Nf6 2. c4 c5 3. d5 d6 4. Nc3 g6 5. e4 Bg7 6. Bd3 O-O 7. Nf3 Bg4 8. h3 Bxf3 9. Qxf3,This is a game between Spassky (as White) and Fischer (as Black). Last move played: White plays Queen takes on f3,Advantage for White (eval: 76 centipawns),9... e6 ,9. Qxf3 e6 
"We would reach, by transposition, a position from an older game.",True,"  The comment suggests the move was a flawed attempt to create a previous position, indicating a potential strategic error.",1. d4 Nf6 2. c4 c5 3. d5 d6 4. Nc3 g6 5. e4 Bg7 6. Bd3 O-O 7. Nf3 Bg4 8. h3 Bxf3 9. Qxf3 Nbd7 10. Qd1 e6 11. O-O exd5 12. exd5,This is a game between Spassky (as White) and Fischer (as Black). Last move played: White plays Pawn takes on d5,Advantage for White (eval: 78 centipawns),12... Nh5 13. Ne4 ,12. exd5 Nh5 
"The e6-square looks weak, but it is not easy to take advantage of this. Still, the knight should have gone to d7, from which it could retreat to f8 later if needed, or work on the queenside via b6.",True," The comment offers potential strategic considerations for a corrective move, suggesting a missed opportunity.",1. d4 Nf6 2. c4 c5 3. d5 d6 4. Nc3 g6 5. e4 Bg7 6. Bd3 O-O 7. Nf3 Bg4 8. h3 Bxf3 9. Qxf3 Nbd7 10. Qd1 e6 11. O-O exd5 12. exd5 Ne8 13. Bd2 Ne5 14. Be2 f5 15. f4 Nf7,This is a game between Spassky (as White) and Fischer (as Black). Last move played: Black plays Knight to f7,Advantage for White (eval: 86 centipawns),16. g4 Bd4+ 17. Kg2 Nf6 18. Qc2 Qd7 19. g5 Bxc3 20. Bxc3 Ne4 21. Rfe1 Rfe8 22. Bf3 Nxc3 23. Qxc3 Rxe1 24. Rxe1 Re8 25. Re6 Rxe6 26. dxe6 Qxe6 27. Kf2 Qe7 28. Bd5 Kf8 29. h4 Ke8 30. Kf1 ,15... Nd7 16. Qc2 Bd4+ 17. Kh2 Nef6 18. Rae1 Bxc3 19. Bxc3 Ne4 20. Bf3 Nxc3 21. Qxc3 Rf7 22. Re6 Nf8 23. Re3 Re7 24. Rxe7 Qxe7 25. Re1 Qh4 26. g3 Qd8 27. Bd1 Qd7 28. b4 Re8 29. bxc5 Rxe1 30. Qxe1 dxc5 
"It is not easy to give a recommendation for Black here, but inviting g4- g5 was hardly the correct plan. There are two alternatives which come to mind, each of which may help justify Fischer's play in the opening. 16...fxg4 17. hxg4 g5!? undermines White's pressure at e5.",True," The comment identifies a flawed plan and suggests alternative moves, indicating a concern with the move's strategic implications.",1. d4 Nf6 2. c4 c5 3. d5 d6 4. Nc3 g6 5. e4 Bg7 6. Bd3 O-O 7. Nf3 Bg4 8. h3 Bxf3 9. Qxf3 Nbd7 10. Qd1 e6 11. O-O exd5 12. exd5 Ne8 13. Bd2 Ne5 14. Be2 f5 15. f4 Nf7 16. g4 Nh6,This is a game between Spassky (as White) and Fischer (as Black). Last move played: Black plays Knight to h6,Large advantage for White (eval: 125 centipawns),17. g5 Nf7 ,16... Bd4+ 17. Kg2 Ng7 18. Qc2 Re8 19. Rae1 Qh4 20. Qd3 a6 21. Bd1 Rxe1 22. Bxe1 Qe7 23. Bd2 h6 24. gxf5 gxf5 25. b3 Re8 26. Ne2 Be3 27. Be1 Qe4+ 28. Qxe4 fxe4 
"White's general plan is to advance his h-pawn, while Black's potential queenside counterplay has been neutralized by this move. Fischer is a player who requires active piece play, and here he is suffocating.",True, The comment accurately describes a strategic blunder and suggests a lack of initiative.,1. d4 Nf6 2. c4 c5 3. d5 d6 4. Nc3 g6 5. e4 Bg7 6. Bd3 O-O 7. Nf3 Bg4 8. h3 Bxf3 9. Qxf3 Nbd7 10. Qd1 e6 11. O-O exd5 12. exd5 Ne8 13. Bd2 Ne5 14. Be2 f5 15. f4 Nf7 16. g4 Nh6 17. Kg2 Nc7 18. g5 Nf7 19. Rb1 Re8 20. Bd3 Rb8 21. h4 a6 22. Qc2 b5 23. b3,This is a game between Spassky (as White) and Fischer (as Black). Last move played: White plays Pawn to b3,Large advantage for White (eval: 151 centipawns),23... h5 24. Ne2 Qd7 25. Ng3 Bd4 26. Bc3 Bxc3 27. Qxc3 b4 28. Qc2 Nh8 29. Bxf5 gxf5 30. Nxf5 Re2+ 31. Qxe2 Qxf5 32. Qxh5 Re8 33. Qf3 Ng6 34. Kg3 Re4 35. Rbe1 Rxf4 36. Qxf4 Nxf4 37. Rxf4 Qh7 38. g6 Qg7 39. Re3 Qa1 40. Re7 Qg1+ 41. Kh3 Qxg6 42. Rxc7 ,23. b3 h5 
Fischer's play on the b-file will be futile. Spassky now increases the pressure slowly and surely.,True," The comment suggests a strategic error and a slow, deliberate approach, indicating a flawed plan.",1. d4 Nf6 2. c4 c5 3. d5 d6 4. Nc3 g6 5. e4 Bg7 6. Bd3 O-O 7. Nf3 Bg4 8. h3 Bxf3 9. Qxf3 Nbd7 10. Qd1 e6 11. O-O exd5 12. exd5 Ne8 13. Bd2 Ne5 14. Be2 f5 15. f4 Nf7 16. g4 Nh6 17. Kg2 Nc7 18. g5 Nf7 19. Rb1 Re8 20. Bd3 Rb8 21. h4 a6 22. Qc2 b5 23. b3 Rb7,This is a game between Spassky (as White) and Fischer (as Black). Last move played: Black plays Rook to b7,Large advantage for White (eval: 221 centipawns),24. h5 Re7 25. Ne2 Qa8 26. h6 Bh8 27. Ng3 Bd4 28. Rbe1 bxc4 29. Bxc4 Kf8 30. Rxe7 Kxe7 31. Re1+ Kf8 ,23... h5 24. Ne2 Qd7 25. Ng3 Bd4 26. Bc3 Bxc3 27. Qxc3 b4 28. Qc2 Nh8 29. Bxf5 gxf5 30. Nxf5 Re2+ 31. Qxe2 Qxf5 32. Qxh5 Re8 33. Qf3 Ng6 34. Kg3 Re4 35. Rbe1 Rxf4 36. Qxf4 Nxf4 37. Rxf4 Qh7 38. g6 Qg7 39. Re3 Qa1 40. Re7 Qg1+ 41. Kh3 Qxg6 42. Rxc7 
White continues to press against Black's pieces. Now Spassky steers straight for the thematic sacrifice of the knight at f5.,True, The comment suggests a potential tactical blunder and a risky sacrifice.,1. d4 Nf6 2. c4 c5 3. d5 d6 4. Nc3 g6 5. e4 Bg7 6. Bd3 O-O 7. Nf3 Bg4 8. h3 Bxf3 9. Qxf3 Nbd7 10. Qd1 e6 11. O-O exd5 12. exd5 Ne8 13. Bd2 Ne5 14. Be2 f5 15. f4 Nf7 16. g4 Nh6 17. Kg2 Nc7 18. g5 Nf7 19. Rb1 Re8 20. Bd3 Rb8 21. h4 a6 22. Qc2 b5 23. b3 Rb7 24. Rbe1 Rxe1 25. Rxe1 Qb8 26. Bc1 Qd8 27. Ne2 bxc4 28. bxc4 Ne8 29. h5 Re7 30. h6,This is a game between Spassky (as White) and Fischer (as Black). Last move played: White plays Pawn to h6,Large advantage for White (eval: 245 centipawns),30... Bh8 31. Bd2 Qd7 32. Rh1 Qa7 33. Ng1 Rb7 34. Nf3 Kf8 35. Qa4 Re7 36. Rb1 Rb7 37. Re1 Re7 38. Rxe7 Kxe7 39. Qc6 Kf8 40. Qc8 Ba1 41. Kf1 Bd4 42. Nxd4 cxd4 43. Ke2 Qe7+ 44. Kd1 ,30. Bd2 Bh8 31. Rb1 Qd7 32. Ng3 Bd4 33. h6 Kf8 34. Rb3 Qa4 35. Ne2 Be3 36. Bxe3 Rxe3 37. Qb2 Qa5 
"White has achieved a winning position. Now perhaps the most efficient path to victory is the one which both Deep Thought and our analytical team prefer, namely the immediate sacrifice at f5.",True," The comment suggests a seemingly aggressive move, potentially indicating a flawed assessment of the resulting position.",1. d4 Nf6 2. c4 c5 3. d5 d6 4. Nc3 g6 5. e4 Bg7 6. Bd3 O-O 7. Nf3 Bg4 8. h3 Bxf3 9. Qxf3 Nbd7 10. Qd1 e6 11. O-O exd5 12. exd5 Ne8 13. Bd2 Ne5 14. Be2 f5 15. f4 Nf7 16. g4 Nh6 17. Kg2 Nc7 18. g5 Nf7 19. Rb1 Re8 20. Bd3 Rb8 21. h4 a6 22. Qc2 b5 23. b3 Rb7 24. Rbe1 Rxe1 25. Rxe1 Qb8 26. Bc1 Qd8 27. Ne2 bxc4 28. bxc4 Ne8 29. h5 Re7 30. h6 Bh8 31. Bd2 Rb7 32. Rb1 Qb8 33. Ng3 Rxb1 34. Qxb1 Qxb1 35. Bxb1 Bb2 36. Kf3 Kf8,This is a game between Spassky (as White) and Fischer (as Black). Last move played: Black plays King to f8,Large advantage for White (eval: 316 centipawns),37. Nxf5 gxf5 38. Bxf5 Nf6 39. gxf6 Nxh6 40. Bc8 Bxf6 41. a4 Bd8 42. a5 Ke8 43. Bxa6 Kd7 44. Bb5+ Kc7 45. Ke4 Bf6 46. Be8 Bd8 47. Bc6 Ng4 48. Kf5 h5 49. Ke6 ,36... Ba3 37. Bc3 Bb4 38. Bb2 Bd2 39. Bc2 Kf8 40. Ba4 Ke7 41. Ba1 Bc1 42. Bc3 Ba3 43. Nf1 Bb4 44. Bb2 Nd8 45. Ke2 Nf7 46. Ne3 Ba5 47. Ng2 Nd8 48. Kd3 Nb7 49. Nh4 Nd8 50. Kc2 Nf7 51. Kb3 Nd8 
"37.Nxf5 gxf5 38.Bxf5 Kg8 39.Bc8 and the a-pawn falls. Spassky chooses another path, and it is also convincing.",True," The comment describes a specific tactical blunder, suggesting a flawed strategic choice.",1. d4 Nf6 2. c4 c5 3. d5 d6 4. Nc3 g6 5. e4 Bg7 6. Bd3 O-O 7. Nf3 Bg4 8. h3 Bxf3 9. Qxf3 Nbd7 10. Qd1 e6 11. O-O exd5 12. exd5 Ne8 13. Bd2 Ne5 14. Be2 f5 15. f4 Nf7 16. g4 Nh6 17. Kg2 Nc7 18. g5 Nf7 19. Rb1 Re8 20. Bd3 Rb8 21. h4 a6 22. Qc2 b5 23. b3 Rb7 24. Rbe1 Rxe1 25. Rxe1 Qb8 26. Bc1 Qd8 27. Ne2 bxc4 28. bxc4 Ne8 29. h5 Re7 30. h6 Bh8 31. Bd2 Rb7 32. Rb1 Qb8 33. Ng3 Rxb1 34. Qxb1 Qxb1 35. Bxb1 Bb2 36. Kf3 Kf8 37. Ke2,This is a game between Spassky (as White) and Fischer (as Black). Last move played: White plays King to e2,Large advantage for White (eval: 249 centipawns),37... Nh8 38. Kd3 Ba1 39. Bc2 Ke7 40. Ba5 Nf7 41. Ne2 Bh8 42. Ba4 Ba1 43. Kc2 Nd8 44. Bb6 Nf7 45. Kb3 Nd8 46. Ka3 Bh8 47. Bc6 Nxc6 48. dxc6 Ke6 49. Ka4 d5 50. Bxc5 dxc4 ,37. Nxf5 gxf5 38. Bxf5 Nf6 39. gxf6 Nxh6 40. Bc8 Bxf6 41. a4 Bd8 42. a5 Ke8 43. Bxa6 Kd7 44. Bb5+ Kc7 45. Ke4 Bf6 46. Be8 Bd8 47. Bc6 Ng4 48. Kf5 h5 49. Ke6 
"An ugly move, but otherwise disaster could strike quickly. 37...Ke7 38.Nxf5+ gxf5 39.Bxf5 and the h-pawn falls.",True," The comment suggests a potential weakness in the move’s development and pawn structure, indicating a flawed strategic choice.",1. d4 Nf6 2. c4 c5 3. d5 d6 4. Nc3 g6 5. e4 Bg7 6. Bd3 O-O 7. Nf3 Bg4 8. h3 Bxf3 9. Qxf3 Nbd7 10. Qd1 e6 11. O-O exd5 12. exd5 Ne8 13. Bd2 Ne5 14. Be2 f5 15. f4 Nf7 16. g4 Nh6 17. Kg2 Nc7 18. g5 Nf7 19. Rb1 Re8 20. Bd3 Rb8 21. h4 a6 22. Qc2 b5 23. b3 Rb7 24. Rbe1 Rxe1 25. Rxe1 Qb8 26. Bc1 Qd8 27. Ne2 bxc4 28. bxc4 Ne8 29. h5 Re7 30. h6 Bh8 31. Bd2 Rb7 32. Rb1 Qb8 33. Ng3 Rxb1 34. Qxb1 Qxb1 35. Bxb1 Bb2 36. Kf3 Kf8 37. Ke2 Nh8,This is a game between Spassky (as White) and Fischer (as Black). Last move played: Black plays Knight to h8,Large advantage for White (eval: 254 centipawns),38. Bc2 Ke7 39. Kd1 Nf7 40. Nxf5+ gxf5 41. Bxf5 Nf6 42. Kc2 Bd4 43. Kb3 Kd8 44. Ka4 Kc7 45. Be6 Nxh6 46. gxh6 Kb7 47. Ka3 Ne4 48. Bc1 Ng3 49. Kb3 Ne4 ,37... Nh8 38. Kd3 Ba1 39. Bc2 Ke7 40. Ba5 Nf7 41. Ne2 Bh8 42. Ba4 Ba1 43. Kc2 Nd8 44. Bb6 Nf7 45. Kb3 Nd8 46. Ka3 Bh8 47. Bc6 Nxc6 48. dxc6 Ke6 49. Ka4 d5 50. Bxc5 dxc4 
"47...Bxg5 was the last chance, but even here White would win with accurateplay.",True," The comment expresses a perceived strategic failure, suggesting the move was ineffective despite appearing to be the optimal path.",1. d4 Nf6 2. c4 c5 3. d5 d6 4. Nc3 g6 5. e4 Bg7 6. Bd3 O-O 7. Nf3 Bg4 8. h3 Bxf3 9. Qxf3 Nbd7 10. Qd1 e6 11. O-O exd5 12. exd5 Ne8 13. Bd2 Ne5 14. Be2 f5 15. f4 Nf7 16. g4 Nh6 17. Kg2 Nc7 18. g5 Nf7 19. Rb1 Re8 20. Bd3 Rb8 21. h4 a6 22. Qc2 b5 23. b3 Rb7 24. Rbe1 Rxe1 25. Rxe1 Qb8 26. Bc1 Qd8 27. Ne2 bxc4 28. bxc4 Ne8 29. h5 Re7 30. h6 Bh8 31. Bd2 Rb7 32. Rb1 Qb8 33. Ng3 Rxb1 34. Qxb1 Qxb1 35. Bxb1 Bb2 36. Kf3 Kf8 37. Ke2 Nh8 38. Kd1 Ke7 39. Kc2 Bd4 40. Kb3 Bf2 41. Nh1 Bh4 42. Ka4 Nc7 43. Ka5 Kd7 44. Kb6 Kc8 45. Bc2 Nf7 46. Ba4 Kb8 47. Bd7 Nd8,This is a game between Spassky (as White) and Fischer (as Black). Last move played: Black plays Knight to d8,Large advantage for White (eval: 355 centipawns),48. Bc3 Na8+ 49. Kxa6 Nc7+ 50. Kb6 Na8+ 51. Kb5 Nc7+ 52. Ka4 Na8 53. Kb3 Kb7 54. Bf6 Nf7 55. a4 Nb6 56. Bc6+ Kb8 57. a5 Nc8 58. Bc3 Nxg5 59. fxg5 Bxg5 60. Nf2 Bxh6 61. Bd7 Kb7 62. a6+ Kc7 63. Be6 Be3 ,47... Nd8 48. Bc3 Na8+ 49. Kxa6 Nc7+ 50. Kb6 Na8+ 51. Kb5 Nc7+ 52. Ka4 Na6 53. Bf6 Nf7 54. Bg7 Nd8 55. a3 Kb7 56. Bf6 Nf7 57. Bc3 Nd8 58. Bg7 Nc7 59. Bf8 Na8 60. Kb3 Kc7 61. Be8 Be1 62. Kc2 Nb6 63. Kd3 Nd7 64. Be7 
Black's knights are utterly useless. 48...Nf7 49.Be6 Nd8 50.Bg8,True," The comment expresses a strong negative opinion about the knights' position, suggesting a significant tactical flaw.",1. d4 Nf6 2. c4 c5 3. d5 d6 4. Nc3 g6 5. e4 Bg7 6. Bd3 O-O 7. Nf3 Bg4 8. h3 Bxf3 9. Qxf3 Nbd7 10. Qd1 e6 11. O-O exd5 12. exd5 Ne8 13. Bd2 Ne5 14. Be2 f5 15. f4 Nf7 16. g4 Nh6 17. Kg2 Nc7 18. g5 Nf7 19. Rb1 Re8 20. Bd3 Rb8 21. h4 a6 22. Qc2 b5 23. b3 Rb7 24. Rbe1 Rxe1 25. Rxe1 Qb8 26. Bc1 Qd8 27. Ne2 bxc4 28. bxc4 Ne8 29. h5 Re7 30. h6 Bh8 31. Bd2 Rb7 32. Rb1 Qb8 33. Ng3 Rxb1 34. Qxb1 Qxb1 35. Bxb1 Bb2 36. Kf3 Kf8 37. Ke2 Nh8 38. Kd1 Ke7 39. Kc2 Bd4 40. Kb3 Bf2 41. Nh1 Bh4 42. Ka4 Nc7 43. Ka5 Kd7 44. Kb6 Kc8 45. Bc2 Nf7 46. Ba4 Kb8 47. Bd7 Nd8 48. Bc3 Na8+,This is a game between Spassky (as White) and Fischer (as Black). Last move played: Black plays Knight to a8 with check,Large advantage for White (eval: 350 centipawns),49. Kxa6 ,48... Na8+ 49. Kxa6 
The king has accomplished its task of eliminating Black's pawn and now returns home to safety.,False,"

The comment offers no insight into why the move was considered a mistake, merely stating a result of the action.",1. d4 Nf6 2. c4 c5 3. d5 d6 4. Nc3 g6 5. e4 Bg7 6. Bd3 O-O 7. Nf3 Bg4 8. h3 Bxf3 9. Qxf3 Nbd7 10. Qd1 e6 11. O-O exd5 12. exd5 Ne8 13. Bd2 Ne5 14. Be2 f5 15. f4 Nf7 16. g4 Nh6 17. Kg2 Nc7 18. g5 Nf7 19. Rb1 Re8 20. Bd3 Rb8 21. h4 a6 22. Qc2 b5 23. b3 Rb7 24. Rbe1 Rxe1 25. Rxe1 Qb8 26. Bc1 Qd8 27. Ne2 bxc4 28. bxc4 Ne8 29. h5 Re7 30. h6 Bh8 31. Bd2 Rb7 32. Rb1 Qb8 33. Ng3 Rxb1 34. Qxb1 Qxb1 35. Bxb1 Bb2 36. Kf3 Kf8 37. Ke2 Nh8 38. Kd1 Ke7 39. Kc2 Bd4 40. Kb3 Bf2 41. Nh1 Bh4 42. Ka4 Nc7 43. Ka5 Kd7 44. Kb6 Kc8 45. Bc2 Nf7 46. Ba4 Kb8 47. Bd7 Nd8 48. Bc3 Na8+ 49. Kxa6 Nc7+ 50. Kb6 Na8+ 51. Ka5 Kb7 52. Kb5 Nc7+ 53. Ka4 Na8 54. Kb3,This is a game between Spassky (as White) and Fischer (as Black). Last move played: White plays King to b3,Large advantage for White (eval: 381 centipawns),54... Kb8 55. Bg7 Ka7 56. Bf6 Nb7 57. Be8 Na5+ 58. Kc3 Nb6 59. Bxg6 Naxc4 60. Bxh7 Ne3 61. Bg7 Nbxd5+ 62. Kd2 Nf1+ 63. Kc1 Nxf4 64. Bxf5 Bxg5 65. h7 Nd5+ 66. Kb1 Bf6 67. Bxf6 ,54. Kb3 Kb6 55. Bg7 Kb7 56. Bf6 Nf7 57. Be8 Nxh6 58. Bc6+ Kb8 59. Be7 Kc7 60. gxh6 Bxe7 61. Bxa8 Bf8 62. Nf2 Bxh6 63. Nh3 Kb6 64. Bc6 Bf8 65. Kc2 
"Spassky plays conservatively, confident that Black's formation is not a solid one. The point is that by delaying e7-e6, Black will allow his opponent to recapture at d5 with the e-pawn, and the pawn structure will be good for White",True," The comment offers a possible explanation for the mistake, suggesting a strategic approach.",1. d4 Nf6 2. c4 c5 3. d5 d6 4. Nc3 g6 5. e4 Bg7 6. Bd3 O-O 7. Nf3,This is a game between Spassky (as White) and Fischer (as Black). Last move played: White plays Knight to f3,Advantage for White (eval: 63 centipawns),7... Bg4 8. O-O e6 9. h3 Bxf3 10. Qxf3 Nbd7 11. Qd1 exd5 12. exd5 Nh5 13. Ne4 Be5 14. f4 Bd4+ 15. Kh2 a6 16. g4 Nhf6 17. Nc3 b5 18. cxb5 Bxc3 19. bxc3 Nxd5 20. bxa6 Nxc3 ,7. h3 e6 8. Nf3 exd5 9. exd5 Re8+ 10. Be3 Bf5 11. O-O Be4 12. Nxe4 Nxe4 13. Qc2 Nf6 14. Rae1 Nbd7 15. Bf4 Rxe1 16. Rxe1 Qc7 17. g4 Re8 18. Qc1 Rxe1+ 19. Qxe1 Kf8 20. Bc2 Ne8 21. Ba4 Bxb2 22. Ng5 Ne5 23. Nxh7+ Kg8 24. Ng5 
"This is a well-known maneuver to fight for the e5 square, but we think that Black could have occupied that key square immediately with a good game. 7...e5 8.O-O Ne8 and f7-f5 will give Black an excellent position.",True," The comment suggests a specific strategic objective that was mismanaged, indicating a flawed plan.",1. d4 Nf6 2. c4 c5 3. d5 d6 4. Nc3 g6 5. e4 Bg7 6. Bd3 O-O 7. Nf3 Bg4,This is a game between Spassky (as White) and Fischer (as Black). Last move played: Black plays Bishop to g4,Advantage for White (eval: 68 centipawns),8. O-O ,7... Bg4 8. O-O e6 9. h3 Bxf3 10. Qxf3 Nbd7 11. Qd1 exd5 12. exd5 Nh5 13. Ne4 Be5 14. f4 Bd4+ 15. Kh2 a6 16. g4 Nhf6 17. Nc3 b5 18. cxb5 Bxc3 19. bxc3 Nxd5 20. bxa6 Nxc3 
"The e6-square looks weak, but it is not easy to take advantage of this. Still, the knight should have gone to d7, from which it could retreat to f8 later if needed, or work on the queenside via b6.",True,", The comment suggests a potential tactical error, indicating a flawed plan.",1. d4 Nf6 2. c4 c5 3. d5 d6 4. Nc3 g6 5. e4 Bg7 6. Bd3 O-O 7. Nf3 Bg4 8. h3 Bxf3 9. Qxf3 Nbd7 10. Qd1 e6 11. O-O exd5 12. exd5 Ne8 13. Bd2 Ne5 14. Be2 f5 15. f4 Nf7,This is a game between Spassky (as White) and Fischer (as Black). Last move played: Black plays Knight to f7,Advantage for White (eval: 86 centipawns),16. g4 Bd4+ 17. Kg2 Nf6 18. Qc2 Qd7 19. g5 Bxc3 20. Bxc3 Ne4 21. Rfe1 Rfe8 22. Bf3 Nxc3 23. Qxc3 Rxe1 24. Rxe1 Re8 25. Re6 Rxe6 26. dxe6 Qxe6 27. Kf2 Qe7 28. Bd5 Kf8 29. h4 Ke8 30. Kf1 ,15... Nd7 16. Qc2 Bd4+ 17. Kh2 Nef6 18. Rae1 Bxc3 19. Bxc3 Ne4 20. Bf3 Nxc3 21. Qxc3 Rf7 22. Re6 Nf8 23. Re3 Re7 24. Rxe7 Qxe7 25. Re1 Qh4 26. g3 Qd8 27. Bd1 Qd7 28. b4 Re8 29. bxc5 Rxe1 30. Qxe1 dxc5 
"White avoids Ne5, which would have forked the bishop and queen, leading to the elimination of the powerful bishop.",True," The comment suggests White’s advantage stems from weakening Black’s pieces, indicating a flaw in the analysis.",1. d4 Nf6 2. c4 c5 3. d5 d6 4. Nc3 g6 5. e4 Bg7 6. Bd3 O-O 7. Nf3 Bg4 8. h3 Bxf3 9. Qxf3 Nbd7 10. Qd1,This is a game between Spassky (as White) and Fischer (as Black). Last move played: White plays Queen to d1,Advantage for White (eval: 57 centipawns),10... e6 11. O-O ,10. Qd1 e6 
"Fischer plays a Benoni-style King's Indian. After a brief spell in a transpositional Twilight Zone, the game returns to well-known channels.",True, The comment identifies a potential tactical error and explains its consequences.,1. d4 Nf6 2. c4 c5 3. d5 d6 4. Nc3 g6 5. e4 Bg7,This is a game between Spassky (as White) and Fischer (as Black). Last move played: Black plays Bishop to g7,Advantage for White (eval: 84 centipawns),6. h3 O-O ,5... Bg7 6. h3 e6 7. Nf3 exd5 8. exd5 O-O 9. Bd3 Re8+ 10. Be3 Bf5 11. O-O Be4 12. Nxe4 Nxe4 13. Qc2 Nf6 14. Bf4 Qc7 15. g4 Nfd7 16. Ng5 Nf6 17. Rae1 Nbd7 18. Bg3 Rxe1 19. Rxe1 Re8 
