comment,good,reasoning,moves,context,engine_eval,engine_best_line,engine_best_alternative
In accordance with the principle of controlling as quickly as possible the square in front of the isolated pawn - in this case d5.,True," The comment suggests a strategic goal, but doesn't explicitly identify the error as a mistake, just a desired objective.",1. c4 e6 2. Nf3 d5 3. d4 Nf6 4. Bg5 Be7 5. Nc3 O-O 6. e3 Nbd7 7. Bd3 c5 8. O-O cxd4 9. exd4 dxc4 10. Bxc4 Nb6,This is a game between Botvinnik (as White) and Vidmar (as Black). Last move played: Black plays Knight to b6,Slight advantage for White (eval: 26 centipawns),11. Bb3 Bd7 ,10... a6 11. a4 h6 12. Bh4 Nb6 13. Bb3 Bd7 14. Ne5 Bc6 15. Re1 Nbd5 16. a5 Qc7 17. Bg3 Qd8 18. Nxc6 bxc6 19. Nxd5 Nxd5 20. Re2 Bh4 21. Rc2 Nb4 22. Rd2 Bxg3 23. hxg3 Rb8 
"It is very important to maintain the Bishop on this diagonal, as the following play will make clear",True," The comment suggests a strategic reason for the move, potentially indicating a flawed plan.",1. c4 e6 2. Nf3 d5 3. d4 Nf6 4. Bg5 Be7 5. Nc3 O-O 6. e3 Nbd7 7. Bd3 c5 8. O-O cxd4 9. exd4 dxc4 10. Bxc4 Nb6 11. Bb3,This is a game between Botvinnik (as White) and Vidmar (as Black). Last move played: White plays Bishop to b3,Slight advantage for White (eval: 29 centipawns),11... Bd7 12. Ne5 Bc6 13. Qd3 Nfd7 14. Bc2 g6 15. Nxc6 bxc6 16. Bh6 Re8 17. Rfd1 Bg5 18. Bxg5 Qxg5 19. Qf3 Nf6 20. g3 Nbd5 21. Rac1 Nxc3 22. Qxc3 Rec8 23. h4 Qh5 ,11. Bb3 Bd7 
"It is always difficult to judge how to make the best use of the Rooks in a case like this. They could be planted on the open file (c and e), but then the weakness of the d-pawn stands out Another placing would be c1 and d1; but the ideal arrangement is that chosen by Botvinnik. It will soon become clear why the Rook is best left at f1",True," The comment offers a potential explanation for the mistake, suggesting a suboptimal placement for the Rooks.",1. c4 e6 2. Nf3 d5 3. d4 Nf6 4. Bg5 Be7 5. Nc3 O-O 6. e3 Nbd7 7. Bd3 c5 8. O-O cxd4 9. exd4 dxc4 10. Bxc4 Nb6 11. Bb3 Bd7 12. Qd3 Nbd5 13. Ne5 Bc6 14. Rad1,This is a game between Botvinnik (as White) and Vidmar (as Black). Last move played: White plays Rook to d1,Slight advantage for White (eval: 32 centipawns),14... Nd7 ,14. Qh3 
This merely drives the Queen to a better square,True,", The comment suggests the Queen is being moved to a more active position, implying a suboptimal choice.",1. c4 e6 2. Nf3 d5 3. d4 Nf6 4. Bg5 Be7 5. Nc3 O-O 6. e3 Nbd7 7. Bd3 c5 8. O-O cxd4 9. exd4 dxc4 10. Bxc4 Nb6 11. Bb3 Bd7 12. Qd3 Nbd5 13. Ne5 Bc6 14. Rad1 Nb4,This is a game between Botvinnik (as White) and Vidmar (as Black). Last move played: Black plays Knight to b4,Advantage for White (eval: 61 centipawns),15. Qh3 ,14... Nd7 
"After this move, the White attack breaks with full intensity",True," The comment suggests the attack is strong, implying a flaw in the original plan.",1. c4 e6 2. Nf3 d5 3. d4 Nf6 4. Bg5 Be7 5. Nc3 O-O 6. e3 Nbd7 7. Bd3 c5 8. O-O cxd4 9. exd4 dxc4 10. Bxc4 Nb6 11. Bb3 Bd7 12. Qd3 Nbd5 13. Ne5 Bc6 14. Rad1 Nb4 15. Qh3 Bd5 16. Nxd5 Nbxd5,This is a game between Botvinnik (as White) and Vidmar (as Black). Last move played: Black plays Knight takes on d5,Large advantage for White (eval: 181 centipawns),17. f4 ,16... Nfxd5 
Played at the right moment,False,"

The comment suggests a justification for a mistake, but doesn't directly explain why the move was considered a mistake.",1. c4 e6 2. Nf3 d5 3. d4 Nf6 4. Bg5 Be7 5. Nc3 O-O 6. e3 Nbd7 7. Bd3 c5 8. O-O cxd4 9. exd4 dxc4 10. Bxc4 Nb6 11. Bb3 Bd7 12. Qd3 Nbd5 13. Ne5 Bc6 14. Rad1 Nb4 15. Qh3 Bd5 16. Nxd5 Nbxd5 17. f4,This is a game between Botvinnik (as White) and Vidmar (as Black). Last move played: White plays Pawn to f4,Large advantage for White (eval: 183 centipawns),17... a5 18. a4 ,17. f4 
"Now it is clear why the Rook stayed on f1, and what an important duty awaited the Bishop on b3. The White pieces now work together like components of a well-oiled machine",True," The comment offers a subjective interpretation of the move’s impact, suggesting a strategic plan, which is not necessarily a valid assessment of a mistake.",1. c4 e6 2. Nf3 d5 3. d4 Nf6 4. Bg5 Be7 5. Nc3 O-O 6. e3 Nbd7 7. Bd3 c5 8. O-O cxd4 9. exd4 dxc4 10. Bxc4 Nb6 11. Bb3 Bd7 12. Qd3 Nbd5 13. Ne5 Bc6 14. Rad1 Nb4 15. Qh3 Bd5 16. Nxd5 Nbxd5 17. f4 Rc8 18. f5 exf5 19. Rxf5,This is a game between Botvinnik (as White) and Vidmar (as Black). Last move played: White plays Rook takes on f5,Large advantage for White (eval: 255 centipawns),19... a5 20. a4 ,19. Rxf5 Rc7 20. Rdf1 Nb4 21. R5f4 a5 22. a4 Qc8 23. Qg3 Nbd5 24. Bxd5 Nxd5 25. Bh6 g6 26. Rxf7 Rxf7 27. Nxf7 Qe6 28. Ne5 Qb6 29. Kh1 Bf6 
Giving his opponent the opportunity to force the game prettily,True," The comment suggests the player sacrificed a piece to create a forced draw, indicating a flawed strategic decision.",1. c4 e6 2. Nf3 d5 3. d4 Nf6 4. Bg5 Be7 5. Nc3 O-O 6. e3 Nbd7 7. Bd3 c5 8. O-O cxd4 9. exd4 dxc4 10. Bxc4 Nb6 11. Bb3 Bd7 12. Qd3 Nbd5 13. Ne5 Bc6 14. Rad1 Nb4 15. Qh3 Bd5 16. Nxd5 Nbxd5 17. f4 Rc8 18. f5 exf5 19. Rxf5 Qd6,This is a game between Botvinnik (as White) and Vidmar (as Black). Last move played: Black plays Queen to d6,Large advantage for White (eval: 512 centipawns),20. Nxf7 Rxf7 21. Bxf6 Nxf6 22. Rxf6 gxf6 23. Qxc8+ Kg7 24. Bxf7 Kxf7 25. Qxb7 Qe6 26. Kh1 Qe2 27. Rc1 Kf8 28. Qb8+ Kf7 29. h3 Qe3 30. Qb3+ Qxb3 31. axb3 Ke6 32. Ra1 Kd5 33. Rxa7 Bb4 34. g4 Ke4 35. Kg2 ,19... a5 20. a4 
"Always this same sacrifice. It is no accident that the offer is made on the square where the lines of action of the Rooks and Bishop meet. In problem terminology, this is a cutting-point, so we may describe this as a cutting-point combination",True," The comment describes a specific tactical situation, suggesting the sacrifice is a result of a strategic maneuver.",1. c4 e6 2. Nf3 d5 3. d4 Nf6 4. Bg5 Be7 5. Nc3 O-O 6. e3 Nbd7 7. Bd3 c5 8. O-O cxd4 9. exd4 dxc4 10. Bxc4 Nb6 11. Bb3 Bd7 12. Qd3 Nbd5 13. Ne5 Bc6 14. Rad1 Nb4 15. Qh3 Bd5 16. Nxd5 Nbxd5 17. f4 Rc8 18. f5 exf5 19. Rxf5 Qd6 20. Nxf7,This is a game between Botvinnik (as White) and Vidmar (as Black). Last move played: White plays Knight takes on f7,Large advantage for White (eval: 514 centipawns),20... Rxf7 21. Bxf6 Nxf6 22. Rxf6 gxf6 23. Qxc8+ Kg7 24. Bxf7 Kxf7 25. Qxb7 Qe6 26. Kh1 f5 27. Qc7 Qe2 28. Rb1 Qe4 29. Rf1 Qe6 30. Rc1 Qe4 31. a3 ,20. Nxf7 Rxf7 21. Bxf6 Nxf6 22. Rxf6 gxf6 23. Qxc8+ Kg7 24. Bxf7 Kxf7 25. Qxb7 Qe6 26. Kh1 Qe2 27. Rc1 Kf8 28. Qb8+ Kf7 29. h3 Qe3 30. Qb3+ Qxb3 31. axb3 Ke6 32. Ra1 Kd5 33. Rxa7 Bb4 34. g4 Ke4 35. Kg2 
