comment,good,reasoning,moves,context,engine_eval,engine_best_line,engine_best_alternative
"Black plays for attack, and is not concerned about holding the extra pawn",True," The comment suggests a lack of defensive consideration, indicating a flawed strategic approach.",1. d4 Nf6 2. Nf3 d5 3. c4 c6 4. Nc3 dxc4 5. e3 b5 6. a4 b4 7. Na2 e6 8. Bxc4 Be7 9. O-O O-O 10. Qe2 Bb7 11. Rd1 a5 12. Bd2 Nbd7 13. Nc1 Qb6 14. Nd3 c5 15. Nde5 Nxe5 16. Nxe5 Rad8 17. Bb5 cxd4 18. exd4 Qxd4 19. Nc4 Qd5,This is a game between Fridstein (as White) and Smyslov (as Black). Last move played: Black plays Queen to d5,Slight advantage for Black (eval: -28 centipawns),20. f3 ,19... Qa7 20. Be3 
"The outcome of the combination is clear enough. White's King position is wrecked, and this fact now dictates the course of the game",True," The comment expresses a pessimistic assessment of the resulting position, suggesting a significant loss of strategic advantage.",1. d4 Nf6 2. Nf3 d5 3. c4 c6 4. Nc3 dxc4 5. e3 b5 6. a4 b4 7. Na2 e6 8. Bxc4 Be7 9. O-O O-O 10. Qe2 Bb7 11. Rd1 a5 12. Bd2 Nbd7 13. Nc1 Qb6 14. Nd3 c5 15. Nde5 Nxe5 16. Nxe5 Rad8 17. Bb5 cxd4 18. exd4 Qxd4 19. Nc4 Qd5 20. Qf1 Qh5 21. Nxa5 Bf3 22. gxf3 Rxd2 23. Rxd2 Qg5+ 24. Kh1 Qxd2,This is a game between Fridstein (as White) and Smyslov (as Black). Last move played: Black plays Queen takes on d2,Large advantage for Black (eval: -140 centipawns),25. Nc6 Bc5 26. a5 Qxb2 27. a6 g6 28. Rc1 Bxf2 29. Rb1 Qc2 30. Nxb4 Qf5 31. Nc6 Kg7 32. Qd3 Qf4 33. Qe2 Be3 34. a7 Ra8 35. Ra1 h5 36. Ba6 Rxa7 37. Nxa7 Bxa7 38. Bb7 Bd4 ,24... Qxd2 
Breaking all resistance,True,", The comment suggests a reckless and potentially disastrous attack, indicating a flaw in strategic planning.",1. d4 Nf6 2. Nf3 d5 3. c4 c6 4. Nc3 dxc4 5. e3 b5 6. a4 b4 7. Na2 e6 8. Bxc4 Be7 9. O-O O-O 10. Qe2 Bb7 11. Rd1 a5 12. Bd2 Nbd7 13. Nc1 Qb6 14. Nd3 c5 15. Nde5 Nxe5 16. Nxe5 Rad8 17. Bb5 cxd4 18. exd4 Qxd4 19. Nc4 Qd5 20. Qf1 Qh5 21. Nxa5 Bf3 22. gxf3 Rxd2 23. Rxd2 Qg5+ 24. Kh1 Qxd2 25. Qe2 Qf4 26. Nc4 Rc8 27. Rd1 Rc5 28. Ne3 g6 29. Ng2 Qc7 30. Ne3 b3 31. Qd3 Qf4 32. Ng2 Qb4 33. Ne3 Qh4 34. a5 Rh5 35. Nf1 Qxf2 36. Rd2 Qc5 37. Bc4 Qxa5 38. Bxb3 Kg7 39. Ng3 Rh4 40. Kg2 Rb4 41. Qc3 Qb5 42. Rd3 Bd6,This is a game between Fridstein (as White) and Smyslov (as Black). Last move played: Black plays Bishop to d6,Large advantage for Black (eval: -447 centipawns),43. Rxd6 Rxb3 44. Qd4 Rxb2+ 45. Kg1 Rb4 46. Qe3 Rb3 47. Qf2 Qe5 48. Rd1 h6 49. f4 Qb2 50. Qxb2 Rxb2 51. Rd4 Rb1+ 52. Kg2 ,42... Bd6 43. Rxd6 Rxb3 44. Qc1 h5 45. Qf4 g5 46. Qd4 Rxb2+ 47. Kg1 Rb1+ 48. Kf2 Kg6 49. Rd8 h4 50. Rh8 Qb2+ 51. Ne2 Qxd4+ 52. Nxd4 Nd5 53. Nc6 Rb2+ 54. Ke1 Kf6 55. Rh7 Nf4 
Black wins at least another pawn,True," The comment suggests a logical fallacy, indicating a flawed assessment of the position's potential.",1. d4 Nf6 2. Nf3 d5 3. c4 c6 4. Nc3 dxc4 5. e3 b5 6. a4 b4 7. Na2 e6 8. Bxc4 Be7 9. O-O O-O 10. Qe2 Bb7 11. Rd1 a5 12. Bd2 Nbd7 13. Nc1 Qb6 14. Nd3 c5 15. Nde5 Nxe5 16. Nxe5 Rad8 17. Bb5 cxd4 18. exd4 Qxd4 19. Nc4 Qd5 20. Qf1 Qh5 21. Nxa5 Bf3 22. gxf3 Rxd2 23. Rxd2 Qg5+ 24. Kh1 Qxd2 25. Qe2 Qf4 26. Nc4 Rc8 27. Rd1 Rc5 28. Ne3 g6 29. Ng2 Qc7 30. Ne3 b3 31. Qd3 Qf4 32. Ng2 Qb4 33. Ne3 Qh4 34. a5 Rh5 35. Nf1 Qxf2 36. Rd2 Qc5 37. Bc4 Qxa5 38. Bxb3 Kg7 39. Ng3 Rh4 40. Kg2 Rb4 41. Qc3 Qb5 42. Rd3 Bd6 43. Re3 Bf4 44. Rd3 Be5 45. Qc2 Nd5 46. Ne2 Rh4,This is a game between Fridstein (as White) and Smyslov (as Black). Last move played: Black plays Rook to h4,Large advantage for Black (eval: -584 centipawns),47. f4 Nxf4+ 48. Nxf4 Qb7+ 49. Rf3 Rxh2+ 50. Kxh2 Qxf3 51. Kg1 Bd4+ 52. Kh2 Qxf4+ 53. Kg2 h5 54. Ba4 Qe3 55. Kf1 h4 56. Be8 h3 57. Bc6 e5 58. b4 Bb6 59. b5 Kh6 ,46... Rh4 47. f4 Nxf4+ 48. Nxf4 Qb7+ 49. Rf3 Rxh2+ 50. Kxh2 Qxf3 51. Bc4 Qxf4+ 52. Kg1 Qg3+ 53. Kf1 Qf3+ 54. Kg1 Bd4+ 55. Kh2 Qe3 56. Kg2 h5 57. b4 h4 58. b5 
White offers a pawn,True,", The comment suggests a potential weakness in the pawn structure, indicating a mistake.",1. d4 Nf6 2. Nf3 d5 3. c4 c6 4. Nc3 dxc4 5. e3 b5 6. a4 b4 7. Na2 e6 8. Bxc4 Be7 9. O-O O-O 10. Qe2 Bb7 11. Rd1 a5 12. Bd2 Nbd7 13. Nc1 Qb6 14. Nd3 c5 15. Nde5 Nxe5 16. Nxe5 Rad8,This is a game between Fridstein (as White) and Smyslov (as Black). Last move played: Black plays Rook to d8,Advantage for Black (eval: -54 centipawns),17. Bb5 ,16... Rfd8 17. Rac1 cxd4 18. exd4 Rxd4 19. Bd3 Qd8 20. Be3 Rd5 21. Bb5 Rc8 22. Rxc8 Rxd1+ 23. Qxd1 Qxc8 24. Nc4 Nd5 25. Bd4 Qd8 26. Be5 f6 27. Bg3 e5 28. Qc2 Nf4 29. Bxf4 exf4 30. Nd2 Qd5 31. Nf3 
