comment,good,reasoning,moves,context
"The opening is an unusual hybrid of the King's Gambit and Italian Game. This experiment does not succeed, but to refute it the inspired and amazingly vigorous play of the young Pillsbury was required. An amusing fact is that White's last move in this given position has not found its way into modern opening guides... 5...",True,"

The comment explains the mistake by highlighting that the move was an unconventional combination of two different openings, suggesting that it deviated from established principles, which ultimately led to a loss after a strong response.",1. e4 e5 2. f4 Bc5 3. Nf3 d6 4. Bc4 Nc6 5. c3,"This is a game between Steinitz, W. (as White) and Pillsbury, Harry (as Black). Last move played: White plays Pawn to c3"
Threatening 7.fe de 8.Bxf7 Kxf7 9.Qc4+. 6...,True,"

The comment effectively explains the mistake made by the player, indicating that they overlooked the tactical opportunity to attack the opposing queen with a bishop fork (Bxf7+), followed by a discovered check (Qc4+).",1. e4 e5 2. f4 Bc5 3. Nf3 d6 4. Bc4 Nc6 5. c3 Nf6 6. Qe2,"This is a game between Steinitz, W. (as White) and Pillsbury, Harry (as Black). Last move played: White plays Queen to e2"
"Not losing an istant! Steinitz has deployed his central and K-side pawns on white squares, and has advanced his Q-side pawns onto black squares. This has led to the creation of ""black holes"" in the centre and on K-side, and given Pillsbury the opportunity for combinations.",False,"

The comment does not explain the mistake made by the player, as it focuses on Steinitz's strategy and Pillsbury's opportunities for combinations rather than detailing the specific error in the player's move.",1. e4 e5 2. f4 Bc5 3. Nf3 d6 4. Bc4 Nc6 5. c3 Nf6 6. Qe2 Qe7 7. d3 Bg4 8. f5 O-O-O 9. b4 Bxf3 10. gxf3 d5,"This is a game between Steinitz, W. (as White) and Pillsbury, Harry (as Black). Last move played: Black plays Pawn to d5"
Aiming at the h4 square.,False,"

The comment does not explain the mistake made by the player, as it only mentions a target square (h4) without providing any context or reasoning for why moving to that square was a mistake.",1. e4 e5 2. f4 Bc5 3. Nf3 d6 4. Bc4 Nc6 5. c3 Nf6 6. Qe2 Qe7 7. d3 Bg4 8. f5 O-O-O 9. b4 Bxf3 10. gxf3 d5 11. exd5 Nxb4 12. d4 Bb6 13. Ba3 Nfxd5,"This is a game between Steinitz, W. (as White) and Pillsbury, Harry (as Black). Last move played: Black plays Knight takes on d5"
"An elegant finish, typical of Pillsbury.",False,"

The comment does not explain the mistake made by the player as it praises an ""elegant finish"" and references Pillsbury, a well-known opening move, without providing any critique or analysis of the player's move.",1. e4 e5 2. f4 Bc5 3. Nf3 d6 4. Bc4 Nc6 5. c3 Nf6 6. Qe2 Qe7 7. d3 Bg4 8. f5 O-O-O 9. b4 Bxf3 10. gxf3 d5 11. exd5 Nxb4 12. d4 Bb6 13. Ba3 Nfxd5 14. Qe4 Nxc3 15. Nxc3 Rxd4 16. Qe2 Qh4+ 17. Kf1 Rxc4 18. Bxb4 Rxb4 19. Ne4 Rd8 20. Kg2 Rxe4,"This is a game between Steinitz, W. (as White) and Pillsbury, Harry (as Black). Last move played: Black plays Rook takes on e4"
"Troughout his long career it is doubtful whether the first World Champion ever experienced such a crushing defeat! From ""Miniatures from the World Champions"" by Anatoly Karpov - Batsford Ltd, London 1985",True,"

The comment highlights the severity of the mistake as it compares the player's current loss to a crushing defeat, suggesting the move was indeed a significant error.",1. e4 e5 2. f4 Bc5 3. Nf3 d6 4. Bc4 Nc6 5. c3 Nf6 6. Qe2 Qe7 7. d3 Bg4 8. f5 O-O-O 9. b4 Bxf3 10. gxf3 d5 11. exd5 Nxb4 12. d4 Bb6 13. Ba3 Nfxd5 14. Qe4 Nxc3 15. Nxc3 Rxd4 16. Qe2 Qh4+ 17. Kf1 Rxc4 18. Bxb4 Rxb4 19. Ne4 Rd8 20. Kg2 Rxe4 21. fxe4 Rd2 22. Qxd2 Qg4+ 23. Kf1 Qf3+,"This is a game between Steinitz, W. (as White) and Pillsbury, Harry (as Black). Last move played: Black plays Queen to f3 with check"
