comment,good,reasoning,moves,context,engine_eval,engine_best_line,engine_best_alternative
This was completely new. 6...b6 7.Bg2 Bb7 This would have transposed into a Classical Dutch defense.,True," The comment suggests a potential tactical blunder, indicating a misjudgment of the resulting position.",1. d4 Nf6 2. c4 e6 3. Nc3 Bb4 4. Nf3 Ne4 5. Qc2 f5 6. g3 Nc6,This is a game between Kasparov (as White) and Karpov (as Black). Last move played: Black plays Knight to c6,Slight advantage for White (eval: 27 centipawns),7. Bg2 Bxc3+ ,6... O-O 7. Bg2 Bxc3+ 8. bxc3 Nc6 9. Ne5 Na5 10. Bxe4 fxe4 11. Qxe4 d6 12. Nf3 Qf6 13. c5 Bd7 14. O-O Bc6 15. Qg4 Nc4 16. cxd6 cxd6 17. Nd2 Nxd2 18. Bxd2 h6 19. Rad1 e5 
"Karpov is combining some of the ideas he had used in previous games from this match. But I have two trump cards, a lead in development and the bishop pair .",True," The comment suggests the player is attempting to justify a weak move by highlighting strategic advantages, which might be a flawed approach.",1. d4 Nf6 2. c4 e6 3. Nc3 Bb4 4. Nf3 Ne4 5. Qc2 f5 6. g3 Nc6 7. Bg2 O-O 8. O-O Bxc3 9. bxc3 Na5,This is a game between Kasparov (as White) and Karpov (as Black). Last move played: Black plays Knight to a5,Slight advantage for White (eval: 27 centipawns),10. c5 ,9... Na5 
"This is a strong pawn sacrifice. If Karpov accepts, then 12,Ba3 is a good reply.",True,". The comment suggests a potential tactical threat, indicating a flawed assessment of the resulting position.",1. d4 Nf6 2. c4 e6 3. Nc3 Bb4 4. Nf3 Ne4 5. Qc2 f5 6. g3 Nc6 7. Bg2 O-O 8. O-O Bxc3 9. bxc3 Na5 10. c5 d6 11. c4,This is a game between Kasparov (as White) and Karpov (as Black). Last move played: White plays Pawn to c4,Advantage for White (eval: 72 centipawns),11... b6 12. Bd2 ,11. c4 
"All the commentators seemed to disapprove of this move, but in fact the error was in the entire opening strategy. At this point he was already in deep trouble.",True," The comment suggests a fundamental flaw in the opening strategy, indicating a significant error.",1. d4 Nf6 2. c4 e6 3. Nc3 Bb4 4. Nf3 Ne4 5. Qc2 f5 6. g3 Nc6 7. Bg2 O-O 8. O-O Bxc3 9. bxc3 Na5 10. c5 d6 11. c4 b6 12. Bd2 Nxd2 13. Nxd2 d5,This is a game between Kasparov (as White) and Karpov (as Black). Last move played: Black plays Pawn to d5,Advantage for White (eval: 88 centipawns),14. cxd5 exd5 15. e3 Be6 16. a4 g5 17. Qc3 Qe7 18. Rfc1 Rae8 19. Rab1 f4 20. exf4 gxf4 21. Re1 ,13... Rb8 
Finally Karpov gets tired of waiting and launches a counterattack. But there is no piece support for the pawnstorm.,True," The comment suggests the player's move was a mistake due to lack of support, indicating a strategic failure.",1. d4 Nf6 2. c4 e6 3. Nc3 Bb4 4. Nf3 Ne4 5. Qc2 f5 6. g3 Nc6 7. Bg2 O-O 8. O-O Bxc3 9. bxc3 Na5 10. c5 d6 11. c4 b6 12. Bd2 Nxd2 13. Nxd2 d5 14. cxd5 exd5 15. e3 Be6 16. Qc3 Rf7 17. Rfc1 Rb8 18. Rab1 Re7 19. a4 Bf7 20. Bf1 h6 21. Bd3 Qd7 22. Qc2 Be6 23. Bb5 Qd8 24. Rd1 g5,This is a game between Kasparov (as White) and Karpov (as Black). Last move played: Black plays Pawn to g5,Large advantage for White (eval: 118 centipawns),25. Bd3 Rf7 ,24... Qf8 25. Nf3 
"I will plant this knight at e5. In addition, I will be able to place my bishop at e4, though that takes quite a bit of preparation.",True," The comment suggests a potential strategic error by aiming for a complex position with a bishop and knight, potentially hindering immediate development.",1. d4 Nf6 2. c4 e6 3. Nc3 Bb4 4. Nf3 Ne4 5. Qc2 f5 6. g3 Nc6 7. Bg2 O-O 8. O-O Bxc3 9. bxc3 Na5 10. c5 d6 11. c4 b6 12. Bd2 Nxd2 13. Nxd2 d5 14. cxd5 exd5 15. e3 Be6 16. Qc3 Rf7 17. Rfc1 Rb8 18. Rab1 Re7 19. a4 Bf7 20. Bf1 h6 21. Bd3 Qd7 22. Qc2 Be6 23. Bb5 Qd8 24. Rd1 g5 25. Nf3,This is a game between Kasparov (as White) and Karpov (as Black). Last move played: White plays Knight to f3,Advantage for White (eval: 93 centipawns),25... Rg7 ,25. Bd3 Rf7 
The bishop did its job on the queenside. Now I need it in the center.,True, The comment suggests a lack of strategic planning and a desire to prioritize immediate gains over long-term positional advantages.,1. d4 Nf6 2. c4 e6 3. Nc3 Bb4 4. Nf3 Ne4 5. Qc2 f5 6. g3 Nc6 7. Bg2 O-O 8. O-O Bxc3 9. bxc3 Na5 10. c5 d6 11. c4 b6 12. Bd2 Nxd2 13. Nxd2 d5 14. cxd5 exd5 15. e3 Be6 16. Qc3 Rf7 17. Rfc1 Rb8 18. Rab1 Re7 19. a4 Bf7 20. Bf1 h6 21. Bd3 Qd7 22. Qc2 Be6 23. Bb5 Qd8 24. Rd1 g5 25. Nf3 Rg7 26. Ne5 f4 27. Bf1,This is a game between Kasparov (as White) and Karpov (as Black). Last move played: White plays Bishop to f1,Large advantage for White (eval: 149 centipawns),27... Qf6 28. Bg2 ,27. Re1 Qf6 28. Bd3 Rf8 29. e4 bxc5 30. exd5 fxg3 31. hxg3 Bxd5 32. Rb5 Nb7 33. Bc4 Bxc4 34. Qxc4+ Kh8 35. Qc2 Nd6 36. Rxc5 Qf5 37. Qa2 g4 38. Qd2 Kg8 39. Nd3 Qf3 40. Re6 
"It is time to open up the game. I am effectively a piece ahead, since the enemy knight is stranded at a5.",True," The comment suggests a strategic error by opening up the position, indicating a flawed plan.",1. d4 Nf6 2. c4 e6 3. Nc3 Bb4 4. Nf3 Ne4 5. Qc2 f5 6. g3 Nc6 7. Bg2 O-O 8. O-O Bxc3 9. bxc3 Na5 10. c5 d6 11. c4 b6 12. Bd2 Nxd2 13. Nxd2 d5 14. cxd5 exd5 15. e3 Be6 16. Qc3 Rf7 17. Rfc1 Rb8 18. Rab1 Re7 19. a4 Bf7 20. Bf1 h6 21. Bd3 Qd7 22. Qc2 Be6 23. Bb5 Qd8 24. Rd1 g5 25. Nf3 Rg7 26. Ne5 f4 27. Bf1 Qf6 28. Bg2 Rd8 29. e4,This is a game between Kasparov (as White) and Karpov (as Black). Last move played: White plays Pawn to e4,Large advantage for White (eval: 171 centipawns),29... Re7 30. exd5 ,29. e4 Re7 30. gxf4 gxf4 31. Kh1 f3 32. Bxf3 Nc6 33. Qc3 Nxe5 34. dxe5 Qf7 35. Bg2 d4 36. Rxd4 Rxd4 37. Qxd4 Qf4 38. Qd8+ Kf7 39. cxb6 axb6 40. Qd3 Bg4 41. Qg3 Qxg3 42. hxg3 Rxe5 43. Rc1 c5 44. Kg1 Re7 45. Rb1 Ra7 46. Rxb6 Rxa4 47. Rxh6 Ra1+ 48. Kh2 
Now the weakness at g5 is felt.,True," The comment suggests a tactical vulnerability, indicating a flawed move.",1. d4 Nf6 2. c4 e6 3. Nc3 Bb4 4. Nf3 Ne4 5. Qc2 f5 6. g3 Nc6 7. Bg2 O-O 8. O-O Bxc3 9. bxc3 Na5 10. c5 d6 11. c4 b6 12. Bd2 Nxd2 13. Nxd2 d5 14. cxd5 exd5 15. e3 Be6 16. Qc3 Rf7 17. Rfc1 Rb8 18. Rab1 Re7 19. a4 Bf7 20. Bf1 h6 21. Bd3 Qd7 22. Qc2 Be6 23. Bb5 Qd8 24. Rd1 g5 25. Nf3 Rg7 26. Ne5 f4 27. Bf1 Qf6 28. Bg2 Rd8 29. e4 dxe4 30. Bxe4 Re7 31. Qc3 Bd5 32. Re1 Kg7 33. Ng4,This is a game between Kasparov (as White) and Karpov (as Black). Last move played: White plays Knight to g4,Large advantage for White (eval: 332 centipawns),33... Qf8 34. Bxd5 Rxd5 35. Rxe7+ Qxe7 36. Re1 Qd8 37. gxf4 gxf4 38. Ne5 bxc5 39. Kh1 Rxd4 40. Qxa5 Rd1 41. Rxd1 Qxd1+ 42. Kg2 Qd5+ 43. Nf3 Qc6 44. Qc3+ Kf7 45. Qe5 c4 46. Qxf4+ Ke8 47. Kg3 c3 48. Qe3+ Kd8 49. Qd4+ Ke7 ,33. Ng4 Qf7 34. Bxd5 Rxe1+ 35. Rxe1 Qxd5 36. cxb6 cxb6 37. Qc7+ Rd7 38. Re7+ Rxe7 39. Qxe7+ Qf7 40. Qe5+ Kf8 41. Qd6+ Qe7 42. Qxh6+ Ke8 43. Ne5 fxg3 44. Qh8+ Qf8 45. Qh5+ Kd8 46. Qxg5+ Kc7 47. Qxg3 Qb4 48. Qg7+ Kb8 49. Kg2 Qxa4 50. h4 Nb3 51. Qf8+ Kb7 52. Qf3+ Kc7 53. Qf7+ Kb8 
Opening more lines.,True,", The comment suggests a lack of development, which is a common mistake in the opening.",1. d4 Nf6 2. c4 e6 3. Nc3 Bb4 4. Nf3 Ne4 5. Qc2 f5 6. g3 Nc6 7. Bg2 O-O 8. O-O Bxc3 9. bxc3 Na5 10. c5 d6 11. c4 b6 12. Bd2 Nxd2 13. Nxd2 d5 14. cxd5 exd5 15. e3 Be6 16. Qc3 Rf7 17. Rfc1 Rb8 18. Rab1 Re7 19. a4 Bf7 20. Bf1 h6 21. Bd3 Qd7 22. Qc2 Be6 23. Bb5 Qd8 24. Rd1 g5 25. Nf3 Rg7 26. Ne5 f4 27. Bf1 Qf6 28. Bg2 Rd8 29. e4 dxe4 30. Bxe4 Re7 31. Qc3 Bd5 32. Re1 Kg7 33. Ng4 Qf7 34. Bxd5 Rxd5 35. Rxe7 Qxe7 36. Re1 Qd8 37. Ne5 Qf6 38. cxb6,This is a game between Kasparov (as White) and Karpov (as Black). Last move played: White plays Pawn takes on b6,Large advantage for White (eval: 463 centipawns),38... Qxb6 39. gxf4 Qd6 40. fxg5 hxg5 41. Re4 Qd8 42. Qe3 c5 43. Rg4 Rxd4 44. Rxg5+ Kf6 45. Qf3+ Ke7 46. Qf5 Rd1+ 47. Kg2 Qd5+ 48. Kh3 Qb3+ 49. f3 Qxa4 ,38. cxb6 Qxb6 39. gxf4 g4 40. f5 Kg8 41. f6 a6 42. f7+ Kg7 43. Qc2 Rd8 44. d5 Qf6 
Open lines on the queenside. Open lines in the center. Open lines on the kingside!,True," The comment suggests potential weaknesses in the position, indicating a flawed strategic assessment.",1. d4 Nf6 2. c4 e6 3. Nc3 Bb4 4. Nf3 Ne4 5. Qc2 f5 6. g3 Nc6 7. Bg2 O-O 8. O-O Bxc3 9. bxc3 Na5 10. c5 d6 11. c4 b6 12. Bd2 Nxd2 13. Nxd2 d5 14. cxd5 exd5 15. e3 Be6 16. Qc3 Rf7 17. Rfc1 Rb8 18. Rab1 Re7 19. a4 Bf7 20. Bf1 h6 21. Bd3 Qd7 22. Qc2 Be6 23. Bb5 Qd8 24. Rd1 g5 25. Nf3 Rg7 26. Ne5 f4 27. Bf1 Qf6 28. Bg2 Rd8 29. e4 dxe4 30. Bxe4 Re7 31. Qc3 Bd5 32. Re1 Kg7 33. Ng4 Qf7 34. Bxd5 Rxd5 35. Rxe7 Qxe7 36. Re1 Qd8 37. Ne5 Qf6 38. cxb6 Qxb6 39. gxf4,This is a game between Kasparov (as White) and Karpov (as Black). Last move played: White plays Pawn takes on f4,Large advantage for White (eval: 457 centipawns),39... c5 40. Qf3 Rxd4 41. fxg5 Qe6 42. gxh6+ Kh7 43. h3 Nc6 44. Qg2 Qg8 45. Qxg8+ Kxg8 46. Nxc6 Rxa4 47. Ne5 c4 48. Re4 Ra3 49. Rxc4 Rxh3 50. Ng4 Kh7 51. Kg2 Rh5 52. Rc7+ Kh8 53. Rc8+ Kh7 ,39. gxf4 c5 40. Qf3 Rxd4 41. fxg5 Qe6 42. gxh6+ Kh7 43. h3 Rd6 44. Qe4+ Kh8 45. Qf4 Kh7 46. Qg3 Qxh6 47. Ng4 Rg6 48. Nxh6 Kxh6 49. Re6 Rxe6 
"A blunder in time pressure, but the game would not have lasted long anyway. 39...gxf4 40.Qf3 Qe6 41.Kh1 Rxd4 42.Qg2+ Kh7 43.Rg1",True," The comment suggests the move was a result of time pressure, implying a lack of strategic consideration.",1. d4 Nf6 2. c4 e6 3. Nc3 Bb4 4. Nf3 Ne4 5. Qc2 f5 6. g3 Nc6 7. Bg2 O-O 8. O-O Bxc3 9. bxc3 Na5 10. c5 d6 11. c4 b6 12. Bd2 Nxd2 13. Nxd2 d5 14. cxd5 exd5 15. e3 Be6 16. Qc3 Rf7 17. Rfc1 Rb8 18. Rab1 Re7 19. a4 Bf7 20. Bf1 h6 21. Bd3 Qd7 22. Qc2 Be6 23. Bb5 Qd8 24. Rd1 g5 25. Nf3 Rg7 26. Ne5 f4 27. Bf1 Qf6 28. Bg2 Rd8 29. e4 dxe4 30. Bxe4 Re7 31. Qc3 Bd5 32. Re1 Kg7 33. Ng4 Qf7 34. Bxd5 Rxd5 35. Rxe7 Qxe7 36. Re1 Qd8 37. Ne5 Qf6 38. cxb6 Qxb6 39. gxf4 Rxd4,This is a game between Kasparov (as White) and Karpov (as Black). Last move played: Black plays Rook takes on d4,Large advantage for White (eval: 462 centipawns),40. Nf3 Nb3 41. Nxd4 Nxd4 42. Qe3 Kf6 43. Qe5+ Kf7 44. Qd5+ Kf6 45. fxg5+ hxg5 46. Re3 Qd6 47. Qxd6+ cxd6 48. Re8 d5 49. Kf1 a5 50. Ra8 Nc6 51. h3 Ke5 ,39... c5 40. Qf3 Rxd4 41. fxg5 Qe6 42. gxh6+ Kh7 43. h3 Nc6 44. Qg2 Qg8 45. Qxg8+ Kxg8 46. Nxc6 Rxa4 47. Ne5 c4 48. Re4 Ra3 49. Rxc4 Rxh3 50. Ng4 Kh7 51. Kg2 Rh5 52. Rc7+ Kh8 53. Rc8+ Kh7 
"The game was adjourned here, but I played my move in public anyway.",True," The comment suggests a potential desire to avoid scrutiny of the move, indicating a flawed assessment of the situation.",1. d4 Nf6 2. c4 e6 3. Nc3 Bb4 4. Nf3 Ne4 5. Qc2 f5 6. g3 Nc6 7. Bg2 O-O 8. O-O Bxc3 9. bxc3 Na5 10. c5 d6 11. c4 b6 12. Bd2 Nxd2 13. Nxd2 d5 14. cxd5 exd5 15. e3 Be6 16. Qc3 Rf7 17. Rfc1 Rb8 18. Rab1 Re7 19. a4 Bf7 20. Bf1 h6 21. Bd3 Qd7 22. Qc2 Be6 23. Bb5 Qd8 24. Rd1 g5 25. Nf3 Rg7 26. Ne5 f4 27. Bf1 Qf6 28. Bg2 Rd8 29. e4 dxe4 30. Bxe4 Re7 31. Qc3 Bd5 32. Re1 Kg7 33. Ng4 Qf7 34. Bxd5 Rxd5 35. Rxe7 Qxe7 36. Re1 Qd8 37. Ne5 Qf6 38. cxb6 Qxb6 39. gxf4 Rxd4 40. Nf3 Nb3 41. Rb1 Qf6,This is a game between Kasparov (as White) and Karpov (as Black). Last move played: Black plays Queen to f6,Large advantage for White (eval: 604 centipawns),42. Qxc7+ Qf7 43. Nxd4 Nxd4 44. Rb7 Qxc7 45. Rxc7+ Kf6 46. Rxa7 Kf5 47. a5 Kg4 48. Rd7 Nf3+ 49. Kh1 Ne1 50. Re7 Kf3 51. Rxe1 gxf4 52. Kg1 Kg4 53. a6 ,41... Qc5 42. Qxc5 Nxc5 43. Nxd4 Nxa4 44. Rc1 c6 45. fxg5 hxg5 46. Rxc6 a5 47. Rc2 Nb6 48. Ne2 a4 49. Rc7+ Kg8 50. Ra7 Nc4 51. Ra8+ Kf7 52. Rxa4 Nd2 53. Ra3 
"An unusual move, especially from Karpov, a Classical player. Still, he clearly wanted to disrupt the opening, to neutralize anything I might have prepared.",True," The comment suggests the move was unusual and aimed at disrupting the opponent’s plans, indicating a potential tactical or strategic flaw.",1. d4 Nf6 2. c4 e6 3. Nc3 Bb4 4. Nf3 Ne4,This is a game between Kasparov (as White) and Karpov (as Black). Last move played: Black plays Knight to e4,Slight advantage for White (eval: 42 centipawns),5. Qc2 ,4... O-O 5. Bg5 
"This is a strong pawn sacrifice. If Karpov accepts, then 12,Ba3 is a good reply.",True," The comment suggests a strategic error by White, implying a lack of initiative and a passive approach.",1. d4 Nf6 2. c4 e6 3. Nc3 Bb4 4. Nf3 Ne4 5. Qc2 f5 6. g3 Nc6 7. Bg2 O-O 8. O-O Bxc3 9. bxc3 Na5 10. c5 d6 11. c4,This is a game between Kasparov (as White) and Karpov (as Black). Last move played: White plays Pawn to c4,Advantage for White (eval: 72 centipawns),11... b6 12. Bd2 ,11. c4 
"This is a strong pawn sacrifice. If Karpov accepts, then 12,Ba3 is a good reply.",True," Yes, the comment suggests a potential weak pawn structure and a risky Queen development, indicating a mistake.",1. d4 Nf6 2. c4 e6 3. Nc3 Bb4 4. Nf3 Ne4 5. Qc2 f5 6. g3 Nc6 7. Bg2 O-O 8. O-O Bxc3 9. bxc3 Na5 10. c5 d6 11. c4,This is a game between Kasparov (as White) and Karpov (as Black). Last move played: White plays Pawn to c4,Advantage for White (eval: 72 centipawns),11... b6 12. Bd2 ,11. c4 
"Karpov is combining some of the ideas he had used in previous games from this match. But I have two trump cards, a lead in development and the bishop pair .",True," The comment suggests a potential improvement, indicating a perceived weakness in the move.",1. d4 Nf6 2. c4 e6 3. Nc3 Bb4 4. Nf3 Ne4 5. Qc2 f5 6. g3 Nc6 7. Bg2 O-O 8. O-O Bxc3 9. bxc3 Na5,This is a game between Kasparov (as White) and Karpov (as Black). Last move played: Black plays Knight to a5,Slight advantage for White (eval: 27 centipawns),10. c5 ,9... Na5 
