comment,good,reasoning,moves,context,engine_eval,engine_best_line,engine_best_alternative
"An aggressive move, common in the French Defense. Black challenges White's center by attacking a central pawn with a flank pawn.",True," The comment identifies a common opening strategy, suggesting the move was flawed due to its reliance on a specific tactical pattern.",1. e4 e6 2. d4 d5 3. Nc3 Bb4 4. e5 c5,"This is a game between Lasker,Em (as White) and Maroczy,G (as Black). Last move played: Black plays Pawn to c5",Advantage for White (eval: 61 centipawns),5. a3 ,4... c5 
"White has weak doubled c-pawns, but has compensation in the form of the two open files.",True," The comment identifies a positional weakness, but doesn't directly explain why the move was considered a mistake.",1. e4 e6 2. d4 d5 3. Nc3 Bb4 4. e5 c5 5. a3 cxd4 6. axb4 dxc3 7. bxc3,"This is a game between Lasker,Em (as White) and Maroczy,G (as Black). Last move played: White plays Pawn takes on c3",Large advantage for White (eval: 123 centipawns),7... Qc7 8. f4 ,7. Qg4 Ne7 
"We see now why Maroczy didn't snatch the c-pawn. He's aiming at the e5-pawn; once this pawn is eliminated, Black's two central pawns will become powerful.",True," The comment offers a potential explanation for the mistake, suggesting a strategic goal that contradicts the intended plan.",1. e4 e6 2. d4 d5 3. Nc3 Bb4 4. e5 c5 5. a3 cxd4 6. axb4 dxc3 7. bxc3 Qc7 8. Nf3 Ne7 9. Bd3 Ng6,"This is a game between Lasker,Em (as White) and Maroczy,G (as Black). Last move played: Black plays Knight to g6",Large advantage for White (eval: 157 centipawns),10. O-O ,9... Nd7 10. O-O 
The e5-square is still the center of attention.,True,". The comment suggests the move was poorly conceived, indicating a potential tactical error.",1. e4 e6 2. d4 d5 3. Nc3 Bb4 4. e5 c5 5. a3 cxd4 6. axb4 dxc3 7. bxc3 Qc7 8. Nf3 Ne7 9. Bd3 Ng6 10. O-O Nd7 11. Re1 Qxc3 12. Bd2 Qc7,"This is a game between Lasker,Em (as White) and Maroczy,G (as Black). Last move played: Black plays Queen to c7",Large advantage for White (eval: 164 centipawns),13. Ra3 ,12... Qc7 13. Ra3 
Overprotecting the pawn and clearing the road for h2-h4.,True,", The comment suggests a defensive strategy that weakens the pawn structure, indicating a flaw in the move's planning.",1. e4 e6 2. d4 d5 3. Nc3 Bb4 4. e5 c5 5. a3 cxd4 6. axb4 dxc3 7. bxc3 Qc7 8. Nf3 Ne7 9. Bd3 Ng6 10. O-O Nd7 11. Re1 Qxc3 12. Bd2 Qc7 13. Qe2 O-O 14. Qe3 Nb6 15. Qg5 Nc4 16. Bc3 h6 17. Qg4 Ne7 18. Qh5 Bd7 19. g4 Bb5 20. g5 g6 21. Qxh6 Nb6 22. Ra3 Bxd3 23. cxd3 Nf5 24. Qh3 Qe7 25. Qg4,"This is a game between Lasker,Em (as White) and Maroczy,G (as Black). Last move played: White plays Queen to g4",Large advantage for Black (eval: -121 centipawns),25... Kg7 26. Bd2 Rh8 27. Rea1 Rh5 28. Rxa7 Rah8 29. Kg2 d4 30. Qe4 Nd5 31. Ra8 Nc3 32. Qf4 Qc7 33. Rxh8 Rxh8 34. Nxd4 Nd5 35. Qe4 Nxd4 36. Qxd4 Qc2 37. Be3 Ne7 38. Qe4 Nf5 39. Bc5 Rh4 40. Qxb7 Qxd3 41. Qf3 ,25. Qg4 d4 
Maroczy deftly counters the threat (see the variation to White's 27th move).,True," The comment suggests a potential weakness in the opponent’s defense, indicating a flawed tactical assessment.",1. e4 e6 2. d4 d5 3. Nc3 Bb4 4. e5 c5 5. a3 cxd4 6. axb4 dxc3 7. bxc3 Qc7 8. Nf3 Ne7 9. Bd3 Ng6 10. O-O Nd7 11. Re1 Qxc3 12. Bd2 Qc7 13. Qe2 O-O 14. Qe3 Nb6 15. Qg5 Nc4 16. Bc3 h6 17. Qg4 Ne7 18. Qh5 Bd7 19. g4 Bb5 20. g5 g6 21. Qxh6 Nb6 22. Ra3 Bxd3 23. cxd3 Nf5 24. Qh3 Qe7 25. Qg4 Kg7 26. Rea1 Rfc8,"This is a game between Lasker,Em (as White) and Maroczy,G (as Black). Last move played: Black plays Rook to c8",Advantage for Black (eval: -71 centipawns),27. Bd2 Rc2 28. Be3 d4 29. Nxd4 Rb2 30. Nxf5+ gxf5 31. Qg3 Rxb4 32. d4 Nd5 33. g6 fxg6 34. Kh1 Nxe3 35. fxe3 Qc7 36. R3a2 ,26... Rh8 27. Bd2 Qd7 28. Rxa7 Rxa7 29. Rxa7 Nc8 30. Ra2 Qb5 31. Ra3 Nce7 32. Qf4 Qc6 33. Ra2 Rc8 34. h4 Rh8 35. Kf1 d4 36. Qe4 Qc8 37. Kg2 Nd5 38. Ra5 Qc2 39. Rc5 
Both of Black's open files are now commanded by a Rook.,True,", This comment reveals a tactical error by suggesting a weakening of the position due to Rook placement.",1. e4 e6 2. d4 d5 3. Nc3 Bb4 4. e5 c5 5. a3 cxd4 6. axb4 dxc3 7. bxc3 Qc7 8. Nf3 Ne7 9. Bd3 Ng6 10. O-O Nd7 11. Re1 Qxc3 12. Bd2 Qc7 13. Qe2 O-O 14. Qe3 Nb6 15. Qg5 Nc4 16. Bc3 h6 17. Qg4 Ne7 18. Qh5 Bd7 19. g4 Bb5 20. g5 g6 21. Qxh6 Nb6 22. Ra3 Bxd3 23. cxd3 Nf5 24. Qh3 Qe7 25. Qg4 Kg7 26. Rea1 Rfc8 27. h4 Na4 28. Bd2 b5 29. R3a2 Rh8 30. Kg2 Rac8,"This is a game between Lasker,Em (as White) and Maroczy,G (as Black). Last move played: Black plays Rook to c8",Slight advantage for Black (eval: -29 centipawns),31. Rh1 d4 32. Nxd4 Qb7+ 33. Qf3 Qxf3+ 34. Nxf3 a6 35. Kf1 Rc6 36. Ke2 Nc3+ 37. Bxc3 Rxc3 38. Rd1 Rb3 39. Rxa6 Rxb4 40. Rb6 Ra8 41. Rb7 Rb3 42. Rd2 b4 43. Rd1 Rb2+ 44. Rd2 Rb1 45. Rd1 ,30... d4 31. Rc2 
Overprotecting the h4-pawn.,True,", The comment suggests a defensive strategy that hinders the opponent's development and potential attacks.",1. e4 e6 2. d4 d5 3. Nc3 Bb4 4. e5 c5 5. a3 cxd4 6. axb4 dxc3 7. bxc3 Qc7 8. Nf3 Ne7 9. Bd3 Ng6 10. O-O Nd7 11. Re1 Qxc3 12. Bd2 Qc7 13. Qe2 O-O 14. Qe3 Nb6 15. Qg5 Nc4 16. Bc3 h6 17. Qg4 Ne7 18. Qh5 Bd7 19. g4 Bb5 20. g5 g6 21. Qxh6 Nb6 22. Ra3 Bxd3 23. cxd3 Nf5 24. Qh3 Qe7 25. Qg4 Kg7 26. Rea1 Rfc8 27. h4 Na4 28. Bd2 b5 29. R3a2 Rh8 30. Kg2 Rac8 31. Rh1,"This is a game between Lasker,Em (as White) and Maroczy,G (as Black). Last move played: White plays Rook to h1",Slight advantage for Black (eval: -22 centipawns),31... Nc3 32. Raa1 ,31. Rh1 d4 32. Nxd4 Qb7+ 33. Qf3 Qxf3+ 34. Nxf3 a6 35. Kf1 Rc6 36. Ke2 Nc3+ 37. Bxc3 Rxc3 38. Rd1 Rb3 39. Rxa6 Rxb4 40. Rb6 Ra8 41. Rb7 Rb3 42. Rd2 b4 43. Rd1 Rb2+ 44. Rd2 Rb1 45. Rd1 
...and Lasker takes yet another square away from the Black Queen.,True," The comment suggests a potential weakening of the Black Queen's position, indicating a mistake.",1. e4 e6 2. d4 d5 3. Nc3 Bb4 4. e5 c5 5. a3 cxd4 6. axb4 dxc3 7. bxc3 Qc7 8. Nf3 Ne7 9. Bd3 Ng6 10. O-O Nd7 11. Re1 Qxc3 12. Bd2 Qc7 13. Qe2 O-O 14. Qe3 Nb6 15. Qg5 Nc4 16. Bc3 h6 17. Qg4 Ne7 18. Qh5 Bd7 19. g4 Bb5 20. g5 g6 21. Qxh6 Nb6 22. Ra3 Bxd3 23. cxd3 Nf5 24. Qh3 Qe7 25. Qg4 Kg7 26. Rea1 Rfc8 27. h4 Na4 28. Bd2 b5 29. R3a2 Rh8 30. Kg2 Rac8 31. Rh1 Qc7 32. Nd4,"This is a game between Lasker,Em (as White) and Maroczy,G (as Black). Last move played: White plays Knight to d4",Advantage for White (eval: 85 centipawns),32... Nxd4 33. Qxd4 ,32. Nd4 Nxd4 
Lasker's plan is to play e6+ and win the Black Queen on the next move.,True," The comment suggests a specific tactical plan, indicating a flawed strategic assessment.",1. e4 e6 2. d4 d5 3. Nc3 Bb4 4. e5 c5 5. a3 cxd4 6. axb4 dxc3 7. bxc3 Qc7 8. Nf3 Ne7 9. Bd3 Ng6 10. O-O Nd7 11. Re1 Qxc3 12. Bd2 Qc7 13. Qe2 O-O 14. Qe3 Nb6 15. Qg5 Nc4 16. Bc3 h6 17. Qg4 Ne7 18. Qh5 Bd7 19. g4 Bb5 20. g5 g6 21. Qxh6 Nb6 22. Ra3 Bxd3 23. cxd3 Nf5 24. Qh3 Qe7 25. Qg4 Kg7 26. Rea1 Rfc8 27. h4 Na4 28. Bd2 b5 29. R3a2 Rh8 30. Kg2 Rac8 31. Rh1 Qc7 32. Nd4 Qd7 33. Nxf5+ exf5 34. Qd4,"This is a game between Lasker,Em (as White) and Maroczy,G (as Black). Last move played: White plays Queen to d4",Large advantage for White (eval: 160 centipawns),34... Qe6 35. Be3 Kh7 36. Ra3 Kg8 37. Raa1 Kh7 38. Rhb1 Nc3 39. Re1 Na4 40. Rh1 a5 41. bxa5 Nc5 42. Rab1 Qd7 43. e6 Nxe6 44. Qf6 Kg8 45. h5 ,34. e6 fxe6 35. Qd4+ Kg8 36. Bf4 Rh7 37. Raa1 Qe8 38. Be5 Rc2 39. Rhc1 Rxc1 40. Rxc1 Nb6 41. Kg3 Nd7 42. f4 Nxe5 43. Qxe5 Re7 44. Rc5 d4 45. Rxb5 a6 
Blocking the e-pawn's advance. Unfortunately the a7-pawn is now undefended.,True," The comment identifies a potential vulnerability in the position, suggesting a defensive error.",1. e4 e6 2. d4 d5 3. Nc3 Bb4 4. e5 c5 5. a3 cxd4 6. axb4 dxc3 7. bxc3 Qc7 8. Nf3 Ne7 9. Bd3 Ng6 10. O-O Nd7 11. Re1 Qxc3 12. Bd2 Qc7 13. Qe2 O-O 14. Qe3 Nb6 15. Qg5 Nc4 16. Bc3 h6 17. Qg4 Ne7 18. Qh5 Bd7 19. g4 Bb5 20. g5 g6 21. Qxh6 Nb6 22. Ra3 Bxd3 23. cxd3 Nf5 24. Qh3 Qe7 25. Qg4 Kg7 26. Rea1 Rfc8 27. h4 Na4 28. Bd2 b5 29. R3a2 Rh8 30. Kg2 Rac8 31. Rh1 Qc7 32. Nd4 Qd7 33. Nxf5+ exf5 34. Qd4 Qe6,"This is a game between Lasker,Em (as White) and Maroczy,G (as Black). Last move played: Black plays Queen to e6",Large advantage for White (eval: 168 centipawns),35. f3 Rc6 36. Be3 a6 37. Kg3 Rh5 38. Rhh2 Rh8 39. Bd2 Kf8 40. Bf4 Ke7 41. Ra1 Kf8 42. Rc1 Rxc1 43. Bxc1 Nb6 44. Be3 Nc8 45. Qc5+ Kg7 46. f4 Ne7 47. Qd6 Nc6 48. Rc2 ,34... Qe6 35. Be3 Kh7 36. Ra3 Kg8 37. Raa1 Kh7 38. Rhb1 Nc3 39. Re1 Na4 40. Rh1 a5 41. bxa5 Nc5 42. Rab1 Qd7 43. e6 Nxe6 44. Qf6 Kg8 45. h5 
Maroczy gives a discovered attack of his own.,True,", The comment suggests the player intentionally created a tactical threat, indicating a flawed move.",1. e4 e6 2. d4 d5 3. Nc3 Bb4 4. e5 c5 5. a3 cxd4 6. axb4 dxc3 7. bxc3 Qc7 8. Nf3 Ne7 9. Bd3 Ng6 10. O-O Nd7 11. Re1 Qxc3 12. Bd2 Qc7 13. Qe2 O-O 14. Qe3 Nb6 15. Qg5 Nc4 16. Bc3 h6 17. Qg4 Ne7 18. Qh5 Bd7 19. g4 Bb5 20. g5 g6 21. Qxh6 Nb6 22. Ra3 Bxd3 23. cxd3 Nf5 24. Qh3 Qe7 25. Qg4 Kg7 26. Rea1 Rfc8 27. h4 Na4 28. Bd2 b5 29. R3a2 Rh8 30. Kg2 Rac8 31. Rh1 Qc7 32. Nd4 Qd7 33. Nxf5+ exf5 34. Qd4 Qe6 35. Qxa7 d4,"This is a game between Lasker,Em (as White) and Maroczy,G (as Black). Last move played: Black plays Pawn to d4",Large advantage for Black (eval: -230 centipawns),36. Raa1 Rc2 37. h5 Rxd2 38. h6+ Kh7 39. Qxd4 Re8 40. Rhe1 Qe7 41. Qe3 Rc2 42. Rac1 Rc3 43. e6 fxe6 44. Qe5 Rxd3 45. Rc7 Rd7 46. Rec1 Nb6 47. Qxb5 Rxc7 48. Rxc7 Qxc7 49. Qxe8 Nd5 50. Kf1 ,35... d4 36. h5 Qxa2 37. e6 Qxe6 38. Qxd4+ Kg8 39. h6 Rh7 40. Re1 Qb6 41. Qe5 Qd8 42. Rc1 Rxc1 43. Bxc1 Nb6 44. Kg1 Nd7 45. Qd5 Qe8 46. Bb2 
The lost pawn has been recovered.,False,"

The comment doesn't explain why the move was a mistake, it simply states a fact about the pawn's recovery.",1. e4 e6 2. d4 d5 3. Nc3 Bb4 4. e5 c5 5. a3 cxd4 6. axb4 dxc3 7. bxc3 Qc7 8. Nf3 Ne7 9. Bd3 Ng6 10. O-O Nd7 11. Re1 Qxc3 12. Bd2 Qc7 13. Qe2 O-O 14. Qe3 Nb6 15. Qg5 Nc4 16. Bc3 h6 17. Qg4 Ne7 18. Qh5 Bd7 19. g4 Bb5 20. g5 g6 21. Qxh6 Nb6 22. Ra3 Bxd3 23. cxd3 Nf5 24. Qh3 Qe7 25. Qg4 Kg7 26. Rea1 Rfc8 27. h4 Na4 28. Bd2 b5 29. R3a2 Rh8 30. Kg2 Rac8 31. Rh1 Qc7 32. Nd4 Qd7 33. Nxf5+ exf5 34. Qd4 Qe6 35. Qxa7 d4 36. Raa1 Qxe5,"This is a game between Lasker,Em (as White) and Maroczy,G (as Black). Last move played: Black plays Queen takes on e5",The position is equal,37. Qb7 Qe2 38. h5 Rxh5 39. Rxh5 Qg4+ 40. Kf1 Qxh5 41. Qxc8 Qh1+ 42. Ke2 Qxa1 43. Qb8 Nc3+ 44. Bxc3 dxc3 45. Qe5+ Kh7 46. Qh2+ Kg7 ,36... Rc2 
The Black Knight switches outpost squares to get closer to the White King.,True," The comment describes a move that is likely a blunder, suggesting a poor strategic decision.",1. e4 e6 2. d4 d5 3. Nc3 Bb4 4. e5 c5 5. a3 cxd4 6. axb4 dxc3 7. bxc3 Qc7 8. Nf3 Ne7 9. Bd3 Ng6 10. O-O Nd7 11. Re1 Qxc3 12. Bd2 Qc7 13. Qe2 O-O 14. Qe3 Nb6 15. Qg5 Nc4 16. Bc3 h6 17. Qg4 Ne7 18. Qh5 Bd7 19. g4 Bb5 20. g5 g6 21. Qxh6 Nb6 22. Ra3 Bxd3 23. cxd3 Nf5 24. Qh3 Qe7 25. Qg4 Kg7 26. Rea1 Rfc8 27. h4 Na4 28. Bd2 b5 29. R3a2 Rh8 30. Kg2 Rac8 31. Rh1 Qc7 32. Nd4 Qd7 33. Nxf5+ exf5 34. Qd4 Qe6 35. Qxa7 d4 36. Raa1 Qxe5 37. Rae1 Qd5+ 38. Kg3 Rhe8 39. h5 gxh5 40. Rxe8 Rxe8 41. Rxh5 Nc3,"This is a game between Lasker,Em (as White) and Maroczy,G (as Black). Last move played: Black plays Knight to c3",The position is equal,42. Qb6 Re6 43. Qb8 Ne2+ 44. Kh2 Qd6+ 45. Qxd6 Rxd6 46. Kg2 Ra6 47. Kf3 Ng1+ 48. Kg2 ,41... Nc3 42. Qa6 Qe5+ 43. Kg2 Qd5+ 
"""Priority of check"" buys Maroczy some time. White has no time to put his own plans into action since he must react to the check.",True," The comment suggests the check is delaying White's development, indicating a flawed strategic assessment.",1. e4 e6 2. d4 d5 3. Nc3 Bb4 4. e5 c5 5. a3 cxd4 6. axb4 dxc3 7. bxc3 Qc7 8. Nf3 Ne7 9. Bd3 Ng6 10. O-O Nd7 11. Re1 Qxc3 12. Bd2 Qc7 13. Qe2 O-O 14. Qe3 Nb6 15. Qg5 Nc4 16. Bc3 h6 17. Qg4 Ne7 18. Qh5 Bd7 19. g4 Bb5 20. g5 g6 21. Qxh6 Nb6 22. Ra3 Bxd3 23. cxd3 Nf5 24. Qh3 Qe7 25. Qg4 Kg7 26. Rea1 Rfc8 27. h4 Na4 28. Bd2 b5 29. R3a2 Rh8 30. Kg2 Rac8 31. Rh1 Qc7 32. Nd4 Qd7 33. Nxf5+ exf5 34. Qd4 Qe6 35. Qxa7 d4 36. Raa1 Qxe5 37. Rae1 Qd5+ 38. Kg3 Rhe8 39. h5 gxh5 40. Rxe8 Rxe8 41. Rxh5 Nc3 42. Qb6 Ne2+,"This is a game between Lasker,Em (as White) and Maroczy,G (as Black). Last move played: Black plays Knight to e2 with check",The position is equal,43. Kh2 Re6 44. Qb8 Qd6+ 45. Qxd6 Rxd6 46. Kg2 Ra6 47. Kf3 Ng1+ 48. Kg2 ,42... Ne2+ 43. Kh2 Re6 44. Qb8 Qd6+ 45. Qxd6 Rxd6 46. Kg2 Ra6 47. Kf3 Ng1+ 48. Kg2 
White is a pawn ahead and can develop some serious pressure along the open h-file. Maroczy needs to find a way to keep White occupied.,True," The comment suggests a potential weakness in White's pawn structure and a need for a specific tactical maneuver, indicating a flawed move.",1. e4 e6 2. d4 d5 3. Nc3 Bb4 4. e5 c5 5. a3 cxd4 6. axb4 dxc3 7. bxc3 Qc7 8. Nf3 Ne7 9. Bd3 Ng6 10. O-O Nd7 11. Re1 Qxc3 12. Bd2 Qc7 13. Qe2 O-O 14. Qe3 Nb6 15. Qg5 Nc4 16. Bc3 h6 17. Qg4 Ne7 18. Qh5 Bd7 19. g4 Bb5 20. g5 g6 21. Qxh6 Nb6 22. Ra3 Bxd3 23. cxd3 Nf5 24. Qh3 Qe7 25. Qg4 Kg7 26. Rea1 Rfc8 27. h4 Na4 28. Bd2 b5 29. R3a2 Rh8 30. Kg2 Rac8 31. Rh1 Qc7 32. Nd4 Qd7 33. Nxf5+ exf5 34. Qd4 Qe6 35. Qxa7 d4 36. Raa1 Qxe5 37. Rae1 Qd5+ 38. Kg3 Rhe8 39. h5 gxh5 40. Rxe8 Rxe8 41. Rxh5 Nc3 42. Qb6 Ne2+ 43. Kh2 Qe6 44. Qxb5,"This is a game between Lasker,Em (as White) and Maroczy,G (as Black). Last move played: White plays Queen takes on b5",Slight advantage for White (eval: 25 centipawns),44... Nc3 ,44. Qxb5 Nc3 
"An easy move to spot. The Bishop was accomplishing little on d2, so it trades itself for a more active Black piece.",True, The comment identifies a strategic error – trading a piece for a less valuable one – which is a common mistake in chess.,1. e4 e6 2. d4 d5 3. Nc3 Bb4 4. e5 c5 5. a3 cxd4 6. axb4 dxc3 7. bxc3 Qc7 8. Nf3 Ne7 9. Bd3 Ng6 10. O-O Nd7 11. Re1 Qxc3 12. Bd2 Qc7 13. Qe2 O-O 14. Qe3 Nb6 15. Qg5 Nc4 16. Bc3 h6 17. Qg4 Ne7 18. Qh5 Bd7 19. g4 Bb5 20. g5 g6 21. Qxh6 Nb6 22. Ra3 Bxd3 23. cxd3 Nf5 24. Qh3 Qe7 25. Qg4 Kg7 26. Rea1 Rfc8 27. h4 Na4 28. Bd2 b5 29. R3a2 Rh8 30. Kg2 Rac8 31. Rh1 Qc7 32. Nd4 Qd7 33. Nxf5+ exf5 34. Qd4 Qe6 35. Qxa7 d4 36. Raa1 Qxe5 37. Rae1 Qd5+ 38. Kg3 Rhe8 39. h5 gxh5 40. Rxe8 Rxe8 41. Rxh5 Nc3 42. Qb6 Ne2+ 43. Kh2 Qe6 44. Qxb5 Qd6+ 45. Kg2 Nf4+ 46. Bxf4,"This is a game between Lasker,Em (as White) and Maroczy,G (as Black). Last move played: White plays Bishop takes on f4",Large advantage for White (eval: 453 centipawns),46... Qxf4 47. Qxe8 Qg4+ 48. Kf1 Qd1+ 49. Qe1 Qxh5 50. Qe5+ Kg8 51. Qxf5 Qh1+ 52. Ke2 Qa1 53. b5 Qb1 54. g6 f6 55. b6 Kg7 56. Qh5 Kf8 57. Qh6+ Ke7 58. Qh7+ Ke6 59. Qh3+ Ke7 60. g7 Kf7 61. Qd7+ Kg8 62. Qxd4 f5 ,46. Bxf4 Qxf4 47. Qxe8 Qg4+ 48. Kf1 Qd1+ 49. Qe1 Qxh5 50. Qe5+ Kg8 51. Qxf5 Qh1+ 52. Ke2 Qa1 53. b5 Qa2+ 54. Kf3 Qa8+ 55. Qe4 Qb8 56. Qd5 Qb6 
Maroczy has run out of checks and the initiative passes to White.,True," The comment suggests White has gained initiative, indicating a flawed strategic decision.",1. e4 e6 2. d4 d5 3. Nc3 Bb4 4. e5 c5 5. a3 cxd4 6. axb4 dxc3 7. bxc3 Qc7 8. Nf3 Ne7 9. Bd3 Ng6 10. O-O Nd7 11. Re1 Qxc3 12. Bd2 Qc7 13. Qe2 O-O 14. Qe3 Nb6 15. Qg5 Nc4 16. Bc3 h6 17. Qg4 Ne7 18. Qh5 Bd7 19. g4 Bb5 20. g5 g6 21. Qxh6 Nb6 22. Ra3 Bxd3 23. cxd3 Nf5 24. Qh3 Qe7 25. Qg4 Kg7 26. Rea1 Rfc8 27. h4 Na4 28. Bd2 b5 29. R3a2 Rh8 30. Kg2 Rac8 31. Rh1 Qc7 32. Nd4 Qd7 33. Nxf5+ exf5 34. Qd4 Qe6 35. Qxa7 d4 36. Raa1 Qxe5 37. Rae1 Qd5+ 38. Kg3 Rhe8 39. h5 gxh5 40. Rxe8 Rxe8 41. Rxh5 Nc3 42. Qb6 Ne2+ 43. Kh2 Qe6 44. Qxb5 Qd6+ 45. Kg2 Nf4+ 46. Bxf4 Qxf4,"This is a game between Lasker,Em (as White) and Maroczy,G (as Black). Last move played: Black plays Queen takes on f4",Large advantage for White (eval: 447 centipawns),47. Qxe8 Qg4+ 48. Kf1 Qd1+ 49. Qe1 Qxh5 50. Qe5+ Kg8 51. Qxf5 Qh1+ 52. Ke2 Qa1 53. b5 Qa2+ 54. Kf3 Qa8+ 55. Kf4 Qg2 56. Ke5 Qb7 57. Kxd4 Qa7+ 58. Qc5 Qa1+ 59. Kd5 Qa8+ 60. Ke5 Qb8+ ,46... Qxf4 47. Qxe8 Qg4+ 48. Kf1 Qd1+ 49. Qe1 Qxh5 50. Qe5+ Kg8 51. Qxf5 Qh1+ 52. Ke2 Qa1 53. b5 Qb1 54. g6 f6 55. b6 Kg7 56. Qh5 Kf8 57. Qh6+ Ke7 58. Qh7+ Ke6 59. Qh3+ Ke7 60. g7 Kf7 61. Qd7+ Kg8 62. Qxd4 f5 
The double attack appears to buy Maroczy some more time.,True," The comment suggests a potential tactical advantage, implying the move was flawed due to a missed opportunity.",1. e4 e6 2. d4 d5 3. Nc3 Bb4 4. e5 c5 5. a3 cxd4 6. axb4 dxc3 7. bxc3 Qc7 8. Nf3 Ne7 9. Bd3 Ng6 10. O-O Nd7 11. Re1 Qxc3 12. Bd2 Qc7 13. Qe2 O-O 14. Qe3 Nb6 15. Qg5 Nc4 16. Bc3 h6 17. Qg4 Ne7 18. Qh5 Bd7 19. g4 Bb5 20. g5 g6 21. Qxh6 Nb6 22. Ra3 Bxd3 23. cxd3 Nf5 24. Qh3 Qe7 25. Qg4 Kg7 26. Rea1 Rfc8 27. h4 Na4 28. Bd2 b5 29. R3a2 Rh8 30. Kg2 Rac8 31. Rh1 Qc7 32. Nd4 Qd7 33. Nxf5+ exf5 34. Qd4 Qe6 35. Qxa7 d4 36. Raa1 Qxe5 37. Rae1 Qd5+ 38. Kg3 Rhe8 39. h5 gxh5 40. Rxe8 Rxe8 41. Rxh5 Nc3 42. Qb6 Ne2+ 43. Kh2 Qe6 44. Qxb5 Qd6+ 45. Kg2 Nf4+ 46. Bxf4 Qxf4 47. Qxe8 Qg4+,"This is a game between Lasker,Em (as White) and Maroczy,G (as Black). Last move played: Black plays Queen to g4 with check",Large advantage for White (eval: 436 centipawns),48. Kf1 Qd1+ 49. Qe1 Qxh5 50. Qe5+ Kg8 51. Qxf5 Qh1+ 52. Ke2 Qc6 53. b5 Qc1 54. g6 f6 55. b6 Kg7 56. Qd7+ Kxg6 57. Qg4+ Kf7 58. Qxd4 Qc2+ 59. Kf3 Qc6+ 60. Kg3 Kg7 61. Qb4 f5 62. b7 Qg6+ 63. Kf3 Qh5+ 64. Kf4 ,47... Qg4+ 48. Kf1 Qxh5 49. Qe5+ Kg8 50. Qxf5 Qh1+ 51. Ke2 Qg1 52. b5 Qc1 53. g6 f6 54. b6 Kg7 55. Qd7+ Kxg6 56. Qg4+ Kf7 57. Qxd4 Qc2+ 58. Kf3 Qc6+ 59. Kg3 Qb7 60. Qc4+ Kg7 61. Qb4 Kh6 
"Maroczy, two pawns down, has a losing endgame ahead of him. He throws in the towel.",True," The comment suggests a likely outcome of a compromised position, indicating a strategic error.",1. e4 e6 2. d4 d5 3. Nc3 Bb4 4. e5 c5 5. a3 cxd4 6. axb4 dxc3 7. bxc3 Qc7 8. Nf3 Ne7 9. Bd3 Ng6 10. O-O Nd7 11. Re1 Qxc3 12. Bd2 Qc7 13. Qe2 O-O 14. Qe3 Nb6 15. Qg5 Nc4 16. Bc3 h6 17. Qg4 Ne7 18. Qh5 Bd7 19. g4 Bb5 20. g5 g6 21. Qxh6 Nb6 22. Ra3 Bxd3 23. cxd3 Nf5 24. Qh3 Qe7 25. Qg4 Kg7 26. Rea1 Rfc8 27. h4 Na4 28. Bd2 b5 29. R3a2 Rh8 30. Kg2 Rac8 31. Rh1 Qc7 32. Nd4 Qd7 33. Nxf5+ exf5 34. Qd4 Qe6 35. Qxa7 d4 36. Raa1 Qxe5 37. Rae1 Qd5+ 38. Kg3 Rhe8 39. h5 gxh5 40. Rxe8 Rxe8 41. Rxh5 Nc3 42. Qb6 Ne2+ 43. Kh2 Qe6 44. Qxb5 Qd6+ 45. Kg2 Nf4+ 46. Bxf4 Qxf4 47. Qxe8 Qg4+ 48. Kf1 Qxh5 49. Qe5+ Kg8 50. Qxf5,"This is a game between Lasker,Em (as White) and Maroczy,G (as Black). Last move played: White plays Queen takes on f5",Large advantage for White (eval: 446 centipawns),50... Qh1+ 51. Ke2 Qh5+ 52. Kd2 Qh1 53. b5 Qf1 54. g6 f6 55. Qd5+ Kg7 56. Qf7+ Kh6 57. Qxf6 Qa1 58. g7+ Kh7 59. Qf5+ Kxg7 60. Ke2 Qb1 61. Kf3 Qb4 62. Ke4 Qb2 63. Qd7+ Kg6 64. Qc6+ Kg5 65. Qc5+ Kg6 66. Kd5 Qxf2 67. Qxd4 Qf7+ 68. Kc6 Qe8+ 69. Kc5 ,50. Qxf5 Qh1+ 51. Ke2 Qb1 52. b5 Qa2+ 53. Kf3 Qa8+ 54. Kf4 Qb8+ 55. Ke4 Qa8+ 56. Kxd4 Qa5 57. Ke3 Qe1+ 58. Kf3 Qh1+ 59. Ke2 Qc1 60. g6 f6 61. Qxf6 Qc2+ 62. Ke3 Qc1+ 63. Ke4 Qh1+ 64. f3 Qe1+ 65. Kd5 
"An aggressive move, common in the French Defense. Black challenges White's center by attacking a central pawn with a flank pawn.",True," The comment suggests a potential strategic miscalculation, indicating a flawed plan.",1. e4 e6 2. d4 d5 3. Nc3 Bb4 4. e5 c5,"This is a game between Lasker,Em (as White) and Maroczy,G (as Black). Last move played: Black plays Pawn to c5",Advantage for White (eval: 61 centipawns),5. a3 ,4... c5 
The e5-square is still the center of attention.,True," The comment suggests a potential tactical threat, indicating a flaw in the move's planning.",1. e4 e6 2. d4 d5 3. Nc3 Bb4 4. e5 c5 5. a3 cxd4 6. axb4 dxc3 7. bxc3 Qc7 8. Nf3 Ne7 9. Bd3 Ng6 10. O-O Nd7 11. Re1 Qxc3 12. Bd2 Qc7,"This is a game between Lasker,Em (as White) and Maroczy,G (as Black). Last move played: Black plays Queen to c7",Large advantage for White (eval: 164 centipawns),13. Ra3 ,12... Qc7 13. Ra3 
Now we see why the White Queen has gone over to the Kingside -- Lasker plans to tear up the pawn cover around the Black King.,True,", The comment indicates a potential weakness in the pawn structure, suggesting an unfavorable pawn structure for the opponent.",1. e4 e6 2. d4 d5 3. Nc3 Bb4 4. e5 c5 5. a3 cxd4 6. axb4 dxc3 7. bxc3 Qc7 8. Nf3 Ne7 9. Bd3 Ng6 10. O-O Nd7 11. Re1 Qxc3 12. Bd2 Qc7 13. Qe2 O-O 14. Qe3 Nb6 15. Qg5 Nc4 16. Bc3 h6 17. Qg4 Ne7 18. Qh5 Bd7 19. g4,"This is a game between Lasker,Em (as White) and Maroczy,G (as Black). Last move played: White plays Pawn to g4",The position is equal,19... d4 ,19. g4 d4 
Threatening Rxa7.,True," The comment suggests a potential tactical blunder, indicating a miscalculation or overextension of the attack.",1. e4 e6 2. d4 d5 3. Nc3 Bb4 4. e5 c5 5. a3 cxd4 6. axb4 dxc3 7. bxc3 Qc7 8. Nf3 Ne7 9. Bd3 Ng6 10. O-O Nd7 11. Re1 Qxc3 12. Bd2 Qc7 13. Qe2 O-O 14. Qe3 Nb6 15. Qg5 Nc4 16. Bc3 h6 17. Qg4 Ne7 18. Qh5 Bd7 19. g4 Bb5 20. g5 g6 21. Qxh6 Nb6 22. Ra3 Bxd3 23. cxd3 Nf5 24. Qh3 Qe7 25. Qg4 Kg7 26. Rea1,"This is a game between Lasker,Em (as White) and Maroczy,G (as Black). Last move played: White plays Rook to a1",Large advantage for Black (eval: -126 centipawns),26... Rh8 27. Bd2 Qd7 28. Rxa7 Rxa7 29. Rxa7 Nc8 30. Ra2 Qb5 31. Ra3 Nce7 32. Qf4 Qc6 33. Ra2 Rc8 34. h4 Rh8 35. Kf1 d4 36. Qe4 Qc8 37. Kg2 Nd5 38. Ra5 Qc2 39. Rc5 ,26. Rb1 
The e5-square is still the center of attention.,True," The comment suggests a potential weakness in the move, hinting at a strategic misstep.",1. e4 e6 2. d4 d5 3. Nc3 Bb4 4. e5 c5 5. a3 cxd4 6. axb4 dxc3 7. bxc3 Qc7 8. Nf3 Ne7 9. Bd3 Ng6 10. O-O Nd7 11. Re1 Qxc3 12. Bd2 Qc7,"This is a game between Lasker,Em (as White) and Maroczy,G (as Black). Last move played: Black plays Queen to c7",Large advantage for White (eval: 164 centipawns),13. Ra3 ,12... Qc7 13. Ra3 
