comment,good,reasoning,moves,context,engine_eval,engine_best_line,engine_best_alternative
"Personally, I don't recommend my students playing 1.d4 until they are about class ""A"" strength. 1.d4 very often leads to strategic play, and 1.e4 is often direct and tactical. The problem is, there are more strategical concepts than tactical in chess, so 1.d4 is harder to play well. I know some players avoid 1. e4 because of the theory involved, but once you understand positions resulting of 1.e4, it really does help understanding 1.d4. This was true for myself.",True,"

The comment offers a rationale for why a particular opening choice (1.d4) might be less suitable for beginners, suggesting a need for deeper strategic understanding, indicating a potential mistake.",1. d4,This is a game between W24 (as White) and B24 (as Black). Last move played: White plays Pawn to d4,Slight advantage for White (eval: 32 centipawns),1... d5 ,1. e4 e5 
"Already a strategical miscue happens. Because of black's inaccurate move 2, white can get nice central control and space with 3. cxd5 Nxd5 4. e4 Nb6 5. Nf3. The pawns on d4 and e4 are called the ""ideal"" pawn center.",True," The comment offers a potential explanation for the mistake, though it's somewhat subjective and relies on assumptions about pawn structures.",1. d4 d5 2. c4 Nf6 3. Nc3,This is a game between W24 (as White) and B24 (as Black). Last move played: White plays Knight to c3,Slight advantage for White (eval: 21 centipawns),3... dxc4 4. e3 a6 5. Bxc4 e6 6. Nf3 b5 7. Bb3 Bb7 8. O-O c5 9. Qe2 Be7 10. dxc5 Bxc5 ,3. cxd5 
"Unfortunately, this is one of those positions where the fianchetto of the bishop isn't very effective. White's bishop is blocked by the black d-pawn, and there is no way to dislodge it except by an eventual e4. But if white does that, then white will be obliged to recapture with a piece, and this leaves white's d-pawn isolated. See all the strategical concepts I was talking about? In this position, much more promising is quick development with 5. Bg5, then a later e3, Bd3, Nf3, etc. The text should give black a nice game.",True," The comment identifies a strategic flaw in the bishop's placement, suggesting alternative development plans.",1. d4 d5 2. c4 Nf6 3. Nc3 e6 4. cxd5 exd5 5. g3,This is a game between W24 (as White) and B24 (as Black). Last move played: White plays Pawn to g3,Slight advantage for Black (eval: -26 centipawns),5... Be7 6. Nf3 O-O 7. Bf4 Re8 8. a3 Bf5 9. e3 c6 10. Bd3 Bxd3 11. Qxd3 Bf8 12. h4 Nbd7 13. Kf1 Qc8 14. h5 h6 15. Kg2 Nb6 16. b3 Ne4 ,5. Bg5 
"Unnecessarily passive. Quick king-side castling is white's best chance for an advantage. Therefore 6. Bg2 is the best chance. 6. ... Ne4 is not really a threat, because 7. Qb3 defends against the threat and counter-attacks. This kind of defense-counterattack tactic is fairly common in 1.e4.",True," The comment offers a justification for the mistake, suggesting a defensive strategy is more valuable than a direct attack.",1. d4 d5 2. c4 Nf6 3. Nc3 e6 4. cxd5 exd5 5. g3 Bb4 6. Bd2,This is a game between W24 (as White) and B24 (as Black). Last move played: White plays Bishop to d2,Slight advantage for Black (eval: -29 centipawns),6... c6 7. Nf3 ,6. Bg5 c6 
"Black shouldn't have released the pressure. Simply O-O is logical and strong. Black could then follow it up with ...Re8, .. .c6, ...Bf5, ...Nbd7, with a nice game because of the clamp on the central e4 square. Only if white wastes a tempo with a3 should black capture the knight at c3.",True," The comment offers a potential explanation for the mistake, suggesting a strategic alternative.",1. d4 d5 2. c4 Nf6 3. Nc3 e6 4. cxd5 exd5 5. g3 Bb4 6. Bd2 Bxc3,This is a game between W24 (as White) and B24 (as Black). Last move played: Black plays Bishop takes on c3,The position is equal,7. Bxc3 O-O ,6... c6 7. Nf3 
The losing move for black. Of course 25. ... Kh8 would leave black in a tenetable position.,True," The comment identifies a specific tactical error, suggesting a poor choice of move.",1. d4 d5 2. c4 Nf6 3. Nc3 e6 4. cxd5 exd5 5. g3 Bb4 6. Bd2 Bxc3 7. Bxc3 Ne4 8. Bg2 Nxc3 9. bxc3 Be6 10. e4 dxe4 11. Bxe4 c6 12. Ne2 Nd7 13. Bg2 Nf6 14. Nf4 O-O 15. Nxe6 fxe6 16. O-O h6 17. Qb3 Qd7 18. Rfe1 Rae8 19. Bh3 Nd5 20. c4 Nb6 21. d5 cxd5 22. cxd5 Nxd5 23. Rad1 Qc6 24. Rc1 Qd7 25. Rc5 b6,This is a game between W24 (as White) and B24 (as Black). Last move played: Black plays Pawn to b6,Large advantage for White (eval: 490 centipawns),26. Rxd5 exd5 27. Bxd7 Rxe1+ 28. Kg2 Re2 29. Qxd5+ Kh8 30. Bf5 Rxf5 31. Qxf5 Rxa2 32. Qf8+ Kh7 33. Qf7 Ra5 34. f4 b5 35. Qe6 b4 36. Qe4+ Kh8 37. Qxb4 Ra2+ 38. Kf1 ,25... Kh8 26. Rc2 
"Nice tactic! The rest of the game wasn't the most accurate, but was sufficient to convert the point.",True," The comment suggests the move was insufficient to win, indicating a flawed assessment of the overall position.",1. d4 d5 2. c4 Nf6 3. Nc3 e6 4. cxd5 exd5 5. g3 Bb4 6. Bd2 Bxc3 7. Bxc3 Ne4 8. Bg2 Nxc3 9. bxc3 Be6 10. e4 dxe4 11. Bxe4 c6 12. Ne2 Nd7 13. Bg2 Nf6 14. Nf4 O-O 15. Nxe6 fxe6 16. O-O h6 17. Qb3 Qd7 18. Rfe1 Rae8 19. Bh3 Nd5 20. c4 Nb6 21. d5 cxd5 22. cxd5 Nxd5 23. Rad1 Qc6 24. Rc1 Qd7 25. Rc5 b6 26. Rxd5 Qxd5 27. Bxe6+,This is a game between W24 (as White) and B24 (as Black). Last move played: White plays Bishop takes on e6 with check,Large advantage for White (eval: 610 centipawns),27... Qxe6 28. Rxe6 Rxe6 29. Qxe6+ Rf7 30. Kg2 Kf8 31. Qc8+ Ke7 32. Qc7+ Ke6 33. Qc6+ Ke7 34. h4 Rf6 35. Qc7+ Kf8 36. Qb8+ Kf7 37. Qxa7+ Kg8 38. Qb8+ Kh7 39. Qc8 Rf7 40. Qe6 h5 ,27. Bxe6+ Qxe6 28. Rxe6 Rxe6 29. Qxe6+ Rf7 30. Kg2 Kf8 31. Qc8+ Ke7 32. Qc7+ Ke6 33. Qc6+ Ke7 34. Qd5 Rf6 35. Qb7+ Kf8 36. Qb8+ Kf7 37. Qxa7+ Kg8 38. Qe7 Kh7 39. Qe4+ Kg8 40. Qe8+ Kh7 41. h4 
"Since white already has mating material, simply going for mate is sufficient. Therefore, cutting off black's king is logical, with either Qb6 or Qd5, and simply advancing white's king.",True," The comment suggests a premature and overly simplistic assessment of the position, ignoring the potential for a more complex and strategic solution.",1. d4 d5 2. c4 Nf6 3. Nc3 e6 4. cxd5 exd5 5. g3 Bb4 6. Bd2 Bxc3 7. Bxc3 Ne4 8. Bg2 Nxc3 9. bxc3 Be6 10. e4 dxe4 11. Bxe4 c6 12. Ne2 Nd7 13. Bg2 Nf6 14. Nf4 O-O 15. Nxe6 fxe6 16. O-O h6 17. Qb3 Qd7 18. Rfe1 Rae8 19. Bh3 Nd5 20. c4 Nb6 21. d5 cxd5 22. cxd5 Nxd5 23. Rad1 Qc6 24. Rc1 Qd7 25. Rc5 b6 26. Rxd5 Qxd5 27. Bxe6+ Qxe6 28. Rxe6 Rxe6 29. Qxe6+ Kh7 30. Qe7 Rc8 31. Qxa7 Rc1+ 32. Kg2 b5 33. Qb7 Rc5 34. Qe7 Rc4 35. Qe2 Rb4 36. a3 Rc4 37. Qe5 b4 38. Qf5+ Kg8 39. Qe6+ Kh7 40. Qxc4 bxa3 41. Qd3+ Kg8 42. Qxa3 Kf7 43. Qb3+ Kf6 44. f4 Ke7,This is a game between W24 (as White) and B24 (as Black). Last move played: Black plays King to e7,Mate in 17 for White,45. f5 Kd6 46. Qe6+ Kc5 47. Kh3 Kb5 48. Kg4 Kb4 49. Kh5 Ka5 50. Kg6 Ka4 51. Kxg7 Ka3 52. Kxh6 Ka4 53. f6 Ka3 54. Kg6 Ka4 55. f7 Ka3 56. f8=Q+ Kb2 57. h4 Kc1 58. Qc4+ Kb2 59. Qf6+ Kb1 60. Qff1+ Kb2 61. Qfc1# ,44... Ke7 45. Kh3 Kd6 46. Kh4 Kc7 47. Qc3+ Kb6 48. Qxg7 Kc5 49. Qg8 Kd4 50. Qb3 h5 51. Kxh5 Ke4 52. f5 Kxf5 53. Qd5+ Kf6 54. Kh6 Ke7 55. Kg5 Ke8 56. h4 Ke7 57. Kg6 Ke8 58. h5 Ke7 59. h6 Ke8 60. Qf7+ Kd8 61. h7 Kc8 62. h8=Q# 
"Personally, I don't recommend my students playing 1.d4 until they are about class ""A"" strength. 1.d4 very often leads to strategic play, and 1.e4 is often direct and tactical. The problem is, there are more strategical concepts than tactical in chess, so 1.d4 is harder to play well. I know some players avoid 1. e4 because of the theory involved, but once you understand positions resulting of 1.e4, it really does help understanding 1.d4. This was true for myself.",True, The comment identifies a potential flaw in the opening strategy.,1. d4,This is a game between W24 (as White) and B24 (as Black). Last move played: White plays Pawn to d4,Slight advantage for White (eval: 32 centipawns),1... d5 ,1. e4 e5 
"Already a strategical miscue happens. Because of black's inaccurate move 2, white can get nice central control and space with 3. cxd5 Nxd5 4. e4 Nb6 5. Nf3. The pawns on d4 and e4 are called the ""ideal"" pawn center.",True," The comment highlights a potential weakness stemming from premature center expansion, suggesting a critical error.",1. d4 d5 2. c4 Nf6 3. Nc3,This is a game between W24 (as White) and B24 (as Black). Last move played: White plays Knight to c3,Slight advantage for White (eval: 21 centipawns),3... dxc4 4. e3 a6 5. Bxc4 e6 6. Nf3 b5 7. Bb3 Bb7 8. O-O c5 9. Qe2 Be7 10. dxc5 Bxc5 ,3. cxd5 
"Unfortunately, this is one of those positions where the fianchetto of the bishop isn't very effective. White's bishop is blocked by the black d-pawn, and there is no way to dislodge it except by an eventual e4. But if white does that, then white will be obliged to recapture with a piece, and this leaves white's d-pawn isolated. See all the strategical concepts I was talking about? In this position, much more promising is quick development with 5. Bg5, then a later e3, Bd3, Nf3, etc. The text should give black a nice game.",True," The comment suggests a potential tactical blunder and a strategic disadvantage for white, indicating a flawed move.",1. d4 d5 2. c4 Nf6 3. Nc3 e6 4. cxd5 exd5 5. g3,This is a game between W24 (as White) and B24 (as Black). Last move played: White plays Pawn to g3,Slight advantage for Black (eval: -26 centipawns),5... Be7 6. Nf3 O-O 7. Bf4 Re8 8. a3 Bf5 9. e3 c6 10. Bd3 Bxd3 11. Qxd3 Bf8 12. h4 Nbd7 13. Kf1 Qc8 14. h5 h6 15. Kg2 Nb6 16. b3 Ne4 ,5. Bg5 
