comment,good,reasoning,moves,context,reformulated
"Of course, this isn't the best. This loses the pawn at e4 for nothing. More logical is Nf3, getting a knight out while defending against the threat against d4.",True,"
The comment correctly explains the mistake by highlighting the loss of the pawn at e4, which is unnecessary, and suggests a better move, Nf3, for both defending and developing the knight.",1. e4 e6 2. d4 Nf6 3. Nd2 Nc6 4. Nb3,This is a game between W9 (as White) and B9 (as Black). Last move played: White plays Knight to b3," White's choice of playing Knight to b3 might seem like a solid move, but it's not optimal. A more strategic option would be Nf3, which not only brings out a knight but also provides support against potential threats like d4."
"I don't like this for black. it gives his bishop at d7 nowhere to move. ..a5 makes more sense. Also, if white captures on e4, black can get a somewhat reasonable post for his B on c6. Now it has nothing. White's bishops, on the other hand, have great scope.",True,"

The comment accurately explains the mistake made by black, as it identifies a weakness created by the move and suggests a better alternative to improve the position.",1. e4 e6 2. d4 Nf6 3. Nd2 Nc6 4. Nb3 Nxe4 5. Bd3 d5 6. Nf3 Bd7 7. O-O Bb4 8. Be3 O-O 9. Ne5 Nxe5 10. dxe5 c6,This is a game between W9 (as White) and B9 (as Black). Last move played: Black plays Pawn to c6," B9's move is not favorable as it leaves their bishop on d7 without a proper square. The move...a5 offers a better continuation for Black. If White decides to capture on e4, Black's light-squared bishop could retreat to a safe square, though it would be somewhat passive. Conversely, White's bishops are well-placed and have strong potential for activity."
"Obviously incorrect. (the Q on d8 can capture this knight for nothing). How about playing 12. f3, winning a knight? (12. ...Nxc5 13. Bxc5 Bxc5, or 12. ... Ng5 13. h4! and black's knight has no where to move!",True,"

The comment accurately explains the mistake made by the player, suggesting a better move to win a knight and thus improving the position.",1. e4 e6 2. d4 Nf6 3. Nd2 Nc6 4. Nb3 Nxe4 5. Bd3 d5 6. Nf3 Bd7 7. O-O Bb4 8. Be3 O-O 9. Ne5 Nxe5 10. dxe5 c6 11. a3 Be7 12. Na5,This is a game between W9 (as White) and B9 (as Black). Last move played: White plays Knight to a5," The move played by White is not optimal. Instead of capturing the knight on a5 with the queen on d8, White could play 12. f3, potentially winning a knight. Following Black's potential response (12....Nxc5), White can capture the knight with 13. Bxc5, gaining material advantage. Alternatively, if Black plays 12.... Ng5, White has a strong follow-up with 13. h4, attacking the knight with no good squares to retreat."
"? White's heavy concentration of pieces indicates that the king-side is where white should be active. For sure, Re3 would be the way to go. Rh3 would be winning (if ...Qd8 to try to trade queens, white can play Rf6!). There is nothing black can do to prevent a sacrificial breaktrhough.",True,"

The comment accurately explains the mistake made by the player, as it highlights the missed opportunity for White to put pressure on Black's king-side and suggests a better move to exploit Black's position.",1. e4 e6 2. d4 Nf6 3. Nd2 Nc6 4. Nb3 Nxe4 5. Bd3 d5 6. Nf3 Bd7 7. O-O Bb4 8. Be3 O-O 9. Ne5 Nxe5 10. dxe5 c6 11. a3 Be7 12. Na5 Nxf2 13. Bxf2 Qxa5 14. Qe2 Bc5 15. Qh5 Bxf2+ 16. Rxf2 g6 17. Qh4 Qc7 18. Re1 a6 19. b4,This is a game between W9 (as White) and B9 (as Black). Last move played: White plays Pawn to b4," White's aggressive placement of pieces suggests that White should focus on the king-side. However, the move played, pawn to b4, doesn't align with this strategy. A better move would be Re3, aiming to control the king-side. Meanwhile, Rh3 stands as a potential winning move if Black tries to exchange queens by playing...Qd8, which would allow White to play Rf6. In this situation, Black cannot effectively prevent the sacrificial breakthrough."
"Oops! This doesn't quite work. 21. Re3 is still the right move (with the idea of Rh3, ...h5, Qg5. Black can defend by playing ...fxg6! 21. Re3 Rxf2 22. Kxf2 Rf8+ 23. Kg1 Rf7.",True,"

The comment explains the mistake made by the player as it clarifies why 21. Re3 was not the best move and provides a better alternative strategy for White.",1. e4 e6 2. d4 Nf6 3. Nd2 Nc6 4. Nb3 Nxe4 5. Bd3 d5 6. Nf3 Bd7 7. O-O Bb4 8. Be3 O-O 9. Ne5 Nxe5 10. dxe5 c6 11. a3 Be7 12. Na5 Nxf2 13. Bxf2 Qxa5 14. Qe2 Bc5 15. Qh5 Bxf2+ 16. Rxf2 g6 17. Qh4 Qc7 18. Re1 a6 19. b4 b5 20. Bxg6,This is a game between W9 (as White) and B9 (as Black). Last move played: White plays Bishop takes on g6," White played 21. Re3, which is not the optimal move. The idea with Rh3, followed by...h5, and Qg5 was preferred. Black's defense with...fxg6 was sufficient after this move. If White had played Rh3, Black could respond with...h5, leading to Qg5, which would have been the better plan. After 21. Re3, Black's move Rxf2 was met with Kxf2, allowing Black to proceed with Rf8+, putting White in a difficult position. The sequence 22. Kxf2 Rf8+ 23. Kg1 Rf7 would have been more favorable for Black."
21. Qxh7+ Kf8 22. Qxf7 is checkmate. Always choose the fastest win.,False,"

This comment does not explain the mistake made by the player as it does not provide any insight into why the move was played; it only states the outcome of the move.",1. e4 e6 2. d4 Nf6 3. Nd2 Nc6 4. Nb3 Nxe4 5. Bd3 d5 6. Nf3 Bd7 7. O-O Bb4 8. Be3 O-O 9. Ne5 Nxe5 10. dxe5 c6 11. a3 Be7 12. Na5 Nxf2 13. Bxf2 Qxa5 14. Qe2 Bc5 15. Qh5 Bxf2+ 16. Rxf2 g6 17. Qh4 Qc7 18. Re1 a6 19. b4 b5 20. Bxg6 Rfb8 21. Bxh7+,This is a game between W9 (as White) and B9 (as Black). Last move played: White plays Bishop takes on h7 with check,-
"Why bother with this, when 22. Rxf7+ wins immediately. 22. ... Kxf7 23. Rf1+ (...Ke8 24. Bg6#) Kg7 24. Qf6+! Kxh7 25. Rf3, and black is helpless against the threat of Rh3+ and Rh8 mate. Watch for this motif, this happens a lot in chess games.",True,"

The comment accurately explains the mistake made by the player, as it describes the immediate tactical sequence that leads to a checkmate and highlights a common motif in chess.",1. e4 e6 2. d4 Nf6 3. Nd2 Nc6 4. Nb3 Nxe4 5. Bd3 d5 6. Nf3 Bd7 7. O-O Bb4 8. Be3 O-O 9. Ne5 Nxe5 10. dxe5 c6 11. a3 Be7 12. Na5 Nxf2 13. Bxf2 Qxa5 14. Qe2 Bc5 15. Qh5 Bxf2+ 16. Rxf2 g6 17. Qh4 Qc7 18. Re1 a6 19. b4 b5 20. Bxg6 Rfb8 21. Bxh7+ Kf8 22. Qh6+,This is a game between W9 (as White) and B9 (as Black). Last move played: White plays Queen to h6 with check," White's last move was risky and not the best choice. A better move would have been 22. Rxf7+, which would have led to a checkmate in two. If Black responded with 22.... Kxf7, White's next move, 23. Rf1+, followed by a series of checks, would leave Black with no good options. For example, if Black moves their king, White could proceed with 24. Qf6+ followed by 25. Rf3, setting up a threat of checkmate with Rh3+ and Rh8. It's important to recognize this pattern as it can happen frequently in chess games."
Good! This moves ties down black's forces.,False,"

The comment does not explain the mistake, as it incorrectly labels a move as ""good"" when it may have actually been a mistake.",1. e4 e6 2. d4 Nf6 3. Nd2 Nc6 4. Nb3 Nxe4 5. Bd3 d5 6. Nf3 Bd7 7. O-O Bb4 8. Be3 O-O 9. Ne5 Nxe5 10. dxe5 c6 11. a3 Be7 12. Na5 Nxf2 13. Bxf2 Qxa5 14. Qe2 Bc5 15. Qh5 Bxf2+ 16. Rxf2 g6 17. Qh4 Qc7 18. Re1 a6 19. b4 b5 20. Bxg6 Rfb8 21. Bxh7+ Kf8 22. Qh6+ Ke8 23. Qg7 Kd8 24. Rxf7,This is a game between W9 (as White) and B9 (as Black). Last move played: White plays Rook takes on f7,-
"Not good. This lets black get out of the bind. Black's king can't move because he was tied down to defense of his bishop. Both Bd3, with the idea of pushing the h-pawn to h8, or Bf5!, both win quickly.",True,"

The comment accurately identifies the mistake made by the player and explains why it was a bad move.",1. e4 e6 2. d4 Nf6 3. Nd2 Nc6 4. Nb3 Nxe4 5. Bd3 d5 6. Nf3 Bd7 7. O-O Bb4 8. Be3 O-O 9. Ne5 Nxe5 10. dxe5 c6 11. a3 Be7 12. Na5 Nxf2 13. Bxf2 Qxa5 14. Qe2 Bc5 15. Qh5 Bxf2+ 16. Rxf2 g6 17. Qh4 Qc7 18. Re1 a6 19. b4 b5 20. Bxg6 Rfb8 21. Bxh7+ Kf8 22. Qh6+ Ke8 23. Qg7 Kd8 24. Rxf7 Qa7+ 25. Kf1 Qb7 26. Qf6+ Kc8 27. Qe7 Qc7 28. Rf8+,This is a game between W9 (as White) and B9 (as Black). Last move played: White plays Rook to f8 with check, 'Playing Rook to f8 isn't a strong move. It doesn't help Black escape the pressure. The Black king remains immobile due to the defense of their bishop. Moves like Bd3 or Bf5 would have been much more effective in securing a quick win.'
"?? Doesn't black's reply of ...Rxf7 pretty much end the game? Whenever you want to move your queen behind enemy lines, make sure enemy pieces can't get at her!",True,"

The comment correctly identifies the mistake in the move, as it leaves the black queen vulnerable to capture, leading to a significant material disadvantage.",1. e4 e6 2. d4 Nf6 3. Nd2 Nc6 4. Nb3 Nxe4 5. Bd3 d5 6. Nf3 Bd7 7. O-O Bb4 8. Be3 O-O 9. Ne5 Nxe5 10. dxe5 c6 11. a3 Be7 12. Na5 Nxf2 13. Bxf2 Qxa5 14. Qe2 Bc5 15. Qh5 Bxf2+ 16. Rxf2 g6 17. Qh4 Qc7 18. Re1 a6 19. b4 b5 20. Bxg6 Rfb8 21. Bxh7+ Kf8 22. Qh6+ Ke8 23. Qg7 Kd8 24. Rxf7 Qa7+ 25. Kf1 Qb7 26. Qf6+ Kc8 27. Qe7 Qc7 28. Rf8+ Kb7 29. Rxb8+ Rxb8 30. a4 Re8 31. Qf7 bxa4 32. Ra1 Rd8 33. g4 Qxe5 34. Rxa4 Qxh2 35. Qh5 Rf8+ 36. Ke1 Qf2+ 37. Kd1 Qf1+ 38. Kd2 Rf2+ 39. Kc3 Qc4+ 40. Kb2 c5 41. Qf7,This is a game between W9 (as White) and B9 (as Black). Last move played: White plays Queen to f7," Black's response with...Rxf7 is a risky move that can lead to a quick checkmate. When moving your queen into aggressive positions, always ensure that there are no immediate threats from the opponent's pieces."
"Why not Qxh2 , ending black's game? There is no perpetual check. It is good to trade when ahead, but it doesn't hurt to be even more ahead either.",True,"

The comment correctly identifies the mistake as being ineffective in gaining an advantage, as it does not lead to a check or material gain.",1. e4 e6 2. d4 Nf6 3. Nd2 Nc6 4. Nb3 Nxe4 5. Bd3 d5 6. Nf3 Bd7 7. O-O Bb4 8. Be3 O-O 9. Ne5 Nxe5 10. dxe5 c6 11. a3 Be7 12. Na5 Nxf2 13. Bxf2 Qxa5 14. Qe2 Bc5 15. Qh5 Bxf2+ 16. Rxf2 g6 17. Qh4 Qc7 18. Re1 a6 19. b4 b5 20. Bxg6 Rfb8 21. Bxh7+ Kf8 22. Qh6+ Ke8 23. Qg7 Kd8 24. Rxf7 Qa7+ 25. Kf1 Qb7 26. Qf6+ Kc8 27. Qe7 Qc7 28. Rf8+ Kb7 29. Rxb8+ Rxb8 30. a4 Re8 31. Qf7 bxa4 32. Ra1 Rd8 33. g4 Qxe5 34. Rxa4 Qxh2 35. Qh5 Rf8+ 36. Ke1 Qf2+ 37. Kd1 Qf1+ 38. Kd2 Rf2+ 39. Kc3 Qc4+ 40. Kb2 c5 41. Qf7 Rh2 42. Qxd7+ Kb8 43. Qd6+ Kb7 44. Qd7+ Kb8 45. Qd6+ Kb7,This is a game between W9 (as White) and B9 (as Black). Last move played: Black plays King to b7," ""The move Qxh2 by White was not the best choice. It doesn't create a perpetual check and might not be necessary even when ahead. Better to aim for a stronger lead."""
"A mistake. Black can now draw. If white plays 54. Ra7+ Kd8 55. Rxe7 Kxe7 56. g5! would win the game. White has a passed c & g pawn -- it's impossible for black's king to stop both, and black's pawns are contained easily by the white king.",True,"

The comment correctly explains the mistake made by Black, as the move allows White to create a passed pawn and gain a significant advantage, leading to a winning position.",1. e4 e6 2. d4 Nf6 3. Nd2 Nc6 4. Nb3 Nxe4 5. Bd3 d5 6. Nf3 Bd7 7. O-O Bb4 8. Be3 O-O 9. Ne5 Nxe5 10. dxe5 c6 11. a3 Be7 12. Na5 Nxf2 13. Bxf2 Qxa5 14. Qe2 Bc5 15. Qh5 Bxf2+ 16. Rxf2 g6 17. Qh4 Qc7 18. Re1 a6 19. b4 b5 20. Bxg6 Rfb8 21. Bxh7+ Kf8 22. Qh6+ Ke8 23. Qg7 Kd8 24. Rxf7 Qa7+ 25. Kf1 Qb7 26. Qf6+ Kc8 27. Qe7 Qc7 28. Rf8+ Kb7 29. Rxb8+ Rxb8 30. a4 Re8 31. Qf7 bxa4 32. Ra1 Rd8 33. g4 Qxe5 34. Rxa4 Qxh2 35. Qh5 Rf8+ 36. Ke1 Qf2+ 37. Kd1 Qf1+ 38. Kd2 Rf2+ 39. Kc3 Qc4+ 40. Kb2 c5 41. Qf7 Rh2 42. Qxd7+ Kb8 43. Qd6+ Kb7 44. Qd7+ Kb8 45. Qd6+ Kb7 46. Qxc5 Qxc5 47. bxc5 Rxh7 48. Rb4+ Kc7 49. Rb6 e5 50. Rxa6 Re7 51. Kc1 e4 52. Kd2 e3+ 53. Ke1 d4 54. g5,This is a game between W9 (as White) and B9 (as Black). Last move played: White plays Pawn to g5," Black made an error. White could potentially win with a sequence like 54. Ra7+ Kd8 55. Rxe7 Kxe7 56. g5!. White has a passed c and g pawn, making it not feasible for Black's king to stop both, and Black's pawns can be easily contained by the White king."
"The notes say White won, but this is a drawn position. Perhaps white won on flag? Continue your studies of tactics, middle game, and endgame. You're sure to improve.",True,"

The comment explains the mistake made by the player by pointing out that despite the notes suggesting a win for White, the position was actually drawn, implying a tactical error.",1. e4 e6 2. d4 Nf6 3. Nd2 Nc6 4. Nb3 Nxe4 5. Bd3 d5 6. Nf3 Bd7 7. O-O Bb4 8. Be3 O-O 9. Ne5 Nxe5 10. dxe5 c6 11. a3 Be7 12. Na5 Nxf2 13. Bxf2 Qxa5 14. Qe2 Bc5 15. Qh5 Bxf2+ 16. Rxf2 g6 17. Qh4 Qc7 18. Re1 a6 19. b4 b5 20. Bxg6 Rfb8 21. Bxh7+ Kf8 22. Qh6+ Ke8 23. Qg7 Kd8 24. Rxf7 Qa7+ 25. Kf1 Qb7 26. Qf6+ Kc8 27. Qe7 Qc7 28. Rf8+ Kb7 29. Rxb8+ Rxb8 30. a4 Re8 31. Qf7 bxa4 32. Ra1 Rd8 33. g4 Qxe5 34. Rxa4 Qxh2 35. Qh5 Rf8+ 36. Ke1 Qf2+ 37. Kd1 Qf1+ 38. Kd2 Rf2+ 39. Kc3 Qc4+ 40. Kb2 c5 41. Qf7 Rh2 42. Qxd7+ Kb8 43. Qd6+ Kb7 44. Qd7+ Kb8 45. Qd6+ Kb7 46. Qxc5 Qxc5 47. bxc5 Rxh7 48. Rb4+ Kc7 49. Rb6 e5 50. Rxa6 Re7 51. Kc1 e4 52. Kd2 e3+ 53. Ke1 d4 54. g5 Kb7 55. Rb6+ Kc7 56. g6 Re5 57. Ke2 Rxc5 58. g7 Rxc2+ 59. Kd3 Rg2 60. Re6 Kd7 61. Re5 Rxg7 62. Kxd4 e2 63. Rxe2 Kd6 64. Kd3 Kd5 65. Kc2 Rh7 66. Rd2+ Ke5 67. Kc3 Rh6 68. Rd3 Rc6+ 69. Kd2 Re6 70. Ke3,This is a game between W9 (as White) and B9 (as Black). Last move played: White plays King to e3," It appears that White may have claimed victory, but the position actually indicates a draw. This suggests the move with White's King to e3 was not advantageous. Continue refining your tactical, middle-game, and endgame skills. You're bound to make progress."
