comment,good,reasoning,moves,context
"This leaves Nf3 to support e4-e5 and so discourages the next natural move Black would like to make, ...Ng8-f6. If instead Black secures e5 by 3...d6 then 4. Bb5 might lead to something like the Kasparov-Polgar game. However, Nc3 leaves d4 weaker than usual, so 3...g6 might work well.",True,"

The comment correctly points out the mistake by explaining the potential consequences of the move, which weakens Black's position and offers White strategic opportunities.",1. e4 c5 2. Nf3 Nc6 3. Nc3,"This is a game between Kasparov, Garri (as White) and Ivanchuk, Vassily (as Black). Last move played: White plays Knight to c3"
"Black greedily chases Bd4, so he can capture Pe5 without offering a bishop trade, but he also weakens b5 & d5 which should give White some opportunities.",True,"

The comment accurately explains the mistake by noting that the move Bd4 allows White to trade a bishop for a knight without any direct repercussions, while also weakening key squares on the chessboard.",1. e4 c5 2. Nf3 Nc6 3. Nc3 g6 4. d4 cxd4 5. Nxd4 Bg7 6. Be3 Nf6 7. Nxc6 bxc6 8. e5 Ng8 9. f4 f6 10. Bd4 Qa5 11. Qd2 fxe5 12. fxe5 c5,"This is a game between Kasparov, Garri (as White) and Ivanchuk, Vassily (as Black). Last move played: Black plays Pawn to c5"
possibly threatening 15. Bxg8 Rxg8 16. Qd5,True,"
The comment explains that the move 15... Rxg8 allows White to play 16. Qd5, putting the Black king in check and highlighting the mistake in the move.",1. e4 c5 2. Nf3 Nc6 3. Nc3 g6 4. d4 cxd4 5. Nxd4 Bg7 6. Be3 Nf6 7. Nxc6 bxc6 8. e5 Ng8 9. f4 f6 10. Bd4 Qa5 11. Qd2 fxe5 12. fxe5 c5 13. Be3 Bxe5 14. Bc4,"This is a game between Kasparov, Garri (as White) and Ivanchuk, Vassily (as Black). Last move played: White plays Bishop to c4"
"Most open positions, such as this, are dominated by pure piece activity and tactical shots.",True,"
The comment accurately explains the mistake made by the player as it highlights the importance of piece activity and tactical threats in open positions.",1. e4 c5 2. Nf3 Nc6 3. Nc3 g6 4. d4 cxd4 5. Nxd4 Bg7 6. Be3 Nf6 7. Nxc6 bxc6 8. e5 Ng8 9. f4 f6 10. Bd4 Qa5 11. Qd2 fxe5 12. fxe5 c5 13. Be3 Bxe5 14. Bc4 Nf6 15. O-O,"This is a game between Kasparov, Garri (as White) and Ivanchuk, Vassily (as Black). Last move played: White plays kingside castle"
Bc4 is inhibiting ...O-O,True,"

The comment accurately explains the mistake, as moving the bishop to c4 directly blocks the black king's escape route to the kingside, potentially leading to a disadvantageous position.",1. e4 c5 2. Nf3 Nc6 3. Nc3 g6 4. d4 cxd4 5. Nxd4 Bg7 6. Be3 Nf6 7. Nxc6 bxc6 8. e5 Ng8 9. f4 f6 10. Bd4 Qa5 11. Qd2 fxe5 12. fxe5 c5 13. Be3 Bxe5 14. Bc4 Nf6 15. O-O Ba6,"This is a game between Kasparov, Garri (as White) and Ivanchuk, Vassily (as Black). Last move played: Black plays Bishop to a6"
Ivanchuk is a little too cautious here and doesn't realize he could play more aggressively if he identifies Kg1 as a target.,True,"

The comment accurately explains the player's mistake of being too cautious and not identifying Kg1 as a target for a more aggressive play.",1. e4 c5 2. Nf3 Nc6 3. Nc3 g6 4. d4 cxd4 5. Nxd4 Bg7 6. Be3 Nf6 7. Nxc6 bxc6 8. e5 Ng8 9. f4 f6 10. Bd4 Qa5 11. Qd2 fxe5 12. fxe5 c5 13. Be3 Bxe5 14. Bc4 Nf6 15. O-O Ba6 16. Bxa6 Qxa6 17. Bxc5 d6,"This is a game between Kasparov, Garri (as White) and Ivanchuk, Vassily (as Black). Last move played: Black plays Pawn to d6"
"Pd6 and Nf6 will be slightly less safe after this move, but it classically chases the opponent's pieces from the center (at least for the moment) . Which is more important, the activity or the weaknesses left in it's wake?",True,"

The comment explains the mistake made by the player by analyzing the consequences (less safety) and potential benefits (chasing opponent's pieces) of the move.",1. e4 c5 2. Nf3 Nc6 3. Nc3 g6 4. d4 cxd4 5. Nxd4 Bg7 6. Be3 Nf6 7. Nxc6 bxc6 8. e5 Ng8 9. f4 f6 10. Bd4 Qa5 11. Qd2 fxe5 12. fxe5 c5 13. Be3 Bxe5 14. Bc4 Nf6 15. O-O Ba6 16. Bxa6 Qxa6 17. Bxc5 d6 18. Rae1 O-O 19. Bd4 Bxd4+ 20. Qxd4 e5,"This is a game between Kasparov, Garri (as White) and Ivanchuk, Vassily (as Black). Last move played: Black plays Pawn to e5"
"He has to realize that 21...Qb6+ 22. Kh1 Qxb2 isn't going to be a problem and that Qb6+ doesn't endanger White's king and that a queen trade would help White to block Black's central pawns. So, how does Black continue trying to win? It's not clear he can safely do that.",True,"

The comment correctly identifies the mistake made by the player, pointing out that the move 21...Qb6+ doesn't pose a significant threat and suggests a better continuation by trading queens to disrupt Black's pawn structure.",1. e4 c5 2. Nf3 Nc6 3. Nc3 g6 4. d4 cxd4 5. Nxd4 Bg7 6. Be3 Nf6 7. Nxc6 bxc6 8. e5 Ng8 9. f4 f6 10. Bd4 Qa5 11. Qd2 fxe5 12. fxe5 c5 13. Be3 Bxe5 14. Bc4 Nf6 15. O-O Ba6 16. Bxa6 Qxa6 17. Bxc5 d6 18. Rae1 O-O 19. Bd4 Bxd4+ 20. Qxd4 e5 21. Qd3,"This is a game between Kasparov, Garri (as White) and Ivanchuk, Vassily (as Black). Last move played: White plays Queen to d3"
"This has one benefit for Black, it blocks the d-file, so Pd6 won't be so exposed.",True,"

The comment does explain the mistake made by the player, as it suggests that the move has a strategic benefit for Black by blocking the White's pawn on d5, which could have made the d6 square more vulnerable to attacks.",1. e4 c5 2. Nf3 Nc6 3. Nc3 g6 4. d4 cxd4 5. Nxd4 Bg7 6. Be3 Nf6 7. Nxc6 bxc6 8. e5 Ng8 9. f4 f6 10. Bd4 Qa5 11. Qd2 fxe5 12. fxe5 c5 13. Be3 Bxe5 14. Bc4 Nf6 15. O-O Ba6 16. Bxa6 Qxa6 17. Bxc5 d6 18. Rae1 O-O 19. Bd4 Bxd4+ 20. Qxd4 e5 21. Qd3 Qxd3 22. cxd3,"This is a game between Kasparov, Garri (as White) and Ivanchuk, Vassily (as Black). Last move played: White plays Pawn takes on d3"
Overprotecting Nf6 will allow ...Rf8-c8.,True,"

The reason for this rating is that the comment accurately identifies a strategic mistake, where the player overprotects a knight leading to a potential tactic against the opponent.",1. e4 c5 2. Nf3 Nc6 3. Nc3 g6 4. d4 cxd4 5. Nxd4 Bg7 6. Be3 Nf6 7. Nxc6 bxc6 8. e5 Ng8 9. f4 f6 10. Bd4 Qa5 11. Qd2 fxe5 12. fxe5 c5 13. Be3 Bxe5 14. Bc4 Nf6 15. O-O Ba6 16. Bxa6 Qxa6 17. Bxc5 d6 18. Rae1 O-O 19. Bd4 Bxd4+ 20. Qxd4 e5 21. Qd3 Qxd3 22. cxd3 Rab8 23. b3 Kg7,"This is a game between Kasparov, Garri (as White) and Ivanchuk, Vassily (as Black). Last move played: Black plays King to g7"
perhaps encouraging the following mini-combination,False,"

This comment does not specifically address the mistake made by the player, but rather suggests a potential strategic opportunity that could arise in the future.",1. e4 c5 2. Nf3 Nc6 3. Nc3 g6 4. d4 cxd4 5. Nxd4 Bg7 6. Be3 Nf6 7. Nxc6 bxc6 8. e5 Ng8 9. f4 f6 10. Bd4 Qa5 11. Qd2 fxe5 12. fxe5 c5 13. Be3 Bxe5 14. Bc4 Nf6 15. O-O Ba6 16. Bxa6 Qxa6 17. Bxc5 d6 18. Rae1 O-O 19. Bd4 Bxd4+ 20. Qxd4 e5 21. Qd3 Qxd3 22. cxd3 Rab8 23. b3 Kg7 24. Rc1 Rfc8 25. h3 a5 26. g4 h6 27. Kg2,"This is a game between Kasparov, Garri (as White) and Ivanchuk, Vassily (as Black). Last move played: White plays King to g2"
Getting rid of White's queen-side pawns will make it easier to draw.,True,"

The comment accurately identifies the mistake of allowing White's queen-side pawns to be removed, which could indeed facilitate a draw by simplifying the position.",1. e4 c5 2. Nf3 Nc6 3. Nc3 g6 4. d4 cxd4 5. Nxd4 Bg7 6. Be3 Nf6 7. Nxc6 bxc6 8. e5 Ng8 9. f4 f6 10. Bd4 Qa5 11. Qd2 fxe5 12. fxe5 c5 13. Be3 Bxe5 14. Bc4 Nf6 15. O-O Ba6 16. Bxa6 Qxa6 17. Bxc5 d6 18. Rae1 O-O 19. Bd4 Bxd4+ 20. Qxd4 e5 21. Qd3 Qxd3 22. cxd3 Rab8 23. b3 Kg7 24. Rc1 Rfc8 25. h3 a5 26. g4 h6 27. Kg2 Rxc3 28. Rxc3 Nd5 29. Rc6 Ne3+ 30. Kf2 Nxf1 31. Kxf1 a4,"This is a game between Kasparov, Garri (as White) and Ivanchuk, Vassily (as Black). Last move played: Black plays Pawn to a4"
and they drew because Black will have ...Ra2-h2xh3+ to keep material equal,True,"

The comment correctly identifies that the player made a mistake by allowing Black to capture on h3 with the rook, which would maintain material equality and not result in a draw.",1. e4 c5 2. Nf3 Nc6 3. Nc3 g6 4. d4 cxd4 5. Nxd4 Bg7 6. Be3 Nf6 7. Nxc6 bxc6 8. e5 Ng8 9. f4 f6 10. Bd4 Qa5 11. Qd2 fxe5 12. fxe5 c5 13. Be3 Bxe5 14. Bc4 Nf6 15. O-O Ba6 16. Bxa6 Qxa6 17. Bxc5 d6 18. Rae1 O-O 19. Bd4 Bxd4+ 20. Qxd4 e5 21. Qd3 Qxd3 22. cxd3 Rab8 23. b3 Kg7 24. Rc1 Rfc8 25. h3 a5 26. g4 h6 27. Kg2 Rxc3 28. Rxc3 Nd5 29. Rc6 Ne3+ 30. Kf2 Nxf1 31. Kxf1 a4 32. bxa4 Rb1+ 33. Ke2 Rb2+ 34. Ke3 Rxa2 35. Rxd6 Rxa4 36. Re6 Ra2,"This is a game between Kasparov, Garri (as White) and Ivanchuk, Vassily (as Black). Last move played: Black plays Rook to a2"
