comment,good,reasoning,moves,context,reformulated
"This seems to be a new move. It's interesting that this year Ivan Sokolov already suffered from a novelty involving Qe2 - in his game against Alexander Morozevich in Sarajevo, which went 1 e4 e5 2 f4 exf4 3 Nf3 Ne7 4 d4 d5 5 Qe2!.",True,"

The comment provides a relevant example of the move Qe2 in a specific game, which can help the player understand the potential pitfalls of the move they made.",1. e4 e5 2. Nf3 Nc6 3. d4 exd4 4. Nxd4 Bc5 5. Be3 Qf6 6. c3 Qg6 7. Qf3 Ne5 8. Qe2,"This is a game between Ponomariov, Ruslan (as White) and Sokolov, Ivan (as Black). Last move played: White plays Queen to e2"," White's move, Qe2, is considered weaker. It's evident from Black's game against Alexander Morozevich in Sarajevo where this novelty was employed: 1.e4 e5 2.f4 exf4 3.Nf3 Ne7 4.d4 d5 5.Qe2."
"It is easy to criticise Black's decision to settle for a unpleasant ending, but White's pawn storm on the kingside could be even more unpleasant!",True,"

The comment indicates that both players made critical errors in their strategy, but it explains that Black made the mistake of settling for a less favorable position, while White's aggressive pawn storm could lead to potential disadvantages.",1. e4 e5 2. Nf3 Nc6 3. d4 exd4 4. Nxd4 Bc5 5. Be3 Qf6 6. c3 Qg6 7. Qf3 Ne5 8. Qe2 Nh6 9. f4 Neg4 10. f5 Qf6 11. Bg1 O-O 12. Nd2 Ne5 13. O-O-O Qa6,"This is a game between Ponomariov, Ruslan (as White) and Sokolov, Ivan (as Black). Last move played: Black plays Queen to a6"," Their decision to settle for a disadvantageous ending is hard to justify, considering White's aggressive pawn advancement on the kingside."
Pieces like the black knight on e5 must be eliminated!,False,"
This comment does not explain the mistake made by the player, as it is a general statement rather than addressing the specific error in the move played.",1. e4 e5 2. Nf3 Nc6 3. d4 exd4 4. Nxd4 Bc5 5. Be3 Qf6 6. c3 Qg6 7. Qf3 Ne5 8. Qe2 Nh6 9. f4 Neg4 10. f5 Qf6 11. Bg1 O-O 12. Nd2 Ne5 13. O-O-O Qa6 14. Qxa6 bxa6 15. N4f3,"This is a game between Ponomariov, Ruslan (as White) and Sokolov, Ivan (as Black). Last move played: White plays Knight to f3",-
"Numerous exchanges did not improve Black's position - his bishop is pretty limited, while White's knight has lots of attractive squares. Now it is going to c5.",True,"
The comment clearly explains the mistake made by the player, as it highlights the ineffective exchange of pieces and the subsequent limited mobility of Black's bishop compared to the potential activity of White's knight.",1. e4 e5 2. Nf3 Nc6 3. d4 exd4 4. Nxd4 Bc5 5. Be3 Qf6 6. c3 Qg6 7. Qf3 Ne5 8. Qe2 Nh6 9. f4 Neg4 10. f5 Qf6 11. Bg1 O-O 12. Nd2 Ne5 13. O-O-O Qa6 14. Qxa6 bxa6 15. N4f3 Bxg1 16. Rxg1 Nhg4 17. h3 Nxf3 18. gxf3 Ne3 19. Re1 Nxf1 20. Rexf1 f6 21. h4 Bb7 22. Nb3,"This is a game between Ponomariov, Ruslan (as White) and Sokolov, Ivan (as Black). Last move played: White plays Knight to b3"," After recent exchanges, Black's position remains unimproved, with the bishop's effectiveness curtailed. White's knight, however, enjoys several promising squares. It is now advancing to c5."
with the idea of Nd3-f4-d5.,True,"

The comment suggests that the player overlooked the potential threat of a knight maneuver to e5, which could have been a better continuation instead of the actual move made.",1. e4 e5 2. Nf3 Nc6 3. d4 exd4 4. Nxd4 Bc5 5. Be3 Qf6 6. c3 Qg6 7. Qf3 Ne5 8. Qe2 Nh6 9. f4 Neg4 10. f5 Qf6 11. Bg1 O-O 12. Nd2 Ne5 13. O-O-O Qa6 14. Qxa6 bxa6 15. N4f3 Bxg1 16. Rxg1 Nhg4 17. h3 Nxf3 18. gxf3 Ne3 19. Re1 Nxf1 20. Rexf1 f6 21. h4 Bb7 22. Nb3 Rae8 23. Nc5 Bc8 24. c4 Kf7 25. h5 Rg8 26. Nd3,"This is a game between Ponomariov, Ruslan (as White) and Sokolov, Ivan (as Black). Last move played: White plays Knight to d3"," White's last move could be interpreted as a weakening of their position without significant strategic gain. Sokolov, as Black, did not capitalize on this potential weakness."
White immediately takes advantage of the open h-file.,False,"

The comment does not directly address the mistake made by the player, as it focuses on a potential advantage rather than critiquing the move itself.",1. e4 e5 2. Nf3 Nc6 3. d4 exd4 4. Nxd4 Bc5 5. Be3 Qf6 6. c3 Qg6 7. Qf3 Ne5 8. Qe2 Nh6 9. f4 Neg4 10. f5 Qf6 11. Bg1 O-O 12. Nd2 Ne5 13. O-O-O Qa6 14. Qxa6 bxa6 15. N4f3 Bxg1 16. Rxg1 Nhg4 17. h3 Nxf3 18. gxf3 Ne3 19. Re1 Nxf1 20. Rexf1 f6 21. h4 Bb7 22. Nb3 Rae8 23. Nc5 Bc8 24. c4 Kf7 25. h5 Rg8 26. Nd3 g6 27. hxg6+ hxg6 28. fxg6+ Rxg6 29. Rxg6 Kxg6 30. Nf4+ Kf7 31. Rh1,"This is a game between Ponomariov, Ruslan (as White) and Sokolov, Ivan (as Black). Last move played: White plays Rook to h1",-
Black decided to give up a pawn.,True,"

The comment accurately describes the mistake made by the player, which was relinquishing material by losing a pawn.",1. e4 e5 2. Nf3 Nc6 3. d4 exd4 4. Nxd4 Bc5 5. Be3 Qf6 6. c3 Qg6 7. Qf3 Ne5 8. Qe2 Nh6 9. f4 Neg4 10. f5 Qf6 11. Bg1 O-O 12. Nd2 Ne5 13. O-O-O Qa6 14. Qxa6 bxa6 15. N4f3 Bxg1 16. Rxg1 Nhg4 17. h3 Nxf3 18. gxf3 Ne3 19. Re1 Nxf1 20. Rexf1 f6 21. h4 Bb7 22. Nb3 Rae8 23. Nc5 Bc8 24. c4 Kf7 25. h5 Rg8 26. Nd3 g6 27. hxg6+ hxg6 28. fxg6+ Rxg6 29. Rxg6 Kxg6 30. Nf4+ Kf7 31. Rh1 Kg7 32. Nd5 Re5,"This is a game between Ponomariov, Ruslan (as White) and Sokolov, Ivan (as Black). Last move played: Black plays Rook to e5"," ""Black made a disadvantageous move by sacrificing a pawn."""
