comment,good,reasoning,moves,context
A30: Symmetrical English: Double Fianchetto and Hedgehog,False,"

The comment does not explain the mistake made by the player as it only describes the opening strategy rather than pointing out any specific errors in the move.",1. Nf3,"This is a game between Kramnik, Vladimir (as White) and Kasparov, Gary (as Black). Last move played: White plays Knight to f3"
Controls g5,True,"

The comment ""Controls g5"" correctly highlights the mistake as it explains that the player missed the opportunity to control the key square g5, which could have influenced the pawn structure and piece development in their favor.",1. Nf3 Nf6 2. c4 c5 3. g3 d5 4. d4 dxc4 5. Qa4+ Bd7 6. Qxc4 Bc6 7. dxc5 Bd5 8. Qa4+ Bc6 9. Qc4 Bd5 10. Qc2 e6 11. Bg2 Be4 12. Qc4 Bd5 13. Qh4 Bxc5 14. Nc3 Bc6 15. O-O Be7 16. Rd1 Qa5 17. Bd2 Nbd7 18. g4 h6,"This is a game between Kramnik, Vladimir (as White) and Kasparov, Gary (as Black). Last move played: Black plays Pawn to h6"
White threatens Rdb1,False,"

The comment does not explain the mistake, as it only refers to a possible future threat rather than the reason why the move was a mistake.",1. Nf3 Nf6 2. c4 c5 3. g3 d5 4. d4 dxc4 5. Qa4+ Bd7 6. Qxc4 Bc6 7. dxc5 Bd5 8. Qa4+ Bc6 9. Qc4 Bd5 10. Qc2 e6 11. Bg2 Be4 12. Qc4 Bd5 13. Qh4 Bxc5 14. Nc3 Bc6 15. O-O Be7 16. Rd1 Qa5 17. Bd2 Nbd7 18. g4 h6 19. Qg3 Qa6 20. h4 Qc4 21. Bf4 Qb4 22. a3 Qxb2 23. Nd4,"This is a game between Kramnik, Vladimir (as White) and Kasparov, Gary (as Black). Last move played: White plays Knight to d4"
With the idea Nxe7,False,"

The comment does not explain the mistake made by the player as it lacks context and specifics about the move in question.",1. Nf3 Nf6 2. c4 c5 3. g3 d5 4. d4 dxc4 5. Qa4+ Bd7 6. Qxc4 Bc6 7. dxc5 Bd5 8. Qa4+ Bc6 9. Qc4 Bd5 10. Qc2 e6 11. Bg2 Be4 12. Qc4 Bd5 13. Qh4 Bxc5 14. Nc3 Bc6 15. O-O Be7 16. Rd1 Qa5 17. Bd2 Nbd7 18. g4 h6 19. Qg3 Qa6 20. h4 Qc4 21. Bf4 Qb4 22. a3 Qxb2 23. Nd4 g5 24. Nxc6 gxf4 25. Qd3,"This is a game between Kramnik, Vladimir (as White) and Kasparov, Gary (as Black). Last move played: White plays Queen to d3"
Black threatens strongly Ne5,False,"

The comment does not directly explain the mistake made by the player, but rather describes a potential threat for the opponent.",1. Nf3 Nf6 2. c4 c5 3. g3 d5 4. d4 dxc4 5. Qa4+ Bd7 6. Qxc4 Bc6 7. dxc5 Bd5 8. Qa4+ Bc6 9. Qc4 Bd5 10. Qc2 e6 11. Bg2 Be4 12. Qc4 Bd5 13. Qh4 Bxc5 14. Nc3 Bc6 15. O-O Be7 16. Rd1 Qa5 17. Bd2 Nbd7 18. g4 h6 19. Qg3 Qa6 20. h4 Qc4 21. Bf4 Qb4 22. a3 Qxb2 23. Nd4 g5 24. Nxc6 gxf4 25. Qd3 bxc6 26. Bxc6 O-O,"This is a game between Kramnik, Vladimir (as White) and Kasparov, Gary (as Black). Last move played: Black plays kingside castle"
Black loses the upper hand,True,"
The comment accurately reflects that the move made by the black player resulted in a significant disadvantage for their position, indicating a mistake.",1. Nf3 Nf6 2. c4 c5 3. g3 d5 4. d4 dxc4 5. Qa4+ Bd7 6. Qxc4 Bc6 7. dxc5 Bd5 8. Qa4+ Bc6 9. Qc4 Bd5 10. Qc2 e6 11. Bg2 Be4 12. Qc4 Bd5 13. Qh4 Bxc5 14. Nc3 Bc6 15. O-O Be7 16. Rd1 Qa5 17. Bd2 Nbd7 18. g4 h6 19. Qg3 Qa6 20. h4 Qc4 21. Bf4 Qb4 22. a3 Qxb2 23. Nd4 g5 24. Nxc6 gxf4 25. Qd3 bxc6 26. Bxc6 O-O 27. Bxa8 Ne5 28. Qd4 Rxa8 29. Qxe5 Rc8 30. Rac1 Nd5,"This is a game between Kramnik, Vladimir (as White) and Kasparov, Gary (as Black). Last move played: Black plays Knight to d5"
The mate threat is Rxc8,True,"
The comment accurately explains the mistake by pointing out the potential checkmate threat created by the opponent's rook.",1. Nf3 Nf6 2. c4 c5 3. g3 d5 4. d4 dxc4 5. Qa4+ Bd7 6. Qxc4 Bc6 7. dxc5 Bd5 8. Qa4+ Bc6 9. Qc4 Bd5 10. Qc2 e6 11. Bg2 Be4 12. Qc4 Bd5 13. Qh4 Bxc5 14. Nc3 Bc6 15. O-O Be7 16. Rd1 Qa5 17. Bd2 Nbd7 18. g4 h6 19. Qg3 Qa6 20. h4 Qc4 21. Bf4 Qb4 22. a3 Qxb2 23. Nd4 g5 24. Nxc6 gxf4 25. Qd3 bxc6 26. Bxc6 O-O 27. Bxa8 Ne5 28. Qd4 Rxa8 29. Qxe5 Rc8 30. Rac1 Nd5 31. Nxd5,"This is a game between Kramnik, Vladimir (as White) and Kasparov, Gary (as Black). Last move played: White plays Knight takes on d5"
"If Black now would get Bc5 in, he might survive",True,"

The comment suggests that Black could have played Bc5 to create a potential counterplay situation, indicating that not playing it was a mistake.",1. Nf3 Nf6 2. c4 c5 3. g3 d5 4. d4 dxc4 5. Qa4+ Bd7 6. Qxc4 Bc6 7. dxc5 Bd5 8. Qa4+ Bc6 9. Qc4 Bd5 10. Qc2 e6 11. Bg2 Be4 12. Qc4 Bd5 13. Qh4 Bxc5 14. Nc3 Bc6 15. O-O Be7 16. Rd1 Qa5 17. Bd2 Nbd7 18. g4 h6 19. Qg3 Qa6 20. h4 Qc4 21. Bf4 Qb4 22. a3 Qxb2 23. Nd4 g5 24. Nxc6 gxf4 25. Qd3 bxc6 26. Bxc6 O-O 27. Bxa8 Ne5 28. Qd4 Rxa8 29. Qxe5 Rc8 30. Rac1 Nd5 31. Nxd5 Qxe5,"This is a game between Kramnik, Vladimir (as White) and Kasparov, Gary (as Black). Last move played: Black plays Queen takes on e5"
Plans Rxc1,True,"

The comment ""Plans Rxc1"" indicates that the player had an intention to capture the rook on c1, but failed to execute the move, which shows that the move was indeed a mistake.",1. Nf3 Nf6 2. c4 c5 3. g3 d5 4. d4 dxc4 5. Qa4+ Bd7 6. Qxc4 Bc6 7. dxc5 Bd5 8. Qa4+ Bc6 9. Qc4 Bd5 10. Qc2 e6 11. Bg2 Be4 12. Qc4 Bd5 13. Qh4 Bxc5 14. Nc3 Bc6 15. O-O Be7 16. Rd1 Qa5 17. Bd2 Nbd7 18. g4 h6 19. Qg3 Qa6 20. h4 Qc4 21. Bf4 Qb4 22. a3 Qxb2 23. Nd4 g5 24. Nxc6 gxf4 25. Qd3 bxc6 26. Bxc6 O-O 27. Bxa8 Ne5 28. Qd4 Rxa8 29. Qxe5 Rc8 30. Rac1 Nd5 31. Nxd5 Qxe5 32. Nxe7+ Kg7,"This is a game between Kramnik, Vladimir (as White) and Kasparov, Gary (as Black). Last move played: Black plays King to g7"
With the decisive threat Qxd1,True,"

The comment explains the mistake made by the player as it highlights the missed opportunity to capture a significant piece (the queen) with a powerful move (Qxd1).",1. Nf3 Nf6 2. c4 c5 3. g3 d5 4. d4 dxc4 5. Qa4+ Bd7 6. Qxc4 Bc6 7. dxc5 Bd5 8. Qa4+ Bc6 9. Qc4 Bd5 10. Qc2 e6 11. Bg2 Be4 12. Qc4 Bd5 13. Qh4 Bxc5 14. Nc3 Bc6 15. O-O Be7 16. Rd1 Qa5 17. Bd2 Nbd7 18. g4 h6 19. Qg3 Qa6 20. h4 Qc4 21. Bf4 Qb4 22. a3 Qxb2 23. Nd4 g5 24. Nxc6 gxf4 25. Qd3 bxc6 26. Bxc6 O-O 27. Bxa8 Ne5 28. Qd4 Rxa8 29. Qxe5 Rc8 30. Rac1 Nd5 31. Nxd5 Qxe5 32. Nxe7+ Kg7 33. Rxc8 Qxe2 34. Rg8+ Kf6,"This is a game between Kramnik, Vladimir (as White) and Kasparov, Gary (as Black). Last move played: Black plays King to f6"
