comment,good,reasoning,moves,context,engine_eval,engine_best_line,engine_best_alternative
5.Nc3 is more common.,True, The comment suggests a potential weakness in the player’s strategic understanding.,1. d4 d5 2. Nf3 Nf6 3. e3 c6 4. c4 e6 5. Nbd2,This is a game between Euwe (as White) and Speyer (as Black). Last move played: White plays Knight to d2,Slight advantage for White (eval: 21 centipawns),5... Be7 ,5. b3 
Black should have attended to his kingside development.,True," The comment suggests a missed opportunity to develop pieces on the kingside, indicating a flaw in strategic planning.",1. d4 d5 2. Nf3 Nf6 3. e3 c6 4. c4 e6 5. Nbd2 c5 6. Bd3 Nbd7 7. O-O b6,This is a game between Euwe (as White) and Speyer (as Black). Last move played: Black plays Pawn to b6,Large advantage for White (eval: 119 centipawns),8. cxd5 ,7... Be7 
"Since Black is not ready to castle, the opening of the e-file is the logical plan.",True," The comment suggests a defensive strategy, indicating a flawed assessment of Black's development.",1. d4 d5 2. Nf3 Nf6 3. e3 c6 4. c4 e6 5. Nbd2 c5 6. Bd3 Nbd7 7. O-O b6 8. cxd5 exd5 9. e4,This is a game between Euwe (as White) and Speyer (as Black). Last move played: White plays Pawn to e4,Large advantage for White (eval: 195 centipawns),9... dxe4 10. Nxe4 Be7 11. Ne5 Bb7 12. Nxf6+ Nxf6 13. Bb5+ Kf8 14. Bc6 Bxc6 15. Nxc6 Qd5 16. Nxe7 Kxe7 17. Re1+ Kf8 18. dxc5 Qxc5 19. Bf4 Kg8 20. Re5 Qb4 21. Qf3 Rd8 22. Bg5 Qg4 23. Qb3 h6 24. Bxf6 gxf6 25. Re7 Rh7 26. Rxa7 Qe2 27. h3 Rg7 28. Qxb6 Rxg2+ 29. Kxg2 Qe4+ 30. Kg1 Rd5 31. Qe3 ,9. e4 
There will be no castling.,True,", The comment indicates a potential weakness in the position, suggesting a strategic deficiency.",1. d4 d5 2. Nf3 Nf6 3. e3 c6 4. c4 e6 5. Nbd2 c5 6. Bd3 Nbd7 7. O-O b6 8. cxd5 exd5 9. e4 Bb7 10. exd5 Bxd5 11. Re1+ Be7 12. dxc5 Nxc5 13. Bb5+ Kf8,This is a game between Euwe (as White) and Speyer (as Black). Last move played: Black plays King to f8,Large advantage for White (eval: 162 centipawns),14. Ne5 ,13... Ncd7 14. Qe2 
"The queen remains under attack, but it still cannot be captured.",True," The comment identifies a positional vulnerability, suggesting the queen's position is problematic, but doesn't explicitly state the mistake.",1. d4 d5 2. Nf3 Nf6 3. e3 c6 4. c4 e6 5. Nbd2 c5 6. Bd3 Nbd7 7. O-O b6 8. cxd5 exd5 9. e4 Bb7 10. exd5 Bxd5 11. Re1+ Be7 12. dxc5 Nxc5 13. Bb5+ Kf8 14. b3 Bb7 15. Bb2 Nd3 16. Bxd3 Qxd3 17. Rc1 Rd8 18. Rxe7 Bxf3 19. Ba3 Qa6 20. Rcc7,This is a game between Euwe (as White) and Speyer (as Black). Last move played: White plays Rook to c7,Mate in 10 for White,20... Qxa3 21. Rxf7+ Kg8 22. Rxg7+ Kf8 23. Rcf7+ Ke8 24. Qe1+ Be4 25. Nxe4 Rd7 26. Nd6+ Kd8 27. Rxd7+ Nxd7 28. Qe7+ Kc7 29. Qxd7+ Kb8 30. Qb7# ,20. Rcc7 Rd7 21. Rexd7+ Qxa3 22. Rd8+ Ne8 23. Rxe8+ Kxe8 24. Nxf3 Qc1 25. Qxc1 g6 26. Qe1+ Kf8 27. Qe5 f6 28. Qd6+ Kg8 29. Qd8# 
12...bxc5 13.Qe2 with a nasty pin on the e-file.,True,", The comment highlights a strategic blunder by sacrificing the queen, indicating a flawed assessment of the resulting position.",1. d4 d5 2. Nf3 Nf6 3. e3 c6 4. c4 e6 5. Nbd2 c5 6. Bd3 Nbd7 7. O-O b6 8. cxd5 exd5 9. e4 Bb7 10. exd5 Bxd5 11. Re1+ Be7 12. dxc5 Nxc5,This is a game between Euwe (as White) and Speyer (as Black). Last move played: Black plays Knight takes on c5,Large advantage for White (eval: 103 centipawns),13. Bb5+ Ncd7 ,12... O-O 13. cxb6 Bc5 14. Nc4 axb6 15. Bf4 Bb4 16. Rf1 Nc5 17. Be2 Ne6 18. Be5 Bc5 19. a3 Ng4 20. Bg3 b5 21. Nce5 Nxe5 22. Bxe5 b4 23. axb4 Bxb4 24. Qd3 Bxf3 25. Qxd8 Raxd8 26. Bxf3 
There will be no castling.,True," The comment describes a sequence of moves that leads to a checkmate, indicating a flawed move.",1. d4 d5 2. Nf3 Nf6 3. e3 c6 4. c4 e6 5. Nbd2 c5 6. Bd3 Nbd7 7. O-O b6 8. cxd5 exd5 9. e4 Bb7 10. exd5 Bxd5 11. Re1+ Be7 12. dxc5 Nxc5 13. Bb5+ Kf8,This is a game between Euwe (as White) and Speyer (as Black). Last move played: Black plays King to f8,Large advantage for White (eval: 162 centipawns),14. Ne5 ,13... Ncd7 14. Qe2 
