comment,good,reasoning,moves,context,engine_eval,engine_best_line,engine_best_alternative
The White bishop pins the knight.,True,", The comment accurately identifies a critical tactical error.",1. Nf3 Nf6 2. c4 e6 3. Nc3 d5 4. d4 c6 5. cxd5 exd5 6. Qc2 Bd6 7. Bg5,This is a game between Petrosian (as White) and Tolush (as Black). Last move played: White plays Bishop to g5,The position is equal,7... Be6 8. e3 ,7. Bg5 
10. f4 is a multipurpose move which reinforces the White knight and gains space on the king side.,False," The comment describes a move's purpose, not the error itself.",1. Nf3 Nf6 2. c4 e6 3. Nc3 d5 4. d4 c6 5. cxd5 exd5 6. Qc2 Bd6 7. Bg5 O-O 8. e3 Bg4 9. Ne5 Bh5 10. f4,This is a game between Petrosian (as White) and Tolush (as Black). Last move played: White plays Pawn to f4,Slight advantage for White (eval: 44 centipawns),10... Qe8 ,10. g4 Bg6 11. Nxg6 fxg6 12. O-O-O Na6 13. f3 b5 14. e4 h6 15. Bxf6 Bf4+ 16. Kb1 Qxf6 17. h4 Qf7 18. Qb3 Nc7 19. Bd3 Rad8 20. Ne2 dxe4 21. Qxf7+ Rxf7 22. Bxe4 Rf6 23. Nxf4 Rxf4 24. Bxc6 Rfxd4 25. Rxd4 Rxd4 
15...Bg6 16.Bxg6 fxg6 17.Qxg6+ Kh8 18.Qxh6+ Kg8 19.Qe6+ Rf7 20.Rhf1 would win the Black rook.,True," The comment describes a clearly unsound plan for Black, leading to a loss.",1. Nf3 Nf6 2. c4 e6 3. Nc3 d5 4. d4 c6 5. cxd5 exd5 6. Qc2 Bd6 7. Bg5 O-O 8. e3 Bg4 9. Ne5 Bh5 10. f4 Qa5 11. Bd3 h6 12. Bxf6 gxf6 13. g4 fxe5 14. fxe5 Be7 15. O-O-O Bg5,This is a game between Petrosian (as White) and Tolush (as Black). Last move played: Black plays Bishop to g5,Large advantage for White (eval: 468 centipawns),16. gxh5 f5 17. Qf2 c5 18. Kb1 c4 19. Bxc4 dxc4 20. h4 Kh8 21. hxg5 hxg5 22. Qg3 g4 23. d5 ,15... Na6 16. gxh5 Nb4 17. Qd2 Nxd3+ 18. Qxd3 Kh8 19. Kb1 Rab8 20. Rhf1 Qa6 21. Qd2 b5 22. Qd3 Qb7 23. Ne2 Qd7 24. Rf2 Bh4 25. Ng3 Qh3 26. Qc2 Bxg3 27. hxg3 
Faced with a mating attack Black resigned.,True," The comment directly indicates a failed attempt to avoid a devastating outcome, suggesting a flawed strategic choice.",1. Nf3 Nf6 2. c4 e6 3. Nc3 d5 4. d4 c6 5. cxd5 exd5 6. Qc2 Bd6 7. Bg5 O-O 8. e3 Bg4 9. Ne5 Bh5 10. f4 Qa5 11. Bd3 h6 12. Bxf6 gxf6 13. g4 fxe5 14. fxe5 Be7 15. O-O-O Bg5 16. gxh5 Kh8 17. Qf2 f5 18. h4 Be7 19. Qf4,This is a game between Petrosian (as White) and Tolush (as Black). Last move played: White plays Queen to f4,Large advantage for White (eval: 730 centipawns),19... Rf7 20. Qxh6+ Rh7 21. Qg6 Qd8 22. Bxf5 Qg8 23. Qxg8+ Kxg8 24. Bxh7+ Kxh7 25. Rdf1 Kh8 26. Rf7 Bc5 27. Rxb7 Na6 28. Rf1 Bf8 29. Kd2 Bg7 30. Rxg7 ,19. Qf4 Rf7 20. Qxh6+ Rh7 21. Qg6 Nd7 22. Rdg1 Qd8 23. Qxf5 Rh6 24. Rg6 Qf8 25. Rhg1 Nf6 26. exf6 Bxf6 27. Ne2 a5 28. Rxh6+ Qxh6 29. Nf4 Bg7 
"The White knight takes up a powerful post in the center. While, at the same time threatening to win a piece.",True,"

The comment suggests a potential weakness in the move's development, indicating a strategic flaw that contributed to the mistake.",1. Nf3 Nf6 2. c4 e6 3. Nc3 d5 4. d4 c6 5. cxd5 exd5 6. Qc2 Bd6 7. Bg5 O-O 8. e3 Bg4 9. Ne5,This is a game between Petrosian (as White) and Tolush (as Black). Last move played: White plays Knight to e5,Slight advantage for White (eval: 37 centipawns),9... Be6 10. f4 ,9. Bd3 h6 
10. f4 is a multipurpose move which reinforces the White knight and gains space on the king side.,True,". The comment suggests a potential tactical vulnerability, indicating a flawed move that could lead to a significant attack.",1. Nf3 Nf6 2. c4 e6 3. Nc3 d5 4. d4 c6 5. cxd5 exd5 6. Qc2 Bd6 7. Bg5 O-O 8. e3 Bg4 9. Ne5 Bh5 10. f4,This is a game between Petrosian (as White) and Tolush (as Black). Last move played: White plays Pawn to f4,Slight advantage for White (eval: 44 centipawns),10... Qe8 ,10. g4 Bg6 11. Nxg6 fxg6 12. O-O-O Na6 13. f3 b5 14. e4 h6 15. Bxf6 Bf4+ 16. Kb1 Qxf6 17. h4 Qf7 18. Qb3 Nc7 19. Bd3 Rad8 20. Ne2 dxe4 21. Qxf7+ Rxf7 22. Bxe4 Rf6 23. Nxf4 Rxf4 24. Bxc6 Rfxd4 25. Rxd4 Rxd4 
The White bishop pins the knight.,True," The comment offers a potential analysis of the move's impact, suggesting a strategic advantage.",1. Nf3 Nf6 2. c4 e6 3. Nc3 d5 4. d4 c6 5. cxd5 exd5 6. Qc2 Bd6 7. Bg5,This is a game between Petrosian (as White) and Tolush (as Black). Last move played: White plays Bishop to g5,The position is equal,7... Be6 8. e3 ,7. Bg5 
The White bishop pins the knight.,True,", The comment offers a potential explanation for the mistake, suggesting the player overlooked a crucial tactical opportunity.",1. Nf3 Nf6 2. c4 e6 3. Nc3 d5 4. d4 c6 5. cxd5 exd5 6. Qc2 Bd6 7. Bg5,This is a game between Petrosian (as White) and Tolush (as Black). Last move played: White plays Bishop to g5,The position is equal,7... Be6 8. e3 ,7. Bg5 
