comment,good,reasoning,moves,context,reformulated
"Well my opponent might be playing a Caro-Kann, but I have news for him...B.D.G",False,"

The comment does not directly address or explain the specific mistake made by the player in the chess move.",1. d4 c6 2. Nc3 d5,"This is a game between Armstrong, A. (as White) and Stummerer, A. (as Black). Last move played: Black plays Pawn to d5",-
"After this move Black can opt to play the Bishop back, instead he decides to swop off the pieces.",True,"

The comment explains the mistake because it suggests that the player could have avoided losing a piece by moving the bishop back instead of capturing another piece.",1. d4 c6 2. Nc3 d5 3. e4 dxe4 4. f3 exf3 5. Nxf3 Bg4 6. h3,"This is a game between Armstrong, A. (as White) and Stummerer, A. (as Black). Last move played: White plays Pawn to h3", White's last move was a pawn to h3. Black then had a choice: retreat the Bishop or exchange pieces. Exchanging seemed less favorable in this situation.
"Black is now up by 2 pawns, can White recover, yes by developing and attacking at the same time.",True,"

The comment accurately identifies the mistake made by the player and suggests a possible recovery strategy.",1. d4 c6 2. Nc3 d5 3. e4 dxe4 4. f3 exf3 5. Nxf3 Bg4 6. h3 Bxf3 7. Qxf3 Qxd4,"This is a game between Armstrong, A. (as White) and Stummerer, A. (as Black). Last move played: Black plays Queen takes on d4", White is at a disadvantage with the loss of two pawns. Recovery by White requires them to simultaneously develop their pieces and initiate an attack.
"Black would love to swop off the Queen's, but that is not my poison.",True,"

The comment accurately describes the move as a mistake because the reference to swapping off the Queen suggests that the player made a blunder by moving the Queen, which is a valuable and powerful chess piece.",1. d4 c6 2. Nc3 d5 3. e4 dxe4 4. f3 exf3 5. Nxf3 Bg4 6. h3 Bxf3 7. Qxf3 Qxd4 8. Be3 Qf6 9. Qg3,"This is a game between Armstrong, A. (as White) and Stummerer, A. (as Black). Last move played: White plays Queen to g3"," 'White has chosen a move that Black might not favor. This move isn't appealing to Black, but it's not against their strategy.'"
"White has now reached a safe castled position, and has much more artillery at his disposal.",False,"

The comment does not explain the mistake made by the player; it simply describes the current position after the move.",1. d4 c6 2. Nc3 d5 3. e4 dxe4 4. f3 exf3 5. Nxf3 Bg4 6. h3 Bxf3 7. Qxf3 Qxd4 8. Be3 Qf6 9. Qg3 e5 10. O-O-O,"This is a game between Armstrong, A. (as White) and Stummerer, A. (as Black). Last move played: White plays queenside castle",-
"Eyeing up the weak f7 square, the Rook on h1 will come to f1 and further embarace the black Queen.",True,"

The comment accurately explains the mistake made by the player by suggesting a strategic plan to exploit the weak f7 square and potentially pressure the black Queen, which is a logical and tactical analysis of the move.",1. d4 c6 2. Nc3 d5 3. e4 dxe4 4. f3 exf3 5. Nxf3 Bg4 6. h3 Bxf3 7. Qxf3 Qxd4 8. Be3 Qf6 9. Qg3 e5 10. O-O-O Nd7 11. Bc4,"This is a game between Armstrong, A. (as White) and Stummerer, A. (as Black). Last move played: White plays Bishop to c4"," White's move to c4 was not ideal as it left the f7 square weak, potentially setting up a future threat for Black's position."
"This time I will oblige Black with the Queen swop, and then hack away the remnants of the defence.",True,"

The comment explains a potential mistake as it implies a risky strategy (Queen exchange) with an aggressive following move (attack the defense), which can lead to a compromised position if not properly calculated.",1. d4 c6 2. Nc3 d5 3. e4 dxe4 4. f3 exf3 5. Nxf3 Bg4 6. h3 Bxf3 7. Qxf3 Qxd4 8. Be3 Qf6 9. Qg3 e5 10. O-O-O Nd7 11. Bc4 Nh6 12. Rhf1 Qg6,"This is a game between Armstrong, A. (as White) and Stummerer, A. (as Black). Last move played: Black plays Queen to g6"," ""Black's queen swap can be risky. It may leave them with a weakened position and open up their defense."""
"Now it starts to get very messy, the Knight on d7 is very vunerable now. Black is still 2 pawns up, but the Bishop to e6 is too strong.",True,"

The comment correctly highlights the mistake by pointing out the vulnerability of the Knight on d7 and the strength of the Bishop on e6, which could have led to an unfavorable position for the player.",1. d4 c6 2. Nc3 d5 3. e4 dxe4 4. f3 exf3 5. Nxf3 Bg4 6. h3 Bxf3 7. Qxf3 Qxd4 8. Be3 Qf6 9. Qg3 e5 10. O-O-O Nd7 11. Bc4 Nh6 12. Rhf1 Qg6 13. Qxg6 fxg6 14. Bxh6 gxh6 15. Ne4,"This is a game between Armstrong, A. (as White) and Stummerer, A. (as Black). Last move played: White plays Knight to e4"," White's last move placed their Knight on e4, which is poorly positioned and vulnerable, especially with Black's Bishop on e6 exerting considerable pressure. Despite being ahead by two pawns, White must be cautious as Black's piece placement could lead to significant tactical threats."
"Followed by Knight to f6 Black will lose the piece or drop the pawns on h7,h6 and g6.",False,"

The comment does not explain the mistake because it assumes that the knight move to f6 is a mistake and does not provide any context or evaluation of the move that would justify such an assumption.",1. d4 c6 2. Nc3 d5 3. e4 dxe4 4. f3 exf3 5. Nxf3 Bg4 6. h3 Bxf3 7. Qxf3 Qxd4 8. Be3 Qf6 9. Qg3 e5 10. O-O-O Nd7 11. Bc4 Nh6 12. Rhf1 Qg6 13. Qxg6 fxg6 14. Bxh6 gxh6 15. Ne4 O-O-O 16. Be6,"This is a game between Armstrong, A. (as White) and Stummerer, A. (as Black). Last move played: White plays Bishop to e6",-
"Alfred decided enough was enough, and so another bloody victory for the B.D.G.",True,"

The comment implies that the player's move was not only a mistake but also a significant setback for B.D.G., suggesting a poor strategic decision.",1. d4 c6 2. Nc3 d5 3. e4 dxe4 4. f3 exf3 5. Nxf3 Bg4 6. h3 Bxf3 7. Qxf3 Qxd4 8. Be3 Qf6 9. Qg3 e5 10. O-O-O Nd7 11. Bc4 Nh6 12. Rhf1 Qg6 13. Qxg6 fxg6 14. Bxh6 gxh6 15. Ne4 O-O-O 16. Be6 Kc7 17. Rf7 Kb6 18. Rdxd7,"This is a game between Armstrong, A. (as White) and Stummerer, A. (as Black). Last move played: White plays Rook takes on d7"," White's aggressive Rook move to d7 is a poor choice, leading to a significant vulnerability in their position."
