comment,good,reasoning,moves,context,engine_eval,engine_best_line,engine_best_alternative
"While this is an English Opening, it has many characteristics of the Grunfeld Defense. This moves avoids d4 inviting the Grunfeld.",True," The comment identifies a potential tactical error, suggesting a move that could lead to a specific defensive structure.",1. Nf3 Nf6 2. c4 g6 3. Nc3 d5 4. cxd5 Nxd5 5. g3,This is a game between W52 (as White) and B52 (as Black). Last move played: White plays Pawn to g3,Slight advantage for White (eval: 29 centipawns),5... Bg7 ,5. Qb3 Nb6 
...Nb6 is more natural in these English positions. One thing the exchange does is weaken Black's grip of the center.,True," The comment suggests a potential flaw in the move’s strategic intent, indicating a misjudgment of the resulting position.",1. Nf3 Nf6 2. c4 g6 3. Nc3 d5 4. cxd5 Nxd5 5. g3 Bg7 6. Qb3 Nxc3,This is a game between W52 (as White) and B52 (as Black). Last move played: Black plays Knight takes on c3,Slight advantage for White (eval: 26 centipawns),7. dxc3 O-O ,6... Nb6 
An old Russian idea. This works in the Grunfeld but not here.,True," The comment points to a specific tactical weakness, suggesting the move was flawed due to a particular pattern.",1. Nf3 Nf6 2. c4 g6 3. Nc3 d5 4. cxd5 Nxd5 5. g3 Bg7 6. Qb3 Nxc3 7. bxc3 c5 8. Bg2 O-O 9. Ba3,This is a game between W52 (as White) and B52 (as Black). Last move played: White plays Bishop to a3,The position is equal,9... Qa5 ,9. Qa3 Qb6 
"Black is suffering from an optical illusion. The illusion is that the b pawn is free if you move the Queen Bishop. Here is the ""truth"" 11..Be6 12. Qxb7?? Rfc1 13.Ng5 Rab8 and the White Queen leaves the board. Keep alert to tactical possibilities.",True," The comment offers a speculative explanation of the mistake, suggesting a misinterpretation of the board position, but lacks concrete tactical analysis.",1. Nf3 Nf6 2. c4 g6 3. Nc3 d5 4. cxd5 Nxd5 5. g3 Bg7 6. Qb3 Nxc3 7. bxc3 c5 8. Bg2 O-O 9. Ba3 Qa5 10. O-O Nc6 11. Bb2 Rb8,This is a game between W52 (as White) and B52 (as Black). Last move played: Black plays Rook to b8,The position is equal,12. c4 ,11... Be6 12. Qa3 Qxa3 13. Bxa3 b6 14. Rfc1 Rac8 15. d3 Rfd8 16. Kf1 h6 17. Nd2 Ne5 18. Bb2 b5 19. Rc2 g5 20. Rb1 a5 21. Rbc1 Bf5 22. Be4 Bh3+ 23. Bg2 Bxg2+ 24. Kxg2 
"Passing on the creation of the isolated d-pawn (...cxd4) is good here. It shows mature thought, even if it was not intentional. We all learn to automatically filter some things by instinct. This is a time saver but must be deliberately challenged. In this filtering process we develop bias such as ""labels."" (e.g. ethnic and religious affiliations) These tend to put blinders on us. In chess, the basic teacher develops a set of rules and presents them in lessons. This system of indoctrinating the student is good because they must be understood since violating them means terrible consequences. Having come to understand the basic filters and biases we then learn to develop ""exceptions"" and deeper understandings. It is the difference between following the Law and living by the Spirit. One such 'law' in chess is that the isolated pawn is a ""bad"" thing. Typically, if you know how to handle the position, the isolated pawn can be difficult from either perspective. The fact that you either intentionally passed on this idea or unintentionally filtered the idea shows good potential. If it was an unintentional filter then you must focus energy on questioning these filters.",True," The comment offers a nuanced perspective on the impact of instinctive filtering, suggesting a potential for self-awareness and the importance of questioning assumptions, which addresses the mistake made by the player.",1. Nf3 Nf6 2. c4 g6 3. Nc3 d5 4. cxd5 Nxd5 5. g3 Bg7 6. Qb3 Nxc3 7. bxc3 c5 8. Bg2 O-O 9. Ba3 Qa5 10. O-O Nc6 11. Bb2 Rb8 12. d4 Be6 13. Qd1 Rfd8,This is a game between W52 (as White) and B52 (as Black). Last move played: Black plays Rook to d8,Advantage for Black (eval: -67 centipawns),14. e3 ,13... Qb6 14. Qd2 Rfd8 15. e3 Qa6 16. Rfe1 Na5 17. Ng5 Bc4 18. h4 e5 19. Qd1 Rbc8 20. h5 h6 21. Ne4 g5 22. Qc2 Bd3 23. Qd1 b6 
Lack of judgment. There is a time to become materialistic. Material is one of the most permanent and decisive imbalances. Taking the pawn with ...Nxa2 should have given you the game. At least this move does not lose.,True," The comment expresses a pessimistic and potentially flawed assessment of the move’s impact, suggesting a lack of strategic consideration.",1. Nf3 Nf6 2. c4 g6 3. Nc3 d5 4. cxd5 Nxd5 5. g3 Bg7 6. Qb3 Nxc3 7. bxc3 c5 8. Bg2 O-O 9. Ba3 Qa5 10. O-O Nc6 11. Bb2 Rb8 12. d4 Be6 13. Qd1 Rfd8 14. e3 Bd5 15. Qe2 b5 16. Rfd1 Bc4 17. Qc2 Qb6 18. Ng5 cxd4 19. cxd4 Nb4 20. Qe4 a5,This is a game between W52 (as White) and B52 (as Black). Last move played: Black plays Pawn to a5,Slight advantage for Black (eval: -38 centipawns),21. a3 Nd5 22. Nf3 Rbc8 23. Nd2 a4 24. Qf3 e6 25. h4 Qa7 26. h5 Qe7 27. e4 Nb6 28. Rab1 Ba2 29. Ra1 ,20... h6 21. Nf3 Bxa2 22. Qxe7 a5 23. Ne5 Be6 24. Rdc1 Bxe5 25. dxe5 Rd7 26. Qf6 Qd8 27. Bd4 a4 28. h4 h5 29. Be4 Nd5 30. Qf3 
"This is your ""losing move."" There is a fine line between a ""great"" player and a ""good"" player. Several distinguishing characteristics are important to note at this point. For instance the ""great"" player has in reserve a larger number of recognized positions (and the tricks that go with them). A ""great"" player also has the sense of when the position is critical. This is such a moment. Normally, I'd rail on this move but you had the courage to send in the game and learn something useful. Getting back to the idea of material, I like taking at a2. An interesting idea is ...Bd3. Once again, protecting the pawn is an illusion. Notice 23...Bxa2 23.Qxe7 Rb7 24.Qe4 f5 and once again the Queen gets to watch from the side of the board. This Knight, in this position, loses effective influence on the center.",True," The comment offers insightful analysis of the mistake, highlighting strategic weaknesses and potential opportunities.",1. Nf3 Nf6 2. c4 g6 3. Nc3 d5 4. cxd5 Nxd5 5. g3 Bg7 6. Qb3 Nxc3 7. bxc3 c5 8. Bg2 O-O 9. Ba3 Qa5 10. O-O Nc6 11. Bb2 Rb8 12. d4 Be6 13. Qd1 Rfd8 14. e3 Bd5 15. Qe2 b5 16. Rfd1 Bc4 17. Qc2 Qb6 18. Ng5 cxd4 19. cxd4 Nb4 20. Qe4 a5 21. h4 h6 22. Nf3 Nd5,This is a game between W52 (as White) and B52 (as Black). Last move played: Black plays Knight to d5,The position is equal,23. Ne5 h5 24. a3 Rbc8 25. Qf3 Bxe5 26. dxe5 b4 27. axb4 Bb3 28. Rd3 a4 29. g4 hxg4 30. Qxg4 Nxb4 31. Rxd8+ Rxd8 32. h5 Nc2 33. Rc1 Be6 ,22... Bxa2 
Lesson number four: play with a plan!,True," The comment suggests a potential strategic flaw, indicating a need for planning.",1. Nf3 Nf6 2. c4 g6 3. Nc3 d5 4. cxd5 Nxd5 5. g3 Bg7 6. Qb3 Nxc3 7. bxc3 c5 8. Bg2 O-O 9. Ba3 Qa5 10. O-O Nc6 11. Bb2 Rb8 12. d4 Be6 13. Qd1 Rfd8 14. e3 Bd5 15. Qe2 b5 16. Rfd1 Bc4 17. Qc2 Qb6 18. Ng5 cxd4 19. cxd4 Nb4 20. Qe4 a5 21. h4 h6 22. Nf3 Nd5 23. Ne5 Nf6 24. Qf4 Rbc8 25. g4 Qe6 26. Rd2 Nd7,This is a game between W52 (as White) and B52 (as Black). Last move played: Black plays Knight to d7,The position is equal,27. Nxc4 Qxc4 28. Bb7 Rb8 29. Bf3 a4 30. Be2 Qb4 31. Rad1 Nb6 32. Ba1 Nd5 33. Qf3 Qd6 34. e4 Nf4 35. e5 Nxe2+ 36. Rxe2 Qd5 37. Qxd5 Rxd5 38. f4 e6 39. Kf2 b4 40. Ke3 b3 41. axb3 axb3 42. Bb2 ,26... Bd5 
"White chokes and gives Black the game (again) but this follow up mistake to 22...Nd5 returns the favor. White gains a Rook, a Knight, a Bishop, and spare change for the Queen with 22...Qxe5. Remember the ""law"" we talked about earlier? One of the lesson/laws we preach is ""protect the Queen at all costs."" The trouble is that it is more important to protect the King! If you count material, you will find that Black gains material on the exchange.",True, The comment highlights a critical strategic error – prioritizing material gain over the King's safety – which is a significant flaw in chess play.,1. Nf3 Nf6 2. c4 g6 3. Nc3 d5 4. cxd5 Nxd5 5. g3 Bg7 6. Qb3 Nxc3 7. bxc3 c5 8. Bg2 O-O 9. Ba3 Qa5 10. O-O Nc6 11. Bb2 Rb8 12. d4 Be6 13. Qd1 Rfd8 14. e3 Bd5 15. Qe2 b5 16. Rfd1 Bc4 17. Qc2 Qb6 18. Ng5 cxd4 19. cxd4 Nb4 20. Qe4 a5 21. h4 h6 22. Nf3 Nd5 23. Ne5 Nf6 24. Qf4 Rbc8 25. g4 Qe6 26. Rd2 Nd7 27. d5 Qf6,This is a game between W52 (as White) and B52 (as Black). Last move played: Black plays Queen to f6,Large advantage for White (eval: 129 centipawns),28. Nc6 ,27... Qxe5 28. Bxe5 Bxe5 29. Qxh6 Bxa1 30. h5 Bg7 31. Qg5 Bf6 32. Qf4 g5 33. Qf5 e6 34. dxe6 Bxe6 35. Qxb5 Rc4 36. Qa6 Kg7 37. Rd6 Ne5 38. Rxd8 Rc1+ 39. Bf1 Bxd8 40. Kg2 Bd5+ 41. Kh3 Bc7 42. h6+ Kh7 
White's pawn = space + possibilities!,True, The comment suggests the move was flawed because it didn't utilize the available space effectively.,1. Nf3 Nf6 2. c4 g6 3. Nc3 d5 4. cxd5 Nxd5 5. g3 Bg7 6. Qb3 Nxc3 7. bxc3 c5 8. Bg2 O-O 9. Ba3 Qa5 10. O-O Nc6 11. Bb2 Rb8 12. d4 Be6 13. Qd1 Rfd8 14. e3 Bd5 15. Qe2 b5 16. Rfd1 Bc4 17. Qc2 Qb6 18. Ng5 cxd4 19. cxd4 Nb4 20. Qe4 a5 21. h4 h6 22. Nf3 Nd5 23. Ne5 Nf6 24. Qf4 Rbc8 25. g4 Qe6 26. Rd2 Nd7 27. d5 Qf6 28. Nc6 Qxf4 29. Nxe7+ Kh7 30. exf4 Bxb2 31. Rxb2 Rc5 32. Nc6 Re8 33. Rd2 Nf6 34. d6,This is a game between W52 (as White) and B52 (as Black). Last move played: White plays Pawn to d6,Large advantage for White (eval: 238 centipawns),34... Be6 35. g5 Nd7 36. Nxa5 Rf5 37. Rd4 Rc5 38. Re1 Rc2 39. Bc6 Rxa2 40. Bxd7 Bxd7 41. Rxe8 Bxe8 42. Nb3 Ra4 43. d7 Bxd7 44. Rxd7 Rxf4 45. Rd4 Rxd4 46. Nxd4 b4 47. Nb3 hxg5 48. hxg5 Kg7 49. Kf1 ,34. d6 Be6 35. g5 Nd7 36. Nxa5 Rf5 37. Rd4 Rc5 38. Nb3 Rc3 39. Rc1 Rxc1+ 40. Nxc1 Rc8 41. Nd3 Bxa2 42. Bh3 Rd8 43. Ne5 Nxe5 44. fxe5 hxg5 45. hxg5 Kg7 46. f4 Rb8 47. Rb4 Bc4 
"Coach's advice: For courage in allowing me to examine a lost game A+! This shows a desire to actually correct faulty thinking processes. (If only I could have your thoughts as you were thinking them.....) So some ideas...... Challenge your filters. You seem to be unwilling to grab the pawn when it was available but unwilling to give up the pawn for a greater good (winning the Queen). Start paying attention to these filters and force yourself to look beyond these ""laws"" you have learned. The truth is on the board, not on a set of learned rules. You show good positional judgment but do not seem to have good attacking skills. The problem with good positional judgment is that if you focus here, it is not enough to win! Somewhere you must attack, even if it is ""pawn picking."" I'd suggest that you develop a ""catalogue of positions."" To do this get some cards or a notebook where you will record positions for games you play or see. Somewhere keep a ""key"" on the correct moves by category. Keep it as simple as possible. Maybe topics would include ""sacrifice"", ""pawns"", ""king safety."" Don't buy a book! You must do the work yourself, if a position strikes you enough for you to take the time to record it then you are more likely to learn it for yourself. I see that you are a ""club"" player. Clubs are fun and often good chess but..... The tendency is to play ""cat and mouse"" games with the other players minds. I'd suggest that you settle into three systems (two with Black and one with White) and play them regardless of who you play and what your opponent played last time. Here is the trick. You opponents will prepare for you, since you will be predictable, and will find the most difficult lines for you. That is good, they will test you and force you to grow and develop good lines. It will also force you to be precise in your opening moves. The idea is that you will have three openings that you know as well as anyone in the world and can play in any circumstance.",True," The comment offers specific advice on improving attacking skills and recognizing positional weaknesses, suggesting a proactive approach to chess improvement.",1. Nf3 Nf6 2. c4 g6 3. Nc3 d5 4. cxd5 Nxd5 5. g3 Bg7 6. Qb3 Nxc3 7. bxc3 c5 8. Bg2 O-O 9. Ba3 Qa5 10. O-O Nc6 11. Bb2 Rb8 12. d4 Be6 13. Qd1 Rfd8 14. e3 Bd5 15. Qe2 b5 16. Rfd1 Bc4 17. Qc2 Qb6 18. Ng5 cxd4 19. cxd4 Nb4 20. Qe4 a5 21. h4 h6 22. Nf3 Nd5 23. Ne5 Nf6 24. Qf4 Rbc8 25. g4 Qe6 26. Rd2 Nd7 27. d5 Qf6 28. Nc6 Qxf4 29. Nxe7+ Kh7 30. exf4 Bxb2 31. Rxb2 Rc5 32. Nc6 Re8 33. Rd2 Nf6 34. d6 Be6 35. g5 Nd7 36. Nxa5 Rec8,This is a game between W52 (as White) and B52 (as Black). Last move played: Black plays Rook to c8,Large advantage for White (eval: 314 centipawns),37. Nb3 Rc4 38. Nd4 Nc5 39. Bf1 Rb4 40. Rad1 hxg5 41. fxg5 Rd8 42. a3 Ra4 43. Bxb5 Rxa3 44. Nxe6 Nxe6 45. Bc4 Kg7 ,36... Rf5 37. Rd4 hxg5 38. fxg5 Kg7 39. Re1 Rh8 40. Nb3 Rd8 41. Rc1 Re5 42. Rc7 Re2 43. Bd5 Bxd5 44. Rxd5 Rxa2 
"While this is an English Opening, it has many characteristics of the Grunfeld Defense. This moves avoids d4 inviting the Grunfeld.",True, The comment suggests a potential tactical weakness that could lead to an unfavorable position.,1. Nf3 Nf6 2. c4 g6 3. Nc3 d5 4. cxd5 Nxd5 5. g3,This is a game between W52 (as White) and B52 (as Black). Last move played: White plays Pawn to g3,Slight advantage for White (eval: 29 centipawns),5... Bg7 ,5. Qb3 Nb6 
