comment,good,reasoning,moves,context,engine_eval,engine_best_line,engine_best_alternative
"Down at the Mexican Interzonal of 1985, Tal agreed to a Blitz match in which he overwhelmed me with many sharp sacrificial openings. I knew that 4.cxd5 cxd5 5.Nf3 e4 6.Ne5 was currently popular, but I also wanted to create something! At the very least I thought I'd surprise him!",True," The comment suggests a strategic miscalculation and a desire to disrupt the opponent, indicating a flawed tactical assessment.",1. d4 d5 2. c4 c6 3. Nc3 e5,"This is a game between Browne,W (as White) and Tal,M (as Black). Last move played: Black plays Pawn to e5",Advantage for White (eval: 51 centipawns),4. cxd5 cxd5 ,3... dxc4 4. e3 
If only because the game becomes so sharp.,True," The comment suggests a potential over-reliance on tactical calculation, implying a flaw in the move's strategic soundness.",1. d4 d5 2. c4 c6 3. Nc3 e5 4. cxd5 cxd5 5. e4,"This is a game between Browne,W (as White) and Tal,M (as Black). Last move played: White plays Pawn to e4",Slight advantage for White (eval: 24 centipawns),5... dxe4 6. Bb5+ ,5. dxe5 d4 
5...exd4?! 6.Nxd5 Nc6 7.Bb5 Bc5 8.Nf3 and White has an edge.,True," Yes, the comment indicates a potential tactical blunder by White, suggesting a risky and ultimately unsuccessful pawn push.",1. d4 d5 2. c4 c6 3. Nc3 e5 4. cxd5 cxd5 5. e4 dxe4,"This is a game between Browne,W (as White) and Tal,M (as Black). Last move played: Black plays Pawn takes on e4",The position is equal,6. Bb5+ Bd7 7. dxe5 Bb4 8. Bd2 Bxc3 9. Bxd7+ Nxd7 10. Bxc3 Nc5 11. Ne2 Nd3+ 12. Kf1 Qd5 13. Ng3 Ne7 14. Qe2 O-O 15. h4 Rfd8 16. Nxe4 Nf4 17. Qf3 Qb5+ 18. Kg1 Ne2+ 19. Kh2 Nxc3 20. Nxc3 Qxe5+ 21. g3 Qf5 22. Qxf5 Nxf5 23. Rhd1 Ne7 24. Kh1 Nc6 ,5... dxe4 6. Bb5+ 
6.dxe5 Qxd1+ is duck soup for Tal.,True," The comment suggests the move is pointless, indicating a flawed strategic plan.",1. d4 d5 2. c4 c6 3. Nc3 e5 4. cxd5 cxd5 5. e4 dxe4 6. Bb5+,"This is a game between Browne,W (as White) and Tal,M (as Black). Last move played: White plays Bishop to b5 with check",Slight advantage for White (eval: 23 centipawns),6... Bd7 7. dxe5 ,6. Bb5+ Bd7 7. dxe5 Bb4 8. Bd2 Bxc3 9. Bxd7+ Nxd7 10. Bxc3 Nc5 11. Ne2 Nd3+ 12. Kf1 Qd5 13. Ng3 Ne7 14. Qe2 O-O 15. h4 Rfd8 16. Nxe4 Nf4 17. Qf3 Qb5+ 18. Kg1 Ne2+ 19. Kh2 Nxc3 20. Nxc3 Qxe5+ 21. g3 Qf5 22. Qxf5 Nxf5 23. Rhd1 Ne7 24. Kh1 Nc6 
6...Nd7? 7.dxe5 is better for White as as e5-e6 is in the air and Black's e-pawn is weak.,True," The comment offers a potential explanation for the mistake, though it’s an oversimplified assessment.",1. d4 d5 2. c4 c6 3. Nc3 e5 4. cxd5 cxd5 5. e4 dxe4 6. Bb5+ Bd7,"This is a game between Browne,W (as White) and Tal,M (as Black). Last move played: Black plays Bishop to d7",The position is equal,7. dxe5 Bb4 ,6... Bd7 7. dxe5 
"True to his nature, Tal keeps the tension, however I needed to win this final game and was worried whether I'd have much after 7...Bxb5 8.Qxd8+ Kxd8 9.Nxb5 Nc6 (9...Bb4+ 10.Bd2 Bxd2+ 11.Kxd2 Nc6 12.f4!? exf3 13.Nxf3 Ke7) 10.Bg5+ f6 11.0-0-0+ Kc8 12.exf6 Nxf6 13.Ne2 although this position is better for White.",True," The comment highlights a potential tactical miscalculation due to the sacrificed pawn, indicating a flaw in the player's strategic thinking.",1. d4 d5 2. c4 c6 3. Nc3 e5 4. cxd5 cxd5 5. e4 dxe4 6. Bb5+ Bd7 7. dxe5 Nc6,"This is a game between Browne,W (as White) and Tal,M (as Black). Last move played: Black plays Knight to c6",Slight advantage for White (eval: 40 centipawns),8. Bf4 Bb4 ,7... Bb4 8. Bd2 Bxc3 9. Bxd7+ Nxd7 10. Bxc3 Nc5 11. Ne2 Nd3+ 12. Kf1 Qd5 13. Ng3 Ne7 14. Qe2 O-O 15. h4 e3 16. Qxe3 Qb5 17. a4 Qc4 18. Kg1 Nd5 19. Qd4 Qxd4 20. Bxd4 Rfd8 
"After some serious contemplation I noticed 8.Bf4 Nxe5? 9.Bxe5 Bxb5 10.Qxd8+ Rxd8 11.Nxb5 wins, but 8...Bb4 is OK for Black.",True," The comment offers a potential explanation for the mistake, suggesting a strategic alternative.",1. d4 d5 2. c4 c6 3. Nc3 e5 4. cxd5 cxd5 5. e4 dxe4 6. Bb5+ Bd7 7. dxe5 Nc6 8. Qd5,"This is a game between Browne,W (as White) and Tal,M (as Black). Last move played: White plays Queen to d5",Slight advantage for White (eval: 46 centipawns),8... Bb4 9. Ne2 ,8. Bf4 Bb4 
"At the time I thought 8...Nb4 was best even though sometime during a restless night I analyzed the following in a drowsy state of semi-sleep: 8...Nb4 9.e6 (9.Qxe4 Bxb5 10.Nxb5 Rc8?? 11.Nd6+ Bxd6 12.exd6+ wins) 9...Nxd5 (9...Bxb5 10.Qxb5+ Nc6 11.Qxb7 Nge7 12.Nb5 winning) 10.Bxd7+ Ke7 11.Nxd5+ Kd6 12.Bf4+, and now: A) 12...Kc5 13.b4+ Kxd5 14.0-0-0+ Kc4 15.Ne2 Kxb4 (15...Bxb4 16.Rd4+ Kc5 17.Bd6+ Kb6 18.Rxb4+ looks winning) 16.Rd4+ Ka5 17.Ra4+ Kb6 18.Be3+ Kc7 19.Rc4+ with a promising attack, or; B) 12...Kxd5 13.0-0-0+ Kc5 (13...Kc4 14.b3+ Kb4 15.Rd4+ Kc5 16.Rc4+ Kd5 17.Ne2 Ba3+ 18.Kc2 Qxd7 19.exd7 Nf6 20.Rd1+ Ke6 21.Nd4+ Ke7 22.Nb5 wins) 14.Be3+ Kb4 15.Rd4+ Ka5 16.Ra4 mate.",True," The comment provides a detailed analysis of the subsequent moves, suggesting a refuted attack and a potential loss.",1. d4 d5 2. c4 c6 3. Nc3 e5 4. cxd5 cxd5 5. e4 dxe4 6. Bb5+ Bd7 7. dxe5 Nc6 8. Qd5 Qe7,"This is a game between Browne,W (as White) and Tal,M (as Black). Last move played: Black plays Queen to e7",Advantage for White (eval: 82 centipawns),9. Nge2 ,8... Bb4 9. Ne2 
"Risky, yet 11...0-0-0 12.Rc1! f5 13.exf6 favors White.",True,", The comment identifies a potential tactical blunder, suggesting a suboptimal move.",1. d4 d5 2. c4 c6 3. Nc3 e5 4. cxd5 cxd5 5. e4 dxe4 6. Bb5+ Bd7 7. dxe5 Nc6 8. Qd5 Qe7 9. Bf4 g5 10. Bg3 Bg7 11. Qxe4 Nxe5,"This is a game between Browne,W (as White) and Tal,M (as Black). Last move played: Black plays Knight takes on e5",Large advantage for White (eval: 253 centipawns),12. Bxe5 Qxe5 13. Bxd7+ Kxd7 14. O-O-O+ Kc8 15. Qd3 Ne7 16. Nf3 Qc5 17. Kb1 Bxc3 18. Nxg5 Qb4 19. Qxc3+ Qxc3 20. bxc3 Kc7 21. Nxf7 Rhf8 22. Ne5 Rae8 23. f3 Rf4 ,11... a6 
After 12...Qd6 13.Nf3 Bxb5 14.Nxe5 0-0-0 15.Rc1+ Kb8 16.Nd7+! Crunch!,True," The comment describes a sudden, aggressive attack, suggesting a flawed positional strategy.",1. d4 d5 2. c4 c6 3. Nc3 e5 4. cxd5 cxd5 5. e4 dxe4 6. Bb5+ Bd7 7. dxe5 Nc6 8. Qd5 Qe7 9. Bf4 g5 10. Bg3 Bg7 11. Qxe4 Nxe5 12. Nd5 f5,"This is a game between Browne,W (as White) and Tal,M (as Black). Last move played: Black plays Pawn to f5",Large advantage for White (eval: 379 centipawns),13. Qe2 Bxb5 14. Qxb5+ Qd7 15. Nc7+ Kf7 16. Qxd7+ Nxd7 17. Nxa8 f4 18. Bxf4 gxf4 19. Nc7 Bxb2 20. Rb1 Ngf6 21. Rxb2 Nc5 22. Rc2 Nd3+ 23. Ke2 Nb4 24. Rb2 a5 25. Rxb4 axb4 26. Nf3 ,12... Bxb5 
Tempting is 13.Nxe7 fxe4 14.Nf5! yet I saw that after 14...Bf6 15.Nd6+ Ke7 16.Bxd7 Kxd6 17.0-0-0+ Ke7 18.Bf5 Nd3+ would give Tal some chances.,True," The comment identifies a potential tactical blunder, suggesting a miscalculation that could be detrimental.",1. d4 d5 2. c4 c6 3. Nc3 e5 4. cxd5 cxd5 5. e4 dxe4 6. Bb5+ Bd7 7. dxe5 Nc6 8. Qd5 Qe7 9. Bf4 g5 10. Bg3 Bg7 11. Qxe4 Nxe5 12. Nd5 f5 13. Qe2,"This is a game between Browne,W (as White) and Tal,M (as Black). Last move played: White plays Queen to e2",Large advantage for White (eval: 396 centipawns),13... Bxb5 14. Qxb5+ ,13. Qe2 Bxb5 14. Qxb5+ Qd7 15. Nc7+ Kf7 16. Qxd7+ Nxd7 17. Nxa8 f4 18. Bxf4 gxf4 19. Nc7 Bxb2 20. Rb1 Ngf6 21. Rxb2 Nc5 22. Rc2 Nd3+ 23. Ke2 Nb4 24. Rb2 a5 25. Rxb4 axb4 26. Nf3 
If 13...Bxb5 14.Qxb5+ Qd7 15.Nc7+ wins.,True, The comment provides a concise explanation of why the move was a mistake.,1. d4 d5 2. c4 c6 3. Nc3 e5 4. cxd5 cxd5 5. e4 dxe4 6. Bb5+ Bd7 7. dxe5 Nc6 8. Qd5 Qe7 9. Bf4 g5 10. Bg3 Bg7 11. Qxe4 Nxe5 12. Nd5 f5 13. Qe2 Qd6,"This is a game between Browne,W (as White) and Tal,M (as Black). Last move played: Black plays Queen to d6",Large advantage for White (eval: 452 centipawns),14. Bxd7+ Kf8 15. Bxe5 Qxd5 16. Bxg7+ Kxg7 17. Rd1 Qxg2 18. Qf3 Qxf3 19. Nxf3 Nf6 20. Bxf5 Rhe8+ 21. Kf1 Rad8 22. Rxd8 Rxd8 23. Rg1 h6 24. Bc2 Nd5 25. h4 Nf4 26. Rg3 Nh5 27. Rg4 Nf4 28. Rg1 Rc8 29. Ne1 Rd8 30. Rg3 ,13... Bxb5 14. Qxb5+ 
If 14...Qxd5 15.Bxd7+ Qxd7 (if 15...Kxd7 16.Rd1 winning) 16.Nxe5 Qe7 17.0-0-0 with a raging attack as 17...Nf6 18.Qb5+ Kf8 19.Nd7+ Nxd7 20.Bd6 wins for White.,True,"

The comment describes a scenario where White's queen attack leads to a checkmate, directly indicating a mistake made by the opponent.",1. d4 d5 2. c4 c6 3. Nc3 e5 4. cxd5 cxd5 5. e4 dxe4 6. Bb5+ Bd7 7. dxe5 Nc6 8. Qd5 Qe7 9. Bf4 g5 10. Bg3 Bg7 11. Qxe4 Nxe5 12. Nd5 f5 13. Qe2 Qd6 14. Nf3 f4,"This is a game between Browne,W (as White) and Tal,M (as Black). Last move played: Black plays Pawn to f4",Large advantage for White (eval: 409 centipawns),15. Bxd7+ Qxd7 16. Nxf4 gxf4 17. Nxe5 Bxe5 18. Qxe5+ Qe7 19. Bxf4 Kf7 20. O-O Qxe5 21. Bxe5 Nf6 22. Rac1 Rac8 23. Bd4 Rhd8 24. Bxa7 Nd5 25. a3 ,14... Kf8 15. Bxe5 Bxe5 16. Bxd7 Qxd7 17. O-O-O Bf6 18. Kb1 Re8 19. Qc2 Qc6 20. Qxf5 Qe6 21. Qc2 Qe4 22. Rd3 Qg4 23. Rhd1 Qxg2 24. Nc7 Re7 25. Nd4 Qe4 26. f3 
I had thought that 16.Bxf4 would be an error after 16...Bxb5 17.Qxb5+ Qc6! but I didn't have time to analyze 18.Qe2 0-0-0 19.Nxe5 Qxg2 20.Rc1+ which also wins.,True," The comment highlights a missed opportunity to develop and a premature queen sacrifice, indicating a flawed strategic assessment.",1. d4 d5 2. c4 c6 3. Nc3 e5 4. cxd5 cxd5 5. e4 dxe4 6. Bb5+ Bd7 7. dxe5 Nc6 8. Qd5 Qe7 9. Bf4 g5 10. Bg3 Bg7 11. Qxe4 Nxe5 12. Nd5 f5 13. Qe2 Qd6 14. Nf3 f4 15. Nxf4 gxf4 16. Bxd7+,"This is a game between Browne,W (as White) and Tal,M (as Black). Last move played: White plays Bishop takes on d7 with check",Large advantage for White (eval: 102 centipawns),16... Kf8 ,16. Bxd7+ Kf8 17. O-O Nxf3+ 18. Qxf3 Qxd7 19. Rfd1 Qf7 20. Bxf4 Nf6 21. Rac1 Re8 22. g3 h5 23. Rc7 Qe6 24. Bd2 Kg8 25. Re1 Qxa2 26. Qf5 Rxe1+ 27. Bxe1 Qd5 
Or 20...Qb6 21.Qd5+ etc.,True,", The comment suggests a potential tactical blunder due to excessive pawn development.",1. d4 d5 2. c4 c6 3. Nc3 e5 4. cxd5 cxd5 5. e4 dxe4 6. Bb5+ Bd7 7. dxe5 Nc6 8. Qd5 Qe7 9. Bf4 g5 10. Bg3 Bg7 11. Qxe4 Nxe5 12. Nd5 f5 13. Qe2 Qd6 14. Nf3 f4 15. Nxf4 gxf4 16. Bxd7+ Kxd7 17. Rd1 Nxf3+ 18. Qxf3 Re8+ 19. Kf1 Bd4 20. Bxf4 Qa6+,"This is a game between Browne,W (as White) and Tal,M (as Black). Last move played: Black plays Queen to a6 with check",Large advantage for White (eval: 504 centipawns),21. Kg1 Re6 22. Rxd4+ Ke8 23. Qh5+ Kf8 24. h3 Nf6 25. Qf5 Qb6 26. Be5 Rg8 27. Kh2 h6 28. Rc1 Rg5 29. Rc8+ Kf7 30. Rd7+ Re7 31. Rxe7+ Kxe7 32. Bxf6+ Qxf6 33. Qh7+ Ke6 34. Qe4+ Qe5+ 35. Qxe5+ Kxe5 ,20... Qa6+ 21. Kg1 Re6 22. Rxd4+ Ke8 23. Qh5+ Rg6 24. h4 Qc6 25. g3 Nf6 26. Qe5+ Kf7 27. Rd6 Re8 28. Rxc6 Rxe5 29. Bxe5 bxc6 30. Bxf6 Rxf6 31. Kg2 Rf5 32. Rc1 Ra5 33. Rxc6 Rxa2 34. Rc7+ Ke6 35. Rxh7 
Black lost on time. Black overstepped in a hopeless position.,True," The comment identifies a strategic blunder as a result of overstepping, suggesting a flawed plan.",1. d4 d5 2. c4 c6 3. Nc3 e5 4. cxd5 cxd5 5. e4 dxe4 6. Bb5+ Bd7 7. dxe5 Nc6 8. Qd5 Qe7 9. Bf4 g5 10. Bg3 Bg7 11. Qxe4 Nxe5 12. Nd5 f5 13. Qe2 Qd6 14. Nf3 f4 15. Nxf4 gxf4 16. Bxd7+ Kxd7 17. Rd1 Nxf3+ 18. Qxf3 Re8+ 19. Kf1 Bd4 20. Bxf4 Qa6+ 21. Kg1 Ne7 22. Rxd4+,"This is a game between Browne,W (as White) and Tal,M (as Black). Last move played: White plays Rook takes on d4 with check",Large advantage for White (eval: 910 centipawns),22... Ke6 23. Re4+ ,22. Rxd4+ Kc8 23. Qg4+ Nf5 24. Qxf5+ Qe6 25. Rc4+ Kd8 26. Qd3+ Qd7 27. Bg5+ Re7 28. Bxe7+ Kxe7 29. Re4+ Kd8 30. Qxd7+ Kxd7 31. f3 Kc8 32. h4 Rd8 33. Kh2 h6 34. Rhe1 Kb8 35. Kh3 
