comment,good,reasoning,moves,context,engine_eval,engine_best_line,engine_best_alternative
else Black plays ... Rf6-Rh6,True," The comment suggests a potential tactical error, indicating a suboptimal move for Black.",1. Nf3 Nf6 2. c4 g6 3. Nc3 Bg7 4. d4 O-O 5. e4 d6 6. Be2 e5 7. d5 Nh5 8. Ng1 Nd7 9. Bxh5 gxh5 10. Qxh5 Nc5 11. Nf3 f5 12. O-O f4 13. b4 Nd7 14. Bb2 Qe7 15. Ng5,This is a game between Szabo (as White) and Boleslavsky (as Black). Last move played: White plays Knight to g5,Slight advantage for Black (eval: -42 centipawns),15... Nf6 16. Qf3 Nxd5 17. Nxd5 Qxg5 18. Nxc7 Bg4 19. Qb3 f3 20. Rfd1 Rac8 21. Nd5 Be6 22. Ne3 Bxc4 23. Qa3 fxg2 24. Rxd6 Rf3 25. Qxa7 Rxf2 26. Kxf2 g1=Q+ 27. Rxg1 Qf4+ 28. Kg2 Qxe4+ 29. Kg3 ,15. c5 Nf6 16. Qh4 Qe8 17. cxd6 cxd6 18. Ng5 h6 19. Ne6 Bxe6 20. dxe6 Qxe6 21. f3 Qc4 22. a3 Qb3 23. Qf2 Rac8 24. Rfc1 d5 25. Nxd5 Nxd5 26. exd5 Rfd8 27. h3 Qxd5 28. Rxc8 Rxc8 29. Kh2 Qb3 30. Rc1 Rxc1 31. Bxc1 e4 
In order to make an escape route for his Queen .. white concedes his opponent the e3 square,True," The comment suggests a strategic blunder by conceding a crucial square, indicating a flawed plan.",1. Nf3 Nf6 2. c4 g6 3. Nc3 Bg7 4. d4 O-O 5. e4 d6 6. Be2 e5 7. d5 Nh5 8. Ng1 Nd7 9. Bxh5 gxh5 10. Qxh5 Nc5 11. Nf3 f5 12. O-O f4 13. b4 Nd7 14. Bb2 Qe7 15. Ng5 Nf6 16. Qh4 h6 17. Nf3 Qf7 18. Nd2 Ng4 19. f3,This is a game between Szabo (as White) and Boleslavsky (as Black). Last move played: White plays Pawn to f3,Large advantage for Black (eval: -156 centipawns),19... Ne3 20. Qf2 Nxf1 21. Qxf1 Qe7 22. Kh1 Kh7 23. a4 Rg8 24. Ba3 Bf6 25. c5 Bh4 26. Rc1 Bg3 27. h3 Rg6 28. cxd6 cxd6 29. b5 Bd7 30. Nc4 Rag8 31. Rc2 a6 32. bxa6 bxa6 ,19. f3 Ne3 20. Qf2 Nxf1 21. Qxf1 Kh7 22. c5 Qe7 23. cxd6 cxd6 24. a4 Bd7 25. Ba3 Rf6 26. Kh1 Rg8 27. Nc4 Rg6 28. Ra2 Bf6 29. a5 Bh4 30. b5 Rc8 31. Rc2 h5 32. b6 a6 33. Bb4 Bg3 
"The tactical point, not only of Black's 19th move but also of Black's whole plan so far. The use this open file was what Black visualized when sacrificing the pawn at move 8",True," The comment highlights a flawed strategic assessment, suggesting the move was a mistake based on a misinterpretation of the opponent's plan.",1. Nf3 Nf6 2. c4 g6 3. Nc3 Bg7 4. d4 O-O 5. e4 d6 6. Be2 e5 7. d5 Nh5 8. Ng1 Nd7 9. Bxh5 gxh5 10. Qxh5 Nc5 11. Nf3 f5 12. O-O f4 13. b4 Nd7 14. Bb2 Qe7 15. Ng5 Nf6 16. Qh4 h6 17. Nf3 Qf7 18. Nd2 Ng4 19. f3 Ne3 20. Rfc1 Kh7 21. Nd1 Bf6 22. Qf2 Rg8,This is a game between Szabo (as White) and Boleslavsky (as Black). Last move played: Black plays Rook to g8,Large advantage for Black (eval: -310 centipawns),23. Nxe3 fxe3 24. Qxe3 Bg5 25. Qd3 Bxd2 26. Qxd2 Bh3 27. g3 Qxf3 28. Rc3 Qh5 29. Qd1 Bg4 30. Qd3 Raf8 31. c5 Bh3 32. cxd6 cxd6 33. Rc4 ,22... Rg8 
The White King is in a tight corner and a White pawn is bound to be lost,True," The comment suggests a potential immediate threat to the king, indicating a flawed strategic decision.",1. Nf3 Nf6 2. c4 g6 3. Nc3 Bg7 4. d4 O-O 5. e4 d6 6. Be2 e5 7. d5 Nh5 8. Ng1 Nd7 9. Bxh5 gxh5 10. Qxh5 Nc5 11. Nf3 f5 12. O-O f4 13. b4 Nd7 14. Bb2 Qe7 15. Ng5 Nf6 16. Qh4 h6 17. Nf3 Qf7 18. Nd2 Ng4 19. f3 Ne3 20. Rfc1 Kh7 21. Nd1 Bf6 22. Qf2 Rg8 23. Nxe3 fxe3 24. Qxe3 Bg5 25. Qe2 Bxd2 26. Qxd2 Bh3 27. g3 Qxf3 28. Rc3 Qxe4 29. c5 Rg7 30. Qc2 Qxc2 31. Rxc2 Rf8 32. Rf2 Rgf7 33. Rxf7+ Rxf7,This is a game between Szabo (as White) and Boleslavsky (as Black). Last move played: Black plays Rook takes on f7,Large advantage for Black (eval: -177 centipawns),34. Re1 ,33... Rxf7 34. Re1 b5 35. Bc1 Rf3 36. cxd6 cxd6 37. Be3 a6 38. Bb6 Kg6 39. Bc7 Rf6 40. Bd8 Rf7 41. Bb6 h5 42. a3 Kf5 43. Re2 Rb7 44. Bd8 Rd7 45. Bb6 Bg4 46. Rd2 Ke4 47. Kg2 Bf5 48. Rd1 Bg6 49. Kh3 Bf7 
Black's united passed pawns now guarantee him an easy win,True," The comment suggests a strategic blunder, implying a flawed plan to achieve a guaranteed win.",1. Nf3 Nf6 2. c4 g6 3. Nc3 Bg7 4. d4 O-O 5. e4 d6 6. Be2 e5 7. d5 Nh5 8. Ng1 Nd7 9. Bxh5 gxh5 10. Qxh5 Nc5 11. Nf3 f5 12. O-O f4 13. b4 Nd7 14. Bb2 Qe7 15. Ng5 Nf6 16. Qh4 h6 17. Nf3 Qf7 18. Nd2 Ng4 19. f3 Ne3 20. Rfc1 Kh7 21. Nd1 Bf6 22. Qf2 Rg8 23. Nxe3 fxe3 24. Qxe3 Bg5 25. Qe2 Bxd2 26. Qxd2 Bh3 27. g3 Qxf3 28. Rc3 Qxe4 29. c5 Rg7 30. Qc2 Qxc2 31. Rxc2 Rf8 32. Rf2 Rgf7 33. Rxf7+ Rxf7 34. Re1 Rf3 35. cxd6 cxd6 36. Bc1 Rd3 37. Be3 a6 38. Kf2 Rxd5,This is a game between Szabo (as White) and Boleslavsky (as Black). Last move played: Black plays Rook takes on d5,Large advantage for Black (eval: -144 centipawns),39. Kf3 ,38... Kg6 39. Rc1 h5 40. Rc7 Ra3 41. Bc1 Rxa2+ 42. Ke3 Rxh2 43. Rxb7 Rh1 44. Bb2 Rd1 45. Rb6 Rxd5 46. Rxa6 Kf5 47. Ra5 Rd1 48. b5 Bf1 49. Ba3 Ke6 50. Kf2 Bc4 51. b6 Rf1+ 52. Ke3 Rb1 53. Ra4 Rb3+ 54. Kd2 
else Black plays ... Rf6-Rh6,True,", The comment accurately identifies a potential weakness in the d-pawn, suggesting a suboptimal pawn structure.",1. Nf3 Nf6 2. c4 g6 3. Nc3 Bg7 4. d4 O-O 5. e4 d6 6. Be2 e5 7. d5 Nh5 8. Ng1 Nd7 9. Bxh5 gxh5 10. Qxh5 Nc5 11. Nf3 f5 12. O-O f4 13. b4 Nd7 14. Bb2 Qe7 15. Ng5,This is a game between Szabo (as White) and Boleslavsky (as Black). Last move played: White plays Knight to g5,Slight advantage for Black (eval: -42 centipawns),15... Nf6 16. Qf3 Nxd5 17. Nxd5 Qxg5 18. Nxc7 Bg4 19. Qb3 f3 20. Rfd1 Rac8 21. Nd5 Be6 22. Ne3 Bxc4 23. Qa3 fxg2 24. Rxd6 Rf3 25. Qxa7 Rxf2 26. Kxf2 g1=Q+ 27. Rxg1 Qf4+ 28. Kg2 Qxe4+ 29. Kg3 ,15. c5 Nf6 16. Qh4 Qe8 17. cxd6 cxd6 18. Ng5 h6 19. Ne6 Bxe6 20. dxe6 Qxe6 21. f3 Qc4 22. a3 Qb3 23. Qf2 Rac8 24. Rfc1 d5 25. Nxd5 Nxd5 26. exd5 Rfd8 27. h3 Qxd5 28. Rxc8 Rxc8 29. Kh2 Qb3 30. Rc1 Rxc1 31. Bxc1 e4 
"One of the most startling discoveries of recent years. Without battling an eyelid, Black gives up a pawn simply to enforce ... Pf5",True," The comment offers a somewhat dramatic explanation for a seemingly passive pawn sacrifice, suggesting a strategic error.",1. Nf3 Nf6 2. c4 g6 3. Nc3 Bg7 4. d4 O-O 5. e4 d6 6. Be2 e5 7. d5 Nh5 8. Ng1 Nd7,This is a game between Szabo (as White) and Boleslavsky (as Black). Last move played: Black plays Knight to d7,Advantage for White (eval: 59 centipawns),9. Bxh5 ,8... Nf4 9. Bf3 
