comment,good,reasoning,moves,context,engine_eval,engine_best_line,engine_best_alternative
7...exd4 8.Ba3 d6 9.e5 Ne4 10.Re1 Nxc3 11.exd6+ Kd7 12. Ne5+ Nxe5 13.Qxd4 f6 14.Nxc3 White has a winning position due to the exposed,True," The comment highlights a potential tactical advantage for the opponent, suggesting a winning position.",1. e4 e5 2. Nf3 Nc6 3. Bc4 Bc5 4. b4 Bxb4 5. c3 Ba5 6. O-O Nf6 7. d4 O-O,This is a game between Mongredien (as White) and Morphy (as Black). Last move played: Black plays kingside castle,Slight advantage for Black (eval: -48 centipawns),8. dxe5 Nxe4 ,7... O-O 8. dxe5 
An instructive mistake since White wishes to develop with gain of tempo. By locking the center White keeps his own pieces out of the attack. 8.dxe5 Nxe4 9.Bd5 Nc5 10.Ng5 Qe7 would leave Black better developed.,True," The comment identifies a strategic blunder by prioritizing development over immediate attack, hindering Black's potential.",1. e4 e5 2. Nf3 Nc6 3. Bc4 Bc5 4. b4 Bxb4 5. c3 Ba5 6. O-O Nf6 7. d4 O-O 8. d5,This is a game between Mongredien (as White) and Morphy (as Black). Last move played: White plays Pawn to d5,Large advantage for Black (eval: -157 centipawns),8... Ne7 9. Bd3 d6 10. c4 Nd7 11. Bc2 Nc5 12. Be3 Na6 13. h3 Bd7 14. Kh2 c6 15. Qe2 cxd5 16. cxd5 f5 17. exf5 Rc8 18. Ng5 Nxf5 19. Na3 Nc5 20. Nc4 h6 21. Nxa5 Qxa5 22. Bxc5 Qxc5 ,8. dxe5 Nxe4 
9.Nxe5 d6 10.Nf3 Nxe4 11.Qd4 leaves White with a little compensation for the lost pawn.,True," The comment suggests a potential weakness in White's pawn structure, indicating a missed opportunity.",1. e4 e5 2. Nf3 Nc6 3. Bc4 Bc5 4. b4 Bxb4 5. c3 Ba5 6. O-O Nf6 7. d4 O-O 8. d5 Ne7 9. Qd3,This is a game between Mongredien (as White) and Morphy (as Black). Last move played: White plays Queen to d3,Large advantage for Black (eval: -195 centipawns),9... d6 10. Nbd2 Ng6 11. Nb3 Bb6 12. a4 a5 13. Bb5 Bd7 14. Bxd7 Qxd7 15. Be3 Qg4 16. Nbd2 Nf4 17. Bxf4 Qxf4 18. Rae1 Nd7 19. Nb3 Qg4 20. Nfd2 ,9. Qc2 Ng6 10. Be2 d6 11. Nbd2 Bb6 12. a4 a5 13. Nc4 Bc5 14. Nfd2 Ba7 15. Nf3 h6 16. Rb1 Nd7 17. Ne3 Bxe3 18. Bxe3 b6 19. Bb5 
Black prepares to finish his development while consolidating his extra pawn.,True," The comment suggests a potential weakness in Black’s development, implying a risky move that could lead to a disadvantage.",1. e4 e5 2. Nf3 Nc6 3. Bc4 Bc5 4. b4 Bxb4 5. c3 Ba5 6. O-O Nf6 7. d4 O-O 8. d5 Ne7 9. Qd3 d6,This is a game between Mongredien (as White) and Morphy (as Black). Last move played: Black plays Pawn to d6,Large advantage for Black (eval: -184 centipawns),10. Nbd2 Bb6 11. a4 a5 12. Qc2 Ba7 13. Ba3 Nd7 14. Bd3 Nc5 15. Bxc5 Bxc5 16. Nb3 Ba7 17. Nxa5 c6 18. Nb3 cxd5 19. exd5 Ng6 20. g3 f5 21. Be2 Kh8 22. c4 ,9... d6 10. Nbd2 Ng6 11. Nb3 Bb6 12. a4 a5 13. Bb5 Bd7 14. Bxd7 Qxd7 15. Be3 Qg4 16. Nbd2 Nf4 17. Bxf4 Qxf4 18. Rae1 Nd7 19. Nb3 Qg4 20. Nfd2 
The Black knights head for the outpost at f4.,True, The comment suggests a potential tactical error due to the knight's advance.,1. e4 e5 2. Nf3 Nc6 3. Bc4 Bc5 4. b4 Bxb4 5. c3 Ba5 6. O-O Nf6 7. d4 O-O 8. d5 Ne7 9. Qd3 d6 10. h3 Ng6 11. Nh2 Nh5,This is a game between Mongredien (as White) and Morphy (as Black). Last move played: Black plays Knight to h5,Large advantage for Black (eval: -331 centipawns),12. Nd2 f5 13. Kh1 Qe8 14. g3 fxe4 15. Nxe4 Bxh3 16. Bg5 Kh8 17. Rg1 Bf5 18. f3 Bb6 19. Ng4 Bxe4 20. fxe4 Bxg1 ,11... Nh5 12. Nd2 Ngf4 13. Qf3 f5 14. exf5 Bxf5 15. Ng4 Qe8 16. Re1 Qg6 17. Ne4 Bxe4 18. Rxe4 Kh8 19. Re3 Bb6 20. Re1 Nf6 21. Nxf6 Rxf6 22. Kh2 
Following the rule that one should attack the pawn chain starting at its base.,True," The comment suggests a logical error in the player’s strategy, indicating a misapplication of a fundamental principle.",1. e4 e5 2. Nf3 Nc6 3. Bc4 Bc5 4. b4 Bxb4 5. c3 Ba5 6. O-O Nf6 7. d4 O-O 8. d5 Ne7 9. Qd3 d6 10. h3 Ng6 11. Nh2 Nh5 12. Bb3 Nhf4 13. Bxf4 Nxf4 14. Qf3 f5,This is a game between Mongredien (as White) and Morphy (as Black). Last move played: Black plays Pawn to f5,Large advantage for Black (eval: -420 centipawns),15. exf5 Bxf5 16. Nd2 Qg5 17. Ng4 h5 18. Ne3 e4 19. Qd1 Bxc3 20. h4 Qg6 21. Rc1 Bd4 22. Ndc4 Bh3 23. Kh2 Bxe3 24. Nxe3 Bxg2 25. Rg1 ,14... f5 15. Nd2 fxe4 16. Nxe4 Nxh3+ 17. gxh3 Rxf3 18. Nxf3 h6 19. Bc2 Bxh3 20. Rfd1 Qf8 21. Rd3 Qf4 22. Re1 Qg4+ 23. Ng3 Bb6 24. Nh2 Qg5 25. Rf3 Rf8 26. Rxf8+ Kxf8 
Black's extra pawn and better development give him a winning position.,True," The comment suggests a logical flaw in the opponent's position, implying a significant advantage for Black.",1. e4 e5 2. Nf3 Nc6 3. Bc4 Bc5 4. b4 Bxb4 5. c3 Ba5 6. O-O Nf6 7. d4 O-O 8. d5 Ne7 9. Qd3 d6 10. h3 Ng6 11. Nh2 Nh5 12. Bb3 Nhf4 13. Bxf4 Nxf4 14. Qf3 f5 15. exf5 Bxf5,This is a game between Mongredien (as White) and Morphy (as Black). Last move played: Black plays Bishop takes on f5,Large advantage for Black (eval: -423 centipawns),16. Nd2 Qg5 17. Ng4 Bxc3 18. Rad1 Qg6 19. Rfe1 Nd3 20. Re2 Bd4 21. Kh2 h5 22. Nxe5 Bxe5+ 23. Kg1 Kh8 ,15... Bxf5 16. Nd2 Bxc3 17. Rad1 Nxh3+ 18. gxh3 Bxd2 19. Rxd2 Qg5+ 20. Qg3 Qxd2 21. Nf3 Qh6 22. Ng5 Qg6 23. Rc1 h6 24. Ne6 Rf7 25. Bd1 Qxg3+ 26. fxg3 a5 27. Bh5 
This premature advance weakens the kingside and hastens the end.,True," The comment suggests a tactical vulnerability, indicating a flawed opening strategy.",1. e4 e5 2. Nf3 Nc6 3. Bc4 Bc5 4. b4 Bxb4 5. c3 Ba5 6. O-O Nf6 7. d4 O-O 8. d5 Ne7 9. Qd3 d6 10. h3 Ng6 11. Nh2 Nh5 12. Bb3 Nhf4 13. Bxf4 Nxf4 14. Qf3 f5 15. exf5 Bxf5 16. g4,This is a game between Mongredien (as White) and Morphy (as Black). Last move played: White plays Pawn to g4,Large advantage for Black (eval: -600 centipawns),16... Bd3 17. Re1 Qh4 18. Kh1 Nxh3 19. Qg3 Nxf2+ 20. Kg2 Be4+ 21. Rxe4 Qxg3+ 22. Kxg3 Nxe4+ 23. Kh3 Kh8 24. Na3 Bxc3 25. Rf1 Nd2 26. Rxf8+ Rxf8 27. Bc2 e4 28. Nb5 Ba5 29. Nxa7 Bb6 30. Nb5 e3 ,16. Nd2 Qg5 17. Ng4 Bxc3 18. Rad1 Qg6 19. Rfe1 Nd3 20. Re2 Bd4 21. Kh2 h5 22. Nxe5 Bxe5+ 23. Kg1 Kh8 
Instead of capturing the rook straight away Black improves the placement of his pieces.,True," The comment suggests a potential strategic improvement, indicating a flawed assessment of the move's impact.",1. e4 e5 2. Nf3 Nc6 3. Bc4 Bc5 4. b4 Bxb4 5. c3 Ba5 6. O-O Nf6 7. d4 O-O 8. d5 Ne7 9. Qd3 d6 10. h3 Ng6 11. Nh2 Nh5 12. Bb3 Nhf4 13. Bxf4 Nxf4 14. Qf3 f5 15. exf5 Bxf5 16. g4 Bd3 17. Qe3 Bb6,This is a game between Mongredien (as White) and Morphy (as Black). Last move played: Black plays Bishop to b6,Large advantage for Black (eval: -767 centipawns),18. Nd2 Bxe3 19. fxe3 Nxh3+ 20. Kg2 Bxf1+ 21. Rxf1 Rxf1 22. Ndxf1 Ng5 23. Bc2 Kh8 24. Bf5 g6 25. e4 gxf5 26. exf5 e4 27. c4 Nf3 28. Ne3 Nxh2 29. Kxh2 Qh4+ 30. Kg2 ,17... Bb6 18. Qxf4 Rxf4 19. Nd2 Kh8 20. Kg2 e4 21. f3 e3 22. Ne4 Rf8 23. a4 a6 24. Ng3 Bxf1+ 25. Nhxf1 g6 26. Ne4 
"White resigned as he is defenseless against Black's kingside attack. If you don't see how, play it out against Gambit.",True, The comment suggests a lack of strategic planning and a failure to defend against a significant threat.,1. e4 e5 2. Nf3 Nc6 3. Bc4 Bc5 4. b4 Bxb4 5. c3 Ba5 6. O-O Nf6 7. d4 O-O 8. d5 Ne7 9. Qd3 d6 10. h3 Ng6 11. Nh2 Nh5 12. Bb3 Nhf4 13. Bxf4 Nxf4 14. Qf3 f5 15. exf5 Bxf5 16. g4 Bd3 17. Qe3 Bb6 18. Qd2 Qh4,This is a game between Mongredien (as White) and Morphy (as Black). Last move played: Black plays Queen to h4,Mate in 10 for Black,19. Qxf4 Rxf4 20. Nd2 Rxf2 21. Rxf2 Qxf2+ 22. Kh1 Qxd2 23. Bc2 Qxc2 24. Nf3 Be4 25. Rf1 Bxf3+ 26. Rxf3 Qc1+ 27. Rf1 Qxf1+ 28. Kh2 Qg1# ,18... Qh4 19. Qxf4 Rxf4 20. Nd2 Rxf2 21. Rxf2 Qxf2+ 22. Kh1 Qxd2 23. Bc2 Qxc2 24. Nf3 Be4 25. Rf1 Bxf3+ 26. Rxf3 Qd1+ 27. Rf1 Qxf1+ 28. Kh2 Qg1# 
