comment,good,reasoning,moves,context,engine_eval,engine_best_line,engine_best_alternative
"In the Dragon Variation Black must react very sharply to a flank attack. Half measures are useless, for White's assault is considerably firecer than agains the Paulsen set up. The reason is that the move ... Pg6 involves a slight weakening, enabling White to open the h-file by Ph4-5. The proper reaction is an immediate counter in thecentre",True," The comment offers a justification for the mistake, suggesting a need for a more aggressive response.",1. e4 c5 2. Nf3 Nc6 3. d4 cxd4 4. Nxd4 Nf6 5. Nc3 d6 6. Be2 g6 7. Be3 Bg7 8. Nb3 Be6 9. f4 O-O 10. g4 Na5,This is a game between Foltys (as White) and Eliskases (as Black). Last move played: Black plays Knight to a5,Slight advantage for White (eval: 48 centipawns),11. g5 ,10... Rc8 
The d5 square is always an important outpost for White in this variation,True,", The comment suggests a potential tactical error based on a perceived positional advantage.",1. e4 c5 2. Nf3 Nc6 3. d4 cxd4 4. Nxd4 Nf6 5. Nc3 d6 6. Be2 g6 7. Be3 Bg7 8. Nb3 Be6 9. f4 O-O 10. g4 Na5 11. g5 Ne8 12. Bd4 Rc8 13. h4 Nc4 14. Bxc4 Rxc4 15. Qd3 Rc8 16. O-O-O Qd7 17. Rd2 Bg4 18. Nd5,This is a game between Foltys (as White) and Eliskases (as Black). Last move played: White plays Knight to d5,Large advantage for White (eval: 157 centipawns),18... Bxd4 19. Nxd4 Nc7 20. Ne3 Na6 21. Re1 h5 22. Qa3 Rc5 23. b4 Rc7 24. f5 e6 25. Rf1 Rfc8 26. fxg6 fxg6 27. Rf6 Rc3 28. Rxg6+ Kh7 ,18. Rg1 
The h-file is broken open by main force,True, The comment suggests a tactical weakness due to the opening vulnerability.,1. e4 c5 2. Nf3 Nc6 3. d4 cxd4 4. Nxd4 Nf6 5. Nc3 d6 6. Be2 g6 7. Be3 Bg7 8. Nb3 Be6 9. f4 O-O 10. g4 Na5 11. g5 Ne8 12. Bd4 Rc8 13. h4 Nc4 14. Bxc4 Rxc4 15. Qd3 Rc8 16. O-O-O Qd7 17. Rd2 Bg4 18. Nd5 b6 19. f5 e6 20. Bxg7 Kxg7 21. f6+ Kh8 22. Ne7 Rd8 23. Nd4 Qa4 24. Kb1 Nc7 25. h5,This is a game between Foltys (as White) and Eliskases (as Black). Last move played: White plays Pawn to h5,Large advantage for White (eval: 619 centipawns),25... Bxh5 26. Rdh2 ,25. Ndc6 Na6 26. Nxd8 Rxd8 27. Qd4 Qd7 28. e5 Qb7 29. Re1 h5 30. gxh6 Bh5 31. exd6 Kh7 32. b3 Nc5 33. a4 a5 34. Re3 Qh1+ 35. Kb2 Bf3 36. Qe5 Qxh4 37. Rxf3 
"In the Dragon Variation Black must react very sharply to a flank attack. Half measures are useless, for White's assault is considerably firecer than agains the Paulsen set up. The reason is that the move ... Pg6 involves a slight weakening, enabling White to open the h-file by Ph4-5. The proper reaction is an immediate counter in thecentre",False,"

The comment doesn't offer any insight into why the move was considered a mistake, merely stating a descriptive phrase.",1. e4 c5 2. Nf3 Nc6 3. d4 cxd4 4. Nxd4 Nf6 5. Nc3 d6 6. Be2 g6 7. Be3 Bg7 8. Nb3 Be6 9. f4 O-O 10. g4 Na5,This is a game between Foltys (as White) and Eliskases (as Black). Last move played: Black plays Knight to a5,Slight advantage for White (eval: 48 centipawns),11. g5 ,10... Rc8 
