comment,good,reasoning,moves,context,engine_eval,engine_best_line,engine_best_alternative
6...Nf6 would be less commital.,True," The comment suggests a potential weakness in the move’s clarity, indicating a possible miscalculation.",1. e4 c5 2. Nc3 Nc6 3. Nf3 e6 4. d4 cxd4 5. Nxd4 a6 6. g3 Bc5,This is a game between Steinitz (as White) and MacDonnell (as Black). Last move played: Black plays Bishop to c5,Advantage for White (eval: 50 centipawns),7. Nxc6 bxc6 ,6... Qc7 7. Bg2 
A good move. The idea is to restrain Black's normal development by controlling the key squares f6 and d6.,True," The comment suggests a strategic objective, but doesn't directly identify the error as a mistake, merely describing a potential plan.",1. e4 c5 2. Nc3 Nc6 3. Nf3 e6 4. d4 cxd4 5. Nxd4 a6 6. g3 Bc5 7. Nxc6 bxc6 8. e5,This is a game between Steinitz (as White) and MacDonnell (as Black). Last move played: White plays Pawn to e5,Advantage for White (eval: 58 centipawns),8... Qc7 9. f4 ,8. e5 
The White knight gains a grip on the dark squares.,True,". This comment describes a potential tactical advantage but doesn't directly address the error in the previous move, suggesting a misunderstanding of the position.",1. e4 c5 2. Nc3 Nc6 3. Nf3 e6 4. d4 cxd4 5. Nxd4 a6 6. g3 Bc5 7. Nxc6 bxc6 8. e5 Qb6 9. Qd2 Ne7 10. Ne4,This is a game between Steinitz (as White) and MacDonnell (as Black). Last move played: White plays Knight to e4,Advantage for White (eval: 74 centipawns),10... a5 11. c3 ,10. Na4 Qb4 
Black stands worse due to his broken pawn structure and bad bishop.,True," The comment identifies a specific weakness in Black's pawn structure, suggesting a flawed strategic choice.",1. e4 c5 2. Nc3 Nc6 3. Nf3 e6 4. d4 cxd4 5. Nxd4 a6 6. g3 Bc5 7. Nxc6 bxc6 8. e5 Qb6 9. Qd2 Ne7 10. Ne4 O-O 11. Bd3 Ng6 12. f4 d6 13. exd6 f5 14. Nxc5 Qxc5,This is a game between Steinitz (as White) and MacDonnell (as Black). Last move played: Black plays Queen takes on c5,Large advantage for White (eval: 270 centipawns),15. Qc3 Qxc3+ 16. bxc3 a5 17. Rb1 Rd8 18. Ba3 Nf8 19. O-O Nd7 20. Rfe1 Kf7 21. g4 fxg4 22. Bc4 Nf6 23. f5 Nd5 24. fxe6+ Bxe6 25. Rb7+ Rd7 ,14... Qxc5 15. Qc3 Qxc3+ 16. bxc3 a5 17. Ba3 Ba6 18. c4 e5 19. Kf2 e4 20. Be2 Rfb8 21. Rab1 Nf8 22. Rxb8 Rxb8 23. Rd1 Kf7 24. d7 Rd8 
The White queen wastes no time in attacking Black's weakened dark squares.,True," The comment suggests the queen is over-aggressive, potentially leading to a weakened position.",1. e4 c5 2. Nc3 Nc6 3. Nf3 e6 4. d4 cxd4 5. Nxd4 a6 6. g3 Bc5 7. Nxc6 bxc6 8. e5 Qb6 9. Qd2 Ne7 10. Ne4 O-O 11. Bd3 Ng6 12. f4 d6 13. exd6 f5 14. Nxc5 Qxc5 15. Qc3,This is a game between Steinitz (as White) and MacDonnell (as Black). Last move played: White plays Queen to c3,Large advantage for White (eval: 276 centipawns),15... Qxc3+ 16. bxc3 Rd8 17. Ba3 a5 18. c4 e5 19. fxe5 Nxe5 20. O-O-O Bd7 21. Rhe1 Re8 22. Be2 a4 23. Bb2 g6 24. c5 Ng4 25. Bxg4 fxg4 ,15. Qc3 Qxc3+ 16. bxc3 a5 17. Rb1 Rd8 18. Ba3 Nf8 19. O-O Nd7 20. Rfe1 Kf7 21. g4 fxg4 22. Bc4 Nf6 23. f5 Nd5 24. fxe6+ Bxe6 25. Rb7+ Rd7 
White's two bishops and control of the dark squares give him a winning advantage.,True," The comment offers a potential explanation for the mistake, suggesting strategic control.",1. e4 c5 2. Nc3 Nc6 3. Nf3 e6 4. d4 cxd4 5. Nxd4 a6 6. g3 Bc5 7. Nxc6 bxc6 8. e5 Qb6 9. Qd2 Ne7 10. Ne4 O-O 11. Bd3 Ng6 12. f4 d6 13. exd6 f5 14. Nxc5 Qxc5 15. Qc3 Qxd6 16. b3 a5 17. a3 Qd5 18. Rf1 Ra7 19. Bb2,This is a game between Steinitz (as White) and MacDonnell (as Black). Last move played: White plays Bishop to b2,Large advantage for White (eval: 333 centipawns),19... a4 20. b4 c5 21. b5 c4 22. Qxc4 Qxc4 23. Bxc4 Rc7 24. Bd3 Bb7 25. Rf2 Be4 26. Bf1 e5 27. fxe5 Rfc8 28. e6 h5 29. c4 Nf8 30. Be5 Rb7 31. Kd1 ,19. Be3 Qd7 20. O-O-O Ne7 21. Bxa7 Qxa7 22. Bc4 Nd5 23. Bxd5 cxd5 24. Rf3 Bd7 25. Qd4 Qxd4 26. Rxd4 Kf7 27. Rc3 Ke7 28. Rc7 Ra8 29. Rd3 Kd6 30. Rdc3 d4 31. R3c4 Bb5 32. R4c5 Bd7 33. Kd2 h5 34. b4 axb4 35. axb4 Ra1 
20...Ba6 would allow White to win material.,True," The comment suggests a potential tactical advantage for White, indicating a flaw in the player’s evaluation of the resulting position.",1. e4 c5 2. Nc3 Nc6 3. Nf3 e6 4. d4 cxd4 5. Nxd4 a6 6. g3 Bc5 7. Nxc6 bxc6 8. e5 Qb6 9. Qd2 Ne7 10. Ne4 O-O 11. Bd3 Ng6 12. f4 d6 13. exd6 f5 14. Nxc5 Qxc5 15. Qc3 Qxd6 16. b3 a5 17. a3 Qd5 18. Rf1 Ra7 19. Bb2 c5 20. O-O-O Qc6,This is a game between Steinitz (as White) and MacDonnell (as Black). Last move played: Black plays Queen to c6,Large advantage for White (eval: 353 centipawns),21. Rfe1 Rff7 22. a4 Ba6 23. Bxa6 Rxa6 24. Rd8+ Nf8 25. Qc4 h6 26. Bc3 Kh7 27. h4 h5 28. Red1 Rd7 29. Qe2 Rxd8 30. Rxd8 ,20... Qc6 21. a4 Ba6 22. Bxa6 Qxa6 23. Qxc5 Rc8 24. Qd4 Qe2 25. Bc3 h6 26. Rf2 Qa6 27. Bb2 Nf8 28. Rfd2 Rd7 29. Qe3 Rxd2 30. Qxd2 Rc7 31. Kb1 Nd7 32. Ka2 Nc5 
"Played to protect the seventh rank. However, by moving this rook Black has weakened his back rank.",True, The comment accurately identifies a defensive move that weakens Black's position.,1. e4 c5 2. Nc3 Nc6 3. Nf3 e6 4. d4 cxd4 5. Nxd4 a6 6. g3 Bc5 7. Nxc6 bxc6 8. e5 Qb6 9. Qd2 Ne7 10. Ne4 O-O 11. Bd3 Ng6 12. f4 d6 13. exd6 f5 14. Nxc5 Qxc5 15. Qc3 Qxd6 16. b3 a5 17. a3 Qd5 18. Rf1 Ra7 19. Bb2 c5 20. O-O-O Qc6 21. h4 Rff7,This is a game between Steinitz (as White) and MacDonnell (as Black). Last move played: Black plays Rook to f7,Large advantage for White (eval: 349 centipawns),22. a4 Ba6 23. Bxa6 Rxa6 24. Rd8+ Nf8 25. Rfd1 h6 26. Ba3 Rc7 27. Qe5 Rc8 28. Rxc8 Qxc8 29. Qxc5 Rc6 30. Qxf8+ Qxf8 31. Bxf8 Kxf8 32. Kb2 e5 33. fxe5 Rg6 34. Rf1 Rxg3 35. Rxf5+ Ke7 ,21... h5 22. Be2 a4 23. Bf3 Qb6 24. bxa4 Rff7 25. Bxh5 Kh7 26. Rg1 Rfb7 27. Bf3 Rf7 28. h5 Ne7 29. g4 Nd5 30. Bxd5 exd5 31. Rxd5 Be6 
White's bishops have the Black pieces tied down defending each other.,True," The comment suggests a tactical weakness, indicating a flawed strategic decision.",1. e4 c5 2. Nc3 Nc6 3. Nf3 e6 4. d4 cxd4 5. Nxd4 a6 6. g3 Bc5 7. Nxc6 bxc6 8. e5 Qb6 9. Qd2 Ne7 10. Ne4 O-O 11. Bd3 Ng6 12. f4 d6 13. exd6 f5 14. Nxc5 Qxc5 15. Qc3 Qxd6 16. b3 a5 17. a3 Qd5 18. Rf1 Ra7 19. Bb2 c5 20. O-O-O Qc6 21. h4 Rff7 22. h5 Ne7 23. Bc4,This is a game between Steinitz (as White) and MacDonnell (as Black). Last move played: White plays Bishop to c4,Large advantage for White (eval: 332 centipawns),23... Nd5 24. Qe5 Rae7 25. h6 Ba6 26. Bxa6 Qxa6 27. c4 Nf6 28. Rd8+ Re8 29. Rfd1 Qb6 30. Rxe8+ Nxe8 31. Kb1 Re7 32. Ka2 Qc7 33. a4 Qxe5 34. Bxe5 Kf7 35. Rd8 Kg6 36. Ka3 ,23. Bb5 Qc7 24. Be8 Rf6 25. Rfe1 Nd5 26. Qc4 Nb6 27. Qb5 Nd7 28. Be5 Nxe5 29. Rxe5 Ba6 30. Qxc5 Qxc5 31. Rxc5 Be2 32. Rd6 Bf3 33. Rd8 Rf8 34. Rcc8 Be2 35. c3 
24...Rfc7 would allow White a winning rook sacrifice.,True," The comment suggests a potential tactical error, indicating a flawed assessment of the resulting position.",1. e4 c5 2. Nc3 Nc6 3. Nf3 e6 4. d4 cxd4 5. Nxd4 a6 6. g3 Bc5 7. Nxc6 bxc6 8. e5 Qb6 9. Qd2 Ne7 10. Ne4 O-O 11. Bd3 Ng6 12. f4 d6 13. exd6 f5 14. Nxc5 Qxc5 15. Qc3 Qxd6 16. b3 a5 17. a3 Qd5 18. Rf1 Ra7 19. Bb2 c5 20. O-O-O Qc6 21. h4 Rff7 22. h5 Ne7 23. Bc4 Nd5 24. Qe5 Qc7,This is a game between Steinitz (as White) and MacDonnell (as Black). Last move played: Black plays Queen to c7,Large advantage for White (eval: 631 centipawns),25. Rxd5 exd5 26. Qe8+ Rf8 27. Bxd5+ Qf7 28. Qe5 Qxd5 29. Qxd5+ Raf7 30. Rd1 h6 31. Be5 Bb7 32. Qe6 a4 33. Rd7 Bf3 34. Bxg7 Kxg7 35. Qg6+ Kh8 36. Qxh6+ Kg8 37. Qg5+ Kh8 ,24... Rae7 25. h6 
A brilliant sacrifice which exposes Black's weakened back rank.,True,". The comment suggests a tactical opening, which is a common mistake when evaluating a move as a mistake.",1. e4 c5 2. Nc3 Nc6 3. Nf3 e6 4. d4 cxd4 5. Nxd4 a6 6. g3 Bc5 7. Nxc6 bxc6 8. e5 Qb6 9. Qd2 Ne7 10. Ne4 O-O 11. Bd3 Ng6 12. f4 d6 13. exd6 f5 14. Nxc5 Qxc5 15. Qc3 Qxd6 16. b3 a5 17. a3 Qd5 18. Rf1 Ra7 19. Bb2 c5 20. O-O-O Qc6 21. h4 Rff7 22. h5 Ne7 23. Bc4 Nd5 24. Qe5 Qc7 25. Rxd5,This is a game between Steinitz (as White) and MacDonnell (as Black). Last move played: White plays Rook takes on d5,Large advantage for White (eval: 635 centipawns),25... Qxe5 26. Rxe5 Ba6 27. Bxa6 Rxa6 28. Rxc5 Rd7 29. a4 g6 30. Re1 Rad6 31. Bc3 Kf7 32. h6 Rd5 33. Rxa5 Rc7 34. Bb4 Rd8 ,25. Rxd5 exd5 26. Qe8+ Rf8 27. Bxd5+ Qf7 28. Qe5 Qxd5 29. Qxd5+ Raf7 30. Rd1 h6 31. Be5 Bb7 32. Qe6 a4 33. Rd7 Bf3 34. Bxg7 Kxg7 35. Qg6+ Kh8 36. Qxh6+ Kg8 37. Qg5+ Kh8 
25...Qxe5 26.Rd8+ Rf8 27.Rxf8+ Kxf8 28.Bxe5 would simply leave White a pieceup.,True," The comment identifies a potential tactical weakness, suggesting the move is unsound.",1. e4 c5 2. Nc3 Nc6 3. Nf3 e6 4. d4 cxd4 5. Nxd4 a6 6. g3 Bc5 7. Nxc6 bxc6 8. e5 Qb6 9. Qd2 Ne7 10. Ne4 O-O 11. Bd3 Ng6 12. f4 d6 13. exd6 f5 14. Nxc5 Qxc5 15. Qc3 Qxd6 16. b3 a5 17. a3 Qd5 18. Rf1 Ra7 19. Bb2 c5 20. O-O-O Qc6 21. h4 Rff7 22. h5 Ne7 23. Bc4 Nd5 24. Qe5 Qc7 25. Rxd5 exd5,This is a game between Steinitz (as White) and MacDonnell (as Black). Last move played: Black plays Pawn takes on d5,Large advantage for White (eval: 667 centipawns),26. Qe8+ Rf8 27. Bxd5+ Qf7 28. Qe5 Qxd5 29. Qxd5+ Raf7 30. Rd1 Re8 31. Be5 Bb7 32. Qc4 Bf3 33. Rd7 Bxh5 34. Rxf7 Bxf7 35. Qxc5 a4 36. bxa4 h6 37. Qc7 Rf8 ,25... Qxe5 26. Rxe5 Ba6 27. Bxa6 Rxa6 28. Rxc5 Rd7 29. a4 g6 30. Re1 Rad6 31. Bc3 Kf7 32. h6 Rd5 33. Rxa5 Rc7 34. Bb4 Rd8 
Black resigned since he has no compensation for his lost material.,True, The comment directly identifies the reason for the mistake – lack of compensation – which clarifies the error.,1. e4 c5 2. Nc3 Nc6 3. Nf3 e6 4. d4 cxd4 5. Nxd4 a6 6. g3 Bc5 7. Nxc6 bxc6 8. e5 Qb6 9. Qd2 Ne7 10. Ne4 O-O 11. Bd3 Ng6 12. f4 d6 13. exd6 f5 14. Nxc5 Qxc5 15. Qc3 Qxd6 16. b3 a5 17. a3 Qd5 18. Rf1 Ra7 19. Bb2 c5 20. O-O-O Qc6 21. h4 Rff7 22. h5 Ne7 23. Bc4 Nd5 24. Qe5 Qc7 25. Rxd5 exd5 26. Qe8+ Rf8 27. Bxd5+ Qf7 28. Bxf7+ Rxf7 29. Qe5 Rf6 30. h6,This is a game between Steinitz (as White) and MacDonnell (as Black). Last move played: White plays Pawn to h6,Large advantage for White (eval: 759 centipawns),30... gxh6 31. a4 Bb7 32. Bc3 Bc6 33. Re1 c4 34. bxc4 Bxa4 35. Qd5+ R6f7 36. Qd6 Bxc2 37. Kxc2 a4 38. Kc1 a3 39. Qd4 Rf6 40. c5 a2 41. Qd5+ Kg7 42. Qxa2 Rd8 43. Qe2 Kf8 44. Bxf6 Rd3 45. Qxd3 ,30. h6 a4 31. hxg7 Kxg7 32. Qe7+ Kg6 33. Bxf6 Rxf6 34. Rh1 h6 35. bxa4 Be6 36. Rxh6+ Kxh6 37. Qxf6+ Kh7 38. Qxe6 Kg7 39. Qe7+ Kg6 40. Qg5+ Kh7 41. Qxf5+ Kg7 
White's idea is to fianchetto his light squared bishop on g2 Thus preventing Black from striking back in the center with pawn d5.,True," The comment suggests a logical error in White’s plan, indicating a flawed strategic assessment.",1. e4 c5 2. Nc3 Nc6 3. Nf3 e6 4. d4 cxd4 5. Nxd4 a6 6. g3,This is a game between Steinitz (as White) and MacDonnell (as Black). Last move played: White plays Pawn to g3,Slight advantage for White (eval: 36 centipawns),6... Qc7 7. Bg2 ,6. Nxc6 bxc6 
