comment,good,reasoning,moves,context,engine_eval,engine_best_line,engine_best_alternative
"The next few moves are easy to understand. White strives for the central push Pe4, Black tries to stop him",True," The comment offers a potential explanation for the mistake, suggesting a strategic attempt to control the center.",1. d4 Nf6 2. c4 e6 3. Nc3 Bb4 4. a3 Bxc3+ 5. bxc3 d5 6. cxd5 exd5 7. e3 O-O 8. Bd3 Re8,This is a game between Taimanov (as White) and Abramov (as Black). Last move played: Black plays Rook to e8,Advantage for White (eval: 55 centipawns),9. Ne2 ,8... b6 9. Ne2 
"Now it seems White can play Pe4, as both Pd4 and Pe4 are protected",True," The comment suggests a potential tactical error by White, indicating a vulnerability to a specific opening move.",1. d4 Nf6 2. c4 e6 3. Nc3 Bb4 4. a3 Bxc3+ 5. bxc3 d5 6. cxd5 exd5 7. e3 O-O 8. Bd3 Re8 9. Ne2 Nbd7 10. O-O Nf8 11. f3 Ng6 12. Qe1 c5 13. Qf2 Qc7 14. Bd2 b5 15. Ng3 Bb7 16. Rae1 Rad8 17. h3,This is a game between Taimanov (as White) and Abramov (as Black). Last move played: White plays Pawn to h3,Advantage for White (eval: 98 centipawns),17... Qb6 18. Re2 h6 19. Rfe1 Re6 20. Rb1 Bc6 21. a4 a6 22. Bf5 Ree8 23. Ree1 Re7 24. axb5 axb5 25. Bd3 Re6 ,17. Bxb5 Bc6 18. Bd3 a6 19. Rc1 Rb8 20. Rfe1 Rb3 21. dxc5 Bb5 22. Bc2 Rxa3 23. e4 dxe4 24. Nxe4 Nxe4 25. Rxe4 Rxe4 26. Bxe4 Bc6 27. Bxc6 Qxc6 28. Qd4 Ra2 29. Qd8+ Nf8 
"Note Black can't doublr Rooks on the e-file, since that would relax pressure on Pd4",True," The comment suggests a potential weakness in Black's pawn structure, indicating a flawed strategic assessment.",1. d4 Nf6 2. c4 e6 3. Nc3 Bb4 4. a3 Bxc3+ 5. bxc3 d5 6. cxd5 exd5 7. e3 O-O 8. Bd3 Re8 9. Ne2 Nbd7 10. O-O Nf8 11. f3 Ng6 12. Qe1 c5 13. Qf2 Qc7 14. Bd2 b5 15. Ng3 Bb7 16. Rae1 Rad8 17. h3 Qd6 18. Bc1 Re6 19. Re2 Bc6,This is a game between Taimanov (as White) and Abramov (as Black). Last move played: Black plays Bishop to c6,Large advantage for White (eval: 154 centipawns),20. Rfe1 a5 21. Bb1 cxd4 22. cxd4 h6 23. Nf5 Qc7 24. Rb2 Qb7 25. Bd2 Ra8 26. Bd3 Ne8 27. e4 dxe4 28. fxe4 Rxe4 29. Bxe4 Bxe4 30. Bc3 Qc6 31. d5 Qxc3 32. Rxe4 Qxa3 33. Rxb5 ,19... Qb6 20. Rfe1 
"Black has nothing constructive to do now, and so marks time",True," The comment suggests a lack of strategic development and a passive approach, indicating a poor move.",1. d4 Nf6 2. c4 e6 3. Nc3 Bb4 4. a3 Bxc3+ 5. bxc3 d5 6. cxd5 exd5 7. e3 O-O 8. Bd3 Re8 9. Ne2 Nbd7 10. O-O Nf8 11. f3 Ng6 12. Qe1 c5 13. Qf2 Qc7 14. Bd2 b5 15. Ng3 Bb7 16. Rae1 Rad8 17. h3 Qd6 18. Bc1 Re6 19. Re2 Bc6 20. Rfe1 Ba8,This is a game between Taimanov (as White) and Abramov (as Black). Last move played: Black plays Bishop to a8,Large advantage for White (eval: 204 centipawns),21. Bf5 Ree8 22. e4 dxe4 23. fxe4 cxd4 24. Bxg6 hxg6 25. e5 Qc6 26. exf6 Rxe2 27. Rxe2 dxc3 28. Bg5 Rd5 29. h4 a5 30. fxg7 b4 31. Re7 f5 32. axb4 axb4 33. Ne2 c2 ,20... h5 21. Nf5 
White tries another tack. He diverts one piece from control of e4 to have d4 fully covered,True," The comment suggests a potential weakness in the opponent's pawn structure, indicating a strategic error.",1. d4 Nf6 2. c4 e6 3. Nc3 Bb4 4. a3 Bxc3+ 5. bxc3 d5 6. cxd5 exd5 7. e3 O-O 8. Bd3 Re8 9. Ne2 Nbd7 10. O-O Nf8 11. f3 Ng6 12. Qe1 c5 13. Qf2 Qc7 14. Bd2 b5 15. Ng3 Bb7 16. Rae1 Rad8 17. h3 Qd6 18. Bc1 Re6 19. Re2 Bc6 20. Rfe1 Ba8 21. Nf5,This is a game between Taimanov (as White) and Abramov (as Black). Last move played: White plays Knight to f5,Large advantage for White (eval: 157 centipawns),21... Qc7 ,21. Bf5 Ree8 22. e4 dxe4 23. fxe4 cxd4 24. Bxg6 hxg6 25. e5 Qc6 26. exf6 Rxe2 27. Rxe2 dxc3 28. Bg5 Rd5 29. h4 a5 30. fxg7 b4 31. Re7 f5 32. axb4 axb4 33. Ne2 c2 
"White's excellent maneuvering has decoyed Black's Rook from d8 to e8, thus reducing pressure on d4",True," The comment describes a potential tactical error, suggesting a misjudgment of the board position.",1. d4 Nf6 2. c4 e6 3. Nc3 Bb4 4. a3 Bxc3+ 5. bxc3 d5 6. cxd5 exd5 7. e3 O-O 8. Bd3 Re8 9. Ne2 Nbd7 10. O-O Nf8 11. f3 Ng6 12. Qe1 c5 13. Qf2 Qc7 14. Bd2 b5 15. Ng3 Bb7 16. Rae1 Rad8 17. h3 Qd6 18. Bc1 Re6 19. Re2 Bc6 20. Rfe1 Ba8 21. Nf5 Qc7 22. Bd2 Rde8 23. Ng3 Qd6,This is a game between Taimanov (as White) and Abramov (as Black). Last move played: Black plays Queen to d6,Large advantage for White (eval: 252 centipawns),24. Bf5 R6e7 25. Bb1 Re6 26. e4 cxd4 27. cxd4 dxe4 28. fxe4 Qxa3 29. Rf1 Kh8 30. d5 Nxd5 31. exd5 Rxe2 32. Nxe2 Bxd5 33. Nd4 Bc4 34. Rd1 a5 35. Bc1 Qe7 36. Nf5 ,23... h5 24. Bf5 Ra6 25. e4 cxd4 26. cxd4 dxe4 27. fxe4 h4 28. Nf1 Ne7 29. e5 Nxf5 30. Qxf5 Qd7 31. Qf4 Nd5 32. Qxh4 Rg6 33. Rf2 Qe7 34. Qh5 Qxa3 35. Nh2 b4 
White now gives up the two Bishops in order to wreck Black's kingside pawn structure,True," Yes, the comment suggests a strategic decision to weaken the opponent's pawn structure, indicating a flawed move.",1. d4 Nf6 2. c4 e6 3. Nc3 Bb4 4. a3 Bxc3+ 5. bxc3 d5 6. cxd5 exd5 7. e3 O-O 8. Bd3 Re8 9. Ne2 Nbd7 10. O-O Nf8 11. f3 Ng6 12. Qe1 c5 13. Qf2 Qc7 14. Bd2 b5 15. Ng3 Bb7 16. Rae1 Rad8 17. h3 Qd6 18. Bc1 Re6 19. Re2 Bc6 20. Rfe1 Ba8 21. Nf5 Qc7 22. Bd2 Rde8 23. Ng3 Qd6 24. Bf5 R6e7 25. e4 dxe4 26. fxe4 cxd4 27. cxd4 Qxa3 28. Bg5,This is a game between Taimanov (as White) and Abramov (as Black). Last move played: White plays Bishop to g5,Large advantage for White (eval: 245 centipawns),28... Qa6 29. e5 Nd5 30. Bxe7 Ngxe7 31. Re4 g6 32. Rg4 b4 33. Bb1 Bb7 34. Qd2 Kh8 35. Rh4 Rg8 36. Rf1 Rg7 37. Ne4 Nf5 38. Nc5 Qc6 39. Rg4 ,28. Bg5 Qa6 29. e5 Nd5 30. Bxe7 Ngxe7 31. Re4 Qh6 32. Rg4 Bc6 33. e6 f6 34. Be4 a5 35. Nf5 Nxf5 36. Qxf5 Ne7 37. Qf3 Bxe4 38. Rgxe4 Qd2 39. Rd1 Qb4 40. Ree1 Qd6 41. Qb7 Rb8 42. Qd7 Qxd7 43. exd7 
Exchanging Black's Queen Bishop and indirectly defending the d-pawn,True," The comment suggests a potential tactical weakness, indicating a flawed move.",1. d4 Nf6 2. c4 e6 3. Nc3 Bb4 4. a3 Bxc3+ 5. bxc3 d5 6. cxd5 exd5 7. e3 O-O 8. Bd3 Re8 9. Ne2 Nbd7 10. O-O Nf8 11. f3 Ng6 12. Qe1 c5 13. Qf2 Qc7 14. Bd2 b5 15. Ng3 Bb7 16. Rae1 Rad8 17. h3 Qd6 18. Bc1 Re6 19. Re2 Bc6 20. Rfe1 Ba8 21. Nf5 Qc7 22. Bd2 Rde8 23. Ng3 Qd6 24. Bf5 R6e7 25. e4 dxe4 26. fxe4 cxd4 27. cxd4 Qxa3 28. Bg5 h6 29. Bxf6 gxf6 30. Nh5 Rd8 31. Nxf6+ Kh8 32. e5 Qb4 33. Be4,This is a game between Taimanov (as White) and Abramov (as Black). Last move played: White plays Bishop to e4,Large advantage for White (eval: 339 centipawns),33... Qxd4 34. Qxd4 Rxd4 35. Bxa8 a5 36. Bc6 b4 37. Ba4 Rc4 38. Kh2 Rc5 39. e6 Rf5 40. Ne8 Nf4 41. Rf2 fxe6 42. Nd6 Rd5 43. Rxf4 Rxd6 44. Rc4 Rd3 45. Re5 Rb7 46. Bc2 Rd2 47. Rxa5 ,33. Rd1 Bd5 34. Kh2 Rc7 35. Nxd5 Rxd5 36. Be4 Rdd7 37. d5 Rc4 38. Qf6+ Kh7 39. e6 Qd6+ 40. Kh1 b4 41. Rf1 Re7 42. Re3 b3 43. Bxg6+ fxg6 44. Rxb3 
"The next few moves are easy to understand. White strives for the central push Pe4, Black tries to stop him",True,", The comment suggests a move to support a pawn advance, indicating a flawed tactical assessment.",1. d4 Nf6 2. c4 e6 3. Nc3 Bb4 4. a3 Bxc3+ 5. bxc3 d5 6. cxd5 exd5 7. e3 O-O 8. Bd3 Re8,This is a game between Taimanov (as White) and Abramov (as Black). Last move played: Black plays Rook to e8,Advantage for White (eval: 55 centipawns),9. Ne2 ,8... b6 9. Ne2 
Reinforcing Pd4 so as to prepare Pe4,True," The comment identifies a potential tactical threat, suggesting the player sacrificed a pawn for a dubious advantage.",1. d4 Nf6 2. c4 e6 3. Nc3 Bb4 4. a3 Bxc3+ 5. bxc3 d5 6. cxd5 exd5 7. e3 O-O 8. Bd3 Re8 9. Ne2 Nbd7 10. O-O Nf8 11. f3 Ng6 12. Qe1 c5 13. Qf2,This is a game between Taimanov (as White) and Abramov (as Black). Last move played: White plays Queen to f2,Advantage for White (eval: 79 centipawns),13... Bd7 ,13. Qf2 Bd7 
"The next few moves are easy to understand. White strives for the central push Pe4, Black tries to stop him",True," The comment highlights a potential tactical error and suggests a missed opportunity, indicating a flawed assessment of the position.",1. d4 Nf6 2. c4 e6 3. Nc3 Bb4 4. a3 Bxc3+ 5. bxc3 d5 6. cxd5 exd5 7. e3 O-O 8. Bd3 Re8,This is a game between Taimanov (as White) and Abramov (as Black). Last move played: Black plays Rook to e8,Advantage for White (eval: 55 centipawns),9. Ne2 ,8... b6 9. Ne2 
