comment,good,reasoning,moves,context,engine_eval,engine_best_line,engine_best_alternative
"An important move, which undermines Black's pawn chain.",True," The comment suggests a tactical flaw, indicating a mistake.",1. Nf3 d5 2. d4 Nf6 3. c4 c6 4. Nc3 dxc4 5. e3 b5 6. a4,This is a game between Reti (as White) and Lasker (as Black). Last move played: White plays Pawn to a4,The position is equal,6... b4 7. Nb1 Ba6 8. Nbd2 c3 9. bxc3 bxc3 10. Nb1 Qa5 11. Qc2 e6 12. Bxa6 Qxa6 13. Nxc3 Nbd7 14. Qe2 Qa5 15. Bd2 Bb4 16. Nb1 Rb8 17. O-O O-O ,6. a4 b4 
6...a6 7.axb5 cxb5 8.Nxb5 allows White to regain his pawn with advantage because of his better pawn structure.,True," The comment offers a potential explanation for the mistake, but it’s overly complex and doesn’t fully justify the move’s weakness.",1. Nf3 d5 2. d4 Nf6 3. c4 c6 4. Nc3 dxc4 5. e3 b5 6. a4 b4,This is a game between Reti (as White) and Lasker (as Black). Last move played: Black plays Pawn to b4,The position is equal,7. Na2 e6 ,6... b4 7. Nb1 Ba6 8. Nbd2 c3 9. bxc3 bxc3 10. Nb1 Qa5 11. Qc2 e6 12. Bxa6 Qxa6 13. Nxc3 Nbd7 14. Qe2 Qa5 15. Bd2 Bb4 16. Nb1 Rb8 17. O-O O-O 
"White has regained the pawn, but the knight is now misplaced.",True," The comment suggests a positional issue due to the knight's position, indicating a potential tactical flaw.",1. Nf3 d5 2. d4 Nf6 3. c4 c6 4. Nc3 dxc4 5. e3 b5 6. a4 b4 7. Na2 e6 8. Bxc4,This is a game between Reti (as White) and Lasker (as Black). Last move played: White plays Bishop takes on c4,The position is equal,8... Bb7 ,8. Bxc4 Bb7 
11.e4 Fighting for the center would be more consistent with the ideas behind this opening.,True, The comment suggests a potential weakness in the opening's strategic development.,1. Nf3 d5 2. d4 Nf6 3. c4 c6 4. Nc3 dxc4 5. e3 b5 6. a4 b4 7. Na2 e6 8. Bxc4 Be7 9. O-O O-O 10. Qe2 Nbd7 11. b3,This is a game between Reti (as White) and Lasker (as Black). Last move played: White plays Pawn to b3,Slight advantage for Black (eval: -22 centipawns),11... a5 ,11. b3 a5 12. Bb2 Nb6 13. Bd3 Bb7 14. Rfd1 Rc8 15. h3 Rc7 16. Ba6 Qa8 17. Bxb7 Qxb7 18. Nd2 c5 19. dxc5 Rxc5 20. Bd4 Rd5 21. Nc1 e5 22. Bxb6 Qxb6 23. e4 Rdd8 24. Nd3 Qd4 25. Nc4 
Black plays to lock the a2 knight out of the game.,True," Yes, this comment suggests a tactical error by Black, specifically attempting to restrict the opponent's piece mobility.",1. Nf3 d5 2. d4 Nf6 3. c4 c6 4. Nc3 dxc4 5. e3 b5 6. a4 b4 7. Na2 e6 8. Bxc4 Be7 9. O-O O-O 10. Qe2 Nbd7 11. b3 a5,This is a game between Reti (as White) and Lasker (as Black). Last move played: Black plays Pawn to a5,The position is equal,12. Bb2 Nb6 13. Bd3 Bb7 14. Rfd1 h6 15. Nc1 Qc7 16. Qe1 Rfc8 17. Ne2 c5 18. dxc5 Nbd7 19. Rac1 Nxc5 20. Bc4 Nfe4 21. Ng3 Bd6 22. Nxe4 ,11... a5 
15.Bxa6 Qxa6 16.Qxa6 Rxa6 Black stands better due to White's undeveloped queenside and b3 weakness.,True," The comment identifies a positional weakness for Black, suggesting the move was detrimental.",1. Nf3 d5 2. d4 Nf6 3. c4 c6 4. Nc3 dxc4 5. e3 b5 6. a4 b4 7. Na2 e6 8. Bxc4 Be7 9. O-O O-O 10. Qe2 Nbd7 11. b3 a5 12. Bb2 c5 13. Rfd1 Qb6 14. Nc1 Ba6 15. dxc5,This is a game between Reti (as White) and Lasker (as Black). Last move played: White plays Pawn takes on c5,Slight advantage for Black (eval: -31 centipawns),15... Nxc5 16. Bd4 ,15. Bxa6 Qxa6 
19.h3 would allow Black to win a pawn.,True,". The comment suggests a potential tactical advantage for Black, indicating a flaw in the player's assessment of the position.",1. Nf3 d5 2. d4 Nf6 3. c4 c6 4. Nc3 dxc4 5. e3 b5 6. a4 b4 7. Na2 e6 8. Bxc4 Be7 9. O-O O-O 10. Qe2 Nbd7 11. b3 a5 12. Bb2 c5 13. Rfd1 Qb6 14. Nc1 Ba6 15. dxc5 Nxc5 16. Ne5 Bxc4 17. Nxc4 Qa6 18. Bd4 Rfc8 19. Bxc5,This is a game between Reti (as White) and Lasker (as Black). Last move played: White plays Bishop takes on c5,The position is equal,19... Rxc5 20. Nd3 Rxc4 21. bxc4 Ne4 22. Qf3 f5 23. g4 Rf8 24. c5 Nc3 25. Rd2 Ne4 26. Rdd1 ,19. Bxc5 Rxc5 
22...f6 woul d allow a pretty smothered mate with 23.Rxd5 exd5 24.Qxd5+ Kh8 25.Nf7+ Kg8 26. Nh6+ Kh8 27.Qg8+ Rxg8 28.Nf7+,True," The comment suggests a potential tactical threat, indicating a flawed assessment of the resulting position.",1. Nf3 d5 2. d4 Nf6 3. c4 c6 4. Nc3 dxc4 5. e3 b5 6. a4 b4 7. Na2 e6 8. Bxc4 Be7 9. O-O O-O 10. Qe2 Nbd7 11. b3 a5 12. Bb2 c5 13. Rfd1 Qb6 14. Nc1 Ba6 15. dxc5 Nxc5 16. Ne5 Bxc4 17. Nxc4 Qa6 18. Bd4 Rfc8 19. Bxc5 Bxc5 20. Qf3 Be7 21. Nd3 Nd5 22. Nde5 Bf6,This is a game between Reti (as White) and Lasker (as Black). Last move played: Black plays Bishop to f6,The position is equal,23. e4 Nc3 24. Rd7 Rd8 25. Rxf7 Bxe5 26. Nxe5 Ne2+ 27. Kh1 Qd6 28. Rxg7+ Kxg7 29. Qf7+ Kh8 30. Qf6+ Kg8 31. Qg5+ Kf8 32. Qh6+ Kg8 ,22... Bf6 23. e4 Nc3 24. Nd7 Nxd1 25. Rxd1 Rd8 26. Rd6 Qa7 27. Nxf6+ gxf6 28. Qxf6 Rxd6 29. Nxd6 Rf8 30. Qg5+ Kh8 31. Qe5+ Kg8 32. Qg5+ 
27.Rd7 Qxe5 28.Qxf7+ Kh8 Black is fine since his queen guarding the g7 square.,True," The comment offers a potential justification for the mistake, suggesting a defensive strategy, but it doesn't fully explain why the move was considered a mistake.",1. Nf3 d5 2. d4 Nf6 3. c4 c6 4. Nc3 dxc4 5. e3 b5 6. a4 b4 7. Na2 e6 8. Bxc4 Be7 9. O-O O-O 10. Qe2 Nbd7 11. b3 a5 12. Bb2 c5 13. Rfd1 Qb6 14. Nc1 Ba6 15. dxc5 Nxc5 16. Ne5 Bxc4 17. Nxc4 Qa6 18. Bd4 Rfc8 19. Bxc5 Bxc5 20. Qf3 Be7 21. Nd3 Nd5 22. Nde5 Bf6 23. e4 Nc3 24. Rd6 Qb7 25. Re1 Bxe5 26. Nxe5 Qc7 27. Nc4,This is a game between Reti (as White) and Lasker (as Black). Last move played: White plays Knight to c4,Advantage for Black (eval: -82 centipawns),27... Nxa4 ,27. Nc4 Nxa4 28. e5 Ra7 29. Rd4 Nc3 30. Nd6 Rb8 31. h4 a4 32. Rc4 Qd7 33. bxa4 Rxa4 34. Rg4 Qe7 35. Rf4 f5 36. Qc6 Ra2 
Played to stop White from opening the f3-a8 diagonal for his queen by e5. 27...Nxa4 28.e5 Rd8 29.Red1 Nc3 30.Rd7 Rxd7 31.Qxa8+,True," The comment describes a move that doesn't logically lead to a secure position for White, suggesting a flawed plan.",1. Nf3 d5 2. d4 Nf6 3. c4 c6 4. Nc3 dxc4 5. e3 b5 6. a4 b4 7. Na2 e6 8. Bxc4 Be7 9. O-O O-O 10. Qe2 Nbd7 11. b3 a5 12. Bb2 c5 13. Rfd1 Qb6 14. Nc1 Ba6 15. dxc5 Nxc5 16. Ne5 Bxc4 17. Nxc4 Qa6 18. Bd4 Rfc8 19. Bxc5 Bxc5 20. Qf3 Be7 21. Nd3 Nd5 22. Nde5 Bf6 23. e4 Nc3 24. Rd6 Qb7 25. Re1 Bxe5 26. Nxe5 Qc7 27. Nc4 e5,This is a game between Reti (as White) and Lasker (as Black). Last move played: Black plays Pawn to e5,Advantage for White (eval: 72 centipawns),28. Qf5 Ne2+ ,27... Nxa4 
A mistake which will be seen shortly. White's king would be safer tucked away in the corner after 29.Kh1.,True," The comment suggests a potential future vulnerability, indicating a flawed move.",1. Nf3 d5 2. d4 Nf6 3. c4 c6 4. Nc3 dxc4 5. e3 b5 6. a4 b4 7. Na2 e6 8. Bxc4 Be7 9. O-O O-O 10. Qe2 Nbd7 11. b3 a5 12. Bb2 c5 13. Rfd1 Qb6 14. Nc1 Ba6 15. dxc5 Nxc5 16. Ne5 Bxc4 17. Nxc4 Qa6 18. Bd4 Rfc8 19. Bxc5 Bxc5 20. Qf3 Be7 21. Nd3 Nd5 22. Nde5 Bf6 23. e4 Nc3 24. Rd6 Qb7 25. Re1 Bxe5 26. Nxe5 Qc7 27. Nc4 e5 28. Qf5 Ne2+ 29. Kf1,This is a game between Reti (as White) and Lasker (as Black). Last move played: White plays King to f1,Advantage for Black (eval: -81 centipawns),29... Nd4 ,29. Kh1 Rd8 
Black has the advantage thanks to his passed b-pawn.,True," The comment suggests a potential positional advantage, but doesn't directly address the error in the move's assessment.",1. Nf3 d5 2. d4 Nf6 3. c4 c6 4. Nc3 dxc4 5. e3 b5 6. a4 b4 7. Na2 e6 8. Bxc4 Be7 9. O-O O-O 10. Qe2 Nbd7 11. b3 a5 12. Bb2 c5 13. Rfd1 Qb6 14. Nc1 Ba6 15. dxc5 Nxc5 16. Ne5 Bxc4 17. Nxc4 Qa6 18. Bd4 Rfc8 19. Bxc5 Bxc5 20. Qf3 Be7 21. Nd3 Nd5 22. Nde5 Bf6 23. e4 Nc3 24. Rd6 Qb7 25. Re1 Bxe5 26. Nxe5 Qc7 27. Nc4 e5 28. Qf5 Ne2+ 29. Kf1 Nd4 30. Qxe5 Nxb3,This is a game between Reti (as White) and Lasker (as Black). Last move played: Black plays Knight takes on b3,Advantage for Black (eval: -61 centipawns),31. Nb6 Nd2+ ,30... Nxb3 31. Nb6 
This move would not be possible had White played 29.Kh1.,True," Yes, the comment points to a potential blunder by White, suggesting a crucial tactical error.",1. Nf3 d5 2. d4 Nf6 3. c4 c6 4. Nc3 dxc4 5. e3 b5 6. a4 b4 7. Na2 e6 8. Bxc4 Be7 9. O-O O-O 10. Qe2 Nbd7 11. b3 a5 12. Bb2 c5 13. Rfd1 Qb6 14. Nc1 Ba6 15. dxc5 Nxc5 16. Ne5 Bxc4 17. Nxc4 Qa6 18. Bd4 Rfc8 19. Bxc5 Bxc5 20. Qf3 Be7 21. Nd3 Nd5 22. Nde5 Bf6 23. e4 Nc3 24. Rd6 Qb7 25. Re1 Bxe5 26. Nxe5 Qc7 27. Nc4 e5 28. Qf5 Ne2+ 29. Kf1 Nd4 30. Qxe5 Nxb3 31. Nb6 Nd2+,This is a game between Reti (as White) and Lasker (as Black). Last move played: Black plays Knight to d2 with check,Advantage for Black (eval: -58 centipawns),32. Kg1 Nc4 33. Nxc4 Qxc4 34. g3 Rab8 35. Rd4 Qc7 36. Qxc7 Rxc7 37. Kg2 Rc5 38. Re2 Kf8 39. Rd3 g6 40. Rb2 Ke7 41. Rbd2 Kf6 42. Rd6+ Kg7 43. R6d3 Rb7 44. Rb2 Kf6 45. Kf3 ,31... Nd2+ 32. Kg1 
42.Qxf6 would not help to halt the b-pawns advance after...Rxf6 43.Rb1 Rc6 44.Ree1 Rc4 45.Re2 Rc1+ 46.Rxc1 bxc1Q+,True," The comment suggests a missed opportunity to attack the b-pawns, indicating a flawed strategic assessment.",1. Nf3 d5 2. d4 Nf6 3. c4 c6 4. Nc3 dxc4 5. e3 b5 6. a4 b4 7. Na2 e6 8. Bxc4 Be7 9. O-O O-O 10. Qe2 Nbd7 11. b3 a5 12. Bb2 c5 13. Rfd1 Qb6 14. Nc1 Ba6 15. dxc5 Nxc5 16. Ne5 Bxc4 17. Nxc4 Qa6 18. Bd4 Rfc8 19. Bxc5 Bxc5 20. Qf3 Be7 21. Nd3 Nd5 22. Nde5 Bf6 23. e4 Nc3 24. Rd6 Qb7 25. Re1 Bxe5 26. Nxe5 Qc7 27. Nc4 e5 28. Qf5 Ne2+ 29. Kf1 Nd4 30. Qxe5 Nxb3 31. Nb6 Nd2+ 32. Kg1 Nc4 33. Nxc4 Qxc4 34. Qf5 Rab8 35. e5 b3 36. e6 fxe6 37. Rdxe6 Rf8 38. Qe5 Qc2 39. f4 b2 40. Re7 Qg6 41. f5 Qf6 42. Qd5+,This is a game between Reti (as White) and Lasker (as Black). Last move played: White plays Queen to d5 with check,Large advantage for Black (eval: -535 centipawns),42... Kh8 43. Rb7 Qc3 44. Rf1 Rxb7 45. Qxb7 Qe5 46. Qf3 Rb8 47. Qd1 b1=Q 48. Qxb1 Rxb1 49. Rxb1 Qd4+ 50. Kh1 h5 51. h3 Qxa4 52. f6 gxf6 53. Rb7 Qa1+ 54. Kh2 Qa3 ,42. Qxf6 Rxf6 
White resigned. 43...Qc3 White resigned since he can't stop the b-pawn from promoting for example...,True, The comment provides a clear explanation of why the move was a mistake.,1. Nf3 d5 2. d4 Nf6 3. c4 c6 4. Nc3 dxc4 5. e3 b5 6. a4 b4 7. Na2 e6 8. Bxc4 Be7 9. O-O O-O 10. Qe2 Nbd7 11. b3 a5 12. Bb2 c5 13. Rfd1 Qb6 14. Nc1 Ba6 15. dxc5 Nxc5 16. Ne5 Bxc4 17. Nxc4 Qa6 18. Bd4 Rfc8 19. Bxc5 Bxc5 20. Qf3 Be7 21. Nd3 Nd5 22. Nde5 Bf6 23. e4 Nc3 24. Rd6 Qb7 25. Re1 Bxe5 26. Nxe5 Qc7 27. Nc4 e5 28. Qf5 Ne2+ 29. Kf1 Nd4 30. Qxe5 Nxb3 31. Nb6 Nd2+ 32. Kg1 Nc4 33. Nxc4 Qxc4 34. Qf5 Rab8 35. e5 b3 36. e6 fxe6 37. Rdxe6 Rf8 38. Qe5 Qc2 39. f4 b2 40. Re7 Qg6 41. f5 Qf6 42. Qd5+ Kh8 43. Rb7 Qc3,This is a game between Reti (as White) and Lasker (as Black). Last move played: Black plays Queen to c3,Large advantage for Black (eval: -536 centipawns),44. Rd1 Qe3+ 45. Kh1 Qc1 46. Rxb2 Qxb2 47. h3 Qf6 48. Rf1 h6 49. Qd3 Rbd8 50. Qc2 Qd6 51. Qe4 Qd3 52. Qxd3 Rxd3 53. Rc1 Rdd8 54. Rc5 h5 55. f6 Rxf6 56. Rxh5+ Kg8 57. Kh2 Rdf8 ,43... Qc3 44. Rf1 Rxb7 45. Qxb7 Qe5 46. g3 Rb8 47. Qf3 b1=R 48. Rxb1 Rxb1+ 49. Kg2 Rb8 50. Kh3 Qf6 51. Qd5 Rd8 52. Qf3 h6 53. Qe4 h5 54. Qf3 
"White has regained the pawn, but the knight is now misplaced.",True," The comment suggests a potential tactical blunder, indicating a misjudgment of the pawn structure.",1. Nf3 d5 2. d4 Nf6 3. c4 c6 4. Nc3 dxc4 5. e3 b5 6. a4 b4 7. Na2 e6 8. Bxc4,This is a game between Reti (as White) and Lasker (as Black). Last move played: White plays Bishop takes on c4,The position is equal,8... Bb7 ,8. Bxc4 Bb7 
