comment,good,reasoning,moves,context,engine_eval,engine_best_line,engine_best_alternative
White has an isolated queen pawn but dynamic attacking possibilities as compensation. The position is equal.,True," The comment suggests a potential weakness stemming from the isolated pawn, but the statement ""the position is equal"" is ambiguous and doesn't clearly indicate a tactical error.",1. d4 d5 2. c4 dxc4 3. e3 e5 4. Bxc4 exd4 5. exd4,This is a game between  La Bourdonnais  (as White) and  McDonnell  (as Black). Last move played: White plays Pawn takes on d4,Slight advantage for White (eval: 27 centipawns),5... Bd6 ,5. exd4 Nf6 6. Nf3 Bd6 7. O-O O-O 8. Bg5 Nc6 9. h3 h6 10. Bh4 g5 11. Bg3 Ne4 12. Bxd6 Nxd6 13. Bd5 Ne7 14. Bb3 g4 15. hxg4 Bxg4 16. Qd3 Bxf3 17. Qxf3 Nef5 18. Nc3 
Both sides have been developing.,False,"

The comment doesn't explain why the move was considered a mistake, only that both sides are developing, which is a general observation and doesn't directly address the tactical or strategic flaw in the move.",1. d4 d5 2. c4 dxc4 3. e3 e5 4. Bxc4 exd4 5. exd4 Nf6 6. Nc3 Be7 7. Nf3 O-O,This is a game between  La Bourdonnais  (as White) and  McDonnell  (as Black). Last move played: Black plays kingside castle,Slight advantage for White (eval: 43 centipawns),8. O-O Nbd7 ,7... O-O 8. O-O 
Taking possession of the central square d5 and planning to plant a knight there.,True,". The comment suggests a potential weakness in the pawn structure and an attempt to undermine the opponent's central control, indicating a mistake.",1. d4 d5 2. c4 dxc4 3. e3 e5 4. Bxc4 exd4 5. exd4 Nf6 6. Nc3 Be7 7. Nf3 O-O 8. Be3 c6,This is a game between  La Bourdonnais  (as White) and  McDonnell  (as Black). Last move played: Black plays Pawn to c6,Slight advantage for White (eval: 30 centipawns),9. O-O Nbd7 ,8... Nbd7 9. Bb3 Nb6 10. O-O c6 11. Re1 Nbd5 12. h3 Be6 13. Bg5 Re8 14. Qd2 Nxc3 15. bxc3 Bd5 16. Qd3 Bxb3 17. axb3 h6 18. Bf4 Bd6 19. Rxe8+ Nxe8 20. Bxd6 Nxd6 
White has an isolated queen pawn but dynamic attacking possibilities as compensation. The position is equal.,True," The comment offers a potential reason for the mistake, suggesting a strategic concern about the resulting pawn structure.",1. d4 d5 2. c4 dxc4 3. e3 e5 4. Bxc4 exd4 5. exd4,This is a game between  La Bourdonnais  (as White) and  McDonnell  (as Black). Last move played: White plays Pawn takes on d4,Slight advantage for White (eval: 27 centipawns),5... Bd6 ,5. exd4 Nf6 6. Nf3 Bd6 7. O-O O-O 8. Bg5 Nc6 9. h3 h6 10. Bh4 g5 11. Bg3 Ne4 12. Bxd6 Nxd6 13. Bd5 Ne7 14. Bb3 g4 15. hxg4 Bxg4 16. Qd3 Bxf3 17. Qxf3 Nef5 18. Nc3 
