comment,good,reasoning,moves,context
"! - Prevents ..Na5 and makes clearer the situation at the center. ""It is surprising that a player like Nimzowitsch did not consider this move when he began his strategical plan with 8...b6."" (Alekhine)",True,"
The comment explains the mistake made by the player because it provides a clear and strategic alternative move (..Na5) that the player could have played to avoid a potential pitfall in the center.",1. e4 e6 2. d4 d5 3. Nc3 Bb4 4. e5 c5 5. Bd2 Ne7 6. Nb5 Bxd2+ 7. Qxd2 O-O 8. c3 b6 9. f4 Ba6 10. Nf3 Qd7 11. a4 Nbc6 12. b4,"This is a game between Alekhine, Alexander (as White) and Nimzowitsch, A. (as Black). Last move played: White plays Pawn to b4"
? - A big strategical mistake. The eyes and the thoughts of Nimzowitsch are turned on the kingside while the danger is on the queenside.,True,"

The comment accurately identifies a strategic mistake by highlighting the player's focus on one side of the board while neglecting the other, consistent with Nimzowitsch's principles of outmaneuvering the opponent's position.",1. e4 e6 2. d4 d5 3. Nc3 Bb4 4. e5 c5 5. Bd2 Ne7 6. Nb5 Bxd2+ 7. Qxd2 O-O 8. c3 b6 9. f4 Ba6 10. Nf3 Qd7 11. a4 Nbc6 12. b4 cxd4 13. cxd4 Bb7 14. Nd6 f5,"This is a game between Alekhine, Alexander (as White) and Nimzowitsch, A. (as Black). Last move played: Black plays Pawn to f5"
!,True,"

The exclamation mark signifies that the player made a mistake, which accurately reflects the comment's intent to point out an error in the previous move.",1. e4 e6 2. d4 d5 3. Nc3 Bb4 4. e5 c5 5. Bd2 Ne7 6. Nb5 Bxd2+ 7. Qxd2 O-O 8. c3 b6 9. f4 Ba6 10. Nf3 Qd7 11. a4 Nbc6 12. b4 cxd4 13. cxd4 Bb7 14. Nd6 f5 15. a5,"This is a game between Alekhine, Alexander (as White) and Nimzowitsch, A. (as Black). Last move played: White plays Pawn to a5"
To eliminate the annoying white Knight in d6.,True,"
The comment likely refers to a mistake where the player's piece, possibly a pawn, was moved to eliminate the white Knight on d6, which could have weakened the player's position or created a tactical issue.",1. e4 e6 2. d4 d5 3. Nc3 Bb4 4. e5 c5 5. Bd2 Ne7 6. Nb5 Bxd2+ 7. Qxd2 O-O 8. c3 b6 9. f4 Ba6 10. Nf3 Qd7 11. a4 Nbc6 12. b4 cxd4 13. cxd4 Bb7 14. Nd6 f5 15. a5 Nc8,"This is a game between Alekhine, Alexander (as White) and Nimzowitsch, A. (as Black). Last move played: Black plays Knight to c8"
"The structural weaknesses for Black are well apparent, as well as his lack of space.",True,"

The comment correctly identifies the structural weaknesses and lack of space, which are factors contributing to the player's mistake.",1. e4 e6 2. d4 d5 3. Nc3 Bb4 4. e5 c5 5. Bd2 Ne7 6. Nb5 Bxd2+ 7. Qxd2 O-O 8. c3 b6 9. f4 Ba6 10. Nf3 Qd7 11. a4 Nbc6 12. b4 cxd4 13. cxd4 Bb7 14. Nd6 f5 15. a5 Nc8 16. Nxb7 Qxb7 17. a6 Qf7 18. Bb5 N8e7 19. O-O h6,"This is a game between Alekhine, Alexander (as White) and Nimzowitsch, A. (as Black). Last move played: Black plays Pawn to h6"
The Queen has pinned herself! For Nimzowitsch it must have been extremely painful to do such a move.,True,"

The comment accurately describes the mistake made by the player, as it indicates that the player's queen has been placed in a vulnerable position, known as ""pinning"" oneself in chess terminology.",1. e4 e6 2. d4 d5 3. Nc3 Bb4 4. e5 c5 5. Bd2 Ne7 6. Nb5 Bxd2+ 7. Qxd2 O-O 8. c3 b6 9. f4 Ba6 10. Nf3 Qd7 11. a4 Nbc6 12. b4 cxd4 13. cxd4 Bb7 14. Nd6 f5 15. a5 Nc8 16. Nxb7 Qxb7 17. a6 Qf7 18. Bb5 N8e7 19. O-O h6 20. Rfc1 Rfc8 21. Rc2 Qe8,"This is a game between Alekhine, Alexander (as White) and Nimzowitsch, A. (as Black). Last move played: Black plays Queen to e8"
An invitation to his King to run and help to strenghten the very weak c7 square.,True,"

The comment explains the mistake as it identifies the player's move as weakening the c7 square, potentially leaving the King vulnerable to attack.",1. e4 e6 2. d4 d5 3. Nc3 Bb4 4. e5 c5 5. Bd2 Ne7 6. Nb5 Bxd2+ 7. Qxd2 O-O 8. c3 b6 9. f4 Ba6 10. Nf3 Qd7 11. a4 Nbc6 12. b4 cxd4 13. cxd4 Bb7 14. Nd6 f5 15. a5 Nc8 16. Nxb7 Qxb7 17. a6 Qf7 18. Bb5 N8e7 19. O-O h6 20. Rfc1 Rfc8 21. Rc2 Qe8 22. Rac1 Rab8 23. Qe3 Rc7 24. Rc3 Qd7,"This is a game between Alekhine, Alexander (as White) and Nimzowitsch, A. (as Black). Last move played: Black plays Queen to d7"
! - The threat to push the pawn b4-b5 makes stagger the Black defense. It will be necessary to sacrifice a pawn to let the King arrive in time to help.,True,"
The comment accurately explains the mistake made by the player, highlighting the potential pawn sacrifice as a strategic move to strengthen the King's position.",1. e4 e6 2. d4 d5 3. Nc3 Bb4 4. e5 c5 5. Bd2 Ne7 6. Nb5 Bxd2+ 7. Qxd2 O-O 8. c3 b6 9. f4 Ba6 10. Nf3 Qd7 11. a4 Nbc6 12. b4 cxd4 13. cxd4 Bb7 14. Nd6 f5 15. a5 Nc8 16. Nxb7 Qxb7 17. a6 Qf7 18. Bb5 N8e7 19. O-O h6 20. Rfc1 Rfc8 21. Rc2 Qe8 22. Rac1 Rab8 23. Qe3 Rc7 24. Rc3 Qd7 25. R1c2 Kf8 26. Qc1 Rbc8 27. Ba4,"This is a game between Alekhine, Alexander (as White) and Nimzowitsch, A. (as Black). Last move played: White plays Bishop to a4"
! - Zugzwang! A deadly one.,True,"

The comment accurately explains the mistake, as Zugzwang is a situation where a player is put at a disadvantage because they must make a move when they would prefer to pass and not move.",1. e4 e6 2. d4 d5 3. Nc3 Bb4 4. e5 c5 5. Bd2 Ne7 6. Nb5 Bxd2+ 7. Qxd2 O-O 8. c3 b6 9. f4 Ba6 10. Nf3 Qd7 11. a4 Nbc6 12. b4 cxd4 13. cxd4 Bb7 14. Nd6 f5 15. a5 Nc8 16. Nxb7 Qxb7 17. a6 Qf7 18. Bb5 N8e7 19. O-O h6 20. Rfc1 Rfc8 21. Rc2 Qe8 22. Rac1 Rab8 23. Qe3 Rc7 24. Rc3 Qd7 25. R1c2 Kf8 26. Qc1 Rbc8 27. Ba4 b5 28. Bxb5 Ke8 29. Ba4 Kd8 30. h4,"This is a game between Alekhine, Alexander (as White) and Nimzowitsch, A. (as Black). Last move played: White plays Pawn to h4"
