comment,good,reasoning,moves,context,engine_eval,engine_best_line,engine_best_alternative
A slow and ineffective move which Karpov soon abandoned.,True," Yes, the comment provides a clear assessment of the move's weakness and suggests a lack of effectiveness.",1. e4 c5 2. Nf3 d6 3. g3,This is a game between Karpov (as White) and Payrhuber (as Black). Last move played: White plays Pawn to g3,The position is equal,3... g6 4. Bg2 Nf6 5. c3 Bg7 6. O-O O-O 7. Re1 Nc6 8. d4 cxd4 9. Nxd4 Bg4 10. f3 Bd7 11. Be3 b5 12. Nxb5 Rb8 13. Nxa7 Rxb2 14. Nxc6 Bxc6 ,3. d4 Nf6 
White prepares the central advance d3-d4.,True," The comment indicates a potential weakness in the opening, suggesting a lack of strategic development.",1. e4 c5 2. Nf3 d6 3. g3 Nf6 4. d3 Nc6 5. Bg2 g6 6. O-O Bg7 7. Re1 O-O 8. c3,This is a game between Karpov (as White) and Payrhuber (as Black). Last move played: White plays Pawn to c3,The position is equal,8... e5 9. h3 Be6 10. Be3 Rc8 11. c4 a6 12. Nc3 Rb8 13. a4 h6 14. Rb1 Ne8 15. Kh2 b6 16. Nd5 Kh7 17. Bd2 a5 18. Rf1 Nc7 19. b3 Bd7 20. Nxc7 Qxc7 ,8. h3 e5 
Now White adopts a well-known procedure to win the exchange.,True," The comment suggests a passive and predictable approach, indicating a lack of strategic initiative.",1. e4 c5 2. Nf3 d6 3. g3 Nf6 4. d3 Nc6 5. Bg2 g6 6. O-O Bg7 7. Re1 O-O 8. c3 Ne8 9. Na3 f5 10. Ng5 Nc7,This is a game between Karpov (as White) and Payrhuber (as Black). Last move played: Black plays Knight to c7,Advantage for White (eval: 52 centipawns),11. Nc4 e5 12. f4 h6 13. Nh3 Kh7 14. Nf2 Rb8 15. a4 Be6 16. fxe5 Nxe5 17. exf5 Bxf5 18. Bf4 Nf7 19. h4 b6 20. Ne3 Bd7 21. d4 cxd4 22. cxd4 ,10... Nc7 
Black must give up the rook because of the fork of his king and queen.,True," The comment suggests a logical flaw in Black’s strategy, indicating a potential misjudgment of the position.",1. e4 c5 2. Nf3 d6 3. g3 Nf6 4. d3 Nc6 5. Bg2 g6 6. O-O Bg7 7. Re1 O-O 8. c3 Ne8 9. Na3 f5 10. Ng5 Nc7 11. Qb3+ Kh8 12. exf5 Bxf5 13. Nf7+ Rxf7,This is a game between Karpov (as White) and Payrhuber (as Black). Last move played: Black plays Rook takes on f7,Large advantage for White (eval: 119 centipawns),14. Qxf7 Ne5 ,13... Rxf7 
"Now White's queen will get out and take several more Black pieces in the process. If you have a question about how this will happen, play the position out with Gambit. Karpov's opponent didn't bother, prefering resignation here.",True," The comment suggests a potential tactical disaster stemming from a queen's exposure, potentially leading to a forced resignation.",1. e4 c5 2. Nf3 d6 3. g3 Nf6 4. d3 Nc6 5. Bg2 g6 6. O-O Bg7 7. Re1 O-O 8. c3 Ne8 9. Na3 f5 10. Ng5 Nc7 11. Qb3+ Kh8 12. exf5 Bxf5 13. Nf7+ Rxf7 14. Qxf7 e6 15. Bg5,This is a game between Karpov (as White) and Payrhuber (as Black). Last move played: White plays Bishop to g5,Large advantage for White (eval: 386 centipawns),15... Qxg5 16. Qxc7 Rf8 17. Qxd6 Bg4 18. Nc4 Rd8 19. Qc7 Rf8 20. f4 Qh5 21. Rf1 Nd4 22. cxd4 Be2 23. Ne5 Bxf1 24. Kxf1 ,15. Bg5 Qc8 16. Nc4 Ne8 17. Ne3 Bxd3 18. Ng4 d5 19. Bh6 Bxh6 20. Nxh6 Ng7 21. Re3 c4 22. Rae1 Qf8 23. Qxb7 Rb8 24. Qxc6 Rxb2 25. Rf3 Qb8 26. Nf7+ Kg8 27. Ne5 Rb1 28. Re3 Rb6 29. Qd7 Rb1 
"Black hopes to take the initiative on the kingside, but he isn't ready for such aggression.",True," The comment suggests a potential tactical threat and a planned development, indicating a flawed assessment of the position.",1. e4 c5 2. Nf3 d6 3. g3 Nf6 4. d3 Nc6 5. Bg2 g6 6. O-O Bg7 7. Re1 O-O 8. c3 Ne8,This is a game between Karpov (as White) and Payrhuber (as Black). Last move played: Black plays Knight to e8,Slight advantage for White (eval: 25 centipawns),9. Na3 e5 ,8... e5 9. h3 
White keeps the c1-h6 diagonal open for his bishop and prepares to centralize his knight by way of c4.,True," The comment suggests a potential tactical error, indicating a missed opportunity to develop the bishop.",1. e4 c5 2. Nf3 d6 3. g3 Nf6 4. d3 Nc6 5. Bg2 g6 6. O-O Bg7 7. Re1 O-O 8. c3 Ne8 9. Na3,This is a game between Karpov (as White) and Payrhuber (as Black). Last move played: White plays Knight to a3,The position is equal,9... e5 10. Nc2 Nf6 11. b4 d5 12. Bb2 dxe4 13. dxe4 Qb6 14. Qe2 cxb4 15. cxb4 Be6 16. b5 Na5 17. Ng5 Bg4 ,9. Na3 e5 
