comment,good,reasoning,moves,context,engine_eval,engine_best_line,engine_best_alternative
"This move is playable, but rather passive. Now your dark-squared bishop can't be deployed to an active post. I would recommend the more active ...Nc6.",True," The comment suggests the move is passive and hinders the dark-squared bishop, indicating a potential tactical or strategic flaw.",1. e4 e5 2. Nf3 d6,This is a game between W29 (as White) and B29 (as Black). Last move played: Black plays Pawn to d6,Advantage for White (eval: 68 centipawns),3. d4 ,2... Nc6 3. Bb5 
"This misses white's threat. White has 2 pieces on the knight at f6 -- white will now a tactical idea called ""removing the defender"", which should have won the game for white. Black's only defense is ...Kf7. It wouldn't be too bad in this position, because if needed, black can always castle ""by hand"" by playing ...Be7, ...Rf8, ...Kg8.",True," The comment offers a potential tactical idea, suggesting a move that could benefit white, indicating a flawed assessment of the situation.",1. e4 e5 2. Nf3 d6 3. Bc4 Be6 4. Qe2 a6 5. Nc3 b5 6. Bd5 c6 7. Bxe6 fxe6 8. d4 exd4 9. Nxd4 e5 10. Qh5+ g6 11. Bg5 Nf6 12. Qf3 Bg7,This is a game between W29 (as White) and B29 (as Black). Last move played: Black plays Bishop to g7,Large advantage for White (eval: 435 centipawns),13. Ne6 Qe7 14. Nxg7+ Kf7 15. Bh6 b4 16. Ne2 d5 17. O-O Nd7 18. Rae1 Rhb8 19. Qh3 b3 20. axb3 Rb4 21. exd5 Nxd5 22. c4 N5f6 23. Nf4 Kg8 24. Nge6 Re8 25. Ng5 e4 26. Qe6+ Qxe6 27. Nfxe6 ,12... Kf7 13. Nb3 
"This gives black a chance. If white would've taken the post near the center (Nf5), and followed up with h4, O-O-O, white would have soon won.",True," The comment suggests a missed opportunity for white, indicating a flawed strategic assessment.",1. e4 e5 2. Nf3 d6 3. Bc4 Be6 4. Qe2 a6 5. Nc3 b5 6. Bd5 c6 7. Bxe6 fxe6 8. d4 exd4 9. Nxd4 e5 10. Qh5+ g6 11. Bg5 Nf6 12. Qf3 Bg7 13. Ne6 Qe7 14. Nxg7+ Kf7 15. Bh6 Rg8 16. g4 g5 17. Nh5,This is a game between W29 (as White) and B29 (as Black). Last move played: White plays Knight to h5,Large advantage for White (eval: 494 centipawns),17... Nd7 18. h4 Qe6 19. Nxf6 Qxf6 20. Qxf6+ Nxf6 21. hxg5 b4 22. gxf6 bxc3 23. bxc3 Rxg4 24. Kd2 Rag8 25. Be3 Rxe4 26. Rxh7+ Kxf6 27. Rah1 Ra4 28. R7h6+ Kf5 29. Rxd6 Rg2 30. Rh8 Ke4 ,17. Nf5 Qc7 18. h4 Nbd7 19. hxg5 b4 20. Nd1 b3 21. gxf6 bxc2 22. Bd2 Nxf6 23. Qb3+ d5 24. Qxc2 Rxg4 
"This does nothing. 18. h4! would have soon won the game.. too many threats. For example, if 18. ... Rxh6 19. hxg5 Rg6 20. Nxf6, and black could safely resign.",True," The comment offers a potential explanation for the mistake, suggesting a strategic deficiency that led to resignation.",1. e4 e5 2. Nf3 d6 3. Bc4 Be6 4. Qe2 a6 5. Nc3 b5 6. Bd5 c6 7. Bxe6 fxe6 8. d4 exd4 9. Nxd4 e5 10. Qh5+ g6 11. Bg5 Nf6 12. Qf3 Bg7 13. Ne6 Qe7 14. Nxg7+ Kf7 15. Bh6 Rg8 16. g4 g5 17. Nh5 Rg6 18. Qf5,This is a game between W29 (as White) and B29 (as Black). Last move played: White plays Queen to f5,Large advantage for White (eval: 299 centipawns),18... Rxh6 19. h4 Rxh5 20. gxh5 g4 21. f3 Qe6 22. fxg4 b4 23. Ne2 Qxf5 24. gxf5 Nbd7 25. Rg1 Nxh5 26. O-O-O Ke7 27. Rg5 Ndf6 28. Ng3 Nxg3 29. Rxg3 Nxe4 30. Rg7+ Kf6 31. Rxh7 Rg8 32. h5 Rg3 33. Rh6+ Kxf5 34. Rf1+ Kg5 ,18. h4 Qe6 19. hxg5 Qxg4 20. Qf5 Qxf5 21. exf5 Rxh6 22. gxh6 Nbd7 23. Nxf6 Nxf6 24. O-O-O d5 25. Rdg1 Rg8 26. Rxg8 Nxg8 27. Ne2 Nf6 28. Rg1 Nh5 29. c3 Kf6 30. b4 Ke7 31. f6+ Kxf6 
"This is wrong. Black's queen side isn't developed. Should be a top priority, because the more pieces you have involved in the battle, the more likely you will succeed in breaking through. Even ... Kf6 is a superior move. The king can be (and often is) a fighting piece in the endgame.",True," The comment highlights a missed opportunity to develop the queen, suggesting a strategic oversight.",1. e4 e5 2. Nf3 d6 3. Bc4 Be6 4. Qe2 a6 5. Nc3 b5 6. Bd5 c6 7. Bxe6 fxe6 8. d4 exd4 9. Nxd4 e5 10. Qh5+ g6 11. Bg5 Nf6 12. Qf3 Bg7 13. Ne6 Qe7 14. Nxg7+ Kf7 15. Bh6 Rg8 16. g4 g5 17. Nh5 Rg6 18. Qf5 Qd7 19. Bg7 Qxf5 20. exf5 Rxg7 21. O-O-O d5 22. f3 Nxh5 23. gxh5 g4,This is a game between W29 (as White) and B29 (as Black). Last move played: Black plays Pawn to g4,Large advantage for White (eval: 141 centipawns),24. h6 ,23... Nd7 
"White threw away his advantage with this move. 29. Rf8 Kxh6 30. h4 would have paralyzed black, and white would have all the time he needed to work on his own plans. After this, black gets developed and has the better game because of white's weak king-side pawns and black's formidable pawn mass in the center.",True," The comment offers a valid critique of the move's consequences, highlighting a potential weakness in white's king position and a strategic disadvantage for black.",1. e4 e5 2. Nf3 d6 3. Bc4 Be6 4. Qe2 a6 5. Nc3 b5 6. Bd5 c6 7. Bxe6 fxe6 8. d4 exd4 9. Nxd4 e5 10. Qh5+ g6 11. Bg5 Nf6 12. Qf3 Bg7 13. Ne6 Qe7 14. Nxg7+ Kf7 15. Bh6 Rg8 16. g4 g5 17. Nh5 Rg6 18. Qf5 Qd7 19. Bg7 Qxf5 20. exf5 Rxg7 21. O-O-O d5 22. f3 Nxh5 23. gxh5 g4 24. h6 Rg5 25. Rhg1 Rxf5 26. fxg4 Rf4 27. Rdf1 Rxf1+ 28. Rxf1+ Kg6 29. Rf5,This is a game between W29 (as White) and B29 (as Black). Last move played: White plays Rook to f5,Large advantage for Black (eval: -107 centipawns),29... Nd7 ,29. Rf8 Kxh6 30. Rg8 Ra7 31. Rxb8 Kg5 32. Rg8+ Kh4 33. Ne2 Rf7 34. Kd2 b4 35. g5 c5 36. g6 hxg6 37. Rxg6 e4 38. Rc6 Kg4 39. Rxc5 Kf3 40. Rxd5 Kf2 41. Nd4 Rf4 42. c3 bxc3+ 43. Kxc3 
"This is playable, but 31. ... Nf6 (attacks the rook on h5 and pawn at g4) 32. Rh4 Kg5 would win 2 pawns and the game.",True," The comment provides a potential winning sequence, indicating a flawed move that led to a loss.",1. e4 e5 2. Nf3 d6 3. Bc4 Be6 4. Qe2 a6 5. Nc3 b5 6. Bd5 c6 7. Bxe6 fxe6 8. d4 exd4 9. Nxd4 e5 10. Qh5+ g6 11. Bg5 Nf6 12. Qf3 Bg7 13. Ne6 Qe7 14. Nxg7+ Kf7 15. Bh6 Rg8 16. g4 g5 17. Nh5 Rg6 18. Qf5 Qd7 19. Bg7 Qxf5 20. exf5 Rxg7 21. O-O-O d5 22. f3 Nxh5 23. gxh5 g4 24. h6 Rg5 25. Rhg1 Rxf5 26. fxg4 Rf4 27. Rdf1 Rxf1+ 28. Rxf1+ Kg6 29. Rf5 Nd7 30. Rh5 Re8 31. Ne2 e4,This is a game between W29 (as White) and B29 (as Black). Last move played: Black plays Pawn to e4,Large advantage for White (eval: 128 centipawns),32. Nf4+ ,31... Nf6 32. Rh3 Nxg4 33. Ra3 Ra8 34. Rc3 Rc8 35. Ra3 Kxh6 36. Kd2 b4 37. Rxa6 Nxh2 38. Rb6 Nf1+ 39. Kc1 Kg5 40. Rxb4 h5 41. a4 h4 42. Ng1 Rf8 43. Nh3+ Kh5 
"This was a serious error by white. White's only plus is his king-side pawn majority, so he should've looked for a way to mobilize them. The way to do that was 33. Rf5+ Ke7 34. g5, which would make it a lot harder for black. Notice black couldn't even have tried 34. ... Rf8? in that variation, because white's pawns are too fast. e.g., 34. ... Rf8 35. g6! Rxf5 36. gxh7 Rf8 37. Ng6+ Kf7 38. Nxf8, and black can't stop white from playing h8Q. This illustrates the power of the advanced, passed pawns.",True," The comment accurately identifies a critical weakness in white’s strategy due to the king-side pawn majority and suggests a suboptimal plan, highlighting the impact of advanced pawns.",1. e4 e5 2. Nf3 d6 3. Bc4 Be6 4. Qe2 a6 5. Nc3 b5 6. Bd5 c6 7. Bxe6 fxe6 8. d4 exd4 9. Nxd4 e5 10. Qh5+ g6 11. Bg5 Nf6 12. Qf3 Bg7 13. Ne6 Qe7 14. Nxg7+ Kf7 15. Bh6 Rg8 16. g4 g5 17. Nh5 Rg6 18. Qf5 Qd7 19. Bg7 Qxf5 20. exf5 Rxg7 21. O-O-O d5 22. f3 Nxh5 23. gxh5 g4 24. h6 Rg5 25. Rhg1 Rxf5 26. fxg4 Rf4 27. Rdf1 Rxf1+ 28. Rxf1+ Kg6 29. Rf5 Nd7 30. Rh5 Re8 31. Ne2 e4 32. Nf4+ Kf6 33. g5+,This is a game between W29 (as White) and B29 (as Black). Last move played: White plays Pawn to g5 with check,Large advantage for Black (eval: -398 centipawns),33... Kf5 34. Ng2 Kg4 35. Rh4+ Kxg5 36. Rh3 Ne5 37. Rg3+ Kxh6 38. Nf4 Nf3 39. Kd1 Re7 40. c3 Nxh2 41. Ke1 Nf3+ 42. Ke2 Rf7 43. Ke3 Nh4 44. Rg1 Nf5+ 45. Ke2 a5 46. Rh1+ Kg5 47. Ne6+ Kg6 ,33. Rf5+ Ke7 34. g5 Kd6 35. h4 Re7 36. b4 Ne5 37. Rf6+ Kd7 38. h5 e3 39. Kd1 e2+ 40. Nxe2 Rf7 41. g6 hxg6 42. hxg6 Rxf6 43. g7 Rf1+ 44. Kd2 Nc4+ 45. Kc3 
"This is winning for black, but because of low time, both players agreed to a draw. So in conclusion, get your pieces developed in the early stages. Also, when calculating variations, see what you get vs. your opponents, to see if you could win material. Early in the game, black could have gotten Q & B, while white would get black's queen. Only by using all your forces will you have good chances of success.",True," The comment offers strategic advice, though potentially overly cautious, to improve development and consider tactical possibilities.",1. e4 e5 2. Nf3 d6 3. Bc4 Be6 4. Qe2 a6 5. Nc3 b5 6. Bd5 c6 7. Bxe6 fxe6 8. d4 exd4 9. Nxd4 e5 10. Qh5+ g6 11. Bg5 Nf6 12. Qf3 Bg7 13. Ne6 Qe7 14. Nxg7+ Kf7 15. Bh6 Rg8 16. g4 g5 17. Nh5 Rg6 18. Qf5 Qd7 19. Bg7 Qxf5 20. exf5 Rxg7 21. O-O-O d5 22. f3 Nxh5 23. gxh5 g4 24. h6 Rg5 25. Rhg1 Rxf5 26. fxg4 Rf4 27. Rdf1 Rxf1+ 28. Rxf1+ Kg6 29. Rf5 Nd7 30. Rh5 Re8 31. Ne2 e4 32. Nf4+ Kf6 33. g5+ Kf5 34. Ne2 Kg6 35. Nf4+ Kf5 36. Nh3 e3 37. Kd1 Kg6 38. Nf4+ Kf5 39. Nh3 Kg4,This is a game between W29 (as White) and B29 (as Black). Last move played: Black plays King to g4,Large advantage for Black (eval: -652 centipawns),40. a4 e2+ 41. Ke1 Kxh5 42. axb5 axb5 43. b4 Kg4 44. Ng1 Kxg5 45. Nxe2 Kxh6 46. Kd2 Re4 47. c3 Ne5 48. Nd4 Kg6 49. Kc2 Kf7 50. Kb2 Nc4+ 51. Kb3 ,39... e2+ 40. Ke1 Kg4 41. g6 Kxh5 42. gxh7 Kxh6 43. Nf4 Kxh7 44. Nxe2 c5 45. Kf1 Nf6 46. Nc1 c4 47. Ne2 Ng4 48. h3 Ne3+ 49. Kg1 Nf5 50. Nf4 d4 51. Nd5 Kh6 52. Nc7 
"While getting space is a laudable goal, in the early phases of the game, you want to get your pieces mobilized. ...Nc6 would do that, plus help restrain the d4 advance that white would like to do.",True,", The comment suggests a missed opportunity for black, indicating a flawed strategic decision.",1. e4 e5 2. Nf3 d6 3. Bc4 Be6 4. Qe2 a6,This is a game between W29 (as White) and B29 (as Black). Last move played: Black plays Pawn to a6,Advantage for White (eval: 67 centipawns),5. d4 ,4... Bxc4 5. Qxc4 c5 6. c3 Nc6 7. O-O Rc8 8. Qa4 Qd7 9. Qd1 Nf6 10. Re1 Be7 11. d4 cxd4 12. cxd4 Bd8 13. Nc3 h6 14. dxe5 dxe5 15. Nd5 Qe6 16. Qb3 Rb8 17. h3 O-O 18. Nxf6+ Qxf6 19. Be3 Re8 
"Actually, 11. ... gxh5 12. Bxd8 Kxd8 would have won a piece. Would've went a long way to help black win the game.",True, The comment accurately describes a potential tactical error leading to a weakened position.,1. e4 e5 2. Nf3 d6 3. Bc4 Be6 4. Qe2 a6 5. Nc3 b5 6. Bd5 c6 7. Bxe6 fxe6 8. d4 exd4 9. Nxd4 e5 10. Qh5+ g6 11. Bg5 Nf6,This is a game between W29 (as White) and B29 (as Black). Last move played: Black plays Knight to f6,Advantage for White (eval: 67 centipawns),12. Qf3 Kf7 13. Nb3 Nd7 14. g4 h6 15. Be3 Qe8 16. h4 Qe6 17. Rg1 Kg8 18. g5 hxg5 19. Bxg5 Nh5 20. Na5 Rc8 21. Nb7 Nf4 22. Nd8 Qe8 23. Ne2 Rxd8 24. Bxd8 Qxd8 25. Nxf4 exf4 26. Rxg6+ Kf7 ,11... gxh5 12. Bxd8 exd4 13. Bb6 dxc3 14. Bd4 cxb2 15. Bxb2 Nf6 16. Bxf6 Rg8 17. a4 b4 18. f4 Nd7 19. Bb2 O-O-O 20. O-O-O Nc5 21. g3 Nxe4 22. f5 Bh6+ 23. Kb1 Bg5 24. Rhf1 Rgf8 25. Bg7 Nc3+ 26. Bxc3 bxc3 27. Rfe1 Rde8 
