comment,good,reasoning,moves,context,engine_eval,engine_best_line,engine_best_alternative
After jockeying for position we have reached the King's Indian Defense.,True,". The comment suggests a defensive move, potentially indicating a flawed opening choice, thus signaling a mistake.",1. d4 g6 2. c4 Bg7 3. Nc3 d6 4. Nf3 Nf6 5. e4,This is a game between Kouatly (as White) and Kasparov (as Black). Last move played: White plays Pawn to e4,Advantage for White (eval: 58 centipawns),5... O-O 6. h3 ,5. e4 O-O 
"The Petrosian variation so named after former World Champion Tigran Petrosian, who added many new ideas to White's set up.",True, The comment provides context about the move's origin and the player who popularized it.,1. d4 g6 2. c4 Bg7 3. Nc3 d6 4. Nf3 Nf6 5. e4 O-O 6. Be2 e5 7. d5,This is a game between Kouatly (as White) and Kasparov (as Black). Last move played: White plays Pawn to d5,Slight advantage for White (eval: 41 centipawns),7... a5 8. Bg5 h6 9. Be3 Ng4 10. Bd2 Na6 11. h3 Nf6 12. Be3 Nh5 13. g3 f5 14. exf5 gxf5 15. Nxe5 f4 16. gxf4 Nxf4 17. Nd3 Ng2+ 18. Kd2 Bf5 19. Qg1 Nxe3 20. fxe3 Kh8 21. Rf1 Qe7 22. Nf4 Nc5 23. Ng6+ Bxg6 24. Qxg6 Bxc3+ 25. bxc3 Qg5 26. Qxg5 hxg5 ,7. O-O h6 
Played in order to gain space on the queenside.,True," The comment suggests a tactical error, likely trying to create a weak square for the opponent.",1. d4 g6 2. c4 Bg7 3. Nc3 d6 4. Nf3 Nf6 5. e4 O-O 6. Be2 e5 7. d5 a5,This is a game between Kouatly (as White) and Kasparov (as Black). Last move played: Black plays Pawn to a5,Advantage for White (eval: 51 centipawns),8. Bg5 h6 ,7... a5 8. Bg5 h6 9. Be3 Ng4 10. Bd2 Na6 11. h3 Nf6 12. Be3 Nh5 13. g3 f5 14. exf5 gxf5 15. Nxe5 f4 16. gxf4 Nxf4 17. Nd3 Ng2+ 18. Kd2 Bf5 19. Qg1 Nxe3 20. fxe3 Kh8 21. Rf1 Qe7 22. Nf4 Nc5 23. Ng6+ Bxg6 24. Qxg6 Bxc3+ 25. bxc3 Qg5 26. Qxg5 hxg5 
The knight heads towards the White king.,True,". The comment suggests a potential tactical error, indicating the move was poorly conceived.",1. d4 g6 2. c4 Bg7 3. Nc3 d6 4. Nf3 Nf6 5. e4 O-O 6. Be2 e5 7. d5 a5 8. h4 Na6 9. Nd2 Nc5 10. g4 a4 11. h5 gxh5 12. g5 Ng4,This is a game between Kouatly (as White) and Kasparov (as Black). Last move played: Black plays Knight to g4,Large advantage for White (eval: 139 centipawns),13. Nf1 f5 14. f3 Qe8 15. fxg4 hxg4 16. Be3 Qg6 17. Rc1 Bd7 18. Rc2 Rf7 19. Rd2 Raf8 20. Bxc5 dxc5 21. d6 Qxg5 22. dxc7 ,12... Ne8 
The opening of the f-file with White's king remaining in the center signals that my opponent has done something wrong.,True," The comment suggests the opponent's move is flawed, indicating a potential tactical or strategic error.",1. d4 g6 2. c4 Bg7 3. Nc3 d6 4. Nf3 Nf6 5. e4 O-O 6. Be2 e5 7. d5 a5 8. h4 Na6 9. Nd2 Nc5 10. g4 a4 11. h5 gxh5 12. g5 Ng4 13. Nf1 f5,This is a game between Kouatly (as White) and Kasparov (as Black). Last move played: Black plays Pawn to f5,Large advantage for White (eval: 121 centipawns),14. f3 fxe4 15. fxg4 Bxg4 16. Bxg4 Nd3+ 17. Kd2 Qxg5+ 18. Kc2 Qxg4 19. Qxg4 Nb4+ 20. Kb1 hxg4 21. a3 Nd3 22. Be3 Nf4 23. Ka2 Nh3 24. c5 dxc5 25. Bxc5 Rf3 26. Nd2 b6 ,13... f5 14. f3 fxe4 15. fxg4 Bxg4 16. Bxg4 Nd3+ 17. Kd2 Qxg5+ 18. Kc2 Qxg4 19. Qxg4 hxg4 20. Be3 Nf2 21. Rh2 Nh3 22. Nd2 h5 23. Ndxe4 h4 24. Re1 
Black has plen ty of compensation for the piece thanks to White's backward development.,True," The comment suggests White has a strong advantage, potentially justifying the move as a strategic mistake.",1. d4 g6 2. c4 Bg7 3. Nc3 d6 4. Nf3 Nf6 5. e4 O-O 6. Be2 e5 7. d5 a5 8. h4 Na6 9. Nd2 Nc5 10. g4 a4 11. h5 gxh5 12. g5 Ng4 13. Nf1 f5 14. f3 Nf2 15. Kxf2 fxe4,This is a game between Kouatly (as White) and Kasparov (as Black). Last move played: Black plays Pawn takes on e4,Large advantage for White (eval: 170 centipawns),16. Be3 Bf5 ,15... fxe4 16. Be3 
White's pieces have lost communication with one another.,True," Yes, the comment suggests a lack of coordination between white's pieces, indicating a flawed move.",1. d4 g6 2. c4 Bg7 3. Nc3 d6 4. Nf3 Nf6 5. e4 O-O 6. Be2 e5 7. d5 a5 8. h4 Na6 9. Nd2 Nc5 10. g4 a4 11. h5 gxh5 12. g5 Ng4 13. Nf1 f5 14. f3 Nf2 15. Kxf2 fxe4 16. Kg2 a3 17. Rxh5 exf3+ 18. Bxf3 e4 19. Be2 Bf5,This is a game between Kouatly (as White) and Kasparov (as Black). Last move played: Black plays Bishop to f5,Large advantage for Black (eval: -135 centipawns),20. Ne3 ,19... Qe8 
Black's remaining piece enters the attack!,True," The comment suggests a potential tactical threat, indicating a misjudgment of the opponent's response.",1. d4 g6 2. c4 Bg7 3. Nc3 d6 4. Nf3 Nf6 5. e4 O-O 6. Be2 e5 7. d5 a5 8. h4 Na6 9. Nd2 Nc5 10. g4 a4 11. h5 gxh5 12. g5 Ng4 13. Nf1 f5 14. f3 Nf2 15. Kxf2 fxe4 16. Kg2 a3 17. Rxh5 exf3+ 18. Bxf3 e4 19. Be2 Bf5 20. Qd2 Bg6 21. Rh3 Qd7 22. Rg3 Qf7 23. Qe1 Rae8,This is a game between Kouatly (as White) and Kasparov (as Black). Last move played: Black plays Rook to e8,Large advantage for Black (eval: -291 centipawns),24. Nh2 Nd3 25. Bxd3 exd3 26. Re3 b5 27. cxb5 Bd4 28. Rxe8 Rxe8 29. Qh4 Bxc3 30. bxc3 d2 31. Bxd2 Qxd5+ 32. Kg1 Qxd2 ,23... Nd3 24. Bxd3 exd3 25. Qe6 Rae8 26. Qxf7+ Rxf7 27. Ne3 d2 28. Bxd2 axb2 29. Re1 Bxc3 30. Bxc3 b1=Q 31. Rxb1 Bxb1 32. Bf6 Bd3 33. Ng4 Bxc4 34. Nh6+ Kf8 35. Nxf7 Bxd5+ 36. Kf2 Kxf7 37. Rg4 Be4 38. Rh4 Bd3 
White is unable to stop the flood of Black's pieces from crashing through on the kingside.,True, The comment suggests a tactical weakness and potential vulnerability to a coordinated attack.,1. d4 g6 2. c4 Bg7 3. Nc3 d6 4. Nf3 Nf6 5. e4 O-O 6. Be2 e5 7. d5 a5 8. h4 Na6 9. Nd2 Nc5 10. g4 a4 11. h5 gxh5 12. g5 Ng4 13. Nf1 f5 14. f3 Nf2 15. Kxf2 fxe4 16. Kg2 a3 17. Rxh5 exf3+ 18. Bxf3 e4 19. Be2 Bf5 20. Qd2 Bg6 21. Rh3 Qd7 22. Rg3 Qf7 23. Qe1 Rae8 24. Be3 Nd3 25. Qd2 axb2 26. Rb1 Be5,This is a game between Kouatly (as White) and Kasparov (as Black). Last move played: Black plays Bishop to e5,Large advantage for Black (eval: -246 centipawns),27. Bg4 Bf5 28. Be2 Qg7 29. Nd1 Bg6 30. a4 Nf4+ 31. Kg1 Nxe2+ 32. Qxe2 Rxf1+ 33. Qxf1 Bxg3 34. Rxb2 Bh5 35. Qh3 Bxd1 36. Rxb7 Be5 37. a5 Bf3 38. a6 Rf8 39. Qe6+ Qf7 40. Qxf7+ Kxf7 41. Rxc7+ Kg6 ,26... Be5 27. Bg4 Bf5 28. Be2 Qg7 29. Nd1 Bg6 30. Rg4 Ra8 31. Ng3 Rxa2 32. Bxd3 exd3 33. Bf4 Ra1 34. Bxe5 Qxe5 35. Qxb2 Qxb2+ 36. Rxb2 Rxd1 37. Rxb7 Rd2+ 
This clearance move allows Black's bishop on g6 to enter as well.,True," The comment clarifies that Black's bishop is attacking a crucial square, indicating a flawed strategic decision.",1. d4 g6 2. c4 Bg7 3. Nc3 d6 4. Nf3 Nf6 5. e4 O-O 6. Be2 e5 7. d5 a5 8. h4 Na6 9. Nd2 Nc5 10. g4 a4 11. h5 gxh5 12. g5 Ng4 13. Nf1 f5 14. f3 Nf2 15. Kxf2 fxe4 16. Kg2 a3 17. Rxh5 exf3+ 18. Bxf3 e4 19. Be2 Bf5 20. Qd2 Bg6 21. Rh3 Qd7 22. Rg3 Qf7 23. Qe1 Rae8 24. Be3 Nd3 25. Qd2 axb2 26. Rb1 Be5 27. Rg4 Nf4+ 28. Bxf4 e3,This is a game between Kouatly (as White) and Kasparov (as Black). Last move played: Black plays Pawn to e3,Large advantage for Black (eval: -210 centipawns),29. Qe1 Bxb1 30. Qxb1 Bxf4 31. Nd1 Be5 32. Ng3 Bxg3 33. Rxg3 Qg7 34. c5 Qe5 35. cxd6 cxd6 36. g6 h5 37. g7 Rf7 38. Qxb2 Qxb2 39. Nxb2 ,28... e3 29. Qe1 Bxb1 30. Qxb1 Bxf4 31. Ng3 Bxg3 32. Rxg3 Qf2+ 33. Kh3 Rf4 34. c5 Re5 35. cxd6 cxd6 36. a3 b6 37. g6 h5 38. g7 Ref5 39. Qxb2 
White resigned since the further loss of material is unavoidable.,True," The comment clearly indicates a loss of material, suggesting a flawed strategic decision.",1. d4 g6 2. c4 Bg7 3. Nc3 d6 4. Nf3 Nf6 5. e4 O-O 6. Be2 e5 7. d5 a5 8. h4 Na6 9. Nd2 Nc5 10. g4 a4 11. h5 gxh5 12. g5 Ng4 13. Nf1 f5 14. f3 Nf2 15. Kxf2 fxe4 16. Kg2 a3 17. Rxh5 exf3+ 18. Bxf3 e4 19. Be2 Bf5 20. Qd2 Bg6 21. Rh3 Qd7 22. Rg3 Qf7 23. Qe1 Rae8 24. Be3 Nd3 25. Qd2 axb2 26. Rb1 Be5 27. Rg4 Nf4+ 28. Bxf4 e3 29. Bxe3 Bxc3 30. Qxc3 Bxb1 31. Rf4 Rxe3,This is a game between Kouatly (as White) and Kasparov (as Black). Last move played: Black plays Rook takes on e3,Large advantage for Black (eval: -710 centipawns),32. Qxe3 Qxf4 33. Qxf4 Rxf4 34. Nd2 Bf5 35. g6 Bxg6 36. c5 dxc5 37. a4 Rd4 38. Nb3 Kg7 39. a5 Rxd5 40. Bf3 Rg5+ 41. Kf2 b1=R 42. Nd2 Rb2 43. Ke1 Re5+ 44. Kd1 ,31... Rxe3 32. Qxe3 Qxf4 33. Qxf4 Rxf4 34. Nd2 Bxa2 35. Bf3 b1=Q 36. Nxb1 Bxb1 37. c5 dxc5 38. Kf2 Kg7 39. Ke3 Rb4 40. Bh5 Be4 41. Bg4 Kg6 42. Be6 Bf5 43. Kd2 Bxe6 44. Kc3 Bxd5 
"The Petrosian variation so named after former World Champion Tigran Petrosian, who added many new ideas to White's set up.",True, The comment accurately describes a move that undermines the strategic goal of a draw.,1. d4 g6 2. c4 Bg7 3. Nc3 d6 4. Nf3 Nf6 5. e4 O-O 6. Be2 e5 7. d5,This is a game between Kouatly (as White) and Kasparov (as Black). Last move played: White plays Pawn to d5,Slight advantage for White (eval: 41 centipawns),7... a5 8. Bg5 h6 9. Be3 Ng4 10. Bd2 Na6 11. h3 Nf6 12. Be3 Nh5 13. g3 f5 14. exf5 gxf5 15. Nxe5 f4 16. gxf4 Nxf4 17. Nd3 Ng2+ 18. Kd2 Bf5 19. Qg1 Nxe3 20. fxe3 Kh8 21. Rf1 Qe7 22. Nf4 Nc5 23. Ng6+ Bxg6 24. Qxg6 Bxc3+ 25. bxc3 Qg5 26. Qxg5 hxg5 ,7. O-O h6 
After jockeying for position we have reached the King's Indian Defense.,True," The comment offers a valid point about the king’s vulnerability, suggesting a potential weakness in White’s opening plan.",1. d4 g6 2. c4 Bg7 3. Nc3 d6 4. Nf3 Nf6 5. e4,This is a game between Kouatly (as White) and Kasparov (as Black). Last move played: White plays Pawn to e4,Advantage for White (eval: 58 centipawns),5... O-O 6. h3 ,5. e4 O-O 
"The Petrosian variation so named after former World Champion Tigran Petrosian, who added many new ideas to White's set up.",True," Yes, the comment suggests a poor opening choice that led to a tactical blunder.",1. d4 g6 2. c4 Bg7 3. Nc3 d6 4. Nf3 Nf6 5. e4 O-O 6. Be2 e5 7. d5,This is a game between Kouatly (as White) and Kasparov (as Black). Last move played: White plays Pawn to d5,Slight advantage for White (eval: 41 centipawns),7... a5 8. Bg5 h6 9. Be3 Ng4 10. Bd2 Na6 11. h3 Nf6 12. Be3 Nh5 13. g3 f5 14. exf5 gxf5 15. Nxe5 f4 16. gxf4 Nxf4 17. Nd3 Ng2+ 18. Kd2 Bf5 19. Qg1 Nxe3 20. fxe3 Kh8 21. Rf1 Qe7 22. Nf4 Nc5 23. Ng6+ Bxg6 24. Qxg6 Bxc3+ 25. bxc3 Qg5 26. Qxg5 hxg5 ,7. O-O h6 
After jockeying for position we have reached the King's Indian Defense.,True," Yes, the comment suggests a tactical weakness, indicating a flawed move.",1. d4 g6 2. c4 Bg7 3. Nc3 d6 4. Nf3 Nf6 5. e4,This is a game between Kouatly (as White) and Kasparov (as Black). Last move played: White plays Pawn to e4,Advantage for White (eval: 58 centipawns),5... O-O 6. h3 ,5. e4 O-O 
