comment,good,reasoning,moves,context,reformulated
Nh4 (move 11) can be played anytime now.,True,"

The comment indicates that the move Nh4 was played at move 11, implying that the player made a mistake by playing this move earlier than it was suggested, which could have been critical to the game's outcome.",1. Nf3 d5 2. c4 c6 3. b3 Nf6 4. g3 Bf5 5. Bg2 Nbd7 6. cxd5 cxd5 7. Bb2 e6,"This is a game between Heinze, B. (as White) and Savage, D J. (as Black). Last move played: Black plays Pawn to e6", White's Nh4 (move 11) is a risky choice that can lead to weakening their kingside defense.
"This move forces some sort of Knight for Bishop exchange, leaving me with doubled and/or isolated pawns. I try and pick the least unatractive option.",True,"

The comment accurately explains the mistake made by the player as it highlights the potential downsides of the move, specifically mentioning the forced exchange of a Knight for a Bishop, and the resulting doubled and/or isolated pawns, which are typically disadvantageous in chess.",1. Nf3 d5 2. c4 c6 3. b3 Nf6 4. g3 Bf5 5. Bg2 Nbd7 6. cxd5 cxd5 7. Bb2 e6 8. Nc3 Bb4 9. O-O O-O 10. Rc1 Rc8 11. Nh4,"This is a game between Heinze, B. (as White) and Savage, D J. (as Black). Last move played: White plays Knight to h4", 'Forceful move with a Knight to h4 by White can lead to doubled or isolated pawns. It's a risky play that leaves Black with a less favorable position.'
Rose tinted spectacle time. Nice would be Nxe4 dxe4 uniting my pawns. Even better d3 and Nxc3 wins a piece. But...,True,"

The comment correctly identifies the mistake made by the player, explaining the potential for a better strategic positioning of the pieces and the risk of losing material.",1. Nf3 d5 2. c4 c6 3. b3 Nf6 4. g3 Bf5 5. Bg2 Nbd7 6. cxd5 cxd5 7. Bb2 e6 8. Nc3 Bb4 9. O-O O-O 10. Rc1 Rc8 11. Nh4 Nb6 12. Nxf5 exf5 13. e3 Ne4,"This is a game between Heinze, B. (as White) and Savage, D J. (as Black). Last move played: Black plays Knight to e4"," White played Nxe4, which seems strong at first but can be dangerous as it exposes the e4 pawn and White's position may become vulnerable. After Black's dxe4, White's plan with d3 could win a piece, as Nxc3 followed by Bxc3 and d4 could put pressure on Black. However, the move might still be risky depending on Black's response."
So much for strategy and tactics. I need some good ideas quickly now: the obvious g6 Qh6 leaves an Nxe4 mate threat. Why not get rid of the Knight?,True,"

The comment accurately explains the mistake made by the player, as the move g6 allows for a tactical threat of Nxe4 mate, which could have been avoided by simply removing the knight.",1. Nf3 d5 2. c4 c6 3. b3 Nf6 4. g3 Bf5 5. Bg2 Nbd7 6. cxd5 cxd5 7. Bb2 e6 8. Nc3 Bb4 9. O-O O-O 10. Rc1 Rc8 11. Nh4 Nb6 12. Nxf5 exf5 13. e3 Ne4 14. Qh5,"This is a game between Heinze, B. (as White) and Savage, D J. (as Black). Last move played: White plays Queen to h5"," ""The move played, Nxe4, was not advisable because it allows the queen on h5 to deliver a checkmate threat. It's recommended to consider alternative moves."""
The threat of Ne2+ forces White to capture the Knight. This option leaves a fight for the long diagonal. The alternative Bxc3 Bxc3 dxc3 destroys White's threat.,True,"

The comment accurately explains the mistake by highlighting the consequences of capturing the Knight with Ne2+ and suggesting a better alternative move.",1. Nf3 d5 2. c4 c6 3. b3 Nf6 4. g3 Bf5 5. Bg2 Nbd7 6. cxd5 cxd5 7. Bb2 e6 8. Nc3 Bb4 9. O-O O-O 10. Rc1 Rc8 11. Nh4 Nb6 12. Nxf5 exf5 13. e3 Ne4 14. Qh5 Nxc3 15. dxc3,"This is a game between Heinze, B. (as White) and Savage, D J. (as Black). Last move played: White plays Pawn takes on c3"," ""Capturing the Knight with Ne2+ was a bad move for White. It opens up a strong counter-attack for Black on the long diagonal."""
# Now the problem is to deal withcxb4 (move it?) or c4. Time to break all th rules of sensible places for a Queen (ie. get desperate).,True,"

The comment explains the mistake made by the player as it suggests a potential blunder in moving the queen to an unconventional and risky square.",1. Nf3 d5 2. c4 c6 3. b3 Nf6 4. g3 Bf5 5. Bg2 Nbd7 6. cxd5 cxd5 7. Bb2 e6 8. Nc3 Bb4 9. O-O O-O 10. Rc1 Rc8 11. Nh4 Nb6 12. Nxf5 exf5 13. e3 Ne4 14. Qh5 Nxc3 15. dxc3 g6 16. Qh6,"This is a game between Heinze, B. (as White) and Savage, D J. (as Black). Last move played: White plays Queen to h6"," '# The problem now is to consider moving the Queen to either cxb4 or c4. This move goes against conventional chess strategy, as it puts the Queen in a vulnerable position. It's time for White to avoid reckless play.'"
"White attempts to win a piece (as the game) by cxb3. But it is a position of who ""gets there firstest with the mostest"".",True,"

The comment accurately explains the mistake made by the player, as it highlights the aggressive intent to win a piece but acknowledges that the move is not sound in the given position.",1. Nf3 d5 2. c4 c6 3. b3 Nf6 4. g3 Bf5 5. Bg2 Nbd7 6. cxd5 cxd5 7. Bb2 e6 8. Nc3 Bb4 9. O-O O-O 10. Rc1 Rc8 11. Nh4 Nb6 12. Nxf5 exf5 13. e3 Ne4 14. Qh5 Nxc3 15. dxc3 g6 16. Qh6 Qf6 17. Rc2,"This is a game between Heinze, B. (as White) and Savage, D J. (as Black). Last move played: White plays Rook to c2"," Black responds with cxb3, a risky attempt to gain material. However, it's a game of timing and strategic positioning; White's move allows Black to maintain a strong defensive setup."
"White declines the Bishop exchange, while setting up another mate threat.",True,"

The comment correctly identifies the mistake made by White in declining a bishop exchange that could have improved their position and possibly led to a tactical advantage.",1. Nf3 d5 2. c4 c6 3. b3 Nf6 4. g3 Bf5 5. Bg2 Nbd7 6. cxd5 cxd5 7. Bb2 e6 8. Nc3 Bb4 9. O-O O-O 10. Rc1 Rc8 11. Nh4 Nb6 12. Nxf5 exf5 13. e3 Ne4 14. Qh5 Nxc3 15. dxc3 g6 16. Qh6 Qf6 17. Rc2 Bxc3 18. Ba3,"This is a game between Heinze, B. (as White) and Savage, D J. (as Black). Last move played: White plays Bishop to a3"," White declined the Bishop exchange, opting for a positional threat instead."
Time to give up the isolated pawn.,True,"

The comment ""Time to give up the isolated pawn"" indicates that the player's move resulted in a pawn that is separated from its allies and has limited mobility, which typically makes it a weakness and an easy target for the opponent.",1. Nf3 d5 2. c4 c6 3. b3 Nf6 4. g3 Bf5 5. Bg2 Nbd7 6. cxd5 cxd5 7. Bb2 e6 8. Nc3 Bb4 9. O-O O-O 10. Rc1 Rc8 11. Nh4 Nb6 12. Nxf5 exf5 13. e3 Ne4 14. Qh5 Nxc3 15. dxc3 g6 16. Qh6 Qf6 17. Rc2 Bxc3 18. Ba3 Rfd8 19. Rfc1 Be5,"This is a game between Heinze, B. (as White) and Savage, D J. (as Black). Last move played: Black plays Bishop to e5", 'Black's last move could be considered a strategic error due to the weakening of their pawn structure.
Nd6 fails to Rc7.,True,"

The comment explains the mistake as it indicates that the move Nd6 does not create the necessary pressure on the c-file by not allowing the opponent's rook on c7 to be exchanged, which would open up the c-file for potential attack.",1. Nf3 d5 2. c4 c6 3. b3 Nf6 4. g3 Bf5 5. Bg2 Nbd7 6. cxd5 cxd5 7. Bb2 e6 8. Nc3 Bb4 9. O-O O-O 10. Rc1 Rc8 11. Nh4 Nb6 12. Nxf5 exf5 13. e3 Ne4 14. Qh5 Nxc3 15. dxc3 g6 16. Qh6 Qf6 17. Rc2 Bxc3 18. Ba3 Rfd8 19. Rfc1 Be5 20. Rxc8 Nxc8 21. Bxd5 b6 22. Rc6 Qg7,"This is a game between Heinze, B. (as White) and Savage, D J. (as Black). Last move played: Black plays Queen to g7"," The move Nd6 does not secure the crucial position needed for Rc7, which would have been strong for Black."
"# I'm still wrigling like the proverbial worm, but what now? Not Rxd5 as Rxc8 while if Re8 then Qc4 looks nasty.",True,"

The comment correctly identifies the mistake made by the player, suggesting that moving the rook to c8 (Rxc8) would allow the opponent's queen to penetrate the position. The alternative move Re8 followed by Qc4 would pose a significant threat to the player's position.",1. Nf3 d5 2. c4 c6 3. b3 Nf6 4. g3 Bf5 5. Bg2 Nbd7 6. cxd5 cxd5 7. Bb2 e6 8. Nc3 Bb4 9. O-O O-O 10. Rc1 Rc8 11. Nh4 Nb6 12. Nxf5 exf5 13. e3 Ne4 14. Qh5 Nxc3 15. dxc3 g6 16. Qh6 Qf6 17. Rc2 Bxc3 18. Ba3 Rfd8 19. Rfc1 Be5 20. Rxc8 Nxc8 21. Bxd5 b6 22. Rc6 Qg7 23. Qh4,"This is a game between Heinze, B. (as White) and Savage, D J. (as Black). Last move played: White plays Queen to h4"," Heinze (White) is in a tricky spot, but the move Qh4 isn't the best choice. If Black captures the rook, it's better for Black to recapture with the e-pawn (Re8), leading to White's queen being attacked and potentially moving to a dangerous square like c4."
"Rxf6 better for White, when if Rxd5, Rc6 wins for White, but g5 might save Black. Now I can win a piece.",True,"

The comment does accurately explain that making the move ""Rxf6"" would have been a better option, as it would have led to a more advantageous position for White, while ""Rxd5"" allows Black to win a piece.",1. Nf3 d5 2. c4 c6 3. b3 Nf6 4. g3 Bf5 5. Bg2 Nbd7 6. cxd5 cxd5 7. Bb2 e6 8. Nc3 Bb4 9. O-O O-O 10. Rc1 Rc8 11. Nh4 Nb6 12. Nxf5 exf5 13. e3 Ne4 14. Qh5 Nxc3 15. dxc3 g6 16. Qh6 Qf6 17. Rc2 Bxc3 18. Ba3 Rfd8 19. Rfc1 Be5 20. Rxc8 Nxc8 21. Bxd5 b6 22. Rc6 Qg7 23. Qh4 Bf6 24. Bb2,"This is a game between Heinze, B. (as White) and Savage, D J. (as Black). Last move played: White plays Bishop to b2"," The move Rxf6 was not advantageous for White; if Black responds with Rxd5, White can win a piece. However, the move g5 might save Black from a disadvantageous position."
Not Bxb2 when Qxd8.,True,"

The comment indicates that the player made a mistake by playing Qxd8 instead of Bxb2, which suggests it addresses the error made in the previously played move.",1. Nf3 d5 2. c4 c6 3. b3 Nf6 4. g3 Bf5 5. Bg2 Nbd7 6. cxd5 cxd5 7. Bb2 e6 8. Nc3 Bb4 9. O-O O-O 10. Rc1 Rc8 11. Nh4 Nb6 12. Nxf5 exf5 13. e3 Ne4 14. Qh5 Nxc3 15. dxc3 g6 16. Qh6 Qf6 17. Rc2 Bxc3 18. Ba3 Rfd8 19. Rfc1 Be5 20. Rxc8 Nxc8 21. Bxd5 b6 22. Rc6 Qg7 23. Qh4 Bf6 24. Bb2 Bxh4,"This is a game between Heinze, B. (as White) and Savage, D J. (as Black). Last move played: Black plays Bishop takes on h4"," ""White's decision to not capture the bishop on b2 is a poor choice. By playing Qxd8, White misses the opportunity to simplify the position and potentially gain material advantage."""
If gxh4 Ne7 forks Bishop and Rook.,True,"
The comment correctly identifies that moving the pawn to g6 (gxh4) would allow the opponent's knight at e7 to fork the player's bishop and rook on f4 and h4, making it a tactical blunder.",1. Nf3 d5 2. c4 c6 3. b3 Nf6 4. g3 Bf5 5. Bg2 Nbd7 6. cxd5 cxd5 7. Bb2 e6 8. Nc3 Bb4 9. O-O O-O 10. Rc1 Rc8 11. Nh4 Nb6 12. Nxf5 exf5 13. e3 Ne4 14. Qh5 Nxc3 15. dxc3 g6 16. Qh6 Qf6 17. Rc2 Bxc3 18. Ba3 Rfd8 19. Rfc1 Be5 20. Rxc8 Nxc8 21. Bxd5 b6 22. Rc6 Qg7 23. Qh4 Bf6 24. Bb2 Bxh4 25. Bxg7 Kxg7 26. Bc4,"This is a game between Heinze, B. (as White) and Savage, D J. (as Black). Last move played: White plays Bishop to c4"," ""White's move gxh4 is poor as it would allow Black to play Ne7, creating a fork of the Bishop and the Rook."""
If Ba6 Ne7 Re7 Rd1+ leads to an exchange of pawns.,True,"

The comment accurately explains the mistake made by the player, as it shows a sequence of moves that leads to an exchange of pawns, which can be a disadvantageous outcome in a chess game.",1. Nf3 d5 2. c4 c6 3. b3 Nf6 4. g3 Bf5 5. Bg2 Nbd7 6. cxd5 cxd5 7. Bb2 e6 8. Nc3 Bb4 9. O-O O-O 10. Rc1 Rc8 11. Nh4 Nb6 12. Nxf5 exf5 13. e3 Ne4 14. Qh5 Nxc3 15. dxc3 g6 16. Qh6 Qf6 17. Rc2 Bxc3 18. Ba3 Rfd8 19. Rfc1 Be5 20. Rxc8 Nxc8 21. Bxd5 b6 22. Rc6 Qg7 23. Qh4 Bf6 24. Bb2 Bxh4 25. Bxg7 Kxg7 26. Bc4 Bf6 27. Rc7,"This is a game between Heinze, B. (as White) and Savage, D J. (as Black). Last move played: White plays Rook to c7"," White's move of Rook to c7 is tactically weak. It allows Black to play bishop to a6, potentially leading to a dangerous exchange on h2 that could give Black a strong positional advantage."
If Rxa7 Nxc4 bxc4 Rd1+ will regain the pawn. It is most enjoyable watching White wriggle for a change.,True,"

The comment accurately explains the mistake by highlighting the alternative move (Rxa7 Nxc4 bxc4 Rd1+) that would have allowed the player to regain the pawn, thus showing that the original move was indeed a mistake.",1. Nf3 d5 2. c4 c6 3. b3 Nf6 4. g3 Bf5 5. Bg2 Nbd7 6. cxd5 cxd5 7. Bb2 e6 8. Nc3 Bb4 9. O-O O-O 10. Rc1 Rc8 11. Nh4 Nb6 12. Nxf5 exf5 13. e3 Ne4 14. Qh5 Nxc3 15. dxc3 g6 16. Qh6 Qf6 17. Rc2 Bxc3 18. Ba3 Rfd8 19. Rfc1 Be5 20. Rxc8 Nxc8 21. Bxd5 b6 22. Rc6 Qg7 23. Qh4 Bf6 24. Bb2 Bxh4 25. Bxg7 Kxg7 26. Bc4 Bf6 27. Rc7 Nd6 28. Bd5,"This is a game between Heinze, B. (as White) and Savage, D J. (as Black). Last move played: White plays Bishop to d5"," The move Rxa7 by Black is a mistake because it allows White to regain material with Rd1+, which is a strong response for White."
"Aiming for Ba3 to free my Rook, and also block the a pawn. # White has no good moves left, eg if Rc6 Nc8 Rc7 Rxd5. He tries to disrupt my kingside pawns.",True,"

The comment accurately explains the mistake by highlighting the intended purpose of the move (freeing the rook and blocking the a-pawn), and also discusses the potential counterplay by the opponent.",1. Nf3 d5 2. c4 c6 3. b3 Nf6 4. g3 Bf5 5. Bg2 Nbd7 6. cxd5 cxd5 7. Bb2 e6 8. Nc3 Bb4 9. O-O O-O 10. Rc1 Rc8 11. Nh4 Nb6 12. Nxf5 exf5 13. e3 Ne4 14. Qh5 Nxc3 15. dxc3 g6 16. Qh6 Qf6 17. Rc2 Bxc3 18. Ba3 Rfd8 19. Rfc1 Be5 20. Rxc8 Nxc8 21. Bxd5 b6 22. Rc6 Qg7 23. Qh4 Bf6 24. Bb2 Bxh4 25. Bxg7 Kxg7 26. Bc4 Bf6 27. Rc7 Nd6 28. Bd5 a5 29. Kg2 Bb2,"This is a game between Heinze, B. (as White) and Savage, D J. (as Black). Last move played: Black plays Bishop to b2"," Heinze (White) isn't improving their position by trying to free their Rook with Ba3 and blocking the a pawn. This move doesn't support their strategy well, as if Black counters with Nc8, followed by Rc7 and Rxd5, White's attempt to disrupt Black's kingside pawns proves ineffective."
"This allows me to exchange Rooks, while if White plays Rd7, Ba3 and Black's Rook is free.",True,"

The comment accurately explains the mistake made by the player, as it highlights the strategic advantage of exchanging Rooks and the potential threat if White plays Rd7, Ba3, and Black's Rook becomes free.",1. Nf3 d5 2. c4 c6 3. b3 Nf6 4. g3 Bf5 5. Bg2 Nbd7 6. cxd5 cxd5 7. Bb2 e6 8. Nc3 Bb4 9. O-O O-O 10. Rc1 Rc8 11. Nh4 Nb6 12. Nxf5 exf5 13. e3 Ne4 14. Qh5 Nxc3 15. dxc3 g6 16. Qh6 Qf6 17. Rc2 Bxc3 18. Ba3 Rfd8 19. Rfc1 Be5 20. Rxc8 Nxc8 21. Bxd5 b6 22. Rc6 Qg7 23. Qh4 Bf6 24. Bb2 Bxh4 25. Bxg7 Kxg7 26. Bc4 Bf6 27. Rc7 Nd6 28. Bd5 a5 29. Kg2 Bb2 30. f3 Rc8 31. Rc6,"This is a game between Heinze, B. (as White) and Savage, D J. (as Black). Last move played: White plays Rook to c6"," ""This move allows Black to exchange Rooks, which is a strategic disadvantage if White plays Rd7, Ba3, and Black's Rook becomes free."""
And White has no viable options left.,True,"

The comment appropriately identifies that the player has made a mistake, leaving themselves in a position with no viable options.",1. Nf3 d5 2. c4 c6 3. b3 Nf6 4. g3 Bf5 5. Bg2 Nbd7 6. cxd5 cxd5 7. Bb2 e6 8. Nc3 Bb4 9. O-O O-O 10. Rc1 Rc8 11. Nh4 Nb6 12. Nxf5 exf5 13. e3 Ne4 14. Qh5 Nxc3 15. dxc3 g6 16. Qh6 Qf6 17. Rc2 Bxc3 18. Ba3 Rfd8 19. Rfc1 Be5 20. Rxc8 Nxc8 21. Bxd5 b6 22. Rc6 Qg7 23. Qh4 Bf6 24. Bb2 Bxh4 25. Bxg7 Kxg7 26. Bc4 Bf6 27. Rc7 Nd6 28. Bd5 a5 29. Kg2 Bb2 30. f3 Rc8 31. Rc6 Rxc6 32. Bxc6 Ba3 33. Kf2 h5,"This is a game between Heinze, B. (as White) and Savage, D J. (as Black). Last move played: Black plays Pawn to h5", The move was poor because White has no good choices.
