comment,good,reasoning,moves,context,reformulated
Controlling the center.,False,"

The comment does not explain the mistake as it does not provide any information on why controlling the center was not achieved or how it relates to the specific move played.",1. d4,This is a game between Pillsbury (as White) and Marco (as Black). Last move played: White plays Pawn to d4,-
The queen's gambit. If Black plays 2... dxc4 White will eventually win back the pawn.,True,"

The comment explains the mistake because it describes the consequences of the move, which is the potential loss of the pawn and the eventual gain of it for White.",1. d4 d5 2. c4,This is a game between Pillsbury (as White) and Marco (as Black). Last move played: White plays Pawn to c4, Black's queen's gambit. They risk losing a pawn if they accept the offer.
The classical way to decline the gambit.,True,"

The comment accurately describes the mistake made by the player, suggesting a failure to correctly respond to a gambit by not declining it.",1. d4 d5 2. c4 e6,This is a game between Pillsbury (as White) and Marco (as Black). Last move played: Black plays Pawn to e6," After Black's last move to e6, they declined the gambit. This move is considered bad for several reasons. First, it doesn't develop a piece, which is a key principle in the opening phase of chess. Instead, it simply moves a pawn without gaining tactical or strategic advantage. Furthermore, e6 doesn't contribute to controlling the center of the board, another vital aspect of opening strategy. Lastly, the move doesn't prepare for castling, a move essential for the safety of the king."
Developing and putting pressure on d5.,False,"

The comment does not explain the mistake made by the player, as ""developing and putting pressure on d5"" refers to a correct or strategic move in chess, not a mistake.",1. d4 d5 2. c4 e6 3. Nc3,This is a game between Pillsbury (as White) and Marco (as Black). Last move played: White plays Knight to c3,-
Developing and defending d5.,False,"

The comment does not explain the mistake as it only mentions the strategy of developing and defending the d5 square without addressing the specific error made in the move.",1. d4 d5 2. c4 e6 3. Nc3 Nf6,This is a game between Pillsbury (as White) and Marco (as Black). Last move played: Black plays Knight to f6,-
Pinning the knight and putting more pressure on d5. Pillsbury was the first to demonstrate this is the best move.,True,"
The comment accurately explains the mistake made by the player as it identifies the specific tactical approach (pinning the knight and applying pressure on d5) that was not executed, and references a historical game (Pillsbury) to support the effectiveness of the correct move.",1. d4 d5 2. c4 e6 3. Nc3 Nf6 4. Bg5,This is a game between Pillsbury (as White) and Marco (as Black). Last move played: White plays Bishop to g5," This move by White did not effectively pin the knight and increased the pressure on d5, which was a mistake."
Breaking the pin.,False,"

The comment ""Breaking the pin"" does not explain the mistake, as it references an action that would be taken to correct the situation, not describe the error in the move.",1. d4 d5 2. c4 e6 3. Nc3 Nf6 4. Bg5 Be7,This is a game between Pillsbury (as White) and Marco (as Black). Last move played: Black plays Bishop to e7,-
Getting the king out of the center.,False,"

The comment does not explain the mistake as it only mentions a general strategy of not having the king out in the center, but does not address the specific move played.",1. d4 d5 2. c4 e6 3. Nc3 Nf6 4. Bg5 Be7 5. e3 O-O,This is a game between Pillsbury (as White) and Marco (as Black). Last move played: Black plays kingside castle,-
The bishop will be developed on b7.,True,"

The comment explains the mistake by predicting the player's ineffective use of the bishop, which could be a missed opportunity to develop the piece more actively or control key positions.",1. d4 d5 2. c4 e6 3. Nc3 Nf6 4. Bg5 Be7 5. e3 O-O 6. Nf3 b6,This is a game between Pillsbury (as White) and Marco (as Black). Last move played: Black plays Pawn to b6," The Black's bishop on b7 is left undeveloped, which hinders their piece development and control of the board."
White's pieces are actively placed.,False,"

The comment does not explain the mistake made by the player, as it merely describes the placement of the pieces without addressing the specific error in the move.",1. d4 d5 2. c4 e6 3. Nc3 Nf6 4. Bg5 Be7 5. e3 O-O 6. Nf3 b6 7. Bd3,This is a game between Pillsbury (as White) and Marco (as Black). Last move played: White plays Bishop to d3,-
White must not delay this move or Black will play dxc4 and his bishop will be very active. The recommended move now is 8... Nxd5 followed by 9. Bxe7 Qxe7 10. Nxd5 exd5. Black avoids 10... Bxd5 because of 11. e4 and White would control the center.,True,"

The comment explains the mistake made by the player, suggesting the correct moves for Black after White's poor decision.",1. d4 d5 2. c4 e6 3. Nc3 Nf6 4. Bg5 Be7 5. e3 O-O 6. Nf3 b6 7. Bd3 Bb7 8. cxd5,This is a game between Pillsbury (as White) and Marco (as Black). Last move played: White plays Pawn takes on d5," White should not delay, as Black may play dxc4, activating their bishop. The better move is 8... Nxd5, followed by 9. Bxe7 Qxe7 10. Nxd5 exd5. Black should avoid 10... Bxd5 because White will then control the center with e4."
Knights placed in center squares are very powerful.,False,"

The comment about knights being powerful in the center squares is a general rule and does not directly address the specific mistake made by the player.",1. d4 d5 2. c4 e6 3. Nc3 Nf6 4. Bg5 Be7 5. e3 O-O 6. Nf3 b6 7. Bd3 Bb7 8. cxd5 exd5 9. Ne5,This is a game between Pillsbury (as White) and Marco (as Black). Last move played: White plays Knight to e5,-
This provides strong support for the knight and opens the way for a kingside attack.,False,"

The comment does not explain the mistake, as it praises the move rather than critiquing it.",1. d4 d5 2. c4 e6 3. Nc3 Nf6 4. Bg5 Be7 5. e3 O-O 6. Nf3 b6 7. Bd3 Bb7 8. cxd5 exd5 9. Ne5 Nbd7 10. f4,This is a game between Pillsbury (as White) and Marco (as Black). Last move played: White plays Pawn to f4,-
It is correct to try to undermine the powerful knight by attacking its defenders.,False,"

The comment does not explain the mistake made by the player, it only suggests a possible strategy.",1. d4 d5 2. c4 e6 3. Nc3 Nf6 4. Bg5 Be7 5. e3 O-O 6. Nf3 b6 7. Bd3 Bb7 8. cxd5 exd5 9. Ne5 Nbd7 10. f4 c5,This is a game between Pillsbury (as White) and Marco (as Black). Last move played: Black plays Pawn to c5,-
"A strategic error: Black relieves the tension in the center. Black's queenside attack is no match for White's kingside attack.""",False,"

The comment does not clearly explain the mistake made by the player, as it only states that Black made a strategic error without specifying what that error was or what move led to it.",1. d4 d5 2. c4 e6 3. Nc3 Nf6 4. Bg5 Be7 5. e3 O-O 6. Nf3 b6 7. Bd3 Bb7 8. cxd5 exd5 9. Ne5 Nbd7 10. f4 c5 11. O-O c4,This is a game between Pillsbury (as White) and Marco (as Black). Last move played: Black plays Pawn to c4,-
Preparing for b5.,True,"

The comment ""Preparing for b5"" suggests that the player made a move that weakened their pawn structure or left their king vulnerable, potentially setting up a future weakness on the b5 square.",1. d4 d5 2. c4 e6 3. Nc3 Nf6 4. Bg5 Be7 5. e3 O-O 6. Nf3 b6 7. Bd3 Bb7 8. cxd5 exd5 9. Ne5 Nbd7 10. f4 c5 11. O-O c4 12. Bc2 a6,This is a game between Pillsbury (as White) and Marco (as Black). Last move played: Black plays Pawn to a6, Black's preparation for b5 was not the best choice given the current board position.
Bringing the queen into the attack.,True,"
The comment effectively explains the mistake as it suggests the player's queen was moved aggressively without proper support, potentially making it vulnerable to attack.",1. d4 d5 2. c4 e6 3. Nc3 Nf6 4. Bg5 Be7 5. e3 O-O 6. Nf3 b6 7. Bd3 Bb7 8. cxd5 exd5 9. Ne5 Nbd7 10. f4 c5 11. O-O c4 12. Bc2 a6 13. Qf3,This is a game between Pillsbury (as White) and Marco (as Black). Last move played: White plays Queen to f3, The move to f3 is risky and overextends White's queen too early.
Threatening 15. Nxd7 Qxd7 (if 15... Nxd7 then Qxh7#) 16. Bxh7+ Kh8 (If 16... Nxh7 17. Qxd7) 17. Bf5+ Kg8 18. Bxd7. If Black plays 14... h6 then 15. Bxh6 gxh6 16. Qxh6 Ne4 17. Rf3 Bf6 18. Rg3+ Nxg3 19. Qh7#.,True,"
The comment explains the mistake made by the player as it outlines the tactical sequence leading to checkmate that the player failed to prevent.",1. d4 d5 2. c4 e6 3. Nc3 Nf6 4. Bg5 Be7 5. e3 O-O 6. Nf3 b6 7. Bd3 Bb7 8. cxd5 exd5 9. Ne5 Nbd7 10. f4 c5 11. O-O c4 12. Bc2 a6 13. Qf3 b5 14. Qh3,This is a game between Pillsbury (as White) and Marco (as Black). Last move played: White plays Queen to h3," Black's last move was 14...h6, which White took advantage of with 15. Bxh6. After Black captures on g6 with 15...gxh6, White continues with 16. Qxh6. Black's 17th move, Ne4, allows White to gain a superior position with 18. Rf3. This puts pressure on Black's position and can lead to a winning advantage for White. Black's 19th move does not prevent White's attacking sequence, which culminates in Qh7# checkmate."
To exchange pawns and open the file for the rook on f1.,True,"

This comment accurately explains the mistake made by the player in terms of chess strategy, as exchanging pawns can potentially weaken their pawn structure and open up the file for the opponent's rook to penetrate.",1. d4 d5 2. c4 e6 3. Nc3 Nf6 4. Bg5 Be7 5. e3 O-O 6. Nf3 b6 7. Bd3 Bb7 8. cxd5 exd5 9. Ne5 Nbd7 10. f4 c5 11. O-O c4 12. Bc2 a6 13. Qf3 b5 14. Qh3 g6 15. f5,This is a game between Pillsbury (as White) and Marco (as Black). Last move played: White plays Pawn to f5, 'White's decision to exchange pawns on f5 weakens control over the central files and makes it easier for 'Black' to open the f-file with their rook.'
Black counterattacks on the queenside.,False,"

The comment does not explain the mistake made by the player, as it merely describes a general strategy without addressing the specific error in the move.",1. d4 d5 2. c4 e6 3. Nc3 Nf6 4. Bg5 Be7 5. e3 O-O 6. Nf3 b6 7. Bd3 Bb7 8. cxd5 exd5 9. Ne5 Nbd7 10. f4 c5 11. O-O c4 12. Bc2 a6 13. Qf3 b5 14. Qh3 g6 15. f5 b4,This is a game between Pillsbury (as White) and Marco (as Black). Last move played: Black plays Pawn to b4,-
If 16... bxc3 then 17. Bxf6 Nxf6 18. Rxf6 fxg6 (Not 18... Bxf6 19. Qxh7#) 19. Bxg6 $1 hxg6 20. Rxg6#. If instead 16... fxg6 then 17. Qe6+ Kh8 18. Nxd7 Nxd7 (If 18... Qxd7 then 19. Bxf6+ wins the queen) 19. Bxe7 wins a piece.,True,"

The comment effectively explains the strategic blunder made by the player, outlining the significant threats and material losses that could result from their move.",1. d4 d5 2. c4 e6 3. Nc3 Nf6 4. Bg5 Be7 5. e3 O-O 6. Nf3 b6 7. Bd3 Bb7 8. cxd5 exd5 9. Ne5 Nbd7 10. f4 c5 11. O-O c4 12. Bc2 a6 13. Qf3 b5 14. Qh3 g6 15. f5 b4 16. fxg6,This is a game between Pillsbury (as White) and Marco (as Black). Last move played: White plays Pawn takes on g6," Black's 16... bxc3 leaves White with a winning tactic. After 17. Bxf6, Black responds with 17... Nxf6, but 18. Rxf6 is better than 18... Bxf6 because after 19. Qxh7#, White wins. If Black plays 16... fxg6, then 17. Qe6+ leads to 18. Nxd7, where if Black plays 18... Nxd7, White wins a piece with 19. Bxe7."
If now 17. Ne2 then 17... Ne4 and Black has counterplay.,True,"

The comment accurately explains the mistake, highlighting that after 17. Ne2, Black can play 17... Ne4, creating counterplay and taking advantage of the weakness.",1. d4 d5 2. c4 e6 3. Nc3 Nf6 4. Bg5 Be7 5. e3 O-O 6. Nf3 b6 7. Bd3 Bb7 8. cxd5 exd5 9. Ne5 Nbd7 10. f4 c5 11. O-O c4 12. Bc2 a6 13. Qf3 b5 14. Qh3 g6 15. f5 b4 16. fxg6 hxg6,This is a game between Pillsbury (as White) and Marco (as Black). Last move played: Black plays Pawn takes on g6," The move 17. Ne2 is not advantageous for White. If Black counters with 17... Ne4, White is left with a weakened position."
White keeps the pressure on.,True,"

The comment accurately describes the mistake by highlighting that the player lost control of the game by maintaining pressure that could be used against them.",1. d4 d5 2. c4 e6 3. Nc3 Nf6 4. Bg5 Be7 5. e3 O-O 6. Nf3 b6 7. Bd3 Bb7 8. cxd5 exd5 9. Ne5 Nbd7 10. f4 c5 11. O-O c4 12. Bc2 a6 13. Qf3 b5 14. Qh3 g6 15. f5 b4 16. fxg6 hxg6 17. Qh4,This is a game between Pillsbury (as White) and Marco (as Black). Last move played: White plays Queen to h4," White's decision to move their Queen to h4 puts unnecessary pressure on the board, leaving them vulnerable to attacks from Black."
If 18... Nxd7 then 19. Bxe7 forking the queen and rook.,True,"

The comment accurately explains that after the move 18... Nxd7, Black's knight could be captured by White's dark-squared bishop, resulting in a fork of the queen and rook, which is a significant tactical error.",1. d4 d5 2. c4 e6 3. Nc3 Nf6 4. Bg5 Be7 5. e3 O-O 6. Nf3 b6 7. Bd3 Bb7 8. cxd5 exd5 9. Ne5 Nbd7 10. f4 c5 11. O-O c4 12. Bc2 a6 13. Qf3 b5 14. Qh3 g6 15. f5 b4 16. fxg6 hxg6 17. Qh4 bxc3 18. Nxd7,This is a game between Pillsbury (as White) and Marco (as Black). Last move played: White plays Knight takes on d7," If Black plays Nxd7, White can continue with Bxe7, creating a double threat against the Black queen and rook."
Hoping for 19. Bxf6 Bxf6 10. Qxf6 cxb2,True,"

The comment correctly identifies the critical mistake made by the player, which involves weakening their position early in the game without gaining any material advantage or creating a decisive threat.",1. d4 d5 2. c4 e6 3. Nc3 Nf6 4. Bg5 Be7 5. e3 O-O 6. Nf3 b6 7. Bd3 Bb7 8. cxd5 exd5 9. Ne5 Nbd7 10. f4 c5 11. O-O c4 12. Bc2 a6 13. Qf3 b5 14. Qh3 g6 15. f5 b4 16. fxg6 hxg6 17. Qh4 bxc3 18. Nxd7 Qxd7,This is a game between Pillsbury (as White) and Marco (as Black). Last move played: Black plays Queen takes on d7," After Pillsbury's last move, they may have miscalculated the potential risks associated with the Queen sacrifice. It's risky because it allows Black to counterattack decisively with the Queen and potentially expose White's King to threats, leading to a dangerous position. White should not play the Bxf6 move as it weakens their King's defense and could lead to a position where Black has a significant advantage."
Wonderful move. If 19... Bxf6 then 20. Bxf6 cxb2 21. Qh8#.,False,"

The comment does not directly address or explain the mistake made by the player.",1. d4 d5 2. c4 e6 3. Nc3 Nf6 4. Bg5 Be7 5. e3 O-O 6. Nf3 b6 7. Bd3 Bb7 8. cxd5 exd5 9. Ne5 Nbd7 10. f4 c5 11. O-O c4 12. Bc2 a6 13. Qf3 b5 14. Qh3 g6 15. f5 b4 16. fxg6 hxg6 17. Qh4 bxc3 18. Nxd7 Qxd7 19. Rxf6,This is a game between Pillsbury (as White) and Marco (as Black). Last move played: White plays Rook takes on f6,-
Black will bring his rook to a6 to help with the defense.,False,"

The comment does not explain the mistake made by the player as it only suggests a possible future move without addressing the specific error in the previous move.",1. d4 d5 2. c4 e6 3. Nc3 Nf6 4. Bg5 Be7 5. e3 O-O 6. Nf3 b6 7. Bd3 Bb7 8. cxd5 exd5 9. Ne5 Nbd7 10. f4 c5 11. O-O c4 12. Bc2 a6 13. Qf3 b5 14. Qh3 g6 15. f5 b4 16. fxg6 hxg6 17. Qh4 bxc3 18. Nxd7 Qxd7 19. Rxf6 a5,This is a game between Pillsbury (as White) and Marco (as Black). Last move played: Black plays Pawn to a5,-
Bringing the last inactive piece into the attack. The threat is 21. Bxg6 fxg6 22. Rxg6#.,False,"

The comment only describes the consequences of the move, but it doesn't explain why the move was a mistake; it lacks context about the board position or the player's intentions.",1. d4 d5 2. c4 e6 3. Nc3 Nf6 4. Bg5 Be7 5. e3 O-O 6. Nf3 b6 7. Bd3 Bb7 8. cxd5 exd5 9. Ne5 Nbd7 10. f4 c5 11. O-O c4 12. Bc2 a6 13. Qf3 b5 14. Qh3 g6 15. f5 b4 16. fxg6 hxg6 17. Qh4 bxc3 18. Nxd7 Qxd7 19. Rxf6 a5 20. Raf1,This is a game between Pillsbury (as White) and Marco (as Black). Last move played: White plays Rook to f1,-
Has the rook arrived in time to save the day?,False,"

The comment does not accurately describe the mistake made by the player as it refers to a rook's strategic positioning rather than identifying the specific error.",1. d4 d5 2. c4 e6 3. Nc3 Nf6 4. Bg5 Be7 5. e3 O-O 6. Nf3 b6 7. Bd3 Bb7 8. cxd5 exd5 9. Ne5 Nbd7 10. f4 c5 11. O-O c4 12. Bc2 a6 13. Qf3 b5 14. Qh3 g6 15. f5 b4 16. fxg6 hxg6 17. Qh4 bxc3 18. Nxd7 Qxd7 19. Rxf6 a5 20. Raf1 Ra6,This is a game between Pillsbury (as White) and Marco (as Black). Last move played: Black plays Rook to a6,-
Threatening Qh7#.,True,"

The comment accurately identifies the mistake made by the player, as it points out the potential checkmate threat with the queen moving to h7.",1. d4 d5 2. c4 e6 3. Nc3 Nf6 4. Bg5 Be7 5. e3 O-O 6. Nf3 b6 7. Bd3 Bb7 8. cxd5 exd5 9. Ne5 Nbd7 10. f4 c5 11. O-O c4 12. Bc2 a6 13. Qf3 b5 14. Qh3 g6 15. f5 b4 16. fxg6 hxg6 17. Qh4 bxc3 18. Nxd7 Qxd7 19. Rxf6 a5 20. Raf1 Ra6 21. Bxg6,This is a game between Pillsbury (as White) and Marco (as Black). Last move played: White plays Bishop takes on g6," In the game, White (Pillsbury) made a mistake by playing Bishop to g6. This move allows Black (Marco) to play Qh7, which can lead to checkmate."
and Black resigned. If 25... Kf8 then 26. Qxd7. If 25... Ke8 then 26. Qg8#. If 25... Ke6 then 26. Qxg6#,True,"

The comment accurately describes the sequence of moves leading to Black's resignation, indicating that White has a checkmate threat regardless of Black's defense.",1. d4 d5 2. c4 e6 3. Nc3 Nf6 4. Bg5 Be7 5. e3 O-O 6. Nf3 b6 7. Bd3 Bb7 8. cxd5 exd5 9. Ne5 Nbd7 10. f4 c5 11. O-O c4 12. Bc2 a6 13. Qf3 b5 14. Qh3 g6 15. f5 b4 16. fxg6 hxg6 17. Qh4 bxc3 18. Nxd7 Qxd7 19. Rxf6 a5 20. Raf1 Ra6 21. Bxg6 fxg6 22. Rxf8+ Bxf8 23. Rxf8+ Kxf8 24. Qh8+ Kf7 25. Qh7+,This is a game between Pillsbury (as White) and Marco (as Black). Last move played: White plays Queen to h7 with check," Black's last move was detrimental to their position. They resigned after analyzing their next moves. If Black played 25... Kf8, White could follow up with 26. Qxd7. Alternatively, if Black moved their king to 25... Ke8, White could deliver checkmate with 26. Qg8#. Another poor move by Black, 25... Ke6, would also allow White to checkmate with 26. Qxg6#."
