comment,good,reasoning,moves,context,engine_eval,engine_best_line,engine_best_alternative
"Slav Defense -- It' a simple idea: to capture Pc4 and defend it with ...b7-b5. This requires White to pay attention to his weakness (Pc4) . Ideally, for Black, White would have to play e2-e3, blocking Bc1. The downside is that many of it's variations are quite drawish or difficult for Black to win. At the top level of competition it's enough to stop White and perhaps take the opponent away from the kind of game he wanted to play.",True," The comment identifies a flawed strategic concept and suggests a potentially passive approach, indicating a serious mistake.",1. d4 d5 2. c4 c6,"This is a game between Ivanchuk, Vassily (as White) and Shirov, Alexei (as Black). Last move played: Black plays Pawn to c6",Slight advantage for White (eval: 28 centipawns),3. cxd5 cxd5 4. Nc3 Nf6 5. Bf4 Nc6 6. Nf3 a6 7. e3 Bg4 8. Bd3 e6 9. h3 Bxf3 10. Qxf3 Nb4 11. Bb1 Bd6 12. O-O Bxf4 13. Qxf4 ,2... e6 3. Nf3 
"Black hasn't yet moved Pe7, so there's no pin after Bc1-g5. That makes Black's army more mobile. And, the more developed he becomes the more likely ...dxc4 will succeed.",True," The comment offers a potential explanation for the mistake, suggesting a missed opportunity for a pin.",1. d4 d5 2. c4 c6 3. Nf3 Nf6,"This is a game between Ivanchuk, Vassily (as White) and Shirov, Alexei (as Black). Last move played: Black plays Knight to f6",Slight advantage for White (eval: 29 centipawns),4. Nc3 e6 ,3... e6 4. g3 
This is a poor place for the queen. It weakens Pd4 and could easily become aligned with a ...Bc8-f5.,True," The comment identifies a potential weakness in the queen's position, suggesting a tactical error.",1. d4 d5 2. c4 c6 3. Nf3 Nf6 4. Qc2,"This is a game between Ivanchuk, Vassily (as White) and Shirov, Alexei (as Black). Last move played: White plays Queen to c2",The position is equal,4... dxc4 ,4. Nc3 e6 
"Now White is ready to O-O, so there's little to be gained by maneuvering ...Nc6-b4-c2. With e5 controlled and the king safe White is probably better. Bg7 can't do much except defend Kg8.",True," The comment suggests a potential weakness in White's plan, indicating a flawed assessment of the position.",1. d4 d5 2. c4 c6 3. Nf3 Nf6 4. Qc2 g6 5. cxd5 cxd5 6. Nc3 Bg7 7. Bf4 Nc6 8. e3 O-O 9. Be2,"This is a game between Ivanchuk, Vassily (as White) and Shirov, Alexei (as Black). Last move played: White plays Bishop to e2",The position is equal,9... Nh5 ,9. h3 
"Ivanchuk didn't seem to be in an adventurous mood, but I like that he achieved a draw without the histrionics he sometimes displays.",True," The comment suggests the player’s lack of adventurousness was a factor in the draw, indicating a potential issue with his approach.",1. d4 d5 2. c4 c6 3. Nf3 Nf6 4. Qc2 g6 5. cxd5 cxd5 6. Nc3 Bg7 7. Bf4 Nc6 8. e3 O-O 9. Be2 Ne4 10. O-O Bf5 11. Nh4 Nxc3 12. Qxc3 Be4 13. Nf3,"This is a game between Ivanchuk, Vassily (as White) and Shirov, Alexei (as Black). Last move played: White plays Knight to f3",The position is equal,13... Rc8 14. Qd2 Qa5 15. Rfc1 Qxd2 16. Nxd2 e5 17. dxe5 Nxe5 18. Bxe5 Bxe5 19. Nxe4 dxe4 20. Rxc8 Rxc8 21. Bd1 Bxb2 22. Rb1 Rc1 23. Rxc1 Bxc1 24. Bb3 Ba3 25. g4 Kf8 ,13. Nf3 Rc8 
