comment,good,reasoning,moves,context,engine_eval,engine_best_line,engine_best_alternative
"Although he has exchanged off only one piece, Black can maneuver comfortably here, mainly becaue White has allowed his important King bishop to be traded off. This great reduces White's possibilities for Kingside attack; consequently, Black will eventually gain the intitiative by pressuring White's centre",True," The comment identifies a specific tactical blunder – the trade of a bishop – and explains its consequence, suggesting Black will gain the initiative.",1. d4 Nf6 2. Bg5 d5 3. Nc3 c6 4. e3 Bf5 5. Bd3 Bxd3 6. cxd3 e6 7. Nf3 Be7 8. O-O O-O 9. Rc1 Nbd7 10. e4 h6 11. Bf4 dxe4 12. dxe4 Qa5 13. Qe2 Rfd8 14. a3 Nf8,This is a game between Bogolyubov (as White) and Kramer (as Black). Last move played: Black plays Knight to f8,Slight advantage for White (eval: 34 centipawns),15. Rfd1 ,14... Nf8 15. Rfd1 Ng6 16. Be3 Qh5 17. h3 Rac8 18. Qf1 Qa5 19. Nd2 Qc7 20. g3 Qb8 21. b4 b6 22. Nc4 Qb7 23. h4 Ng4 
protecting the d-pawn indirectly,True,", The comment suggests a defensive move that unintentionally hinders the opponent's pawn structure, indicating a flawed strategic choice.",1. d4 Nf6 2. Bg5 d5 3. Nc3 c6 4. e3 Bf5 5. Bd3 Bxd3 6. cxd3 e6 7. Nf3 Be7 8. O-O O-O 9. Rc1 Nbd7 10. e4 h6 11. Bf4 dxe4 12. dxe4 Qa5 13. Qe2 Rfd8 14. a3 Nf8 15. h3 Ng6 16. Bh2 Rd7 17. Rc2 Nh7 18. Qe3 Rad8 19. Bg3 Ng5 20. Nd2,This is a game between Bogolyubov (as White) and Kramer (as Black). Last move played: White plays Knight to d2,The position is equal,20... Qa6 21. h4 ,20. Nd2 Qa6 
A powerful stroke. Now White's proud centre is under full attack,True," The comment describes a potential tactical advantage, suggesting the move was a mistake due to a resulting threat.",1. d4 Nf6 2. Bg5 d5 3. Nc3 c6 4. e3 Bf5 5. Bd3 Bxd3 6. cxd3 e6 7. Nf3 Be7 8. O-O O-O 9. Rc1 Nbd7 10. e4 h6 11. Bf4 dxe4 12. dxe4 Qa5 13. Qe2 Rfd8 14. a3 Nf8 15. h3 Ng6 16. Bh2 Rd7 17. Rc2 Nh7 18. Qe3 Rad8 19. Bg3 Ng5 20. Nd2 Qb6 21. Ne2 c5,This is a game between Bogolyubov (as White) and Kramer (as Black). Last move played: Black plays Pawn to c5,The position is equal,22. h4 ,21... c5 22. h4 
After a very long endgame Black's material advantage finally won,True, The comment suggests a logical fallacy – a material advantage doesn't automatically guarantee a win in the endgame.,1. d4 Nf6 2. Bg5 d5 3. Nc3 c6 4. e3 Bf5 5. Bd3 Bxd3 6. cxd3 e6 7. Nf3 Be7 8. O-O O-O 9. Rc1 Nbd7 10. e4 h6 11. Bf4 dxe4 12. dxe4 Qa5 13. Qe2 Rfd8 14. a3 Nf8 15. h3 Ng6 16. Bh2 Rd7 17. Rc2 Nh7 18. Qe3 Rad8 19. Bg3 Ng5 20. Nd2 Qb6 21. Ne2 c5 22. Nc4 Qc6 23. f3 cxd4 24. Qd3 Nh7 25. f4 Nf6 26. Nd2 Qxc2 27. Qxc2 d3 28. Qc4 dxe2 29. Re1 Rxd2,This is a game between Bogolyubov (as White) and Kramer (as Black). Last move played: Black plays Rook takes on d2,Large advantage for Black (eval: -503 centipawns),30. f5 exf5 31. exf5 R8d4 32. Qc8+ Nf8 33. Bf2 R4d3 34. Qc4 Rd1 35. g3 N8d7 36. Kg2 Nb6 37. Bxb6 axb6 38. Rxe2 Bc5 39. b4 Bd6 40. Kf2 Rxg3 41. Qc8+ Kh7 ,29... Rxd2 30. f5 R8d4 31. Qc8+ Nf8 32. fxe6 fxe6 33. Bf2 Rd7 34. Be3 Rd1 35. Kf2 Nxe4+ 36. Kxe2 R1d5 37. Bf4 Nd6 38. Qb8 Kh7 39. Rd1 Ng6 40. Bxd6 Bxd6 41. Rxd5 exd5 
intending Ph4 to prevent ... Ng5,True," The comment offers a potential explanation for the mistake, suggesting a planned attack.",1. d4 Nf6 2. Bg5 d5 3. Nc3 c6 4. e3 Bf5 5. Bd3 Bxd3 6. cxd3 e6 7. Nf3 Be7 8. O-O O-O 9. Rc1 Nbd7 10. e4 h6 11. Bf4 dxe4 12. dxe4 Qa5 13. Qe2 Rfd8 14. a3 Nf8 15. h3 Ng6 16. Bh2 Rd7 17. Rc2 Nh7 18. Qe3 Rad8 19. Bg3,This is a game between Bogolyubov (as White) and Kramer (as Black). Last move played: White plays Bishop to g3,Slight advantage for Black (eval: -25 centipawns),19... Qh5 ,19. Rd1 Ng5 20. Ne5 Nxe5 21. Bxe5 f6 22. Bg3 e5 23. Rcd2 Qb6 24. Na4 Qa6 25. Nc3 
"Although he has exchanged off only one piece, Black can maneuver comfortably here, mainly becaue White has allowed his important King bishop to be traded off. This great reduces White's possibilities for Kingside attack; consequently, Black will eventually gain the intitiative by pressuring White's centre",True," The comment accurately identifies a potential weakness in White's strategy due to the Ng5 push, suggesting a flawed plan.",1. d4 Nf6 2. Bg5 d5 3. Nc3 c6 4. e3 Bf5 5. Bd3 Bxd3 6. cxd3 e6 7. Nf3 Be7 8. O-O O-O 9. Rc1 Nbd7 10. e4 h6 11. Bf4 dxe4 12. dxe4 Qa5 13. Qe2 Rfd8 14. a3 Nf8,This is a game between Bogolyubov (as White) and Kramer (as Black). Last move played: Black plays Knight to f8,Slight advantage for White (eval: 34 centipawns),15. Rfd1 ,14... Nf8 15. Rfd1 Ng6 16. Be3 Qh5 17. h3 Rac8 18. Qf1 Qa5 19. Nd2 Qc7 20. g3 Qb8 21. b4 b6 22. Nc4 Qb7 23. h4 Ng4 
