comment,good,reasoning,moves,context,engine_eval,engine_best_line,engine_best_alternative
A fairly recent preference in the Alekhine Defense.,True,". The comment suggests a potential weakness in the Alekhine Defense, indicating a tactical flaw.",1. e4 Nf6 2. e5 Nd5 3. d4 d6 4. Nf3 g6,This is a game between Karpov (as White) and Torre (as Black). Last move played: Black plays Pawn to g6,Advantage for White (eval: 66 centipawns),5. c4 Nb6 ,4... dxe5 5. Nxe5 
The point is to support the center.,True," The comment suggests a strategic goal, but doesn't explicitly address the flaw in the move's execution.",1. e4 Nf6 2. e5 Nd5 3. d4 d6 4. Nf3 g6 5. Bc4 Nb6 6. Bb3 Bg7 7. Ng5 d5 8. f4 Nc6 9. c3 f6,This is a game between Karpov (as White) and Torre (as Black). Last move played: Black plays Pawn to f6,Large advantage for White (eval: 108 centipawns),10. Nf3 ,9... f6 
Karpov now decides to eliminate the light-squared bishops.,True,", It indicates a potential tactical blunder involving the removal of a bishop, suggesting a misjudgment of the position.",1. e4 Nf6 2. e5 Nd5 3. d4 d6 4. Nf3 g6 5. Bc4 Nb6 6. Bb3 Bg7 7. Ng5 d5 8. f4 Nc6 9. c3 f6 10. Nf3 Bf5 11. O-O Qd7 12. Nbd2 fxe5 13. fxe5 O-O 14. Rf2 Na5,This is a game between Karpov (as White) and Torre (as Black). Last move played: Black plays Knight to a5,Advantage for White (eval: 84 centipawns),15. h3 Bd3 ,14... Na5 
"Black's minor pieces are not doing much but observing the play. By deflecting the queen, Karpov manages to trap it.",True," The comment suggests a lack of development and tactical potential, indicating a poor move.",1. e4 Nf6 2. e5 Nd5 3. d4 d6 4. Nf3 g6 5. Bc4 Nb6 6. Bb3 Bg7 7. Ng5 d5 8. f4 Nc6 9. c3 f6 10. Nf3 Bf5 11. O-O Qd7 12. Nbd2 fxe5 13. fxe5 O-O 14. Rf2 Na5 15. Bc2 Bxc2 16. Qxc2 Qf5 17. Qd1 e6 18. Nf1 c5 19. h3 cxd4 20. cxd4 Nc6 21. b3 Nd7 22. Ba3 Rf7,This is a game between Karpov (as White) and Torre (as Black). Last move played: Black plays Rook to f7,Large advantage for White (eval: 359 centipawns),23. g4 Qe4 24. Ng5 Rxf2 25. Nxe4 Rf4 26. Ng5 Rxd4 27. Qc2 Ndxe5 28. Kh1 h6 29. Nxe6 Re4 30. Nxg7 Kxg7 31. Rd1 Re8 32. Bc5 Rf4 33. Qd2 Rf3 34. Nh2 Rg3 35. Qxd5 Rd8 36. Qxd8 Nxd8 37. Rxd8 ,22... Qf4 23. Bxf8 Rxf8 24. Qd2 Qxd2 25. Rxd2 h5 26. Rad1 Bh6 27. Rc2 Nb6 28. Rc3 Rf4 29. Kh1 Nc8 30. b4 a6 31. Rb1 Rf7 32. Rcb3 g5 33. b5 axb5 
"The queen is trapped, so Black resigned.",True," The comment directly indicates a loss due to the queen's vulnerability, prompting a resignation.",1. e4 Nf6 2. e5 Nd5 3. d4 d6 4. Nf3 g6 5. Bc4 Nb6 6. Bb3 Bg7 7. Ng5 d5 8. f4 Nc6 9. c3 f6 10. Nf3 Bf5 11. O-O Qd7 12. Nbd2 fxe5 13. fxe5 O-O 14. Rf2 Na5 15. Bc2 Bxc2 16. Qxc2 Qf5 17. Qd1 e6 18. Nf1 c5 19. h3 cxd4 20. cxd4 Nc6 21. b3 Nd7 22. Ba3 Rf7 23. g4 Qe4 24. Ng5,This is a game between Karpov (as White) and Torre (as Black). Last move played: White plays Knight to g5,Large advantage for White (eval: 370 centipawns),24... Rxf2 25. Nxe4 Rf4 26. Ng5 Rxd4 27. Qe2 Ndxe5 28. Rd1 Rf4 29. Nxe6 Nf3+ 30. Kh1 Ncd4 31. Nxd4 Nxd4 32. Qe7 Rf2 33. Bc5 Raf8 34. Ng3 R2f3 35. Qxb7 Rxg3 36. Qxd5+ Kh8 ,24. Ng5 Rxf2 25. Nxe4 Rf4 26. Ng5 Rxd4 27. Qe2 Ndxe5 28. Kh1 Rd3 29. Rd1 Nd4 30. Qe1 Nc2 31. Qh4 h6 32. Rxd3 hxg5 33. Qxg5 Nxa3 34. Rd1 Nb5 35. Nd2 
A fairly recent preference in the Alekhine Defense.,True," Yes, the comment indicates a potential weakness in the player's defensive structure, suggesting a flawed opening strategy.",1. e4 Nf6 2. e5 Nd5 3. d4 d6 4. Nf3 g6,This is a game between Karpov (as White) and Torre (as Black). Last move played: Black plays Pawn to g6,Advantage for White (eval: 66 centipawns),5. c4 Nb6 ,4... dxe5 5. Nxe5 
