comment,good,reasoning,moves,context,engine_eval,engine_best_line,engine_best_alternative
I switch back to the Spanish Game. Karpov responded quickly with a new pawn sacrifice.,True, The comment indicates a poor strategic choice due to the sudden pawn sacrifice.,1. e4 e5 2. Nf3 Nc6 3. Bb5,This is a game between Kasparov (as White) and Karpov (as Black). Last move played: White plays Bishop to b5,Slight advantage for White (eval: 24 centipawns),3... Nf6 ,3. Bb5 
"We had been here before, in the final game of the New York leg.",True," The comment indicates a repetition of a previous position, suggesting a flawed strategic decision.",1. e4 e5 2. Nf3 Nc6 3. Bb5 a6 4. Ba4 Nf6 5. O-O Be7 6. Re1 b5 7. Bb3 d6 8. c3 O-O 9. h3 Nd7 10. d4 Bf6 11. a4 Bb7 12. Na3 exd4 13. cxd4,This is a game between Kasparov (as White) and Karpov (as Black). Last move played: White plays Pawn takes on d4,Advantage for White (eval: 74 centipawns),13... Nb6 ,13. cxd4 bxa4 
Best!,True,". The comment ""Best!"" indicates a lack of understanding or a subjective assessment of the move's quality, suggesting a mistake.",1. e4 e5 2. Nf3 Nc6 3. Bb5 a6 4. Ba4 Nf6 5. O-O Be7 6. Re1 b5 7. Bb3 d6 8. c3 O-O 9. h3 Nd7 10. d4 Bf6 11. a4 Bb7 12. Na3 exd4 13. cxd4 Nb6 14. Bf4,This is a game between Kasparov (as White) and Karpov (as Black). Last move played: White plays Bishop to f4,Advantage for White (eval: 58 centipawns),14... bxa4 15. Bxa4 Nxa4 16. Qxa4 a5 17. Bd2 Nb4 18. Bxb4 axb4 19. Qxb4 Qb8 20. Qd2 c5 21. d5 Ba6 22. Rab1 Qb4 23. Qc2 Bd4 24. Nd2 h5 25. Nac4 Bxc4 26. Nxc4 Ra6 27. g3 Rb8 28. Kg2 g6 29. Re2 Kg7 30. f4 Qb3 31. Qxb3 ,14. axb5 axb5 15. Rb1 Ba6 16. d5 Ne5 17. Nxe5 dxe5 18. Nc2 Bc8 19. Nb4 Bd7 20. Bd2 Be7 21. Rc1 Bd6 22. Nc6 Qf6 23. Re3 Nc4 24. Bxc4 Bxc6 25. Rg3 
"Black has gotten rid of the famous ""Spanish bishop"", but aside from that he hasn't done much. My pieces occupy better squares. He has no good squares under control, so now he takes over b4 for his knight.",True, The comment identifies a weakness in Black's piece placement and suggests a tactical opportunity for White.,1. e4 e5 2. Nf3 Nc6 3. Bb5 a6 4. Ba4 Nf6 5. O-O Be7 6. Re1 b5 7. Bb3 d6 8. c3 O-O 9. h3 Nd7 10. d4 Bf6 11. a4 Bb7 12. Na3 exd4 13. cxd4 Nb6 14. Bf4 bxa4 15. Bxa4 Nxa4 16. Qxa4,This is a game between Kasparov (as White) and Karpov (as Black). Last move played: White plays Queen takes on a4,Slight advantage for White (eval: 49 centipawns),16... a5 ,16. Qxa4 a5 17. Bd2 Re8 18. d5 Nb4 19. Bxb4 axb4 20. Qxb4 Qb8 21. Rab1 g6 22. Qd2 c6 23. Nc4 cxd5 24. exd5 Rxe1+ 25. Rxe1 Qc7 26. Qf4 Bg7 27. Rd1 Ba6 28. b3 Bxc4 29. Rc1 Qb7 30. bxc4 Qb2 31. g3 h6 32. Re1 
"So much for the big square! Well, Karpov has the bishop pair, but the one at b7 certainly doesn't impress.",True," The comment expresses a negative assessment of the bishop pair, suggesting the move was weak.",1. e4 e5 2. Nf3 Nc6 3. Bb5 a6 4. Ba4 Nf6 5. O-O Be7 6. Re1 b5 7. Bb3 d6 8. c3 O-O 9. h3 Nd7 10. d4 Bf6 11. a4 Bb7 12. Na3 exd4 13. cxd4 Nb6 14. Bf4 bxa4 15. Bxa4 Nxa4 16. Qxa4 a5 17. Bd2 Re8 18. d5 Nb4 19. Bxb4,This is a game between Kasparov (as White) and Karpov (as Black). Last move played: White plays Bishop takes on b4,Slight advantage for White (eval: 47 centipawns),19... axb4 ,19. Bxb4 axb4 
"OK, so now he has both bishops working as compensation for the pawn and miserable pawn structure. And I am going to make something of the pawn!",True," The comment suggests a strategic miscalculation and a flawed plan, indicating a mistake.",1. e4 e5 2. Nf3 Nc6 3. Bb5 a6 4. Ba4 Nf6 5. O-O Be7 6. Re1 b5 7. Bb3 d6 8. c3 O-O 9. h3 Nd7 10. d4 Bf6 11. a4 Bb7 12. Na3 exd4 13. cxd4 Nb6 14. Bf4 bxa4 15. Bxa4 Nxa4 16. Qxa4 a5 17. Bd2 Re8 18. d5 Nb4 19. Bxb4 axb4 20. Qxb4 Rb8 21. Qc4 Qc8 22. Nd4 Ba6 23. Qc3,This is a game between Kasparov (as White) and Karpov (as Black). Last move played: White plays Queen to c3,Advantage for White (eval: 62 centipawns),23... Qb7 ,23. Qc3 Qb7 24. Nac2 Bb5 25. Re3 g6 26. Ra5 Bd7 27. b4 Qb6 28. b5 h5 29. Ra4 Ra8 30. Rb4 Ra5 31. Qb3 h4 32. Nc6 Bxc6 33. bxc6 
Having secured the kingside I can give the queenside my undivided attention.,True," The comment suggests a strategic shift, potentially indicating a poor move that led to a tactical vulnerability.",1. e4 e5 2. Nf3 Nc6 3. Bb5 a6 4. Ba4 Nf6 5. O-O Be7 6. Re1 b5 7. Bb3 d6 8. c3 O-O 9. h3 Nd7 10. d4 Bf6 11. a4 Bb7 12. Na3 exd4 13. cxd4 Nb6 14. Bf4 bxa4 15. Bxa4 Nxa4 16. Qxa4 a5 17. Bd2 Re8 18. d5 Nb4 19. Bxb4 axb4 20. Qxb4 Rb8 21. Qc4 Qc8 22. Nd4 Ba6 23. Qc3 c5 24. dxc6 Bxd4 25. Qxd4 Qxc6 26. b4 h6 27. Re3 Re6 28. f3 Rc8 29. Rb3,This is a game between Kasparov (as White) and Karpov (as Black). Last move played: White plays Rook to b3,Large advantage for White (eval: 146 centipawns),29... Bb7 30. Rd3 Rg6 31. Kh1 Qa4 32. Qb2 Kh7 33. Rad1 Qd7 34. Rd4 f5 35. Nc4 fxe4 36. Ne5 Rxg2 37. Qxg2 Qf5 38. Rxd6 exf3 39. Qg6+ Qxg6 40. Nxg6 Rc2 41. Rf1 f2+ 42. Kh2 ,29. Rb3 Bb7 
These retre ats are justified by the fact that I must eliminate all counterplay before returning to the advance of the b-pawn.,True," The comment suggests a strategic maneuver to reduce opponent’s options, indicating a flawed evaluation of the resulting position.",1. e4 e5 2. Nf3 Nc6 3. Bb5 a6 4. Ba4 Nf6 5. O-O Be7 6. Re1 b5 7. Bb3 d6 8. c3 O-O 9. h3 Nd7 10. d4 Bf6 11. a4 Bb7 12. Na3 exd4 13. cxd4 Nb6 14. Bf4 bxa4 15. Bxa4 Nxa4 16. Qxa4 a5 17. Bd2 Re8 18. d5 Nb4 19. Bxb4 axb4 20. Qxb4 Rb8 21. Qc4 Qc8 22. Nd4 Ba6 23. Qc3 c5 24. dxc6 Bxd4 25. Qxd4 Qxc6 26. b4 h6 27. Re3 Re6 28. f3 Rc8 29. Rb3 Bb5 30. Rb2 Qb7 31. Nc2 Qe7 32. Qf2 Rg6 33. Ne3 Qe5 34. Rbb1,This is a game between Kasparov (as White) and Karpov (as Black). Last move played: White plays Rook to b1,Large advantage for White (eval: 181 centipawns),34... Kh7 35. Ra5 Qd4 36. Ra2 Qe5 37. Kh1 Bd7 38. Nd5 Rg3 39. Qe3 Be6 40. Rd2 f5 41. Qf4 fxe4 42. Qxe5 dxe5 43. fxe4 Rc4 44. Kh2 Rg6 45. b5 Rxe4 46. b6 Bxd5 47. Rxd5 ,34. Qd2 Kh7 35. Ra5 Rb8 36. Nd5 Rb7 37. Nc3 Qe8 38. Qd4 Bc6 39. Ne2 Qe7 40. Qf2 Rg5 41. Rxg5 Qxg5 42. Nd4 Qc1+ 43. Kh2 Qf4+ 44. Qg3 
Here I sealed my move and went home. The rest of the game was simple and I wrapped it up quickly the following day.,False,"

The comment expresses a lack of strategic consideration and a reluctance to engage with the complexities of the game, suggesting a flawed decision.",1. e4 e5 2. Nf3 Nc6 3. Bb5 a6 4. Ba4 Nf6 5. O-O Be7 6. Re1 b5 7. Bb3 d6 8. c3 O-O 9. h3 Nd7 10. d4 Bf6 11. a4 Bb7 12. Na3 exd4 13. cxd4 Nb6 14. Bf4 bxa4 15. Bxa4 Nxa4 16. Qxa4 a5 17. Bd2 Re8 18. d5 Nb4 19. Bxb4 axb4 20. Qxb4 Rb8 21. Qc4 Qc8 22. Nd4 Ba6 23. Qc3 c5 24. dxc6 Bxd4 25. Qxd4 Qxc6 26. b4 h6 27. Re3 Re6 28. f3 Rc8 29. Rb3 Bb5 30. Rb2 Qb7 31. Nc2 Qe7 32. Qf2 Rg6 33. Ne3 Qe5 34. Rbb1 Bd7 35. Ra5 Qe7 36. Ra7 Qd8 37. Nd5 Kh7 38. Kh2 Rb8 39. f4 Re6 40. Qd4 Qe8,This is a game between Kasparov (as White) and Karpov (as Black). Last move played: Black plays Queen to e8,Large advantage for White (eval: 258 centipawns),41. Re1 Bc6 ,40... Qe8 41. Re1 
Best!,True," The comment suggests a potential alternative move that could have hindered the opponent's development, indicating a flawed strategic choice.",1. e4 e5 2. Nf3 Nc6 3. Bb5 a6 4. Ba4 Nf6 5. O-O Be7 6. Re1 b5 7. Bb3 d6 8. c3 O-O 9. h3 Nd7 10. d4 Bf6 11. a4 Bb7 12. Na3 exd4 13. cxd4 Nb6 14. Bf4,This is a game between Kasparov (as White) and Karpov (as Black). Last move played: White plays Bishop to f4,Advantage for White (eval: 58 centipawns),14... bxa4 15. Bxa4 Nxa4 16. Qxa4 a5 17. Bd2 Nb4 18. Bxb4 axb4 19. Qxb4 Qb8 20. Qd2 c5 21. d5 Ba6 22. Rab1 Qb4 23. Qc2 Bd4 24. Nd2 h5 25. Nac4 Bxc4 26. Nxc4 Ra6 27. g3 Rb8 28. Kg2 g6 29. Re2 Kg7 30. f4 Qb3 31. Qxb3 ,14. axb5 axb5 15. Rb1 Ba6 16. d5 Ne5 17. Nxe5 dxe5 18. Nc2 Bc8 19. Nb4 Bd7 20. Bd2 Be7 21. Rc1 Bd6 22. Nc6 Qf6 23. Re3 Nc4 24. Bxc4 Bxc6 25. Rg3 
