comment,good,reasoning,moves,context,engine_eval,engine_best_line,engine_best_alternative
"Znosko-Borovsky is probably best remembered today for four books that served as texts for the pre-war generation of Soviet players: How to Play the Chess Openings, The Middle Game in Chess, How to Play Chess Endings, and the delightful and irreverent How Not to Play Chess. Mieses, too, was the author of several books including The Chess Pilot, Manual of the End Game, and Instructive Positions from Master Chess. Mieses had a hearty dislike of ""long lines,"" theoretical openings analyzed so deeply that anyone with a good memory could find his way through them. He would frequently trot out the Danish Gambit (2.d4 exd4 3.c3!?) in international competition. Here, he heads for a variation of the Vienna Game that was not sufficiently well explored at that time. His opponent's unfamiliarity with this sideline soon nets Mieses a significant positional advantage.",True," The comment provides context for why the move was considered a mistake, suggesting Mieses’s unusual and potentially detrimental focus on specific openings.",1. e4 e5 2. Nc3,"This is a game between Mieses, J (as White) and Znosko-Borovsky, E (as Black). Last move played: White plays Knight to c3",The position is equal,2... Nf6 ,2. Nf3 
"Znosko-Borovsky passes up the opportunity to test Mieses with 3...Nxe4. While it is generally considered harmless for White to take the Knight (4.Nxe4 d5! gets back the piece with a spatial advantage for White), Mieses might well have essayed 4.Nf3!? Nxc3 5.dxc3, the Boden-Kieseritzky Gambit, or the extremely complicated lines beginning with 4.Qh5!? Nd6 5.Bb3 Nc6 6.Nb5!?, which lead to almost unfathomable tactics.",True," The comment clearly identifies a potential tactical blunder and suggests alternative lines that led to a worse position, indicating a flawed evaluation of the move.",1. e4 e5 2. Nc3 Nf6 3. Bc4 Nc6,"This is a game between Mieses, J (as White) and Znosko-Borovsky, E (as Black). Last move played: Black plays Knight to c6",The position is equal,4. d3 ,3... Bc5 4. Nf3 d6 5. O-O a5 6. Ne2 Nxe4 7. d4 exd4 8. Ng3 Nf6 9. Re1+ Kf8 10. Nxd4 d5 11. Bb5 Nbd7 12. c3 c6 13. Bf1 Kg8 14. Bd3 Nf8 15. h3 h5 16. Bg5 
"As an interesting aside, White often reaches this position via the Bishop's Opening without giving Black the opportunity to take on e4, thus: 1.e4 e5 2.Bc4 Nf6 3.d3 Nc6 4.Nc3, etc.",True," The comment provides a potential explanation for the mistake, suggesting a flawed opening strategy.",1. e4 e5 2. Nc3 Nf6 3. Bc4 Nc6 4. d3,"This is a game between Mieses, J (as White) and Znosko-Borovsky, E (as Black). Last move played: White plays Pawn to d3",The position is equal,4... Na5 ,4. d3 
"Here 4...Bc5 would probably transpose into a King's Gambit Declined -- an opening, however, with which the veteran gambitteer Mieses could be expected to be familiar. Znosko-Borovsky's move is designed to start a fight in the center focused on the d5 square. By pinning White's N/c3, Black obtains presumptive control of d5 and is prepared to push his pawn there next move. After, for example, 5.Ne2 d5 6.exd5 Nxd5, Black has achieved the favorable ""Jump Formation"" in the center and can look forward to the middlegame with confidence thanks to his spatial advantage.",True," The comment offers a potential explanation for the mistake, suggesting a strategic goal for Black.",1. e4 e5 2. Nc3 Nf6 3. Bc4 Nc6 4. d3 Bb4,"This is a game between Mieses, J (as White) and Znosko-Borovsky, E (as Black). Last move played: Black plays Bishop to b4",The position is equal,5. Nf3 h6 ,4... Na5 
"This is such a natural-looking move that it is difficult to condemn it. Yet Alekhine, in his annotations to the game Alekhine-Gregory, St. Petersburg, 1909, suggests that Black's strongest course is an immediate 5...h6! with the idea 6.Bxf6 Bxc3+! (before White can play Ne2) 7.bxc3 Qxf6, with equal chances. On the other hand, if White were to meet 5...h6 with 6.Bh4, Black could continue 6...g5 7.Bg3 d5! and, having driven off White's Bishop, he would achieve his central goal and have no further worries.",True," The comment provides a counter-argument to the initial mistake, suggesting a more strategic alternative.",1. e4 e5 2. Nc3 Nf6 3. Bc4 Nc6 4. d3 Bb4 5. Bg5 d6,"This is a game between Mieses, J (as White) and Znosko-Borovsky, E (as Black). Last move played: Black plays Pawn to d6",Slight advantage for White (eval: 21 centipawns),6. Ne2 ,5... h6 6. Bxf6 
"Now that Mieses has taken the time to defend the N/c3 with a fellow steed, the idea of ...h6 is less appealing. White can recapture on c3 with a Knight, and Black's Queen would be exposed after her recapture on f6 since White plans both Nd5 (hitting f6 and c7) and 0-0 with f4! coming.",True," The comment highlights a strategic flaw, suggesting a weak plan and potential vulnerability to counterattack.",1. e4 e5 2. Nc3 Nf6 3. Bc4 Nc6 4. d3 Bb4 5. Bg5 d6 6. Ne2,"This is a game between Mieses, J (as White) and Znosko-Borovsky, E (as Black). Last move played: White plays Knight to e2",The position is equal,6... h6 7. Bxf6 Qxf6 8. O-O Bxc3 9. Nxc3 Be6 10. Nd5 Qd8 11. a4 O-O 12. a5 Ne7 13. Ne3 Qd7 14. c3 Rad8 15. Qa4 c6 16. Bxe6 Qxe6 17. f4 exf4 18. Rxf4 d5 ,6. Ne2 
"The tension this move introduces is quite characteristic of Vienna and Giuoco Piano positions. Tarrasch was one of the first people to note that White should not, as a rule, capture on e6: although it doubles Black's pawns, the pawns control important central squares (like d5 -- there's that square again!) and the open f-file is an asset for Black. The two paths most commonly taken are Bb3, defending the B comfortably with the a-pawn, and Mieses's more daring plan here:",True," The comment offers insightful analysis of the move's strategic implications, suggesting a potential weakness in White's opening choice.",1. e4 e5 2. Nc3 Nf6 3. Bc4 Nc6 4. d3 Bb4 5. Bg5 d6 6. Ne2 Be6,"This is a game between Mieses, J (as White) and Znosko-Borovsky, E (as Black). Last move played: Black plays Bishop to e6",Slight advantage for White (eval: 25 centipawns),7. a3 Bxc3+ ,6... h6 7. Bxf6 Qxf6 8. O-O Bxc3 9. Nxc3 Be6 10. Nd5 Qd8 11. a4 O-O 12. a5 Ne7 13. Ne3 Qd7 14. c3 Rad8 15. Qa4 c6 16. Bxe6 Qxe6 17. f4 exf4 18. Rxf4 d5 
"Mieses simply completes his development. If Black captures on c4, White will have a death-grip on the d5 square. This is highly uncomfortable for Black! So Znosko-Borovsky puts the question to White's B/g5 instead. Yet perhaps the best move of all for Black is simply 7...Bxc3. This is a difficult point to understand unless you really grasp the niceties of the pawn formation. Black's darksquare Bishop is outside his pawn chain, true: yet it hasn't much of a future where it stands. In the subsequent course of the game, it serves as more of a punching bag for White than an offensive piece. Trading it off might have been the better part of valor.",True," The comment offers a nuanced explanation of the mistake, highlighting a strategic disadvantage and a potential tactical opportunity for Black.",1. e4 e5 2. Nc3 Nf6 3. Bc4 Nc6 4. d3 Bb4 5. Bg5 d6 6. Ne2 Be6 7. O-O,"This is a game between Mieses, J (as White) and Znosko-Borovsky, E (as Black). Last move played: White plays kingside castle",The position is equal,7... Bxc3 ,7. a3 Bxc3+ 
"Already, the B/b4 looks like it is ""floating"" without a purpose. Mieses captures on d5 with his Bishop for a good reason. There is nothing to be gained immediately by kicking Black's N/c6 with a pawn; and long-term, the pawn on d5 might become a liability. Mieses is planning to push f4 soon, harassing Black's Queen and opening a critical file. Notice how weak the f7 square would be if there were no White f-pawn!",True," The comment offers a nuanced analysis of the move's potential weaknesses and suggests a strategic plan, indicating a thoughtful evaluation of the mistake.",1. e4 e5 2. Nc3 Nf6 3. Bc4 Nc6 4. d3 Bb4 5. Bg5 d6 6. Ne2 Be6 7. O-O h6 8. Bxf6 Qxf6 9. Nd5 Bxd5,"This is a game between Mieses, J (as White) and Znosko-Borovsky, E (as Black). Last move played: Black plays Bishop takes on d5",Advantage for White (eval: 79 centipawns),10. Bxd5 Ne7 ,9... Bxd5 
"This prepares for the eventual advance of White's d-pawn. The idea is to soften up the center with f4 first, and if the Black e-pawn can be deflected, then d4 will establish a dominant center for White.",True," The comment offers a potential explanation for the mistake, but it’s speculative and doesn’t directly address why the move was deemed a mistake.",1. e4 e5 2. Nc3 Nf6 3. Bc4 Nc6 4. d3 Bb4 5. Bg5 d6 6. Ne2 Be6 7. O-O h6 8. Bxf6 Qxf6 9. Nd5 Bxd5 10. Bxd5 Bc5 11. Bxc6+,"This is a game between Mieses, J (as White) and Znosko-Borovsky, E (as Black). Last move played: White plays Bishop takes on c6 with check",Slight advantage for White (eval: 33 centipawns),11... bxc6 ,11. c3 
As advertised: White is preparing f4.,True, The comment directly identifies a potential error in the player's plan.,1. e4 e5 2. Nc3 Nf6 3. Bc4 Nc6 4. d3 Bb4 5. Bg5 d6 6. Ne2 Be6 7. O-O h6 8. Bxf6 Qxf6 9. Nd5 Bxd5 10. Bxd5 Bc5 11. Bxc6+ bxc6 12. Kh1,"This is a game between Mieses, J (as White) and Znosko-Borovsky, E (as Black). Last move played: White plays King to h1",Slight advantage for White (eval: 39 centipawns),12... Bb6 ,12. Kh1 Bb6 
"Here Mieses makes a small mis-step, which his opponent declines to capitalize on.",True," The comment suggests the player’s move was a weak one, potentially leading to an opponent’s advantage.",1. e4 e5 2. Nc3 Nf6 3. Bc4 Nc6 4. d3 Bb4 5. Bg5 d6 6. Ne2 Be6 7. O-O h6 8. Bxf6 Qxf6 9. Nd5 Bxd5 10. Bxd5 Bc5 11. Bxc6+ bxc6 12. Kh1 d5 13. f4 exf4,"This is a game between Mieses, J (as White) and Znosko-Borovsky, E (as Black). Last move played: Black plays Pawn takes on f4",Large advantage for White (eval: 175 centipawns),14. e5 Qg5 15. d4 Be7 16. Nxf4 O-O 17. c3 Rad8 18. Qa4 c5 19. Qxa7 cxd4 20. cxd4 Qg4 21. h3 Qd7 22. Rac1 Bg5 23. Qxc7 Qf5 24. Qc2 Qe4 25. Qf2 Rc8 26. Rxc8 Rxc8 27. Qf3 Rc2 28. Nxd5 Qxf3 29. Rxf3 Rxb2 ,13... Be3 
"This dares Black to snatch a pawn on b2. Yet he might as well grab some booty for his troubles. Mieses could have avoided all of this with 14.d4! and 15.Rxf4, transposing into something like the game continuation without offering Black that opportunity.",True," The comment offers a potential alternative move and highlights a missed opportunity, suggesting a flawed assessment of the situation.",1. e4 e5 2. Nc3 Nf6 3. Bc4 Nc6 4. d3 Bb4 5. Bg5 d6 6. Ne2 Be6 7. O-O h6 8. Bxf6 Qxf6 9. Nd5 Bxd5 10. Bxd5 Bc5 11. Bxc6+ bxc6 12. Kh1 d5 13. f4 exf4 14. Rxf4,"This is a game between Mieses, J (as White) and Znosko-Borovsky, E (as Black). Last move played: White plays Rook takes on f4",The position is equal,14... Qxb2 15. Rb1 Qxa2 16. Ra1 Qb2 17. Rb1 Qa3 18. Ra1 Qb2 ,14. e5 Qg5 15. d4 Be7 16. Nxf4 O-O 17. c3 Rad8 18. Qa4 c5 19. Qxa7 cxd4 20. cxd4 Qg4 21. h3 Qd7 22. Rac1 Bg5 23. Qxc7 Qf5 24. Qc2 Qe4 25. Qf2 Rc8 26. Rxc8 Rxc8 27. Qf3 Rc2 28. Nxd5 Qxf3 29. Rxf3 Rxb2 
Black ducks the challenge. Now White's plan rolls forward unhindered.,True," The comment suggests a strategic blunder by Black, hindering their own plans.",1. e4 e5 2. Nc3 Nf6 3. Bc4 Nc6 4. d3 Bb4 5. Bg5 d6 6. Ne2 Be6 7. O-O h6 8. Bxf6 Qxf6 9. Nd5 Bxd5 10. Bxd5 Bc5 11. Bxc6+ bxc6 12. Kh1 d5 13. f4 exf4 14. Rxf4 Qe7,"This is a game between Mieses, J (as White) and Znosko-Borovsky, E (as Black). Last move played: Black plays Queen to e7",Large advantage for White (eval: 150 centipawns),15. d4 Bb6 ,14... Qxb2 15. Rb1 Qxa2 16. Ra1 Qb2 17. Rb1 Qa3 18. Ra1 Qb2 
"What should White play if Black puts the Bishop on d6 now? 15...Bd6 is not the game continuation, but it is worth looking at. The key to this position, as is so often the case in chess, is an undefended man -- here, the pawn on c6. Black's problem is that his Bishop can be forced to go to an undefended square as well, and White can then fork the B and the P. 16.e5 Bb4 17.c3 Ba5 18.Qa4 ... and Black must lose a piece since allowing the fork on c6 is out of the question. For this reason, Black must put his Bishop on b6.",True," The comment offers a potential explanation for the mistake, suggesting a key strategic point for Black.",1. e4 e5 2. Nc3 Nf6 3. Bc4 Nc6 4. d3 Bb4 5. Bg5 d6 6. Ne2 Be6 7. O-O h6 8. Bxf6 Qxf6 9. Nd5 Bxd5 10. Bxd5 Bc5 11. Bxc6+ bxc6 12. Kh1 d5 13. f4 exf4 14. Rxf4 Qe7 15. d4,"This is a game between Mieses, J (as White) and Znosko-Borovsky, E (as Black). Last move played: White plays Pawn to d4",Large advantage for White (eval: 162 centipawns),15... Bb6 ,15. d4 Bb6 
"Znosko-Borovsky is well aware that the Kingside is an unwelcome home for him, so he spirits his King away to the other side. The castle on the west side of his domain is drafty, but he counts on the fact that he has a clerical defender there and White's pieces are not aimed properly for an assault on the Queenside.",True," The comment offers a possible explanation for the mistake, suggesting a defensive strategy to mitigate a potential attack.",1. e4 e5 2. Nc3 Nf6 3. Bc4 Nc6 4. d3 Bb4 5. Bg5 d6 6. Ne2 Be6 7. O-O h6 8. Bxf6 Qxf6 9. Nd5 Bxd5 10. Bxd5 Bc5 11. Bxc6+ bxc6 12. Kh1 d5 13. f4 exf4 14. Rxf4 Qe7 15. d4 Bb6 16. Ng3 O-O-O,"This is a game between Mieses, J (as White) and Znosko-Borovsky, E (as Black). Last move played: Black plays queenside castle",Large advantage for White (eval: 178 centipawns),17. e5 f6 18. Nf5 Qd7 19. exf6 gxf6 20. b4 Rhe8 21. c3 Kb7 22. Nxh6 Re3 23. Rf3 Rde8 24. Nf5 Re2 25. Ng3 R2e3 26. a4 a5 27. Rxe3 Rxe3 28. Qd2 ,16... O-O-O 17. e5 f6 18. Nf5 Qd7 19. exf6 gxf6 20. b4 Rhe8 21. c3 Re6 22. Qf1 Kb7 23. Nxh6 Rde8 24. Rf3 Re2 
"Now White threatens a positional crush with c3 and b4, burying Black's Bishop alive. Even with Black's King ""safe"" on the Queenside, Black cannot hold the game if he is effectively a piece down. This positional threat is very real and it would be sheer suicide to permit White to carry it out. This helps to explain Black's next move, which is otherwise an incomprehensible opening of lines against his own King.",True," The comment provides a detailed explanation of why the move was a mistake, highlighting a significant positional weakness and suggesting a likely consequence.",1. e4 e5 2. Nc3 Nf6 3. Bc4 Nc6 4. d3 Bb4 5. Bg5 d6 6. Ne2 Be6 7. O-O h6 8. Bxf6 Qxf6 9. Nd5 Bxd5 10. Bxd5 Bc5 11. Bxc6+ bxc6 12. Kh1 d5 13. f4 exf4 14. Rxf4 Qe7 15. d4 Bb6 16. Ng3 O-O-O 17. e5,"This is a game between Mieses, J (as White) and Znosko-Borovsky, E (as Black). Last move played: White plays Pawn to e5",Large advantage for White (eval: 179 centipawns),17... f6 ,17. e5 f6 18. Nf5 Qd7 19. exf6 gxf6 20. b4 Rhe8 21. c3 Kb7 22. Nxh6 Re3 23. Rf3 Rde8 24. Nf5 Re2 25. Ng3 R2e3 26. a4 a5 27. Rxe3 Rxe3 28. Qd2 
"Black scurries off of the hot file and prepares ...c5, hoping to undermine White's center before Mieses has a chance to reorganize his forces. True, the king is on an open file, but Black has to act fast or White will lock down on c5 and Black will be, practically speaking, a piece down.",True," The comment identifies a potential strategic blunder and suggests Black's aim to weaken the center, indicating a flawed assessment of the position.",1. e4 e5 2. Nc3 Nf6 3. Bc4 Nc6 4. d3 Bb4 5. Bg5 d6 6. Ne2 Be6 7. O-O h6 8. Bxf6 Qxf6 9. Nd5 Bxd5 10. Bxd5 Bc5 11. Bxc6+ bxc6 12. Kh1 d5 13. f4 exf4 14. Rxf4 Qe7 15. d4 Bb6 16. Ng3 O-O-O 17. e5 c5 18. c3 cxd4 19. cxd4 Kb8,"This is a game between Mieses, J (as White) and Znosko-Borovsky, E (as Black). Last move played: Black plays King to b8",Large advantage for White (eval: 252 centipawns),20. Nf5 Qg5 21. Qf3 g6 22. Ne3 Qh5 23. Qf1 f6 24. exf6 Rhf8 25. Re1 g5 26. Rf5 c6 27. h3 Qg6 28. Ng4 Bxd4 29. Re7 Rf7 30. Re6 h5 31. Ne5 Bxe5 32. Rfxe5 d4 33. Rxc6 ,19... f6 
"This threatens to win a piece, however.",True," The comment suggests a potential tactical threat, indicating a flawed evaluation of the resulting position.",1. e4 e5 2. Nc3 Nf6 3. Bc4 Nc6 4. d3 Bb4 5. Bg5 d6 6. Ne2 Be6 7. O-O h6 8. Bxf6 Qxf6 9. Nd5 Bxd5 10. Bxd5 Bc5 11. Bxc6+ bxc6 12. Kh1 d5 13. f4 exf4 14. Rxf4 Qe7 15. d4 Bb6 16. Ng3 O-O-O 17. e5 c5 18. c3 cxd4 19. cxd4 Kb8 20. a4,"This is a game between Mieses, J (as White) and Znosko-Borovsky, E (as Black). Last move played: White plays Pawn to a4",Large advantage for White (eval: 228 centipawns),20... a5 ,20. Nf5 Qg5 21. Qf3 g6 22. Ne3 Qh5 23. Qf1 f6 24. exf6 Rhf8 25. Re1 g5 26. Rf5 c6 27. h3 Qg6 28. Ng4 Bxd4 29. Re7 Rf7 30. Re6 h5 31. Ne5 Bxe5 32. Rfxe5 d4 33. Rxc6 
Now Mieses is truly inspired!,False,"

The comment expresses enthusiasm for a move that was deemed a mistake, suggesting a positive assessment of the player's tactical skill, which doesn't necessarily indicate a correct evaluation of the move's quality.",1. e4 e5 2. Nc3 Nf6 3. Bc4 Nc6 4. d3 Bb4 5. Bg5 d6 6. Ne2 Be6 7. O-O h6 8. Bxf6 Qxf6 9. Nd5 Bxd5 10. Bxd5 Bc5 11. Bxc6+ bxc6 12. Kh1 d5 13. f4 exf4 14. Rxf4 Qe7 15. d4 Bb6 16. Ng3 O-O-O 17. e5 c5 18. c3 cxd4 19. cxd4 Kb8 20. a4 a5,"This is a game between Mieses, J (as White) and Znosko-Borovsky, E (as Black). Last move played: Black plays Pawn to a5",Large advantage for White (eval: 215 centipawns),21. Nf5 Qf8 22. Rf3 Ka7 23. b4 Qxb4 24. Rb1 Qf8 25. Qc2 Rb8 26. Rb5 Qe8 27. Nxg7 Qd7 28. Nf5 Rhe8 29. Nxh6 Re6 30. Qd2 f6 31. exf6 Re4 32. Nf5 Rf8 33. Rxa5+ Kb7 34. Rb5 Rxf6 ,20... a5 
Black's erstwhile safe shelter is being torn to shreds. Now 21...axb4 is met by 22.a5 Ba7 23.Qa4 and the invaders are already at the gates.,True, The comment accurately describes a disastrous tactical sequence leading to a loss.,1. e4 e5 2. Nc3 Nf6 3. Bc4 Nc6 4. d3 Bb4 5. Bg5 d6 6. Ne2 Be6 7. O-O h6 8. Bxf6 Qxf6 9. Nd5 Bxd5 10. Bxd5 Bc5 11. Bxc6+ bxc6 12. Kh1 d5 13. f4 exf4 14. Rxf4 Qe7 15. d4 Bb6 16. Ng3 O-O-O 17. e5 c5 18. c3 cxd4 19. cxd4 Kb8 20. a4 a5 21. b4,"This is a game between Mieses, J (as White) and Znosko-Borovsky, E (as Black). Last move played: White plays Pawn to b4",Large advantage for White (eval: 162 centipawns),21... Qxb4 22. Rb1 Qc4 23. Nf5 f6 24. Nd6 Qc6 25. Nf7 Rhe8 26. Nxd8 Rxd8 27. Rc1 Qe6 28. exf6 gxf6 29. Qf1 Qe3 30. Rd1 Qb3 31. Rxf6 Qxa4 32. Rxh6 Kb7 33. Re6 Qc4 34. Qf7 Qb4 35. g4 Bxd4 36. g5 ,21. Nf5 Qf8 22. Rf3 Ka7 23. b4 Qxb4 24. Rb1 Qf8 25. Qc2 Rb8 26. Rb5 Qe8 27. Nxg7 Qd7 28. Nf5 Rhe8 29. Nxh6 Re6 30. Qd2 f6 31. exf6 Re4 32. Nf5 Rf8 33. Rxa5+ Kb7 34. Rb5 Rxf6 
Seizing the newly-opened file without delay.,True," The comment suggests a reckless, potentially disastrous move, indicating a flaw in the player's assessment of the resulting position.",1. e4 e5 2. Nc3 Nf6 3. Bc4 Nc6 4. d3 Bb4 5. Bg5 d6 6. Ne2 Be6 7. O-O h6 8. Bxf6 Qxf6 9. Nd5 Bxd5 10. Bxd5 Bc5 11. Bxc6+ bxc6 12. Kh1 d5 13. f4 exf4 14. Rxf4 Qe7 15. d4 Bb6 16. Ng3 O-O-O 17. e5 c5 18. c3 cxd4 19. cxd4 Kb8 20. a4 a5 21. b4 Qxb4 22. Rb1,"This is a game between Mieses, J (as White) and Znosko-Borovsky, E (as Black). Last move played: White plays Rook to b1",Large advantage for White (eval: 169 centipawns),22... Qc4 23. Nf5 f6 24. Nd6 Qc6 25. Nf7 Rhg8 26. Nxd8 Rxd8 27. exf6 gxf6 28. Rc1 Qd6 29. g3 Ka7 30. Qc2 Re8 31. Kg2 Qb4 32. Kh3 Re6 33. Rcf1 h5 34. Rc1 ,22. Rb1 Qc3 23. Nf5 f6 24. Rc1 Qb4 25. Rf3 Rhe8 26. Rb3 Qf8 27. Qc2 Ka7 28. Rcb1 Re6 29. Rxb6 cxb6 30. Qc7+ Ka6 31. Nxg7 Rde8 32. Qd7 Qe7 33. Qb5+ Ka7 34. Qxe8 Qxe8 35. Nxe8 Rxe8 36. exf6 Rf8 37. Rf1 b5 38. g4 bxa4 39. Kg2 Kb6 40. Kh3 
Now Mieses sets up a brilliant double-attack:,True," The comment suggests a potential tactical threat, indicating a flaw in the opponent's setup.",1. e4 e5 2. Nc3 Nf6 3. Bc4 Nc6 4. d3 Bb4 5. Bg5 d6 6. Ne2 Be6 7. O-O h6 8. Bxf6 Qxf6 9. Nd5 Bxd5 10. Bxd5 Bc5 11. Bxc6+ bxc6 12. Kh1 d5 13. f4 exf4 14. Rxf4 Qe7 15. d4 Bb6 16. Ng3 O-O-O 17. e5 c5 18. c3 cxd4 19. cxd4 Kb8 20. a4 a5 21. b4 Qxb4 22. Rb1 Qe7,"This is a game between Mieses, J (as White) and Znosko-Borovsky, E (as Black). Last move played: Black plays Queen to e7",Large advantage for White (eval: 225 centipawns),23. Nf5 Qd7 24. Nxg7 Ka7 25. Qc2 h5 26. Rbf1 Qe7 27. h3 Qb4 28. Rxf7 Qc4 29. Rc1 Qxc2 30. Rxc2 Bxd4 31. Rcxc7+ Kb6 32. Rb7+ Kc6 ,22... Qc4 23. Nf5 f6 24. Nd6 Qc6 25. Nf7 Rhg8 26. Nxd8 Rxd8 27. exf6 gxf6 28. Rc1 Qd6 29. g3 Ka7 30. Qc2 Re8 31. Kg2 Qb4 32. Kh3 Re6 33. Rcf1 h5 34. Rc1 
Simply glorious -- a fine example of probing both wings at once. White threatens both Rxf7 and Qa6.,True, The comment describes a move that is considered a mistake due to an unnecessary and potentially weak opening position.,1. e4 e5 2. Nc3 Nf6 3. Bc4 Nc6 4. d3 Bb4 5. Bg5 d6 6. Ne2 Be6 7. O-O h6 8. Bxf6 Qxf6 9. Nd5 Bxd5 10. Bxd5 Bc5 11. Bxc6+ bxc6 12. Kh1 d5 13. f4 exf4 14. Rxf4 Qe7 15. d4 Bb6 16. Ng3 O-O-O 17. e5 c5 18. c3 cxd4 19. cxd4 Kb8 20. a4 a5 21. b4 Qxb4 22. Rb1 Qe7 23. Qf1,"This is a game between Mieses, J (as White) and Znosko-Borovsky, E (as Black). Last move played: White plays Queen to f1",Large advantage for White (eval: 256 centipawns),23... Qe6 24. Qa6 f6 25. Qxa5 fxe5 26. dxe5 Qc6 27. e6 g5 28. Rf6 Rhe8 29. Qa6 Rxe6 30. Rxe6 Qxe6 31. a5 Rd6 32. Rf1 Qc8 33. Qb5 Qd7 34. Qxd7 Rxd7 35. axb6 c5 ,23. Nf5 Qd7 24. Nxg7 Ka7 25. Qc2 h5 26. Rbf1 Qe7 27. h3 Qb4 28. Rxf7 Qc4 29. Rc1 Qxc2 30. Rxc2 Bxd4 31. Rcxc7+ Kb6 32. Rb7+ Kc6 
"Black judges that of the two threats, Qa6 is the more deadly. White could play 24.Rxf7 now, a good move, but Mieses is ever searching for the most brilliant continuation. His search is rewarded with...",True," The comment suggests a potential tactical flaw stemming from Mieses's relentless pursuit of a brilliant continuation, indicating a mistake.",1. e4 e5 2. Nc3 Nf6 3. Bc4 Nc6 4. d3 Bb4 5. Bg5 d6 6. Ne2 Be6 7. O-O h6 8. Bxf6 Qxf6 9. Nd5 Bxd5 10. Bxd5 Bc5 11. Bxc6+ bxc6 12. Kh1 d5 13. f4 exf4 14. Rxf4 Qe7 15. d4 Bb6 16. Ng3 O-O-O 17. e5 c5 18. c3 cxd4 19. cxd4 Kb8 20. a4 a5 21. b4 Qxb4 22. Rb1 Qe7 23. Qf1 Ka7,"This is a game between Mieses, J (as White) and Znosko-Borovsky, E (as Black). Last move played: Black plays King to a7",Large advantage for White (eval: 366 centipawns),24. Rxb6 Kxb6 25. Qb5+ Ka7 26. Qxa5+ Kb7 27. Rf1 Rb8 28. Nf5 Qd8 29. Ne3 Re8 30. Nxd5 Kc8 31. Rc1 Re7 32. Nxe7+ Qxe7 33. h3 Kd8 34. Kh2 Rb2 35. Qa8+ Kd7 36. Qc6+ Kd8 ,23... Qe6 24. Qa6 f6 25. Qxa5 fxe5 26. dxe5 Qc6 27. e6 g5 28. Rf6 Rhe8 29. Qa6 Rxe6 30. Rxe6 Qxe6 31. a5 Rd6 32. Rf1 Qc8 33. Qb5 Qd7 34. Qxd7 Rxd7 35. axb6 c5 
"Having garnered a B+P for the Rook, Mieses already has back practically full compensation for the exchange. Of course, he also sacrificed a pawn to open the b-file. But the open file is worth far more to White than the pawn is to Black.",True," The comment offers a justification for the mistake, suggesting White benefits more from the open file.",1. e4 e5 2. Nc3 Nf6 3. Bc4 Nc6 4. d3 Bb4 5. Bg5 d6 6. Ne2 Be6 7. O-O h6 8. Bxf6 Qxf6 9. Nd5 Bxd5 10. Bxd5 Bc5 11. Bxc6+ bxc6 12. Kh1 d5 13. f4 exf4 14. Rxf4 Qe7 15. d4 Bb6 16. Ng3 O-O-O 17. e5 c5 18. c3 cxd4 19. cxd4 Kb8 20. a4 a5 21. b4 Qxb4 22. Rb1 Qe7 23. Qf1 Ka7 24. Rxb6 Kxb6 25. Qb5+ Ka7 26. Qxa5+,"This is a game between Mieses, J (as White) and Znosko-Borovsky, E (as Black). Last move played: White plays Queen takes on a5 with check",Large advantage for White (eval: 392 centipawns),26... Kb7 27. Rf1 ,26. Qxa5+ Kb7 27. Rf1 Rb8 28. Nf5 Qd8 29. Ne3 Re8 30. Nxd5 Kc8 31. Rc1 Re7 32. h3 Qd7 33. Nxe7+ Qxe7 34. Qc3 Qd7 35. d5 Rb7 36. Qd4 Kb8 37. a5 Rb5 
White switches sides effortlessly. This whole game exhibits a sort of grace in the attack for which Mieses was justly famous and well-beloved.,False,"

The comment offers a subjective and potentially misleading assessment of the move's quality, suggesting a flawless execution rather than a strategic error.",1. e4 e5 2. Nc3 Nf6 3. Bc4 Nc6 4. d3 Bb4 5. Bg5 d6 6. Ne2 Be6 7. O-O h6 8. Bxf6 Qxf6 9. Nd5 Bxd5 10. Bxd5 Bc5 11. Bxc6+ bxc6 12. Kh1 d5 13. f4 exf4 14. Rxf4 Qe7 15. d4 Bb6 16. Ng3 O-O-O 17. e5 c5 18. c3 cxd4 19. cxd4 Kb8 20. a4 a5 21. b4 Qxb4 22. Rb1 Qe7 23. Qf1 Ka7 24. Rxb6 Kxb6 25. Qb5+ Ka7 26. Qxa5+ Kb7 27. Rf1,"This is a game between Mieses, J (as White) and Znosko-Borovsky, E (as Black). Last move played: White plays Rook to f1",Large advantage for White (eval: 425 centipawns),27... Rb8 28. Nf5 ,27. Rf1 Qe6 28. Rb1+ Kc8 29. Rc1 Kd7 30. Rxc7+ Ke8 31. Qc5 Rd7 32. Qb5 Kd8 33. Rc6 Qg4 34. Qb6+ Ke7 35. Qc5+ Ke8 36. Nf1 f6 37. e6 Rd8 38. Kg1 Qe2 39. a5 
And now for the coup de grace:,True,". The comment suggests a devastating, unexpected move, indicating a significant error in the previous sequence of moves.",1. e4 e5 2. Nc3 Nf6 3. Bc4 Nc6 4. d3 Bb4 5. Bg5 d6 6. Ne2 Be6 7. O-O h6 8. Bxf6 Qxf6 9. Nd5 Bxd5 10. Bxd5 Bc5 11. Bxc6+ bxc6 12. Kh1 d5 13. f4 exf4 14. Rxf4 Qe7 15. d4 Bb6 16. Ng3 O-O-O 17. e5 c5 18. c3 cxd4 19. cxd4 Kb8 20. a4 a5 21. b4 Qxb4 22. Rb1 Qe7 23. Qf1 Ka7 24. Rxb6 Kxb6 25. Qb5+ Ka7 26. Qxa5+ Kb7 27. Rf1 Rb8 28. Nf5 Qe6,"This is a game between Mieses, J (as White) and Znosko-Borovsky, E (as Black). Last move played: Black plays Queen to e6",Large advantage for White (eval: 877 centipawns),29. Nd6+ Qxd6 30. exd6 Rhc8 31. Rb1+ Kc6 32. Rxb8 Kxd6 33. Rxc8 Ke6 34. Qxc7 Kf6 35. Rf8 Kf5 36. Qd7+ Ke4 37. Qg4+ Kd3 38. Qd1+ Kc4 39. Rxf7 ,28... Qd8 29. Ne3 Re8 30. Nxd5 Kc8 31. Rc1 Re7 32. Qa6+ Kd7 33. Qc6+ Kc8 34. Nxe7+ Qxe7 35. d5 Rb7 36. d6 Qd7 37. Qd5 Kb8 38. a5 cxd6 39. exd6 Rb2 40. Qe5 Qb5 41. Qxb5+ Rxb5 42. d7 Rd5 43. Rc8+ Ka7 
