comment,good,reasoning,moves,context,engine_eval,engine_best_line,engine_best_alternative
"Perhaps influenced by the renewed interest in the opening in the 1980s. The Queen's Gambit Accepted is an unusual choice from Fischer, who usually prefers a more hypermodern treatment of 1.d4.",True,", The comment suggests a potential influence on the move's quality due to a historical trend.",1. d4 d5 2. c4 dxc4,This is a game between Spassky (as White) and Fischer (as Black). Last move played: Black plays Pawn takes on c4,Slight advantage for White (eval: 26 centipawns),3. e3 Nf6 ,2... e6 3. Nf3 
3.e4 is a popular alternative which has been the subject of much scrutiny lately.,True," The comment suggests the move was considered a poor choice, indicating a potential flaw in the player's strategy.",1. d4 d5 2. c4 dxc4 3. Nf3,This is a game between Spassky (as White) and Fischer (as Black). Last move played: White plays Knight to f3,Slight advantage for White (eval: 31 centipawns),3... a6 4. e3 Nf6 5. Bxc4 c5 6. O-O e6 7. dxc5 Bxc5 8. Qxd8+ Kxd8 9. Be2 Ke7 10. Bd2 b6 11. Ne5 a5 12. Rc1 Nfd7 13. Nc4 Ba6 14. a3 Nc6 15. Nc3 ,3. e3 Nf6 
Spassky shows a definite preference for endgames in this match! 7.Qe2 and 7.a4 are the more common moves.,True," The comment suggests a potential weakness in Spassky’s opening strategy, indicating a focus on endgames.",1. d4 d5 2. c4 dxc4 3. Nf3 Nf6 4. e3 e6 5. Bxc4 c5 6. O-O a6 7. dxc5,This is a game between Spassky (as White) and Fischer (as Black). Last move played: White plays Pawn takes on c5,Slight advantage for White (eval: 27 centipawns),7... Bxc5 8. Qxd8+ Kxd8 9. Be2 Ke7 10. Nbd2 Bd7 11. Nb3 Bb6 12. Bd2 Nc6 13. Rfd1 Rhd8 14. Rac1 Kf8 15. Be1 Nd5 16. Nc5 Bxc5 17. Rxc5 Be8 18. e4 ,7. dxc5 Bxc5 8. Qxd8+ Kxd8 9. Be2 Ke7 10. Ne5 Nbd7 11. Nc4 a5 12. Nc3 b6 13. Na4 Ba6 14. Rd1 Rac8 15. b3 Bb4 16. a3 Bxc4 17. Bxc4 Bd6 
"9.a3 with the idea of playing b4, is more common here.",True," The comment suggests a potential tactical blunder, indicating a suboptimal choice.",1. d4 d5 2. c4 dxc4 3. Nf3 Nf6 4. e3 e6 5. Bxc4 c5 6. O-O a6 7. dxc5 Qxd1 8. Rxd1 Bxc5 9. b3,This is a game between Spassky (as White) and Fischer (as Black). Last move played: White plays Pawn to b3,Slight advantage for White (eval: 24 centipawns),9... Nbd7 10. Bb2 O-O 11. Nbd2 b6 12. Be2 Bb7 13. Nc4 Rfd8 14. Rac1 Rac8 15. Kf1 Kf8 16. Nce5 Nxe5 17. Rxd8+ Rxd8 18. Nxe5 Nd5 19. Nd3 Be7 ,9. Be2 
The cautious approach. The extended fianchetto (10...b5) is riskier because the pawn chain can be undermined by a2-a4.,True," The comment identifies a potential vulnerability in the opponent's position, suggesting a suboptimal move.",1. d4 d5 2. c4 dxc4 3. Nf3 Nf6 4. e3 e6 5. Bxc4 c5 6. O-O a6 7. dxc5 Qxd1 8. Rxd1 Bxc5 9. b3 Nbd7 10. Bb2 b6,This is a game between Spassky (as White) and Fischer (as Black). Last move played: Black plays Pawn to b6,Slight advantage for White (eval: 24 centipawns),11. Nbd2 O-O ,10... O-O 11. Nbd2 
Black has achieved full equality.,True," The comment suggests Black has reached a state of equilibrium, implying a flawed strategic decision.",1. d4 d5 2. c4 dxc4 3. Nf3 Nf6 4. e3 e6 5. Bxc4 c5 6. O-O a6 7. dxc5 Qxd1 8. Rxd1 Bxc5 9. b3 Nbd7 10. Bb2 b6 11. Nc3 Bb7 12. Rac1 Be7 13. Nd4 Rc8 14. f3 b5 15. Be2 Bc5,This is a game between Spassky (as White) and Fischer (as Black). Last move played: Black plays Bishop to c5,The position is equal,16. Nc2 O-O ,15... O-O 
A very lame move. 16.Kf2 Ke7 17.a4 bxa4 18.Nxa4 Ba7 maintains equality.,True," The comment suggests the move is weak and inefficient, indicating a potential mistake.",1. d4 d5 2. c4 dxc4 3. Nf3 Nf6 4. e3 e6 5. Bxc4 c5 6. O-O a6 7. dxc5 Qxd1 8. Rxd1 Bxc5 9. b3 Nbd7 10. Bb2 b6 11. Nc3 Bb7 12. Rac1 Be7 13. Nd4 Rc8 14. f3 b5 15. Be2 Bc5 16. Kf1,This is a game between Spassky (as White) and Fischer (as Black). Last move played: White plays King to f1,The position is equal,16... Ke7 17. e4 ,16. Nc2 O-O 
"A strategic disaster. White weakens the long diagonal without any good reason, allowing Fischer to develop an interesting counterattack. 17.Kf2 was the correct move.",True," The comment identifies a strategic flaw, suggesting the move was detrimental, indicating a mistake.",1. d4 d5 2. c4 dxc4 3. Nf3 Nf6 4. e3 e6 5. Bxc4 c5 6. O-O a6 7. dxc5 Qxd1 8. Rxd1 Bxc5 9. b3 Nbd7 10. Bb2 b6 11. Nc3 Bb7 12. Rac1 Be7 13. Nd4 Rc8 14. f3 b5 15. Be2 Bc5 16. Kf1 Ke7 17. e4,This is a game between Spassky (as White) and Fischer (as Black). Last move played: White plays Pawn to e4,The position is equal,17... Bd6 18. a4 b4 19. Nd5+ exd5 20. Nf5+ Ke6 21. Nxg7+ Ke7 22. Nf5+ Ke6 ,17. e4 Bd6 18. a4 b4 19. Nd5+ exd5 20. Nf5+ Ke6 21. Nxg7+ Ke7 22. Nf5+ Ke6 23. Nd4+ Ke7 
"Black intends to advance the g-pawn, capture at f3, bring a knight to f4 and put a rook on the g-file, a simple and effective plan.",True," The comment offers a potential plan, but lacks specific tactical analysis or strategic considerations, suggesting a flawed assessment.",1. d4 d5 2. c4 dxc4 3. Nf3 Nf6 4. e3 e6 5. Bxc4 c5 6. O-O a6 7. dxc5 Qxd1 8. Rxd1 Bxc5 9. b3 Nbd7 10. Bb2 b6 11. Nc3 Bb7 12. Rac1 Be7 13. Nd4 Rc8 14. f3 b5 15. Be2 Bc5 16. Kf1 Ke7 17. e4 g5,This is a game between Spassky (as White) and Fischer (as Black). Last move played: Black plays Pawn to g5,Slight advantage for White (eval: 26 centipawns),18. a4 ,17... Bd6 18. a4 b4 19. Nd5+ exd5 20. Nf5+ Ke6 21. Nxg7+ Ke7 22. Nf5+ Ke6 
The point of this move is to try to exchange dark squared bishops after Ba3.,True,", The comment suggests a potential weakness in the move's strategic intent.",1. d4 d5 2. c4 dxc4 3. Nf3 Nf6 4. e3 e6 5. Bxc4 c5 6. O-O a6 7. dxc5 Qxd1 8. Rxd1 Bxc5 9. b3 Nbd7 10. Bb2 b6 11. Nc3 Bb7 12. Rac1 Be7 13. Nd4 Rc8 14. f3 b5 15. Be2 Bc5 16. Kf1 Ke7 17. e4 g5 18. Nb1,This is a game between Spassky (as White) and Fischer (as Black). Last move played: White plays Knight to b1,Slight advantage for White (eval: 39 centipawns),18... Bd6 ,18. a4 
It is hard to believe that Fischer overlooked the obvious exchange sacrifice which follows. 19...Bxa3 20.Nxa3 gxf3 21.gxf3 Rhg8 22.Kf2 Ne5 with good play for Black.,True," The comment provides context for why the move was considered a mistake, suggesting a missed opportunity for Black.",1. d4 d5 2. c4 dxc4 3. Nf3 Nf6 4. e3 e6 5. Bxc4 c5 6. O-O a6 7. dxc5 Qxd1 8. Rxd1 Bxc5 9. b3 Nbd7 10. Bb2 b6 11. Nc3 Bb7 12. Rac1 Be7 13. Nd4 Rc8 14. f3 b5 15. Be2 Bc5 16. Kf1 Ke7 17. e4 g5 18. Nb1 g4 19. Ba3 b4,This is a game between Spassky (as White) and Fischer (as Black). Last move played: Black plays Pawn to b4,Large advantage for White (eval: 119 centipawns),20. Rxc5 Nxc5 21. Bxb4 h5 22. Nd2 h4 23. h3 gxf3 24. gxf3 a5 25. Ba3 Nd7 26. Kf2 Kf6 27. Nc4 Ba6 28. Nd6 Bxe2 29. Kxe2 Rcg8 30. e5+ Kg6 31. Rc1 Na6 32. f4 Rg7 33. f5+ Kh7 34. fxe6 fxe6 35. Nxe6 ,19... Bxa3 20. Nxa3 Ne5 21. Nac2 Rhd8 22. a4 b4 23. a5 Nh5 24. Rb1 Nf4 25. Nxb4 Nxe2 26. Kxe2 h5 27. Na2 gxf3+ 28. gxf3 
Now White's position is superior thanks to his ferocious bishop and the vulnerable Black king. The distance between a very good position and a very bad one is very small indeed!,True," The comment offers a justification for the mistake, suggesting a significant advantage for White.",1. d4 d5 2. c4 dxc4 3. Nf3 Nf6 4. e3 e6 5. Bxc4 c5 6. O-O a6 7. dxc5 Qxd1 8. Rxd1 Bxc5 9. b3 Nbd7 10. Bb2 b6 11. Nc3 Bb7 12. Rac1 Be7 13. Nd4 Rc8 14. f3 b5 15. Be2 Bc5 16. Kf1 Ke7 17. e4 g5 18. Nb1 g4 19. Ba3 b4 20. Rxc5 Nxc5 21. Bxb4,This is a game between Spassky (as White) and Fischer (as Black). Last move played: White plays Bishop takes on b4,Large advantage for White (eval: 129 centipawns),21... h5 22. Nd2 ,21. Bxb4 
"White has already achieved a completely dominating position because all of his pieces are active, while Black lacks any counterplay.",True," The comment suggests a flawed assessment of the position's dynamic, implying a lack of counterplay, which is a common mistake in chess analysis.",1. d4 d5 2. c4 dxc4 3. Nf3 Nf6 4. e3 e6 5. Bxc4 c5 6. O-O a6 7. dxc5 Qxd1 8. Rxd1 Bxc5 9. b3 Nbd7 10. Bb2 b6 11. Nc3 Bb7 12. Rac1 Be7 13. Nd4 Rc8 14. f3 b5 15. Be2 Bc5 16. Kf1 Ke7 17. e4 g5 18. Nb1 g4 19. Ba3 b4 20. Rxc5 Nxc5 21. Bxb4 Rhd8 22. Na3 gxf3 23. gxf3 Nd7 24. Nc4,This is a game between Spassky (as White) and Fischer (as Black). Last move played: White plays Knight to c4,Large advantage for White (eval: 221 centipawns),24... Ba8 25. Rc1 h6 26. Ba3 Rc7 27. Kf2 Kf6 28. Ke3 Nb7 29. Rg1 Nbc5 30. Rg4 Ke7 31. Rh4 Kf6 32. Rxh6+ Kg7 ,24. Nc4 Ba8 25. Rc1 Rg8 26. Nb6 Nxb6 27. Bxc5+ Kf6 28. Bxa6 Rb8 29. Bb5 Rg5 30. a4 Rh5 31. Rc2 Nc8 32. b4 Ne7 33. Nb3 e5 34. Bc4 Ng6 35. Bd6 Rc8 36. a5 
Spassky intensifies the pressure with every move.,True,". The comment suggests the player is trying to increase the pressure, which is a common tactic in mistakes, indicating a potential lack of strategic understanding.",1. d4 d5 2. c4 dxc4 3. Nf3 Nf6 4. e3 e6 5. Bxc4 c5 6. O-O a6 7. dxc5 Qxd1 8. Rxd1 Bxc5 9. b3 Nbd7 10. Bb2 b6 11. Nc3 Bb7 12. Rac1 Be7 13. Nd4 Rc8 14. f3 b5 15. Be2 Bc5 16. Kf1 Ke7 17. e4 g5 18. Nb1 g4 19. Ba3 b4 20. Rxc5 Nxc5 21. Bxb4 Rhd8 22. Na3 gxf3 23. gxf3 Nd7 24. Nc4 Ba8 25. Kf2 Rg8 26. h4 Rc7 27. Nc2 Rb8 28. Ba3 h5 29. Rg1 Kf6 30. Ke3 a5 31. Rg5,This is a game between Spassky (as White) and Fischer (as Black). Last move played: White plays Rook to g5,Large advantage for White (eval: 263 centipawns),31... e5 32. Bb2 Ke7 33. Bxe5 Nxe5 34. Rxe5+ Ne6 35. Rxa5 Rc5 36. Rxc5 Nxc5 37. Nd4 f6 38. Nf5+ Kf8 39. Ng3 Bb7 40. Nxh5 Ra8 41. Nxf6 Rxa2 42. b4 Ne6 43. Nd7+ Ke8 ,31. Nd4 e5 32. Nf5 a4 33. bxa4 Bc6 34. Rg5 Bxa4 35. Rxh5 Rg8 36. Ncd6 Nb6 37. Nh6 Rg2 38. Ng4+ Ke7 39. Rh6 f6 40. Nxf6 Ne6 41. Nde8+ Kd8 42. Nxc7 Nf4 43. Ne6+ Nxe6 44. Rh8+ Kc7 45. Nd5+ Nxd5+ 46. exd5 
"White's domination is complete. Fischer now embarks on a desperate sacrifice, but it doesn't work.",True," The comment suggests a significant tactical blunder and a reckless move, indicating a mistake.",1. d4 d5 2. c4 dxc4 3. Nf3 Nf6 4. e3 e6 5. Bxc4 c5 6. O-O a6 7. dxc5 Qxd1 8. Rxd1 Bxc5 9. b3 Nbd7 10. Bb2 b6 11. Nc3 Bb7 12. Rac1 Be7 13. Nd4 Rc8 14. f3 b5 15. Be2 Bc5 16. Kf1 Ke7 17. e4 g5 18. Nb1 g4 19. Ba3 b4 20. Rxc5 Nxc5 21. Bxb4 Rhd8 22. Na3 gxf3 23. gxf3 Nd7 24. Nc4 Ba8 25. Kf2 Rg8 26. h4 Rc7 27. Nc2 Rb8 28. Ba3 h5 29. Rg1 Kf6 30. Ke3 a5 31. Rg5 a4 32. b4 Nb7 33. b5 Nbc5 34. Nd4,This is a game between Spassky (as White) and Fischer (as Black). Last move played: White plays Knight to d4,Large advantage for White (eval: 404 centipawns),34... Rcc8 35. Bb4 Rc7 36. b6 Rcc8 37. Nb5 Bb7 38. Na7 Rg8 39. Rxc5 Nxc5 40. Bxc5 Rg2 41. Bd4+ Kg6 42. Ne5+ Kh7 43. Nxf7 Rh2 44. Bc4 Rxh4 45. Bxe6 Rh1 46. Nd6 ,34. Nd4 Rcc8 35. Bb4 Rc7 36. b6 Rcc8 37. Nb5 Rg8 38. Bxc5 Rxg5 39. hxg5+ Kxg5 40. Bd6 Rg8 41. Nc7 Bb7 42. Bf4+ Kg6 43. Kf2 h4 44. Bf1 Kh5 45. Bh3 a3 
A mistake.,True,"  The comment directly states a mistake, indicating a problem with the move.",1. d4 d5 2. c4 dxc4 3. Nf3 Nf6 4. e3 e6 5. Bxc4 c5 6. O-O a6 7. dxc5 Qxd1 8. Rxd1 Bxc5 9. b3 Nbd7 10. Bb2 b6 11. Nc3 Bb7 12. Rac1 Be7 13. Nd4 Rc8 14. f3 b5 15. Be2 Bc5 16. Kf1 Ke7 17. e4 g5 18. Nb1 g4 19. Ba3 b4 20. Rxc5 Nxc5 21. Bxb4 Rhd8 22. Na3 gxf3 23. gxf3 Nd7 24. Nc4 Ba8 25. Kf2 Rg8 26. h4 Rc7 27. Nc2 Rb8 28. Ba3 h5 29. Rg1 Kf6 30. Ke3 a5 31. Rg5 a4 32. b4 Nb7 33. b5 Nbc5 34. Nd4 e5,This is a game between Spassky (as White) and Fischer (as Black). Last move played: Black plays Pawn to e5,Large advantage for White (eval: 433 centipawns),35. Nf5 Rh8 36. Bb4 a3 37. Nfd6 Rf8 38. Rxh5 Kg6 39. Rg5+ Kf6 40. Rf5+ Ke7 41. Rh5 Rg8 42. Rh6 Ra7 43. Nf5+ Kd8 44. Rd6 Kc8 45. b6 Ra4 46. Ne7+ Kb8 47. Nxg8 Rxb4 ,34... Rcc8 35. Bb4 Rc7 36. b6 Rcc8 37. Nb5 Bb7 38. Na7 Rg8 39. Rxc5 Nxc5 40. Bxc5 Rg2 41. Bd4+ Kg6 42. Ne5+ Kh7 43. Nxf7 Rh2 44. Bc4 Rxh4 45. Bxe6 Rh1 46. Nd6 
The point of the combination. If Black takes the knight Fischer will escape.,True," The comment offers a potential explanation for the mistake, suggesting a tactical opportunity for Black.",1. d4 d5 2. c4 dxc4 3. Nf3 Nf6 4. e3 e6 5. Bxc4 c5 6. O-O a6 7. dxc5 Qxd1 8. Rxd1 Bxc5 9. b3 Nbd7 10. Bb2 b6 11. Nc3 Bb7 12. Rac1 Be7 13. Nd4 Rc8 14. f3 b5 15. Be2 Bc5 16. Kf1 Ke7 17. e4 g5 18. Nb1 g4 19. Ba3 b4 20. Rxc5 Nxc5 21. Bxb4 Rhd8 22. Na3 gxf3 23. gxf3 Nd7 24. Nc4 Ba8 25. Kf2 Rg8 26. h4 Rc7 27. Nc2 Rb8 28. Ba3 h5 29. Rg1 Kf6 30. Ke3 a5 31. Rg5 a4 32. b4 Nb7 33. b5 Nbc5 34. Nd4 e5 35. Nxe5 Nxe5 36. Rf5+ Kg7 37. Rxe5 Nxe4,This is a game between Spassky (as White) and Fischer (as Black). Last move played: Black plays Knight takes on e4,Large advantage for White (eval: 343 centipawns),38. Bd3 Rc3 39. Bb4 Rxd3+ 40. Kxd3 Nf6 41. Bc3 Rd8 42. Kc4 Kh7 43. Rc5 Nd7 44. Rxh5+ Kg6 45. Rg5+ Kh7 46. Nf5 Nb6+ 47. Kc5 Nd5 48. Rg7+ Kh8 49. Ba1 Rc8+ 50. Kd6 Rd8+ 51. Ke5 Rd7 52. Rg5 Kh7 53. Rh5+ Kg8 54. Rh6 Nc7 55. Rd6 Rxd6 56. Nxd6 Bxf3 ,37... Nxe4 38. Bd3 Rc3 39. Bb4 Rxd3+ 40. Kxd3 Nf6 41. Bd6 Rc8 42. Rg5+ Kh7 43. Rf5 Kg6 44. a3 Nh7 45. Rc5 Rxc5 46. Bxc5 Nf6 47. Kc4 Nd5 48. Nc6 Nf4 49. Bd6 Ng2 50. Bg3 Kf6 51. Kb4 Ke6 52. Kxa4 Kd5 53. Nd8 f6 54. Bf2 Kc4 55. Ka5 Bxf3 
38.fxe4 Rc3+,True, The comment suggests a potential tactical blunder due to an unsupported queen advance.,1. d4 d5 2. c4 dxc4 3. Nf3 Nf6 4. e3 e6 5. Bxc4 c5 6. O-O a6 7. dxc5 Qxd1 8. Rxd1 Bxc5 9. b3 Nbd7 10. Bb2 b6 11. Nc3 Bb7 12. Rac1 Be7 13. Nd4 Rc8 14. f3 b5 15. Be2 Bc5 16. Kf1 Ke7 17. e4 g5 18. Nb1 g4 19. Ba3 b4 20. Rxc5 Nxc5 21. Bxb4 Rhd8 22. Na3 gxf3 23. gxf3 Nd7 24. Nc4 Ba8 25. Kf2 Rg8 26. h4 Rc7 27. Nc2 Rb8 28. Ba3 h5 29. Rg1 Kf6 30. Ke3 a5 31. Rg5 a4 32. b4 Nb7 33. b5 Nbc5 34. Nd4 e5 35. Nxe5 Nxe5 36. Rf5+ Kg7 37. Rxe5 Nxe4 38. Bd3,This is a game between Spassky (as White) and Fischer (as Black). Last move played: White plays Bishop to d3,Large advantage for White (eval: 321 centipawns),38... Rc3 39. Bb4 Rxd3+ 40. Kxd3 Nf6 41. Rg5+ Kh7 42. a3 Rc8 43. Rc5 Rxc5 44. Bxc5 Nd7 45. Bd6 Nb6 46. Bc7 Nd5 47. Bb8 Kg6 48. Kc4 Kf6 49. Bd6 Bb7 50. Kc5 Ba8 51. f4 Kg6 52. b6 f5 53. Kb5 Nc3+ 54. Kc4 ,38. Bd3 Rc3 39. Bb4 Rxd3+ 40. Kxd3 Nf6 41. Bc3 Rd8 42. Kc4 Kh7 43. Rc5 Nd7 44. Rxh5+ Kg6 45. Rg5+ Kh7 46. Nf5 Nb6+ 47. Kc5 Nd5 48. Rg7+ Kh8 49. Ba1 Rc8+ 50. Kd6 Rd8+ 51. Ke5 Rd7 52. Rg5 Kh7 53. Rh5+ Kg8 54. Rh6 Nc7 55. Rd6 Rxd6 56. Nxd6 Bxf3 
Spassky's ship steers clear of the final reef and the game heads for home.,True," The comment offers a somewhat descriptive, but somewhat vague, explanation of the move's result, suggesting a strategic blunder.",1. d4 d5 2. c4 dxc4 3. Nf3 Nf6 4. e3 e6 5. Bxc4 c5 6. O-O a6 7. dxc5 Qxd1 8. Rxd1 Bxc5 9. b3 Nbd7 10. Bb2 b6 11. Nc3 Bb7 12. Rac1 Be7 13. Nd4 Rc8 14. f3 b5 15. Be2 Bc5 16. Kf1 Ke7 17. e4 g5 18. Nb1 g4 19. Ba3 b4 20. Rxc5 Nxc5 21. Bxb4 Rhd8 22. Na3 gxf3 23. gxf3 Nd7 24. Nc4 Ba8 25. Kf2 Rg8 26. h4 Rc7 27. Nc2 Rb8 28. Ba3 h5 29. Rg1 Kf6 30. Ke3 a5 31. Rg5 a4 32. b4 Nb7 33. b5 Nbc5 34. Nd4 e5 35. Nxe5 Nxe5 36. Rf5+ Kg7 37. Rxe5 Nxe4 38. Bd3 Rc3 39. Bb4,This is a game between Spassky (as White) and Fischer (as Black). Last move played: White plays Bishop to b4,Large advantage for White (eval: 337 centipawns),39... Rxd3+ 40. Kxd3 Nf6 41. Nc6 Rc8 42. Rg5+ Kh6 43. Bd2 Kh7 44. Rc5 Nd7 45. Rxh5+ Kg7 46. Bc3+ f6 47. Rd5 Nb8 48. Rd8 Rxd8+ 49. Nxd8 Bd5 50. a3 Nd7 51. f4 Kg6 52. Kd4 Bf3 53. Ke3 Bd1 54. Bd4 Kh5 55. b6 Kxh4 56. b7 Kg4 57. Nc6 ,39. Bb4 Rxd3+ 40. Kxd3 Nf6 41. Rg5+ Kh7 42. Nc6 Rc8 43. Ne7 Rc7 44. Rf5 Kg7 45. Bc3 Rxe7 46. Rxf6 Kg8 47. Rf5 f6 48. Bxf6 Rf7 49. Kc4 Bb7 50. Rf4 Kh7 
This modest pawn decides the outcome of the game.,True," The comment suggests the pawn's move was insignificant, implying a flawed strategy.",1. d4 d5 2. c4 dxc4 3. Nf3 Nf6 4. e3 e6 5. Bxc4 c5 6. O-O a6 7. dxc5 Qxd1 8. Rxd1 Bxc5 9. b3 Nbd7 10. Bb2 b6 11. Nc3 Bb7 12. Rac1 Be7 13. Nd4 Rc8 14. f3 b5 15. Be2 Bc5 16. Kf1 Ke7 17. e4 g5 18. Nb1 g4 19. Ba3 b4 20. Rxc5 Nxc5 21. Bxb4 Rhd8 22. Na3 gxf3 23. gxf3 Nd7 24. Nc4 Ba8 25. Kf2 Rg8 26. h4 Rc7 27. Nc2 Rb8 28. Ba3 h5 29. Rg1 Kf6 30. Ke3 a5 31. Rg5 a4 32. b4 Nb7 33. b5 Nbc5 34. Nd4 e5 35. Nxe5 Nxe5 36. Rf5+ Kg7 37. Rxe5 Nxe4 38. Bd3 Rc3 39. Bb4 Rxd3+ 40. Kxd3 Nf6 41. Bd6 Rc8 42. Rg5+ Kh7 43. Be5 Ne8 44. Rxh5+ Kg6 45. Rg5+ Kh7 46. Bf4 f6 47. Rf5 Kg6 48. b6,This is a game between Spassky (as White) and Fischer (as Black). Last move played: White plays Pawn to b6,Large advantage for White (eval: 466 centipawns),48... Rd8 49. Ra5 Bxf3 50. h5+ Kh7 51. Ra7+ Kh8 52. Ke3 Bh1 53. Nf5 Rd1 54. b7 Bxb7 55. Rxb7 Ra1 56. Rb8 Kh7 57. Rb2 a3 58. Rd2 Kh8 59. h6 ,48. h5+ Kh7 49. b6 Bb7 50. Ra5 Ra8 51. Rxa8 Bxa8 52. Kc4 Ng7 53. Kb5 Nxh5 54. Bd2 Ng7 55. Ka6 Kg8 56. b7 Bxb7+ 57. Kxb7 Nf5 58. Nb5 Nd6+ 59. Nxd6 Kf8 60. Kc8 Ke7 
Black resigns. The worst game by Fischer in the first half of the match. Spassky played quite well.,True," The comment suggests a resignation, indicating a significant error in the move.",1. d4 d5 2. c4 dxc4 3. Nf3 Nf6 4. e3 e6 5. Bxc4 c5 6. O-O a6 7. dxc5 Qxd1 8. Rxd1 Bxc5 9. b3 Nbd7 10. Bb2 b6 11. Nc3 Bb7 12. Rac1 Be7 13. Nd4 Rc8 14. f3 b5 15. Be2 Bc5 16. Kf1 Ke7 17. e4 g5 18. Nb1 g4 19. Ba3 b4 20. Rxc5 Nxc5 21. Bxb4 Rhd8 22. Na3 gxf3 23. gxf3 Nd7 24. Nc4 Ba8 25. Kf2 Rg8 26. h4 Rc7 27. Nc2 Rb8 28. Ba3 h5 29. Rg1 Kf6 30. Ke3 a5 31. Rg5 a4 32. b4 Nb7 33. b5 Nbc5 34. Nd4 e5 35. Nxe5 Nxe5 36. Rf5+ Kg7 37. Rxe5 Nxe4 38. Bd3 Rc3 39. Bb4 Rxd3+ 40. Kxd3 Nf6 41. Bd6 Rc8 42. Rg5+ Kh7 43. Be5 Ne8 44. Rxh5+ Kg6 45. Rg5+ Kh7 46. Bf4 f6 47. Rf5 Kg6 48. b6 Rd8 49. Ra5 Bxf3 50. h5+ Kf7 51. Ra7+,This is a game between Spassky (as White) and Fischer (as Black). Last move played: White plays Rook to a7 with check,Large advantage for White (eval: 554 centipawns),51... Kg8 52. Ke3 Bd5 53. Nf5 Kh8 54. b7 Bxb7 55. Rxb7 Rd1 56. h6 Re1+ 57. Kf2 Re4 58. Kf3 Re1 59. Nh4 Rf1+ 60. Kg4 Rg1+ 61. Kf5 Ng7+ 62. hxg7+ Rxg7 63. Ng6+ Kh7 ,51. Ra7+ Kg8 52. Ke3 Bd5 53. Nf5 Bxa2 54. b7 Ng7 55. Nxg7 Bd5 56. b8=Q Rxb8 57. Bxb8 Bf7 58. h6 a3 59. Kf4 Kh8 60. Kf5 Bc4 61. Kxf6 a2 62. Ne6 Bd3 63. Rxa2 
7...Bxc5 8.Qxd8+ Kxd8 9.Nbd2 Ke7 10.b3 b6 11.Bb2 Bb7 12.Be2 Nbd7=,True," The comment describes a strategic consequence of the move, suggesting a flawed plan.",1. d4 d5 2. c4 dxc4 3. Nf3 Nf6 4. e3 e6 5. Bxc4 c5 6. O-O a6 7. dxc5 Qxd1,This is a game between Spassky (as White) and Fischer (as Black). Last move played: Black plays Queen takes on d1,Slight advantage for White (eval: 30 centipawns),8. Rxd1 Bxc5 ,7... Bxc5 8. Qxd8+ Kxd8 9. Be2 Ke7 10. Nbd2 Bd7 11. Nb3 Bb6 12. Bd2 Nc6 13. Rfd1 Rhd8 14. Rac1 Kf8 15. Be1 Nd5 16. Nc5 Bxc5 17. Rxc5 Be8 18. e4 
"9.a3 with the idea of playing b4, is more common here.",True," The comment highlights a potential weakness in the move, suggesting a lack of strategic options, indicating a flawed decision.",1. d4 d5 2. c4 dxc4 3. Nf3 Nf6 4. e3 e6 5. Bxc4 c5 6. O-O a6 7. dxc5 Qxd1 8. Rxd1 Bxc5 9. b3,This is a game between Spassky (as White) and Fischer (as Black). Last move played: White plays Pawn to b3,Slight advantage for White (eval: 24 centipawns),9... Nbd7 10. Bb2 O-O 11. Nbd2 b6 12. Be2 Bb7 13. Nc4 Rfd8 14. Rac1 Rac8 15. Kf1 Kf8 16. Nce5 Nxe5 17. Rxd8+ Rxd8 18. Nxe5 Nd5 19. Nd3 Be7 ,9. Be2 
