comment,good,reasoning,moves,context
A move designed to take advantage of White's passive opening.,False,"

The comment does not explain the mistake made by the player as it only suggests a strategy that could be used in the situation, not providing a specific analysis of the poor move.",1. e4 e6 2. d3 d5 3. Nd2 e5,"This is a game between Simpson, R. (as White) and Beacon, R. (as Black). Last move played: Black plays Pawn to e5"
"After this exchange it is difficult for White to ""harass"" the Queen on d5.",True,"

The comment accurately explains the mistake made by the player, as it highlights the strategic disadvantage created by the exchange, which hampers White's ability to put pressure on the Black Queen on d5.",1. e4 e6 2. d3 d5 3. Nd2 e5 4. exd5,"This is a game between Simpson, R. (as White) and Beacon, R. (as Black). Last move played: White plays Pawn takes on d5"
This is too passive. 9.d4 or 9.c4 would be more promising.,True,"

The comment accurately explains the mistake made by the player as it suggests more aggressive moves that would have been more promising than the passive move played.",1. e4 e6 2. d3 d5 3. Nd2 e5 4. exd5 Qxd5 5. Qe2 Nc6 6. Ngf3 f5 7. c3 Nf6 8. Nb3 Be7 9. Nfd2,"This is a game between Simpson, R. (as White) and Beacon, R. (as Black). Last move played: White plays Knight to d2"
"Obviously Queenside castling would have prevented this move which ""underdevelops"" White's game.",True,"
The comment accurately explains the mistake made by the player, as it points out that Queenside castling could have prevented the move and highlights the underdevelopment of White's game due to that move.",1. e4 e6 2. d3 d5 3. Nd2 e5 4. exd5 Qxd5 5. Qe2 Nc6 6. Ngf3 f5 7. c3 Nf6 8. Nb3 Be7 9. Nfd2 O-O 10. Nc4 f4 11. d4 exd4 12. Nxd4 Nxd4 13. cxd4 Bb4+ 14. Bd2 Re8 15. Ne5 Qxd4 16. Qc4+ Qxc4 17. Bxc4+ Be6 18. Bxe6+ Rxe6 19. Bxb4 Rxe5+ 20. Kf1,"This is a game between Simpson, R. (as White) and Beacon, R. (as Black). Last move played: White plays King to f1"
The main merit of this game is Black's third move ...e5. It is a rare move which looks promising for Black.,False,"

The comment does not explain the mistake made by the player, as it only praises Black's move e5 without providing any insight into the mistake.",1. e4 e6 2. d3 d5 3. Nd2 e5 4. exd5 Qxd5 5. Qe2 Nc6 6. Ngf3 f5 7. c3 Nf6 8. Nb3 Be7 9. Nfd2 O-O 10. Nc4 f4 11. d4 exd4 12. Nxd4 Nxd4 13. cxd4 Bb4+ 14. Bd2 Re8 15. Ne5 Qxd4 16. Qc4+ Qxc4 17. Bxc4+ Be6 18. Bxe6+ Rxe6 19. Bxb4 Rxe5+ 20. Kf1 Rae8 21. f3 Re2 22. Bc3 Nd5 23. Bd4 Rd2 24. Bxa7 b6 25. h3 Ne3+ 26. Ke1 Rxb2 27. Rc1 Rxa2 28. Rg1 Rxa7 29. Kd2 c5 30. g3 fxg3 31. Rxg3 Rd7+ 32. Kc3 Kf7 33. Kb3 Nf5 34. Rgg1 Nd4+,"This is a game between Simpson, R. (as White) and Beacon, R. (as Black). Last move played: Black plays Knight to d4 with check"
