comment,good,reasoning,moves,context,engine_eval,engine_best_line,engine_best_alternative
By transposition we have reached the Four Pawns variation.,True," The comment suggests a potential error in the move, indicating a possible tactical blunder.",1. c4 g6 2. Nc3 Bg7 3. d4 c5 4. d5 Nf6 5. e4 d6 6. Bd3 O-O 7. f4,This is a game between Hernandez (as White) and Kasparov (as Black). Last move played: White plays Pawn to f4,Slight advantage for White (eval: 34 centipawns),7... e6 8. Nge2 exd5 9. exd5 Nh5 10. O-O f5 11. Bd2 Nd7 12. Qc2 Ndf6 13. Rae1 a6 14. a4 Re8 15. g3 Ng4 16. Nd1 b6 17. h3 Ngf6 18. Kg2 Ra7 19. Ng1 Rae7 20. Rxe7 Qxe7 ,7. h3 e6 8. Nf3 exd5 9. exd5 Re8+ 10. Be3 Bh6 11. O-O Bxe3 12. fxe3 Qe7 13. e4 Nbd7 14. Qd2 Ne5 15. Nxe5 Qxe5 16. Qf4 Kg7 17. Nb5 Rd8 18. Qxe5 dxe5 19. Nc7 Rb8 20. g4 h6 21. Rf2 Nh7 22. b4 Ng5 23. Kg2 cxb4 
Black gains a strong initiative with this pawn sacrifice.,True,". The comment suggests Black has an advantage, implying a potential weakness in the player's position, which is a key indicator of a mistake.",1. c4 g6 2. Nc3 Bg7 3. d4 c5 4. d5 Nf6 5. e4 d6 6. Bd3 O-O 7. f4 a6 8. Nge2 b5,This is a game between Hernandez (as White) and Kasparov (as Black). Last move played: Black plays Pawn to b5,The position is equal,9. cxb5 ,8... b5 9. cxb5 Qb6 10. a4 axb5 11. Bxb5 Bd7 12. Ng3 Bxb5 13. Nxb5 c4 14. Qe2 Nbd7 15. Be3 Qa5+ 16. Bd2 Qb6 
"10.Bxb5 Ba6 11.Bxa6 Nxa6 12.O-O gives Black has good play against White's queenside, as numerous Benko Gambit's have shown.",True," The comment suggests a potential tactical blunder, indicating a flawed strategic assessment.",1. c4 g6 2. Nc3 Bg7 3. d4 c5 4. d5 Nf6 5. e4 d6 6. Bd3 O-O 7. f4 a6 8. Nge2 b5 9. cxb5 axb5 10. Nxb5,This is a game between Hernandez (as White) and Kasparov (as Black). Last move played: White plays Knight takes on b5,Advantage for Black (eval: -62 centipawns),10... Ba6 11. Nbc3 ,10. Bxb5 Qb6 11. a4 Bd7 12. Ng3 Bxb5 13. Nxb5 c4 14. Ra3 Nbd7 15. Be3 Qa5+ 16. Bd2 Qb6 17. Be3 
Opening the h8-a1 diagonal for the dark squared bishop.,True,", The comment suggests an illegal move, indicating a flaw in the opening strategy.",1. c4 g6 2. Nc3 Bg7 3. d4 c5 4. d5 Nf6 5. e4 d6 6. Bd3 O-O 7. f4 a6 8. Nge2 b5 9. cxb5 axb5 10. Nxb5 Ba6 11. Nec3 c4 12. Bc2 Bxb5 13. Nxb5 Qa5+ 14. Nc3 Nfd7,This is a game between Hernandez (as White) and Kasparov (as Black). Last move played: Black plays Knight to d7,Advantage for Black (eval: -56 centipawns),15. a4 Na6 ,14... Nfd7 15. a4 
White has lost a valuable tempo with his queen.,True," The comment suggests the queen's position is unfavorable, indicating a missed opportunity.",1. c4 g6 2. Nc3 Bg7 3. d4 c5 4. d5 Nf6 5. e4 d6 6. Bd3 O-O 7. f4 a6 8. Nge2 b5 9. cxb5 axb5 10. Nxb5 Ba6 11. Nec3 c4 12. Bc2 Bxb5 13. Nxb5 Qa5+ 14. Nc3 Nfd7 15. Qf3 Na6 16. O-O Nb4 17. Qe2,This is a game between Hernandez (as White) and Kasparov (as Black). Last move played: White plays Queen to e2,Large advantage for Black (eval: -122 centipawns),17... Nc5 18. Kh1 Rfb8 19. f5 Nxc2 20. Qxc2 Nd3 21. Nd1 Qc5 22. fxg6 hxg6 23. Qe2 Qd4 24. Bd2 Rxb2 25. Nxb2 Qxb2 26. a4 Qc2 27. Ra3 c3 28. a5 cxd2 ,17. Bb1 
The occupation of the d3 square spells doom for White's queenside.,True," The comment suggests a potential vulnerability stemming from the queen’s position, indicating a flawed strategic decision.",1. c4 g6 2. Nc3 Bg7 3. d4 c5 4. d5 Nf6 5. e4 d6 6. Bd3 O-O 7. f4 a6 8. Nge2 b5 9. cxb5 axb5 10. Nxb5 Ba6 11. Nec3 c4 12. Bc2 Bxb5 13. Nxb5 Qa5+ 14. Nc3 Nfd7 15. Qf3 Na6 16. O-O Nb4 17. Qe2 Nc5 18. Be3 Nbd3,This is a game between Hernandez (as White) and Kasparov (as Black). Last move played: Black plays Knight to d3,Advantage for Black (eval: -79 centipawns),19. e5 ,18... Nxc2 19. Qxc2 
20.Kh1 Nxb2 21.Qxb2 Bxc3 is thematic in this type of position.,True," The comment suggests the move was strategically unsound, indicating a potential flaw in the player's planning.",1. c4 g6 2. Nc3 Bg7 3. d4 c5 4. d5 Nf6 5. e4 d6 6. Bd3 O-O 7. f4 a6 8. Nge2 b5 9. cxb5 axb5 10. Nxb5 Ba6 11. Nec3 c4 12. Bc2 Bxb5 13. Nxb5 Qa5+ 14. Nc3 Nfd7 15. Qf3 Na6 16. O-O Nb4 17. Qe2 Nc5 18. Be3 Nbd3 19. Bxd3 Nxd3 20. e5,This is a game between Hernandez (as White) and Kasparov (as Black). Last move played: White plays Pawn to e5,Large advantage for Black (eval: -208 centipawns),20... dxe5 ,20. Rab1 
Black's queenside play is at full speed.,True," The comment suggests a potential issue with the pace of Black’s development, implying a possible flaw in their strategy.",1. c4 g6 2. Nc3 Bg7 3. d4 c5 4. d5 Nf6 5. e4 d6 6. Bd3 O-O 7. f4 a6 8. Nge2 b5 9. cxb5 axb5 10. Nxb5 Ba6 11. Nec3 c4 12. Bc2 Bxb5 13. Nxb5 Qa5+ 14. Nc3 Nfd7 15. Qf3 Na6 16. O-O Nb4 17. Qe2 Nc5 18. Be3 Nbd3 19. Bxd3 Nxd3 20. e5 dxe5 21. fxe5 Bxe5 22. Bh6 Rfb8,This is a game between Hernandez (as White) and Kasparov (as Black). Last move played: Black plays Rook to b8,Large advantage for Black (eval: -264 centipawns),23. Rab1 f6 24. Kh1 Nxb2 25. Rbc1 Qc5 26. Qf3 Kh8 27. Be3 Qb4 28. Bd2 Qd6 29. h3 Nd3 30. Rc2 Qd7 31. Qe4 Ra3 ,22... Rfb8 23. Qf3 Qb6+ 24. Kh1 f5 25. Nd1 Qf6 26. Be3 Qd6 27. Bg1 Nxb2 28. Ne3 f4 29. Ng4 Nd3 30. Nxe5 Qxe5 31. a4 Ra5 32. g3 Qf5 33. Rab1 Rxb1 34. Rxb1 Rxa4 
"White decides to sacrifice a piece for some attacking chances, as his position was lost anyway.",True," The comment suggests a strategic blunder by sacrificing a piece, indicating a flawed assessment of the position.",1. c4 g6 2. Nc3 Bg7 3. d4 c5 4. d5 Nf6 5. e4 d6 6. Bd3 O-O 7. f4 a6 8. Nge2 b5 9. cxb5 axb5 10. Nxb5 Ba6 11. Nec3 c4 12. Bc2 Bxb5 13. Nxb5 Qa5+ 14. Nc3 Nfd7 15. Qf3 Na6 16. O-O Nb4 17. Qe2 Nc5 18. Be3 Nbd3 19. Bxd3 Nxd3 20. e5 dxe5 21. fxe5 Bxe5 22. Bh6 Rfb8 23. Qf3 f5 24. g4 Rxb2 25. gxf5,This is a game between Hernandez (as White) and Kasparov (as Black). Last move played: White plays Pawn takes on f5,Large advantage for Black (eval: -433 centipawns),25... Qxc3 26. d6 Bxh2+ 27. Kh1 Nf2+ 28. Rxf2 Qxf3+ 29. Rxf3 Bxd6 30. Kg1 Rh2 31. Bc1 Rhxa2 32. Rxa2 Rxa2 33. fxg6 hxg6 34. Rc3 Ra4 35. Kg2 Be5 36. Re3 Ra5 37. Re4 c3 38. Kf3 Bf6 39. Be3 ,25. gxf5 Qxc3 26. d6 Bxh2+ 27. Kh1 Nf2+ 28. Rxf2 Qxf3+ 29. Rxf3 Bxd6 30. Kg1 Rh2 31. Bf4 Raxa2 32. Rc1 Rhg2+ 33. Kh1 Rgc2 34. Rxc2 Rxc2 35. fxg6 hxg6 36. Be3 Rh2+ 37. Kg1 Rh5 38. Kf2 Rf5 39. Bd4 Bc5 40. Bxc5 Rxc5 41. Ke3 
White resigned due to his material deficit and exposed king position.,True," The comment clearly indicates the player's resignation due to a material disadvantage and a vulnerable king, signifying a flawed move.",1. c4 g6 2. Nc3 Bg7 3. d4 c5 4. d5 Nf6 5. e4 d6 6. Bd3 O-O 7. f4 a6 8. Nge2 b5 9. cxb5 axb5 10. Nxb5 Ba6 11. Nec3 c4 12. Bc2 Bxb5 13. Nxb5 Qa5+ 14. Nc3 Nfd7 15. Qf3 Na6 16. O-O Nb4 17. Qe2 Nc5 18. Be3 Nbd3 19. Bxd3 Nxd3 20. e5 dxe5 21. fxe5 Bxe5 22. Bh6 Rfb8 23. Qf3 f5 24. g4 Rxb2 25. gxf5 Qxc3 26. fxg6 Qd4+,This is a game between Hernandez (as White) and Kasparov (as Black). Last move played: Black plays Queen to d4 with check,Large advantage for Black (eval: -466 centipawns),27. Be3 Qh4 28. h3 Qf6 29. gxh7+ Kh8 30. Qg4 Qg7 31. Rf5 Qxg4+ 32. hxg4 Re2 33. Rxe5 Nxe5 34. Bd4 Kxh7 35. Bc3 Kg6 36. Kf1 Rexa2 37. Rxa2 Rxa2 38. Bxe5 ,26... Qd4+ 27. Be3 Qh4 28. h3 Kh8 29. Qg4 Qxg4+ 30. hxg4 Re2 31. Bb6 hxg6 32. Rad1 Kg8 33. Rf3 Rb2 34. Be3 Raxa2 35. Rh3 Rg2+ 36. Kh1 Rxg4 37. Rh6 Nf2+ 38. Bxf2 c3 39. Rg1 Rxg1+ 40. Kxg1 
Black gains a strong initiative with this pawn sacrifice.,True, The comment suggests a specific tactical error and a potential move to address it.,1. c4 g6 2. Nc3 Bg7 3. d4 c5 4. d5 Nf6 5. e4 d6 6. Bd3 O-O 7. f4 a6 8. Nge2 b5,This is a game between Hernandez (as White) and Kasparov (as Black). Last move played: Black plays Pawn to b5,The position is equal,9. cxb5 ,8... b5 9. cxb5 Qb6 10. a4 axb5 11. Bxb5 Bd7 12. Ng3 Bxb5 13. Nxb5 c4 14. Qe2 Nbd7 15. Be3 Qa5+ 16. Bd2 Qb6 
By transposition we have reached the Four Pawns variation.,True," The comment suggests a potential weakness in White's central control, indicating a flawed move.",1. c4 g6 2. Nc3 Bg7 3. d4 c5 4. d5 Nf6 5. e4 d6 6. Bd3 O-O 7. f4,This is a game between Hernandez (as White) and Kasparov (as Black). Last move played: White plays Pawn to f4,Slight advantage for White (eval: 34 centipawns),7... e6 8. Nge2 exd5 9. exd5 Nh5 10. O-O f5 11. Bd2 Nd7 12. Qc2 Ndf6 13. Rae1 a6 14. a4 Re8 15. g3 Ng4 16. Nd1 b6 17. h3 Ngf6 18. Kg2 Ra7 19. Ng1 Rae7 20. Rxe7 Qxe7 ,7. h3 e6 8. Nf3 exd5 9. exd5 Re8+ 10. Be3 Bh6 11. O-O Bxe3 12. fxe3 Qe7 13. e4 Nbd7 14. Qd2 Ne5 15. Nxe5 Qxe5 16. Qf4 Kg7 17. Nb5 Rd8 18. Qxe5 dxe5 19. Nc7 Rb8 20. g4 h6 21. Rf2 Nh7 22. b4 Ng5 23. Kg2 cxb4 
Preparing to weaken White's grip on the center with 8...b5.,True, The comment identifies a specific tactical error that hinders Black's plan.,1. c4 g6 2. Nc3 Bg7 3. d4 c5 4. d5 Nf6 5. e4 d6 6. Bd3 O-O 7. f4 a6,This is a game between Hernandez (as White) and Kasparov (as Black). Last move played: Black plays Pawn to a6,Advantage for White (eval: 59 centipawns),8. Nf3 ,7... e6 8. Nge2 exd5 9. exd5 Nh5 10. O-O f5 11. Bd2 Nd7 12. Qc2 Ndf6 13. Rae1 a6 14. a4 Re8 15. g3 Ng4 16. Nd1 b6 17. h3 Ngf6 18. Kg2 Ra7 19. Ng1 Rae7 20. Rxe7 Qxe7 
