comment,good,reasoning,moves,context,engine_eval,engine_best_line,engine_best_alternative
"Gaining the bishop pair counts in Kasparov's favor, but in doing so he has lost time.",True," The comment highlights a potential strategic flaw due to the loss of time, suggesting a miscalculation.",1. Nf3 d5 2. g3 Bg4 3. Bg2 Nd7 4. h3 Bxf3 5. Bxf3 c6 6. d3 e6 7. e4 Ne5,"This is a game between Kasparov, Garry (as White) and Deep Blue (as Black). Last move played: Black plays Knight to e5",Advantage for White (eval: 56 centipawns),8. Bg2 ,7... Ngf6 8. O-O 
"The check accomplishes nothing in itself, what it does do is slightly disrupt the smooth flow of White's development. 11 c3 is impossible because of 11...Nxd3+. If 11 Nc3, then Black exploits the pin with 11...Nd5 12 Bd2 Qa5, forcing an exchange of pieces that leaves Black comfortably placed.",True," The comment offers a justification for the mistake, suggesting a missed opportunity, but lacks a clear explanation of *why* the move was incorrect.",1. Nf3 d5 2. g3 Bg4 3. Bg2 Nd7 4. h3 Bxf3 5. Bxf3 c6 6. d3 e6 7. e4 Ne5 8. Bg2 dxe4 9. Bxe4 Nf6 10. Bg2 Bb4+,"This is a game between Kasparov, Garry (as White) and Deep Blue (as Black). Last move played: Black plays Bishop to b4 with check",Advantage for White (eval: 51 centipawns),11. Nd2 O-O ,10... Qc7 11. Qe2 
"This move is based on the fact that Black's knights work best on squares where they are protected and therefore are more stable. Black's threat is to play ...h4, and if g4 then Black can hope to occupy the f4 square by dropping the knight back to g6.",True," The comment provides a potential explanation for the mistake, suggesting Black's strategy relies on a specific pawn structure, but it's not a valid or strong justification for the error.",1. Nf3 d5 2. g3 Bg4 3. Bg2 Nd7 4. h3 Bxf3 5. Bxf3 c6 6. d3 e6 7. e4 Ne5 8. Bg2 dxe4 9. Bxe4 Nf6 10. Bg2 Bb4+ 11. Nd2 h5,"This is a game between Kasparov, Garry (as White) and Deep Blue (as Black). Last move played: Black plays Pawn to h5",Advantage for White (eval: 77 centipawns),12. Qe2 ,11... O-O 12. O-O 
"At first sight I thought that this was a very curious decision, opening up the position when White has the two bishops, but Deep Blue has seen a long way ahead yet again and judged the consequences correctly. If Black doesn't break free with the pawn, then White will set up a clamp with Nc4.",True," The comment offers a plausible explanation for the mistake, suggesting a strategic analysis of the opponent's potential response.",1. Nf3 d5 2. g3 Bg4 3. Bg2 Nd7 4. h3 Bxf3 5. Bxf3 c6 6. d3 e6 7. e4 Ne5 8. Bg2 dxe4 9. Bxe4 Nf6 10. Bg2 Bb4+ 11. Nd2 h5 12. Qe2 Qc7 13. c3 Be7 14. d4 Ng6 15. h4 e5,"This is a game between Kasparov, Garry (as White) and Deep Blue (as Black). Last move played: Black plays Pawn to e5",Advantage for White (eval: 68 centipawns),16. Ne4 Ng4 17. f3 Nf6 18. Nxf6+ gxf6 19. dxe5 Bc5 20. b4 Bb6 21. a4 a6 22. a5 Ba7 23. Be3 Bxe3 24. Qxe3 O-O-O 25. O-O Nxe5 26. Qa7 Rd2 27. Rf2 Rhd8 28. Qa8+ Qb8 29. Qxb8+ Kxb8 30. Rxd2 Rxd2 31. f4 ,15... Ng4 
"The knight is so powerful here, tying White to the defense of the pawn on f2.",True," The comment suggests a potential weakness in White’s pawn structure, indicating a flawed strategic decision.",1. Nf3 d5 2. g3 Bg4 3. Bg2 Nd7 4. h3 Bxf3 5. Bxf3 c6 6. d3 e6 7. e4 Ne5 8. Bg2 dxe4 9. Bxe4 Nf6 10. Bg2 Bb4+ 11. Nd2 h5 12. Qe2 Qc7 13. c3 Be7 14. d4 Ng6 15. h4 e5 16. Nf3 exd4 17. Nxd4 O-O-O 18. Bg5 Ng4,"This is a game between Kasparov, Garry (as White) and Deep Blue (as Black). Last move played: Black plays Knight to g4",Advantage for White (eval: 54 centipawns),19. O-O-O ,18... Nd5 19. O-O-O 
"23.Rxh5 would have been asking for trouble, there are too many loose points in White's position, the rook on h5, the pawn on f2, the rook on d1: 23...c5 24.Nb5 Qb6 brings White's position to breaking point",True," The comment identifies a specific tactical vulnerability and suggests a significant positional weakness, indicating a flawed move.",1. Nf3 d5 2. g3 Bg4 3. Bg2 Nd7 4. h3 Bxf3 5. Bxf3 c6 6. d3 e6 7. e4 Ne5 8. Bg2 dxe4 9. Bxe4 Nf6 10. Bg2 Bb4+ 11. Nd2 h5 12. Qe2 Qc7 13. c3 Be7 14. d4 Ng6 15. h4 e5 16. Nf3 exd4 17. Nxd4 O-O-O 18. Bg5 Ng4 19. O-O-O Rhe8 20. Qc2 Kb8 21. Kb1 Bxg5 22. hxg5 N6e5 23. Rhe1,"This is a game between Kasparov, Garry (as White) and Deep Blue (as Black). Last move played: White plays Rook to e1",Slight advantage for White (eval: 38 centipawns),23... Qb6 24. a4 ,23. Rhe1 c5 24. Nf3 Rxd1+ 25. Rxd1 a6 26. Re1 Qd8 27. Nxe5 Rxe5 28. Rxe5 Nxe5 29. f4 Nd3 30. Be4 c4 31. Qe2 Qb6 32. Bxd3 cxd3 33. Qxd3 Qg1+ 34. Kc2 Qf2+ 35. Kb3 Qb6+ 36. Kc4 Qxb2 37. Qd8+ Ka7 38. Qd4+ Ka8 
"The knights are causing the world champion problems. The one on g4 keeps a constant watch over f2, and the other has ambitions to fly into d3 or c4. With knight forks dancing in front of his eyes, and knowing that Deep Blue was calculating them all perfectly, I'm not surprised Kasparov was concerned.",True," The comment suggests the knight's position is problematic and contributes to a potential tactical threat, indicating a mistake.",1. Nf3 d5 2. g3 Bg4 3. Bg2 Nd7 4. h3 Bxf3 5. Bxf3 c6 6. d3 e6 7. e4 Ne5 8. Bg2 dxe4 9. Bxe4 Nf6 10. Bg2 Bb4+ 11. Nd2 h5 12. Qe2 Qc7 13. c3 Be7 14. d4 Ng6 15. h4 e5 16. Nf3 exd4 17. Nxd4 O-O-O 18. Bg5 Ng4 19. O-O-O Rhe8 20. Qc2 Kb8 21. Kb1 Bxg5 22. hxg5 N6e5 23. Rhe1 c5,"This is a game between Kasparov, Garry (as White) and Deep Blue (as Black). Last move played: Black plays Pawn to c5",Slight advantage for White (eval: 34 centipawns),24. Nf5 g6 25. Nh6 Rxd1+ 26. Rxd1 a6 27. a3 Re7 28. Nxg4 Nxg4 29. Rd2 c4 30. Rd4 Re1+ 31. Ka2 Qb6 32. Rd7 Qxf2 33. Qxf2 Nxf2 34. Rxb7+ Kc8 35. a4 Nd3 36. Rxf7 Re2 37. Bd5 Rxb2+ 38. Ka1 Rc2 39. Bxc4 Rxc3 40. Bxa6+ Kb8 ,23... Qb6 24. a4 
"The only move, but a good one. If 27 Rxd8+ Qxd8 28 Qxc4 Qd1 - splat.",True," The comment offers a brief, dismissive assessment of a flawed move, suggesting a lack of strategic value.",1. Nf3 d5 2. g3 Bg4 3. Bg2 Nd7 4. h3 Bxf3 5. Bxf3 c6 6. d3 e6 7. e4 Ne5 8. Bg2 dxe4 9. Bxe4 Nf6 10. Bg2 Bb4+ 11. Nd2 h5 12. Qe2 Qc7 13. c3 Be7 14. d4 Ng6 15. h4 e5 16. Nf3 exd4 17. Nxd4 O-O-O 18. Bg5 Ng4 19. O-O-O Rhe8 20. Qc2 Kb8 21. Kb1 Bxg5 22. hxg5 N6e5 23. Rhe1 c5 24. Nf3 Rxd1+ 25. Rxd1 Nc4 26. Qa4 Rd8,"This is a game between Kasparov, Garry (as White) and Deep Blue (as Black). Last move played: Black plays Rook to d8",Slight advantage for White (eval: 33 centipawns),27. Re1 ,26... Rd8 
a crucial move as it cuts the knight on b6 out of the game for several moves,True," The comment suggests a significant tactical blunder, indicating a poor move.",1. Nf3 d5 2. g3 Bg4 3. Bg2 Nd7 4. h3 Bxf3 5. Bxf3 c6 6. d3 e6 7. e4 Ne5 8. Bg2 dxe4 9. Bxe4 Nf6 10. Bg2 Bb4+ 11. Nd2 h5 12. Qe2 Qc7 13. c3 Be7 14. d4 Ng6 15. h4 e5 16. Nf3 exd4 17. Nxd4 O-O-O 18. Bg5 Ng4 19. O-O-O Rhe8 20. Qc2 Kb8 21. Kb1 Bxg5 22. hxg5 N6e5 23. Rhe1 c5 24. Nf3 Rxd1+ 25. Rxd1 Nc4 26. Qa4 Rd8 27. Re1 Nb6 28. Qc2 Qd6 29. c4,"This is a game between Kasparov, Garry (as White) and Deep Blue (as Black). Last move played: White plays Pawn to c4",The position is equal,29... Rd7 ,29. Kc1 Qd5 
29...Nc8 would have been preferable,True," The comment suggests a better alternative move, indicating a flawed decision.",1. Nf3 d5 2. g3 Bg4 3. Bg2 Nd7 4. h3 Bxf3 5. Bxf3 c6 6. d3 e6 7. e4 Ne5 8. Bg2 dxe4 9. Bxe4 Nf6 10. Bg2 Bb4+ 11. Nd2 h5 12. Qe2 Qc7 13. c3 Be7 14. d4 Ng6 15. h4 e5 16. Nf3 exd4 17. Nxd4 O-O-O 18. Bg5 Ng4 19. O-O-O Rhe8 20. Qc2 Kb8 21. Kb1 Bxg5 22. hxg5 N6e5 23. Rhe1 c5 24. Nf3 Rxd1+ 25. Rxd1 Nc4 26. Qa4 Rd8 27. Re1 Nb6 28. Qc2 Qd6 29. c4 Qg6,"This is a game between Kasparov, Garry (as White) and Deep Blue (as Black). Last move played: Black plays Queen to g6",Advantage for White (eval: 55 centipawns),30. Qxg6 fxg6 ,29... Rd7 
The pawn on g6 is going and suddenly Black's forces appear split and uncoordinated.,True," The comment suggests a tactical weakness stemming from the pawn's vulnerability, indicating a flawed move.",1. Nf3 d5 2. g3 Bg4 3. Bg2 Nd7 4. h3 Bxf3 5. Bxf3 c6 6. d3 e6 7. e4 Ne5 8. Bg2 dxe4 9. Bxe4 Nf6 10. Bg2 Bb4+ 11. Nd2 h5 12. Qe2 Qc7 13. c3 Be7 14. d4 Ng6 15. h4 e5 16. Nf3 exd4 17. Nxd4 O-O-O 18. Bg5 Ng4 19. O-O-O Rhe8 20. Qc2 Kb8 21. Kb1 Bxg5 22. hxg5 N6e5 23. Rhe1 c5 24. Nf3 Rxd1+ 25. Rxd1 Nc4 26. Qa4 Rd8 27. Re1 Nb6 28. Qc2 Qd6 29. c4 Qg6 30. Qxg6 fxg6 31. b3 Nxf2 32. Re6,"This is a game between Kasparov, Garry (as White) and Deep Blue (as Black). Last move played: White plays Rook to e6",Slight advantage for White (eval: 35 centipawns),32... Nc8 ,32. Re6 Nc8 
The threat is Nf5 and Rxg7,True," The comment offers a potential explanation for the mistake, but it's a general observation and lacks specific analysis of the move's logical flaws.",1. Nf3 d5 2. g3 Bg4 3. Bg2 Nd7 4. h3 Bxf3 5. Bxf3 c6 6. d3 e6 7. e4 Ne5 8. Bg2 dxe4 9. Bxe4 Nf6 10. Bg2 Bb4+ 11. Nd2 h5 12. Qe2 Qc7 13. c3 Be7 14. d4 Ng6 15. h4 e5 16. Nf3 exd4 17. Nxd4 O-O-O 18. Bg5 Ng4 19. O-O-O Rhe8 20. Qc2 Kb8 21. Kb1 Bxg5 22. hxg5 N6e5 23. Rhe1 c5 24. Nf3 Rxd1+ 25. Rxd1 Nc4 26. Qa4 Rd8 27. Re1 Nb6 28. Qc2 Qd6 29. c4 Qg6 30. Qxg6 fxg6 31. b3 Nxf2 32. Re6 Kc7 33. Rxg6 Rd7 34. Nh4,"This is a game between Kasparov, Garry (as White) and Deep Blue (as Black). Last move played: White plays Knight to h4",The position is equal,34... Nc8 ,34. Nh4 Nc8 35. Bd5 Ne7 36. Rxg7 Nxd5 37. Rxd7+ Kxd7 38. cxd5 Ne4 39. g6 Nc3+ 40. Kc2 Nxd5 41. Kd3 Ke6 42. Kc4 Nf6 43. a3 Ne4 44. g7 Kf7 45. Nf5 b6 46. b4 cxb4 47. Kxb4 Nd2 48. Kb5 Ne4 49. Ka6 
"If 35. Nf5 then, remarkably, it is Black who is almost winning: 35...Ne7! 36 Nxe7 Rxe7 and White's rook is trapped on g6. Black threatens ...Ng4 and ...Ne5. White can try 37 Bd5 Ng4 38 Re6 Rxe6 39 Bxe6, but 39...Ne3 leaves him struggling.",True," The comment identifies a critical tactical weakness, suggesting the move was flawed.",1. Nf3 d5 2. g3 Bg4 3. Bg2 Nd7 4. h3 Bxf3 5. Bxf3 c6 6. d3 e6 7. e4 Ne5 8. Bg2 dxe4 9. Bxe4 Nf6 10. Bg2 Bb4+ 11. Nd2 h5 12. Qe2 Qc7 13. c3 Be7 14. d4 Ng6 15. h4 e5 16. Nf3 exd4 17. Nxd4 O-O-O 18. Bg5 Ng4 19. O-O-O Rhe8 20. Qc2 Kb8 21. Kb1 Bxg5 22. hxg5 N6e5 23. Rhe1 c5 24. Nf3 Rxd1+ 25. Rxd1 Nc4 26. Qa4 Rd8 27. Re1 Nb6 28. Qc2 Qd6 29. c4 Qg6 30. Qxg6 fxg6 31. b3 Nxf2 32. Re6 Kc7 33. Rxg6 Rd7 34. Nh4 Nc8,"This is a game between Kasparov, Garry (as White) and Deep Blue (as Black). Last move played: Black plays Knight to c8",The position is equal,35. Bd5 Nd3 ,34... Nc8 
"An extraordinary move. Black threatens ...Nc3+ and apart from the game continuation, there is not a great deal to be done about it. For instance 37 Kb2 can be met by 37...Nd3+ with some really juicy forks on the cards.",True," The comment offers a subjective assessment of the move's value, suggesting it's a significant, albeit somewhat underwhelming, development.",1. Nf3 d5 2. g3 Bg4 3. Bg2 Nd7 4. h3 Bxf3 5. Bxf3 c6 6. d3 e6 7. e4 Ne5 8. Bg2 dxe4 9. Bxe4 Nf6 10. Bg2 Bb4+ 11. Nd2 h5 12. Qe2 Qc7 13. c3 Be7 14. d4 Ng6 15. h4 e5 16. Nf3 exd4 17. Nxd4 O-O-O 18. Bg5 Ng4 19. O-O-O Rhe8 20. Qc2 Kb8 21. Kb1 Bxg5 22. hxg5 N6e5 23. Rhe1 c5 24. Nf3 Rxd1+ 25. Rxd1 Nc4 26. Qa4 Rd8 27. Re1 Nb6 28. Qc2 Qd6 29. c4 Qg6 30. Qxg6 fxg6 31. b3 Nxf2 32. Re6 Kc7 33. Rxg6 Rd7 34. Nh4 Nc8 35. Bd5 Nd6 36. Re6 Nb5,"This is a game between Kasparov, Garry (as White) and Deep Blue (as Black). Last move played: Black plays Knight to b5",The position is equal,37. cxb5 Rxd5 ,36... Nb5 37. cxb5 Rxd5 38. Rg6 Rd7 39. Nf5 Ne4 40. Nxg7 Rd1+ 41. Kc2 Rd2+ 42. Kc1 Rxa2 43. Nxh5 Rg2 44. Kd1 Nxg3 45. Nf4 Rg1+ 46. Kd2 Ne4+ 47. Ke3 Nxg5 48. b6+ axb6 49. Rxg5 Rxg5 50. Ne6+ Kc6 51. Nxg5 Kb5 52. Ne6 Kb4 53. Kd3 
"His bishop is gone, but Kasparov has survived that little skirmish and seems to have the position under control again.",True," The comment suggests the player’s position is stable, implying a successful defense despite the bishop’s potential vulnerability.",1. Nf3 d5 2. g3 Bg4 3. Bg2 Nd7 4. h3 Bxf3 5. Bxf3 c6 6. d3 e6 7. e4 Ne5 8. Bg2 dxe4 9. Bxe4 Nf6 10. Bg2 Bb4+ 11. Nd2 h5 12. Qe2 Qc7 13. c3 Be7 14. d4 Ng6 15. h4 e5 16. Nf3 exd4 17. Nxd4 O-O-O 18. Bg5 Ng4 19. O-O-O Rhe8 20. Qc2 Kb8 21. Kb1 Bxg5 22. hxg5 N6e5 23. Rhe1 c5 24. Nf3 Rxd1+ 25. Rxd1 Nc4 26. Qa4 Rd8 27. Re1 Nb6 28. Qc2 Qd6 29. c4 Qg6 30. Qxg6 fxg6 31. b3 Nxf2 32. Re6 Kc7 33. Rxg6 Rd7 34. Nh4 Nc8 35. Bd5 Nd6 36. Re6 Nb5 37. cxb5 Rxd5 38. Rg6 Rd7 39. Nf5,"This is a game between Kasparov, Garry (as White) and Deep Blue (as Black). Last move played: White plays Knight to f5",The position is equal,39... Ne4 ,39. Nf5 Ne4 40. Nxg7 Rd2 41. Kc1 Rxa2 42. Nxh5 Rg2 43. Kd1 Nxg3 44. Nf4 Rg1+ 45. Kd2 Kd7 46. Rg7+ Kd6 47. g6 Nf5 48. Rxb7 Rg4 49. Nh5 Rxg6 50. Rxa7 Rg4 51. b6 Rd4+ 52. Kc3 Rb4 
"Though I couldn't quite see how Deep Blue was going to hold the game, from the way in which Kasparov had seemingly lost interest, I had a feeling that something was up. He was curiously pensive, leaning back in his chair and staring away from the board somewhere into the middle distance. He didn't look like a man about to make a new queen.",True," The comment suggests Kasparov’s apparent lack of engagement and pensive demeanor indicates a potential tactical flaw or a missed opportunity, supporting the assessment of the move as a mistake.",1. Nf3 d5 2. g3 Bg4 3. Bg2 Nd7 4. h3 Bxf3 5. Bxf3 c6 6. d3 e6 7. e4 Ne5 8. Bg2 dxe4 9. Bxe4 Nf6 10. Bg2 Bb4+ 11. Nd2 h5 12. Qe2 Qc7 13. c3 Be7 14. d4 Ng6 15. h4 e5 16. Nf3 exd4 17. Nxd4 O-O-O 18. Bg5 Ng4 19. O-O-O Rhe8 20. Qc2 Kb8 21. Kb1 Bxg5 22. hxg5 N6e5 23. Rhe1 c5 24. Nf3 Rxd1+ 25. Rxd1 Nc4 26. Qa4 Rd8 27. Re1 Nb6 28. Qc2 Qd6 29. c4 Qg6 30. Qxg6 fxg6 31. b3 Nxf2 32. Re6 Kc7 33. Rxg6 Rd7 34. Nh4 Nc8 35. Bd5 Nd6 36. Re6 Nb5 37. cxb5 Rxd5 38. Rg6 Rd7 39. Nf5 Ne4 40. Nxg7 Rd1+ 41. Kc2 Rd2+ 42. Kc1 Rxa2 43. Nxh5 Nd2 44. Nf4 Nxb3+ 45. Kb1 Rd2 46. Re6,"This is a game between Kasparov, Garry (as White) and Deep Blue (as Black). Last move played: White plays Rook to e6",The position is equal,46... c4 ,46. Re6 c4 
The king joins the attack just in the nick of time to force a draw by perpetual check.,True," The comment describes a move that leads to a draw, suggesting a flawed strategic decision.",1. Nf3 d5 2. g3 Bg4 3. Bg2 Nd7 4. h3 Bxf3 5. Bxf3 c6 6. d3 e6 7. e4 Ne5 8. Bg2 dxe4 9. Bxe4 Nf6 10. Bg2 Bb4+ 11. Nd2 h5 12. Qe2 Qc7 13. c3 Be7 14. d4 Ng6 15. h4 e5 16. Nf3 exd4 17. Nxd4 O-O-O 18. Bg5 Ng4 19. O-O-O Rhe8 20. Qc2 Kb8 21. Kb1 Bxg5 22. hxg5 N6e5 23. Rhe1 c5 24. Nf3 Rxd1+ 25. Rxd1 Nc4 26. Qa4 Rd8 27. Re1 Nb6 28. Qc2 Qd6 29. c4 Qg6 30. Qxg6 fxg6 31. b3 Nxf2 32. Re6 Kc7 33. Rxg6 Rd7 34. Nh4 Nc8 35. Bd5 Nd6 36. Re6 Nb5 37. cxb5 Rxd5 38. Rg6 Rd7 39. Nf5 Ne4 40. Nxg7 Rd1+ 41. Kc2 Rd2+ 42. Kc1 Rxa2 43. Nxh5 Nd2 44. Nf4 Nxb3+ 45. Kb1 Rd2 46. Re6 c4 47. Re3 Kb6,"This is a game between Kasparov, Garry (as White) and Deep Blue (as Black). Last move played: Black plays King to b6",The position is equal,48. g6 Kxb5 ,47... Kb6 
"If 50 g8(Q), then Black forces a draw with 50...Rd1+ 51 Kc2 Rd2+ 52 Kb1 Rd1+, and so on.",True," Yes, the comment provides a logical sequence of moves that leads to a draw, suggesting a flawed strategic assessment.",1. Nf3 d5 2. g3 Bg4 3. Bg2 Nd7 4. h3 Bxf3 5. Bxf3 c6 6. d3 e6 7. e4 Ne5 8. Bg2 dxe4 9. Bxe4 Nf6 10. Bg2 Bb4+ 11. Nd2 h5 12. Qe2 Qc7 13. c3 Be7 14. d4 Ng6 15. h4 e5 16. Nf3 exd4 17. Nxd4 O-O-O 18. Bg5 Ng4 19. O-O-O Rhe8 20. Qc2 Kb8 21. Kb1 Bxg5 22. hxg5 N6e5 23. Rhe1 c5 24. Nf3 Rxd1+ 25. Rxd1 Nc4 26. Qa4 Rd8 27. Re1 Nb6 28. Qc2 Qd6 29. c4 Qg6 30. Qxg6 fxg6 31. b3 Nxf2 32. Re6 Kc7 33. Rxg6 Rd7 34. Nh4 Nc8 35. Bd5 Nd6 36. Re6 Nb5 37. cxb5 Rxd5 38. Rg6 Rd7 39. Nf5 Ne4 40. Nxg7 Rd1+ 41. Kc2 Rd2+ 42. Kc1 Rxa2 43. Nxh5 Nd2 44. Nf4 Nxb3+ 45. Kb1 Rd2 46. Re6 c4 47. Re3 Kb6 48. g6 Kxb5 49. g7 Kb4,"This is a game between Kasparov, Garry (as White) and Deep Blue (as Black). Last move played: Black plays King to b4",The position is equal,50. Re2 Rd1+ 51. Kb2 c3+ 52. Kc2 Rc1+ 53. Kd3 Rd1+ 54. Kc2 ,49... Kb4 50. Re2 Rd1+ 51. Kb2 c3+ 52. Kc2 Rc1+ 53. Kd3 Rd1+ 54. Kc2 
In game one Kasparov played 3. b3,True," The comment indicates a potential tactical blunder, suggesting the move was incorrect.",1. Nf3 d5 2. g3 Bg4 3. Bg2,"This is a game between Kasparov, Garry (as White) and Deep Blue (as Black). Last move played: White plays Bishop to g2",Slight advantage for White (eval: 22 centipawns),3... e6 ,3. Bg2 e6 4. h3 Bxf3 5. Bxf3 Nf6 6. Bg2 c6 7. O-O Nbd7 8. d4 Bd6 9. c4 O-O 10. Qc2 h6 11. Rd1 Qc7 12. Nd2 Rfe8 13. e4 dxe4 14. Nxe4 Nxe4 
