comment,good,reasoning,moves,context,engine_eval,engine_best_line,engine_best_alternative
"Black must give up the centre. Delay may lead him in the following trap, discovered by Tarrasch 7...0-0? 8 Bxc6 Bxc6 9 dxe5 dxe5 10 Qxd8 Raxd8 11 Nxe5 Bxe4 12 Nxe4 Nxe4 13 Nd3 f5 14 f3 Bc5+ 15 Nxc5 Nxc5 16 Bg5 Rd5 17 c4 Rd7 18 Be7- White wins the exchange.)",True," The comment identifies a potential tactical trap and suggests a consequence of Black's move, indicating a flawed assessment of the position.",1. e4 e5 2. Nf3 Nc6 3. Bb5 d6 4. d4 Bd7 5. Nc3 Nf6 6. O-O Be7 7. Re1 exd4,"This is a game between Tarrasch, S (as White) and Vogel, S (as Black). Last move played: Black plays Pawn takes on d4",Slight advantage for White (eval: 25 centipawns),8. Nxd4 Nxd4 9. Bxd7+ Nxd7 10. Qxd4 O-O 11. Qb4 Nc5 12. Be3 a5 13. Qc4 c6 14. Bxc5 dxc5 15. e5 a4 16. Rad1 Qc8 17. Ne4 b5 18. Qc3 Qe6 19. Nd6 Qxa2 20. b3 axb3 21. cxb3 Bxd6 22. exd6 c4 23. d7 ,7... exd4 
Black tries to simflify the position.,True,", The comment suggests a potential tactical weakness, indicating the move was flawed.",1. e4 e5 2. Nf3 Nc6 3. Bb5 d6 4. d4 Bd7 5. Nc3 Nf6 6. O-O Be7 7. Re1 exd4 8. Nxd4 Nxd4 9. Qxd4 Bxb5 10. Nxb5 O-O 11. Bg5 Ng4,"This is a game between Tarrasch, S (as White) and Vogel, S (as Black). Last move played: Black plays Knight to g4",Slight advantage for White (eval: 34 centipawns),12. Bxe7 Qxe7 13. h3 Nf6 14. e5 dxe5 15. Rxe5 Qd8 16. Qb4 a5 17. Qc3 c6 18. Nd4 Re8 19. Nf5 Rxe5 20. Qxe5 Qd2 21. Qe7 Qb4 22. Nh6+ gxh6 23. Qxf6 Re8 24. Rd1 Re1+ 25. Rxe1 Qxe1+ 26. Kh2 Qd2 27. c4 b5 28. Qxc6 ,11... c6 12. e5 
"Simple and strong. The main threat is not 17 Nxc7 as after 17... Rac8 Black regains the Pawn, but 17 h3 after which, 17... Nh6 is obviously bad and17... Nf6 allows 18 Nxf6 breaking up Black's Pawn position.",True," The comment identifies a critical error in the move, highlighting the threat of the 17... Nh6 and its subsequent consequence of allowing a break in Black’s pawn structure.",1. e4 e5 2. Nf3 Nc6 3. Bb5 d6 4. d4 Bd7 5. Nc3 Nf6 6. O-O Be7 7. Re1 exd4 8. Nxd4 Nxd4 9. Qxd4 Bxb5 10. Nxb5 O-O 11. Bg5 Ng4 12. Bxe7 Qxe7 13. c4 a6 14. Nc3 Qe5 15. Qxe5 dxe5 16. Nd5,"This is a game between Tarrasch, S (as White) and Vogel, S (as Black). Last move played: White plays Knight to d5",Slight advantage for White (eval: 25 centipawns),16... Nf6 ,16. Nd5 Nf6 
"After this natural move Black's d6 is seriously weakened. Better was 16... Nf6, after which 17 Nxf6 gives White only a slight advantage.",True, The comment identifies a key weakness in Black's development and suggests a more favorable alternative.,1. e4 e5 2. Nf3 Nc6 3. Bb5 d6 4. d4 Bd7 5. Nc3 Nf6 6. O-O Be7 7. Re1 exd4 8. Nxd4 Nxd4 9. Qxd4 Bxb5 10. Nxb5 O-O 11. Bg5 Ng4 12. Bxe7 Qxe7 13. c4 a6 14. Nc3 Qe5 15. Qxe5 dxe5 16. Nd5 c6,"This is a game between Tarrasch, S (as White) and Vogel, S (as Black). Last move played: Black plays Pawn to c6",Advantage for White (eval: 80 centipawns),17. Nb6 Rad8 18. f3 Nh6 19. Rad1 f6 20. Nd7 Rfe8 21. Rd3 b5 22. Red1 Nf7 23. c5 h5 24. h4 a5 25. b3 Rc8 26. Nb6 Rc7 27. a4 bxa4 28. bxa4 Rb8 29. Kf2 Rbb7 30. R1d2 Re7 31. Ke2 Kf8 32. g4 hxg4 33. fxg4 Rec7 34. Rg3 Re7 ,16... Nf6 
"This Knight is very strongly placed on d6. The immediate threat is 21 Nxf7+ winning the exchange, while the Pawn on b7 is also under attack.",True," The comment identifies a potential tactical threat, suggesting a misjudgment of the position.",1. e4 e5 2. Nf3 Nc6 3. Bb5 d6 4. d4 Bd7 5. Nc3 Nf6 6. O-O Be7 7. Re1 exd4 8. Nxd4 Nxd4 9. Qxd4 Bxb5 10. Nxb5 O-O 11. Bg5 Ng4 12. Bxe7 Qxe7 13. c4 a6 14. Nc3 Qe5 15. Qxe5 dxe5 16. Nd5 c6 17. Ne7+ Kh8 18. Nf5 Rad8 19. Rad1 g6 20. Nd6,"This is a game between Tarrasch, S (as White) and Vogel, S (as Black). Last move played: White plays Knight to d6",Advantage for White (eval: 63 centipawns),20... Rd7 ,20. Nd6 Rd7 21. f3 Nf6 22. c5 Nh5 23. Nc4 Rfd8 24. Rd6 Rxd6 25. cxd6 f6 26. Rd1 Nf4 27. d7 Kg8 28. Na5 Ne2+ 29. Kf2 Nd4 30. Nxb7 Rxd7 31. Nc5 Rd8 32. Ke3 
"Supports the outpost, provides c4 as a useful square for the Knight and fixes Black's Pawns on the Q side.",True, The comment suggests the move is flawed by creating a weak outpost and potentially hindering pawn structure.,1. e4 e5 2. Nf3 Nc6 3. Bb5 d6 4. d4 Bd7 5. Nc3 Nf6 6. O-O Be7 7. Re1 exd4 8. Nxd4 Nxd4 9. Qxd4 Bxb5 10. Nxb5 O-O 11. Bg5 Ng4 12. Bxe7 Qxe7 13. c4 a6 14. Nc3 Qe5 15. Qxe5 dxe5 16. Nd5 c6 17. Ne7+ Kh8 18. Nf5 Rad8 19. Rad1 g6 20. Nd6 Rd7 21. c5,"This is a game between Tarrasch, S (as White) and Vogel, S (as Black). Last move played: White plays Pawn to c5",Advantage for White (eval: 62 centipawns),21... f6 22. f3 Nh6 23. Kf1 Nf7 24. Nc4 Rfd8 25. Ke2 Rd4 26. b3 f5 27. exf5 gxf5 28. Na5 R4d7 29. Rxd7 Rxd7 30. Rd1 Re7 31. Kd3 Kg7 32. Kc3 Kf6 33. Nc4 h5 34. Kb4 h4 35. Ka5 ,21. c5 
"Black gives up a Pawn for which, his Rook will seize the seventh rank. If 24...Nf6, 25 Re2 Re7 26 Rd2 Rd7 27 Rxd7 Nxd7 28 b4 and 29 Na5.",True," The comment describes a potential tactical sequence leading to a lost pawn, indicating a flawed strategic decision.",1. e4 e5 2. Nf3 Nc6 3. Bb5 d6 4. d4 Bd7 5. Nc3 Nf6 6. O-O Be7 7. Re1 exd4 8. Nxd4 Nxd4 9. Qxd4 Bxb5 10. Nxb5 O-O 11. Bg5 Ng4 12. Bxe7 Qxe7 13. c4 a6 14. Nc3 Qe5 15. Qxe5 dxe5 16. Nd5 c6 17. Ne7+ Kh8 18. Nf5 Rad8 19. Rad1 g6 20. Nd6 Rd7 21. c5 Kg8 22. Nc4 Rfd8 23. Rxd7 Rxd7 24. f3 Nh6,"This is a game between Tarrasch, S (as White) and Vogel, S (as Black). Last move played: Black plays Knight to h6",Large advantage for White (eval: 139 centipawns),25. Nxe5 ,24... Rd4 25. Rc1 
"One piece wins the game practically single-handed! Tarrasch's Knight makes 13 of the 37 moves in the game, controls important squares, holds the enemy Rooks at the bay, captures Pawns here and there, and as a final touch, clears the way for a passed Pawn to become a Queen.",True," The comment provides a detailed analysis of the tactical and strategic implications of the move, suggesting a significant advantage and a potential for a decisive outcome.",1. e4 e5 2. Nf3 Nc6 3. Bb5 d6 4. d4 Bd7 5. Nc3 Nf6 6. O-O Be7 7. Re1 exd4 8. Nxd4 Nxd4 9. Qxd4 Bxb5 10. Nxb5 O-O 11. Bg5 Ng4 12. Bxe7 Qxe7 13. c4 a6 14. Nc3 Qe5 15. Qxe5 dxe5 16. Nd5 c6 17. Ne7+ Kh8 18. Nf5 Rad8 19. Rad1 g6 20. Nd6 Rd7 21. c5 Kg8 22. Nc4 Rfd8 23. Rxd7 Rxd7 24. f3 Nh6 25. Nxe5 Rd2 26. Nc4 Rc2 27. b3 Rxa2 28. Rd1 a5 29. Rd8+ Kg7 30. Ra8 a4 31. Rxa4 Rxa4 32. bxa4 Ng8 33. Nd6 Kf6 34. Nxb7 Ke5 35. a5 Ne7 36. Nd6 Kd4 37. a6,"This is a game between Tarrasch, S (as White) and Vogel, S (as Black). Last move played: White plays Pawn to a6",Large advantage for White (eval: 654 centipawns),37... Kxc5 38. a7 Kxd6 39. a8=Q Kd7 40. h4 Ke6 41. Qa2+ Kf6 42. Qb2+ Ke6 43. Qb3+ Kf6 44. Qc3+ Ke6 45. Qc4+ Kf6 46. Qb4 Ke6 47. Kh1 Kd7 48. Qa3 Kd8 49. Qd6+ Ke8 50. Kh2 h6 51. Kg1 c5 52. Qxc5 f6 53. Qc4 f5 54. Qa4+ Kd8 55. e5 Nc6 56. e6 ,37. a6 Kxc5 38. a7 Kxd6 39. a8=Q Kd7 40. h4 c5 41. Qa7+ Ke8 42. Qb8+ Kd7 43. Qb5+ Kd8 44. Qxc5 Ke8 45. Qd6 h5 46. Qb8+ Kd7 47. Qb5+ Ke6 48. Qc4+ Kd7 49. Qc5 Ke8 
Black tries to simflify the position.,True," The comment suggests a potential tactical threat to White's Queen side, indicating a flawed move.",1. e4 e5 2. Nf3 Nc6 3. Bb5 d6 4. d4 Bd7 5. Nc3 Nf6 6. O-O Be7 7. Re1 exd4 8. Nxd4 Nxd4 9. Qxd4 Bxb5 10. Nxb5 O-O 11. Bg5 Ng4,"This is a game between Tarrasch, S (as White) and Vogel, S (as Black). Last move played: Black plays Knight to g4",Slight advantage for White (eval: 34 centipawns),12. Bxe7 Qxe7 13. h3 Nf6 14. e5 dxe5 15. Rxe5 Qd8 16. Qb4 a5 17. Qc3 c6 18. Nd4 Re8 19. Nf5 Rxe5 20. Qxe5 Qd2 21. Qe7 Qb4 22. Nh6+ gxh6 23. Qxf6 Re8 24. Rd1 Re1+ 25. Rxe1 Qxe1+ 26. Kh2 Qd2 27. c4 b5 28. Qxc6 ,11... c6 12. e5 
"Black must give up the centre. Delay may lead him in the following trap, discovered by Tarrasch 7...0-0? 8 Bxc6 Bxc6 9 dxe5 dxe5 10 Qxd8 Raxd8 11 Nxe5 Bxe4 12 Nxe4 Nxe4 13 Nd3 f5 14 f3 Bc5+ 15 Nxc5 Nxc5 16 Bg5 Rd5 17 c4 Rd7 18 Be7- White wins the exchange.)",True,"

The comment suggests a defensive move that leads to a weakening of the position, indicating a flaw in the player's strategic assessment.",1. e4 e5 2. Nf3 Nc6 3. Bb5 d6 4. d4 Bd7 5. Nc3 Nf6 6. O-O Be7 7. Re1 exd4,"This is a game between Tarrasch, S (as White) and Vogel, S (as Black). Last move played: Black plays Pawn takes on d4",Slight advantage for White (eval: 25 centipawns),8. Nxd4 Nxd4 9. Bxd7+ Nxd7 10. Qxd4 O-O 11. Qb4 Nc5 12. Be3 a5 13. Qc4 c6 14. Bxc5 dxc5 15. e5 a4 16. Rad1 Qc8 17. Ne4 b5 18. Qc3 Qe6 19. Nd6 Qxa2 20. b3 axb3 21. cxb3 Bxd6 22. exd6 c4 23. d7 ,7... exd4 
