comment,good,reasoning,moves,context,engine_eval,engine_best_line,engine_best_alternative
"White is playing the opening with no ambition whatsoever, and Black achieves a comfortable game effortlessly.",True," The comment expresses a subjective assessment of the move's lack of ambition and suggests effortless play, indicating a potential flaw in the evaluation.",1. e4 c5 2. Nf3 d6 3. c3 Nf6 4. Qc2 Qc7 5. d3 g6 6. Be2,This is a game between Czerniak (as White) and Petrosian (as Black). Last move played: White plays Bishop to e2,Slight advantage for Black (eval: -24 centipawns),6... Bg7 ,6. g3 Bg7 
12.Nc4 would be more solid.,True," The comment suggests a potential improvement, indicating a misunderstanding of the strategic implications of the move.",1. e4 c5 2. Nf3 d6 3. c3 Nf6 4. Qc2 Qc7 5. d3 g6 6. Be2 Bg7 7. O-O O-O 8. h3 b6 9. Bf4 Nbd7 10. Nbd2 Bb7 11. Bh2 e5 12. Nh4,This is a game between Czerniak (as White) and Petrosian (as Black). Last move played: White plays Knight to h4,Slight advantage for Black (eval: -30 centipawns),12... Rfe8 13. a4 ,12. a4 
"White uses -on-man"" coverage by setting up an opposition between this rook and the enemy queen. This indirectly prevents Black from taking the e- pawn.",True," The comment identifies a potential tactical flaw, suggesting the rook placement creates a strategic disadvantage.",1. e4 c5 2. Nf3 d6 3. c3 Nf6 4. Qc2 Qc7 5. d3 g6 6. Be2 Bg7 7. O-O O-O 8. h3 b6 9. Bf4 Nbd7 10. Nbd2 Bb7 11. Bh2 e5 12. Nh4 d5 13. f4 exf4 14. Bxf4 Qd8 15. Nhf3 Re8 16. Rad1,This is a game between Czerniak (as White) and Petrosian (as Black). Last move played: White plays Rook to d1,Advantage for Black (eval: -82 centipawns),16... Nh5 ,16. e5 
White will be unable to maintain his center against the powerful blows being hammered upon it. 16...dxe4 17.Nxe4 Nxe4 18.dxe4 Bxe4 19.Qa4 Bf5 20.Bb5,True," The comment suggests a weakness in White's defense due to the aggressive nature of the attack, indicating a flaw in the move's planning.",1. e4 c5 2. Nf3 d6 3. c3 Nf6 4. Qc2 Qc7 5. d3 g6 6. Be2 Bg7 7. O-O O-O 8. h3 b6 9. Bf4 Nbd7 10. Nbd2 Bb7 11. Bh2 e5 12. Nh4 d5 13. f4 exf4 14. Bxf4 Qd8 15. Nhf3 Re8 16. Rad1 c4,This is a game between Czerniak (as White) and Petrosian (as Black). Last move played: Black plays Pawn to c4,Slight advantage for White (eval: 36 centipawns),17. e5 Nh5 ,16... Nh5 
With this blockade White locks the Bb7 out of the game.,True," The comment suggests a potential tactical weakness, indicating a flawed move that hinders White's development.",1. e4 c5 2. Nf3 d6 3. c3 Nf6 4. Qc2 Qc7 5. d3 g6 6. Be2 Bg7 7. O-O O-O 8. h3 b6 9. Bf4 Nbd7 10. Nbd2 Bb7 11. Bh2 e5 12. Nh4 d5 13. f4 exf4 14. Bxf4 Qd8 15. Nhf3 Re8 16. Rad1 c4 17. e5 cxd3 18. Bxd3 Nh5 19. Bg5 Qc7 20. Bb5 Qc5+ 21. Nd4,This is a game between Czerniak (as White) and Petrosian (as Black). Last move played: White plays Knight to d4,Advantage for Black (eval: -64 centipawns),21... Rxe5 22. Nf3 ,21. Nd4 Rxe5 
"Black has won a pawn. However, some tactical complications come with it.",True," The comment suggests a potential tactical threat, indicating a flawed assessment of the position.",1. e4 c5 2. Nf3 d6 3. c3 Nf6 4. Qc2 Qc7 5. d3 g6 6. Be2 Bg7 7. O-O O-O 8. h3 b6 9. Bf4 Nbd7 10. Nbd2 Bb7 11. Bh2 e5 12. Nh4 d5 13. f4 exf4 14. Bxf4 Qd8 15. Nhf3 Re8 16. Rad1 c4 17. e5 cxd3 18. Bxd3 Nh5 19. Bg5 Qc7 20. Bb5 Qc5+ 21. Nd4 Rxe5,This is a game between Czerniak (as White) and Petrosian (as Black). Last move played: Black plays Rook takes on e5,The position is equal,22. Nf3 ,21... Rxe5 22. Nf3 
25...Re8 26.Bxh5 gxh5 27.Nf5,True," The comment describes a seemingly forced pawn sacrifice, suggesting a flawed plan.",1. e4 c5 2. Nf3 d6 3. c3 Nf6 4. Qc2 Qc7 5. d3 g6 6. Be2 Bg7 7. O-O O-O 8. h3 b6 9. Bf4 Nbd7 10. Nbd2 Bb7 11. Bh2 e5 12. Nh4 d5 13. f4 exf4 14. Bxf4 Qd8 15. Nhf3 Re8 16. Rad1 c4 17. e5 cxd3 18. Bxd3 Nh5 19. Bg5 Qc7 20. Bb5 Qc5+ 21. Nd4 Rxe5 22. Nf3 Rxg5 23. Bxd7 Rg3 24. Qf2 Qc7 25. Bg4 Nf6,This is a game between Czerniak (as White) and Petrosian (as Black). Last move played: Black plays Knight to f6,Large advantage for Black (eval: -184 centipawns),26. Nb5 Qf4 ,25... Nf6 26. Nb5 Qf4 27. Nfd4 Qxf2+ 28. Rxf2 Rd8 29. Bf3 a6 30. Na7 Bf8 31. Nac6 Re8 32. Nb4 h5 33. Re2 Ne4 34. Ndc6 Bc5+ 35. Kh2 Rg5 36. Nxd5 Bxc6 37. Rxe4 
The main tactics are over with Black keeping his pawn advantage.,True, The comment suggests a lack of strategic depth and a failure to recognize the potential for a more solid position.,1. e4 c5 2. Nf3 d6 3. c3 Nf6 4. Qc2 Qc7 5. d3 g6 6. Be2 Bg7 7. O-O O-O 8. h3 b6 9. Bf4 Nbd7 10. Nbd2 Bb7 11. Bh2 e5 12. Nh4 d5 13. f4 exf4 14. Bxf4 Qd8 15. Nhf3 Re8 16. Rad1 c4 17. e5 cxd3 18. Bxd3 Nh5 19. Bg5 Qc7 20. Bb5 Qc5+ 21. Nd4 Rxe5 22. Nf3 Rxg5 23. Bxd7 Rg3 24. Qf2 Qc7 25. Bg4 Nf6 26. Nb5 Qb8 27. Nh2 h5 28. Bf3 Rg5,This is a game between Czerniak (as White) and Petrosian (as Black). Last move played: Black plays Rook to g5,Large advantage for Black (eval: -243 centipawns),29. g4 hxg4 30. Nxg4 Qf4 31. Rde1 Ba6 32. a4 Rf8 33. Bd1 Qxf2+ 34. Rxf2 Ne4 35. Rg2 Bxb5 36. axb5 Rd8 37. Nf2 Rxg2+ 38. Kxg2 Nd6 39. Nd3 Nxb5 40. Bb3 ,28... a6 29. Nd4 Qc7 30. Rfe1 Ne4 31. Qe3 Re8 32. Nf1 Rg5 33. Bxe4 Rge5 34. Qf4 dxe4 35. Ne3 b5 36. Rf1 Rf8 37. Rd2 Qe7 38. Rfd1 
The White knights are misplaced away from the center.,True," The comment offers a potential reason for the error, suggesting a strategic imbalance.",1. e4 c5 2. Nf3 d6 3. c3 Nf6 4. Qc2 Qc7 5. d3 g6 6. Be2 Bg7 7. O-O O-O 8. h3 b6 9. Bf4 Nbd7 10. Nbd2 Bb7 11. Bh2 e5 12. Nh4 d5 13. f4 exf4 14. Bxf4 Qd8 15. Nhf3 Re8 16. Rad1 c4 17. e5 cxd3 18. Bxd3 Nh5 19. Bg5 Qc7 20. Bb5 Qc5+ 21. Nd4 Rxe5 22. Nf3 Rxg5 23. Bxd7 Rg3 24. Qf2 Qc7 25. Bg4 Nf6 26. Nb5 Qb8 27. Nh2 h5 28. Bf3 Rg5 29. Rfe1 a6 30. Na3,This is a game between Czerniak (as White) and Petrosian (as Black). Last move played: White plays Knight to a3,Large advantage for Black (eval: -290 centipawns),30... Qc7 31. Nf1 Bf8 32. Nc2 Rf5 33. Re2 Ne4 34. Qe1 Re8 35. Bxe4 dxe4 36. Red2 Qe5 37. Rd7 Bc6 38. Rd8 Rxd8 39. Rxd8 Kg7 40. Nfe3 Rf6 41. Nd4 a5 42. Nc4 Qc7 ,30. Nd4 Re5 31. Rxe5 Qxe5 32. Nc2 Qc7 33. g4 hxg4 34. Nxg4 Nh5 35. Nd4 Re8 36. Ne2 b5 37. a3 Qe7 38. Qa7 Nf6 39. Nxf6+ Bxf6 40. Kg2 Bh4 
White has no way out of the coming pin.,True," The comment suggests a defensive strategy, implying a lack of tactical opportunities, which is a common error in chess.",1. e4 c5 2. Nf3 d6 3. c3 Nf6 4. Qc2 Qc7 5. d3 g6 6. Be2 Bg7 7. O-O O-O 8. h3 b6 9. Bf4 Nbd7 10. Nbd2 Bb7 11. Bh2 e5 12. Nh4 d5 13. f4 exf4 14. Bxf4 Qd8 15. Nhf3 Re8 16. Rad1 c4 17. e5 cxd3 18. Bxd3 Nh5 19. Bg5 Qc7 20. Bb5 Qc5+ 21. Nd4 Rxe5 22. Nf3 Rxg5 23. Bxd7 Rg3 24. Qf2 Qc7 25. Bg4 Nf6 26. Nb5 Qb8 27. Nh2 h5 28. Bf3 Rg5 29. Rfe1 a6 30. Na3 Qc7 31. c4 Ne4 32. Qe3 Bh6 33. Qd4 Bf8,This is a game between Czerniak (as White) and Petrosian (as Black). Last move played: Black plays Bishop to f8,Large advantage for Black (eval: -535 centipawns),34. b4 Bxb4 35. cxd5 Bc5 36. Bxe4 Bxd4+ 37. Rxd4 Rd8 38. Nf3 Rgxd5 39. Bxd5 Rxd5 40. Rc4 Qd8 41. Nc2 Rd1 42. Rd4 Rxe1+ 43. Ncxe1 Qe7 44. h4 Qe3+ 45. Kh1 ,33... Bf8 34. b4 Bxb4 35. cxd5 Bc5 36. Bxe4 Bxd4+ 37. Rxd4 Rd8 38. Nc2 Rgxd5 39. Bxd5 Rxd5 40. Rxd5 Bxd5 41. Nd4 Qc5 42. Rd1 Be4 43. Nf1 Bc2 44. Rd2 Bb1 45. Ng3 f5 46. Kh2 h4 47. Nge2 Qe5+ 48. Kg1 
White resigned as Black is two exchanges ahead.,True," The comment suggests a flawed assessment of the position, indicating a potential error in evaluating the game's trajectory.",1. e4 c5 2. Nf3 d6 3. c3 Nf6 4. Qc2 Qc7 5. d3 g6 6. Be2 Bg7 7. O-O O-O 8. h3 b6 9. Bf4 Nbd7 10. Nbd2 Bb7 11. Bh2 e5 12. Nh4 d5 13. f4 exf4 14. Bxf4 Qd8 15. Nhf3 Re8 16. Rad1 c4 17. e5 cxd3 18. Bxd3 Nh5 19. Bg5 Qc7 20. Bb5 Qc5+ 21. Nd4 Rxe5 22. Nf3 Rxg5 23. Bxd7 Rg3 24. Qf2 Qc7 25. Bg4 Nf6 26. Nb5 Qb8 27. Nh2 h5 28. Bf3 Rg5 29. Rfe1 a6 30. Na3 Qc7 31. c4 Ne4 32. Qe3 Bh6 33. Qd4 Bf8 34. Qe3 Bc5 35. Rd4 Re8 36. Nc2 Rge5 37. Qh6 Ng5 38. Qxg5 Bxd4+ 39. Nxd4 Rxe1+ 40. Nf1,This is a game between Czerniak (as White) and Petrosian (as Black). Last move played: White plays Knight to f1,Large advantage for Black (eval: -823 centipawns),40... Qxc4 41. Ne2 Qc5+ 42. Kh2 Rxf1 43. b4 Qe3 44. Qxe3 Rxe3 45. Nd4 h4 46. a4 Kg7 47. Be2 Rf4 48. a5 bxa5 49. bxa5 Kf8 50. Bf3 Rxd4 ,40. Nf1 Qxc4 41. Qf4 Rxf1+ 42. Kh2 Qc1 43. Qxc1 Rxc1 44. h4 Rc4 45. Ne2 Kf8 46. b3 Rxh4+ 47. Kg1 Bc6 48. g3 Rb4 49. Kf2 a5 50. Nf4 Rd4 51. a4 Rd2+ 52. Kf1 Re3 53. Nxg6+ fxg6 54. Bxh5 Bb5+ 55. axb5 gxh5 56. Kg1 
"White is playing the opening with no ambition whatsoever, and Black achieves a comfortable game effortlessly.",True," The comment suggests Black is aggressively pursuing the initiative, potentially indicating a tactical error.",1. e4 c5 2. Nf3 d6 3. c3 Nf6 4. Qc2 Qc7 5. d3 g6 6. Be2,This is a game between Czerniak (as White) and Petrosian (as Black). Last move played: White plays Bishop to e2,Slight advantage for Black (eval: -24 centipawns),6... Bg7 ,6. g3 Bg7 
12.Nc4 would be more solid.,True," The comment describes a sequence of moves that leads to a checkmate, indicating a flaw in the move.",1. e4 c5 2. Nf3 d6 3. c3 Nf6 4. Qc2 Qc7 5. d3 g6 6. Be2 Bg7 7. O-O O-O 8. h3 b6 9. Bf4 Nbd7 10. Nbd2 Bb7 11. Bh2 e5 12. Nh4,This is a game between Czerniak (as White) and Petrosian (as Black). Last move played: White plays Knight to h4,Slight advantage for Black (eval: -30 centipawns),12... Rfe8 13. a4 ,12. a4 
