comment,good,reasoning,moves,context,engine_eval,engine_best_line,engine_best_alternative
"9.Nbd2 b5 10.Be2 Bb7 11.Nb3 Be7 12.Na5 Forced Spassky to grovel with the Black pieces against Bronstein at Moscow 1964, so Spassky chose another plan.",True," The comment provides context about a specific game and a player's strategic choice, suggesting a flawed move was a catalyst for a more aggressive plan.",1. d4 d5 2. c4 dxc4 3. Nf3 Nf6 4. e3 e6 5. Bxc4 c5 6. O-O a6 7. dxc5 Qxd1 8. Rxd1 Bxc5 9. b3,This is a game between Spassky (as White) and Fischer (as Black). Last move played: White plays Pawn to b3,Slight advantage for White (eval: 24 centipawns),9... Nbd7 10. Bb2 O-O 11. Nbd2 b6 12. Be2 Bb7 13. Nc4 Rfd8 14. Rac1 Rac8 15. Kf1 Kf8 16. Nce5 Nxe5 17. Rxd8+ Rxd8 18. Nxe5 Nd5 19. Nd3 Be7 ,9. Be2 
It is precisely this move which often discourages the extended fianchetto by Black. The following exchange leaves the a-pawn weak. Few players seem to enjoy the Black side of these positions.,True," The comment suggests a potential tactical disadvantage for Black, indicating a flaw in the move's strategic implications.",1. d4 d5 2. c4 dxc4 3. Nf3 Nf6 4. e3 e6 5. Bxc4 c5 6. O-O a6 7. dxc5 Qxd1 8. Rxd1 Bxc5 9. b3 Nbd7 10. Bb2 b5 11. Be2 Bb7 12. Nbd2 Ke7 13. a4,This is a game between Spassky (as White) and Fischer (as Black). Last move played: White plays Pawn to a4,The position is equal,13... bxa4 ,13. a4 bxa4 14. bxa4 Bd5 15. Ne1 Rhc8 16. g4 h6 17. Nd3 Bd6 18. Rac1 Rxc1 19. Rxc1 e5 20. f3 e4 21. fxe4 Nxe4 22. Nxe4 Bxe4 
This ties down the Nd7 and Bc5 therefore Black experiences some discomfort.,True," The comment suggests a positional weakness due to the move choices, indicating a flawed strategic understanding.",1. d4 d5 2. c4 dxc4 3. Nf3 Nf6 4. e3 e6 5. Bxc4 c5 6. O-O a6 7. dxc5 Qxd1 8. Rxd1 Bxc5 9. b3 Nbd7 10. Bb2 b5 11. Be2 Bb7 12. Nbd2 Ke7 13. a4 bxa4 14. Rxa4 Rhb8 15. Rc1,This is a game between Spassky (as White) and Fischer (as Black). Last move played: White plays Rook to c1,Slight advantage for White (eval: 25 centipawns),15... a5 16. Nd4 ,15. Rda1 Bd5 
An interesting move.,False,"

The comment offers no insight into why the move was considered a mistake.",1. d4 d5 2. c4 dxc4 3. Nf3 Nf6 4. e3 e6 5. Bxc4 c5 6. O-O a6 7. dxc5 Qxd1 8. Rxd1 Bxc5 9. b3 Nbd7 10. Bb2 b5 11. Be2 Bb7 12. Nbd2 Ke7 13. a4 bxa4 14. Rxa4 Rhb8 15. Rc1 Bd5 16. Ne5 Bd6 17. Nxd7 Nxd7 18. Rxa6 Rxa6 19. Bxa6 f6 20. Bc4 Bxc4 21. Rxc4 Nc5 22. Rc3 f5 23. Ba3 Ne4,This is a game between Spassky (as White) and Fischer (as Black). Last move played: Black plays Knight to e4,Large advantage for White (eval: 223 centipawns),24. Rc7+ ,23... Na6 
One might well expect White to win from this position.,True," The comment suggests a potential outcome that isn't logically supported by the current position, indicating a flawed assessment.",1. d4 d5 2. c4 dxc4 3. Nf3 Nf6 4. e3 e6 5. Bxc4 c5 6. O-O a6 7. dxc5 Qxd1 8. Rxd1 Bxc5 9. b3 Nbd7 10. Bb2 b5 11. Be2 Bb7 12. Nbd2 Ke7 13. a4 bxa4 14. Rxa4 Rhb8 15. Rc1 Bd5 16. Ne5 Bd6 17. Nxd7 Nxd7 18. Rxa6 Rxa6 19. Bxa6 f6 20. Bc4 Bxc4 21. Rxc4 Nc5 22. Rc3 f5 23. Ba3 Ne4 24. Rc7+ Kd8 25. Bxd6 Nxd2 26. Rxg7 Rxb3 27. h4 h5 28. Bf4,This is a game between Spassky (as White) and Fischer (as Black). Last move played: White plays Bishop to f4,Large advantage for White (eval: 219 centipawns),28... Ke8 29. Bg5 ,28. Bf4 Ke8 29. Bg5 Kf8 30. Rg6 Rb6 31. Bf4 Ne4 32. f3 Rb1+ 33. Kh2 Kf7 34. Rh6 Nf6 35. Bg5 Ng8 36. Rxh5 Kg6 37. g4 fxg4 38. fxg4 Rb5 39. Kg2 Ra5 40. Kg3 Rd5 41. Kf3 Ra5 42. e4 Rb5 43. Ke3 Ra5 44. Kf4 Rb5 45. Kf3 Ra5 46. Ke3 Ra3+ 47. Kf4 Ra5 
The pin on the g-pawn is most annoying.,True," The comment directly expresses a negative sentiment about a specific tactical issue, indicating a flawed move.",1. d4 d5 2. c4 dxc4 3. Nf3 Nf6 4. e3 e6 5. Bxc4 c5 6. O-O a6 7. dxc5 Qxd1 8. Rxd1 Bxc5 9. b3 Nbd7 10. Bb2 b5 11. Be2 Bb7 12. Nbd2 Ke7 13. a4 bxa4 14. Rxa4 Rhb8 15. Rc1 Bd5 16. Ne5 Bd6 17. Nxd7 Nxd7 18. Rxa6 Rxa6 19. Bxa6 f6 20. Bc4 Bxc4 21. Rxc4 Nc5 22. Rc3 f5 23. Ba3 Ne4 24. Rc7+ Kd8 25. Bxd6 Nxd2 26. Rxg7 Rxb3 27. h4 h5 28. Bf4 Ke8 29. Kh2 Rb2 30. Kh3 Ne4 31. f3 Nf2+ 32. Kh2 Nd3 33. Bg5 e5 34. Kh3 Nf2+ 35. Kh2 Nd3 36. Bh6 Ne1,This is a game between Spassky (as White) and Fischer (as Black). Last move played: Black plays Knight to e1,Large advantage for White (eval: 162 centipawns),37. Kh3 ,36... Rc2 
"Instead, 40.Rh7 would have won, as discovered by the computer program Deep Thought II.",True," The comment suggests a potential tactical advantage that was missed, indicating a flawed evaluation of the position.",1. d4 d5 2. c4 dxc4 3. Nf3 Nf6 4. e3 e6 5. Bxc4 c5 6. O-O a6 7. dxc5 Qxd1 8. Rxd1 Bxc5 9. b3 Nbd7 10. Bb2 b5 11. Be2 Bb7 12. Nbd2 Ke7 13. a4 bxa4 14. Rxa4 Rhb8 15. Rc1 Bd5 16. Ne5 Bd6 17. Nxd7 Nxd7 18. Rxa6 Rxa6 19. Bxa6 f6 20. Bc4 Bxc4 21. Rxc4 Nc5 22. Rc3 f5 23. Ba3 Ne4 24. Rc7+ Kd8 25. Bxd6 Nxd2 26. Rxg7 Rxb3 27. h4 h5 28. Bf4 Ke8 29. Kh2 Rb2 30. Kh3 Ne4 31. f3 Nf2+ 32. Kh2 Nd3 33. Bg5 e5 34. Kh3 Nf2+ 35. Kh2 Nd3 36. Bh6 Ne1 37. Kg1 Nd3 38. Bg5 Rb1+ 39. Kh2 Rb2 40. Re7+,This is a game between Spassky (as White) and Fischer (as Black). Last move played: White plays Rook to e7 with check,Large advantage for White (eval: 102 centipawns),40... Kf8 41. Re6 Kg7 42. Kh3 Ra2 43. Rd6 e4 44. Rd7+ Kg6 45. Rd5 Re2 46. Ra5 Nf2+ 47. Kg3 Nd3 48. Ra6+ Kg7 49. Ra7+ Kg6 50. fxe4 fxe4 51. Ra5 Kf7 52. Rb5 Ne1 53. Kf4 Nxg2+ 54. Kxe4 Ra2 55. Kf3 Ne1+ 56. Kf4 Ng2+ 57. Kg3 Ne1 58. Bf4 Rg2+ 59. Kh3 ,40. Rh7 
"46.Rd5 The computer program Deep Thought II claimed that White would have won here, but human analysts felt that 46...Kf7 would pro",True," The comment suggests a potential strategic error based on a computer analysis, indicating a flawed move.",1. d4 d5 2. c4 dxc4 3. Nf3 Nf6 4. e3 e6 5. Bxc4 c5 6. O-O a6 7. dxc5 Qxd1 8. Rxd1 Bxc5 9. b3 Nbd7 10. Bb2 b5 11. Be2 Bb7 12. Nbd2 Ke7 13. a4 bxa4 14. Rxa4 Rhb8 15. Rc1 Bd5 16. Ne5 Bd6 17. Nxd7 Nxd7 18. Rxa6 Rxa6 19. Bxa6 f6 20. Bc4 Bxc4 21. Rxc4 Nc5 22. Rc3 f5 23. Ba3 Ne4 24. Rc7+ Kd8 25. Bxd6 Nxd2 26. Rxg7 Rxb3 27. h4 h5 28. Bf4 Ke8 29. Kh2 Rb2 30. Kh3 Ne4 31. f3 Nf2+ 32. Kh2 Nd3 33. Bg5 e5 34. Kh3 Nf2+ 35. Kh2 Nd3 36. Bh6 Ne1 37. Kg1 Nd3 38. Bg5 Rb1+ 39. Kh2 Rb2 40. Re7+ Kf8 41. Re6 Kg7 42. Kh3 Re2 43. Rd6 Ne1 44. Bf6+ Kg8 45. Bxe5 Rxe3 46. Bf4,This is a game between Spassky (as White) and Fischer (as Black). Last move played: White plays Bishop to f4,Large advantage for White (eval: 233 centipawns),46... Re2 47. Bd2 Nc2 48. Kg3 Kf7 49. Rd8 Kf6 50. Bg5+ Kg6 51. Rd6+ Kg7 52. Kf4 Ne3 53. g3 Nf1 54. Rd1 Rf2 55. Rc1 Kg6 56. Rc6+ Kf7 57. Rf6+ Ke8 58. Rxf5 Rg2 59. Re5+ Kf7 60. g4 hxg4 61. fxg4 Nh2 62. Re7+ Kf8 63. Rd7 Rxg4+ 64. Kf5 Ra4 ,46. Rd5 
"Score: Spassky 2, Fischer 1, 3 draws.",True,". The comment indicates a draw, suggesting the move was flawed and resulted in a stalemate.",1. d4 d5 2. c4 dxc4 3. Nf3 Nf6 4. e3 e6 5. Bxc4 c5 6. O-O a6 7. dxc5 Qxd1 8. Rxd1 Bxc5 9. b3 Nbd7 10. Bb2 b5 11. Be2 Bb7 12. Nbd2 Ke7 13. a4 bxa4 14. Rxa4 Rhb8 15. Rc1 Bd5 16. Ne5 Bd6 17. Nxd7 Nxd7 18. Rxa6 Rxa6 19. Bxa6 f6 20. Bc4 Bxc4 21. Rxc4 Nc5 22. Rc3 f5 23. Ba3 Ne4 24. Rc7+ Kd8 25. Bxd6 Nxd2 26. Rxg7 Rxb3 27. h4 h5 28. Bf4 Ke8 29. Kh2 Rb2 30. Kh3 Ne4 31. f3 Nf2+ 32. Kh2 Nd3 33. Bg5 e5 34. Kh3 Nf2+ 35. Kh2 Nd3 36. Bh6 Ne1 37. Kg1 Nd3 38. Bg5 Rb1+ 39. Kh2 Rb2 40. Re7+ Kf8 41. Re6 Kg7 42. Kh3 Re2 43. Rd6 Ne1 44. Bf6+ Kg8 45. Bxe5 Rxe3 46. Bf4 Re2 47. Rg6+ Kf7 48. Rg5 Ke6 49. Bc7 Ra2 50. Bb6 Nd3 51. Kh2 Ne1 52. Kh3 Nd3 53. Bc7 Rc2 54. Bb6 Ra2 55. Kg3 Ne1 56. Rxh5 Rxg2+ 57. Kf4 Nd3+ 58. Ke3 Ne5 59. Rh6+ Kd5 60. Bc7 Rg7 61. Bxe5 Kxe5,This is a game between Spassky (as White) and Fischer (as Black). Last move played: Black plays King takes on e5,The position is equal,62. Ra6 f4+ 63. Ke2 Kf5 64. Ra5+ Kf6 65. Kf2 Rg3 66. h5 Rh3 67. Ke2 Rh1 68. h6 Kg6 69. Ra6+ Kh7 70. Rf6 Rh2+ 71. Kd3 Ra2 72. Rxf4 Kxh6 73. Ke3 ,61... Kxe5 62. Ra6 f4+ 63. Kd3 Rd7+ 64. Kc3 Rc7+ 65. Kd2 Rd7+ 
This ties down the Nd7 and Bc5 therefore Black experiences some discomfort.,True, The comment identifies a specific error in the move sequence.,1. d4 d5 2. c4 dxc4 3. Nf3 Nf6 4. e3 e6 5. Bxc4 c5 6. O-O a6 7. dxc5 Qxd1 8. Rxd1 Bxc5 9. b3 Nbd7 10. Bb2 b5 11. Be2 Bb7 12. Nbd2 Ke7 13. a4 bxa4 14. Rxa4 Rhb8 15. Rc1,This is a game between Spassky (as White) and Fischer (as Black). Last move played: White plays Rook to c1,Slight advantage for White (eval: 25 centipawns),15... a5 16. Nd4 ,15. Rda1 Bd5 
The weakness of c6 is important. Black's light-squared bishop can easily be placed in a position where it has too much work to do.,True,", The comment suggests a potential weakening of the kingside, indicating a strategic flaw.",1. d4 d5 2. c4 dxc4 3. Nf3 Nf6 4. e3 e6 5. Bxc4 c5 6. O-O a6 7. dxc5 Qxd1 8. Rxd1 Bxc5 9. b3 Nbd7 10. Bb2 b5 11. Be2 Bb7 12. Nbd2 Ke7 13. a4 bxa4 14. Rxa4 Rhb8 15. Rc1 Bd5 16. Ne5,This is a game between Spassky (as White) and Fischer (as Black). Last move played: White plays Knight to e5,Advantage for White (eval: 69 centipawns),16... Bd6 17. Nc6+ ,16. e4 
"9.Nbd2 b5 10.Be2 Bb7 11.Nb3 Be7 12.Na5 Forced Spassky to grovel with the Black pieces against Bronstein at Moscow 1964, so Spassky chose another plan.",True," The comment provides context about the previous move, suggesting a strategic deviation.",1. d4 d5 2. c4 dxc4 3. Nf3 Nf6 4. e3 e6 5. Bxc4 c5 6. O-O a6 7. dxc5 Qxd1 8. Rxd1 Bxc5 9. b3,This is a game between Spassky (as White) and Fischer (as Black). Last move played: White plays Pawn to b3,Slight advantage for White (eval: 24 centipawns),9... Nbd7 10. Bb2 O-O 11. Nbd2 b6 12. Be2 Bb7 13. Nc4 Rfd8 14. Rac1 Rac8 15. Kf1 Kf8 16. Nce5 Nxe5 17. Rxd8+ Rxd8 18. Nxe5 Nd5 19. Nd3 Be7 ,9. Be2 
14...Nb6 seems best. 15.Ra5 Bb4 16.Ba3 Bxa3 17.Rxa3 Nfd5 18.Rda1 Nb4 secures the defense.,True," The comment suggests a potential weakness in White’s pawn structure, implying the inactivity hinders their advantage.",1. d4 d5 2. c4 dxc4 3. Nf3 Nf6 4. e3 e6 5. Bxc4 c5 6. O-O a6 7. dxc5 Qxd1 8. Rxd1 Bxc5 9. b3 Nbd7 10. Bb2 b5 11. Be2 Bb7 12. Nbd2 Ke7 13. a4 bxa4 14. Rxa4 Rhb8,This is a game between Spassky (as White) and Fischer (as Black). Last move played: Black plays Rook to b8,Slight advantage for White (eval: 48 centipawns),15. Rda1 Bd5 ,14... Nb6 
