comment,good,reasoning,moves,context,engine_eval,engine_best_line,engine_best_alternative
The Queen's Indian Defense where Black obtains a solid but somewhat passive position.,True," The comment suggests a potential weakness in the Queen's Indian Defense, indicating a lack of dynamism.",1. d4 Nf6 2. Nf3 e6 3. c4 b6 4. g3 Bb7 5. Bg2,This is a game between Alekhine (as White) and Bogoljubow (as Black). Last move played: White plays Bishop to g2,Slight advantage for White (eval: 41 centipawns),5... Bb4+ 6. Bd2 ,5. Bg2 
This aggressive attempt to take over the center backfires.,True," The comment suggests a negative consequence of the move, indicating a flawed strategic decision.",1. d4 Nf6 2. Nf3 e6 3. c4 b6 4. g3 Bb7 5. Bg2 c5,This is a game between Alekhine (as White) and Bogoljubow (as Black). Last move played: Black plays Pawn to c5,Advantage for White (eval: 88 centipawns),6. d5 exd5 ,5... Bb4+ 6. Bd2 
White has the advantage due to his control of the d-file.,True," The comment suggests a potential advantage, but lacks specific tactical or strategic reasoning to justify the perceived mistake.",1. d4 Nf6 2. Nf3 e6 3. c4 b6 4. g3 Bb7 5. Bg2 c5 6. dxc5 Bxc5 7. O-O O-O 8. Nc3,This is a game between Alekhine (as White) and Bogoljubow (as Black). Last move played: White plays Knight to c3,The position is equal,8... d5 ,8. Nc3 d5 
"This move cuts down on White's control of the d-file. However, it allows White the opportunity to unmask his light squared bishop with advantage. 8... Nc6 would be a better move although White would still remain with the advantage due to Black's d-pawn standing on the semi-open",True," The comment identifies a positional weakness and suggests a more solid alternative, indicating a flawed assessment of the resulting position.",1. d4 Nf6 2. Nf3 e6 3. c4 b6 4. g3 Bb7 5. Bg2 c5 6. dxc5 Bxc5 7. O-O O-O 8. Nc3 d5,This is a game between Alekhine (as White) and Bogoljubow (as Black). Last move played: Black plays Pawn to d5,The position is equal,9. cxd5 ,8... d5 
9.Ne5 Qc7 10.Bf4 Nh5 would give Black the advantage of the two bishops.,True," The comment suggests a potential strategic error by Black, indicating a missed opportunity to consolidate their position.",1. d4 Nf6 2. Nf3 e6 3. c4 b6 4. g3 Bb7 5. Bg2 c5 6. dxc5 Bxc5 7. O-O O-O 8. Nc3 d5 9. Nd4,This is a game between Alekhine (as White) and Bogoljubow (as Black). Last move played: White plays Knight to d4,The position is equal,9... h6 10. Nc2 ,9. cxd5 
9...Nc6 10.Nxc6 Bxc6 11.Bg5 Be7 12.Rc1 would give an advantage to White because of his more active pieces.,True," The comment suggests a potential strategic error by White, implying an over-aggressive plan.",1. d4 Nf6 2. Nf3 e6 3. c4 b6 4. g3 Bb7 5. Bg2 c5 6. dxc5 Bxc5 7. O-O O-O 8. Nc3 d5 9. Nd4 Bxd4,This is a game between Alekhine (as White) and Bogoljubow (as Black). Last move played: Black plays Bishop takes on d4,Slight advantage for White (eval: 37 centipawns),10. Qxd4 Nc6 ,9... h6 10. Nc2 
White has gained the two bishops and in an open position like this one this constitutes a big advantage.,True," The comment suggests a strategic benefit gained through the bishop advancement, potentially indicating a flawed evaluation of the position.",1. d4 Nf6 2. Nf3 e6 3. c4 b6 4. g3 Bb7 5. Bg2 c5 6. dxc5 Bxc5 7. O-O O-O 8. Nc3 d5 9. Nd4 Bxd4 10. Qxd4,This is a game between Alekhine (as White) and Bogoljubow (as Black). Last move played: White plays Queen takes on d4,Slight advantage for White (eval: 34 centipawns),10... Nc6 11. Qh4 Ne5 12. cxd5 Nxd5 13. Qh5 Nd7 14. Bg5 Qe8 15. Nxd5 Bxd5 16. e4 Bb7 17. Rac1 f6 18. Qxe8 Rfxe8 19. Be3 Rac8 20. Rxc8 Rxc8 21. Rd1 Nf8 22. Rc1 h6 23. Rxc8 Bxc8 ,10. Qxd4 Nc6 
Very well played! White is in no hurry to capture the c-pawn and first takes control of the d-file.,True, The comment suggests the move is a strategic blunder because white is avoiding a direct attack.,1. d4 Nf6 2. Nf3 e6 3. c4 b6 4. g3 Bb7 5. Bg2 c5 6. dxc5 Bxc5 7. O-O O-O 8. Nc3 d5 9. Nd4 Bxd4 10. Qxd4 Nc6 11. Qh4 dxc4 12. Rd1,This is a game between Alekhine (as White) and Bogoljubow (as Black). Last move played: White plays Rook to d1,Advantage for White (eval: 90 centipawns),12... Nd5 13. Bg5 Qe8 14. Nxd5 exd5 15. Rxd5 Nb4 16. Rd2 Bxg2 17. Be7 Bb7 18. Bxb4 c3 19. Bxc3 Rd8 20. Rad1 Qc6 21. f3 Rxd2 22. Rxd2 f6 23. Qf4 Re8 24. e4 Ba6 25. h4 h6 26. Kf2 ,12. Rd1 Nd5 
White's superior development allows him to train his sights on the kingside.,True," The comment suggests the player’s strong development is leading to a tactical disadvantage, potentially indicating a flaw in their plan.",1. d4 Nf6 2. Nf3 e6 3. c4 b6 4. g3 Bb7 5. Bg2 c5 6. dxc5 Bxc5 7. O-O O-O 8. Nc3 d5 9. Nd4 Bxd4 10. Qxd4 Nc6 11. Qh4 dxc4 12. Rd1 Qc8 13. Bg5 Nd5 14. Nxd5 exd5 15. Rxd5 Nb4 16. Be4,This is a game between Alekhine (as White) and Bogoljubow (as Black). Last move played: White plays Bishop to e4,Large advantage for White (eval: 224 centipawns),16... h5 ,16. Be4 h5 17. Rd4 Bxe4 18. Rxe4 Qf5 19. Rxc4 f6 20. Bd2 Na6 21. Be3 Rfd8 22. Rac1 Rd7 23. R4c3 b5 24. Rc6 Rad8 25. Rxa6 Rd1+ 26. Rxd1 Rxd1+ 27. Kg2 Qb1 28. Qxh5 Rh1 
With this move White is able to win Black's queen.,True," The comment suggests a potential winning strategy, indicating a flawed move.",1. d4 Nf6 2. Nf3 e6 3. c4 b6 4. g3 Bb7 5. Bg2 c5 6. dxc5 Bxc5 7. O-O O-O 8. Nc3 d5 9. Nd4 Bxd4 10. Qxd4 Nc6 11. Qh4 dxc4 12. Rd1 Qc8 13. Bg5 Nd5 14. Nxd5 exd5 15. Rxd5 Nb4 16. Be4 f5 17. Bxf5,This is a game between Alekhine (as White) and Bogoljubow (as Black). Last move played: White plays Bishop takes on f5,Large advantage for White (eval: 357 centipawns),17... Rxf5 18. Rd8+ Qxd8 19. Bxd8 Re5 20. Qd4 Re4 21. Qd7 Bc6 22. Qd6 Rc8 23. Qxb4 Rxd8 24. f3 Red4 25. Re1 Be8 26. g4 b5 27. Kf2 Rd2 28. h4 a6 29. h5 Bf7 30. Kg3 Rc2 31. h6 gxh6 ,17. Bxf5 Rxf5 18. Rd8+ Qxd8 19. Bxd8 Re5 20. Qxc4+ Nd5 21. e4 Rxd8 22. exd5 Bxd5 23. Qd3 Ree8 24. Rd1 Kh8 25. f4 Rd7 26. a3 h6 27. Kf2 Be6 28. Qf3 Rc7 29. Re1 Rc2+ 30. Re2 Bg4 31. Qxg4 Rcxe2+ 32. Qxe2 
White has a material advantage and with Alekhine's technique the game is over.,True," The comment suggests a logical conclusion about the outcome based on material advantage, implying a flawed assessment of the position.",1. d4 Nf6 2. Nf3 e6 3. c4 b6 4. g3 Bb7 5. Bg2 c5 6. dxc5 Bxc5 7. O-O O-O 8. Nc3 d5 9. Nd4 Bxd4 10. Qxd4 Nc6 11. Qh4 dxc4 12. Rd1 Qc8 13. Bg5 Nd5 14. Nxd5 exd5 15. Rxd5 Nb4 16. Be4 f5 17. Bxf5 Rxf5 18. Rd8+ Qxd8 19. Bxd8,This is a game between Alekhine (as White) and Bogoljubow (as Black). Last move played: White plays Bishop takes on d8,Large advantage for White (eval: 363 centipawns),19... Re5 20. Qd4 Re4 21. Qd7 Bc6 22. Qd2 Nd3 23. Bg5 Ne5 24. f3 c3 25. bxc3 Nxf3+ 26. exf3 Re6 27. Kf2 Rae8 28. Bf4 Re2+ 29. Qxe2 ,19. Bxd8 Re5 20. Qxc4+ Nd5 21. e4 Rxd8 22. exd5 Bxd5 23. Qd3 Ree8 24. Rd1 Rd7 25. f4 Be6 26. Qf3 Rde7 27. Re1 Kf8 28. Re5 Bxa2 29. Qa3 Bc4 30. h3 Kf7 31. Rxe7+ Rxe7 32. g4 Re1+ 33. Kh2 
Stops the White rook from taking the seventh rank.,True," Yes, the comment directly identifies a flaw in the White rook's strategic plan, indicating a mistake.",1. d4 Nf6 2. Nf3 e6 3. c4 b6 4. g3 Bb7 5. Bg2 c5 6. dxc5 Bxc5 7. O-O O-O 8. Nc3 d5 9. Nd4 Bxd4 10. Qxd4 Nc6 11. Qh4 dxc4 12. Rd1 Qc8 13. Bg5 Nd5 14. Nxd5 exd5 15. Rxd5 Nb4 16. Be4 f5 17. Bxf5 Rxf5 18. Rd8+ Qxd8 19. Bxd8 Rc8 20. Rd1 Rf7,This is a game between Alekhine (as White) and Bogoljubow (as Black). Last move played: Black plays Rook to f7,Large advantage for White (eval: 428 centipawns),21. Bxb6 c3 22. bxc3 Nc6 23. Be3 Re8 24. h3 h6 25. Qa4 Rfe7 26. Qb3+ Kh8 27. c4 Ne5 28. Bc5 Rf7 29. Bxa7 Be4 30. Bd4 Rb7 31. Qc3 ,20... Nd3 21. Qe7 Rf7 22. Qe8+ Rf8 23. Qe6+ Rf7 24. Bg5 Nc5 25. Qe5 Rff8 26. Be3 Rfe8 27. Qd4 Ne4 28. Qd7 Bc6 29. Qxa7 c3 30. Bd4 Nf6 31. Bxf6 gxf6 32. bxc3 Red8 33. Rxd8+ Rxd8 34. f3 Rd7 35. Qb8+ Kg7 36. Kg2 
An oversight or is Black giving up?,True,", The comment suggests a potential loss of interest or strategy, indicating a potential mistake.",1. d4 Nf6 2. Nf3 e6 3. c4 b6 4. g3 Bb7 5. Bg2 c5 6. dxc5 Bxc5 7. O-O O-O 8. Nc3 d5 9. Nd4 Bxd4 10. Qxd4 Nc6 11. Qh4 dxc4 12. Rd1 Qc8 13. Bg5 Nd5 14. Nxd5 exd5 15. Rxd5 Nb4 16. Be4 f5 17. Bxf5 Rxf5 18. Rd8+ Qxd8 19. Bxd8 Rc8 20. Rd1 Rf7 21. Qg4 Nd3,This is a game between Alekhine (as White) and Bogoljubow (as Black). Last move played: Black plays Knight to d3,Large advantage for White (eval: 395 centipawns),22. exd3 Rxd8 23. dxc4 Re8 24. f4 Bc8 25. Qg5 h6 26. Qh5 Rfe7 27. f5 Re5 28. Rd5 Re4 29. f6 Kh7 30. Rd1 Bg4 31. Qf7 Rg8 32. Rf1 Re5 33. Qc7 Re4 34. c5 Re2 35. Rf2 Re1+ 36. Kg2 ,21... Nd3 22. exd3 Rxd8 23. dxc4 Re8 24. f4 Bc8 25. Qg5 h6 26. Qh5 Rfe7 27. Rd2 b5 28. Kf2 bxc4 29. Qd1 Bf5 30. Rd8 Bd3 31. Rxe8+ Rxe8 32. Qf3 Kh7 33. f5 Re5 34. g4 Re4 
When ahead in material you should exchange pieces to make promoting a pawn easier.,True," The comment offers a potential strategy, but it’s not a correct assessment of the mistake – the player should not exchange pieces to promote a pawn.",1. d4 Nf6 2. Nf3 e6 3. c4 b6 4. g3 Bb7 5. Bg2 c5 6. dxc5 Bxc5 7. O-O O-O 8. Nc3 d5 9. Nd4 Bxd4 10. Qxd4 Nc6 11. Qh4 dxc4 12. Rd1 Qc8 13. Bg5 Nd5 14. Nxd5 exd5 15. Rxd5 Nb4 16. Be4 f5 17. Bxf5 Rxf5 18. Rd8+ Qxd8 19. Bxd8 Rc8 20. Rd1 Rf7 21. Qg4 Nd3 22. exd3 Rxd8 23. dxc4 Rdf8 24. f4 Re7 25. Kf2 h6 26. Re1,This is a game between Alekhine (as White) and Bogoljubow (as Black). Last move played: White plays Rook to e1,Large advantage for White (eval: 422 centipawns),26... Bc8 27. Qh5 Be6 28. Qb5 Rf6 29. b3 g5 30. Re4 Kh7 31. Qe5 Ref7 32. Rd4 Bg4 33. Rd6 Rxd6 34. Qxd6 Rd7 35. Qf6 Rd2+ 36. Ke3 Re2+ 37. Kd3 Rxh2 ,26. Re1 Bc8 27. Qh5 Be6 28. b3 Bf7 29. Qd1 Rc7 30. Qd4 Bh5 31. Re5 Bg4 32. Qe4 Rd7 33. Rd5 Rdd8 34. Rxd8 Rxd8 
White's queen is pinning the rook on f7.,True," The comment directly indicates a potential tactical threat, suggesting a problematic opening or pawn structure.",1. d4 Nf6 2. Nf3 e6 3. c4 b6 4. g3 Bb7 5. Bg2 c5 6. dxc5 Bxc5 7. O-O O-O 8. Nc3 d5 9. Nd4 Bxd4 10. Qxd4 Nc6 11. Qh4 dxc4 12. Rd1 Qc8 13. Bg5 Nd5 14. Nxd5 exd5 15. Rxd5 Nb4 16. Be4 f5 17. Bxf5 Rxf5 18. Rd8+ Qxd8 19. Bxd8 Rc8 20. Rd1 Rf7 21. Qg4 Nd3 22. exd3 Rxd8 23. dxc4 Rdf8 24. f4 Re7 25. Kf2 h6 26. Re1 Bc8 27. Qf3 Ref7 28. Qd5,This is a game between Alekhine (as White) and Bogoljubow (as Black). Last move played: White plays Queen to d5,Large advantage for White (eval: 422 centipawns),28... Kh7 29. Qd6 Rf6 30. Qd1 R8f7 31. Re5 g5 32. a4 Bd7 33. Rd5 Bc6 34. Rd8 Kg7 35. Qd4 gxf4 36. g4 Bxa4 ,28. Re5 Bf5 29. Qd5 g6 30. Re7 Kg7 31. Qe5+ Kh7 32. b4 h5 33. Rc7 Rxc7 34. Qxc7+ Kg8 35. c5 bxc5 36. bxc5 Rf7 37. Qa5 Bh3 38. c6 Kg7 39. Ke3 Re7+ 40. Kd2 
Black resigned due to his material deficit.,True, The comment clearly indicates a strategic blunder leading to resignation.,1. d4 Nf6 2. Nf3 e6 3. c4 b6 4. g3 Bb7 5. Bg2 c5 6. dxc5 Bxc5 7. O-O O-O 8. Nc3 d5 9. Nd4 Bxd4 10. Qxd4 Nc6 11. Qh4 dxc4 12. Rd1 Qc8 13. Bg5 Nd5 14. Nxd5 exd5 15. Rxd5 Nb4 16. Be4 f5 17. Bxf5 Rxf5 18. Rd8+ Qxd8 19. Bxd8 Rc8 20. Rd1 Rf7 21. Qg4 Nd3 22. exd3 Rxd8 23. dxc4 Rdf8 24. f4 Re7 25. Kf2 h6 26. Re1 Bc8 27. Qf3 Ref7 28. Qd5 g5 29. Re7 gxf4 30. gxf4,This is a game between Alekhine (as White) and Bogoljubow (as Black). Last move played: White plays Pawn takes on f4,Large advantage for White (eval: 486 centipawns),30... Kg7 31. Rxf7+ Rxf7 32. Qe5+ Kg6 33. b4 Bf5 34. c5 bxc5 35. bxc5 a5 36. c6 a4 37. a3 Rf8 38. Ke3 Rf6 39. Kf3 Be6 40. c7 Kf7 41. Ke4 Bc8 42. Qd5+ Kg7 ,30. gxf4 Kg7 31. Rxf7+ Rxf7 32. Qe5+ Kg6 33. b4 Bf5 34. c5 bxc5 35. bxc5 Rf6 36. c6 h5 37. c7 h4 38. Qe7 h3 39. Kf1 Rf7 40. Qe5 Kh7 41. a3 a6 
9.Ne5 Qc7 10.Bf4 Nh5 would give Black the advantage of the two bishops.,True," Yes, the comment offers a potential explanation for the mistake, suggesting a missed defensive opportunity.",1. d4 Nf6 2. Nf3 e6 3. c4 b6 4. g3 Bb7 5. Bg2 c5 6. dxc5 Bxc5 7. O-O O-O 8. Nc3 d5 9. Nd4,This is a game between Alekhine (as White) and Bogoljubow (as Black). Last move played: White plays Knight to d4,The position is equal,9... h6 10. Nc2 ,9. cxd5 
