comment,good,reasoning,moves,context,engine_eval,engine_best_line,engine_best_alternative
"dans cette position, 7. h4 et 7.0-0-0 sont des coups importants",True," The comment suggests the moves are crucial, indicating a potential misjudgment of the resulting pawn structure.",1. e4 d6 2. d4 Nf6 3. Nc3 g6 4. Be3 Bg7 5. Qd2 c6 6. f3 b5 7. Nge2,"This is a game between Kasparov, Garry (as White) and Topalov, Veselin (as Black). Last move played: White plays Knight to e2",Slight advantage for White (eval: 38 centipawns),7... a5 8. Bh6 ,7. a3 Nbd7 
"une combinaison etonnante, en tout cas une excellente possibilite pratique. Le premier sacrifice d'une partie exceptionnelle",True," The comment describes a seemingly exceptional move but also highlights a mistake, suggesting a potential flaw in the player's strategic thinking.",1. e4 d6 2. d4 Nf6 3. Nc3 g6 4. Be3 Bg7 5. Qd2 c6 6. f3 b5 7. Nge2 Nbd7 8. Bh6 Bxh6 9. Qxh6 Bb7 10. a3 e5 11. O-O-O Qe7 12. Kb1 a6 13. Nc1 O-O-O 14. Nb3 exd4 15. Rxd4 c5 16. Rd1 Nb6 17. g3 Kb8 18. Na5 Ba8 19. Bh3 d5 20. Qf4+ Ka7 21. Rhe1 d4 22. Nd5 Nbxd5 23. exd5 Qd6 24. Rxd4,"This is a game between Kasparov, Garry (as White) and Topalov, Veselin (as Black). Last move played: White plays Rook takes on d4",Slight advantage for Black (eval: -29 centipawns),24... Kb6 25. b4 ,24. Rxd4 Kb6 25. b4 Qxf4 26. Rxf4 Nxd5 27. Rxf7 cxb4 28. axb4 Rhe8 29. Rxe8 Rxe8 30. Nb3 Re1+ 31. Kb2 Re2 32. Rxh7 Nxb4 33. Nd4 Rxh2 34. Rh4 Bd5 35. Be6 Nd3+ 36. Kb1 
"Topalov avait au moins deux facons d'eviter l'attaque, il est probable qu'il ait vu l'une des deux suites tranquilles, mais lui aussi voulait gagner!",True," The comment suggests Topalov considered alternative defensive strategies, indicating a potential flaw in his assessment of the situation.",1. e4 d6 2. d4 Nf6 3. Nc3 g6 4. Be3 Bg7 5. Qd2 c6 6. f3 b5 7. Nge2 Nbd7 8. Bh6 Bxh6 9. Qxh6 Bb7 10. a3 e5 11. O-O-O Qe7 12. Kb1 a6 13. Nc1 O-O-O 14. Nb3 exd4 15. Rxd4 c5 16. Rd1 Nb6 17. g3 Kb8 18. Na5 Ba8 19. Bh3 d5 20. Qf4+ Ka7 21. Rhe1 d4 22. Nd5 Nbxd5 23. exd5 Qd6 24. Rxd4 cxd4,"This is a game between Kasparov, Garry (as White) and Topalov, Veselin (as Black). Last move played: Black plays Pawn takes on d4",Large advantage for White (eval: 273 centipawns),25. Re7+ ,24... Kb6 25. b4 
VOIR DIAGRAMME 1,True," Yes, the comment indicates a diagram is needed to understand the error.",1. e4 d6 2. d4 Nf6 3. Nc3 g6 4. Be3 Bg7 5. Qd2 c6 6. f3 b5 7. Nge2 Nbd7 8. Bh6 Bxh6 9. Qxh6 Bb7 10. a3 e5 11. O-O-O Qe7 12. Kb1 a6 13. Nc1 O-O-O 14. Nb3 exd4 15. Rxd4 c5 16. Rd1 Nb6 17. g3 Kb8 18. Na5 Ba8 19. Bh3 d5 20. Qf4+ Ka7 21. Rhe1 d4 22. Nd5 Nbxd5 23. exd5 Qd6 24. Rxd4 cxd4 25. Re7+ Kb6 26. Qxd4+ Kxa5 27. b4+ Ka4 28. Qc3 Qxd5 29. Ra7 Bb7,"This is a game between Kasparov, Garry (as White) and Topalov, Veselin (as Black). Last move played: Black plays Bishop to b7",Advantage for White (eval: 80 centipawns),30. Rxb7 Qc4 ,29... Bb7 
"Le numero 1 mondial joue ici un coup fabuleux. Il aurait pu prendre la nulle, avec 2 pieces de retard, cela eut ete une decision comprehensible. Il choisit l'attaque, l'avenir lui donnera raison mais il n'a pas le droit de se tromper!",True," The comment describes a seemingly good move but criticizes the player's hesitation, suggesting a missed opportunity for a more solid defense.",1. e4 d6 2. d4 Nf6 3. Nc3 g6 4. Be3 Bg7 5. Qd2 c6 6. f3 b5 7. Nge2 Nbd7 8. Bh6 Bxh6 9. Qxh6 Bb7 10. a3 e5 11. O-O-O Qe7 12. Kb1 a6 13. Nc1 O-O-O 14. Nb3 exd4 15. Rxd4 c5 16. Rd1 Nb6 17. g3 Kb8 18. Na5 Ba8 19. Bh3 d5 20. Qf4+ Ka7 21. Rhe1 d4 22. Nd5 Nbxd5 23. exd5 Qd6 24. Rxd4 cxd4 25. Re7+ Kb6 26. Qxd4+ Kxa5 27. b4+ Ka4 28. Qc3 Qxd5 29. Ra7 Bb7 30. Rxb7,"This is a game between Kasparov, Garry (as White) and Topalov, Veselin (as Black). Last move played: White plays Rook takes on b7",Advantage for White (eval: 60 centipawns),30... Qc4 ,30. Rxb7 Qc4 
"il n'y a plus d'espoir, Topalov abandonne",True,". The comment clearly indicates a significant loss of hope and a player's decision to abandon the game, suggesting a critical error.",1. e4 d6 2. d4 Nf6 3. Nc3 g6 4. Be3 Bg7 5. Qd2 c6 6. f3 b5 7. Nge2 Nbd7 8. Bh6 Bxh6 9. Qxh6 Bb7 10. a3 e5 11. O-O-O Qe7 12. Kb1 a6 13. Nc1 O-O-O 14. Nb3 exd4 15. Rxd4 c5 16. Rd1 Nb6 17. g3 Kb8 18. Na5 Ba8 19. Bh3 d5 20. Qf4+ Ka7 21. Rhe1 d4 22. Nd5 Nbxd5 23. exd5 Qd6 24. Rxd4 cxd4 25. Re7+ Kb6 26. Qxd4+ Kxa5 27. b4+ Ka4 28. Qc3 Qxd5 29. Ra7 Bb7 30. Rxb7 Qc4 31. Qxf6 Kxa3 32. Qxa6+ Kxb4 33. c3+ Kxc3 34. Qa1+ Kd2 35. Qb2+ Kd1 36. Bf1 Rd2 37. Rd7 Rxd7 38. Bxc4 bxc4 39. Qxh8 Rd3 40. Qa8 c3 41. Qa4+ Ke1 42. f4 f5 43. Kc1 Rd2 44. Qa7,"This is a game between Kasparov, Garry (as White) and Topalov, Veselin (as Black). Last move played: White plays Queen to a7",Large advantage for White (eval: 499 centipawns),44... h5 45. Qb6 h4 46. Qg1+ Ke2 47. gxh4 Kd3 48. Qg3+ Kc4 49. Qxg6 Rxh2 50. Qg3 Re2 51. h5 Kb4 52. Qg1 Kb5 53. Qg6 Rh2 54. Qxf5+ Kc6 55. Qc8+ Kd6 56. Qxc3 Rxh5 57. Qf3 Rc5+ 58. Kd1 ,44. Qa7 h6 45. Qb6 Kf1 46. Qxg6 Rxh2 47. Qxf5 h5 48. Qd3+ Kg2 49. f5 Rh1+ 50. Kc2 Rf1 51. Qxf1+ Kxf1 52. f6 Kg2 53. f7 Kxg3 54. f8=Q h4 55. Qg7+ Kf2 
Kasparov veut jouer 0-0-0 sans permettre ...b4,True," Yes, the comment provides a potential explanation for the mistake, indicating a tactical observation.",1. e4 d6 2. d4 Nf6 3. Nc3 g6 4. Be3 Bg7 5. Qd2 c6 6. f3 b5 7. Nge2 Nbd7 8. Bh6 Bxh6 9. Qxh6 Bb7 10. a3,"This is a game between Kasparov, Garry (as White) and Topalov, Veselin (as Black). Last move played: White plays Pawn to a3",Slight advantage for White (eval: 22 centipawns),10... a5 ,10. h4 
