comment,good,reasoning,moves,context,engine_eval,engine_best_line,engine_best_alternative
White wishes to exchange Black's strong knight on e4 and is willing to give up his Bb3 to ...Nc5 and ...Nxb6.,True," The comment clearly indicates a flawed pawn structure and a strategic sacrifice, suggesting a mistake.",1. e4 e5 2. Nf3 Nc6 3. Bb5 a6 4. Ba4 Nf6 5. O-O Nxe4 6. d4 b5 7. Bb3 d5 8. dxe5 Be6 9. Nbd2,This is a game between Karpov (as White) and Korchnoi (as Black). Last move played: White plays Knight to d2,Slight advantage for White (eval: 32 centipawns),9... Nc5 10. c3 Be7 11. Bc2 d4 12. Nb3 d3 13. Nxc5 dxc2 14. Qxd8+ Rxd8 15. Nxe6 fxe6 16. Be3 Rd5 17. Rac1 Nxe5 18. Nxe5 Rxe5 19. Rxc2 Re4 20. g3 Rc4 21. Kg2 Kd7 22. Rd1+ Bd6 ,9. c3 Be7 
"White's knight is strong on this square and gives him some initiative. This should not be too troubling for Black, but Korchnoi was confused and thought for over an hour about his response.",True," The comment suggests the player’s knight placement was a mistake, prompting Black to overthink, indicating a flawed strategic choice.",1. e4 e5 2. Nf3 Nc6 3. Bb5 a6 4. Ba4 Nf6 5. O-O Nxe4 6. d4 b5 7. Bb3 d5 8. dxe5 Be6 9. Nbd2 Nc5 10. c3 d4 11. Bxe6 Nxe6 12. cxd4 Ncxd4 13. Ne4,This is a game between Karpov (as White) and Korchnoi (as Black). Last move played: White plays Knight to e4,Slight advantage for White (eval: 27 centipawns),13... Qd5 ,13. a4 Bb4 
"Black trades off his best piece and activates White's queen for him, but the alternative wasn't inviting. 14...c5 15.b4 This move gives White a powerful initiative. 15...Nxf3+ 16.Qxf3 And the attack on c5 is still a problem for Black.",True," The comment accurately describes a problematic position, suggesting a missed opportunity for Black.",1. e4 e5 2. Nf3 Nc6 3. Bb5 a6 4. Ba4 Nf6 5. O-O Nxe4 6. d4 b5 7. Bb3 d5 8. dxe5 Be6 9. Nbd2 Nc5 10. c3 d4 11. Bxe6 Nxe6 12. cxd4 Ncxd4 13. Ne4 Be7 14. Be3 Nxf3+,This is a game between Karpov (as White) and Korchnoi (as Black). Last move played: Black plays Knight takes on f3 with check,Large advantage for White (eval: 128 centipawns),15. Qxf3 ,14... Nf5 
This is a blunder. Black locks in his own kingside and puts his queen on a bad square. 16...Qc8 17.Rac1 Will keep some initiative for White.,True, The comment accurately describes a significant positional blunder that leads to a compromised king and a weak queen.,1. e4 e5 2. Nf3 Nc6 3. Bb5 a6 4. Ba4 Nf6 5. O-O Nxe4 6. d4 b5 7. Bb3 d5 8. dxe5 Be6 9. Nbd2 Nc5 10. c3 d4 11. Bxe6 Nxe6 12. cxd4 Ncxd4 13. Ne4 Be7 14. Be3 Nxf3+ 15. Qxf3 O-O 16. Rfd1 Qe8,This is a game between Karpov (as White) and Korchnoi (as Black). Last move played: Black plays Queen to e8,Large advantage for White (eval: 140 centipawns),17. Nf6+ ,16... Qb8 
White takes immediate advantage of Black's misplaced pieces on the kingside.,True," The comment suggests a tactical blunder, indicating a misjudgment of the board position.",1. e4 e5 2. Nf3 Nc6 3. Bb5 a6 4. Ba4 Nf6 5. O-O Nxe4 6. d4 b5 7. Bb3 d5 8. dxe5 Be6 9. Nbd2 Nc5 10. c3 d4 11. Bxe6 Nxe6 12. cxd4 Ncxd4 13. Ne4 Be7 14. Be3 Nxf3+ 15. Qxf3 O-O 16. Rfd1 Qe8 17. Nf6+,This is a game between Karpov (as White) and Korchnoi (as Black). Last move played: White plays Knight to f6 with check,Large advantage for White (eval: 136 centipawns),17... gxf6 18. exf6 Rd8 19. fxe7 Qxe7 20. h3 Qh4 21. Qc6 Qh5 22. Rxd8 Rxd8 23. Qxa6 Qe5 24. Qa3 Nd4 25. Qb4 c5 26. Qa5 Rd6 27. Re1 Qd5 28. Bf4 Rg6 29. Re8+ Kg7 30. Be5+ Kh6 ,17. Nf6+ 
After 19...Kxg7 White has a sacrificial win by 20.Bh6+,True," The comment offers a potential tactical analysis of a seemingly forced win, indicating a flawed assessment of the position.",1. e4 e5 2. Nf3 Nc6 3. Bb5 a6 4. Ba4 Nf6 5. O-O Nxe4 6. d4 b5 7. Bb3 d5 8. dxe5 Be6 9. Nbd2 Nc5 10. c3 d4 11. Bxe6 Nxe6 12. cxd4 Ncxd4 13. Ne4 Be7 14. Be3 Nxf3+ 15. Qxf3 O-O 16. Rfd1 Qe8 17. Nf6+ Bxf6 18. exf6 Qc8 19. fxg7 Rd8,This is a game between Karpov (as White) and Korchnoi (as Black). Last move played: Black plays Rook to d8,Large advantage for White (eval: 211 centipawns),20. h4 c5 21. Rxd8+ Qxd8 22. h5 Nd4 23. Qe4 Ra7 24. h6 Re7 25. Qg4 Re6 26. Rd1 Qe8 27. Qh5 Re5 28. Qh3 Rd5 29. Rd2 a5 30. Qg4 a4 31. Bxd4 Rxd4 32. Rxd4 Qe1+ 33. Kh2 ,19... Rd8 20. h4 c5 21. Rxd8+ Qxd8 22. h5 Nd4 23. Qg4 Qd5 24. h6 Rd8 25. Rc1 Ne6 26. b3 a5 27. Qf3 Qe5 28. Qb7 Qb2 29. Qxb5 Qxa2 30. g3 Qb2 31. Qxa5 Qxb3 32. Bxc5 Rd1+ 33. Kh2 Qd5 34. Rxd1 Qh5+ 35. Kg2 Qxd1 36. Be3 
White prepares to defend his g7 pawn by h4-h5-h6.,True," The comment suggests a potential tactical weakness, indicating the move was poorly considered.",1. e4 e5 2. Nf3 Nc6 3. Bb5 a6 4. Ba4 Nf6 5. O-O Nxe4 6. d4 b5 7. Bb3 d5 8. dxe5 Be6 9. Nbd2 Nc5 10. c3 d4 11. Bxe6 Nxe6 12. cxd4 Ncxd4 13. Ne4 Be7 14. Be3 Nxf3+ 15. Qxf3 O-O 16. Rfd1 Qe8 17. Nf6+ Bxf6 18. exf6 Qc8 19. fxg7 Rd8 20. h4,This is a game between Karpov (as White) and Korchnoi (as Black). Last move played: White plays Pawn to h4,Large advantage for White (eval: 211 centipawns),20... c5 21. Rxd8+ ,20. h4 c5 21. Rxd8+ Qxd8 22. h5 Nd4 23. Qe4 Ra7 24. h6 Re7 25. Qg4 Re6 26. Rd1 Qe8 27. Qh5 Re5 28. Qh3 Rd5 29. Rd2 a5 30. Qg4 a4 31. Bxd4 Rxd4 32. Rxd4 Qe1+ 33. Kh2 
White continues his attack by combining mating threats on f7 and the back rank.,True," The comment suggests a potential weakness in the attack's strategy, indicating a flawed plan.",1. e4 e5 2. Nf3 Nc6 3. Bb5 a6 4. Ba4 Nf6 5. O-O Nxe4 6. d4 b5 7. Bb3 d5 8. dxe5 Be6 9. Nbd2 Nc5 10. c3 d4 11. Bxe6 Nxe6 12. cxd4 Ncxd4 13. Ne4 Be7 14. Be3 Nxf3+ 15. Qxf3 O-O 16. Rfd1 Qe8 17. Nf6+ Bxf6 18. exf6 Qc8 19. fxg7 Rd8 20. h4 c5 21. Rac1 Qc7 22. h5 Qe5 23. h6 Qxb2 24. Rd7,This is a game between Karpov (as White) and Korchnoi (as Black). Last move played: White plays Rook to d7,Large advantage for White (eval: 211 centipawns),24... Rxd7 25. Qxa8+ ,24. Rd7 Rxd7 25. Qxa8+ Rd8 26. Qxa6 b4 27. Qc4 Qf6 28. Qe4 Rb8 29. Rd1 Nd4 30. Re1 Ne6 31. g3 Rd8 32. Qc6 Qe5 33. Rc1 Qh5 34. Kg2 Qg6 35. Qb7 Qh5 36. Qf3 Qg6 37. Rc4 Qd3 38. Qe4 Qxe4+ 39. Rxe4 Rc8 40. Kf3 Ra8 
28...Nd8 29.Rxd1 Qxd1+ 30.Kh2 Qh5+ 31.Kg3 Qg6+ 32.Kh4 Qf6+ 33.Kh3 And after g4 and Kg2 White will escape from further checks.,True," The comment describes a potential escape route, suggesting a flawed plan that was ultimately unsuccessful.",1. e4 e5 2. Nf3 Nc6 3. Bb5 a6 4. Ba4 Nf6 5. O-O Nxe4 6. d4 b5 7. Bb3 d5 8. dxe5 Be6 9. Nbd2 Nc5 10. c3 d4 11. Bxe6 Nxe6 12. cxd4 Ncxd4 13. Ne4 Be7 14. Be3 Nxf3+ 15. Qxf3 O-O 16. Rfd1 Qe8 17. Nf6+ Bxf6 18. exf6 Qc8 19. fxg7 Rd8 20. h4 c5 21. Rac1 Qc7 22. h5 Qe5 23. h6 Qxb2 24. Rd7 Rxd7 25. Qxa8+ Rd8 26. Qxa6 Qe2 27. Rf1 Rd1 28. Qa8+ Rd8,This is a game between Karpov (as White) and Korchnoi (as Black). Last move played: Black plays Rook to d8,Large advantage for White (eval: 138 centipawns),29. Qa6 ,28... Rd8 29. Qa6 Rd1 30. Qc8+ Rd8 31. Qb7 b4 32. Qe7 Qb5 33. Re1 Re8 34. Qd6 Rd8 35. Qe5 Qc6 36. Bg5 Re8 37. Qf6 c4 38. f4 Qd7 39. Bh4 c3 40. f5 Nc7 41. Rxe8+ Nxe8 42. Qe7 Qxe7 43. Bxe7 
White plays actively to remove all obstacles to his kingside pawns.,True," The comment suggests a tactical blunder, indicating a potential weakness in the player’s position.",1. e4 e5 2. Nf3 Nc6 3. Bb5 a6 4. Ba4 Nf6 5. O-O Nxe4 6. d4 b5 7. Bb3 d5 8. dxe5 Be6 9. Nbd2 Nc5 10. c3 d4 11. Bxe6 Nxe6 12. cxd4 Ncxd4 13. Ne4 Be7 14. Be3 Nxf3+ 15. Qxf3 O-O 16. Rfd1 Qe8 17. Nf6+ Bxf6 18. exf6 Qc8 19. fxg7 Rd8 20. h4 c5 21. Rac1 Qc7 22. h5 Qe5 23. h6 Qxb2 24. Rd7 Rxd7 25. Qxa8+ Rd8 26. Qxa6 Qe2 27. Rf1 Rd1 28. Qa8+ Rd8 29. Qc6 b4 30. Qa4 Qd3 31. Rc1 Qd5 32. Qb3 Qe4 33. Qc2 Qxc2 34. Rxc2 f5 35. f4 Kf7 36. g4,This is a game between Karpov (as White) and Korchnoi (as Black). Last move played: White plays Pawn to g4,Large advantage for White (eval: 309 centipawns),36... Rd1+ 37. Kg2 fxg4 38. f5 Nxg7 39. hxg7 Kxg7 40. Rxc5 Kf6 41. Kg3 h5 42. Kf4 Rf1+ 43. Ke4 g3 44. Bd4+ Kg5 45. f6+ Kg4 46. Rc7 h4 47. Rg7+ Kh3 48. f7 Kg2 49. Be3 b3 50. axb3 h3 51. Bf4 ,36. g4 fxg4 37. f5 Nxg7 38. hxg7 Kxg7 39. Rxc5 Rd3 40. Kf2 h5 41. Bg5 b3 42. axb3 Rxb3 43. Rc7+ Kf8 44. f6 Rf3+ 45. Kg2 Kg8 46. Rg7+ Kh8 47. Bh4 Rf5 48. Rg5 Rf3 49. Rb5 
"Black has no chance of eliminating White's two pawns, so he resigns.",True," The comment directly states the lack of a viable plan, suggesting resignation as the appropriate response.",1. e4 e5 2. Nf3 Nc6 3. Bb5 a6 4. Ba4 Nf6 5. O-O Nxe4 6. d4 b5 7. Bb3 d5 8. dxe5 Be6 9. Nbd2 Nc5 10. c3 d4 11. Bxe6 Nxe6 12. cxd4 Ncxd4 13. Ne4 Be7 14. Be3 Nxf3+ 15. Qxf3 O-O 16. Rfd1 Qe8 17. Nf6+ Bxf6 18. exf6 Qc8 19. fxg7 Rd8 20. h4 c5 21. Rac1 Qc7 22. h5 Qe5 23. h6 Qxb2 24. Rd7 Rxd7 25. Qxa8+ Rd8 26. Qxa6 Qe2 27. Rf1 Rd1 28. Qa8+ Rd8 29. Qc6 b4 30. Qa4 Qd3 31. Rc1 Qd5 32. Qb3 Qe4 33. Qc2 Qxc2 34. Rxc2 f5 35. f4 Kf7 36. g4 Rd5 37. gxf5 Rxf5 38. Rd2 Rf6 39. Rd7+ Kg8 40. f5 Rxf5 41. Re7 Nxg7 42. Rxg7+ Kh8 43. Rc7 Kg8 44. Bxc5 Rg5+ 45. Kf2 Rg6 46. Be3,This is a game between Karpov (as White) and Korchnoi (as Black). Last move played: White plays Bishop to e3,Large advantage for White (eval: 541 centipawns),46... Rf6+ 47. Ke2 Rg6 48. Ra7 Rg3 49. Kf2 Rg6 50. Kf3 Rf6+ 51. Ke4 Re6+ 52. Kd4 Rc6 53. Kd5 Rg6 54. Kc4 Rg3 55. Bd4 Rg6 56. Kxb4 Rxh6 57. a4 Rg6 58. a5 h5 59. a6 Rxa6 60. Rxa6 Kf7 61. Rb6 h4 62. Kc4 h3 63. Be5 h2 64. Bxh2 ,46. Rc8+ Kf7 47. Rc7+ Kg8 48. Be3 Ra6 49. Rg7+ Kf8 50. Bc5+ Ke8 51. Rxh7 Rxa2+ 52. Kg3 Ra3+ 53. Kg4 Ra6 54. Re7+ Kd8 55. h7 Rh6 56. Ra7 Rh1 57. Kf3 b3 58. Bd4 b2 59. Bxb2 Ke8 60. h8=Q+ Rxh8 
