comment,good,reasoning,moves,context,engine_eval,engine_best_line,engine_best_alternative
"This seems reasonable, but even at the time it was known that 6...d5 was the correct move.",True," The comment highlights a crucial positional error, indicating a flawed strategic assessment.",1. e4 e5 2. Bc4 Bc5 3. c3 Nc6 4. Nf3 Nf6 5. d4 exd4 6. e5 Qe7,This is a game between Morphy (as White) and Cunningham (as Black). Last move played: Black plays Queen to e7,Large advantage for White (eval: 206 centipawns),7. cxd4 Bb4+ 8. Kf1 Ne4 9. h4 f5 10. a3 Ba5 11. Bg5 Qf8 12. Bf4 b5 13. Bxb5 Rb8 14. Qd3 Nd8 15. b4 Rxb5 16. Qxb5 Bb6 17. Nbd2 Ne6 ,6... d5 
"White's control of the center is absolute. From such a position it is easy to win, because Black has no room to maneuver, and will be unable to complete development.",True," The comment suggests a strategic flaw in Black's development, implying a lack of flexibility.",1. e4 e5 2. Bc4 Bc5 3. c3 Nc6 4. Nf3 Nf6 5. d4 exd4 6. e5 Qe7 7. O-O Ng8 8. cxd4 Bb6 9. d5,This is a game between Morphy (as White) and Cunningham (as Black). Last move played: White plays Pawn to d5,Large advantage for White (eval: 490 centipawns),9... Na5 10. d6 Qf8 11. Na3 Nxc4 12. Nxc4 c6 13. Nxb6 axb6 14. Qb3 Nh6 15. Qxb6 Nf5 ,9. d5 Nh6 10. dxc6 Ng4 11. Nc3 Nxf2 12. Rxf2 bxc6 13. Qe2 d5 14. exd6 Qxe2 15. Bxe2 O-O 16. Kf1 Re8 17. Na4 Bxf2 18. Kxf2 cxd6 19. Nc3 Rb8 20. b3 f6 21. Bc4+ Kf8 
9...Nxe5 10.Nxe5 Qxe5 11.Re1,True," The comment describes a sequence of moves that leads to a compromised pawn structure, indicating a mistake.",1. e4 e5 2. Bc4 Bc5 3. c3 Nc6 4. Nf3 Nf6 5. d4 exd4 6. e5 Qe7 7. O-O Ng8 8. cxd4 Bb6 9. d5 Qc5,This is a game between Morphy (as White) and Cunningham (as Black). Last move played: Black plays Queen to c5,Large advantage for White (eval: 504 centipawns),10. b3 Nd4 11. Ba3 Nxf3+ 12. Qxf3 Qd4 13. Nc3 Nh6 14. h3 Ba5 15. Nb5 Qh4 16. Rae1 a6 17. Re4 Qg5 18. Nd4 Qg6 19. Re2 Qg5 20. e6 fxe6 21. dxe6 d6 22. Bc1 ,9... Na5 10. d6 Qf8 11. Na3 Nxc4 12. Nxc4 c6 13. Nxb6 axb6 14. Qb3 Nh6 15. Qxb6 Nf5 
The pin is not the real problem for Black. It is that he must now part with one of his only developed pieces.,True," The comment suggests the pin is a secondary issue, implying the player failed to adequately address the primary threat.",1. e4 e5 2. Bc4 Bc5 3. c3 Nc6 4. Nf3 Nf6 5. d4 exd4 6. e5 Qe7 7. O-O Ng8 8. cxd4 Bb6 9. d5 Qc5 10. Na3 Nd4 11. Be3,This is a game between Morphy (as White) and Cunningham (as Black). Last move played: White plays Bishop to e3,Large advantage for White (eval: 590 centipawns),11... Nxf3+ 12. Qxf3 Qf8 13. Bxb6 axb6 14. Nb5 Ra5 15. d6 Rxb5 16. Bxb5 Nh6 17. Rae1 c6 18. Bd3 g6 19. Qf6 b5 20. h3 Nf5 21. Bxf5 gxf5 22. Re3 Rg8 23. Qxf5 b6 24. Rg3 Bb7 25. a3 Rg6 26. Qf4 ,11. Be3 Nxf3+ 12. Qxf3 Qf8 13. Bxb6 axb6 14. Nb5 Kd8 15. d6 c6 16. a4 f6 17. Qe3 Ra6 18. Na3 fxe5 19. Bxa6 Qxd6 20. Rfd1 Qc5 21. Bf1 d5 22. Nc4 
This is no place for a lady!,True,". The comment suggests a defensive, potentially passive, approach, implying a lack of initiative and strategic ambition, which is a common mistake in chess.",1. e4 e5 2. Bc4 Bc5 3. c3 Nc6 4. Nf3 Nf6 5. d4 exd4 6. e5 Qe7 7. O-O Ng8 8. cxd4 Bb6 9. d5 Qc5 10. Na3 Nd4 11. Be3 Nxf3+ 12. Qxf3 Qf8,This is a game between Morphy (as White) and Cunningham (as Black). Last move played: Black plays Queen to f8,Large advantage for White (eval: 616 centipawns),13. Bxb6 axb6 14. Nb5 Ra4 15. Rac1 Kd8 16. d6 c5 17. b3 Rxa2 18. Rfd1 Ra6 19. b4 Nh6 20. Nc7 Ra4 21. Nd5 f6 22. Qb3 ,12... Qe7 13. d6 cxd6 14. Bg5 f6 15. exf6 Nxf6 16. Rae1 Qe6 17. Bxe6 dxe6 18. Nc4 O-O 19. Nxb6 axb6 20. h4 Rxa2 21. Qb3 Ra6 22. Ra1 Ra5 23. Rxa5 bxa5 24. Qb6 Kf7 25. Qxa5 
Now Black has no developed pieces. White has almost all of the forces in the game. The end cannot be far off.,True," The comment suggests Black's lack of development and White's dominance, indicating a potential tactical blunder.",1. e4 e5 2. Bc4 Bc5 3. c3 Nc6 4. Nf3 Nf6 5. d4 exd4 6. e5 Qe7 7. O-O Ng8 8. cxd4 Bb6 9. d5 Qc5 10. Na3 Nd4 11. Be3 Nxf3+ 12. Qxf3 Qf8 13. Bxb6 axb6,This is a game between Morphy (as White) and Cunningham (as Black). Last move played: Black plays Pawn takes on b6,Large advantage for White (eval: 595 centipawns),14. Nb5 Ra5 15. d6 Rxb5 16. Bxb5 g5 17. dxc7 Qb4 18. a4 Ne7 19. Rfd1 Qxb2 20. Qf6 Rg8 21. Qxb6 Qxe5 22. Re1 Rg6 23. Rxe5 Rxb6 24. Rxg5 Nc6 ,13... axb6 14. Nb5 Ra4 15. Rac1 c5 16. d6 f6 17. b3 Rxa2 18. Nc7+ Kd8 19. b4 Rb2 20. bxc5 bxc5 21. Qa3 Rb4 
White occupies the open file and takes aim at c7.,True," The comment suggests a potential weakness in the opening position, indicating a strategic misstep.",1. e4 e5 2. Bc4 Bc5 3. c3 Nc6 4. Nf3 Nf6 5. d4 exd4 6. e5 Qe7 7. O-O Ng8 8. cxd4 Bb6 9. d5 Qc5 10. Na3 Nd4 11. Be3 Nxf3+ 12. Qxf3 Qf8 13. Bxb6 axb6 14. Nb5 Kd8 15. Rac1,This is a game between Morphy (as White) and Cunningham (as Black). Last move played: White plays Rook to c1,Large advantage for White (eval: 528 centipawns),15... c6 16. dxc6 bxc6 17. Rfd1 Ne7 18. Nd6 Kc7 19. Nxf7 Ra7 20. Nxh8 Qxf3 21. gxf3 c5 22. Nf7 Ng6 23. Nd6 Ba6 24. Bxa6 Rxa6 25. Nb5+ Kc6 26. Nd4+ Kd5 27. Nf5+ Kxe5 28. Ne3 Nf4 29. Kh1 Rxa2 ,15. d6 c5 16. Qb3 Ra5 17. Nc7 b5 18. Bxb5 Ne7 19. Rad1 h5 20. Bc4 b5 21. Bxb5 h4 22. h3 Rh6 23. Qc3 Rxb5 24. Nxb5 Nc6 25. f4 Re6 26. Qxc5 Qh8 
"Morphy now puts on a display of his impressive talents. The Black king has almost no maneuvering room. First, he employs a discovered attack on the rook at a6.",True, The comment describes a strategic maneuver that suggests a flaw in the opponent's defensive positioning.,1. e4 e5 2. Bc4 Bc5 3. c3 Nc6 4. Nf3 Nf6 5. d4 exd4 6. e5 Qe7 7. O-O Ng8 8. cxd4 Bb6 9. d5 Qc5 10. Na3 Nd4 11. Be3 Nxf3+ 12. Qxf3 Qf8 13. Bxb6 axb6 14. Nb5 Kd8 15. Rac1 d6 16. exd6 cxd6 17. Qe3 Ra6,This is a game between Morphy (as White) and Cunningham (as Black). Last move played: Black plays Rook to a6,Large advantage for White (eval: 730 centipawns),18. Rfe1 Nf6 19. Na7 Nd7 20. Bxa6 Nc5 21. Bb5 f5 22. b4 f4 23. Qc3 Kc7 24. bxc5 bxc5 25. Nxc8 Kxc8 26. Be2 g5 27. Kh1 Qh6 28. Bf3 g4 29. Bxg4+ Kb8 ,17... f5 18. Qxb6+ Ke8 19. Nxd6+ Qxd6 20. Qxd6 Kf7 21. Qc7+ Kg6 22. Qg3+ Kf7 23. d6+ Kf8 24. d7 Bxd7 25. Kh1 Nf6 26. Qd6+ Ke8 27. Rce1+ Ne4 
White will exchange this knight for the rook at a6.,True," The comment indicates a potential tactical blunder by White, suggesting a poor exchange choice.",1. e4 e5 2. Bc4 Bc5 3. c3 Nc6 4. Nf3 Nf6 5. d4 exd4 6. e5 Qe7 7. O-O Ng8 8. cxd4 Bb6 9. d5 Qc5 10. Na3 Nd4 11. Be3 Nxf3+ 12. Qxf3 Qf8 13. Bxb6 axb6 14. Nb5 Kd8 15. Rac1 d6 16. exd6 cxd6 17. Qe3 Ra6 18. Nc7 Qe7 19. Ne6+,This is a game between Morphy (as White) and Cunningham (as Black). Last move played: White plays Knight to e6 with check,Large advantage for White (eval: 737 centipawns),19... fxe6 20. Bxa6 Bd7 21. Qxb6+ Ke8 22. dxe6 Bc6 23. Bb5 Kf8 24. Bxc6 bxc6 25. Rfe1 Nf6 26. Rxc6 Ne8 27. Rc8 h5 28. Qb5 g5 29. a4 h4 30. a5 g4 31. Qd7 Rh5 32. a6 Ra5 33. a7 Rxa7 34. Rxe8+ Qxe8 35. Qxa7 h3 36. e7+ Kf7 ,19. Ne6+ fxe6 20. Bxa6 Bd7 21. Qxb6+ Ke8 22. dxe6 Bc6 23. Bb5 Kf8 24. Bxc6 bxc6 25. Rfe1 Nf6 26. Rxc6 Ne8 27. Rc8 h5 28. Qb5 Rh6 29. h4 Rf6 30. Qxh5 Rh6 31. Qf5+ Rf6 32. Qb5 Rh6 33. h5 Rxe6 34. Qf5+ Rf6 
The pawn cannot be captured because of the pin on the bishop at d7.,True," The comment directly identifies a flaw in the move, suggesting a strategic error.",1. e4 e5 2. Bc4 Bc5 3. c3 Nc6 4. Nf3 Nf6 5. d4 exd4 6. e5 Qe7 7. O-O Ng8 8. cxd4 Bb6 9. d5 Qc5 10. Na3 Nd4 11. Be3 Nxf3+ 12. Qxf3 Qf8 13. Bxb6 axb6 14. Nb5 Kd8 15. Rac1 d6 16. exd6 cxd6 17. Qe3 Ra6 18. Nc7 Qe7 19. Ne6+ fxe6 20. Bxa6 Bd7 21. Bb5 Ke8 22. dxe6 Nf6,This is a game between Morphy (as White) and Cunningham (as Black). Last move played: Black plays Knight to f6,Mate in 19 for White,23. Bxd7+ Qxd7 24. exd7+ Kf7 25. Rfe1 Kg6 26. Qg3+ Kf7 27. Qxd6 Kg6 28. Re7 h5 29. Qg3+ Ng4 30. f3 Rd8 31. fxg4 Rxd7 32. Rxd7 hxg4 33. Qxg4+ Kh6 34. Qxg7+ Kh5 35. Re1 b5 36. Qf7+ Kh4 37. Re4+ Kg5 38. Re5+ Kh6 39. Re6+ Kg5 40. Qg6+ Kh4 41. Re4# ,22... Bxb5 23. Rc8+ Qd8 24. Rxd8+ Kxd8 25. Qxb6+ Kc8 26. Qxb5 Nf6 27. Rc1+ Kb8 28. Qb6 Re8 29. Qxd6+ Ka7 30. f3 Ka8 31. Qc7 Ng8 32. Qc8+ Rxc8 33. Rxc8+ Ka7 34. Rxg8 Kb6 35. Rxg7 Kc6 36. e7 Kd7 37. Rf7 b5 
One final exploitation of the pin at d7!,True,", The comment suggests a tactical opportunity to exploit a pin, indicating a flaw in the opponent's position.",1. e4 e5 2. Bc4 Bc5 3. c3 Nc6 4. Nf3 Nf6 5. d4 exd4 6. e5 Qe7 7. O-O Ng8 8. cxd4 Bb6 9. d5 Qc5 10. Na3 Nd4 11. Be3 Nxf3+ 12. Qxf3 Qf8 13. Bxb6 axb6 14. Nb5 Kd8 15. Rac1 d6 16. exd6 cxd6 17. Qe3 Ra6 18. Nc7 Qe7 19. Ne6+ fxe6 20. Bxa6 Bd7 21. Bb5 Ke8 22. dxe6 Nf6 23. Rc8+,This is a game between Morphy (as White) and Cunningham (as Black). Last move played: White plays Rook to c8 with check,Mate in 13 for White,23... Qd8 24. exd7+ Kf7 25. Rxd8 Rxd8 26. Re1 Rxd7 27. Qe6+ Kg6 28. Bd3+ Kh6 29. Qh3+ Nh5 30. Qe3+ g5 31. Qe6+ Nf6 32. Qxf6+ Kh5 33. Qf5 Kh6 34. Re6+ Kg7 35. Qf6+ Kg8 36. Re8# ,23. Bxd7+ Qxd7 24. exd7+ Kf7 25. Rfe1 Kg6 26. Qg3+ Kf7 27. Qxd6 Kg6 28. Re7 h5 29. Qg3+ Ng4 30. f3 Rd8 31. fxg4 Rxd7 32. Rxd7 hxg4 33. Qxg4+ Kh6 34. Qxg7+ Kh5 35. Re1 b5 36. Qf7+ Kh4 37. Re4+ Kg5 38. Re5+ Kh6 39. Re6+ Kg5 40. Qg6+ Kh4 41. Re4# 
9...Nxe5 10.Nxe5 Qxe5 11.Re1,True," The comment describes a series of tactical steps that lead to a compromised pawn structure, indicating a mistake.",1. e4 e5 2. Bc4 Bc5 3. c3 Nc6 4. Nf3 Nf6 5. d4 exd4 6. e5 Qe7 7. O-O Ng8 8. cxd4 Bb6 9. d5 Qc5,This is a game between Morphy (as White) and Cunningham (as Black). Last move played: Black plays Queen to c5,Large advantage for White (eval: 504 centipawns),10. b3 Nd4 11. Ba3 Nxf3+ 12. Qxf3 Qd4 13. Nc3 Nh6 14. h3 Ba5 15. Nb5 Qh4 16. Rae1 a6 17. Re4 Qg5 18. Nd4 Qg6 19. Re2 Qg5 20. e6 fxe6 21. dxe6 d6 22. Bc1 ,9... Na5 10. d6 Qf8 11. Na3 Nxc4 12. Nxc4 c6 13. Nxb6 axb6 14. Qb3 Nh6 15. Qxb6 Nf5 
