comment,good,reasoning,moves,context,engine_eval,engine_best_line,engine_best_alternative
"The Evans Gambit was very popular during the 19th Century. It provides an excellent example of the importance of controlling the center. Eventually, however, Black found effective defensive plans and it is no longer popular.",True," The comment offers a potential explanation for the move's decline, suggesting Black adapted to the situation.",1. e4 e5 2. Nf3 Nc6 3. Bc4 Bc5 4. b4,This is a game between Morphy (as White) and Hampton (as Black). Last move played: White plays Pawn to b4,The position is equal,4... Bxb4 5. c3 ,4. O-O Nf6 5. d3 d6 6. c3 O-O 7. h3 a5 8. Re1 Ba7 9. Bb3 Be6 10. Ba4 Bd7 11. Na3 Ne7 12. d4 Bxa4 13. Qxa4 h6 14. Nb5 
"Black tries to develop quickly, but the central pawns now advance with devastating effect.",True, The comment suggests a potential weakness in the development strategy due to the pawn advance.,1. e4 e5 2. Nf3 Nc6 3. Bc4 Bc5 4. b4 Bxb4 5. c3 Bc5 6. O-O d6 7. d4 exd4 8. cxd4 Bb6 9. Nc3 Nf6,This is a game between Morphy (as White) and Hampton (as Black). Last move played: Black plays Knight to f6,Large advantage for White (eval: 158 centipawns),10. e5 dxe5 11. Ba3 Nxd4 12. Nxd4 Bxd4 13. Nb5 c5 14. Nxd4 Qxd4 15. Qb3 b6 16. Bb2 Qf4 17. g3 Qg4 18. Bxf7+ Ke7 19. Rfe1 Rd8 20. Bxe5 Kf8 21. Bxf6 gxf6 22. Qe3 Kg7 ,9... Na5 10. Bd3 Ne7 11. h3 O-O 12. Rb1 Nac6 13. Bc2 Bd7 14. Re1 f6 15. Ne2 Kh8 16. Nf4 Qe8 17. a4 a5 18. Ba3 Nb4 19. Bxb4 axb4 
A very strong move which prevents Black from castling.,True," The comment directly identifies a flaw in the opponent’s strategy, suggesting a defensive move that hinders their plans.",1. e4 e5 2. Nf3 Nc6 3. Bc4 Bc5 4. b4 Bxb4 5. c3 Bc5 6. O-O d6 7. d4 exd4 8. cxd4 Bb6 9. Nc3 Nf6 10. e5 dxe5 11. Ba3,This is a game between Morphy (as White) and Hampton (as Black). Last move played: White plays Bishop to a3,Large advantage for White (eval: 186 centipawns),11... Nxd4 12. Nxd4 Bxd4 13. Nb5 c5 14. Nxd4 Qxd4 15. Qb3 b6 16. Bb2 Qf4 17. g3 Qh6 18. Bxf7+ Ke7 19. h4 Ng4 20. Qf3 Rf8 21. Qxa8 Kxf7 22. Qxa7+ Kg8 23. Rad1 Kh8 ,11. Ba3 Nxd4 12. Nxd4 Bxd4 13. Nb5 Be6 14. Qa4 Qd7 15. Nxc7+ Kd8 16. Nxe6+ fxe6 17. Bb5 Qc7 18. Rac1 Qb6 19. Qc4 Nd5 20. Rfd1 h5 21. Ba4 Rh6 22. Qc2 a6 23. h4 Qc7 24. Qe4 Qf7 25. Rxd4 exd4 26. Qe5 
White strikes at the vulnerable f7-square.,True," The comment suggests a potential tactical vulnerability, indicating a mistake.",1. e4 e5 2. Nf3 Nc6 3. Bc4 Bc5 4. b4 Bxb4 5. c3 Bc5 6. O-O d6 7. d4 exd4 8. cxd4 Bb6 9. Nc3 Nf6 10. e5 dxe5 11. Ba3 Bg4 12. Qb3,This is a game between Morphy (as White) and Hampton (as Black). Last move played: White plays Queen to b3,Large advantage for White (eval: 334 centipawns),12... Kd7 13. dxe5 Bxf3 14. gxf3 Nd4 15. Rad1 Kc8 16. Rxd4 Qxd4 17. exf6 Qxf6 18. Ne4 Qf5 19. Bxf7 Kb8 20. Be6 Qg6+ 21. Kh1 a5 22. Rg1 a4 23. Qc4 Qh5 24. Bg4 Qh6 25. Bc1 Qc6 26. Qxc6 bxc6 ,12. Qb3 Kd7 13. dxe5 Bxf3 14. gxf3 Nd4 15. Rad1 Kc8 16. Rxd4 Qxd4 17. exf6 Qxf6 18. Ne4 Qg6+ 19. Kh1 Kb8 20. Bxf7 Qh6 21. Be7 a5 22. Rg1 Ka7 23. h4 Rad8 24. Bg5 Qc6 25. Bxd8 Rxd8 26. Kg2 
"Now White has almost all of his pieces in the attack. The position can hardly be improved because the rook at f1, the remaining spectator, is needed there to guard the pawn at f2. So it is time to strike!",True, The comment suggests a strategic blunder by prioritizing a rook for defense rather than developing the position.,1. e4 e5 2. Nf3 Nc6 3. Bc4 Bc5 4. b4 Bxb4 5. c3 Bc5 6. O-O d6 7. d4 exd4 8. cxd4 Bb6 9. Nc3 Nf6 10. e5 dxe5 11. Ba3 Bg4 12. Qb3 Bh5 13. dxe5 Ng4 14. Rad1 Qc8,This is a game between Morphy (as White) and Hampton (as Black). Last move played: Black plays Queen to c8,Large advantage for White (eval: 628 centipawns),15. e6 f5 16. Nd5 a6 17. Qc3 Rg8 18. h3 Ba5 19. Qc2 Nh6 20. Qd3 b5 21. Bb3 Bxf3 22. Qxf3 Ne5 23. Qh5+ Ng6 24. Nf4 c5 25. Nxg6 hxg6 26. Qxg6+ Kf8 ,14... Qxd1 15. Qxd1 Ngxe5 16. Bb5 f6 17. Re1 Bxf3 18. gxf3 Rd8 19. Nd5 Kf7 20. f4 Rhe8 21. fxe5 Rxe5 22. Bc4 Rxe1+ 23. Qxe1 Ne5 24. Nxb6+ Nxc4 
Attacking the hanging bishop at h5.,True,", The comment suggests a flaw in the bishop's position, indicating a potential tactical error.",1. e4 e5 2. Nf3 Nc6 3. Bc4 Bc5 4. b4 Bxb4 5. c3 Bc5 6. O-O d6 7. d4 exd4 8. cxd4 Bb6 9. Nc3 Nf6 10. e5 dxe5 11. Ba3 Bg4 12. Qb3 Bh5 13. dxe5 Ng4 14. Rad1 Qc8 15. e6 f6 16. Qb5,This is a game between Morphy (as White) and Hampton (as Black). Last move played: White plays Queen to b5,Large advantage for White (eval: 675 centipawns),16... Nxf2 17. Rxf2 Bg4 18. Bd5 Bxe6 19. Re1 Qd7 20. Bxe6 O-O-O 21. Bxd7+ Rxd7 22. Na4 Rhd8 23. Nxb6+ axb6 24. Bb2 Kb8 25. Qb3 Rd3 26. Qa4 b5 27. Qe4 R3d6 28. g4 Na5 ,16. Qa4 Qd8 17. Bb5 Bxf2+ 18. Kh1 Qd6 19. Bxd6 O-O-O 20. Bxc6 Rxd6 21. Rxd6 cxd6 22. Bd7+ Kb8 23. e7 f5 24. h3 Ne3 25. Rxf2 g5 26. Kh2 
"Here Black igned. If you are not sure why, play out the game as Black against Gambit. Even on a relatively low level, it should win every time!",True," The comment suggests a reckless and potentially disastrous move, indicating a flawed assessment of the position.",1. e4 e5 2. Nf3 Nc6 3. Bc4 Bc5 4. b4 Bxb4 5. c3 Bc5 6. O-O d6 7. d4 exd4 8. cxd4 Bb6 9. Nc3 Nf6 10. e5 dxe5 11. Ba3 Bg4 12. Qb3 Bh5 13. dxe5 Ng4 14. Rad1 Qc8 15. e6 f6 16. Qb5 Bg6 17. Bd5,This is a game between Morphy (as White) and Hampton (as Black). Last move played: White plays Bishop to d5,Large advantage for White (eval: 1007 centipawns),17... Qd7 18. exd7+ Kd8 19. Bxc6 bxc6 20. Qb4 c5 21. Qxg4 c6 22. Rfe1 Kc7 23. Na4 Bc2 24. Nxc5 Bxc5 25. Qf4+ Kb7 26. Bxc5 Bxd1 27. Rxd1 Ka6 28. Qa4+ Kb7 29. Rb1+ Kc7 30. Qa5+ Kxd7 ,17. Bd5 Qxe6 18. Bxe6 Bd3 19. Qxd3 Nce5 20. Bd7+ Kf7 21. Qd5+ Kg6 22. Bxg4 Nxg4 23. Qe4+ Kh5 24. Qf5+ g5 25. Nd5 Kh6 26. Qxg4 Rae8 27. Nxf6 Kg6 28. Nxe8 Rxe8 29. Nxg5 
"The Evans Gambit was very popular during the 19th Century. It provides an excellent example of the importance of controlling the center. Eventually, however, Black found effective defensive plans and it is no longer popular.",True," The comment suggests a strategic weakness in the central pawn structure, indicating a flawed move.",1. e4 e5 2. Nf3 Nc6 3. Bc4 Bc5 4. b4,This is a game between Morphy (as White) and Hampton (as Black). Last move played: White plays Pawn to b4,The position is equal,4... Bxb4 5. c3 ,4. O-O Nf6 5. d3 d6 6. c3 O-O 7. h3 a5 8. Re1 Ba7 9. Bb3 Be6 10. Ba4 Bd7 11. Na3 Ne7 12. d4 Bxa4 13. Qxa4 h6 14. Nb5 
