comment,good,reasoning,moves,context,engine_eval,engine_best_line,engine_best_alternative
C10: French with 3 Nc3: Unusual Black 3rd moves instead of 3...dxe4,True," The comment identifies a specific error in Black's move, suggesting a suboptimal plan.",1. d4,"This is a game between Levitsky (as White) and Marshall, Frank (as Black). Last move played: White plays Pawn to d4",Slight advantage for White (eval: 32 centipawns),1... d5 ,1. e4 e5 
Marshall plays a weak move that will ultimately allow white to shred black's center. Perhaps black was hoping for tactical chances in the resulting complex position.,True," The comment suggests a potential weakness in Marshall’s move, hinting at a strategic disadvantage for black.",1. d4 e6 2. e4 d5 3. Nc3 c5,"This is a game between Levitsky (as White) and Marshall, Frank (as Black). Last move played: Black plays Pawn to c5",Large advantage for White (eval: 151 centipawns),4. exd5 exd5 5. Bb5+ Nc6 6. dxc5 a6 7. Bxc6+ bxc6 8. Be3 Be7 9. Nge2 Nf6 10. O-O O-O 11. h3 a5 12. Na4 Ne4 13. f3 Ng5 14. Nd4 Qc7 15. Qd2 ,3... Nf6 4. e5 Nfd7 5. f4 c5 6. Nf3 Nc6 7. Be3 cxd4 8. Nxd4 Qb6 9. Ncb5 a6 10. Nf5 Bc5 11. Nbd6+ Kf8 12. Qh5 Nd8 13. Nxg7 Bxe3 14. Nxe6+ fxe6 15. Qe8+ Kg7 16. Qe7+ Kg8 17. Bd3 Qb4+ 18. c3 Qxf4 19. Qxd8+ Qf8 
Black cannot afford the loss of his entire center. He wastes no time bolstering the weakling.,True," The comment suggests a strategic disadvantage, implying a poor move that leads to a loss of central control.",1. d4 e6 2. e4 d5 3. Nc3 c5 4. Nf3 Nc6 5. exd5 exd5 6. Be2 Nf6 7. O-O Be7 8. Bg5 O-O 9. dxc5 Be6,"This is a game between Levitsky (as White) and Marshall, Frank (as Black). Last move played: Black plays Bishop to e6",Slight advantage for White (eval: 44 centipawns),10. Na4 Ne4 ,9... Bxc5 10. Bxf6 
"A bad idea by white. Black reconnects a strong central pair of pawns, opens up the f-file for his Rooks. White cannot generate counter play against the central pawns in time.",True," The comment highlights a potential weakness in White's plan, suggesting a vulnerable central pawn structure.",1. d4 e6 2. e4 d5 3. Nc3 c5 4. Nf3 Nc6 5. exd5 exd5 6. Be2 Nf6 7. O-O Be7 8. Bg5 O-O 9. dxc5 Be6 10. Nd4 Bxc5 11. Nxe6,"This is a game between Levitsky (as White) and Marshall, Frank (as Black). Last move played: White plays Knight takes on e6",The position is equal,11... fxe6 12. Qd3 ,11. Nb3 Be7 
White should have played a3 to control the important b4 square.,True, The comment suggests a missed opportunity to improve a key strategic position.,1. d4 e6 2. e4 d5 3. Nc3 c5 4. Nf3 Nc6 5. exd5 exd5 6. Be2 Nf6 7. O-O Be7 8. Bg5 O-O 9. dxc5 Be6 10. Nd4 Bxc5 11. Nxe6 fxe6 12. Bg4 Qd6 13. Bh3 Rae8 14. Qd2,"This is a game between Levitsky (as White) and Marshall, Frank (as Black). Last move played: White plays Queen to d2",The position is equal,14... h6 15. Bxf6 ,14. Kh1 
Black immediately pins the poor Knight.,True,". The comment suggests a critical error in the player's planning, indicating a potential weakness in their piece development or strategic positioning.",1. d4 e6 2. e4 d5 3. Nc3 c5 4. Nf3 Nc6 5. exd5 exd5 6. Be2 Nf6 7. O-O Be7 8. Bg5 O-O 9. dxc5 Be6 10. Nd4 Bxc5 11. Nxe6 fxe6 12. Bg4 Qd6 13. Bh3 Rae8 14. Qd2 Bb4,"This is a game between Levitsky (as White) and Marshall, Frank (as Black). Last move played: Black plays Bishop to b4",The position is equal,15. Bxf6 ,14... h6 15. Bxf6 
White deals with black's threat of Nf6-e4.,True," The comment suggests White is responding to a potential threat, indicating a flawed assessment of the position.",1. d4 e6 2. e4 d5 3. Nc3 c5 4. Nf3 Nc6 5. exd5 exd5 6. Be2 Nf6 7. O-O Be7 8. Bg5 O-O 9. dxc5 Be6 10. Nd4 Bxc5 11. Nxe6 fxe6 12. Bg4 Qd6 13. Bh3 Rae8 14. Qd2 Bb4 15. Bxf6,"This is a game between Levitsky (as White) and Marshall, Frank (as Black). Last move played: White plays Bishop takes on f6",The position is equal,15... Rxf6 16. a3 Ba5 17. Rae1 Qc5 18. b4 Nxb4 19. axb4 Bxb4 20. Na4 Bxd2 21. Nxc5 Bxe1 22. Rxe1 Re7 23. Nxe6 a5 24. g3 a4 25. Ra1 Rexe6 26. Bxe6+ Rxe6 27. Rxa4 Rc6 28. Rb4 Rxc2 29. Rxb7 Rc1+ 30. Kg2 Rc8 31. Ra7 g6 32. Ra5 ,15. Bxf6 
Now white deals with the threat of d5-d4.,True,", The comment suggests a potential weakness in white's pawn structure, implying a tactical vulnerability.",1. d4 e6 2. e4 d5 3. Nc3 c5 4. Nf3 Nc6 5. exd5 exd5 6. Be2 Nf6 7. O-O Be7 8. Bg5 O-O 9. dxc5 Be6 10. Nd4 Bxc5 11. Nxe6 fxe6 12. Bg4 Qd6 13. Bh3 Rae8 14. Qd2 Bb4 15. Bxf6 Rxf6 16. Rad1,"This is a game between Levitsky (as White) and Marshall, Frank (as Black). Last move played: White plays Rook to d1",Slight advantage for Black (eval: -38 centipawns),16... Qc5 17. Qd3 ,16. a3 Ba5 17. Ne4 Bxd2 18. Nxd6 Rb8 19. Rad1 Bf4 20. Nb5 a6 21. Nd4 Nxd4 22. Rxd4 Be5 23. Rd3 Kf7 24. c3 h5 25. g3 g5 26. Re1 Bc7 27. c4 Bb6 28. Re2 g4 29. Bf1 dxc4 30. Rd7+ Kg6 31. Bg2 Rbf8 32. Be4+ Kh6 33. Rh7+ Kg5 34. Rg7+ Kh6 
Black activates his Knight while gaining time on White's Queen. How should white respond? The Queen must keep pressure on the e8-Rook. If 20. Qe5 then 20... Nf3+! 21. gxf3 Rg6+ is crushing.,True," The comment provides a potential explanation for the mistake, suggesting a strategic blunder regarding queen activity.",1. d4 e6 2. e4 d5 3. Nc3 c5 4. Nf3 Nc6 5. exd5 exd5 6. Be2 Nf6 7. O-O Be7 8. Bg5 O-O 9. dxc5 Be6 10. Nd4 Bxc5 11. Nxe6 fxe6 12. Bg4 Qd6 13. Bh3 Rae8 14. Qd2 Bb4 15. Bxf6 Rxf6 16. Rad1 Qc5 17. Qe2 Bxc3 18. bxc3 Qxc3 19. Rxd5 Nd4,"This is a game between Levitsky (as White) and Marshall, Frank (as Black). Last move played: Black plays Knight to d4",The position is equal,20. Qe4 Rf4 ,19... Nd4 
White loses the upper hand. 20. Qe4 Rf4 21. Qe5 is white's only chance.,True," The comment suggests a strategic flaw leading to a loss, indicating a mistake.",1. d4 e6 2. e4 d5 3. Nc3 c5 4. Nf3 Nc6 5. exd5 exd5 6. Be2 Nf6 7. O-O Be7 8. Bg5 O-O 9. dxc5 Be6 10. Nd4 Bxc5 11. Nxe6 fxe6 12. Bg4 Qd6 13. Bh3 Rae8 14. Qd2 Bb4 15. Bxf6 Rxf6 16. Rad1 Qc5 17. Qe2 Bxc3 18. bxc3 Qxc3 19. Rxd5 Nd4 20. Qh5,"This is a game between Levitsky (as White) and Marshall, Frank (as Black). Last move played: White plays Queen to h5",Large advantage for Black (eval: -416 centipawns),20... Ref8 21. Re5 Rxf2 22. Rfe1 Qd2 23. Qd1 Qxd1 24. Rxd1 Ne2+ 25. Rxe2 Rxe2 26. Bg4 Re5 27. Bf3 g6 28. Bxb7 Rc5 29. Be4 Ra5 30. c4 Rc8 31. Bb7 Rxc4 32. Bf3 Rxa2 33. Rd8+ Kg7 ,20. Qe4 Rf4 
With the decisive threat Rxf2. Black has nothing to gain by 20... exd5?! 21. Qxe8+ Rf8 22. Be6+ Nxe6 23. Qxe6+ Rf7 24. Qxd5 Qxc2 25. f3 =. 20... g6 allows 21. Qe5 =.,True," The comment directly identifies a weak endgame scenario and suggests a poor tactical decision, indicating a mistake.",1. d4 e6 2. e4 d5 3. Nc3 c5 4. Nf3 Nc6 5. exd5 exd5 6. Be2 Nf6 7. O-O Be7 8. Bg5 O-O 9. dxc5 Be6 10. Nd4 Bxc5 11. Nxe6 fxe6 12. Bg4 Qd6 13. Bh3 Rae8 14. Qd2 Bb4 15. Bxf6 Rxf6 16. Rad1 Qc5 17. Qe2 Bxc3 18. bxc3 Qxc3 19. Rxd5 Nd4 20. Qh5 Ref8,"This is a game between Levitsky (as White) and Marshall, Frank (as Black). Last move played: Black plays Rook to f8",Large advantage for Black (eval: -426 centipawns),21. Re5 Rh6 22. Qd1 Nf3+ 23. gxf3 Qxe5 24. Re1 Qf4 25. Re4 Rg6+ 26. Bg4 Qxf3 27. Qxf3 Rxf3 28. Kf1 Rff6 29. h4 Kf8 30. Rc4 e5 31. Bh5 ,20... Ref8 21. Re5 Rxf2 22. Rfe1 Qd2 23. Qd1 Qxd1 24. Rxd1 Ne2+ 25. Rxe2 Rxe2 26. Bg4 Re5 27. Bf3 g6 28. Bxb7 Rc5 29. Be4 Ra5 30. c4 Rc8 31. Bb7 Rxc4 32. Bf3 Rxa2 33. Rd8+ Kg7 
"White may have wanted to play 21. Rc5, but after 21... Rxf2! the game is over. 22. Rxf2 Qe1+ or 22. g3 Nf3+ are both crushing.",True," The comment highlights a crucial tactical blunder that led to a loss, indicating a significant error.",1. d4 e6 2. e4 d5 3. Nc3 c5 4. Nf3 Nc6 5. exd5 exd5 6. Be2 Nf6 7. O-O Be7 8. Bg5 O-O 9. dxc5 Be6 10. Nd4 Bxc5 11. Nxe6 fxe6 12. Bg4 Qd6 13. Bh3 Rae8 14. Qd2 Bb4 15. Bxf6 Rxf6 16. Rad1 Qc5 17. Qe2 Bxc3 18. bxc3 Qxc3 19. Rxd5 Nd4 20. Qh5 Ref8 21. Re5,"This is a game between Levitsky (as White) and Marshall, Frank (as Black). Last move played: White plays Rook to e5",Large advantage for Black (eval: -415 centipawns),21... Rh6 22. Qd1 Nf3+ 23. gxf3 Qxe5 24. Re1 Qf4 25. Re4 Rg6+ 26. Bg4 Qxf3 27. Qxf3 Rxf3 28. Kf1 Rff6 29. h3 b6 30. Rc4 Rf8 31. f3 Rgf6 32. Rc7 a5 33. Ke2 g6 34. Rc6 h5 35. Bxe6+ Kg7 36. Rxb6 Rxf3 ,21. Re5 Rh6 22. Qd1 Nf3+ 23. gxf3 Qxe5 24. Re1 Qf4 25. Re4 Rg6+ 26. Bg4 Qxf3 27. Qxf3 Rxf3 28. Kf1 Rff6 29. h4 Kf8 30. Rc4 e5 31. Bh5 
If 22. Qg4? then black would win routinely with 22... Nf3+ discovery on the Rook on e5.,True," The comment offers a potential strategic error, suggesting a misjudgment of the resulting position.",1. d4 e6 2. e4 d5 3. Nc3 c5 4. Nf3 Nc6 5. exd5 exd5 6. Be2 Nf6 7. O-O Be7 8. Bg5 O-O 9. dxc5 Be6 10. Nd4 Bxc5 11. Nxe6 fxe6 12. Bg4 Qd6 13. Bh3 Rae8 14. Qd2 Bb4 15. Bxf6 Rxf6 16. Rad1 Qc5 17. Qe2 Bxc3 18. bxc3 Qxc3 19. Rxd5 Nd4 20. Qh5 Ref8 21. Re5 Rh6 22. Qg5,"This is a game between Levitsky (as White) and Marshall, Frank (as Black). Last move played: White plays Queen to g5",Large advantage for Black (eval: -485 centipawns),22... Rxh3 23. Rd1 Qxc2 24. Rf1 Qc7 25. Rfe1 Rh6 26. Qe3 Nc6 27. Qc5 Qb8 28. Rh5 Rxh5 29. Qxh5 Qf4 30. Qc5 Qf7 31. Rd1 ,22. Qxh6 gxh6 23. Bxe6+ Kh8 24. Re3 Qc6 25. Bb3 Nxb3 26. cxb3 Qc2 27. h4 h5 28. Re7 h6 29. Rxb7 a5 
"There you have a move to admire. The Queen is en prise three ways. All of which lose. If 24. hxf3, then 24... Ne2 is mate. If 24. fxg3, then 24... Ne2+ leads to mate. The game could have continued painfully for white like this: 24. Qxg3 Ne2+ 25. Kh1 Nxg3+ 26. Kg1 Nxf1.",True," The comment provides a detailed analysis of the resulting threats and how they lead to a checkmate, directly addressing the mistake.",1. d4 e6 2. e4 d5 3. Nc3 c5 4. Nf3 Nc6 5. exd5 exd5 6. Be2 Nf6 7. O-O Be7 8. Bg5 O-O 9. dxc5 Be6 10. Nd4 Bxc5 11. Nxe6 fxe6 12. Bg4 Qd6 13. Bh3 Rae8 14. Qd2 Bb4 15. Bxf6 Rxf6 16. Rad1 Qc5 17. Qe2 Bxc3 18. bxc3 Qxc3 19. Rxd5 Nd4 20. Qh5 Ref8 21. Re5 Rh6 22. Qg5 Rxh3 23. Rc5 Qg3,"This is a game between Levitsky (as White) and Marshall, Frank (as Black). Last move played: Black plays Queen to g3",Large advantage for Black (eval: -502 centipawns),24. Qxg3 Ne2+ 25. Kh1 Nxg3+ 26. Kg1 Rh5 27. Rxh5 Nxh5 28. Rd1 h6 29. Rd7 Rf7 30. Rd8+ Kh7 31. c4 Nf6 32. Rc8 e5 33. c5 e4 34. c6 bxc6 35. g3 c5 36. Rc6 e3 37. fxe3 Re7 38. Kf2 ,23... Qg3 24. Qxg3 Ne2+ 25. Kh1 Nxg3+ 26. Kg1 Ne2+ 27. Kh1 Rc3 28. Ra5 Rxc2 29. a4 h6 30. g3 Nd4 31. Kg1 Nc6 32. Rb5 b6 33. h3 h5 
Marshall plays a weak move that will ultimately allow white to shred black's center. Perhaps black was hoping for tactical chances in the resulting complex position.,True," The comment suggests a deeper analysis of the situation, implying a more strategic understanding than simply a simple exchange.",1. d4 e6 2. e4 d5 3. Nc3 c5,"This is a game between Levitsky (as White) and Marshall, Frank (as Black). Last move played: Black plays Pawn to c5",Large advantage for White (eval: 151 centipawns),4. exd5 exd5 5. Bb5+ Nc6 6. dxc5 a6 7. Bxc6+ bxc6 8. Be3 Be7 9. Nge2 Nf6 10. O-O O-O 11. h3 a5 12. Na4 Ne4 13. f3 Ng5 14. Nd4 Qc7 15. Qd2 ,3... Nf6 4. e5 Nfd7 5. f4 c5 6. Nf3 Nc6 7. Be3 cxd4 8. Nxd4 Qb6 9. Ncb5 a6 10. Nf5 Bc5 11. Nbd6+ Kf8 12. Qh5 Nd8 13. Nxg7 Bxe3 14. Nxe6+ fxe6 15. Qe8+ Kg7 16. Qe7+ Kg8 17. Bd3 Qb4+ 18. c3 Qxf4 19. Qxd8+ Qf8 
