comment,good,reasoning,moves,context,engine_eval,engine_best_line,engine_best_alternative
Also after a longer think Rebel sticks to this logical move. White tries to take advantage of the unusual c7-square for the Black queen by means of Nf4-d5.,True, The comment suggests a potential tactical error stemming from an over-analysis of a specific square.,1. d4 Nf6 2. c4 g6 3. Nc3 d5 4. cxd5 Nxd5 5. e4 Nxc3 6. bxc3 Bg7 7. Bc4 O-O 8. Ne2 c5 9. O-O Nc6 10. Be3 Bg4 11. f3 Bd7 12. Rb1 Qc7 13. Nf4,"This is a game between Rebel10 (exp) (as White) and Anand,V (as Black). Last move played: White plays Knight to f4",The position is equal,13... cxd4 14. cxd4 ,13. Bf4 e5 
A serious alternative would have been 14. d5. Rebel's move removes the bishop to Nc6-a5 attacks.,True," The comment provides a potential alternative move that could have been better, suggesting a tactical advantage.",1. d4 Nf6 2. c4 g6 3. Nc3 d5 4. cxd5 Nxd5 5. e4 Nxc3 6. bxc3 Bg7 7. Bc4 O-O 8. Ne2 c5 9. O-O Nc6 10. Be3 Bg4 11. f3 Bd7 12. Rb1 Qc7 13. Nf4 e6 14. Be2,"This is a game between Rebel10 (exp) (as White) and Anand,V (as Black). Last move played: White plays Bishop to e2",The position is equal,14... cxd4 15. cxd4 ,14. d5 Ne5 
Played after prolonged thought. It is the only way to defend c5.,True," The comment suggests a defensive move, but doesn't directly address the strategic flaw in the initial move.",1. d4 Nf6 2. c4 g6 3. Nc3 d5 4. cxd5 Nxd5 5. e4 Nxc3 6. bxc3 Bg7 7. Bc4 O-O 8. Ne2 c5 9. O-O Nc6 10. Be3 Bg4 11. f3 Bd7 12. Rb1 Qc7 13. Nf4 e6 14. Be2 Ne7 15. Qb3 b6 16. dxc5 bxc5 17. Qa3 Be5,"This is a game between Rebel10 (exp) (as White) and Anand,V (as Black). Last move played: Black plays Bishop to e5",Advantage for White (eval: 80 centipawns),18. g3 Rfb8 19. Bxc5 Nc6 20. Rxb8+ Rxb8 21. Rd1 Bxf4 22. gxf4 Qxf4 23. Bd6 Qe3+ 24. Kf1 Rb7 25. Qc5 Qxc5 26. Bxc5 Nb8 27. Rd4 a5 28. Rd6 e5 29. Kf2 Be6 30. Bb6 Nd7 31. Bxa5 Rb2 32. a4 ,17... Nc6 18. Qxc5 
Simply threatening 20 Rxd6. There is not much Black can do about that.,True," The comment suggests a lack of strategic depth and potential for improvement, indicating a flawed move.",1. d4 Nf6 2. c4 g6 3. Nc3 d5 4. cxd5 Nxd5 5. e4 Nxc3 6. bxc3 Bg7 7. Bc4 O-O 8. Ne2 c5 9. O-O Nc6 10. Be3 Bg4 11. f3 Bd7 12. Rb1 Qc7 13. Nf4 e6 14. Be2 Ne7 15. Qb3 b6 16. dxc5 bxc5 17. Qa3 Be5 18. g3 Bd6 19. Rfd1,"This is a game between Rebel10 (exp) (as White) and Anand,V (as Black). Last move played: White plays Rook to d1",Large advantage for White (eval: 156 centipawns),19... Nc6 20. Rxd6 Qxd6 21. Bxc5 Qc7 22. Bd6 Qa5 23. Bxf8 Rxf8 24. Qxa5 Nxa5 25. Nd3 Rc8 26. Ne5 Bc6 27. Kf2 Kf8 28. Nxc6 Rxc6 29. Rb5 Nc4 30. Bd3 ,19. Rfd1 Nc6 20. Rxd6 Qxd6 21. Bxc5 Qc7 22. Bd6 Qa5 23. Bxf8 Rxf8 24. Qxa5 Nxa5 25. Nd3 Rc8 26. Ne5 Bc6 27. Kf2 Kf8 28. Ba6 Rc7 29. Ke3 Be8 30. Rb8 Ke7 31. c4 f6 32. Ng4 h5 33. Nxf6 Kxf6 34. Rxe8 Nxc4+ 35. Bxc4 Rxc4 36. Rf8+ Kg7 
Equal to resigning. But 23 ... Rb1+ or 23 ... e5 also was insufficient.,True," The comment suggests the move was a weak choice, indicating a potential resignation.",1. d4 Nf6 2. c4 g6 3. Nc3 d5 4. cxd5 Nxd5 5. e4 Nxc3 6. bxc3 Bg7 7. Bc4 O-O 8. Ne2 c5 9. O-O Nc6 10. Be3 Bg4 11. f3 Bd7 12. Rb1 Qc7 13. Nf4 e6 14. Be2 Ne7 15. Qb3 b6 16. dxc5 bxc5 17. Qa3 Be5 18. g3 Bd6 19. Rfd1 Rfb8 20. Rxb8+ Rxb8 21. Rxd6 Qxd6 22. Bxc5 Qd2 23. Bxe7 Rb7,"This is a game between Rebel10 (exp) (as White) and Anand,V (as Black). Last move played: Black plays Rook to b7",Large advantage for White (eval: 407 centipawns),24. Kf2 ,23... Rb1+ 24. Kg2 Re1 25. Qxa7 Rxe2+ 26. Nxe2 Qxe2+ 27. Kh3 Qf1+ 28. Kh4 Qb5 29. g4 Kg7 30. Qd4+ Kg8 31. Bc5 Qb8 32. Bd6 Qd8+ 33. Kg3 f6 34. h4 e5 35. Qd5+ Kg7 36. Bc5 Qc7 
"Now the only move is 26 ... Qb6, leaving no hope of salvation. Anand resigned. A spectecular start from Rebel's point of view. 1-0",True,". The comment describes a resignation, suggesting a significant tactical blunder, indicating a poor move.",1. d4 Nf6 2. c4 g6 3. Nc3 d5 4. cxd5 Nxd5 5. e4 Nxc3 6. bxc3 Bg7 7. Bc4 O-O 8. Ne2 c5 9. O-O Nc6 10. Be3 Bg4 11. f3 Bd7 12. Rb1 Qc7 13. Nf4 e6 14. Be2 Ne7 15. Qb3 b6 16. dxc5 bxc5 17. Qa3 Be5 18. g3 Bd6 19. Rfd1 Rfb8 20. Rxb8+ Rxb8 21. Rxd6 Qxd6 22. Bxc5 Qd2 23. Bxe7 Rb7 24. Qa5 Be8 25. Bb4 Qe3+ 26. Kg2,"This is a game between Rebel10 (exp) (as White) and Anand,V (as Black). Last move played: White plays King to g2",Large advantage for White (eval: 430 centipawns),26... Qb6 27. Qxb6 Rxb6 28. Kf2 g5 29. Nd3 Bb5 30. Ke3 Rb8 31. e5 h5 32. Bd6 Rb6 33. Kd4 Ra6 34. a3 Rc6 35. Nc1 Bxe2 36. Nxe2 f6 37. c4 Rb6 38. Bb4 fxe5+ 39. Kxe5 ,26. Kf1 Qb6 27. Qxb6 Rxb6 28. a3 g5 29. Ng2 a5 30. Bxa5 Rb1+ 31. Ne1 e5 32. c4 f6 33. Bc3 Kf7 34. Kf2 h5 35. Nd3 Kg6 36. Kg2 Rb3 37. Bb4 g4 38. fxg4 hxg4 
An unusual variation. More usual is 11 ... Na5. Rebel's following move was still in its book.,True," The comment suggests the move was significantly unconventional and deviates from standard opening theory, indicating a flaw.",1. d4 Nf6 2. c4 g6 3. Nc3 d5 4. cxd5 Nxd5 5. e4 Nxc3 6. bxc3 Bg7 7. Bc4 O-O 8. Ne2 c5 9. O-O Nc6 10. Be3 Bg4 11. f3 Bd7,"This is a game between Rebel10 (exp) (as White) and Anand,V (as Black). Last move played: Black plays Bishop to d7",Slight advantage for White (eval: 40 centipawns),12. Rb1 cxd4 13. cxd4 a6 14. d5 Ne5 15. Bb3 a5 16. f4 a4 17. Bc2 Nc4 18. Bf2 e5 19. Bd3 b5 20. Bxc4 bxc4 21. Bc5 Re8 22. f5 gxf5 23. Ng3 ,11... Bd7 12. Rb1 
Rebel's book expected 12 ... Na5. Now the chessprogram had to think for the very first time.,True," The comment suggests the player's move was poorly conceived, indicating a significant error.",1. d4 Nf6 2. c4 g6 3. Nc3 d5 4. cxd5 Nxd5 5. e4 Nxc3 6. bxc3 Bg7 7. Bc4 O-O 8. Ne2 c5 9. O-O Nc6 10. Be3 Bg4 11. f3 Bd7 12. Rb1 Qc7,"This is a game between Rebel10 (exp) (as White) and Anand,V (as Black). Last move played: Black plays Queen to c7",Slight advantage for White (eval: 35 centipawns),13. Bf4 e5 ,12... Qc7 13. Bd3 
"Preventing 15 d5, but the knight is very passive at e7. More active was 14 ... Rad8 or Rfd8.",True," The comment identifies a key vulnerability, suggesting the move was flawed.",1. d4 Nf6 2. c4 g6 3. Nc3 d5 4. cxd5 Nxd5 5. e4 Nxc3 6. bxc3 Bg7 7. Bc4 O-O 8. Ne2 c5 9. O-O Nc6 10. Be3 Bg4 11. f3 Bd7 12. Rb1 Qc7 13. Nf4 e6 14. Be2 Ne7,"This is a game between Rebel10 (exp) (as White) and Anand,V (as Black). Last move played: Black plays Knight to e7",Advantage for White (eval: 65 centipawns),15. dxc5 ,14... cxd4 15. cxd4 
"Already the losing mistake! Much stronger was either 15 ... Rab8, or Rebel's choice 15 ... b5!?",True," The comment suggests a potential tactical blunder by attempting to create active counterplay, indicating a flawed assessment of the position.",1. d4 Nf6 2. c4 g6 3. Nc3 d5 4. cxd5 Nxd5 5. e4 Nxc3 6. bxc3 Bg7 7. Bc4 O-O 8. Ne2 c5 9. O-O Nc6 10. Be3 Bg4 11. f3 Bd7 12. Rb1 Qc7 13. Nf4 e6 14. Be2 Ne7 15. Qb3 b6,"This is a game between Rebel10 (exp) (as White) and Anand,V (as Black). Last move played: Black plays Pawn to b6",Advantage for White (eval: 55 centipawns),16. dxc5 Nc6 ,15... Rfb8 
Very strong. c5 is a big weakness. Note that the undefended knight on e7 prevents the answer ... c5-c4.,True," The comment suggests a lack of threat assessment, indicating a flawed evaluation of Black's plans.",1. d4 Nf6 2. c4 g6 3. Nc3 d5 4. cxd5 Nxd5 5. e4 Nxc3 6. bxc3 Bg7 7. Bc4 O-O 8. Ne2 c5 9. O-O Nc6 10. Be3 Bg4 11. f3 Bd7 12. Rb1 Qc7 13. Nf4 e6 14. Be2 Ne7 15. Qb3 b6 16. dxc5 bxc5 17. Qa3,"This is a game between Rebel10 (exp) (as White) and Anand,V (as Black). Last move played: White plays Queen to a3",Advantage for White (eval: 67 centipawns),17... Nc6 18. Qxc5 ,17. Qb7 
An unusual variation. More usual is 11 ... Na5. Rebel's following move was still in its book.,True, The comment suggests a potential weakness in the knight's development and a need for more aggressive options.,1. d4 Nf6 2. c4 g6 3. Nc3 d5 4. cxd5 Nxd5 5. e4 Nxc3 6. bxc3 Bg7 7. Bc4 O-O 8. Ne2 c5 9. O-O Nc6 10. Be3 Bg4 11. f3 Bd7,"This is a game between Rebel10 (exp) (as White) and Anand,V (as Black). Last move played: Black plays Bishop to d7",Slight advantage for White (eval: 40 centipawns),12. Rb1 cxd4 13. cxd4 a6 14. d5 Ne5 15. Bb3 a5 16. f4 a4 17. Bc2 Nc4 18. Bf2 e5 19. Bd3 b5 20. Bxc4 bxc4 21. Bc5 Re8 22. f5 gxf5 23. Ng3 ,11... Bd7 12. Rb1 
