comment,good,reasoning,moves,context,engine_eval,engine_best_line,engine_best_alternative
White might do better to castle and make a gambit of the opening.,True," The comment suggests a potential strategic weakness, indicating a flawed opening choice.",1. e4 e5 2. Nf3 Nc6 3. Bb5 d6 4. c3 a6 5. Ba4 f5 6. d4 fxe4 7. Ng5 exd4 8. Nxe4,This is a game between Reti (as White) and Capablanca (as Black). Last move played: White plays Knight takes on e4,Advantage for Black (eval: -63 centipawns),8... Bf5 9. Qxd4 b5 10. Qe3 Qe7 11. Bc2 g6 12. Na3 d5 13. Ng3 Qxe3+ 14. fxe3 Bd7 15. Nb1 O-O-O 16. Nd2 Bc5 17. Nb3 Bb6 18. a4 Ne5 19. axb5 Bxb5 20. Nd4 Nf6 21. Nxb5 axb5 22. Rf1 ,8. Nxe4 
Black uses the exposed White knight to develop with tempo.,True," The comment suggests a potential tactical error due to the knight's exposure, indicating a misjudgment of the position.",1. e4 e5 2. Nf3 Nc6 3. Bb5 d6 4. c3 a6 5. Ba4 f5 6. d4 fxe4 7. Ng5 exd4 8. Nxe4 Nf6,This is a game between Reti (as White) and Capablanca (as Black). Last move played: Black plays Knight to f6,The position is equal,9. Nxf6+ ,8... Bf5 9. Qxd4 b5 10. Qe3 Qe7 11. Bc2 g6 12. Na3 d5 13. Ng3 Qxe3+ 14. fxe3 Bd7 15. Nb1 O-O-O 16. Nd2 Bc5 17. Nb3 Bb6 18. a4 Ne5 19. axb5 Bxb5 20. Nd4 Nf6 21. Nxb5 axb5 22. Rf1 
13.Qxc6+ Bd7,True, The comment provides insufficient context to determine the error.,1. e4 e5 2. Nf3 Nc6 3. Bb5 d6 4. c3 a6 5. Ba4 f5 6. d4 fxe4 7. Ng5 exd4 8. Nxe4 Nf6 9. Bg5 Be7 10. Qxd4 b5 11. Nxf6+ gxf6 12. Qd5 bxa4 13. Bh6,This is a game between Reti (as White) and Capablanca (as Black). Last move played: White plays Bishop to h6,Large advantage for Black (eval: -430 centipawns),13... Qd7 14. Bg7 Qe6+ 15. Qxe6 Bxe6 16. Bxh8 Kf7 17. Bxf6 Bxf6 18. O-O Rb8 19. b3 Nb4 20. Rc1 Nd3 21. Rd1 Bf5 22. bxa4 Nb2 23. Re1 Nxa4 24. Nd2 Nxc3 25. Rac1 c5 26. Re3 Nxa2 27. Ne4 Nxc1 28. Nxd6+ Kg6 ,13. Bh6 Qd7 14. Bg7 Qe6+ 15. Qxe6 Bxe6 16. Bxh8 Kf7 17. Bxf6 Bxf6 18. Nd2 Rb8 19. b3 Nb4 20. O-O Bxc3 21. Rad1 Nxa2 22. bxa4 Bf5 23. Nc4 Bc2 24. Rd5 Nb4 25. Ra5 Bf6 26. Re1 Bd3 27. Rc1 Bxc4 28. Rxc4 c5 29. Re4 Bd4 
"This fine move defends the knight as well as the bishop on e7, prepares to attack White's kingside by a later ...Qg4 or Qh3 and gets ready to castle queenside.",True," The comment offers potential explanations for the mistake, suggesting strategic considerations.",1. e4 e5 2. Nf3 Nc6 3. Bb5 d6 4. c3 a6 5. Ba4 f5 6. d4 fxe4 7. Ng5 exd4 8. Nxe4 Nf6 9. Bg5 Be7 10. Qxd4 b5 11. Nxf6+ gxf6 12. Qd5 bxa4 13. Bh6 Qd7,This is a game between Reti (as White) and Capablanca (as Black). Last move played: Black plays Queen to d7,Large advantage for Black (eval: -432 centipawns),14. Bg7 Qe6+ 15. Qxe6 Bxe6 16. Bxh8 Kf7 17. Bg7 Kxg7 18. O-O f5 19. Re1 Kf7 20. Nd2 Bf6 21. Re3 Ne5 22. f4 Ng6 23. g3 Rb8 24. b3 Bd5 25. Rae1 Ne7 26. Rd3 Bc6 27. bxa4 ,13... Qd7 14. Bg7 Qe6+ 15. Qxe6 Bxe6 16. Bxh8 Kf7 17. Bxf6 Bxf6 18. O-O Rb8 19. b3 Nb4 20. Rc1 Nd3 21. Rd1 Bf5 22. bxa4 Nb2 23. Re1 Nxa4 24. Nd2 Nxc3 25. Rac1 c5 26. Re3 Nxa2 27. Ne4 Nxc1 28. Nxd6+ Kg6 
Aiming his extra piece straight at White's king position.,True," Yes, the comment suggests a dangerous and reckless attack, indicating a flawed strategic decision.",1. e4 e5 2. Nf3 Nc6 3. Bb5 d6 4. c3 a6 5. Ba4 f5 6. d4 fxe4 7. Ng5 exd4 8. Nxe4 Nf6 9. Bg5 Be7 10. Qxd4 b5 11. Nxf6+ gxf6 12. Qd5 bxa4 13. Bh6 Qd7 14. O-O Bb7,This is a game between Reti (as White) and Capablanca (as Black). Last move played: Black plays Bishop to b7,Large advantage for Black (eval: -493 centipawns),15. Qh5+ Kd8 16. c4 Rg8 17. Nc3 Qg4 18. Qxg4 Rxg4 19. Nd5 Ne5 20. Rac1 Kd7 21. Rfe1 Rag8 22. g3 Bd8 23. f4 Bxd5 24. cxd5 Nf7 25. Bf8 Rxf8 26. Rc4 Rgg8 27. Rxa4 f5 28. Rxa6 ,14... Bb7 15. Qh5+ Kd8 16. c4 Rg8 17. Nc3 Ne5 18. Nd5 Qg4 19. Qxg4 Rxg4 20. Rac1 Kd7 21. Rfd1 Rag8 22. g3 Rxc4 23. Nxe7 Kxe7 24. Rxc4 Nxc4 25. Rc1 Bd5 26. Bf8+ 
"Another fine move. Black is willing to give back a little material to take the initiative. After White takes the rook Black will have his queen bishop, knight, queen and rook all aiming at White's king, which has no defenders.",True," The comment highlights a potential tactical blunder by Black, suggesting a vulnerable position and a risky sacrifice.",1. e4 e5 2. Nf3 Nc6 3. Bb5 d6 4. c3 a6 5. Ba4 f5 6. d4 fxe4 7. Ng5 exd4 8. Nxe4 Nf6 9. Bg5 Be7 10. Qxd4 b5 11. Nxf6+ gxf6 12. Qd5 bxa4 13. Bh6 Qd7 14. O-O Bb7 15. Bg7 O-O-O,This is a game between Reti (as White) and Capablanca (as Black). Last move played: Black plays queenside castle,Large advantage for Black (eval: -634 centipawns),16. Bxh8 Ne5 17. Qxb7+ Kxb7 18. f4 Nc6 19. Bg7 Rg8 20. Nd2 Rxg7 21. Rae1 d5 22. Kh1 Bd6 23. b3 a5 24. bxa4 Ka7 25. Nf3 Re7 26. Rxe7 Qxe7 ,15... O-O-O 16. Bxh8 Ne5 17. Qxb7+ Kxb7 18. f4 Ng4 19. Nd2 Rxh8 20. Rae1 f5 21. b3 d5 22. Nf3 Bc5+ 23. Kh1 Qd6 24. bxa4 Ka8 25. Rb1 Re8 26. Rfe1 Rxe1+ 27. Rxe1 
Now White's queen won't be able to get back to defend the kingside.,True,". The comment suggests a potential vulnerability in White's defensive structure, indicating a flawed strategic decision.",1. e4 e5 2. Nf3 Nc6 3. Bb5 d6 4. c3 a6 5. Ba4 f5 6. d4 fxe4 7. Ng5 exd4 8. Nxe4 Nf6 9. Bg5 Be7 10. Qxd4 b5 11. Nxf6+ gxf6 12. Qd5 bxa4 13. Bh6 Qd7 14. O-O Bb7 15. Bg7 O-O-O 16. Bxh8 Ne5,This is a game between Reti (as White) and Capablanca (as Black). Last move played: Black plays Knight to e5,Large advantage for Black (eval: -638 centipawns),17. Qxb7+ Kxb7 18. f4 Nc6 19. Bxf6 Bxf6 20. Nd2 Qf5 21. Rae1 d5 22. Kh1 Ka8 23. c4 dxc4 24. Ne4 ,16... Ne5 17. Qxb7+ Kxb7 18. Nd2 Rxh8 19. b3 d5 20. bxa4 Ka8 21. Rfb1 Bc5 22. Nb3 Ba7 23. Nd4 Bxd4 24. cxd4 Nc4 25. Re1 Rb8 26. Rab1 Re8 27. Rxe8+ Qxe8 
"Very powerful; Black wins a tempo on White's queen while not allowing the counterplay White might hope for after, e.g. 17...Qf5 18.Qxa4.",True, The comment suggests a missed opportunity for White to develop and create counterplay.,1. e4 e5 2. Nf3 Nc6 3. Bb5 d6 4. c3 a6 5. Ba4 f5 6. d4 fxe4 7. Ng5 exd4 8. Nxe4 Nf6 9. Bg5 Be7 10. Qxd4 b5 11. Nxf6+ gxf6 12. Qd5 bxa4 13. Bh6 Qd7 14. O-O Bb7 15. Bg7 O-O-O 16. Bxh8 Ne5 17. Qd1 Bf3,This is a game between Reti (as White) and Capablanca (as Black). Last move played: Black plays Bishop to f3,Large advantage for Black (eval: -622 centipawns),18. Nd2 Bxd1 19. Raxd1 Qc6 20. Rfe1 Rg8 21. g3 Rxh8 22. c4 f5 23. b4 Bf6 24. Rb1 f4 25. b5 axb5 26. cxb5 Qb7 27. Rxe5 Bxe5 28. Nc4 fxg3 29. hxg3 Rf8 30. Nxe5 dxe5 31. b6 cxb6 32. Rc1+ Kb8 ,17... Rg8 18. f3 Qh3 19. Rf2 Nxf3+ 20. Kf1 Nxh2+ 21. Ke1 Qh4 22. Ke2 Bd8 23. Qg1 Qh5+ 24. Kd2 Nf3+ 25. Rxf3 Bxf3 26. g3 Qh3 27. Kc1 Rxg3 28. Qe1 Rg2 29. Nd2 Rg8 
White has no defense to threats like 19...Nxf3+ and 19...Rg8+,True, The comment highlights a missed opportunity for the Black king to escape a potential threat.,1. e4 e5 2. Nf3 Nc6 3. Bb5 d6 4. c3 a6 5. Ba4 f5 6. d4 fxe4 7. Ng5 exd4 8. Nxe4 Nf6 9. Bg5 Be7 10. Qxd4 b5 11. Nxf6+ gxf6 12. Qd5 bxa4 13. Bh6 Qd7 14. O-O Bb7 15. Bg7 O-O-O 16. Bxh8 Ne5 17. Qd1 Bf3 18. gxf3 Qh3,This is a game between Reti (as White) and Capablanca (as Black). Last move played: Black plays Queen to h3,Mate in 10 for Black,19. Qd5 Nxf3+ 20. Qxf3 Qxf3 21. Re1 Rg8+ 22. Bg7 Rxg7+ 23. Kf1 Rg2 24. Re2 Rxh2 25. Ke1 Rh1+ 26. Kd2 Qd5+ 27. Ke3 Rh3+ 28. Kf4 Qf3# ,18... Qh3 19. Qd5 Nxf3+ 20. Qxf3 Qxf3 21. Re1 Rg8+ 22. Bg7 Rxg7+ 23. Kf1 Rg2 24. Re2 Rxh2 25. Ke1 Rh1+ 26. Kd2 Qd5+ 27. Ke3 Rh3+ 28. Kf4 Qf3# 
Black uses the exposed White knight to develop with tempo.,True, The comment suggests the player misjudged the potential counterplay Black could create with their pawn structure.,1. e4 e5 2. Nf3 Nc6 3. Bb5 d6 4. c3 a6 5. Ba4 f5 6. d4 fxe4 7. Ng5 exd4 8. Nxe4 Nf6,This is a game between Reti (as White) and Capablanca (as Black). Last move played: Black plays Knight to f6,The position is equal,9. Nxf6+ ,8... Bf5 9. Qxd4 b5 10. Qe3 Qe7 11. Bc2 g6 12. Na3 d5 13. Ng3 Qxe3+ 14. fxe3 Bd7 15. Nb1 O-O-O 16. Nd2 Bc5 17. Nb3 Bb6 18. a4 Ne5 19. axb5 Bxb5 20. Nd4 Nf6 21. Nxb5 axb5 22. Rf1 
White might do better to castle and make a gambit of the opening.,True, The comment suggests a logical flaw in the player’s assessment of Black’s potential.,1. e4 e5 2. Nf3 Nc6 3. Bb5 d6 4. c3 a6 5. Ba4 f5 6. d4 fxe4 7. Ng5 exd4 8. Nxe4,This is a game between Reti (as White) and Capablanca (as Black). Last move played: White plays Knight takes on e4,Advantage for Black (eval: -63 centipawns),8... Bf5 9. Qxd4 b5 10. Qe3 Qe7 11. Bc2 g6 12. Na3 d5 13. Ng3 Qxe3+ 14. fxe3 Bd7 15. Nb1 O-O-O 16. Nd2 Bc5 17. Nb3 Bb6 18. a4 Ne5 19. axb5 Bxb5 20. Nd4 Nf6 21. Nxb5 axb5 22. Rf1 ,8. Nxe4 
