comment,good,reasoning,moves,context,engine_eval,engine_best_line,engine_best_alternative
Black brings life to a dull game.,True," The comment suggests the move was an improvement, potentially mitigating a lack of dynamism.",1. c4 e6 2. g3 d5 3. Bg2 Nf6 4. Nf3 Be7 5. O-O O-O 6. d4 c6 7. Qc2 b6 8. b3 Bb7 9. Bb2 Na6 10. Rd1 Qc8 11. e3 c5 12. Qe2 dxc4,"This is a game between Korchnoi, Viktor (as White) and Bronstein, David (as Black). Last move played: Black plays Pawn takes on c4",Slight advantage for White (eval: 49 centipawns),13. bxc4 Re8 ,12... dxc4 
An unnecessary weakening.,True,", The comment suggests the move didn't improve the position, indicating a weakness.",1. c4 e6 2. g3 d5 3. Bg2 Nf6 4. Nf3 Be7 5. O-O O-O 6. d4 c6 7. Qc2 b6 8. b3 Bb7 9. Bb2 Na6 10. Rd1 Qc8 11. e3 c5 12. Qe2 dxc4 13. bxc4 Rd8 14. Nc3 Ne4 15. Nxe4 Bxe4 16. Ne5 Bxg2 17. Kxg2 f6 18. Nf3 Nc7 19. a4 Bf8 20. h4 Qb7 21. Kg1 Qe4 22. Nd2 Qc2 23. Ra2 cxd4 24. Rc1 Qf5 25. exd4 Bb4 26. Nf3 Rac8 27. Kg2 h5,"This is a game between Korchnoi, Viktor (as White) and Bronstein, David (as Black). Last move played: Black plays Pawn to h5",Slight advantage for White (eval: 33 centipawns),28. Ba3 ,27... Qg6 
Black counterattacks.,True,", The comment indicates a potential tactical opening, suggesting a flawed strategic plan.",1. c4 e6 2. g3 d5 3. Bg2 Nf6 4. Nf3 Be7 5. O-O O-O 6. d4 c6 7. Qc2 b6 8. b3 Bb7 9. Bb2 Na6 10. Rd1 Qc8 11. e3 c5 12. Qe2 dxc4 13. bxc4 Rd8 14. Nc3 Ne4 15. Nxe4 Bxe4 16. Ne5 Bxg2 17. Kxg2 f6 18. Nf3 Nc7 19. a4 Bf8 20. h4 Qb7 21. Kg1 Qe4 22. Nd2 Qc2 23. Ra2 cxd4 24. Rc1 Qf5 25. exd4 Bb4 26. Nf3 Rac8 27. Kg2 h5 28. Bc3 Bf8 29. Rd2 Qg4 30. Rd3 Rd7 31. Re3 Qf5 32. Re4 Rd6 33. Rd1 Rc6 34. Rf4 Qg6 35. Nd2 Qc2,"This is a game between Korchnoi, Viktor (as White) and Bronstein, David (as Black). Last move played: Black plays Queen to c2",Advantage for White (eval: 55 centipawns),36. Rf3 ,35... a5 36. Re1 
White has a strong attack for a piece.,True," The comment suggests a potential tactical advantage, implying the move was flawed.",1. c4 e6 2. g3 d5 3. Bg2 Nf6 4. Nf3 Be7 5. O-O O-O 6. d4 c6 7. Qc2 b6 8. b3 Bb7 9. Bb2 Na6 10. Rd1 Qc8 11. e3 c5 12. Qe2 dxc4 13. bxc4 Rd8 14. Nc3 Ne4 15. Nxe4 Bxe4 16. Ne5 Bxg2 17. Kxg2 f6 18. Nf3 Nc7 19. a4 Bf8 20. h4 Qb7 21. Kg1 Qe4 22. Nd2 Qc2 23. Ra2 cxd4 24. Rc1 Qf5 25. exd4 Bb4 26. Nf3 Rac8 27. Kg2 h5 28. Bc3 Bf8 29. Rd2 Qg4 30. Rd3 Rd7 31. Re3 Qf5 32. Re4 Rd6 33. Rd1 Rc6 34. Rf4 Qg6 35. Nd2 Qc2 36. Qxh5 Qxc3 37. Ne4 Qc2 38. d5 exd5 39. cxd5 Rd6,"This is a game between Korchnoi, Viktor (as White) and Bronstein, David (as Black). Last move played: Black plays Rook to d6",Large advantage for White (eval: 217 centipawns),40. Rd2 ,39... Rd6 40. Rd2 
The players made an exhibition of the last game.,False,"

The comment suggests the move was a display of skill rather than a strategic or tactical consideration, indicating a lack of depth in the analysis.",1. c4 e6 2. g3 d5 3. Bg2 Nf6 4. Nf3 Be7 5. O-O O-O 6. d4 c6 7. Qc2 b6 8. b3 Bb7 9. Bb2 Na6 10. Rd1 Qc8 11. e3 c5 12. Qe2 dxc4 13. bxc4 Rd8 14. Nc3 Ne4 15. Nxe4 Bxe4 16. Ne5 Bxg2 17. Kxg2 f6 18. Nf3 Nc7 19. a4 Bf8 20. h4 Qb7 21. Kg1 Qe4 22. Nd2 Qc2 23. Ra2 cxd4 24. Rc1 Qf5 25. exd4 Bb4 26. Nf3 Rac8 27. Kg2 h5 28. Bc3 Bf8 29. Rd2 Qg4 30. Rd3 Rd7 31. Re3 Qf5 32. Re4 Rd6 33. Rd1 Rc6 34. Rf4 Qg6 35. Nd2 Qc2 36. Qxh5 Qxc3 37. Ne4 Qc2 38. d5 exd5 39. cxd5 Rd6 40. Rd2 Qc1 41. Qg6 Re8 42. Nxd6 Bxd6 43. Rc2 Qb1 44. Rxf6 Be5 45. d6 Bxf6 46. dxc7 Rc8 47. Qf5 Rxc7 48. Qd5+ Rf7 49. Rc8+,"This is a game between Korchnoi, Viktor (as White) and Bronstein, David (as Black). Last move played: White plays Rook to c8 with check",Mate in 2 for White,49... Bd8 50. Rxd8+ Kh7 51. Qh5# ,49. Rc8+ Bd8 50. Rxd8+ Kh7 51. Qh5# 
Black brings life to a dull game.,True,", The comment suggests a potential tactical pursuit, indicating a flawed strategic decision.",1. c4 e6 2. g3 d5 3. Bg2 Nf6 4. Nf3 Be7 5. O-O O-O 6. d4 c6 7. Qc2 b6 8. b3 Bb7 9. Bb2 Na6 10. Rd1 Qc8 11. e3 c5 12. Qe2 dxc4,"This is a game between Korchnoi, Viktor (as White) and Bronstein, David (as Black). Last move played: Black plays Pawn takes on c4",Slight advantage for White (eval: 49 centipawns),13. bxc4 Re8 ,12... dxc4 
