comment,good,reasoning,moves,context,engine_eval,engine_best_line,engine_best_alternative
Exchanging in this position is an error,True,", The comment directly identifies a flaw in the move, indicating a mistake.",1. d4 Nf6 2. Nf3 e6 3. Bg5 c5 4. e3 Qb6 5. Qc1 Be7 6. Nbd2 d5 7. c3 Nc6 8. Be2 h6 9. Bh4 Bd7 10. Qc2 Rc8 11. Qb3 Qxb3,This is a game between Sundenberg (as White) and Kramer (as Black). Last move played: Black plays Queen takes on b3,The position is equal,12. axb3 ,11... cxd4 12. Qxb6 axb6 13. Nxd4 e5 14. Nxc6 Bxc6 15. Bg3 Bd6 16. f4 exf4 17. Bxf4 Rd8 18. Nf3 O-O 19. Nd4 Rfe8 20. h3 Bc5 
Now White has the initiative on both flanks,True,". The comment suggests White has control of the center, which is a potential mistake if the move was actually weakening their position.",1. d4 Nf6 2. Nf3 e6 3. Bg5 c5 4. e3 Qb6 5. Qc1 Be7 6. Nbd2 d5 7. c3 Nc6 8. Be2 h6 9. Bh4 Bd7 10. Qc2 Rc8 11. Qb3 Qxb3 12. axb3 g5 13. Bg3 cxd4 14. Nxd4 a6 15. b4 O-O 16. h4,This is a game between Sundenberg (as White) and Kramer (as Black). Last move played: White plays Pawn to h4,Slight advantage for White (eval: 37 centipawns),16... Nxd4 17. exd4 ,16. h4 
the two weaknesses emerge,True,", The comment suggests a tactical flaw, indicating a mistake.",1. d4 Nf6 2. Nf3 e6 3. Bg5 c5 4. e3 Qb6 5. Qc1 Be7 6. Nbd2 d5 7. c3 Nc6 8. Be2 h6 9. Bh4 Bd7 10. Qc2 Rc8 11. Qb3 Qxb3 12. axb3 g5 13. Bg3 cxd4 14. Nxd4 a6 15. b4 O-O 16. h4 Ne4 17. Nxe4 dxe4 18. hxg5 hxg5 19. Nb3 Na7 20. Be5 f6 21. Bd4 Nc6 22. Bc5 f5 23. O-O-O Be8 24. Bxe7 Nxe7 25. Nc5,This is a game between Sundenberg (as White) and Kramer (as Black). Last move played: White plays Knight to c5,Large advantage for White (eval: 222 centipawns),25... a5 26. Nd7 ,25. Nc5 a5 
counterattack as the best means of defence Instead of trying to hold his winnings White quite rightly plays for the attack,True," The comment suggests a flawed strategic approach, implying a defensive move is preferable to an offensive one.",1. d4 Nf6 2. Nf3 e6 3. Bg5 c5 4. e3 Qb6 5. Qc1 Be7 6. Nbd2 d5 7. c3 Nc6 8. Be2 h6 9. Bh4 Bd7 10. Qc2 Rc8 11. Qb3 Qxb3 12. axb3 g5 13. Bg3 cxd4 14. Nxd4 a6 15. b4 O-O 16. h4 Ne4 17. Nxe4 dxe4 18. hxg5 hxg5 19. Nb3 Na7 20. Be5 f6 21. Bd4 Nc6 22. Bc5 f5 23. O-O-O Be8 24. Bxe7 Nxe7 25. Nc5 a5 26. Nxe6 Rf6 27. Nxg5 axb4 28. Rd4,This is a game between Sundenberg (as White) and Kramer (as Black). Last move played: White plays Rook to d4,The position is equal,28... Rg6 29. Nh3 bxc3 30. bxc3 Rxc3+ 31. Kd2 Rc8 32. Nf4 Rb6 33. Rc1 Rb2+ 34. Kd1 Ra8 35. Ke1 Bf7 36. Rd7 Nc6 37. Kf1 Ne5 38. Re7 Re8 39. Rec7 Kf8 40. Kg1 Re7 41. R7c5 b6 42. R5c3 Ra7 43. Kh2 Ke7 ,28. Rh7 Rg6 29. Rxe7 Rxg5 30. Rxb7 Rxg2 31. Ba6 Kf8 32. Rh1 Kg8 33. Rxb4 Ra8 34. Rb6 Rxf2 35. c4 Kg7 36. Rg1+ Kf8 37. c5 Bb5 38. Rxb5 Rxa6 39. Kb1 Rf3 40. Rc1 Rc6 41. Rc3 Kf7 42. Rb6 Rc7 43. c6 
"Suddenly, like parts of a well-oiled machine, all the White pieces are working smoothly together against the Black King",True," The comment suggests a coordinated and efficient sequence of moves, indicating a potential flaw in the initial move.",1. d4 Nf6 2. Nf3 e6 3. Bg5 c5 4. e3 Qb6 5. Qc1 Be7 6. Nbd2 d5 7. c3 Nc6 8. Be2 h6 9. Bh4 Bd7 10. Qc2 Rc8 11. Qb3 Qxb3 12. axb3 g5 13. Bg3 cxd4 14. Nxd4 a6 15. b4 O-O 16. h4 Ne4 17. Nxe4 dxe4 18. hxg5 hxg5 19. Nb3 Na7 20. Be5 f6 21. Bd4 Nc6 22. Bc5 f5 23. O-O-O Be8 24. Bxe7 Nxe7 25. Nc5 a5 26. Nxe6 Rf6 27. Nxg5 axb4 28. Rd4 b5 29. Bd1 bxc3 30. Bb3+,This is a game between Sundenberg (as White) and Kramer (as Black). Last move played: White plays Bishop to b3 with check,Large advantage for White (eval: 123 centipawns),30... Kg7 31. Ne6+ ,30. Bb3+ Kg7 
