comment,good,reasoning,moves,context,engine_eval,engine_best_line,engine_best_alternative
"While White is gearing up for a kingside attack, Black calmly wins the pawn on c4.",True," The comment suggests a defensive maneuver, contradicting the intended aggressive plan.",1. d4 Nf6 2. c4 e6 3. Nc3 Bb4 4. e3 c5 5. a3 Bxc3+ 6. bxc3 b6 7. Bd3 Bb7 8. f3 Nc6 9. Ne2 O-O 10. O-O Na5,This is a game between Geller (as White) and Euwe (as Black). Last move played: Black plays Knight to a5,The position is equal,11. e4 Ne8 ,10... Na5 11. e4 cxd4 12. e5 Ne8 13. Nxd4 Rc8 14. a4 Nxc4 15. Bxc4 Rxc4 16. Ba3 d6 17. Nb5 a6 18. Nxd6 Nxd6 19. Qxd6 Re8 20. Qxd8 Rxd8 21. Rfb1 Rxa4 22. Rxb6 Bd5 23. Rb4 Rxb4 24. Bxb4 
"Black avoids the nasty pin 12 Bg5 and prepares to meet 12 f4 by 12...f5. White's next move prevents this, but takes another tempo.",True," The comment identifies a potential tactical blunder and suggests a response, indicating a failure to correctly assess the position.",1. d4 Nf6 2. c4 e6 3. Nc3 Bb4 4. e3 c5 5. a3 Bxc3+ 6. bxc3 b6 7. Bd3 Bb7 8. f3 Nc6 9. Ne2 O-O 10. O-O Na5 11. e4 Ne8,This is a game between Geller (as White) and Euwe (as Black). Last move played: Black plays Knight to e8,The position is equal,12. dxc5 ,11... Ne8 
"Black couldn't let White play 16 f6, when 16...Nxf6 17 Bg5 followed by 18 Nh5 would be just as bad as 16...gxf6 17.Nh5 and 18 Bh6 or letting White take on g7.",True," The comment highlights a potential strategic blunder by Black, suggesting a missed opportunity to solidify control of the center.",1. d4 Nf6 2. c4 e6 3. Nc3 Bb4 4. e3 c5 5. a3 Bxc3+ 6. bxc3 b6 7. Bd3 Bb7 8. f3 Nc6 9. Ne2 O-O 10. O-O Na5 11. e4 Ne8 12. Ng3 cxd4 13. cxd4 Rc8 14. f4 Nxc4 15. f5 f6,This is a game between Geller (as White) and Euwe (as Black). Last move played: Black plays Pawn to f6,Slight advantage for Black (eval: -29 centipawns),16. a4 Ned6 ,15... b5 16. Rb1 
"Now Black has b6 for his queen, and it becomes apparent that White's king may come under long range fire.",True," The comment suggests a potential threat to the king, indicating a flawed strategic decision.",1. d4 Nf6 2. c4 e6 3. Nc3 Bb4 4. e3 c5 5. a3 Bxc3+ 6. bxc3 b6 7. Bd3 Bb7 8. f3 Nc6 9. Ne2 O-O 10. O-O Na5 11. e4 Ne8 12. Ng3 cxd4 13. cxd4 Rc8 14. f4 Nxc4 15. f5 f6 16. Rf4 b5,This is a game between Geller (as White) and Euwe (as Black). Last move played: Black plays Pawn to b5,Large advantage for Black (eval: -125 centipawns),17. Bxc4 ,16... b5 17. Rh4 
"While White is gearing up for a kingside attack, Black calmly wins the pawn on c4.",True," The comment provides context about Euwe's strategic understanding, suggesting White's attack is unlikely to succeed.",1. d4 Nf6 2. c4 e6 3. Nc3 Bb4 4. e3 c5 5. a3 Bxc3+ 6. bxc3 b6 7. Bd3 Bb7 8. f3 Nc6 9. Ne2 O-O 10. O-O Na5,This is a game between Geller (as White) and Euwe (as Black). Last move played: Black plays Knight to a5,The position is equal,11. e4 Ne8 ,10... Na5 11. e4 cxd4 12. e5 Ne8 13. Nxd4 Rc8 14. a4 Nxc4 15. Bxc4 Rxc4 16. Ba3 d6 17. Nb5 a6 18. Nxd6 Nxd6 19. Qxd6 Re8 20. Qxd8 Rxd8 21. Rfb1 Rxa4 22. Rxb6 Bd5 23. Rb4 Rxb4 24. Bxb4 
