comment,good,reasoning,moves,context,engine_eval,engine_best_line,engine_best_alternative
"Morphy's opponent is not just an ordinary citizen, but a British Lord and President of the British Chess Association. All of which is of no use when seated at the chessboard against Morphy, even when Morphy is blindfolded!",True," The comment provides a humorous and somewhat absurd explanation for the mistake, suggesting the opponent's status is irrelevant.",1. e4 e5,This is a game between Morphy (as White) and Lyttleton (as Black). Last move played: Black plays Pawn to e5,Slight advantage for White (eval: 32 centipawns),2. Nf3 ,1... e5 2. Nf3 Nc6 3. d4 exd4 4. Nxd4 Bc5 5. Nb3 Bb6 6. a4 Qh4 7. Qf3 a5 8. g3 Qf6 9. Qe2 Nge7 10. Nc3 
This position was frequently seen in games played in the 19th century.,True," The comment provides context about the game's historical significance, suggesting a potential flaw in the move’s strategic soundness.",1. e4 e5 2. f4 exf4 3. Nf3 g5 4. h4 g4 5. Ne5,This is a game between Morphy (as White) and Lyttleton (as Black). Last move played: White plays Knight to e5,Advantage for Black (eval: -70 centipawns),5... Nf6 6. d4 ,5. Ne5 Nf6 6. d4 d6 7. Nd3 Nxe4 8. Bxf4 Nc6 9. Nc3 Bf5 10. g3 Qd7 11. Bg2 O-O-O 12. Nxe4 Re8 13. Nf2 d5 14. O-O dxe4 15. d5 Nb4 16. Qd4 e3 17. Qxa7 exf2+ 18. Rxf2 Qb5 19. Bf1 Qb6 20. Qa8+ Kd7 21. Qa4+ c6 22. dxc6+ Nxc6 
Black gains time by attacking the weak pawn at h4.,True," The comment suggests a potential tactical disadvantage, indicating a flawed assessment of the resulting position.",1. e4 e5 2. f4 exf4 3. Nf3 g5 4. h4 g4 5. Ne5 d6 6. Nxg4 Be7,This is a game between Morphy (as White) and Lyttleton (as Black). Last move played: Black plays Bishop to e7,Slight advantage for Black (eval: -30 centipawns),7. d4 Bxh4+ ,6... Be7 7. Nf2 
"White occupies the center, achieving one of the primary objectives of the opening.",True," The comment offers a potential justification for the mistake, suggesting a strategic goal, but doesn't explicitly state why the move was considered a mistake.",1. e4 e5 2. f4 exf4 3. Nf3 g5 4. h4 g4 5. Ne5 d6 6. Nxg4 Be7 7. d4,This is a game between Morphy (as White) and Lyttleton (as Black). Last move played: White plays Pawn to d4,Slight advantage for Black (eval: -23 centipawns),7... Bxh4+ 8. Nf2 Bg3 9. Qf3 Qg5 10. Nc3 Nf6 11. Bd3 Rg8 12. Kf1 Nc6 13. Ne2 Bxf2 14. Bxf4 Qg7 15. Qxf2 Ng4 16. Qh4 Nxd4 17. Qxh7 Qxh7 18. Rxh7 Nc6 19. Nc3 Be6 20. g3 Nce5 21. Ke1 Ke7 22. Kd2 c6 23. b3 b5 ,7. d4 Bxh4+ 
"It might have been nice to maintain this pin a bit longer, but Black wants to be able to bring the knight at g8 into the game.",True," The comment suggests a potential improvement to a specific move, indicating a flaw in the original plan.",1. e4 e5 2. f4 exf4 3. Nf3 g5 4. h4 g4 5. Ne5 d6 6. Nxg4 Be7 7. d4 Bxh4+ 8. Nf2 Bxf2+,This is a game between Morphy (as White) and Lyttleton (as Black). Last move played: Black plays Bishop takes on f2 with check,The position is equal,9. Kxf2 Qg5 ,8... Qg5 9. Qf3 Bg3 10. Nc3 Nf6 11. Bd3 Rg8 12. Kf1 Nc6 13. Ne2 Bxf2 14. Bxf4 Qg7 15. Qxf2 Ng4 16. Qh4 Nxd4 17. Qxh7 Qxh7 18. Rxh7 Nc6 19. Nc3 Be6 20. Nd5 O-O-O 21. Be2 Rde8 22. Rh4 f5 23. exf5 Bxf5 24. Bxg4 
"A powerful move, threatening a nasty pin with Re1.",True," The comment suggests a potential threat, indicating a flawed strategic decision.",1. e4 e5 2. f4 exf4 3. Nf3 g5 4. h4 g4 5. Ne5 d6 6. Nxg4 Be7 7. d4 Bxh4+ 8. Nf2 Bxf2+ 9. Kxf2 Nf6 10. Nc3 Qe7 11. Bxf4 Nxe4+ 12. Nxe4 Qxe4 13. Bb5+,This is a game between Morphy (as White) and Lyttleton (as Black). Last move played: White plays Bishop to b5 with check,Large advantage for White (eval: 578 centipawns),13... Bd7 14. Re1 Qxe1+ 15. Qxe1+ Kd8 16. Bxd7 Nxd7 17. Kg1 a5 18. Qe4 Re8 19. Qxh7 f6 20. Bd2 c6 21. Re1 Kc7 22. Rxe8 Rxe8 23. Bxa5+ b6 24. Bc3 Re6 25. Bb4 Re2 26. Kh2 Re8 27. Qf7 ,13. Bb5+ Nc6 14. Re1 Bf5 15. Qf3 d5 16. Bxc6+ bxc6 17. Rxe4+ dxe4 18. Qh5 Be6 19. Re1 Rg8 20. Rxe4 Rg6 21. Qe5 Kf8 22. Qh8+ Rg8 23. Bh6+ Ke7 24. Qe5 Kd7 25. Bf4 Rac8 26. b4 h5 27. Re3 h4 28. b5 Rg4 
"White is closing in for the kill. The king is trapped along the back rank, so if White can get a rook or queen to the e- file and then to e8, the game ends.",True, The comment describes a potential tactical threat but doesn't explicitly state why the move was a mistake.,1. e4 e5 2. f4 exf4 3. Nf3 g5 4. h4 g4 5. Ne5 d6 6. Nxg4 Be7 7. d4 Bxh4+ 8. Nf2 Bxf2+ 9. Kxf2 Nf6 10. Nc3 Qe7 11. Bxf4 Nxe4+ 12. Nxe4 Qxe4 13. Bb5+ Kf8 14. Bh6+ Kg8 15. Rh5,This is a game between Morphy (as White) and Lyttleton (as Black). Last move played: White plays Rook to h5,Large advantage for White (eval: 680 centipawns),15... Qg6 16. Rg5 Qxg5 17. Bxg5 h5 18. Qf3 Bg4 19. Qxb7 Kg7 20. Qxa8 c6 21. Qxa7 cxb5 22. Qe7 Nd7 23. Kg1 b4 24. Re1 Rc8 25. Qxd6 Rxc2 ,15. Rh5 Qg6 16. Rg5 Nc6 17. Bxc6 bxc6 18. Qf3 Qxg5 19. Bxg5 h5 20. Qxc6 Bb7 21. Qxb7 Re8 22. Re1 Rxe1 23. Kxe1 Kg7 24. Qxc7 Re8+ 25. Kd2 Re6 
The threat is Re1.,True,", The comment suggests the player attempted to create a threat, potentially leading to a tactical blunder.",1. e4 e5 2. f4 exf4 3. Nf3 g5 4. h4 g4 5. Ne5 d6 6. Nxg4 Be7 7. d4 Bxh4+ 8. Nf2 Bxf2+ 9. Kxf2 Nf6 10. Nc3 Qe7 11. Bxf4 Nxe4+ 12. Nxe4 Qxe4 13. Bb5+ Kf8 14. Bh6+ Kg8 15. Rh5 Bf5 16. Qd2,This is a game between Morphy (as White) and Lyttleton (as Black). Last move played: White plays Queen to d2,Large advantage for White (eval: 771 centipawns),16... Nc6 17. Bxc6 bxc6 18. Re1 f6 19. Rxe4 Bxe4 20. Qf4 Kf7 21. Qxe4 Rae8 22. Qxc6 Re6 23. Qxc7+ Re7 24. Qc4+ Re6 25. Rh3 Re8 26. Re3 Re7 27. Rxe6 Rxe6 28. Qc6 ,16. Qd2 f6 17. Re1 Kf7 18. Rxe4 Bxe4 19. Qf4 Bg6 20. Rh3 Nd7 21. Bxd7 Ke7 22. Bg4 Raf8 23. Qf3 Bxc2 24. Bxf8+ Rxf8 25. Qxb7 Kd8 
"The move that was set-up by 13.Bb5+ finishes the game, as if the queen moves, Re8+ mates.",True," The comment suggests a logical fallacy by claiming the queen move immediately leads to a mate, which is an oversimplification.",1. e4 e5 2. f4 exf4 3. Nf3 g5 4. h4 g4 5. Ne5 d6 6. Nxg4 Be7 7. d4 Bxh4+ 8. Nf2 Bxf2+ 9. Kxf2 Nf6 10. Nc3 Qe7 11. Bxf4 Nxe4+ 12. Nxe4 Qxe4 13. Bb5+ Kf8 14. Bh6+ Kg8 15. Rh5 Bf5 16. Qd2 Bg6 17. Re1,This is a game between Morphy (as White) and Lyttleton (as Black). Last move played: White plays Rook to e1,Large advantage for White (eval: 1076 centipawns),17... d5 18. Rxe4 dxe4 19. Re5 Na6 20. Bxa6 Rb8 21. Bxb7 a5 22. Qf4 e3+ 23. Rxe3 Bxc2 24. Bd5 Bg6 25. Bc4 Rxb2+ 26. Be2 Rxe2+ 27. Rxe2 a4 ,17. Re1 Qxe1+ 18. Qxe1 Nc6 19. Rh3 Ne5 20. dxe5 Rf8 21. Bd7 b6 22. Re3 c5 23. Kg1 d5 24. e6 d4 25. exf7+ Bxf7 
