comment,good,reasoning,moves,context,engine_eval,engine_best_line,engine_best_alternative
A move leading more often to tactical rather than positional play.,True, The comment suggests a potential weakness in the player’s strategic understanding.,1. e4,This is a game between Morphy (as White) and Anderssen (as Black). Last move played: White plays Pawn to e4,Slight advantage for White (eval: 33 centipawns),1... e5 2. Nf3 Nc6 3. d4 exd4 4. Nxd4 Bc5 5. Nb3 Bb6 6. a4 Qh4 7. Qf3 a5 8. g3 Qf6 9. Qe2 Nge7 10. Nc3 ,1. e4 e5 
The Sicilian Defense.,True,", The comment indicates a specific opening choice, suggesting a flawed strategic consideration.",1. e4 c5,This is a game between Morphy (as White) and Anderssen (as Black). Last move played: Black plays Pawn to c5,Slight advantage for White (eval: 34 centipawns),2. Nf3 ,1... e5 2. Nf3 Nc6 3. d4 exd4 4. Nxd4 Bc5 5. Nb3 Bb6 6. a4 Qh4 7. Qf3 a5 8. g3 Qf6 9. Qe2 Nge7 10. Nc3 
Morphy preferred this move order to 2. Nf3 and 3. d4,True," The comment offers a potential reason for the error, suggesting a desired strategic approach.",1. e4 c5 2. d4,This is a game between Morphy (as White) and Anderssen (as Black). Last move played: White plays Pawn to d4,The position is equal,2... cxd4 3. Nf3 e5 4. c3 Nc6 5. Bc4 Nf6 6. Ng5 d5 7. exd5 Na5 8. Bb5+ Bd7 9. Qa4 Be7 10. Nf3 O-O 11. Bxd7 Nxd7 12. cxd4 exd4 13. O-O Rc8 14. Nxd4 Nc5 15. Qd1 Qxd5 16. Nc3 Qd7 17. Ndb5 Nc6 18. Qxd7 Nxd7 19. Nd5 Bc5 20. b4 Nxb4 21. Nxb4 Bxb4 22. Nxa7 Rc4 ,2. Nf3 
Otherwise White has control of the center.,True," The comment suggests White’s position is advantageous, potentially indicating a flawed assessment of the center’s importance.",1. e4 c5 2. d4 cxd4,This is a game between Morphy (as White) and Anderssen (as Black). Last move played: Black plays Pawn takes on d4,The position is equal,3. Nf3 e5 4. c3 Nc6 5. cxd4 exd4 6. Nxd4 Nf6 7. Nc3 Bb4 8. Bc4 O-O 9. O-O Bxc3 10. bxc3 Nxe4 11. Nb5 d6 12. Qd5 a6 13. Qxe4 axb5 14. Bxb5 Re8 15. Qf4 Re5 16. c4 Rf5 17. Qg3 ,2... cxd4 3. Nf3 e5 4. c3 Nc6 5. Bc4 Nf6 6. Ng5 d5 7. exd5 Na5 8. Bb5+ Bd7 9. Qa4 Be7 10. Nf3 O-O 11. Bxd7 Nxd7 12. cxd4 exd4 13. O-O Rc8 14. Nxd4 Nc5 15. Qd1 Qxd5 16. Nc3 Qd7 17. Ndb5 Nc6 18. Qxd7 Nxd7 19. Nd5 Bc5 20. b4 Nxb4 21. Nxb4 Bxb4 22. Nxa7 Rc4 
"Black can protect the pawn with 3... e5 since 4. Nxe5 would lose the knight to 4... Qa5+. However, White gets definite compensation after 4. c3 dxc3 5. Nxc3. Morphy's opponents rarely cared to risk this line.",True," The comment offers a potential explanation for the mistake, suggesting White's compensation is significant.",1. e4 c5 2. d4 cxd4 3. Nf3,This is a game between Morphy (as White) and Anderssen (as Black). Last move played: White plays Knight to f3,The position is equal,3... e5 ,3. Nf3 
"Because this move can give Black a backwards d pawn, it was condemned by the analysts for a long time. Only in the middle of the 20th century was it realized that Black's piece activity provides reasonable compensation for the backwards pawn.",True, The comment explains why the move was considered a mistake by highlighting a specific strategic flaw.,1. e4 c5 2. d4 cxd4 3. Nf3 Nc6 4. Nxd4 e6,This is a game between Morphy (as White) and Anderssen (as Black). Last move played: Black plays Pawn to e6,Advantage for White (eval: 50 centipawns),5. Nc3 ,4... Nf6 5. Nc3 e5 6. Ndb5 d6 7. Bg5 a6 8. Na3 b5 9. Nd5 Be7 10. Bxf6 Bxf6 11. c3 O-O 12. Nc2 Bg5 13. a4 bxa4 14. Rxa4 a5 15. h4 Bh6 16. Bc4 Be6 17. b4 Rb8 18. O-O axb4 19. cxb4 Qxh4 
Threatening 6. Nd6+ Bxd6 7. Qxd6 with an advantage.,True," The comment suggests a potential tactical threat, indicating a flawed evaluation of the position.",1. e4 c5 2. d4 cxd4 3. Nf3 Nc6 4. Nxd4 e6 5. Nb5,This is a game between Morphy (as White) and Anderssen (as Black). Last move played: White plays Knight to b5,Slight advantage for White (eval: 31 centipawns),5... d6 6. c4 ,5. Nc3 
Attacking the pawn again.,True,", The comment indicates a potentially flawed strategic decision based on a repeated attack.",1. e4 c5 2. d4 cxd4 3. Nf3 Nc6 4. Nxd4 e6 5. Nb5 d6 6. Bf4,This is a game between Morphy (as White) and Anderssen (as Black). Last move played: White plays Bishop to f4,The position is equal,6... e5 ,6. c4 Nf6 7. N1c3 a6 8. Na3 Be7 9. Be2 b6 10. O-O Bb7 11. Be3 O-O 12. Qb3 Nd7 13. f3 Qc7 14. Qd1 Rac8 15. Rc1 Nce5 16. Qd2 Rcd8 17. Rcd1 Ng6 18. Bf2 h5 
Now the d pawn is backwards: it will have trouble advancing to d5.,True, The comment accurately describes a potential tactical flaw and its consequence.,1. e4 c5 2. d4 cxd4 3. Nf3 Nc6 4. Nxd4 e6 5. Nb5 d6 6. Bf4 e5,This is a game between Morphy (as White) and Anderssen (as Black). Last move played: Black plays Pawn to e5,The position is equal,7. Be3 Nf6 ,6... e5 
A premature move.,True,", The comment suggests the move was premature, indicating a potential weakness or lack of strategic consideration.",1. e4 c5 2. d4 cxd4 3. Nf3 Nc6 4. Nxd4 e6 5. Nb5 d6 6. Bf4 e5 7. Be3 f5,This is a game between Morphy (as White) and Anderssen (as Black). Last move played: Black plays Pawn to f5,Large advantage for White (eval: 136 centipawns),8. N1c3 f4 ,7... Nf6 
White calmly develops and refutes Black's last move. There is no way for Black to stop the knight from going to d5 where it can then give a fatal check on c7. If 8... Be6 then 9. exf5 Bxf5 10. Nd5. Or if 8... a6 then 9. Nd5 axb5 10. Bb6 Qd7 11. Nc7+ and 12. Nxa8. If 8... Nf6 then 9. Bg5 a6 10. Bxf6 gxf6 11. Qh5+ is good for White.,True," The comment offers a plausible explanation for the mistake, suggesting a strategic deficiency in Black's defense.",1. e4 c5 2. d4 cxd4 3. Nf3 Nc6 4. Nxd4 e6 5. Nb5 d6 6. Bf4 e5 7. Be3 f5 8. N1c3,This is a game between Morphy (as White) and Anderssen (as Black). Last move played: White plays Knight to c3,Large advantage for White (eval: 144 centipawns),8... f4 9. Nd5 fxe3 10. Nbc7+ Kf7 11. Nxa8 Nf6 12. Nac7 exf2+ 13. Kxf2 Nxe4+ 14. Kg1 g6 15. Qf3+ Bf5 16. Bd3 Nd4 17. Qe3 Nc5 18. Rf1 h5 19. Bxf5 gxf5 20. h4 Qc8 ,8. N1c3 f4 
White could now play 11. Nxa8 exf2+ 12. Kxf2 Qh4+ 13. g3 Qxe4 14. Bg2 with an advantage in material.,True," The comment highlights a potential tactical blunder, suggesting White is leaving a piece undefended.",1. e4 c5 2. d4 cxd4 3. Nf3 Nc6 4. Nxd4 e6 5. Nb5 d6 6. Bf4 e5 7. Be3 f5 8. N1c3 f4 9. Nd5 fxe3 10. Nbc7+ Kf7,This is a game between Morphy (as White) and Anderssen (as Black). Last move played: Black plays King to f7,Large advantage for White (eval: 147 centipawns),11. Nxa8 ,10... Kf7 11. Nxa8 exf2+ 12. Kxf2 Qh4+ 13. g3 Qxe4 14. Bg2 Qd4+ 15. Qxd4 Nxd4 16. Nac7 Nf6 17. c3 Ne6 18. Rhf1 Nxc7 19. Nxc7 h5 20. a4 h4 21. a5 hxg3+ 22. hxg3 Be7 23. Nd5 Bd8 24. Nxf6 gxf6 
"Instead White prefers a line with incredible complications. Morphy loved to take risks, and was leading in the match 5.5 to 1.5 (draws count .5).",True," The comment offers a potential explanation for the mistake, suggesting a risky, complex line that could have led to a draw.",1. e4 c5 2. d4 cxd4 3. Nf3 Nc6 4. Nxd4 e6 5. Nb5 d6 6. Bf4 e5 7. Be3 f5 8. N1c3 f4 9. Nd5 fxe3 10. Nbc7+ Kf7 11. Qf3+,This is a game between Morphy (as White) and Anderssen (as Black). Last move played: White plays Queen to f3 with check,The position is equal,11... Nf6 12. Nxf6 Nd4 13. Bc4+ d5 14. Bxd5+ Ke7 15. Qh5 gxf6 16. Nxa8 Nxc2+ 17. Ke2 Nd4+ 18. Kd3 Be6 19. Rac1 Bxd5 20. Rc7+ Kd6 21. exd5 exf2 22. Qf7 Be7 23. Rxb7 Rf8 24. Qg7 Rg8 25. Qxh7 Rh8 26. Qg7 Rg8 ,11. Nxa8 
If now 13... Ke7 14. Nfd5+ Kd7 15. Qf7+ and 16. Nxa8 wins easily.,True," The comment describes a straightforward win condition, indicating a flawed strategic choice.",1. e4 c5 2. d4 cxd4 3. Nf3 Nc6 4. Nxd4 e6 5. Nb5 d6 6. Bf4 e5 7. Be3 f5 8. N1c3 f4 9. Nd5 fxe3 10. Nbc7+ Kf7 11. Qf3+ Nf6 12. Bc4 Nd4 13. Nxf6+,This is a game between Morphy (as White) and Anderssen (as Black). Last move played: White plays Knight takes on f6 with check,The position is equal,13... d5 14. Bxd5+ Ke7 15. Qh5 gxf6 16. Qf7+ Kd6 17. Nxa8 Nxc2+ 18. Ke2 Nd4+ 19. Kd3 exf2 20. Bb3 Bh6 21. Qd5+ Ke7 22. Qf7+ Kd6 ,13. Nxf6+ d5 14. Bxd5+ Ke7 15. Qh5 gxf6 16. Nxa8 Nxc2+ 17. Ke2 Nd4+ 18. Kd3 Be6 19. Rac1 Bxd5 20. Rc7+ Kd6 21. exd5 exf2 22. Qf7 Be7 23. Rxb7 Rf8 24. Qxh7 Rh8 25. Qg7 Rg8 26. Qf7 e4+ 
Here Black should play 14... Ke7 leading to an extremely complicated position after either 15. Ng8+ or 15. Qh5.,True," The comment suggests a highly complex position, indicating a flawed move.",1. e4 c5 2. d4 cxd4 3. Nf3 Nc6 4. Nxd4 e6 5. Nb5 d6 6. Bf4 e5 7. Be3 f5 8. N1c3 f4 9. Nd5 fxe3 10. Nbc7+ Kf7 11. Qf3+ Nf6 12. Bc4 Nd4 13. Nxf6+ d5 14. Bxd5+,This is a game between Morphy (as White) and Anderssen (as Black). Last move played: White plays Bishop takes on d5 with check,The position is equal,14... Ke7 15. Qh5 gxf6 16. Nxa8 Nxc2+ 17. Ke2 Nd4+ 18. Kd3 Be6 19. Rhc1 Bxd5 20. Rc7+ Kd6 21. exd5 exf2 22. Qf7 Be7 23. Rxb7 Rf8 24. Qxh7 Rh8 25. Qf7 Rf8 26. Qh7 ,14. Bxd5+ Ke7 15. Qh5 gxf6 16. Nxa8 Nxc2+ 17. Ke2 Nd4+ 18. Kxe3 Be6 19. Rac1 Bxd5 20. Rc7+ Kd6 21. exd5 Qxa8 22. Qf7 Qd8 23. Rxb7 Bh6+ 24. Kd3 Rf8 25. Qxh7 Rh8 26. Qf7 Rf8 
This loses at once to a fine combination.,True," The comment suggests a tactical blunder, indicating a flawed plan.",1. e4 c5 2. d4 cxd4 3. Nf3 Nc6 4. Nxd4 e6 5. Nb5 d6 6. Bf4 e5 7. Be3 f5 8. N1c3 f4 9. Nd5 fxe3 10. Nbc7+ Kf7 11. Qf3+ Nf6 12. Bc4 Nd4 13. Nxf6+ d5 14. Bxd5+ Kg6,This is a game between Morphy (as White) and Anderssen (as Black). Last move played: Black plays King to g6,Large advantage for White (eval: 456 centipawns),15. Qh5+ Kxf6 16. fxe3 g6 17. Qh4+ g5 18. Qh5 Nxc2+ 19. Ke2 Qxc7 20. Raf1+ Ke7 21. Rf7+ Kd6 22. Rxc7 Kxc7 23. Rc1 Be7 24. Rxc2+ Kd8 25. Rd2 Kc7 26. Qf3 ,14... Ke7 15. Qh5 gxf6 16. Nxa8 Nxc2+ 17. Ke2 Nd4+ 18. Kd3 Be6 19. Rhc1 Bxd5 20. Rc7+ Kd6 21. exd5 exf2 22. Qf7 Be7 23. Rxb7 Rf8 24. Qxh7 Rh8 25. Qf7 Rf8 26. Qh7 
White cannot play 16. Ne8+ because of 16... Qxe8 17. Qxe8 Bb4+ 18. c3 Rxe8. After the obvious attacking move 16. Qf7+ Black plays 16... Kg5 and it is not easy to get at the Black king.,True," The comment accurately describes a specific tactical sequence and why it’s a mistake, highlighting a potential threat.",1. e4 c5 2. d4 cxd4 3. Nf3 Nc6 4. Nxd4 e6 5. Nb5 d6 6. Bf4 e5 7. Be3 f5 8. N1c3 f4 9. Nd5 fxe3 10. Nbc7+ Kf7 11. Qf3+ Nf6 12. Bc4 Nd4 13. Nxf6+ d5 14. Bxd5+ Kg6 15. Qh5+ Kxf6,This is a game between Morphy (as White) and Anderssen (as Black). Last move played: Black plays King takes on f6,Large advantage for White (eval: 416 centipawns),16. fxe3 g6 17. Qh4+ g5 18. O-O+ Nf5 19. Qg4 Qxc7 20. Rxf5+ Bxf5 21. Qxf5+ Ke7 22. Qe6+ Kd8 23. Qf6+ Qe7 24. Qxh8 Qg7 25. Qxg7 Bxg7 26. Re1 ,15... Kxf6 16. fxe3 g6 17. Qh4+ g5 18. O-O+ Nf5 19. Rxf5+ Bxf5 20. Qf2 Qxc7 21. Qxf5+ Ke7 22. Qe6+ Kd8 23. Qf6+ Ke8 24. Qxh8 Qf7 
Now the rook on h1 can come into the game. If 16... Qxc7 17. Rf1+ Ke7 18. Rf7+ Kd6 19. Rxc7.,True," The comment suggests a potential tactical threat, indicating a flaw in the initial move.",1. e4 c5 2. d4 cxd4 3. Nf3 Nc6 4. Nxd4 e6 5. Nb5 d6 6. Bf4 e5 7. Be3 f5 8. N1c3 f4 9. Nd5 fxe3 10. Nbc7+ Kf7 11. Qf3+ Nf6 12. Bc4 Nd4 13. Nxf6+ d5 14. Bxd5+ Kg6 15. Qh5+ Kxf6 16. fxe3,This is a game between Morphy (as White) and Anderssen (as Black). Last move played: White plays Pawn takes on e3,Large advantage for White (eval: 427 centipawns),16... g6 17. Qh4+ g5 18. Qh5 Nxc2+ 19. Ke2 Ke7 20. Raf1 Kd6 21. Rf7 Be7 22. Nxa8 Be6 23. Rd1 Qa5 24. Bxe6+ Kxe6 25. Rxe7+ Kxe7 26. Qxg5+ Ke8 27. Qf6 Qb5+ 28. Kf2 ,16. fxe3 g6 17. Qh4+ g5 18. O-O+ Nf5 19. Qg4 Qxc7 20. Rxf5+ Bxf5 21. Qxf5+ Ke7 22. Qe6+ Kd8 23. Qf6+ Qe7 24. Qxh8 Qg7 25. Qxg7 Bxg7 26. Re1 
and Black resigned. If 17... Nxa1 then 18. Ne8+ Ke7 19. Qf7#. If 17... Qxc7 then 18. Rhf1+ Kd7 19. Rf7+ Kd8 20. Rxc7 Kxc7 21. Rc1,True," The comment provides a detailed sequence of moves that leads to a resignation, indicating a flawed strategic decision.",1. e4 c5 2. d4 cxd4 3. Nf3 Nc6 4. Nxd4 e6 5. Nb5 d6 6. Bf4 e5 7. Be3 f5 8. N1c3 f4 9. Nd5 fxe3 10. Nbc7+ Kf7 11. Qf3+ Nf6 12. Bc4 Nd4 13. Nxf6+ d5 14. Bxd5+ Kg6 15. Qh5+ Kxf6 16. fxe3 Nxc2+ 17. Ke2,This is a game between Morphy (as White) and Anderssen (as Black). Last move played: White plays King to e2,Large advantage for White (eval: 465 centipawns),17... Qxc7 18. Raf1+ Ke7 19. Rf7+ Kd6 20. Rxc7 Kxc7 21. Rc1 Bd6 22. Rxc2+ Kb6 23. Qf7 Rb8 24. Qxg7 Rd8 25. Qh6 a6 26. h3 Ka7 27. Kf2 Bb4 28. a3 Rd6 29. Qg7 Bd7 ,17. Ke2 Qxc7 18. Raf1+ Ke7 19. Rf7+ Kd8 20. Rxc7 Kxc7 21. Rc1 Kb6 22. Rxc2 Bd6 23. Qf7 Rb8 24. Qxg7 Rd8 25. Qh6 Bg4+ 26. Kf2 a6 27. h3 Bd1 28. Rd2 Ba4 29. Kg1 Rbc8 30. Rf2 Rc1+ 31. Kh2 Rc7 32. Rf6 
A move leading more often to tactical rather than positional play.,True," The comment identifies a potential weakness in the opponent’s position, suggesting a strategic flaw.",1. e4,This is a game between Morphy (as White) and Anderssen (as Black). Last move played: White plays Pawn to e4,Slight advantage for White (eval: 33 centipawns),1... e5 2. Nf3 Nc6 3. d4 exd4 4. Nxd4 Bc5 5. Nb3 Bb6 6. a4 Qh4 7. Qf3 a5 8. g3 Qf6 9. Qe2 Nge7 10. Nc3 ,1. e4 e5 
The Sicilian Defense.,True," The comment suggests a potential tactical threat, indicating a flawed assessment of the position.",1. e4 c5,This is a game between Morphy (as White) and Anderssen (as Black). Last move played: Black plays Pawn to c5,Slight advantage for White (eval: 34 centipawns),2. Nf3 ,1... e5 2. Nf3 Nc6 3. d4 exd4 4. Nxd4 Bc5 5. Nb3 Bb6 6. a4 Qh4 7. Qf3 a5 8. g3 Qf6 9. Qe2 Nge7 10. Nc3 
