comment,good,reasoning,moves,context,engine_eval,engine_best_line,engine_best_alternative
"This is one of the sharpest variations of the French Defense. It was the subject of a number of important World Championship games, with Botvinnik playing the Black side against both Smyslov and Tal.",True," The comment provides context about the move's historical significance, suggesting a potential mistake based on its importance in the game.",1. e4 e6 2. d4 d5 3. Nc3 Bb4 4. e5 c5 5. a3 Bxc3+ 6. bxc3,This is a game between Tal (as White) and Botvinnik (as Black). Last move played: White plays Pawn takes on c3,Advantage for White (eval: 76 centipawns),6... Ne7 7. h4 ,6. bxc3 
"This variation is no longer popular, having been replaced by 6...Ne7.",True," The comment indicates a shift in popular openings, suggesting a move that was once considered strong is now less favored.",1. e4 e6 2. d4 d5 3. Nc3 Bb4 4. e5 c5 5. a3 Bxc3+ 6. bxc3 Qc7,This is a game between Tal (as White) and Botvinnik (as Black). Last move played: Black plays Queen to c7,Advantage for White (eval: 66 centipawns),7. a4 Ne7 8. Nf3 h6 9. h4 b6 10. Bb5+ Bd7 11. Be2 Nbc6 12. Qd2 f6 13. exf6 gxf6 14. dxc5 bxc5 15. O-O Kf7 16. h5 Rhg8 ,6... Ne7 7. h4 
"A very aggressive move typical of the Winawer Variation of the French. But the more solid 7.Nf3 is now preferred, having been honed into a fine weapon by Anatoly Karpov.",True," The comment suggests a potential strategic shift, indicating the move was considered suboptimal.",1. e4 e6 2. d4 d5 3. Nc3 Bb4 4. e5 c5 5. a3 Bxc3+ 6. bxc3 Qc7 7. Qg4,This is a game between Tal (as White) and Botvinnik (as Black). Last move played: White plays Queen to g4,Advantage for White (eval: 64 centipawns),7... Ne7 8. Qxg7 Rg8 9. Qxh7 cxd4 10. Ne2 Nbc6 11. h4 dxc3 12. Rb1 Bd7 13. Bg5 O-O-O 14. Qd3 Nxe5 15. Qxc3 N5c6 16. Nd4 Qe5+ 17. Qe3 Qxe3+ 18. fxe3 ,7. a4 Ne7 8. Nf3 h6 9. h4 b6 10. Bb5+ Bd7 11. Be2 Nbc6 12. Qd2 f6 13. exf6 gxf6 14. dxc5 bxc5 15. O-O Kf7 16. h5 Rhg8 
"The main lines of the Winawer could still have been reached had Black chosen to develop the knight. Unlike most World Championship matches, which start out like boxing matches with a cautious first round, this is an early slugfest. 7...Ne7 8.Qxg7 Rg8 9.Qxh7 cxd4 10.Kd1 This is a popular line, similar to the game, which is known as the ""Life or Death Variation"".",True," The comment offers a potential explanation for the mistake, suggesting a strategic alternative to the initial move.",1. e4 e6 2. d4 d5 3. Nc3 Bb4 4. e5 c5 5. a3 Bxc3+ 6. bxc3 Qc7 7. Qg4 f5,This is a game between Tal (as White) and Botvinnik (as Black). Last move played: Black plays Pawn to f5,Large advantage for White (eval: 134 centipawns),8. Qg3 ,7... Ne7 
The difference between this and the line in the previous note is that here the queen cannot easily retreat to help defend the king.,True, The comment suggests a missed opportunity for a defensive maneuver.,1. e4 e6 2. d4 d5 3. Nc3 Bb4 4. e5 c5 5. a3 Bxc3+ 6. bxc3 Qc7 7. Qg4 f5 8. Qg3 Ne7 9. Qxg7 Rg8 10. Qxh7,This is a game between Tal (as White) and Botvinnik (as Black). Last move played: White plays Queen takes on h7,Large advantage for White (eval: 154 centipawns),10... cxd4 11. Ne2 ,10. Qxh7 cxd4 
This forces White to weaken the a4-d1 diagonal.,True," Yes, the comment suggests a potential weakness in the opponent's pawn structure, indicating a flawed strategic choice.",1. e4 e6 2. d4 d5 3. Nc3 Bb4 4. e5 c5 5. a3 Bxc3+ 6. bxc3 Qc7 7. Qg4 f5 8. Qg3 Ne7 9. Qxg7 Rg8 10. Qxh7 cxd4 11. Kd1 Bd7 12. Qh5+ Ng6 13. Ne2 d3,This is a game between Tal (as White) and Botvinnik (as Black). Last move played: Black plays Pawn to d3,Large advantage for White (eval: 114 centipawns),14. cxd3 d4 ,13... d3 14. cxd3 d4 15. cxd4 Nc6 16. Bd2 Qb6 17. Rc1 O-O-O 18. h4 Kb8 19. Ke1 Nxd4 20. Nxd4 Qxd4 21. Qg5 Bc6 22. Rh3 Nxe5 23. Qf4 Bxg2 24. Bxg2 Rxg2 25. Qxd4 Rxd4 26. Kf1 Rg8 27. Bc3 
"An obvious move but it is actually a bit slow. In order to attack successfully Black needs more power, and so developing the Nb8 would have been better. 15...Nc6 16.f4 O-O-O 17.Bd2 Tal notes that sooner or later Black will sacrifice the knight at e5, with complications which are hard.",True," The comment suggests a strategic flaw in Black's development, indicating a potential tactical mistake.",1. e4 e6 2. d4 d5 3. Nc3 Bb4 4. e5 c5 5. a3 Bxc3+ 6. bxc3 Qc7 7. Qg4 f5 8. Qg3 Ne7 9. Qxg7 Rg8 10. Qxh7 cxd4 11. Kd1 Bd7 12. Qh5+ Ng6 13. Ne2 d3 14. cxd3 Ba4+ 15. Ke1 Qxe5,This is a game between Tal (as White) and Botvinnik (as Black). Last move played: Black plays Queen takes on e5,Large advantage for White (eval: 201 centipawns),16. d4 Qc7 ,15... d4 
"The point of this move is not to advance the passed pawn. Instead, it prepares a rook lift Rh1-h3-e3.",True, The comment clarifies the move's purpose by highlighting a strategic objective.,1. e4 e6 2. d4 d5 3. Nc3 Bb4 4. e5 c5 5. a3 Bxc3+ 6. bxc3 Qc7 7. Qg4 f5 8. Qg3 Ne7 9. Qxg7 Rg8 10. Qxh7 cxd4 11. Kd1 Bd7 12. Qh5+ Ng6 13. Ne2 d3 14. cxd3 Ba4+ 15. Ke1 Qxe5 16. Bg5 Nc6 17. d4 Qc7 18. h4,This is a game between Tal (as White) and Botvinnik (as Black). Last move played: White plays Pawn to h4,Large advantage for White (eval: 206 centipawns),18... e5 19. Qf3 Qf7 20. dxe5 Ngxe5 21. Qh3 Kd7 22. Nf4 Rae8 23. Be2 Kc8 24. Kf1 Kb8 25. Qe3 Bb3 26. Kg1 Bc4 27. Qd2 Ka8 28. Bxc4 dxc4 29. Rd1 ,18. h4 
This pin is important not because it wins the knight (it doesn't) but rather because it forces the Black king to move off of the e-file. White is beginning to establish an initiative.,True," The comment offers a justification for the move's evaluation, suggesting a strategic advantage rather than a direct tactical gain.",1. e4 e6 2. d4 d5 3. Nc3 Bb4 4. e5 c5 5. a3 Bxc3+ 6. bxc3 Qc7 7. Qg4 f5 8. Qg3 Ne7 9. Qxg7 Rg8 10. Qxh7 cxd4 11. Kd1 Bd7 12. Qh5+ Ng6 13. Ne2 d3 14. cxd3 Ba4+ 15. Ke1 Qxe5 16. Bg5 Nc6 17. d4 Qc7 18. h4 e5 19. Rh3 Qf7 20. dxe5 Ncxe5 21. Re3,This is a game between Tal (as White) and Botvinnik (as Black). Last move played: White plays Rook to e3,Large advantage for White (eval: 188 centipawns),21... Kd7 ,21. Re3 Kd7 22. Rb1 Bc6 23. Nd4 f4 24. Rxe5 Nxe5 25. Qxf7+ Nxf7 26. Bxf4 Rg4 27. g3 Rxf4 28. Bh3+ Ke7 29. gxf4 Rh8 30. Bg4 Nd6 31. Nxc6+ bxc6 32. h5 Rf8 33. f3 Rxf4 34. Kf2 Kf6 35. Rh1 Rc4 36. h6 Nf7 37. h7 Kg7 38. Bf5 Rxc3 39. Re1 Ng5 
The bishop is no longer doing much at a4 and so 22...Bc6 might have been a wiser move.,True," The comment suggests a potential weakness in the bishop’s position, indicating a flaw in the previous move.",1. e4 e6 2. d4 d5 3. Nc3 Bb4 4. e5 c5 5. a3 Bxc3+ 6. bxc3 Qc7 7. Qg4 f5 8. Qg3 Ne7 9. Qxg7 Rg8 10. Qxh7 cxd4 11. Kd1 Bd7 12. Qh5+ Ng6 13. Ne2 d3 14. cxd3 Ba4+ 15. Ke1 Qxe5 16. Bg5 Nc6 17. d4 Qc7 18. h4 e5 19. Rh3 Qf7 20. dxe5 Ncxe5 21. Re3 Kd7 22. Rb1 b6,This is a game between Tal (as White) and Botvinnik (as Black). Last move played: Black plays Pawn to b6,Large advantage for White (eval: 290 centipawns),23. Nf4 Rae8 24. Rb4 Bc6 25. Nxg6 Rxg6 26. Be2 Rgg8 27. Kf1 Qf8 28. Qh7+ Rg7 29. Qh6 Qg8 30. Bf4 Re6 31. Qh5 Rxg2 32. Bg3 Nc4 33. Kxg2 Nxe3+ 34. Kh2 Nc4 35. Qxf5 a5 36. Bxc4 axb4 ,22... Bc6 23. Nd4 f4 24. Rxe5 Nxe5 25. Qxf7+ Nxf7 26. Bxf4 Rg4 27. g3 Rxf4 28. Bh3+ Ke7 29. gxf4 Rh8 30. Bg4 Kf6 31. h5 Rg8 32. f3 Nh6 33. Kd2 Nxg4 34. fxg4 Rxg4 35. Rh1 Kg7 36. Ke2 Bd7 37. h6+ Kh7 38. Kf3 b6 39. Rh2 Rg1 40. f5 
White now enjoys a clear initiative. Black remains on the defensive for the rest of the game.,True," The comment suggests a defensive strategy, implying the move was a mistake.",1. e4 e6 2. d4 d5 3. Nc3 Bb4 4. e5 c5 5. a3 Bxc3+ 6. bxc3 Qc7 7. Qg4 f5 8. Qg3 Ne7 9. Qxg7 Rg8 10. Qxh7 cxd4 11. Kd1 Bd7 12. Qh5+ Ng6 13. Ne2 d3 14. cxd3 Ba4+ 15. Ke1 Qxe5 16. Bg5 Nc6 17. d4 Qc7 18. h4 e5 19. Rh3 Qf7 20. dxe5 Ncxe5 21. Re3 Kd7 22. Rb1 b6 23. Nf4,This is a game between Tal (as White) and Botvinnik (as Black). Last move played: White plays Knight to f4,Large advantage for White (eval: 275 centipawns),23... Rae8 24. Rb4 Bc6 25. Nxg6 Nxg6 26. Bd3 Kc8 27. Rxe8+ Rxe8+ 28. Kf1 Kb7 29. Rd4 Qe6 30. Kg1 Qe1+ 31. Bf1 Ne5 32. Rd1 Qe4 33. f3 Qc2 34. Qh7+ Nd7 35. Rc1 Qb2 36. Qxf5 Qxa3 37. h5 ,23. Nf4 Rae8 24. Rb4 Bc6 25. Nxg6 Rxg6 26. Be2 Rgg8 27. Kf1 Qf8 28. Qh7+ Rg7 29. Qh6 Qg8 30. Bf4 Re6 31. Qh5 Rxg2 32. Bg3 Nc4 33. Kxg2 Nxe3+ 34. Kh2 Nc4 35. Qxf5 a5 36. Bxc4 axb4 
23...Rh8 24.Nxg6 Nxg6 25. Qe2 and the queen attacks from the other flank by moving to a6!,True," The comment describes a potential tactical threat, suggesting a misjudgment of the board position.",1. e4 e6 2. d4 d5 3. Nc3 Bb4 4. e5 c5 5. a3 Bxc3+ 6. bxc3 Qc7 7. Qg4 f5 8. Qg3 Ne7 9. Qxg7 Rg8 10. Qxh7 cxd4 11. Kd1 Bd7 12. Qh5+ Ng6 13. Ne2 d3 14. cxd3 Ba4+ 15. Ke1 Qxe5 16. Bg5 Nc6 17. d4 Qc7 18. h4 e5 19. Rh3 Qf7 20. dxe5 Ncxe5 21. Re3 Kd7 22. Rb1 b6 23. Nf4 Rae8,This is a game between Tal (as White) and Botvinnik (as Black). Last move played: Black plays Rook to e8,Large advantage for White (eval: 270 centipawns),24. Rb4 Bc6 25. Nxg6 Nxg6 26. Bd3 Re4 27. Bxe4 dxe4 28. Kf1 Kc8 29. a4 Kb7 30. a5 Qd5 31. Rd4 Qa2 32. Qd1 Ne5 ,23... Rae8 24. Rb4 Bc6 25. Nxg6 Nxg6 26. Bd3 Kc8 27. Rxe8+ Rxe8+ 28. Kf1 Kb7 29. Rd4 Qe6 30. Kg1 Qe1+ 31. Bf1 Ne5 32. Rd1 Qe4 33. f3 Qc2 34. Qh7+ Nd7 35. Rc1 Qb2 36. Qxf5 Qxa3 37. h5 
Now we see that 22...b6 was just a waste of time.,True," Yes, the comment indicates a perceived lack of value in the move, suggesting a suboptimal strategic choice.",1. e4 e6 2. d4 d5 3. Nc3 Bb4 4. e5 c5 5. a3 Bxc3+ 6. bxc3 Qc7 7. Qg4 f5 8. Qg3 Ne7 9. Qxg7 Rg8 10. Qxh7 cxd4 11. Kd1 Bd7 12. Qh5+ Ng6 13. Ne2 d3 14. cxd3 Ba4+ 15. Ke1 Qxe5 16. Bg5 Nc6 17. d4 Qc7 18. h4 e5 19. Rh3 Qf7 20. dxe5 Ncxe5 21. Re3 Kd7 22. Rb1 b6 23. Nf4 Rae8 24. Rb4 Bc6,This is a game between Tal (as White) and Botvinnik (as Black). Last move played: Black plays Bishop to c6,Large advantage for White (eval: 283 centipawns),25. Nxg6 Nxg6 26. Bd3 Kc7 27. Rxe8 Rxe8+ 28. Kf1 Kb7 29. Rd4 Qe6 30. Kg1 Qe1+ 31. Bf1 Ne5 32. Rd1 Qe4 33. Rd2 Qe1 34. Re2 Qa1 35. Qh7+ Bd7 36. h5 Qxc3 37. Qg7 ,24... Bc6 25. Nxg6 Nxg6 26. Bd3 Re4 27. Bxe4 dxe4 28. Qe2 Kc7 29. Rd4 Kb7 30. Qc4 Qh7 31. Qe6 Nf8 32. Qe7+ Qxe7 33. Bxe7 Ne6 34. Rd6 Nf4 35. Rg3 Nxg2+ 36. Kf1 Nxh4 37. Bxh4 Rxg3 38. fxg3 
"Her mission accomplished on the kingside, the queen returns home.",True,". The comment suggests the queen is returning to the back rank, which contradicts the strategic goal of maintaining control of the kingside.",1. e4 e6 2. d4 d5 3. Nc3 Bb4 4. e5 c5 5. a3 Bxc3+ 6. bxc3 Qc7 7. Qg4 f5 8. Qg3 Ne7 9. Qxg7 Rg8 10. Qxh7 cxd4 11. Kd1 Bd7 12. Qh5+ Ng6 13. Ne2 d3 14. cxd3 Ba4+ 15. Ke1 Qxe5 16. Bg5 Nc6 17. d4 Qc7 18. h4 e5 19. Rh3 Qf7 20. dxe5 Ncxe5 21. Re3 Kd7 22. Rb1 b6 23. Nf4 Rae8 24. Rb4 Bc6 25. Qd1,This is a game between Tal (as White) and Botvinnik (as Black). Last move played: White plays Queen to d1,Large advantage for White (eval: 249 centipawns),25... Nxf4 26. Rxf4 Ng6 27. Rd4 Kc7 28. Be2 Re4 29. Kf1 Kb7 30. Qd2 Qh7 31. f3 Nxh4 32. fxe4 Nxg2 33. Rg3 dxe4 34. Rxg2 Qh1+ 35. Rg1 ,25. Nxg6 Nxg6 26. Bd3 Kc7 27. Rxe8 Rxe8+ 28. Kf1 Kb7 29. Rd4 Qe6 30. Kg1 Qe1+ 31. Bf1 Ne5 32. Rd1 Qe4 33. Rd2 Qe1 34. Re2 Qa1 35. Qh7+ Bd7 36. h5 Qxc3 37. Qg7 
"25...Ng4 26.Rxe8 Rxe8+ 27.Ne2 Black is in deep trouble, and has no real compensation for the passed pawn on the h-file.",True, The comment accurately identifies a significant positional weakness and the consequences of the pawn vulnerability.,1. e4 e6 2. d4 d5 3. Nc3 Bb4 4. e5 c5 5. a3 Bxc3+ 6. bxc3 Qc7 7. Qg4 f5 8. Qg3 Ne7 9. Qxg7 Rg8 10. Qxh7 cxd4 11. Kd1 Bd7 12. Qh5+ Ng6 13. Ne2 d3 14. cxd3 Ba4+ 15. Ke1 Qxe5 16. Bg5 Nc6 17. d4 Qc7 18. h4 e5 19. Rh3 Qf7 20. dxe5 Ncxe5 21. Re3 Kd7 22. Rb1 b6 23. Nf4 Rae8 24. Rb4 Bc6 25. Qd1 Nxf4,This is a game between Tal (as White) and Botvinnik (as Black). Last move played: Black plays Knight takes on f4,Large advantage for White (eval: 230 centipawns),26. Bxf4 Ng4 27. Rxe8 Rxe8+ 28. Be2 Qe7 29. Qd3 Kc8 30. Bg5 Qc5 31. Qxf5+ Bd7 32. Qf3 Nh2 33. Qd3 Ng4 34. Qd4 Qd6 35. Qd2 Qc5 36. Rd4 Bb5 37. Be3 Bxe2 38. Kxe2 Qb5+ 39. Ke1 Nxe3 40. fxe3 Qb1+ 41. Kf2 ,25... Nxf4 26. Rxf4 Ng6 27. Rd4 Kc7 28. Be2 Re4 29. Kf1 Kb7 30. Qd2 Qh7 31. f3 Nxh4 32. fxe4 Nxg2 33. Rg3 dxe4 34. Rxg2 Qh1+ 35. Rg1 
White's extra pawn is becoming important.,True,", The comment suggests a potential weakness in the pawn structure, indicating a flaw in the move's strategic implications.",1. e4 e6 2. d4 d5 3. Nc3 Bb4 4. e5 c5 5. a3 Bxc3+ 6. bxc3 Qc7 7. Qg4 f5 8. Qg3 Ne7 9. Qxg7 Rg8 10. Qxh7 cxd4 11. Kd1 Bd7 12. Qh5+ Ng6 13. Ne2 d3 14. cxd3 Ba4+ 15. Ke1 Qxe5 16. Bg5 Nc6 17. d4 Qc7 18. h4 e5 19. Rh3 Qf7 20. dxe5 Ncxe5 21. Re3 Kd7 22. Rb1 b6 23. Nf4 Rae8 24. Rb4 Bc6 25. Qd1 Nxf4 26. Rxf4 Ng6 27. Rd4 Rxe3+ 28. fxe3,This is a game between Tal (as White) and Botvinnik (as Black). Last move played: White plays Pawn takes on e3,Large advantage for White (eval: 349 centipawns),28... Kc7 29. c4 Kb7 30. cxd5 Bd7 31. Kf2 Ne5 32. Kg1 Rc8 33. Qd2 Rc5 34. Be2 Ng4 35. Bf4 Qh7 36. Qe1 a5 37. Bxg4 fxg4 38. Bg3 Qf5 ,28. fxe3 Kc8 29. c4 Kb7 30. Kf2 Rh8 31. cxd5 Bd7 32. g3 Rc8 33. Kg1 Rc3 34. d6 Qa2 35. Bg2+ Kc8 
This opening of the c- and d-files seals the victory.,True,". The comment suggests a passive and ultimately unsuccessful strategy, indicating a flaw in the opening choice.",1. e4 e6 2. d4 d5 3. Nc3 Bb4 4. e5 c5 5. a3 Bxc3+ 6. bxc3 Qc7 7. Qg4 f5 8. Qg3 Ne7 9. Qxg7 Rg8 10. Qxh7 cxd4 11. Kd1 Bd7 12. Qh5+ Ng6 13. Ne2 d3 14. cxd3 Ba4+ 15. Ke1 Qxe5 16. Bg5 Nc6 17. d4 Qc7 18. h4 e5 19. Rh3 Qf7 20. dxe5 Ncxe5 21. Re3 Kd7 22. Rb1 b6 23. Nf4 Rae8 24. Rb4 Bc6 25. Qd1 Nxf4 26. Rxf4 Ng6 27. Rd4 Rxe3+ 28. fxe3 Kc7 29. c4,This is a game between Tal (as White) and Botvinnik (as Black). Last move played: White plays Pawn to c4,Large advantage for White (eval: 352 centipawns),29... Kb7 30. cxd5 Bd7 31. Kf2 Ne5 32. Kg1 Rc8 33. Qd2 Rc5 34. e4 fxe4 35. Rxe4 Rxd5 36. Qf4 Qf5 37. Be2 a5 38. Re3 b5 39. h5 Nc6 40. Rg3 Ne5 41. Qxf5 Bxf5 42. Bf4 ,29. c4 Kb7 30. cxd5 Bd7 31. Kf2 Ne5 32. Kg1 Rc8 33. Be2 Rc5 34. a4 Qg7 35. Bb5 Bxb5 36. axb5 Rxb5 37. d6 Qd7 38. h5 Ng4 39. Rc4 a5 40. Rc7+ Qxc7 41. dxc7 
29...Ne7 30. cxd5 Bxd5 31.Bxe7 Qxe7 32.Qc1+ Bc6 33.Bb5 Rg6 34.Rc4 Qd7 35.Bxc6 Rxc6 36.Rxc6+ Qxc6 37.Qxc6+ Kxc6 38.h5,True," The comment describes a series of connected moves that lead to a forced checkmate, indicating a significant tactical error.",1. e4 e6 2. d4 d5 3. Nc3 Bb4 4. e5 c5 5. a3 Bxc3+ 6. bxc3 Qc7 7. Qg4 f5 8. Qg3 Ne7 9. Qxg7 Rg8 10. Qxh7 cxd4 11. Kd1 Bd7 12. Qh5+ Ng6 13. Ne2 d3 14. cxd3 Ba4+ 15. Ke1 Qxe5 16. Bg5 Nc6 17. d4 Qc7 18. h4 e5 19. Rh3 Qf7 20. dxe5 Ncxe5 21. Re3 Kd7 22. Rb1 b6 23. Nf4 Rae8 24. Rb4 Bc6 25. Qd1 Nxf4 26. Rxf4 Ng6 27. Rd4 Rxe3+ 28. fxe3 Kc7 29. c4 dxc4,This is a game between Tal (as White) and Botvinnik (as Black). Last move played: Black plays Pawn takes on c4,Large advantage for White (eval: 472 centipawns),30. Bxc4 Qe8 31. Bxg8 Qxg8 32. Qc2 f4 33. Rc4 Qe8 34. Rxc6+ Qxc6 35. Bxf4+ Kb7 36. Qxc6+ Kxc6 37. h5 Nf8 38. e4 Kd7 39. Ke2 Ke6 40. g4 a5 41. Bd2 ,29... Kb7 30. cxd5 Bd7 31. Kf2 Ne5 32. Kg1 Rc8 33. Qd2 Rc5 34. e4 fxe4 35. Rxe4 Rxd5 36. Qf4 Qf5 37. Be2 a5 38. Re3 b5 39. h5 Nc6 40. Rg3 Ne5 41. Qxf5 Bxf5 42. Bf4 
"This is one of the sharpest variations of the French Defense. It was the subject of a number of important World Championship games, with Botvinnik playing the Black side against both Smyslov and Tal.",True," The comment provides context about the move's history and the player's advice, suggesting a flawed strategic choice.",1. e4 e6 2. d4 d5 3. Nc3 Bb4 4. e5 c5 5. a3 Bxc3+ 6. bxc3,This is a game between Tal (as White) and Botvinnik (as Black). Last move played: White plays Pawn takes on c3,Advantage for White (eval: 76 centipawns),6... Ne7 7. h4 ,6. bxc3 
"A very aggressive move typical of the Winawer Variation of the French. But the more solid 7.Nf3 is now preferred, having been honed into a fine weapon by Anatoly Karpov.",True," The comment offers a potential explanation for the mistake, suggesting a strong attack.",1. e4 e6 2. d4 d5 3. Nc3 Bb4 4. e5 c5 5. a3 Bxc3+ 6. bxc3 Qc7 7. Qg4,This is a game between Tal (as White) and Botvinnik (as Black). Last move played: White plays Queen to g4,Advantage for White (eval: 64 centipawns),7... Ne7 8. Qxg7 Rg8 9. Qxh7 cxd4 10. Ne2 Nbc6 11. h4 dxc3 12. Rb1 Bd7 13. Bg5 O-O-O 14. Qd3 Nxe5 15. Qxc3 N5c6 16. Nd4 Qe5+ 17. Qe3 Qxe3+ 18. fxe3 ,7. a4 Ne7 8. Nf3 h6 9. h4 b6 10. Bb5+ Bd7 11. Be2 Nbc6 12. Qd2 f6 13. exf6 gxf6 14. dxc5 bxc5 15. O-O Kf7 16. h5 Rhg8 
The difference between this and the line in the previous note is that here the queen cannot easily retreat to help defend the king.,True," The comment suggests a vulnerability in Black’s king safety, indicating a flawed strategic decision.",1. e4 e6 2. d4 d5 3. Nc3 Bb4 4. e5 c5 5. a3 Bxc3+ 6. bxc3 Qc7 7. Qg4 f5 8. Qg3 Ne7 9. Qxg7 Rg8 10. Qxh7,This is a game between Tal (as White) and Botvinnik (as Black). Last move played: White plays Queen takes on h7,Large advantage for White (eval: 154 centipawns),10... cxd4 11. Ne2 ,10. Qxh7 cxd4 
12...Kd8 13.Bg5 White has a strong attack.,True," The comment offers a potential explanation for the mistake, suggesting a defensive strategy.",1. e4 e6 2. d4 d5 3. Nc3 Bb4 4. e5 c5 5. a3 Bxc3+ 6. bxc3 Qc7 7. Qg4 f5 8. Qg3 Ne7 9. Qxg7 Rg8 10. Qxh7 cxd4 11. Kd1 Bd7 12. Qh5+ Ng6,This is a game between Tal (as White) and Botvinnik (as Black). Last move played: Black plays Knight to g6,Large advantage for White (eval: 118 centipawns),13. Rb1 ,12... Kd8 13. cxd4 
"This variation is no longer popular, having been replaced by 6...Ne7.",True," The comment provides a potential explanation of the error, suggesting a line of attack that was not properly considered.",1. e4 e6 2. d4 d5 3. Nc3 Bb4 4. e5 c5 5. a3 Bxc3+ 6. bxc3 Qc7,This is a game between Tal (as White) and Botvinnik (as Black). Last move played: Black plays Queen to c7,Advantage for White (eval: 66 centipawns),7. a4 Ne7 8. Nf3 h6 9. h4 b6 10. Bb5+ Bd7 11. Be2 Nbc6 12. Qd2 f6 13. exf6 gxf6 14. dxc5 bxc5 15. O-O Kf7 16. h5 Rhg8 ,6... Ne7 7. h4 
