comment,good,reasoning,moves,context,engine_eval,engine_best_line,engine_best_alternative
"Ponomariov's two previous games were decisive, so it will be interesting to see if he enters into complications or steers to a quiet draw. Ponomariov was ""odd man out"" round three and didn't play.",True," The comment suggests the player’s move was a mistake due to Ponomariov’s previous strong performances, potentially leading to a drawn position.",1. e4,"This is a game between Ponomariov, Ruslan (as White) and Shirov, Alexei (as Black). Last move played: White plays Pawn to e4",Slight advantage for White (eval: 33 centipawns),1... e5 2. Nf3 Nc6 3. d4 exd4 4. Nxd4 Bc5 5. Nb3 Bb6 6. a4 Qh4 7. Qf3 a5 8. g3 Qf6 9. Qe2 Nge7 10. Nc3 ,1. e4 e5 
"It hasn't been that long ago players wouldn't play 3...e5. It was feared White could use the c4-f7 diagonal. But, in the past year or so 3...e5 has been seen quite a few times. For the time being f2-f4 is blocked by Nf3 and Black's pawns prevent d2-d4, so White will necessarily lose time reorganizing. In the long run Black's weak d5 may tell, but he should be able to develop pieces actively.",True," The comment provides a plausible explanation for the move's perceived weakness, suggesting a strategic shift and highlighting potential future complications.",1. e4 c5 2. Nf3 Nc6 3. Nc3 e5,"This is a game between Ponomariov, Ruslan (as White) and Shirov, Alexei (as Black). Last move played: Black plays Pawn to e5",Slight advantage for White (eval: 30 centipawns),4. Bc4 Be7 ,3... e5 4. Bc4 
"He is trading his ""bad bishop"" (the one which clashes with his central pawns) for a White knight which might maneuver Nd2-f1-e3-d5. Whether this is necessary isn't clear, but it is consistent positional play.",True," The comment suggests a potential strategic flaw in the move, indicating a misjudgment of positional implications.",1. e4 c5 2. Nf3 Nc6 3. Nc3 e5 4. Bc4 d6 5. d3 Be7 6. Nd2 Bg5 7. h4 Bxd2+,"This is a game between Ponomariov, Ruslan (as White) and Shirov, Alexei (as Black). Last move played: Black plays Bishop takes on d2 with check",Advantage for White (eval: 57 centipawns),8. Qxd2 ,7... Bh6 8. Qh5 g6 9. Qd1 Nf6 10. Nd5 Nh5 11. g4 Nf4 12. a4 Be6 13. c3 O-O 14. g5 Bg7 15. Nf1 Bxd5 16. Bxd5 Nxd5 17. exd5 Ne7 18. c4 Nf5 19. Nd2 f6 20. h5 
"I'm not certain I like this move, but ...Ng8-e7 has some problems too. Qd8 needs room to move, to give Ke8 an option to O-O-O. That means he needs ...Bc8-e6 and perhaps ...Qd8-d7. It's not clear what's required and what's optional here. After all, after the game move White can't maintain a pin on Nf6 with 9. Bg5 in light of 9...h6.",True," The comment highlights a potential weakness in the move's development and strategic planning, suggesting a need for more space and a specific tactical response.",1. e4 c5 2. Nf3 Nc6 3. Nc3 e5 4. Bc4 d6 5. d3 Be7 6. Nd2 Bg5 7. h4 Bxd2+ 8. Bxd2 Nf6,"This is a game between Ponomariov, Ruslan (as White) and Shirov, Alexei (as Black). Last move played: Black plays Knight to f6",Advantage for White (eval: 55 centipawns),9. Bb5 Bd7 ,8... Nf6 9. Bg5 h6 10. Bxf6 Qxf6 11. Nd5 Qd8 12. Ne3 Be6 13. c3 Qf6 14. Qe2 Qg6 15. g3 h5 16. a4 Bxc4 17. Nxc4 O-O 18. O-O-O f5 
"Now Black's ready for ...a7-a6 and ...b7-b5 to squeeze White's queen-side, particularly the bishop, and perhaps to gain control of which files might open for rooks.",True," The comment suggests a potential tactical threat and opening strategy, indicating a flaw in the move's assessment.",1. e4 c5 2. Nf3 Nc6 3. Nc3 e5 4. Bc4 d6 5. d3 Be7 6. Nd2 Bg5 7. h4 Bxd2+ 8. Bxd2 Nf6 9. Bg5 Be6 10. Nd5 Bxd5 11. Bxd5 h6 12. Bxf6 Qxf6 13. Qd2 Ne7 14. Bc4 O-O,"This is a game between Ponomariov, Ruslan (as White) and Shirov, Alexei (as Black). Last move played: Black plays kingside castle",Slight advantage for White (eval: 33 centipawns),15. O-O-O ,14... Rb8 15. a4 
"This move surprises me completely. I'd have thought he was happy with the cooperation of his Ne7 with the dark-square pawns. He must be thinking Kf1 is uncomfortable and White's rooks are split, so he should go right down the middle at Qd2 (e.g. ...d6-d5xe4) .",True," The comment offers a potential explanation for the mistake, suggesting a miscalculation of the opponent's intentions.",1. e4 c5 2. Nf3 Nc6 3. Nc3 e5 4. Bc4 d6 5. d3 Be7 6. Nd2 Bg5 7. h4 Bxd2+ 8. Bxd2 Nf6 9. Bg5 Be6 10. Nd5 Bxd5 11. Bxd5 h6 12. Bxf6 Qxf6 13. Qd2 Ne7 14. Bc4 O-O 15. Kf1 Rad8,"This is a game between Ponomariov, Ruslan (as White) and Shirov, Alexei (as Black). Last move played: Black plays Rook to d8",Slight advantage for Black (eval: -24 centipawns),16. Re1 a6 ,15... Rad8 16. Re1 d5 17. Bxd5 Nxd5 18. exd5 Rxd5 19. Rh3 Rd4 20. Kg1 e4 21. Qc3 exd3 22. Rxd3 Qxh4 23. Qxc5 Rc4 24. Qxa7 Rxc2 25. b3 Qf6 26. Qd4 Qxd4 27. Rxd4 
Leaving Black's pawn on the board is probably more dangerous than exposing the king further to checks.,True," The comment highlights a potential tactical vulnerability, suggesting the pawn sacrifice is risky.",1. e4 c5 2. Nf3 Nc6 3. Nc3 e5 4. Bc4 d6 5. d3 Be7 6. Nd2 Bg5 7. h4 Bxd2+ 8. Bxd2 Nf6 9. Bg5 Be6 10. Nd5 Bxd5 11. Bxd5 h6 12. Bxf6 Qxf6 13. Qd2 Ne7 14. Bc4 O-O 15. Kf1 Rad8 16. Re1 d5 17. exd5 Nxd5 18. Qe2 Rfe8 19. Qe4 Nb6 20. Bb3 Rd4 21. Qxb7 c4 22. dxc4 e4 23. Kg1 Rd7 24. Qa6 e3 25. fxe3,"This is a game between Ponomariov, Ruslan (as White) and Shirov, Alexei (as Black). Last move played: White plays Pawn takes on e3",Large advantage for Black (eval: -229 centipawns),25... Rd2 ,25. fxe3 Rd2 
and White (or is it Black) must concede to a draw by perpetual check after 28. Rh3 Qf4+ 29. Rg3 ( 29. g3?? Qf2# ) Qh4+ ( 29...Rxh1+ 30. Kxh1 Qxf4 should be good for White because Pc4 is passed and Pa7 about to fall ) =,True," The comment describes a specific, flawed sequence of moves that leads to a draw, suggesting a miscalculation.",1. e4 c5 2. Nf3 Nc6 3. Nc3 e5 4. Bc4 d6 5. d3 Be7 6. Nd2 Bg5 7. h4 Bxd2+ 8. Bxd2 Nf6 9. Bg5 Be6 10. Nd5 Bxd5 11. Bxd5 h6 12. Bxf6 Qxf6 13. Qd2 Ne7 14. Bc4 O-O 15. Kf1 Rad8 16. Re1 d5 17. exd5 Nxd5 18. Qe2 Rfe8 19. Qe4 Nb6 20. Bb3 Rd4 21. Qxb7 c4 22. dxc4 e4 23. Kg1 Rd7 24. Qa6 e3 25. fxe3 Rxe3 26. Rxe3 Rd1+ 27. Kh2 Qxh4+,"This is a game between Ponomariov, Ruslan (as White) and Shirov, Alexei (as Black). Last move played: Black plays Queen takes on h4 with check",The position is equal,28. Rh3 Qf4+ 29. Rg3 Qh4+ ,27... Qd6+ 28. Rg3 Rd4 29. Rf1 Rxh4+ 30. Kg1 Qxg3 31. c5 Qh2+ 32. Kf2 Qe5 33. Bxf7+ Kh8 34. Kg1 Qh2+ 35. Kf2 
"He is trading his ""bad bishop"" (the one which clashes with his central pawns) for a White knight which might maneuver Nd2-f1-e3-d5. Whether this is necessary isn't clear, but it is consistent positional play.",True," The comment suggests a risky, potentially sacrificing move that could lead to a weakened position.",1. e4 c5 2. Nf3 Nc6 3. Nc3 e5 4. Bc4 d6 5. d3 Be7 6. Nd2 Bg5 7. h4 Bxd2+,"This is a game between Ponomariov, Ruslan (as White) and Shirov, Alexei (as Black). Last move played: Black plays Bishop takes on d2 with check",Advantage for White (eval: 57 centipawns),8. Qxd2 ,7... Bh6 8. Qh5 g6 9. Qd1 Nf6 10. Nd5 Nh5 11. g4 Nf4 12. a4 Be6 13. c3 O-O 14. g5 Bg7 15. Nf1 Bxd5 16. Bxd5 Nxd5 17. exd5 Ne7 18. c4 Nf5 19. Nd2 f6 20. h5 
"Ponomariov's two previous games were decisive, so it will be interesting to see if he enters into complications or steers to a quiet draw. Ponomariov was ""odd man out"" round three and didn't play.",True," The comment suggests a potential strategic miscalculation based on the bishop/knight imbalance, indicating a flawed assessment of future value.",1. e4,"This is a game between Ponomariov, Ruslan (as White) and Shirov, Alexei (as Black). Last move played: White plays Pawn to e4",Slight advantage for White (eval: 33 centipawns),1... e5 2. Nf3 Nc6 3. d4 exd4 4. Nxd4 Bc5 5. Nb3 Bb6 6. a4 Qh4 7. Qf3 a5 8. g3 Qf6 9. Qe2 Nge7 10. Nc3 ,1. e4 e5 
