comment,good,reasoning,moves,context,engine_eval,engine_best_line,engine_best_alternative
"The Queen's Gambit Declined, which gives Black a solid yet somewhat passive position.",True," The comment suggests a weakness in Black's position, indicating a flawed strategic decision.",1. d4 Nf6 2. c4 e6 3. Nc3 d5 4. Nf3 Be7 5. Bg5 O-O 6. e3,This is a game between Kasparov (as White) and Dur (as Black). Last move played: White plays Pawn to e3,Slight advantage for White (eval: 24 centipawns),6... Nbd7 ,6. e3 
"Although Black has the two bishops, his light squared bishop is blocked by his own pawns.",True," The comment accurately describes a critical tactical vulnerability, indicating a flaw in the player’s planning.",1. d4 Nf6 2. c4 e6 3. Nc3 d5 4. Nf3 Be7 5. Bg5 O-O 6. e3 h6 7. Bxf6 Bxf6 8. Qd2 c6,This is a game between Kasparov (as White) and Dur (as Black). Last move played: Black plays Pawn to c6,Slight advantage for White (eval: 43 centipawns),9. h4 ,8... c5 9. cxd5 
This move allows White a strong initiative on the kingside. Better was 9...g6 10.O-O-O Bg7,True," The comment suggests White has a strong initiative, potentially indicating a flawed move.",1. d4 Nf6 2. c4 e6 3. Nc3 d5 4. Nf3 Be7 5. Bg5 O-O 6. e3 h6 7. Bxf6 Bxf6 8. Qd2 c6 9. h4 Nd7,This is a game between Kasparov (as White) and Dur (as Black). Last move played: Black plays Knight to d7,Advantage for White (eval: 54 centipawns),10. g4 Be7 ,9... g6 10. g4 
"Owing to White's initiative on the kingside Black tries to counter- attack on the opposite wing. Even though it will cost him a pawn to open up the queenside, this is Black's best practical chance.",True," The comment highlights a strategic error by Black, suggesting a suboptimal pawn opening to create an attack, indicating a flawed tactical assessment.",1. d4 Nf6 2. c4 e6 3. Nc3 d5 4. Nf3 Be7 5. Bg5 O-O 6. e3 h6 7. Bxf6 Bxf6 8. Qd2 c6 9. h4 Nd7 10. g4 Re8 11. O-O-O b5,This is a game between Kasparov (as White) and Dur (as Black). Last move played: Black plays Pawn to b5,Large advantage for White (eval: 219 centipawns),12. g5 b4 13. Ne2 hxg5 14. hxg5 Bxg5 15. Nxg5 Qxg5 16. f4 Qd8 17. Ng3 b3 18. a3 Nf6 19. Bd3 Ba6 20. e4 dxe4 21. Nxe4 Nxe4 22. Bxe4 Qf6 23. Bh7+ Kf8 24. Qb4+ Re7 ,11... Be7 
Clears the second rank for White's queen to attack on the h-file.,True,". The comment suggests a potential weakness in White's defensive structure, indicating a flawed strategic decision.",1. d4 Nf6 2. c4 e6 3. Nc3 d5 4. Nf3 Be7 5. Bg5 O-O 6. e3 h6 7. Bxf6 Bxf6 8. Qd2 c6 9. h4 Nd7 10. g4 Re8 11. O-O-O b5 12. cxb5 cxb5 13. Bxb5 Rb8 14. g5 hxg5 15. hxg5 Bxg5 16. Nxg5 Qxg5 17. f4,This is a game between Kasparov (as White) and Dur (as Black). Last move played: White plays Pawn to f4,Large advantage for White (eval: 367 centipawns),17... Qd8 18. Qh2 f5 19. Rdg1 Kf7 20. Qh5+ Ke7 21. Rxg7+ Kd6 22. e4 a6 23. Ba4 Qb6 24. b3 dxe4 25. Qxe8 ,17. Rdg1 Qf6 18. e4 g6 19. e5 Qg7 20. Rh6 a6 21. Ba4 Rb4 22. Rgh1 Rxa4 23. Nxa4 Bb7 24. Qf4 Rc8+ 25. Nc3 Nxe5 26. dxe5 d4 27. Qxd4 Bd5 28. R6h4 
"It's easy to see that White stands better, since Black's attack has never gotten farther than the first stage.",True," The comment suggests a lack of strategic depth and potential for improvement, indicating a flawed assessment of the position.",1. d4 Nf6 2. c4 e6 3. Nc3 d5 4. Nf3 Be7 5. Bg5 O-O 6. e3 h6 7. Bxf6 Bxf6 8. Qd2 c6 9. h4 Nd7 10. g4 Re8 11. O-O-O b5 12. cxb5 cxb5 13. Bxb5 Rb8 14. g5 hxg5 15. hxg5 Bxg5 16. Nxg5 Qxg5 17. f4 Qf6 18. Qh2 g6 19. f5 Qg7 20. fxe6 fxe6 21. Rdg1,This is a game between Kasparov (as White) and Dur (as Black). Last move played: White plays Rook to g1,Large advantage for White (eval: 479 centipawns),21... Rf8 22. Bd3 Rf6 23. Bxg6 Rxg6 24. Rxg6 Qxg6 25. Qh8+ Kf7 26. Rh7+ Qxh7 27. Qxh7+ Ke8 28. Na4 Ra8 29. e4 Nb6 30. Nc5 dxe4 31. Qxe4 Nd5 32. b3 a5 33. Qh7 a4 34. Nxa4 Rxa4 35. bxa4 Kd8 ,21. Bd3 Kf7 22. Bxg6+ Qxg6 23. Rhg1 Qxg1 24. Rxg1 Rf8 25. Na4 Rb7 26. Qd6 Ke8 27. b3 Nf6 28. Nc5 Rb6 29. Qc7 Bd7 30. Qe5 Kd8 31. Kb1 Rc6 
Black resigned since his queen is deflected from covering the h8 square.,True, The comment accurately describes a potential tactical error leading to a resignation.,1. d4 Nf6 2. c4 e6 3. Nc3 d5 4. Nf3 Be7 5. Bg5 O-O 6. e3 h6 7. Bxf6 Bxf6 8. Qd2 c6 9. h4 Nd7 10. g4 Re8 11. O-O-O b5 12. cxb5 cxb5 13. Bxb5 Rb8 14. g5 hxg5 15. hxg5 Bxg5 16. Nxg5 Qxg5 17. f4 Qf6 18. Qh2 g6 19. f5 Qg7 20. fxe6 fxe6 21. Rdg1 Rf8 22. Bd3 Rf6 23. e4 e5 24. Nxd5 Rf7 25. Rxg6,This is a game between Kasparov (as White) and Dur (as Black). Last move played: White plays Rook takes on g6,Mate in 15 for White,25... Rf1+ 26. Bxf1 Qxg6 27. Ne7+ Kf7 28. Nxg6 Nf6 29. Bc4+ Be6 30. Bxe6+ Kxe6 31. Qxe5+ Kd7 32. Qxb8 Ke6 33. Ne5 a6 34. Qb6+ Ke7 35. Qc7+ Ke6 36. Qf7+ Kd6 37. Qxf6+ Kc7 38. Qc6+ Kb8 39. Qb6+ Kc8 40. Rh8# ,25. Rxg6 Rf1+ 26. Rxf1 Qxg6 27. Ne7+ Kg7 28. Nxg6 Ba6 29. Bxa6 Nf6 30. Nxe5 Rc8+ 31. Bxc8 a6 32. Rg1+ Ng4 33. Rxg4+ Kf8 34. Qh8+ Ke7 35. Rg7+ Kd6 36. Qf8# 
This move allows White a strong initiative on the kingside. Better was 9...g6 10.O-O-O Bg7,True," The comment suggests a flawed strategic move, potentially sacrificing a pawn for positional advantage.",1. d4 Nf6 2. c4 e6 3. Nc3 d5 4. Nf3 Be7 5. Bg5 O-O 6. e3 h6 7. Bxf6 Bxf6 8. Qd2 c6 9. h4 Nd7,This is a game between Kasparov (as White) and Dur (as Black). Last move played: Black plays Knight to d7,Advantage for White (eval: 54 centipawns),10. g4 Be7 ,9... g6 10. g4 
"Although Black has the two bishops, his light squared bishop is blocked by his own pawns.",True, The comment highlights a critical tactical blunder that led to a loss.,1. d4 Nf6 2. c4 e6 3. Nc3 d5 4. Nf3 Be7 5. Bg5 O-O 6. e3 h6 7. Bxf6 Bxf6 8. Qd2 c6,This is a game between Kasparov (as White) and Dur (as Black). Last move played: Black plays Pawn to c6,Slight advantage for White (eval: 43 centipawns),9. h4 ,8... c5 9. cxd5 
