comment,good,reasoning,moves,context,engine_eval,engine_best_line,engine_best_alternative
The game started out as a Reti Opening but play has now transposed into a Sicilian Defense. Learning how to handle transpositions is among the more difficult tasks of studying the opening.,True," The comment suggests a tactical misstep, indicating a failure to adapt to the resulting pawn structure.",1. Nf3 c5 2. c4 g6 3. e4 Bg7 4. d4 cxd4 5. Nxd4 Nc6 6. Be3,This is a game between Furman (as White) and Spassky (as Black). Last move played: White plays Bishop to e3,Advantage for White (eval: 53 centipawns),6... Nxd4 ,6. Be3 Nf6 7. Nc3 d6 8. Be2 O-O 9. O-O Nxd4 10. Bxd4 Bd7 11. Qd3 a5 12. b3 Bc6 13. Rad1 Nd7 14. Bxg7 Kxg7 15. h4 Qb6 16. Nd5 Bxd5 17. exd5 Ne5 18. Qc3 Qb4 19. Qb2 f6 20. f4 
"This may seem surprising, since the fianchettoed bishop is Black's most powerful weapon in this opening variation. But at the time it was thought to be good.",True," The comment highlights a misjudgment of the bishop's value, suggesting a flawed strategic assessment.",1. Nf3 c5 2. c4 g6 3. e4 Bg7 4. d4 cxd4 5. Nxd4 Nc6 6. Be3 Nh6 7. Nc3 O-O 8. Be2 f5 9. exf5 Bxd4,This is a game between Furman (as White) and Spassky (as Black). Last move played: Black plays Bishop takes on d4,Large advantage for White (eval: 108 centipawns),10. Bxh6 ,9... Nxf5 10. Nxf5 
"White plays the obvious move. But capturing at h6 would have been more effective, according to Spassky.",True," The comment suggests a potential strategic misjudgment based on a perceived superior move, indicating a flawed evaluation.",1. Nf3 c5 2. c4 g6 3. e4 Bg7 4. d4 cxd4 5. Nxd4 Nc6 6. Be3 Nh6 7. Nc3 O-O 8. Be2 f5 9. exf5 Bxd4 10. Bxd4,This is a game between Furman (as White) and Spassky (as Black). Last move played: White plays Bishop takes on d4,Slight advantage for White (eval: 47 centipawns),10... Nxf5 11. Bc5 ,10. Bxh6 
The threat was Nc2.,True," The comment indicates a potential tactical flaw, suggesting the player didn't fully consider the resulting threat.",1. Nf3 c5 2. c4 g6 3. e4 Bg7 4. d4 cxd4 5. Nxd4 Nc6 6. Be3 Nh6 7. Nc3 O-O 8. Be2 f5 9. exf5 Bxd4 10. Bxd4 Nxf5 11. Bc5 d6 12. Ba3 Nfd4 13. O-O Bf5 14. Rc1,This is a game between Furman (as White) and Spassky (as Black). Last move played: White plays Rook to c1,Advantage for White (eval: 58 centipawns),14... Qa5 ,14. b3 Qa5 
Black's pieces are much better coordinated than White's and the f-file can be used to mount an attack on the kingside.,True," The comment suggests a misjudgment of positional strengths, indicating a flawed evaluation of the board state.",1. Nf3 c5 2. c4 g6 3. e4 Bg7 4. d4 cxd4 5. Nxd4 Nc6 6. Be3 Nh6 7. Nc3 O-O 8. Be2 f5 9. exf5 Bxd4 10. Bxd4 Nxf5 11. Bc5 d6 12. Ba3 Nfd4 13. O-O Bf5 14. Rc1 Qd7 15. Nd5 Rf7,This is a game between Furman (as White) and Spassky (as Black). Last move played: Black plays Rook to f7,Advantage for White (eval: 76 centipawns),16. b3 Raf8 ,15... e5 16. Bd3 Bxd3 17. Qxd3 Rad8 18. Rcd1 Qf5 19. Qxf5 Rxf5 20. Nc3 a6 21. Ne4 d5 22. Nd6 dxc4 23. Nxf5 gxf5 24. f4 e4 25. Bc5 
Now White takes advantage of the retreat of the bishop to take control of the b1-h7 diagonal. Furman perhaps expected Spassky to accept the sacrifice of a pawn at b4.,True," The comment suggests a strategic error based on misinterpretations of pawn structure and potential sacrifices, indicating a flawed assessment of the position.",1. Nf3 c5 2. c4 g6 3. e4 Bg7 4. d4 cxd4 5. Nxd4 Nc6 6. Be3 Nh6 7. Nc3 O-O 8. Be2 f5 9. exf5 Bxd4 10. Bxd4 Nxf5 11. Bc5 d6 12. Ba3 Nfd4 13. O-O Bf5 14. Rc1 Qd7 15. Nd5 Rf7 16. b3 Raf8 17. Bb2 e5 18. b4 Be6,This is a game between Furman (as White) and Spassky (as Black). Last move played: Black plays Bishop to e6,The position is equal,19. Ne3 Rf4 20. b5 Nxe2+ 21. Qxe2 Nd4 22. Bxd4 exd4 23. Nd5 Bxd5 24. cxd5 Qf7 25. g3 d3 26. Qe6 Ra4 27. Rc3 d2 28. Rc2 Rd4 29. Qxf7+ Rxf7 30. Rd1 Rxd5 31. Rdxd2 Rxb5 32. Rxd6 Rb1+ 33. Kg2 ,18... Be6 
Spassky has more on his mind than mere pawns.,True," The comment suggests the player is preoccupied with deeper strategic considerations, indicating a flawed move.",1. Nf3 c5 2. c4 g6 3. e4 Bg7 4. d4 cxd4 5. Nxd4 Nc6 6. Be3 Nh6 7. Nc3 O-O 8. Be2 f5 9. exf5 Bxd4 10. Bxd4 Nxf5 11. Bc5 d6 12. Ba3 Nfd4 13. O-O Bf5 14. Rc1 Qd7 15. Nd5 Rf7 16. b3 Raf8 17. Bb2 e5 18. b4 Be6 19. Bd3,This is a game between Furman (as White) and Spassky (as Black). Last move played: White plays Bishop to d3,Large advantage for Black (eval: -138 centipawns),19... Bg4 ,19. Ne3 Rf4 20. b5 Nxe2+ 21. Qxe2 Nd4 22. Bxd4 exd4 23. Nd5 Bxd5 24. cxd5 Qf7 25. g3 d3 26. Qe6 Ra4 27. Rc3 d2 28. Rc2 Rd4 29. Qxf7+ Rxf7 30. Rd1 Rxd5 31. Rdxd2 Rxb5 32. Rxd6 Rb1+ 33. Kg2 
This is a crushing blow which wins the game for Black. The threat is Nf3+ with a mating attack.,True," The comment describes a specific tactical sequence, suggesting a flawed plan.",1. Nf3 c5 2. c4 g6 3. e4 Bg7 4. d4 cxd4 5. Nxd4 Nc6 6. Be3 Nh6 7. Nc3 O-O 8. Be2 f5 9. exf5 Bxd4 10. Bxd4 Nxf5 11. Bc5 d6 12. Ba3 Nfd4 13. O-O Bf5 14. Rc1 Qd7 15. Nd5 Rf7 16. b3 Raf8 17. Bb2 e5 18. b4 Be6 19. Bd3 Bg4,This is a game between Furman (as White) and Spassky (as Black). Last move played: Black plays Bishop to g4,Large advantage for Black (eval: -160 centipawns),20. f3 Bxf3 ,19... Bg4 
Now Black gets to sacrifice a different piece! 20.Qd2 Nf3+ 21.gxf3 Bxf3 22.Qg5 Rf4 23.Nxf4 Rxf4 24.h3 Qxh3 25.Bxe5 Rg4+ 26.Qxg4 Qxg4+ 27.Bg3 Qh3,True," The comment describes a dangerous, over-aggressive move that jeopardizes Black's pawn structure and king safety.",1. Nf3 c5 2. c4 g6 3. e4 Bg7 4. d4 cxd4 5. Nxd4 Nc6 6. Be3 Nh6 7. Nc3 O-O 8. Be2 f5 9. exf5 Bxd4 10. Bxd4 Nxf5 11. Bc5 d6 12. Ba3 Nfd4 13. O-O Bf5 14. Rc1 Qd7 15. Nd5 Rf7 16. b3 Raf8 17. Bb2 e5 18. b4 Be6 19. Bd3 Bg4 20. f3,This is a game between Furman (as White) and Spassky (as Black). Last move played: White plays Pawn to f3,Large advantage for Black (eval: -143 centipawns),20... Bxf3 21. gxf3 Nxf3+ 22. Kh1 Qh3 23. Qe2 Nxh2 24. Qg2 Qxg2+ 25. Kxg2 Nxf1 26. Rxf1 Rxf1 27. Bxf1 Nd4 28. Bd3 Kg7 29. Nc3 Nf5 30. Ne4 Nh4+ 31. Kg1 Nf3+ 32. Kf2 Nd2+ 33. Ke2 Nxe4 34. Bxe4 b6 35. Bc1 ,20. f3 Bxf3 
"Black threatens Rxf2, but if the rook leaves the second rank, then there is a mate at g2, while if it moves laterally it opens up the f1-square for invasion. Furman resigned instead of making such a decision.",True," The comment provides a detailed explanation of why the move was considered a mistake, highlighting a flawed strategic assessment.",1. Nf3 c5 2. c4 g6 3. e4 Bg7 4. d4 cxd4 5. Nxd4 Nc6 6. Be3 Nh6 7. Nc3 O-O 8. Be2 f5 9. exf5 Bxd4 10. Bxd4 Nxf5 11. Bc5 d6 12. Ba3 Nfd4 13. O-O Bf5 14. Rc1 Qd7 15. Nd5 Rf7 16. b3 Raf8 17. Bb2 e5 18. b4 Be6 19. Bd3 Bg4 20. f3 Bxf3 21. gxf3 Nxf3+ 22. Kh1 Qh3 23. Rf2 Ne1,This is a game between Furman (as White) and Spassky (as Black). Last move played: Black plays Knight to e1,Mate in 8 for Black,24. Nf6+ Rxf6 25. Qh5 Qxh5 26. Rxf6 Rxf6 27. Rc2 Nxd3 28. h4 Rf1+ 29. Kh2 Nf4 30. Kg3 Qf3+ 31. Kh2 Rh1# ,23... Ne1 24. Qh5 gxh5 25. Nf6+ Rxf6 26. Bf5 Rxf5 27. Rxe1 Rxf2 28. Rg1+ Kh8 29. Bxe5+ dxe5 30. Rg8+ Rxg8 31. b5 Qxh2# 
The idea behind this move is to rapidly advance the f-pawn to f5 and attack the White center.,True," The comment suggests a strategic deficiency, indicating a flawed move.",1. Nf3 c5 2. c4 g6 3. e4 Bg7 4. d4 cxd4 5. Nxd4 Nc6 6. Be3 Nh6,This is a game between Furman (as White) and Spassky (as Black). Last move played: Black plays Knight to h6,Advantage for White (eval: 87 centipawns),7. h3 ,6... Nxd4 7. Bxd4 Nf6 8. Nc3 d6 9. Be2 O-O 10. O-O Bd7 11. Qc2 a5 12. Rad1 Qc7 13. h3 Bc6 14. Nd5 Bxd5 15. exd5 Nd7 
