comment,good,reasoning,moves,context,engine_eval,engine_best_line,engine_best_alternative
"The Leningrad Variation of the Nimzoindian, which Boris Spassky used to love to play.",True," Yes, it provides context for why the move was considered a mistake.",1. d4 Nf6 2. c4 e6 3. Nc3 Bb4 4. Bg5,This is a game between Spassky (as White) and Smyslov (as Black). Last move played: White plays Bishop to g5,The position is equal,4... c5 5. Nf3 h6 6. Bxf6 Qxf6 7. e3 Bxc3+ 8. bxc3 b6 9. Be2 d6 10. Qa4+ Bd7 11. Qd1 O-O 12. O-O Be8 13. Nd2 Qe7 14. a4 ,4. Nf3 b6 5. e3 O-O 6. Qc2 Bb7 7. Be2 c5 8. dxc5 Bxc5 9. a3 d5 10. cxd5 Nxd5 11. Nxd5 Qxd5 
"Black has removed one of the potential attackers of his weak d- pawn, and the other, the Nc3, departs quickly.",True," The comment identifies a potential tactical error, suggesting the removal of a piece was a poor choice.",1. d4 Nf6 2. c4 e6 3. Nc3 Bb4 4. Bg5 h6 5. Bh4 c5 6. d5 d6 7. e3 exd5 8. cxd5 Nbd7 9. Bb5 O-O 10. Ne2 Ne5 11. O-O Ng6 12. Bg3 Nh5 13. Bd3 Nxg3 14. Nxg3,This is a game between Spassky (as White) and Smyslov (as Black). Last move played: White plays Knight takes on g3,The position is equal,14... a6 ,14. Nxg3 
"Capturing with the queen would have saved precious time, as will become obvious.",True," The comment suggests a missed opportunity for a better move, indicating a flaw in the player's strategic assessment.",1. d4 Nf6 2. c4 e6 3. Nc3 Bb4 4. Bg5 h6 5. Bh4 c5 6. d5 d6 7. e3 exd5 8. cxd5 Nbd7 9. Bb5 O-O 10. Ne2 Ne5 11. O-O Ng6 12. Bg3 Nh5 13. Bd3 Nxg3 14. Nxg3 Ne5 15. Be2 Bxc3 16. bxc3 Qh4 17. f4 Ng4 18. Bxg4 Bxg4,This is a game between Spassky (as White) and Smyslov (as Black). Last move played: Black plays Bishop takes on g4,Slight advantage for White (eval: 42 centipawns),19. Qb3 b6 ,18... Bxg4 19. Qd3 f5 20. a4 b6 21. a5 bxa5 22. Rxa5 h5 23. Rfa1 Qe7 24. h3 h4 25. Nf1 Bh5 26. Ra6 g5 27. fxg5 Rab8 28. Nd2 Qxg5 29. Rxd6 Rb2 30. Rxa7 
"Having eliminated the attack, Spassky establishes a dominating center.",True,". The comment suggests a defensive maneuver, not a strategic improvement, indicating a flawed move.",1. d4 Nf6 2. c4 e6 3. Nc3 Bb4 4. Bg5 h6 5. Bh4 c5 6. d5 d6 7. e3 exd5 8. cxd5 Nbd7 9. Bb5 O-O 10. Ne2 Ne5 11. O-O Ng6 12. Bg3 Nh5 13. Bd3 Nxg3 14. Nxg3 Ne5 15. Be2 Bxc3 16. bxc3 Qh4 17. f4 Ng4 18. Bxg4 Bxg4 19. Qa4 Bc8 20. e4,This is a game between Spassky (as White) and Smyslov (as Black). Last move played: White plays Pawn to e4,Large advantage for White (eval: 112 centipawns),20... f5 21. Rae1 ,20. e4 
"Smyslov, the harmonist, is now simply flapping his wings to no effect.",True," The comment suggests the move is ineffective, indicating a flaw in strategic planning.",1. d4 Nf6 2. c4 e6 3. Nc3 Bb4 4. Bg5 h6 5. Bh4 c5 6. d5 d6 7. e3 exd5 8. cxd5 Nbd7 9. Bb5 O-O 10. Ne2 Ne5 11. O-O Ng6 12. Bg3 Nh5 13. Bd3 Nxg3 14. Nxg3 Ne5 15. Be2 Bxc3 16. bxc3 Qh4 17. f4 Ng4 18. Bxg4 Bxg4 19. Qa4 Bc8 20. e4 Qg4 21. Qc2 h5 22. Rf3 b5,This is a game between Spassky (as White) and Smyslov (as Black). Last move played: Black plays Pawn to b5,Large advantage for White (eval: 134 centipawns),23. h3 Qg6 ,22... Re8 23. Re1 Qg6 24. f5 Qh6 25. Qf2 Re5 26. Rf4 Bd7 27. Rh4 g6 28. Rf1 Bb5 29. fxg6 fxg6 30. Qf7+ Kh8 31. Rf3 Qc1+ 32. Nf1 Rg8 33. Qf6+ Kh7 34. Qxd6 Bxf1 35. Rf7+ Kh6 36. Qxe5 Bd3+ 37. Kf2 
Threatening mate in a few moves after 32.Ne7+.,True," The comment indicates a potential threat of mate, suggesting a flawed opening strategy.",1. d4 Nf6 2. c4 e6 3. Nc3 Bb4 4. Bg5 h6 5. Bh4 c5 6. d5 d6 7. e3 exd5 8. cxd5 Nbd7 9. Bb5 O-O 10. Ne2 Ne5 11. O-O Ng6 12. Bg3 Nh5 13. Bd3 Nxg3 14. Nxg3 Ne5 15. Be2 Bxc3 16. bxc3 Qh4 17. f4 Ng4 18. Bxg4 Bxg4 19. Qa4 Bc8 20. e4 Qg4 21. Qc2 h5 22. Rf3 b5 23. e5 h4 24. Nf1 Bf5 25. Qd2 dxe5 26. fxe5 Bg6 27. Re1 h3 28. d6 Be4 29. Ne3 Qe6 30. Rf4 Bxg2 31. Nf5,This is a game between Spassky (as White) and Smyslov (as Black). Last move played: White plays Knight to f5,Large advantage for White (eval: 348 centipawns),31... Rae8 32. Qd3 c4 33. Qg3 Qg6 34. Qxg6 fxg6 35. Ne7+ Rxe7 36. dxe7 Re8 37. e6 Rxe7 38. Rd4 Kf8 39. Kf2 Ke8 40. Re5 a6 41. Rd6 Rb7 42. Rxa6 b4 43. cxb4 Rxb4 ,31. Nf5 Rae8 32. Qd3 c4 33. Qg3 Qg6 34. Ne7+ Rxe7 35. Qxg6 fxg6 36. dxe7 Re8 37. Rd1 g5 38. Rf8+ Rxf8 39. Rd8 Re8 40. Rxe8+ Kf7 41. Rc8 
"The Leningrad Variation of the Nimzoindian, which Boris Spassky used to love to play.",True," The comment highlights a potential weakness in the move's strategic implications, suggesting it could hinder White's plans.",1. d4 Nf6 2. c4 e6 3. Nc3 Bb4 4. Bg5,This is a game between Spassky (as White) and Smyslov (as Black). Last move played: White plays Bishop to g5,The position is equal,4... c5 5. Nf3 h6 6. Bxf6 Qxf6 7. e3 Bxc3+ 8. bxc3 b6 9. Be2 d6 10. Qa4+ Bd7 11. Qd1 O-O 12. O-O Be8 13. Nd2 Qe7 14. a4 ,4. Nf3 b6 5. e3 O-O 6. Qc2 Bb7 7. Be2 c5 8. dxc5 Bxc5 9. a3 d5 10. cxd5 Nxd5 11. Nxd5 Qxd5 
Black's strong outpost at e5 and queenside majority might seem to give him the advantage here but the strongpoint cannot be maintained and it is hard to find useful employment for the B at c8.,True," The comment offers a potential explanation for the mistake, suggesting a strategic shift but doesn't directly address why the move was considered a mistake.",1. d4 Nf6 2. c4 e6 3. Nc3 Bb4 4. Bg5 h6 5. Bh4 c5 6. d5 d6 7. e3 exd5 8. cxd5 Nbd7 9. Bb5 O-O 10. Ne2 Ne5 11. O-O Ng6 12. Bg3 Nh5 13. Bd3 Nxg3 14. Nxg3 Ne5 15. Be2 Bxc3 16. bxc3,This is a game between Spassky (as White) and Smyslov (as Black). Last move played: White plays Pawn takes on c3,Advantage for White (eval: 64 centipawns),16... Qh4 17. f4 ,16. bxc3 Qh4 
