comment,good,reasoning,moves,context,engine_eval,engine_best_line,engine_best_alternative
The Dutch Defense which is a somewhat risky way of stopping White from playing pawn e4 due to the weakening of Black's kingside.,True," The comment offers a potential reason for the mistake, suggesting a strategic flaw.",1. d4 f5,This is a game between Kasparov (as White) and Gueye (as Black). Last move played: Black plays Pawn to f5,Advantage for White (eval: 60 centipawns),2. Bg5 g6 ,1... d5 
"6...Be7 is also possible with the idea of not having to worry about White exchanging off dark squared bishops,.",True," The comment suggests a potential alternative move that addresses a specific concern about White's bishop development, indicating a flawed assessment of the position.",1. d4 f5 2. g3 e6 3. Bg2 Nf6 4. c4 d5 5. Nd2 c6 6. Nh3 Bd6,This is a game between Kasparov (as White) and Gueye (as Black). Last move played: Black plays Bishop to d6,Advantage for White (eval: 53 centipawns),7. Qc2 O-O ,6... Bd6 
7...dxc4 8.Nxc4 is winning for White thanks to the holes and inactive pieces in Black's position.,True," The comment offers a potential explanation for the mistake, suggesting a tactical advantage based on the position.",1. d4 f5 2. g3 e6 3. Bg2 Nf6 4. c4 d5 5. Nd2 c6 6. Nh3 Bd6 7. Qc2 b6,This is a game between Kasparov (as White) and Gueye (as Black). Last move played: Black plays Pawn to b6,Advantage for White (eval: 74 centipawns),8. O-O ,7... h6 8. Nf4 
Played to eliminate Black's good bishop.,True, The comment suggests a defensive move that undermines the opponent’s strategic advantage.,1. d4 f5 2. g3 e6 3. Bg2 Nf6 4. c4 d5 5. Nd2 c6 6. Nh3 Bd6 7. Qc2 b6 8. Nf3 O-O 9. O-O Qe7 10. Bf4,This is a game between Kasparov (as White) and Gueye (as Black). Last move played: White plays Bishop to f4,Advantage for White (eval: 86 centipawns),10... Ne4 ,10. Bf4 Ne4 
"A new weakness has appeared in Black's position, namely the hole on e5.",True," The comment suggests a positional flaw, indicating a potential problem with Black's setup.",1. d4 f5 2. g3 e6 3. Bg2 Nf6 4. c4 d5 5. Nd2 c6 6. Nh3 Bd6 7. Qc2 b6 8. Nf3 O-O 9. O-O Qe7 10. Bf4 Bxf4 11. Nxf4,This is a game between Kasparov (as White) and Gueye (as Black). Last move played: White plays Knight takes on f4,Large advantage for White (eval: 145 centipawns),11... Na6 12. a3 Bb7 13. b4 Ne4 14. c5 Nb8 15. Ne5 Ng5 16. Nfd3 Ba6 17. a4 Bxd3 18. Nxd3 Rc8 19. cxb6 axb6 20. a5 Ra6 21. axb6 Rxb6 22. Ra8 Nf7 23. Rc1 ,11. Nxf4 Na6 
"White has a winning position thanks to his outposted knight on e5 combined with his control of the c-file, not to mention Black's bad bishop.",True," The comment suggests a strategic error by Black, implying a flawed position due to the knight's outposition and bishop weakness.",1. d4 f5 2. g3 e6 3. Bg2 Nf6 4. c4 d5 5. Nd2 c6 6. Nh3 Bd6 7. Qc2 b6 8. Nf3 O-O 9. O-O Qe7 10. Bf4 Bxf4 11. Nxf4 Ne4 12. Ne5 Bb7 13. cxd5 cxd5 14. Rfc1,This is a game between Kasparov (as White) and Gueye (as Black). Last move played: White plays Rook to c1,Large advantage for White (eval: 201 centipawns),14... Nd6 15. h4 Rc8 16. Qa4 Na6 17. Bf1 Nc7 18. e3 Nf7 19. a3 Nxe5 20. dxe5 d4 21. Qxd4 Nd5 22. Nh3 Rc5 23. b4 Rxc1 24. Rxc1 Rd8 25. Bg2 h6 26. Qb2 a5 27. b5 Ra8 28. h5 Rd8 29. Rc2 ,14. Rfc1 Nd6 15. h4 Rd8 16. Qc7 Re8 17. e3 Na6 18. Qc2 Nf7 19. Nxf7 Kxf7 20. Nd3 Rec8 21. Qa4 Kg8 22. Bf1 Nc7 23. Ne5 Qd8 24. Be2 Ne8 25. Rxc8 Qxc8 26. Qa3 Qd8 27. Rc1 
Pins the knight on d6.,True," Yes, the comment clearly indicates a potential tactical weakness due to the knight being pinned, suggesting a flawed plan.",1. d4 f5 2. g3 e6 3. Bg2 Nf6 4. c4 d5 5. Nd2 c6 6. Nh3 Bd6 7. Qc2 b6 8. Nf3 O-O 9. O-O Qe7 10. Bf4 Bxf4 11. Nxf4 Ne4 12. Ne5 Bb7 13. cxd5 cxd5 14. Rfc1 Na6 15. Qa4 Nd6 16. e3 b5 17. Qa3,This is a game between Kasparov (as White) and Gueye (as Black). Last move played: White plays Queen to a3,Large advantage for White (eval: 263 centipawns),17... Rfc8 18. h4 Rxc1+ 19. Rxc1 Nc7 20. Qa5 Rc8 21. Rc5 Nce8 22. Bf1 a6 23. Qb6 Ra8 24. Rc1 Rc8 25. Rxc8 Bxc8 ,17. Qa5 g5 18. Nfd3 Rfc8 19. a4 Rxc1+ 20. Rxc1 bxa4 21. Qxa4 Rc8 22. Ra1 Rc7 23. Bf1 Qe8 24. Qa5 Qb8 25. Qa3 Qd8 26. b4 Bc8 27. Qa5 Nc4 28. Qa4 Nxe5 29. Nxe5 Nb8 30. b5 Qe7 
Played to take the c4 square away from Black's knight.,True," The comment suggests a tactical error by moving the c4 square, implying a misjudgment of the position.",1. d4 f5 2. g3 e6 3. Bg2 Nf6 4. c4 d5 5. Nd2 c6 6. Nh3 Bd6 7. Qc2 b6 8. Nf3 O-O 9. O-O Qe7 10. Bf4 Bxf4 11. Nxf4 Ne4 12. Ne5 Bb7 13. cxd5 cxd5 14. Rfc1 Na6 15. Qa4 Nd6 16. e3 b5 17. Qa3 Rfe8 18. b3,This is a game between Kasparov (as White) and Gueye (as Black). Last move played: White plays Pawn to b3,Large advantage for White (eval: 271 centipawns),18... Nf7 19. Qa5 ,18. Qa5 Qd8 19. Qxd8 Raxd8 20. a4 b4 21. Bf1 Rc8 22. Bb5 Re7 23. Rxc8+ Bxc8 24. Rc1 Nb8 25. Rc5 Rb7 26. Bc6 Nxc6 27. Rxc6 Rb6 28. Rc1 Kf8 
The bishop joins in the queenside attack.,True," The comment suggests a tactical error, indicating a potential weakness in the defensive structure.",1. d4 f5 2. g3 e6 3. Bg2 Nf6 4. c4 d5 5. Nd2 c6 6. Nh3 Bd6 7. Qc2 b6 8. Nf3 O-O 9. O-O Qe7 10. Bf4 Bxf4 11. Nxf4 Ne4 12. Ne5 Bb7 13. cxd5 cxd5 14. Rfc1 Na6 15. Qa4 Nd6 16. e3 b5 17. Qa3 Rfe8 18. b3 Qd8 19. Bf1,This is a game between Kasparov (as White) and Gueye (as Black). Last move played: White plays Bishop to f1,Large advantage for White (eval: 265 centipawns),19... Nb8 20. Qc5 Na6 21. Qc2 g5 22. Nfd3 Rc8 23. Qd1 Qe7 24. Qh5 Nb8 25. Nc5 Ba8 26. a4 bxa4 27. Rxa4 Nc6 28. Nxc6 Bxc6 29. Ra6 Rc7 ,19. Nc6 Qd7 20. Nd3 b4 21. Ncxb4 Nxb4 22. Qxb4 a5 23. Qb6 Qd8 24. Qxd8 Raxd8 25. Rc5 Ra8 26. Bf1 Ne4 27. Rc2 Rec8 28. Rac1 Ba6 29. Ne5 Rxc2 30. Rxc2 
An oversight which only hastens the end.,True," The comment suggests a lack of consideration for the consequences of the move, indicating a flawed assessment of its impact.",1. d4 f5 2. g3 e6 3. Bg2 Nf6 4. c4 d5 5. Nd2 c6 6. Nh3 Bd6 7. Qc2 b6 8. Nf3 O-O 9. O-O Qe7 10. Bf4 Bxf4 11. Nxf4 Ne4 12. Ne5 Bb7 13. cxd5 cxd5 14. Rfc1 Na6 15. Qa4 Nd6 16. e3 b5 17. Qa3 Rfe8 18. b3 Qd8 19. Bf1 Qb6,This is a game between Kasparov (as White) and Gueye (as Black). Last move played: Black plays Queen to b6,Large advantage for White (eval: 552 centipawns),20. Nd7 b4 21. Nxb6 bxa3 22. Nxa8 g5 23. Bxa6 Bxa6 24. Nc7 gxf4 25. Nxa6 fxe3 26. fxe3 Ne4 27. Nc5 Nd2 28. Rd1 Nf3+ 29. Kh1 Rc8 30. Rac1 Kf7 31. Nd3 Rxc1 32. Rxc1 a5 33. b4 axb4 34. Nxb4 ,19... Nb8 20. Qc5 Na6 21. Qc2 g5 22. Nfd3 Rc8 23. Qd1 Qe7 24. Qh5 Nb8 25. Nc5 Ba8 26. a4 bxa4 27. Rxa4 Nc6 28. Nxc6 Bxc6 29. Ra6 Rc7 
Black resigned as his material losses are mounting.,True," The comment directly states the consequence of material losses, indicating a flawed decision.",1. d4 f5 2. g3 e6 3. Bg2 Nf6 4. c4 d5 5. Nd2 c6 6. Nh3 Bd6 7. Qc2 b6 8. Nf3 O-O 9. O-O Qe7 10. Bf4 Bxf4 11. Nxf4 Ne4 12. Ne5 Bb7 13. cxd5 cxd5 14. Rfc1 Na6 15. Qa4 Nd6 16. e3 b5 17. Qa3 Rfe8 18. b3 Qd8 19. Bf1 Qb6 20. Nd7 b4 21. Nxb6 bxa3 22. Nxa8 g5 23. Bxa6 Bxa6 24. Nc7,This is a game between Kasparov (as White) and Gueye (as Black). Last move played: White plays Knight to c7,Large advantage for White (eval: 541 centipawns),24... gxf4 25. Nxa6 fxe3 26. fxe3 Ne4 27. Nc5 Nd6 28. Rf1 Kf7 29. Rac1 a5 30. Nd3 Kg8 31. Rc7 Rb8 ,24. Nc7 gxf4 25. Nxe8 Nxe8 26. exf4 Bb5 27. Rc5 a6 28. Re1 Kf7 29. g4 Kf6 30. g5+ Ke7 31. Rxd5 Ng7 32. f3 Bd3 33. Rde5 Kd6 34. h4 Bb5 35. h5 Nxh5 36. Rxe6+ Kd7 37. Re7+ Kd6 38. Rf7 
The Dutch Defense which is a somewhat risky way of stopping White from playing pawn e4 due to the weakening of Black's kingside.,True," The comment suggests a weakness in Black’s position, indicating a mistake.",1. d4 f5,This is a game between Kasparov (as White) and Gueye (as Black). Last move played: Black plays Pawn to f5,Advantage for White (eval: 60 centipawns),2. Bg5 g6 ,1... d5 
Played to eliminate Black's good bishop.,True," The comment suggests a vulnerability in Black's position, indicating a flawed move.",1. d4 f5 2. g3 e6 3. Bg2 Nf6 4. c4 d5 5. Nd2 c6 6. Nh3 Bd6 7. Qc2 b6 8. Nf3 O-O 9. O-O Qe7 10. Bf4,This is a game between Kasparov (as White) and Gueye (as Black). Last move played: White plays Bishop to f4,Advantage for White (eval: 86 centipawns),10... Ne4 ,10. Bf4 Ne4 
The Dutch Defense which is a somewhat risky way of stopping White from playing pawn e4 due to the weakening of Black's kingside.,True," The comment describes a potential weakness in the move, suggesting it's not fully effective.",1. d4 f5,This is a game between Kasparov (as White) and Gueye (as Black). Last move played: Black plays Pawn to f5,Advantage for White (eval: 60 centipawns),2. Bg5 g6 ,1... d5 
The Dutch Defense which is a somewhat risky way of stopping White from playing pawn e4 due to the weakening of Black's kingside.,True," The comment offers a potential explanation for the mistake, suggesting a strategic flaw in Black’s pawn structure.",1. d4 f5,This is a game between Kasparov (as White) and Gueye (as Black). Last move played: Black plays Pawn to f5,Advantage for White (eval: 60 centipawns),2. Bg5 g6 ,1... d5 
The Stonewall variation gives Black a solid yet passive position.,True,"

The comment suggests a potential winning strategy, indicating a flaw in the player's assessment of the position.",1. d4 f5 2. g3 e6 3. Bg2 Nf6 4. c4 d5 5. Nd2 c6,This is a game between Kasparov (as White) and Gueye (as Black). Last move played: Black plays Pawn to c6,Slight advantage for White (eval: 49 centipawns),6. Nh3 Bd6 ,5... a5 6. Ngf3 
