comment,good,reasoning,moves,context,engine_eval,engine_best_line,engine_best_alternative
"Faced with the choice of losing either a Rook or a Knight, Bogo goes with the without lesser of two evils and decides to give up the Knight.",True," The comment suggests the player prioritized a less advantageous outcome over a more solid position, indicating a mistake.",1. e4 e5 2. Nf3 d6 3. d4 Nf6 4. Nc3 Nbd7 5. Bc4 Be7 6. O-O O-O 7. Bg5 c6 8. Bb3 h6 9. Bh4 Re8 10. Qd3 Nh5 11. Qc4 Rf8 12. Bxe7 Qxe7 13. Ne2 a5 14. Qc3 a4 15. Bc4 b5 16. Bd3 Bb7 17. dxe5 dxe5 18. Rad1 Rfe8 19. Ng3 Nxg3 20. hxg3 Nf6 21. Nh4 g6 22. Qd2 Kg7 23. Qe3 Ng4 24. Qd2 Qc5 25. Be2 Nf6 26. Bd3 Rad8 27. Qe2 Bc8 28. Kh1 Bg4 29. f3 Be6 30. a3 Re7 31. Rde1 Qd4 32. Qf2 Qxb2 33. Qc5 Rc7 34. Rb1 Qd4 35. Rxb5 g5 36. Nf5+ Bxf5 37. exf5 Nh5 38. Re1 Nxg3+ 39. Kh2 Qh4+ 40. Kg1 f6 41. Rxe5 fxe5 42. Qxe5+ Kg8 43. Rb4 Qh1+ 44. Kf2 Rf7,"This is a game between Lasker,Ed (as White) and Bogoljubow,E (as Black). Last move played: Black plays Rook to f7",Large advantage for White (eval: 257 centipawns),45. Kxg3 Rdf8 46. Kf2 c5 47. Rxa4 Rf6 48. Rc4 Kh7 49. a4 h5 50. a5 Kh6 51. Rxc5 Qh4+ 52. Kg1 Qf4 53. a6 R8f7 54. Kf2 Qh4+ 55. g3 Qh2+ 56. Ke3 Qg1+ 57. Kd2 Qf2+ 58. Kc3 ,44... Rf7 45. Kxg3 Rdf8 46. Kf2 c5 47. Rxa4 Rf6 48. Rc4 Kg7 49. a4 h5 50. a5 Kh6 51. Rxc5 Qh4+ 52. Kg1 Qf4 53. a6 Qxe5 54. Rxe5 R8f7 55. Kf2 Kg7 56. Kg3 Rd6 57. Re8 Ra7 58. f4 Kf6 59. Rh8 h4+ 60. Kh3 gxf4 61. Rh6+ Ke5 62. Rxd6 Kxd6 
WOW! Lasker is relentless in the pursuit of a Black Rook for his trophy case!,True,". The comment suggests the move was a bold and aggressive attempt to force a checkmate, indicating a potentially flawed strategic decision.",1. e4 e5 2. Nf3 d6 3. d4 Nf6 4. Nc3 Nbd7 5. Bc4 Be7 6. O-O O-O 7. Bg5 c6 8. Bb3 h6 9. Bh4 Re8 10. Qd3 Nh5 11. Qc4 Rf8 12. Bxe7 Qxe7 13. Ne2 a5 14. Qc3 a4 15. Bc4 b5 16. Bd3 Bb7 17. dxe5 dxe5 18. Rad1 Rfe8 19. Ng3 Nxg3 20. hxg3 Nf6 21. Nh4 g6 22. Qd2 Kg7 23. Qe3 Ng4 24. Qd2 Qc5 25. Be2 Nf6 26. Bd3 Rad8 27. Qe2 Bc8 28. Kh1 Bg4 29. f3 Be6 30. a3 Re7 31. Rde1 Qd4 32. Qf2 Qxb2 33. Qc5 Rc7 34. Rb1 Qd4 35. Rxb5 g5 36. Nf5+ Bxf5 37. exf5 Nh5 38. Re1 Nxg3+ 39. Kh2 Qh4+ 40. Kg1 f6 41. Rxe5 fxe5 42. Qxe5+ Kg8 43. Rb4 Qh1+ 44. Kf2 Rf7 45. Rb8,"This is a game between Lasker,Ed (as White) and Bogoljubow,E (as Black). Last move played: White plays Rook to b8",The position is equal,45... Rxb8 46. Qxb8+ Kg7 47. Qe5+ Kf8 48. Qd6+ Kg7 ,45. Kxg3 Rdf8 46. Kf2 c5 47. Rxa4 Rf6 48. Rc4 Kh7 49. a4 h5 50. a5 Kh6 51. Rxc5 Qh4+ 52. Kg1 Qf4 53. a6 R8f7 54. Kf2 Qh4+ 55. g3 Qh2+ 56. Ke3 Qg1+ 57. Kd2 Qf2+ 58. Kc3 
"Bogo decides to trade Rooks. If he plays ...Rdf8, White's reply Bc4 puts the without f7-Rook in an ugly pin, while ...Rff8 leads to Black's sad demise (see the without variation).",True," The comment provides a rationale for the mistake, suggesting a tactical disadvantage for White.",1. e4 e5 2. Nf3 d6 3. d4 Nf6 4. Nc3 Nbd7 5. Bc4 Be7 6. O-O O-O 7. Bg5 c6 8. Bb3 h6 9. Bh4 Re8 10. Qd3 Nh5 11. Qc4 Rf8 12. Bxe7 Qxe7 13. Ne2 a5 14. Qc3 a4 15. Bc4 b5 16. Bd3 Bb7 17. dxe5 dxe5 18. Rad1 Rfe8 19. Ng3 Nxg3 20. hxg3 Nf6 21. Nh4 g6 22. Qd2 Kg7 23. Qe3 Ng4 24. Qd2 Qc5 25. Be2 Nf6 26. Bd3 Rad8 27. Qe2 Bc8 28. Kh1 Bg4 29. f3 Be6 30. a3 Re7 31. Rde1 Qd4 32. Qf2 Qxb2 33. Qc5 Rc7 34. Rb1 Qd4 35. Rxb5 g5 36. Nf5+ Bxf5 37. exf5 Nh5 38. Re1 Nxg3+ 39. Kh2 Qh4+ 40. Kg1 f6 41. Rxe5 fxe5 42. Qxe5+ Kg8 43. Rb4 Qh1+ 44. Kf2 Rf7 45. Rb8 Rxb8,"This is a game between Lasker,Ed (as White) and Bogoljubow,E (as Black). Last move played: Black plays Rook takes on b8",The position is equal,46. Qxb8+ Kg7 47. Qe5+ Kf8 48. Qd6+ Kg7 49. Qg6+ Kf8 50. Bc4 Ne4+ 51. fxe4 Qh4+ 52. Kf1 Qh1+ 53. Kf2 ,45... Rxb8 46. Qxb8+ Kg7 47. Qe5+ Kf8 48. Qd6+ Kg7 
Lasker completes the trade and checks the Black King as well! Also it's a without double attack because the g3-Knight is still squarely in the White Queen's without sights!,True," The comment offers a justification for the mistake, suggesting a lack of a double attack, but its somewhat convoluted and could be clearer.",1. e4 e5 2. Nf3 d6 3. d4 Nf6 4. Nc3 Nbd7 5. Bc4 Be7 6. O-O O-O 7. Bg5 c6 8. Bb3 h6 9. Bh4 Re8 10. Qd3 Nh5 11. Qc4 Rf8 12. Bxe7 Qxe7 13. Ne2 a5 14. Qc3 a4 15. Bc4 b5 16. Bd3 Bb7 17. dxe5 dxe5 18. Rad1 Rfe8 19. Ng3 Nxg3 20. hxg3 Nf6 21. Nh4 g6 22. Qd2 Kg7 23. Qe3 Ng4 24. Qd2 Qc5 25. Be2 Nf6 26. Bd3 Rad8 27. Qe2 Bc8 28. Kh1 Bg4 29. f3 Be6 30. a3 Re7 31. Rde1 Qd4 32. Qf2 Qxb2 33. Qc5 Rc7 34. Rb1 Qd4 35. Rxb5 g5 36. Nf5+ Bxf5 37. exf5 Nh5 38. Re1 Nxg3+ 39. Kh2 Qh4+ 40. Kg1 f6 41. Rxe5 fxe5 42. Qxe5+ Kg8 43. Rb4 Qh1+ 44. Kf2 Rf7 45. Rb8 Rxb8 46. Qxb8+,"This is a game between Lasker,Ed (as White) and Bogoljubow,E (as Black). Last move played: White plays Queen takes on b8 with check",The position is equal,46... Kg7 47. Qe5+ Kf8 48. Qd6+ Kg7 ,46. Qxb8+ Kg7 47. Qe5+ Kf8 48. Qd6+ Kg7 49. Qg6+ Kf8 50. Bc4 Ne4+ 51. fxe4 Qh4+ 52. Kf1 Qh1+ 53. Kf2 
"The Queen checks again. The players are headed for a draw by threefold without repetition (if the exact same board position occurs three times in the same without game, the game is declared a draw).",True," The comment suggests a potential draw based on a repeated position, indicating a flawed evaluation of the move's impact.",1. e4 e5 2. Nf3 d6 3. d4 Nf6 4. Nc3 Nbd7 5. Bc4 Be7 6. O-O O-O 7. Bg5 c6 8. Bb3 h6 9. Bh4 Re8 10. Qd3 Nh5 11. Qc4 Rf8 12. Bxe7 Qxe7 13. Ne2 a5 14. Qc3 a4 15. Bc4 b5 16. Bd3 Bb7 17. dxe5 dxe5 18. Rad1 Rfe8 19. Ng3 Nxg3 20. hxg3 Nf6 21. Nh4 g6 22. Qd2 Kg7 23. Qe3 Ng4 24. Qd2 Qc5 25. Be2 Nf6 26. Bd3 Rad8 27. Qe2 Bc8 28. Kh1 Bg4 29. f3 Be6 30. a3 Re7 31. Rde1 Qd4 32. Qf2 Qxb2 33. Qc5 Rc7 34. Rb1 Qd4 35. Rxb5 g5 36. Nf5+ Bxf5 37. exf5 Nh5 38. Re1 Nxg3+ 39. Kh2 Qh4+ 40. Kg1 f6 41. Rxe5 fxe5 42. Qxe5+ Kg8 43. Rb4 Qh1+ 44. Kf2 Rf7 45. Rb8 Rxb8 46. Qxb8+ Kg7 47. Qe5+ Kf8 48. Qb8+ Kg7 49. Qe5+,"This is a game between Lasker,Ed (as White) and Bogoljubow,E (as Black). Last move played: White plays Queen to e5 with check",The position is equal,49... Kf8 50. Qd6+ Kg7 51. Qg6+ Kf8 ,49. Qe5+ Kf8 50. Qb8+ Kg7 
The King moves to f8 again.,True,", It indicates a potential tactical blunder by moving the king to a vulnerable square.",1. e4 e5 2. Nf3 d6 3. d4 Nf6 4. Nc3 Nbd7 5. Bc4 Be7 6. O-O O-O 7. Bg5 c6 8. Bb3 h6 9. Bh4 Re8 10. Qd3 Nh5 11. Qc4 Rf8 12. Bxe7 Qxe7 13. Ne2 a5 14. Qc3 a4 15. Bc4 b5 16. Bd3 Bb7 17. dxe5 dxe5 18. Rad1 Rfe8 19. Ng3 Nxg3 20. hxg3 Nf6 21. Nh4 g6 22. Qd2 Kg7 23. Qe3 Ng4 24. Qd2 Qc5 25. Be2 Nf6 26. Bd3 Rad8 27. Qe2 Bc8 28. Kh1 Bg4 29. f3 Be6 30. a3 Re7 31. Rde1 Qd4 32. Qf2 Qxb2 33. Qc5 Rc7 34. Rb1 Qd4 35. Rxb5 g5 36. Nf5+ Bxf5 37. exf5 Nh5 38. Re1 Nxg3+ 39. Kh2 Qh4+ 40. Kg1 f6 41. Rxe5 fxe5 42. Qxe5+ Kg8 43. Rb4 Qh1+ 44. Kf2 Rf7 45. Rb8 Rxb8 46. Qxb8+ Kg7 47. Qe5+ Kf8 48. Qb8+ Kg7 49. Qe5+ Kf8,"This is a game between Lasker,Ed (as White) and Bogoljubow,E (as Black). Last move played: Black plays King to f8",The position is equal,50. Qd6+ Kg7 51. Qe5+ Kf8 ,49... Kf8 50. Qd6+ Kg7 51. Qg6+ Kf8 
"The draw is obvious, but the players continue to go through the formalities.",True," The comment suggests the move was a mistake and the players are overly cautious, indicating a flawed assessment of the position.",1. e4 e5 2. Nf3 d6 3. d4 Nf6 4. Nc3 Nbd7 5. Bc4 Be7 6. O-O O-O 7. Bg5 c6 8. Bb3 h6 9. Bh4 Re8 10. Qd3 Nh5 11. Qc4 Rf8 12. Bxe7 Qxe7 13. Ne2 a5 14. Qc3 a4 15. Bc4 b5 16. Bd3 Bb7 17. dxe5 dxe5 18. Rad1 Rfe8 19. Ng3 Nxg3 20. hxg3 Nf6 21. Nh4 g6 22. Qd2 Kg7 23. Qe3 Ng4 24. Qd2 Qc5 25. Be2 Nf6 26. Bd3 Rad8 27. Qe2 Bc8 28. Kh1 Bg4 29. f3 Be6 30. a3 Re7 31. Rde1 Qd4 32. Qf2 Qxb2 33. Qc5 Rc7 34. Rb1 Qd4 35. Rxb5 g5 36. Nf5+ Bxf5 37. exf5 Nh5 38. Re1 Nxg3+ 39. Kh2 Qh4+ 40. Kg1 f6 41. Rxe5 fxe5 42. Qxe5+ Kg8 43. Rb4 Qh1+ 44. Kf2 Rf7 45. Rb8 Rxb8 46. Qxb8+ Kg7 47. Qe5+ Kf8 48. Qb8+ Kg7 49. Qe5+ Kf8 50. Qb8+,"This is a game between Lasker,Ed (as White) and Bogoljubow,E (as Black). Last move played: White plays Queen to b8 with check",The position is equal,50... Kg7 51. Qe5+ Kf8 52. Qd6+ Kg7 ,50. Qd6+ Kg7 51. Qe5+ Kf8 
"Again, the Black King hides behind the Rook",True,", The comment suggests a positional weakness in Black's defense, indicating a potential vulnerability to attack.",1. e4 e5 2. Nf3 d6 3. d4 Nf6 4. Nc3 Nbd7 5. Bc4 Be7 6. O-O O-O 7. Bg5 c6 8. Bb3 h6 9. Bh4 Re8 10. Qd3 Nh5 11. Qc4 Rf8 12. Bxe7 Qxe7 13. Ne2 a5 14. Qc3 a4 15. Bc4 b5 16. Bd3 Bb7 17. dxe5 dxe5 18. Rad1 Rfe8 19. Ng3 Nxg3 20. hxg3 Nf6 21. Nh4 g6 22. Qd2 Kg7 23. Qe3 Ng4 24. Qd2 Qc5 25. Be2 Nf6 26. Bd3 Rad8 27. Qe2 Bc8 28. Kh1 Bg4 29. f3 Be6 30. a3 Re7 31. Rde1 Qd4 32. Qf2 Qxb2 33. Qc5 Rc7 34. Rb1 Qd4 35. Rxb5 g5 36. Nf5+ Bxf5 37. exf5 Nh5 38. Re1 Nxg3+ 39. Kh2 Qh4+ 40. Kg1 f6 41. Rxe5 fxe5 42. Qxe5+ Kg8 43. Rb4 Qh1+ 44. Kf2 Rf7 45. Rb8 Rxb8 46. Qxb8+ Kg7 47. Qe5+ Kf8 48. Qb8+ Kg7 49. Qe5+ Kf8 50. Qb8+ Kg7,"This is a game between Lasker,Ed (as White) and Bogoljubow,E (as Black). Last move played: Black plays King to g7",The position is equal,51. Qe5+ Kf8 52. Qd6+ Kg7 ,50... Kg7 51. Qe5+ Kf8 52. Qd6+ Kg7 
"And Lasker repeats the position for the third time. This incredible, without hard-fought game, ends in a draw.",True," The comment indicates the move was a mistake, suggesting a lack of effort and potential for a drawn position.",1. e4 e5 2. Nf3 d6 3. d4 Nf6 4. Nc3 Nbd7 5. Bc4 Be7 6. O-O O-O 7. Bg5 c6 8. Bb3 h6 9. Bh4 Re8 10. Qd3 Nh5 11. Qc4 Rf8 12. Bxe7 Qxe7 13. Ne2 a5 14. Qc3 a4 15. Bc4 b5 16. Bd3 Bb7 17. dxe5 dxe5 18. Rad1 Rfe8 19. Ng3 Nxg3 20. hxg3 Nf6 21. Nh4 g6 22. Qd2 Kg7 23. Qe3 Ng4 24. Qd2 Qc5 25. Be2 Nf6 26. Bd3 Rad8 27. Qe2 Bc8 28. Kh1 Bg4 29. f3 Be6 30. a3 Re7 31. Rde1 Qd4 32. Qf2 Qxb2 33. Qc5 Rc7 34. Rb1 Qd4 35. Rxb5 g5 36. Nf5+ Bxf5 37. exf5 Nh5 38. Re1 Nxg3+ 39. Kh2 Qh4+ 40. Kg1 f6 41. Rxe5 fxe5 42. Qxe5+ Kg8 43. Rb4 Qh1+ 44. Kf2 Rf7 45. Rb8 Rxb8 46. Qxb8+ Kg7 47. Qe5+ Kf8 48. Qb8+ Kg7 49. Qe5+ Kf8 50. Qb8+ Kg7 51. Qe5+,"This is a game between Lasker,Ed (as White) and Bogoljubow,E (as Black). Last move played: White plays Queen to e5 with check",The position is equal,51... Kf8 52. Qd6+ Kg7 53. f6+ Rxf6 54. Qd7+ Rf7 55. Qd4+ Kf8 56. Qd6+ Kg7 ,51. Qe5+ Kf8 52. Qd6+ Kg7 
Lasker continues in an aggressive fashion. He develops his Kingside Knight without and attacks the Black d5-pawn at the same time.,True," The comment highlights a potential tactical threat, suggesting a risky and unusual move.",1. e4 e5 2. Nf3,"This is a game between Lasker,Ed (as White) and Bogoljubow,E (as Black). Last move played: White plays Knight to f3",Slight advantage for White (eval: 39 centipawns),2... Nc6 3. Bb5 ,2. Nf3 
"Most people play 2...Nc6 here in order to guard the e5-pawn. Instead, Bogo without opts to play Philidor's Defense (named after the greatest chessplayer of the without 18th Century), in which Black defends the pawn with 2...d6.",True, The comment identifies a potential weakness in the player's strategy and suggests a tactical disadvantage.,1. e4 e5 2. Nf3 d6,"This is a game between Lasker,Ed (as White) and Bogoljubow,E (as Black). Last move played: Black plays Pawn to d6",Advantage for White (eval: 68 centipawns),3. d4 ,2... Nc6 3. Bb5 
"Lasker chooses to develop another piece and defend the e4-pawn at the same without time (doing two things with one move!). In your games, look for moves like without this that serve more than one purpose.",True," The comment describes a potentially problematic move that creates a tactical threat, suggesting a missed opportunity to consolidate a position.",1. e4 e5 2. Nf3 d6 3. d4 Nf6 4. Nc3,"This is a game between Lasker,Ed (as White) and Bogoljubow,E (as Black). Last move played: White plays Knight to c3",Advantage for White (eval: 51 centipawns),4... Nbd7 5. a4 ,4. dxe5 
"The King heads for the safety of the flank, while the Rook develops toward without the center.",True," The comment offers a potential explanation for the mistake, suggesting a tactical vulnerability.",1. e4 e5 2. Nf3 d6 3. d4 Nf6 4. Nc3 Nbd7 5. Bc4 Be7 6. O-O,"This is a game between Lasker,Ed (as White) and Bogoljubow,E (as Black). Last move played: White plays kingside castle",Slight advantage for White (eval: 44 centipawns),6... c6 ,6. a4 
The White Bishop makes good its escape!,True," The comment accurately identifies a potential weakness in White's position, highlighting a threat that doesn't immediately create a tactical advantage.",1. e4 e5 2. Nf3 d6 3. d4 Nf6 4. Nc3 Nbd7 5. Bc4 Be7 6. O-O O-O 7. Bg5 c6 8. Bb3 h6 9. Bh4 Re8 10. Qd3 Nh5 11. Qc4 Rf8 12. Bxe7 Qxe7 13. Ne2 a5 14. Qc3 a4 15. Bc4,"This is a game between Lasker,Ed (as White) and Bogoljubow,E (as Black). Last move played: White plays Bishop to c4",Advantage for Black (eval: -61 centipawns),15... b5 ,15. Bc4 
"Now that the White Bishop blocks the White Queen from capturing Black's pawn without on c6, it's safe for Bogo to continue his Queenside pawn mobilization. He's without getting more room, little by little!",True, The comment describes a clearly flawed plan that leads to a lost position.,1. e4 e5 2. Nf3 d6 3. d4 Nf6 4. Nc3 Nbd7 5. Bc4 Be7 6. O-O O-O 7. Bg5 c6 8. Bb3 h6 9. Bh4 Re8 10. Qd3 Nh5 11. Qc4 Rf8 12. Bxe7 Qxe7 13. Ne2 a5 14. Qc3 a4 15. Bc4 b5,"This is a game between Lasker,Ed (as White) and Bogoljubow,E (as Black). Last move played: Black plays Pawn to b5",Advantage for Black (eval: -58 centipawns),16. Bd3 ,15... b5 
"The White Bishop finally retreats to a safe haven on d3. Of course, the poor without Bishop has no squares to move to. It's stuck like a fly in a block of amber! without Now it's Lasker who is finding his position cramped!",True," The comment suggests a strategic error by prioritizing a draw over potential gains, indicating a flawed assessment of the position.",1. e4 e5 2. Nf3 d6 3. d4 Nf6 4. Nc3 Nbd7 5. Bc4 Be7 6. O-O O-O 7. Bg5 c6 8. Bb3 h6 9. Bh4 Re8 10. Qd3 Nh5 11. Qc4 Rf8 12. Bxe7 Qxe7 13. Ne2 a5 14. Qc3 a4 15. Bc4 b5 16. Bd3,"This is a game between Lasker,Ed (as White) and Bogoljubow,E (as Black). Last move played: White plays Bishop to d3",Advantage for Black (eval: -67 centipawns),16... c5 17. dxe5 ,16. Bd3 
Lasker (White) advances his e-pawn. This is White's most aggressive opening without move. It grabs a healthy chunk of the center (the d5- and f5-squares) and without allows White free development of his Queen and light-square Bishop.,True,", The comment highlights a potentially risky and inefficient move that sacrifices a pawn for a quick attack.",1. e4,"This is a game between Lasker,Ed (as White) and Bogoljubow,E (as Black). Last move played: White plays Pawn to e4",Slight advantage for White (eval: 33 centipawns),1... e5 2. Nf3 Nc6 3. d4 exd4 4. Nxd4 Bc5 5. Nb3 Bb6 6. a4 Qh4 7. Qf3 a5 8. g3 Qf6 9. Qe2 Nge7 10. Nc3 ,1. e4 e5 
"Bogoljubow (Black) responds with an equally aggressive move of his own. He, without too, grabs a couple of center squares (d4 and f4), and opens lines for the without development of his Queen and dark-square Bishop.",True, The comment highlights a critical error in planning and a potential weakness in the players move.,1. e4 e5,"This is a game between Lasker,Ed (as White) and Bogoljubow,E (as Black). Last move played: Black plays Pawn to e5",Slight advantage for White (eval: 32 centipawns),2. Nf3 ,1... e5 2. Nf3 Nc6 3. d4 exd4 4. Nxd4 Bc5 5. Nb3 Bb6 6. a4 Qh4 7. Qf3 a5 8. g3 Qf6 9. Qe2 Nge7 10. Nc3 
Lasker continues in an aggressive fashion. He develops his Kingside Knight without and attacks the Black d5-pawn at the same time.,True," The comment suggests a defensive move that compromises the center, indicating a flaw in the players strategic planning.",1. e4 e5 2. Nf3,"This is a game between Lasker,Ed (as White) and Bogoljubow,E (as Black). Last move played: White plays Knight to f3",Slight advantage for White (eval: 39 centipawns),2... Nc6 3. Bb5 ,2. Nf3 
"Bogo, unaware of Lasker's counterplan, proceeds with his own plan. He expects without Lasker to play Bxe7.",True," The comment identifies a potential weakness in the move's pawn structure and suggests a future tactical threat, indicating a flawed evaluation.",1. e4 e5 2. Nf3 d6 3. d4 Nf6 4. Nc3 Nbd7 5. Bc4 Be7 6. O-O O-O 7. Bg5 c6 8. Bb3 h6 9. Bh4 Re8 10. Qd3 Nh5,"This is a game between Lasker,Ed (as White) and Bogoljubow,E (as Black). Last move played: Black plays Knight to h5",The position is equal,11. Bxe7 Qxe7 12. Qe3 Nf4 13. dxe5 dxe5 14. h3 a5 15. Rfd1 Nf6 16. Ne1 Be6 17. Rd2 Red8 18. Rad1 Rxd2 19. Rxd2 Bxb3 20. axb3 ,10... exd4 11. Qxd4 b5 12. a4 b4 13. Qxb4 Ba6 14. Rfd1 c5 15. Qa3 c4 16. Ba2 d5 17. b4 cxb3 18. Qxb3 Nc5 19. Qb2 Rb8 20. Qc1 Ncxe4 21. Nxd5 Nxd5 22. Rxd5 Qc7 23. Bg3 Nxg3 24. hxg3 Bf6 25. Rb1 Bc4 26. Rxb8 Rxb8 27. Bxc4 Qxc4 28. Qd1 Qxa4 29. Qd3 Qa1+ 30. Kh2 
"Bogo begins to expand on the Queenside. His obvious threat is a5-a4, winning without the b3-Bishop. Among his other threats is ...exd4, to be followed by ...Nc5 without (allowing him to pile up on the e4-pawn).",True,", The comment indicates a potential tactical error by sacrificing the Queen.",1. e4 e5 2. Nf3 d6 3. d4 Nf6 4. Nc3 Nbd7 5. Bc4 Be7 6. O-O O-O 7. Bg5 c6 8. Bb3 h6 9. Bh4 Re8 10. Qd3 Nh5 11. Qc4 Rf8 12. Bxe7 Qxe7 13. Ne2 a5,"This is a game between Lasker,Ed (as White) and Bogoljubow,E (as Black). Last move played: Black plays Pawn to a5",The position is equal,14. a3 ,13... a5 
"Lasker, seeing that Bogoljubow is planning to free his game by opening up the without e-file, hits upon a plan to prevent it. The first step is to bring his Queen without to d3, where it has access to the a6-f1 diagonal.",True," The comment highlights a significant tactical error by White, suggesting a lack of willingness to accept a trade.",1. e4 e5 2. Nf3 d6 3. d4 Nf6 4. Nc3 Nbd7 5. Bc4 Be7 6. O-O O-O 7. Bg5 c6 8. Bb3 h6 9. Bh4 Re8 10. Qd3,"This is a game between Lasker,Ed (as White) and Bogoljubow,E (as Black). Last move played: White plays Queen to d3",Slight advantage for Black (eval: -34 centipawns),10... exd4 11. Qxd4 b5 12. a4 b4 13. Qxb4 Ba6 14. Rfd1 c5 15. Qa3 c4 16. Ba2 d5 17. b4 cxb3 18. Qxb3 Nc5 19. Qb2 Rb8 20. Qc1 Ncxe4 21. Nxd5 Nxd5 22. Rxd5 Qc7 23. Bg3 Nxg3 24. hxg3 Bf6 25. Rb1 Bc4 26. Rxb8 Rxb8 27. Bxc4 Qxc4 28. Qd1 Qxa4 29. Qd3 Qa1+ 30. Kh2 ,10. h3 exd4 
"Now Lasker threatens to win material by 12.Qxf7+ Kh8 13.Qxh5, getting a pawn without and Knight for free!",True," The comment suggests a defensive move was made, implying a lack of aggressive play and a preference for a draw.",1. e4 e5 2. Nf3 d6 3. d4 Nf6 4. Nc3 Nbd7 5. Bc4 Be7 6. O-O O-O 7. Bg5 c6 8. Bb3 h6 9. Bh4 Re8 10. Qd3 Nh5 11. Qc4,"This is a game between Lasker,Ed (as White) and Bogoljubow,E (as Black). Last move played: White plays Queen to c4",The position is equal,11... Rf8 ,11. Bxe7 Qxe7 12. Qe3 Nf4 13. dxe5 dxe5 14. h3 a5 15. Rfd1 Nf6 16. Ne1 Be6 17. Rd2 Red8 18. Rad1 Rxd2 19. Rxd2 Bxb3 20. axb3 
"Bogo threatens the other White Bishop and forces Lasker to decide whether to without capture the f6-Knight now or waste a tempo by moving the Bishop again. This without is known as ""putting the question to the Bishop"".",True," Yes, the comment identifies a potential tactical threat and suggests a better alternative move, indicating a flawed assessment of the resulting position.",1. e4 e5 2. Nf3 d6 3. d4 Nf6 4. Nc3 Nbd7 5. Bc4 Be7 6. O-O O-O 7. Bg5 c6 8. Bb3 h6,"This is a game between Lasker,Ed (as White) and Bogoljubow,E (as Black). Last move played: Black plays Pawn to h6",The position is equal,9. Bh4 exd4 10. Qxd4 a5 11. a3 Qc7 12. Rfd1 Ne5 13. Bg3 Nxf3+ 14. gxf3 Rd8 15. a4 Nh5 16. Ne2 Bf6 17. Qe3 Bxb2 ,8... h6 9. Bh4 
"Lasker, seeing that Bogoljubow is planning to free his game by opening up the without e-file, hits upon a plan to prevent it. The first step is to bring his Queen without to d3, where it has access to the a6-f1 diagonal.",True," The comment suggests a potential tactical blunder by Lasker, indicating a missed opportunity.",1. e4 e5 2. Nf3 d6 3. d4 Nf6 4. Nc3 Nbd7 5. Bc4 Be7 6. O-O O-O 7. Bg5 c6 8. Bb3 h6 9. Bh4 Re8 10. Qd3,"This is a game between Lasker,Ed (as White) and Bogoljubow,E (as Black). Last move played: White plays Queen to d3",Slight advantage for Black (eval: -34 centipawns),10... exd4 11. Qxd4 b5 12. a4 b4 13. Qxb4 Ba6 14. Rfd1 c5 15. Qa3 c4 16. Ba2 d5 17. b4 cxb3 18. Qxb3 Nc5 19. Qb2 Rb8 20. Qc1 Ncxe4 21. Nxd5 Nxd5 22. Rxd5 Qc7 23. Bg3 Nxg3 24. hxg3 Bf6 25. Rb1 Bc4 26. Rxb8 Rxb8 27. Bxc4 Qxc4 28. Qd1 Qxa4 29. Qd3 Qa1+ 30. Kh2 ,10. h3 exd4 
"Bogo threatens the other White Bishop and forces Lasker to decide whether to without capture the f6-Knight now or waste a tempo by moving the Bishop again. This without is known as ""putting the question to the Bishop"".",True, The comment clearly indicates a tactical blunder and a loss of control of the pawn.,1. e4 e5 2. Nf3 d6 3. d4 Nf6 4. Nc3 Nbd7 5. Bc4 Be7 6. O-O O-O 7. Bg5 c6 8. Bb3 h6,"This is a game between Lasker,Ed (as White) and Bogoljubow,E (as Black). Last move played: Black plays Pawn to h6",The position is equal,9. Bh4 exd4 10. Qxd4 a5 11. a3 Qc7 12. Rfd1 Ne5 13. Bg3 Nxf3+ 14. gxf3 Rd8 15. a4 Nh5 16. Ne2 Bf6 17. Qe3 Bxb2 ,8... h6 9. Bh4 
"Bogo gets ready for the opening of the e-file by sliding his Rook over. He'll without move his f6-Knight, and if White plays Bxe7, he can play ...Rxe7. Then Bogo without will play...Qe8 and ...exd4, then begin to pile up on White's e-pawn.",True,", The comment suggests a defensive strategy that likely led to a tactical blunder.",1. e4 e5 2. Nf3 d6 3. d4 Nf6 4. Nc3 Nbd7 5. Bc4 Be7 6. O-O O-O 7. Bg5 c6 8. Bb3 h6 9. Bh4 Re8,"This is a game between Lasker,Ed (as White) and Bogoljubow,E (as Black). Last move played: Black plays Rook to e8",The position is equal,10. h3 exd4 ,9... a5 10. Re1 
