comment,good,reasoning,moves,context,engine_eval,engine_best_line,engine_best_alternative
"Lasker is moves his King to h1 to dissolve the pin on the f-pawn. If Black without plays ...Bg4, Lasker can now reply f2-f3, saving both his Queen and d1-Rook. without .",True," The comment describes a logical error in Lasker's response, indicating a miscalculation of the resulting pawn structure.",1. e4 e5 2. Nf3 d6 3. d4 Nf6 4. Nc3 Nbd7 5. Bc4 Be7 6. O-O O-O 7. Bg5 c6 8. Bb3 h6 9. Bh4 Re8 10. Qd3 Nh5 11. Qc4 Rf8 12. Bxe7 Qxe7 13. Ne2 a5 14. Qc3 a4 15. Bc4 b5 16. Bd3 Bb7 17. dxe5 dxe5 18. Rad1 Rfe8 19. Ng3 Nxg3 20. hxg3 Nf6 21. Nh4 g6 22. Qd2 Kg7 23. Qe3 Ng4 24. Qd2 Qc5 25. Be2 Nf6 26. Bd3 Rad8 27. Qe2 Bc8 28. Kh1,"This is a game between Lasker,Ed (as White) and Bogoljubow,E (as Black). Last move played: White plays King to h1",Large advantage for Black (eval: -137 centipawns),28... Bg4 29. Nf3 ,28. Nf3 Bg4 29. Rfe1 a3 30. b3 Nh5 31. Qe3 Qxe3 32. Rxe3 f5 33. Ree1 f4 34. Kh2 Bxf3 35. gxf3 Rd4 36. c3 Rd7 37. Bc2 Red8 38. Rxd7+ Rxd7 39. Rd1 Rxd1 40. Bxd1 
"Lasker saves the two threatened heavy pieces. (Qxg4 was impossible because of without ...Nxg4, and Nf3 lets Black advance his pawns). Now White has a bad Bishop, without an immobilized Knight, a weak g3-pawn, and restricted heavy pieces! What without next?",True," The comment identifies key weaknesses in White's position, suggesting a flawed tactical assessment.",1. e4 e5 2. Nf3 d6 3. d4 Nf6 4. Nc3 Nbd7 5. Bc4 Be7 6. O-O O-O 7. Bg5 c6 8. Bb3 h6 9. Bh4 Re8 10. Qd3 Nh5 11. Qc4 Rf8 12. Bxe7 Qxe7 13. Ne2 a5 14. Qc3 a4 15. Bc4 b5 16. Bd3 Bb7 17. dxe5 dxe5 18. Rad1 Rfe8 19. Ng3 Nxg3 20. hxg3 Nf6 21. Nh4 g6 22. Qd2 Kg7 23. Qe3 Ng4 24. Qd2 Qc5 25. Be2 Nf6 26. Bd3 Rad8 27. Qe2 Bc8 28. Kh1 Bg4 29. f3,"This is a game between Lasker,Ed (as White) and Bogoljubow,E (as Black). Last move played: White plays Pawn to f3",Large advantage for Black (eval: -181 centipawns),29... Be6 30. a3 Rd7 31. Kh2 Red8 32. Rde1 Qe7 33. f4 Ng4+ 34. Kh1 exf4 35. Rxf4 Qg5 36. e5 Qh5 37. Kg1 g5 38. Rf5 Bxf5 39. Nxf5+ Kh8 40. Qe4 Qh2+ 41. Kf1 Qh1+ 42. Ke2 ,29. Nf3 Nh7 
"The Black Bishop was attacked by the White f-pawn, so it had to move away. without Now it threatens White's a2-pawn! Bogo is smiling a little now. Why not? without Just look at White's position: the White pieces are all in each other's without way!",True," The comment highlights a potential weakness in the Black Bishop's defense, suggesting a reactive move that could be detrimental.",1. e4 e5 2. Nf3 d6 3. d4 Nf6 4. Nc3 Nbd7 5. Bc4 Be7 6. O-O O-O 7. Bg5 c6 8. Bb3 h6 9. Bh4 Re8 10. Qd3 Nh5 11. Qc4 Rf8 12. Bxe7 Qxe7 13. Ne2 a5 14. Qc3 a4 15. Bc4 b5 16. Bd3 Bb7 17. dxe5 dxe5 18. Rad1 Rfe8 19. Ng3 Nxg3 20. hxg3 Nf6 21. Nh4 g6 22. Qd2 Kg7 23. Qe3 Ng4 24. Qd2 Qc5 25. Be2 Nf6 26. Bd3 Rad8 27. Qe2 Bc8 28. Kh1 Bg4 29. f3 Be6,"This is a game between Lasker,Ed (as White) and Bogoljubow,E (as Black). Last move played: Black plays Bishop to e6",Large advantage for Black (eval: -191 centipawns),30. a3 Rd6 ,29... Be6 30. b3 
Lasker sighs and advances the a-pawn. Pushing the b-pawn to b3 instead would without be bad for White because it would allow Black to pry open the Queenside without through pawn exchanges.,True," The comment offers a potential strategic reason for the mistake, suggesting a tactical advantage for Black.",1. e4 e5 2. Nf3 d6 3. d4 Nf6 4. Nc3 Nbd7 5. Bc4 Be7 6. O-O O-O 7. Bg5 c6 8. Bb3 h6 9. Bh4 Re8 10. Qd3 Nh5 11. Qc4 Rf8 12. Bxe7 Qxe7 13. Ne2 a5 14. Qc3 a4 15. Bc4 b5 16. Bd3 Bb7 17. dxe5 dxe5 18. Rad1 Rfe8 19. Ng3 Nxg3 20. hxg3 Nf6 21. Nh4 g6 22. Qd2 Kg7 23. Qe3 Ng4 24. Qd2 Qc5 25. Be2 Nf6 26. Bd3 Rad8 27. Qe2 Bc8 28. Kh1 Bg4 29. f3 Be6 30. a3,"This is a game between Lasker,Ed (as White) and Bogoljubow,E (as Black). Last move played: White plays Pawn to a3",Large advantage for Black (eval: -217 centipawns),30... Rd7 31. Kh2 Red8 32. Rb1 Rd4 33. Qf2 Qe7 34. Rbe1 Bc4 35. Bxc4 bxc4 36. Re2 c3 37. bxc3 Rd1 38. Rxd1 ,30. a3 Rd6 
"It's a old chess saying: when you're cramped, free your game by exchanging without pieces. Lasker prepares to exchange Queens with this move. He plans to next without play Qe2-e3 or Qe2-f2, offering to swap Queens with Bogo.",True," The comment offers a potential explanation for a mistake, suggesting a strategy to alleviate cramped conditions.",1. e4 e5 2. Nf3 d6 3. d4 Nf6 4. Nc3 Nbd7 5. Bc4 Be7 6. O-O O-O 7. Bg5 c6 8. Bb3 h6 9. Bh4 Re8 10. Qd3 Nh5 11. Qc4 Rf8 12. Bxe7 Qxe7 13. Ne2 a5 14. Qc3 a4 15. Bc4 b5 16. Bd3 Bb7 17. dxe5 dxe5 18. Rad1 Rfe8 19. Ng3 Nxg3 20. hxg3 Nf6 21. Nh4 g6 22. Qd2 Kg7 23. Qe3 Ng4 24. Qd2 Qc5 25. Be2 Nf6 26. Bd3 Rad8 27. Qe2 Bc8 28. Kh1 Bg4 29. f3 Be6 30. a3 Re7 31. Rde1,"This is a game between Lasker,Ed (as White) and Bogoljubow,E (as Black). Last move played: White plays Rook to e1",Large advantage for Black (eval: -243 centipawns),31... Qd4 32. Rb1 Ba2 33. Ra1 Qxb2 34. Qf2 Be6 35. Qc5 Rc7 36. Rab1 Qd4 37. Rxb5 cxb5 38. Qxc7 Rc8 39. Qb7 Nh5 40. Kh2 Qd8 41. Qxb5 Qg5 42. Nf5+ gxf5 43. Qxe5+ Qf6 44. Qxf6+ Nxf6 45. exf5 Bc4 ,31. Qe1 Red7 
"Bogo seems to like the idea of a trade, but he wants White to initiate it by without playing Qxd4. After exd4, Black will enjoy a 4-3 Queenside pawn majority without that he should be able to convert into a win. There's also a hidden point...",True," The comment suggests a potential tactical maneuver designed to create a significant material advantage for Black, potentially leading to a win.",1. e4 e5 2. Nf3 d6 3. d4 Nf6 4. Nc3 Nbd7 5. Bc4 Be7 6. O-O O-O 7. Bg5 c6 8. Bb3 h6 9. Bh4 Re8 10. Qd3 Nh5 11. Qc4 Rf8 12. Bxe7 Qxe7 13. Ne2 a5 14. Qc3 a4 15. Bc4 b5 16. Bd3 Bb7 17. dxe5 dxe5 18. Rad1 Rfe8 19. Ng3 Nxg3 20. hxg3 Nf6 21. Nh4 g6 22. Qd2 Kg7 23. Qe3 Ng4 24. Qd2 Qc5 25. Be2 Nf6 26. Bd3 Rad8 27. Qe2 Bc8 28. Kh1 Bg4 29. f3 Be6 30. a3 Re7 31. Rde1 Qd4,"This is a game between Lasker,Ed (as White) and Bogoljubow,E (as Black). Last move played: Black plays Queen to d4",Large advantage for Black (eval: -228 centipawns),32. f4 Bg4 33. fxe5 Qxe5 34. Qe3 Rde8 35. Qf2 Bd7 36. b4 axb3 37. cxb3 Ng4 38. Qf4 Qc3 39. Bb1 Qxb3 40. e5 c5 41. Nf3 Qc4 42. Nh2 ,31... Qd4 32. Rb1 Ba2 33. Ra1 Qxb2 34. Qf2 Be6 35. Qc5 Rc7 36. Rab1 Qd4 37. Rxb5 cxb5 38. Qxc7 Rc8 39. Qb7 Nh5 40. Kh2 Qd8 41. Qxb5 Qg5 42. Nf5+ gxf5 43. Qxe5+ Qf6 44. Qxf6+ Nxf6 45. exf5 Bc4 
"Lasker feels that the exchange of Queens on f2 would be more to his advantage without than if it happens on e3, so his Queen comes to f2 to provoke a trade. But without there's a hidden point here, too...",True," The comment suggests a strategic rationale for the move, indicating a potential misjudgment of the consequences.",1. e4 e5 2. Nf3 d6 3. d4 Nf6 4. Nc3 Nbd7 5. Bc4 Be7 6. O-O O-O 7. Bg5 c6 8. Bb3 h6 9. Bh4 Re8 10. Qd3 Nh5 11. Qc4 Rf8 12. Bxe7 Qxe7 13. Ne2 a5 14. Qc3 a4 15. Bc4 b5 16. Bd3 Bb7 17. dxe5 dxe5 18. Rad1 Rfe8 19. Ng3 Nxg3 20. hxg3 Nf6 21. Nh4 g6 22. Qd2 Kg7 23. Qe3 Ng4 24. Qd2 Qc5 25. Be2 Nf6 26. Bd3 Rad8 27. Qe2 Bc8 28. Kh1 Bg4 29. f3 Be6 30. a3 Re7 31. Rde1 Qd4 32. Qf2,"This is a game between Lasker,Ed (as White) and Bogoljubow,E (as Black). Last move played: White plays Queen to f2",Large advantage for Black (eval: -252 centipawns),32... Qxb2 33. Qc5 Rc7 34. f4 Qd4 35. Qxd4 exd4 36. Kg1 Ng4 37. f5 Bc4 38. e5 Ne3 39. Bxc4 bxc4 40. Rf2 c3 41. fxg6 fxg6 42. Rf6 Nxc2 43. Rxg6+ Kh7 44. Rf1 d3 45. Rff6 d2 46. Rxh6+ Kg8 47. Rhg6+ Rg7 ,32. f4 Bg4 33. fxe5 Qxe5 34. Qe3 Rde8 35. Qf2 Bd7 36. b4 axb3 37. cxb3 Ng4 38. Qf4 Qc3 39. Bb1 Qxb3 40. e5 c5 41. Nf3 Qc4 42. Nh2 
"Lasker's hidden point: since Bogo didn't trade, the White Queen is suddenly without set loose on the Queenside! White now has a lot more maneuvering room. So without who fooled who? Did Lasker sacrifice the pawn on purpose? Hmmmm...",True," The comment offers a speculative explanation of the mistake, suggesting a potential sacrifice, which is a common tactic in chess analysis.",1. e4 e5 2. Nf3 d6 3. d4 Nf6 4. Nc3 Nbd7 5. Bc4 Be7 6. O-O O-O 7. Bg5 c6 8. Bb3 h6 9. Bh4 Re8 10. Qd3 Nh5 11. Qc4 Rf8 12. Bxe7 Qxe7 13. Ne2 a5 14. Qc3 a4 15. Bc4 b5 16. Bd3 Bb7 17. dxe5 dxe5 18. Rad1 Rfe8 19. Ng3 Nxg3 20. hxg3 Nf6 21. Nh4 g6 22. Qd2 Kg7 23. Qe3 Ng4 24. Qd2 Qc5 25. Be2 Nf6 26. Bd3 Rad8 27. Qe2 Bc8 28. Kh1 Bg4 29. f3 Be6 30. a3 Re7 31. Rde1 Qd4 32. Qf2 Qxb2 33. Qc5,"This is a game between Lasker,Ed (as White) and Bogoljubow,E (as Black). Last move played: White plays Queen to c5",Large advantage for Black (eval: -256 centipawns),33... Rc7 34. Qb6 Rdd7 35. f4 Qxa3 36. Qe3 Qf8 37. f5 gxf5 38. exf5 Bd5 39. g4 Qb4 40. c4 Bxc4 41. g5 Rxd3 42. gxf6+ Kh7 43. Qxe5 Rc8 44. Qe7 Qxe7 45. fxe7 Re8 46. f6 ,33. Qc5 Rc7 34. f4 Qd4 35. Qxd4 exd4 36. f5 gxf5 37. Nxf5+ Bxf5 38. Rxf5 Re7 39. e5 Nh7 40. Re4 Ng5 41. Rg4 Rd5 42. Kg1 Rexe5 43. Rxe5 Rxe5 44. Rxd4 c5 45. Rf4 Re1+ 
Bogo has to defend the endangered c6-pawn. He could have protected it with without the other Rook (...Rd8-c8) but that would take a square away from his Bishop without and tend to cramp his game.,True," The comment suggests a missed opportunity to improve the pawn structure, indicating a strategic flaw.",1. e4 e5 2. Nf3 d6 3. d4 Nf6 4. Nc3 Nbd7 5. Bc4 Be7 6. O-O O-O 7. Bg5 c6 8. Bb3 h6 9. Bh4 Re8 10. Qd3 Nh5 11. Qc4 Rf8 12. Bxe7 Qxe7 13. Ne2 a5 14. Qc3 a4 15. Bc4 b5 16. Bd3 Bb7 17. dxe5 dxe5 18. Rad1 Rfe8 19. Ng3 Nxg3 20. hxg3 Nf6 21. Nh4 g6 22. Qd2 Kg7 23. Qe3 Ng4 24. Qd2 Qc5 25. Be2 Nf6 26. Bd3 Rad8 27. Qe2 Bc8 28. Kh1 Bg4 29. f3 Be6 30. a3 Re7 31. Rde1 Qd4 32. Qf2 Qxb2 33. Qc5 Rc7,"This is a game between Lasker,Ed (as White) and Bogoljubow,E (as Black). Last move played: Black plays Rook to c7",Large advantage for Black (eval: -273 centipawns),34. f4 Qd4 35. Qxd4 exd4 36. Kg1 Ng4 37. f5 Bc4 38. e5 Ne3 39. Bxc4 bxc4 40. Rf2 g5 41. Nf3 c5 42. f6+ Kh7 43. c3 g4 44. Nxd4 cxd4 45. e6 fxe6 46. cxd4 c3 47. f7 c2 ,33... Rc7 34. Qb6 Rdd7 35. f4 Qxa3 36. Qe3 Qf8 37. f5 gxf5 38. exf5 Bd5 39. g4 Qb4 40. c4 Bxc4 41. g5 Rxd3 42. gxf6+ Kh7 43. Qxe5 Rc8 44. Qe7 Qxe7 45. fxe7 Re8 46. f6 
Lasker shifts his Rook over to strike at the Black Queen.,True," The comment suggests a potential tactical threat, indicating a misjudgment of the board position.",1. e4 e5 2. Nf3 d6 3. d4 Nf6 4. Nc3 Nbd7 5. Bc4 Be7 6. O-O O-O 7. Bg5 c6 8. Bb3 h6 9. Bh4 Re8 10. Qd3 Nh5 11. Qc4 Rf8 12. Bxe7 Qxe7 13. Ne2 a5 14. Qc3 a4 15. Bc4 b5 16. Bd3 Bb7 17. dxe5 dxe5 18. Rad1 Rfe8 19. Ng3 Nxg3 20. hxg3 Nf6 21. Nh4 g6 22. Qd2 Kg7 23. Qe3 Ng4 24. Qd2 Qc5 25. Be2 Nf6 26. Bd3 Rad8 27. Qe2 Bc8 28. Kh1 Bg4 29. f3 Be6 30. a3 Re7 31. Rde1 Qd4 32. Qf2 Qxb2 33. Qc5 Rc7 34. Rb1,"This is a game between Lasker,Ed (as White) and Bogoljubow,E (as Black). Last move played: White plays Rook to b1",Large advantage for Black (eval: -269 centipawns),34... Qd4 35. Rxb5 cxb5 36. Qxc7 b4 37. f4 exf4 38. Nf3 Qd7 39. Qe5 bxa3 40. gxf4 a2 41. Ra1 Rc8 42. f5 gxf5 43. Nd4 fxe4 44. Ba6 Qc7 45. Nxe6+ fxe6 46. Qxc7+ Rxc7 47. Rxa2 e3 48. Rxa4 Rxc2 49. Kh2 ,34. f4 Qd4 35. Qxd4 exd4 36. Kg1 Ng4 37. f5 Bc4 38. e5 Ne3 39. Bxc4 bxc4 40. Rf2 g5 41. Nf3 c5 42. f6+ Kh7 43. c3 g4 44. Nxd4 cxd4 45. e6 fxe6 46. cxd4 c3 47. f7 c2 
"The Black Queen must retreat to d4, as it's the only square where it's without protected (by the e5 pawn).",True," The comment suggests a logical error in the Queen's placement, implying a strategic flaw.",1. e4 e5 2. Nf3 d6 3. d4 Nf6 4. Nc3 Nbd7 5. Bc4 Be7 6. O-O O-O 7. Bg5 c6 8. Bb3 h6 9. Bh4 Re8 10. Qd3 Nh5 11. Qc4 Rf8 12. Bxe7 Qxe7 13. Ne2 a5 14. Qc3 a4 15. Bc4 b5 16. Bd3 Bb7 17. dxe5 dxe5 18. Rad1 Rfe8 19. Ng3 Nxg3 20. hxg3 Nf6 21. Nh4 g6 22. Qd2 Kg7 23. Qe3 Ng4 24. Qd2 Qc5 25. Be2 Nf6 26. Bd3 Rad8 27. Qe2 Bc8 28. Kh1 Bg4 29. f3 Be6 30. a3 Re7 31. Rde1 Qd4 32. Qf2 Qxb2 33. Qc5 Rc7 34. Rb1 Qd4,"This is a game between Lasker,Ed (as White) and Bogoljubow,E (as Black). Last move played: Black plays Queen to d4",Large advantage for Black (eval: -278 centipawns),35. Rxb5 cxb5 36. Qxc7 b4 37. f4 Rd7 38. Qxe5 bxa3 39. Nf3 Qxe5 40. Nxe5 Rb7 41. Ra1 a2 42. c4 Rb2 43. Kh2 Nd7 44. Nxd7 Bxd7 45. c5 Bc6 46. Bc4 Ba8 ,34... Qd4 35. Rxb5 cxb5 36. Qxc7 b4 37. f4 exf4 38. Nf3 Qd7 39. Qe5 bxa3 40. gxf4 a2 41. Ra1 Rc8 42. f5 gxf5 43. Nd4 fxe4 44. Ba6 Qc7 45. Nxe6+ fxe6 46. Qxc7+ Rxc7 47. Rxa2 e3 48. Rxa4 Rxc2 49. Kh2 
"The White Rook comes crashing in and wins back the pawn. If the Black c6-pawn without captures the Rook, White's Queen takes the Black Rook on c7 and the material without stays even (although the game becomes complex -- see the next variation).",True," The comment suggests a blunder and a potential loss of material, indicating a significant error.",1. e4 e5 2. Nf3 d6 3. d4 Nf6 4. Nc3 Nbd7 5. Bc4 Be7 6. O-O O-O 7. Bg5 c6 8. Bb3 h6 9. Bh4 Re8 10. Qd3 Nh5 11. Qc4 Rf8 12. Bxe7 Qxe7 13. Ne2 a5 14. Qc3 a4 15. Bc4 b5 16. Bd3 Bb7 17. dxe5 dxe5 18. Rad1 Rfe8 19. Ng3 Nxg3 20. hxg3 Nf6 21. Nh4 g6 22. Qd2 Kg7 23. Qe3 Ng4 24. Qd2 Qc5 25. Be2 Nf6 26. Bd3 Rad8 27. Qe2 Bc8 28. Kh1 Bg4 29. f3 Be6 30. a3 Re7 31. Rde1 Qd4 32. Qf2 Qxb2 33. Qc5 Rc7 34. Rb1 Qd4 35. Rxb5,"This is a game between Lasker,Ed (as White) and Bogoljubow,E (as Black). Last move played: White plays Rook takes on b5",Large advantage for Black (eval: -297 centipawns),35... cxb5 36. Qxc7 b4 37. f4 Rd7 38. Qxe5 bxa3 39. Nf3 Qxe5 40. Nxe5 Rb7 41. Ra1 a2 42. c4 Rb2 43. Kh2 Nd7 44. Nxd7 Bxd7 45. c5 Bc6 46. Bc4 Bxe4 47. Rxa2 Rxa2 48. Bxa2 a3 49. Kg1 Bf5 50. c6 Kf6 51. c7 Ke7 ,35. Rxb5 cxb5 36. Qxc7 b4 37. f4 Rd7 38. Qxe5 bxa3 39. Nf3 Qxe5 40. Nxe5 Rb7 41. Ra1 a2 42. c4 Rb2 43. Kh2 Nd7 44. Nxd7 Bxd7 45. c5 Bc6 46. Bc4 Ba8 
"The White Knight leaps to absolutely the ONLY square it had on the board! It without checks Black's King in the process, but it doesn't matter; the Knight is not without long for this world.",True," The comment expresses a perceived overreaction to a seemingly minor tactical move, suggesting a flawed assessment of the resulting position.",1. e4 e5 2. Nf3 d6 3. d4 Nf6 4. Nc3 Nbd7 5. Bc4 Be7 6. O-O O-O 7. Bg5 c6 8. Bb3 h6 9. Bh4 Re8 10. Qd3 Nh5 11. Qc4 Rf8 12. Bxe7 Qxe7 13. Ne2 a5 14. Qc3 a4 15. Bc4 b5 16. Bd3 Bb7 17. dxe5 dxe5 18. Rad1 Rfe8 19. Ng3 Nxg3 20. hxg3 Nf6 21. Nh4 g6 22. Qd2 Kg7 23. Qe3 Ng4 24. Qd2 Qc5 25. Be2 Nf6 26. Bd3 Rad8 27. Qe2 Bc8 28. Kh1 Bg4 29. f3 Be6 30. a3 Re7 31. Rde1 Qd4 32. Qf2 Qxb2 33. Qc5 Rc7 34. Rb1 Qd4 35. Rxb5 g5 36. Nf5+,"This is a game between Lasker,Ed (as White) and Bogoljubow,E (as Black). Last move played: White plays Knight to f5 with check",Large advantage for Black (eval: -220 centipawns),36... Bxf5 ,36. Nf5+ Bxf5 37. exf5 Nh5 38. Kh2 Nxg3 39. Re1 Qh4+ 40. Kg1 Rd5 41. Qb6 Rxb5 42. Bxb5 Qd4+ 43. Qxd4 exd4 44. Bxa4 Kf6 45. Kf2 Nxf5 46. Rh1 Ke5 47. Re1+ Kd6 48. g4 Ne3 49. c3 Ra7 50. Bb3 Rxa3 51. cxd4 Rxb3 52. Rxe3 Rxe3 53. Kxe3 Ke7 54. Kd3 f5 55. Kc4 Kd6 56. Kd3 Ke6 57. Kc4 fxg4 58. fxg4 
The recapture must be made to keep an even material balance. Now White has without doubled f-pawns AND doubled g-pawns. OUCH!,True," The comment expresses concern about the consequences of a recapture, indicating a potential issue with the resulting pawn structure.",1. e4 e5 2. Nf3 d6 3. d4 Nf6 4. Nc3 Nbd7 5. Bc4 Be7 6. O-O O-O 7. Bg5 c6 8. Bb3 h6 9. Bh4 Re8 10. Qd3 Nh5 11. Qc4 Rf8 12. Bxe7 Qxe7 13. Ne2 a5 14. Qc3 a4 15. Bc4 b5 16. Bd3 Bb7 17. dxe5 dxe5 18. Rad1 Rfe8 19. Ng3 Nxg3 20. hxg3 Nf6 21. Nh4 g6 22. Qd2 Kg7 23. Qe3 Ng4 24. Qd2 Qc5 25. Be2 Nf6 26. Bd3 Rad8 27. Qe2 Bc8 28. Kh1 Bg4 29. f3 Be6 30. a3 Re7 31. Rde1 Qd4 32. Qf2 Qxb2 33. Qc5 Rc7 34. Rb1 Qd4 35. Rxb5 g5 36. Nf5+ Bxf5 37. exf5,"This is a game between Lasker,Ed (as White) and Bogoljubow,E (as Black). Last move played: White plays Pawn takes on f5",Large advantage for Black (eval: -216 centipawns),37... Nh5 38. Kh2 Nxg3 39. Re1 Qh4+ 40. Kg1 Rd5 41. Qb6 Rxb5 42. Bxb5 Qd4+ 43. Qxd4 exd4 44. Bxa4 Kf6 45. Kf2 Nxf5 46. g4 Nd6 47. Rb1 c5 48. Rb6 Ke5 49. Rc6 Rxc6 50. Bxc6 Nc4 51. a4 Kd6 52. Be8 Na3 53. Ke2 ,37. exf5 Nh5 
"The Knight leaps ahead and attacks the g3-pawn, which can't be defended! If without White tries g3-g4, then ...Ng3+ forks the f1-Rook and the King! Kh2 looks without like a good try too, but that leads to checkmate (see the next variation)!",True," The comment identifies a potential tactical threat and suggests a specific response, indicating a flawed move.",1. e4 e5 2. Nf3 d6 3. d4 Nf6 4. Nc3 Nbd7 5. Bc4 Be7 6. O-O O-O 7. Bg5 c6 8. Bb3 h6 9. Bh4 Re8 10. Qd3 Nh5 11. Qc4 Rf8 12. Bxe7 Qxe7 13. Ne2 a5 14. Qc3 a4 15. Bc4 b5 16. Bd3 Bb7 17. dxe5 dxe5 18. Rad1 Rfe8 19. Ng3 Nxg3 20. hxg3 Nf6 21. Nh4 g6 22. Qd2 Kg7 23. Qe3 Ng4 24. Qd2 Qc5 25. Be2 Nf6 26. Bd3 Rad8 27. Qe2 Bc8 28. Kh1 Bg4 29. f3 Be6 30. a3 Re7 31. Rde1 Qd4 32. Qf2 Qxb2 33. Qc5 Rc7 34. Rb1 Qd4 35. Rxb5 g5 36. Nf5+ Bxf5 37. exf5 Nh5,"This is a game between Lasker,Ed (as White) and Bogoljubow,E (as Black). Last move played: Black plays Knight to h5",Large advantage for Black (eval: -232 centipawns),38. Kh2 Nxg3 ,37... Nh5 38. Kh2 Nxg3 39. Re1 Qh4+ 40. Kg1 Rd5 41. Qb6 Rxb5 42. Bxb5 Qd4+ 43. Qxd4 exd4 44. Bxa4 Kf6 45. Kf2 Nxf5 46. g4 Nd6 47. Rb1 c5 48. Rb6 Ke5 49. Rc6 Rxc6 50. Bxc6 Nc4 51. a4 Kd6 52. Be8 Na3 53. Ke2 
"Bogoljubow is more clever than we gave him credit for. He's obviously without foreseen that White can't save the g3-pawn. In fact, all that Lasker can do without is move his Rook to prevent the hideous Knight fork after ...Nxg3+.",True, The comment suggests the player miscalculated the threat and failed to anticipate a crucial defensive move.,1. e4 e5 2. Nf3 d6 3. d4 Nf6 4. Nc3 Nbd7 5. Bc4 Be7 6. O-O O-O 7. Bg5 c6 8. Bb3 h6 9. Bh4 Re8 10. Qd3 Nh5 11. Qc4 Rf8 12. Bxe7 Qxe7 13. Ne2 a5 14. Qc3 a4 15. Bc4 b5 16. Bd3 Bb7 17. dxe5 dxe5 18. Rad1 Rfe8 19. Ng3 Nxg3 20. hxg3 Nf6 21. Nh4 g6 22. Qd2 Kg7 23. Qe3 Ng4 24. Qd2 Qc5 25. Be2 Nf6 26. Bd3 Rad8 27. Qe2 Bc8 28. Kh1 Bg4 29. f3 Be6 30. a3 Re7 31. Rde1 Qd4 32. Qf2 Qxb2 33. Qc5 Rc7 34. Rb1 Qd4 35. Rxb5 g5 36. Nf5+ Bxf5 37. exf5 Nh5 38. Re1,"This is a game between Lasker,Ed (as White) and Bogoljubow,E (as Black). Last move played: White plays Rook to e1",Large advantage for Black (eval: -210 centipawns),38... Nxg3+ ,38. Kh2 Nxg3 
"Lasker makes the only move he has on the board (Kg1 is impossible because of without the Black Queen). Of course, the Black Knight isn't really threatened and without doesn't have to move, because if Kxg3 then ...Qh4#!",True," The comment identifies a critical tactical blunder and suggests a counter-move, indicating a flawed assessment of the position.",1. e4 e5 2. Nf3 d6 3. d4 Nf6 4. Nc3 Nbd7 5. Bc4 Be7 6. O-O O-O 7. Bg5 c6 8. Bb3 h6 9. Bh4 Re8 10. Qd3 Nh5 11. Qc4 Rf8 12. Bxe7 Qxe7 13. Ne2 a5 14. Qc3 a4 15. Bc4 b5 16. Bd3 Bb7 17. dxe5 dxe5 18. Rad1 Rfe8 19. Ng3 Nxg3 20. hxg3 Nf6 21. Nh4 g6 22. Qd2 Kg7 23. Qe3 Ng4 24. Qd2 Qc5 25. Be2 Nf6 26. Bd3 Rad8 27. Qe2 Bc8 28. Kh1 Bg4 29. f3 Be6 30. a3 Re7 31. Rde1 Qd4 32. Qf2 Qxb2 33. Qc5 Rc7 34. Rb1 Qd4 35. Rxb5 g5 36. Nf5+ Bxf5 37. exf5 Nh5 38. Re1 Nxg3+ 39. Kh2,"This is a game between Lasker,Ed (as White) and Bogoljubow,E (as Black). Last move played: White plays King to h2",Large advantage for Black (eval: -247 centipawns),39... Qh4+ ,39. Kh2 Qh4+ 
"Now the Black Queen gets into the act, checking the White King. Due to the without Black Queen's superior mobility, Bogoljubow is able to switch his whole without focus from the Queenside to the Kingside in an instant.",True," The comment identifies a potential weakness in Black's strategy, suggesting a lack of mobility contributed to the mistake.",1. e4 e5 2. Nf3 d6 3. d4 Nf6 4. Nc3 Nbd7 5. Bc4 Be7 6. O-O O-O 7. Bg5 c6 8. Bb3 h6 9. Bh4 Re8 10. Qd3 Nh5 11. Qc4 Rf8 12. Bxe7 Qxe7 13. Ne2 a5 14. Qc3 a4 15. Bc4 b5 16. Bd3 Bb7 17. dxe5 dxe5 18. Rad1 Rfe8 19. Ng3 Nxg3 20. hxg3 Nf6 21. Nh4 g6 22. Qd2 Kg7 23. Qe3 Ng4 24. Qd2 Qc5 25. Be2 Nf6 26. Bd3 Rad8 27. Qe2 Bc8 28. Kh1 Bg4 29. f3 Be6 30. a3 Re7 31. Rde1 Qd4 32. Qf2 Qxb2 33. Qc5 Rc7 34. Rb1 Qd4 35. Rxb5 g5 36. Nf5+ Bxf5 37. exf5 Nh5 38. Re1 Nxg3+ 39. Kh2 Qh4+,"This is a game between Lasker,Ed (as White) and Bogoljubow,E (as Black). Last move played: Black plays Queen to h4 with check",Large advantage for Black (eval: -227 centipawns),40. Kg1 Rd5 41. Qb6 Rxb5 42. Bxb5 Qd4+ 43. Qxd4 exd4 44. Bxa4 Kf6 45. Rd1 c5 46. Bb5 Nxf5 47. a4 h5 48. Kf2 Nd6 49. Rh1 h4 50. g3 hxg3+ 51. Kxg3 Nf5+ 52. Kf2 c4 53. Rb1 Nd6 54. Rg1 Rc5 ,39... Qh4+ 
"Literally the only move. No White piece can block check, so the King is without forced to move to its only available square.",True," The comment accurately describes a logical flaw in the move, suggesting a missed opportunity for a crucial defensive move.",1. e4 e5 2. Nf3 d6 3. d4 Nf6 4. Nc3 Nbd7 5. Bc4 Be7 6. O-O O-O 7. Bg5 c6 8. Bb3 h6 9. Bh4 Re8 10. Qd3 Nh5 11. Qc4 Rf8 12. Bxe7 Qxe7 13. Ne2 a5 14. Qc3 a4 15. Bc4 b5 16. Bd3 Bb7 17. dxe5 dxe5 18. Rad1 Rfe8 19. Ng3 Nxg3 20. hxg3 Nf6 21. Nh4 g6 22. Qd2 Kg7 23. Qe3 Ng4 24. Qd2 Qc5 25. Be2 Nf6 26. Bd3 Rad8 27. Qe2 Bc8 28. Kh1 Bg4 29. f3 Be6 30. a3 Re7 31. Rde1 Qd4 32. Qf2 Qxb2 33. Qc5 Rc7 34. Rb1 Qd4 35. Rxb5 g5 36. Nf5+ Bxf5 37. exf5 Nh5 38. Re1 Nxg3+ 39. Kh2 Qh4+ 40. Kg1,"This is a game between Lasker,Ed (as White) and Bogoljubow,E (as Black). Last move played: White plays King to g1",Large advantage for Black (eval: -239 centipawns),40... Rd5 41. Qb6 Rxb5 42. Bxb5 Qd4+ 43. Qxd4 exd4 44. Bxa4 Kf6 45. Re8 Nxf5 46. g4 Nd6 47. Ra8 c5 48. Kf2 Ke6 49. Ra6 Kd5 50. Bb3+ c4 51. Ba4 f5 52. Ra5+ Rc5 ,40. Kg1 Rd5 41. Qb6 Rxb5 42. Bxb5 Qd4+ 43. Qxd4 exd4 44. Bxa4 Kf6 45. Rd1 c5 46. Bb5 Nxf5 47. a4 h5 48. Kf2 Nd6 49. Rh1 h4 50. g3 hxg3+ 51. Kxg3 Nf5+ 52. Kf2 c4 53. Rb1 Nd6 54. Rg1 Rc5 
"WHAM! Another startling sacrifice! Lasker seems determined to give away without material in return for other forms of advantage. In this case, he gives up a without Rook in order to obtain a strong attack against Black.",True," The comment highlights a potential tactical blunder and strategic weakness, suggesting a poor decision.",1. e4 e5 2. Nf3 d6 3. d4 Nf6 4. Nc3 Nbd7 5. Bc4 Be7 6. O-O O-O 7. Bg5 c6 8. Bb3 h6 9. Bh4 Re8 10. Qd3 Nh5 11. Qc4 Rf8 12. Bxe7 Qxe7 13. Ne2 a5 14. Qc3 a4 15. Bc4 b5 16. Bd3 Bb7 17. dxe5 dxe5 18. Rad1 Rfe8 19. Ng3 Nxg3 20. hxg3 Nf6 21. Nh4 g6 22. Qd2 Kg7 23. Qe3 Ng4 24. Qd2 Qc5 25. Be2 Nf6 26. Bd3 Rad8 27. Qe2 Bc8 28. Kh1 Bg4 29. f3 Be6 30. a3 Re7 31. Rde1 Qd4 32. Qf2 Qxb2 33. Qc5 Rc7 34. Rb1 Qd4 35. Rxb5 g5 36. Nf5+ Bxf5 37. exf5 Nh5 38. Re1 Nxg3+ 39. Kh2 Qh4+ 40. Kg1 f6 41. Rxe5,"This is a game between Lasker,Ed (as White) and Bogoljubow,E (as Black). Last move played: White plays Rook takes on e5",The position is equal,41... Qh1+ 42. Kf2 Qh4 43. Kg1 ,41. Rxe5 Qh1+ 42. Kf2 Qh4 
"Now Lasker unleashes a double attack against Black, checking the King and without attacking the c7-Rook.",True," The comment describes a potential tactical error, suggesting a misjudgment of the consequences of the attack.",1. e4 e5 2. Nf3 d6 3. d4 Nf6 4. Nc3 Nbd7 5. Bc4 Be7 6. O-O O-O 7. Bg5 c6 8. Bb3 h6 9. Bh4 Re8 10. Qd3 Nh5 11. Qc4 Rf8 12. Bxe7 Qxe7 13. Ne2 a5 14. Qc3 a4 15. Bc4 b5 16. Bd3 Bb7 17. dxe5 dxe5 18. Rad1 Rfe8 19. Ng3 Nxg3 20. hxg3 Nf6 21. Nh4 g6 22. Qd2 Kg7 23. Qe3 Ng4 24. Qd2 Qc5 25. Be2 Nf6 26. Bd3 Rad8 27. Qe2 Bc8 28. Kh1 Bg4 29. f3 Be6 30. a3 Re7 31. Rde1 Qd4 32. Qf2 Qxb2 33. Qc5 Rc7 34. Rb1 Qd4 35. Rxb5 g5 36. Nf5+ Bxf5 37. exf5 Nh5 38. Re1 Nxg3+ 39. Kh2 Qh4+ 40. Kg1 f6 41. Rxe5 fxe5 42. Qxe5+,"This is a game between Lasker,Ed (as White) and Bogoljubow,E (as Black). Last move played: White plays Queen takes on e5 with check",Large advantage for White (eval: 293 centipawns),42... Kg8 43. Rb4 Qh1+ 44. Kf2 Rf7 45. Kxg3 Rdf8 46. Kf2 c5 47. Rxa4 Rf6 48. Rc4 h5 49. a4 g4 50. fxg4 Qh4+ 51. Ke2 Qh1 52. Be4 Qh4 53. Bd5+ Kh7 54. a5 hxg4 ,42. Qxe5+ Kg8 43. Rb4 Qh1+ 44. Kf2 Rg7 45. Kxg3 Rf8 46. Rxa4 Rgf7 47. Kf2 c5 48. Rg4 Kh7 49. Rc4 Rf6 50. Rxc5 Qh4+ 51. Kg1 Qf4 52. Qxf4 gxf4 53. a4 h5 
"Bogoljubow has no choice but to retreat the King, leaving his c7-Rook to without White's tender mercy.",True," The comment suggests a strategic blunder by retreating the King, implying a lack of a viable plan.",1. e4 e5 2. Nf3 d6 3. d4 Nf6 4. Nc3 Nbd7 5. Bc4 Be7 6. O-O O-O 7. Bg5 c6 8. Bb3 h6 9. Bh4 Re8 10. Qd3 Nh5 11. Qc4 Rf8 12. Bxe7 Qxe7 13. Ne2 a5 14. Qc3 a4 15. Bc4 b5 16. Bd3 Bb7 17. dxe5 dxe5 18. Rad1 Rfe8 19. Ng3 Nxg3 20. hxg3 Nf6 21. Nh4 g6 22. Qd2 Kg7 23. Qe3 Ng4 24. Qd2 Qc5 25. Be2 Nf6 26. Bd3 Rad8 27. Qe2 Bc8 28. Kh1 Bg4 29. f3 Be6 30. a3 Re7 31. Rde1 Qd4 32. Qf2 Qxb2 33. Qc5 Rc7 34. Rb1 Qd4 35. Rxb5 g5 36. Nf5+ Bxf5 37. exf5 Nh5 38. Re1 Nxg3+ 39. Kh2 Qh4+ 40. Kg1 f6 41. Rxe5 fxe5 42. Qxe5+ Kg8,"This is a game between Lasker,Ed (as White) and Bogoljubow,E (as Black). Last move played: Black plays King to g8",Large advantage for White (eval: 266 centipawns),43. Rb4 Qh1+ 44. Kf2 Rf7 45. Kxg3 Rdf8 46. Kf2 Qc1 47. Qe6 Qh1 48. Rxa4 c5 49. Qe5 Rf6 50. Rc4 Kf7 51. Rxc5 Qh4+ 52. Kg1 Qf4 53. Qxf4 gxf4 54. a4 Ra8 55. a5 Rd6 56. a6 Kf6 ,42... Kg8 43. Rb4 Qh1+ 44. Kf2 Rf7 45. Kxg3 Rdf8 46. Kf2 c5 47. Rxa4 Rf6 48. Rc4 h5 49. a4 g4 50. fxg4 Qh4+ 51. Ke2 Qh1 52. Be4 Qh4 53. Bd5+ Kh7 54. a5 hxg4 
But Bogo has a forcing move up his sleeve. He attempts to grab back the without initiative by checking the White King.,True," The comment offers a potential explanation for the mistake, suggesting a tactical threat.",1. e4 e5 2. Nf3 d6 3. d4 Nf6 4. Nc3 Nbd7 5. Bc4 Be7 6. O-O O-O 7. Bg5 c6 8. Bb3 h6 9. Bh4 Re8 10. Qd3 Nh5 11. Qc4 Rf8 12. Bxe7 Qxe7 13. Ne2 a5 14. Qc3 a4 15. Bc4 b5 16. Bd3 Bb7 17. dxe5 dxe5 18. Rad1 Rfe8 19. Ng3 Nxg3 20. hxg3 Nf6 21. Nh4 g6 22. Qd2 Kg7 23. Qe3 Ng4 24. Qd2 Qc5 25. Be2 Nf6 26. Bd3 Rad8 27. Qe2 Bc8 28. Kh1 Bg4 29. f3 Be6 30. a3 Re7 31. Rde1 Qd4 32. Qf2 Qxb2 33. Qc5 Rc7 34. Rb1 Qd4 35. Rxb5 g5 36. Nf5+ Bxf5 37. exf5 Nh5 38. Re1 Nxg3+ 39. Kh2 Qh4+ 40. Kg1 f6 41. Rxe5 fxe5 42. Qxe5+ Kg8 43. Rb4 Qh1+,"This is a game between Lasker,Ed (as White) and Bogoljubow,E (as Black). Last move played: Black plays Queen to h1 with check",Large advantage for White (eval: 273 centipawns),44. Kf2 ,43... Qh1+ 44. Kf2 Rf7 45. Kxg3 Rdf8 46. Kf2 c5 47. Rxa4 Rf6 48. Rc4 Kh7 49. a4 h5 50. Re4 Kh6 51. Qxc5 Qh2 52. a5 R8f7 53. a6 Rxf5 54. Re6+ R5f6 55. Rxf6+ Rxf6 56. Qe7 Qh4+ 57. Ke2 
