comment,good,reasoning,moves,context,reformulated
B33: Sicilian: Pelikan and Sveshnikov Variations,True,"

The comment clarifies the mistake as a choice between the Pelikan or Sveshnikov variations within the Sicilian Defense, indicating a strategic decision error.",1. e4,"This is a game between Lutz, Ch (as White) and Kramnik, V. (as Black). Last move played: White plays Pawn to e4"," 'B33: In the Sicilian, Players often choose the Pelikan or Sveshnikov Variations for complex positions. However, this move by White has not aligned with these variations, indicating a strategic misstep.'"
last book move,False,"

The comment ""last book move"" does not explain the mistake made by the player, as it merely states the type of move (a move from a chess book) without providing any insight into why it was a mistake.",1. e4 c5 2. Nf3 Nc6 3. d4 cxd4 4. Nxd4 Nf6 5. Nc3 e5 6. Ndb5 d6 7. Bg5 a6 8. Na3 b5 9. Nd5 Be7 10. Bxf6 Bxf6 11. c3 O-O 12. Nc2 Bg5 13. a4 bxa4 14. Rxa4 a5 15. Bc4 Rb8 16. b3 Kh8 17. O-O g6 18. Qe2 Bd7 19. Rfa1 Bh6,"This is a game between Lutz, Ch (as White) and Kramnik, V. (as Black). Last move played: Black plays Bishop to h6",-
Consolidates f4,True,"

The comment explains the mistake because ""consolidating f4"" refers to the player making a move that weakens their pawn structure and potentially creates weaknesses for future attacks.",1. e4 c5 2. Nf3 Nc6 3. d4 cxd4 4. Nxd4 Nf6 5. Nc3 e5 6. Ndb5 d6 7. Bg5 a6 8. Na3 b5 9. Nd5 Be7 10. Bxf6 Bxf6 11. c3 O-O 12. Nc2 Bg5 13. a4 bxa4 14. Rxa4 a5 15. Bc4 Rb8 16. b3 Kh8 17. O-O g6 18. Qe2 Bd7 19. Rfa1 Bh6 20. g3,"This is a game between Lutz, Ch (as White) and Kramnik, V. (as Black). Last move played: White plays Pawn to g3"," White consolidates their f4 pawn.

This move weakens White's kingside pawn structure."
Black wins space.,True,"

The comment accurately explains the mistake made by the player because gaining space is a positive outcome in chess, suggesting that the player's move created more room for their pieces to maneuver and potentially control the board.",1. e4 c5 2. Nf3 Nc6 3. d4 cxd4 4. Nxd4 Nf6 5. Nc3 e5 6. Ndb5 d6 7. Bg5 a6 8. Na3 b5 9. Nd5 Be7 10. Bxf6 Bxf6 11. c3 O-O 12. Nc2 Bg5 13. a4 bxa4 14. Rxa4 a5 15. Bc4 Rb8 16. b3 Kh8 17. O-O g6 18. Qe2 Bd7 19. Rfa1 Bh6 20. g3 f5 21. exf5 gxf5 22. b4 e4,"This is a game between Lutz, Ch (as White) and Kramnik, V. (as Black). Last move played: Black plays Pawn to e4", White's pawn advance to e4 weakens Black's position.
He broke from his leash,True,"

The comment ""He broke from his leash"" aptly describes the mistake made by the player, likely referring to a loss of control and deviation from a planned or safer move.",1. e4 c5 2. Nf3 Nc6 3. d4 cxd4 4. Nxd4 Nf6 5. Nc3 e5 6. Ndb5 d6 7. Bg5 a6 8. Na3 b5 9. Nd5 Be7 10. Bxf6 Bxf6 11. c3 O-O 12. Nc2 Bg5 13. a4 bxa4 14. Rxa4 a5 15. Bc4 Rb8 16. b3 Kh8 17. O-O g6 18. Qe2 Bd7 19. Rfa1 Bh6 20. g3 f5 21. exf5 gxf5 22. b4 e4 23. bxa5 Ne5 24. Rb4 Rxb4 25. cxb4 f4 26. Nd4 e3 27. fxe3 f3,"This is a game between Lutz, Ch (as White) and Kramnik, V. (as Black). Last move played: Black plays Pawn to f3"," In this situation, Black played a move that was not effective."
The pressure on the isolated pawn grows,False,"

The comment does not explain the mistake made by the player, as it only comments on the potential consequences of the move without directly addressing the reason it was considered a mistake.",1. e4 c5 2. Nf3 Nc6 3. d4 cxd4 4. Nxd4 Nf6 5. Nc3 e5 6. Ndb5 d6 7. Bg5 a6 8. Na3 b5 9. Nd5 Be7 10. Bxf6 Bxf6 11. c3 O-O 12. Nc2 Bg5 13. a4 bxa4 14. Rxa4 a5 15. Bc4 Rb8 16. b3 Kh8 17. O-O g6 18. Qe2 Bd7 19. Rfa1 Bh6 20. g3 f5 21. exf5 gxf5 22. b4 e4 23. bxa5 Ne5 24. Rb4 Rxb4 25. cxb4 f4 26. Nd4 e3 27. fxe3 f3 28. Qa2 f2+ 29. Kg2 Qe8 30. Be2 Ng4,"This is a game between Lutz, Ch (as White) and Kramnik, V. (as Black). Last move played: Black plays Knight to g4",-
"sad, but how else could White save the game?.",False,"

This comment does not explain the mistake made by the player, as it implies regret but does not provide any insight into the specific error or suggest a better alternative move.",1. e4 c5 2. Nf3 Nc6 3. d4 cxd4 4. Nxd4 Nf6 5. Nc3 e5 6. Ndb5 d6 7. Bg5 a6 8. Na3 b5 9. Nd5 Be7 10. Bxf6 Bxf6 11. c3 O-O 12. Nc2 Bg5 13. a4 bxa4 14. Rxa4 a5 15. Bc4 Rb8 16. b3 Kh8 17. O-O g6 18. Qe2 Bd7 19. Rfa1 Bh6 20. g3 f5 21. exf5 gxf5 22. b4 e4 23. bxa5 Ne5 24. Rb4 Rxb4 25. cxb4 f4 26. Nd4 e3 27. fxe3 f3 28. Qa2 f2+ 29. Kg2 Qe8 30. Be2 Ng4 31. Bf3 Nxe3+ 32. Nxe3 Qxe3 33. Qxf2,"This is a game between Lutz, Ch (as White) and Kramnik, V. (as Black). Last move played: White plays Queen takes on f2",-
the final blow,False,"

The comment ""the final blow"" does not explain the mistake made by the player as it is vague and could refer to the end of a game or the outcome of a specific move, without indicating what was wrong with the move.",1. e4 c5 2. Nf3 Nc6 3. d4 cxd4 4. Nxd4 Nf6 5. Nc3 e5 6. Ndb5 d6 7. Bg5 a6 8. Na3 b5 9. Nd5 Be7 10. Bxf6 Bxf6 11. c3 O-O 12. Nc2 Bg5 13. a4 bxa4 14. Rxa4 a5 15. Bc4 Rb8 16. b3 Kh8 17. O-O g6 18. Qe2 Bd7 19. Rfa1 Bh6 20. g3 f5 21. exf5 gxf5 22. b4 e4 23. bxa5 Ne5 24. Rb4 Rxb4 25. cxb4 f4 26. Nd4 e3 27. fxe3 f3 28. Qa2 f2+ 29. Kg2 Qe8 30. Be2 Ng4 31. Bf3 Nxe3+ 32. Nxe3 Qxe3 33. Qxf2 Bh3+,"This is a game between Lutz, Ch (as White) and Kramnik, V. (as Black). Last move played: Black plays Bishop to h3 with check",-
Black now must not overlook the idea Re1,True,"

The comment correctly identifies a mistake by pointing out that Black needs to consider the move Re1, which would put pressure on the e6 pawn.",1. e4 c5 2. Nf3 Nc6 3. d4 cxd4 4. Nxd4 Nf6 5. Nc3 e5 6. Ndb5 d6 7. Bg5 a6 8. Na3 b5 9. Nd5 Be7 10. Bxf6 Bxf6 11. c3 O-O 12. Nc2 Bg5 13. a4 bxa4 14. Rxa4 a5 15. Bc4 Rb8 16. b3 Kh8 17. O-O g6 18. Qe2 Bd7 19. Rfa1 Bh6 20. g3 f5 21. exf5 gxf5 22. b4 e4 23. bxa5 Ne5 24. Rb4 Rxb4 25. cxb4 f4 26. Nd4 e3 27. fxe3 f3 28. Qa2 f2+ 29. Kg2 Qe8 30. Be2 Ng4 31. Bf3 Nxe3+ 32. Nxe3 Qxe3 33. Qxf2 Bh3+ 34. Kg1,"This is a game between Lutz, Ch (as White) and Kramnik, V. (as Black). Last move played: White plays King to g1"," White has just played King to g1. Black should be cautious not to ignore the potential threat of Re1, as it could be a strategic move."
