comment,good,reasoning,moves,context,engine_eval,engine_best_line,engine_best_alternative
"I have to make another observation here. I started playing 6.Bg5 here when I was less than 1400 rated, and my reasons for choosing it had nothing to do with the considerations that might be relavent to me today. However for a very long time I persisted in playing it exclusively, because it became the only line that I knew, and the disparity grew with every game that I played it again. I think that this is a common problem in the way that amateurs choose their opening repertoire.",True," The comment offers a potential explanation for the mistake, suggesting a reliance on a particular opening choice despite lack of strategic depth.",1. e4 c5 2. Nf3 d6 3. d4 cxd4 4. Nxd4 Nf6 5. Nc3 a6 6. Bg5,"This is a game between Hartwig, Thomas (as White) and Carl, Kevin (as Black). Last move played: White plays Bishop to g5",Slight advantage for White (eval: 32 centipawns),6... e6 ,6. Bg5 e6 
This turned out to be a very astute choice as I was much better prepared for the main line.,True," The comment suggests the move was strategically sound, potentially mitigating the mistake.",1. e4 c5 2. Nf3 d6 3. d4 cxd4 4. Nxd4 Nf6 5. Nc3 a6 6. Bg5 e6 7. f4 Be7 8. Qf3 Qa5,"This is a game between Hartwig, Thomas (as White) and Carl, Kevin (as Black). Last move played: Black plays Queen to a5",Advantage for White (eval: 71 centipawns),9. O-O-O Bd7 ,8... Qc7 9. O-O-O 
With the idea of Nd2-f3. White appears to have made some progress.,True," The comment suggests a potential positive development, indicating the move was not a mistake.",1. e4 c5 2. Nf3 d6 3. d4 cxd4 4. Nxd4 Nf6 5. Nc3 a6 6. Bg5 e6 7. f4 Be7 8. Qf3 Qa5 9. Nb3 Qc7 10. Bd3 Nbd7 11. O-O h6 12. Bh4 g5 13. fxg5 Ne5 14. Qe2 Nfg4 15. h3 Qb6+ 16. Kh1 hxg5 17. Bg3 Bd7 18. a4 Rc8 19. a5 Qc7 20. Kg1 Nf6 21. Nd2,"This is a game between Hartwig, Thomas (as White) and Carl, Kevin (as Black). Last move played: White plays Knight to d2",Large advantage for Black (eval: -128 centipawns),21... Nh5 ,21. Rf2 
"A last desperate fling? It might have been, except in fact I just missed 31... Re3.",True," The comment indicates a missed tactic, suggesting a poor strategic decision.",1. e4 c5 2. Nf3 d6 3. d4 cxd4 4. Nxd4 Nf6 5. Nc3 a6 6. Bg5 e6 7. f4 Be7 8. Qf3 Qa5 9. Nb3 Qc7 10. Bd3 Nbd7 11. O-O h6 12. Bh4 g5 13. fxg5 Ne5 14. Qe2 Nfg4 15. h3 Qb6+ 16. Kh1 hxg5 17. Bg3 Bd7 18. a4 Rc8 19. a5 Qc7 20. Kg1 Nf6 21. Nd2 Nh5 22. Bxe5 dxe5 23. Qf3 Bc5+ 24. Kh1 Nf4 25. Ne2 Bc6 26. Nxf4 gxf4 27. c3 Ke7 28. b4 Ba7 29. c4 Rcg8 30. b5,"This is a game between Hartwig, Thomas (as White) and Carl, Kevin (as Black). Last move played: White plays Pawn to b5",Large advantage for Black (eval: -285 centipawns),30... Rg3 31. Qe2 Re3 32. Qg4 Rxd3 33. Nf3 Bxe4 34. b6 Bxb6 35. axb6 Qxb6 36. Rab1 Qc7 37. Kh2 Kf8 38. Qg5 Rg8 39. Qh6+ Ke8 40. Rb2 Bxf3 41. gxf3 Qd7 42. Qh7 Rg3 43. Qh8+ Ke7 44. Qh4+ Kd6 ,30. Qe2 Be3 
This turned out to be a very astute choice as I was much better prepared for the main line.,True," The comment suggests a flaw in assessing the pawn structure, indicating a misjudgment of its impact.",1. e4 c5 2. Nf3 d6 3. d4 cxd4 4. Nxd4 Nf6 5. Nc3 a6 6. Bg5 e6 7. f4 Be7 8. Qf3 Qa5,"This is a game between Hartwig, Thomas (as White) and Carl, Kevin (as Black). Last move played: Black plays Queen to a5",Advantage for White (eval: 71 centipawns),9. O-O-O Bd7 ,8... Qc7 9. O-O-O 
"I have to make another observation here. I started playing 6.Bg5 here when I was less than 1400 rated, and my reasons for choosing it had nothing to do with the considerations that might be relavent to me today. However for a very long time I persisted in playing it exclusively, because it became the only line that I knew, and the disparity grew with every game that I played it again. I think that this is a common problem in the way that amateurs choose their opening repertoire.",True," The comment suggests the move didn't adequately address the weakening of dark squares, indicating a potential tactical flaw.",1. e4 c5 2. Nf3 d6 3. d4 cxd4 4. Nxd4 Nf6 5. Nc3 a6 6. Bg5,"This is a game between Hartwig, Thomas (as White) and Carl, Kevin (as Black). Last move played: White plays Bishop to g5",Slight advantage for White (eval: 32 centipawns),6... e6 ,6. Bg5 e6 
