comment,good,reasoning,moves,context
"Playing Adams in this tournament has been something akin to walking through a minefield. If Kasparov can get through unscathed he'll stay in the lead and get to the climactic matchup with Ponomariov in the next game. But, if he should lose he'll be the underdog in that big matchup. Adams or Shirov in the last round, could act as spoilers, but the fight is between Kasparov and Ponomariov.",False,"

The comment does not focus on the specific mistake made by the player; instead, it discusses potential outcomes and scenarios in the tournament.",1. e4 c5,"This is a game between Adams, Michael (as White) and Kasparov, Garri (as Black). Last move played: Black plays Pawn to c5"
"Wow, now this is something interesting. I've seen a New In Chess magazine theoretical article on 6. Qf3 and played 6. Bg5 e6 7. Qf3, but I've never seen it played after 6. Be3. The idea is usually to allow O-O-O without having Qd2 blocking the d-file and to be able to meet ...e6-e5 with Nd4-f5 (and possibly ...g7-g6 with Nf5-e3, so putting Be3 seems odd. It's weakness is that it blocks Pf2 from immediately moving to f4, so that means Black can use square e5 or at least he doesn't have to worry much about e4-e5.",True,"

The comment accurately explains the mistake made by the player, as it highlights the weakness introduced by 6. Be3, which blocks the f4 square and allows Black to take advantage of e5 or e4.",1. e4 c5 2. Nf3 d6 3. d4 cxd4 4. Nxd4 Nf6 5. Nc3 a6 6. Be3 e6 7. Qf3,"This is a game between Adams, Michael (as White) and Kasparov, Garri (as Black). Last move played: White plays Queen to f3"
preparing g2-g4-g5,True,"
This comment explains the mistake made by the player, as it highlights the aggressive pawn push that can lead to weaknesses in the pawn structure and potential vulnerabilities in the player's position.",1. e4 c5 2. Nf3 d6 3. d4 cxd4 4. Nxd4 Nf6 5. Nc3 a6 6. Be3 e6 7. Qf3 Nbd7 8. Be2,"This is a game between Adams, Michael (as White) and Kasparov, Garri (as Black). Last move played: White plays Bishop to e2"
"Yes, it prevents g2-g4, but what does Ke8 have to say about it? Does he feel safer now? I think Adams would be happy to have another weakness he can play against, without having extended his own position; just so he doesn't lose Qf3 because of it's exposure.",True,"

The comment explains the mistake made by the player by pointing out that the move weakens the king's position and creates vulnerability that the opponent can exploit, specifically mentioning a potential loss of the queen due to its exposure.",1. e4 c5 2. Nf3 d6 3. d4 cxd4 4. Nxd4 Nf6 5. Nc3 a6 6. Be3 e6 7. Qf3 Nbd7 8. Be2 h5,"This is a game between Adams, Michael (as White) and Kasparov, Garri (as Black). Last move played: Black plays Pawn to h5"
threat: ...Qa5xg5 and possibly in some cases ...Nf6xe4,True,"
The comment correctly identifies a potential mistake, as it points out the possible threats of capturing the opponent's queen and knight, which implies that the move could be leaving valuable pieces at risk.",1. e4 c5 2. Nf3 d6 3. d4 cxd4 4. Nxd4 Nf6 5. Nc3 a6 6. Be3 e6 7. Qf3 Nbd7 8. Be2 h5 9. Bg5 Qa5,"This is a game between Adams, Michael (as White) and Kasparov, Garri (as Black). Last move played: Black plays Queen to a5"
Apparently he's willing to go to some length to not create any weaknesses Kasparov might utilize/exploit.,False,"

The comment does not directly explain the mistake made by the player; it rather discusses the player's strategy to avoid weaknesses.",1. e4 c5 2. Nf3 d6 3. d4 cxd4 4. Nxd4 Nf6 5. Nc3 a6 6. Be3 e6 7. Qf3 Nbd7 8. Be2 h5 9. Bg5 Qa5 10. Bd2,"This is a game between Adams, Michael (as White) and Kasparov, Garri (as Black). Last move played: White plays Bishop to d2"
It would appear Black wants to play ...Nd7-e5-c4 or ...b7-b5 and ...Bc8-b7.,True,"

The comment accurately describes the potential mistake made by Black, suggesting that they might be planning to move their knight to e5 and c4 or bishop to b7, which could indicate a lack of proper piece coordination or a tactical oversight.",1. e4 c5 2. Nf3 d6 3. d4 cxd4 4. Nxd4 Nf6 5. Nc3 a6 6. Be3 e6 7. Qf3 Nbd7 8. Be2 h5 9. Bg5 Qa5 10. Bd2 Qb6 11. Nb3 Qc7,"This is a game between Adams, Michael (as White) and Kasparov, Garri (as Black). Last move played: Black plays Queen to c7"
"This move is slightly effective. It prevents ...b7-b5, so that after ...b7-b6 Pa6 will still need a defender. It also indicates White won't be castling to the queen-side and if he goes king-side one has to ask, ""Is Qf3 well placed?""",True,"

The comment describes the potential threats and weaknesses associated with the move, indicating that it does indeed reflect a mistake made by the player.",1. e4 c5 2. Nf3 d6 3. d4 cxd4 4. Nxd4 Nf6 5. Nc3 a6 6. Be3 e6 7. Qf3 Nbd7 8. Be2 h5 9. Bg5 Qa5 10. Bd2 Qb6 11. Nb3 Qc7 12. a4,"This is a game between Adams, Michael (as White) and Kasparov, Garri (as Black). Last move played: White plays Pawn to a4"
"In many instances this freezes Nd7 as defender of Nf6. But, Black could spend a tempo on ...Bf8-e7 to take over that duty.",True,"

The comment explains the mistake made by the player as it identifies the issue with the move and suggests a better alternative.",1. e4 c5 2. Nf3 d6 3. d4 cxd4 4. Nxd4 Nf6 5. Nc3 a6 6. Be3 e6 7. Qf3 Nbd7 8. Be2 h5 9. Bg5 Qa5 10. Bd2 Qb6 11. Nb3 Qc7 12. a4 b6 13. Bg5,"This is a game between Adams, Michael (as White) and Kasparov, Garri (as Black). Last move played: White plays Bishop to g5"
"Adams is slowly rearranging his pieces to suit his needs in regard to playing against the slightly odd Black position. He might yet O-O and play f2-f4, but he is wisely repositioning his queen to prevent ...Nd7-c5 from being effective. Of course, that doesn't prevent ...Nd7-e5-c4.",True,"
The comment correctly identifies Adams' strategic repositioning of his queen to counter Black's potential knight maneuver.",1. e4 c5 2. Nf3 d6 3. d4 cxd4 4. Nxd4 Nf6 5. Nc3 a6 6. Be3 e6 7. Qf3 Nbd7 8. Be2 h5 9. Bg5 Qa5 10. Bd2 Qb6 11. Nb3 Qc7 12. a4 b6 13. Bg5 Bb7 14. Rd1 Be7 15. Qe3,"This is a game between Adams, Michael (as White) and Kasparov, Garri (as Black). Last move played: White plays Queen to e3"
Why on earth is he avoiding that knight trade? Now Rd1 is blocked and Black can hardly be worse.,True,"

The comment accurately explains the player's mistake by highlighting the missed opportunity for a knight trade and the resulting disadvantage for Black.",1. e4 c5 2. Nf3 d6 3. d4 cxd4 4. Nxd4 Nf6 5. Nc3 a6 6. Be3 e6 7. Qf3 Nbd7 8. Be2 h5 9. Bg5 Qa5 10. Bd2 Qb6 11. Nb3 Qc7 12. a4 b6 13. Bg5 Bb7 14. Rd1 Be7 15. Qe3 Nc5 16. Nd2,"This is a game between Adams, Michael (as White) and Kasparov, Garri (as Black). Last move played: White plays Knight to d2"
"Kasparov was fully prepared to have his Ng4 captured. With or without that he was hitting Ph2, so that ...d6-d5 could clear the way for ...Qc7xh2#. He wasn't going to ...O-O anyway, so this just gives Rh8 a way to play. That Black gains the two bishops is probably incidental, but may prove useful later.",True,"

The comment analyzes the consequences of the move in terms of positional play, suggesting that even if the knight is captured, the player's strategy of advancing the pawn and attacking with the queen is sound, and the loss of the knight may not be a significant disadvantage.",1. e4 c5 2. Nf3 d6 3. d4 cxd4 4. Nxd4 Nf6 5. Nc3 a6 6. Be3 e6 7. Qf3 Nbd7 8. Be2 h5 9. Bg5 Qa5 10. Bd2 Qb6 11. Nb3 Qc7 12. a4 b6 13. Bg5 Bb7 14. Rd1 Be7 15. Qe3 Nc5 16. Nd2 Rd8 17. O-O Ng4 18. Bxg4 hxg4,"This is a game between Adams, Michael (as White) and Kasparov, Garri (as Black). Last move played: Black plays Pawn takes on g4"
"And this is the result. Pe4 is en prise and Ph2 is very weak; if Black were to double rooks on the h-file it would probably fall. The open f-file isn't so bad for Black. He could play ...f7-f6 in a pinch, but Pg4 is quite weak. One Black advantage which could easily be overlooked is that his king is centralized and would be better in an endgame (I think the current situation is too complicated to be called an endgame and neither king would feel safe playing offensively) .",True,"

The comment accurately identifies the weaknesses in Black's position, specifically the vulnerability of the pawns and the lack of king safety, which would indeed make the move a mistake.",1. e4 c5 2. Nf3 d6 3. d4 cxd4 4. Nxd4 Nf6 5. Nc3 a6 6. Be3 e6 7. Qf3 Nbd7 8. Be2 h5 9. Bg5 Qa5 10. Bd2 Qb6 11. Nb3 Qc7 12. a4 b6 13. Bg5 Bb7 14. Rd1 Be7 15. Qe3 Nc5 16. Nd2 Rd8 17. O-O Ng4 18. Bxg4 hxg4 19. Bxe7 d5 20. Qg3 Qxg3 21. fxg3 Kxe7,"This is a game between Adams, Michael (as White) and Kasparov, Garri (as Black). Last move played: Black plays King takes on e7"
"This creates a small conundrum for Black. If he recaptures with the bishop to keep the d-file open he has to allow Nc3xd5, but a pawn recapture blocks Bb7.",True,"

The comment accurately explains the dilemma faced by Black after White played Nc3 in the given position, highlighting a tactical situation that results from the move.",1. e4 c5 2. Nf3 d6 3. d4 cxd4 4. Nxd4 Nf6 5. Nc3 a6 6. Be3 e6 7. Qf3 Nbd7 8. Be2 h5 9. Bg5 Qa5 10. Bd2 Qb6 11. Nb3 Qc7 12. a4 b6 13. Bg5 Bb7 14. Rd1 Be7 15. Qe3 Nc5 16. Nd2 Rd8 17. O-O Ng4 18. Bxg4 hxg4 19. Bxe7 d5 20. Qg3 Qxg3 21. fxg3 Kxe7 22. exd5,"This is a game between Adams, Michael (as White) and Kasparov, Garri (as Black). Last move played: White plays Pawn takes on d5"
"This was certainly one of the more curious oddly intricate games. It might have been the game of the tournament if he'd played 26. Nxe4 and went on to win. But, unlike the other players who've upset one another, this game (and the result) are more according to Kasparov's plan and he remains in first place.",False,"

The comment does not directly explain the mistake made by the player, as it mainly discusses the game's intricate nature, Kasparov's plan, and the overall tournament standings rather than specific move evaluation.",1. e4 c5 2. Nf3 d6 3. d4 cxd4 4. Nxd4 Nf6 5. Nc3 a6 6. Be3 e6 7. Qf3 Nbd7 8. Be2 h5 9. Bg5 Qa5 10. Bd2 Qb6 11. Nb3 Qc7 12. a4 b6 13. Bg5 Bb7 14. Rd1 Be7 15. Qe3 Nc5 16. Nd2 Rd8 17. O-O Ng4 18. Bxg4 hxg4 19. Bxe7 d5 20. Qg3 Qxg3 21. fxg3 Kxe7 22. exd5 exd5 23. Rde1+ Kf8 24. b4 Ne4 25. Ncxe4 dxe4 26. Nc4 Rh5 27. Nxb6 Rd6 28. Nc4 Rd4 29. Ne3 Rxb4 30. Rd1 Re5 31. Rd7 Re7 32. Rd8+ Re8 33. Rd7 Re7 34. Rd8+,"This is a game between Adams, Michael (as White) and Kasparov, Garri (as Black). Last move played: White plays Rook to d8 with check"
