comment,good,reasoning,moves,context,engine_eval,engine_best_line,engine_best_alternative
"After the carnage inflicted by Kasparov in round 5, Karpov wisely sidesteps any possibility of repetition by avoiding the main-line.",True," The comment suggests a strategic decision to avoid a predictable pattern, implying a flawed tactical or positional assessment.",1. e4 c6 2. d4 d5 3. e5 Bf5 4. Nc3 Qb6,"This is a game between Grischuk, A. (as White) and Karpov, An (as Black). Last move played: Black plays Queen to b6",Advantage for White (eval: 72 centipawns),5. g4 Bd7 ,4... e6 
"More often seen is 7 ..Nd7, but there is no real difference here as the line tends to go 7 .. Nd7 8 b3 Bg4.",True," The comment identifies a common tactical sequence, suggesting a misjudgment of the resulting position.",1. e4 c6 2. d4 d5 3. e5 Bf5 4. Nc3 Qb6 5. Nf3 e6 6. Be2 Ne7 7. O-O Bg4,"This is a game between Grischuk, A. (as White) and Karpov, An (as Black). Last move played: Black plays Bishop to g4",Advantage for White (eval: 76 centipawns),8. h3 ,7... Nd7 8. Na4 
This may be a bit too committal - Grischuk can take advantage of Karpov's lack of development to open the game now. Maybe the cautious 9 ..Nd7 was to be preffered.,True," The comment suggests a strategic maneuver that could have been more solid, indicating a flawed assessment of the position.",1. e4 c6 2. d4 d5 3. e5 Bf5 4. Nc3 Qb6 5. Nf3 e6 6. Be2 Ne7 7. O-O Bg4 8. Na4 Qc7 9. b3 b5,"This is a game between Grischuk, A. (as White) and Karpov, An (as Black). Last move played: Black plays Pawn to b5",Advantage for White (eval: 88 centipawns),10. Nb2 ,9... Ng6 10. h3 Bxf3 11. Bxf3 Nd7 12. c3 b5 13. Nb2 Ba3 14. Bg4 O-O 15. f4 Ne7 16. Nd3 Bxc1 17. Qxc1 g6 18. Qe3 Rac8 19. Rae1 c5 20. f5 Nxf5 21. Bxf5 
The locked in bishop on h4 causes Karpov trouble.,True," Yes, the comment identifies a specific tactical vulnerability that led to the mistake.",1. e4 c6 2. d4 d5 3. e5 Bf5 4. Nc3 Qb6 5. Nf3 e6 6. Be2 Ne7 7. O-O Bg4 8. Na4 Qc7 9. b3 b5 10. Nb2 Nd7 11. c4 bxc4 12. bxc4 dxc4 13. Ng5 Bxe2 14. Qxe2 Nb6 15. Nxc4 Nf5 16. Rd1 Be7 17. Nf3 Nxc4 18. Qxc4 Qd7 19. g4 Nh4 20. Nxh4 Bxh4 21. g5 h6 22. d5 hxg5 23. Qxc6 Rc8 24. Qxd7+ Kxd7 25. d6 f6,"This is a game between Grischuk, A. (as White) and Karpov, An (as Black). Last move played: Black plays Pawn to f6",Slight advantage for White (eval: 29 centipawns),26. Be3 a6 27. Rab1 Rb8 28. Rdc1 fxe5 29. Bb6 e4 30. Rc7+ Kxd6 31. Rxg7 Rhc8 32. Rd1+ Ke5 33. Bd4+ Kf5 34. Rf7+ Kg6 35. Rf6+ Kh5 36. Be3 Rf8 37. Rxf8 Rxf8 38. Rd6 Kg4 39. Kg2 Kf5 40. Rxa6 g4 41. a4 Rc8 42. Ra7 Bg5 ,25... f6 
The rest is academic now: White easily wins.,True," The comment expresses a dismissive and overly confident assessment of the move, indicating a lack of understanding of the strategic implications.",1. e4 c6 2. d4 d5 3. e5 Bf5 4. Nc3 Qb6 5. Nf3 e6 6. Be2 Ne7 7. O-O Bg4 8. Na4 Qc7 9. b3 b5 10. Nb2 Nd7 11. c4 bxc4 12. bxc4 dxc4 13. Ng5 Bxe2 14. Qxe2 Nb6 15. Nxc4 Nf5 16. Rd1 Be7 17. Nf3 Nxc4 18. Qxc4 Qd7 19. g4 Nh4 20. Nxh4 Bxh4 21. g5 h6 22. d5 hxg5 23. Qxc6 Rc8 24. Qxd7+ Kxd7 25. d6 f6 26. Be3 a5 27. Rab1 Rb8 28. Bb6 fxe5 29. Rdc1 e4 30. Rc7+ Kxd6 31. Rxg7 Rhc8 32. Rd1+ Ke5 33. Be3 Kf6 34. Rdd7 Rd8 35. Bxg5+ Bxg5 36. Rdf7+ Ke5 37. Rxg5+ Kd4 38. Ra7 Rb1+ 39. Kg2 Rb2 40. Raxa5 Rf8 41. Ra4+ Kd3 42. Rg3+ Kd2 43. Rxe4,"This is a game between Grischuk, A. (as White) and Karpov, An (as Black). Last move played: White plays Rook takes on e4",Large advantage for White (eval: 389 centipawns),43... Rxa2 44. Rxe6 Ra4 45. Ree3 Rfa8 46. h3 R8a7 47. Rg4 R4a6 48. Rd4+ Kc1 49. Rde4 Rd6 50. Rg4 Kd2 51. Rgg3 Rf7 52. Ref3 Rb7 53. Ra3 Kc1 54. f4 Rd2+ 55. Kf3 ,43. Rxe4 Rxa2 44. Rxe6 Rd8 45. h3 Rd4 46. Ree3 Rc2 47. Rg4 Rd8 48. h4 Rf8 49. Rf3 Rh8 50. Rh3 Rf8 51. h5 Ke2 52. Re3+ Kd2 53. Rgg3 Rc5 54. Rh3 Rff5 55. h6 
