comment,good,reasoning,moves,context,engine_eval,engine_best_line,engine_best_alternative
"I don't know how much fighting spirit is left in these two. They've both had their ups and downs and probably feel there's little chance to climb back into the fight for first place. Adams has played five decisive games, so there's no doubt any of his games might follow suit.",True," The comment suggests the player’s recent performance is inconsistent and lacks momentum, potentially indicating a strategic error.",1. e4 c5,"This is a game between Adams, Michael (as White) and Shirov, Alexei (as Black). Last move played: Black plays Pawn to c5",Slight advantage for White (eval: 34 centipawns),2. Nf3 ,1... e5 2. Nf3 Nc6 3. d4 exd4 4. Nxd4 Bc5 5. Nb3 Bb6 6. a4 Qh4 7. Qf3 a5 8. g3 Qf6 9. Qe2 Nge7 10. Nc3 
"While it was odd for Kasparov to use this against Shirov it makes more sense for Adams. Still, it's odd that two players would choose this when facing Shirov.",True," The comment identifies a potential reason for the mistake, suggesting a strategic mismatch.",1. e4 c5 2. Nf3 Nc6 3. Bb5,"This is a game between Adams, Michael (as White) and Shirov, Alexei (as Black). Last move played: White plays Bishop to b5",Slight advantage for White (eval: 30 centipawns),3... e6 ,3. Bb5 g6 
I like this move because it makes Bb5 less effective. It can't force doubled pawns by capturing Nc6.,True, The comment identifies a specific tactical flaw – the inability to create doubled pawns – which directly contributes to the mistake.,1. e4 c5 2. Nf3 Nc6 3. Bb5 e6 4. O-O Nge7,"This is a game between Adams, Michael (as White) and Shirov, Alexei (as Black). Last move played: Black plays Knight to e7",Slight advantage for White (eval: 39 centipawns),5. d4 ,4... Nge7 
"Clearly one of White's aims is to keep his pawns supported, so he can get in d2-d4 without a major disruption. How does Black prevent this ""obvious"" plan?",True," The comment attempts to explain the mistake by suggesting a defensive strategy, but it doesn't directly address the flawed move itself.",1. e4 c5 2. Nf3 Nc6 3. Bb5 e6 4. O-O Nge7 5. c3 a6 6. Ba4 b5 7. Bc2 Bb7 8. Qe2,"This is a game between Adams, Michael (as White) and Shirov, Alexei (as Black). Last move played: White plays Queen to e2",The position is equal,8... d5 9. d4 cxd4 10. Rd1 g6 11. cxd4 dxe4 12. Bxe4 Bg7 13. Nc3 O-O 14. h4 Qc7 15. h5 Rad8 16. Be3 h6 17. Rac1 ,8. Re1 Rc8 
trying to undermine Pd4 and exchange a minor piece to ease Black's slight cramp,True," The comment suggests a strategic maneuver to alleviate a positional weakness, potentially indicating a flawed plan.",1. e4 c5 2. Nf3 Nc6 3. Bb5 e6 4. O-O Nge7 5. c3 a6 6. Ba4 b5 7. Bc2 Bb7 8. Qe2 Ng6 9. d4 cxd4 10. cxd4 Nh4,"This is a game between Adams, Michael (as White) and Shirov, Alexei (as Black). Last move played: Black plays Knight to h4",Advantage for White (eval: 57 centipawns),11. Nbd2 ,10... Be7 11. Nc3 
"This blocks Bc1 for the moment, but it makes room for Bc2-b1 (if needed) and defends Pe4 again.",True," The comment suggests a defensive move that addresses a potential weakness, indicating a mistake.",1. e4 c5 2. Nf3 Nc6 3. Bb5 e6 4. O-O Nge7 5. c3 a6 6. Ba4 b5 7. Bc2 Bb7 8. Qe2 Ng6 9. d4 cxd4 10. cxd4 Nh4 11. Nbd2,"This is a game between Adams, Michael (as White) and Shirov, Alexei (as Black). Last move played: White plays Knight to d2",Advantage for White (eval: 50 centipawns),11... Rc8 12. Bb1 Qf6 13. Nxh4 Qxh4 14. Nf3 Qh5 15. a4 bxa4 16. Bd2 Bd6 17. e5 Bc7 18. Re1 Ne7 19. Be4 Bxe4 20. Qxe4 Nd5 21. Qc2 O-O 22. Qxa4 a5 23. Qxd7 Bb6 24. Qb5 Qf5 ,11. Nbd2 
"The bishop may take an odd route (Bf8-d6-b8-a7) to find a weak White pawn it can target. This is the kind of contortions one has to endure when the opening play hasn't secured adequate space for the pieces. I suppose I should add, though it's guesswork, that Shirov may have played this way to provoke Adams into rash pawn moves which might weaken his position so that Shirov could counter-attack successfully. It's an odd thought though. Adams isn't known for doing anything rashly or out of control.",True," The comment offers potential insights into the player's thought process, suggesting a tactical analysis and a possible strategic intention.",1. e4 c5 2. Nf3 Nc6 3. Bb5 e6 4. O-O Nge7 5. c3 a6 6. Ba4 b5 7. Bc2 Bb7 8. Qe2 Ng6 9. d4 cxd4 10. cxd4 Nh4 11. Nbd2 Rc8 12. Bb1 Bd6,"This is a game between Adams, Michael (as White) and Shirov, Alexei (as Black). Last move played: Black plays Bishop to d6",Advantage for White (eval: 65 centipawns),13. a4 Nxf3+ ,12... Qf6 
"From here the knight defends Pa6 and keeps Ra4 inactive. After an e4-e5 it could go back ...Nb4-d5. However, it's tied to Bd6, so e4-e5 would shove ...Bd6-e7 which isn't a very active square for the bishop.",True," The comment identifies a potential tactical error by tying the knight to a passive square, suggesting a missed opportunity for more active piece development.",1. e4 c5 2. Nf3 Nc6 3. Bb5 e6 4. O-O Nge7 5. c3 a6 6. Ba4 b5 7. Bc2 Bb7 8. Qe2 Ng6 9. d4 cxd4 10. cxd4 Nh4 11. Nbd2 Rc8 12. Bb1 Bd6 13. a4 bxa4 14. Rxa4 Nxf3+ 15. Nxf3 Nb4,"This is a game between Adams, Michael (as White) and Shirov, Alexei (as Black). Last move played: Black plays Knight to b4",Advantage for White (eval: 80 centipawns),16. Bd2 ,15... Nb4 16. Bd2 
"White immediately challenges this ""bone in his throat"". Adams is the kind of player who will emphasize coordination and mobility for his pieces. It's a little unusual for an 1. e4 player, but, it doesn't take much effort to recall how effective GM Anatoly Karpov was with 1. e4.",True," The comment suggests Karpov's tactical brilliance and strategic understanding, potentially highlighting a flaw in White's move.",1. e4 c5 2. Nf3 Nc6 3. Bb5 e6 4. O-O Nge7 5. c3 a6 6. Ba4 b5 7. Bc2 Bb7 8. Qe2 Ng6 9. d4 cxd4 10. cxd4 Nh4 11. Nbd2 Rc8 12. Bb1 Bd6 13. a4 bxa4 14. Rxa4 Nxf3+ 15. Nxf3 Nb4 16. Bd2,"This is a game between Adams, Michael (as White) and Shirov, Alexei (as Black). Last move played: White plays Bishop to d2",Advantage for White (eval: 82 centipawns),16... Qb6 17. Qd1 ,16. Bd2 
"This secures Nb4, but it also forces Nb4 to remain because it defends Pa5 from Ra4 & Bd2. It also sneakily (perhaps by accident) threatens ...Bb7-a6!",True," The comment describes a potentially deceptive move that sacrifices a piece for a future advantage, suggesting a flawed strategic assessment.",1. e4 c5 2. Nf3 Nc6 3. Bb5 e6 4. O-O Nge7 5. c3 a6 6. Ba4 b5 7. Bc2 Bb7 8. Qe2 Ng6 9. d4 cxd4 10. cxd4 Nh4 11. Nbd2 Rc8 12. Bb1 Bd6 13. a4 bxa4 14. Rxa4 Nxf3+ 15. Nxf3 Nb4 16. Bd2 a5,"This is a game between Adams, Michael (as White) and Shirov, Alexei (as Black). Last move played: Black plays Pawn to a5",Advantage for White (eval: 73 centipawns),17. Re1 O-O ,16... a5 
"Now it's clear Black is trying to box-in Qe2 and threatens ...Bb7-a6 to chase her back further. Black can't challenge Pd4 & Pe4, but he can play around them with good effect.",True," The comment identifies a potential positional threat and suggests a strategic maneuver, indicating a flawed move.",1. e4 c5 2. Nf3 Nc6 3. Bb5 e6 4. O-O Nge7 5. c3 a6 6. Ba4 b5 7. Bc2 Bb7 8. Qe2 Ng6 9. d4 cxd4 10. cxd4 Nh4 11. Nbd2 Rc8 12. Bb1 Bd6 13. a4 bxa4 14. Rxa4 Nxf3+ 15. Nxf3 Nb4 16. Bd2 a5 17. Rd1 O-O 18. Bc3 Qb6 19. Ra1 Bf4,"This is a game between Adams, Michael (as White) and Shirov, Alexei (as Black). Last move played: Black plays Bishop to f4",Large advantage for White (eval: 108 centipawns),20. Ne5 Bxe5 ,19... f6 20. h4 
"This creates a kind of wall on the e-file. Black's queen-side pieces will find it difficult to cross that wall to help defend Kg8. White might use Ra1-a3, Bc3-d4, Ra3-g3 to bring at least one more big piece to the king-side. There is also Bc3-d2-h6, but Pe5 needs defense.",True," The comment offers potential tactical and strategic reasons for the mistake, suggesting a problematic pawn structure and piece placement.",1. e4 c5 2. Nf3 Nc6 3. Bb5 e6 4. O-O Nge7 5. c3 a6 6. Ba4 b5 7. Bc2 Bb7 8. Qe2 Ng6 9. d4 cxd4 10. cxd4 Nh4 11. Nbd2 Rc8 12. Bb1 Bd6 13. a4 bxa4 14. Rxa4 Nxf3+ 15. Nxf3 Nb4 16. Bd2 a5 17. Rd1 O-O 18. Bc3 Qb6 19. Ra1 Bf4 20. Ne5 Qc7 21. Qg4 Bxe5 22. dxe5,"This is a game between Adams, Michael (as White) and Shirov, Alexei (as Black). Last move played: White plays Pawn takes on e5",Large advantage for White (eval: 139 centipawns),22... Nc6 23. f4 Ba6 24. h3 h6 25. Kh2 Kh7 26. Rd6 Bb5 27. Bc2 Rg8 28. Rd2 Rb8 29. Qg3 a4 30. Bxa4 Qa7 31. b3 Bxa4 32. bxa4 Rb3 33. Rc2 Rc8 34. a5 Qc5 ,22. dxe5 
"Black might be preparing ...f7-f6 since Qf4 isn't defended, but any move (s) such as that would end up opening lines to Kh8.",True," The comment suggests a potential tactical weakness due to the move, indicating a flawed assessment of the resulting position.",1. e4 c5 2. Nf3 Nc6 3. Bb5 e6 4. O-O Nge7 5. c3 a6 6. Ba4 b5 7. Bc2 Bb7 8. Qe2 Ng6 9. d4 cxd4 10. cxd4 Nh4 11. Nbd2 Rc8 12. Bb1 Bd6 13. a4 bxa4 14. Rxa4 Nxf3+ 15. Nxf3 Nb4 16. Bd2 a5 17. Rd1 O-O 18. Bc3 Qb6 19. Ra1 Bf4 20. Ne5 Qc7 21. Qg4 Bxe5 22. dxe5 Bc6 23. h4 Kh8 24. Ra3 Rg8 25. h5 h6 26. Qf4 Rcf8,"This is a game between Adams, Michael (as White) and Shirov, Alexei (as Black). Last move played: Black plays Rook to f8",Large advantage for White (eval: 123 centipawns),27. Rc1 Qb6 ,26... Qb6 27. Rd6 
probably hoping for ...Bb5-e2xh5-g6,True," Yes, the comment suggests a possible tactical error hoping for a specific pawn structure.",1. e4 c5 2. Nf3 Nc6 3. Bb5 e6 4. O-O Nge7 5. c3 a6 6. Ba4 b5 7. Bc2 Bb7 8. Qe2 Ng6 9. d4 cxd4 10. cxd4 Nh4 11. Nbd2 Rc8 12. Bb1 Bd6 13. a4 bxa4 14. Rxa4 Nxf3+ 15. Nxf3 Nb4 16. Bd2 a5 17. Rd1 O-O 18. Bc3 Qb6 19. Ra1 Bf4 20. Ne5 Qc7 21. Qg4 Bxe5 22. dxe5 Bc6 23. h4 Kh8 24. Ra3 Rg8 25. h5 h6 26. Qf4 Rcf8 27. Bd4 Bb5,"This is a game between Adams, Michael (as White) and Shirov, Alexei (as Black). Last move played: Black plays Bishop to b5",Large advantage for White (eval: 112 centipawns),28. Rg3 Qc4 29. Bc3 Kh7 30. Qf3 Qc5 31. Rd2 Nc6 32. Qf4 Qe7 33. Qe3 Rb8 34. f4 Qh4 35. f5 ,27... Bb5 28. Rc3 
"This is most direct to the point. He could have played Bc5-d6, but that isn't really necessary. Only if counter-play via the capture of e5 was going to be effective would White take the time to prevent it. In the final position Black can't do much. If 31...Bh5-g6 Rxh6+ forces mate and 31...g5 allows 32. Qf6+ and 33. Rxh5, winning the piece and/or checkmating. This has got to be one of the strangest tournaments for Adams. That's six decisive games out of ten!",True," The comment offers a potential explanation for the mistake, suggesting a strategic consideration beyond immediate tactical gains.",1. e4 c5 2. Nf3 Nc6 3. Bb5 e6 4. O-O Nge7 5. c3 a6 6. Ba4 b5 7. Bc2 Bb7 8. Qe2 Ng6 9. d4 cxd4 10. cxd4 Nh4 11. Nbd2 Rc8 12. Bb1 Bd6 13. a4 bxa4 14. Rxa4 Nxf3+ 15. Nxf3 Nb4 16. Bd2 a5 17. Rd1 O-O 18. Bc3 Qb6 19. Ra1 Bf4 20. Ne5 Qc7 21. Qg4 Bxe5 22. dxe5 Bc6 23. h4 Kh8 24. Ra3 Rg8 25. h5 h6 26. Qf4 Rcf8 27. Bd4 Bb5 28. Rc3 Nc6 29. Bc5 Be2 30. Rd2 Bxh5 31. Rh3,"This is a game between Adams, Michael (as White) and Shirov, Alexei (as Black). Last move played: White plays Rook to h3",Large advantage for White (eval: 412 centipawns),31... Kh7 32. Rxh5 Rb8 33. Bd6 Qc8 34. Bxb8 Qxb8 35. Rd1 Ne7 36. Bd3 Ng6 37. Qd2 Rc8 38. Rh3 Kg8 39. Bf1 Rc5 40. Rg3 Qc7 41. Qxd7 Qxd7 42. Rxd7 Nf4 ,31. Rh3 Kh7 32. Rxh5 Rb8 33. Bd6 Qa7 34. Qxf7 Rxb2 35. Rxh6+ Kxh6 36. Rxb2 Qd4 37. Qf4+ g5 38. Qd2 Rc8 39. Rc2 Qxd2 40. Rxd2 Ra8 41. Bd3 a4 42. Bb5 
