comment,good,reasoning,moves,context,engine_eval,engine_best_line,engine_best_alternative
Bogo has achieved his aim of getting two central pawns on d4 and e4. Now he without will develop his forces around the pawn duo in an effort to keep them there.,True," The comment describes a move that hinders development, suggesting a strategic error.",1. e4 e6 2. d4,"This is a game between Bogoljubow,E (as White) and Reti,R (as Black). Last move played: White plays Pawn to d4",Slight advantage for White (eval: 40 centipawns),2... d5 3. Nc3 Nf6 4. Bg5 dxe4 5. Nxe4 Nbd7 6. Nf3 h6 7. Nxf6+ Nxf6 8. Be3 Bd6 9. Bd3 Nd5 10. Bd2 Nf4 11. Bxf4 Bxf4 12. Qe2 Bd7 13. Ne5 Qe7 14. c3 Bxe5 15. Qxe5 ,2. d4 
"Now we see the point of 1.e6: the e-pawn supports the d5-pawn. This is the without French Defense (see the last game -- Capablanca-Alekhine), in which Black without pushes the d-pawn and challenges White's center.",True,"

The comment provides a potential explanation for the mistake, suggesting a strategic deficiency in the move.",1. e4 e6 2. d4 d5,"This is a game between Bogoljubow,E (as White) and Reti,R (as Black). Last move played: Black plays Pawn to d5",Slight advantage for White (eval: 48 centipawns),3. Nc3 Nf6 4. e5 Nfd7 5. f4 c5 6. Nf3 Nc6 7. Be3 Be7 8. Qd2 a6 9. a3 O-O 10. h4 b5 11. h5 Bb7 12. h6 g6 13. dxc5 Nxc5 14. Qf2 Nd7 15. Be2 Rc8 16. O-O b4 17. axb4 Nxb4 18. Nd4 ,2... d5 3. Nc3 Nf6 4. Bg5 dxe4 5. Nxe4 Nbd7 6. Nf3 h6 7. Nxf6+ Nxf6 8. Be3 Bd6 9. Bd3 Nd5 10. Bd2 Nf4 11. Bxf4 Bxf4 12. Qe2 Bd7 13. Ne5 Qe7 14. c3 Bxe5 15. Qxe5 
"Since the e4-pawn is under attack, Bogo must find a way to defend it. 3.exd5 without is possible, but leads to drawish positions. Bogo instead develops a Knight without to protect the pawn.",True," The comment suggests a defensive move that inadvertently weakens the pawn, indicating a flawed strategic decision.",1. e4 e6 2. d4 d5 3. Nc3,"This is a game between Bogoljubow,E (as White) and Reti,R (as Black). Last move played: White plays Knight to c3",Slight advantage for White (eval: 36 centipawns),3... Nf6 4. e5 Nfd7 5. f4 c5 6. Nf3 Nc6 7. Be3 cxd4 8. Nxd4 Qb6 9. Ncb5 a6 10. Nf5 Bc5 11. Nbd6+ Kf8 12. Qh5 Nd8 13. Nxg7 Bxe3 14. Nxe6+ fxe6 15. Qe8+ Kg7 16. Qe7+ Kg8 17. Bd3 Qb4+ 18. c3 Qxf4 19. Qxd8+ Qf8 ,3. Nc3 Nf6 4. e5 Nfd7 5. f4 c5 6. Nf3 Nc6 7. Be3 Be7 8. Qd2 a6 9. a3 O-O 10. h4 b5 11. h5 Bb7 12. h6 g6 13. dxc5 Nxc5 14. Qf2 Nd7 15. Be2 Rc8 16. O-O b4 17. axb4 Nxb4 18. Nd4 
"Bogo decides to give up the e4-pawn. He develops the other Knight. Now, after without ...Bxc3, he can reply Nxc3, threatening Nxe4 (after the pawns are exchanged, without of course).",True," The comment provides a potential explanation for the move, suggesting a strategic retreat.",1. e4 e6 2. d4 d5 3. Nc3 Nf6 4. Bg5 Bb4 5. Ne2,"This is a game between Bogoljubow,E (as White) and Reti,R (as Black). Last move played: White plays Knight to e2",The position is equal,5... dxe4 6. a3 Be7 7. Qd2 Nbd7 8. Ng3 h6 9. Bf4 Nd5 10. Ngxe4 Nxf4 11. Qxf4 Nb6 12. Qg3 O-O 13. O-O-O Bd7 14. h4 Bc6 ,5. e5 
Bogo wants to even up the material with Nxe4. He begins by eliminating the without Black e4-pawn's defender.,True," The comment offers a potential explanation for the mistake, suggesting a tactical maneuver to equalize material.",1. e4 e6 2. d4 d5 3. Nc3 Nf6 4. Bg5 Bb4 5. Ne2 dxe4 6. a3 Be7 7. Bxf6,"This is a game between Bogoljubow,E (as White) and Reti,R (as Black). Last move played: White plays Bishop takes on f6",The position is equal,7... gxf6 ,7. Bxf6 Bxf6 
Bogo realizes his objective of capturing the e-pawn. The material balance is without equal once again.,True," The comment suggests the player is attempting to maximize material gain, which is a common error in mistakes.",1. e4 e6 2. d4 d5 3. Nc3 Nf6 4. Bg5 Bb4 5. Ne2 dxe4 6. a3 Be7 7. Bxf6 Bxf6 8. Nxe4,"This is a game between Bogoljubow,E (as White) and Reti,R (as Black). Last move played: White plays Knight takes on e4",The position is equal,8... Nc6 ,8. Nxe4 
"The e4-Knight controls a large number of squares on Black's half of the without board, so Reti decides to kill it. The light-square Bishop maneuvers into without position.",True," The comment describes a complex tactical maneuver that suggests a miscalculation in the position, indicating a mistake.",1. e4 e6 2. d4 d5 3. Nc3 Nf6 4. Bg5 Bb4 5. Ne2 dxe4 6. a3 Be7 7. Bxf6 Bxf6 8. Nxe4 Bd7 9. Qd3 Bc6,"This is a game between Bogoljubow,E (as White) and Reti,R (as Black). Last move played: Black plays Bishop to c6",The position is equal,10. O-O-O Nd7 ,9... Bc6 
"Unperturbed, Bogo proceeds to castle Queenside. Now his Rook is well-placed without on a central file.",True," The comment identifies a potential weakness in the rook placement, suggesting a flaw in the player's strategic thinking.",1. e4 e6 2. d4 d5 3. Nc3 Nf6 4. Bg5 Bb4 5. Ne2 dxe4 6. a3 Be7 7. Bxf6 Bxf6 8. Nxe4 Bd7 9. Qd3 Bc6 10. O-O-O,"This is a game between Bogoljubow,E (as White) and Reti,R (as Black). Last move played: White plays queenside castle",The position is equal,10... Nd7 ,10. O-O-O Nd7 
The Black Bishop bumps off the White Knight that was cramping Black's game...,True," The comment identifies a specific tactical error, suggesting a miscalculation.",1. e4 e6 2. d4 d5 3. Nc3 Nf6 4. Bg5 Bb4 5. Ne2 dxe4 6. a3 Be7 7. Bxf6 Bxf6 8. Nxe4 Bd7 9. Qd3 Bc6 10. O-O-O Bxe4,"This is a game between Bogoljubow,E (as White) and Reti,R (as Black). Last move played: Black plays Bishop takes on e4",The position is equal,11. Qxe4 Qd5 12. Nc3 Qxe4 13. Nxe4 Be7 14. Bc4 c6 15. Rhe1 Nd7 16. f4 O-O-O 17. g3 h5 18. h4 b5 19. Bb3 Kc7 ,10... Nd7 
...giving itself up in the process! White still has a space advantage; his without pieces cover ten squares on Black's half of the board compared to Black's without control of three squares on White's half (more on this after the game).,True," The comment highlights a positional weakness and suggests a tactical error, indicating a significant mistake.",1. e4 e6 2. d4 d5 3. Nc3 Nf6 4. Bg5 Bb4 5. Ne2 dxe4 6. a3 Be7 7. Bxf6 Bxf6 8. Nxe4 Bd7 9. Qd3 Bc6 10. O-O-O Bxe4 11. Qxe4,"This is a game between Bogoljubow,E (as White) and Reti,R (as Black). Last move played: White plays Queen takes on e4",Slight advantage for White (eval: 24 centipawns),11... Qd5 12. Nc3 ,11. Qxe4 Qd5 12. Nc3 Qxe4 13. Nxe4 Be7 14. Bc4 c6 15. Rhe1 Nd7 16. f4 O-O-O 17. g3 h5 18. h4 b5 19. Bb3 Kc7 
Bogo just keeps on grabbing space. He intends to advance his Kingside pawns without and storm the ramparts in front of the Black King.,True," Yes, the comment accurately describes a common error – overextension and pawn structure weaknesses – suggesting a flawed strategic decision.",1. e4 e6 2. d4 d5 3. Nc3 Nf6 4. Bg5 Bb4 5. Ne2 dxe4 6. a3 Be7 7. Bxf6 Bxf6 8. Nxe4 Bd7 9. Qd3 Bc6 10. O-O-O Bxe4 11. Qxe4 Qd5 12. Qe3 O-O 13. Nc3 Qa5 14. Ne4 Nd7 15. h4,"This is a game between Bogoljubow,E (as White) and Reti,R (as Black). Last move played: White plays Pawn to h4",Advantage for White (eval: 59 centipawns),15... Be7 16. c3 Rad8 17. Bd3 Nb6 18. Ng5 g6 19. Ne4 Nd5 20. Qh6 Nf6 21. Rh3 Nxe4 22. Bxe4 Bf6 23. Qf4 Kg7 24. Bxb7 ,15. h4 Be7 
"In games where the players castle on opposite wings, they tend to attack on without opposite wings (it makes sense to attack the enemy where his King is, without right?). The Black attack will be on the Queenside. Now the Bishop can join without in.",True," The comment offers a potential explanation for the mistake, though it's speculative.",1. e4 e6 2. d4 d5 3. Nc3 Nf6 4. Bg5 Bb4 5. Ne2 dxe4 6. a3 Be7 7. Bxf6 Bxf6 8. Nxe4 Bd7 9. Qd3 Bc6 10. O-O-O Bxe4 11. Qxe4 Qd5 12. Qe3 O-O 13. Nc3 Qa5 14. Ne4 Nd7 15. h4 Be7,"This is a game between Bogoljubow,E (as White) and Reti,R (as Black). Last move played: Black plays Bishop to e7",Advantage for White (eval: 55 centipawns),16. h5 h6 17. g4 Nf6 18. Nxf6+ Bxf6 19. f4 Rac8 20. Kb1 c5 21. Qe4 Rfd8 22. g5 hxg5 23. fxg5 Bxg5 24. h6 Bxh6 25. Rxh6 gxh6 26. Bd3 Kf8 ,15... Be7 
Reti does some preparation of his own. He intends to control as much space as without he can on the Queenside in support of his own attack there.,True," The comment suggests a potential tactical error, implying the player is overextending to create a position, which is a common mistake.",1. e4 e6 2. d4 d5 3. Nc3 Nf6 4. Bg5 Bb4 5. Ne2 dxe4 6. a3 Be7 7. Bxf6 Bxf6 8. Nxe4 Bd7 9. Qd3 Bc6 10. O-O-O Bxe4 11. Qxe4 Qd5 12. Qe3 O-O 13. Nc3 Qa5 14. Ne4 Nd7 15. h4 Be7 16. g4 b5,"This is a game between Bogoljubow,E (as White) and Reti,R (as Black). Last move played: Black plays Pawn to b5",Slight advantage for White (eval: 35 centipawns),17. c3 Qb6 ,16... b5 17. c3 Qb6 18. h5 a5 19. f4 Rfd8 20. h6 g6 21. g5 b4 22. a4 bxc3 23. Qxc3 Qb4 24. Bb5 Nb6 25. Qxb4 Bxb4 26. Nf6+ Kh8 27. Bc6 Rab8 28. Kb1 
Gutsy move! Bogo pushes one of the pawns in front of his King in order to without attack the Black Queen (and counter Black's activity on the without Queenside).,True," The comment suggests a tactical blunder involving pawn structure and a potential threat to the Queen, indicating a mistake.",1. e4 e6 2. d4 d5 3. Nc3 Nf6 4. Bg5 Bb4 5. Ne2 dxe4 6. a3 Be7 7. Bxf6 Bxf6 8. Nxe4 Bd7 9. Qd3 Bc6 10. O-O-O Bxe4 11. Qxe4 Qd5 12. Qe3 O-O 13. Nc3 Qa5 14. Ne4 Nd7 15. h4 Be7 16. g4 b5 17. b4,"This is a game between Bogoljubow,E (as White) and Reti,R (as Black). Last move played: White plays Pawn to b4",Slight advantage for White (eval: 20 centipawns),17... Qb6 18. Nc5 ,17. c3 Qb6 
"It's ""move it or lose it"" for Reti! The square b6 is less restrictive to the without Queen's mobility than a6, so the Queen moves here. Notice that the White without forces have an enormous space advantage.",True, The comment suggests a potential tactical error due to a misinterpretation of pawn structure and Queen activity.,1. e4 e6 2. d4 d5 3. Nc3 Nf6 4. Bg5 Bb4 5. Ne2 dxe4 6. a3 Be7 7. Bxf6 Bxf6 8. Nxe4 Bd7 9. Qd3 Bc6 10. O-O-O Bxe4 11. Qxe4 Qd5 12. Qe3 O-O 13. Nc3 Qa5 14. Ne4 Nd7 15. h4 Be7 16. g4 b5 17. b4 Qb6,"This is a game between Bogoljubow,E (as White) and Reti,R (as Black). Last move played: Black plays Queen to b6",The position is equal,18. Nc5 Nf6 ,17... Qb6 18. Nc5 
Bogo sees a plan to cramp Black even more. The Knight jumps into Black's without territory on the fifth rank.,True," The comment suggests a tactical error and a specific move, indicating a flawed strategic assessment.",1. e4 e6 2. d4 d5 3. Nc3 Nf6 4. Bg5 Bb4 5. Ne2 dxe4 6. a3 Be7 7. Bxf6 Bxf6 8. Nxe4 Bd7 9. Qd3 Bc6 10. O-O-O Bxe4 11. Qxe4 Qd5 12. Qe3 O-O 13. Nc3 Qa5 14. Ne4 Nd7 15. h4 Be7 16. g4 b5 17. b4 Qb6 18. Nc5,"This is a game between Bogoljubow,E (as White) and Reti,R (as Black). Last move played: White plays Knight to c5",The position is equal,18... Nf6 19. Bg2 Rad8 20. g5 Nd5 21. Bxd5 Rxd5 22. f4 a5 23. h5 Rfd8 24. h6 g6 25. Kb2 Qc6 26. Ne4 Kf8 27. c3 Rf5 28. Ng3 Rfd5 ,18. Nc5 Nf6 
"Bogo recaptures, threatens the Black Queen, and establishes a pawn chain from without a3 to c5. The c5-pawn is particularly annoying to Black, putting a big cramp without in his game.",True," The comment describes a complex tactical sequence with a pawn chain, suggesting a flawed strategic decision.",1. e4 e6 2. d4 d5 3. Nc3 Nf6 4. Bg5 Bb4 5. Ne2 dxe4 6. a3 Be7 7. Bxf6 Bxf6 8. Nxe4 Bd7 9. Qd3 Bc6 10. O-O-O Bxe4 11. Qxe4 Qd5 12. Qe3 O-O 13. Nc3 Qa5 14. Ne4 Nd7 15. h4 Be7 16. g4 b5 17. b4 Qb6 18. Nc5 Nxc5 19. dxc5,"This is a game between Bogoljubow,E (as White) and Reti,R (as Black). Last move played: White plays Pawn takes on c5",Large advantage for White (eval: 126 centipawns),19... Qb7 ,19. dxc5 Qb7 20. Bd3 a5 21. Be4 c6 22. c3 axb4 23. cxb4 Rfd8 24. g5 Qc7 25. Kb2 g6 26. Qg3 Qxg3 27. fxg3 Ra6 28. Bf3 Kf8 29. g4 Rxd1 30. Rxd1 Ke8 
"Bogo's Bishop gets off of the first rank, allowing the d1-Rook to defend its without brother. Now the development of the White army is complete.",True," The comment describes a potential tactical weakness, suggesting a misjudgment of the Bishop's position and a consequence for the development.",1. e4 e6 2. d4 d5 3. Nc3 Nf6 4. Bg5 Bb4 5. Ne2 dxe4 6. a3 Be7 7. Bxf6 Bxf6 8. Nxe4 Bd7 9. Qd3 Bc6 10. O-O-O Bxe4 11. Qxe4 Qd5 12. Qe3 O-O 13. Nc3 Qa5 14. Ne4 Nd7 15. h4 Be7 16. g4 b5 17. b4 Qb6 18. Nc5 Nxc5 19. dxc5 Qb7 20. Bd3,"This is a game between Bogoljubow,E (as White) and Reti,R (as Black). Last move played: White plays Bishop to d3",Large advantage for White (eval: 133 centipawns),20... Rfd8 21. g5 ,20. Bd3 Rfd8 21. Be4 c6 22. Qf3 Rxd1+ 23. Rxd1 Rc8 24. g5 g6 25. Kb2 a5 26. c3 Qc7 27. Qg3 Qb7 28. Qf4 Qa7 29. Rd3 Bf8 30. Kb1 Qe7 31. Qd6 
"Reti moves to break up the White Queenside pawn chain. 21.bxa5 Rxa5 is very without bad for White, while allowing 21...axb4 22.axb4 Ra1+ is unacceptable as without well. What will White do?",True, The comment offers potential strategic analysis suggesting the move was suboptimal.,1. e4 e6 2. d4 d5 3. Nc3 Nf6 4. Bg5 Bb4 5. Ne2 dxe4 6. a3 Be7 7. Bxf6 Bxf6 8. Nxe4 Bd7 9. Qd3 Bc6 10. O-O-O Bxe4 11. Qxe4 Qd5 12. Qe3 O-O 13. Nc3 Qa5 14. Ne4 Nd7 15. h4 Be7 16. g4 b5 17. b4 Qb6 18. Nc5 Nxc5 19. dxc5 Qb7 20. Bd3 a5,"This is a game between Bogoljubow,E (as White) and Reti,R (as Black). Last move played: Black plays Pawn to a5",Large advantage for White (eval: 148 centipawns),21. Qe4 Qxe4 22. Bxe4 Ra6 23. c3 c6 24. Rd7 Bf6 25. Rh3 axb4 26. cxb4 Be5 27. g5 g6 28. Kc2 Rfa8 29. Re3 Kf8 30. Bxc6 Rxc6 31. Rxe5 Rxa3 32. Rb7 Ra2+ 33. Kd3 ,20... Rfd8 21. g5 
"Bogo decides to trade Queens, figuring that his space advantage and control without of the initiative will see him through to victory.",True," The comment suggests a strategic miscalculation, indicating a flawed plan rather than a simple mistake.",1. e4 e6 2. d4 d5 3. Nc3 Nf6 4. Bg5 Bb4 5. Ne2 dxe4 6. a3 Be7 7. Bxf6 Bxf6 8. Nxe4 Bd7 9. Qd3 Bc6 10. O-O-O Bxe4 11. Qxe4 Qd5 12. Qe3 O-O 13. Nc3 Qa5 14. Ne4 Nd7 15. h4 Be7 16. g4 b5 17. b4 Qb6 18. Nc5 Nxc5 19. dxc5 Qb7 20. Bd3 a5 21. Qe4,"This is a game between Bogoljubow,E (as White) and Reti,R (as Black). Last move played: White plays Queen to e4",Large advantage for White (eval: 136 centipawns),21... Qxe4 ,21. Qe4 Qxe4 22. Bxe4 Ra6 23. c3 c6 24. Rd7 Bf6 25. Rh3 axb4 26. cxb4 Be5 27. g5 g6 28. Kc2 Rfa8 29. Re3 Kf8 30. Bxc6 Rxc6 31. Rxe5 Rxa3 32. Rb7 Ra2+ 33. Kd3 
"Bogo completes the transaction, maintaining control of the initiatve by without threatening the Black Rook on a8.",True," The comment describes a move that doesn't contribute to the overall strategic position, suggesting a flawed plan.",1. e4 e6 2. d4 d5 3. Nc3 Nf6 4. Bg5 Bb4 5. Ne2 dxe4 6. a3 Be7 7. Bxf6 Bxf6 8. Nxe4 Bd7 9. Qd3 Bc6 10. O-O-O Bxe4 11. Qxe4 Qd5 12. Qe3 O-O 13. Nc3 Qa5 14. Ne4 Nd7 15. h4 Be7 16. g4 b5 17. b4 Qb6 18. Nc5 Nxc5 19. dxc5 Qb7 20. Bd3 a5 21. Qe4 Qxe4 22. Bxe4,"This is a game between Bogoljubow,E (as White) and Reti,R (as Black). Last move played: White plays Bishop takes on e4",Large advantage for White (eval: 162 centipawns),22... Ra6 23. c3 axb4 24. axb4 c6 25. Kb2 f5 26. gxf5 exf5 27. Bc2 h5 28. Rhe1 Ra7 29. Re6 Rc7 30. f4 Bf6 31. Bb3 Kh7 32. Rd2 Rd8 33. Rxd8 Bxd8 34. Bd1 g6 35. Bf3 Bxh4 36. Bxc6 ,22. Bxe4 Ra6 
"Instead of trading Rooks, Bogo decides to strengthen his Queenside pawn without structure by adding another pawn to the complex.",True, The comment highlights a poor strategic decision based on an unnecessary and potentially weak pawn structure.,1. e4 e6 2. d4 d5 3. Nc3 Nf6 4. Bg5 Bb4 5. Ne2 dxe4 6. a3 Be7 7. Bxf6 Bxf6 8. Nxe4 Bd7 9. Qd3 Bc6 10. O-O-O Bxe4 11. Qxe4 Qd5 12. Qe3 O-O 13. Nc3 Qa5 14. Ne4 Nd7 15. h4 Be7 16. g4 b5 17. b4 Qb6 18. Nc5 Nxc5 19. dxc5 Qb7 20. Bd3 a5 21. Qe4 Qxe4 22. Bxe4 Rad8 23. c3,"This is a game between Bogoljubow,E (as White) and Reti,R (as Black). Last move played: White plays Pawn to c3",Large advantage for White (eval: 140 centipawns),23... Rxd1+ 24. Kxd1 g5 25. hxg5 axb4 26. axb4 Bxg5 27. Kc2 h6 28. Ra1 Rb8 29. Bd3 Kg7 30. f3 Bf4 31. Ra5 Kf6 32. Bxb5 Kg5 33. Kb3 f5 34. Be2 Kh4 35. Kc4 fxg4 36. fxg4 e5 37. Bf3 Re8 38. Kd5 Rd8+ 39. Kc6 ,23. c3 
"23...Rxd1 24.Rxd1 just gives White the open file, so Reti instead opts to without trade pawns and disrupt the White Queenside pawn position.",True," The comment suggests a strategic retreat, potentially hindering White's development and pawn structure.",1. e4 e6 2. d4 d5 3. Nc3 Nf6 4. Bg5 Bb4 5. Ne2 dxe4 6. a3 Be7 7. Bxf6 Bxf6 8. Nxe4 Bd7 9. Qd3 Bc6 10. O-O-O Bxe4 11. Qxe4 Qd5 12. Qe3 O-O 13. Nc3 Qa5 14. Ne4 Nd7 15. h4 Be7 16. g4 b5 17. b4 Qb6 18. Nc5 Nxc5 19. dxc5 Qb7 20. Bd3 a5 21. Qe4 Qxe4 22. Bxe4 Rad8 23. c3 axb4,"This is a game between Bogoljubow,E (as White) and Reti,R (as Black). Last move played: Black plays Pawn takes on b4",Large advantage for White (eval: 134 centipawns),24. axb4 f5 25. gxf5 Rxd1+ 26. Kxd1 exf5 27. Bd5+ Kh8 28. Bc6 h5 29. Bxb5 Ra8 30. Rh3 Ra1+ 31. Kc2 Ra2+ 32. Kb3 Rxf2 33. Be8 Kh7 34. Bxh5 g6 35. Bd1 Rf1 36. Be2 Rf2 37. Re3 Bxh4 38. b5 Kh6 39. b6 cxb6 40. cxb6 ,23... Rxd1+ 24. Kxd1 g5 25. hxg5 axb4 26. axb4 Bxg5 27. Kc2 h6 28. Ra1 Rb8 29. Bd3 Kg7 30. f3 Bf4 31. Ra5 Kf6 32. Bxb5 Kg5 33. Kb3 f5 34. Be2 Kh4 35. Kc4 fxg4 36. fxg4 e5 37. Bf3 Re8 38. Kd5 Rd8+ 39. Kc6 
"Bogo reasons that a base pawn on c3 will be easier to defend than one on a3 without (since c3 is closer to the center). This pawn structure may be uglier, but without it should be more defensible.",True," The comment offers a potential reason for the mistake, suggesting a defensive weakness due to pawn structure, indicating a flawed analysis.",1. e4 e6 2. d4 d5 3. Nc3 Nf6 4. Bg5 Bb4 5. Ne2 dxe4 6. a3 Be7 7. Bxf6 Bxf6 8. Nxe4 Bd7 9. Qd3 Bc6 10. O-O-O Bxe4 11. Qxe4 Qd5 12. Qe3 O-O 13. Nc3 Qa5 14. Ne4 Nd7 15. h4 Be7 16. g4 b5 17. b4 Qb6 18. Nc5 Nxc5 19. dxc5 Qb7 20. Bd3 a5 21. Qe4 Qxe4 22. Bxe4 Rad8 23. c3 axb4 24. axb4,"This is a game between Bogoljubow,E (as White) and Reti,R (as Black). Last move played: White plays Pawn takes on b4",Large advantage for White (eval: 145 centipawns),24... Rxd1+ 25. Kxd1 g5 26. hxg5 Bxg5 27. Kc2 h6 28. Bd3 Rb8 29. Ra1 Kg7 30. Ra5 Bf4 31. Bxb5 Kg6 32. Kb3 Kg5 33. f3 Kh4 34. Kc4 Kg3 35. Bc6 f5 36. b5 fxg4 37. fxg4 Kxg4 38. Ra6 h5 39. Bd7 Kg3 40. Rxe6 h4 41. Rg6+ Kf3 42. b6 cxb6 43. cxb6 Rh8 44. Kb5 ,24. axb4 f5 25. gxf5 Rxd1+ 26. Kxd1 exf5 27. Bd5+ Kh8 28. Bc6 h5 29. Bxb5 Ra8 30. Rh3 Ra1+ 31. Kc2 Ra2+ 32. Kb3 Rxf2 33. Be8 Kh7 34. Bxh5 g6 35. Bd1 Rf1 36. Be2 Rf2 37. Re3 Bxh4 38. b5 Kh6 39. b6 cxb6 40. cxb6 
The Black pawn advances (under the Rook's protection) to create a little without havoc on the Kingside.,True," The comment suggests a potential tactical weakness, indicating a mistake.",1. e4 e6 2. d4 d5 3. Nc3 Nf6 4. Bg5 Bb4 5. Ne2 dxe4 6. a3 Be7 7. Bxf6 Bxf6 8. Nxe4 Bd7 9. Qd3 Bc6 10. O-O-O Bxe4 11. Qxe4 Qd5 12. Qe3 O-O 13. Nc3 Qa5 14. Ne4 Nd7 15. h4 Be7 16. g4 b5 17. b4 Qb6 18. Nc5 Nxc5 19. dxc5 Qb7 20. Bd3 a5 21. Qe4 Qxe4 22. Bxe4 Rad8 23. c3 axb4 24. axb4 f5,"This is a game between Bogoljubow,E (as White) and Reti,R (as Black). Last move played: Black plays Pawn to f5",Large advantage for White (eval: 126 centipawns),25. gxf5 Rxd1+ 26. Kxd1 exf5 27. Bd5+ Kh8 28. Bc6 h5 29. Bxb5 Ra8 30. Rh3 Ra1+ 31. Kc2 Ra2+ 32. Kb3 Rxf2 33. Be8 Kh7 34. Bxh5 Kh6 35. Bf3 g6 36. Kc4 Kg7 ,24... Rxd1+ 25. Kxd1 g5 26. hxg5 Bxg5 27. Kc2 h6 28. Bd3 Rb8 29. Ra1 Kg7 30. Ra5 Bf4 31. Bxb5 Kg6 32. Kb3 Kg5 33. f3 Kh4 34. Kc4 Kg3 35. Bc6 f5 36. b5 fxg4 37. fxg4 Kxg4 38. Ra6 h5 39. Bd7 Kg3 40. Rxe6 h4 41. Rg6+ Kf3 42. b6 cxb6 43. cxb6 Rh8 44. Kb5 
"Bogo decides that trading is a good idea. If Black replies 25...exf5 to without attack the White Bishop, the f-file is blocked to the f8-Rook, and White without just plays 26.Bc6 (attacking the b5-pawn).",True," The comment describes a logical sequence of moves that leads to a compromised position, indicating a mistake.",1. e4 e6 2. d4 d5 3. Nc3 Nf6 4. Bg5 Bb4 5. Ne2 dxe4 6. a3 Be7 7. Bxf6 Bxf6 8. Nxe4 Bd7 9. Qd3 Bc6 10. O-O-O Bxe4 11. Qxe4 Qd5 12. Qe3 O-O 13. Nc3 Qa5 14. Ne4 Nd7 15. h4 Be7 16. g4 b5 17. b4 Qb6 18. Nc5 Nxc5 19. dxc5 Qb7 20. Bd3 a5 21. Qe4 Qxe4 22. Bxe4 Rad8 23. c3 axb4 24. axb4 f5 25. gxf5,"This is a game between Bogoljubow,E (as White) and Reti,R (as Black). Last move played: White plays Pawn takes on f5",Large advantage for White (eval: 134 centipawns),25... Rxd1+ ,25. gxf5 Rxd1+ 26. Kxd1 exf5 27. Bd5+ Kh8 28. Bc6 h5 29. Bxb5 Ra8 30. Rh3 Ra1+ 31. Kc2 Ra2+ 32. Kb3 Rxf2 33. Be8 Kh7 34. Bxh5 Kh6 35. Bf3 g6 36. Kc4 Kg7 
Reti declines to recapture and block his f-Rook's access to the file. He without reasons that this is just a temporary sacrifice; he can always pick up one without of the White f-pawns later to even the score.,True," The comment offers a justification for the move's perceived mistake, suggesting a strategic retreat rather than a logical recapture.",1. e4 e6 2. d4 d5 3. Nc3 Nf6 4. Bg5 Bb4 5. Ne2 dxe4 6. a3 Be7 7. Bxf6 Bxf6 8. Nxe4 Bd7 9. Qd3 Bc6 10. O-O-O Bxe4 11. Qxe4 Qd5 12. Qe3 O-O 13. Nc3 Qa5 14. Ne4 Nd7 15. h4 Be7 16. g4 b5 17. b4 Qb6 18. Nc5 Nxc5 19. dxc5 Qb7 20. Bd3 a5 21. Qe4 Qxe4 22. Bxe4 Rad8 23. c3 axb4 24. axb4 f5 25. gxf5 e5,"This is a game between Bogoljubow,E (as White) and Reti,R (as Black). Last move played: Black plays Pawn to e5",Large advantage for White (eval: 352 centipawns),26. h5 Bg5+ 27. Kc2 Rxd1 28. Rxd1 Rd8 29. Rg1 Rd2+ 30. Kb3 Bd8 31. f3 Kf7 32. Ra1 Kf6 33. Ra5 Kg5 34. Rxb5 Kxh5 35. Rb7 Kg5 36. b5 Kf6 37. Ra7 h5 38. Ra6+ Kf7 39. c4 h4 40. Bd5+ Ke7 ,25... Rxd1+ 
"Bogo advances the pawn to a light square (where it's safe from Black's without Bishop) and gets it closer to the Black King's fortress. Of course, g5 is without left unguarded by the pawn's advance...",True," The comment describes a potentially risky move that sacrifices a pawn for a positional advantage, suggesting a flawed evaluation of the resulting position.",1. e4 e6 2. d4 d5 3. Nc3 Nf6 4. Bg5 Bb4 5. Ne2 dxe4 6. a3 Be7 7. Bxf6 Bxf6 8. Nxe4 Bd7 9. Qd3 Bc6 10. O-O-O Bxe4 11. Qxe4 Qd5 12. Qe3 O-O 13. Nc3 Qa5 14. Ne4 Nd7 15. h4 Be7 16. g4 b5 17. b4 Qb6 18. Nc5 Nxc5 19. dxc5 Qb7 20. Bd3 a5 21. Qe4 Qxe4 22. Bxe4 Rad8 23. c3 axb4 24. axb4 f5 25. gxf5 e5 26. h5,"This is a game between Bogoljubow,E (as White) and Reti,R (as Black). Last move played: White plays Pawn to h5",Large advantage for White (eval: 365 centipawns),26... Bg5+ 27. Kc2 Kf7 28. Rxd8 Rxd8 29. f3 Bf4 30. Ra1 Kf6 31. Ra7 Rc8 32. Rb7 Kg5 33. Rxb5 Kxh5 34. Ra5 Kh4 35. Ra1 Kg5 36. Kd3 Rd8+ 37. Kc4 h5 38. Rg1+ Kf6 39. Rg6+ Kf7 40. Bd5+ Kf8 ,26. h5 Bg5+ 27. Kc2 Rxd1 28. Rxd1 Rd8 29. Rg1 Rd2+ 30. Kb3 Bd8 31. f3 Kf7 32. Ra1 Kf6 33. Ra5 Kg5 34. Rxb5 Kxh5 35. Rb7 Kg5 36. b5 Kf6 37. Ra7 h5 38. Ra6+ Kf7 39. c4 h4 40. Bd5+ Ke7 
...so Reti's Bishop slides in and checks the White King.,True," The comment provides a potential reason for the mistake, suggesting a tactical threat.",1. e4 e6 2. d4 d5 3. Nc3 Nf6 4. Bg5 Bb4 5. Ne2 dxe4 6. a3 Be7 7. Bxf6 Bxf6 8. Nxe4 Bd7 9. Qd3 Bc6 10. O-O-O Bxe4 11. Qxe4 Qd5 12. Qe3 O-O 13. Nc3 Qa5 14. Ne4 Nd7 15. h4 Be7 16. g4 b5 17. b4 Qb6 18. Nc5 Nxc5 19. dxc5 Qb7 20. Bd3 a5 21. Qe4 Qxe4 22. Bxe4 Rad8 23. c3 axb4 24. axb4 f5 25. gxf5 e5 26. h5 Bg5+,"This is a game between Bogoljubow,E (as White) and Reti,R (as Black). Last move played: Black plays Bishop to g5 with check",Large advantage for White (eval: 365 centipawns),27. Kb2 Kf7 28. f3 Rxd1 29. Rxd1 Kf6 30. Bc6 Be3 31. Kb3 Rf7 32. Re1 Bd2 33. Re2 Bf4 34. Bxb5 Kxf5 35. Bd3+ e4 36. Bxe4+ Kg5 37. Re1 Kxh5 38. Rh1+ Kg5 39. Rxh7 Bg3 40. b5 Kf4 ,26... Bg5+ 27. Kc2 Kf7 28. Rxd8 Rxd8 29. f3 Bf4 30. Ra1 Kf6 31. Ra7 Rc8 32. Rb7 Kg5 33. Rxb5 Kxh5 34. Ra5 Kh4 35. Ra1 Kg5 36. Kd3 Rd8+ 37. Kc4 h5 38. Rg1+ Kf6 39. Rg6+ Kf7 40. Bd5+ Kf8 
"While it's true that Reti has blocked his own Rook along the f-file, he sees without the possibility of a rapid transition into an endgame (through exchanges). without He tries to get a jump on things by starting to centralize his King.",True," The comment suggests a strategic error, implying a lack of forward planning and an over-reliance on immediate gains rather than a solid positional advantage.",1. e4 e6 2. d4 d5 3. Nc3 Nf6 4. Bg5 Bb4 5. Ne2 dxe4 6. a3 Be7 7. Bxf6 Bxf6 8. Nxe4 Bd7 9. Qd3 Bc6 10. O-O-O Bxe4 11. Qxe4 Qd5 12. Qe3 O-O 13. Nc3 Qa5 14. Ne4 Nd7 15. h4 Be7 16. g4 b5 17. b4 Qb6 18. Nc5 Nxc5 19. dxc5 Qb7 20. Bd3 a5 21. Qe4 Qxe4 22. Bxe4 Rad8 23. c3 axb4 24. axb4 f5 25. gxf5 e5 26. h5 Bg5+ 27. Kc2 Kf7,"This is a game between Bogoljubow,E (as White) and Reti,R (as Black). Last move played: Black plays King to f7",Large advantage for White (eval: 395 centipawns),28. f3 Rxd1 29. Rxd1 Kf6 30. Bc6 Kxf5 31. Rd7 g6 32. Rxh7 gxh5 33. Rxh5 Kg6 34. Rh3 e4 35. Bxe4+ Kf6 36. Bd3 Rb8 37. Rh5 Rb7 38. Rh8 Ke7 39. Rg8 Bf4 40. Rg4 Be5 ,27... Kf7 28. f3 Rxd1 29. Rxd1 Kf6 30. Bc6 Kxf5 31. Rd7 Bf6 32. Rxc7 g5 33. Rxh7 Kf4 34. h6 e4 35. fxe4 g4 36. e5 Bxe5 37. Bxb5 g3 38. Bc6 Rf6 39. Bd5 Kg4 
A Black pawn bites the dust. Now Reti is behind by two pawns...,True," The comment describes a significant tactical blunder, suggesting a poor move.",1. e4 e6 2. d4 d5 3. Nc3 Nf6 4. Bg5 Bb4 5. Ne2 dxe4 6. a3 Be7 7. Bxf6 Bxf6 8. Nxe4 Bd7 9. Qd3 Bc6 10. O-O-O Bxe4 11. Qxe4 Qd5 12. Qe3 O-O 13. Nc3 Qa5 14. Ne4 Nd7 15. h4 Be7 16. g4 b5 17. b4 Qb6 18. Nc5 Nxc5 19. dxc5 Qb7 20. Bd3 a5 21. Qe4 Qxe4 22. Bxe4 Rad8 23. c3 axb4 24. axb4 f5 25. gxf5 e5 26. h5 Bg5+ 27. Kc2 Kf7 28. Bc6 Kf6 29. Bxb5,"This is a game between Bogoljubow,E (as White) and Reti,R (as Black). Last move played: White plays Bishop takes on b5",Large advantage for White (eval: 306 centipawns),29... Rxd1 30. Rxd1 e4 31. Bc6 Kxf5 32. Kb3 Ke5 33. Rd4 Rxf2 34. Rxe4+ Kf6 35. b5 Rf1 36. Re8 Kf7 37. Rc8 Bf4 38. Be4 g6 39. hxg6+ hxg6 40. b6 cxb6 41. cxb6 Re1 42. Bd5+ Ke7 43. b7 g5 44. c4 g4 45. Ka4 ,29. f3 Kxf5 30. Bxb5 e4 31. fxe4+ Ke5 32. Rhg1 Rf2+ 33. Kb3 Rxd1 34. Rxd1 Kxe4 35. Rd7 Bf4 36. Bd3+ Ke3 37. Bxh7 Be5 38. Bg6 Rf3 39. Kc4 Rf4+ 40. Kb5 Kf2 41. Rd2+ Ke1 42. Rd3 Kf2 43. c4 Rh4 44. Rd8 Ke3 45. Rd7 
