comment,good,reasoning,moves,context,engine_eval,engine_best_line,engine_best_alternative
"...but not for long! Now he's behind by one pawn (the one he sacrificed on without the f-file). If the Black King moves off of the f-file, it will uncover an without attack by the f8-Rook on the f2-pawn.",True," The comment provides a clear explanation of the immediate consequence of the mistake, highlighting a vulnerability and suggesting a potential tactical threat.",1. e4 e6 2. d4 d5 3. Nc3 Nf6 4. Bg5 Bb4 5. Ne2 dxe4 6. a3 Be7 7. Bxf6 Bxf6 8. Nxe4 Bd7 9. Qd3 Bc6 10. O-O-O Bxe4 11. Qxe4 Qd5 12. Qe3 O-O 13. Nc3 Qa5 14. Ne4 Nd7 15. h4 Be7 16. g4 b5 17. b4 Qb6 18. Nc5 Nxc5 19. dxc5 Qb7 20. Bd3 a5 21. Qe4 Qxe4 22. Bxe4 Rad8 23. c3 axb4 24. axb4 f5 25. gxf5 e5 26. h5 Bg5+ 27. Kc2 Kf7 28. Bc6 Kf6 29. Bxb5 Kxf5,"This is a game between Bogoljubow,E (as White) and Reti,R (as Black). Last move played: Black plays King takes on f5",Large advantage for White (eval: 323 centipawns),30. f3 e4 31. fxe4+ Ke5 32. Rhg1 Rf2+ 33. Kb3 Rxd1 34. Rxd1 Rd2 35. Rg1 Bf6 36. Bc6 Rh2 37. Rd1 Ke6 38. Bd7+ Kf7 39. Bc8 Ke8 40. Rd5 Re2 41. Bf5 Re3 42. Ka4 Bxc3 43. Bxh7 Ke7 44. Bg6 Be1 45. Re5+ Kd7 ,29... Rxd1 30. Rxd1 e4 31. Bc6 Kxf5 32. Kb3 Ke5 33. Rd4 Rxf2 34. Rxe4+ Kf6 35. b5 Rf1 36. Re8 Kf7 37. Rc8 Bf4 38. Be4 g6 39. hxg6+ hxg6 40. b6 cxb6 41. cxb6 Re1 42. Bd5+ Ke7 43. b7 g5 44. c4 g4 45. Ka4 
"Bogo is well-aware of the possibility of a discovered attack on his f-pawn, without so he prepares for this eventuality with this Bishop move. Watch...",True," The comment suggests the player is anticipating a potential attack, indicating a flawed strategic assessment.",1. e4 e6 2. d4 d5 3. Nc3 Nf6 4. Bg5 Bb4 5. Ne2 dxe4 6. a3 Be7 7. Bxf6 Bxf6 8. Nxe4 Bd7 9. Qd3 Bc6 10. O-O-O Bxe4 11. Qxe4 Qd5 12. Qe3 O-O 13. Nc3 Qa5 14. Ne4 Nd7 15. h4 Be7 16. g4 b5 17. b4 Qb6 18. Nc5 Nxc5 19. dxc5 Qb7 20. Bd3 a5 21. Qe4 Qxe4 22. Bxe4 Rad8 23. c3 axb4 24. axb4 f5 25. gxf5 e5 26. h5 Bg5+ 27. Kc2 Kf7 28. Bc6 Kf6 29. Bxb5 Kxf5 30. Bc6,"This is a game between Bogoljubow,E (as White) and Reti,R (as Black). Last move played: White plays Bishop to c6",Large advantage for White (eval: 296 centipawns),30... Rxd1 31. Rxd1 e4 32. Kb3 Ke6 33. Rg1 Bh6 34. Bxe4 Rxf2 35. Bxh7 Rf3 36. Bg8+ Ke7 37. Bd5 Rh3 38. Re1+ Re3 39. Rf1 Re5 40. Bf7 Bd2 41. Rf2 Bg5 42. Bg6 Bf6 43. Rf3 Kd7 44. Bf5+ Kc6 45. Kc4 Kb7 46. Bg6 Kc8 ,30. f3 e4 31. fxe4+ Ke5 32. Rhg1 Rf2+ 33. Kb3 Rxd1 34. Rxd1 Rd2 35. Rg1 Bf6 36. Bc6 Rh2 37. Rd1 Ke6 38. Bd7+ Kf7 39. Bc8 Ke8 40. Rd5 Re2 41. Bf5 Re3 42. Ka4 Bxc3 43. Bxh7 Ke7 44. Bg6 Be1 45. Re5+ Kd7 
...and Reti advances the Rook to defend the pawn (which would have been without impossible had the Bishop remained on e7).,True," The comment identifies a critical error in the initial move, highlighting a missed opportunity due to the Bishop's position.",1. e4 e6 2. d4 d5 3. Nc3 Nf6 4. Bg5 Bb4 5. Ne2 dxe4 6. a3 Be7 7. Bxf6 Bxf6 8. Nxe4 Bd7 9. Qd3 Bc6 10. O-O-O Bxe4 11. Qxe4 Qd5 12. Qe3 O-O 13. Nc3 Qa5 14. Ne4 Nd7 15. h4 Be7 16. g4 b5 17. b4 Qb6 18. Nc5 Nxc5 19. dxc5 Qb7 20. Bd3 a5 21. Qe4 Qxe4 22. Bxe4 Rad8 23. c3 axb4 24. axb4 f5 25. gxf5 e5 26. h5 Bg5+ 27. Kc2 Kf7 28. Bc6 Kf6 29. Bxb5 Kxf5 30. Bc6 Ke6 31. f3 Be7 32. Ra1 Bg5 33. Ra7 Rf7,"This is a game between Bogoljubow,E (as White) and Reti,R (as Black). Last move played: Black plays Rook to f7",Large advantage for White (eval: 491 centipawns),34. Be4 Rd2+ 35. Kb3 Be3 36. Ra6+ Kd7 37. Rha1 Rf2 38. Rd1+ Rd2 39. Re1 Bf2 40. Rea1 Be3 41. Ra8 Re2 42. Rg8 Rh2 43. Raa8 Rh4 44. Rge8 Rxh5 45. Bd5 Rhf5 ,33... Rd2+ 34. Kb3 e4 35. Bxe4 Bf4 36. Bxh7 Re2 37. Be4 Re3 38. Rg1 Be5 39. Rg6+ Ke7 40. Kc4 Rxc3+ 41. Kd5 Bf4 42. Rxg7+ Kf6 43. Rd7 Rc1 44. h6 Kg5 45. Rg7+ Kh5 46. h7 Rd1+ 47. Kc6 
"The White Bishop takes up a beautiful central post, controls two diagonals without (b1-h7 & a8-h1), blockades the e5-pawn, keeps the Black King off of d5 and without f5, and attacks the h7-pawn!",True," The comment provides specific tactical observations about the consequences of the move, suggesting a flawed strategic assessment.",1. e4 e6 2. d4 d5 3. Nc3 Nf6 4. Bg5 Bb4 5. Ne2 dxe4 6. a3 Be7 7. Bxf6 Bxf6 8. Nxe4 Bd7 9. Qd3 Bc6 10. O-O-O Bxe4 11. Qxe4 Qd5 12. Qe3 O-O 13. Nc3 Qa5 14. Ne4 Nd7 15. h4 Be7 16. g4 b5 17. b4 Qb6 18. Nc5 Nxc5 19. dxc5 Qb7 20. Bd3 a5 21. Qe4 Qxe4 22. Bxe4 Rad8 23. c3 axb4 24. axb4 f5 25. gxf5 e5 26. h5 Bg5+ 27. Kc2 Kf7 28. Bc6 Kf6 29. Bxb5 Kxf5 30. Bc6 Ke6 31. f3 Be7 32. Ra1 Bg5 33. Ra7 Rf7 34. Be4,"This is a game between Bogoljubow,E (as White) and Reti,R (as Black). Last move played: White plays Bishop to e4",Large advantage for White (eval: 513 centipawns),34... Bh6 35. Ra6+ Ke7 36. Re1 Rc8 37. Bxh7 Rf6 38. Rxe5+ Kf8 39. Rxf6+ gxf6 40. Re6 Kg7 ,34. Be4 Rd2+ 35. Kb3 Be3 36. Ra6+ Kd7 37. Rha1 Rf2 38. Rd1+ Rd2 39. Re1 Bf2 40. Rea1 Be3 41. Ra8 Re2 42. Rg8 Rh2 43. Raa8 Rh4 44. Rge8 Rxh5 45. Bd5 Rhf5 
Reti protects the pawn by advancing it out of harm's without way.,True," The comment suggests a defensive move that doesn't contribute to the overall strategic position, indicating a flaw in the move's evaluation.",1. e4 e6 2. d4 d5 3. Nc3 Nf6 4. Bg5 Bb4 5. Ne2 dxe4 6. a3 Be7 7. Bxf6 Bxf6 8. Nxe4 Bd7 9. Qd3 Bc6 10. O-O-O Bxe4 11. Qxe4 Qd5 12. Qe3 O-O 13. Nc3 Qa5 14. Ne4 Nd7 15. h4 Be7 16. g4 b5 17. b4 Qb6 18. Nc5 Nxc5 19. dxc5 Qb7 20. Bd3 a5 21. Qe4 Qxe4 22. Bxe4 Rad8 23. c3 axb4 24. axb4 f5 25. gxf5 e5 26. h5 Bg5+ 27. Kc2 Kf7 28. Bc6 Kf6 29. Bxb5 Kxf5 30. Bc6 Ke6 31. f3 Be7 32. Ra1 Bg5 33. Ra7 Rf7 34. Be4 h6,"This is a game between Bogoljubow,E (as White) and Reti,R (as Black). Last move played: Black plays Pawn to h6",Large advantage for White (eval: 545 centipawns),35. Rha1 Rc8 36. R1a6+ Ke7 37. b5 Rf6 38. b6 Be3 39. Ra5 Rff8 40. b7 Rb8 41. Kd3 Bf4 42. Ra1 Kf6 43. Kc4 Kg5 44. Rg1+ Kxh5 45. Rxg7 ,34... Bh6 35. Ra6+ Ke7 36. Re1 Rc8 37. Bxh7 Rf6 38. Rxe5+ Kf8 39. Rxf6+ gxf6 40. Re6 Kg7 
"Bogoljubow doubles his Rooks on the open file, increasing their without power.",True,". The comment suggests a tactical error by doubling the Rook count, potentially leading to a weakened position and a missed attack.",1. e4 e6 2. d4 d5 3. Nc3 Nf6 4. Bg5 Bb4 5. Ne2 dxe4 6. a3 Be7 7. Bxf6 Bxf6 8. Nxe4 Bd7 9. Qd3 Bc6 10. O-O-O Bxe4 11. Qxe4 Qd5 12. Qe3 O-O 13. Nc3 Qa5 14. Ne4 Nd7 15. h4 Be7 16. g4 b5 17. b4 Qb6 18. Nc5 Nxc5 19. dxc5 Qb7 20. Bd3 a5 21. Qe4 Qxe4 22. Bxe4 Rad8 23. c3 axb4 24. axb4 f5 25. gxf5 e5 26. h5 Bg5+ 27. Kc2 Kf7 28. Bc6 Kf6 29. Bxb5 Kxf5 30. Bc6 Ke6 31. f3 Be7 32. Ra1 Bg5 33. Ra7 Rf7 34. Be4 h6 35. Rha1,"This is a game between Bogoljubow,E (as White) and Reti,R (as Black). Last move played: White plays Rook to a1",Large advantage for White (eval: 541 centipawns),35... Rd2+ 36. Kb3 Bd8 37. R1a6+ Ke7 38. b5 Kf8 39. Re6 Rd1 40. Kc4 Rf6 41. Rxe5 Rf4 42. Ra8 Kf7 43. Rd5 Rxd5 44. Kxd5 ,35. Rha1 Rc8 36. R1a6+ Ke7 37. b5 Rf6 38. b6 Be3 39. Ra5 Rff8 40. b7 Rb8 41. Kd3 Bf4 42. Ra1 Kf6 43. Kc4 Kg5 44. Rg1+ Kxh5 45. Rxg7 
"Reti completes the maneuver by sliding his Bishop back to defend the pawn, without freeing up his f7-Rook. Of course, nothing guards the Bishop (but Reti has without thought of this, too, as we shall see...).",True, The comment identifies a strategic error – failing to open up the f7-Rook – and suggests a potential oversight.,1. e4 e6 2. d4 d5 3. Nc3 Nf6 4. Bg5 Bb4 5. Ne2 dxe4 6. a3 Be7 7. Bxf6 Bxf6 8. Nxe4 Bd7 9. Qd3 Bc6 10. O-O-O Bxe4 11. Qxe4 Qd5 12. Qe3 O-O 13. Nc3 Qa5 14. Ne4 Nd7 15. h4 Be7 16. g4 b5 17. b4 Qb6 18. Nc5 Nxc5 19. dxc5 Qb7 20. Bd3 a5 21. Qe4 Qxe4 22. Bxe4 Rad8 23. c3 axb4 24. axb4 f5 25. gxf5 e5 26. h5 Bg5+ 27. Kc2 Kf7 28. Bc6 Kf6 29. Bxb5 Kxf5 30. Bc6 Ke6 31. f3 Be7 32. Ra1 Bg5 33. Ra7 Rf7 34. Be4 h6 35. Rha1 Rd2+ 36. Kb3 Bd8,"This is a game between Bogoljubow,E (as White) and Reti,R (as Black). Last move played: Black plays Bishop to d8",Large advantage for White (eval: 597 centipawns),37. R1a6+ Ke7 38. b5 Kf8 39. b6 cxb6 40. cxb6 Bxb6 41. Rxf7+ Kxf7 42. Rxb6 Ke7 43. Rg6 Rh2 44. Rxg7+ Kf8 45. Rb7 Rxh5 46. c4 Rh1 47. c5 h5 48. c6 h4 49. c7 Rc1 ,36... Bd8 37. R1a6+ Ke7 38. b5 Kf8 39. b6 cxb6 40. cxb6 Bxb6 41. Rxf7+ Kxf7 42. Rxb6 Kf8 43. Kc4 g5 44. Kc5 Ke7 45. Bd5 Rh2 46. Rb7+ Kf8 47. Rf7+ Ke8 
"Bogo pushes a pawn and increases his hold over the Queenside. If he can find without a way to clear some material off of the board, the b5 and c5 pawns could without advance ""arm-in-arm"" up the board to promotion squares.",True," The comment offers a potential explanation for the mistake, suggesting a strategic maneuver to gain a positional advantage.",1. e4 e6 2. d4 d5 3. Nc3 Nf6 4. Bg5 Bb4 5. Ne2 dxe4 6. a3 Be7 7. Bxf6 Bxf6 8. Nxe4 Bd7 9. Qd3 Bc6 10. O-O-O Bxe4 11. Qxe4 Qd5 12. Qe3 O-O 13. Nc3 Qa5 14. Ne4 Nd7 15. h4 Be7 16. g4 b5 17. b4 Qb6 18. Nc5 Nxc5 19. dxc5 Qb7 20. Bd3 a5 21. Qe4 Qxe4 22. Bxe4 Rad8 23. c3 axb4 24. axb4 f5 25. gxf5 e5 26. h5 Bg5+ 27. Kc2 Kf7 28. Bc6 Kf6 29. Bxb5 Kxf5 30. Bc6 Ke6 31. f3 Be7 32. Ra1 Bg5 33. Ra7 Rf7 34. Be4 h6 35. Rha1 Rd2+ 36. Kb3 Bd8 37. b5,"This is a game between Bogoljubow,E (as White) and Reti,R (as Black). Last move played: White plays Pawn to b5",Large advantage for White (eval: 567 centipawns),37... Kf6 38. R1a6+ Kg5 39. b6 Kh4 40. Ra1 Kxh5 41. b7 Bh4 42. R7a2 Rxa2 43. Rxa2 Rf4 44. b8=N ,37. R1a6+ Ke7 38. b5 Kf8 39. b6 cxb6 40. cxb6 Bxb6 41. Rxf7+ Kxf7 42. Rxb6 Ke7 43. Rg6 Rh2 44. Rxg7+ Kf8 45. Rb7 Rxh5 46. c4 Rh1 47. c5 h5 48. c6 h4 49. c7 Rc1 
"After 37.b5, Bogo had probably considered Reti's reply and was planning without 38.c6. But that would close off the sixth rank for his Rook, so he was without forced to find another way to undouble Black's Rooks. I think he's found without it...",True," The comment suggests a strategic consideration of a potential threat and a planned response, indicating a flawed tactical assessment.",1. e4 e6 2. d4 d5 3. Nc3 Nf6 4. Bg5 Bb4 5. Ne2 dxe4 6. a3 Be7 7. Bxf6 Bxf6 8. Nxe4 Bd7 9. Qd3 Bc6 10. O-O-O Bxe4 11. Qxe4 Qd5 12. Qe3 O-O 13. Nc3 Qa5 14. Ne4 Nd7 15. h4 Be7 16. g4 b5 17. b4 Qb6 18. Nc5 Nxc5 19. dxc5 Qb7 20. Bd3 a5 21. Qe4 Qxe4 22. Bxe4 Rad8 23. c3 axb4 24. axb4 f5 25. gxf5 e5 26. h5 Bg5+ 27. Kc2 Kf7 28. Bc6 Kf6 29. Bxb5 Kxf5 30. Bc6 Ke6 31. f3 Be7 32. Ra1 Bg5 33. Ra7 Rf7 34. Be4 h6 35. Rha1 Rd2+ 36. Kb3 Bd8 37. b5 Rfd7 38. R1a6+,"This is a game between Bogoljubow,E (as White) and Reti,R (as Black). Last move played: White plays Rook to a6 with check",Large advantage for White (eval: 592 centipawns),38... Kf7 39. b6 cxb6 40. cxb6 Bxb6 41. Rxd7+ Rxd7 42. Rxb6 Rd8 43. Kc4 Ke7 44. Rg6 Rc8+ 45. Kd3 Rd8+ 46. Kc2 Rf8 47. Rxg7+ Kd6 48. Rg2 Rf4 49. Rg6+ Kc7 50. Kd3 Rh4 ,38. R1a6+ Kf7 39. b6 cxb6 40. cxb6 Bxb6 41. Rxd7+ Rxd7 42. Rxb6 Rd1 43. Kc4 Ke7 44. Rg6 Kf7 45. Kc5 Rh1 46. Ra6 Ke7 47. Bg6 Rg1 48. c4 e4 49. Ra7+ Kf6 50. fxe4 
Bogo keeps up the pressure by attacking the Black Bishop.,True," The comment suggests a potential tactical threat, indicating a flaw in the move's planning.",1. e4 e6 2. d4 d5 3. Nc3 Nf6 4. Bg5 Bb4 5. Ne2 dxe4 6. a3 Be7 7. Bxf6 Bxf6 8. Nxe4 Bd7 9. Qd3 Bc6 10. O-O-O Bxe4 11. Qxe4 Qd5 12. Qe3 O-O 13. Nc3 Qa5 14. Ne4 Nd7 15. h4 Be7 16. g4 b5 17. b4 Qb6 18. Nc5 Nxc5 19. dxc5 Qb7 20. Bd3 a5 21. Qe4 Qxe4 22. Bxe4 Rad8 23. c3 axb4 24. axb4 f5 25. gxf5 e5 26. h5 Bg5+ 27. Kc2 Kf7 28. Bc6 Kf6 29. Bxb5 Kxf5 30. Bc6 Ke6 31. f3 Be7 32. Ra1 Bg5 33. Ra7 Rf7 34. Be4 h6 35. Rha1 Rd2+ 36. Kb3 Bd8 37. b5 Rfd7 38. R1a6+ Kf7 39. Bf5 Re7 40. Bg6+ Kf8 41. Ra8,"This is a game between Bogoljubow,E (as White) and Reti,R (as Black). Last move played: White plays Rook to a8",Large advantage for White (eval: 616 centipawns),41... Rf7 42. Bxf7 Kxf7 43. Kc4 Be7 44. Rc8 e4 45. fxe4 Re2 46. Rxc7 Rxe4+ 47. Kb3 Kg8 48. Rxe7 Rxe7 49. c6 Kf7 50. c4 Re5 51. Ra7+ Ke6 ,41. Be4 Rd1 42. Kc4 Red7 43. b6 cxb6 44. cxb6 R7d6 45. Rb7 Ke8 46. Ra8 R1d2 47. Kc5 Kf8 48. Rc8 Rd1 49. c4 R1d4 50. Ra8 Rxe4 51. Kxd6 
"Of course not! Remember the rule: when attacking, don't weaken your attack by without needlessly exchanging pieces! Rather than swap, Bogo slides over to attack without the c7-pawn. What is he planning?",True," The comment offers a potential explanation for the mistake, suggesting a strategic maneuver.",1. e4 e6 2. d4 d5 3. Nc3 Nf6 4. Bg5 Bb4 5. Ne2 dxe4 6. a3 Be7 7. Bxf6 Bxf6 8. Nxe4 Bd7 9. Qd3 Bc6 10. O-O-O Bxe4 11. Qxe4 Qd5 12. Qe3 O-O 13. Nc3 Qa5 14. Ne4 Nd7 15. h4 Be7 16. g4 b5 17. b4 Qb6 18. Nc5 Nxc5 19. dxc5 Qb7 20. Bd3 a5 21. Qe4 Qxe4 22. Bxe4 Rad8 23. c3 axb4 24. axb4 f5 25. gxf5 e5 26. h5 Bg5+ 27. Kc2 Kf7 28. Bc6 Kf6 29. Bxb5 Kxf5 30. Bc6 Ke6 31. f3 Be7 32. Ra1 Bg5 33. Ra7 Rf7 34. Be4 h6 35. Rha1 Rd2+ 36. Kb3 Bd8 37. b5 Rfd7 38. R1a6+ Kf7 39. Bf5 Re7 40. Bg6+ Kf8 41. Ra8 Red7 42. Re6 Re7 43. Rc6,"This is a game between Bogoljubow,E (as White) and Reti,R (as Black). Last move played: White plays Rook to c6",Large advantage for White (eval: 620 centipawns),43... Red7 44. Re6 Re7 45. Rd6 Rd7 46. Rxd7 Rxd7 47. b6 cxb6 48. c6 Rc7 49. Rxd8+ Ke7 50. Re8+ Kf6 51. Be4 Ra7 52. Rb8 Kg5 53. Rb7 Ra5 54. c7 Kf4 55. Rb8 ,43. Rd6 Rd7 44. Rxd7 Rxd7 45. b6 cxb6 46. c6 Rc7 47. Rxd8+ Ke7 48. Re8+ Kd6 49. Be4 Ra7 50. Rb8 Ra1 51. Rb7 b5 52. c7 Kd7 53. Kb4 Kd6 54. c8=N+ Ke6 55. Kc5 Ra3 56. Bd5+ Kf6 57. Rf7+ Kg5 
HUH?? Has Bogo lost his mind?,True,". The comment suggests a potential loss of concentration, indicating a significant error in judgment.",1. e4 e6 2. d4 d5 3. Nc3 Nf6 4. Bg5 Bb4 5. Ne2 dxe4 6. a3 Be7 7. Bxf6 Bxf6 8. Nxe4 Bd7 9. Qd3 Bc6 10. O-O-O Bxe4 11. Qxe4 Qd5 12. Qe3 O-O 13. Nc3 Qa5 14. Ne4 Nd7 15. h4 Be7 16. g4 b5 17. b4 Qb6 18. Nc5 Nxc5 19. dxc5 Qb7 20. Bd3 a5 21. Qe4 Qxe4 22. Bxe4 Rad8 23. c3 axb4 24. axb4 f5 25. gxf5 e5 26. h5 Bg5+ 27. Kc2 Kf7 28. Bc6 Kf6 29. Bxb5 Kxf5 30. Bc6 Ke6 31. f3 Be7 32. Ra1 Bg5 33. Ra7 Rf7 34. Be4 h6 35. Rha1 Rd2+ 36. Kb3 Bd8 37. b5 Rfd7 38. R1a6+ Kf7 39. Bf5 Re7 40. Bg6+ Kf8 41. Ra8 Red7 42. Re6 Re7 43. Rc6 Red7 44. Rxd8+,"This is a game between Bogoljubow,E (as White) and Reti,R (as Black). Last move played: White plays Rook takes on d8 with check",Large advantage for White (eval: 670 centipawns),44... Rxd8 45. Rxc7 Ra8 46. Rf7+ Kg8 47. c6 Rda2 48. Rd7 R2a3+ 49. Kc4 Kf8 50. c7 R3a5 51. Kc5 Ra3 52. c4 R3a7 53. Rd8+ Ke7 54. Rxa8 Rxa8 55. b6 Ra5+ 56. Kb4 ,44. Rxd8+ Rxd8 45. Rxc7 e4 46. Bxe4 Rh2 47. b6 Rdd2 48. Kc4 Rb2 49. Rd7 Ke8 50. Rxg7 Rhg2 51. Rxg2 Rxg2 52. b7 Rb2 53. c6 Ke7 54. c7 
"Reti recaptures, of course.",True,", The comment indicates a potential tactical blunder due to the Reti recapture, suggesting a misjudgment of the resulting position.",1. e4 e6 2. d4 d5 3. Nc3 Nf6 4. Bg5 Bb4 5. Ne2 dxe4 6. a3 Be7 7. Bxf6 Bxf6 8. Nxe4 Bd7 9. Qd3 Bc6 10. O-O-O Bxe4 11. Qxe4 Qd5 12. Qe3 O-O 13. Nc3 Qa5 14. Ne4 Nd7 15. h4 Be7 16. g4 b5 17. b4 Qb6 18. Nc5 Nxc5 19. dxc5 Qb7 20. Bd3 a5 21. Qe4 Qxe4 22. Bxe4 Rad8 23. c3 axb4 24. axb4 f5 25. gxf5 e5 26. h5 Bg5+ 27. Kc2 Kf7 28. Bc6 Kf6 29. Bxb5 Kxf5 30. Bc6 Ke6 31. f3 Be7 32. Ra1 Bg5 33. Ra7 Rf7 34. Be4 h6 35. Rha1 Rd2+ 36. Kb3 Bd8 37. b5 Rfd7 38. R1a6+ Kf7 39. Bf5 Re7 40. Bg6+ Kf8 41. Ra8 Red7 42. Re6 Re7 43. Rc6 Red7 44. Rxd8+ Rxd8,"This is a game between Bogoljubow,E (as White) and Reti,R (as Black). Last move played: Black plays Rook takes on d8",Large advantage for White (eval: 659 centipawns),45. Rxc7 Ra8 46. Rf7+ Kg8 47. c6 Rda2 48. c7 R2a3+ 49. Kb4 R8a4+ 50. Kc5 Rxc3+ 51. Kb6 e4 52. Re7 Ra8 53. Rxe4 Rxf3 54. Kb7 Rff8 55. Re5 Rfc8 ,44... Rxd8 45. Rxc7 Ra8 46. Rf7+ Kg8 47. c6 Rda2 48. Rd7 R2a3+ 49. Kc4 Kf8 50. c7 R3a5 51. Kc5 Ra3 52. c4 R3a7 53. Rd8+ Ke7 54. Rxa8 Rxa8 55. b6 Ra5+ 56. Kb4 
"Bogo snags the pawn. What has Bogoljubow accomplished? VICTORY!!! Reti without resigns! Confused? You won't be, after you look at the variation!",True," The comment offers a seemingly positive assessment of the move, while simultaneously highlighting a significant strategic blunder, suggesting a lack of understanding of the position.",1. e4 e6 2. d4 d5 3. Nc3 Nf6 4. Bg5 Bb4 5. Ne2 dxe4 6. a3 Be7 7. Bxf6 Bxf6 8. Nxe4 Bd7 9. Qd3 Bc6 10. O-O-O Bxe4 11. Qxe4 Qd5 12. Qe3 O-O 13. Nc3 Qa5 14. Ne4 Nd7 15. h4 Be7 16. g4 b5 17. b4 Qb6 18. Nc5 Nxc5 19. dxc5 Qb7 20. Bd3 a5 21. Qe4 Qxe4 22. Bxe4 Rad8 23. c3 axb4 24. axb4 f5 25. gxf5 e5 26. h5 Bg5+ 27. Kc2 Kf7 28. Bc6 Kf6 29. Bxb5 Kxf5 30. Bc6 Ke6 31. f3 Be7 32. Ra1 Bg5 33. Ra7 Rf7 34. Be4 h6 35. Rha1 Rd2+ 36. Kb3 Bd8 37. b5 Rfd7 38. R1a6+ Kf7 39. Bf5 Re7 40. Bg6+ Kf8 41. Ra8 Red7 42. Re6 Re7 43. Rc6 Red7 44. Rxd8+ Rxd8 45. Rxc7,"This is a game between Bogoljubow,E (as White) and Reti,R (as Black). Last move played: White plays Rook takes on c7",Large advantage for White (eval: 673 centipawns),45... Ra8 46. c6 e4 47. fxe4 Rf2 48. Rd7 Rc8 49. Kb4 Rb2+ 50. Kc4 Ra2 51. c7 Rd2 52. Rxd2 Rxc7+ 53. Kb4 Ke7 54. c4 Kf6 55. Rd5 Ke7 56. b6 Rc8 57. Rb5 ,45. Rxc7 Ra8 46. Rf7+ Kg8 47. c6 Rda2 48. c7 R2a3+ 49. Kb4 R8a4+ 50. Kc5 Rxc3+ 51. Kb6 e4 52. Re7 Ra8 53. Rxe4 Rxf3 54. Kb7 Rff8 55. Re5 Rfc8 
White's plan in the opening is to establish pawns on d4 and e4; Black's plan without is to prevent this. How does Reti's move do this. Watch...,True," The comment suggests Reti's move disrupts White's planned pawn structure, indicating a potential tactical blunder.",1. e4 e6,"This is a game between Bogoljubow,E (as White) and Reti,R (as Black). Last move played: Black plays Pawn to e6",Slight advantage for White (eval: 34 centipawns),2. d4 ,1... e5 2. Nf3 Nc6 3. d4 exd4 4. Nxd4 Bc5 5. Nb3 Bb6 6. a4 Qh4 7. Qf3 a5 8. g3 Qf6 9. Qe2 Nge7 10. Nc3 
"Reti is finally able to kill the White e-pawn, wrecking White's ideal d4-e4 without pawn pair.",True," The comment highlights a tactical blunder involving a Bishop out of a valid square, indicating a mistake.",1. e4 e6 2. d4 d5 3. Nc3 Nf6 4. Bg5 Bb4 5. Ne2 dxe4,"This is a game between Bogoljubow,E (as White) and Reti,R (as Black). Last move played: Black plays Pawn takes on e4",The position is equal,6. a3 Be7 ,5... dxe4 6. a3 Be7 7. Qd2 Nbd7 8. Ng3 h6 9. Bf4 Nd5 10. Ngxe4 Nxf4 11. Qxf4 Nb6 12. Qg3 O-O 13. O-O-O Bd7 14. h4 Bc6 
"Bogo gets his Queen off of the first rank and paves the way for castling without Queenside (sometimes called castling ""long"").",True," The comment suggests a potential tactical error related to pawn structure and the exchange of pieces, indicating a misjudgment.",1. e4 e6 2. d4 d5 3. Nc3 Nf6 4. Bg5 Bb4 5. Ne2 dxe4 6. a3 Be7 7. Bxf6 Bxf6 8. Nxe4 Bd7 9. Qd3,"This is a game between Bogoljubow,E (as White) and Reti,R (as Black). Last move played: White plays Queen to d3",The position is equal,9... Bc6 ,9. Qd3 
Reti examines his options and decides to capture the invader. Would ...Nf6 without have worked? See the variation.,True," The comment suggests a tactical blunder, indicating a potential vulnerability in the King's position.",1. e4 e6 2. d4 d5 3. Nc3 Nf6 4. Bg5 Bb4 5. Ne2 dxe4 6. a3 Be7 7. Bxf6 Bxf6 8. Nxe4 Bd7 9. Qd3 Bc6 10. O-O-O Bxe4 11. Qxe4 Qd5 12. Qe3 O-O 13. Nc3 Qa5 14. Ne4 Nd7 15. h4 Be7 16. g4 b5 17. b4 Qb6 18. Nc5 Nxc5,"This is a game between Bogoljubow,E (as White) and Reti,R (as Black). Last move played: Black plays Knight takes on c5",Large advantage for White (eval: 133 centipawns),19. dxc5 Qb7 20. Bd3 a5 21. Be4 c6 22. c3 axb4 23. cxb4 Rfd8 24. g5 Qc7 25. Kb2 g6 26. Qg3 Qxg3 27. fxg3 Ra6 28. Bf3 Kf8 29. g4 Rxd1 30. Rxd1 Ke8 ,18... Nf6 19. Bg2 Rad8 20. g5 Nd5 21. Bxd5 Rxd5 22. f4 a5 23. h5 Rfd8 24. h6 g6 25. Kb2 Qc6 26. Ne4 Kf8 27. c3 Rf5 28. Ng3 Rfd5 
"Now we see the point of 1.e6: the e-pawn supports the d5-pawn. This is the without French Defense (see the last game -- Capablanca-Alekhine), in which Black without pushes the d-pawn and challenges White's center.",True," The comment accurately describes a potential tactical blunder, suggesting a compromised pawn structure and an open line of attack.",1. e4 e6 2. d4 d5,"This is a game between Bogoljubow,E (as White) and Reti,R (as Black). Last move played: Black plays Pawn to d5",Slight advantage for White (eval: 48 centipawns),3. Nc3 Nf6 4. e5 Nfd7 5. f4 c5 6. Nf3 Nc6 7. Be3 Be7 8. Qd2 a6 9. a3 O-O 10. h4 b5 11. h5 Bb7 12. h6 g6 13. dxc5 Nxc5 14. Qf2 Nd7 15. Be2 Rc8 16. O-O b4 17. axb4 Nxb4 18. Nd4 ,2... d5 3. Nc3 Nf6 4. Bg5 dxe4 5. Nxe4 Nbd7 6. Nf3 h6 7. Nxf6+ Nxf6 8. Be3 Bd6 9. Bd3 Nd5 10. Bd2 Nf4 11. Bxf4 Bxf4 12. Qe2 Bd7 13. Ne5 Qe7 14. c3 Bxe5 15. Qxe5 
Recapturing with the Bishop is much better than recapturing with the g-pawn. without Now the Bishop is posted on the long a1-h8 diagonal.,True," The comment suggests a tactical reason for the Queen's retreat, indicating a misjudgment of the resulting position.",1. e4 e6 2. d4 d5 3. Nc3 Nf6 4. Bg5 Bb4 5. Ne2 dxe4 6. a3 Be7 7. Bxf6 Bxf6,"This is a game between Bogoljubow,E (as White) and Reti,R (as Black). Last move played: Black plays Bishop takes on f6",The position is equal,8. Nxe4 ,7... gxf6 
"Bogo doesn't want to trade Queens, so he retreats. But now Black has a slight without space advantage (9-6).",True," The comment suggests the opponent is aggressively pursuing the King, indicating a potential tactical blunder.",1. e4 e6 2. d4 d5 3. Nc3 Nf6 4. Bg5 Bb4 5. Ne2 dxe4 6. a3 Be7 7. Bxf6 Bxf6 8. Nxe4 Bd7 9. Qd3 Bc6 10. O-O-O Bxe4 11. Qxe4 Qd5 12. Qe3,"This is a game between Bogoljubow,E (as White) and Reti,R (as Black). Last move played: White plays Queen to e3",The position is equal,12... Qa2 13. c3 Be7 14. Qd3 Nd7 15. c4 O-O-O 16. Nc3 Qb3 17. Qg3 h6 18. Be2 Nb6 19. Ne4 Qa2 20. Nc3 ,12. Nc3 
Bogo sees a plan to cramp Black even more. The Knight jumps into Black's without territory on the fifth rank.,True," The comment suggests a defensive tactic, indicating a potential mistake in planning or execution.",1. e4 e6 2. d4 d5 3. Nc3 Nf6 4. Bg5 Bb4 5. Ne2 dxe4 6. a3 Be7 7. Bxf6 Bxf6 8. Nxe4 Bd7 9. Qd3 Bc6 10. O-O-O Bxe4 11. Qxe4 Qd5 12. Qe3 O-O 13. Nc3 Qa5 14. Ne4 Nd7 15. h4 Be7 16. g4 b5 17. b4 Qb6 18. Nc5,"This is a game between Bogoljubow,E (as White) and Reti,R (as Black). Last move played: White plays Knight to c5",The position is equal,18... Nf6 19. Bg2 Rad8 20. g5 Nd5 21. Bxd5 Rxd5 22. f4 a5 23. h5 Rfd8 24. h6 g6 25. Kb2 Qc6 26. Ne4 Kf8 27. c3 Rf5 28. Ng3 Rfd5 ,18. Nc5 Nf6 
"Since the e4-pawn is under attack, Bogo must find a way to defend it. 3.exd5 without is possible, but leads to drawish positions. Bogo instead develops a Knight without to protect the pawn.",True," The comment accurately describes a common tactical error where a player prematurely sacrifices a piece to avoid a potential tactical threat, leading to a suboptimal position.",1. e4 e6 2. d4 d5 3. Nc3,"This is a game between Bogoljubow,E (as White) and Reti,R (as Black). Last move played: White plays Knight to c3",Slight advantage for White (eval: 36 centipawns),3... Nf6 4. e5 Nfd7 5. f4 c5 6. Nf3 Nc6 7. Be3 cxd4 8. Nxd4 Qb6 9. Ncb5 a6 10. Nf5 Bc5 11. Nbd6+ Kf8 12. Qh5 Nd8 13. Nxg7 Bxe3 14. Nxe6+ fxe6 15. Qe8+ Kg7 16. Qe7+ Kg8 17. Bd3 Qb4+ 18. c3 Qxf4 19. Qxd8+ Qf8 ,3. Nc3 Nf6 4. e5 Nfd7 5. f4 c5 6. Nf3 Nc6 7. Be3 Be7 8. Qd2 a6 9. a3 O-O 10. h4 b5 11. h5 Bb7 12. h6 g6 13. dxc5 Nxc5 14. Qf2 Nd7 15. Be2 Rc8 16. O-O b4 17. axb4 Nxb4 18. Nd4 
Bogo continues preparing an attack by grabbing still more space on the without Kingside.,True," The comment offers a potential reason for the mistake, suggesting a lack of understanding of the strategic implications.",1. e4 e6 2. d4 d5 3. Nc3 Nf6 4. Bg5 Bb4 5. Ne2 dxe4 6. a3 Be7 7. Bxf6 Bxf6 8. Nxe4 Bd7 9. Qd3 Bc6 10. O-O-O Bxe4 11. Qxe4 Qd5 12. Qe3 O-O 13. Nc3 Qa5 14. Ne4 Nd7 15. h4 Be7 16. g4,"This is a game between Bogoljubow,E (as White) and Reti,R (as Black). Last move played: White plays Pawn to g4",Advantage for White (eval: 51 centipawns),16... b5 17. c3 Qb6 18. h5 a5 19. f4 Rfd8 20. h6 g6 21. g5 b4 22. a4 bxc3 23. Qxc3 Qb4 24. Bb5 Nb6 25. Qxb4 Bxb4 26. Nf6+ Kh8 27. Bc6 Rab8 28. Kb1 ,16. h5 
Bogo wants to even up the material with Nxe4. He begins by eliminating the without Black e4-pawn's defender.,True," The comment suggests a potential weakness in the opponent's defensive setup, indicating a flawed plan.",1. e4 e6 2. d4 d5 3. Nc3 Nf6 4. Bg5 Bb4 5. Ne2 dxe4 6. a3 Be7 7. Bxf6,"This is a game between Bogoljubow,E (as White) and Reti,R (as Black). Last move played: White plays Bishop takes on f6",The position is equal,7... gxf6 ,7. Bxf6 Bxf6 
Reti does some preparation of his own. He intends to control as much space as without he can on the Queenside in support of his own attack there.,True," The comment indicates a potential tactical weakness, suggesting the move is poorly planned.",1. e4 e6 2. d4 d5 3. Nc3 Nf6 4. Bg5 Bb4 5. Ne2 dxe4 6. a3 Be7 7. Bxf6 Bxf6 8. Nxe4 Bd7 9. Qd3 Bc6 10. O-O-O Bxe4 11. Qxe4 Qd5 12. Qe3 O-O 13. Nc3 Qa5 14. Ne4 Nd7 15. h4 Be7 16. g4 b5,"This is a game between Bogoljubow,E (as White) and Reti,R (as Black). Last move played: Black plays Pawn to b5",Slight advantage for White (eval: 35 centipawns),17. c3 Qb6 ,16... b5 17. c3 Qb6 18. h5 a5 19. f4 Rfd8 20. h6 g6 21. g5 b4 22. a4 bxc3 23. Qxc3 Qb4 24. Bb5 Nb6 25. Qxb4 Bxb4 26. Nf6+ Kh8 27. Bc6 Rab8 28. Kb1 
"Bogo decides to give up the e4-pawn. He develops the other Knight. Now, after without ...Bxc3, he can reply Nxc3, threatening Nxe4 (after the pawns are exchanged, without of course).",True," The comment suggests a retreat based on a perceived lack of space, implying a flawed strategic assessment.",1. e4 e6 2. d4 d5 3. Nc3 Nf6 4. Bg5 Bb4 5. Ne2,"This is a game between Bogoljubow,E (as White) and Reti,R (as Black). Last move played: White plays Knight to e2",The position is equal,5... dxe4 6. a3 Be7 7. Qd2 Nbd7 8. Ng3 h6 9. Bf4 Nd5 10. Ngxe4 Nxf4 11. Qxf4 Nb6 12. Qg3 O-O 13. O-O-O Bd7 14. h4 Bc6 ,5. e5 
Reti releases the pin on White's c3-Knight and breaks the pin on his without f6-Knight at the same time.,True," The comment suggests a strategic miscalculation by Reti, prioritizing positional advantages over immediate development, which is a common mistake.",1. e4 e6 2. d4 d5 3. Nc3 Nf6 4. Bg5 Bb4 5. Ne2 dxe4 6. a3 Be7,"This is a game between Bogoljubow,E (as White) and Reti,R (as Black). Last move played: Black plays Bishop to e7",The position is equal,7. Bxf6 Bxf6 ,6... Be7 
